ID	UPCEAN	Name	CategoryID	CategoryName	BrandID	BrandName
53670	4018077692093	Драже Lorenz арахис в хрустящ.оболочке 110g	19	Продукты питания (folder)/Орехи	41174	Lorenz
3312935	4650062488962	Драже Love is ассорти сахарное 12g тв/уп	1	Неклассифицированные/default	0	
3312937	8680945415781	Драже Love is шоколадное 12g тв/уп	1	Неклассифицированные/default	0	
2725142	500159446402	Драже m&m's 130g	19677	Продукты питания (folder)/Кондитерские изделия (folder)/Шоколад	0	
3312941	6957342910846	Драже madacascar сахаристое с игрушкой браслет 3g мяг/у	1	Неклассифицированные/default	0	
3312942	8697422657367	Драже Magic bon сердечки шоколадное 10g	1	Неклассифицированные/default	0	
53672	5000159396103	Драже Mars m&m's апельсин 45g	22145	Продукты питания (folder)/Кондитерские изделия (folder)/Конфеты	4497212	Mars m&m's
53673	5000159381871	Драже Mars m&m's арахис 238g стакан	22145	Продукты питания (folder)/Кондитерские изделия (folder)/Конфеты	4497212	Mars m&m's
2230069	4607065370473	Драже Mars m&m's арахис 45g новый год	330591	Продукты питания (folder)/Продукты питания	4497212	Mars m&m's
1206771	4011100157682	Драже Mars m&m's арахис 49.3g	330591	Продукты питания (folder)/Продукты питания	4497212	Mars m&m's
706058	5000159449663	Драже Mars m&m's арахис шоколадное 140g	674836	Продукты питания (folder)/Кондитерские изделия (folder)/Драже	4497212	Mars m&m's
1206773	401110015616	Драже Mars m&m's асс марс 0.050	19677	Продукты питания (folder)/Кондитерские изделия (folder)/Шоколад	4497212	Mars m&m's
2432607	401110015852	Драже Mars m&m's асс марс 0.100	22145	Продукты питания (folder)/Кондитерские изделия (folder)/Конфеты	0	
2432608	5000159396059	Драже Mars m&m's асс марс м/у 0.400	22145	Продукты питания (folder)/Кондитерские изделия (folder)/Конфеты	0	
153678	4011100979017	Драже Mars m&m's веселая тусовка орех ст 250g	22145	Продукты питания (folder)/Кондитерские изделия (folder)/Конфеты	4497212	Mars m&m's
141783	4011100978997	Драже Mars m&m's веселая тусовка шок ст 250g	19677	Продукты питания (folder)/Кондитерские изделия (folder)/Шоколад	4497212	Mars m&m's
53677	4011100158528	Драже Mars m&m's гони за зеленой арахис 100g	22145	Продукты питания (folder)/Кондитерские изделия (folder)/Конфеты	4497212	Mars m&m's
53678	4011100158504	Драже Mars m&m's гони за зеленой арахис 250g	22145	Продукты питания (folder)/Кондитерские изделия (folder)/Конфеты	4497212	Mars m&m's
53679	4011100158542	Драже Mars m&m's гони за зеленой арахис 400g	22145	Продукты питания (folder)/Кондитерские изделия (folder)/Конфеты	4497212	Mars m&m's
53680	4011100158481	Драже Mars m&m's гони за зеленой арахис 50g	22145	Продукты питания (folder)/Кондитерские изделия (folder)/Конфеты	4497212	Mars m&m's
53681	4011100158511	Драже Mars m&m's гони за зеленой шоколад 100g	22145	Продукты питания (folder)/Кондитерские изделия (folder)/Конфеты	4497212	Mars m&m's
53682	4011100158474	Драже Mars m&m's гони за зеленой шоколад 50g	22145	Продукты питания (folder)/Кондитерские изделия (folder)/Конфеты	4497212	Mars m&m's
2861495	4607065378691	Драже Mars m&m's криспи хрустящие шарики в молочном шоколаде мягуп 36g	1	Неклассифицированные/default	4497212	Mars m&m's
2861501	4607065378745	Драже Mars m&m's криспи хрустящие шарики мягуп 220g	1	Неклассифицированные/default	4497212	Mars m&m's
312448	5000159446389	Драже Mars m&m's махi с арахисом/шоколадом 70g /ассорт./	1	Неклассифицированные/default	4497212	Mars m&m's
53686	5000159363655	Драже Mars m&m's мини-фигурки 25.5g	22145	Продукты питания (folder)/Кондитерские изделия (folder)/Конфеты	4497212	Mars m&m's
2230068	4607065370497	Драже Mars m&m's новогодняя серия арахис в молочном шоколаде мягуп 360g	330591	Продукты питания (folder)/Продукты питания	4497212	Mars m&m's
2230071	4607065370534	Драже Mars m&m's новогодняя серия, молочный шоколад 45g, м/у	330591	Продукты питания (folder)/Продукты питания	4497212	Mars m&m's
2230070	4607065370558	Драже Mars m&m's новогодняя серия, молочный шоколад мягуп 360g	330591	Продукты питания (folder)/Продукты питания	4497212	Mars m&m's
105868	40111162	Драже Mars m&m's разноцв/коробочки 0.050	19677	Продукты питания (folder)/Кондитерские изделия (folder)/Шоколад	4497212	Mars m&m's
1206769	4607065000790	Драже Mars m&m's с арах.и мол шок покр.хр.разноц.глаз.45g	674836	Продукты питания (folder)/Кондитерские изделия (folder)/Драже	4497212	Mars m&m's
1206772	5015944638900	Драже Mars m&m's с арахисом 70g	674836	Продукты питания (folder)/Кондитерские изделия (folder)/Драже	4497212	Mars m&m's
2861496	4607065376772	Драже Mars m&m's с арахисом и молочным шоколадом мягуп 240g	1	Неклассифицированные/default	4497212	Mars m&m's
312449	5000159449670	Драже Mars m&m's с арахисом/шоколадом 140g /ассорт./	1	Неклассифицированные/default	4497212	Mars m&m's
53693	5000159391955	Драже Mars m&m's с арахисом/шоколадом 240g /ассорт./	22145	Продукты питания (folder)/Кондитерские изделия (folder)/Конфеты	4497212	Mars m&m's
53674	4011100158122	Драже Mars m&m's с арахисом/шоколадом/лесн.орех 360-400g /ассорт./	22145	Продукты питания (folder)/Кондитерские изделия (folder)/Конфеты	4497212	Mars m&m's
53676	4011100977648	Драже Mars m&m's с арахисом/шоколадом/лесн.орех 45-50g /ассорт./	22145	Продукты питания (folder)/Кондитерские изделия (folder)/Конфеты	4497212	Mars m&m's
23116	4011100158092	Драже Mars m&m's с арахисом/шоколадом/лесн.орех 90/130g /ассорт./	1	Неклассифицированные/default	4497212	Mars m&m's
1206770	4607065000868	Драже Mars m&m's с мол шок покр.хруст.разноцв.гл. 45g	674836	Продукты питания (folder)/Кондитерские изделия (folder)/Драже	4497212	Mars m&m's
23119	4011100156166	Драже Mars m&m's с молочным шоколадом 45-мягуп 50g	19677	Продукты питания (folder)/Кондитерские изделия (folder)/Шоколад	4497212	Mars m&m's
3312940	4607065733773	Драже Mars m&m's с молочным шоколадом мягуп 230g	1	Неклассифицированные/default	4497212	Mars m&m's
2861497	4607065376796	Драже Mars m&m's с молочным шоколадом мягуп 240g	1	Неклассифицированные/default	4497212	Mars m&m's
53683	5000159414593	Драже Mars m&m's с молочным шоколадом со вкусом лесного ореха 400g	22145	Продукты питания (folder)/Кондитерские изделия (folder)/Конфеты	4497212	Mars m&m's
53685	5000159414579	Драже Mars m&m's с молочным шоколадом со вкусом лесного ореха 90g	22145	Продукты питания (folder)/Кондитерские изделия (folder)/Конфеты	4497212	Mars m&m's
1206774	500015944967	Драже Mars m&m's с шок 0.140/0.130	19677	Продукты питания (folder)/Кондитерские изделия (folder)/Шоколад	4497212	Mars m&m's
53684	5000159414531	Драже Mars m&m's со вкусом лесного ореха меу 46g	22145	Продукты питания (folder)/Кондитерские изделия (folder)/Конфеты	4497212	Mars m&m's
1206775	5000159415316	Драже Mars m&m's со вкусом лесного ореха меу 46g #2	1	Неклассифицированные/default	4497212	Mars m&m's
2432609	401110015708	Драже Mars m&m's трубка асс 0.085	22145	Продукты питания (folder)/Кондитерские изделия (folder)/Конфеты	0	
1206776	4011100157873	Драже Mars m&m's шоколад 47.9g	330591	Продукты питания (folder)/Продукты питания	4497212	Mars m&m's
53690	4011100977655	Драже Mars m&m's шоколад 50g	22145	Продукты питания (folder)/Кондитерские изделия (folder)/Конфеты	4497212	Mars m&m's
706061	4003100561668	Драже Mars m&m's шоколад 50g #2	674836	Продукты питания (folder)/Кондитерские изделия (folder)/Драже	4497212	Mars m&m's
53691	5000159363662	Драже Mars m&m's шоколад 50g коробочка	22145	Продукты питания (folder)/Кондитерские изделия (folder)/Конфеты	4497212	Mars m&m's
312450	40111582	Драже Mars m&m's шоколад коробочка 50g /пл. коробочка/	1	Неклассифицированные/default	4497212	Mars m&m's
153679	05350001	Драже Mars m&m's шоколад пак марс 0.050	22145	Продукты питания (folder)/Кондитерские изделия (folder)/Конфеты	4497212	Mars m&m's
153680	4011100156180	Драже Mars m&m's шоколад пак марс 0.050x30	22145	Продукты питания (folder)/Кондитерские изделия (folder)/Конфеты	4497212	Mars m&m's
53692	4011100158498	Драже Mars m&m's шоколад с арахисом 240g	22145	Продукты питания (folder)/Кондитерские изделия (folder)/Конфеты	4497212	Mars m&m's
53687	5000159381888	Драже Mars m&m's шоколад ст. 238g	22145	Продукты питания (folder)/Кондитерские изделия (folder)/Конфеты	4497212	Mars m&m's
312451	40111469	Драже Mars m&m's шоколадные фигурки 25.5g /фигурка/	22145	Продукты питания (folder)/Кондитерские изделия (folder)/Конфеты	4497212	Mars m&m's
195186	5000159020312	Драже Mars maltesers в молочном шоколаде с хрустящей начинкой 37g	22145	Продукты питания (folder)/Кондитерские изделия (folder)/Конфеты	195183	Mars Maltesers
195197	5000159031103	Драже Mars maltesers хрустящие шарики в шоколаде мягуп 175g	22145	Продукты питания (folder)/Кондитерские изделия (folder)/Конфеты	195183	Mars Maltesers
2432611	500015939567	Драже Mars skittles 0.075	22145	Продукты питания (folder)/Кондитерские изделия (folder)/Конфеты	201549	Mars Skittles
2432612	500015941140	Драже Mars skittles 0.075 #2	22145	Продукты питания (folder)/Кондитерские изделия (folder)/Конфеты	201549	Mars Skittles
201553	5000159314572	Драже Mars skittles в кислой глазури 125g	22145	Продукты питания (folder)/Кондитерские изделия (folder)/Конфеты	201549	Mars Skittles
53769	4011100156470	Драже Mars skittles в кислой глазури 180g	22145	Продукты питания (folder)/Кондитерские изделия (folder)/Конфеты	201549	Mars Skittles
1206797	401110015647	Драже Mars skittles в кислой глазури 200g	22145	Продукты питания (folder)/Кондитерские изделия (folder)/Конфеты	201549	Mars Skittles
1206798	5000159376792	Драже Mars skittles в кислой глазури 38g	1	Неклассифицированные/default	201549	Mars Skittles
53770	5000159395670	Драже Mars skittles в кислой глазури 75g	22145	Продукты питания (folder)/Кондитерские изделия (folder)/Конфеты	201549	Mars Skittles
53774	5000159382298	Драже Mars skittles в сахарной глазури 0.038	22145	Продукты питания (folder)/Кондитерские изделия (folder)/Конфеты	201549	Mars Skittles
2432613	5000159396189	Драже Mars skittles в сахарной глазури 0.180	22145	Продукты питания (folder)/Кондитерские изделия (folder)/Конфеты	201549	Mars Skittles
201558	5000159021692	Драже Mars skittles в сахарной глазури 125g	22145	Продукты питания (folder)/Кондитерские изделия (folder)/Конфеты	201549	Mars Skittles
53771	4011100156463	Драже Mars skittles в сахарной глазури 180g	22145	Продукты питания (folder)/Кондитерские изделия (folder)/Конфеты	201549	Mars Skittles
1206799	5000159376655	Драже Mars skittles в сахарной глазури 38g	1	Неклассифицированные/default	201549	Mars Skittles
53772	5000159395694	Драже Mars skittles в сахарной глазури 75g	22145	Продукты питания (folder)/Кондитерские изделия (folder)/Конфеты	201549	Mars Skittles
53773	5000159395656	Драже Mars skittles дикие ягоды 75g	22145	Продукты питания (folder)/Кондитерские изделия (folder)/Конфеты	201549	Mars Skittles
1206800	500015944011	Драже Mars skittles кисломикс 0.120	22145	Продукты питания (folder)/Кондитерские изделия (folder)/Конфеты	201549	Mars Skittles
1206801	5000159335591	Драже Mars skittles лесная ягода 125g	1	Неклассифицированные/default	201549	Mars Skittles
1206802	5000159376709	Драже Mars skittles лесная ягода 38g	1	Неклассифицированные/default	201549	Mars Skittles
53775	4011100978867	Драже Mars skittles фруктовое 38g	22145	Продукты питания (folder)/Кондитерские изделия (folder)/Конфеты	201549	Mars Skittles
3312943	6928886129803	Драже marvel мстители команда со вкусом яблока клубники лимона с игрушкой	1	Неклассифицированные/default	0	
3312944	6957342927523	Драже Maxi микс и тату мягуп 12g	1	Неклассифицированные/default	0	
3312945	4607087228929	Драже megaboom вишня в молочном шоколаде 150g	1	Неклассифицированные/default	0	
1214286	6942961473193	Драже melada водный мир сахарное с игрушкой мягуп 5g	980	Игрушки (folder)/Игрушка	0	
2753917	6924300119726	Драже melada сахарное с игрушкой мягуп 7g	77	Продукты питания (folder)/Кондитерские изделия (folder)/Кондитерские изделия	0	
312453	87108019	Драже mentos 38g+15% беспл. /ассорт./	19856	Продукты питания (folder)/Кондитерские изделия (folder)/Леденцы	20357	Mentos
3312948	4601798020346	Драже mentos tutti frutti мягуп 37g	1	Неклассифицированные/default	20357	Mentos
156082	4602606000666	Драже mentos виноградный 38g	22145	Продукты питания (folder)/Кондитерские изделия (folder)/Конфеты	20357	Mentos
53697	49226430	Драже mentos вит.с/грейпфрут/вишня/черн.смор.120g	22145	Продукты питания (folder)/Кондитерские изделия (folder)/Конфеты	20357	Mentos
2861617	46194442	Драже mentos жаркий микс жевательное мягуп 37g	22145	Продукты питания (folder)/Кондитерские изделия (folder)/Конфеты	20357	Mentos
156080	87108729	Драже mentos жеват.мятные 3x 38g	22145	Продукты питания (folder)/Кондитерские изделия (folder)/Конфеты	20357	Mentos
70279	46058065	Драже mentos жевательн.с мятн.вкусом 37g	23131	Продукты питания (folder)/Кондитерские изделия (folder)/Конфеты жевательные	20357	Mentos
3805865	8710800955555	Драже mentos жевательн.с мятн.вкусом 37g #2	674836	Продукты питания (folder)/Кондитерские изделия (folder)/Драже	20357	Mentos
1179791	87108026	Драже mentos жевательн.с фрук.вкусом 37g	1	Неклассифицированные/default	20357	Mentos
3805866	7290002752332	Драже mentos жевательн.с фрук.вкусом 37g #2	674836	Продукты питания (folder)/Кондитерские изделия (folder)/Драже	20357	Mentos
3805867	8710800955562	Драже mentos жевательн.с фрук.вкусом 37g #3	674836	Продукты питания (folder)/Кондитерские изделия (folder)/Драже	20357	Mentos
3805868	8710800967305	Драже mentos жевательн.с фрук.вкусом 37g #4	674836	Продукты питания (folder)/Кондитерские изделия (folder)/Драже	20357	Mentos
156078	46035134	Драже mentos жевательное с фруктовым вкусом 37g	23131	Продукты питания (folder)/Кондитерские изделия (folder)/Конфеты жевательные	20357	Mentos
3312950	46105691	Драже mentos зеленая мята, 15g, м/у	1	Неклассифицированные/default	20357	Mentos
156079	46035127	Драже mentos зеленое яблоко 37g, м/у	22145	Продукты питания (folder)/Кондитерские изделия (folder)/Конфеты	20357	Mentos
53698	7895144610177	Драже mentos кислотный микс 30g	22145	Продукты питания (folder)/Кондитерские изделия (folder)/Конфеты	20357	Mentos
3312951	4602606000475	Драже mentos мята, 38g, м/у	1	Неклассифицированные/default	20357	Mentos
318117	87311396	Драже mentos Радуга со вкусом фруктов жевательные 37g	19856	Продукты питания (folder)/Кондитерские изделия (folder)/Леденцы	20357	Mentos
53699	87108446	Драже mentos с/с 34g	22145	Продукты питания (folder)/Кондитерские изделия (folder)/Конфеты	20357	Mentos
706030	80964391	Драже mentos фрут краш 56g ассортим кор.	77	Продукты питания (folder)/Кондитерские изделия (folder)/Кондитерские изделия	20357	Mentos
706031	80910084	Драже mentos фрут краш 90g ассортим кор.	77	Продукты питания (folder)/Кондитерские изделия (folder)/Кондитерские изделия	20357	Mentos
1255688	87307955	Драже mentos энергия, 37g, м/у	674836	Продукты питания (folder)/Кондитерские изделия (folder)/Драже	20357	Mentos
3805869	8710800969576	Драже mentos яблоко 37g	674836	Продукты питания (folder)/Кондитерские изделия (folder)/Драже	20357	Mentos
195721	87308259	Драже mentos ягодный микс, 37g, м/у	22145	Продукты питания (folder)/Кондитерские изделия (folder)/Конфеты	20357	Mentos
706033	659253127899	Драже michel cluizel какао бобы в горьк.шокол.150g мешочек	674836	Продукты питания (folder)/Кондитерские изделия (folder)/Драже	706032	Michel Cluizel
2979099	6592531278989	Драже michel cluizel какао бобы в горьк.шокол.150g мешочек #2	674836	Продукты питания (folder)/Кондитерские изделия (folder)/Драже	706032	Michel Cluizel
706034	659253127219	Драже michel cluizel кофейное зерно в горьк.шокол.150g мешочек	674836	Продукты питания (folder)/Кондитерские изделия (folder)/Драже	706032	Michel Cluizel
706035	659253127790	Драже michel cluizel миндаль в горьк.шокол.150g мешочек	674836	Продукты питания (folder)/Кондитерские изделия (folder)/Драже	706032	Michel Cluizel
1663531	659253127301	Драже michel cluizel миндаль в горьком шоколаде мешочек 150g	22145	Продукты питания (folder)/Кондитерские изделия (folder)/Конфеты	1663530	МишельКлюизель
3312953	4670027900056	Драже mika глазированный арахис изделие сахаристое мягуп 15g	1	Неклассифицированные/default	0	
1206781	4823001414005	Драже milka лила старс арахис 50g	1	Неклассифицированные/default	0	
1206782	4823001415163	Драже milka лила старс криспелло 50g	1	Неклассифицированные/default	0	
1206783	4823001414012	Драже milka лила старс с лесным орехом 50g	1	Неклассифицированные/default	0	
626472	5017375040628	Драже millions bubblegum flavour жевательное 20g	1	Неклассифицированные/default	0	
626473	5017375040635	Драже millions cola жевательное 20g	1	Неклассифицированные/default	0	
626474	5017375040604	Драже millions strawberry жевательное 20g	1	Неклассифицированные/default	0	
3312955	8697422654779	Драже mint's апельсин мягуп 15g	1	Неклассифицированные/default	0	
3312956	8697422654793	Драже mint's ассорти мягуп 15g	1	Неклассифицированные/default	0	
3312957	8697422654786	Драже mint's вишня мягуп 15g	1	Неклассифицированные/default	0	
3312958	8697422654762	Драже mint's лимон мягуп 15g	1	Неклассифицированные/default	0	
3312959	8697422654755	Драже mint's мята мягуп 15g	1	Неклассифицированные/default	0	
3312960	6949634261224	Драже monster girl желейное с игрушкой 15g т/уп	1	Неклассифицированные/default	0	
3312961	6933893324387	Драже monster girl с игрушкой 3g	1	Неклассифицированные/default	0	
3312962	6933893326572	Драже monster girls с игрушкой 10g	1	Неклассифицированные/default	0	
2432635	6933928698889	Драже monster high с детским косметическим набором мягуп 10g	77	Продукты питания (folder)/Кондитерские изделия (folder)/Кондитерские изделия	0	
2725122	6942971505488	Драже monster high со вкусом клубники и украшения для девоч 10g пл/уп	77	Продукты питания (folder)/Кондитерские изделия (folder)/Кондитерские изделия	0	
1663546	4620009892251	Драже monster гламурная шкатулка с игрушкой 10g	337649	Уход за детьми (folder)/Уход за детьми	0	
3312963	6920510423806	Драже monster сверкающий маникюр мягуп 5g	1	Неклассифицированные/default	0	
3312965	6957342998776	Драже mozzavr в трубочке мягуп 9g	1	Неклассифицированные/default	0	
3312966	4610027860080	Драже mozzavr парк дино cахарное вкус апельсина 10m/уп	1	Неклассифицированные/default	0	
3312967	4627075733617	Драже mozzavr сахарное и растущая игрушка мягуп 2g	1	Неклассифицированные/default	0	
