ID	UPCEAN	Name	CategoryID	CategoryName	BrandID	BrandName
4460903	014381317527	Kitten in a cage/girl from pussycat (DVD)	1	Неклассифицированные/default	0	
4460904	633619000781	Kitten mitten	1	Неклассифицированные/default	0	
4460905	633619931238	Kitten mitten #2	1	Неклассифицированные/default	0	
4460906	076347510007	Kitten mitten toy 1ct	1	Неклассифицированные/default	0	
4460907	075726162301	Kitten placemat 1ct	1	Неклассифицированные/default	0	
4460908	094594074189	Kitten puzzle 500pc 1ct	1	Неклассифицированные/default	0	
4460909	088677650711	Kitten reflections	1	Неклассифицированные/default	0	
614516	5011012450900	Kitten Soft 9 rolls	1	Неклассифицированные/default	0	
614518	5011012450870	Kitten Soft toilet tissue 4 rolls	2664	Гигиена (folder)/Бумага туалетная	0	
614517	5011012450887	Kitten Soft toilet tissue 9 rolls	2664	Гигиена (folder)/Бумага туалетная	0	
2162888	020279997047	Kitten weaning Formula 14oz	337596	Товары для животных (folder)/Pets	0	
2162889	018065051684	Kitten&Cat Care starter kit	337596	Товары для животных (folder)/Pets	0	
4460910	088677731434	Kitten&flwr plw ca	1	Неклассифицированные/default	0	
4460911	029502353544	Kitten/caitlin (DVD)	1	Неклассифицированные/default	0	
4460912	070896152374	Kittens baking cups 1ct	1	Неклассифицированные/default	2567061	Wilton
4460913	070896152398	Kittens baking cups 1ct #2	1	Неклассифицированные/default	2567061	Wilton
4460914	033500171574	Kittens Color book 1ct	1	Неклассифицированные/default	0	
4460915	049489106469	Kittens in a row	1	Неклассифицированные/default	0	
4460916	088677650186	Kittens in Spring	1	Неклассифицированные/default	0	
4460917	071896488791	Kittens USA 1ct	1	Неклассифицированные/default	0	
1032284	5011012451259	Kittensoft toilet paper 16 pack	2664	Гигиена (folder)/Бумага туалетная	0	
1914240	8004260413213	Kittensoft toilet roll 24 pk	1	Неклассифицированные/default	0	
614521	069321001813	Kittling ridge icewine and brandy 50ml	22133	Продукты питания (folder)/Алкогольные напитки/Вино (folder)/Вино	0	
614519	069321003633	Kittling ridge icewine&brandy 375ml	22133	Продукты питания (folder)/Алкогольные напитки/Вино (folder)/Вино	0	
614520	069321002636	Kittling ridge icewine&brandy 4-glass gift 375ml	22133	Продукты питания (folder)/Алкогольные напитки/Вино (folder)/Вино	0	
614522	069321004043	Kittling ridge kingsgate port 750ml	22133	Продукты питания (folder)/Алкогольные напитки/Вино (folder)/Вино	0	
614523	069321002506	Kittling ridge kingsgate sherry 750ml	22133	Продукты питания (folder)/Алкогольные напитки/Вино (folder)/Вино	0	
652658	069321000380	Kittling ridge niagara bench small cask brandy VSOP 200ml	22210	Продукты питания (folder)/Алкогольные напитки/Коньяк	0	
614524	069321003367	Kittling ridge White Zinfandel/vidal 1500ml	22133	Продукты питания (folder)/Алкогольные напитки/Вино (folder)/Вино	0	
614525	069321002827	Kittling ridge White Zinfandel/vidal 750ml	22133	Продукты питания (folder)/Алкогольные напитки/Вино (folder)/Вино	0	
4460918	903991165928	Kittra	1	Неклассифицированные/default	0	
1032285	039915659249	Kittra dressed kit	1	Неклассифицированные/default	0	
1032286	039915659287	Kittra tabby large	1	Неклассифицированные/default	0	
1032287	039915659263	Kittra tabby med	1	Неклассифицированные/default	0	
2348085	790444028554	Kittrich adehsive roll clear 18inch x 75' kit9995	1	Неклассифицированные/default	2348084	Kittrich
2348086	790444034104	Kittrich adhesive roll 18inch x 24' zebrablk 24fc9t0806	1	Неклассифицированные/default	2348084	Kittrich
2348087	790444020909	Kittrich adhesive roll Black 18inch x 75' kit9935	1	Неклассифицированные/default	2348084	Kittrich
2348088	790444034432	Kittrich adhesive roll chevron jade 18inch 24fc9h0806	1	Неклассифицированные/default	2348084	Kittrich
2348089	790444099981	Kittrich adhesive roll clear 18inch x 24' kit9998	1	Неклассифицированные/default	2348084	Kittrich
2348090	790444028318	Kittrich adhesive roll clear 18inch x 9' 09fc999312	1	Неклассифицированные/default	2348084	Kittrich
2348091	790444028486	Kittrich adhesive roll Green 18inch x 24' kit9h48	1	Неклассифицированные/default	2348084	Kittrich
2348092	790444028585	Kittrich adhesive roll Green 18inch x 75' kit9h45	1	Неклассифицированные/default	2348084	Kittrich
2614763	790444034401	Kittrich adhesive roll lemonade hearts 24fc9j1806	1	Неклассифицированные/default	2348084	Kittrich
2614764	790444034371	Kittrich adhesive roll leopard Rose 18inch 24fc9j0806	1	Неклассифицированные/default	2348084	Kittrich
2348093	790444028479	Kittrich adhesive roll Red 18inch x 24' kit9h38	1	Неклассифицированные/default	2348084	Kittrich
2348094	790444028578	Kittrich adhesive roll Red 18inch x 75' kit9h35	1	Неклассифицированные/default	2348084	Kittrich
2348095	790444028455	Kittrich adhesive roll roy Blue 18inch x 24' kit9h18	1	Неклассифицированные/default	2348084	Kittrich
2348096	790444020893	Kittrich adhesive roll royl blu 18inch x 75' kit9h15	1	Неклассифицированные/default	2348084	Kittrich
2348097	7904440995861	Kittrich adhesive roll White 18inch x 24' kit9958	1	Неклассифицированные/default	2348084	Kittrich
2348098	7904440995519	Kittrich adhesive roll White 18inch x 75' kit9955	1	Неклассифицированные/default	2348084	Kittrich
2348099	790444028462	Kittrich adhesive roll Yellow 18inch x 24' kit9h28	1	Неклассифицированные/default	2348084	Kittrich
2348100	790444028561	Kittrich adhesive roll Yellow 18inch x 75' kit9h25	1	Неклассифицированные/default	2348084	Kittrich
2348101	790444006194	Kittrich cntct adh roll 18inch x 6' d chlkbd 06fc8202006	1	Неклассифицированные/default	2348084	Kittrich
2614765	790444006361	Kittrich cntct adh roll 18inch x 6' dryerase 06fc8201006	1	Неклассифицированные/default	2348084	Kittrich
2348102	790444034319	Kittrich cntct adh roll 18x24 chvrn aqu 24fc9l1806	1	Неклассифицированные/default	2348084	Kittrich
2348103	790444034340	Kittrich cntct adh roll 18x24 chvrn blk 24fc9k0806	1	Неклассифицированные/default	2348084	Kittrich
2348104	790444034258	Kittrich cntct adh roll 18x24 chvrn pnk 24fc9p1806	1	Неклассифицированные/default	2348084	Kittrich
2348105	790444034289	Kittrich cntct adh roll 18x24 chvrn Pur 24fc9l0806	1	Неклассифицированные/default	2348084	Kittrich
4460919	087508034263	Kittrich co. stretchable book cover assorted print	1	Неклассифицированные/default	0	
2348106	087508115276	Kittrich colored Ink Fashion asst 10ct bp63ar1c1048	1	Неклассифицированные/default	2348084	Kittrich
4460920	087508048055	Kittrich corporation first class stretchable book cover	1	Неклассифицированные/default	0	
2348107	087508085555	Kittrich decor door cover christmas sdc0855508	1	Неклассифицированные/default	2348084	Kittrich
2348108	087508114354	Kittrich decor door cover christmas sdc1143508	1	Неклассифицированные/default	2348084	Kittrich
2348109	087508119175	Kittrich display Cat Eye gltr port 48ct pf4122148	1	Неклассифицированные/default	2348084	Kittrich
2348110	087508119205	Kittrich display diam glitter port 48ct pf4122248	1	Неклассифицированные/default	2348084	Kittrich
2614766	087508119236	Kittrich display dots glitter port 24ct pf4122624	1	Неклассифицированные/default	2348084	Kittrich
2614767	087508086927	Kittrich display jumbo bk cvr photo 20c bsj4120920	1	Неклассифицированные/default	2348084	Kittrich
2348111	087508119298	Kittrich display matte glittr port 48ct pf4122348	1	Неклассифицированные/default	2348084	Kittrich
2348112	087508118819	Kittrich display peace Love port 48ct pf4121848	1	Неклассифицированные/default	2348084	Kittrich
2614768	087508020464	Kittrich display sports portfolios 48ct pf4513148	1	Неклассифицированные/default	2348084	Kittrich
2348113	087508118604	Kittrich erasers Fashion 4 asst 6 count Da16argb0648	1	Неклассифицированные/default	2348084	Kittrich
2348114	087508118611	Kittrich erasers wedge assorted 4 count Da17argb0448	1	Неклассифицированные/default	2348084	Kittrich
4923308	089775749031	Kittrich grip liner 12x4 ft Extra #dpgm-12e4Fa-01	1	Неклассифицированные/default	0	
1852488	087508097626	Kittrich grip liner 12x5 ft reg. w/asst clr #05f-1275-48	1	Неклассифицированные/default	0	
4923309	089775205568	Kittrich grip liner 18x4 ft regular #dpgm-18r4Fa-01	1	Неклассифицированные/default	0	
2348115	087508038049	Kittrich highltr erase dual tip pnk/yel hs01lzcb0248	1	Неклассифицированные/default	2348084	Kittrich
2614769	087508110936	Kittrich Mini glitter pens 5-ct gs04acmb0548	1	Неклассифицированные/default	2348084	Kittrich
2614770	087508112374	Kittrich Mini Stick pens petites 8-ct bp38fc1b0848	1	Неклассифицированные/default	2348084	Kittrich
2348116	087508115290	Kittrich pdq portfolios bugs 48 count pf103448	1	Неклассифицированные/default	2348084	Kittrich
2348117	087508115337	Kittrich pdq portfolios Color block 48c pf103848	1	Неклассифицированные/default	2348084	Kittrich
2348118	087508046105	Kittrich pdq portfolios warm fuzzy 48ct pf4112648e	1	Неклассифицированные/default	2348084	Kittrich
2348119	087508115344	Kittrich pdq theme bks Color blckng 24c tb103824	1	Неклассифицированные/default	2348084	Kittrich
2348120	087508119199	Kittrich pdq theme bks diam glttr 24ct tb4122224	1	Неклассифицированные/default	2348084	Kittrich
2348121	087508119229	Kittrich pdq theme bks dots glttr 24ct tb4122624	1	Неклассифицированные/default	2348084	Kittrich
2348122	087508118826	Kittrich pdq theme bks peace Love 24ct tb4121824	1	Неклассифицированные/default	2348084	Kittrich
2348123	087508039244	Kittrich pencil mech clique fx fash 5ct mq02df7p0548	1	Неклассифицированные/default	2348084	Kittrich
2348124	087508118802	Kittrich pencil mech wrpd Fashion 6 cnt mq30dr7b0648	1	Неклассифицированные/default	2348084	Kittrich
2348125	087508028439	Kittrich portfolios street racers 48ct srpfa613848e	1	Неклассифицированные/default	2348084	Kittrich
569184	087508992006	Kittrich roll clear 13.5inch x 15' 05f75012	1	Неклассифицированные/default	2348084	Kittrich
4923310	087508117386	Kittrich shelf liner 1.5 yd x 18 adheso marble dsgn	1	Неклассифицированные/default	0	
4923311	089775301321	Kittrich shelf liner 1.5 yd x 18 adheso print dsgn	1	Неклассифицированные/default	0	
4923312	089775360700	Kittrich shelf liner 1.5 yd x 18 adheso Wood dsgn	1	Неклассифицированные/default	0	
2348126	087508115474	Kittrich Stick pen Pro grip 1.0 fash 6c bp67ff1p0648	1	Неклассифицированные/default	2348084	Kittrich
4923313	087508118031	Kittrich vinyl top liner 12x30 in w asst dsn	1	Неклассифицированные/default	0	
1513916	039915247613	Kitty	1	Неклассифицированные/default	0	
4460921	088677728809	Kitty #2	1	Неклассифицированные/default	0	
4460922	094805061052	Kitty and puppy sleeping	1	Неклассифицированные/default	0	
4460923	049489219831	Kitty ballerina	1	Неклассифицированные/default	0	
4460924	049489213143	Kitty bank	1	Неклассифицированные/default	0	
4460925	018273124262	Kitty barn 1ct	1	Неклассифицированные/default	0	
4460926	823576010125	Kitty belle records CD charlene carole: Fine on my own	1	Неклассифицированные/default	0	
4460927	088305190060	Kitty blanket	1	Неклассифицированные/default	0	
2000977	831843009475	Kitty blindfold (d)	1980397	Adult/HS	0	
2014683	791611010211	Kitty cactus w/toy 24inch	337596	Товары для животных (folder)/Pets	0	
2014220	791611010037	Kitty cactus with pom pom 16inch	337596	Товары для животных (folder)/Pets	0	
4460928	736615000011	Kitty can't cope sac 1ct	1	Неклассифицированные/default	0	
4460929	757764030100	Kitty chew chew inc 25oz newmans Organic olive Oil	1	Неклассифицированные/default	0	
4460930	735340901570	Kitty chorus	1	Неклассифицированные/default	0	
4460931	616658305895	Kitty city Classic tabby notepad	1	Неклассифицированные/default	0	
1513918	876173003465	Kitty city автодразнилка (pouncing paws sp0346) 1	313226	Товары для животных (folder)/Игрушки для животных	1513917	Kitty City
1713301	180632000576	Kitty city домик для кошек кубик рубик. Kitty Play cube : 38x38 x 38cm (sp0057) 0.18	312236	Товары для животных (folder)/Домики для животных	1513917	Kitty City
1713302	876173002321	Kitty city домик для кошек: место встречи. Kitty corner : 72x36 x 36cm, флис (sp0232) 0.68	312236	Товары для животных (folder)/Домики для животных	1513917	Kitty City
1713303	876173002345	Kitty city игровой комплекс для кошек мегаполис. skyscraper : 157.5x80 x 80cm (sp0234) 3.83	312236	Товары для животных (folder)/Домики для животных	1513917	Kitty City
1713304	876173003649	Kitty city игровой комплекс для кошек: версаль. Kitty Play palace : 70x70 x 70cm (sp0364) 1.13	312236	Товары для животных (folder)/Домики для животных	1513917	Kitty City
1713305	876173003373	Kitty city игровой комплекс для кошек: карибская жемчужина. caribbean cruiser : 86x60 x 31cm (sp0337) 0.85	312236	Товары для животных (folder)/Домики для животных	1513917	Kitty City
1713306	876173002291	Kitty city игровой комплекс для кошек: колесо обозрения. wheel of fun : 66x66 x 43cm (sp0229) 1.35	312236	Товары для животных (folder)/Домики для животных	1513917	Kitty City
1713307	876173003144	Kitty city игровой комплекс для кошек: лабиринт. hideaway cave : 44x123 x 45cm (sp0314) 1.64	312236	Товары для животных (folder)/Домики для животных	1513917	Kitty City
1713308	876173003137	Kitty city игровой комплекс для кошек: манхэттен. tunnel tower : 79x45 x 91cm (sp0313) 1.44	312236	Товары для животных (folder)/Домики для животных	1513917	Kitty City
1713309	180632000750	Kitty city игровой комплекс для кошек: пентхаус. Cat Play center : 76x76 x 76cm (sp0075) 1.35	312236	Товары для животных (folder)/Домики для животных	1513917	Kitty City
1713310	876173003045	Kitty city игровой комплекс с когтеточкой для кошек: белая гора. climbing Hill : 44x45 x 45cm, сизаль (sp0304) 1.18	315253	Товары для животных (folder)/Когтеточки для животных	1513917	Kitty City
1713311	876173003014	Kitty city игровой комплекс с когтеточкой для кошек: биг бен. tower : 79x45 x 45cm, сизаль (sp0301) 1.75	315253	Товары для животных (folder)/Когтеточки для животных	1513917	Kitty City
1713312	876173003069	Kitty city игровой комплекс с когтеточкой для кошек: сонное Царство. sleepy corner : 44x45 x 45cm, сизаль (sp0306) 1.25	315253	Товары для животных (folder)/Когтеточки для животных	1513917	Kitty City
1713314	876173003441	Kitty city когтеточка для кошек школа рока. rocking roller 46x60 x 33cm, сизаль (sp0344) 0.77	315253	Товары для животных (folder)/Когтеточки для животных	1513917	Kitty City
1713315	876173003120	Kitty city когтеточка для кошек: кошкин дом. peek-a-boo passage : 44x45 x 45cm (sp0312) 1.01	315253	Товары для животных (folder)/Когтеточки для животных	1513917	Kitty City
1713316	876173003113	Kitty city лежак для кошек: барские покои. cozy bed : 44x45 x 45cm (sp0311) 1.38	312236	Товары для животных (folder)/Домики для животных	1513917	Kitty City
1713317	876173003182	Kitty city лежак для кошек: сладкий сон. slumber bed : 15x45 x 45cm (sp0318) 0.9	312236	Товары для животных (folder)/Домики для животных	1513917	Kitty City
1713318	876173003052	Kitty city спб с 09.09 игровой комплекс для кошек: компас. Play Zone : 39x36 x 36cm, сизаль (sp0305) 0.47	312236	Товары для животных (folder)/Домики для животных	1513917	Kitty City
1713319	876173003038	Kitty city спб с 09.09 игровой комплекс с когтеточкой для кошек: тайное укрытие. hideaway : 44x45 x 45cm, сизаль (sp0303) 1.36	315253	Товары для животных (folder)/Когтеточки для животных	1513917	Kitty City
1713320	876173003267	Kitty city тоннель-шуршалка для кошек: Космос. Kitty tunnel : 28x28 x 91cm (sp0326) 0.31	312236	Товары для животных (folder)/Домики для животных	1513917	Kitty City
3146258	088733001624	Kitty cocktail gourmet soda	330591	Продукты питания (folder)/Продукты питания	0	
4460932	852568001698	Kitty Comfort inn	1	Неклассифицированные/default	0	
4460933	758170010366	Kitty condo	1	Неклассифицированные/default	0	
2162890	791611010266	Kitty condo 2 level	337596	Товары для животных (folder)/Pets	0	
2162891	791611010273	Kitty condo w/perch	337596	Товары для животных (folder)/Pets	0	
2162892	791611012215	Kitty condo w/playground	337596	Товары для животных (folder)/Pets	0	
4460934	759751004026	Kitty corner	1	Неклассифицированные/default	0	
2000978	831843009482	Kitty crop (d)	1980397	Adult/HS	0	
2162893	791611010426	Kitty crows nest	337596	Товары для животных (folder)/Pets	0	
2162894	871864003052	Kitty cuddle pal	337596	Товары для животных (folder)/Pets	0	
2162895	045663005757	Kitty curry brush	337596	Товары для животных (folder)/Pets	0	
1513922	041788001209	Kitty diggins Cat li	1	Неклассифицированные/default	0	
4460935	041788690250	Kitty dri Natural lttr 400oz	1	Неклассифицированные/default	0	
1914241	058262162592	Kitty dwl cmfrt catlt 22.7kg/1	1	Неклассифицированные/default	0	
4460936	032692235262	Kitty fairy girls l (4-6x)	1	Неклассифицированные/default	0	
4460937	032692235279	Kitty fairy girls m (7-8)	1	Неклассифицированные/default	0	
4460938	032692235255	Kitty fairy girls xs (3t-4t)	1	Неклассифицированные/default	0	
4460939	053939677225	Kitty foyle (DVD/p&s-1.33/eng-fr-sp sub)	1	Неклассифицированные/default	0	
4460940	784369875010	Kitty fun crab 1ct	1	Неклассифицированные/default	0	
4460941	084369875080	Kitty fun fish 1ct	1	Неклассифицированные/default	0	
4460942	784369875089	Kitty fun fish 1ct #2	1	Неклассифицированные/default	0	
4460943	084369875028	Kitty fun lobster 1ct	1	Неклассифицированные/default	0	
4460944	784369875027	Kitty fun lobster 1ct #2	1	Неклассифицированные/default	0	
4460945	084369875059	Kitty fun Sun 1ct	1	Неклассифицированные/default	0	
4460946	784369875058	Kitty fun Sun 1ct #2	1	Неклассифицированные/default	0	
4460947	088677913182	Kitty in flowers	1	Неклассифицированные/default	0	
4460948	088677730925	Kitty in window	1	Неклассифицированные/default	0	
1980655	812272014063	Kitty jungle m/l	363351	Adult/Sex-Shop	0	
1980656	812272014056	Kitty jungle s/m	363351	Adult/Sex-Shop	0	
2348127	632634300012	Kitty kantina surf&turf, 2.7oz, ark Naturals	1	Неклассифицированные/default	0	
2014028	029695261244	Kitty kaps clipstrip 12pcs	337596	Товары для животных (folder)/Pets	0	
4460949	041334002032	Kitty kare Cat litte 160oz	1	Неклассифицированные/default	0	
2005118	716770046314	Kitty kat mask&ear (wd)	1980235	Adult/ON Sale	0	
2162896	705425129618	Kitty kaviar 0.5oz	337596	Товары для животных (folder)/Pets	0	
2162897	705425426960	Kitty kaviar 1.0oz	337596	Товары для животных (folder)/Pets	0	
4460950	088677087302	Kitty keepsake ornaments	1	Неклассифицированные/default	0	
4460951	071083581564	Kitty killers (DVD)	1	Неклассифицированные/default	0	
4460952	737138092927	Kitty Kitty kit boom boom (DVD/hebrew)	1	Неклассифицированные/default	0	
1513923	4800401550076	Kitty kleene Cat litter 1/2kg	337596	Товары для животных (folder)/Pets	0	
2162898	048476811010	Kitty korner komber selfgroom aid w/catnip	337596	Товары для животных (folder)/Pets	0	
4460953	075726036008	Kitty kraze 1ct	1	Неклассифицированные/default	0	
4460954	075726035995	Kitty kraze seed 3oz 1ct	1	Неклассифицированные/default	0	
4460955	088305180061	Kitty krinckle	1	Неклассифицированные/default	0	
4460956	073091427612	Kitty kritter w/catnip 1ct	1	Неклассифицированные/default	0	
4460957	088305795302	Kitty kuddler	1	Неклассифицированные/default	0	
4460958	051933155022	Kitty litter	1	Неклассифицированные/default	0	
4460959	088677351847	Kitty litter #2	1	Неклассифицированные/default	0	
4460960	723503500289	Kitty litter pan	1	Неклассифицированные/default	0	
4460961	783371100424	Kitty margolis evolution	1	Неклассифицированные/default	0	
4460962	820320005321	Kitty margolis heart and soul. live in san francisco	1	Неклассифицированные/default	0	
4460963	783371100820	Kitty margolis left Coast Life	1	Неклассифицированные/default	0	
4460964	786497023028	Kitty margolis live at the jazz workshop	1	Неклассифицированные/default	0	
4460965	783371100622	Kitty margolis straight up with a Twist	1	Неклассифицированные/default	0	
2348128	9556958433403	Kitty Milk Powder 300g	1	Неклассифицированные/default	0	
4460966	049489211705	Kitty multi-Color pillowcase p	1	Неклассифицированные/default	0	
2014021	043993770215	Kitty nest asst prepacked disp 15inch 12pcs	337596	Товары для животных (folder)/Pets	0	
2015673	043993770062	Kitty nest&cubby prepacked disp (3 each) 6pcs	337596	Товары для животных (folder)/Pets	0	
1980711	176554005362	Kitty Play Game	1980280	Adult/Adult Games	0	
4460967	018273242003	Kitty playground 1ct	1	Неклассифицированные/default	0	
2162899	791611012192	Kitty playtime perch	337596	Товары для животных (folder)/Pets	0	
2162900	655199030972	Kitty sill de luxe bolster 14x24 tan Kitty print (unheated)	337596	Товары для животных (folder)/Pets	0	
4460968	049489219398	Kitty single Color pillowcase	1	Неклассифицированные/default	0	
4460969	762071721993	Kitty sitter (DVD)-nla	1	Неклассифицированные/default	0	
1513924	072084003604	Kitty sour candy	1	Неклассифицированные/default	0	
2162901	043993006161	Kitty swat exerciser	337596	Товары для животных (folder)/Pets	0	
4460970	073168803578	Kitty vals	1	Неклассифицированные/default	0	
614527	041516110319	Kitty whity premium Cat litter 4.54kg	1	Неклассифицированные/default	0	
