ID	UPCEAN	Name	CategoryID	CategoryName	BrandID	BrandName
170319	4605654000749	Вино а'лофф красн сух 11% 0.700л	22133	Продукты питания (folder)/Алкогольные напитки/Вино (folder)/Вино	0	
170313	4607096160531	Вино а'лофф цимлянское 12% 750мл красн сух	22133	Продукты питания (folder)/Алкогольные напитки/Вино (folder)/Вино	0	
170314	4607096160494	Вино а'лофф цимлянское 3.000л 10% бел полусладк пакет	22133	Продукты питания (folder)/Алкогольные напитки/Вино (folder)/Вино	0	
170315	4607096160500	Вино а'лофф цимлянское 3.000л 10% красн полусладк пакет	22133	Продукты питания (folder)/Алкогольные напитки/Вино (folder)/Вино	0	
170312	4607096160548	Вино а'лофф цимлянское саперави 12% 750мл красн полусладк	22133	Продукты питания (folder)/Алкогольные напитки/Вино (folder)/Вино	0	
41843	5201021694758	Вино а.асири гора афон бел сух 12% 750мл	22133	Продукты питания (folder)/Алкогольные напитки/Вино (folder)/Вино	0	
41852	3365910000012	Вино а.буржуа мюскаде сэвр э мэн бел сух 12% 750мл	41821	Продукты питания (folder)/Алкогольные напитки/Вино (folder)/Вина Франции	41851	А.Буржуа
41853	3365910002313	Вино а.буржуа сансер жадис бел сух 13% 750мл	41821	Продукты питания (folder)/Алкогольные напитки/Вино (folder)/Вина Франции	41851	А.Буржуа
688739	3365910002214	Вино а.буржуа сансер ле барон блан бел сух 750мл	688374	Продукты питания (folder)/Алкогольные напитки/Вино (folder)/Вина Франции Долина Луары	688738	Анри Буржуа
41854	3365910002719	Вино а.буржуа сансер ле барон красн сух 12.5% 750мл	41821	Продукты питания (folder)/Алкогольные напитки/Вино (folder)/Вина Франции	41851	А.Буржуа
41855	3365910002610	Вино а.буржуа сансер ле барон розов сух 12.5% 750мл	41821	Продукты питания (folder)/Алкогольные напитки/Вино (folder)/Вина Франции	41851	А.Буржуа
4836309	3760004140849	Вино а.виллямон поммар красн сух 750мл	688362	Продукты питания (folder)/Алкогольные напитки/Вино (folder)/Вина Франции Бургундия	4836308	А.Виллямон
4989266	4623721360541	Вино а.гамбал с.-обэн 1-ье крю бел сух 750мл	688362	Продукты питания (folder)/Алкогольные напитки/Вино (folder)/Вина Франции Бургундия	4836318	Алекс Гамбал
1191778	8001670101105	Вино а.д.фолонари брунелло ди монтальчино ля фуга красн сух 750мл	22133	Продукты питания (folder)/Алкогольные напитки/Вино (folder)/Вино	1191777	Амброджио и Джованни Фолонари
1191779	8001670134059	Вино а.д.фолонари кампо аль маре 2009г красн сух 750мл/болгери	22133	Продукты питания (folder)/Алкогольные напитки/Вино (folder)/Вино	1191777	Амброджио и Джованни Фолонари
1191780	8001670134080	Вино а.д.фолонари кампоальмаребайаальвенто 2008г красн сух 750мл/болгери	22133	Продукты питания (folder)/Алкогольные напитки/Вино (folder)/Вино	1191777	Амброджио и Джованни Фолонари
3792136	3077051202025	Вино а.ж.леклюз Cabernet сов. красн сух 750мл	22133	Продукты питания (folder)/Алкогольные напитки/Вино (folder)/Вино	3792135	А.Ж.ЛЕКЛЮЗ
3792137	3077051202018	Вино а.ж.леклюз Merlot красн сух 750мл	22133	Продукты питания (folder)/Алкогольные напитки/Вино (folder)/Вино	3792135	А.Ж.ЛЕКЛЮЗ
41867	3451274000369	Вино а.жофруа chablis пр.крю фуршом бел сух 13% 750мл	41821	Продукты питания (folder)/Алкогольные напитки/Вино (folder)/Вина Франции	41866	Алэн Жофруа
41868	4840042002640	Вино а.каб.мерло амор красн псух 9% 0.	22133	Продукты питания (folder)/Алкогольные напитки/Вино (folder)/Вино	0	
2852950	4022724504417	Вино а.кесселер рислинг лорххойзер бел сух 750мл	22133	Продукты питания (folder)/Алкогольные напитки/Вино (folder)/Вино	0	
2852951	4022724506541	Вино а.кесселер рислинг лорххойзер бел сух 750мл #2	22133	Продукты питания (folder)/Алкогольные напитки/Вино (folder)/Вино	0	
2852952	4022724506503	Вино а.кесселер рислинг пфальц бел сух 750мл	22133	Продукты питания (folder)/Алкогольные напитки/Вино (folder)/Вино	0	
2852953	4022724505704	Вино а.кесселер рислинг рейнгау файнхерб бел п/ сух 750мл	22133	Продукты питания (folder)/Алкогольные напитки/Вино (folder)/Вино	0	
2852954	4022724508705	Вино а.кесселер рислинг рейнгау файнхерб бел п/ сух 750мл #2	22133	Продукты питания (folder)/Алкогольные напитки/Вино (folder)/Вино	0	
41870	4000424001245	Вино а.мезон блан д.блан бел сух 11% 700мл	41821	Продукты питания (folder)/Алкогольные напитки/Вино (folder)/Вина Франции	41869	Мезон
41871	4000424001276	Вино а.мезон блан муалле бел полусладк 11% 750мл	41821	Продукты питания (folder)/Алкогольные напитки/Вино (folder)/Вина Франции	41869	Мезон
2852955	8032853551691	Вино а.муратори джалло бел сух 750мл	22133	Продукты питания (folder)/Алкогольные напитки/Вино (folder)/Вино	0	
2852956	8032853551516	Вино а.муратори ле мура Тоскана красн сух 750мл/igt	22133	Продукты питания (folder)/Алкогольные напитки/Вино (folder)/Вино	0	
2226803	8032853551189	Вино а.муратори оппида аминеа карачена бел сух 750мл/doc	22470	Продукты питания (folder)/Алкогольные напитки/Вино (folder)/Вина Италии	2226802	Арчипелаго Муратори белое
2226804	895825001086	Вино а.муратори оппида аминеа каучино бел сух 750мл/doc	22470	Продукты питания (folder)/Алкогольные напитки/Вино (folder)/Вина Италии	2226802	Арчипелаго Муратори белое
2226805	8032853551011	Вино а.муратори оппида аминеа каучино бел сух 750мл/doc #2	22470	Продукты питания (folder)/Алкогольные напитки/Вино (folder)/Вина Италии	2226802	Арчипелаго Муратори белое
2226806	8032853551196	Вино а.муратори оппида аминеа пелике бел сух 750мл/doc	22470	Продукты питания (folder)/Алкогольные напитки/Вино (folder)/Вина Италии	2226802	Арчипелаго Муратори белое
2226808	8032853551097	Вино а.муратори руббиа колле баррикоччио красн сух 750мл/doc	22470	Продукты питания (folder)/Алкогольные напитки/Вино (folder)/Вина Италии	2226807	Арчипелаго Муратори красное
2226809	8032853551059	Вино а.муратори руббиа колле ольпайо красн сух 750мл/doc	22470	Продукты питания (folder)/Алкогольные напитки/Вино (folder)/Вина Италии	2226807	Арчипелаго Муратори красное
2226810	8032853551110	Вино а.муратори руббиа колле рабукколо красн сух 750мл/igt	22470	Продукты питания (folder)/Алкогольные напитки/Вино (folder)/Вина Италии	2226807	Арчипелаго Муратори красное
41876	4840042002657	Вино а.мускат амор бел полусладк 9-11% 750мл	22133	Продукты питания (folder)/Алкогольные напитки/Вино (folder)/Вино	0	
4836310	8429073018019	Вино а.паласиос каминс дель приорат красн сух 750мл	41484	Продукты питания (folder)/Алкогольные напитки/Вино (folder)/Вина Испании	1191781	Альваро Паласиос
688748	8033675240060	Вино а.пуника барруа красн сух 750мл	22470	Продукты питания (folder)/Алкогольные напитки/Вино (folder)/Вина Италии	688747	Агрикола Пуника
41877	8437000239734	Вино а.ретуера примисия красн сух 13.5% 750мл	41484	Продукты питания (folder)/Алкогольные напитки/Вино (folder)/Вина Испании	0	
41879	3271360014144	Вино а.роде божоле aoc красн сух 12.5% 750мл	41821	Продукты питания (folder)/Алкогольные напитки/Вино (folder)/Вина Франции	41878	А.Роде
41880	3271360009447	Вино а.роде божоле виллаж красн сух 13% 750мл	41821	Продукты питания (folder)/Алкогольные напитки/Вино (folder)/Вина Франции	41878	А.Роде
41881	3271360002592	Вино а.роде божоле нуво виллаж красн сух 12.5% 750мл	41821	Продукты питания (folder)/Алкогольные напитки/Вино (folder)/Вина Франции	41878	А.Роде
41882	3271360013604	Вино а.роде божоле нуво красн сух 12.5% 750мл	41821	Продукты питания (folder)/Алкогольные напитки/Вино (folder)/Вина Франции	41878	А.Роде
2424884	3271360010788	Вино а.роде бургонь Chardonnay бел сух 750мл	22133	Продукты питания (folder)/Алкогольные напитки/Вино (folder)/Вино	2226832	Антонен Роде
2424883	3271360027663	Вино а.роде бургонь пинонуаршато демерсе красн сух 750мл	22133	Продукты питания (folder)/Алкогольные напитки/Вино (folder)/Вино	2226832	Антонен Роде
2424885	3271360041119	Вино а.роде кото бургиньон красн сух 750мл	22133	Продукты питания (folder)/Алкогольные напитки/Вино (folder)/Вино	2226832	Антонен Роде
2424886	3271360004534	Вино а.роде меркюре шато де мерсе красн сух 750мл	22133	Продукты питания (folder)/Алкогольные напитки/Вино (folder)/Вино	2226832	Антонен Роде
2424887	3271360037976	Вино а.роде нюи-сен-жоржпремьекрюкло деторемонополь красн сух 750мл	22133	Продукты питания (folder)/Алкогольные напитки/Вино (folder)/Вино	2226832	Антонен Роде
41883	3271360008686	Вино а.роде шато де рулли бел сух 12% 750мл	41821	Продукты питания (folder)/Алкогольные напитки/Вино (folder)/Вина Франции	41878	А.Роде
41884	3271360008679	Вино а.роде шато де рулли красн сух 13% 750мл	41821	Продукты питания (folder)/Алкогольные напитки/Вино (folder)/Вина Франции	41878	А.Роде
1191789	8437003104282	Вино аальто 750мл 14.0% сухое	22133	Продукты питания (folder)/Алкогольные напитки/Вино (folder)/Вино	0	
1191790	8437003104565	Вино аальто 750мл 14.0% сухое, #2	22133	Продукты питания (folder)/Алкогольные напитки/Вино (folder)/Вино	0	
41885	850778000210	Вино аальто красн сух 14% 750мл	22133	Продукты питания (folder)/Алкогольные напитки/Вино (folder)/Вино	0	
3792198	8437003154157	Вино аальто криан.риб.д.д. красн сух 9-15% 750мл	22133	Продукты питания (folder)/Алкогольные напитки/Вино (folder)/Вино	0	
1191788	8437003104480	Вино аальто п.с., 750мл 14.0% сухое	22133	Продукты питания (folder)/Алкогольные напитки/Вино (folder)/Вино	0	
2852957	4607159663610	Вино абадзехи красн полусладк 700мл	22133	Продукты питания (folder)/Алкогольные напитки/Вино (folder)/Вино	3769013	VINNIKOFF
3285626	4620016310441	Вино абадзехи красное столов полусладк 10-12% 700мл с\б	22133	Продукты питания (folder)/Алкогольные напитки/Вино (folder)/Вино	3769013	VINNIKOFF
3285627	8436549540837	Вино абадия Del Monte белое полусладк 11% 750мл стекло	22133	Продукты питания (folder)/Алкогольные напитки/Вино (folder)/Вино	36678	Del Monte
3285628	8436549540820	Вино абадия Del Monte белое сухое 11% 750мл стекло	22133	Продукты питания (folder)/Алкогольные напитки/Вино (folder)/Вино	36678	Del Monte
1191791	8423037100024	Вино абадия де сан кампио, 750мл 12.0% сухое	22133	Продукты питания (folder)/Алкогольные напитки/Вино (folder)/Вино	0	
2852958	4250287901231	Вино аббе де кондияк бел полусладк 9.5% 750мл	22133	Продукты питания (folder)/Алкогольные напитки/Вино (folder)/Вино	0	
3285629	4250287901248	Вино аббе де кондияк красное полусладк 9% 750мл ст/б	22133	Продукты питания (folder)/Алкогольные напитки/Вино (folder)/Вино	0	
3285630	4002301422488	Вино абенд фестлихкайт столов красное полусладк 750мл 9.5% стекло	22133	Продукты питания (folder)/Алкогольные напитки/Вино (folder)/Вино	0	
2424888	3279982021021	Вино абим кюве гастрономи савуа жан перье бел сух 750мл	22133	Продукты питания (folder)/Алкогольные напитки/Вино (folder)/Вино	0	
2852959	3279984000079	Вино абим кюве гастрономи савуа жан перье бел сух 750мл #2	22133	Продукты питания (folder)/Алкогольные напитки/Вино (folder)/Вино	0	
3285631	8007531116523	Вино абоненто красное сухое 11% 750мл ст/б	22133	Продукты питания (folder)/Алкогольные напитки/Вино (folder)/Вино	0	
3285632	8007531116516	Вино абоненто столов белое полусладк 10.5% 750мл стекло	22133	Продукты питания (folder)/Алкогольные напитки/Вино (folder)/Вино	0	
3285633	8007531116530	Вино абоненто столов красное полусладк 10.5% 750мл	22133	Продукты питания (folder)/Алкогольные напитки/Вино (folder)/Вино	0	
3285634	8007531116509	Вино абоненто столов сухое белое 11% 750мл стекло	22133	Продукты питания (folder)/Алкогольные напитки/Вино (folder)/Вино	0	
3790347	4670013220052	Вино абрау Cabernet ст. красн сух 750мл	22133	Продукты питания (folder)/Алкогольные напитки/Вино (folder)/Вино	3790030	АБРАУ
3790348	4670013220434	Вино абрау Cabernet ст. красн сух 750мл #2	22133	Продукты питания (folder)/Алкогольные напитки/Вино (folder)/Вино	3790030	АБРАУ
3285635	4605899002713	Вино абрау Cabernet сухое красное 12.5% 750мл стекло	22133	Продукты питания (folder)/Алкогольные напитки/Вино (folder)/Вино	3790030	АБРАУ
3285636	4630027300096	Вино абрау купаж красный столов сухое полусладк красное 12% 750мл стекло	22133	Продукты питания (folder)/Алкогольные напитки/Вино (folder)/Вино	0	
3285637	4605899002737	Вино абрау купаж светлый 12% 750мл ст/б	22133	Продукты питания (folder)/Алкогольные напитки/Вино (folder)/Вино	3793320	АБРАУ КУПАЖ
3285638	4670013220427	Вино абрау купаж светлый белое сухое 12% 750мл стекло	22133	Продукты питания (folder)/Алкогольные напитки/Вино (folder)/Вино	3793320	АБРАУ КУПАЖ
3285640	4670013220397	Вино абрау купаж темный красное сухое 12% 750мл стекло	22133	Продукты питания (folder)/Алкогольные напитки/Вино (folder)/Вино	3793320	АБРАУ КУПАЖ
2852960	4607026341399	Вино абрау лайт игрист бел полусладк 750мл	22133	Продукты питания (folder)/Алкогольные напитки/Вино (folder)/Вино	3776774	Абрау-Дюрсо
2852961	4607026341405	Вино абрау лайт игрист розов полусладк 750мл	22133	Продукты питания (folder)/Алкогольные напитки/Вино (folder)/Вино	3776774	Абрау-Дюрсо
3285641	4670013220410	Вино абрау рислинг белое сухое 12% 750мл стекло	22133	Продукты питания (folder)/Алкогольные напитки/Вино (folder)/Вино	3794115	РИСЛИНГ
43431	4607026340200	Вино Абрау-Дюрсо игр.бел полусладк 10.5% 750мл	296061	Продукты питания (folder)/Алкогольные напитки/Вино (folder)/Вино игристое	43429	Абрау Дюрсо
3285642	4607026341863	Вино Абрау-Дюрсо красное полусладк 13.5% 750мл ст/б	22133	Продукты питания (folder)/Алкогольные напитки/Вино (folder)/Вино	3776774	Абрау-Дюрсо
2852962	4605528003111	Вино абрикосовое 10% 700мл	22133	Продукты питания (folder)/Алкогольные напитки/Вино (folder)/Вино	0	
170246	4971980134558	Вино абрикосовое 14% 720мл	22133	Продукты питания (folder)/Алкогольные напитки/Вино (folder)/Вино	0	
170247	6906673571035	Вино абрикосовое 9% 750мл	22133	Продукты питания (folder)/Алкогольные напитки/Вино (folder)/Вино	0	
2852963	4605528003074	Вино абрикосовое бел полусладк 1.0	22133	Продукты питания (folder)/Алкогольные напитки/Вино (folder)/Вино	0	
2852964	4607072971663	Вино абрикосовое бел полусладк 2.0	22133	Продукты питания (folder)/Алкогольные напитки/Вино (folder)/Вино	0	
2852965	4840526001565	Вино абрикосовое бел слад 0.75 8.5%	22133	Продукты питания (folder)/Алкогольные напитки/Вино (folder)/Вино	0	
688749	4607136394230	Вино абрикосовое нат бел/слад, виногр фрукт, (кубанская лоза) пакет 1л	22133	Продукты питания (folder)/Алкогольные напитки/Вино (folder)/Вино	0	
2852966	4605528002183	Вино абрикосовое плодовое 10-12% 700мл	22133	Продукты питания (folder)/Алкогольные напитки/Вино (folder)/Вино	0	
1194893	4607072974671	Вино абрикосовое плодовое белое полусладк с фруктами 11% 750мл ст/б	22133	Продукты питания (folder)/Алкогольные напитки/Вино (folder)/Вино	0	
1194894	4607072978228	Вино абрикосовое плодовое с фруктами белое полусладк 11% 750мл стекло	22133	Продукты питания (folder)/Алкогольные напитки/Вино (folder)/Вино	0	
1191795	6936663800197	Вино абрикосовое плодовое, 750мл 0.0%	22133	Продукты питания (folder)/Алкогольные напитки/Вино (folder)/Вино	0	
1659654	4607111460592	Вино абрикосовое полусладк плод 1л 12%	22133	Продукты питания (folder)/Алкогольные напитки/Вино (folder)/Вино	0	
3792140	4620016310038	Вино абрикосовое рай плод.полусладк 12% 1.0л	1759520	Продукты питания (folder)/Алкогольные напитки/Вино (folder)/Вино плодовое	3792139	АБРИКОСОВЫЙ РАЙ
3285643	4607085179780	Вино абрикосовое сардоникс фруктовое плодовое полусладк 10-12% 500мл стбут	22133	Продукты питания (folder)/Алкогольные напитки/Вино (folder)/Вино	0	
3285644	4607085177441	Вино абрикосовое сардоникс фруктовое столов полусладк 10-12% tetrapak 1л	22133	Продукты питания (folder)/Алкогольные напитки/Вино (folder)/Вино	0	
1818339	4607019690626	Вино абрикосовое столов белое сладкое 13-15% 1л	688533	Продукты питания (folder)/Алкогольные напитки/Вино (folder)/Вина России и ближнего зарубежья	0	
1818381	4607019690459	Вино абрикосовое столов полусладк белое 8.5-9% 1л	688533	Продукты питания (folder)/Алкогольные напитки/Вино (folder)/Вина России и ближнего зарубежья	0	
2853008	4670007934156	Вино абрикосовое фруктовое (плодовое) полусладк 10-12% tetrapak 1л	22133	Продукты питания (folder)/Алкогольные напитки/Вино (folder)/Вино	0	
3285645	4607008803556	Вино абрикосовое фруктовое 10-12% 500мл ст/б	22133	Продукты питания (folder)/Алкогольные напитки/Вино (folder)/Вино	0	
3285646	4607072978808	Вино абрикосовое фруктовое белое полусладк 10-12% 750мл стекло	22133	Продукты питания (folder)/Алкогольные напитки/Вино (folder)/Вино	0	
3285649	4607111460691	Вино абрикосовое фруктовое белое полусладк 6-8% tetrapak 1л	22133	Продукты питания (folder)/Алкогольные напитки/Вино (folder)/Вино	0	
3285650	4610003580827	Вино абрикосовое фруктовое плодовое полусладк 10-12% tetrapak 1л	22133	Продукты питания (folder)/Алкогольные напитки/Вино (folder)/Вино	0	
3285651	4650067391663	Вино абрикосовое фруктовое плодовое полусладк 10-12% tetrapak 1л #2	22133	Продукты питания (folder)/Алкогольные напитки/Вино (folder)/Вино	0	
3285652	4607149307760	Вино абрикосовое фруктовое плодовое полусладк 8% 1л тетра /пак	22133	Продукты питания (folder)/Алкогольные напитки/Вино (folder)/Вино	0	
3285653	4607149308651	Вино абрикосовое фруктовое плодовое полусладк 8-10% 1л ст/б	22133	Продукты питания (folder)/Алкогольные напитки/Вино (folder)/Вино	0	
