ID	UPCEAN	Name	CategoryID	CategoryName	BrandID	BrandName
2427502	3760087342857	Вино chateau сантонже aoc бордо бел сух 13% 750мл	22133	Продукты питания (folder)/Алкогольные напитки/Вино (folder)/Вино	0	
3790962	4600735004340	Вино chateau саркел бел сух 13% 750мл	22133	Продукты питания (folder)/Алкогольные напитки/Вино (folder)/Вино	3790961	ШАТО САРКЕЛ
3790963	4600735004708	Вино chateau саркел бел сух 13% 750мл #2	22133	Продукты питания (folder)/Алкогольные напитки/Вино (folder)/Вино	3790961	ШАТО САРКЕЛ
3790964	4600735004739	Вино chateau саркел цимл.чер. красн сух 14% 750мл	22133	Продукты питания (folder)/Алкогольные напитки/Вино (folder)/Вино	0	
3284079	4600735004241	Вино chateau саркел цимлянский черный красное сухое 14% 750мл ст/б	22133	Продукты питания (folder)/Алкогольные напитки/Вино (folder)/Вино	0	
47392	3249991910838	Вино chateau сегон aoc красн сух 12.5% 750мл	22133	Продукты питания (folder)/Алкогольные напитки/Вино (folder)/Вино	0	
170430	3429670784022	Вино chateau сегонзак ла форэ bordeaux красн сух 12% 750мл	22133	Продукты питания (folder)/Алкогольные напитки/Вино (folder)/Вино	0	
3790965	3500610093623	Вино chateau сегуала красн сух 14.5% 750мл	22133	Продукты питания (folder)/Алкогольные напитки/Вино (folder)/Вино	0	
47393	3429671221991	Вино chateau сегюр де кабан красн сух 12% 750мл	22133	Продукты питания (folder)/Алкогольные напитки/Вино (folder)/Вино	0	
688639	3495336300417	Вино chateau сегюр де кабана сэн-эстеф крю буржуа 750мл 13% сухое	22133	Продукты питания (folder)/Алкогольные напитки/Вино (folder)/Вино	0	
688640	3429671315010	Вино chateau сегюр де кабанак сэнт-эстеф 750мл 0% сухое	22133	Продукты питания (folder)/Алкогольные напитки/Вино (folder)/Вино	0	
47394	3278489800009	Вино chateau сейла лаплань красн сух 12.5% 750мл	41821	Продукты питания (folder)/Алкогольные напитки/Вино (folder)/Вина Франции	0	
171367	3120580870941	Вино chateau сен лоран корбьер 750мл 0% красн сух	22133	Продукты питания (folder)/Алкогольные напитки/Вино (folder)/Вино	0	
3284080	3331905135014	Вино chateau сен понс красное сухое 19% 750мл ст/б	22133	Продукты питания (folder)/Алкогольные напитки/Вино (folder)/Вино	3790966	ШАТО СЕН ПОНС
2427504	3760131261127	Вино chateau сен-пьер традисьон бел сух 750мл	22133	Продукты питания (folder)/Алкогольные напитки/Вино (folder)/Вино	2427503	Шато Сен-Пьер
940397	3760131260120	Вино chateau сен-пьер традисьон р. сух 750мл	41821	Продукты питания (folder)/Алкогольные напитки/Вино (folder)/Вина Франции	2427503	Шато Сен-Пьер
4837207	3460440005527	Вино chateau сен-флорен бел сух 750мл	688367	Продукты питания (folder)/Алкогольные напитки/Вино (folder)/Вина Франции Бордо	4837206	Сен-Флорен
4837208	3460440638565	Вино chateau сен-флорен красн сух 750мл	688367	Продукты питания (folder)/Алкогольные напитки/Вино (folder)/Вина Франции Бордо	4837206	Сен-Флорен
1196066	3257980497321	Вино chateau сент март 2005г красн/ сух 14.5% 750мл	22133	Продукты питания (folder)/Алкогольные напитки/Вино (folder)/Вино	0	
688641	3429674387052	Вино chateau сент пьер 750мл 0% сухое	22133	Продукты питания (folder)/Алкогольные напитки/Вино (folder)/Вино	0	
3790967	3700091815466	Вино chateau сент-илер красн сух выдерж.1.5л	22133	Продукты питания (folder)/Алкогольные напитки/Вино (folder)/Вино	0	
3284081	3211209133759	Вино chateau сент-леон бордо красн сух 10-13% 750мл ст/б	22133	Продукты питания (folder)/Алкогольные напитки/Вино (folder)/Вино	0	
688642	4607125541690	Вино chateau сентонж красн сух 750мл	41821	Продукты питания (folder)/Алкогольные напитки/Вино (folder)/Вина Франции	688492	Оноальянс
3790968	3182525810030	Вино chateau серес.лаланд красн сух 12.5% 750мл	22133	Продукты питания (folder)/Алкогольные напитки/Вино (folder)/Вино	0	
47395	3192371056636	Вино chateau серэ бордо красн сух 12% 750мл	22133	Продукты питания (folder)/Алкогольные напитки/Вино (folder)/Вино	0	
3790969	097985139986	Вино chateau сиран 2007г красн сух 10.75л	22133	Продукты питания (folder)/Алкогольные напитки/Вино (folder)/Вино	0	
3790970	4623720690847	Вино chateau сиран 2007г красн сух 10.75л #2	22133	Продукты питания (folder)/Алкогольные напитки/Вино (folder)/Вино	0	
3790971	4623721069703	Вино chateau сиран 2007г красн сух 10.75л #3	22133	Продукты питания (folder)/Алкогольные напитки/Вино (folder)/Вино	0	
283646	3342590011064	Вино chateau сиссак о-медок крю буржуа красн сух 750мл 12.5% /Франция/	22133	Продукты питания (folder)/Алкогольные напитки/Вино (folder)/Вино	0	
3790972	3700266206365	Вино chateau ситран красн сух 10-15% 750мл	22133	Продукты питания (folder)/Алкогольные напитки/Вино (folder)/Вино	0	
3790973	3258691331003	Вино chateau ситран красн сух 11-13.5% 750мл	22133	Продукты питания (folder)/Алкогольные напитки/Вино (folder)/Вино	47397	Шато Ситран
3790974	3258691339078	Вино chateau ситран красн сух 11-13.5% 750мл #2	22133	Продукты питания (folder)/Алкогольные напитки/Вино (folder)/Вино	47397	Шато Ситран
3790975	3258691438917	Вино chateau ситран красн сух 11-13.5% 750мл #3	22133	Продукты питания (folder)/Алкогольные напитки/Вино (folder)/Вино	47397	Шато Ситран
688643	3258690092400	Вино chateau ситран красн сух 750мл	41821	Продукты питания (folder)/Алкогольные напитки/Вино (folder)/Вина Франции	47397	Шато Ситран
4989246	36998401	Вино chateau ситран красн сух 750мл/haut-medoc аос	688367	Продукты питания (folder)/Алкогольные напитки/Вино (folder)/Вина Франции Бордо	47397	Шато Ситран
47398	4607053044560	Вино chateau ситран крю б. медок 2000 красн сух 13% 750мл	22133	Продукты питания (folder)/Алкогольные напитки/Вино (folder)/Вино	47397	Шато Ситран
47399	3258691218014	Вино chateau ситран крю б. медок 2003 красн сух 13% 750мл	22133	Продукты питания (folder)/Алкогольные напитки/Вино (folder)/Вино	47397	Шато Ситран
688644	3258691242477	Вино chateau ситран крю б.медок красн сух 750мл бордо	688367	Продукты питания (folder)/Алкогольные напитки/Вино (folder)/Вина Франции Бордо	47397	Шато Ситран
1660255	4607811550395	Вино chateau ситран крю буржуа красн сух 750мл	688367	Продукты питания (folder)/Алкогольные напитки/Вино (folder)/Вина Франции Бордо	47397	Шато Ситран
688645	1000002057964	Вино chateau ситран крю буржуа о-медок 750мл	688367	Продукты питания (folder)/Алкогольные напитки/Вино (folder)/Вина Франции Бордо	47397	Шато Ситран
47400	3251092407087	Вино chateau ситран крю буржуа о-медок 750мл 13% сухое	41821	Продукты питания (folder)/Алкогольные напитки/Вино (folder)/Вина Франции	47397	Шато Ситран
2855234	4690491068038	Вино chateau ситран о-медок красн сух 750мл	22133	Продукты питания (folder)/Алкогольные напитки/Вино (folder)/Вино	0	
688646	3438010104086	Вино chateau смит о лафит 750мл 12% сухое	22133	Продукты питания (folder)/Алкогольные напитки/Вино (folder)/Вино	0	
1196068	3258690380859	Вино chateau смит о лафит красн сух 750мл	22133	Продукты питания (folder)/Алкогольные напитки/Вино (folder)/Вино	1196067	Шато Смит О Лафит
1196069	3438010107087	Вино chateau смит о лафит красн сух 750мл #2	22133	Продукты питания (folder)/Алкогольные напитки/Вино (folder)/Вино	1196067	Шато Смит О Лафит
3790977	721713845305	Вино chateau смит-о-лафит блан бел сух 750мл	22133	Продукты питания (folder)/Алкогольные напитки/Вино (folder)/Вино	3790976	СМИТ-О-ЛАФИТ
3790978	3760169920928	Вино chateau смит-о-лафит блан бел сух 750мл #2	22133	Продукты питания (folder)/Алкогольные напитки/Вино (folder)/Вино	3790976	СМИТ-О-ЛАФИТ
151887	3303290102544	Вино chateau сотье бержерак 12.5% сух/ красн 750мл	22133	Продукты питания (folder)/Алкогольные напитки/Вино (folder)/Вино	0	
171368	3342850800124	Вино chateau судар aoc о-медок крю буржуа 750мл 13% сухое	22133	Продукты питания (folder)/Алкогольные напитки/Вино (folder)/Вино	0	
47401	3416830510270	Вино chateau суссан марго красн сух 13% 750мл	41821	Продукты питания (folder)/Алкогольные напитки/Вино (folder)/Вина Франции	0	
3790979	4690491013267	Вино chateau сутар гран крю красн сух 750мл	22133	Продукты питания (folder)/Алкогольные напитки/Вино (folder)/Вино	0	
3790980	4690491022795	Вино chateau сутар гран крю красн сух 750мл #2	22133	Продукты питания (folder)/Алкогольные напитки/Вино (folder)/Вино	0	
3790981	4690491034316	Вино chateau сутар гран крю красн сух 750мл #3	22133	Продукты питания (folder)/Алкогольные напитки/Вино (folder)/Вино	0	
688392	3490890021310	Вино chateau сэн флорен бордо бел сух 13.5% 750мл (Франция)	22133	Продукты питания (folder)/Алкогольные напитки/Вино (folder)/Вино	0	
1760266	3490890011823	Вино chateau сэн флорэн 2005 бор.р. красн сух 13% 750мл	22133	Продукты питания (folder)/Алкогольные напитки/Вино (folder)/Вино	0	
3790982	3490890015876	Вино chateau сэн флорэн 2005 бор.р. красн сух 13% 750мл #2	22133	Продукты питания (folder)/Алкогольные напитки/Вино (folder)/Вино	0	
3790983	3490890011830	Вино chateau сэн флорэн 2006 бор.б.бел сух 13% 750мл	22133	Продукты питания (folder)/Алкогольные напитки/Вино (folder)/Вино	0	
3790984	3490890013124	Вино chateau сэн флорэн 2006 бор.б.бел сух 13% 750мл #2	22133	Продукты питания (folder)/Алкогольные напитки/Вино (folder)/Вино	0	
3790985	3490890016934	Вино chateau сэн флорэн 2006 бор.б.бел сух 13% 750мл #3	22133	Продукты питания (folder)/Алкогольные напитки/Вино (folder)/Вино	0	
282447	3490890018730	Вино chateau сэн флорэн бордо бел сух 750мл 13% /Франция/	22133	Продукты питания (folder)/Алкогольные напитки/Вино (folder)/Вино	0	
688391	3490890021204	Вино chateau сэн флорэн бордо красн сух 13% 750мл (Франция)	22133	Продукты питания (folder)/Алкогольные напитки/Вино (folder)/Вино	0	
282448	3490890016927	Вино chateau сэн флорэн бордо красн сух 750мл 12.5% /Франция/	22133	Продукты питания (folder)/Алкогольные напитки/Вино (folder)/Вино	0	
283645	3490890019706	Вино chateau сэн флорэн бордо красн сух 750мл 13.5% /Франция/	22133	Продукты питания (folder)/Алкогольные напитки/Вино (folder)/Вино	0	
151888	3272810163573	Вино chateau сэрестэн лаланд. красн сух 750мл	22133	Продукты питания (folder)/Алкогольные напитки/Вино (folder)/Вино	0	
47402	3371232750009	Вино chateau сюо бордо сух бел 750мл	22133	Продукты питания (folder)/Алкогольные напитки/Вино (folder)/Вино	0	
2954544	3371232750047	Вино chateau сюо бордо сух бел 750мл #2	22133	Продукты питания (folder)/Алкогольные напитки/Вино (folder)/Вино	0	
47403	3328150012726	Вино chateau тайфер помроль красн сух 13% 750мл	41821	Продукты питания (folder)/Алкогольные напитки/Вино (folder)/Вина Франции	0	
2954545	3192371049959	Вино chateau тайфер помроль красн сух 13% 750мл #2	41821	Продукты питания (folder)/Алкогольные напитки/Вино (folder)/Вина Франции	0	
2954546	3192371055790	Вино chateau тайфер помроль красн сух 13% 750мл #3	41821	Продукты питания (folder)/Алкогольные напитки/Вино (folder)/Вина Франции	0	
3790986	097985075642	Вино chateau тал.4-й гр.к.к. красн сух 13% 750мл	22133	Продукты питания (folder)/Алкогольные напитки/Вино (folder)/Вино	0	
1760314	4607043170989	Вино chateau тальбо 1995 к.с 13% 750мл	22133	Продукты питания (folder)/Алкогольные напитки/Вино (folder)/Вино	0	
47405	4607053045048	Вино chateau тальбо 1996 красн сух 12.8% 750мл	41821	Продукты питания (folder)/Алкогольные напитки/Вино (folder)/Вина Франции	47404	Шато Тальбо
2427505	4623721069727	Вино chateau тальбо 4-й гран крю классе красн сух 750мл	22133	Продукты питания (folder)/Алкогольные напитки/Вино (folder)/Вино	2424916	Великие вина Бордо
3790987	4690491044797	Вино chateau тальбо гран крю кл. красн сух 750мл	22133	Продукты питания (folder)/Алкогольные напитки/Вино (folder)/Вино	47404	Шато Тальбо
1196070	4690491016916	Вино chateau тальбо гран крю классе aoc бордо красн сух 750мл	22133	Продукты питания (folder)/Алкогольные напитки/Вино (folder)/Вино	47404	Шато Тальбо
4837209	3661419111205	Вино chateau тальбо гран крю сен-жюльен красн сух 750мл	688367	Продукты питания (folder)/Алкогольные напитки/Вино (folder)/Вина Франции Бордо	4836509	Гран Крю Классе
4989247	3412951421624	Вино chateau тальбо гран крю сен-жюльен красн сух 750мл #2	688367	Продукты питания (folder)/Алкогольные напитки/Вино (folder)/Вина Франции Бордо	4836509	Гран Крю Классе
4837210	3661419114206	Вино chateau тальбо сен-жюльен аос 4 крю красн сух 750мл	688367	Продукты питания (folder)/Алкогольные напитки/Вино (folder)/Вина Франции Бордо	4837144	Yvon Mau
3284082	4607062862278	Вино chateau тамань 2016 мускат тамани сухое белое 11-13% 750мл стекло	22133	Продукты питания (folder)/Алкогольные напитки/Вино (folder)/Вино	0	
2855235	4607062861370	Вино chateau тамань Cabernet тамани геогр. наим. красн сух 11-13% 750мл (Россия)	22133	Продукты питания (folder)/Алкогольные напитки/Вино (folder)/Вино	3790126	ВИНА ТАМАНИ
3284090	4607062865873	Вино chateau тамань Cabernet тамани крас столов сух 13% 750мл тв/уп	22133	Продукты питания (folder)/Алкогольные напитки/Вино (folder)/Вино	0	
3284106	4607062864890	Вино chateau тамань Chardonnay белое сухое 10.5-12.5% 750мл стбут	22133	Продукты питания (folder)/Алкогольные напитки/Вино (folder)/Вино	0	
2427512	4607062868539	Вино chateau тамань Chardonnay сухое белое 10.5-12.5% 0.187л ст/б	22133	Продукты питания (folder)/Алкогольные напитки/Вино (folder)/Вино	690275	Кубань-Вино
3284107	4607062863978	Вино chateau тамань Chardonnay сухое белое 12% 750мл стекло	22133	Продукты питания (folder)/Алкогольные напитки/Вино (folder)/Вино	0	
2427511	4607062866962	Вино chateau тамань Chardonnay тамани геогр.наим. бел сух 10.5-12.5% 750мл (Россия)	22133	Продукты питания (folder)/Алкогольные напитки/Вино (folder)/Вино	690275	Кубань-Вино
3284083	4607062866474	Вино chateau тамань Duo blanc столов белое сухое 12% 750мл стбут	22133	Продукты питания (folder)/Алкогольные напитки/Вино (folder)/Вино	0	
3284084	4607062866498	Вино chateau тамань Duo Rose розовое столов сухое 12% 750мл стекло	22133	Продукты питания (folder)/Алкогольные напитки/Вино (folder)/Вино	0	
3284104	4607062864494	Вино chateau тамань Sauvignon белое сухое 10.5-12.5% 750мл ст/б	22133	Продукты питания (folder)/Алкогольные напитки/Вино (folder)/Вино	0	
689860	4607062862254	Вино chateau тамань алиготе сухое белое 11% 0.75 стекло	688533	Продукты питания (folder)/Алкогольные напитки/Вино (folder)/Вина России и ближнего зарубежья	0	
3284085	4607062863992	Вино chateau тамань алиготе сухое белое 12% 750мл стекло	22133	Продукты питания (folder)/Алкогольные напитки/Вино (folder)/Вино	0	
3284086	4607062864357	Вино chateau тамань белое тамани полусухое 10.5-12.5% 750мл стбут	22133	Продукты питания (folder)/Алкогольные напитки/Вино (folder)/Вино	3633958	chateau тамань (ARIANT VINNIY HOLDING/RUSSIA)
3284087	4607062868058	Вино chateau тамань дуо белое полусладк 10-12% 750мл ст/б	22133	Продукты питания (folder)/Алкогольные напитки/Вино (folder)/Вино	0	
3284088	4607062868041	Вино chateau тамань дуо красное полусладк 10-12% 750мл ст/б	22133	Продукты питания (folder)/Алкогольные напитки/Вино (folder)/Вино	0	
3284089	4607062867112	Вино chateau тамань дуо красное сухое 11-13% 750мл ст/б	22133	Продукты питания (folder)/Алкогольные напитки/Вино (folder)/Вино	0	
170775	4607062862209	Вино chateau тамань игр.б.полусладк п/у 750мл	22133	Продукты питания (folder)/Алкогольные напитки/Вино (folder)/Вино	3633958	chateau тамань (ARIANT VINNIY HOLDING/RUSSIA)
2853607	4607062861561	Вино chateau тамань игристоеб брют белое 10.5%-12.5% 1.5л стекло	22133	Продукты питания (folder)/Алкогольные напитки/Вино (folder)/Вино	3633958	chateau тамань (ARIANT VINNIY HOLDING/RUSSIA)
2427506	4607062866948	Вино chateau тамань каб.тамани красн сух 0.187л	22133	Продукты питания (folder)/Алкогольные напитки/Вино (folder)/Вино	690275	Кубань-Вино
4837212	4607062864104	Вино chateau тамань каб.тамани красн сух 0.187л #2	688533	Продукты питания (folder)/Алкогольные напитки/Вино (folder)/Вина России и ближнего зарубежья	690275	Кубань-Вино
4837211	4607062864036	Вино chateau тамань каб.тамани красн сух 0.187л #3	688533	Продукты питания (folder)/Алкогольные напитки/Вино (folder)/Вина России и ближнего зарубежья	690275	Кубань-Вино
3284091	4607062867068	Вино chateau тамань красное полусухое 12.5% 750мл	22133	Продукты питания (folder)/Алкогольные напитки/Вино (folder)/Вино	0	
3284092	4607062869123	Вино chateau тамань красное столов полусладк 11-13% 750мл стекло	22133	Продукты питания (folder)/Алкогольные напитки/Вино (folder)/Вино	0	
3284093	4607062865729	Вино chateau тамань красное столов полусухое красное 10.5-12.5% 750мл ст/б	22133	Продукты питания (folder)/Алкогольные напитки/Вино (folder)/Вино	0	
3284094	4607062867365	Вино chateau тамань красностоп красное сухое 12-14% 750мл ст/б	22133	Продукты питания (folder)/Алкогольные напитки/Вино (folder)/Вино	3793253	ШАТО ТАМАНИ
3284095	4607062868515	Вино chateau тамань красностоп резерв выдержанное сухое красное 11-13% 750мл стекло	22133	Продукты питания (folder)/Алкогольные напитки/Вино (folder)/Вино	3791598	ШАТО ТАМАНЬ РЕЗЕРВ
3284096	4607062863961	Вино chateau тамань красностоп сухое красное12% 750мл стбут	22133	Продукты питания (folder)/Алкогольные напитки/Вино (folder)/Вино	0	
4837213	4630037250237	Вино chateau тамань молодое красн сух 750мл	688533	Продукты питания (folder)/Алкогольные напитки/Вино (folder)/Вина России и ближнего зарубежья	690275	Кубань-Вино
1196071	4607062865682	Вино chateau тамань мускат спец 16.5% 750мл	22133	Продукты питания (folder)/Алкогольные напитки/Вино (folder)/Вино	690275	Кубань-Вино
3284097	4607062864005	Вино chateau тамань мускат сухое белое 12% 750мл стбут	22133	Продукты питания (folder)/Алкогольные напитки/Вино (folder)/Вино	0	
3284098	4607062864869	Вино chateau тамань премьер блан белое сухое 10.5-12.5% 750мл стбут	22133	Продукты питания (folder)/Алкогольные напитки/Вино (folder)/Вино	0	
3790988	4607062866344	Вино chateau тамань р.пр.руж сух красн 12.5% 750мл	22133	Продукты питания (folder)/Алкогольные напитки/Вино (folder)/Вино	3790126	ВИНА ТАМАНИ
