ID	UPCEAN	Name	CategoryID	CategoryName	BrandID	BrandName
3790453	3422511120324	Вино chablis aoc симонне.бел сух 750мл #3	22133	Продукты питания (folder)/Алкогольные напитки/Вино (folder)/Вино	3790450	ШАБЛИ
3790454	3422511130323	Вино chablis aoc симонне.бел сух 750мл #4	22133	Продукты питания (folder)/Алкогольные напитки/Вино (folder)/Вино	3790450	ШАБЛИ
3790455	3422511140322	Вино chablis aoc симонне.бел сух 750мл #5	22133	Продукты питания (folder)/Алкогольные напитки/Вино (folder)/Вино	3790450	ШАБЛИ
3790456	3422599100324	Вино chablis aoc симонне.бел сух 750мл #6	22133	Продукты питания (folder)/Алкогольные напитки/Вино (folder)/Вино	3790450	ШАБЛИ
1759820	4605513003188	Вино chablis bou.cruб.с.13% 750мл	22133	Продукты питания (folder)/Алкогольные напитки/Вино (folder)/Вино	0	
1760270	3340180000757	Вино chablis bouchard бел сух 750мл	22133	Продукты питания (folder)/Алкогольные напитки/Вино (folder)/Вино	184405	Bouchard
691347	3333241102415	Вино chablis chateau гренуй гран крю, 0.375л 0%	22133	Продукты питания (folder)/Алкогольные напитки/Вино (folder)/Вино	0	
1191545	3443500675021	Вино chablis domaine du colombier белое сухое 750мл	22133	Продукты питания (folder)/Алкогольные напитки/Вино (folder)/Вино	0	
1759821	4605513000514	Вино chablis gc l'closб.13% 750мл	22133	Продукты питания (folder)/Алкогольные напитки/Вино (folder)/Вино	0	
3790440	3332418000936	Вино chablis gr.cru bl.бел сух 750мл	22133	Продукты питания (folder)/Алкогольные напитки/Вино (folder)/Вино	1721254	Centrum
3790441	3151850003202	Вино chablis j.mor.белое сухое 750мл	22133	Продукты питания (folder)/Алкогольные напитки/Вино (folder)/Вино	0	
3790442	3451271000461	Вино chablis La marguerite 12.5% бел сух 750мл	22133	Продукты питания (folder)/Алкогольные напитки/Вино (folder)/Вино	1656683	Маргарита
3790443	3451271000584	Вино chablis La marguerite 12.5% бел сух 750мл #2	22133	Продукты питания (folder)/Алкогольные напитки/Вино (folder)/Вино	1656683	Маргарита
3790444	3451271001147	Вино chablis La marguerite 12.5% бел сух 750мл #3	22133	Продукты питания (folder)/Алкогольные напитки/Вино (folder)/Вино	1656683	Маргарита
3790445	3451271001819	Вино chablis La marguerite 12.5% бел сух 750мл #4	22133	Продукты питания (folder)/Алкогольные напитки/Вино (folder)/Вино	1656683	Маргарита
3283973	3451271002199	Вино chablis La marguerite белое 12.5% 750мл	22133	Продукты питания (folder)/Алкогольные напитки/Вино (folder)/Вино	1656683	Маргарита
1191546	3568900000027	Вино chablis lusienne michel белое сухое 750мл	22133	Продукты питания (folder)/Алкогольные напитки/Вино (folder)/Вино	0	
44530	3333241100060	Вино chablis petit chablis ла шаблизьен 12% 750мл бел сух	41821	Продукты питания (folder)/Алкогольные напитки/Вино (folder)/Вина Франции	44529	Ла Шаблизьен
45514	3333241106161	Вино chablis petit chablis ле виньерон 12% 750мл бел сух	22133	Продукты питания (folder)/Алкогольные напитки/Вино (folder)/Вино	0	
171321	3451276000435	Вино chablis petit chablis ля маргэрит 12% 750мл бел сух	22133	Продукты питания (folder)/Алкогольные напитки/Вино (folder)/Вино	3790430	LA MARGUERITE
3790447	3451271000829	Вино chablis viel.vignes'02 с.б.12.5% 750мл	22133	Продукты питания (folder)/Алкогольные напитки/Вино (folder)/Вино	0	
3790448	3451271001406	Вино chablis viel.vignes'02 с.б.12.5% 750мл #2	22133	Продукты питания (folder)/Алкогольные напитки/Вино (folder)/Вино	0	
3790459	3451492750954	Вино chablis белое сух 12% 750мл	22133	Продукты питания (folder)/Алкогольные напитки/Вино (folder)/Вино	0	
1195859	312058107052	Вино chablis белое сух 12.5% 750мл	22133	Продукты питания (folder)/Алкогольные напитки/Вино (folder)/Вино	0	
3790458	3436804800411	Вино chablis белое сух 12.5% 750мл #2	22133	Продукты питания (folder)/Алкогольные напитки/Вино (folder)/Вино	3790450	ШАБЛИ
1191547	3333241000551	Вино chablis белое сух 750мл	22133	Продукты питания (folder)/Алкогольные напитки/Вино (folder)/Вино	0	
3790469	3298660025663	Вино chablis белое сух 750мл #10	22133	Продукты питания (folder)/Алкогольные напитки/Вино (folder)/Вино	3790468	LORON
3790470	3259660120994	Вино chablis белое сух 750мл #11	22133	Продукты питания (folder)/Алкогольные напитки/Вино (folder)/Вино	3790450	ШАБЛИ
3790471	3269396054012	Вино chablis белое сух 750мл #12	22133	Продукты питания (folder)/Алкогольные напитки/Вино (folder)/Вино	0	
3790460	4690491015896	Вино chablis белое сух 750мл #2	22133	Продукты питания (folder)/Алкогольные напитки/Вино (folder)/Вино	2610764	Joseph Drouhin
3790461	4690491023662	Вино chablis белое сух 750мл #3	22133	Продукты питания (folder)/Алкогольные напитки/Вино (folder)/Вино	2610764	Joseph Drouhin
3790462	4690491034309	Вино chablis белое сух 750мл #4	22133	Продукты питания (folder)/Алкогольные напитки/Вино (folder)/Вино	2610764	Joseph Drouhin
3790463	4690491040003	Вино chablis белое сух 750мл #5	22133	Продукты питания (folder)/Алкогольные напитки/Вино (folder)/Вино	2610764	Joseph Drouhin
3790464	4690491045503	Вино chablis белое сух 750мл #6	22133	Продукты питания (folder)/Алкогольные напитки/Вино (folder)/Вино	2610764	Joseph Drouhin
3790465	4690491056950	Вино chablis белое сух 750мл #7	22133	Продукты питания (folder)/Алкогольные напитки/Вино (folder)/Вино	2610764	Joseph Drouhin
3790466	4690491064511	Вино chablis белое сух 750мл #8	22133	Продукты питания (folder)/Алкогольные напитки/Вино (folder)/Вино	2610764	Joseph Drouhin
3790467	4690491071496	Вино chablis белое сух 750мл #9	22133	Продукты питания (folder)/Алкогольные напитки/Вино (folder)/Вино	2610764	Joseph Drouhin
283494	3591623061105	Вино chablis белое сух 750мл 12.5% /Франция/	22133	Продукты питания (folder)/Алкогольные напитки/Вино (folder)/Вино	0	
283493	3451271001444	Вино chablis белое сух 750мл 12.5% alain geoffroy /Франция/	22133	Продукты питания (folder)/Алкогольные напитки/Вино (folder)/Вино	0	
3790474	4680004073727	Вино chablis белое сух 9-15% 750мл	22133	Продукты питания (folder)/Алкогольные напитки/Вино (folder)/Вино	0	
3790475	4680004075912	Вино chablis белое сух 9-15% 750мл #2	22133	Продукты питания (folder)/Алкогольные напитки/Вино (folder)/Вино	0	
3790473	3451271000751	Вино chablis белое сух 9-15% 750мл #3	22133	Продукты питания (folder)/Алкогольные напитки/Вино (folder)/Вино	3790472	МОРИС ТРАМБЛЕ
3790476	3525130000111	Вино chablis белое сухое 12.5% 0.375л	22133	Продукты питания (folder)/Алкогольные напитки/Вино (folder)/Вино	0	
4837136	3525130311613	Вино chablis бийо-симон бел сух 750мл	688362	Продукты питания (folder)/Алкогольные напитки/Вино (folder)/Вина Франции Бургундия	42120	Бийо-Симон
4837137	3525130311712	Вино chablis бийо-симон бел сух 750мл #2	688362	Продукты питания (folder)/Алкогольные напитки/Вино (folder)/Вина Франции Бургундия	42120	Бийо-Симон
1760269	1000003827962	Вино chablis вьей винь бел 750мл	22133	Продукты питания (folder)/Алкогольные напитки/Вино (folder)/Вино	0	
691337	3333241105911	Вино chablis вьей винь ла шаблизьен, 0.375л 13% сухое	22133	Продукты питания (folder)/Алкогольные напитки/Вино (folder)/Вино	0	
1195860	3540528448948	Вино chablis вьэй винь сух бел 2006г 750мл (Франция)	22133	Продукты питания (folder)/Алкогольные напитки/Вино (folder)/Вино	0	
4837138	3525135471510	Вино chablis гран крю бугро бел сух 750мл	688362	Продукты питания (folder)/Алкогольные напитки/Вино (folder)/Вина Франции Бургундия	42120	Бийо-Симон
3790478	3760096070154	Вино chablis гран крю вальмюр бел сух 750мл	22133	Продукты питания (folder)/Алкогольные напитки/Вино (folder)/Вино	3790477	ГРАН КРЮ
3790479	4640013684383	Вино chablis гран крю вальмюр бел сух 750мл #2	22133	Продукты питания (folder)/Алкогольные напитки/Вино (folder)/Вино	3790477	ГРАН КРЮ
3790480	4640013684680	Вино chablis гран крю вальмюр бел сух 750мл #3	22133	Продукты питания (folder)/Алкогольные напитки/Вино (folder)/Вино	3790477	ГРАН КРЮ
3790481	4640013686141	Вино chablis гран крю вальмюр бел сух 750мл #4	22133	Продукты питания (folder)/Алкогольные напитки/Вино (folder)/Вино	3790477	ГРАН КРЮ
3790482	4680004073734	Вино chablis гран крю вальмюр бел сух 750мл #5	22133	Продукты питания (folder)/Алкогольные напитки/Вино (folder)/Вино	3790477	ГРАН КРЮ
3790483	3451491750962	Вино chablis гран крю вод.бел сух 13% 750мл	22133	Продукты питания (folder)/Алкогольные напитки/Вино (folder)/Вино	3790477	ГРАН КРЮ
2227468	3399235800316	Вино chablis гран крю водезир 2012 бел/сух 0.75 13% 1/12	22133	Продукты питания (folder)/Алкогольные напитки/Вино (folder)/Вино	0	
4837140	3553520000120	Вино chablis гран крю водезир ролан лавантюро бел сух 750мл	688362	Продукты питания (folder)/Алкогольные напитки/Вино (folder)/Вина Франции Бургундия	4837139	Ролан Лавантюро
1659755	3151850048074	Вино chablis гран крю водезир сухое белое моро 13% (Франция) 750мл	22133	Продукты питания (folder)/Алкогольные напитки/Вино (folder)/Вино	0	
691340	3333241102064	Вино chablis гран крю гренуй 750мл 0%	22133	Продукты питания (folder)/Алкогольные напитки/Вино (folder)/Вино	1721254	Centrum
691341	3333241102019	Вино chablis гран крю гренуй, 0.375л 0%	22133	Продукты питания (folder)/Алкогольные напитки/Вино (folder)/Вино	0	
3790484	3151850027079	Вино chablis гран крю ле к.бел сух 750мл	22133	Продукты питания (folder)/Алкогольные напитки/Вино (folder)/Вино	3790477	ГРАН КРЮ
691342	3333241101463	Вино chablis гран крю ле кло ла шаблизьен 750мл 0%	22133	Продукты питания (folder)/Алкогольные напитки/Вино (folder)/Вино	3790477	ГРАН КРЮ
1659756	3158500270793	Вино chablis гран крю ле кло сухое белое 13% (Франция) 750мл	22133	Продукты питания (folder)/Алкогольные напитки/Вино (folder)/Вино	0	
3790485	3535927755001	Вино chablis гренуй гран крю бел сух 0.75 1	22133	Продукты питания (folder)/Алкогольные напитки/Вино (folder)/Вино	0	
1191548	3422511002323	Вино chablis жан делини белое сухое 750мл	22133	Продукты питания (folder)/Алкогольные напитки/Вино (folder)/Вино	0	
1195861	3298660028039	Вино chablis жюль бурден бел сух 750мл 12.5% /Франция/	22133	Продукты питания (folder)/Алкогольные напитки/Вино (folder)/Вино	0	
1195862	3451275000313	Вино chablis л.кло гран крю б/сух 13% 0.75 #2	22133	Продукты питания (folder)/Алкогольные напитки/Вино (folder)/Вино	0	
47125	012086325519	Вино chablis л.кло гран крю б/сух 13% 750мл	688362	Продукты питания (folder)/Алкогольные напитки/Вино (folder)/Вина Франции Бургундия	0	
283495	3535926012006	Вино chablis ла фонтен бел сух 750мл 13% /Франция/	22133	Продукты питания (folder)/Алкогольные напитки/Вино (folder)/Вино	0	
44531	3333241100169	Вино chablis ла шаблизьен 12% 750мл бел сух	41821	Продукты питания (folder)/Алкогольные напитки/Вино (folder)/Вина Франции	44529	Ла Шаблизьен
171316	3333241101067	Вино chablis ла шаблизьен боруа премьер крю 12% 750мл бел сух	22133	Продукты питания (folder)/Алкогольные напитки/Вино (folder)/Вино	0	
171317	3333241100565	Вино chablis ла шаблизьен ле фуршом премьер крю 12% 750мл бел сух	22133	Продукты питания (folder)/Алкогольные напитки/Вино (folder)/Вино	3790446	LES FOURCHAUMES
1759806	3269390054018	Вино chablis ламблен&фис сухое белое 12.5% 750мл стекло	22133	Продукты питания (folder)/Алкогольные напитки/Вино (folder)/Вино	3790421	ЛАМБЛЕН ЭНД ФИС
691343	3333241101715	Вино chablis ле бланшо гран крю ла шаблизьен, 0.375л 0%	22133	Продукты питания (folder)/Алкогольные напитки/Вино (folder)/Вино	0	
171318	3333241106062	Вино chablis ле виньерон 12% 750мл бел сух	22133	Продукты питания (folder)/Алкогольные напитки/Вино (folder)/Вино	1721254	Centrum
171319	3566921000781	Вино chablis луи латур ла шанфлер 750мл 13% бел сух	22133	Продукты питания (folder)/Алкогольные напитки/Вино (folder)/Вино	0	
1760271	3535926010002	Вино chablis луижад.б.с.13% 750мл	22133	Продукты питания (folder)/Алкогольные напитки/Вино (folder)/Вино	0	
171320	3451271001123	Вино chablis ля маргэрит 12% 750мл бел сух	22133	Продукты питания (folder)/Алкогольные напитки/Вино (folder)/Вино	1656683	Маргарита
283496	3451271001291	Вино chablis ля маргэрит бел сух 750мл 12.5% /Франция/	22133	Продукты питания (folder)/Алкогольные напитки/Вино (folder)/Вино	1656683	Маргарита
283497	3274032921023	Вино chablis мон флери бел сух 750мл 12% /Франция/	22133	Продукты питания (folder)/Алкогольные напитки/Вино (folder)/Вино	44745	Мон Флери
47126	3443620078467	Вино chablis оффрей бел сух 12.5% 750мл	22133	Продукты питания (folder)/Алкогольные напитки/Вино (folder)/Вино	0	
2954490	3443620084505	Вино chablis оффрей бел сух 12.5% 750мл #2	22133	Продукты питания (folder)/Алкогольные напитки/Вино (folder)/Вино	0	
3790486	3451496750967	Вино chablis пр. красн фур.в.в.бел сух 13% 750мл	22133	Продукты питания (folder)/Алкогольные напитки/Вино (folder)/Вино	0	
3790488	3436802300418	Вино chablis прем крю бор бел сух 0.75 13	22133	Продукты питания (folder)/Алкогольные напитки/Вино (folder)/Вино	0	
47127	3760100870060	Вино chablis премье крю 13% 750мл	41821	Продукты питания (folder)/Алкогольные напитки/Вино (folder)/Вина Франции	0	
3790498	3422511100357	Вино chablis премье крю бел сух 13% 750мл	22133	Продукты питания (folder)/Алкогольные напитки/Вино (folder)/Вино	0	
47128	3443620081924	Вино chablis премье крю боруа бел сух 12.5% 750мл	22133	Продукты питания (folder)/Алкогольные напитки/Вино (folder)/Вино	0	
47129	3335568306217	Вино chablis премье крю вайон 83 бел сух 12.9% 750мл	22133	Продукты питания (folder)/Алкогольные напитки/Вино (folder)/Вино	0	
283498	3591623051229	Вино chablis премье крю кот де леше резерв бел сух 750мл 13% /Франция/	22133	Продукты питания (folder)/Алкогольные напитки/Вино (folder)/Вино	0	
283499	3451272000668	Вино chablis премье крю ля маргэрит бел сух 750мл 13% /Франция/	22133	Продукты питания (folder)/Алкогольные напитки/Вино (folder)/Вино	3790430	LA MARGUERITE
1195864	3274033021029	Вино chablis премье крю мон флери бел сух 750мл 12.5% /Франция/	22133	Продукты питания (folder)/Алкогольные напитки/Вино (folder)/Вино	0	
3790499	3193411808079	Вино chablis премьер крю бел сух 750мл	22133	Продукты питания (folder)/Алкогольные напитки/Вино (folder)/Вино	3790487	ШАБЛИ КРЮ
3790500	3451273000308	Вино chablis премьер крю бел сух 750мл #2	22133	Продукты питания (folder)/Алкогольные напитки/Вино (folder)/Вино	3790487	ШАБЛИ КРЮ
1195865	3443620000314	Вино chablis премьер крю вайон 2007 бел 750мл	22133	Продукты питания (folder)/Алкогольные напитки/Вино (folder)/Вино	0	
691344	3333241100763	Вино chablis премьер крю ла шаблизьен 750мл 0%	22133	Продукты питания (folder)/Алкогольные напитки/Вино (folder)/Вино	0	
691345	3333241100367	Вино chablis премьер крю мон де милье ла шаблизьен 750мл 0%	22133	Продукты питания (folder)/Алкогольные напитки/Вино (folder)/Вино	0	
1195866	3333241100466	Вино chablis премьер крю мон де тоннери 750мл Франция	22133	Продукты питания (folder)/Алкогольные напитки/Вино (folder)/Вино	0	
1195867	3443620120111	Вино chablis премьер крю мон де тоннери 750мл Франция #2	22133	Продукты питания (folder)/Алкогольные напитки/Вино (folder)/Вино	0	
1659757	3151851464071	Вино chablis премьер крю монмен сухое белое моро 12.5-13% (Франция) 750мл	22133	Продукты питания (folder)/Алкогольные напитки/Вино (folder)/Вино	0	
1659758	3151850074073	Вино chablis премьер крю фушом сухое белое моро 12.5% (Франция) 750мл	22133	Продукты питания (folder)/Алкогольные напитки/Вино (folder)/Вино	3790487	ШАБЛИ КРЮ
1191663	3120581202277	Вино chablis рауль клерже сухое белое 12% 750мл стекло	22133	Продукты питания (folder)/Алкогольные напитки/Вино (folder)/Вино	0	
47130	3760100870046	Вино chablis савари бел сух 12.5% 750мл	41821	Продукты питания (folder)/Алкогольные напитки/Вино (folder)/Вина Франции	0	
1659759	3260980000156	Вино chablis сухое белое /жан-клод буасе/ 750мл	22133	Продукты питания (folder)/Алкогольные напитки/Вино (folder)/Вино	0	
1759823	8042295006291	Вино chainti docg красн с.12%750мл #2	22133	Продукты питания (folder)/Алкогольные напитки/Вино (folder)/Вино	3790501	CHAINTI
1759822	8042295003481	Вино chainti docg красн сух 12% 750мл	22133	Продукты питания (folder)/Алкогольные напитки/Вино (folder)/Вино	3790501	CHAINTI
3283974	3249381096210	Вино chais Saint vincent сухое белое 12.5% 250мл ст/б	22133	Продукты питания (folder)/Алкогольные напитки/Вино (folder)/Вино	0	
3283975	3176489011596	Вино chalet blanc moelleux белое полусладк 11% 750мл стекло	22133	Продукты питания (folder)/Алкогольные напитки/Вино (folder)/Вино	0	
3283976	3176489011572	Вино chalet столов красное полусладк 11% 750мл стекло	22133	Продукты питания (folder)/Алкогольные напитки/Вино (folder)/Вино	0	
3283977	3176489011565	Вино chalet столов красное сухое 12% 750мл стекло	22133	Продукты питания (folder)/Алкогольные напитки/Вино (folder)/Вино	0	
2720792	3249381047410	Вино chaleur de l ete blanc moelleux белое полусладк 10.5% 750мл ст/б	22133	Продукты питания (folder)/Алкогольные напитки/Вино (folder)/Вино	0	
2720795	3249381047380	Вино chaleur de l ete Rouge sec красное сухое 11% 750мл ст/б	22133	Продукты питания (folder)/Алкогольные напитки/Вино (folder)/Вино	0	
3283978	3249381077387	Вино chaleur de l ete Rouge sec красное сухое 11% 750мл ст/б #2	22133	Продукты питания (folder)/Алкогольные напитки/Вино (folder)/Вино	0	
2720794	3249381047397	Вино chaleur de l ete rouger moelleux столов красное полусладк 10.5% 750мл ст/б	22133	Продукты питания (folder)/Алкогольные напитки/Вино (folder)/Вино	0	
1759824	4607056603221	Вино chamb.musign.к.с.12% 750мл	22133	Продукты питания (folder)/Алкогольные напитки/Вино (folder)/Вино	0	
3283979	3120581085740	Вино chanson de l Amour красное сухое 11% 750мл стбут	22133	Продукты питания (folder)/Алкогольные напитки/Вино (folder)/Вино	0	
1191550	3342830436107	Вино chanson pouilly - fuisse 2006г белое сухое 750мл	22133	Продукты питания (folder)/Алкогольные напитки/Вино (folder)/Вино	0	
1191551	3342830905108	Вино chanson меркурий красн сух 750мл	22133	Продукты питания (folder)/Алкогольные напитки/Вино (folder)/Вино	0	
47149	3045710022628	Вино chantarel Cabernet Sauvignon 2005 красн сух 12.5% 750мл	41821	Продукты питания (folder)/Алкогольные напитки/Вино (folder)/Вина Франции	47148	Chantarel
1660216	3045710037271	Вино chantarel Cabernet Sauvignon красн сух 12% 750мл ст/б	688432	Продукты питания (folder)/Алкогольные напитки/Вино (folder)/Вина Франции Лангедок	47148	Chantarel
