ID	UPCEAN	Name	CategoryID	CategoryName	BrandID	BrandName
45193	3343380002637	Вино ноблекур метрдотель красн сух 11% 750ml	22133	Продукты питания (folder)/Алкогольные напитки/Вино (folder)/Вино	0	
283176	8005357040589	Вино новелло Merlot дель венетто igt красн сух 750ml 11.5% Италия	22133	Продукты питания (folder)/Алкогольные напитки/Вино (folder)/Вино	3790322	ДЕЛЛЕ ВЕНЕЦИЯ
45195	8013324004335	Вино новелло венето красн сух 12% 750ml	22470	Продукты питания (folder)/Алкогольные напитки/Вино (folder)/Вина Италии	45194	Новелло
1194731	8437006894593	Вино новильеро красн полусладк 11.5% 750ml	22133	Продукты питания (folder)/Алкогольные напитки/Вино (folder)/Вино	0	
3793840	4680011893943	Вино новоарбатское бел полусладк 10-12% 750ml	22133	Продукты питания (folder)/Алкогольные напитки/Вино (folder)/Вино	0	
3793841	4680011893950	Вино новоарбатское красн полусладк 10-12% 750ml	22133	Продукты питания (folder)/Алкогольные напитки/Вино (folder)/Вино	0	
690506	3120580012303	Вино ноел лепринц кюве Престиж 750ml 11% сухое	22133	Продукты питания (folder)/Алкогольные напитки/Вино (folder)/Вино	0	
4989700	012231119185	Вино ноз расинес Sauvignon блан бел псух 750ml	41821	Продукты питания (folder)/Алкогольные напитки/Вино (folder)/Вина Франции	4989699	Ноз Расинес
4989701	012231119208	Вино ноз расинес мерло красн п/ сух 750ml	41821	Продукты питания (folder)/Алкогольные напитки/Вино (folder)/Вина Франции	4989699	Ноз Расинес
1194732	8413933000153	Вино ноктурно вальдепеньяс крианса крас/сух 13% 750ml	22133	Продукты питания (folder)/Алкогольные напитки/Вино (folder)/Вино	0	
3793843	4603040012543	Вино номер.рез.саперави красн полусладк 375ml	22133	Продукты питания (folder)/Алкогольные напитки/Вино (folder)/Вино	0	
3290260	4630016490913	Вино номерное фруктовое плодовое полусладк 13-15% 1.5л пл/бут	22133	Продукты питания (folder)/Алкогольные напитки/Вино (folder)/Вино	0	
3290261	4630016491262	Вино номерное фруктовое плодовое полусладк 13-15% 1.5л пл/бут #2	22133	Продукты питания (folder)/Алкогольные напитки/Вино (folder)/Вино	0	
3290262	4630016491002	Вино номерное фруктовое плодовое полусладк 13-15% жб 700ml	22133	Продукты питания (folder)/Алкогольные напитки/Вино (folder)/Вино	0	
3290263	4630016491248	Вино номерное фруктовое столов полусладк 13-15% 700ml ст/б	22133	Продукты питания (folder)/Алкогольные напитки/Вино (folder)/Вино	0	
3290264	4630017481330	Вино номерной купаж купаж №10 сухое белое 12.6% 750ml ст/б	22133	Продукты питания (folder)/Алкогольные напитки/Вино (folder)/Вино	0	
3290265	4630017481347	Вино номерной купаж купаж №12 сухое белое 12.4% 750ml ст/б	22133	Продукты питания (folder)/Алкогольные напитки/Вино (folder)/Вино	0	
2854035	4630017481361	Вино номерной купаж купаж №20 сухое красное 12.7% 750ml ст/б	22133	Продукты питания (folder)/Алкогольные напитки/Вино (folder)/Вино	0	
2854036	4630017481378	Вино номерной купаж купаж №22 сухое красное 13.7% 750ml ст/б	22133	Продукты питания (folder)/Алкогольные напитки/Вино (folder)/Вино	0	
3290266	4602476005129	Вино норд роял белое полусладк 14% 700ml стекло	22133	Продукты питания (folder)/Алкогольные напитки/Вино (folder)/Вино	0	
3290267	4602476005563	Вино норд роял белое полусладк 14% 700ml стекло #2	22133	Продукты питания (folder)/Алкогольные напитки/Вино (folder)/Вино	0	
3290268	4602476005112	Вино норд роял красное полусладк 14% 700ml стекло	22133	Продукты питания (folder)/Алкогольные напитки/Вино (folder)/Вино	0	
3290269	4602476005570	Вино норд роял столов красное полусладк фруктовое 14% 700ml стекло	22133	Продукты питания (folder)/Алкогольные напитки/Вино (folder)/Вино	0	
170977	8008495005502	Вино норманно инзолия 12% 750ml бел сух	22133	Продукты питания (folder)/Алкогольные напитки/Вино (folder)/Вино	0	
170978	8008495001801	Вино норманно неро д'авола ди сицилия красн сух 12% 750ml	22133	Продукты питания (folder)/Алкогольные напитки/Вино (folder)/Вино	0	
42369	7792319677976	Вино нортон Malbec красн сух 750ml 13.5% /Аргентина/	282251	Продукты питания (folder)/Алкогольные напитки/Вино (folder)/Вина Аргентины	346466	Bodega Norton
690507	8437004444028	Вино носедаль резерва красн сух 750ml п/у/риоха	41484	Продукты питания (folder)/Алкогольные напитки/Вино (folder)/Вина Испании	0	
151391	4840044000491	Вино ностальжи розов полусладк молд. 700ml	22133	Продукты питания (folder)/Алкогольные напитки/Вино (folder)/Вино	0	
2426504	4840165000370	Вино нострадамус бел дес гарлинг 16% 0.700	22133	Продукты питания (folder)/Алкогольные напитки/Вино (folder)/Вино	0	
2426505	484016500035	Вино нострадамус бел полусладк гарлинг 10% 0.700	22133	Продукты питания (folder)/Алкогольные напитки/Вино (folder)/Вино	0	
2426506	4840165000387	Вино нострадамус красн п/дес гарлинг 16% 0.700	22133	Продукты питания (folder)/Алкогольные напитки/Вино (folder)/Вино	0	
2426507	4840165000363	Вино нострадамус красн полусладк гарлинг 10% 0.700	22133	Продукты питания (folder)/Алкогольные напитки/Вино (folder)/Вино	0	
45202	8032841440020	Вино ноттола нобиле ди монтеп красн сух 13.5% 750ml	22470	Продукты питания (folder)/Алкогольные напитки/Вино (folder)/Вина Италии	45201	Ноттола
45203	8032841440037	Вино ноттола россо ди монтеп красн сух 13.5% 750ml	22470	Продукты питания (folder)/Алкогольные напитки/Вино (folder)/Вина Италии	45201	Ноттола
690508	9300752070940	Вино ноубл 1 750ml 10% сладкое	22133	Продукты питания (folder)/Алкогольные напитки/Вино (folder)/Вино	0	
2854487	1220000070059	Вино ноули хэд Chardonnay бел сух 750ml	22133	Продукты питания (folder)/Алкогольные напитки/Вино (folder)/Вино	0	
2854485	822420299730	Вино ноули хэд вионье бел п/ сух 750ml	22133	Продукты питания (folder)/Алкогольные напитки/Вино (folder)/Вино	0	
4989702	36431816	Вино ноули хэд олд вайн зинфандель красн сух 750ml	22133	Продукты питания (folder)/Алкогольные напитки/Вино (folder)/Вино	41950	Алианта
2854486	822420011189	Вино ноули хэд птит сира красн сух 750ml	22133	Продукты питания (folder)/Алкогольные напитки/Вино (folder)/Вино	0	
3290270	4610002330850	Вино ночная Анапа столов белое полусладк 10-12% 700ml стбут	22133	Продукты питания (folder)/Алкогольные напитки/Вино (folder)/Вино	0	
2854488	4602613002066	Вино ночная красавица кра/пс 0.660	22133	Продукты питания (folder)/Алкогольные напитки/Вино (folder)/Вино	0	
3290271	4002301422877	Вино ночной флирт белое полусладк 9.5% 750ml ст/б	22133	Продукты питания (folder)/Алкогольные напитки/Вино (folder)/Вино	0	
3290272	8427894007779	Вино ночь любви столов красное полусладк 11% 700ml стекло	22133	Продукты питания (folder)/Алкогольные напитки/Вино (folder)/Вино	0	
3290273	4607142241474	Вино ночь любви столов красное полусухое 11% 700ml стекло	22133	Продукты питания (folder)/Алкогольные напитки/Вино (folder)/Вино	0	
151393	4823034001036	Вино ночь нефертити бел полусладк 750ml	22133	Продукты питания (folder)/Алкогольные напитки/Вино (folder)/Вино	0	
2854489	9418165201018	Вино нуала Sauvignon блан бел сух 750ml	22133	Продукты питания (folder)/Алкогольные напитки/Вино (folder)/Вино	0	
170980	8032610316808	Вино нуволати барбареско 750ml 13% красн сух	22133	Продукты питания (folder)/Алкогольные напитки/Вино (folder)/Вино	0	
170981	8032610316822	Вино нуволати барбера д'асти 750ml 13% красн сух	22133	Продукты питания (folder)/Алкогольные напитки/Вино (folder)/Вино	0	
170982	8032610316785	Вино нуволати бароло 750ml 13% красн сух	22133	Продукты питания (folder)/Алкогольные напитки/Вино (folder)/Вино	0	
170983	8032610316860	Вино нуволати гави ди гави 12% 750ml бел сух	22133	Продукты питания (folder)/Алкогольные напитки/Вино (folder)/Вино	0	
170984	8032610316846	Вино нуволати неббиоло д'альба 750ml 13% красн сух	22133	Продукты питания (folder)/Алкогольные напитки/Вино (folder)/Вино	0	
170985	3322720680902	Вино нуи делис 750ml 11% бел полусладк	22133	Продукты питания (folder)/Алкогольные напитки/Вино (folder)/Вино	0	
170986	3322720680865	Вино нуи делис 750ml 11% бел сух	22133	Продукты питания (folder)/Алкогольные напитки/Вино (folder)/Вино	0	
170987	3322720680889	Вино нуи делис 750ml 11% красн полусладк	22133	Продукты питания (folder)/Алкогольные напитки/Вино (folder)/Вино	0	
170988	3322720680841	Вино нуи делис 750ml 11% красн сух	22133	Продукты питания (folder)/Алкогольные напитки/Вино (folder)/Вино	0	
3793845	5010186018695	Вино нун ган флэгстоун юар 0.75 13% ст	22133	Продукты питания (folder)/Алкогольные напитки/Вино (folder)/Вино	0	
3290274	8427894011011	Вино нуэве дос белое полусухое 10-12% 750ml стекло	22133	Продукты питания (folder)/Алкогольные напитки/Вино (folder)/Вино	0	
3290275	8427894011059	Вино нуэве дос красное сухое 10-12% 750ml стекло	22133	Продукты питания (folder)/Алкогольные напитки/Вино (folder)/Вино	0	
3290276	8427894011035	Вино нуэве дос столов белое сухое 10% 750ml	22133	Продукты питания (folder)/Алкогольные напитки/Вино (folder)/Вино	0	
3793847	8023550167513	Вино нью сарп.т.р.тер&п. 750ml	22133	Продукты питания (folder)/Алкогольные напитки/Вино (folder)/Вино	3793846	НЬЮ САРПИНЕЛЛО
690510	9400001421148	Вино ньюдорф Chardonnay нельсон белсух.750ml/нельсон	688350	Продукты питания (folder)/Алкогольные напитки/Вино (folder)/Вина Новая Зеландия	690509	Ньюдорф
690511	9331727010081	Вино нэли дюдс баросса велли shiraz красн сух спец.750ml	282286	Продукты питания (folder)/Алкогольные напитки/Вино (folder)/Вина Австралии	0	
2977095	9331727010487	Вино нэли дюдс баросса велли shiraz красн сух спец.750ml #2	282286	Продукты питания (folder)/Алкогольные напитки/Вино (folder)/Вина Австралии	0	
3290278	4601211003932	Вино нэцкэ земляничное 750ml 9.5-11.5% ту стбут	22133	Продукты питания (folder)/Алкогольные напитки/Вино (folder)/Вино	3793848	НЭЦКЭ
1759529	4601211003925	Вино нэцкэ.вишневое полусладк 9.5-11.5% 750ml	1759520	Продукты питания (folder)/Алкогольные напитки/Вино (folder)/Вино плодовое	3793848	НЭЦКЭ
3793849	4601211003949	Вино нэцкэ.грушевое полусладк 9.5-11.5% 750ml	22133	Продукты питания (folder)/Алкогольные напитки/Вино (folder)/Вино	3793848	НЭЦКЭ
1759530	4601211003956	Вино нэцкэ.малинов.полусладк 9.5-11.5% 750ml	1759520	Продукты питания (folder)/Алкогольные напитки/Вино (folder)/Вино плодовое	3793848	НЭЦКЭ
3290277	4601211003918	Вино нэцкэ.сливовое полусладк 9.5-11.5% 750ml	22133	Продукты питания (folder)/Алкогольные напитки/Вино (folder)/Вино	0	
3793850	4601211004120	Вино нэцкэ.ч.смород.полусладк 9.5-11.5% 750ml	22133	Продукты питания (folder)/Алкогольные напитки/Вино (folder)/Вино	3793848	НЭЦКЭ
283177	3535921760001	Вино нюи сен жорж красн сух 750ml 13% /Франция/	22133	Продукты питания (folder)/Алкогольные напитки/Вино (folder)/Вино	3791650	NUITS-SAINT-GEORGES
4989704	3340778000473	Вино нютон-бенуа бургонь-от-кот-де-бон бел сух 750ml	688362	Продукты питания (folder)/Алкогольные напитки/Вино (folder)/Вина Франции Бургундия	4989703	Нютон-Бенуа
1760182	3295890133021	Вино о де гр.вин. красн полусладк 750ml	22133	Продукты питания (folder)/Алкогольные напитки/Вино (folder)/Вино	0	
1760181	3295890133014	Вино о де гр.вин.бел полусладк 750ml	22133	Продукты питания (folder)/Алкогольные напитки/Вино (folder)/Вино	0	
2854490	3416830265477	Вино о машель бел полусладк 11% 0.750 Франция	22133	Продукты питания (folder)/Алкогольные напитки/Вино (folder)/Вино	0	
1195971	3416830265439	Вино о машель бел сух 11.5% 0.750 Франция	22133	Продукты питания (folder)/Алкогольные напитки/Вино (folder)/Вино	0	
2854491	3416830265460	Вино о машель красн полусладк 11% 0.750 Франция	22133	Продукты питания (folder)/Алкогольные напитки/Вино (folder)/Вино	0	
1195972	3416830265422	Вино о машель красн сух 11.5% 0.750 Франция	22133	Продукты питания (folder)/Алкогольные напитки/Вино (folder)/Вино	0	
170992	3429671412023	Вино о медок chateau де маллере 12% 750ml красн сух	22133	Продукты питания (folder)/Алкогольные напитки/Вино (folder)/Вино	0	
170993	3429670665024	Вино о медок chateau о ля гравьер 12% 750ml красн сух	22133	Продукты питания (folder)/Алкогольные напитки/Вино (folder)/Вино	0	
170990	3211203421159	Вино о медок шато д'арсен крю буржуа 750ml 13% красн сух	22133	Продукты питания (folder)/Алкогольные напитки/Вино (folder)/Вино	0	
47407	3475290023997	Вино о медок шато труа мулен крю буржуа 12% 750ml красн сух	41821	Продукты питания (folder)/Алкогольные напитки/Вино (folder)/Вина Франции	0	
3290279	8011510009126	Вино о соле мио бонжорно белое полу сладкое столов 10.5% 750ml стекло	22133	Продукты питания (folder)/Алкогольные напитки/Вино (folder)/Вино	0	
3290280	8011510009133	Вино о соле мио буаносера красное полу сладкое столов 10.5% 750ml стекло	22133	Продукты питания (folder)/Алкогольные напитки/Вино (folder)/Вино	0	
3290281	8011510009119	Вино о соле мио буаносера красное сухое 11% 750ml	22133	Продукты питания (folder)/Алкогольные напитки/Вино (folder)/Вино	0	
4989706	3590410000617	Вино о-бланвиль гр.рез. Chardonnay русан пэи бел сух 750ml	688432	Продукты питания (folder)/Алкогольные напитки/Вино (folder)/Вина Франции Лангедок	4989152	РЕМЕР
4989705	3590410000297	Вино о-бланвиль гр.рез.сира-гренаш нуар красн сух 750ml	688432	Продукты питания (folder)/Алкогольные напитки/Вино (folder)/Вина Франции Лангедок	4989152	РЕМЕР
4989707	3590410000549	Вино о-бланвиль солаль верментино пэи бел сух 750ml	688432	Продукты питания (folder)/Алкогольные напитки/Вино (folder)/Вина Франции Лангедок	4989152	РЕМЕР
4989708	3590410000471	Вино о-бланвиль солаль вионье пэи бел сух 750ml	688432	Продукты питания (folder)/Алкогольные напитки/Вино (folder)/Вина Франции Лангедок	4989152	РЕМЕР
4989709	3590410000556	Вино о-бланвиль солаль гренаш-сенсо пэи розов сух 750ml	688432	Продукты питания (folder)/Алкогольные напитки/Вино (folder)/Вина Франции Лангедок	4989152	РЕМЕР
4989710	3590410000105	Вино о-бланвиль солаль мерло пэи красн сух 750ml	688432	Продукты питания (folder)/Алкогольные напитки/Вино (folder)/Вина Франции Лангедок	4989152	РЕМЕР
2720664	3395940528637	Вино о-ла-ла красн/сух 12%алк. 750ml	22133	Продукты питания (folder)/Алкогольные напитки/Вино (folder)/Вино	0	
3290291	3395940528613	Вино о-ла-ла столов белое полусладк 11% 750ml ст/б	22133	Продукты питания (folder)/Алкогольные напитки/Вино (folder)/Вино	0	
3290292	3395940528651	Вино о-ла-ла столов красное полусладк 11.5% 750ml ст/б	22133	Продукты питания (folder)/Алкогольные напитки/Вино (folder)/Вино	0	
1194755	3423290147571	Вино о-медок chateau жуйян св.винсент красн сух 13.5% 750ml /Франция/	22133	Продукты питания (folder)/Алкогольные напитки/Вино (folder)/Вино	0	
45210	3259356435005	Вино о-медок гранд театр красн сух 12.5% 750ml	41821	Продукты питания (folder)/Алкогольные напитки/Вино (folder)/Вина Франции	0	
283178	3412950051129	Вино о-медок шато бернадот красн сух 750ml 13% /Франция/св.винсент selection/	22133	Продукты питания (folder)/Алкогольные напитки/Вино (folder)/Вино	0	
2854492	3442320810292	Вино о.лефлев алос-кортон красн сух 750ml	22133	Продукты питания (folder)/Алкогольные напитки/Вино (folder)/Вино	0	
690513	3442320000976	Вино о.лефлев бургонь Chardonnay бел сух 750ml	688362	Продукты питания (folder)/Алкогольные напитки/Вино (folder)/Вина Франции Бургундия	690512	О.Лефлев
2977096	3442320186731	Вино о.лефлев бургонь Chardonnay бел сух 750ml #2	688362	Продукты питания (folder)/Алкогольные напитки/Вино (folder)/Вина Франции Бургундия	690512	О.Лефлев
2977097	3442320135296	Вино о.лефлев бургонь Chardonnay бел сух 750ml #3	688362	Продукты питания (folder)/Алкогольные напитки/Вино (folder)/Вина Франции Бургундия	690512	О.Лефлев
2977098	3442320033585	Вино о.лефлев бургонь Chardonnay бел сух 750ml #4	688362	Продукты питания (folder)/Алкогольные напитки/Вино (folder)/Вина Франции Бургундия	690512	О.Лефлев
2977099	3442320033424	Вино о.лефлев бургонь Chardonnay бел сух 750ml #5	688362	Продукты питания (folder)/Алкогольные напитки/Вино (folder)/Вина Франции Бургундия	690512	О.Лефлев
690514	3442320031802	Вино о.лефлев поммар красн сух 750ml	688362	Продукты питания (folder)/Алкогольные напитки/Вино (folder)/Вина Франции Бургундия	690512	О.Лефлев
2977100	3442320033790	Вино о.лефлев поммар красн сух 750ml #2	688362	Продукты питания (folder)/Алкогольные напитки/Вино (folder)/Вина Франции Бургундия	690512	О.Лефлев
2854493	3442320823575	Вино о.лефлев пюлиньи-монраше бел сух 750ml	22133	Продукты питания (folder)/Алкогольные напитки/Вино (folder)/Вино	0	
4836870	3442320854371	Вино о.лефлев пюлиньи-монраше бел сух 750ml #2	688362	Продукты питания (folder)/Алкогольные напитки/Вино (folder)/Вина Франции Бургундия	690512	О.Лефлев
1194735	3335569806211	Вино о.трикон chablis пр.крю вайон бел сух 750ml	22133	Продукты питания (folder)/Алкогольные напитки/Вино (folder)/Вино	45211	Оливье Трикон
1194734	3399235631774	Вино о.трикон petit chablis белое сух 12.5% 750ml	22133	Продукты питания (folder)/Алкогольные напитки/Вино (folder)/Вино	45211	Оливье Трикон
690515	4978526801073	Вино обаачан но умешу миири слив.со слив.п/ сух 1.6л	689306	Продукты питания (folder)/Алкогольные напитки/Вино (folder)/Вина Китая и Японии	0	
690516	4978526807129	Вино обаачан но умешу слив.п/ сух 0.72л	689306	Продукты питания (folder)/Алкогольные напитки/Вино (folder)/Вина Китая и Японии	0	
2426510	4030308102959	Вино облака любви белое полусладк 11% 750ml ст/б	22133	Продукты питания (folder)/Алкогольные напитки/Вино (folder)/Вино	0	
2426511	4030308102973	Вино облака любви красн полусладк 10% 750ml	22133	Продукты питания (folder)/Алкогольные напитки/Вино (folder)/Вино	0	
