ID	UPCEAN	Name	CategoryID	CategoryName	BrandID	BrandName
4989683	3664395026259	Вино мезон шампи бургонь пино нуар кюве эдме красн сух 750ml	688362	Продукты питания (folder)/Алкогольные напитки/Вино (folder)/Вина Франции Бургундия	4989681	Мезон Шампи
170926	3322720681008	Вино мейсон пиере 12% 750ml красн сух	22133	Продукты питания (folder)/Алкогольные напитки/Вино (folder)/Вино	0	
170925	3322720680421	Вино мейсон пиере 750ml 11% бел сух	22133	Продукты питания (folder)/Алкогольные напитки/Вино (folder)/Вино	0	
2426997	4650067390055	Вино меланж Cabernet столов полусладк красн алк-10-12% 1.000	22133	Продукты питания (folder)/Алкогольные напитки/Вино (folder)/Вино	0	
2426998	4650067390062	Вино меланж Chardonnay столов бел полусладк алк-10-12% 1.000	22133	Продукты питания (folder)/Алкогольные напитки/Вино (folder)/Вино	0	
3289576	4650067390147	Вино меланж Изабелла красное полусладк 10-12% tetrapak 3л	22133	Продукты питания (folder)/Алкогольные напитки/Вино (folder)/Вино	0	
3289577	4630000330058	Вино меланж Изабелла столов красное полусладк 10-12% tetrapak 1л	22133	Продукты питания (folder)/Алкогольные напитки/Вино (folder)/Вино	0	
3289578	4650067390048	Вино меланж Изабелла столов красное полусладк 10-12% tetrapak 1л #2	22133	Продукты питания (folder)/Алкогольные напитки/Вино (folder)/Вино	0	
3289579	4650067390031	Вино меланж мускат столов белое полусладк 11% tetrapak 1л	22133	Продукты питания (folder)/Алкогольные напитки/Вино (folder)/Вино	0	
1759500	4840472003583	Вино меланхолия столов полусладк белое мускат 700ml 12 %	1759450	Продукты питания (folder)/Алкогольные напитки/Вино (folder)/Вина Молдовы	0	
1759501	4840472003439	Вино меланхолия столов полусладк крас.каберне 700ml 13%	1759450	Продукты питания (folder)/Алкогольные напитки/Вино (folder)/Вина Молдовы	0	
2854265	8000160624100	Вино мелини кьянти красн сух 13% 750ml	22133	Продукты питания (folder)/Алкогольные напитки/Вино (folder)/Вино	0	
690377	8000160621536	Вино мелини орвието классико бел полусладк 750ml/умбрия	22470	Продукты питания (folder)/Алкогольные напитки/Вино (folder)/Вина Италии	0	
2426158	4660003840193	Вино мело красн полусладк втд 10-12% пэт 1.000	22133	Продукты питания (folder)/Алкогольные напитки/Вино (folder)/Вино	0	
2426159	4840009002065	Вино мелод/солнца Cabernet красн полусладк 9% 0.700	22133	Продукты питания (folder)/Алкогольные напитки/Вино (folder)/Вино	0	
2426160	4840009002072	Вино мелод/солнца Merlot красн полусладк 9% 0.700	22133	Продукты питания (folder)/Алкогольные напитки/Вино (folder)/Вино	0	
2426161	4840009002089	Вино мелод/солнца пино фран красн полусладк 9% 0.700	22133	Продукты питания (folder)/Алкогольные напитки/Вино (folder)/Вино	0	
2426162	4840009002041	Вино мелод/солнца фетяска бел полусладк 9% 0.700	22133	Продукты питания (folder)/Алкогольные напитки/Вино (folder)/Вино	0	
44967	3263810115983	Вино мелоди Cabernet Sauvignon красн 13.5% 750ml	22133	Продукты питания (folder)/Алкогольные напитки/Вино (folder)/Вино	44966	Мелоди
44968	3263810116003	Вино мелоди Chardonnay 2000 б.13% 750ml	22133	Продукты питания (folder)/Алкогольные напитки/Вино (folder)/Вино	44966	Мелоди
2854266	4601784000482	Вино мелодии любви розов полусладк ставроп 10-12% 0.700	22133	Продукты питания (folder)/Алкогольные напитки/Вино (folder)/Вино	0	
3289580	4699302005316	Вино мелодия души Cabernet столов красное полусладк 10-12% tetrapak 1л	22133	Продукты питания (folder)/Алкогольные напитки/Вино (folder)/Вино	0	
2720964	4699302005279	Вино мелодия души Chardonnay белое полусладк 10-12% 1л стекло	22133	Продукты питания (folder)/Алкогольные напитки/Вино (folder)/Вино	0	
3289581	4699302005309	Вино мелодия души красн полусладк 11% 1л	22133	Продукты питания (folder)/Алкогольные напитки/Вино (folder)/Вино	0	
3289582	4699302005361	Вино мелодия души ми Merlot красное полусладк 10-12% 700ml стекло	22133	Продукты питания (folder)/Алкогольные напитки/Вино (folder)/Вино	0	
3289583	4699302005262	Вино мелодия души мускат белое полусладк 11% 1л	22133	Продукты питания (folder)/Алкогольные напитки/Вино (folder)/Вино	0	
3289584	4699302005354	Вино мелодия души фа мускат белое полусладк 10-12% 700ml стекло	22133	Продукты питания (folder)/Алкогольные напитки/Вино (folder)/Вино	0	
3289585	4606860000707	Вино мелодия любви красн п сл 9-11% 700ml ст/б	22133	Продукты питания (folder)/Алкогольные напитки/Вино (folder)/Вино	0	
2426163	3800104122229	Вино мельник красн п/сух винпром 11% 0.700	1759169	Продукты питания (folder)/Алкогольные напитки/Вино (folder)/Вина Болгарии	0	
2426164	3800016640231	Вино мельник красн п/сух русе 11.5% 750ml	1759169	Продукты питания (folder)/Алкогольные напитки/Вино (folder)/Вина Болгарии	0	
283014	3800006908280	Вино мельник красн полусладк 2.0л 10.5-12.5% /Болгария/	1759169	Продукты питания (folder)/Алкогольные напитки/Вино (folder)/Вина Болгарии	0	
151091	3800011409086	Вино мельник красн полусладк болг 750ml	1759169	Продукты питания (folder)/Алкогольные напитки/Вино (folder)/Вина Болгарии	0	
2426165	3800082202142	Вино мельник красн полусладк недялков 10-12% 750ml	1759169	Продукты питания (folder)/Алкогольные напитки/Вино (folder)/Вина Болгарии	0	
151092	3800082204931	Вино мельник красн псух классика 11-12% 750ml	1759169	Продукты питания (folder)/Алкогольные напитки/Вино (folder)/Вина Болгарии	150392	РИКОМ 42
1194484	380001140906	Вино мельник красн сух 10-12% 750ml	1759169	Продукты питания (folder)/Алкогольные напитки/Вино (folder)/Вина Болгарии	0	
44969	3800005833224	Вино мельник красн сух 12% 750ml дгр	1759169	Продукты питания (folder)/Алкогольные напитки/Вино (folder)/Вина Болгарии	0	
2426166	380000580024	Вино мельник красн сух болг 12% 750ml	1759169	Продукты питания (folder)/Алкогольные напитки/Вино (folder)/Вина Болгарии	0	
3289586	3800003405133	Вино мельник красное полусладк 12% 750ml стекло	1759169	Продукты питания (folder)/Алкогольные напитки/Вино (folder)/Вина Болгарии	0	
2426167	380000583322	Вино мельник поморие красн сух 12% 750ml	1759169	Продукты питания (folder)/Алкогольные напитки/Вино (folder)/Вина Болгарии	0	
2854267	3800003402507	Вино мельник специальное 16% 700ml ст/б	1759169	Продукты питания (folder)/Алкогольные напитки/Вино (folder)/Вина Болгарии	0	
3289587	3800118130494	Вино мельник столов красное сухое 11-13% 750ml стекло	1759169	Продукты питания (folder)/Алкогольные напитки/Вино (folder)/Вина Болгарии	0	
3289588	3531380067422	Вино мелюзина белое сухое 11% 750ml	22133	Продукты питания (folder)/Алкогольные напитки/Вино (folder)/Вино	0	
3289589	3531380067484	Вино мелюзина сухое красное 11% 750ml	22133	Продукты питания (folder)/Алкогольные напитки/Вино (folder)/Вино	0	
3793650	7790189041842	Вино менд.х.бон-Cabernet Sauvignon красн сух 12.5% 750ml	22133	Продукты питания (folder)/Алкогольные напитки/Вино (folder)/Вино	0	
2854268	7798099350719	Вино мендуко Cabernet Sauvignon красн сух 750ml	22133	Продукты питания (folder)/Алкогольные напитки/Вино (folder)/Вино	0	
2854269	7798099350689	Вино мендуко Malbec красн сух 14% 750ml	22133	Продукты питания (folder)/Алкогольные напитки/Вино (folder)/Вино	0	
2854270	7798099350740	Вино мендуко торронтес бел сух 14% 750ml	22133	Продукты питания (folder)/Алкогольные напитки/Вино (folder)/Вино	0	
151094	4601211000900	Вино менуэт ООО прокос 18% 700ml	22133	Продукты питания (folder)/Алкогольные напитки/Вино (folder)/Вино	0	
690378	3495330260717	Вино меню aoc бордо бел сух 750ml 12% 0.2008. (Франция)	22133	Продукты питания (folder)/Алкогольные напитки/Вино (folder)/Вино	0	
690379	3495332760512	Вино меню aoc бордо красн сух 750ml 13% 0.2008. (Франция)	22133	Продукты питания (folder)/Алкогольные напитки/Вино (folder)/Вино	0	
267210	4650055692383	Вино меот.шард.бел сух п. столов 11-13% 750ml	22133	Продукты питания (folder)/Алкогольные напитки/Вино (folder)/Вино	45789	Русский Азов
267206	4650055692413	Вино меотида Merlot красное сух 10-12% 750ml	22133	Продукты питания (folder)/Алкогольные напитки/Вино (folder)/Вино	45789	Русский Азов
267207	4650055692420	Вино меотида Pinot Noir красн сух 10-12% 750ml	22133	Продукты питания (folder)/Алкогольные напитки/Вино (folder)/Вино	45789	Русский Азов
267205	4650055692376	Вино меотида каб. красн сух столов 11-13% 750ml	22133	Продукты питания (folder)/Алкогольные напитки/Вино (folder)/Вино	45789	Русский Азов
3289590	4607062867150	Вино мер нуар столов белое сухое 12% 750ml	22133	Продукты питания (folder)/Алкогольные напитки/Вино (folder)/Вино	0	
44977	4860001681136	Вино мерани алаз.Долина бел полусладк 12% 750ml	282274	Продукты питания (folder)/Алкогольные напитки/Вино (folder)/Вина Грузии	44976	Мерани
44978	4860001681143	Вино мерани алаз.Долина красн полусладк 12% 750ml	282274	Продукты питания (folder)/Алкогольные напитки/Вино (folder)/Вина Грузии	44976	Мерани
44979	4860001681174	Вино мерани ахашени красн полусладк 12% 750ml	282274	Продукты питания (folder)/Алкогольные напитки/Вино (folder)/Вина Грузии	44976	Мерани
44980	4860001681150	Вино мерани киндзмараули красн полусладк 12% 750ml	282274	Продукты питания (folder)/Алкогольные напитки/Вино (folder)/Вина Грузии	44976	Мерани
44981	4860001681181	Вино мерани саперави красн сух 12% 750ml	282274	Продукты питания (folder)/Алкогольные напитки/Вино (folder)/Вина Грузии	44976	Мерани
44982	4860001681167	Вино мерани хванчкара красн полусладк 12% 750ml	282274	Продукты питания (folder)/Алкогольные напитки/Вино (folder)/Вина Грузии	44976	Мерани
151098	4840249003426	Вино мерени Cabernet Sauvignon красн псух 3.0	22133	Продукты питания (folder)/Алкогольные напитки/Вино (folder)/Вино	150794	МЕРЕНИ
151101	4840249003402	Вино мерени Merlot красн псух 3.0	22133	Продукты питания (folder)/Алкогольные напитки/Вино (folder)/Вино	150794	МЕРЕНИ
1194486	484024900339	Вино мерени Sauvignon бел/п/сух 3.0	22133	Продукты питания (folder)/Алкогольные напитки/Вино (folder)/Вино	149718	БАХУС
151105	4840249003396	Вино мерени Sauvignon белое псух 3.0	22133	Продукты питания (folder)/Алкогольные напитки/Вино (folder)/Вино	150794	МЕРЕНИ
151096	4840249003419	Вино мерени Изабелла красн полусладк 3.0	22133	Продукты питания (folder)/Алкогольные напитки/Вино (folder)/Вино	150794	МЕРЕНИ
151095	4840249002450	Вино мерени Изабелла красн/креп молд. 0.75+штопор	22133	Продукты питания (folder)/Алкогольные напитки/Вино (folder)/Вино	150794	МЕРЕНИ
151097	4840249002474	Вино мерени изаура розов/креп молд. 0.75+штопор	22133	Продукты питания (folder)/Алкогольные напитки/Вино (folder)/Вино	150794	МЕРЕНИ
1194485	484024900247	Вино мерени изаура розов/креп молд. 0.75+штопор #2	22133	Продукты питания (folder)/Алкогольные напитки/Вино (folder)/Вино	0	
151099	4840249002498	Вино мерени кагор красн/десерт молд. 0.75+штопор	22133	Продукты питания (folder)/Алкогольные напитки/Вино (folder)/Вино	150794	МЕРЕНИ
151100	4840249002481	Вино мерени Лидия крас/пол/дес. молд. 0.75+штопор	22133	Продукты питания (folder)/Алкогольные напитки/Вино (folder)/Вино	150794	МЕРЕНИ
151102	4840249002443	Вино мерени мускат б/п/десерт молд. 0.75+штопор	22133	Продукты питания (folder)/Алкогольные напитки/Вино (folder)/Вино	150794	МЕРЕНИ
690381	8006805289017	Вино меридиана бел сух 11% 750ml	22470	Продукты питания (folder)/Алкогольные напитки/Вино (folder)/Вина Италии	690380	Меридиана
690382	8006805291010	Вино меридиана ст. красн сух 11% 750ml	22470	Продукты питания (folder)/Алкогольные напитки/Вино (folder)/Вина Италии	690380	Меридиана
2426168	4605654001029	Вино меритан блан муалле бел полусладк 10-12% 750ml	22133	Продукты питания (folder)/Алкогольные напитки/Вино (folder)/Вино	0	
2426169	4605654001005	Вино меритан руж муалле красн полусладк 10-12% 750ml	22133	Продукты питания (folder)/Алкогольные напитки/Вино (folder)/Вино	0	
3793653	3535921360003	Вино меркюри aoc красное сухое 750ml	22133	Продукты питания (folder)/Алкогольные напитки/Вино (folder)/Вино	3793652	МЕРКЮРИ
3289688	3308440052298	Вино мерлот защищенного географического указания красное сухое 13% 0.75 стбут	22133	Продукты питания (folder)/Алкогольные напитки/Вино (folder)/Вино	0	
3289689	4840463008016	Вино мерлот столов полусладк красное 10-12% 750ml стекло	22133	Продукты питания (folder)/Алкогольные напитки/Вино (folder)/Вино	0	
1659980	8437001172924	Вино мерседес Cabernet Sauvignon крас сух 0.75 13%	22133	Продукты питания (folder)/Алкогольные напитки/Вино (folder)/Вино	0	
1659982	8437001172931	Вино мерседес Chardonnay бел сух 750ml	22133	Продукты питания (folder)/Алкогольные напитки/Вино (folder)/Вино	0	
2854314	8437001172887	Вино мерседес Merlot красн п/сух 750ml	22133	Продукты питания (folder)/Алкогольные напитки/Вино (folder)/Вино	0	
2854315	8437001172948	Вино мерседес Sauvignon блан бел п/сух 750ml	22133	Продукты питания (folder)/Алкогольные напитки/Вино (folder)/Вино	0	
1659981	8437001172894	Вино мерседес темпранильо крас сух 750ml	22133	Продукты питания (folder)/Алкогольные напитки/Вино (folder)/Вино	0	
45000	3473120000774	Вино мерсо 2000g красн сух 13% 750ml	22133	Продукты питания (folder)/Алкогольные напитки/Вино (folder)/Вино	0	
1760162	3340180000887	Вино мерсо bouchard бел сух 750ml	22133	Продукты питания (folder)/Алкогольные напитки/Вино (folder)/Вино	3793654	МЕРСО
3793655	3340180005554	Вино мерсо bouchard бел сух 750ml #2	22133	Продукты питания (folder)/Алкогольные напитки/Вино (folder)/Вино	3793654	МЕРСО
690387	3506123830113	Вино мерсо бел сух 750ml/кот де бон	688362	Продукты питания (folder)/Алкогольные напитки/Вино (folder)/Вина Франции Бургундия	0	
3793656	4670003278827	Вино мерсо белое сухое 13% 750ml	22133	Продукты питания (folder)/Алкогольные напитки/Вино (folder)/Вино	3793654	МЕРСО
3793657	4690491000632	Вино мерсо белое сухое 13% 750ml #2	22133	Продукты питания (folder)/Алкогольные напитки/Вино (folder)/Вино	3793654	МЕРСО
3793658	3337690136786	Вино мерсо ле клу бел сух 750ml	22133	Продукты питания (folder)/Алкогольные напитки/Вино (folder)/Вино	0	
3793659	3337690143654	Вино мерсо ле клу бел сух 750ml #2	22133	Продукты питания (folder)/Алкогольные напитки/Вино (folder)/Вино	0	
3793660	3337690150430	Вино мерсо ле клу бел сух 750ml #3	22133	Продукты питания (folder)/Алкогольные напитки/Вино (folder)/Вино	0	
3793661	3337690156210	Вино мерсо ле клу бел сух 750ml #4	22133	Продукты питания (folder)/Алкогольные напитки/Вино (folder)/Вино	0	
3793662	3337690162891	Вино мерсо ле клу бел сух 750ml #5	22133	Продукты питания (folder)/Алкогольные напитки/Вино (folder)/Вино	0	
3793663	3337690169715	Вино мерсо ле клу бел сух 750ml #6	22133	Продукты питания (folder)/Алкогольные напитки/Вино (folder)/Вино	0	
3793664	3337690175174	Вино мерсо ле клу бел сух 750ml #7	22133	Продукты питания (folder)/Алкогольные напитки/Вино (folder)/Вино	0	
283058	3180421025169	Вино мерсо ле нарво шарль тома бел сух 750ml 13% /Франция/	22133	Продукты питания (folder)/Алкогольные напитки/Вино (folder)/Вино	0	
1194536	3193410820089	Вино мерсо святой винсент бел сух 750ml 13% /Франция/	22133	Продукты питания (folder)/Алкогольные напитки/Вино (folder)/Вино	0	
690388	3566921002396	Вино мерсо-блани шато де блани премьер крю луи латур 750ml 0% сухое	22133	Продукты питания (folder)/Алкогольные напитки/Вино (folder)/Вино	0	
44652	3566922002395	Вино мерсо-блани шато де блани премьер крю луи латур, 375ml 0%	22133	Продукты питания (folder)/Алкогольные напитки/Вино (folder)/Вино	44647	Луи Латур
2720851	8436559521437	Вино меса де мундо столов белое полусладк 0.75 11%	22133	Продукты питания (folder)/Алкогольные напитки/Вино (folder)/Вино	0	
2720852	8436559521420	Вино меса де мундо столов белое сухое 0.75 11%	22133	Продукты питания (folder)/Алкогольные напитки/Вино (folder)/Вино	0	
2720853	8436559521413	Вино меса де мундо столов красное полусладк 0.75 11%	22133	Продукты питания (folder)/Алкогольные напитки/Вино (folder)/Вино	0	
2720854	8436559521406	Вино меса де мундо столов красное сухое 0.75 11%	22133	Продукты питания (folder)/Алкогольные напитки/Вино (folder)/Вино	0	
1194537	5601292121319	Вино месиаш селектьон беррада бел сух 750ml 11.5% /Португалия/	22133	Продукты питания (folder)/Алкогольные напитки/Вино (folder)/Вино	0	
1194538	5601292122286	Вино месиаш селектьон дао бел сух 750ml 11.5% /Португалия/	22133	Продукты питания (folder)/Алкогольные напитки/Вино (folder)/Вино	0	
1194540	3021891807766	Вино месье карафон beaujolais nouveau 750ml	22133	Продукты питания (folder)/Алкогольные напитки/Вино (folder)/Вино	1194539	Месье Карафон
3289691	3295890160713	Вино месье карафон Cabernet Sauvignon красное сухое 12% 750ml	22133	Продукты питания (folder)/Алкогольные напитки/Вино (folder)/Вино	0	
3289690	3262850039365	Вино месье карафон блан белое сухое 10% 750ml стбут	22133	Продукты питания (folder)/Алкогольные напитки/Вино (folder)/Вино	0	
4836828	5200121100114	Вино метеора красн сух 750ml	22133	Продукты питания (folder)/Алкогольные напитки/Вино (folder)/Вино	4836827	Метеора
283060	4860099000482	Вино метехи алазанская Долина бел полусладк 750ml	282274	Продукты питания (folder)/Алкогольные напитки/Вино (folder)/Вина Грузии	283059	МЕТЕХИ
283061	4860099000437	Вино метехи алазанская Долина красн полусладк 750ml	282274	Продукты питания (folder)/Алкогольные напитки/Вино (folder)/Вина Грузии	283059	МЕТЕХИ
1194541	4860099000420	Вино метехи ахашени красн полусладк 750ml	282274	Продукты питания (folder)/Алкогольные напитки/Вино (folder)/Вина Грузии	0	
283062	4860099000406	Вино метехи киндзмараули красн полусладк 750ml	282274	Продукты питания (folder)/Алкогольные напитки/Вино (folder)/Вина Грузии	283059	МЕТЕХИ
