ID	UPCEAN	Name	CategoryID	CategoryName	BrandID	BrandName
5102945	4620015853055	Чай Richard Royal White tea, белый, 25 пакетиков	21794	Продукты питания (folder)/Чай и кофе/Чай	3584878	RICHARD
5102946	4620015854922	Чай Richard year of the Royal mouse, черный, листовой, 20g	21794	Продукты питания (folder)/Чай и кофе/Чай	3584878	RICHARD
5102947	4620015854717	Чай Richard year of the Royal mouse, черный, листовой, 40g	21794	Продукты питания (folder)/Чай и кофе/Чай	3584878	RICHARD
5102948	4620015854724	Чай Richard year of the Royal mouse, черный, листовой, 80g	21794	Продукты питания (folder)/Чай и кофе/Чай	3584878	RICHARD
3584885	4620015850573	Чай Richard апельсин корица гвоздика черный крупнолистовой жб 80g	21794	Продукты питания (folder)/Чай и кофе/Чай	3584878	RICHARD
2763160	4607099303942	Чай Richard жасмин	21794	Продукты питания (folder)/Чай и кофе/Чай	0	
2498474	4620015850610	Чай Richard зеленый Royal Green в пакетиках, 25шт 4620015850610	21794	Продукты питания (folder)/Чай и кофе/Чай	2498834	Ричард
2763164	4620015850597	Чай Richard зеленый крупнолистовой Royal Green, 90g 4620015850597	21794	Продукты питания (folder)/Чай и кофе/Чай	3584878	RICHARD
5817492	4823063700641	Чай Richard зеленый листовой милк улун 50г	21794	Продукты питания (folder)/Чай и кофе/Чай	3584878	RICHARD
2946099	4620015850580	Чай Richard китайский зеленый крупнолистовой жб 80g	21794	Продукты питания (folder)/Чай и кофе/Чай	3584878	RICHARD
2763091	4620015850047	Чай Richard корол.чай № 1лист черн 90g	21794	Продукты питания (folder)/Чай и кофе/Чай	3584878	RICHARD
2763102	4620015850030	Чай Richard лист lord grey 90g черн цейлонский с ароматом бергамота и лимона средний лист.	21794	Продукты питания (folder)/Чай и кофе/Чай	3584878	RICHARD
2498840	4620015850054	Чай Richard лист Royal ceylon 90g черн байховый цейлонский крупный лист	21794	Продукты питания (folder)/Чай и кофе/Чай	2498834	Ричард
2946097	4620015851747	Чай Richard лист Royal English breakfast 90g черн байх. кеннийский и индийский крупный лист	21794	Продукты питания (folder)/Чай и кофе/Чай	3584878	RICHARD
2947095	4620015852089	Чай Richard новогодний шар цейлонский черный 20g тв/уп	21794	Продукты питания (folder)/Чай и кофе/Чай	3584878	RICHARD
5817493	4660115901607	Чай Richard пакет Royal Peach&mint 25пак*1.7г 42.5г	21794	Продукты питания (folder)/Чай и кофе/Чай	3584878	RICHARD
3586815	4620015850238	Чай Richard цейлонский высший сорт 25 пак. т/у	21794	Продукты питания (folder)/Чай и кофе/Чай	0	
5817494	4823063703857	Чай Richard черный christmas clock 2 20г	21794	Продукты питания (folder)/Чай и кофе/Чай	3584878	RICHARD
5817495	4820018738032	Чай Richard черный Royal ceylon 25шт	21794	Продукты питания (folder)/Чай и кофе/Чай	3584878	RICHARD
5817496	4820018738131	Чай Richard черный Royal ceylon 90г	21794	Продукты питания (folder)/Чай и кофе/Чай	3584878	RICHARD
2946096	4620015851761	Чай Richard черный Royal English вreakfast в пакетиках, 25шт 4620015851761	21794	Продукты питания (folder)/Чай и кофе/Чай	3584878	RICHARD
2946103	4620015852447	Чай Richard черный Royal kenya в пакетиках, 25шт 4620015852447	21794	Продукты питания (folder)/Чай и кофе/Чай	3584878	RICHARD
5817497	4823063701020	Чай Richard черный листовой королевское сердце 30г	21794	Продукты питания (folder)/Чай и кофе/Чай	3584878	RICHARD
1340421	4796006750549	Чай richman Black tea органический листовой, 20 пирамидок по 2g	21794	Продукты питания (folder)/Чай и кофе/Чай	1340417	Ричман
5102949	4680014031281	Чай richman Classic darjeeling, черный листовой, 100g	21794	Продукты питания (folder)/Чай и кофе/Чай	3740230	RICHMAN
2947105	4680014031144	Чай richman Classic earl grey fantasy, черный листовой, с добавками, 100g	21794	Продукты питания (folder)/Чай и кофе/Чай	3740230	RICHMAN
2947106	4670003870328	Чай richman Classic flowery broken Orange pekoe, черный листовой, 100g	21794	Продукты питания (folder)/Чай и кофе/Чай	3740230	RICHMAN
5102950	4680014031120	Чай richman Classic fop черный листовой, кения, 100g	21794	Продукты питания (folder)/Чай и кофе/Чай	3740230	RICHMAN
2947104	4680014031137	Чай richman Classic Milk oolong, зеленый листовой, с добавками, 100g	21794	Продукты питания (folder)/Чай и кофе/Чай	3740230	RICHMAN
3740232	4670003870304	Чай richman Classic Orange pekoe, черный листовой, 100g	21794	Продукты питания (folder)/Чай и кофе/Чай	3740230	RICHMAN
5102951	4680014031274	Чай richman Classic puer dessert, черный листовой, с добавками, 100g	21794	Продукты питания (folder)/Чай и кофе/Чай	3740230	RICHMAN
2947103	4670003870380	Чай richman Classic young hyson, зеленый листовой, 100g	21794	Продукты питания (folder)/Чай и кофе/Чай	3740230	RICHMAN
5102952	4680014031113	Чай richman Classic ассам, черный крупнолистовой, 100g	21794	Продукты питания (folder)/Чай и кофе/Чай	3740230	RICHMAN
1340423	4796006750518	Чай richman earl grey органич черн жб 100g	21794	Продукты питания (folder)/Чай и кофе/Чай	1340417	Ричман
3940954	4680014031182	Чай richman earl grey черный листовой, с добавками, 100 пакетиков по 2g	21794	Продукты питания (folder)/Чай и кофе/Чай	3740230	RICHMAN
5102953	4680014031175	Чай richman earl grey черный листовой, с добавками, 25 пакетиков по 2g	21794	Продукты питания (folder)/Чай и кофе/Чай	3740230	RICHMAN
1340424	4796006750563	Чай richman earl grey черный органический листовой, с добавками, 20 пирамидок по 2g	21794	Продукты питания (folder)/Чай и кофе/Чай	1340417	Ричман
3940953	4680014031168	Чай richman engl.breakf черн байх.100x 2g	21794	Продукты питания (folder)/Чай и кофе/Чай	3740230	RICHMAN
5102954	4680014031151	Чай richman English brekfast, черный листовой, 25 пакетиков по 2g	21794	Продукты питания (folder)/Чай и кофе/Чай	3740230	RICHMAN
1340422	4796006750570	Чай richman exotic Black, черный органический листовой, с добавками, 20 пирамидок по 2g	21794	Продукты питания (folder)/Чай и кофе/Чай	1340417	Ричман
1340419	4796006750556	Чай richman Green tea органический листовой, 20 пирамидок по 2g	21794	Продукты питания (folder)/Чай и кофе/Чай	1340417	Ричман
3740235	4680014031199	Чай richman Herbal, зеленый листовой, с добавками, 100g	276607	Продукты питания (folder)/Чай и кофе/Фиточай	3740230	RICHMAN
3740236	4680014031205	Чай richman karkade, травяной, с добавками, 100g	276607	Продукты питания (folder)/Чай и кофе/Фиточай	3740230	RICHMAN
1340420	4796006750525	Чай richman young hyson, зеленый органический листовой, 100g	21794	Продукты питания (folder)/Чай и кофе/Чай	1340417	Ричман
5102955	4680014031458	Чай richman альпийский чабрец, черный листовой, с добавками, 25 пакетиков по 2g	21794	Продукты питания (folder)/Чай и кофе/Чай	3740230	RICHMAN
5102956	4680014031465	Чай richman малиновый десерт, травяной, с добавками, 25 пакетиков по 2g	21794	Продукты питания (folder)/Чай и кофе/Чай	3740230	RICHMAN
1340418	4796006750501	Чай richman оранж pekoe органич черн жб 100g	21794	Продукты питания (folder)/Чай и кофе/Чай	1340417	Ричман
1710472	4796006751713	Чай richman органик 100g+кружка	21794	Продукты питания (folder)/Чай и кофе/Чай	1340417	Ричман
2947107	4796006751072	Чай richman органик зелен жасмин/лимон/лесные ягоды 20пак*2g 40g	21794	Продукты питания (folder)/Чай и кофе/Чай	3740230	RICHMAN
5102957	4680014031472	Чай richman ройбуш Крем-карамель, травяной, с добавками, 25 пакетиков по 1.5g	21794	Продукты питания (folder)/Чай и кофе/Чай	3740230	RICHMAN
5102958	4680014031229	Чай richman с мятой, мелиссой и лимоном, зеленый листовой, с добавками, 25 пакетиков по 1.5g	21794	Продукты питания (folder)/Чай и кофе/Чай	3740230	RICHMAN
223755	5000183097069	Чай ridgeway org 80g	21794	Продукты питания (folder)/Чай и кофе/Чай	0	
2947094	5060123606225	Чай ridgways darjeeling черн 20пак.индив упак	21794	Продукты питания (folder)/Чай и кофе/Чай	409326	Ridgways
2947090	5060123606195	Чай ridgways earl grey черн 20пак.индив упак	21794	Продукты питания (folder)/Чай и кофе/Чай	409326	Ridgways
2947091	5060123606164	Чай ridgways английский завтрак черн 100пак	21794	Продукты питания (folder)/Чай и кофе/Чай	409326	Ridgways
2947092	5060123606188	Чай ridgways английский завтрак черн 20пак.индив упак	21794	Продукты питания (folder)/Чай и кофе/Чай	409326	Ridgways
2947093	5060123606232	Чай ridgways ассам черн 20пак.индив упак	21794	Продукты питания (folder)/Чай и кофе/Чай	409326	Ridgways
3584887	4607008959598	Чай rioba байховый с чабрецом 20x 5g	21794	Продукты питания (folder)/Чай и кофе/Чай	0	
3584888	4607008959543	Чай rioba фруктовый коктейль 20x 5g т/уп	21794	Продукты питания (folder)/Чай и кофе/Чай	0	
137109	4792156000404	Чай Riston 100g English elite 6x 20шт смесь черного с зеленым с ароматом бергамота uk New (Литва) Минск ип караван	21794	Продукты питания (folder)/Чай и кофе/Чай	21824	Riston
168967	4792156003245	Чай Riston 100g vintage Blend, черный (крупный лист) 6x 20шт uk (Литва) Минск ип караван	21794	Продукты питания (folder)/Чай и кофе/Чай	21824	Riston
2498475	4792156011462	Чай Riston 100g рождественский сочельник жб	21794	Продукты питания (folder)/Чай и кофе/Чай	21824	Riston
295703	4792156001050	Чай Riston 100g сeylon premium, 6x 20шт, черный (крупный лист) uk New (Литва) Минск ип караван	21794	Продукты питания (folder)/Чай и кофе/Чай	21824	Riston
1339092	4792156009629	Чай Riston 90g*20шт Orange gream черный байховый,цейлонский и китайский крупный лист аромотный с добавлением растительного сырь	21794	Продукты питания (folder)/Чай и кофе/Чай	21824	Riston
1339147	4792156005393	Чай Riston assorted Fruit teas ,черный,фруктовое ассорти 5 вкусов, 25 пак.по 1.5g, ш/к05393	21794	Продукты питания (folder)/Чай и кофе/Чай	21824	Riston
1339145	4792156009926	Чай Riston assorted teas, зеленый и травяной, ассорти 5 вкусов, 25пак. по 1.5g, ш/к 09926	21794	Продукты питания (folder)/Чай и кофе/Чай	21824	Riston
1339093	4792156005614	Чай Riston ceylon Blend пач. 80g	21794	Продукты питания (folder)/Чай и кофе/Чай	0	
295704	4792156000787	Чай Riston ceylon premium черный, 100 пакетиков по 2g, ш/к 00787	21794	Продукты питания (folder)/Чай и кофе/Чай	21824	Riston
137105	4792156001081	Чай Riston ceylon premium, черный листовой, 200g	21794	Продукты питания (folder)/Чай и кофе/Чай	21824	Riston
5102959	4612739010012	Чай Riston ceylon premium, черный, 25 пакетиков	21794	Продукты питания (folder)/Чай и кофе/Чай	21824	Riston
137123	4792156005126	Чай Riston Cherry jasmine черный пакетированный 25x 2g	21794	Продукты питания (folder)/Чай и кофе/Чай	21824	Riston
3584889	4792156010397	Чай Riston christmas черный крупнолистовой с ароматом клубники и корицы жб 100g	21794	Продукты питания (folder)/Чай и кофе/Чай	21824	Riston
137127	4791075001509	Чай Riston de luxe кволити жб 125g	21794	Продукты питания (folder)/Чай и кофе/Чай	21824	Riston
137128	4791075001516	Чай Riston de luxe кволити жб 275g	21794	Продукты питания (folder)/Чай и кофе/Чай	21824	Riston
137182	4792156004686	Чай Riston earl gray бергамот 25x 2g 50g ф/конв	21794	Продукты питания (folder)/Чай и кофе/Чай	21824	Riston
1339119	4792156001364	Чай Riston earl grey в жб 200g	21794	Продукты питания (folder)/Чай и кофе/Чай	21824	Riston
137181	4792156001685	Чай Riston earl grey Премиум черный с ароматом бергамота 25пак. 37.5g	21794	Продукты питания (folder)/Чай и кофе/Чай	21824	Riston
1841711	4792156006109	Чай Riston earl grey черн байх с аром бергамота 0.2g тв/уп	21794	Продукты питания (folder)/Чай и кофе/Чай	21824	Riston
295705	4792156006215	Чай Riston earl grey черный байховый 100x1.5g к/к	21794	Продукты питания (folder)/Чай и кофе/Чай	21824	Riston
295692	4792156003733	Чай Riston English breakfast, черный, 100 пакетиков по 2g, ш/к 03733	21794	Продукты питания (folder)/Чай и кофе/Чай	21824	Riston
137170	4792156000718	Чай Riston English delight черный байховый 100g	21794	Продукты питания (folder)/Чай и кофе/Чай	21824	Riston
860797	4792156000398	Чай Riston English elite tea, черный и зеленый листовой с бергамотом, купаж,200g,ш/к00398	21794	Продукты питания (folder)/Чай и кофе/Чай	21824	Riston
168984	4792156000428	Чай Riston English elite tea, черный с бергамотом, 100 пакетиков по 2g, ш/к 00428	21794	Продукты питания (folder)/Чай и кофе/Чай	21824	Riston
1339094	4792156006178	Чай Riston English elite без нитки 40п*2g	21794	Продукты питания (folder)/Чай и кофе/Чай	0	
1339095	4792156002668	Чай Riston finest ceylon 100g	21794	Продукты питания (folder)/Чай и кофе/Чай	0	
3940955	4792156051796	Чай Riston finest ceylon 100x1.5g	21794	Продукты питания (folder)/Чай и кофе/Чай	21824	Riston
137174	4792156001746	Чай Riston finest ceylon tea, черный, 100 пакетиков по 1.5g, ш/к 01746	21794	Продукты питания (folder)/Чай и кофе/Чай	21824	Riston
137175	4791075000939	Чай Riston finest ceylon пакет. с ярл. 25x1.5g	21794	Продукты питания (folder)/Чай и кофе/Чай	21824	Riston
137126	4792156004624	Чай Riston Green paradise зеленый 25x1.5g к/к	21794	Продукты питания (folder)/Чай и кофе/Чай	21824	Riston
3584890	4792156005461	Чай Riston Green tea with jasmine, зеленый с жасмином, 100 пак. по 2g, ш/к 05461	21794	Продукты питания (folder)/Чай и кофе/Чай	21824	Riston
1339096	4792156002330	Чай Riston Green tea хайсон 100g	21794	Продукты питания (folder)/Чай и кофе/Чай	0	
3584891	4650001072146	Чай Riston Green жасмин зелен жб 100g	21794	Продукты питания (folder)/Чай и кофе/Чай	21824	Riston
3940956	4792156014500	Чай Riston hol.greet черн к/лист.инд.90g	21794	Продукты питания (folder)/Чай и кофе/Чай	21824	Riston
3940957	4792156014517	Чай Riston hol.greet черн к/лист.инд.90g #2	21794	Продукты питания (folder)/Чай и кофе/Чай	21824	Riston
1339097	4792156006000	Чай Riston irish breakfast 100пак*1.5g	21794	Продукты питания (folder)/Чай и кофе/Чай	0	
1339098	4792156002071	Чай Riston irish crem 20пак*2g	21794	Продукты питания (folder)/Чай и кофе/Чай	0	
1339099	4792156001531	Чай Riston Lemon tea 20пак*2g	21794	Продукты питания (folder)/Чай и кофе/Чай	0	
3584892	4792156014364	Чай Riston Original Blend черный 25x2 к/к	21794	Продукты питания (folder)/Чай и кофе/Чай	21824	Riston
137160	4792156004655	Чай Riston Passion Fruit черный 25x 2g к/к	21794	Продукты питания (folder)/Чай и кофе/Чай	21824	Riston
3584893	4792156010526	Чай Riston Passion island черный 25x1.5g к/к	21794	Продукты питания (folder)/Чай и кофе/Чай	21824	Riston
1339100	4792156006192	Чай Riston premium English без нитки 40п*2g	21794	Продукты питания (folder)/Чай и кофе/Чай	0	
3584894	4792156007137	Чай Riston Pure Green tea, зеленый листовой, картонная коробка, 200g ш/к 07137	21794	Продукты питания (folder)/Чай и кофе/Чай	21824	Riston
1841710	4792156005478	Чай Riston Pure Green tea, зеленый, 100 пакетиков по 2g, ш/к 05478	21794	Продукты питания (folder)/Чай и кофе/Чай	21824	Riston
5817498	4792156015385	Чай Riston Royal collection ceylon supreme черный 100 пакетиков 4792156015385	21794	Продукты питания (folder)/Чай и кофе/Чай	21824	Riston
5817499	4792156015507	Чай Riston Royal collection ceylon supreme черный крупнолистовой 100г 4792156015507	21794	Продукты питания (folder)/Чай и кофе/Чай	21824	Riston
5817500	4792156015590	Чай Riston Royal collection gourmet earl grey черный 100г 4792156015590	21794	Продукты питания (folder)/Чай и кофе/Чай	21824	Riston
5817501	4792156015613	Чай Riston Royal collection Wild strawberry черный ароматизированый 100г 4792156015613	21794	Продукты питания (folder)/Чай и кофе/Чай	21824	Riston
1339101	4792156004402	Чай Riston Royal delight жб 100g	21794	Продукты питания (folder)/Чай и кофе/Чай	0	
137119	4792156003276	Чай Riston vintage Blend, черный листовой, картонная коробка 200g ш/к 03276	21794	Продукты питания (folder)/Чай и кофе/Чай	21824	Riston
295696	4792156005133	Чай Riston Vitality черный пакетированный 25x 2g	21794	Продукты питания (folder)/Чай и кофе/Чай	21824	Riston
3584895	4792156005041	Чай Riston английская роза черный жб 100g	21794	Продукты питания (folder)/Чай и кофе/Чай	21824	Riston
3584896	4792156014937	Чай Riston английский завтрак 25 пакетов м/у	21794	Продукты питания (folder)/Чай и кофе/Чай	21824	Riston
295702	4792156004662	Чай Riston английский завтрак в пакетиках для раз.заварки 25пак*2g	21794	Продукты питания (folder)/Чай и кофе/Чай	21824	Riston
168964	4791075000403	Чай Riston английский завтрак лист 100g	21794	Продукты питания (folder)/Чай и кофе/Чай	21824	Riston
137102	4792156002156	Чай Riston английский завтрак лист.200g	21794	Продукты питания (folder)/Чай и кофе/Чай	21824	Riston
1339103	4792156003764	Чай Riston английский завтрак традиционный 100g	21794	Продукты питания (folder)/Чай и кофе/Чай	21824	Riston
1339104	4792156003795	Чай Riston английский завтрак традиция 200g	21794	Продукты питания (folder)/Чай и кофе/Чай	21824	Riston
2763109	4792156007410	Чай Riston английский завтрак черн гр.мел/л. 90g	21794	Продукты питания (folder)/Чай и кофе/Чай	21824	Riston
3584897	4792156014951	Чай Riston английский завтрак черный байховый 100x 2g тв/у	21794	Продукты питания (folder)/Чай и кофе/Чай	21824	Riston
295693	4792156003672	Чай Riston английский завтрак черный пакетированный 25x 2g	21794	Продукты питания (folder)/Чай и кофе/Чай	21824	Riston
295691	4792156003511	Чай Riston английский завтрак черный цейлонский среднелистовой 200 т/у	21794	Продукты питания (folder)/Чай и кофе/Чай	21824	Riston
3940958	4792156011424	Чай Riston английский классический 25x 2g	21794	Продукты питания (folder)/Чай и кофе/Чай	21824	Riston
137103	4792156004679	Чай Riston английский классический в пакетиках для раз.заварки 25пак*2g	21794	Продукты питания (folder)/Чай и кофе/Чай	21824	Riston
1339105	4792156000640	Чай Riston английский конверт 50пак*2g	21794	Продукты питания (folder)/Чай и кофе/Чай	21824	Riston
1841709	4792156001111	Чай Riston английский ор Премиум 500g	21794	Продукты питания (folder)/Чай и кофе/Чай	0	
168974	4791075001523	Чай Riston английский Премиум /ор/ 100g	21794	Продукты питания (folder)/Чай и кофе/Чай	21824	Riston
137104	4791075000571	Чай Riston английский Премиум 100пак*2g	21794	Продукты питания (folder)/Чай и кофе/Чай	21824	Riston
137106	4792156000756	Чай Riston английский Премиум 50пак*2g	21794	Продукты питания (folder)/Чай и кофе/Чай	21824	Riston
1339106	4792156000879	Чай Riston английский Премиум конверт 50пак*2g	21794	Продукты питания (folder)/Чай и кофе/Чай	0	
137107	4792156002545	Чай Riston английский супреме 200g	21794	Продукты питания (folder)/Чай и кофе/Чай	21824	Riston
2946105	4792156013923	Чай Riston английский суприм жб 100g	21794	Продукты питания (folder)/Чай и кофе/Чай	0	
1339107	4792156001333	Чай Riston английский суприм кр.лист жб 300g	21794	Продукты питания (folder)/Чай и кофе/Чай	21824	Riston
137110	4791075000441	Чай Riston английский элитный 20x 2g	21794	Продукты питания (folder)/Чай и кофе/Чай	21824	Riston
168986	4792156000411	Чай Riston английский элитный 20пак*2g	21794	Продукты питания (folder)/Чай и кофе/Чай	21824	Riston
137114	4792156000442	Чай Riston английский элитный 50пак*2g	21794	Продукты питания (folder)/Чай и кофе/Чай	21824	Riston
