ID	UPCEAN	Name	CategoryID	CategoryName	BrandID	BrandName
32055	4607051151697	Чай терпкий 200g	21794	Продукты питания (folder)/Чай и кофе/Чай	31501	МАЙСКИЙ ЧАЙ
2498933	4607010490072	Чай тетли 2x 100g+банка	21794	Продукты питания (folder)/Чай и кофе/Чай	0	
1710518	4796004231019	Чай ти лиа безмятежный трав.20пир*2g 40g	21794	Продукты питания (folder)/Чай и кофе/Чай	1710517	Ти Лиа
1710519	4796004230920	Чай ти лиа вишня зелен 20пир*2g 40g	21794	Продукты питания (folder)/Чай и кофе/Чай	1710517	Ти Лиа
1710520	4796004230845	Чай ти лиа губернатор грэй чер.20пир*2g 40g	21794	Продукты питания (folder)/Чай и кофе/Чай	1710517	Ти Лиа
1710521	4796004231156	Чай ти лиа зелен жб 100g	21794	Продукты питания (folder)/Чай и кофе/Чай	1710517	Ти Лиа
1710522	4796004231095	Чай ти лиа карамель/яблоко жб 100g	21794	Продукты питания (folder)/Чай и кофе/Чай	1710517	Ти Лиа
1710524	4796004230852	Чай ти лиа пряный имбирь/персик чер.20пир*2g 40g	21794	Продукты питания (folder)/Чай и кофе/Чай	1710517	Ти Лиа
1710525	4796004231194	Чай ти лиа ройбос карамель трав.жб 100g	21794	Продукты питания (folder)/Чай и кофе/Чай	1710517	Ти Лиа
1710526	4796004230913	Чай ти лиа тирамису 20пир*2g 40g	21794	Продукты питания (folder)/Чай и кофе/Чай	1710517	Ти Лиа
1710527	4796004231040	Чай ти лиа цейлонский чер.жб 100g	21794	Продукты питания (folder)/Чай и кофе/Чай	1710517	Ти Лиа
3587106	4627088830198	Чай тиавит травянной №37 желчегонный 37g тв/уп	21794	Продукты питания (folder)/Чай и кофе/Чай	0	
3587107	4627088830266	Чай тиавит ягодный брусничный 50g тв/уп	21794	Продукты питания (folder)/Чай и кофе/Чай	0	
3587108	4627088830334	Чай тиавиттаежный бальзам 50g тв/уп	21794	Продукты питания (folder)/Чай и кофе/Чай	0	
541014	7290005169922	Чай тибетский 2g №100 пак /натуральн вкус/	378131	Лекарственные средства (folder)/Лекарственные сборы	0	
541017	7290005169953	Чай тибетский 2g №100 пак /фруктовый вкус/	378131	Лекарственные средства (folder)/Лекарственные сборы	0	
137532	4607021760188	Чай тибетский без кофеина 50g	21794	Продукты питания (folder)/Чай и кофе/Чай	0	
2966430	4607021760218	Чай тибетский без кофеина 50g #2	21794	Продукты питания (folder)/Чай и кофе/Чай	0	
137533	4607021760225	Чай тибетский брусника/смородина 50g	21794	Продукты питания (folder)/Чай и кофе/Чай	0	
541015	7290005169946	Чай тибетский лимон вкус 2g №100 ф/п	378131	Лекарственные средства (folder)/Лекарственные сборы	0	
28797	4601498001430	Чай тибетский очищающий 2.0 №20 (ОАО красногорсклексредства)	2506298	Продукты питания (folder)/Чай и кофе/Чайный напиток	28795	ЩЕДРОСТЬ ПРИРОДЫ
137534	4607021760201	Чай тибетский с золотым корнем 50g	21794	Продукты питания (folder)/Чай и кофе/Чай	0	
5103657	4606471350147	Чай тибетский №28 ф/п 1.8 №20 (при броонхите)	21794	Продукты питания (folder)/Чай и кофе/Чай	0	
1340531	4603224135099	Чай тигрейт букет любви жб 100g	21794	Продукты питания (folder)/Чай и кофе/Чай	1340530	Тигрейт
1340532	4603224134948	Чай тигрейт букет нежности жб 100g	21794	Продукты питания (folder)/Чай и кофе/Чай	1340530	Тигрейт
2271771	4601234569699	Чай тигрейт владимирская матрешка чер.жб 150g	21794	Продукты питания (folder)/Чай и кофе/Чай	1340530	Тигрейт
2271772	4601234569743	Чай тигрейт владимирская матрешка чер.жб 75g	21794	Продукты питания (folder)/Чай и кофе/Чай	1340530	Тигрейт
1340533	4603224135150	Чай тигрейт волшебная жемчужина жб 100g	21794	Продукты питания (folder)/Чай и кофе/Чай	1340530	Тигрейт
1338398	4607032390176	Чай тигрейт жемчужина востока жб 100g	21794	Продукты питания (folder)/Чай и кофе/Чай	1340530	Тигрейт
2271774	4601234569729	Чай тигрейт ивановская матрешка чер.жб 75g	21794	Продукты питания (folder)/Чай и кофе/Чай	1340530	Тигрейт
2271775	4601234569682	Чай тигрейт костромская матрешка чер.жб 150g	21794	Продукты питания (folder)/Чай и кофе/Чай	1340530	Тигрейт
2947281	4603224147009	Чай тигрейт матрешка зеленая 50g сувенирн.уп	21794	Продукты питания (folder)/Чай и кофе/Чай	0	
2947283	4603224146989	Чай тигрейт матрешка синяя 50g сувенирн.уп	21794	Продукты питания (folder)/Чай и кофе/Чай	0	
1340534	4603224135174	Чай тигрейт морская жемчужина жб 100g	21794	Продукты питания (folder)/Чай и кофе/Чай	1340530	Тигрейт
2947285	4603224147122	Чай тигрейт самовар Золотой 75g сувенирн.уп	21794	Продукты питания (folder)/Чай и кофе/Чай	0	
2947286	4603224147139	Чай тигрейт самовар красный 75g сувенирн.уп	21794	Продукты питания (folder)/Чай и кофе/Чай	0	
2271776	4601234569668	Чай тигрейт суздальская матрешка чер.жб 150g	21794	Продукты питания (folder)/Чай и кофе/Чай	1340530	Тигрейт
2271778	4601234569705	Чай тигрейт ярославская матрешка чер.жб 150g	21794	Продукты питания (folder)/Чай и кофе/Чай	1340530	Тигрейт
2271779	4601234569750	Чай тигрейт ярославская матрешка чер.жб 75g	21794	Продукты питания (folder)/Чай и кофе/Чай	1340530	Тигрейт
5103659	4009300528166	Чай тикане зелен манго-цитрон 20x1.5g	21794	Продукты питания (folder)/Чай и кофе/Чай	5103658	Тикане
5103660	4009300528524	Чай тикане черн earl grey цитрус 20x1.8g	21794	Продукты питания (folder)/Чай и кофе/Чай	5103658	Тикане
5103661	4009300528548	Чай тикане черн гранат 20x 2g	21794	Продукты питания (folder)/Чай и кофе/Чай	5103658	Тикане
5103662	4009300528470	Чай тикане черн тимьян-мед 20x 2g	21794	Продукты питания (folder)/Чай и кофе/Чай	5103658	Тикане
5103664	4009300528784	Чай тиканне подарочный набор нг ассорти 6вид*4пак	21794	Продукты питания (folder)/Чай и кофе/Чай	5103663	Тиканне
137535	5901716913828	Чай тип-топ 200g	135886	Продукты питания (folder)/Чай и кофе/Чай детский	9937	Тип-Топ
137536	5901716913811	Чай тип-топ c 10-ти мес.вит.с 200g	135886	Продукты питания (folder)/Чай и кофе/Чай детский	9937	Тип-Топ
2498949	5901716983906	Чай тип-топ ромашка 200g	21794	Продукты питания (folder)/Чай и кофе/Чай	0	
137538	5901716913842	Чай тип-топ с 10мес.травяной 200g	135886	Продукты питания (folder)/Чай и кофе/Чай детский	9937	Тип-Топ
137539	4008976598497	Чай тип-топ с 4-х мес.	135886	Продукты питания (folder)/Чай и кофе/Чай детский	9937	Тип-Топ
2966431	4008976598480	Чай тип-топ с 4-х мес. #2	135886	Продукты питания (folder)/Чай и кофе/Чай детский	9937	Тип-Топ
168813	5901716985474	Чай тип-топ травяной с липовым цветом 200g	22738	Продукты питания (folder)/Детское питание (folder)/Детское питание	0	
860833	858218001193	Чай типози 4сезона весенняя соната 24g	21794	Продукты питания (folder)/Чай и кофе/Чай	860832	Типози
860834	858218001223	Чай типози 4сезона зимний дуэт 24g	21794	Продукты питания (folder)/Чай и кофе/Чай	860832	Типози
860835	858218001209	Чай типози 4сезона летняя симфония 24g	21794	Продукты питания (folder)/Чай и кофе/Чай	860832	Типози
860836	858218001216	Чай типози 4сезона осенний концерт 24g	21794	Продукты питания (folder)/Чай и кофе/Чай	860832	Типози
3587109	4607071973606	Чай тиссам зеленый мелкий 16x 50g	21794	Продукты питания (folder)/Чай и кофе/Чай	0	
3587110	4607071973583	Чай тиссам зеленый среднелистовой 100g	21794	Продукты питания (folder)/Чай и кофе/Чай	0	
3587111	4607071973552	Чай тиссам черный цейлонский 25x 2g к/к	21794	Продукты питания (folder)/Чай и кофе/Чай	0	
3587112	4607071973569	Чай тиссам черный цейлонский крупнолистовой 100g	21794	Продукты питания (folder)/Чай и кофе/Чай	0	
3587113	4607071973538	Чай тиссам черный цейлонский среднелистовой 100g	21794	Продукты питания (folder)/Чай и кофе/Чай	0	
3587114	4607071973545	Чай тиссам черный цейлонский среднелистовой 250g	21794	Продукты питания (folder)/Чай и кофе/Чай	3759456	TEESSAM (KLASSIK/SPB)
3587115	4870005792073	Чай той бастар кенийский черный 250g тв/уп	21794	Продукты питания (folder)/Чай и кофе/Чай	0	
3587116	4870057006777	Чай той восточный черный крупнолистовой 150g тв/уп	21794	Продукты питания (folder)/Чай и кофе/Чай	0	
3587117	4870057003608	Чай той индийский крупнолистовой жб 200g	21794	Продукты питания (folder)/Чай и кофе/Чай	0	
3587118	4870057006784	Чай той кенийский черный крупнолистовой 150g тв/уп	21794	Продукты питания (folder)/Чай и кофе/Чай	0	
3587119	4870057005039	Чай той крупнолистовой индийский мягуп 100g	21794	Продукты питания (folder)/Чай и кофе/Чай	0	
3587121	4870057006968	Чай той черный крупнолистовой 200g тв/уп пиала в подарок	21794	Продукты питания (folder)/Чай и кофе/Чай	0	
3587120	4870057006883	Чай той черный крупнолистовой мягуп 200g	21794	Продукты питания (folder)/Чай и кофе/Чай	0	
3587122	4870057004704	Чай той черный листовой tetrapak 150g	21794	Продукты питания (folder)/Чай и кофе/Чай	0	
3587123	4870002442544	Чай той шашуы красный индийский 50g к/к	21794	Продукты питания (folder)/Чай и кофе/Чай	0	
541018	4607020901414	Чай тонкая талия фильтр-пакеты 1.5g №26	21794	Продукты питания (folder)/Чай и кофе/Чай	0	
3587124	4607178830901	Чай торгконтракт семена льна молотые 25x 5g кор	21794	Продукты питания (folder)/Чай и кофе/Чай	0	
3587137	4607037640030	Чай тот самый (синий слон) черный листовой, 50g	21794	Продукты питания (folder)/Чай и кофе/Чай	3923554	Тот самый чай (MOSKOVSKAYA CHAYNAYA FABRIKA)
2947294	4607037640085	Чай тот самый бергамот 100g	21794	Продукты питания (folder)/Чай и кофе/Чай	0	
2947295	4607037641099	Чай тот самый высокогорный 100g	21794	Продукты питания (folder)/Чай и кофе/Чай	0	
2947296	4607147700426	Чай тот самый высокогорный 100g#2	21794	Продукты питания (folder)/Чай и кофе/Чай	0	
2947303	4607037641051	Чай тот самый индийский 100g	21794	Продукты питания (folder)/Чай и кофе/Чай	3923554	Тот самый чай (MOSKOVSKAYA CHAYNAYA FABRIKA)
137543	4600441000124	Чай тот самый индийский 1с 100g	21794	Продукты питания (folder)/Чай и кофе/Чай	32049	Тот Самый
2947302	4607147700198	Чай тот самый индийский 250g#3	21794	Продукты питания (folder)/Чай и кофе/Чай	0	
2498950	4607037641419	Чай тот самый индийский 25п с/я	21794	Продукты питания (folder)/Чай и кофе/Чай	3923554	Тот самый чай (MOSKOVSKAYA CHAYNAYA FABRIKA)
2498952	4607037640283	Чай тот самый индийский 40п с/я	21794	Продукты питания (folder)/Чай и кофе/Чай	0	
3587125	4607147700334	Чай тот самый индийский байхов черн 100x 2g к/к	21794	Продукты питания (folder)/Чай и кофе/Чай	3923554	Тот самый чай (MOSKOVSKAYA CHAYNAYA FABRIKA)
137540	4607037640436	Чай тот самый индийский зеленый слон кр.лист 100g	21794	Продукты питания (folder)/Чай и кофе/Чай	32049	Тот Самый
3587126	4607037642676	Чай тот самый индийский классика черный листовой 25x 2g тв/уп	21794	Продукты питания (folder)/Чай и кофе/Чай	32049	Тот Самый
2947297	4607147700389	Чай тот самый индийский классич 100g	21794	Продукты питания (folder)/Чай и кофе/Чай	3923554	Тот самый чай (MOSKOVSKAYA CHAYNAYA FABRIKA)
2947305	4607037641013	Чай тот самый индийский классический (синий слон) 25x 2g к/к	21794	Продукты питания (folder)/Чай и кофе/Чай	0	
3587127	4607037641136	Чай тот самый индийский классический (синий слон) 25x 2g к/к #2	21794	Продукты питания (folder)/Чай и кофе/Чай	0	
32050	4607147700327	Чай тот самый индийский красный слон с/я вс 25x 2g	21794	Продукты питания (folder)/Чай и кофе/Чай	32049	Тот Самый
2498954	460026031134	Чай тот самый индийский м/лист кр/слон в/с 100g	21794	Продукты питания (folder)/Чай и кофе/Чай	0	
2498955	4600260311487	Чай тот самый индийский м/лист сер/слон 1/с 0.050	21794	Продукты питания (folder)/Чай и кофе/Чай	0	
2498956	4607037640054	Чай тот самый индийский м/лист сер/слон 1/с 0.050 #2	21794	Продукты питания (folder)/Чай и кофе/Чай	3923554	Тот самый чай (MOSKOVSKAYA CHAYNAYA FABRIKA)
2498958	460026000048	Чай тот самый индийский м/лист син/слон 1/с 0.050	21794	Продукты питания (folder)/Чай и кофе/Чай	0	
2947298	4607037641068	Чай тот самый индийский отборный 100g	21794	Продукты питания (folder)/Чай и кофе/Чай	0	
2947299	4607147700396	Чай тот самый индийский отборный 100g#2	21794	Продукты питания (folder)/Чай и кофе/Чай	3923554	Тот самый чай (MOSKOVSKAYA CHAYNAYA FABRIKA)
2498953	4607147700341	Чай тот самый индийский черн байх мелк/лист 20x 2g к/к	21794	Продукты питания (folder)/Чай и кофе/Чай	3923554	Тот самый чай (MOSKOVSKAYA CHAYNAYA FABRIKA)
3587128	4607147700051	Чай тот самый индийский черный байхов 50g к/к	21794	Продукты питания (folder)/Чай и кофе/Чай	3923554	Тот самый чай (MOSKOVSKAYA CHAYNAYA FABRIKA)
3587130	4607147700129	Чай тот самый индийский черный байховый 100g	21794	Продукты питания (folder)/Чай и кофе/Чай	0	
2947293	4607147700181	Чай тот самый индийский черный первый сорт мелколистовой 250g кор	21794	Продукты питания (folder)/Чай и кофе/Чай	0	
168936	4607037640016	Чай тот самый классика синий слон индийский черный 100g к/к	21794	Продукты питания (folder)/Чай и кофе/Чай	3923554	Тот самый чай (MOSKOVSKAYA CHAYNAYA FABRIKA)
5092026	4607037642713	Чай тот самый классика, черный, 100 пакетиков	21794	Продукты питания (folder)/Чай и кофе/Чай	32049	Тот Самый
2498951	4607147700358	Чай тот самый классический черн 25x 2g к/к	21794	Продукты питания (folder)/Чай и кофе/Чай	3923554	Тот самый чай (MOSKOVSKAYA CHAYNAYA FABRIKA)
2947304	4607147700068	Чай тот самый красный слон индийский черный байховый листовой 100g т/у	21794	Продукты питания (folder)/Чай и кофе/Чай	3923554	Тот самый чай (MOSKOVSKAYA CHAYNAYA FABRIKA)
3587131	4607037641167	Чай тот самый красный слон индийский черный листовой в/с 250g к/кор	21794	Продукты питания (folder)/Чай и кофе/Чай	3923554	Тот самый чай (MOSKOVSKAYA CHAYNAYA FABRIKA)
32012	4607037641006	Чай тот самый крупнолист 0.115	21794	Продукты питания (folder)/Чай и кофе/Чай	32011	ТОТ САМЫЙ ЧАЙ
2947306	4607147700372	Чай тот самый крупнолист 0.115 #2	21794	Продукты питания (folder)/Чай и кофе/Чай	0	
2947307	4607037641129	Чай тот самый крупнолист 200g	21794	Продукты питания (folder)/Чай и кофе/Чай	0	
2947308	4607147700174	Чай тот самый крупнолист 200g#2	21794	Продукты питания (folder)/Чай и кофе/Чай	0	
2947309	4607037640092	Чай тот самый лимон 100g	21794	Продукты питания (folder)/Чай и кофе/Чай	0	
2947310	4607147700402	Чай тот самый отборный 100g	21794	Продукты питания (folder)/Чай и кофе/Чай	0	
137544	4607037640061	Чай тот самый Премиум красный слон индийский черный 100g тв/уп	21794	Продукты питания (folder)/Чай и кофе/Чай	32049	Тот Самый
3587132	4607037642645	Чай тот самый Премиум красный слон индийский черный листовой 100g слон к/кор	21794	Продукты питания (folder)/Чай и кофе/Чай	32049	Тот Самый
3587133	4607037642614	Чай тот самый Премиум красный слон индийский черный листовой 25пак*2g к/кор	21794	Продукты питания (folder)/Чай и кофе/Чай	32049	Тот Самый
3587134	4607037642652	Чай тот самый серый слон индийский черный индийский листовой 100g тв/уп	21794	Продукты питания (folder)/Чай и кофе/Чай	32049	Тот Самый
3587135	4607037642683	Чай тот самый стандарт серый слон индийский листовой 25x2 к/к	21794	Продукты питания (folder)/Чай и кофе/Чай	32049	Тот Самый
137545	4607037640047	Чай тот самый стандарт серый слон черный мелкий 100g к/к	21794	Продукты питания (folder)/Чай и кофе/Чай	32049	Тот Самый
3587136	4607147700686	Чай тот самый цейлонский черный байхов лист 100g к/к	21794	Продукты питания (folder)/Чай и кофе/Чай	0	
2947301	4607037641174	Чай тот самый чай индийский черный мелколистовой 250g к/к	21794	Продукты питания (folder)/Чай и кофе/Чай	0	
2947300	4607037640443	Чай тот самый чай индийский черный мелколистовой мягуп 250g	21794	Продукты питания (folder)/Чай и кофе/Чай	3923554	Тот самый чай (MOSKOVSKAYA CHAYNAYA FABRIKA)
295530	4607147700044	Чай тот самый чай серый слон индийский черный байховый мелколистовой 100g т/у	21794	Продукты питания (folder)/Чай и кофе/Чай	3923554	Тот самый чай (MOSKOVSKAYA CHAYNAYA FABRIKA)
3587138	4690324013587	Чай травогор башкирский традиционный 20 пакетиков 30g	21794	Продукты питания (folder)/Чай и кофе/Чай	0	
3587139	4690324012474	Чай травогор башкирский традиционный 60g к/к	21794	Продукты питания (folder)/Чай и кофе/Чай	0	
3587140	4690324012436	Чай травогор вальс цветов 60g к/к	21794	Продукты питания (folder)/Чай и кофе/Чай	0	
3587141	4690324012467	Чай травогор дыхание гор 60g к/к	21794	Продукты питания (folder)/Чай и кофе/Чай	0	
3587142	4690324012443	Чай травогор княжеский чай 60g к/к	21794	Продукты питания (folder)/Чай и кофе/Чай	0	
3587143	4690324012504	Чай травогор копорский изысканный 60g к/к	21794	Продукты питания (folder)/Чай и кофе/Чай	0	
3587144	4690324012511	Чай травогор копорский элитный 60g к/к	21794	Продукты питания (folder)/Чай и кофе/Чай	0	
3587145	4690324012450	Чай травогор пряное яблоко травяной 60g к/к	21794	Продукты питания (folder)/Чай и кофе/Чай	0	
3587146	4690324012481	Чай травогор Русский традиционный 60g к/к	21794	Продукты питания (folder)/Чай и кофе/Чай	0	
3587147	4690324012498	Чай травогор татарский традиционный травяной 60g к/к	21794	Продукты питания (folder)/Чай и кофе/Чай	0	
3587149	4605426002742	Чай травы башкирии зеленый с можжевельником 20x 2g кор	21794	Продукты питания (folder)/Чай и кофе/Чай	3923638	травы BASHKIRII
3587150	4605426002759	Чай травы башкирии зеленый с мятой 20x 2g кор	21794	Продукты питания (folder)/Чай и кофе/Чай	0	
3587151	4605426002889	Чай травы башкирии каркаде с шиповником 20x 2g кор	21794	Продукты питания (folder)/Чай и кофе/Чай	0	
3587152	4605426002827	Чай травы башкирии с черникой черный 20x 2g тв/уп	21794	Продукты питания (folder)/Чай и кофе/Чай	0	
3587148	4605426008584	Чай травы башкирии №95 байховый зеленый 90g к/к	21794	Продукты питания (folder)/Чай и кофе/Чай	0	
5103666	4607005923837	Чай травы горного крыма с мелиссой, зеленый с добавками, 20 пирамидок	21794	Продукты питания (folder)/Чай и кофе/Чай	5103665	Травы Горного Крыма
5103667	4607005923547	Чай травы горного крыма черный с горным чабрецом, черный, 20 пирамидок	21794	Продукты питания (folder)/Чай и кофе/Чай	5103665	Травы Горного Крыма
