ID	UPCEAN	Name	CategoryID	CategoryName	BrandID	BrandName
3584325	4791051235232	Чай leoste tea черный листовой с натур/фрукт добавками жб 150g	21794	Продукты питания (folder)/Чай и кофе/Чай	0	
3584326	4791051233733	Чай leoste tea ялла ночь с фруктовыми добавками черный 100g кор	21794	Продукты питания (folder)/Чай и кофе/Чай	0	
3584327	4791051233610	Чай leoste tea ялла ночь черный с кусочками натур. фруктов и лепестками пакетированный 25x 2g тв/у	21794	Продукты питания (folder)/Чай и кофе/Чай	0	
3584329	4791051233108	Чай leoste с новым годом черный круглолистовой жб 200g	21794	Продукты питания (folder)/Чай и кофе/Чай	0	
3584330	4791051236215	Чай leoste цейлонский завтрак черный среднелистовой жб 150g	21794	Продукты питания (folder)/Чай и кофе/Чай	0	
2946322	6948244920019	Чай ling Long китайская серия зеленый 80g кор	21794	Продукты питания (folder)/Чай и кофе/Чай	0	
2946039	9711766200368	Чай Lipton 100 пак + банка жестяная	21794	Продукты питания (folder)/Чай и кофе/Чай	0	
2763092	8714100709184	Чай Lipton 100g 1x 24лист новая фасовка 90шт	21794	Продукты питания (folder)/Чай и кофе/Чай	17392	Lipton
168907	5900300550258	Чай Lipton 100п*2g	21794	Продукты питания (folder)/Чай и кофе/Чай	17392	Lipton
2498420	8901055006059	Чай Lipton 100п*2g 200g#3	21794	Продукты питания (folder)/Чай и кофе/Чай	17392	Lipton
1338843	460592200064	Чай Lipton 100п*2g конв 200g	21794	Продукты питания (folder)/Чай и кофе/Чай	17392	Lipton
2498421	460592200613	Чай Lipton 100п*жб 2g 200g	21794	Продукты питания (folder)/Чай и кофе/Чай	17392	Lipton
2498424	460592200088	Чай Lipton 10п*2g 0.020	21794	Продукты питания (folder)/Чай и кофе/Чай	17392	Lipton
2498425	460592200675	Чай Lipton 10п*2g 0.020 #2	21794	Продукты питания (folder)/Чай и кофе/Чай	17392	Lipton
2498427	4605922001904	Чай Lipton 10п*2g 0.020 #4	21794	Продукты питания (folder)/Чай и кофе/Чай	17392	Lipton
2498428	8901055006066	Чай Lipton 10п*2g 0.020 #5	21794	Продукты питания (folder)/Чай и кофе/Чай	17392	Lipton
136274	6221048770401	Чай Lipton 10пак*2g	21794	Продукты питания (folder)/Чай и кофе/Чай	17392	Lipton
2498429	4605922000679	Чай Lipton 112п*2g 0.224	21794	Продукты питания (folder)/Чай и кофе/Чай	17392	Lipton
2498430	4605922001898	Чай Lipton 125п*2g 250g	21794	Продукты питания (folder)/Чай и кофе/Чай	17392	Lipton
2498431	4823063108881	Чай Lipton 1л персик	21794	Продукты питания (folder)/Чай и кофе/Чай	17392	Lipton
2763097	8712566283033	Чай Lipton 20 пак пирамидка #3	21794	Продукты питания (folder)/Чай и кофе/Чай	0	
31882	8722700198154	Чай Lipton 20пак 1x12 пирамида Green gunpowder/ зеленый ганпаудер !!!	21794	Продукты питания (folder)/Чай и кофе/Чай	17392	Lipton
295409	8712566127955	Чай Lipton 20пак 1x12 пирамида Mandarin Orange Green tea/ зеленый с мандарином !!!	21794	Продукты питания (folder)/Чай и кофе/Чай	17392	Lipton
2498443	8714100703939	Чай Lipton 20пак 1x12 пирамида pina colada/с кусочками ананаса (192) !!!	21794	Продукты питания (folder)/Чай и кофе/Чай	17392	Lipton
136272	4605922000938	Чай Lipton 25п*2g 0.050	21794	Продукты питания (folder)/Чай и кофе/Чай	17392	Lipton
2498434	4605922000686	Чай Lipton 28п*2g 0.056	21794	Продукты питания (folder)/Чай и кофе/Чай	17392	Lipton
1338846	6281006701366	Чай Lipton 2g*100шт	21794	Продукты питания (folder)/Чай и кофе/Чай	17392	Lipton
1338847	6281006700154	Чай Lipton 2g*100шт конверты	21794	Продукты питания (folder)/Чай и кофе/Чай	17392	Lipton
1338845	460592200521	Чай Lipton 2x50 п*2g промо кружка 0.1	21794	Продукты питания (folder)/Чай и кофе/Чай	17392	Lipton
168909	4605922005216	Чай Lipton 2x50 п*2g промо кружка 0.1 #2	21794	Продукты питания (folder)/Чай и кофе/Чай	17392	Lipton
136308	8722700043836	Чай Lipton 50п*2уп+кашпо для цветов	21794	Продукты питания (folder)/Чай и кофе/Чай	17392	Lipton
168908	8722700108160	Чай Lipton 50пак*2+кружка 200g	21794	Продукты питания (folder)/Чай и кофе/Чай	17392	Lipton
3940820	8722700519768	Чай Lipton asian White tea 20x1.6g	214672	Продукты питания (folder)/Чай и кофе/Fruit Teas	17392	Lipton
194467	5410033802406	Чай Lipton blackcurrant 40g	21794	Продукты питания (folder)/Чай и кофе/Чай	17392	Lipton
31915	8722700080978	Чай Lipton Blue Fruit, черный с ежевикой, смородиной и черникой, 20 пирамидок по 2g, 20206121	21794	Продукты питания (folder)/Чай и кофе/Чай	17392	Lipton
1338872	8711200571673	Чай Lipton Blueberry muffin, черный со вкусом черничного кекса, 20 пирамидок по 2g, 65421722	21794	Продукты питания (folder)/Чай и кофе/Чай	17392	Lipton
3940821	8722700608554	Чай Lipton bomb.baz.чер.со спец.20x1.8g	21794	Продукты питания (folder)/Чай и кофе/Чай	17392	Lipton
1338881	8712566480388	Чай Lipton Cherry morello, черный с вишней, 20 пирамидок по 2g, 65417128	21794	Продукты питания (folder)/Чай и кофе/Чай	17392	Lipton
2271624	4605922009870	Чай Lipton citrus Garden, зеленый с ароматом цитрусовых, 25 пакетиков по 1.4g, ш/к 09870	21794	Продукты питания (folder)/Чай и кофе/Чай	17392	Lipton
31926	8722700429371	Чай Lipton citrus, черный с цедрой цитрусовых, 20 пирамидок по 2g, 20206122	21794	Продукты питания (folder)/Чай и кофе/Чай	17392	Lipton
1338850	8712566351350	Чай Lipton Classic darjeeling черн байх 20x1.9g к/к	21794	Продукты питания (folder)/Чай и кофе/Чай	17392	Lipton
3584331	8712566209828	Чай Lipton Classic зеленый байховый пакетированный 100 пакетов 130g тв/уп	21794	Продукты питания (folder)/Чай и кофе/Чай	17392	Lipton
2498423	4605922016342	Чай Lipton Classic зеленый байховый пакетированный 100x 170g тв/уп	21794	Продукты питания (folder)/Чай и кофе/Чай	17392	Lipton
3584332	8714100717752	Чай Lipton classik+moroccan зеленый 82.5g тв/уп	21794	Продукты питания (folder)/Чай и кофе/Чай	17392	Lipton
2946537	8712566315932	Чай Lipton clear Green Classic зеленый 100x1.3g	21794	Продукты питания (folder)/Чай и кофе/Чай	17392	Lipton
31897	8722700260042	Чай Lipton clear Green зелен с мятой 25x1.3g 32.5g	21794	Продукты питания (folder)/Чай и кофе/Чай	17392	Lipton
31880	8722700260035	Чай Lipton clear Green зеленый байховый пакетированный 25x1.3g	21794	Продукты питания (folder)/Чай и кофе/Чай	17392	Lipton
194471	3228881038951	Чай Lipton darjeeling himalaya x20 sachets 40g	21794	Продукты питания (folder)/Чай и кофе/Чай	17392	Lipton
136282	5900300586967	Чай Lipton darjeeling высокогорн.25x 2g 50g	21794	Продукты питания (folder)/Чай и кофе/Чай	17392	Lipton
31886	8722700198178	Чай Lipton delicate mint мята/лимон.трава 20пирам*2g	21794	Продукты питания (folder)/Чай и кофе/Чай	17392	Lipton
2498462	8722700849612	Чай Lipton discovery cuba resort,  черный, 25 пакетиков по 2g, ш/к 49612	21794	Продукты питания (folder)/Чай и кофе/Чай	17392	Lipton
2947606	4605922330509	Чай Lipton discovery English breakfast черный, 25 пакетиков по 2g, ш/к 30509	21794	Продукты питания (folder)/Чай и кофе/Чай	17392	Lipton
2947605	4605922330257	Чай Lipton discovery English breakfast, черный, 100 пакетиков по 2g, ш/к 30257	21794	Продукты питания (folder)/Чай и кофе/Чай	17392	Lipton
2946044	8722700849575	Чай Lipton discovery Green oriental temple, зеленый,  100 пакетиков по 2g, ш/к 49575	21794	Продукты питания (folder)/Чай и кофе/Чай	17392	Lipton
2498459	8722700849582	Чай Lipton discovery Green oriental temple, зеленый,  25 пакетиков по 2g, ш/к 49582	21794	Продукты питания (folder)/Чай и кофе/Чай	17392	Lipton
2946054	8722700849599	Чай Lipton discovery heart of ceylon черный, 100 пакетиков по 2g, ш/к 49599	21794	Продукты питания (folder)/Чай и кофе/Чай	17392	Lipton
2498461	8722700849605	Чай Lipton discovery heart of ceylon, черный, 25 пакетиков по 2g, ш/к 49605	21794	Продукты питания (folder)/Чай и кофе/Чай	17392	Lipton
2947607	4605922330639	Чай Lipton discovery Jasmin silk road Green 25x1.4g	21794	Продукты питания (folder)/Чай и кофе/Чай	17392	Lipton
2947608	4605922330325	Чай Lipton discovery scandinavian Wild berries ,черн. с аром. лесн. ягод,25п.*2g,ш/к30325 	21794	Продукты питания (folder)/Чай и кофе/Чай	17392	Lipton
2498460	8722700849544	Чай Lipton discovery victorian earl grey ,черный с бергамотом,25 пакетиков по 2g,ш/к 49544	21794	Продукты питания (folder)/Чай и кофе/Чай	17392	Lipton
2763072	8722700849537	Чай Lipton discovery victorian earl grey черный с бергамотом,100 пакетиков по 2g,ш/к49537	21794	Продукты питания (folder)/Чай и кофе/Чай	17392	Lipton
2900906	8714100711071	Чай Lipton discovery, набор, 54 пакетика, ассорти 88g, ш/к11071	21794	Продукты питания (folder)/Чай и кофе/Чай	17392	Lipton
3940822	8690637848896	Чай Lipton Dog.kar.чер.ар.лист.с бер 500g	21794	Продукты питания (folder)/Чай и кофе/Чай	17392	Lipton
136319	3228881018403	Чай Lipton earl gray с бергамотом 25пак*2g 50g	21794	Продукты питания (folder)/Чай и кофе/Чай	17392	Lipton
31911	4605922003885	Чай Lipton earl gray с жасмином 25пак*1.5g 37.5g	21794	Продукты питания (folder)/Чай и кофе/Чай	17392	Lipton
31930	8722700074854	Чай Lipton earl gray с цитрусовыми лист 90g	21794	Продукты питания (folder)/Чай и кофе/Чай	17392	Lipton
31929	4605922003854	Чай Lipton earl gray с цитрусом 25пак*1.5g 37.5g	21794	Продукты питания (folder)/Чай и кофе/Чай	17392	Lipton
3940823	8722700127604	Чай Lipton earl grey 25x1.5g	21794	Продукты питания (folder)/Чай и кофе/Чай	17392	Lipton
2498437	460592200385	Чай Lipton earl grey 25п*1.5g 0.0375	21794	Продукты питания (folder)/Чай и кофе/Чай	17392	Lipton
1338851	6281006703872	Чай Lipton earl grey 2g*25шт	21794	Продукты питания (folder)/Чай и кофе/Чай	17392	Lipton
194472	5410033801553	Чай Lipton earl grey 40g	21794	Продукты питания (folder)/Чай и кофе/Чай	17392	Lipton
295411	8712566283002	Чай Lipton earl grey империал черный байховый с лепестками цветов 20пакетиков-пирамидок 36g	21794	Продукты питания (folder)/Чай и кофе/Чай	17392	Lipton
3584333	460592200040	Чай Lipton earl grey черн 25 пак к/к	21794	Продукты питания (folder)/Чай и кофе/Чай	17392	Lipton
1338896	4605922000440	Чай Lipton earl grey черный с бергамотом, 25 пакетиков	21794	Продукты питания (folder)/Чай и кофе/Чай	17392	Lipton
2454007	4605922000501	Чай Lipton earl grey, черный, 100 пакетиков с ярлычками по 2g, 21072022	21794	Продукты питания (folder)/Чай и кофе/Чай	17392	Lipton
194491	5410033801508	Чай Lipton eng. breakfast x20	21794	Продукты питания (folder)/Чай и кофе/Чай	17392	Lipton
3940824	8712566845033	Чай Lipton English break.чер.пир 20x1.8g	21794	Продукты питания (folder)/Чай и кофе/Чай	17392	Lipton
3584335	4605922335207	Чай Lipton English breakfast черный 100п+25п тв/уп	21794	Продукты питания (folder)/Чай и кофе/Чай	17392	Lipton
3584336	8714100717738	Чай Lipton English breakfast черный 100п+25п тв/уп #2	21794	Продукты питания (folder)/Чай и кофе/Чай	17392	Lipton
194473	3228881047458	Чай Lipton finest earl grey x20 sachets 40g	21794	Продукты питания (folder)/Чай и кофе/Чай	17392	Lipton
31903	8722700080985	Чай Lipton forest Fruit, черный с лесными ягодами, вишней и клубникой, 20 пирамидок по 2g	21794	Продукты питания (folder)/Чай и кофе/Чай	17392	Lipton
1710318	8711200576708	Чай Lipton gr.gun.зелен с ар.осм/груш.100g	21794	Продукты питания (folder)/Чай и кофе/Чай	17392	Lipton
3940825	8714100703625	Чай Lipton gr.gunp.20пир+asian whit.20пир	21794	Продукты питания (folder)/Чай и кофе/Чай	17392	Lipton
1338854	6281006703841	Чай Lipton Green 2g*100шт	21794	Продукты питания (folder)/Чай и кофе/Чай	17392	Lipton
217386	6281006702349	Чай Lipton Green 34g 20 bags	21794	Продукты питания (folder)/Чай и кофе/Чай	17392	Lipton
3940826	4605922553861	Чай Lipton Green asian Spice 25x1.3g	21794	Продукты питания (folder)/Чай и кофе/Чай	17392	Lipton
295415	8712566127931	Чай Lipton Green Lemon melissa, зеленый, 20 пирамидок по 2g, 65414956	21794	Продукты питания (folder)/Чай и кофе/Чай	17392	Lipton
1338856	6281006850033	Чай Lipton Green Lemon tb 1.5g*25шт	21794	Продукты питания (folder)/Чай и кофе/Чай	17392	Lipton
31898	4605922003946	Чай Lipton Green orient, зеленый, 25 пакетиков с ярлычками по 1.3g	21794	Продукты питания (folder)/Чай и кофе/Чай	17392	Lipton
1338857	6281006703858	Чай Lipton Green tb 2g*25шт	21794	Продукты питания (folder)/Чай и кофе/Чай	17392	Lipton
2271619	4605922009863	Чай Lipton Green tea Classic зеленый, 25 пакетиков по 1.7g, ш/к 09863	21794	Продукты питания (folder)/Чай и кофе/Чай	17392	Lipton
217387	6281006702363	Чай Lipton Green w/ mint 30g 20 bags (can)	21794	Продукты питания (folder)/Чай и кофе/Чай	17392	Lipton
3584337	4605922013280	Чай Lipton Green пакетированный 25x 3g подарок шарф	21794	Продукты питания (folder)/Чай и кофе/Чай	17392	Lipton
2946053	8714100712474	Чай Lipton heart of ceylon черный листовой 85g тв/уп	21794	Продукты питания (folder)/Чай и кофе/Чай	17392	Lipton
3584338	4600494516023	Чай Lipton Ice, белый, негаз. 600ml, пл/б	21794	Продукты питания (folder)/Чай и кофе/Чай	17392	Lipton
17393	4600494514746	Чай Lipton Ice, гранат, негаз 600ml, пл/б	17371	Продукты питания (folder)/Напитки безалкогольные/Напитки	17392	Lipton
859813	4600494519093	Чай Lipton Ice, гранат, негаз. 1.25л, пл/б	186980	Продукты питания (folder)/Напитки безалкогольные/Холодный чай	17392	Lipton
2810425	8714100920589	Чай Lipton indian Spice с корицей и имбирем черный 20x1.8g тв/уп	21794	Продукты питания (folder)/Чай и кофе/Чай	17392	Lipton
2763089	4605922009603	Чай Lipton jas.fl.зелен байх.лист.жасм 100g	21794	Продукты питания (folder)/Чай и кофе/Чай	17392	Lipton
2946043	4605922016335	Чай Lipton jasmine flowers, зеленый с цветами жасмина, 100 пакетиков по 1.4g, ш/к 16335	21794	Продукты питания (folder)/Чай и кофе/Чай	17392	Lipton
31896	4605922003939	Чай Lipton jasmine зеленый пакетированный 25x 2g	21794	Продукты питания (folder)/Чай и кофе/Чай	17392	Lipton
194492	5410033802307	Чай Lipton Lemon (20) 40g	21794	Продукты питания (folder)/Чай и кофе/Чай	17392	Lipton
2271620	4605922012610	Чай Lipton limited edition листовой 3 вида 150g тв/уп	21794	Продукты питания (folder)/Чай и кофе/Чай	17392	Lipton
3584339	4605922012382	Чай Lipton Magic Aroma 100пак тв/у	21794	Продукты питания (folder)/Чай и кофе/Чай	17392	Lipton
1710319	8711200580019	Чай Lipton Mild ceylon чер.байх.лист 100g	21794	Продукты питания (folder)/Чай и кофе/Чай	17392	Lipton
31908	8722700199540	Чай Lipton Mild ceylon черн 75g к/к	21794	Продукты питания (folder)/Чай и кофе/Чай	17392	Lipton
31909	8722700198161	Чай Lipton Mild ceylon, черный, 20 пирамидок по 2g, 20204431	21794	Продукты питания (folder)/Чай и кофе/Чай	17392	Lipton
2271621	4605922010395	Чай Lipton moroccan mint, зеленый ароматизированный, 25 пакетиков по 1.4g, ш/к 10395	21794	Продукты питания (folder)/Чай и кофе/Чай	17392	Lipton
136289	8722700475705	Чай Lipton Orange jaipur черный листовой пакетированный пирамидки 20x1.9g	21794	Продукты питания (folder)/Чай и кофе/Чай	17392	Lipton
2810416	8714100923467	Чай Lipton oriental milky oolong зеленый 85g тв/уп	21794	Продукты питания (folder)/Чай и кофе/Чай	17392	Lipton
2810418	8714100715130	Чай Lipton oriental sencha ароматизированный 40g тв/уп	21794	Продукты питания (folder)/Чай и кофе/Чай	17392	Lipton
2946045	8714100712597	Чай Lipton oriental temple зеленый листовой 85g тв/уп	21794	Продукты питания (folder)/Чай и кофе/Чай	17392	Lipton
31907	8722700429753	Чай Lipton Passion Raspberry, черный с малиной и маракуйей, 20 пирамидок по 2g, 65415134	21794	Продукты питания (folder)/Чай и кофе/Чай	17392	Lipton
31912	8722700429760	Чай Lipton Peach mango, черный с персиком и манго, 20 пирамидок по 2g, 20244054	21794	Продукты питания (folder)/Чай и кофе/Чай	17392	Lipton
2498432	4605922011149	Чай Lipton pear chocolate, черный с грушей, шоколадом и мороженым, 20 пирамидок по 1.6g, 21187947	21794	Продукты питания (folder)/Чай и кофе/Чай	17392	Lipton
295412	8712566128013	Чай Lipton pomegranate White tea белый с корками граната 20x1.5g	21794	Продукты питания (folder)/Чай и кофе/Чай	17392	Lipton
1338864	8712566078325	Чай Lipton Rich + strawberry пирамидки 20пак+20пак	21794	Продукты питания (folder)/Чай и кофе/Чай	17392	Lipton
31913	8722700198185	Чай Lipton Rich rosehip травяной с шиповником пакетированный 20x1.9g	21794	Продукты питания (folder)/Чай и кофе/Чай	17392	Lipton
31914	4605922003908	Чай Lipton Royal ceylon черный пакетированный 25x 2g	21794	Продукты питания (folder)/Чай и кофе/Чай	17392	Lipton
3940827	8722700608578	Чай Lipton russian earl grey 20пакетиков	21794	Продукты питания (folder)/Чай и кофе/Чай	17392	Lipton
136292	8722700475811	Чай Lipton russian earl grey с цедрой черн 20x1.8g к/r	21794	Продукты питания (folder)/Чай и кофе/Чай	17392	Lipton
3584340	8714100921258	Чай Lipton sir Thomas delicate gunpowder зеленый листовой 100g тв/уп	21794	Продукты питания (folder)/Чай и кофе/Чай	17392	Lipton
136299	3228881006936	Чай Lipton sir Thomas earl gray жб 200g	21794	Продукты питания (folder)/Чай и кофе/Чай	17392	Lipton
194483	5410033801591	Чай Lipton sir Thomas earl grey 40g	21794	Продукты питания (folder)/Чай и кофе/Чай	17392	Lipton
194484	5410033801546	Чай Lipton sir Thomas eng b/fast 40g	21794	Продукты питания (folder)/Чай и кофе/Чай	17392	Lipton
2946051	8714100921234	Чай Lipton sir Thomas Fine ceylon черный 2x 25g тв/уп	21794	Продукты питания (folder)/Чай и кофе/Чай	17392	Lipton
2946050	8714100921241	Чай Lipton sir Thomas kenyan estate черный 2x 25g тв/уп	21794	Продукты питания (folder)/Чай и кофе/Чай	17392	Lipton
136298	3228881006851	Чай Lipton sir Thomas корол/ цейл жб 200g	21794	Продукты питания (folder)/Чай и кофе/Чай	17392	Lipton
136296	3228881001641	Чай Lipton sir Thomas кристмас жб 200g	21794	Продукты питания (folder)/Чай и кофе/Чай	17392	Lipton
136297	3228881007353	Чай Lipton sir Thomas оранж дж.жб 200g	21794	Продукты питания (folder)/Чай и кофе/Чай	17392	Lipton
136291	3228881007506	Чай Lipton sir Thomas рус earl grey жб 200g	21794	Продукты питания (folder)/Чай и кофе/Чай	17392	Lipton
2946052	8714100921272	Чай Lipton sir Thomas цейлон лист.жб 100g	21794	Продукты питания (folder)/Чай и кофе/Чай	17392	Lipton
2946049	8714100921265	Чай Lipton sir Thomas черный листовой earl grey finesse 100g	21794	Продукты питания (folder)/Чай и кофе/Чай	17392	Lipton
2498463	8722700849568	Чай Lipton spicy marrakesh черный байховый ароматизированный 50g тв/у	21794	Продукты питания (folder)/Чай и кофе/Чай	17392	Lipton
2946048	8714100712610	Чай Lipton spicy marrakesh1 черный листовой 85g тв/у	21794	Продукты питания (folder)/Чай и кофе/Чай	17392	Lipton
136300	8722700429807	Чай Lipton sri lanka treasure черный пакетированный 20x1.8g	21794	Продукты питания (folder)/Чай и кофе/Чай	17392	Lipton
1338882	8711200567584	Чай Lipton strawberry cake, зеленый фруктовый, 20 пирамидок по 2g, 65421734	21794	Продукты питания (folder)/Чай и кофе/Чай	17392	Lipton
1338880	8712566480401	Чай Lipton strawberry mint, черный с клубникой и мятой, 20 пирамидок по 2g, 65417129	21794	Продукты питания (folder)/Чай и кофе/Чай	17392	Lipton
2498438	8722700849551	Чай Lipton sultan delight зеленый байховый ароматизированный 25x1.8g	21794	Продукты питания (folder)/Чай и кофе/Чай	17392	Lipton
194487	5410033802352	Чай Lipton Sun Mandarin x20 bags-40g	21794	Продукты питания (folder)/Чай и кофе/Чай	17392	Lipton
194489	5410033854535	Чай Lipton Sun Peach x20 teabags-34g	21794	Продукты питания (folder)/Чай и кофе/Чай	17392	Lipton
2498444	4791033103030	Чай Lipton Sun tea earl grey 10п*1.5g 0.015	21794	Продукты питания (folder)/Чай и кофе/Чай	17392	Lipton
194488	3228881040268	Чай Lipton Sun tea Orange jaipur x20 bags 40g	21794	Продукты питания (folder)/Чай и кофе/Чай	17392	Lipton
194490	3228881075406	Чай Lipton Sun tea Tropical Fruit x20 bags 32g	21794	Продукты питания (folder)/Чай и кофе/Чай	17392	Lipton
