ID	UPCEAN	Name	CategoryID	CategoryName	BrandID	BrandName
5388292	4690207269766	Картридж струйный cactus cs-pgi-1400xl bk черный для canon mb2050/mb2350/mb2040/mb2340 36ml cs-pgi1400xlbk	230307	Техника (folder)/Электротехника (folder)/Цифровая техника (folder)/Расходные материалы для цифровой техники (folder)/Картридж для принтера	2729362	Cactus
5390906	4690207155571	Картридж струйный cactus cs-pgi-35bk черный для canon pixma ip100 9ml cs-pgi35	5192970	картриджи и тонеры совместимые	2729362	Cactus
3336976	4690207106283	Картридж струйный cactus cs-pgi-425pgbk черный для canon pixma ip4840, mg5140/5240/6140 (16ml) cs-pgi425bk	230307	Техника (folder)/Электротехника (folder)/Цифровая техника (folder)/Расходные материалы для цифровой техники (folder)/Картридж для принтера	2729362	Cactus
3336977	4690207215961	Картридж струйный cactus cs-pgi-450xl pgbk черный для canon mg6340/5440/ip7240 21.4ml cs-pgi450	230307	Техника (folder)/Электротехника (folder)/Цифровая техника (folder)/Расходные материалы для цифровой техники (folder)/Картридж для принтера	2729362	Cactus
5390907	4690207272445	Картридж струйный cactus cs-pgi-470xl pgbk черный для canon pixma ip7240/mg6340/mg5440 cs-pgi470xlbk	5192970	картриджи и тонеры совместимые	2729362	Cactus
3336978	4690207077729	Картридж струйный cactus cs-pgi-520bk черный для canon pixma mp540/ mp550/ mp620/ mp630 (16ml) cs-pgi520bk	230307	Техника (folder)/Электротехника (folder)/Цифровая техника (folder)/Расходные материалы для цифровой техники (folder)/Картридж для принтера	2729362	Cactus
723079	4960999869384	Картридж струйный canon (bc-20) bjc-2000/2100/4000/5500, черный ориг	230307	Техника (folder)/Электротехника (folder)/Цифровая техника (folder)/Расходные материалы для цифровой техники (folder)/Картридж для принтера	177631	CANON
723080	4960999867304	Картридж струйный canon (bc-21e) bjc-2000/4000/4550/5100 и другие, цветной, ориг ресурс 2000стр	230307	Техника (folder)/Электротехника (folder)/Цифровая техника (folder)/Расходные материалы для цифровой техники (folder)/Картридж для принтера	177631	CANON
240882	4960999869360	Картридж струйный canon (bci-21bk) bjc-2000/2100/4000/5000, черный ориг	1	Неклассифицированные/default	177631	CANON
240884	4960999869353	Картридж струйный canon (bci-21c) bjc-2000/2100/4000/5000, цветной, ориг	1	Неклассифицированные/default	177631	CANON
470054	4960999864761	Картридж струйный canon (bci-6y) pixma ip3000/4000/8500/mp750/760, желтый ориг	230307	Техника (folder)/Электротехника (folder)/Цифровая техника (folder)/Расходные материалы для цифровой техники (folder)/Картридж для принтера	177631	CANON
1671003	4960999782386	Картридж струйный canon (cl-441) pixma mg2140/pixma mg3140/pixma mg4140, цветной,ориг, рес. 180 стр.	230307	Техника (folder)/Электротехника (folder)/Цифровая техника (folder)/Расходные материалы для цифровой техники (folder)/Картридж для принтера	177631	CANON
470058	4960999641539	Картридж струйный canon (cl-511) pixma mp240/mp260/mp480 цветной, ориг., ресурс 244 стр.	230307	Техника (folder)/Электротехника (folder)/Цифровая техника (folder)/Расходные материалы для цифровой техники (folder)/Картридж для принтера	177631	CANON
3336953	4690207106214	Картридж струйный canon (cli-426c) pixma mg5140/mg5240/mg6140/mg8140 голубой cactus совместимый	230307	Техника (folder)/Электротехника (folder)/Цифровая техника (folder)/Расходные материалы для цифровой техники (folder)/Картридж для принтера	2729362	Cactus
3336954	4690207170420	Картридж струйный canon (cli-426c/m/y) pixma mg5140/5240, многоцветный,комплект, cactus совместимый	230307	Техника (folder)/Электротехника (folder)/Цифровая техника (folder)/Расходные материалы для цифровой техники (folder)/Картридж для принтера	2729362	Cactus
3336955	4690207152457	Картридж струйный canon (cli-426gy) pixma mg6140/6240/8140/8240 серый cactus совместимый	230307	Техника (folder)/Электротехника (folder)/Цифровая техника (folder)/Расходные материалы для цифровой техники (folder)/Картридж для принтера	2729362	Cactus
722876	4960999670157	Картридж струйный canon (cli-426gy) pixma mg6140/6240/8140/8240 серый ориг. 1395стр	230307	Техника (folder)/Электротехника (folder)/Цифровая техника (folder)/Расходные материалы для цифровой техники (folder)/Картридж для принтера	177631	CANON
3336956	4690207106221	Картридж струйный canon (cli-426m) pixma mg5140/5240/6140/8140, пурпур,447стр, cactus совместимый	230307	Техника (folder)/Электротехника (folder)/Цифровая техника (folder)/Расходные материалы для цифровой техники (folder)/Картридж для принтера	2729362	Cactus
3336957	4690207106238	Картридж струйный canon (cli-426y) pixma mg5140/mg5240/mg6140/mg8140 желтый cactus совместимый	230307	Техника (folder)/Электротехника (folder)/Цифровая техника (folder)/Расходные материалы для цифровой техники (folder)/Картридж для принтера	2729362	Cactus
3336962	4690207077767	Картридж струйный canon (cli-521bk) pixma mp540/630/980, черный фото cactus совместимый	230307	Техника (folder)/Электротехника (folder)/Цифровая техника (folder)/Расходные материалы для цифровой техники (folder)/Картридж для принтера	2729362	Cactus
3336963	4690207158343	Картридж струйный canon (cli-521c/m/y) pixma mp540/630/980 комплект 3цв cactus совместимый	230307	Техника (folder)/Электротехника (folder)/Цифровая техника (folder)/Расходные материалы для цифровой техники (folder)/Картридж для принтера	2729362	Cactus
3336964	4690207077743	Картридж струйный canon (cli-521m) pixma mp540/630/980, пурпурный cactus совместимый	230307	Техника (folder)/Электротехника (folder)/Цифровая техника (folder)/Расходные материалы для цифровой техники (folder)/Картридж для принтера	2729362	Cactus
3336965	4690207077736	Картридж струйный canon (cli-521y) pixma mp540/630/980, желтый cactus совместимый	230307	Техника (folder)/Электротехника (folder)/Цифровая техника (folder)/Расходные материалы для цифровой техники (folder)/Картридж для принтера	2729362	Cactus
3336966	4690207077699	Картридж струйный canon (cli-8bk) pixma ip4200/4300/4500/5200/5300, черный cactus совместимый	230307	Техника (folder)/Электротехника (folder)/Цифровая техника (folder)/Расходные материалы для цифровой техники (folder)/Картридж для принтера	2729362	Cactus
3336967	4690207170437	Картридж струйный canon (cli-8c/m/y) pixma ip4200/4300/4500/5200 комплект 3цв cactus совместимый	230307	Техника (folder)/Электротехника (folder)/Цифровая техника (folder)/Расходные материалы для цифровой техники (folder)/Картридж для принтера	2729362	Cactus
3336968	4690207077668	Картридж струйный canon (cli-8m) pixma ip4200/4300/5200/5300, пурпурный cactus совместимый	230307	Техника (folder)/Электротехника (folder)/Цифровая техника (folder)/Расходные материалы для цифровой техники (folder)/Картридж для принтера	2729362	Cactus
230529	4960999272894	Картридж струйный canon (cli-8pcs) ip6600d/6700/mp970/ pixma9000 голубой ориг. 450стр	230307	Техника (folder)/Электротехника (folder)/Цифровая техника (folder)/Расходные материалы для цифровой техники (folder)/Картридж для принтера	177631	CANON
3336969	4690207077682	Картридж струйный canon (cli-8с) pixma ip4200/4300/4500/5200/5300, голубой cactus совместимый	230307	Техника (folder)/Электротехника (folder)/Цифровая техника (folder)/Расходные материалы для цифровой техники (folder)/Картридж для принтера	2729362	Cactus
2729442	4960999299778	Картридж струйный canon (pfi-102bk) ipf500/510/f600/605/610/650/655/700/710/720 черный ориг. 130ml	230307	Техника (folder)/Электротехника (folder)/Цифровая техника (folder)/Расходные материалы для цифровой техники (folder)/Картридж для принтера	177631	CANON
2729443	4960999299785	Картридж струйный canon (pfi-102c) ipf500/510/f600/605/610/650/655/700/710/720 голубой ориг. 130ml	230307	Техника (folder)/Электротехника (folder)/Цифровая техника (folder)/Расходные материалы для цифровой техники (folder)/Картридж для принтера	177631	CANON
2729444	4960999299792	Картридж струйный canon (pfi-102m) ipf500/510/f600/605/610/650/655/700/710/720 пурпурный ориг. 130m	230307	Техника (folder)/Электротехника (folder)/Цифровая техника (folder)/Расходные материалы для цифровой техники (folder)/Картридж для принтера	177631	CANON
2729446	4960999299808	Картридж струйный canon (pfi-102y) ipf500/510/f600/605/610/650/655/700/710/720 желтый ориг. 130ml	230307	Техника (folder)/Электротехника (folder)/Цифровая техника (folder)/Расходные материалы для цифровой техники (folder)/Картридж для принтера	177631	CANON
2729445	4960999299761	Картридж струйный canon (pfi-102мbk) ipf500/510/f600/605/610/650/655/700 матовый ченый ориг. 130ml	230307	Техника (folder)/Электротехника (folder)/Цифровая техника (folder)/Расходные материалы для цифровой техники (folder)/Картридж для принтера	177631	CANON
2729447	4960999636528	Картридж струйный canon (pfi-104m) ipf650/655/750/755/760/765 пурпурный ориг. 130ml	230307	Техника (folder)/Электротехника (folder)/Цифровая техника (folder)/Расходные материалы для цифровой техники (folder)/Картридж для принтера	177631	CANON
2729461	4960999910956	Картридж струйный canon (pfi-107c) ipf680/685/780/785 голубой ориг.130ml	230307	Техника (folder)/Электротехника (folder)/Цифровая техника (folder)/Расходные материалы для цифровой техники (folder)/Картридж для принтера	177631	CANON
3336970	4960999910963	Картридж струйный canon (pfi-107m) ipf680/685/780/785 пурпурный ориг. 130ml	230307	Техника (folder)/Электротехника (folder)/Цифровая техника (folder)/Расходные материалы для цифровой техники (folder)/Картридж для принтера	177631	CANON
2729462	4960999910932	Картридж струйный canon (pfi-107mbk) pf680/685/780/785 матовый черный ориг. 130ml	230307	Техника (folder)/Электротехника (folder)/Цифровая техника (folder)/Расходные материалы для цифровой техники (folder)/Картридж для принтера	177631	CANON
2729463	4960999910970	Картридж струйный canon (pfi-107y) ipf680/685/780/785 желтый ориг. 130ml	230307	Техника (folder)/Электротехника (folder)/Цифровая техника (folder)/Расходные материалы для цифровой техники (folder)/Картридж для принтера	177631	CANON
3336972	4690207129183	Картридж струйный canon (pg-37) pixma mp210/220/310/300/140/ip1800 и др черный cactus совместимый	230307	Техника (folder)/Электротехника (folder)/Цифровая техника (folder)/Расходные материалы для цифровой техники (folder)/Картридж для принтера	2729362	Cactus
3336973	4690207077637	Картридж струйный canon (pg-40) pixma ip1200/1600/mp150/160/170 и др, черный cactus совместимый	230307	Техника (folder)/Электротехника (folder)/Цифровая техника (folder)/Расходные материалы для цифровой техники (folder)/Картридж для принтера	2729362	Cactus
1671004	4960999782362	Картридж струйный canon (pg-440) pixma mg2140/pixma mg3140/pixma mg4140, черный, ориг, рес. 180 стр.	230307	Техника (folder)/Электротехника (folder)/Цифровая техника (folder)/Расходные материалы для цифровой техники (folder)/Картридж для принтера	177631	CANON
2440590	4960999974460	Картридж струйный canon (pg-445) pixma mg2440/pixma mg2540, черный, ориг, рес.180 стр.	230307	Техника (folder)/Электротехника (folder)/Цифровая техника (folder)/Расходные материалы для цифровой техники (folder)/Картридж для принтера	177631	CANON
2743306	8714574605555	Картридж струйный canon (pg-445/cl-446) pixma mg2440/mg2540 комплект ориг. 2цв 180стр	230307	Техника (folder)/Электротехника (folder)/Цифровая техника (folder)/Расходные материалы для цифровой техники (folder)/Картридж для принтера	177631	CANON
3336974	4690207089609	Картридж струйный canon (pg-50) pixma mp150/170/450/160/460/jx200/500 черный cactus совместимый	230307	Техника (folder)/Электротехника (folder)/Цифровая техника (folder)/Расходные материалы для цифровой техники (folder)/Картридж для принтера	2729362	Cactus
240886	4960999273402	Картридж струйный canon (pg-50) pixma mp150/170/450/160/460/jx200/500 черный ориг. увелич. 520стр	1	Неклассифицированные/default	177631	CANON
1221555	4960999641515	Картридж струйный canon (pg-510) pixma mp240/mp260/mp480 черный, ориг, ресурс 220 стр.	1	Неклассифицированные/default	177631	CANON
3336979	4690207077651	Картридж струйный canon (pgi-5bk) pixma ip4200/4300/4500/5200/5300, фото cactus совместимый	230307	Техника (folder)/Электротехника (folder)/Цифровая техника (folder)/Расходные материалы для цифровой техники (folder)/Картридж для принтера	2729362	Cactus
2762474	4960999357256	Картридж струйный canon (pgi-9pcs) pixma Pro9500 светло-голубой ориг. 1150стр	230307	Техника (folder)/Электротехника (folder)/Цифровая техника (folder)/Расходные материалы для цифровой техники (folder)/Картридж для принтера	177631	CANON
470073	8715946361062	Картридж струйный epson (c13t00740210) stylus photo 790/870/915/1270 и др, черный комплект 2шт ориг	230307	Техника (folder)/Электротехника (folder)/Цифровая техника (folder)/Расходные материалы для цифровой техники (folder)/Картридж для принтера	205832	Epson
1670857	8715946359809	Картридж струйный epson (c13t00840110) stylus photo 790/890/915 и др, цветной, ориг	230307	Техника (folder)/Электротехника (folder)/Цифровая техника (folder)/Расходные материалы для цифровой техники (folder)/Картридж для принтера	205832	Epson
722884	8715946361109	Картридж струйный epson (c13t00940210) stylus photo 900/1270/1290 цветной, ориг комплект 2шт	230307	Техника (folder)/Электротехника (folder)/Цифровая техника (folder)/Расходные материалы для цифровой техники (folder)/Картридж для принтера	205832	Epson
2549003	8715946355146	Картридж струйный epson (c13t02640110) stylus photo 810/830/925/935 и др, черный ориг	230307	Техника (folder)/Электротехника (folder)/Цифровая техника (folder)/Расходные материалы для цифровой техники (folder)/Картридж для принтера	205832	Epson
364828	8715946355207	Картридж струйный epson (c13t02740110) stylus photo 810/830/925/935 и др, цветной, ориг	230307	Техника (folder)/Электротехника (folder)/Цифровая техника (folder)/Расходные материалы для цифровой техники (folder)/Картридж для принтера	205832	Epson
1670863	8715946355504	Картридж струйный epson (c13t03414010) stylus photo 2100, черный фото, ориг	230307	Техника (folder)/Электротехника (folder)/Цифровая техника (folder)/Расходные материалы для цифровой техники (folder)/Картридж для принтера	205832	Epson
2576588	8715946355528	Картридж струйный epson (c13t03424010) stylus photo 2100 голубой, ориг	1	Неклассифицированные/default	205832	Epson
2576589	8715946355542	Картридж струйный epson (c13t03434010) stylus photo 2100, пурпурный, ориг	1	Неклассифицированные/default	205832	Epson
2549129	8715946355566	Картридж струйный epson (c13t03444010) stylus photo 2100, желтый, ориг	1	Неклассифицированные/default	205832	Epson
2576590	8715946355580	Картридж струйный epson (c13t03454010) stylus photo 2100, светло-голубой, ориг	1	Неклассифицированные/default	205832	Epson
2078748	8715946355603	Картридж струйный epson (c13t03464010) stylus photo 2100, светло-пурпурный, ориг	2057596	Техника (folder)/Электротехника (folder)/Цифровая техника (folder)/Inkjet Supplies	205832	Epson
2078750	8715946355641	Картридж струйный epson (c13t03484010) stylus photo 2100, черный матовый, ориг	2057596	Техника (folder)/Электротехника (folder)/Цифровая техника (folder)/Inkjet Supplies	205832	Epson
2078756	8715946355887	Картридж струйный epson (c13t04424010) stylus c64/c66/c84/c86/cx3600/cx3650/cx6400/cx6600 голуб ориг	2057596	Техника (folder)/Электротехника (folder)/Цифровая техника (folder)/Inkjet Supplies	205832	Epson
1713619	8715946355900	Картридж струйный epson (c13t04434010) stylusc64/c66/c84/c86/cx3600/cx3650/cx6400/cx6600 пурпур ориг	230307	Техника (folder)/Электротехника (folder)/Цифровая техника (folder)/Расходные материалы для цифровой техники (folder)/Картридж для принтера	205832	Epson
2078758	8715946355924	Картридж струйный epson (c13t04444010) stylusc64/c66/c84/c86/cx3600/cx3650/cx6400/cx6600 желтый ориг	2057596	Техника (folder)/Электротехника (folder)/Цифровая техника (folder)/Inkjet Supplies	205832	Epson
2078770	8715946356204	Картридж струйный epson (c13t05114210) styluscolor 740/800/1520/scan2000 и др черн комплект 2шт ориг	2057596	Техника (folder)/Электротехника (folder)/Цифровая техника (folder)/Inkjet Supplies	205832	Epson
2078771	8715946356228	Картридж струйный epson (c13t05204010) styluscolor 400/600/740/1520/scan2000/2500 и др, цветной ориг	2057596	Техника (folder)/Электротехника (folder)/Цифровая техника (folder)/Inkjet Supplies	205832	Epson
3336981	4690207101509	Картридж струйный epson (c13t05204010) styluscolor 400/600/c20/scan2000 и др цвет cactus совместимый	230307	Техника (folder)/Электротехника (folder)/Цифровая техника (folder)/Расходные материалы для цифровой техники (folder)/Картридж для принтера	2729362	Cactus
3336982	4690207101417	Картридж струйный epson (c13t05404010) stylus photo R800/r1800 глянец cactus совместимый	230307	Техника (folder)/Электротехника (folder)/Цифровая техника (folder)/Расходные материалы для цифровой техники (folder)/Картридж для принтера	2729362	Cactus
3336983	4690207101424	Картридж струйный epson (c13t05414010) stylus photo R800/r1800 черный фото cactus совместимый	230307	Техника (folder)/Электротехника (folder)/Цифровая техника (folder)/Расходные материалы для цифровой техники (folder)/Картридж для принтера	2729362	Cactus
3336984	4690207101431	Картридж струйный epson (c13t05424010) stylus photo R800/r1800, голубой cactus совместимый	230307	Техника (folder)/Электротехника (folder)/Цифровая техника (folder)/Расходные материалы для цифровой техники (folder)/Картридж для принтера	2729362	Cactus
2549130	8715946356303	Картридж струйный epson (c13t05424010) stylus photo R800/r1800, голубой ориг	1	Неклассифицированные/default	205832	Epson
3336985	4690207101448	Картридж струйный epson (c13t05434010) stylus photo R800/r1800, пурпурный cactus совместимый	230307	Техника (folder)/Электротехника (folder)/Цифровая техника (folder)/Расходные материалы для цифровой техники (folder)/Картридж для принтера	2729362	Cactus
3336986	4690207101455	Картридж струйный epson (c13t05444010) stylus photo R800/r1800, желтый cactus совместимый	230307	Техника (folder)/Электротехника (folder)/Цифровая техника (folder)/Расходные материалы для цифровой техники (folder)/Картридж для принтера	2729362	Cactus
