ID	UPCEAN	Name	CategoryID	CategoryName	BrandID	BrandName
5355727	4895136046123	Игра развивающая под елку bondibon вв4623 ура, новый год! (36 магнитов)	5333490	Игры магнитные и дорожные	439738	Bondibon
5355728	4895136036223	Игра развивающая под елку bondibon верю - не верю. новогодняя серия вв3547	5333490	Игры магнитные и дорожные	439738	Bondibon
5355729	4895136046956	Игра развивающая под елку bondibon для смышленых малышей вв4533	5333490	Игры магнитные и дорожные	439738	Bondibon
5355730	4895136048400	Игра развивающая под елку bondibon дорисуем. новогодняя серия вв4629	5333490	Игры магнитные и дорожные	439738	Bondibon
5355731	4895136035448	Игра развивающая под елку bondibon дорисуй! новогодняя серия вв3545	5333490	Игры магнитные и дорожные	439738	Bondibon
5355732	4895136046116	Игра развивающая под елку bondibon елка-календарь (36 магнитов). новогодняя серия вв4622	5333490	Игры магнитные и дорожные	439738	Bondibon
5355733	4895136037992	Игра развивающая под елку bondibon загадки малышам. новогодняя серия вв3552	5333490	Игры магнитные и дорожные	439738	Bondibon
5355734	4895136037985	Игра развивающая под елку bondibon игра-обводилка малышам. новогодняя серия вв3551	5333490	Игры магнитные и дорожные	439738	Bondibon
5355735	4895136037800	Игра развивающая под елку bondibon логика малышам. новогодняя серия вв3550	5333490	Игры магнитные и дорожные	439738	Bondibon
5355736	4895136035431	Игра развивающая под елку bondibon логические задачки 30шт новогодняя серия вв3544	5333490	Игры магнитные и дорожные	439738	Bondibon
5355737	4895136035240	Игра развивающая под елку bondibon логические задачки 32шт новогодняя серия вв3541	5333490	Игры магнитные и дорожные	439738	Bondibon
5355738	4895136035424	Игра развивающая под елку bondibon любимые игры. новогодняя серия вв3543	5333490	Игры магнитные и дорожные	439738	Bondibon
5355739	4895136036247	Игра развивающая под елку bondibon морской бой. новогодняя серия вв3549	5333490	Игры магнитные и дорожные	439738	Bondibon
5355740	4895136047533	Игра развивающая под елку bondibon мы рисуем. новогодняя серия вв4535	5333490	Игры магнитные и дорожные	439738	Bondibon
5355741	4895136035219	Игра развивающая под елку bondibon найди 10 отличий. новогодняя серия вв3538	5333490	Игры магнитные и дорожные	439738	Bondibon
5355742	4895136046185	Игра развивающая под елку bondibon найди 5 отличий. новогодняя серия вв4528	5333490	Игры магнитные и дорожные	439738	Bondibon
5355743	4895136048387	Игра развивающая под елку bondibon новогоднее приключение вв4644	5333490	Игры магнитные и дорожные	439738	Bondibon
5355744	4895136046819	Игра развивающая под елку bondibon новогодние водные раскраски (многоразовые) вв4529	5333490	Игры магнитные и дорожные	439738	Bondibon
5355745	4895136048394	Игра развивающая под елку bondibon новогодние водные раскраски (многоразовые) вв4626	5333490	Игры магнитные и дорожные	439738	Bondibon
5355746	4895136035257	Игра развивающая под елку bondibon новогодний сюрприз. новогодняя серия вв3542	5333490	Игры магнитные и дорожные	439738	Bondibon
5355747	4895136046826	Игра развивающая под елку bondibon новогодняя игра-бродилка вв4530	5333490	Игры магнитные и дорожные	439738	Bondibon
5355748	4895136047540	Игра развивающая под елку bondibon открытки-аппликации. новогодняя серия вв4648	5333490	Игры магнитные и дорожные	439738	Bondibon
5355749	4895136036230	Игра развивающая под елку bondibon ребусы. новогодняя серия вв3548	5333490	Игры магнитные и дорожные	439738	Bondibon
5355750	4895136047939	Игра развивающая под елку bondibon самому умному. новогодняя серия вв4534	5333490	Игры магнитные и дорожные	439738	Bondibon
5355751	4895136036216	Игра развивающая под елку bondibon снежные головоломки. новогодняя серия вв3546	5333490	Игры магнитные и дорожные	439738	Bondibon
5355752	4895136046178	Игра развивающая под елку bondibon снежный мир. новогодняя серия вв4527	5333490	Игры магнитные и дорожные	439738	Bondibon
5355753	4895136035226	Игра развивающая под елку bondibon судоку. новогодняя серия вв3539	5333490	Игры магнитные и дорожные	439738	Bondibon
828782	4612734090057	Игра развивающая причудливая пирамида головоломка смышленый а-3574 акр	555711	Игрушки (folder)/Головоломка	0	
2727008	6934615499635	Игра развивающая продукты питания на батар свет и звук, руссифиц в русс. кор. 26x7x 28cm в кор.2x 18шт	1726592	Игрушки (folder)/Игрушки развивающие	0	
2727009	6934615499611	Игра развивающая продукты питания на батар свет и звук, руссифиц в русс. кор. 54x7x 33cm в кор.2x 9шт	1726592	Игрушки (folder)/Игрушки развивающие	0	
805885	4602827760349	Игра развивающая профессии (арт.76034)	1	Неклассифицированные/default	1583102	Step
3322790	7700168140015	Игра развивающая прямоуг 7x 22cm	1	Неклассифицированные/default	0	
464161	4603322128696	Игра развивающая пятнашки 8x 8cm 3483 50469 josef otten ндс18%	980	Игрушки (folder)/Игрушка	442856	Josef Otten
464162	4603322128573	Игра развивающая пятнашки 8x 8cm 3485 50468 josef otten	980	Игрушки (folder)/Игрушка	442856	Josef Otten
5066552	4660007013715	Игра развивающая Радуга с-942 кубики самый, самый	1	Неклассифицированные/default	486	Радуга
5069900	4602933517691	Игра развивающая Русский стиль викторины в картинках. супернабор 4в1 03429	1	Неклассифицированные/default	116734	Русский Стиль
89361	672552085004	Игра развивающая рыбалка 3850 гулливер	713265	Игрушки (folder)/Игровой набор	0	
5355754	4680107902030	Игра развивающая с липучками буба умные игры)	1	Неклассифицированные/default	0	
5355755	4680013714352	Игра развивающая с липучками веселые друзья. ми-ми-мишки. в кор. 4680013714352 умные игры	1	Неклассифицированные/default	0	
5355756	4680013714369	Игра развивающая с липучками волшебные истории. сказочный патруль. в кор.4680013714369 умные игры	1	Неклассифицированные/default	0	
3322791	4606553051085	Игра развивающая счет м/у	1	Неклассифицированные/default	0	
519499	4820026220062	Игра развивающая топотуша слоненок тренажер тт-0062 уник-ум	343139	Лекарственные средства (folder)/Антисептики наружного применения	448179	Уник-Ум
5003098	4602827761377	Игра развивающая транспорт.чудо-молоток степ паззл	286761	Игрушки (folder)/Игра	2686764	STEPpazzle
464164	4820092270091	Игра развивающая тренажер для письма английский язык т-0091 966-8294-00-9 тестплей	286761	Игрушки (folder)/Игра	464163	Тестплей
464165	4820092270107	Игра развивающая тренажер для письма немецкий язык 966-8294-01-7 тестплей	286761	Игрушки (folder)/Игра	464163	Тестплей
1213229	4820092270282	Игра развивающая умные кубики 1.2.3.4.5 0282 тестплей	1	Неклассифицированные/default	464163	Тестплей
1213230	4820092270183	Игра развивающая умные кубики без тренажера абвгдейка тестплей ндс 18%	1	Неклассифицированные/default	0	
1213231	4820092270299	Игра развивающая умные кубики в мире животных т-0299 тестплей	1	Неклассифицированные/default	464163	Тестплей
1769086	4820092270220	Игра развивающая умные кубики+тренажер для письма англ.язык 0220 тестплей	286761	Игрушки (folder)/Игра	464163	Тестплей
464167	4820092270039	Игра развивающая умные кубики+тренажер для письма англ.язык 966-8294-03-3 тестплей ндс 18%	286761	Игрушки (folder)/Игра	464163	Тестплей
464168	4820092270015	Игра развивающая умные кубики+тренажер для письма Русский язык 966-8294-09-2 тестплей	286761	Игрушки (folder)/Игра	464163	Тестплей
464169	4820060630384	Игра развивающая фантазер тренажер интеллекта ар-1354 уник-ум	286761	Игрушки (folder)/Игра	448179	Уник-Ум
661350	4812939002170	Игра развивающая формы topgame 00217	56347	Игрушки (folder)/Игра настольная	661276	Top Game
828784	4612740770011	Игра развивающая хилап тренажер смышленый м-7-7 (9),525 акр	1	Неклассифицированные/default	0	
661353	4812939002187	Игра развивающая цвета topgame 00218	56347	Игрушки (folder)/Игра настольная	661276	Top Game
154253	4606088000077	Игра развивающая цвета и фигуры умное домино б00007	980	Игрушки (folder)/Игрушка	439963	Тридевятое царство
3322792	4607020621923	Игра развивающая цветные ковирки от 3-х лет	1	Неклассифицированные/default	0	
661354	4812939002194	Игра развивающая циферки topgame 00219	56347	Игрушки (folder)/Игра настольная	661276	Top Game
2255422	6065848050178	Игра развивающая часики знаний 7007 на батарейках, в коробке	980	Игрушки (folder)/Игрушка	0	
712983	4606471866600	Игра развивающая часы - обучающие 4475	980	Игрушки (folder)/Игрушка	675204	Тойс
1213228	4602933032019	Игра развивающая часы - обучающие 4475 #2	980	Игрушки (folder)/Игрушка	675204	Тойс
661356	4812939002217	Игра развивающая чей домик topgame 00221	56347	Игрушки (folder)/Игра настольная	661276	Top Game
2255416	6065539051712	Игра развивающая чудо-азбука 7008	980	Игрушки (folder)/Игрушка	0	
5355757	4631150416418	Игра развивающая шнуровка:пуговка синяя sshp01c0304bu	1763109	Игрушки (folder)/Игрушка деревянная	5332275	уланик
2727010	4602933034204	Игра развитие внимания /00051	980	Игрушки (folder)/Игрушка	0	
3322793	6924300125291	Игра разноцветные колечки водная	1	Неклассифицированные/default	0	
3322795	4607155192084	Игра раскраска-плакат арифметика зверюшек 4+	1	Неклассифицированные/default	0	
3322796	4607155191056	Игра раскраска-плакат магазин игрушек 3+	1	Неклассифицированные/default	0	
3322797	4607155190127	Игра раскраска-плакат пираты 4+	1	Неклассифицированные/default	0	
3322798	4607155190134	Игра раскраска-плакат ягодная азбука 4+	1	Неклассифицированные/default	0	
712985	4603322161723	Игра раскрывающееся кольцо 18559 для подкидывания, d-12.5cm /1 /0 /768	1	Неклассифицированные/default	5785	Пчелка
713060	4603322162157	Игра раскрывающийся шар 18337 d - 14-29cm /1 /0 /144	286761	Игрушки (folder)/Игра	5785	Пчелка
713061	4603322162171	Игра раскрывающийся шар 18340 d-10cm меняет цвет и светится /6 /0 /180	286761	Игрушки (folder)/Игра	5785	Пчелка
713062	4603322162164	Игра раскрывающийся шар 18341 d-8cm меняет цвет /12 /0 /360	286761	Игрушки (folder)/Игра	442856	Josef Otten
713063	4603322162126	Игра раскрывающийся шар 18344-1 d - 8-18cm цв асс /12 /0 /360	286761	Игрушки (folder)/Игра	442856	Josef Otten
713064	4603322162133	Игра раскрывающийся шар 18344-2 d - 8-18cm цв асс /12 /0 /360	286761	Игрушки (folder)/Игра	5785	Пчелка
56439	4607014055253	Игра расскажи мне скзку	980	Игрушки (folder)/Игрушка	0	
1694947	4607020625570	Игра расскажи сказку развитие внимания и памяти	1	Неклассифицированные/default	0	
3322799	9785353070276	Игра растем-ка! кто что строит пальчиковые занятия	1	Неклассифицированные/default	0	
3322800	9785353070344	Игра растем-ка! мы едем в деревню пальчиковые занятия	1	Неклассифицированные/default	0	
2752407	9785353066057	Игра растем-ка! наша дружная семья пальчиковые занятия	1	Неклассифицированные/default	205409	РОСМЭН
1666624	5010994650278	Игра ратуки карточная 30709h	1	Неклассифицированные/default	0	
154255	4601656003313	Игра репетитор по англ. языку ким	154077	Медиа (folder)/Software	0	
1726654	6901202700009	Игра робот-конструктор воины андромеды №sl-4023a в пак/сув/240x4	146199	Игрушки (folder)/Игрушечное оружие	0	
1213233	4894001529501	Игра ролевая spider-man дартс 2 мячика+1 дротик 52950 батик	456071	Спорт и отдых (folder)/Дартс	0	
1213234	4607056791775	Игра ролевая городки у471 уфа	980	Игрушки (folder)/Игрушка	0	
1213235	4607077654349	Игра ролевая дартс круглый д=50+2дротика спорт 00003 гелий	456071	Спорт и отдых (folder)/Дартс	0	
1213236	4607077654332	Игра ролевая дартс круглый д=50+3дротика 00002 гелий	456071	Спорт и отдых (folder)/Дартс	0	
1213237	4607077654318	Игра ролевая дартс прикольный 2162 00016 гелий	456071	Спорт и отдых (folder)/Дартс	0	
1213238	6438240327641	Игра ролевая дартс тир 25cm белый 32764 премьер игрушка	456071	Спорт и отдых (folder)/Дартс	0	
1213239	6438240327696	Игра ролевая дартс фигуры 35cm 32769 премьер игрушка	456071	Спорт и отдых (folder)/Дартс	0	
1213240	6438240327665	Игра ролевая дартс футбол 25cm 32766 премьер игрушка	456071	Спорт и отдых (folder)/Дартс	0	
712987	4607047046075	Игра ростомер, 100x670, 994 /0 /0 /100	278582	Спорт и отдых (folder)/Спорт и отдых	0	
1966496	4607020624214	Игра рукавичка/зимушка-зима настольно-печатная лоскутная мозаика	1	Неклассифицированные/default	0	
3322801	4607020624221	Игра рукавичка/зимушка-зима настольно-печатная лоскутная мозаика #2	1	Неклассифицированные/default	0	
712989	4603322016641	Игра рукоделие 3388 пайетки-набор цв асс /12 /0 /288	712988	Товары для творчества (folder)/Рукоделие	0	
712990	4603322163352	Игра рукоделие 6298 бисер-набор для плетения цв асс /12 /0 /288	712988	Товары для творчества (folder)/Рукоделие	441467	ПРОБЮРО
712993	4603322163345	Игра рукоделие 6299 бусинки-набор для плетения цв асс /12 /0 /288	712988	Товары для творчества (folder)/Рукоделие	441467	ПРОБЮРО
712994	4603322163376	Игра рукоделие 6304 бусинки-набор для плетения цв асс /1 /0 /360	712988	Товары для творчества (folder)/Рукоделие	441467	ПРОБЮРО
712997	4603322163390	Игра рукоделие 6305 набор бусинок-набор для плетения цв асс /1 /0 /144	712988	Товары для творчества (folder)/Рукоделие	441467	ПРОБЮРО
712991	4603322163369	Игра рукоделие 6307 бисер-набор для плетения /12 /0 /432	712988	Товары для творчества (folder)/Рукоделие	441467	ПРОБЮРО
712995	4603322163406	Игра рукоделие 6309 бусинки-набор для плетения /1 /0 /960	712988	Товары для творчества (folder)/Рукоделие	441467	ПРОБЮРО
712992	4603322163444	Игра рукоделие 6310 бисер-набор для плетения /12 /0 /240	712988	Товары для творчества (folder)/Рукоделие	441467	ПРОБЮРО
1213241	4603322172330	Игра рукоделие бисер 6314 54515 josef otten	712988	Товары для творчества (folder)/Рукоделие	442856	Josef Otten
1213242	4603322172453	Игра рукоделие бисер для плетения 7120 цена за 1 пакетик 54527 josef otten	712988	Товары для творчества (folder)/Рукоделие	442856	Josef Otten
1213243	4603322172316	Игра рукоделие бисер цв 6312 54513 josef otten	712988	Товары для творчества (folder)/Рукоделие	442856	Josef Otten
1213244	4603322016610	Игра рукоделие бисер-набор для плетения 3389 50298 josef otten	712988	Товары для творчества (folder)/Рукоделие	442856	Josef Otten
712996	4603322163420	Игра рукоделие бусинки на планшете 20 пак. 7119 53462 josef otten	712988	Товары для творчества (folder)/Рукоделие	442856	Josef Otten
1213246	4603322173115	Игра рукоделие вышивка крестиком на брелке 6613 54898 josef otten	712988	Товары для творчества (folder)/Рукоделие	442856	Josef Otten
1213247	4603322173085	Игра рукоделие вышивка крестиком на подвеске 6610 54890 josef otten	712988	Товары для творчества (folder)/Рукоделие	442856	Josef Otten
1213248	4603322172361	Игра рукоделие набор бусин 6311 54518 josef otten	712988	Товары для творчества (folder)/Рукоделие	442856	Josef Otten
1213249	4603322172439	Игра рукоделие набор бусин 7133 цена за 1 пакетик 54525 josef otten	712988	Товары для творчества (folder)/Рукоделие	442856	Josef Otten
1213250	4603322172415	Игра рукоделие набор бусин 7135 54523 josef otten	712988	Товары для творчества (folder)/Рукоделие	442856	Josef Otten
712998	4603322163451	Игра рукоделие набор бусинок 6306 53465 josef otten	712988	Товары для творчества (folder)/Рукоделие	442856	Josef Otten
1213251	4603322172446	Игра рукоделие пайетки на планшете 24 пак. 7117 54526 josef otten	712988	Товары для творчества (folder)/Рукоделие	442856	Josef Otten
713000	4603322163383	Игра рукоделие плетение 6315 53458 josef otten	712988	Товары для творчества (folder)/Рукоделие	442856	Josef Otten
713001	4603322163437	Игра рукоделие плетение на планшете 20 пак. 7118 53463 josef otten	712988	Товары для творчества (folder)/Рукоделие	442856	Josef Otten
1696280	4006592650896	Игра рулетка лас-вегас simba 10 6155089	980	Игрушки (folder)/Игрушка	651699	Simba
713002	4606383024242	Игра рулетка пластик. 6 стопок	278582	Спорт и отдых (folder)/Спорт и отдых	0	
1213252	6934522979589	Игра руль электронный а754-н05004/918-38	980	Игрушки (folder)/Игрушка	0	
1213253	5000000328505	Игра русалочка 2 возвращ.в море рс-сd	1351406	Медиа (folder)/Компьютерные игры	0	
3322802	4602933037564	Игра Русский стиль вальс цветов тв/уп	1	Неклассифицированные/default	0	
687464	4602933031838	Игра Русский стиль веселые шнурочки кошки-мышки/ музыкальный инструмент мяг/уп	980	Игрушки (folder)/Игрушка	0	
2719972	4602933031845	Игра Русский стиль веселые шнурочки сказочные часы/сорока-почтальон мяг/уп	980	Игрушки (folder)/Игрушка	0	
3894313	4607055593028	Игра Русский стиль волшебство Disney мозаика	56347	Игрушки (folder)/Игра настольная	116734	Русский Стиль
3322803	4602933032446	Игра Русский стиль домино для детей от 3х лет	1	Неклассифицированные/default	0	
463944	4602010235685	Игра Русский стиль лисичка-сестричка арт.03423	56347	Игрушки (folder)/Игра настольная	116734	Русский Стиль
3894314	4607055593011	Игра Русский стиль микки маус мозаика в картинк.	56347	Игрушки (folder)/Игра настольная	116734	Русский Стиль
56359	4602933032255	Игра Русский стиль по щучьем.веленью в кармашке	56347	Игрушки (folder)/Игра настольная	116734	Русский Стиль
3894315	4607055592021	Игра Русский стиль пух мозаика напольн.110элем	56347	Игрушки (folder)/Игра настольная	116734	Русский Стиль
3322804	4602933090521	Игра Русский стиль самоучитель на металлофоне веселые гуси	1	Неклассифицированные/default	0	
3322805	4602933038837	Игра Русский стиль театр динозаврики	1	Неклассифицированные/default	0	
3322806	4602933038813	Игра Русский стиль театр рыцарский турнир	1	Неклассифицированные/default	0	
3322807	4602933038806	Игра Русский стиль театр щелкунчик	1	Неклассифицированные/default	0	
3894319	4602933030015	Игра Русский стиль часть и целое наст	56347	Игрушки (folder)/Игра настольная	116734	Русский Стиль
