ID	UPCEAN	Name	CategoryID	CategoryName	BrandID	BrandName
2235791	9785490001003	Азбукварик pop-up книга кого ищет львенок?	2220881	Полиграфия (folder)/Книги со звуками	1224661	Азбукварик (Белфакс)
2238837	9785490000990	Азбукварик pop-up книга кто живет в джунглях?	2220881	Полиграфия (folder)/Книги со звуками	1224661	Азбукварик (Белфакс)
2238838	9785490001317	Азбукварик pop-up книга кто живет в лесу?	2220881	Полиграфия (folder)/Книги со звуками	1224661	Азбукварик (Белфакс)
2238839	9785490001218	Азбукварик pop-up книга кто живет в океане?	2220881	Полиграфия (folder)/Книги со звуками	1224661	Азбукварик (Белфакс)
2238840	9785490001096	Азбукварик pop-up книга кто живет в пруду?	2220881	Полиграфия (folder)/Книги со звуками	1224661	Азбукварик (Белфакс)
2238841	9785490000631	Азбукварик pop-up книга кто живет в саванне?	2220881	Полиграфия (folder)/Книги со звуками	1224661	Азбукварик (Белфакс)
2238843	9785490001232	Азбукварик pop-up книга кто живет на ферме?	2220881	Полиграфия (folder)/Книги со звуками	1224661	Азбукварик (Белфакс)
2246705	9785490000600	Азбукварик pop-up книга Мой лес	2220881	Полиграфия (folder)/Книги со звуками	1224661	Азбукварик (Белфакс)
2246720	9785490000587	Азбукварик pop-up книга Мой пруд	2220881	Полиграфия (folder)/Книги со звуками	1224661	Азбукварик (Белфакс)
2253248	9785402005952	Азбукварик pop-up книга по следам динозавров	2220881	Полиграфия (folder)/Книги со звуками	1224661	Азбукварик (Белфакс)
2260390	9785402008861	Азбукварик pop-up книга страшно смешные монстры	2220881	Полиграфия (folder)/Книги со звуками	1224661	Азбукварик (Белфакс)
2274230	9785490001638	Азбукварик pop-up книга я объеду целый мир	2220881	Полиграфия (folder)/Книги со звуками	1224661	Азбукварик (Белфакс)
2274232	9785490000907	Азбукварик pop-up книга я отважный капитан	2220881	Полиграфия (folder)/Книги со звуками	1224661	Азбукварик (Белфакс)
2274233	9785490001553	Азбукварик pop-up книга я прекрасная Принцесса	2220881	Полиграфия (folder)/Книги со звуками	1224661	Азбукварик (Белфакс)
2220701	9785402006201	Азбукварик Австралия	205408	Полиграфия (folder)/Книги	1224661	Азбукварик (Белфакс)
2220857	9785402017757	Азбукварик азбука в стихах	472873	Полиграфия (folder)/Книги детские	1224661	Азбукварик (Белфакс)
2222370	9785402015036	Азбукварик азбука в стихах /20	472873	Полиграфия (folder)/Книги детские	1224661	Азбукварик (Белфакс)
1657065	9785402011601	Азбукварик азбука в стихах /24	1	Неклассифицированные/default	1224661	Азбукварик (Белфакс)
2846027	4630014080536	Азбукварик азбука-малютка 80536	1	Неклассифицированные/default	0	
2220879	9785402006263	Азбукварик азия	205408	Полиграфия (folder)/Книги	1224661	Азбукварик (Белфакс)
2222371	9785402000919	Азбукварик активное обучение играй с животными /20	472873	Полиграфия (folder)/Книги детские	1224661	Азбукварик (Белфакс)
2222372	9785402000926	Азбукварик активное обучение играй с формами и цветами /20	472873	Полиграфия (folder)/Книги детские	1224661	Азбукварик (Белфакс)
2222373	9785402000872	Азбукварик активное обучение играй с цифрами /20	472873	Полиграфия (folder)/Книги детские	1224661	Азбукварик (Белфакс)
2221235	9785402006188	Азбукварик америка	205408	Полиграфия (folder)/Книги	1224661	Азбукварик (Белфакс)
2221522	9785402006164	Азбукварик арктика и антарктида	205408	Полиграфия (folder)/Книги	1224661	Азбукварик (Белфакс)
677488	9785402002142	Азбукварик арт-студия крутые тачки /30	331286	Игрушки (folder)/Игры обучающие и развивающие	1224661	Азбукварик (Белфакс)
677489	9785402003835	Азбукварик арт-студия супер-мотоциклы /30	331286	Игрушки (folder)/Игры обучающие и развивающие	1224661	Азбукварик (Белфакс)
677490	9785402000582	Азбукварик атлас для малышей книга с 3D наклейками /20	331286	Игрушки (folder)/Игры обучающие и развивающие	1224661	Азбукварик (Белфакс)
2222139	9785490002574	Азбукварик барашек и его друзья	472873	Полиграфия (folder)/Книги детские	1224661	Азбукварик (Белфакс)
226177	9785474005010	Азбукварик баюшки-баю колыбельные для маленьких с мелодией /24	205408	Полиграфия (folder)/Книги	1224661	Азбукварик (Белфакс)
2222553	9785402000940	Азбукварик бип-бип	472873	Полиграфия (folder)/Книги детские	1224661	Азбукварик (Белфакс)
1657066	9785490001485	Азбукварик большая игровая книга для девоч /28	1	Неклассифицированные/default	1224661	Азбукварик (Белфакс)
1657067	9785402013346	Азбукварик большая игровая книга для мальч /28	1	Неклассифицированные/default	1224661	Азбукварик (Белфакс)
2225493	9785402017856	Азбукварик букварь мультяшек	472873	Полиграфия (folder)/Книги детские	1224661	Азбукварик (Белфакс)
677491	9785402009288	Азбукварик букварь мультяшек /30	331286	Игрушки (folder)/Игры обучающие и развивающие	1224661	Азбукварик (Белфакс)
2421551	9785402018129	Азбукварик букварь мультяшек /30 #2	1	Неклассифицированные/default	1224661	Азбукварик (Белфакс)
2226010	9785474005881	Азбукварик в гостях у осьминого	472873	Полиграфия (folder)/Книги детские	1224661	Азбукварик (Белфакс)
2226034	9785402000612	Азбукварик в лесной стране	472873	Полиграфия (folder)/Книги детские	1224661	Азбукварик (Белфакс)
2226066	9789854078861	Азбукварик в синем море в белой пене	472873	Полиграфия (folder)/Книги детские	1224661	Азбукварик (Белфакс)
2246719	4607080270772	Азбукварик в.берестов Мой портфель (с прописью и мини-фломастерами)	472873	Полиграфия (folder)/Книги детские	1224661	Азбукварик (Белфакс)
677492	9785474005331	Азбукварик великолепная пятерка (электронная игровая книга) /26	331286	Игрушки (folder)/Игры обучающие и развивающие	1224661	Азбукварик (Белфакс)
2226401	9785402001022	Азбукварик великолепные наряды	472873	Полиграфия (folder)/Книги детские	1224661	Азбукварик (Белфакс)
4970023	4630014080635	Азбукварик веселая мастерская лепим машинки (набор с пластилином и книжкой-инструкцией) 1835	1	Неклассифицированные/default	4970022	Азбукварик
2226543	9785490002376	Азбукварик веселая ферма	472873	Полиграфия (folder)/Книги детские	1224661	Азбукварик (Белфакс)
2226559	9785402001725	Азбукварик веселые машинки	472873	Полиграфия (folder)/Книги детские	1224661	Азбукварик (Белфакс)
2226560	9785490002390	Азбукварик веселые машинки #2	472873	Полиграфия (folder)/Книги детские	1224661	Азбукварик (Белфакс)
2226687	9785906764034	Азбукварик вечеринка в стиле Winx. Winx Club	472873	Полиграфия (folder)/Книги детские	1224661	Азбукварик (Белфакс)
2227663	9785402018518	Азбукварик вместе весело шагать	472873	Полиграфия (folder)/Книги детские	1224661	Азбукварик (Белфакс)
677493	9785402000513	Азбукварик вместе весело шагать (с пианино) /12	331286	Игрушки (folder)/Игры обучающие и развивающие	1224661	Азбукварик (Белфакс)
2716658	9785906764430	Азбукварик вместе весело шагать (с пианино) /24	1	Неклассифицированные/default	1224661	Азбукварик (Белфакс)
2227664	9785402000575	Азбукварик вместе с солнышком встаем	472873	Полиграфия (folder)/Книги детские	1224661	Азбукварик (Белфакс)
709965	9785402006317	Азбукварик волшебная ручка зайкин зоопарк /20	1	Неклассифицированные/default	1224661	Азбукварик (Белфакс)
709967	9785402006270	Азбукварик волшебная ручка зайкина ферма /20	1	Неклассифицированные/default	1224661	Азбукварик (Белфакс)
677494	9785402006294	Азбукварик волшебная ручка зайкины уроки /20	331286	Игрушки (folder)/Игры обучающие и развивающие	1224661	Азбукварик (Белфакс)
2228057	9785402000551	Азбукварик Волшебница природа	472873	Полиграфия (folder)/Книги детские	1224661	Азбукварик (Белфакс)
2228104	9785402000421	Азбукварик вот так цифры!	472873	Полиграфия (folder)/Книги детские	1224661	Азбукварик (Белфакс)
1657069	9785402012493	Азбукварик вышла курочка гулять /18	1	Неклассифицированные/default	1224661	Азбукварик (Белфакс)
1956462	9785402015678	Азбукварик вышла курочка гулять /18 #2	1	Неклассифицированные/default	1224661	Азбукварик (Белфакс)
2716659	9785402017528	Азбукварик гармошечка веселушки /32	1	Неклассифицированные/default	1224661	Азбукварик (Белфакс)
1657071	9785402012974	Азбукварик гармошечка топотушки /32	1	Неклассифицированные/default	1224661	Азбукварик (Белфакс)
2421552	9785402017542	Азбукварик гармошечка топотушки /32 #2	1	Неклассифицированные/default	1224661	Азбукварик (Белфакс)
1657072	9785402012936	Азбукварик гармошечка чудо-зверюшки /32	1	Неклассифицированные/default	1224661	Азбукварик (Белфакс)
1657073	9785402013605	Азбукварик говорящая азбука /30	1	Неклассифицированные/default	1224661	Азбукварик (Белфакс)
1956463	9785402015050	Азбукварик говорящая азбука /30 #2	1	Неклассифицированные/default	1224661	Азбукварик (Белфакс)
2421553	9785402018105	Азбукварик говорящая азбука /30 #3	1	Неклассифицированные/default	1224661	Азбукварик (Белфакс)
677495	9785402004955	Азбукварик говорящая азбука /32	331286	Игрушки (folder)/Игры обучающие и развивающие	1224661	Азбукварик (Белфакс)
1657074	9785402013728	Азбукварик говорящая азбука для всезнаек /24	1	Неклассифицированные/default	1224661	Азбукварик (Белфакс)
1956464	9785402015029	Азбукварик говорящая азбука для всезнаек /24 #2	1	Неклассифицированные/default	1224661	Азбукварик (Белфакс)
1183438	9785402001602	Азбукварик говорящая азбука для мальчишек /22	980	Игрушки (folder)/Игрушка	1224661	Азбукварик (Белфакс)
1657075	9785402014404	Азбукварик говорящая азбука для мальчишек /22 #2	1	Неклассифицированные/default	1224661	Азбукварик (Белфакс)
1956465	9785402010680	Азбукварик говорящая азбука для мальчишек /22 #3	1	Неклассифицированные/default	1224661	Азбукварик (Белфакс)
677496	9785402001589	Азбукварик говорящая азбука для принцесс /22	472873	Полиграфия (folder)/Книги детские	1224661	Азбукварик (Белфакс)
1956466	9785402015074	Азбукварик говорящая веселая азбука /30	1	Неклассифицированные/default	1224661	Азбукварик (Белфакс)
2421554	9785402017795	Азбукварик говорящая веселая азбука /30 #2	1	Неклассифицированные/default	1224661	Азбукварик (Белфакс)
677497	9785402001541	Азбукварик говорящая волшебная азбука /22	331286	Игрушки (folder)/Игры обучающие и развивающие	1224661	Азбукварик (Белфакс)
677498	9785402001565	Азбукварик говорящая волшебная математика /22	331286	Игрушки (folder)/Игры обучающие и развивающие	1224661	Азбукварик (Белфакс)
1657076	9785402011113	Азбукварик говорящая волшебная математика /22 #2	1	Неклассифицированные/default	1224661	Азбукварик (Белфакс)
4970024	4680019284682	Азбукварик говорящая доска мир животных, двухсторон, для обучения и рисования 82x100/32	1	Неклассифицированные/default	4970022	Азбукварик
677499	9785402007475	Азбукварик говорящая зоо азбука	331286	Игрушки (folder)/Игры обучающие и развивающие	1224661	Азбукварик (Белфакс)
1183439	9785402009257	Азбукварик говорящая зоо азбука #2	980	Игрушки (folder)/Игрушка	1224661	Азбукварик (Белфакс)
1956467	9785402015128	Азбукварик говорящая зоо азбука /20	1	Неклассифицированные/default	1224661	Азбукварик (Белфакс)
1956468	9785402014978	Азбукварик говорящая игровая азбука /20	1	Неклассифицированные/default	1224661	Азбукварик (Белфакс)
1657077	9785402013643	Азбукварик говорящая игрушечная азбука /30	980	Игрушки (folder)/Игрушка	1224661	Азбукварик (Белфакс)
1956469	9785402014398	Азбукварик говорящая игрушечная азбука /30 #2	980	Игрушки (folder)/Игрушка	1224661	Азбукварик (Белфакс)
2421555	9785402017832	Азбукварик говорящая игрушечная азбука /30 #3	1	Неклассифицированные/default	1224661	Азбукварик (Белфакс)
677500	9785402002340	Азбукварик говорящая книга для малышей я изучаю животных /12	331286	Игрушки (folder)/Игры обучающие и развивающие	1224661	Азбукварик (Белфакс)
677501	9785402011359	Азбукварик говорящая книжка айболит /20	331286	Игрушки (folder)/Игры обучающие и развивающие	1224661	Азбукварик (Белфакс)
677502	9785402004832	Азбукварик говорящая книжка лесные сказки с голосами зверей и птиц /28	331286	Игрушки (folder)/Игры обучающие и развивающие	1224661	Азбукварик (Белфакс)
753617	9785402010826	Азбукварик говорящая книжка лесные сказки с голосами зверей и птиц /28 #2	1	Неклассифицированные/default	1224661	Азбукварик (Белфакс)
677503	9785402004979	Азбукварик говорящая книжка малышкина книжка /28	331286	Игрушки (folder)/Игры обучающие и развивающие	1224661	Азбукварик (Белфакс)
677504	9785402004993	Азбукварик говорящая книжка мир вокруг нас /28	331286	Игрушки (folder)/Игры обучающие и развивающие	1224661	Азбукварик (Белфакс)
764590	9785402010376	Азбукварик говорящая книжка муха-цокотуха.телефон /20	1	Неклассифицированные/default	1224661	Азбукварик (Белфакс)
677505	9785402002562	Азбукварик говорящая книжка такие умные домашние животные /20	331286	Игрушки (folder)/Игры обучающие и развивающие	1224661	Азбукварик (Белфакс)
1657078	9785402010178	Азбукварик говорящая книжка такие умные домашние животные /20 #2	1	Неклассифицированные/default	1224661	Азбукварик (Белфакс)
1183440	9785402009523	Азбукварик говорящая книжка чьи домишки? чьи детишки? с голосами зверей и птиц	980	Игрушки (folder)/Игрушка	1224661	Азбукварик (Белфакс)
1657079	9785402014855	Азбукварик говорящая книжка чьи домишки? чьи детишки? с голосами зверей и птиц /28	1	Неклассифицированные/default	1224661	Азбукварик (Белфакс)
677506	9785402002678	Азбукварик говорящая книжка это я о теле человека для малышей /20	331286	Игрушки (folder)/Игры обучающие и развивающие	1224661	Азбукварик (Белфакс)
1657080	9785402008526	Азбукварик говорящая книжка это я о теле человека для малышей /20 #2	1	Неклассифицированные/default	1224661	Азбукварик (Белфакс)
1657081	9785402013681	Азбукварик говорящая плюшевая азбука /30	1	Неклассифицированные/default	1224661	Азбукварик (Белфакс)
1956470	9785402015098	Азбукварик говорящая плюшевая азбука /30 #2	1	Неклассифицированные/default	1224661	Азбукварик (Белфакс)
1183441	9785402003323	Азбукварик говорящая плюшевая азбука /32	980	Игрушки (folder)/Игрушка	1224661	Азбукварик (Белфакс)
2222374	9785402016033	Азбукварик говорящая стрелочка буквы,счет,цвета и формы /24	472873	Полиграфия (folder)/Книги детские	1224661	Азбукварик (Белфакс)
2228791	9785402017771	Азбукварик говорящая умная азбука	472873	Полиграфия (folder)/Книги детские	1224661	Азбукварик (Белфакс)
677507	9785402003385	Азбукварик говорящая энциклопедия для малышей про мощный самосвал и не только... /24	331286	Игрушки (folder)/Игры обучающие и развивающие	1224661	Азбукварик (Белфакс)
2716660	9785402011755	Азбукварик говорящие книжки-мультики бюро находок	1	Неклассифицированные/default	1224661	Азбукварик (Белфакс)
677515	9785402004795	Азбукварик говорящие книжки-мультики домовенок кузька /24	331286	Игрушки (folder)/Игры обучающие и развивающие	1224661	Азбукварик (Белфакс)
2421556	9785402011731	Азбукварик говорящие книжки-мультики домовенок кузька /24 #2	1	Неклассифицированные/default	1224661	Азбукварик (Белфакс)
677508	9785402006843	Азбукварик говорящие окошки - прятки где Мой малыш? /32	331286	Игрушки (folder)/Игры обучающие и развивающие	1224661	Азбукварик (Белфакс)
677509	9785490000099	Азбукварик говорящие окошки что умеют машинки? /28	331286	Игрушки (folder)/Игры обучающие и развивающие	1224661	Азбукварик (Белфакс)
677510	9785402006935	Азбукварик говорящие плюшевые зверята мишуткин лес /25	331286	Игрушки (folder)/Игры обучающие и развивающие	1224661	Азбукварик (Белфакс)
677511	9785402001053	Азбукварик говорящие сказки аленький цветочек и другие сказки /24	331286	Игрушки (folder)/Игры обучающие и развивающие	1224661	Азбукварик (Белфакс)
1183442	9785402010437	Азбукварик говорящие сказки аленький цветочек и другие сказки /24 #2	980	Игрушки (folder)/Игрушка	1224661	Азбукварик (Белфакс)
677512	9785402003866	Азбукварик говорящие сказки гуси-лебеди и другие сказки /24	331286	Игрушки (folder)/Игры обучающие и развивающие	1224661	Азбукварик (Белфакс)
1657082	9785402010383	Азбукварик говорящие сказки гуси-лебеди и другие сказки /24 #2	1	Неклассифицированные/default	1224661	Азбукварик (Белфакс)
2229214	9785402017061	Азбукварик говорящие сказки гуси-лебеди и другие сказки /24 #3	2220881	Полиграфия (folder)/Книги со звуками	1224661	Азбукварик (Белфакс)
677513	9785402011007	Азбукварик говорящие сказки двенадцать месяцев /24	331286	Игрушки (folder)/Игры обучающие и развивающие	1224661	Азбукварик (Белфакс)
677514	9785402003880	Азбукварик говорящие сказки день рождения кота леопольда и другие сказки /24	331286	Игрушки (folder)/Игры обучающие и развивающие	1224661	Азбукварик (Белфакс)
1657083	9785402010406	Азбукварик говорящие сказки день рождения кота леопольда и другие сказки /24 #2	1	Неклассифицированные/default	1224661	Азбукварик (Белфакс)
677516	9785402003767	Азбукварик говорящие сказки Золушка и другие сказки /24	331286	Игрушки (folder)/Игры обучающие и развивающие	1224661	Азбукварик (Белфакс)
2421557	9785402010512	Азбукварик говорящие сказки Золушка и другие сказки /24 #2	1	Неклассифицированные/default	1224661	Азбукварик (Белфакс)
677517	9785402003828	Азбукварик говорящие сказки Колобок и другие сказки /24	331286	Игрушки (folder)/Игры обучающие и развивающие	1224661	Азбукварик (Белфакс)
