ID	UPCEAN	Name	CategoryID	CategoryName	BrandID	BrandName
705320	8721891012799	Доска разделочная прямоуг с жело 35x 24cm	19096	Посуда (folder)/Доска разделочная	0	
831966	4607018476658	Доска разделочная прямоуг с желобком 35x19.5x1.5	19096	Посуда (folder)/Доска разделочная	1663456	Oriental Way
1663460	4607018479444	Доска разделочная прямоуг с мет. ручкой 30.5x20.5x1.6	19096	Посуда (folder)/Доска разделочная	1663456	Oriental Way
705870	8721891012768	Доска разделочная прямоуг с ручк.30x18	19096	Посуда (folder)/Доска разделочная	0	
153623	7896403700097	Доска разделочная прямоуг с ручкой 380x195 x18 к10 10030/060	19096	Посуда (folder)/Доска разделочная	0	
153665	7896403700189	Доска разделочная прямоуг с ручкой 400x210 x18 к5 10045/73	19096	Посуда (folder)/Доска разделочная	0	
1206657	789640300823	Доска разделочная прямоуг с ручкой 400x230 x12 к20 10006/08	19096	Посуда (folder)/Доска разделочная	0	
4998454	4607164830502	Доска разделочная прямоуг с ручкой, микс (25) is10009-25	19096	Посуда (folder)/Доска разделочная	0	
3312672	4620754178297	Доска разделочная прямоуг средняя 30.9x23.3x1.3cm	19096	Посуда (folder)/Доска разделочная	0	
1783514	4602017000859	Доска разделочная прямоуго	19096	Посуда (folder)/Доска разделочная	0	
3805819	4607071950133	Доска разделочная прямоуго #2	19096	Посуда (folder)/Доска разделочная	0	
3312673	1093950100028	Доска разделочная прямоугольник 18x 29cm	19096	Посуда (folder)/Доска разделочная	0	
3312674	1093950100035	Доска разделочная прямоугольник большой 20x 36cm	19096	Посуда (folder)/Доска разделочная	0	
5334089	4610016195179	Доска разделочная птички, ф 24cm береза, marmiton 17115	19096	Посуда (folder)/Доска разделочная	0	
3312675	4607021012294	Доска разделочная Пчелка d=230mm	19096	Посуда (folder)/Доска разделочная	0	
3312677	4607021015523	Доска разделочная Пчелка овальная 310x 265mm	19096	Посуда (folder)/Доска разделочная	0	
142052	4602017000910	Доска разделочная раздвижная к	19096	Посуда (folder)/Доска разделочная	312605	ООО НПФ Квинта
705872	8711295778520	Доска разделочная разм 29x18	19096	Посуда (folder)/Доска разделочная	0	
3312678	7700206560010	Доска разделочная размер 20.5x 30cm пластик	19096	Посуда (folder)/Доска разделочная	0	
705873	8662201009910	Доска разделочная ракушки 20x 30cm /24 991	19096	Посуда (folder)/Доска разделочная	0	
3312679	4009977853998	Доска разделочная рамантика стеклянная 40x 30cm	19096	Посуда (folder)/Доска разделочная	0	
153668	6924423720205	Доска разделочная ребристая 20x20	19096	Посуда (folder)/Доска разделочная	0	
2967281	7920424720243	Доска разделочная ребристая 20x20 #2	19096	Посуда (folder)/Доска разделочная	0	
153667	6924423730259	Доска разделочная ребристая 20x30	19096	Посуда (folder)/Доска разделочная	0	
2967280	7920424730204	Доска разделочная ребристая 20x30 #2	19096	Посуда (folder)/Доска разделочная	0	
153645	6924423730228	Доска разделочная ребристая гольден 20x 30cm 6065rs	19096	Посуда (folder)/Доска разделочная	0	
153669	6924423730273	Доска разделочная ребристая кофе 20x 30cm 6359	19096	Посуда (folder)/Доска разделочная	0	
153670	6924423720267	Доска разделочная ребристая лайм 20x20	19096	Посуда (folder)/Доска разделочная	0	
53475	6924423730204	Доска разделочная ребристая полдник 20x 30cm 6014rs	19096	Посуда (folder)/Доска разделочная	0	
2955003	6924423730242	Доска разделочная ребристая полдник 20x 30cm 6014rs #2	19096	Посуда (folder)/Доска разделочная	0	
2955004	6924423730211	Доска разделочная ребристая полдник 20x 30cm 6014rs #3	19096	Посуда (folder)/Доска разделочная	0	
4839538	5055323632815	Доска разделочная редмонд дуб массив 180x180 rcb-w6010	19096	Посуда (folder)/Доска разделочная	2226641	Редмонд
4839539	5055323632839	Доска разделочная редмонд дуб массив 180x300 rcb-w6011	19096	Посуда (folder)/Доска разделочная	2226641	Редмонд
4839540	5055323632877	Доска разделочная редмонд дуб торцевая 19.5x 27cm rcb-w6000	19096	Посуда (folder)/Доска разделочная	2226641	Редмонд
4839541	5055323632891	Доска разделочная редмонд дуб торцевая 24x30.5cm rcb-w6001	19096	Посуда (folder)/Доска разделочная	2226641	Редмонд
4839542	5055323632914	Доска разделочная редмонд дуб торцевая 28.5x 34cm rcb-w6002	19096	Посуда (folder)/Доска разделочная	2226641	Редмонд
1206658	4606900329270	Доска разделочная рифл 20x 30cm 5340030/26	19096	Посуда (folder)/Доска разделочная	0	
1206659	4606900329454	Доска разделочная рифл 20x 30cm 5340030/26 #2	19096	Посуда (folder)/Доска разделочная	0	
5334090	6900021407007	Доска разделочная розовые розы 25x16.5cm деревянная Виктория с 8 марта 2140700 50062379	19096	Посуда (folder)/Доска разделочная	0	
3312681	4009977857026	Доска разделочная романтика стеклянная	19096	Посуда (folder)/Доска разделочная	0	
3312682	4710694612613	Доска разделочная Русский петух 18x 18cm	19096	Посуда (folder)/Доска разделочная	0	
705875	4710694577875	Доска разделочная Русский стиль стекло d=20cm fh66-204	19096	Посуда (folder)/Доска разделочная	705874	Джой Брайт Лимитед
3312683	6917453363153	Доска разделочная рыба	19096	Посуда (folder)/Доска разделочная	0	
2432559	462000061038	Доска разделочная рыбка	19096	Посуда (folder)/Доска разделочная	0	
2432560	4607045760843	Доска разделочная рыбка #2	19096	Посуда (folder)/Доска разделочная	0	
3312684	4607153304137	Доска разделочная рыбка в ассортиемнте	19096	Посуда (folder)/Доска разделочная	0	
4998455	4660005933756	Доска разделочная рыбка мп+ микс sk084	19096	Посуда (folder)/Доска разделочная	0	
705876	4607177040790	Доска разделочная рыбка пц1505	19096	Посуда (folder)/Доска разделочная	0	
3312685	4607153301082	Доска разделочная рыбка цвет розовый	19096	Посуда (folder)/Доска разделочная	0	
705877	4000270305498	Доска разделочная с бортиком пласт 35.5x22.5cm (3054-9)	19096	Посуда (folder)/Доска разделочная	701783	KESPER
5334091	4680059190554	Доска разделочная с вырезной ручкой 28x18 x 1cm бамбук	19096	Посуда (folder)/Доска разделочная	184557	BRAVO
5334092	4680059190561	Доска разделочная с вырезной ручкой 30x20 x 1cm бамбук	19096	Посуда (folder)/Доска разделочная	184557	BRAVO
3805820	4603444005424	Доска разделочная с желоб.400x250 x 15mm	19096	Посуда (folder)/Доска разделочная	0	
3805821	4603444005417	Доска разделочная с желобком 400x250 x 15mm	19096	Посуда (folder)/Доска разделочная	3805730	КОВЧЕГЪ
5334093	4007371039604	Доска разделочная с канавкой kuchenprofi 36x 26cm серая 23 3626 50 00	19096	Посуда (folder)/Доска разделочная	0	
705878	4607177041476	Доска разделочная с контейнером пл-ц	19096	Посуда (folder)/Доска разделочная	0	
705879	4811221004625	Доска разделочная с лотком	19096	Посуда (folder)/Доска разделочная	0	
3312312	4811244041546	Доска разделочная с лотком kleo голубая лагуна, berossi (изделие из пластмассы. размер 372x243 x 27mm) ик20747000	19096	Посуда (folder)/Доска разделочная	3421478	Berossi
3312313	4811244041553	Доска разделочная с лотком kleo мандарин, berossi (изделие из пластмассы. размер 372x243 x 27mm) ик20740000	19096	Посуда (folder)/Доска разделочная	3421478	Berossi
2725102	4811244041560	Доска разделочная с лотком kleo роза, berossi (изделие из пластмассы. размер 372x243 x 27mm) ик20746000	19096	Посуда (folder)/Доска разделочная	3421478	Berossi
3805750	4811244041577	Доска разделочная с лотком kleo салатный, berossi (изделие из пластмассы. размер 372x243 x 27mm) ик20738000	19096	Посуда (folder)/Доска разделочная	3421478	Berossi
3312314	4811244044424	Доска разделочная с лотком kleo солнечный, berossi (изделие из пластмассы. размер 372x243 x 27mm) ик20734000	19096	Посуда (folder)/Доска разделочная	3421478	Berossi
5334094	6900044668645	Доска разделочная с новым годом! добрый дедушка мороз 23x 16cm деревянная, декорированная симаглобал 4466864 50067279	19096	Посуда (folder)/Доска разделочная	0	
5334095	6900044668638	Доска разделочная с новым годом! мишкины подарки 23x 16cm деревянная, декорированная симаглобал 4466863 50067280	19096	Посуда (folder)/Доска разделочная	0	
5334096	6900044668652	Доска разделочная с новым годом! праздничное настроение 23x 16cm деревянная, декорированная симаглобал 4466865 50067281	19096	Посуда (folder)/Доска разделочная	0	
5333866	5028420600278	Доска разделочная с ножеточкой joseph joseph slice&sharpen (60027)	19096	Посуда (folder)/Доска разделочная	5174386	joseph joseph
806194	6905505221230	Доска разделочная с ножом п/у (522123)	19096	Посуда (folder)/Доска разделочная	0	
705880	4000270686436	Доска разделочная с пл.крыш. свет.дер. (6864-3)	19096	Посуда (folder)/Доска разделочная	701783	KESPER
705881	4001171080323	Доска разделочная с пласт кр.с	19096	Посуда (folder)/Доска разделочная	319660	DORMAN
705882	4001171090315	Доска разделочная с пласт кр.т	19096	Посуда (folder)/Доска разделочная	319660	DORMAN
3312162	4660003331783	Доска разделочная с руч.370x220 x 12mm	19096	Посуда (folder)/Доска разделочная	3805730	КОВЧЕГЪ
2432561	4607045760065	Доска разделочная с ручк. sk-006	19096	Посуда (folder)/Доска разделочная	0	
53456	4607869045638	Доска разделочная с ручкой 160x35 ст030	19096	Посуда (folder)/Доска разделочная	0	
53457	4607869046512	Доска разделочная с ручкой 160x35 ст038	19096	Посуда (folder)/Доска разделочная	0	
3312686	4612715551867	Доска разделочная с ручкой 170x 340mm	19096	Посуда (folder)/Доска разделочная	0	
53518	4607115260143	Доска разделочная с ручкой 255x 190mm (1) (50) бп219	19096	Посуда (folder)/Доска разделочная	0	
4998456	4626013160393	Доска разделочная с ручкой 28x18 x1 бамбук	19096	Посуда (folder)/Доска разделочная	0	
53519	4606333194445	Доска разделочная с ручкой 30x 25cm меланин	19096	Посуда (folder)/Доска разделочная	0	
53520	4606333201235	Доска разделочная с ручкой 34x 25cm меланин	19096	Посуда (folder)/Доска разделочная	0	
262921	8595028424607	Доска разделочная с ручкой Tescoma presto 35x 18cm	19096	Посуда (folder)/Доска разделочная	17465	Tescoma
262922	8595028422450	Доска разделочная с ручкой woody 35x 18cm	19096	Посуда (folder)/Доска разделочная	17465	Tescoma
4998457	4620008420035	Доска разделочная с ручкой из дерева	19096	Посуда (folder)/Доска разделочная	0	
53455	4620000610434	Доска разделочная с ручкой руником	19096	Посуда (folder)/Доска разделочная	0	
3312331	4660011278841	Доска разделочная с ручкой, букет, 35x18.5cm береза, marmiton 17035	19096	Посуда (folder)/Доска разделочная	3702489	MARMITON
1663461	4000270517006	Доска разделочная с ручкой, дерево 30x20 x1.6cm (5170-0)	19096	Посуда (folder)/Доска разделочная	0	
1663462	4000270517013	Доска разделочная с ручкой, дерево 35x25 x1.6cm (5170-1)	19096	Посуда (folder)/Доска разделочная	0	
705883	4000270517020	Доска разделочная с ручкой, дерево 40x30 x1.6cm (5170-2)	19096	Посуда (folder)/Доска разделочная	701783	KESPER
5128893	5413821068503	Доска разделочная с тарелкой berghoff leo (3950057)	19096	Посуда (folder)/Доска разделочная	308727	BergHOFF
5128907	5413821068527	Доска разделочная с тарелкой berghoff leo (3950058)	19096	Посуда (folder)/Доска разделочная	308727	BergHOFF
53522	5037231238044	Доска разделочная санвелл 25cm swr014/560/719/780Al	19096	Посуда (folder)/Доска разделочная	53521	Санвелл
2955007	5037231238457	Доска разделочная санвелл 25cm swr014/560/719/780Al #2	19096	Посуда (folder)/Доска разделочная	53521	Санвелл
2955008	5037231238426	Доска разделочная санвелл 25cm swr014/560/719/780Al #3	19096	Посуда (folder)/Доска разделочная	53521	Санвелл
2955009	5037231238419	Доска разделочная санвелл 25cm swr014/560/719/780Al #4	19096	Посуда (folder)/Доска разделочная	53521	Санвелл
2432562	4607045760034	Доска разделочная свинка	19096	Посуда (folder)/Доска разделочная	0	
4998458	4660005933763	Доска разделочная свинка мп+ sk003	19096	Посуда (folder)/Доска разделочная	0	
3312689	6908181180129	Доска разделочная свитхоме стеклянная 300mm х 200mm арт. cb-j118	19096	Посуда (folder)/Доска разделочная	0	
3312690	4620008420028	Доска разделочная сектор вега бук 180x290	19096	Посуда (folder)/Доска разделочная	0	
5334098	4660005314128	Доска разделочная селфи круг малая 25x1.8cm	19096	Посуда (folder)/Доска разделочная	5334097	селфи
5334099	4660005314159	Доска разделочная селфи круг с ручкой 25x1.8cm	19096	Посуда (folder)/Доска разделочная	5334097	селфи
5334100	4660005314135	Доска разделочная селфи круг с ручкой 35x1.8cm	19096	Посуда (folder)/Доска разделочная	5334097	селфи
5334101	4660005313114	Доска разделочная селфи круг средняя 30x1.8cm	19096	Посуда (folder)/Доска разделочная	5334097	селфи
3312692	6933111900010	Доска разделочная селфи пластик 24x 18cm	19096	Посуда (folder)/Доска разделочная	0	
5334102	4660005313077	Доска разделочная селфи прямоугольник большая (2 металлические ручки) 36x22 x1.8cm	19096	Посуда (folder)/Доска разделочная	5334097	селфи
5334103	4660005313282	Доска разделочная селфи угловая ручка большая с желобом 38x22 x1.8cm	19096	Посуда (folder)/Доска разделочная	5334097	селфи
3312693	4603299177963	Доска разделочная сельский пейзаж стеклянная	19096	Посуда (folder)/Доска разделочная	0	
705884	4607046010213	Доска разделочная сердечко 26x 38cm	19096	Посуда (folder)/Доска разделочная	0	
1206662	6934112265283	Доска разделочная симфония ребр.круглая 20cm 6339	19096	Посуда (folder)/Доска разделочная	0	
3312694	4606901000413	Доска разделочная сказочная страна 20x 30cm 5340175	19096	Посуда (folder)/Доска разделочная	0	
3805822	4650070199720	Доска разделочная складная	19096	Посуда (folder)/Доска разделочная	0	
1663463	6931693203390	Доска разделочная складная 21cm*27cm, с ручкой, пластик	19096	Посуда (folder)/Доска разделочная	0	
705625	4603299186835	Доска разделочная складная 852-003	19096	Посуда (folder)/Доска разделочная	0	
2725105	4605196018172	Доска разделочная складная деко 350x 280mm орхидея м/1577	19096	Посуда (folder)/Доска разделочная	3673575	М-Пластика Idea
3312695	1093950100066	Доска разделочная скоба большая 161983	19096	Посуда (folder)/Доска разделочная	0	
3312696	1093950100042	Доска разделочная скоба маленькая 161981	19096	Посуда (folder)/Доска разделочная	0	
3312697	1093950100059	Доска разделочная скоба средняя 161982	19096	Посуда (folder)/Доска разделочная	0	
4839545	8711295458378	Доска разделочная сланец/бамбук 5x 45cm купман	19096	Посуда (folder)/Доска разделочная	3682723	KOOPMAN
705885	4602017002273	Доска разделочная слива 'кк250	19096	Посуда (folder)/Доска разделочная	0	
3312698	4710694617274	Доска разделочная собака на празднике стеклянная д-20cm м/у	19096	Посуда (folder)/Доска разделочная	0	
1695084	8595028440423	Доска разделочная совок Tescoma presto 26x 16cm	19096	Посуда (folder)/Доска разделочная	0	
3312699	4680259112646	Доска разделочная соленья пластик 20x 30cm	19096	Посуда (folder)/Доска разделочная	0	
2432563	4680259113865	Доска разделочная Соло-3 30x21.5x0.8cm	19096	Посуда (folder)/Доска разделочная	0	
3312701	4603299338012	Доска разделочная Соло-4 851-069	19096	Посуда (folder)/Доска разделочная	0	
2432564	4680259113872	Доска разделочная Соло-6 37.5x25 x0.8cm	19096	Посуда (folder)/Доска разделочная	0	
3312702	4620008421759	Доска разделочная сосна 150x 270mm дс-12	19096	Посуда (folder)/Доска разделочная	0	
2432565	7315340359002	Доска разделочная София 420x290 x 12mm далопласт	19096	Посуда (folder)/Доска разделочная	2432533	Далопласт
3805823	4606900910218	Доска разделочная Сочи образ игр 20x 30cm	19096	Посуда (folder)/Доска разделочная	0	
3312703	4606900746022	Доска разделочная специи рифленая стекло 20x 30cm	19096	Посуда (folder)/Доска разделочная	0	
4998460	4607947691733	Доска разделочная средняя 190x300 /50 (интехпром) Россия новинка 2021	19096	Посуда (folder)/Доска разделочная	0	
5334104	8710755109102	Доска разделочная средняя brabantia tasty colours (109102)	19096	Посуда (folder)/Доска разделочная	675236	BRABANTIA
2725106	4607115260150	Доска разделочная средняя б/руч 300x 205mm (1) (50) бп220	19096	Посуда (folder)/Доска разделочная	0	
3312706	6905218010152	Доска разделочная стек. 30x40 x0.4cm зеленый чай 853-240	19096	Посуда (folder)/Доска разделочная	0	
3312711	6900458685009	Доска разделочная стек. цветы cn685	19096	Посуда (folder)/Доска разделочная	0	
153606	6924423740364	Доска разделочная стекл Золотые рыбки 004	19096	Посуда (folder)/Доска разделочная	0	
1206724	696282000021	Доска разделочная стекл круглая с ручкой 31x 23cm в асс	19096	Посуда (folder)/Доска разделочная	0	
1206648	6924423720274	Доска разделочная стекл ребристая 20x20 лимоны	19096	Посуда (folder)/Доска разделочная	0	
2725107	4814940036625	Доска разделочная стекл.	19096	Посуда (folder)/Доска разделочная	0	
2725108	4814940036632	Доска разделочная стекл. #2	19096	Посуда (folder)/Доска разделочная	0	
3312712	4710694581926	Доска разделочная стекл. 190x 190cm fh48-24	19096	Посуда (folder)/Доска разделочная	0	
3805826	6917453369148	Доска разделочная стекл.30x 40cm	19096	Посуда (folder)/Доска разделочная	0	
3805827	6918341311775	Доска разделочная стекл.30x 40cm #2	19096	Посуда (folder)/Доска разделочная	0	
3312719	6905218011876	Доска разделочная стекл.30x40 x0.4 853-236 сакура	19096	Посуда (folder)/Доска разделочная	0	
1663464	4814940021942	Доска разделочная стекло	19096	Посуда (folder)/Доска разделочная	0	
2230042	4710694601167	Доска разделочная стекло # лошадь фото-граф 18x18 6д fh88-208	19096	Посуда (folder)/Доска разделочная	448622	МультиДом
2230043	4710694601501	Доска разделочная стекло # сказочная лошадь 20x30 4 диз fh88-222	19096	Посуда (folder)/Доска разделочная	448622	МультиДом
1663465	4814940021959	Доска разделочная стекло #2	19096	Посуда (folder)/Доска разделочная	0	
705891	5010000051679	Доска разделочная стекло (	19096	Посуда (folder)/Доска разделочная	0	
53523	4895117804766	Доска разделочная стекло 039	19096	Посуда (folder)/Доска разделочная	0	
53524	6410411132773	Доска разделочная стекло 113277	19096	Посуда (folder)/Доска разделочная	0	
705889	4710694587263	Доска разделочная стекло 18x 18cm ассорти 16диз fh48-6 /16 мультидом /10 Россия	19096	Посуда (folder)/Доска разделочная	448622	МультиДом
