ID	UPCEAN	Name	CategoryID	CategoryName	BrandID	BrandName
4192295	078635457926	Cd elvis presley elvis sings the wonderful world of christmas''	4093300	Медиа (folder)/Media	0	
4192296	880831034128	Cd elvis presley elvis the early recordings	4093300	Медиа (folder)/Media	0	
4192297	078636692128	Cd elvis presley elvis the other sides	4093300	Медиа (folder)/Media	0	
4192298	078636511528	Cd elvis presley elvis today, tomorrow&forever	4093300	Медиа (folder)/Media	0	
4192299	886970523622	Cd elvis presley elvis ultimate gospel [bonus track]	4093300	Медиа (folder)/Media	0	
4192277	078635548624	Cd elvis presley elvis' christmas album	4093300	Медиа (folder)/Media	0	
4192279	078636746524	Cd elvis presley elvis' Gold records, volume 4	4093300	Медиа (folder)/Media	0	
4192280	078636746623	Cd elvis presley elvis' Gold records, volume 5	4093300	Медиа (folder)/Media	0	
4192282	078636746425	Cd elvis presley elvis' Golden records, volume 3	4093300	Медиа (folder)/Media	0	
4192285	078636756523	Cd elvis presley elvis' greatest jukebox hits	4093300	Медиа (folder)/Media	0	
4192300	078635640120	Cd elvis presley elvis' worldwide 50 Gold award hits, vol. 1, parts 1&2	4093300	Медиа (folder)/Media	0	
4192301	078635264227	Cd elvis presley elvis-aloha from hawaii via satellite	4093300	Медиа (folder)/Media	0	
2575188	828768904824	Cd elvis presley Essential elvis presley [rca/ sony bmg]	4093300	Медиа (folder)/Media	0	
4192302	078635145625	Cd elvis presley from elvis in memphis	4093300	Медиа (folder)/Media	0	
4192303	078636793221	Cd elvis presley from elvis in memphis #2	4093300	Медиа (folder)/Media	0	
2575171	886975149728	Cd elvis presley from elvis in memphis [legacy edition]	4093300	Медиа (folder)/Media	0	
4192304	078635150629	Cd elvis presley from elvis presley boulevard, memphis, tennessee	4093300	Медиа (folder)/Media	0	
4192305	078636616025	Cd elvis presley from nashville to memphis the Essential 60's masters	4093300	Медиа (folder)/Media	0	
4192306	078635222722	Cd elvis presley great performances	4093300	Медиа (folder)/Media	0	
4192307	078635192322	Cd elvis presley he touched me	4093300	Медиа (folder)/Media	0	
4192308	886972267128	Cd elvis presley he touched me [bonus tracks]	4093300	Медиа (folder)/Media	0	
4192309	078636653228	Cd elvis presley heart and soul	4093300	Медиа (folder)/Media	0	
4192310	078635131925	Cd elvis presley his hand in mine	4093300	Медиа (folder)/Media	0	
4192311	061921808922	Cd elvis presley hits of	4093300	Медиа (folder)/Media	0	
4192312	5708985990228	Cd elvis presley hound Dog&other hits	1	Неклассифицированные/default	0	
4192313	078635375824	Cd elvis presley how great thou Art	4093300	Медиа (folder)/Media	0	
4192314	078636650623	Cd elvis presley if every Day was like christmas Special collector's editio	4093300	Медиа (folder)/Media	0	
4192315	078636648224	Cd elvis presley if everyday was like christmas	4093300	Медиа (folder)/Media	0	
4192316	078635477627	Cd elvis presley live at madison square gardens	4093300	Медиа (folder)/Media	0	
4192317	078636935423	Cd elvis presley live in las vegas	4093300	Медиа (folder)/Media	0	
4192318	4988017087947	Cd elvis presley Love letters from elvis	4093300	Медиа (folder)/Media	0	
4192319	078636759524	Cd elvis presley Love songs	4093300	Медиа (folder)/Media	0	
4192320	5033606022027	Cd elvis presley maybellene	4093300	Медиа (folder)/Media	0	
4192321	078636761220	Cd elvis presley memories (30th anniversary of nbc tv' 68 comeback Special)	4093300	Медиа (folder)/Media	0	
4192322	078635242829	Cd elvis presley moody Blue	4093300	Медиа (folder)/Media	0	
4192323	078636793122	Cd elvis presley moody Blue #2	4093300	Медиа (folder)/Media	0	
4192324	078636102122	Cd elvis presley nbc-tv Special	4093300	Медиа (folder)/Media	0	
4192325	078635638226	Cd elvis presley number One hits, the	4093300	Медиа (folder)/Media	0	
4192326	078636774121	Cd elvis presley on stage	4093300	Медиа (folder)/Media	0	
4192327	078635436228	Cd elvis presley on stage (february, 1970)	4093300	Медиа (folder)/Media	0	
4192328	078636799124	Cd elvis presley peace in the Valley the complete gospel recordings	4093300	Медиа (folder)/Media	0	
4192329	078636746920	Cd elvis presley Platinum a Life in music	4093300	Медиа (folder)/Media	0	
4192330	078636773926	Cd elvis presley pot luck	4093300	Медиа (folder)/Media	0	
4192331	078635087321	Cd elvis presley promised land	4093300	Медиа (folder)/Media	0	
4192332	078635373226	Cd elvis presley Pure Gold	4093300	Медиа (folder)/Media	0	
4192333	078636938424	Cd elvis presley rca 100th anniversary series the best of elvis presley	4093300	Медиа (folder)/Media	0	
4192334	078636767222	Cd elvis presley rhythm and country Essential elvis vol. 5	4093300	Медиа (folder)/Media	0	
4192335	078636773827	Cd elvis presley something for everybody	4093300	Медиа (folder)/Media	0	
4192336	078636767529	Cd elvis presley sunrise	4093300	Медиа (folder)/Media	0	
4192337	078636767727	Cd elvis presley suspicious minds.	4093300	Медиа (folder)/Media	0	
4192338	745099457327	Cd elvis presley symphonic elvis	4093300	Медиа (folder)/Media	0	
4192339	078635411423	Cd elvis presley that's the way it is	4093300	Медиа (folder)/Media	0	
4192340	078636793825	Cd elvis presley that's the way it is #2	4093300	Медиа (folder)/Media	0	
4192341	078636785424	Cd elvis presley the collection	4093300	Медиа (folder)/Media	0	
4192342	078636799025	Cd elvis presley the country side of elvis	4093300	Медиа (folder)/Media	0	
4192343	035629041820	Cd elvis presley the definitive film album	4093300	Медиа (folder)/Media	0	
4192344	741157119626	Cd elvis presley the elvis broadcasts on Air	4093300	Медиа (folder)/Media	0	
4192345	078636767628	Cd elvis presley the Home recordings. includes 15 previously unreleased perf	4093300	Медиа (folder)/Media	0	
4192346	078636761121	Cd elvis presley Tiger man. 30th anniversary edition	4093300	Медиа (folder)/Media	0	
1741622	078636774022	Cd elvis presley tomorrow is a Long time	763970	Медиа (folder)/Медиа Звуковая запись	0	
4192347	078635638325	Cd elvis presley top ten hits, the	4093300	Медиа (folder)/Media	0	
4192348	078636759227	Cd elvis presley Touch of Platinum	4093300	Медиа (folder)/Media	0	
4192349	078636759326	Cd elvis presley Touch of Platinum volume 2	4093300	Медиа (folder)/Media	0	
4192350	078636612928	Cd elvis presley viva las vegas / roustabout	4093300	Медиа (folder)/Media	0	
4192351	078636667027	Cd elvis presley walk a mile in my shoes the Essential 70's masters	4093300	Медиа (folder)/Media	0	
4192352	078636795928	Cd elvis presley White christmas	4093300	Медиа (folder)/Media	0	
2550202	8594064981303	Cd elvis presley-country hits 2t	3300794	Полиграфия (folder)/Периодические издания	0	
2550203	8594064970956	Cd elvis presley-Love songs 2t	3300794	Полиграфия (folder)/Периодические издания	0	
2550204	8594064981846	Cd elvis presley-the best of 2t	3300794	Полиграфия (folder)/Периодические издания	0	
4192353	765481503128	Cd elvis stewart and the led wagons the Bright side of your moon	4093300	Медиа (folder)/Media	0	
4192354	828765786829	Cd elvis ultimate gospel release date mar 23, 2004 record Label bmg heritage	4093300	Медиа (folder)/Media	0	
4192355	660200204723	Cd elwood the parlance of our time	4093300	Медиа (folder)/Media	0	
4192356	783722245620	Cd ely Joe musta notta gotta l	4093300	Медиа (folder)/Media	0	
4192357	794465719422	Cd elyse o'connor alleluia 2001	4093300	Медиа (folder)/Media	0	
4192358	881237100424	Cd elysian fields dreams that breathe your name	4093300	Медиа (folder)/Media	0	
4192359	634479269721	Cd elysian the Flamingo yard	4093300	Медиа (folder)/Media	0	
4192360	602527208008	Cd elysium iii beloved symphony	4093300	Медиа (folder)/Media	0	
4192361	794465724327	Cd elza wide open	4093300	Медиа (folder)/Media	0	
4192362	743037213028	Cd emad sayyah Modern bellydance from lebanon ma ajmal beirut	4093300	Медиа (folder)/Media	0	
4192363	724385498220	Cd emancipation by tafkap (prince)	4093300	Медиа (folder)/Media	0	
4192365	828765570329	Cd emanuel ax beethoven the 5 piano concertos	4093300	Медиа (folder)/Media	0	
4192366	886970351027	Cd emanuel ax brahms piano concerto no. 1	4093300	Медиа (folder)/Media	0	
4192367	074644491821	Cd emanuel ax, haydn sonatas 33, 38, 58&60	4093300	Медиа (folder)/Media	0	
4192368	634479113529	Cd emanuel transmission Eternity	4093300	Медиа (folder)/Media	0	
4192369	781676697021	Cd embalmer there was blood everywhere	4093300	Медиа (folder)/Media	0	
4192370	620061687929	Cd ember swift insectinside	4093300	Медиа (folder)/Media	0	
4192371	724389463521	Cd embrace all you Good Good people CD2 (hutdx90)	4093300	Медиа (folder)/Media	0	
4192372	724381097304	Cd embrace if you've never been	4093300	Медиа (folder)/Media	0	
4192373	724381097328	Cd embrace if you've never been #2	4093300	Медиа (folder)/Media	0	
4192374	724354606007	Cd embrace make it last CD1 2001 hutcd144	4093300	Медиа (folder)/Media	0	
4192375	724389680522	Cd embrace save me (hutcd133)	4093300	Медиа (folder)/Media	0	
4192376	720642516522	Cd embrace the Good will out	4093300	Медиа (folder)/Media	0	
4192377	634479766923	Cd embrace today breaking the Code of silence	4093300	Медиа (folder)/Media	0	
4192378	724389785425	Cd embrace wonder CD1 (hutcd142)	4093300	Медиа (folder)/Media	0	
4192379	724389785401	Cd embrace wonder CD2 hutdx142	4093300	Медиа (folder)/Media	0	
4192380	4016342000925	Cd embryo father, son and holy ghosts	4093300	Медиа (folder)/Media	0	
4192381	634479396229	Cd emdee the barefoot years	4093300	Медиа (folder)/Media	0	
4192382	634479824227	Cd emerald jade a New Classic	4093300	Медиа (folder)/Media	0	
4192383	783707417820	Cd emerald joy and Paul tye cups of the heart	4093300	Медиа (folder)/Media	0	
4192384	677516528627	Cd emerald Rose celtic crescent	4093300	Медиа (folder)/Media	0	
4192385	677516521628	Cd emerald Rose fire in the head	4093300	Медиа (folder)/Media	0	
4192386	634479442728	Cd emergence scarred ep	4093300	Медиа (folder)/Media	0	
1861861	7898005714199	Cd emergencial tut-Hair 300ml	1	Неклассифицированные/default	0	
4192387	897896002252	Cd emergency 911 sky harbor	4093300	Медиа (folder)/Media	0	
4192388	600445027220	Cd emerson drive emerson drive	4093300	Медиа (folder)/Media	0	
4192389	620638025826	Cd emerson keith&nice the absolutely the best	4093300	Медиа (folder)/Media	0	
4192390	081227223328	Cd emerson lake&palmer best of	4093300	Медиа (folder)/Media	0	
4192391	081227245924	Cd emerson lake&palmer brain salad surgery	4093300	Медиа (folder)/Media	0	
4192392	081227222321	Cd emerson lake&palmer elp	4093300	Медиа (folder)/Media	0	
4192393	081227223625	Cd emerson lake&palmer live at the Royal albert hall	4093300	Медиа (folder)/Media	0	
4192394	081227292225	Cd emerson lake&palmer Lucky man&other hits	4093300	Медиа (folder)/Media	0	
4192395	081227222529	Cd emerson lake&palmer pictures at an exhibition	4093300	Медиа (folder)/Media	0	
4192396	081227223427	Cd emerson lake&palmer return of the manticore	4093300	Медиа (folder)/Media	0	
4192397	081227222420	Cd emerson lake&palmer tarkus	4093300	Медиа (folder)/Media	0	
4192398	081227222628	Cd emerson lake&palmer trilogy	4093300	Медиа (folder)/Media	0	
4192399	081227977726	Cd emerson lake&palmer very best of, the	4093300	Медиа (folder)/Media	0	
4192400	081227222826	Cd emerson lake&palmer welcome back my friends..	4093300	Медиа (folder)/Media	0	
4192401	081227223229	Cd emerson lake&palmer works alive	4093300	Медиа (folder)/Media	0	
4192402	735885405526	Cd emerson Rose rockers 2005	4093300	Медиа (folder)/Media	0	
4192403	028947449522	Cd emerson string quartet bach the Art of fugue	4093300	Медиа (folder)/Media	0	
4192404	028947434122	Cd emerson string quartet beethoven the late string quartets	4093300	Медиа (folder)/Media	0	
4192405	028947764588	Cd emerson string quartet brahms string quartets	4093300	Медиа (folder)/Media	0	
4192406	028947704522	Cd emerson string quartet schubert the late string quartets	4093300	Медиа (folder)/Media	0	
4192407	028945967028	Cd emerson string quartet shostakovich string quartet no. 8 in c minor	4093300	Медиа (folder)/Media	0	
4192408	028947574071	Cd emerson string quartet shostakovich the string quartets [Box set]	4093300	Медиа (folder)/Media	0	
4192409	623667205603	Cd emerson the Fine Art of saying Good bye	4093300	Медиа (folder)/Media	0	
4192410	075678152320	Cd emerson, lake&palmer brain salad surgery	4093300	Медиа (folder)/Media	0	
4192411	075678156328	Cd emerson, lake&palmer in concert	4093300	Медиа (folder)/Media	0	
4192412	075678152122	Cd emerson, lake&palmer pictures at an exhibition	4093300	Медиа (folder)/Media	0	
4192413	075678152023	Cd emerson, lake&palmer tarkus	4093300	Медиа (folder)/Media	0	
4192414	075678152221	Cd emerson, lake&palmer trilogy	4093300	Медиа (folder)/Media	0	
4192415	075678140921	Cd emerson, lake&palmer works, volume 1	4093300	Медиа (folder)/Media	0	
4192416	075678153822	Cd emerson, lake&palmer works, volume 2	4093300	Медиа (folder)/Media	0	
4192417	5099924400923	Cd emery ...in shallow seas we sail	4093300	Медиа (folder)/Media	0	
4192418	5099952149023	Cd emery while broken hearts prevail	4093300	Медиа (folder)/Media	0	
4192419	634479663628	Cd emeryville the 20 minute sample	4093300	Медиа (folder)/Media	0	
4192420	5099920428723	Cd emf children (cdr6288)	4093300	Медиа (folder)/Media	0	
4192421	724353354329	Cd emf epson mad funkers the best of	4093300	Медиа (folder)/Media	0	
4192422	724347682926	Cd emil gilels beethoven piano concertos nos.4&5 ???emperor???	4093300	Медиа (folder)/Media	0	
4192423	786851345223	Cd emil Ink works of Ink vol. 2	4093300	Медиа (folder)/Media	0	
4192424	634479023927	Cd emil richards calamari live at rocco's	4093300	Медиа (folder)/Media	0	
4192425	710571100220	Cd emile pandolfi starry starry Night	4093300	Медиа (folder)/Media	0	
4192426	601215323825	Cd emilia big big world	4093300	Медиа (folder)/Media	0	
4192427	883870028523	Cd emiliana torrini me and armini	4093300	Медиа (folder)/Media	0	
4192428	663875223624	Cd emily ayn for what it means	4093300	Медиа (folder)/Media	0	
4192429	783707724423	Cd emily curtis emily curtis	4093300	Медиа (folder)/Media	0	
4192430	656605932224	Cd emily easterly cole	4093300	Медиа (folder)/Media	0	
4192431	783707367026	Cd emily greene terra Nova	4093300	Медиа (folder)/Media	0	
4192432	825346437927	Cd emily hagihara time to wake (CD)	4093300	Медиа (folder)/Media	0	
4192433	783707528229	Cd emily kurn the doorman	4093300	Медиа (folder)/Media	0	
4192434	013431435624	Cd emily remler East to wes	4093300	Медиа (folder)/Media	0	
4192435	013431416227	Cd emily remler firefly	4093300	Медиа (folder)/Media	0	
4192436	634479065927	Cd emily richards can't take it with you	4093300	Медиа (folder)/Media	0	
4192437	783707569727	Cd emily shore for the climb	4093300	Медиа (folder)/Media	0	
4192438	650687213721	Cd emily solace	4093300	Медиа (folder)/Media	0	
4192439	606949779320	Cd eminem cleanin' out my closet ecd	4093300	Медиа (folder)/Media	0	
4192440	823564900025	Cd eminem document	4093300	Медиа (folder)/Media	0	
3632501	4605026009905	Cd eminem eminen pres.the re-up	4093300	Медиа (folder)/Media	0	
4192441	809744304227	Cd eminem in the spotlight with	4093300	Медиа (folder)/Media	0	
4192442	382556977426	Cd eminem infinite	4093300	Медиа (folder)/Media	0	
3632502	4601250362908	Cd eminem infinite (лиц)	4093300	Медиа (folder)/Media	0	
4192443	606949503727	Cd eminem just don t give a f***-CD5	4093300	Медиа (folder)/Media	0	
4192444	606949782825	Cd eminem lose yourself (cdm)	4093300	Медиа (folder)/Media	0	
4192445	606949781521	Cd eminem lose yourself (ecdm)	4093300	Медиа (folder)/Media	0	
4192446	606949306229	Cd eminem marshall mathers lp limite	4093300	Медиа (folder)/Media	0	
3632503	4605026701946	Cd eminem relapse лиц	4093300	Медиа (folder)/Media	0	
4192447	606949747329	Cd eminem stan	4093300	Медиа (folder)/Media	0	
4192448	606949746728	Cd eminem stan [holland CD]	4093300	Медиа (folder)/Media	0	
4192449	606949329228	Cd eminem the eminem show (edited)	4093300	Медиа (folder)/Media	0	
4192450	606949063221	Cd eminem the marshall mathers (edite	4093300	Медиа (folder)/Media	0	
4192451	606949313722	Cd eminem the marshall mathers lp uk	4093300	Медиа (folder)/Media	0	
4192452	606949772925	Cd eminem without me (cdm)	4093300	Медиа (folder)/Media	0	
4192453	634479790720	Cd eminence chaotic System	4093300	Медиа (folder)/Media	0	
4192454	740155156923	Cd emitt rhodes daisy Fresh from hawthorne, California (the best of the Dunhill years)	4093300	Медиа (folder)/Media	0	
4192455	623339200622	Cd emm gryner asianblue	4093300	Медиа (folder)/Media	0	
4192456	623339200127	Cd emm gryner the Original leap year	4093300	Медиа (folder)/Media	0	
4192457	634479276224	Cd emm juvenile	4093300	Медиа (folder)/Media	0	
4192458	761268203427	Cd emma veary best of emma	4093300	Медиа (folder)/Media	0	
4192470	634479469923	Cd emma's Mini beat generation mad trick	4093300	Медиа (folder)/Media	0	
4192459	724385155628	Cd emmanuel a musical celebration of the Life of christ	4093300	Медиа (folder)/Media	0	
4192460	743219760128	Cd emmanuel coleccion rca 100 anos de musica	4093300	Медиа (folder)/Media	0	
4192461	829757403625	Cd emmanuel dadzie forever Love	4093300	Медиа (folder)/Media	0	
4192462	733792336629	Cd emmanuel dadzie help me lord	4093300	Медиа (folder)/Media	0	
4192463	886975303021	Cd emmanuel dos clasicos	4093300	Медиа (folder)/Media	0	
4192464	078635730128	Cd emmanuel intimamente...	4093300	Медиа (folder)/Media	0	
4192465	078635330021	Cd emmanuel serie 20 exitos emmanuel	4093300	Медиа (folder)/Media	0	
4192466	078635229721	Cd emmanuel solo exitos	4093300	Медиа (folder)/Media	0	
4192467	078635304329	Cd emmanuel toda La vida, exitos	4093300	Медиа (folder)/Media	0	
4192468	634479544026	Cd emmanuel vaughan-lee quintet previous misconceptions	4093300	Медиа (folder)/Media	0	
4192469	5099951904425	Cd emmanuelle ha??m lamenti	4093300	Медиа (folder)/Media	0	
4192471	634479696527	Cd emmett north jr. & 'the atlantic soul machine' 'black,White&blue'	4093300	Медиа (folder)/Media	0	
4192473	634479511226	Cd emmett north jr. 'in the zone'	4093300	Медиа (folder)/Media	0	
4192475	634479511523	Cd emmett north jr. 'wrap me in your love'	4093300	Медиа (folder)/Media	0	
4192472	634479511820	Cd emmett north jr. i'll never let you go'	4093300	Медиа (folder)/Media	0	
4192474	634479511721	Cd emmett north jr. the groove	4093300	Медиа (folder)/Media	0	
4192476	057623106824	Cd emmett rik absolutely	4093300	Медиа (folder)/Media	0	
4192477	057623107920	Cd emmett rik ipso facto	4093300	Медиа (folder)/Media	0	
4192478	057623109627	Cd emmett rik the spiral notebook	4093300	Медиа (folder)/Media	0	
4192479	776127166720	Cd emmett, rik handiwork	4093300	Медиа (folder)/Media	0	
4192480	724352698622	Cd emmett, rik live at berklee	4093300	Медиа (folder)/Media	0	
4192481	724349930223	Cd emmett, rik raw quartet	4093300	Медиа (folder)/Media	0	
4192482	724349761025	Cd emmett, rik swing shift	4093300	Медиа (folder)/Media	0	
4192483	724349760929	Cd emmett, rik ten invitations from the mistress of mr.e.	4093300	Медиа (folder)/Media	0	
4192484	776127105125	Cd emmett, rik the Spirit of christmas (with sam reid)	4093300	Медиа (folder)/Media	0	
4192485	746105052628	Cd emmure felony	4093300	Медиа (folder)/Media	0	
4192486	746105034129	Cd emmure Good bye to the gallows	4093300	Медиа (folder)/Media	0	
4192487	075597992854	Cd emmylou harris all i intended to be	4093300	Медиа (folder)/Media	0	
4192488	081227811228	Cd emmylou harris Blue kentucky girl [bonus tracks]	4093300	Медиа (folder)/Media	0	
4192489	081227810924	Cd emmylou harris elite hotel [bonus tracks]	4093300	Медиа (folder)/Media	0	
4192490	081227611026	Cd emmylou harris Light of the stable [bonus tracks]	4093300	Медиа (folder)/Media	0	
4192491	081227811020	Cd emmylou harris luxury liner [bonus tracks]	4093300	Медиа (folder)/Media	0	
4192492	081227810825	Cd emmylou harris pieces of the sky [bonus tracks]	4093300	Медиа (folder)/Media	0	
4192493	075992520522	Cd emmylou harris the ballad of Sally Rose	4093300	Медиа (folder)/Media	0	
4192494	081227312329	Cd emmylou harris very best of emmylou harris heartaches&highways	4093300	Медиа (folder)/Media	0	
4192495	075992369121	Cd emmylou harris White shoes	4093300	Медиа (folder)/Media	0	
4192496	622306903528	Cd emo leblanc sweet dreams&memories	4093300	Медиа (folder)/Media	0	
4192497	634479336829	Cd emory E marshall emory E marshall	4093300	Медиа (folder)/Media	0	
4192498	783707451220	Cd emotep sneak-thieves	4093300	Медиа (folder)/Media	0	
4192499	628740809327	Cd emotion emotion	4093300	Медиа (folder)/Media	0	
4192500	074646463222	Cd emotions Love songs	4093300	Медиа (folder)/Media	0	
4192501	074643476225	Cd emotions rejoice	4093300	Медиа (folder)/Media	0	
4192502	696998634121	Cd emotions, the Super hits	4093300	Медиа (folder)/Media	0	
4192503	067461639224	Cd empathy brother	4093300	Медиа (folder)/Media	0	
4192504	5016685023222	Cd emperor anthems to the welkin at dust	4093300	Медиа (folder)/Media	0	
4192505	803341167322	Cd emperor in the nightside eclipse	4093300	Медиа (folder)/Media	0	
4192506	720616800725	Cd emperors New clothes wisdom and lies	4093300	Медиа (folder)/Media	0	
4192507	089408061424	Cd empire brass baroque music for brass and organ	4093300	Медиа (folder)/Media	0	
4192508	089408024924	Cd empire brass braggin' in brass	4093300	Медиа (folder)/Media	0	
4192509	089408022029	Cd empire brass class brass	4093300	Медиа (folder)/Media	0	
4192510	089408049323	Cd empire brass class brass firedance	4093300	Медиа (folder)/Media	0	
4192511	089408030529	Cd empire brass class brass ii	4093300	Медиа (folder)/Media	0	
4192512	089408043826	Cd empire brass empire brass greatest hit	4093300	Медиа (folder)/Media	0	
4192513	089408030321	Cd empire brass empire brass on broadway	4093300	Медиа (folder)/Media	0	
4192514	089408015922	Cd empire brass highlights from West side	4093300	Медиа (folder)/Media	0	
4192515	089408033223	Cd empire brass mozart for brass	4093300	Медиа (folder)/Media	0	
4192516	089408020421	Cd empire brass music of gabrieli	4093300	Медиа (folder)/Media	0	
4192517	089408035524	Cd empire brass passage music from chant	4093300	Медиа (folder)/Media	0	
4192518	089408030123	Cd empire brass Romantic brass	4093300	Медиа (folder)/Media	0	
4192519	089408025723	Cd empire brass Royal brass	4093300	Медиа (folder)/Media	0	
4192520	089408055324	Cd empire brass the glory of gabrieli:anth	4093300	Медиа (folder)/Media	0	
4192521	089408041624	Cd empire brass the world sings an empire	4093300	Медиа (folder)/Media	0	
4192522	5099923540323	Cd empire of the Sun walking on a Dream	4093300	Медиа (folder)/Media	0	
4192523	859700532751	Cd empty aeon xpand	4093300	Медиа (folder)/Media	0	
4192524	660654820920	Cd empty head who's talking...who's listening	4093300	Медиа (folder)/Media	0	
4192525	859701151166	Cd empty never get to you	4093300	Медиа (folder)/Media	0	
4192526	634479419140	Cd empty open aeon	4093300	Медиа (folder)/Media	0	
4192527	859703150686	Cd empty surfacing	4093300	Медиа (folder)/Media	0	
4192528	5060096474210	Cd emptyset emptyset	4093300	Медиа (folder)/Media	0	
2550129	4009993195089	Cd emtec 80min	1	Неклассифицированные/default	0	
4192529	655288700625	Cd emulsion sounding rockets	1	Неклассифицированные/default	0	
4192530	074649146320	Cd en blanco y negro pido y rezo	4093300	Медиа (folder)/Media	0	
4192531	075596232227	Cd en Vogue best of en Vogue	4093300	Медиа (folder)/Media	0	
4192532	075678208423	Cd en Vogue born to sing	4093300	Медиа (folder)/Media	0	
4192533	075596205726	Cd en Vogue ev3	4093300	Медиа (folder)/Media	0	
4192534	075679612823	Cd en Vogue free your mind	4093300	Медиа (folder)/Media	0	
4192535	075679212122	Cd en Vogue funky divas	4093300	Медиа (folder)/Media	0	
4192536	075596379625	Cd en Vogue hold on	4093300	Медиа (folder)/Media	0	
4192537	075596241625	Cd en Vogue masterpiece theatre	4093300	Медиа (folder)/Media	0	
4192538	075679181428	Cd en Vogue remix to sing ep	4093300	Медиа (folder)/Media	0	
4192539	075596705721	Cd en Vogue riddle	4093300	Медиа (folder)/Media	0	
4192540	075679229625	Cd en Vogue runaway Love ep	4093300	Медиа (folder)/Media	0	
4192541	081227434823	Cd en Vogue very best of, the	4093300	Медиа (folder)/Media	0	
4192542	075596408226	Cd en Vogue/missy misdemeanor elliott/busta rhymes no fool no more [CD5/cassette single]	4093300	Медиа (folder)/Media	0	
4192544	601215977424	Cd enanitos verdes serie sensacional	4093300	Медиа (folder)/Media	0	
4192545	783707566429	Cd encaustic a shadow's pull	4093300	Медиа (folder)/Media	0	
4192546	723721398453	Cd enchanted Garden (CD)	4093300	Медиа (folder)/Media	0	
4192547	025981112320	Cd enchanted rainforest (tranquility series) by suzanne doucet&chuck plaisance	4093300	Медиа (folder)/Media	0	
