ID	UPCEAN	Name	CategoryID	CategoryName	BrandID	BrandName
5076575	4680206020529	Семена львиный зев твинни розовый махровый	4990039	Растениеводство (folder)/Семена цветы	0	
325031	4601826009299	Семена львиный зев тетра, смесь (грин белт)	324395	Растениеводство (folder)/Семена	324438	Green Belt
1305364	460670602094	Семена льна 0.025	1183282	Продукты питания (folder)/Специальное и спортивное питание/Диабет	0	
4854796	4607136740815	Семена льна 100g	241824	Лекарственные средства (folder)/Аптека	0	
1305365	4820043011322	Семена льна 100g (чп бондарь)	1	Неклассифицированные/default	0	
5718685	4660013186274	Семена льна 200г dial-export диалэкс_1076	5473750	семечки и семена	5508206	dial-export
1354180	4602242005889	Семена льна 5g №10 саше эвалар ЗАО	1	Неклассифицированные/default	0	
2484710	8019010269637	Семена льна ecor 250g	1183282	Продукты питания (folder)/Специальное и спортивное питание/Диабет	2418066	Ecor
5718686	4603735593319	Семена льна holy om коричневые 1кг 4603735593319	5237737	Приправы и специи аюрведические	5237738	holy om
4854797	4602009616457	Семена льна альбероверде 200g	279339	Продукты питания (folder)/Диетические продукты	4844667	АльбероВерде
2484707	4680287519813	Семена льна аривера 200g	22067	Продукты питания (folder)/Крупа и бобовые	2238748	Аривера
2923917	4660009950964	Семена льна белого здоровка 0.200	1	Неклассифицированные/default	711211	Здоровка
2484708	4607175610728	Семена льна бородинские цветной пакет 100g 1/48	1	Неклассифицированные/default	0	
2484709	4660009950490	Семена льна здоровка 0.200	1183282	Продукты питания (folder)/Специальное и спортивное питание/Диабет	711211	Здоровка
2923918	4627078390961	Семена льна зеленая гора 300g	1	Неклассифицированные/default	0	
3517710	4650065952255	Семена льна кладовая природы мягуп 200g	324395	Растениеводство (folder)/Семена	0	
2923919	4607078975009	Семена льна компас здоровья 0.200	1	Неклассифицированные/default	0	
825199	4640006470016	Семена льна масличного семечко льна хрустящее фасованные, 300g	324395	Растениеводство (folder)/Семена	825198	Алтайский лен
3517711	4610014590051	Семена льна молотые 25 пакетов тв/у	324395	Растениеводство (folder)/Семена	0	
4854798	4620761300520	Семена льна радоград коричневого 200g	279339	Продукты питания (folder)/Диетические продукты	4844985	РадоГрад
2923920	4620006730099	Семена льна традиции севера 0.170	1	Неклассифицированные/default	0	
2923921	4640001381003	Семена льна фармгрупп 100g #2	1	Неклассифицированные/default	0	
5718687	4680010700426	Семена льна, 100г	1305382	Продукты питания (folder)/Семечки	0	
325032	4601887016823	Семена любисток удалец (а) (пак.1g) п (парт. 690 / 31.12.12)	324395	Растениеводство (folder)/Семена	324438	Green Belt
3517712	4660007973590	Семена любисток удалец 0.5g цв/п	324395	Растениеводство (folder)/Семена	0	
822766	6017290381744	Семена любисток удалец цв/п (а) Россия --- прян.	324395	Растениеводство (folder)/Семена	0	
822767	4601729016820	Семена люпин алые паруса красный многолетний цв/п (а) Россия --- мн	324395	Растениеводство (folder)/Семена	0	
822769	4601887105466	Семена люпин говернер 1g цв/п 10/ (поиск)	324395	Растениеводство (folder)/Семена	0	
3517713	4660007972586	Семена люпин говернер 1x 10шт цв/п	324395	Растениеводство (folder)/Семена	3514118	агрэкс
822770	4601887017622	Семена люпин канделябр 1g цв/п 10/ поиск)	324395	Растениеводство (folder)/Семена	0	
3517714	4601887105824	Семена люпин минарет низкорослый 1g цв/п	324395	Растениеводство (folder)/Семена	0	
822771	4601887130307	Семена люпин низкорослый фестиваль синий (поиск)	324395	Растениеводство (folder)/Семена	0	
822773	4601729026171	Семена люпин однолетний б/п 20/ (а) Россия	324395	Растениеводство (folder)/Семена	0	
325037	4601729034879	Семена люпин розовая стрела. 1g (а)	324395	Растениеводство (folder)/Семена	0	
822774	4601729000867	Семена люпин руссель многолетний, смесь 1g цв/п 10/ (а) Россия	324395	Растениеводство (folder)/Семена	448645	Аэлита
822777	4601887105473	Семена люпин чателайн 1g цв/п 10/ (поиск)	324395	Растениеводство (folder)/Семена	0	
822778	4601887104452	Семена люцерна голубая краснодарская ранняя 5g б/п 20/ (поиск)	324395	Растениеводство (folder)/Семена	0	
325038	4601729003295	Семена майоран Байкал садовый 0.5g (а)	324395	Растениеводство (folder)/Семена	448645	Аэлита
325039	6017290410376	Семена майоран Байкал садовый б/п 1g 20/ (а) Россия хит	324395	Растениеводство (folder)/Семена	0	
325040	4601729048241	Семена майоран зимняя сказка 0.1g (а) Россия	324395	Растениеводство (folder)/Семена	0	
325042	4601729023545	Семена мак рев вилкс ширли (а)	324395	Растениеводство (folder)/Семена	0	
3902807	4602066729701	Семена мак шелковый муар	3619917	Растениеводство (folder)/Семена и луковичные	0	
3517715	4690368005470	Семена малиновый цвет томат б/п	324395	Растениеводство (folder)/Семена	0	
3517716	4690368006323	Семена малыш перец б/п	324395	Растениеводство (folder)/Семена	0	
822786	4601887101161	Семена мангольд рубин (а) (поиск)	324395	Растениеводство (folder)/Семена	3517971	Поиск
822785	4601887100294	Семена мангольд рубин 3g б/п 20/ (поиск) США	324395	Растениеводство (folder)/Семена	0	
3517717	4607082860315	Семена манул мальчик с пальчик f1 12шт	324395	Растениеводство (folder)/Семена	0	
3517718	4607082863729	Семена манул огурец базар f1 12шт м/у	324395	Растениеводство (folder)/Семена	0	
3517719	4607082863491	Семена манул огурец балконный 12шт	324395	Растениеводство (folder)/Семена	0	
3517720	4607082863576	Семена манул огурец богатырская сила 12шт	324395	Растениеводство (folder)/Семена	0	
3517721	4607082861527	Семена манул огурец букет 12шт	324395	Растениеводство (folder)/Семена	0	
3517722	4607082863583	Семена манул огурец городской 12шт	324395	Растениеводство (folder)/Семена	0	
325133	4607082860230	Семена манул огурец Емеля 12шт м/уп	324395	Растениеводство (folder)/Семена	0	
325144	4607082860247	Семена манул огурец зазуля f1 10-12шт	324395	Растениеводство (folder)/Семена	0	
3517723	4607082863750	Семена манул огурец лабиринт f1 10шт м/у	324395	Растениеводство (folder)/Семена	0	
325186	4607082860322	Семена манул огурец манул f1 12шт м/у	324395	Растениеводство (folder)/Семена	0	
3517724	4607082860384	Семена манул огурец младший лейтенант 12шт	324395	Растениеводство (folder)/Семена	0	
3517725	4607082864108	Семена манул огурец настоящий полковник f1 10шт м/у	324395	Растениеводство (folder)/Семена	0	
3517726	4607082863132	Семена манул огурец охотный ряд f1 12шт м/у	324395	Растениеводство (folder)/Семена	0	
325214	4607082863088	Семена манул огурец первый класс f1 12шт м/у	324395	Растениеводство (folder)/Семена	0	
325217	4607082860421	Семена манул огурец подмосковные вечера 12шт	324395	Растениеводство (folder)/Семена	0	
3517727	4607082860445	Семена манул огурец салтан 12шт	324395	Растениеводство (folder)/Семена	0	
3517728	4607082863620	Семена манул огурец фокус f1 12шт м/у	324395	Растениеводство (folder)/Семена	0	
3517729	4607082860513	Семена манул патиссон каравай 8шт м/у	324395	Растениеводство (folder)/Семена	0	
325635	4607082860971	Семена манул томат десерт 12шт м/у	324395	Растениеводство (folder)/Семена	0	
325044	4601729049002	Семена маргаритка белиссима (а) Россия	324395	Растениеводство (folder)/Семена	0	
822788	4601887102281	Семена маргаритка белый шар 0.05g цв/п 10/ (поиск)	324395	Растениеводство (folder)/Семена	0	
822794	4601729053061	Семена маргаритка роггли (а) Россия --- дв	324395	Растениеводство (folder)/Семена	0	
822798	4601887105008	Семена маргаритка тассо микс 1x 20шт цв/п	324395	Растениеводство (folder)/Семена	0	
757392	4602066731841	Семена маргаритка хабанера (Профи) 15шт /200 (hk)	324395	Растениеводство (folder)/Семена	0	
325046	4601729053078	Семена маргаритка хабанера махровая, смесь 0.1g цв/п 5/ (а) Россия	324395	Растениеводство (folder)/Семена	0	
822803	4601887105015	Семена маргаритка хабанера микс 15шт цв/п 5/ (поиск)	324395	Растениеводство (folder)/Семена	0	
822804	4601729058059	Семена маргаритка хризантемовидная 0.05g ламинат 10/ (а) Россия--- дв	324395	Растениеводство (folder)/Семена	448645	Аэлита
325047	4601729002052	Семена маргаритка экстра, смесь 0.05g (а) Россия	324395	Растениеводство (folder)/Семена	448645	Аэлита
3517731	4690368006330	Семена марья перец б/п	324395	Растениеводство (folder)/Семена	0	
1305366	4820089350324	Семена маслята подсолнечн. жар 100g	1	Неклассифицированные/default	0	
3517732	4602160016318	Семена матиола ночная фиалка 2g	324395	Растениеводство (folder)/Семена	0	
822805	4601729073052	Семена маттиола букетная (левкой) цв/п /10 (а)	324395	Растениеводство (folder)/Семена	448645	Аэлита
3517733	4620754279055	Семена маттиола седая фиолетовая 1x 10шт цв/п	324395	Растениеводство (folder)/Семена	0	
3517735	4690698003535	Семена махровая смесь кларкия	324395	Растениеводство (folder)/Семена	0	
3517736	4601887150954	Семена мезембриантемум джелато розовый 1x 20шт цв/п	324395	Растениеводство (folder)/Семена	0	
3517737	4607069093668	Семена мелисса кадриль, лекарственная 0.2g цв/п	324395	Растениеводство (folder)/Семена	0	
822812	4601729048258	Семена мелисса лимонный бальзам цв/п (а) Россия --- л.ог.	324395	Растениеводство (folder)/Семена	448645	Аэлита
822813	6017290534126	Семена мелисса турецкая душистая цв/п (а) Россия --- л.ог.	324395	Растениеводство (folder)/Семена	0	
3517738	4601729087424	Семена мимулюс желтое пламя 1x 10шт цв/п	324395	Растениеводство (folder)/Семена	0	
3902808	4601819495108	Семена мина лобата вьюно	3619917	Растениеводство (folder)/Семена и луковичные	0	
3517739	4626015130394	Семена мир садоводов кабачок искандер f1 5шт м/у	324395	Растениеводство (folder)/Семена	0	
3517740	4626015130028	Семена мир садоводов капуста f1 краутман белокочанная 15шт м/у	324395	Растениеводство (folder)/Семена	0	
3517741	4626015130141	Семена мир садоводов капуста f1 рамко белокочанная 15шт м/у	324395	Растениеводство (folder)/Семена	0	
3517742	4626015130349	Семена мир садоводов капуста f1 ринда белокочанная 15шт м/у	324395	Растениеводство (folder)/Семена	0	
3517743	4626015130660	Семена мир садоводов капуста брокколи лорд f1 15шт м/у	324395	Растениеводство (folder)/Семена	0	
3517744	4626015130073	Семена мир садоводов огурец f1 герман 10шт т/у	324395	Растениеводство (folder)/Семена	0	
3517745	4626015130080	Семена мир садоводов редис f1 селеста мягуп 1g	324395	Растениеводство (folder)/Семена	0	
3517746	4626015130233	Семена мир садоводов томат f1 Катя 15шт м/у	324395	Растениеводство (folder)/Семена	0	
3517747	4626015130738	Семена мир садоводов томат санька мягуп 0.15g	324395	Растениеводство (folder)/Семена	0	
116115	4607042774553	Семена мир садоводства обриета 1 уп	324395	Растениеводство (folder)/Семена	0	
5076576	4627130871582	Семена мирабилис карамель красная	4990039	Растениеводство (folder)/Семена цветы	0	
822817	4601729057304	Семена мирабилис цветочная фантазия, смесь цв/п 10/ (а) Россия	324395	Растениеводство (folder)/Семена	448645	Аэлита
3902809	4602066623443	Семена мирабилис ялапа	3619917	Растениеводство (folder)/Семена и луковичные	3865583	НК
3902818	4602066786926	Семена мирабилис ялапа #10	3619917	Растениеводство (folder)/Семена и луковичные	3865583	НК
3902819	4602066827384	Семена мирабилис ялапа #11	3619917	Растениеводство (folder)/Семена и луковичные	3865583	НК
3902820	4602066828824	Семена мирабилис ялапа #12	3619917	Растениеводство (folder)/Семена и луковичные	3865583	НК
3902821	4602066828831	Семена мирабилис ялапа #13	3619917	Растениеводство (folder)/Семена и луковичные	3865583	НК
3902822	4602066828862	Семена мирабилис ялапа #14	3619917	Растениеводство (folder)/Семена и луковичные	3865583	НК
3902823	4602066831787	Семена мирабилис ялапа #15	3619917	Растениеводство (folder)/Семена и луковичные	3865583	НК
3902824	4602066832043	Семена мирабилис ялапа #16	3619917	Растениеводство (folder)/Семена и луковичные	3865583	НК
3902825	4602066832067	Семена мирабилис ялапа #17	3619917	Растениеводство (folder)/Семена и луковичные	3865583	НК
3902826	4602066943091	Семена мирабилис ялапа #18	3619917	Растениеводство (folder)/Семена и луковичные	3865583	НК
3902827	4602066990705	Семена мирабилис ялапа #19	3619917	Растениеводство (folder)/Семена и луковичные	3865583	НК
3902810	4602066670584	Семена мирабилис ялапа #2	3619917	Растениеводство (folder)/Семена и луковичные	3865583	НК
3902828	4602066991160	Семена мирабилис ялапа #20	3619917	Растениеводство (folder)/Семена и луковичные	3865583	НК
3902811	4602066700182	Семена мирабилис ялапа #3	3619917	Растениеводство (folder)/Семена и луковичные	3865583	НК
3902812	4602066700205	Семена мирабилис ялапа #4	3619917	Растениеводство (folder)/Семена и луковичные	3865583	НК
3902813	4602066721996	Семена мирабилис ялапа #5	3619917	Растениеводство (folder)/Семена и луковичные	3865583	НК
3902814	4602066728872	Семена мирабилис ялапа #6	3619917	Растениеводство (folder)/Семена и луковичные	3865583	НК
3902815	4602066731773	Семена мирабилис ялапа #7	3619917	Растениеводство (folder)/Семена и луковичные	3865583	НК
3902816	4602066740157	Семена мирабилис ялапа #8	3619917	Растениеводство (folder)/Семена и луковичные	3865583	НК
3902817	4602066780504	Семена мирабилис ялапа #9	3619917	Растениеводство (folder)/Семена и луковичные	3865583	НК
5076577	4601887323662	Семена мискантус уиндин	4990039	Растениеводство (folder)/Семена цветы	0	
823828	4601887112365	Семена многолетник примула бесстебельная потсдамские гиганты мягуп 0.05g	324395	Растениеводство (folder)/Семена	0	
823830	4601887112372	Семена многолетник примула высокая колоссея мягуп 0.05g	324395	Растениеводство (folder)/Семена	0	
3517748	4601887112389	Семена многолетник хризантема корейская смесь мягуп 0.04g	324395	Растениеводство (folder)/Семена	0	
822818	4601887111313	Семена молодило кровельное цв/п 0.01g (поиск)	324395	Растениеводство (folder)/Семена	0	
325048	4601729051388	Семена монарда лимонный аромат (а)	324395	Растениеводство (folder)/Семена	0	
822821	6017290094958	Семена монарда лимонный аромат 0.02g цв/п 10/ (а) Россия--- прян.	324395	Растениеводство (folder)/Семена	0	
5076578	5200118210932	Семена моринги, неочищенные, органические, 100g, тм kurtes	1	Неклассифицированные/default	4999058	Kurtes
3902829	4601819120628	Семена моркови трофи	3619917	Растениеводство (folder)/Семена и луковичные	0	
822836	4601887101529	Семена морковь (драж.семена) шантенэ роял 300шт цв/п 10/ (поиск) США	324395	Растениеводство (folder)/Семена	0	
822837	4601887115380	Семена морковь (на ленте) амстердамска 8m цв/п 5/ (поиск) Франция	324395	Растениеводство (folder)/Семена	0	
822853	4601887101567	Семена морковь (на ленте) шантенэ роял (поиск) 8m цв/п 5/ (поиск) Франция	324395	Растениеводство (folder)/Семена	3517971	Поиск
822854	4601887101550	Семена морковь (на ленте) ярославна 8m цв/п 5/ (поиск) Германия	324395	Растениеводство (folder)/Семена	0	
822855	4601887101000	Семена морковь амстердамска 2g б/п 20/ (поиск) Франция	324395	Растениеводство (folder)/Семена	3517971	Поиск
822856	4601729056468	Семена морковь амстердамска ламинат (а) Россия	324395	Растениеводство (folder)/Семена	0	
3517749	4650001406415	Семена морковь Анастасия ц/п	324395	Растениеводство (folder)/Семена	0	
822858	4601729040351	Семена морковь барыня 2g ламинат 10/ (а) Россия	324395	Растениеводство (folder)/Семена	0	
3517750	4602066230108	Семена морковь без сердцевины 2g	324395	Растениеводство (folder)/Семена	0	
325049	4601729050138	Семена морковь безсердцевидная (дражже) (а)	324395	Растениеводство (folder)/Семена	0	
822861	4601729056475	Семена морковь берликум роял ламинат л/п*2 (а) Россия	324395	Растениеводство (folder)/Семена	0	
822863	6017290501388	Семена морковь бессердцевидная др (а)	324395	Растениеводство (folder)/Семена	0	
822864	4601887137979	Семена морковь вита лонга 0.5g лидер (поиск)	324395	Растениеводство (folder)/Семена	0	
822865	4601826002559	Семена морковь витаминная - 6 (пак 2g) - 100шт/кор Green belt	324395	Растениеводство (folder)/Семена	324438	Green Belt
822866	4601826006700	Семена морковь витаминная 6 (драж семена) 300шт Green belt	324395	Растениеводство (folder)/Семена	324438	Green Belt
822867	4601826006595	Семена морковь витаминная 6 (лента) (8m) Green belt	324395	Растениеводство (folder)/Семена	324438	Green Belt
822870	6018870243858	Семена морковь витаминная 6 2g б/п 20/ (поиск) Франция	324395	Растениеводство (folder)/Семена	0	
822874	4601729005060	Семена морковь витаминная 6 б/п 2g 20/ (а) Россия хит	324395	Растениеводство (folder)/Семена	0	
822875	4601729056482	Семена морковь витаминная 6 ламинат л/п*2 (а) Россия	324395	Растениеводство (folder)/Семена	0	
822877	4601729064012	Семена морковь гигант росса лидер 10/ (а) Россия	324395	Растениеводство (folder)/Семена	0	
822878	4601729043567	Семена морковь голландка 1g ламинат (а) Россия	324395	Растениеводство (folder)/Семена	0	
822880	4601729038426	Семена морковь дарина лента (а)	324395	Растениеводство (folder)/Семена	0	
822882	4601729039409	Семена морковь деликатесная (лента) 8m (а) Россия	324395	Растениеводство (folder)/Семена	0	
822883	4601729044120	Семена морковь деликатесная 300шт дражже 5/ (а) Россия	324395	Растениеводство (folder)/Семена	0	
822884	017290329438	Семена морковь деликатесная б/п 2g 20/ (а) Россия	324395	Растениеводство (folder)/Семена	0	
822885	4601729057311	Семена морковь десертная ламинат 10/ (а) Россия	324395	Растениеводство (folder)/Семена	0	
822886	4601826010202	Семена морковь детская (дражже) (пак 300шт) Green belt	324395	Растениеводство (folder)/Семена	324438	Green Belt
822887	4601826010080	Семена морковь детская (лента 8m) (грин белт)	324395	Растениеводство (folder)/Семена	0	
