ID	UPCEAN	Name	CategoryID	CategoryName	BrandID	BrandName
274331	4607125980239	Спрей multi clean-для бытовой техники, 250 млспрей multi clean 250ml	6693	Хозяйственные товары (folder)/Бытовая химия (folder)/Чистящие моющие средства	0	
3538144	7630014919253	Спрей nadzor от комаров москитов мошек слепней 100ml пл/уп	1	Неклассифицированные/default	0	
5081340	4381021003185	Спрей nexxt 250ml масло арганы	225	Уход за волосами (folder)/Моделирование прически	0	
5081341	4381021001396	Спрей nexxt 250ml увлажн,питание,защита	225	Уход за волосами (folder)/Моделирование прически	0	
3538145	4620767190781	Спрей nita-Farm септо для животных 100ml	1	Неклассифицированные/default	0	
274332	4607125980178	Спрей notebook clean 250ml	6693	Хозяйственные товары (folder)/Бытовая химия (folder)/Чистящие моющие средства	0	
121824	4022583143024	Спрей office point для доски 600260	2	Канцелярские товары (folder)/Канцелярские товары	471965	Office Point
5740379	4712764550047	Спрей oral-relax для домашних животных oral-relax	5129951	косметика для животных гигиеническая	5311707	vetdicate
1083006	4680007201592	Спрей organik с маслом чайного дерева для всех кухонных поверхностей 500ml пл/бут	1	Неклассифицированные/default	1082974	Organic people
636743	5410076494378	Спрей Pantene Pro-v мгновенное укрепление и блеск для окрашеных волос 150ml	28	Уход за волосами (folder)/Уход за волосами	12837	Pantene Pro-V
525236	4607044240032	Спрей parity для чистки оргтехники и компьютеров 150ml	6693	Хозяйственные товары (folder)/Бытовая химия (folder)/Чистящие моющие средства	519782	Parity
2774139	4607145634181	Спрей pchelodar professional для нейтрализации неприятных запахов и удаления пятен от домашних животных 500ml	1	Неклассифицированные/default	4862253	Пчелодар
3538146	4820185020077	Спрей picnic Baby от комаров с экстрактом ромашки 120ml тв/уп	1	Неклассифицированные/default	3779173	Арнест PICNIC
3538147	4260145996828	Спрей Power wash пятновыводитель 750ml п/б	1	Неклассифицированные/default	0	
3538148	4607057634101	Спрей priz от грибка и плесени 500ml	1	Неклассифицированные/default	3672594	HOME SANITAR (VIZIR COMPANY Z-D BYT.KHIMII/CHELYABINSK)
2310045	4690471021640	Спрей prodent ягодный фреш для полости рта арт ос002	203	Гигиена (folder)/Уход за зубами и ртом (folder)/Уход за зубами и ртом	2310015	D.i.e.s
274333	4607125980192	Спрей profi clean 250ml	6693	Хозяйственные товары (folder)/Бытовая химия (folder)/Чистящие моющие средства	0	
3538149	8801549200928	Спрей profitom 3000 мягкий очиститель интерьера автомобиля. 600ml пл/бут	1	Неклассифицированные/default	0	
5740380	4606453057286	Спрей push-up для прикорневого объема волос Estel airex сильная фиксация, 100ml apu100	225	Уход за волосами (folder)/Моделирование прически	5149377	estel professional
3538150	4068400001146	Спрей reinex для чистки ковров 750ml	1	Неклассифицированные/default	0	
2673619	5000204839128	Спрей Salamander краска-восстановитель цвета для изделий из замши и нубука жб 250ml	1	Неклассифицированные/default	3255	Salamander
5740381	5000204110593	Спрей Salamander экстра-защита от воды для кроссовок и повседневной обуви, 200ml 5000204110593	594	Хозяйственные товары (folder)/Уход за обувью	3255	Salamander
121843	8032487101453	Спрей Salton для гл.кожи восст черн 300ml	594	Хозяйственные товары (folder)/Уход за обувью	21929	Salton
121844	8032487101422	Спрей Salton для замши восст.коричн 300ml	594	Хозяйственные товары (folder)/Уход за обувью	21929	Salton
121846	8032487101583	Спрей Salton универсал.водоотталк.250ml	594	Хозяйственные товары (folder)/Уход за обувью	21929	Salton
3200752	4003583187669	Спрей sanosan для легкого расчесывания волос 125ml 089805 sanosan	1	Неклассифицированные/default	411814	Sanosan
3538151	4607149980291	Спрей sauvage натуральный 16ml	1	Неклассифицированные/default	0	
5081343	4015100214581	Спрей Schwarzkopf taft 150ml естеств.блеск	225	Уход за волосами (folder)/Моделирование прически	2135	Schwarzkopf Taft
274334	4607125980154	Спрей screen clean 250ml	6693	Хозяйственные товары (folder)/Бытовая химия (folder)/Чистящие моющие средства	0	
5740382	5420031900790	Спрей show tech denti-dazzle для ухода за зубами животных 50мл	1369168	Товары для животных (folder)/Гигиена животных	5298589	show tech
5740383	5420031900103	Спрей show tech grande finale Hair spray для фиксации для животных 100мл	1369168	Товары для животных (folder)/Гигиена животных	5298589	show tech
5740384	4640006309767	Спрей shuster охотник от комаров, клещей, слепней, мошек 15мл 37-3701	102	Борьба с насекомыми и грызунами/Средства против насекомых	5249743	shuster
5740385	4640006309736	Спрей shuster охотник от комаров, клещей, слепней, мошек 50ml 37-3702	102	Борьба с насекомыми и грызунами/Средства против насекомых	5249743	shuster
831227	4605370003246	Спрей Silver Care без фтора без спирта 20ml (мята-лимон) Россия	1	Неклассифицированные/default	0	
831228	4605370003253	Спрей Silver Fresh c фтором 20ml Россия	1	Неклассифицированные/default	0	
2260036	8690757902331	Спрей Silver premium 250ml для всех типов изд. универсальный водоотталкивающий+25%бесплатно промо	1	Неклассифицированные/default	279806	Silver Premium
2925067	8690757005469	Спрей Silver sa2101-00 универсальная защита и уход для всех видов кожи и текстиля, 250ml 8690757005469	1	Неклассифицированные/default	3211	Silver
2260037	8690757002741	Спрей Silver si2201-00 защита от воды для всех видов кожи и текстиля, бесцветный, 250ml + 20% 8690757002741	1	Неклассифицированные/default	279806	Silver Premium
4951446	8690757005933	Спрей Silver si2502-00 экстра защита от воды для всех видов кожи и текстиля, 250ml 8690757005933	1	Неклассифицированные/default	3211	Silver
2925065	8690757005452	Спрей Silver st2101-00 защита от соли и реагентов для всех видов кожи и текстиля, 250ml 8690757005452	1	Неклассифицированные/default	3750671	SILVER (CHIGIR KIMYA/TURKEY)
4856169	4607083725262	Спрей smart кровоост 50ml	241824	Лекарственные средства (folder)/Аптека	0	
121805	8841680003743	Спрей snowmen конфетти 6цв 250ml	28	Уход за волосами (folder)/Уход за волосами	0	
3538152	4895151857346	Спрей stopper для полости рта от запаха табака и алкоголя 10ml	1	Неклассифицированные/default	0	
3538153	4895151857315	Спрей stopper от курения для полости рта 10ml	1	Неклассифицированные/default	0	
274336	4607125980161	Спрей Super clean - для пластика и металла, 250ml	6693	Хозяйственные товары (folder)/Бытовая химия (folder)/Чистящие моющие средства	0	
2488629	4607074281197	Спрей techpoint для ухода за компьютерной техникой 200ml, антибакт удаляет пыль, предотвращает образование отпечатков. входящий	1	Неклассифицированные/default	3759398	TECHPOINT
2210591	4660003391466	Спрей top house чистящий для холодильников 750ml	6693	Хозяйственные товары (folder)/Бытовая химия (folder)/Чистящие моющие средства	430699	Top House
3538154	5903792746185	Спрей trish для мытья окон зеленый 500ml п/б	1	Неклассифицированные/default	0	
5740386	645095002197	Спрей tropiclean Fresh breath свежее дыхание для чистки зубов для собак 118мл 69765	5129951	косметика для животных гигиеническая	1632834	Tropiclean
1385326	4650058300056	Спрей unicum для чистки ковров и мягкой мебели (не требует смывания водой) 500ml	1	Неклассифицированные/default	1980127	Unicum
2841912	4650058303736	Спрей unicum жироудалитель гризли (сверхмощный, в виде пенки, с запахом мяты) 500ml	1	Неклассифицированные/default	1980127	Unicum
2842211	4650058305655	Спрей vaily чистящий спрей (для кухни) эко бытовая химия, 500ml	6693	Хозяйственные товары (folder)/Бытовая химия (folder)/Чистящие моющие средства	3766272	VAILY
3538156	5902101517331	Спрей venita 1-Day синий 50ml	1	Неклассифицированные/default	3334986	Venita
121777	8009150185126	Спрей venus антицел.мультиактив 250ml	5586	Косметика (folder)/Косметика	0	
121778	8009150100280	Спрей venus антицел.эфф.дренажа 200ml	5586	Косметика (folder)/Косметика	0	
180913	8697422821300	Спрей vilo краска-восстановитель для замши и нубука черный жб 200ml	180898	Хозяйственные товары (folder)/Бытовая химия (folder)/Средство для ухода за изделиями из кожи	666117	VILO
3538157	4690471078637	Спрей vister универсальный водоотталкивающий 300ml	1	Неклассифицированные/default	0	
5740387	4605632246466	Спрей vitateka пантенол пена с гиалуроновой кислотой 58г 228079	5248998	лечебные кремы, мази, бальзамы, лосьоны и лаки	4990156	Витатека
5740388	5499899069314	Спрей wunderbar shape it!, 500ml (69314)	1	Неклассифицированные/default	5233579	Wunderbar
5740389	4047379114200	Спрей wunderbar уход и увлажнение волос 200ml (114200)	1	Неклассифицированные/default	5233579	Wunderbar
5740390	5060322953946	Спрей yardley London april violets 200ml (5060322953946)	1	Неклассифицированные/default	0	
5740391	5060322953915	Спрей yardley London English Lavender 200ml (5060322953915)	1	Неклассифицированные/default	0	
5740392	5060322953922	Спрей yardley London yardley Lily of the Valley 200ml (5060322953922)	1	Неклассифицированные/default	0	
3538158	4607112040311	Спрей zanzara от камаров	1	Неклассифицированные/default	0	
2420195	3518646057991	Спрей а-церумен средство многофункциональное отоларинголог для промывания ушного прохода 40ml №1 513072753	241824	Лекарственные средства (folder)/Аптека	4862255	Nycomed
5740393	4603586007645	Спрей авз (агроветзащита) ранозоль, для лечения ран и антисептической обработки кожи животных, 80мл 75257	210391	Лекарственные средства (folder)/Лекарственные средства	672683	Агроветзащита
174927	4810151009953	Спрей автозагар 100ml	3702	Косметика (folder)/Загар и защита от солнца	174920	Bielita СОЛЯРИС
121821	4005808854691	Спрей автозагар Nivea 125ml	5586	Косметика (folder)/Косметика	398	NIVEA
3538159	4607005527028	Спрей адрилан для очищения смесителей и кафеля от ржавчины 500ml пл/б	1	Неклассифицированные/default	3608930	ADRILAN (ADRIYA I K/SPB)
4970303	4660077130268	Спрей аквасол морская вода 50ml цб-00007124	2418507	Изделия медицинского назначения (folder)/Изделия медицинского назначения	5032543	мирролла
4970302	4660077130244	Спрей аквасол морская вода и алоэ 50ml цб-00007135	1	Неклассифицированные/default	5032543	мирролла
5740394	4660077130237	Спрей аквасол морская вода и пантенол 50ml цб-00007136	5248149	лечение органов чувств, горла, зрения и слуха	5032543	мирролла
5740395	4660077130251	Спрей аквасол морская вода, гиалуроновая кислота и эктоин 50ml цб-00007137	5248149	лечение органов чувств, горла, зрения и слуха	5032543	мирролла
121803	5900793010260	Спрей активатор загара kolastyna 150ml	5586	Косметика (folder)/Косметика	384459	Kolastyna
326780	5023534010722	Спрей аламицин 140g	309254	Товары для животных (folder)/Ветеринарные препараты (folder)/Ветеринарные препараты Антибактериальные	0	
2714834	4100420075339	Спрей алюмин liqui moly aluminium-spray 0.4л 7533 liquimoly	300445	Эксплуатация и ремонт автомобилей/Автомобильные принадлежности	619297	Liqui Moly
525238	6931227000082	Спрей антибакт тм лонгевита (longevita) спрей 8ml	1	Неклассифицированные/default	0	
1313398	5900998022228	Спрей антижир cussons E boom 750ml	1	Неклассифицированные/default	0	
5740396	4100420016158	Спрей антикор для садового инвентаря liqui moly pflege-spray fur garten-gerate 300ml 1615 liquimoly	5245602	средства для антикоррозионной и защитной обработки	619297	Liqui Moly
5223759	4814628010145	Спрей антимикробный suprim 0.4л	5147514	средства для ухода за бытовой техникой	3757515	SUPRIM
5740397	4606531205899	Спрей антисептик clean Home для уборки за животными, удаление запахов, 500ml 4606531205899	6693	Хозяйственные товары (folder)/Бытовая химия (folder)/Чистящие моющие средства	5245392	clean home
761427	4603586002800	Спрей антисептический ранозаживляющий авз (агроветзащита) мигстим для живтоных 100ml 69479	337596	Товары для животных (folder)/Pets	672683	Агроветзащита
238582	4019114303569	Спрей антистатик defender 250ml	265563	Техника (folder)/Электротехника (folder)/Цифровая техника (folder)/Компьютерные аксессуары	0	
122517	4600104007743	Спрей арнест picnic Baby от комаров,мокрецов,москитов с экстрактом ромашки от 1 года 120ml /30 Россия	102	Борьба с насекомыми и грызунами/Средства против насекомых	37985	Пикник(сопут)
3538193	4600104032509	Спрей арнест Прелесть professional эффект ламинирования для укладки 225ml	1	Неклассифицированные/default	38122	Арнест Прелесть
831257	4810153011657	Спрей аромат модница 100ml	1	Неклассифицированные/default	4241	Bielita
5740398	8436551848198	Спрей ароматический для дома ambientair lacrosse грейпфрут, 100ml sp100pnlc	5246849	ароматы для дома	5330391	ambientair
5740399	8436551848136	Спрей ароматический для дома ambientair lacrosse дерево и тонка, 100ml sp100wtlc	5246849	ароматы для дома	5330391	ambientair
5740400	8435474410635	Спрей ароматический для дома ambientair lacrosse сандал и бергамот, 100ml sp100sblc	5246849	ароматы для дома	5330391	ambientair
5740401	8435474410659	Спрей ароматический для дома ambientair lacrosse термальный источник, 100ml sp100twlc	5246849	ароматы для дома	5330391	ambientair
2757840	692332620089	Спрей ассортим Маша и медведь и Disney 20ml	330591	Продукты питания (folder)/Продукты питания	0	
5740402	4750701112163	Спрей аттрактант feeder concept карась 50ml fc102-05	5246926	прикормки для рыбалки	5246927	feeder concept
5740403	4750701112170	Спрей аттрактант feeder concept карп-карась 50ml fc102-06	5246926	прикормки для рыбалки	5246927	feeder concept
5740404	4750701112132	Спрей аттрактант feeder concept лещ 50ml fc102-02	5246926	прикормки для рыбалки	5246927	feeder concept
5740405	4750701112156	Спрей аттрактант feeder concept лещ-плотва 50ml fc102-04	5246926	прикормки для рыбалки	5246927	feeder concept
5740406	4750701112149	Спрей аттрактант feeder concept плотва 50ml fc102-03	5246926	прикормки для рыбалки	5246927	feeder concept
5740407	4750701112125	Спрей аттрактант feeder concept фидер 50ml fc102-01	5246926	прикормки для рыбалки	5246927	feeder concept
1313399	4650058301275	Спрей баги супер кожа для чистки кожи 500ml	25023	Хозяйственные товары (folder)/Бытовая химия (folder)/Бытовая химия	17597	BAGI
121819	4606982002146	Спрей бальзам mosquitall после укусов с экстрактом ромашки 50ml	102	Борьба с насекомыми и грызунами/Средства против насекомых	18359	Арнест Mosquitall
5740409	4650056490728	Спрей бальзам mosquitall скорая помощь после укусов 50ml 4650056490728	102	Борьба с насекомыми и грызунами/Средства против насекомых	4935657	Mosquitall
3538160	4605508001786	Спрей бальзам Радуга для обуви из искуственной кожи 120ml пл/б	1	Неклассифицированные/default	0	
525240	403586000417	Спрей барс для кошек от блох 100ml	1	Неклассифицированные/default	0	
5740410	4603586008079	Спрей барс инсектоакарицидный для грызунов,флакон в коробке 100ml 69310	5248129	защита от блох и клещей	672683	Агроветзащита
326781	4603586005160	Спрей барс инсектоакарицидный для кошек, 100ml флакон в коробке агроветзащита (1x18) 773	1816058	Товары для животных (folder)/Ветеринарные препараты (folder)/Ветеринарные препараты противопаразитарные	672683	Агроветзащита
831229	4603586003548	Спрей барс инсектоакарицидный для собак 200ml агроветзащита (1x24) 269	565199	Товары для животных (folder)/Ветеринарные препараты (folder)/Ветеринарные препараты для собак	672683	Агроветзащита
831230	4603586004804	Спрей барс форте инсектоакарицидный для кошек, 100ml (на основе фипронила) агроветзащита (1x18) 736	565273	Товары для животных (folder)/Ветеринарные препараты (folder)/Ветеринарные препараты для кошек	672683	Агроветзащита
831231	4603586004798	Спрей барс форте инсектоакарицидный для собак 100ml (на основе фипронила) агроветзащита (1x18) 737	565199	Товары для животных (folder)/Ветеринарные препараты (folder)/Ветеринарные препараты для собак	672683	Агроветзащита
3538161	4607055500583	Спрей био вакс от блох и клещей для котят и щенков 150ml	1	Неклассифицированные/default	0	
326783	4607055500811	Спрей биовакс блистать?да! для мелких жив-ных 180ml уход за шерстью	1780133	Товары для животных (folder)/Косметика для животных	0	
3538162	4607055500682	Спрей биовакс для щенков и собак грызть?да 180ml	1	Неклассифицированные/default	0	
326787	8594004855633	Спрей биокубатол 160ml	309254	Товары для животных (folder)/Ветеринарные препараты (folder)/Ветеринарные препараты Антибактериальные	0	
525291	4015000933391	Спрей блеск Syoss blond&highlights 200ml для светлых/мелир	28	Уход за волосами (folder)/Уход за волосами	14746	SYOSS
121858	4015000535854	Спрей блеск Syoss Shine boost 200ml для ломких/тусклых	28	Уход за волосами (folder)/Уход за волосами	14746	SYOSS
2930850	4620018853502	Спрей блеск для поверхностей mr.sanitar 500ml (17) 397	1	Неклассифицированные/default	0	
1702021	5904517067639	Спрей вiд комарiв 2в1+захист вiд сонця 10+ 50ml репелент.зас. bros	102	Борьба с насекомыми и грызунами/Средства против насекомых	0	
5740411	4605370012620	Спрей венотол zd для ног 100ml 60160	5248998	лечебные кремы, мази, бальзамы, лосьоны и лаки	5001708	Зеленая дубрава
121859	4003583073825	Спрей воск Happy Hair для укладки волос блист.эфф.150ml	28	Уход за волосами (folder)/Уход за волосами	49448	Флэчманн
2767464	6417150005528	Спрей восстановитель волос sim Sensitive System 4 терапевтический, с хитозаном r, 200ml 5308_sim Sensitive	1	Неклассифицированные/default	5249936	sim sensitive
15650	4015000524346	Спрей выпрямляющий нежность шелка сильной фиксации	225	Уход за волосами (folder)/Моделирование прически	2135	Schwarzkopf Taft
326793	4607055500545	Спрей голд-Премиум тоник от колтунов для кошек	1780133	Товары для животных (folder)/Косметика для животных	0	
326794	4607055500569	Спрей голд-Премиум тоник от колтунов для собак	1780133	Товары для животных (folder)/Косметика для животных	0	
3538165	4607043209429	Спрей дарики-дарики для защиты от укусов комаров москитов и мокрецов 20ml	1	Неклассифицированные/default	3641197	DARIKI-DARIKI
3538166	9907076040071	Спрей дачник для растений 100ml	1	Неклассифицированные/default	0	
