ID	UPCEAN	Name	CategoryID	CategoryName	BrandID	BrandName
1463460	076174760590	Stanley fatmax blade 100pk 11-700akb	41797	Инструменты (folder)/Инструмент	306099	Stanley
1463461	076174760583	Stanley fatmax blade 50pk 11-700lkb	41797	Инструменты (folder)/Инструмент	306099	Stanley
1463462	076174163278	Stanley fatmax brick set 3inch w/guardm 16-327	41797	Инструменты (folder)/Инструмент	306099	Stanley
1463463	076174163285	Stanley fatmax brick set 4inch w/guardm 16-328	41797	Инструменты (folder)/Инструмент	306099	Stanley
1032909	076174105551	Stanley fatmax carpet knife bad 10-555	41797	Инструменты (folder)/Инструмент	306099	Stanley
5221895	3253560104818	Stanley fatmax cartridge 180mm (0-10-481)	1	Неклассифицированные/default	306099	Stanley
1463464	076174471403	Stanley fatmax chalk Line reel mad 47-140l	41797	Инструменты (folder)/Инструмент	306099	Stanley
576681	076174476811	Stanley fatmax chalkline w/lvl mdd 47-681	41797	Инструменты (folder)/Инструмент	306099	Stanley
1463465	076174163315	Stanley fatmax chsl flr 3x 11inch w/gr d 16-331	41797	Инструменты (folder)/Инструмент	306099	Stanley
1463466	076174691887	Stanley fatmax clip-n-grip scdrvr 69-188m	41797	Инструменты (folder)/Инструмент	306099	Stanley
1463467	076174163292	Stanley fatmax cncrt chsl 3/4inch w/grmd 16-329	41797	Инструменты (folder)/Инструмент	306099	Stanley
1463468	076174163322	Stanley fatmax cold chsl 1inch w/gr dm 16-332	41797	Инструменты (folder)/Инструмент	306099	Stanley
649045	076174172058	Stanley fatmax compass saw 12inch 9 tpia 17-205	41797	Инструменты (folder)/Инструмент	306099	Stanley
4696637	076174436808	Stanley fatmax Extreme 8' / 96inch i-Beam level	1	Неклассифицированные/default	0	
614765	076174107999	Stanley fatmax fixed bld knife dmad 10-799	41797	Инструменты (folder)/Инструмент	306099	Stanley
1463469	076174107807	Stanley fatmax fixed blf utlty knif 10-780	41797	Инструменты (folder)/Инструмент	306099	Stanley
1463470	076174514018	Stanley fatmax frame hmmr 22oz ac 51-401	41797	Инструменты (folder)/Инструмент	306099	Stanley
1463471	076174514032	Stanley fatmax frme hmr w/ovr amd 51-403	41797	Инструменты (folder)/Инструмент	306099	Stanley
1463472	076174519419	Stanley fatmax hmr antv claw 16ozmd 51-941	41797	Инструменты (folder)/Инструмент	306099	Stanley
1463473	076174514025	Stanley fatmax hmr Mill 22oz cdad 51-402	41797	Инструменты (folder)/Инструмент	306099	Stanley
1463474	076174514087	Stanley fatmax hmr Mill 22oz d 51-408	41797	Инструменты (folder)/Инструмент	306099	Stanley
1463475	076174105100	Stanley fatmax hook knife d 10-510	41797	Инструменты (folder)/Инструмент	306099	Stanley
649055	076174205565	Stanley fatmax jab saw ddmac 20-556	41797	Инструменты (folder)/Инструмент	306099	Stanley
614773	076174107777	Stanley fatmax lck/ret knife utility add 10-777	41797	Инструменты (folder)/Инструмент	306099	Stanley
1463476	076174435245	Stanley fatmax level 24inch a 43-524	41797	Инструменты (folder)/Инструмент	306099	Stanley
1039971	076174435726	Stanley fatmax level 72inch a 43-572	41797	Инструменты (folder)/Инструмент	306099	Stanley
1463477	076174435061	Stanley fatmax level mag 48inch ma 43-506	41797	Инструменты (folder)/Инструмент	306099	Stanley
618184	076174435009	Stanley fatmax lvl boxbeam 24inch amd 43-500	41797	Инструменты (folder)/Инструмент	306099	Stanley
1463478	076174945362	Stanley fatmax lvl w/case 48inch 6-dis 94-536d	41797	Инструменты (folder)/Инструмент	306099	Stanley
1463479	076174435252	Stanley fatmax mag level 24inch a 43-525	41797	Инструменты (folder)/Инструмент	306099	Stanley
1463480	076174435498	Stanley fatmax mag level 48inch a 43-549	41797	Инструменты (folder)/Инструмент	306099	Stanley
1463481	076174932928	Stanley fatmax mobile project cntr 93-292	41797	Инструменты (folder)/Инструмент	306099	Stanley
626982	076174942101	Stanley fatmax mobile workstation m sts 020800r	41797	Инструменты (folder)/Инструмент	306099	Stanley
1463482	076174163346	Stanley fatmax msn chl2-3/4inch w/gr md 16-334	41797	Инструменты (folder)/Инструмент	306099	Stanley
1463483	076174163339	Stanley fatmax msn chsl1-3/4inch w/grmd 16-333	41797	Инструменты (folder)/Инструмент	306099	Stanley
1039965	076174435481	Stanley fatmax non-mag level 48inch a 43-548	41797	Инструменты (folder)/Инструмент	306099	Stanley
1463484	076174939514	Stanley fatmax open tote 18inch m sts 518160m	41797	Инструменты (folder)/Инструмент	306099	Stanley
602630	076174200454	Stanley fatmax pnl saw 15inch 9 pt madc 20-045	41797	Инструменты (folder)/Инструмент	306099	Stanley
1463486	076174620016	Stanley fatmax scdrv set 6pcs d 62-001	41797	Инструменты (folder)/Инструмент	306099	Stanley
1463487	076174760545	Stanley fatmax snp off blds 18mm 11-718tkb	41797	Инструменты (folder)/Инструмент	306099	Stanley
1360062	076174169744	Stanley fatmax ss chsl 3/8inch 16-974	41797	Инструменты (folder)/Инструмент	306099	Stanley
1463489	076174169768	Stanley fatmax ss chsl 5/8inch 16-976	41797	Инструменты (folder)/Инструмент	306099	Stanley
661151	076174939446	Stanley fatmax strc Foam tool bx 28inch sts 028001l	41797	Инструменты (folder)/Инструмент	306099	Stanley
1463490	076174337167	Stanley fatmax tape 1-1/4inch x 16' ma 33-716	41797	Инструменты (folder)/Инструмент	306099	Stanley
1119374	076174337259	Stanley fatmax tape 1-1/4inch x 25' dma 33-725	41797	Инструменты (folder)/Инструмент	306099	Stanley
647384	076174337303	Stanley fatmax tape 1-1/4inch x 30' mad 33-730tp	41797	Инструменты (folder)/Инструмент	306099	Stanley
658348	076174337358	Stanley fatmax tape 1-1/4inch x 35' dmac 33-735	41797	Инструменты (folder)/Инструмент	306099	Stanley
658364	076174341300	Stanley fatmax tape 3/8inch x 100'ss mad 34-130	41797	Инструменты (folder)/Инструмент	306099	Stanley
1119368	076174341294	Stanley fatmax tape 3/8inch x 50' ss p 34-129	41797	Инструменты (folder)/Инструмент	306099	Stanley
1463491	076174337402	Stanley fatmax tape retra 40' dg 33-740	41797	Инструменты (folder)/Инструмент	306099	Stanley
1463492	076174939521	Stanley fatmax technician tool bagm sts 511150m	41797	Инструменты (folder)/Инструмент	306099	Stanley
1463493	076174625639	Stanley fatmax torx 3inch bld t 10x 8inch d 62-563	41797	Инструменты (folder)/Инструмент	306099	Stanley
1463494	076174625646	Stanley fatmax torx 3inch bld t 15x 8inch d 62-564	41797	Инструменты (folder)/Инструмент	306099	Stanley
1463495	076174625660	Stanley fatmax trx 4inch bld t 25x8-3/4d 62-566	41797	Инструменты (folder)/Инструмент	306099	Stanley
5221897	3253560626488	Stanley fatmax vde 1000v ph 1x100mm ph 2x125 mm (fmht0-62648)	344583	Инструменты (folder)/Отвертка	306099	Stanley
1463496	076174169058	Stanley fatmax wd chsl cg 1/2inch dmad 16-905	41797	Инструменты (folder)/Инструмент	306099	Stanley
1463497	076174169034	Stanley fatmax wd chsl cg 1/4inch dmad 16-903	41797	Инструменты (folder)/Инструмент	306099	Stanley
988257	076174162547	Stanley fatmax Wood chisel 1/2inch ss	41797	Инструменты (folder)/Инструмент	306099	Stanley
988256	076174162615	Stanley fatmax Wood chisel 1inch ss	41797	Инструменты (folder)/Инструмент	306099	Stanley
988258	076174169072	Stanley fatmax Wood chisel 3/4inch ss	41797	Инструменты (folder)/Инструмент	306099	Stanley
5221900	3253561478215	Stanley fatmax xl 225g	5165942	разметочные карандаши, маркеры, шнуры	306099	Stanley
1463498	076174474800	Stanley fatmax xtreme 100'chlk rl d 47-480	41797	Инструменты (folder)/Инструмент	306099	Stanley
1463499	076174338850	Stanley fatmax xtreme 16' tape 33-885	41797	Инструменты (folder)/Инструмент	306099	Stanley
658362	076174338904	Stanley fatmax xtreme 25' tape 33-890	41797	Инструменты (folder)/Инструмент	306099	Stanley
1463500	076174338959	Stanley fatmax xtreme 30' tape 33-895	41797	Инструменты (folder)/Инструмент	306099	Stanley
658341	076174339000	Stanley fatmax xtreme 35'tape m 33-900	41797	Инструменты (folder)/Инструмент	306099	Stanley
1463501	076174474824	Stanley fatmax xtreme chalkline set 47-482l	41797	Инструменты (folder)/Инструмент	306099	Stanley
1463502	076174474879	Stanley fatmax xtreme chalklne setm 47-487l	41797	Инструменты (folder)/Инструмент	306099	Stanley
1463503	076174675467	Stanley fatmax xtreme dmo dr.2pcs m 67-546	41797	Инструменты (folder)/Инструмент	306099	Stanley
1163390	076174108163	Stanley fatmax xtreme fixed knife 10-816	41797	Инструменты (folder)/Инструмент	306099	Stanley
1463504	076174473124	Stanley fatmax xtreme fn mrkr blk d 47-312	41797	Инструменты (folder)/Инструмент	306099	Stanley
1463505	076174550993	Stanley fatmax xtreme fubar 64oz 55-099	41797	Инструменты (folder)/Инструмент	306099	Stanley
1463506	076174551204	Stanley fatmax xtreme fubar iii w/r 55-120	41797	Инструменты (folder)/Инструмент	306099	Stanley
1463507	076174511635	Stanley fatmax xtreme hmr 16 ozanti-sta 51-163	41797	Инструменты (folder)/Инструмент	306099	Stanley
1010294	076174511659	Stanley fatmax xtreme hmr 20oz anti 51-165	41797	Инструменты (folder)/Инструмент	306099	Stanley
1010295	076174511772	Stanley fatmax xtreme hmr 22oz antid 51-177	41797	Инструменты (folder)/Инструмент	306099	Stanley
1463508	076174511673	Stanley fatmax xtreme hmr anti-vb d 51-167	41797	Инструменты (folder)/Инструмент	306099	Stanley
1463509	076174436099	Stanley fatmax xtreme mag trpd lev 43-609	41797	Инструменты (folder)/Инструмент	306099	Stanley
1463510	076174473155	Stanley fatmax xtreme mrkr mlt-clrd 47-315	41797	Инструменты (folder)/Инструмент	306099	Stanley
1463511	076174474961	Stanley fatmax xtreme quick spike d 47-496	41797	Инструменты (folder)/Инструмент	306099	Stanley
1163387	076174108156	Stanley fatmax xtreme retr.knife 10-815	41797	Инструменты (folder)/Инструмент	306099	Stanley
1463512	076174108170	Stanley fatmax xtreme snap-off knfm 10-817	41797	Инструменты (folder)/Инструмент	306099	Stanley
1463513	076174939576	Stanley fatmax xtreme xl open totem sts 501500m	41797	Инструменты (folder)/Инструмент	306099	Stanley
5221901	3253561829611	Stanley fmst82961-1	1	Неклассифицированные/default	306099	Stanley
4696638	9059154903942	Stanley folding hex key set	1	Неклассифицированные/default	0	
1358508	076174101096	Stanley folding safety knife 10-784	41797	Инструменты (folder)/Инструмент	306099	Stanley
1358511	076174108552	Stanley folding utility knife 10-855	41797	Инструменты (folder)/Инструмент	306099	Stanley
4696639	3253561422348	Stanley france sas 600mm stanley Spirit level	1	Неклассифицированные/default	0	
4696640	3253561927904	Stanley france sas mobile contractor Box	1	Неклассифицированные/default	0	
4696641	3253561420764	Stanley france sas stanley 1.2m Spirit level	1	Неклассифицированные/default	0	
2204635	9311043803185	Stanley fruity lexia 4l	2027426	Продукты питания (folder)/Алкогольные напитки/Cask	0	
4696642	702404048779	Stanley furniture bachelor chest w/ marble	1	Неклассифицированные/default	0	
4696643	702404027835	Stanley furniture slat side chair	1	Неклассифицированные/default	0	
1615212	070394016338	Stanley Garden util pls glv-large	1	Неклассифицированные/default	0	
655104	033923806275	Stanley gfci wall plate antique bronze	1	Неклассифицированные/default	0	
655105	033923806312	Stanley gfci wall plate antique copper	1	Неклассифицированные/default	0	
655106	033923806305	Stanley gfci wall plate antique pewter	1	Неклассифицированные/default	0	
655107	033923806251	Stanley gfci wall plate Black chrome	1	Неклассифицированные/default	0	
4696644	5013446025518	Stanley gibbons LTD 1000 pack stanley gibbons folded stamp hinges	1	Неклассифицированные/default	0	
4696645	856771002015	Stanley global cac smart card reader sgt111	1	Неклассифицированные/default	0	
1615623	070394040210	Stanley hand helpers all purpose canvas Gloves 100% cotton. 22532	1	Неклассифицированные/default	0	
1615151	070394039238	Stanley hand helpers cowhide leather Palm - large	1	Неклассифицированные/default	0	
1615125	070394038217	Stanley hand helpers dotted jersey Gloves - small	1	Неклассифицированные/default	0	
4696646	070394057287	Stanley hand helpers double leather Palm Gloves	1	Неклассифицированные/default	0	
4696647	070394030129	Stanley hand helpers vinyl disposable Gloves 12ct	1	Неклассифицированные/default	0	
563520	076174551198	Stanley hand tools 55-119 fatmax functional ut...	41797	Инструменты (folder)/Инструмент	306099	Stanley
5221904	3253561705595	Stanley hand tools козлы складные 2-way adjustable sawhorse twin pack пластмассовые регулируемые по высоте (комплект из 2-х шт)	5221903	козлы строительные	306099	Stanley
5221905	3253560468255	Stanley hand tools малка 200mm stanley 0-46-825	5119056	Угломер	306099	Stanley
5221906	3253561560064	Stanley hand tools мини-кувалда 1400g antivibe fatmax fmht1-56006 1-56-006	5183327	Инструменты (folder)/Кувалда	306099	Stanley
5221907	3253560621148	Stanley hand tools набор отверток и инструментов 39предм stht0-62114, stanley 0-62-114 3253560621148	3617597	Инструменты (folder)/Инструмент ручной	306099	Stanley
5221909	3253561946691	Stanley hand tools набор торцевых головок expert 1/4 +1/2 (77предм) 1-94-669	3617597	Инструменты (folder)/Инструмент ручной	306099	Stanley
5221911	9273762152886	Stanley hand tools ножовка jet cut sp 500mm 2-15-288 #2	498411	Инструменты (folder)/Ножовка	306099	Stanley
5221912	5035048482896	Stanley hand tools электромолоток stanley sthm10k	5132476	Инструменты (folder)/Отбойный молоток	306099	Stanley
5221914	3253561929083	Stanley hand tools ящик для инструментов stanly 1-92-908, jambo 22, металлические замки, 56x31 x28	344013	Инструменты (folder)/Ящик для инструментов	306099	Stanley
5221915	3253561833977	Stanley hand tools ящик для инструментов stanly Essential cantilever 19, stst83397-1	344013	Инструменты (folder)/Ящик для инструментов	306099	Stanley
4696648	033923141963	Stanley hardware 18 cnt stanley butt screw Satin nickel	1	Неклассифицированные/default	0	
4696649	033923147446	Stanley hardware 1ct Classic solid brass adjustable ball catch	1	Неклассифицированные/default	0	
4696650	033923014267	Stanley hardware 2 per package folding lid support	1	Неклассифицированные/default	0	
4696651	033923013352	Stanley hardware 2-1/2inch 2-1/2inch rope cleat	1	Неклассифицированные/default	0	
4696652	033923312806	Stanley hardware 3.5 in. husky folding lock-back utility knife	1	Неклассифицированные/default	0	
4696653	033923000444	Stanley hardware 4inch stanley barrel bolt	1	Неклассифицированные/default	0	
1737658	033923090018	Stanley hardware bottom pivot and jamb bracket, zinc-plated #402124	1737272	Неклассифицированные/Home Improvement	0	
4696654	033923001182	Stanley hardware door stop	1	Неклассифицированные/default	0	
4696655	033923090179	Stanley hardware floor guide for sliding closet doors	1	Неклассифицированные/default	0	
4696656	033923068178	Stanley hardware heavy duty s bracket	1	Неклассифицированные/default	0	
4696657	033923000956	Stanley hardware hinge pin door stop	1	Неклассифицированные/default	0	
4696658	033923010900	Stanley hardware radius hinge	1	Неклассифицированные/default	0	
4696659	033923089517	Stanley hardware shelf and closet rod supports	1	Неклассифицированные/default	0	
4696660	033923926164	Stanley hardware shelf support	1	Неклассифицированные/default	0	
4696661	033923321457	Stanley hardware single pack 3 1/2inch Satin brass door hinge	1	Неклассифицированные/default	0	
4696662	033923000925	Stanley hardware stanley bar latch (Satin brass finish) 81-9108 sp450	1	Неклассифицированные/default	0	
4696663	033923141925	Stanley hardware stanley hinge	1	Неклассифицированные/default	0	
3980641	033923927109	Stanley hardware stanley rope hook, 13-1030 / 4120-2-1/2	1	Неклассифицированные/default	0	
1369496	076174933017	Stanley hi-vis Yellow panel carry 93-301	41797	Инструменты (folder)/Инструмент	306099	Stanley
4696664	070394018332	Stanley hidex mechanic work Gloves	1	Неклассифицированные/default	0	
4696665	068654043231	Stanley hinges, (4x4) brass with ball bearings	1	Неклассифицированные/default	0	
5221917	3253560738723	Stanley hobby, 12шт (stht0-73872)	1	Неклассифицированные/default	306099	Stanley
1466213	033923820165	Stanley Home designs 820167 closet flange set, Satin nickel	1	Неклассифицированные/default	0	
1737659	033923825566	Stanley Home designs 825562 magnetic doorstop with catch, antique brass	1737272	Неклассифицированные/Home Improvement	0	
1737660	033923825573	Stanley Home designs 825570 magnetic doorstop with catch, Oil-rubbed bronze	1737272	Неклассифицированные/Home Improvement	0	
2686254	686140566097	Stanley indoor cordmax 9ft.	1	Неклассифицированные/default	306099	Stanley
4696666	076174770186	Stanley intellimeasure	1	Неклассифицированные/default	0	
4696667	076174772500	Stanley intellisensor digiscan stud Sensor	1	Неклассифицированные/default	0	
4039036	3253561152894	Stanley jetcut for fast, aggressive cutting 550mm 22inch 7tpi / 8 points	1	Неклассифицированные/default	0	
4696668	707787646673	Stanley jordan trio-Paris concert (DVD)	1	Неклассифицированные/default	0	
915948	076174119114	Stanley knife blade --5 per card-- 11-911	41797	Инструменты (folder)/Инструмент	306099	Stanley
915930	076174110401	Stanley knife blade 11-040	41797	Инструменты (folder)/Инструмент	306099	Stanley
1358932	076174111118	Stanley knife blade 11-111	41797	Инструменты (folder)/Инструмент	306099	Stanley
4696669	043396211070	Stanley kramer film collection (DVD/6 disc)(guess w/5000/Wild o/member/ship	1	Неклассифицированные/default	0	
4696670	043396604742	Stanley kramer's bless the beasts and children (wide screen/full screen versions)	1	Неклассифицированные/default	0	
4696671	012569697881	Stanley kubrick 3-pk (DVD/back to back/space ody/clockwork or/shining)	1	Неклассифицированные/default	0	
4696672	012569697898	Stanley kubrick 3-pk (DVD/side x side/space ody/clockwork or/shining)	1	Неклассифицированные/default	0	
4696673	883929012114	Stanley kubrick collection (DVD/6pk/9 disc/New pkg)	1	Неклассифицированные/default	0	
4696674	085391187592	Stanley kubrick-Life in pictures (DVD/2001)	1	Неклассифицированные/default	0	
419133	635460004086	Stanley Lambert Black sheep shiraz glass 750ml	22133	Продукты питания (folder)/Алкогольные напитки/Вино (folder)/Вино	0	
419134	635460003966	Stanley Lambert choc a bloc glass 750ml	22133	Продукты питания (folder)/Алкогольные напитки/Вино (folder)/Вино	0	
419135	635460003942	Stanley Lambert Family tree shiraz glass 750ml	22133	Продукты питания (folder)/Алкогольные напитки/Вино (folder)/Вино	0	
419136	635460004055	Stanley Lambert mustang Sally shiraz glass 750ml	22133	Продукты питания (folder)/Алкогольные напитки/Вино (folder)/Вино	0	
419137	635460004062	Stanley Lambert pristine Chardonnay glass 750ml	22133	Продукты питания (folder)/Алкогольные напитки/Вино (folder)/Вино	0	
419138	635460004031	Stanley Lambert riesling nordic Frost glass 750ml	22133	Продукты питания (folder)/Алкогольные напитки/Вино (folder)/Вино	0	
419139	635460003997	Stanley Lambert thoroughbred Cabernet barossa Valley glass 750ml	22133	Продукты питания (folder)/Алкогольные напитки/Вино (folder)/Вино	0	
419140	635460004024	Stanley Lambert three's company gsm glass 750ml	22133	Продукты питания (folder)/Алкогольные напитки/Вино (folder)/Вино	0	
915799	076174119831	Stanley large hook utility blades (5 per card) 11-983	41797	Инструменты (folder)/Инструмент	306099	Stanley
4696675	076174779103	Stanley laser measurer tlm 100 (77-910)	1	Неклассифицированные/default	0	
1358931	076174111033	Stanley linoleum blade (11-980) 11-103	41797	Инструменты (folder)/Инструмент	306099	Stanley
4696676	076174780055	Stanley locking knife	1	Неклассифицированные/default	0	
4696677	070394079234	Stanley lthr Palm glv 48ct	1	Неклассифицированные/default	0	
4696678	076174511048	Stanley mallet, rubber, 16oz /454g 51-104	1	Неклассифицированные/default	0	
4696679	076174470611	Stanley marking gauge	1	Неклассифицированные/default	0	
4696680	3253561261039	Stanley maxfinish roller set	1	Неклассифицированные/default	0	
4696681	076174951417	Stanley maxlife tripod flashlights	1	Неклассифицированные/default	0	
4696682	076174970074	Stanley medium barrel Air hammer 97-007	1	Неклассифицированные/default	0	
4696683	070394045260	Stanley mega grp knt lds glvs	1	Неклассифицированные/default	0	
1615186	070394045284	Stanley megagrip knit Gloves	1	Неклассифицированные/default	0	
4696684	076174921007	Stanley metal&plastic wall cabinet	1	Неклассифицированные/default	0	
4696685	010851723188	Stanley Mini jigs	1	Неклассифицированные/default	0	
4696686	076174929027	Stanley mobile contractor Box	1	Неклассифицированные/default	0	
4696687	076174944884	Stanley mobile work center	1	Неклассифицированные/default	0	
4696688	076174567052	Stanley mod: 56701 3lb drilling hammer jacketed fiberglass	1	Неклассифицированные/default	0	
4696689	076174910247	Stanley multi pak 48oz	1	Неклассифицированные/default	0	
5221923	3253560708856	Stanley multibit со сменными вставками, 32предм (stht0-70885)	1	Неклассифицированные/default	306099	Stanley
5221924	3253560625115	Stanley multifunctional со сменными вставками-стержнями, 10предм (0-62-511)	344583	Инструменты (folder)/Отвертка	306099	Stanley
668633	076174771947	Stanley mw408 12 in. auminum measuring wheel	1	Неклассифицированные/default	0	
2686255	731383593925	Stanley myers - the deer Hunter and othe CD cdof93925	4093300	Медиа (folder)/Media	0	
1140865	660000162506	Stanley nighttime	1	Неклассифицированные/default	0	
4696690	733417111204	Stanley organizer	1	Неклассифицированные/default	0	
1615624	686140515231	Stanley outdoor extension cord	1	Неклассифицированные/default	0	
1615625	686140515804	Stanley outdoor extension cord #2	1	Неклассифицированные/default	0	
306100	041604213137	Stanley outdoor mug with clip grip 16oz	41797	Инструменты (folder)/Инструмент	306099	Stanley
