ID	UPCEAN	Name	CategoryID	CategoryName	BrandID	BrandName
3626369	4690317018735	Доска разделочная bohmann пластик.склад.	19096	Посуда (folder)/Доска разделочная	1671248	Bohmann
4998412	4690231257494	Доска разделочная bono gr1491	19096	Посуда (folder)/Доска разделочная	0	
4998413	4690231273302	Доска разделочная bono круглая томат gr1498	19096	Посуда (folder)/Доска разделочная	0	
705670	6900003626327	Доска разделочная bora стеклоd 20cm	19096	Посуда (folder)/Доска разделочная	0	
5333788	4260361285287	Доска разделочная bork Home hb700	19096	Посуда (folder)/Доска разделочная	3789510	BORK
5333789	4260361285294	Доска разделочная bork Home hb701	19096	Посуда (folder)/Доска разделочная	3789510	BORK
5333790	4260361285300	Доска разделочная bork Home hb702	19096	Посуда (folder)/Доска разделочная	3789510	BORK
5333791	4260361289834	Доска разделочная bork Home hb703	19096	Посуда (folder)/Доска разделочная	3789510	BORK
5333792	4260361280695	Доска разделочная bork kb700	19096	Посуда (folder)/Доска разделочная	3789510	BORK
5333793	4260361280701	Доска разделочная bork kb701	19096	Посуда (folder)/Доска разделочная	3789510	BORK
3627680	8713638018300	Доска разделочная boska holland дуб 16cm	19096	Посуда (folder)/Доска разделочная	3627676	BOSKA
3627681	8713638018287	Доска разделочная boska holland дуб 30cm	19096	Посуда (folder)/Доска разделочная	3627676	BOSKA
3627682	8713638018263	Доска разделочная boska holland дуб 40cm	19096	Посуда (folder)/Доска разделочная	3627676	BOSKA
3312253	7290015978972	Доска разделочная bradex гибкая набор 1x 4шт	19096	Посуда (folder)/Доска разделочная	0	
53492	4895124460498	Доска разделочная Calve 23069/4532	19096	Посуда (folder)/Доска разделочная	36576	Calve посуда
3312254	4895124467398	Доска разделочная Calve деревянная 350x250 x 18mm	19096	Посуда (folder)/Доска разделочная	0	
3312255	6931048731493	Доска разделочная chop block с ножом арт n216	19096	Посуда (folder)/Доска разделочная	0	
705671	4812124242428	Доска разделочная contur стекл 20	19096	Посуда (folder)/Доска разделочная	0	
3312256	6918341311997	Доска разделочная cotoff стекло 40x30 x0.4cm	19096	Посуда (folder)/Доска разделочная	0	
705526	4016002022786	Доска разделочная culinario 20x 14cm 050646	19096	Посуда (folder)/Доска разделочная	36947	Culinario
2979077	4016002017270	Доска разделочная culinario 20x 14cm 050646 #2	19096	Посуда (folder)/Доска разделочная	36947	Culinario
2979078	4016002017287	Доска разделочная culinario 20x 14cm 050646 #3	19096	Посуда (folder)/Доска разделочная	36947	Culinario
2979079	4016002017331	Доска разделочная culinario 20x 14cm 050646 #4	19096	Посуда (folder)/Доска разделочная	36947	Culinario
2979080	4016002017348	Доска разделочная culinario 20x 14cm 050646 #5	19096	Посуда (folder)/Доска разделочная	36947	Culinario
1206556	4016002022717	Доска разделочная culinario 36x 25cm 050796	19096	Посуда (folder)/Доска разделочная	36947	Culinario
705527	4016002018949	Доска разделочная culinario 36x 25cm 050796 #2	19096	Посуда (folder)/Доска разделочная	36947	Culinario
2230035	4016002023943	Доска разделочная culinario 36x 30cm желтая 051249	19096	Посуда (folder)/Доска разделочная	36947	Culinario
2230036	4016002023929	Доска разделочная culinario 36x 30cm зеленая 051247	19096	Посуда (folder)/Доска разделочная	36947	Culinario
2230037	4016002023950	Доска разделочная culinario 36x 30cm красная 051250	19096	Посуда (folder)/Доска разделочная	36947	Culinario
2230038	4016002023936	Доска разделочная culinario 36x 30cm оранж 051248	19096	Посуда (folder)/Доска разделочная	36947	Culinario
2230039	4016002023967	Доска разделочная culinario 36x 30cm сине-белая 051251	19096	Посуда (folder)/Доска разделочная	36947	Culinario
705528	4016002009473	Доска разделочная culinario 43x 29cm хлебная двухсторонняя	19096	Посуда (folder)/Доска разделочная	36947	Culinario
53450	4016002015351	Доска разделочная culinario антибакт 20.3x 14cm	19096	Посуда (folder)/Доска разделочная	36947	Culinario
53451	4016002015344	Доска разделочная culinario антибакт 29.2x20.3cm	19096	Посуда (folder)/Доска разделочная	36947	Culinario
705831	4016002022588	Доска разделочная culinario антибакт 29.2x20.3cm #2	19096	Посуда (folder)/Доска разделочная	36947	Culinario
1206647	4016002022694	Доска разделочная culinario антибакт 36.8x25.4cm	19096	Посуда (folder)/Доска разделочная	36947	Culinario
53452	4016002015429	Доска разделочная culinario антибакт 36.8x25.4cm #2	19096	Посуда (folder)/Доска разделочная	36947	Culinario
2954999	4016002015412	Доска разделочная culinario антибакт 36.8x25.4cm #2 #2	19096	Посуда (folder)/Доска разделочная	36947	Culinario
2955000	4016002015337	Доска разделочная culinario антибакт 36.8x25.4cm #2 #3	19096	Посуда (folder)/Доска разделочная	36947	Culinario
2955001	4016002015399	Доска разделочная culinario антибакт 36.8x25.4cm #2 #4	19096	Посуда (folder)/Доска разделочная	36947	Culinario
2955002	4016002015405	Доска разделочная culinario антибакт 36.8x25.4cm #2 #5	19096	Посуда (folder)/Доска разделочная	36947	Culinario
705832	4016002022700	Доска разделочная culinario антибакт 36.8x25.4cm #3	19096	Посуда (folder)/Доска разделочная	36947	Culinario
53453	4016002015320	Доска разделочная culinario антибакт 44.5x30.5cm	19096	Посуда (folder)/Доска разделочная	36947	Culinario
705529	4016002018000	Доска разделочная culinario бамбук 050713	19096	Посуда (folder)/Доска разделочная	36947	Culinario
705530	4016002017997	Доска разделочная culinario бамбук 21x 15cm 050712	19096	Посуда (folder)/Доска разделочная	36947	Culinario
705531	4016002017980	Доска разделочная culinario бамбук 29x 20cm 050711	19096	Посуда (folder)/Доска разделочная	36947	Culinario
705532	4016002017973	Доска разделочная culinario бамбук 36x 25cm 050710	19096	Посуда (folder)/Доска разделочная	36947	Culinario
705533	4016002017966	Доска разделочная culinario бамбук 44x 30cm 050709	19096	Посуда (folder)/Доска разделочная	36947	Culinario
705672	6912191731080	Доска разделочная d-33x20 x1.5	19096	Посуда (folder)/Доска разделочная	0	
705673	6912191731073	Доска разделочная d-36x21 x2	19096	Посуда (folder)/Доска разделочная	0	
3312257	6902367062537	Доска разделочная Da ye 16778-d23	19096	Посуда (folder)/Доска разделочная	0	
3312258	6902823087289	Доска разделочная Da ye 16778-d24	19096	Посуда (folder)/Доска разделочная	0	
3312259	6903714282349	Доска разделочная Da ye 16778-d25	19096	Посуда (folder)/Доска разделочная	0	
3312260	4627072870681	Доска разделочная deco пластиковая с фотоизображением р.20x 30cm	19096	Посуда (folder)/Доска разделочная	0	
705674	6900458671002	Доска разделочная dom craft 18x18 стекл ассортим	19096	Посуда (folder)/Доска разделочная	0	
1663440	6900458687003	Доска разделочная dom craft стекл. 19x 28cm /ассорт./	19096	Посуда (folder)/Доска разделочная	0	
1663441	6900458682008	Доска разделочная dom craft стекло 19x 28cm /ассортим//cn682-681/	19096	Посуда (folder)/Доска разделочная	0	
3312261	4607179610892	Доска разделочная domina ассорти стеклянная 20x 30cm т/у	19096	Посуда (folder)/Доска разделочная	0	
5333794	4607018473619	Доска разделочная dommix bnb4680b2	19096	Посуда (folder)/Доска разделочная	1663456	Oriental Way
705643	8711295279430	Доска разделочная dorman	19096	Посуда (folder)/Доска разделочная	319660	DORMAN
2979082	5010000034436	Доска разделочная dorman #2	19096	Посуда (folder)/Доска разделочная	319660	DORMAN
705667	4001171995269	Доска разделочная dorman 99526 тем.круг	19096	Посуда (folder)/Доска разделочная	319660	DORMAN
705675	4001171080316	Доска разделочная dorman кругл 8031	19096	Посуда (folder)/Доска разделочная	319660	DORMAN
1783512	4001171090322	Доска разделочная dormann	19096	Посуда (folder)/Доска разделочная	3646418	DORMANN
1783513	4001171992442	Доска разделочная dormann #2	19096	Посуда (folder)/Доска разделочная	3646418	DORMANN
1663356	6904567587650	Доска разделочная Dream village фарфор /58-765/	19096	Посуда (folder)/Доска разделочная	0	
1783126	4606009007543	Доска разделочная el. apl. 30.5x20.5x1.8cm	19096	Посуда (folder)/Доска разделочная	3652323	ELSE
1783127	4606009007512	Доска разделочная el. apl. 35.5x25.5x1.5cm	19096	Посуда (folder)/Доска разделочная	3652323	ELSE
1783128	4606009007420	Доска разделочная el. asp. 22x27 x1.5cm	19096	Посуда (folder)/Доска разделочная	3652323	ELSE
705930	5051584000264	Доска разделочная else gelse 17x32 x1.5cm	19096	Посуда (folder)/Доска разделочная	3652323	ELSE
1783129	4606009007437	Доска разделочная else melse 17x32 x1.5cm	19096	Посуда (folder)/Доска разделочная	3652323	ELSE
3805753	5051584000301	Доска разделочная else melse 17x32 x1.5cm #2	19096	Посуда (folder)/Доска разделочная	3652323	ELSE
1783130	4606009007444	Доска разделочная else melse 21x36 x1.5cm	19096	Посуда (folder)/Доска разделочная	3652323	ELSE
5333795	4009049366982	Доска разделочная emsa click cut набор 514058	19096	Посуда (folder)/Доска разделочная	0	
3312262	4606900747616	Доска разделочная ens 24x20 x 1cm бамбук	19096	Посуда (folder)/Доска разделочная	0	
3312263	4606900747708	Доска разделочная ens Group бамбук 4350088 31x20.5x 1cm	19096	Посуда (folder)/Доска разделочная	0	
3312264	4606900745490	Доска разделочная ens Group бытовая материал стекло 20x 30cm т/у	19096	Посуда (folder)/Доска разделочная	0	
3312265	4606900745551	Доска разделочная ens Group стекло 20cm 5340093	19096	Посуда (folder)/Доска разделочная	0	
53590	4008033392013	Доска разделочная fackelmann c крыш. 24x 15cm Fa	19096	Посуда (folder)/Доска разделочная	41398	Fackelmann
705342	4008033109406	Доска разделочная fackelmann fackelmann универсал гномы	19096	Посуда (folder)/Доска разделочная	41398	Fackelmann
53575	4008033392037	Доска разделочная fackelmann акрил 24x 15cm fac	19096	Посуда (folder)/Доска разделочная	41398	Fackelmann
705676	4008033392839	Доска разделочная fackelmann акрил 34x 19cm fac	19096	Посуда (folder)/Доска разделочная	41398	Fackelmann
53577	4008033392938	Доска разделочная fackelmann акрил 35x 25cm fack	19096	Посуда (folder)/Доска разделочная	41398	Fackelmann
53576	4008033392730	Доска разделочная fackelmann акрил 39273	19096	Посуда (folder)/Доска разделочная	41398	Fackelmann
53578	4008033317771	Доска разделочная fackelmann бамбук 31777	19096	Посуда (folder)/Доска разделочная	41398	Fackelmann
53579	4008033317801	Доска разделочная fackelmann бамбук 31780	19096	Посуда (folder)/Доска разделочная	41398	Fackelmann
53580	4008033317818	Доска разделочная fackelmann бамбук 31781	19096	Посуда (folder)/Доска разделочная	41398	Fackelmann
53581	4008033317863	Доска разделочная fackelmann бамбук 31787	19096	Посуда (folder)/Доска разделочная	41398	Fackelmann
53584	4008033317962	Доска разделочная fackelmann бамбук 31796	19096	Посуда (folder)/Доска разделочная	41398	Fackelmann
53585	4008033317825	Доска разделочная fackelmann бамбук 37x14 x2 31782	19096	Посуда (folder)/Доска разделочная	41398	Fackelmann
53582	4008033317924	Доска разделочная fackelmann бамбук с ручк. 23x3	19096	Посуда (folder)/Доска разделочная	41398	Fackelmann
53583	4008033317931	Доска разделочная fackelmann бамбук с ручк. 25.6	19096	Посуда (folder)/Доска разделочная	41398	Fackelmann
1783158	4008033317757	Доска разделочная fackelmann бамбук с ручк.25cm	19096	Посуда (folder)/Доска разделочная	41398	Fackelmann
1783145	4008033317733	Доска разделочная fackelmann бамбуковая 35x25 x 2cm	19096	Посуда (folder)/Доска разделочная	41398	Fackelmann
1783146	4008033318013	Доска разделочная fackelmann береза круг 25x1.5cm	19096	Посуда (folder)/Доска разделочная	41398	Fackelmann
53586	5907445213093	Доска разделочная fackelmann дерев 21309	19096	Посуда (folder)/Доска разделочная	41398	Fackelmann
53587	5907445213109	Доска разделочная fackelmann дерев 21310	19096	Посуда (folder)/Доска разделочная	41398	Fackelmann
537041	4008033316422	Доска разделочная fackelmann дерев 22x14 x 1cm, 6	19096	Посуда (folder)/Доска разделочная	41398	Fackelmann
53588	5907445213154	Доска разделочная fackelmann дерев 30x 21cm 21315	19096	Посуда (folder)/Доска разделочная	41398	Fackelmann
53589	4008033317306	Доска разделочная fackelmann дерев 31730.1	19096	Посуда (folder)/Доска разделочная	41398	Fackelmann
705677	4008033391931	Доска разделочная fackelmann стекл д 27cm	19096	Посуда (folder)/Доска разделочная	41398	Fackelmann
705678	4008033380348	Доска разделочная fackelmann стекло 35x25	19096	Посуда (folder)/Доска разделочная	41398	Fackelmann
3312266	6903124390504	Доска разделочная feihu 16778-d22	19096	Посуда (folder)/Доска разделочная	0	
3312267	6900581560013	Доска разделочная feihu овал пластмасса	19096	Посуда (folder)/Доска разделочная	0	
3312268	6900581570012	Доска разделочная feihu пярмоугольная пластм	19096	Посуда (folder)/Доска разделочная	0	
4998415	4630032198473	Доска разделочная flex 250x176 x 15mm (микс 2) (30) 32106	19096	Посуда (folder)/Доска разделочная	0	
4998416	4630032195489	Доска разделочная flex 300x 215mm (микс 1) (24) 32107	19096	Посуда (folder)/Доска разделочная	0	
2324345	4630011451209	Доска разделочная flex mode 38.5x21.5cm 45120-4160	19096	Посуда (folder)/Доска разделочная	595076	FLEX MODE
3312269	4828118902087	Доска разделочная flex трансформер 37x 21cm ассортим	19096	Посуда (folder)/Доска разделочная	0	
5333797	4600416339617	Доска разделочная florentina 39.7x 27cm (3038)	19096	Посуда (folder)/Доска разделочная	5333796	florentina
5333798	4600416339655	Доска разделочная florentina 41.4x35.3cm (4000)	19096	Посуда (folder)/Доска разделочная	5333796	florentina
5333799	4600416339662	Доска разделочная florentina 41.4x35.3cm (4025)	19096	Посуда (folder)/Доска разделочная	5333796	florentina
5333800	4600416339686	Доска разделочная florentina 41.8x 29cm (5042)	19096	Посуда (folder)/Доска разделочная	5333796	florentina
5333801	4600416339624	Доска разделочная florentina 42.5x 27cm (3040)	19096	Посуда (folder)/Доска разделочная	5333796	florentina
5333802	4600416339648	Доска разделочная florentina 44.5x26.8cm (3543)	19096	Посуда (folder)/Доска разделочная	5333796	florentina
5333803	4600416339679	Доска разделочная florentina 45.4x35.7cm (4400)	19096	Посуда (folder)/Доска разделочная	5333796	florentina
5333804	4600416339631	Доска разделочная florentina 45.5x 27cm (3044)	19096	Посуда (folder)/Доска разделочная	5333796	florentina
5333805	4600416339693	Доска разделочная florentina 49x38.5cm (5049)	19096	Посуда (folder)/Доска разделочная	5333796	florentina
5333806	4600416339709	Доска разделочная florentina 54.2x31.5cm (9010)	19096	Посуда (folder)/Доска разделочная	5333796	florentina
3312270	4606900745742	Доска разделочная flowers	19096	Посуда (folder)/Доска разделочная	0	
53597	9007861956010	Доска разделочная fortuna 23x15 x 1cm	19096	Посуда (folder)/Доска разделочная	53548	Фортуна
3805754	9007861956416	Доска разделочная fortuna 23x15 x 1cm #2	19096	Посуда (folder)/Доска разделочная	368040	FORTUNA
53598	9007861956119	Доска разделочная fortuna 27.5x15 x 1cm	19096	Посуда (folder)/Доска разделочная	53548	Фортуна
3805755	9007861956614	Доска разделочная fortuna 27.5x15 x 1cm #2	19096	Посуда (folder)/Доска разделочная	368040	FORTUNA
53591	9007861953118	Доска разделочная fortuna 35x16 x1.5cm	19096	Посуда (folder)/Доска разделочная	368040	FORTUNA
3805756	9007861953514	Доска разделочная fortuna 35x16 x1.5cm #2	19096	Посуда (folder)/Доска разделочная	368040	FORTUNA
53595	9007861955013	Доска разделочная fortuna 36x21 x 2cm	19096	Посуда (folder)/Доска разделочная	53548	Фортуна
53593	9007861953217	Доска разделочная fortuna 39x20 x1.5cm	19096	Посуда (folder)/Доска разделочная	368040	FORTUNA
53596	9007861955112	Доска разделочная fortuna 40x25 x 2cm	19096	Посуда (folder)/Доска разделочная	368040	FORTUNA
53594	9007861953316	Доска разделочная fortuna 44x24 x1.5cm	19096	Посуда (folder)/Доска разделочная	53548	Фортуна
53549	9007861950117	Доска разделочная fortuna кругл 9501-1	19096	Посуда (folder)/Доска разделочная	53548	Фортуна
53592	9007861950018	Доска разделочная fortuna кругл d=25cm	19096	Посуда (folder)/Доска разделочная	53548	Фортуна
5333807	6951210760038	Доска разделочная friday голубой perfecto linea (215x 310mm)	19096	Посуда (folder)/Доска разделочная	5200658	perfecto linea
5333808	6951210760021	Доска разделочная friday розовый perfecto linea (215x 310mm)	19096	Посуда (folder)/Доска разделочная	5200658	perfecto linea
5333809	6951210760014	Доска разделочная friday салатный perfecto linea (215x 310mm)	19096	Посуда (folder)/Доска разделочная	5200658	perfecto linea
5333810	6951210760007	Доска разделочная friday, лазурно-синий perfecto linea (215x 310mm)	19096	Посуда (folder)/Доска разделочная	5200658	perfecto linea
3660324	8806179699821	Доска разделочная frybest bull мал.cb-de-s29f	19096	Посуда (folder)/Доска разделочная	3661669	FRYBEST
3660325	8806179699814	Доска разделочная frybest bull сред.cb-de-m36f	19096	Посуда (folder)/Доска разделочная	3661669	FRYBEST
3805757	8809390578272	Доска разделочная frybest виноград 203x292	19096	Посуда (folder)/Доска разделочная	3661669	FRYBEST
3805758	8806179686456	Доска разделочная frybest огурец 140x203	19096	Посуда (folder)/Доска разделочная	3661669	FRYBEST
3805759	8809390578289	Доска разделочная frybest огурец 140x203 #2	19096	Посуда (folder)/Доска разделочная	3661669	FRYBEST
3805760	4610018292340	Доска разделочная frybest томат 203x292	19096	Посуда (folder)/Доска разделочная	3661669	FRYBEST
3805761	8806179685404	Доска разделочная frybest томат 203x292 #2	19096	Посуда (folder)/Доска разделочная	3661669	FRYBEST
5333811	4811244060424	Доска разделочная funny xl лазурно-синий, berossi (изделие из пластмассы. размер 350x247 x2 mm) ик35539000	19096	Посуда (folder)/Доска разделочная	3421478	Berossi
5333736	4811244060462	Доска разделочная funny xl салатный, berossi (изделие из пластмассы. размер 350x247 x2 mm) ик35538000	19096	Посуда (folder)/Доска разделочная	3421478	Berossi
3312244	4811244059893	Доска разделочная funny лазурно-синий, berossi (изделие из пластмассы. размер 330x214 x 2mm) ик35439000	19096	Посуда (folder)/Доска разделочная	3421478	Berossi
5333812	4006664139809	Доска разделочная gefu levoro (13980)	19096	Посуда (folder)/Доска разделочная	1190579	Gefu
5333813	4006664139854	Доска разделочная gefu levoro (13985)	19096	Посуда (folder)/Доска разделочная	1190579	Gefu
5333814	4006664139908	Доска разделочная gefu levoro (13990)	19096	Посуда (folder)/Доска разделочная	1190579	Gefu
5333815	8711369826041	Доска разделочная gn 1/1, 53x32.5cm haccp hendi 826041 50032409	19096	Посуда (folder)/Доска разделочная	5251286	hendi
5333816	8711369826102	Доска разделочная gn 1/2, 32.5x26.5cm haccp hendi 826102 50022578	19096	Посуда (folder)/Доска разделочная	5251286	hendi
5333817	8711369826119	Доска разделочная gn 1/2, 32.5x26.5cm haccp hendi 826119 50032407	19096	Посуда (folder)/Доска разделочная	5251286	hendi
5333818	8711369826126	Доска разделочная gn 1/2, 32.5x26.5cm haccp hendi 826126 50022580	19096	Посуда (folder)/Доска разделочная	5251286	hendi
5333819	8711369826133	Доска разделочная gn 1/2, 32.5x26.5cm haccp hendi 826133 50032740	19096	Посуда (folder)/Доска разделочная	5251286	hendi
5333820	8711369826157	Доска разделочная gn 1/2, 32.5x26.5cm haccp hendi 826157 50022582	19096	Посуда (folder)/Доска разделочная	5251286	hendi
