ID	UPCEAN	Name	CategoryID	CategoryName	BrandID	BrandName
480307	4603541000209	Крем для лица маграв 50ml витам. для сух/к	664	Косметика (folder)/Крем для лица	20195	МАГРАВ
480308	4603541000186	Крем для лица маграв 50ml для л.т./к питательный	664	Косметика (folder)/Крем для лица	20195	МАГРАВ
480309	4603541000223	Крем для лица маграв 50ml для л.т./к тонизирующий	664	Косметика (folder)/Крем для лица	20195	МАГРАВ
480310	4603541000216	Крем для лица маграв 50ml для с/нор/к гипоаллергенный	664	Косметика (folder)/Крем для лица	20195	МАГРАВ
480311	4603541000254	Крем для лица маграв 50ml для с/нор/к отбеливающий	664	Косметика (folder)/Крем для лица	20195	МАГРАВ
480312	4603541000247	Крем для лица маграв 50ml для сух/к питательный	664	Косметика (folder)/Крем для лица	20195	МАГРАВ
480313	4603541000193	Крем для лица маграв 50ml для увядающей кожи	664	Косметика (folder)/Крем для лица	20195	МАГРАВ
480314	4603541000230	Крем для лица маграв 50ml от морщин для л.т./к	664	Косметика (folder)/Крем для лица	20195	МАГРАВ
480315	4603541000261	Крем для лица маграв 50ml от угрей для ж/нор/к	664	Косметика (folder)/Крем для лица	20195	МАГРАВ
266416	4600702072082	Крем для лица маленькая Фея легкий 15ml/калина/24	664	Косметика (folder)/Крем для лица	603	Маленькая Фея
665	4600702001914	Крем для лица маленькая Фея нежн 50	664	Косметика (folder)/Крем для лица	603	Маленькая Фея
666	4600702022841	Крем для лица маленькая Фея нежный банка 15ml	664	Косметика (folder)/Крем для лица	603	Маленькая Фея
2455064	4810321000070	Крем для лица марта виноградный (баночка) 50ml/к12	664	Косметика (folder)/Крем для лица	0	
2455093	048103210049	Крем для лица марта сафари дневной на основе страусиного жира 50ml/к12	664	Косметика (folder)/Крем для лица	0	
480776	4600970000091	Крем для лица маска faif с цинком и облепихой 45ml	664	Косметика (folder)/Крем для лица	443670	FAIF
1097764	4953923337783	Крем для лица массажный pola биоактивный омолаживающий 120g	664	Косметика (folder)/Крем для лица	1097739	POLA
480316	6412600312171	Крем для лица матирующий фрешкаре 75ml	664	Косметика (folder)/Крем для лица	0	
480317	4607008960402	Крем для лица мгновенный эффект антиугревой 100ml	664	Косметика (folder)/Крем для лица	0	
480318	3264680001499	Крем для лица медовая мечта ультра комфорт 50ml	664	Косметика (folder)/Крем для лица	443855	Медовая мечта
1354145	4607132560370	Крем для лица мезо эффект момент подтяжка 50ml	664	Косметика (folder)/Крем для лица	0	
480319	4001638097932	Крем для лица миндальный увлажняющий 30ml	664	Косметика (folder)/Крем для лица	304961	Weleda
1240828	4607069863261	Крем для лица мир женщины фито/баланс 24 0.050	664	Косметика (folder)/Крем для лица	0	
3748530	4650001794451	Крем для лица мирролла серия 03 аевит и тела 75ml цб-00004677	5586	Косметика (folder)/Косметика	3748529	SERIYA 03 (MIRROLLA/SPB)
5458720	4680040922218	Крем для лица мирролла серия 03 аевит и тела 75мл цб-00004677 #2	664	Косметика (folder)/Крем для лица	5032543	мирролла
4854869	4650001797179	Крем для лица мирролла серия 03 витамин е и тела 75ml цб-00004676	241824	Лекарственные средства (folder)/Аптека	5032543	мирролла
75728	4810181002177	Крем для лица модум 75g	664	Косметика (folder)/Крем для лица	0	
2957637	4810181002184	Крем для лица модум 75g #2	664	Косметика (folder)/Крем для лица	0	
2957639	4810181002191	Крем для лица модум 75g #4	664	Косметика (folder)/Крем для лица	0	
2957640	4810181003778	Крем для лица модум 75g #5	664	Косметика (folder)/Крем для лица	0	
1150123	4811230012390	Крем для лица модум tea Line премакияж белый чай 50ml 24 /b083-210/	664	Косметика (folder)/Крем для лица	311027	Modum
1240939	4820074622672	Крем для лица Мой Каприз дневной 100ml	664	Косметика (folder)/Крем для лица	0	
480320	4823015908163	Крем для лица Мой Каприз ночной питательный 100ml	664	Косметика (folder)/Крем для лица	475638	Мой Каприз
480342	4820074622665	Крем для лица Мой Каприз ночной питательный 100ml #2	664	Косметика (folder)/Крем для лица	0	
480321	4823015908187	Крем для лица Мой Каприз омолажив. против морщин 100ml	664	Косметика (folder)/Крем для лица	475638	Мой Каприз
1240940	4820074622689	Крем для лица Мой Каприз омолаживающий против морщин 100ml	664	Косметика (folder)/Крем для лица	0	
120	4600936181109	Крем для лица молоко и мед омолажив. для чув/к 82g	664	Косметика (folder)/Крем для лица	116	Молоко и Мёд
1781635	4600702095647	Крем для лица морковный омолаживающий 45ml/калина/35	664	Косметика (folder)/Крем для лица	3708208	MORKOVNIY (KALINA (URALSKIE SAMOTSVETY))
480303	4600702087819	Крем для лица морковный экстракт моркови витамине 42ml тв уп	664	Косметика (folder)/Крем для лица	18324	КАЛИНА
5019298	3282779285360	Крем для лица мс безупречность дневной	664	Косметика (folder)/Крем для лица	0	
480804	4820058760208	Крем для лица мультивитамин ночной восстанавливающий	664	Косметика (folder)/Крем для лица	0	
4844229	4606711432411	Крем для лица мультивитамин питательный 46ml	664	Косметика (folder)/Крем для лица	0	
4844230	4606711432510	Крем для лица мультивитамин увлажняющий 46ml	664	Косметика (folder)/Крем для лица	0	
2766715	4607012145550	Крем для лица мультиматрикс kora дневной обновляющий, 50ml 45550	1	Неклассифицированные/default	4923619	Kora
9816	4600702026283	Крем для лица мумие питательный для норм/жирн кожи 42ml/калина/32	664	Косметика (folder)/Крем для лица	620	Прочие Калина
1781636	4600702095692	Крем для лица мумие питательный для норм/жирн кожи 45ml/калина/35	664	Косметика (folder)/Крем для лица	18324	КАЛИНА
480156	4600732134231	Крем для лица муссон вечерний омолажив для сух/н/к 40g	664	Косметика (folder)/Крем для лица	0	
480157	4600732134248	Крем для лица муссон дневной увлажн для сух/нор/к 40g	664	Косметика (folder)/Крем для лица	0	
480812	4607070020424	Крем для лица на козьем молоке отбел 50ml	664	Косметика (folder)/Крем для лица	0	
19411	4607070020431	Крем для лица на козьем молоке пилинг деликатный 80ml	664	Косметика (folder)/Крем для лица	19401	КОСМЕТИКА XXI
781031	460643900554	Крем для лица народные Рецепты злаки 40 увлажн для н/комб.к	664	Косметика (folder)/Крем для лица	418	Народные Рецепты
12033	4606439005584	Крем для лица народные Рецепты злаки актив восстан для всех т к 40g	664	Косметика (folder)/Крем для лица	418	Народные Рецепты
12034	4606439005577	Крем для лица народные Рецепты злаки веч для всех т к 40g	664	Косметика (folder)/Крем для лица	418	Народные Рецепты
12035	4606439005539	Крем для лица народные Рецепты злаки питат для нор комб к 40g	664	Косметика (folder)/Крем для лица	418	Народные Рецепты
12036	4606439005553	Крем для лица народные Рецепты злаки питат для сух и чувст к 40g	664	Косметика (folder)/Крем для лица	418	Народные Рецепты
12037	4606439005546	Крем для лица народные Рецепты злаки увлаж для норм комб к 40g	664	Косметика (folder)/Крем для лица	418	Народные Рецепты
12038	4606439005560	Крем для лица народные Рецепты злаки увлаж для сух чувст к 40g	664	Косметика (folder)/Крем для лица	418	Народные Рецепты
781033	460643900585	Крем для лица народные Рецепты овощи 40 веч.для всех т.к	664	Косметика (folder)/Крем для лица	418	Народные Рецепты
12043	4606439005867	Крем для лица народные Рецепты овощи акт против морщин для всех т к 40g	664	Косметика (folder)/Крем для лица	418	Народные Рецепты
12044	4606439005850	Крем для лица народные Рецепты овощи вечер для всех т к 40g	664	Косметика (folder)/Крем для лица	418	Народные Рецепты
12045	4606439005812	Крем для лица народные Рецепты овощи питат для норм комб к 40g	664	Косметика (folder)/Крем для лица	418	Народные Рецепты
12046	4606439005836	Крем для лица народные Рецепты овощи питат для сух чувст к 40g	664	Косметика (folder)/Крем для лица	418	Народные Рецепты
12047	4606439005829	Крем для лица народные Рецепты овощи увлаж для норм комб к 40g	664	Косметика (folder)/Крем для лица	418	Народные Рецепты
12048	4606439005843	Крем для лица народные Рецепты овощи увлаж для сух чувст к 40g	664	Косметика (folder)/Крем для лица	418	Народные Рецепты
12053	4606439005690	Крем для лица народные Рецепты травы вечер для всех т к 40	664	Косметика (folder)/Крем для лица	418	Народные Рецепты
12054	4606439005652	Крем для лица народные Рецепты травы питат для норм и комб к 40	664	Косметика (folder)/Крем для лица	418	Народные Рецепты
12055	4606439005676	Крем для лица народные Рецепты травы питат для сух и чувст к 40	664	Косметика (folder)/Крем для лица	418	Народные Рецепты
12056	4606439005669	Крем для лица народные Рецепты травы увлаж для норм и комб к 40	664	Косметика (folder)/Крем для лица	418	Народные Рецепты
12057	4606439005683	Крем для лица народные Рецепты травы увлаж для сух и чувст к 40	664	Косметика (folder)/Крем для лица	418	Народные Рецепты
480160	4600936180348	Крем для лица Наташа для нор/жир/кожи 42g	664	Косметика (folder)/Крем для лица	3757831	Svoboda
2439359	4600697192345	Крем для лица невская косметика календула увляжняющий для жирной и нормальной кожи, 40ml	1	Неклассифицированные/default	2460374	Крем прочее Н.К.
5019299	4640021388358	Крем для лица норм к. увлажн .с гиалур.кислотой, экст.алоэ, вит а,е,д 75ml (388112)	664	Косметика (folder)/Крем для лица	228859	DOMIX
2779062	3282770049350	Крем для лица ночной avene physiolift разглаживающий от глубоких морщин, 30ml c52616	1	Неклассифицированные/default	206708	Avene
1763149	3600522548034	Крем для лица ночной L'oreal Paris возраст Эксперт 35+ увлажняющий, против морщин, 50ml a7821100	5586	Косметика (folder)/Косметика	388370	L'Oreal Dermo Expertise
2810854	3600523408917	Крем для лица ночной L'oreal Paris возраст Эксперт 65+, 50ml a9124700	1	Неклассифицированные/default	388370	L'Oreal Dermo Expertise
4927517	4603739666439	Крем для лица ночной levrana черника anti-age, 50ml 649414222	5586	Косметика (folder)/Косметика	3690496	Levrana
12205	5000174681109	Крем для лица ночной olay total effects от 7 признаков старения 27-45ле 50ml	664	Косметика (folder)/Крем для лица	12158	Olay
174855	4810151009809	Крем для лица ночной Royal iris 50ml	664	Косметика (folder)/Крем для лица	174851	Bielita Royal iris
5458721	3337875722520	Крем для лица ночной vichy liftactiv collagen specialist для восстановления кожи, 50ml эх99989405851	664	Косметика (folder)/Крем для лица	224648	VICHY
2427714	3337875483940	Крем для лица ночной vichy neovadio в период менопаузы, 50ml m9067100	5586	Косметика (folder)/Косметика	224648	VICHY
8282	4810153008381	Крем для лица ночной клеточное омоложение эффективное разглаживание 45ml	664	Косметика (folder)/Крем для лица	4241	Bielita
174712	4810151009656	Крем для лица ночной мультиактивный vip 10ml пробник	664	Косметика (folder)/Крем для лица	174711	Bielita VIP-COMPLEX
5296	4810151009489	Крем для лица ночной мультиактивный vip 50ml	664	Косметика (folder)/Крем для лица	174711	Bielita VIP-COMPLEX
1675397	3800200963191	Крем для лица ночной омолаживающий herbs of bulgaria 50	664	Косметика (folder)/Крем для лица	0	
4807193	4603728946023	Крем для лица ночной отбеливающий achromin для норм. и комб. кожи, 50ml 28028	5586	Косметика (folder)/Косметика	4807169	Achromin
5458722	4650070511379	Крем для лица ночной отбеливающий achromin для норм. и комб. кожи, 50ml 28028 #2	5586	Косметика (folder)/Косметика	4807169	Achromin
4807184	4650070510334	Крем для лица ночной отбеливающий achromin для проблемной кожи, 50ml 27995	5586	Косметика (folder)/Косметика	4807169	Achromin
4807182	4603728946016	Крем для лица ночной отбеливающий achromin для сухой и чувств. кожи, 50ml 28027	5586	Косметика (folder)/Косметика	4807169	Achromin
5458723	4650070511362	Крем для лица ночной отбеливающий achromin для сухой и чувств. кожи, 50ml 28027 #2	5586	Косметика (folder)/Косметика	4807169	Achromin
15093	4600702035759	Крем для лица ночной пит для норм и комб.кожи сок алоэ и овсяные хлопья сто рецептов красоты	664	Косметика (folder)/Крем для лица	633	Сто Рецептов Красоты
15094	4600702035780	Крем для лица ночной питательный для сухой и нормальной кожи мед и банан сто рецептов красоты	664	Косметика (folder)/Крем для лица	633	Сто Рецептов Красоты
266481	4820059460664	Крем для лица ночной с жиром эму зеленый континент 50g	241824	Лекарственные средства (folder)/Аптека	0	
5019300	4813406005243	Крем для лица ночной с муцином улитки 50g (ООО белика-м)	664	Косметика (folder)/Крем для лица	4241	Bielita
5020104	8714100781012	Крем для лица ночной черный Жемчуг экстремальное увлажнение, 50ml 67660608	5586	Косметика (folder)/Косметика	151	Черный Жемчуг
5019301	4604094032396	Крем для лица нэфис лесная полянка питательный 40g	664	Косметика (folder)/Крем для лица	3870965	Нэфис Лесная полянка
5019302	4604094032419	Крем для лица нэфис лесная полянка увлажняющий 40g	664	Косметика (folder)/Крем для лица	3870965	Нэфис Лесная полянка
5019303	4604094032402	Крем для лица нэфис лесная полянка успокаивающий 40g	664	Косметика (folder)/Крем для лица	3870965	Нэфис Лесная полянка
5019304	4604094031641	Крем для лица нэфис целебные травы ночной 45ml	664	Косметика (folder)/Крем для лица	4890217	Нэфис целебные травы
5019305	4604094031634	Крем для лица нэфис целебные травы с календулой, 45ml	664	Косметика (folder)/Крем для лица	4890217	Нэфис целебные травы
5019306	4604094031610	Крем для лица нэфис целебные травы с купажом 7 трав 45ml	664	Косметика (folder)/Крем для лица	4890217	Нэфис целебные травы
5019307	4604094031627	Крем для лица нэфис целебные травы с маслом пшеницы, 45ml	664	Косметика (folder)/Крем для лица	4890217	Нэфис целебные травы
480161	4600702016017	Крем для лица облепиха питат. для нор/к 42g	664	Косметика (folder)/Крем для лица	633	Сто Рецептов Красоты
9819	4600702026474	Крем для лица облепиховый для норм/жирн кожи 42ml/калина/32	664	Косметика (folder)/Крем для лица	620	Прочие Калина
3376610	4680008981936	Крем для лица овощная диета с экстратом моркови 75ml тв/у	664	Косметика (folder)/Крем для лица	0	
480322	5906750826899	Крем для лица огурец секреты природы 85ml отбеливающ.	664	Косметика (folder)/Крем для лица	0	
231760	4820003381885	Крем для лица огуречный 40g	664	Косметика (folder)/Крем для лица	0	
1781638	4600702095838	Крем для лица огуречный увлажняющий 45ml/калина/35	664	Косметика (folder)/Крем для лица	18324	КАЛИНА
480162	4600702000580	Крем для лица оливковый питат. для сух/нор/к 42g	664	Косметика (folder)/Крем для лица	3725526	OLIVKOVIY (KALINA (URALSKIE SAMOTSVETY))
5458724	1395745015372	Крем для лица омолаживающий beauty style матриксил Gold с аппликатором, 50г 4515926	5586	Косметика (folder)/Косметика	342690	Beauty Style
5458725	8801053201565	Крем для лица омолаживающий beauty style матриксил Gold с аппликатором, 50г 4515926 #2	5586	Косметика (folder)/Косметика	342690	Beauty Style
1837953	4607014955300	Крем для лица ос.с.в. днев.увл.75ml	664	Косметика (folder)/Крем для лица	0	
742611	460701495220	Крем для лица особая серия для всех тип.к.75	664	Косметика (folder)/Крем для лица	0	
12496	4607014952200	Крем для лица особая серия дневной зародыши пшеницы и белый виноград 75ml туба	664	Косметика (folder)/Крем для лица	12489	Особая серия
12497	4607014952217	Крем для лица особая серия ночной 75m (24ш/у) облепиха и овсяное молочко	664	Косметика (folder)/Крем для лица	12489	Особая серия
12498	4607014953252	Крем для лица особая серия отбеливающий для всех типов кожи 75ml	664	Косметика (folder)/Крем для лица	12489	Особая серия
4176	4607014952590	Крем для лица особая серия специальный после бани и сауны 75ml	664	Косметика (folder)/Крем для лица	12489	Особая серия
1781640	4600702095807	Крем для лица персиковый защитный 45ml/калина/35	664	Косметика (folder)/Крем для лица	3731122	PERSIKOVIY (KALINA (URALSKIE SAMOTSVETY))
480323	4820026140506	Крем для лица петрушка 60g	664	Косметика (folder)/Крем для лица	0	
1676743	460073200200	Крем для лица пилинг Linda 50ml	664	Косметика (folder)/Крем для лица	10012	Линда
480324	4823015919961	Крем для лица питательний elfa dr.sante olivio lux	664	Косметика (folder)/Крем для лица	261925	Elfa Dr.Sante
5458726	3282770209402	Крем для лица питательный avene sensibles восстановление, 50ml 215164	664	Косметика (folder)/Крем для лица	206708	Avene
2808991	3337872413575	Крем для лица питательный La roche posay nutritic Riche глубокое восстановление кожи, 50ml m5044200	1	Неклассифицированные/default	302307	La Roche-Posay
742613	4603023063982	Крем для лица питательный интенсив орхидея 30ml	664	Косметика (folder)/Крем для лица	0	
1965128	4600697192321	Крем для лица питательный с ромашкой (ОАО невская косметика)	664	Косметика (folder)/Крем для лица	3892723	ромашка (NEVSKAYA KOSMETIKA)
5019308	6947790767819	Крем для лица Плюс база для макияжа bioaqua Light and Water 7819	664	Косметика (folder)/Крем для лица	0	
5019309	8809587524839	Крем для лица подтягивающий с коллагеном collagen Power lifting crem, mizon, 35g туба (6) 524839	664	Косметика (folder)/Крем для лица	0	
9821	4600702026337	Крем для лица полюшко для сух/норм кожи 42ml/калина/32	664	Косметика (folder)/Крем для лица	620	Прочие Калина
480164	4600702000559	Крем для лица полюшко питат. для сух/нор/кожи 42ml	664	Косметика (folder)/Крем для лица	633	Сто Рецептов Красоты
75705	3600520088457	Крем для лица после загара L'oreal 50ml	664	Косметика (folder)/Крем для лица	2626	L'Oreal
5458727	4603726763899	Крем для лица после загара и тела achromin освежающий, 250ml 28390 achromin	664	Косметика (folder)/Крем для лица	4807169	Achromin
742908	4607002055203	Крем для лица природная аптека 40ml восст.упругости	664	Косметика (folder)/Крем для лица	0	
