ID	UPCEAN	Name	CategoryID	CategoryName	BrandID	BrandName
1346814	4607049784371	Ящик для растен martika пл 40см фелиция с под мрам арт с 185м	1	Неклассифицированные/default	3279457	martika
3604393	4607049784364	Ящик для растен martika пл 40см фелиция с под террак арт с 185м	1	Неклассифицированные/default	3279457	martika
1821068	4607049781356	Ящик для растений колывань 40см с поддоном	561877	Растениеводство/Товары для садоводства	3279457	martika
871450	4750701180674	Ящик для снастей №2 400x195 x210 90кг	562237	Спорт и отдых (folder)/Рыбалка (folder)/Рыбалка	0	
2765666	4690231137680	Ящик для хранения 12л optima bq2571	1	Неклассифицированные/default	0	
871452	8711295882876	Ящик для хранения 30x20 x15 cm	3536	Хозяйственные товары (folder)/Хозяйственные товары	0	
3001517	8711295882869	Ящик для хранения 30x20 x15 cm #2	3536	Хозяйственные товары (folder)/Хозяйственные товары	0	
871453	3253925000229	Ящик для хранения 30л	3536	Хозяйственные товары (folder)/Хозяйственные товары	0	
3604395	3253920033123	Ящик для хранения 30л #2	1	Неклассифицированные/default	0	
2274332	4690462337965	Ящик для хранения 40.5x28 x 30см	3536	Хозяйственные товары (folder)/Хозяйственные товары	2255494	GULLIVER (Дерево)
2952703	6948743101292	Ящик для хранения 43x27 x 27см 4f-101b.хаузманн	1	Неклассифицированные/default	0	
2952704	6948743102299	Ящик для хранения 43x54 x 18см 4f-102b.хаузманн	1	Неклассифицированные/default	0	
5113745	4605196022735	Ящик для хранения 5.5л 340x190 x 120мм прозрачный м/2351	3536	Хозяйственные товары (folder)/Хозяйственные товары	0	
5113746	4605196022766	Ящик для хранения 50л 530x370 x 300мм прозрачный м/2354	3536	Хозяйственные товары (folder)/Хозяйственные товары	0	
871455	3253924701158	Ящик для хранения deco's cars 23л	3536	Хозяйственные товары (folder)/Хозяйственные товары	0	
3001518	5996093322196	Ящик для хранения deco's cars 23л #2	3536	Хозяйственные товары (folder)/Хозяйственные товары	0	
871456	3253924701127	Ящик для хранения deco's winne 23л	3536	Хозяйственные товары (folder)/Хозяйственные товары	0	
3001519	5907753215499	Ящик для хранения deco's winne 23л #2	3536	Хозяйственные товары (folder)/Хозяйственные товары	0	
3604320	4690231093023	Ящик для хранения mybok 5.1л	1	Неклассифицированные/default	0	
3604321	4690231139325	Ящик для хранения optima брызги 57л	1	Неклассифицированные/default	0	
330507	4690231023174	Ящик для хранения plastic centre ibox CD	3536	Хозяйственные товары (folder)/Хозяйственные товары	54493	Пластик-Центр
330508	4690231023198	Ящик для хранения plastic centre ibox DVD	3536	Хозяйственные товары (folder)/Хозяйственные товары	54493	Пластик-Центр
330509	4690231019832	Ящик для хранения x-Box 12.5л лего	3536	Хозяйственные товары (folder)/Хозяйственные товары	309375	ООО Пи энд Си
3604327	4690231108505	Ящик для хранения x-Box 12л	1	Неклассифицированные/default	0	
330510	4690231019818	Ящик для хранения x-Box 7.5л лего	3536	Хозяйственные товары (folder)/Хозяйственные товары	309375	ООО Пи энд Си
3604328	4690231027813	Ящик для хранения x-Box на роликах пластик 57л 610x406 x 330мм	1	Неклассифицированные/default	0	
3604397	6907001421145	Ящик для хранения арт.142-114	1	Неклассифицированные/default	0	
2952702	6948743410875	Ящик для хранения без крыш.31x34 x29.5см 4p-108.хаузманн	1	Неклассифицированные/default	0	
2506003	8711295149467	Ящик для хранения быт.из.48x35 x 24 (0350	3536	Хозяйственные товары (folder)/Хозяйственные товары	0	
2506004	8711295534041	Ящик для хранения быт.изд.на кол.(0050	3536	Хозяйственные товары (folder)/Хозяйственные товары	0	
330511	4690290198134	Ящик для хранения мелочей 8.5л	3536	Хозяйственные товары (folder)/Хозяйственные товары	309375	ООО Пи энд Си
736776	4601532809022	Ящик для хранения мелочей школа, 6.5л, (в18*ш31*г 20см), пластик, с дополн. вкладышем, син,4380902	3536	Хозяйственные товары (folder)/Хозяйственные товары	145147	Полимербыт
2506005	8022621059054	Ящик для хранения мя-14 сирень 25x14 xh10 гифт лэнд	3536	Хозяйственные товары (folder)/Хозяйственные товары	1242086	Гифт
2506006	8022621059047	Ящик для хранения мя-14 уютный дом 25x14 xh10 гифт лэнд	3536	Хозяйственные товары (folder)/Хозяйственные товары	1242086	Гифт
871459	4607023590820	Ящик для хранения обуви большой, (в13*ш38*г 20.5см), прозрачный, м2869	3536	Хозяйственные товары (folder)/Хозяйственные товары	555296	М-Пластик
871460	4607023590813	Ящик для хранения обуви малый, (в 10.5*ш32*г 19см), прозрачный, м2868	3536	Хозяйственные товары (folder)/Хозяйственные товары	555296	М-Пластик
330515	3253920032034	Ящик для хранения оптима 15л (прозрачн/голубой/серебристый)	3536	Хозяйственные товары (folder)/Хозяйственные товары	311922	Curver CHEF HOME
330513	3253920033031	Ящик для хранения оптима 30л (прозрачн/голубой/серебристый)	3536	Хозяйственные товары (folder)/Хозяйственные товары	311922	Curver CHEF HOME
330514	3253920031006	Ящик для хранения оптима 5л (прозрачн/голубой/серебристый)	3536	Хозяйственные товары (folder)/Хозяйственные товары	311922	Curver CHEF HOME
5113747	4640028410021	Ящик для хранения с крышкой 5л basic (16) fb1031-16	3536	Хозяйственные товары (folder)/Хозяйственные товары	0	
871492	4690231059944	Ящик для хранения Смешарики	3536	Хозяйственные товары (folder)/Хозяйственные товары	0	
3001520	4690231059906	Ящик для хранения Смешарики #2	3536	Хозяйственные товары (folder)/Хозяйственные товары	0	
871491	4690231059869	Ящик для хранения Смешарики 57л	3536	Хозяйственные товары (folder)/Хозяйственные товары	0	
315829	4601532008104	Ящик для хранения универсальный 10л, (в190*ш355*г 235см),пластик,крышка с ручкой,на защел,син,4381000	3536	Хозяйственные товары (folder)/Хозяйственные товары	145147	Полимербыт
871461	4607023590707	Ящик для хранения универсальный 14л, крышка на защелках, (в 17.8*ш 42.7*г 28.9см), прозрачный, м2866	3536	Хозяйственные товары (folder)/Хозяйственные товары	299129	idea
736771	4601532008111	Ящик для хранения универсальный 15л, (в420*ш260*г 220см),пластик,крышка с ручкой,на защел,син,4381100	3536	Хозяйственные товары (folder)/Хозяйственные товары	145147	Полимербыт
871462	4607023590714	Ящик для хранения универсальный 25л, крышка на защелках, (в24*ш 48.4*г 32см), прозрачный, м2867	3536	Хозяйственные товары (folder)/Хозяйственные товары	299129	idea
330519	4601532480016	Ящик для хранения универсальный 43л, (в25*ш47*г 37см), пластик,2отсека для мелочей в крышке,син,4348001	3536	Хозяйственные товары (folder)/Хозяйственные товары	145147	Полимербыт
241560	4601532004700	Ящик для хранения универсальный 65л, (в20*ш74*г 44см), пластик, подкроватный, на колесах, сер,4347000	3536	Хозяйственные товары (folder)/Хозяйственные товары	145147	Полимербыт
871463	4607016814605	Ящик для хранения универсальный Кристалл 18л (в17*ш40.5*г 33.5см) прозрачный, 4312493	3536	Хозяйственные товары (folder)/Хозяйственные товары	54486	Бытпласт
871464	4607016814612	Ящик для хранения универсальный Кристалл 9л, (в8.50*ш40*г 33.5см) прозрачный, 4312494	3536	Хозяйственные товары (folder)/Хозяйственные товары	54486	Бытпласт
871465	4607016815084	Ящик для хранения универсальный, на колесах, (г60*в36*ш 40см), прозрачный, цветные крышки, 4312443 	3536	Хозяйственные товары (folder)/Хозяйственные товары	0	
871466	4690290009980	Ящик для хранения штабелируемый 30л, (в17*ш60*г 40см), цвет синий, pt9959	3536	Хозяйственные товары (folder)/Хозяйственные товары	0	
871467	4690290001687	Ящик для хранения штабелируемый 60л, (в60*ш40*г 34см), цвет синий, pt9954	3536	Хозяйственные товары (folder)/Хозяйственные товары	1575181	Plast Team
3604406	4627096319395	Ящик для цв изюминка 6л с\п (прямоуг) (корич) /24 (альтернатива) Россия	1	Неклассифицированные/default	0	
5113748	4627096319418	Ящик для цв изюминка 6л с\п (прямоуг) белый /24 (альтернатива) Россия	1	Неклассифицированные/default	0	
871468	4811221000542	Ящик для цветов	561877	Растениеводство/Товары для садоводства	0	
553015	5907749902617	Ящик для цветов верона 261-00	561877	Растениеводство/Товары для садоводства	304865	PLAFOR
3604334	4627096319432	Ящик для цветов изюминка 12л прямоуг (коричневый) (упак 14)	1	Неклассифицированные/default	149661	Альтернатива
5113749	4627096319456	Ящик для цветов изюминка 12л прямоуг белый (упак 14)	1	Неклассифицированные/default	0	
170182	4605196002782	Ящик для цветов м-пластика lamela терракот. 100см	561877	Растениеводство/Товары для садоводства	3820881	М-Пластика Lamela
170183	4605196000559	Ящик для цветов м-пластика lamela терракот. 40см	561877	Растениеводство/Товары для садоводства	3820881	М-Пластика Lamela
2274333	8022621058941	Ящик для цветов моя семья мя-14 гифтхом	561877	Растениеводство/Товары для садоводства	1242086	Гифт
608663	4630004770034	Ящик для цветов настенный ing1433f 40x22 x 15см	561877	Растениеводство/Товары для садоводства	0	
3604399	4630008140888	Ящик для цветов пластиковый #2	1	Неклассифицированные/default	0	
3604400	4630018021825	Ящик для цветов пластиковый #3	1	Неклассифицированные/default	0	
3604398	4607168310765	Ящик для цветов с дренажной решеткой (цветной) /10 (радиан) Россия	1	Неклассифицированные/default	0	
3604401	4630008241011	Ящик для цветов с дренажной решеткой 590x185 x 125мм пластик	1	Неклассифицированные/default	0	
3604402	4630018021863	Ящик для цветов с дренажной решеткой 590x185 x 125мм пластик #2	1	Неклассифицированные/default	0	
3604391	4607168310352	Ящик для цветов с дренажной решеткой черный /10 (радиан) Россия	1	Неклассифицированные/default	0	
1346817	4607084475913	Ящик для цветов с под 360x150 x 125м 303 а м303 альтернатива	561877	Растениеводство/Товары для садоводства	149661	Альтернатива
2506007	4607084475937	Ящик для цветов с под 550x150 x 125м 304 а м304 альтернатива	561877	Растениеводство/Товары для садоводства	149661	Альтернатива
871469	4630008240243	Ящик для цветов черный 19x44 (средний) Ижевск	561877	Растениеводство/Товары для садоводства	0	
1346818	4811221000344	Ящик для яг. фруктов	3536	Хозяйственные товары (folder)/Хозяйственные товары	0	
3604407	4630008240236	Ящик инвикс-к для цветов б без дренажной решетки черный	1	Неклассифицированные/default	0	
3604408	4630008240250	Ящик инвис-к для цветов цветной (590x185 x125)	1	Неклассифицированные/default	0	
3604409	4630008240991	Ящик инвис-к для цветов цветной (590x185 x125) #2	1	Неклассифицированные/default	0	
3604410	4630008241004	Ящик инвис-к для цветов черный (590x185 x125)	1	Неклассифицированные/default	0	
871493	4607016814629	Ящик колор стайл универсальный 190x157 x 90см	3536	Хозяйственные товары (folder)/Хозяйственные товары	0	
871451	4607016814582	Ящик Кристалл хозяйствнный 2л 190x157 x 90см 12491	3536	Хозяйственные товары (folder)/Хозяйственные товары	54486	Бытпласт
5113750	4604819000082	Ящик Люкс плетенный с крышкой 42л	3536	Хозяйственные товары (folder)/Хозяйственные товары	0	
5113751	4604819000464	Ящик Люкс плетенный с крышкой m ассортим (6) 3002/3003	3536	Хозяйственные товары (folder)/Хозяйственные товары	0	
3604427	4605196016611	Ящик м-пластика idea алиц.балк.с под.тер.м3215 600мм	1	Неклассифицированные/default	3673575	М-Пластика Idea
3604421	4605196020021	Ящик м-пластика idea алиция балкон.с под.б/гл 1000мм	1	Неклассифицированные/default	3673575	М-Пластика Idea
3948131	4605196026955	Ящик м-пластика idea вязание для хранения с кр.бел рот.1.5л	3536	Хозяйственные товары (folder)/Хозяйственные товары	3673575	М-Пластика Idea
3948132	4605196026047	Ящик м-пластика idea вязание для хранения с кр.бел ротан.3л	3536	Хозяйственные товары (folder)/Хозяйственные товары	3673575	М-Пластика Idea
3948133	4605196026085	Ящик м-пластика idea вязание для хранения с кр.бел ротан.6л	3536	Хозяйственные товары (folder)/Хозяйственные товары	3673575	М-Пластика Idea
3948134	4605196026962	Ящик м-пластика idea вязание для хранения с кр.пурпур.1.5л	3536	Хозяйственные товары (folder)/Хозяйственные товары	3673575	М-Пластика Idea
3948135	4605196026054	Ящик м-пластика idea вязание для хранения с кр.пурпур.3л	3536	Хозяйственные товары (folder)/Хозяйственные товары	3673575	М-Пластика Idea
3948136	4605196026092	Ящик м-пластика idea вязание для хранения с кр.пурпур.6л	3536	Хозяйственные товары (folder)/Хозяйственные товары	3673575	М-Пластика Idea
3948137	4605196026979	Ящик м-пластика idea вязание для хранения с кр.фисташ.1.5л	3536	Хозяйственные товары (folder)/Хозяйственные товары	3673575	М-Пластика Idea
3948138	4605196026061	Ящик м-пластика idea вязание для хранения с кр.фисташ.3л	3536	Хозяйственные товары (folder)/Хозяйственные товары	3673575	М-Пластика Idea
3948139	4605196026108	Ящик м-пластика idea вязание для хранения с кр.фисташ.6л	3536	Хозяйственные товары (folder)/Хозяйственные товары	3673575	М-Пластика Idea
3948140	4605196026986	Ящик м-пластика idea вязание для хранения с кр.чай.роз.1.5л	3536	Хозяйственные товары (folder)/Хозяйственные товары	3673575	М-Пластика Idea
3370949	4605196026078	Ящик м-пластика idea вязание для хранения с кр.чай.роз.3л	1	Неклассифицированные/default	3673575	М-Пластика Idea
3948141	4605196026115	Ящик м-пластика idea вязание для хранения с кр.чай.роз.6л	3536	Хозяйственные товары (folder)/Хозяйственные товары	3673575	М-Пластика Idea
3948142	4605196026504	Ящик м-пластика idea вязание с крыш.м 2369-п 3л	231359	Посуда (folder)/Контейнер для продуктов	3673575	М-Пластика Idea
3604300	4605196022742	Ящик м-пластика idea м2352 с крышкой прозрачный 370x250 x 140мм 10л	1	Неклассифицированные/default	3673575	М-Пластика Idea
3948143	4605196026337	Ящик м-пластика idea мозаика балкон.фисташ.	3649594	Растениеводство/Поддоны и балконные ящики	3673575	М-Пластика Idea
3948144	4605196026320	Ящик м-пластика idea мозаика чайн.роза	3649594	Растениеводство/Поддоны и балконные ящики	3673575	М-Пластика Idea
3604303	4605196022728	Ящик м-пластика idea прозрачный полипропиленовый 2л	1	Неклассифицированные/default	3673575	М-Пластика Idea
2765657	4605196014723	Ящик м-пластика idea ротанг балкон.м3226 бел 600мм	1	Неклассифицированные/default	3673575	М-Пластика Idea
3604428	4605196023251	Ящик м-пластика деко с крышкой 190x160 x 90мм 2л	1	Неклассифицированные/default	155913	М-пластика
2506009	4605196015805	Ящик м-пластика складной ротанг 28x18.5x12.6см бежевый м2372	1	Неклассифицированные/default	155913	М-пластика
2506010	4605196015751	Ящик м-пластика складной ротанг 28x18.5x12.6см белый м2372	1	Неклассифицированные/default	155913	М-пластика
2765669	4605196015768	Ящик м-пластика складной ротанг 28x18.5x12.6см коричневый м2373	1	Неклассифицированные/default	155913	М-пластика
2506011	4605196015812	Ящик м-пластика складной ротанг 37x28 x 19см бежевый м2375	1	Неклассифицированные/default	155913	М-пластика
2506012	4605196015775	Ящик м-пластика складной ротанг 37x28 x 19см белый м2375	1	Неклассифицированные/default	155913	М-пластика
2506013	4605196015782	Ящик м-пластика складной ротанг 37x28 x 19см коричневый м2375	1	Неклассифицированные/default	155913	М-пластика
1980069	6953888564413	Ящик металлический 284x160 x78 матрикс 906055	1	Неклассифицированные/default	0	
5113752	4607115266725	Ящик минибокс-3 (10) бп526	3536	Хозяйственные товары (folder)/Хозяйственные товары	0	
3604431	4630030961260	Ящик мультипласт для метизов 150x95 x70	1	Неклассифицированные/default	0	
3604432	4630030961277	Ящик мультипласт для метизов 225x155 x120	1	Неклассифицированные/default	0	
871470	8404880656623	Ящик пластик 65606	41797	Инструменты (folder)/Инструмент	0	
871471	8412497033607	Ящик пластик на колесах 26л	3536	Хозяйственные товары (folder)/Хозяйственные товары	0	
871472	8412497033706	Ящик пластик на колесах диз 1	3536	Хозяйственные товары (folder)/Хозяйственные товары	0	
3604439	4601532004816	Ящик пластмассовый хозяйственный  470x365 x 245см 30л	1	Неклассифицированные/default	0	
871501	4810344033499	Ящик полесье цветочный №2 арт.3499	310878	Растениеводство/Горшок цветочный	0	
3948147	4601532809305	Ящик полимербыт 6.5л новый год 4380930	3536	Хозяйственные товары (folder)/Хозяйственные товары	145147	Полимербыт
871417	4601532809558	Ящик полимербыт Disney рисунок принцессы/феи пластиковый 310x200 x 180мм 6.5л	476072	Хозяйственные товары (folder)/Контейнер для игрушек	145147	Полимербыт
3604441	4601532508246	Ящик полимербыт бамбук пластиковый 15л 410x295 x 183мм	1	Неклассифицированные/default	145147	Полимербыт
3604442	4601532509243	Ящик полимербыт бамбук пластиковый 55л 410x295 x 312мм	1	Неклассифицированные/default	145147	Полимербыт
871422	4601532004809	Ящик полимербыт для елочных игрушек 470x370 x250 с48000	3536	Хозяйственные товары (folder)/Хозяйственные товары	145147	Полимербыт
5113753	4601532509113	Ящик полимербыт для угля 25л barbeque 4350911	3536	Хозяйственные товары (folder)/Хозяйственные товары	145147	Полимербыт
3604443	4601532005097	Ящик полимербыт для хранения 410x295 x 312мм 25 литров	1	Неклассифицированные/default	145147	Полимербыт
3604444	4601532005066	Ящик полимербыт для хранения мелочей 284x144 x 85мм	1	Неклассифицированные/default	145147	Полимербыт
241559	4601532001198	Ящик полимербыт для цветов 200мм с поддоном (63) (1 008) 11900	561877	Растениеводство/Товары для садоводства	145147	Полимербыт
3948148	4601532005080	Ящик полимербыт Профи 410x295 x183 15л	3536	Хозяйственные товары (folder)/Хозяйственные товары	145147	Полимербыт
871411	4601532809015	Ящик полимербыт Радуга детский пластиковый 310x200 x 180мм 6.5л	476072	Хозяйственные товары (folder)/Контейнер для игрушек	145147	Полимербыт
