ID	UPCEAN	Name	CategoryID	CategoryName	BrandID	BrandName
4211216	747014449226	Cd mark vickery mark vickery	4093300	Медиа (folder)/Media	0	
4211217	886975524129	Cd mark vincent my Dream -- mio visionario	4093300	Медиа (folder)/Media	0	
4211218	634479713927	Cd mark w schmidt sampler 2004	4093300	Медиа (folder)/Media	0	
4211219	634479388521	Cd mark wade wrong road to take	4093300	Медиа (folder)/Media	0	
4211220	794465732728	Cd mark Walker forever yours	4093300	Медиа (folder)/Media	0	
4211221	634479409721	Cd mark Walker lines of the truth	4093300	Медиа (folder)/Media	0	
4211222	783707401225	Cd mark wallace bluegrass state of mind	4093300	Медиа (folder)/Media	0	
4211223	634479360626	Cd mark wayne glasmire all of my heart	4093300	Медиа (folder)/Media	0	
4211224	783707345826	Cd mark weakland Little animals	4093300	Медиа (folder)/Media	0	
4211225	634479281228	Cd mark weber spiritual eyes	4093300	Медиа (folder)/Media	0	
4211226	783707415222	Cd mark weierman owe the devil	4093300	Медиа (folder)/Media	0	
4211227	656863861526	Cd mark weigle all that matters	4093300	Медиа (folder)/Media	0	
4211228	656863623421	Cd mark weigle different and the same	4093300	Медиа (folder)/Media	0	
4211229	656863324427	Cd mark weigle out of the loop	4093300	Медиа (folder)/Media	0	
4211230	656863306621	Cd mark weigle the truth is	4093300	Медиа (folder)/Media	0	
4211231	625989031021	Cd mark weinstein jazz world trios	4093300	Медиа (folder)/Media	0	
4211232	634479146527	Cd mark weinstein milling time	4093300	Медиа (folder)/Media	0	
4211233	624048003924	Cd mark weinstein seasoning	4093300	Медиа (folder)/Media	0	
4211234	764942995328	Cd mark weinstein three deuces	4093300	Медиа (folder)/Media	0	
4211235	061432528227	Cd mark wenner runs Good	4093300	Медиа (folder)/Media	0	
4211236	791022209624	Cd mark wenner&the bel airs mama tried	4093300	Медиа (folder)/Media	0	
4211237	783707476629	Cd mark westin move from center	4093300	Медиа (folder)/Media	0	
4211238	634479800627	Cd mark whitty under the influence	4093300	Медиа (folder)/Media	0	
4211239	634479729928	Cd mark williams here, there, and everywhere	4093300	Медиа (folder)/Media	0	
4211240	783707670522	Cd mark williams hold on	4093300	Медиа (folder)/Media	0	
4211241	761701156228	Cd mark wolfram piercing the celluloid veil	4093300	Медиа (folder)/Media	0	
4211242	761701191120	Cd mark wolfram saving egyptian film classics	4093300	Медиа (folder)/Media	0	
4211243	761701195029	Cd mark wolfram the interrogation	4093300	Медиа (folder)/Media	0	
4211244	650687260329	Cd mark Wood sanctuary	4093300	Медиа (folder)/Media	0	
4211245	088561504021	Cd mark Wood voodoo violince	4093300	Медиа (folder)/Media	0	
4211246	097149504025	Cd mark Wood voodoo violince #2	4093300	Медиа (folder)/Media	0	
4211247	724382036524	Cd mark, robin shout to the north	4093300	Медиа (folder)/Media	0	
2550146	7891360498131	Cd marker faber-castell	1	Неклассифицированные/default	0	
4211248	5029551910342	Cd marker pens 25g	1	Неклассифицированные/default	0	
4211249	765481772326	Cd markers Life size sole	4093300	Медиа (folder)/Media	0	
4211250	090771608529	Cd marketts, the out of limits	4093300	Медиа (folder)/Media	0	
4211251	634479424922	Cd marklyn marklyn	4093300	Медиа (folder)/Media	0	
4211252	634479377822	Cd marko ciciliani tullius rooms	4093300	Медиа (folder)/Media	0	
4211253	634479155628	Cd marko nadsworth universal ep	4093300	Медиа (folder)/Media	0	
4211254	761195109823	Cd marko yl??nen joonas kokkonen cello concerto	4093300	Медиа (folder)/Media	0	
4211255	783707825021	Cd marks of christ songs that surround me	4093300	Медиа (folder)/Media	0	
4211256	804879210023	Cd marks$leary rockin,rhythm and soul CD 4oz	1	Неклассифицированные/default	0	
4211257	754971001220	Cd markus James snakeskin violin	4093300	Медиа (folder)/Media	0	
4211258	8717306958837	Cd markus schulz world tour best of 2009	4093300	Медиа (folder)/Media	0	
4211259	075679220325	Cd marky mark and the funky bunch you gotta believe	4093300	Медиа (folder)/Media	0	
4211260	777521110722	Cd marla Jane i live my Life	4093300	Медиа (folder)/Media	0	
4211261	634479257728	Cd marla reid then god whispered	4093300	Медиа (folder)/Media	0	
4211262	786851140828	Cd marla sokoloff grateful	4093300	Медиа (folder)/Media	0	
4211263	634479030123	Cd marlee napurano starting	4093300	Медиа (folder)/Media	0	
4211264	634479547225	Cd marlena marlena	4093300	Медиа (folder)/Media	0	
4211265	806838108228	Cd marlene first breath	4093300	Медиа (folder)/Media	0	
4211266	731452441928	Cd marley bob&the wailers dreams of freedom bob mar	4093300	Медиа (folder)/Media	0	
4211267	731458640820	Cd marley bob&the wailers exodus (de luxe edition)	4093300	Медиа (folder)/Media	0	
4211268	731458884422	Cd marley bob&the wailers i know a place (cdm)	4093300	Медиа (folder)/Media	0	
4211269	731458671428	Cd marley bob&the wailers legend (de luxe edition)	4093300	Медиа (folder)/Media	0	
4211270	731452410320	Cd marley bob&the wailers Natural mystic	4093300	Медиа (folder)/Media	0	
4211271	731458655121	Cd marley bob&the wailers One Love:the very best of	4093300	Медиа (folder)/Media	0	
4211272	074645009025	Cd marley, bob bob marley	4093300	Медиа (folder)/Media	0	
4211273	741157121322	Cd marley, bob complete upsetter singles 1970-72	4093300	Медиа (folder)/Media	0	
4211274	075679016928	Cd marley, bob legend	4093300	Медиа (folder)/Media	0	
4211275	074646358825	Cd marley, bob trenchtown days birth of a legend	4093300	Медиа (folder)/Media	0	
4211276	760246706721	Cd marley, ky-mani many more roads	4093300	Медиа (folder)/Media	0	
4211277	077778603825	Cd marley, ziggy conscious party	4093300	Медиа (folder)/Media	0	
4211278	724384409821	Cd marley, ziggy reggae revolution the best of	4093300	Медиа (folder)/Media	0	
4211279	075596203227	Cd marley, ziggy&the melody makers fallen is babylon	4093300	Медиа (folder)/Media	0	
4211280	075596170222	Cd marley, ziggy&the melody makers free like we want 2 b	4093300	Медиа (folder)/Media	0	
4211281	075596239622	Cd marley, ziggy&the melody makers Spirit of music	4093300	Медиа (folder)/Media	0	
4211282	075596259026	Cd marley, ziggy&the melody makers ziggy marley & .. live, vol.1	4093300	Медиа (folder)/Media	0	
4211283	829757581422	Cd marlin believe	4093300	Медиа (folder)/Media	0	
4211284	776098986723	Cd marlin ramazzini quiero ser yo	4093300	Медиа (folder)/Media	0	
4211285	329847329526	Cd marlon Cherry elsewhere	4093300	Медиа (folder)/Media	0	
4211286	602527107394	Cd marlon estoy de pie	4093300	Медиа (folder)/Media	0	
4211287	829757301228	Cd marlon spike One step closer	4093300	Медиа (folder)/Media	0	
4211288	714151302325	Cd marmalade-reflections of my Life	4093300	Медиа (folder)/Media	0	
4211289	634479237829	Cd marnie vincolisi cosmic connection meditations	4093300	Медиа (folder)/Media	0	
4211290	634479237720	Cd marnie vincolisi meditation made Easy	4093300	Медиа (folder)/Media	0	
4211291	776127137423	Cd maro kiss my remix	4093300	Медиа (folder)/Media	0	
4211292	602517884250	Cd maroon 5 call and response the remix album	4093300	Медиа (folder)/Media	0	
3632566	4605026011557	Cd maroon 5 it won't be soon	4093300	Медиа (folder)/Media	0	
4211293	828766995220	Cd maroon 5 live friday the 13th	4093300	Медиа (folder)/Media	0	
4211294	602517533141	Cd maroon five won't go Home without you	4093300	Медиа (folder)/Media	0	
4211295	801841000224	Cd maroon migratory	4093300	Медиа (folder)/Media	0	
4211296	842977075885	Cd maroon shaker Modern belly dance [maroon shaker]	4093300	Медиа (folder)/Media	0	
4211297	801841000422	Cd maroon who the sky betrays	4093300	Медиа (folder)/Media	0	
4211298	600638987423	Cd marque surely soley souly	4093300	Медиа (folder)/Media	0	
4211299	680215310028	Cd marques callaway the story	4093300	Медиа (folder)/Media	0	
4211300	718122509270	Cd marques houston mr.houston	4093300	Медиа (folder)/Media	0	
4211301	600353005020	Cd marques wyatt sound design v1	4093300	Медиа (folder)/Media	0	
4211302	639842267922	Cd marquez, edith frente a ti	4093300	Медиа (folder)/Media	0	
4211303	660200206123	Cd marquez, Maria 11 Love stories	4093300	Медиа (folder)/Media	0	
4211304	753088202223	Cd marquise knox man child	4093300	Медиа (folder)/Media	0	
4211305	783707702728	Cd Mars Hill sink or swim	4093300	Медиа (folder)/Media	0	
4211306	602498602980	Cd Mars volta de-loused in the comatorium	4093300	Медиа (folder)/Media	0	
4211307	074645732329	Cd marsalis, branford buckshot lefonque	4093300	Медиа (folder)/Media	0	
4211308	074646385029	Cd marsalis, branford contemporary jazz	4093300	Медиа (folder)/Media	0	
4211309	696998925120	Cd marsalis, branford creation. orpheus chamber orchestra.	4093300	Медиа (folder)/Media	0	
4211310	074644608328	Cd marsalis, branford i heard you twice the first time	4093300	Медиа (folder)/Media	0	
4211311	074644071122	Cd marsalis, branford renaissance	4093300	Медиа (folder)/Media	0	
4211312	074646965528	Cd marsalis, branford requiem	4093300	Медиа (folder)/Media	0	
4211313	074644212228	Cd marsalis, branford romances for saxophone. b. marsalis, English chamber orch.	4093300	Медиа (folder)/Media	0	
4211314	074646787625	Cd marsalis, branford the Dark keys	4093300	Медиа (folder)/Media	0	
4211315	074644419924	Cd marsalis, branford trio jeepy	4093300	Медиа (folder)/Media	0	
4211316	074646363126	Cd marsalis, ellis duke in Blue	4093300	Медиа (folder)/Media	0	
4211317	074644750928	Cd marsalis, ellis heart of Gold	4093300	Медиа (folder)/Media	0	
4211318	074646912324	Cd marsalis, ellis twelve's it	4093300	Медиа (folder)/Media	0	
4211319	074646736920	Cd marsalis, ellis&marsalis, branford loved ones	4093300	Медиа (folder)/Media	0	
4211320	696998981720	Cd marsalis, wynton all rise	4093300	Медиа (folder)/Media	0	
4211321	074644247824	Cd marsalis, wynton baroque music for trumpets vivaldi, telemann, pachelbel, m.	4093300	Медиа (folder)/Media	0	
4211322	074646986028	Cd marsalis, wynton big train	4093300	Медиа (folder)/Media	0	
4211323	074644000924	Cd marsalis, wynton Black codes (from the underground)	4093300	Медиа (folder)/Media	0	
4211324	074644872927	Cd marsalis, wynton Blue interlude	4093300	Медиа (folder)/Media	0	
4211325	074644213720	Cd marsalis, wynton carnaval. marsalis, eastman wind ensemble, hunsberger	4093300	Медиа (folder)/Media	0	
4211326	074644528725	Cd marsalis, wynton crescent city christmas card	4093300	Медиа (folder)/Media	0	
4211327	074643953023	Cd marsalis, wynton Hot house flowers	4093300	Медиа (folder)/Media	0	
4211328	074646624425	Cd marsalis, wynton in gabriel's Garden. marsalis, English chamber orch., newm	4093300	Медиа (folder)/Media	0	
4211329	074644030822	Cd marsalis, wynton j mood	4093300	Медиа (folder)/Media	0	
4211330	074646299821	Cd marsalis, wynton jump start and jazz. wynton marsalis	4093300	Медиа (folder)/Media	0	
4211331	074644067521	Cd marsalis, wynton live at blues alley	4093300	Медиа (folder)/Media	0	
4211332	074646987629	Cd marsalis, wynton live at the village vanguard	4093300	Медиа (folder)/Media	0	
4211333	074646750322	Cd marsalis, wynton marsalis plays monk standard time vol. 4	4093300	Медиа (folder)/Media	0	
4211336	074645749723	Cd marsalis, wynton marsalis, wynton 'the London concert'. haydn, mozart, humme	4093300	Медиа (folder)/Media	0	
4211334	074646080429	Cd marsalis, wynton marsalis, wynton Classic wynton. (bach, purcell, handel, vi	4093300	Медиа (folder)/Media	0	
4211335	074644472622	Cd marsalis, wynton marsalis, wynton portrait of wynton marsalis	4093300	Медиа (folder)/Media	0	
4211337	074646987223	Cd marsalis, wynton mr.jelly lord standard time vol.6	4093300	Медиа (folder)/Media	0	
4211338	696998549623	Cd marsalis, wynton popular songs the best of wyton marsalis	4093300	Медиа (folder)/Media	0	
4211339	074643906128	Cd marsalis, wynton purcell/handel/torelli/ fasch/molter music for trumpet&or	4093300	Медиа (folder)/Media	0	
4211340	074645123929	Cd marsalis, wynton reel time. marsalis, roberts, o'connor, wilson, caesar	4093300	Медиа (folder)/Media	0	
4211341	074646219126	Cd marsalis, wynton selections from the village vanguard Box set	4093300	Медиа (folder)/Media	0	
4211342	074644797725	Cd marsalis, wynton soul gestures in southern Blue thick in the south vol. i	4093300	Медиа (folder)/Media	0	
4211343	074644046120	Cd marsalis, wynton standard time, vol. 1	4093300	Медиа (folder)/Media	0	
4211344	074644734621	Cd marsalis, wynton standard time, vol. 2	4093300	Медиа (folder)/Media	0	
4211345	074644509120	Cd marsalis, wynton the majesty of the blues	4093300	Медиа (folder)/Media	0	
4211346	074646987728	Cd marsalis, wynton the marciac suites	4093300	Медиа (folder)/Media	0	
4211347	074646892121	Cd marsalis, wynton the midnight blues (standard time vol. 5)	4093300	Медиа (folder)/Media	0	
4211348	074644614329	Cd marsalis, wynton the resolution of romance (standard time, vol.3)	4093300	Медиа (folder)/Media	0	
4211349	696998986220	Cd marsalis, wynton trumpet concertos	4093300	Медиа (folder)/Media	0	
4211350	074643757423	Cd marsalis, wynton wynton marsalis	4093300	Медиа (folder)/Media	0	
4211351	074646688021	Cd marsalis, wynton&marsalis, ellis Joe cool's blues	4093300	Медиа (folder)/Media	0	
4211352	074643784627	Cd marsalis/nat'l phil. orch./leppard hummel/haydn/l.mozart trumpet concertos	4093300	Медиа (folder)/Media	0	
4211353	057623104325	Cd marsh hugh shaking the pumpkin	4093300	Медиа (folder)/Media	0	
4211354	634479560422	Cd marsha mcfarland celebrate Life	4093300	Медиа (folder)/Media	0	
4211355	634479577123	Cd marsha mcfarland written with Love	4093300	Медиа (folder)/Media	0	
4211356	783707823027	Cd marshall artz here now	4093300	Медиа (folder)/Media	0	
4211357	793018284424	Cd marshall crenshaw 447	4093300	Медиа (folder)/Media	0	
4211358	793018283823	Cd marshall crenshaw 9v years	4093300	Медиа (folder)/Media	0	
4211359	075992387323	Cd marshall crenshaw Field Day	4093300	Медиа (folder)/Media	0	
4211360	707108805925	Cd marshall crenshaw i've suffered for my Art, now it's your turn	4093300	Медиа (folder)/Media	0	
4211361	795041777126	Cd marshall crenshaw jaggedland	4093300	Медиа (folder)/Media	0	
4211362	793018281522	Cd marshall crenshaw live? my truck is Home	4093300	Медиа (folder)/Media	0	
4211363	075992367325	Cd marshall crenshaw marshall crenshaw	4093300	Медиа (folder)/Media	0	
4211364	081227991623	Cd marshall crenshaw marshall crenshaw (de luxe ed.)	4093300	Медиа (folder)/Media	0	
4211365	793018282321	Cd marshall crenshaw miracle of science	4093300	Медиа (folder)/Media	0	
4211366	081227991524	Cd marshall crenshaw this is Easy the bestof	4093300	Медиа (folder)/Media	0	
4211367	789577085824	Cd marshall davis arise from within	4093300	Медиа (folder)/Media	0	
4211368	619981030328	Cd marshall hawkins marshall hawkins&seahawk	4093300	Медиа (folder)/Media	0	
4211369	778224164524	Cd marshall lawrence where's the party	4093300	Медиа (folder)/Media	0	
4211370	059582201022	Cd marshall lois schubert die schone mulle	4093300	Медиа (folder)/Media	0	
4211371	059582201121	Cd marshall lois schubert die winterreise	4093300	Медиа (folder)/Media	0	
4211372	634479046520	Cd marshall nanis authentic blues for jews	4093300	Медиа (folder)/Media	0	
4211373	829757163321	Cd marshall titus the reality of dreams project	4093300	Медиа (folder)/Media	0	
4211374	829757298429	Cd marshall titus titus vol.1	4093300	Медиа (folder)/Media	0	
4211375	639857823120	Cd marshall tucker band, the dedicated	4093300	Медиа (folder)/Media	0	
4211376	639857824028	Cd marshall tucker band, the face down the blues	4093300	Медиа (folder)/Media	0	
4211377	639857823922	Cd marshall tucker band, the gospel	4093300	Медиа (folder)/Media	0	
4211378	639857823526	Cd marshall tucker band, the greetings from south Carolina	4093300	Медиа (folder)/Media	0	
4211379	639857823427	Cd marshall tucker band, the just us	4093300	Медиа (folder)/Media	0	
4211380	639857823021	Cd marshall tucker band, the running like the wind	4093300	Медиа (folder)/Media	0	
4211381	639857823724	Cd marshall tucker band, the southern Spirit	4093300	Медиа (folder)/Media	0	
4211382	639857823328	Cd marshall tucker band, the tenth	4093300	Медиа (folder)/Media	0	
4211383	639857823229	Cd marshall tucker band, the tuckerized	4093300	Медиа (folder)/Media	0	
4211384	639857823823	Cd marshall tucker band, the walk outside the lines	4093300	Медиа (folder)/Media	0	
4211385	022775067729	Cd marshall tucker band, the where we all belong	4093300	Медиа (folder)/Media	0	
4211386	775020108523	Cd marshall tully marshall tully	4093300	Медиа (folder)/Media	0	
4211387	074648022922	Cd marshall, amanda amanda marshall	4093300	Медиа (folder)/Media	0	
4211388	074646756225	Cd marshall, amanda amanda marshall #2	4093300	Медиа (folder)/Media	0	
4211389	098707838521	Cd marshall, amanda birmingham (CD single)	4093300	Медиа (folder)/Media	0	
4211390	696998070226	Cd marshall, amanda everybody's got a story	4093300	Медиа (folder)/Media	0	
4211391	098700337229	Cd marshall, amanda marry me	4093300	Медиа (folder)/Media	0	
4211392	074648038022	Cd marshall, amanda tuesday's child	4093300	Медиа (folder)/Media	0	
4211393	711517632720	Cd Marta gomez Marta gomez	4093300	Медиа (folder)/Media	0	
4211394	711517659321	Cd Marta gomez solo es vivir	4093300	Медиа (folder)/Media	0	
4211395	880023100310	Cd Marta La sirena	4093300	Медиа (folder)/Media	0	
4211396	602498748886	Cd Marta sanchez en directo gira 2005 La coru?a	4093300	Медиа (folder)/Media	0	
4211397	061432220121	Cd Marta topferova homage to homeland czech, moravian&slovak folk songs	4093300	Медиа (folder)/Media	0	
4211398	028947750260	Cd martha argerich beethoven piano concertos no. 2&3	4093300	Медиа (folder)/Media	0	
4211399	709363721620	Cd martha blackard river romance	4093300	Медиа (folder)/Media	0	
4211400	634479010927	Cd martha Lipton blissville	4093300	Медиа (folder)/Media	0	
4211401	634479655425	Cd martha Lipton fickle fate	4093300	Медиа (folder)/Media	0	
4211402	828461001004	Cd martha munizzi change the world	4093300	Медиа (folder)/Media	0	
4211403	081227997526	Cd martha stewart living spooky scary sounds for hall..	4093300	Медиа (folder)/Media	0	
4211404	081227432829	Cd martha stewart living summer entertaining	4093300	Медиа (folder)/Media	0	
4211405	601143111624	Cd martha wainwright i know you???re married but i???ve got feelings too	4093300	Медиа (folder)/Media	0	
4211406	724349600126	Cd martha&the muffins then again a retrospective + New	4093300	Медиа (folder)/Media	0	
4211407	602517773325	Cd martha&the vandellas definitive collection	4093300	Медиа (folder)/Media	0	
4211408	783707670423	Cd martha's trouble still	4093300	Медиа (folder)/Media	0	
4211409	783707817323	Cd martian acres middle of the Night	4093300	Медиа (folder)/Media	0	
4211410	708857974627	Cd martignon, hector the foreign affair	4093300	Медиа (folder)/Media	0	
4211411	8715440004304	Cd martijn schok boogie and blues band let the four winds blow	4093300	Медиа (folder)/Media	0	
4211412	8712604571047	Cd martijn schok doing the boogie woogie	4093300	Медиа (folder)/Media	0	
4211413	8715440004335	Cd martijn schok solo boogie woogie and blues piano	4093300	Медиа (folder)/Media	0	
4211414	8712604571115	Cd martijn schok trainride	4093300	Медиа (folder)/Media	0	
4211415	074644429022	Cd martika martika	4093300	Медиа (folder)/Media	0	
4211416	803763014129	Cd Martin adu i have his promise	4093300	Медиа (folder)/Media	0	
4211417	634479023422	Cd Martin adu let there be praise	4093300	Медиа (folder)/Media	0	
4211418	017046971522	Cd Martin denny quiet village/ the enchanted sea	4093300	Медиа (folder)/Media	0	
4211419	634479612022	Cd Martin eden devolver	4093300	Медиа (folder)/Media	0	
4211420	048248123327	Cd Martin hayes welcome here again	4093300	Медиа (folder)/Media	0	
4211421	829757433424	Cd Martin Jack rosenblum swamp river	4093300	Медиа (folder)/Media	0	
4211422	634479247521	Cd Martin jude phraseology	4093300	Медиа (folder)/Media	0	
4211423	829757583921	Cd Martin kenny window to my soul	4093300	Медиа (folder)/Media	0	
4211424	822597001020	Cd Martin lass sonnet	1	Неклассифицированные/default	0	
4211425	094637590621	Cd Martin neary faur?? requiem	4093300	Медиа (folder)/Media	0	
4211426	669311206824	Cd Martin o'donnell halo 3 odst	4093300	Медиа (folder)/Media	0	
4211427	093624729723	Cd Martin One shade of Love	4093300	Медиа (folder)/Media	0	
4211428	089408059421	Cd Martin pearlman handel music for the Royal fireworks	4093300	Медиа (folder)/Media	0	
4211429	625989144622	Cd Martin posen listening hands	4093300	Медиа (folder)/Media	0	
4211430	621950006029	Cd Martin posen triple heater	4093300	Медиа (folder)/Media	0	
4211431	053436827925	Cd Martin rev Martin rev	4093300	Медиа (folder)/Media	0	
4211432	053436822029	Cd Martin rev see me ridin'	4093300	Медиа (folder)/Media	0	
4211433	634479654626	Cd Martin rivas bottleneck	4093300	Медиа (folder)/Media	0	
4211434	634457183322	Cd Martin sexton seeds	4093300	Медиа (folder)/Media	0	
4211435	634457503021	Cd Martin sexton solo	4093300	Медиа (folder)/Media	0	
4211436	099923774525	Cd Martin West pyotr il???yich tchaikovsky the nutcracker	4093300	Медиа (folder)/Media	0	
4211437	054391691927	Cd Martin who	4093300	Медиа (folder)/Media	0	
4211438	765387718428	Cd Martin yates Richard arnell piano concerto	4093300	Медиа (folder)/Media	0	
4211439	656453394120	Cd Martin zellar scattered	1	Неклассифицированные/default	0	
4211440	656453393925	Cd Martin zellar&the hardaways the many moods of Martin zellar and the haradways	1	Неклассифицированные/default	0	
4211441	078221902021	Cd Martin, andrea the best of me	4093300	Медиа (folder)/Media	0	
4211442	696998511521	Cd Martin, brad wings of a honky tonk Angel	4093300	Медиа (folder)/Media	0	
4211443	715187738324	Cd Martin, dean all-time greatest hits	4093300	Медиа (folder)/Media	0	
4211444	724349496125	Cd Martin, dean greatest hits	4093300	Медиа (folder)/Media	0	
4211445	724352150922	Cd Martin, dean hurtin' country songs	4093300	Медиа (folder)/Media	0	
4211446	724353375126	Cd Martin, dean italian Love songs	4093300	Медиа (folder)/Media	0	
4211447	724352150823	Cd Martin, dean late at Night with	4093300	Медиа (folder)/Media	0	
4211448	724349573529	Cd Martin, dean making spirits Bright christmas collection	4093300	Медиа (folder)/Media	0	
4211449	724382938927	Cd Martin, dean spotlight on...	4093300	Медиа (folder)/Media	0	
4211450	724354179228	Cd Martin, dean swingin' with dino	4093300	Медиа (folder)/Media	0	
4211451	724383757121	Cd Martin, dean that's amore the best of dean Martin	4093300	Медиа (folder)/Media	0	
4211452	077779840922	Cd Martin, dean the capitol years (2 cds)	4093300	Медиа (folder)/Media	0	
4211453	724385531323	Cd Martin, dean the very best of	4093300	Медиа (folder)/Media	0	
4211454	724352419524	Cd Martin, dean the very best of dean Martin	4093300	Медиа (folder)/Media	0	
4211455	724385454622	Cd Martin, dean this time im swingin / pretty Baby (2-fer)	4093300	Медиа (folder)/Media	0	
4211456	724353263126	Cd Martin, George produced by George Martin (6 CD)	4093300	Медиа (folder)/Media	0	
4211457	777521141320	Cd Martin, Jean get together weather	4093300	Медиа (folder)/Media	0	
4211458	055490000924	Cd Martin, nicole 20 ans d'amour (hlts)	4093300	Медиа (folder)/Media	0	
4211459	779667003524	Cd Martin, nicole grands succes vol.1	4093300	Медиа (folder)/Media	0	
4211460	779667003623	Cd Martin, nicole grands succes vol.2	4093300	Медиа (folder)/Media	0	
4211461	779667002220	Cd Martin, nicole un noel d'amour	4093300	Медиа (folder)/Media	0	
4211462	074649115920	Cd Martin, ricky a medio vivir	4093300	Медиа (folder)/Media	0	
4211463	074645019321	Cd Martin, ricky La historia	4093300	Медиа (folder)/Media	0	
4211464	098707959622	Cd Martin, ricky loaded	4093300	Медиа (folder)/Media	0	
4211465	074649122829	Cd Martin, ricky me amaras	4093300	Медиа (folder)/Media	0	
4211466	074649122720	Cd Martin, ricky ricky Martin (first latin album)	4093300	Медиа (folder)/Media	0	
4211467	074646139424	Cd Martin, ricky sound loaded	4093300	Медиа (folder)/Media	0	
4211468	074649158026	Cd Martin, ricky the best of ricky Martin	4093300	Медиа (folder)/Media	0	
4211469	074649118327	Cd Martin, ricky vuelve	4093300	Медиа (folder)/Media	0	
4211470	093624688723	Cd Martin, steve comedy is not pretty	4093300	Медиа (folder)/Media	0	
4211471	093624569428	Cd Martin, steve let's get small	4093300	Медиа (folder)/Media	0	
4211472	078636939728	Cd Martin, tony rca 100th anniversary series tony martin's greatest hits	4093300	Медиа (folder)/Media	0	
4211473	775020429024	Cd martina griffiths powerful Baby	4093300	Медиа (folder)/Media	0	
4211474	886972774824	Cd martina mcbride playlist martina mcbride	4093300	Медиа (folder)/Media	0	
4211475	886973419021	Cd martina mcbride Shine	4093300	Медиа (folder)/Media	0	
4211476	828767242521	Cd martina mcbride timeless	4093300	Медиа (folder)/Media	0	
4211477	886970367424	Cd martina mcbride waking up laughing	4093300	Медиа (folder)/Media	0	
