ID	UPCEAN	Name	CategoryID	CategoryName	BrandID	BrandName
537263	28911470	Филе тилапии, кг, Китай	330591	Продукты питания (folder)/Продукты питания	0	
5795749	4630000374571	Филе трески 500г	3609100	Продукты питания (folder)/Рыба и морепродукты (folder)/Рыба замороженная	0	
3934248	5704025011885	Филе трески emborg с лайм и корианд 240	36552	Продукты питания (folder)/Рыба и морепродукты (folder)/Рыбные полуфабрикаты	3934247	EMBORG (F.UHRENHOLT DAIRY HOLDING)
3573729	4680007810046	Филе трески sirena без кожи морож мягуп 700g	330591	Продукты питания (folder)/Продукты питания	0	
3934252	4607048251249	Филе трески арсинтэк б/к Россия 500g	3609100	Продукты питания (folder)/Рыба и морепродукты (folder)/Рыба замороженная	3818837	АРСИНТЭК
853032	4607153851983	Филе тресковой рыбы бухта изобилия морож 400g	36552	Продукты питания (folder)/Рыба и морепродукты (folder)/Рыбные полуфабрикаты	62961	Бухта Изобилия
130247	4607153852010	Филе тресковой рыбы с/м в пан. 400g /бухта изобилия/	36552	Продукты питания (folder)/Рыба и морепродукты (folder)/Рыбные полуфабрикаты	62961	Бухта Изобилия
853033	4607153854427	Филе тресковой рыбы с/м с брокколи 400g /бухта изобилия/	330591	Продукты питания (folder)/Продукты питания	0	
853034	4607153854403	Филе тресковой рыбы с/м с картофельное пюре 350g /бухта изобилия/	330591	Продукты питания (folder)/Продукты питания	0	
2496172	4642821990311	Филе тресковый сытый слон 240g	41409	Продукты питания (folder)/Рыба и морепродукты (folder)/Морепродукты	0	
1708925	4646395993433	Филе тресковых пород в кляре 0.440	115797	Продукты питания (folder)/Рыба и морепродукты (folder)/Рыба	0	
2943512	4770190109932	Филе тресковых рыб с грибным соусом карт/кор 1/250g vici	330591	Продукты питания (folder)/Продукты питания	37382	VICI
2943513	4770190109956	Филе тресковых рыб со сливочным соусом и овощами карт/кор 1/250g vici	330591	Продукты питания (folder)/Продукты питания	37382	VICI
537265	28124382	Филе угря копченого замороженое 9oz, japan produkt, кг, Китай	330591	Продукты питания (folder)/Продукты питания	0	
537266	28716945	Филе угря копченого замороженое japan produkt, Китай	330591	Продукты питания (folder)/Продукты питания	0	
2943520	4665297250048	Филе угря финнмарк подкопчен.вак уп 250g	330591	Продукты питания (folder)/Продукты питания	0	
2943521	4670017633162	Филе утенка запеченное, вакуумный пакет, охлажденное	330591	Продукты питания (folder)/Продукты питания	0	
2943522	4670017633087	Филе утенка запеченное, монолит охлажденное	330591	Продукты питания (folder)/Продукты питания	0	
2943523	4670017633148	Филе утенка копчено-вареное, вакуумный пакет, охлажденное	330591	Продукты питания (folder)/Продукты питания	0	
2943524	4670017633216	Филе утенка копчено-вареное, гву, охлажденное	330591	Продукты питания (folder)/Продукты питания	0	
2943525	4670017633049	Филе утенка копчено-вареное, монолит охлажденное	330591	Продукты питания (folder)/Продукты питания	0	
132603	4607048750223	Филе утки плп в медовом конфю 410g охл.	100955	Продукты питания (folder)/Птица охлажденная	50363	ПЛП
132604	4607048750964	Филе утки плп по-пекински 410g охл.	100955	Продукты питания (folder)/Птица охлажденная	50363	ПЛП
2943527	4604598002314	Филе халяль охл вал.	330591	Продукты питания (folder)/Продукты питания	0	
2943528	4604800005867	Филе халяль охл фас	330591	Продукты питания (folder)/Продукты питания	0	
132471	4770190035477	Филе хоки vici б/кожи 400g	3609100	Продукты питания (folder)/Рыба и морепродукты (folder)/Рыба замороженная	37382	VICI
132617	7893000759497	Филе цыпленка sadia брокколи/грибы/бел соус 600g	1180491	Продукты питания (folder)/Полуфабрикаты мясные	51718	Sadia
2943612	4631137722884	Филе цыпленка без кости к/в охлажд 0.025kg	1183382	Продукты питания (folder)/Мясные продукты	0	
2943614	4631137722907	Филе цыпленка без кости к/в охлажд 0.06kg	1183382	Продукты питания (folder)/Мясные продукты	0	
2943613	4631137722891	Филе цыпленка без кости к/в охлажд 50g	1183382	Продукты питания (folder)/Мясные продукты	0	
168398	4607088661404	Филе цыпленка в слив соусе жб 0.340	23172	Продукты питания (folder)/Консервы (folder)/Консервы мясные	0	
29226	4606993102675	Филе цыпленка Золотой петушок бедра в панировке 420g	38685	Продукты питания (folder)/Птица замороженная	29212	Золотой Петушок
2943374	4670004860144	Филе цыпленка охл на подл. деревенские напевы/тендер	1183382	Продукты питания (folder)/Мясные продукты	0	
2496178	4603552001998	Филе цыпленка с гречей дом/бистро 0.150	28312	Продукты питания (folder)/Продукты быстрого приготовления	0	
2900745	4607035851773	Филе цыпленка сытый боярин в собств соку 325g	1183382	Продукты питания (folder)/Мясные продукты	0	
2943531	4607149452743	Филе цыпленка часар 0.300	1183382	Продукты питания (folder)/Мясные продукты	0	
3573805	4607149454174	Филе часар рыбное кусочки в панировке 240g т/у	330591	Продукты питания (folder)/Продукты питания	3620244	BARSKIY STOL
1708920	4607149453405	Филе часар цыпленка кусочки в хрустящей панировке мягуп 400g	144932	Продукты питания (folder)/Полуфабрикаты	0	
3573806	4620003240645	Филе череповчанка, сельди, 350g пл/б	330591	Продукты питания (folder)/Продукты питания	0	
2761795	4607014518246	Филе чехони 40g	1661897	Продукты питания (folder)/Рыба и морепродукты (folder)/Рыба сушеная вяленая	0	
3573807	4630009984825	Филе экор сельди с овощами, 220g пл/б	330591	Продукты питания (folder)/Продукты питания	0	
132618	4607086900659	Филе-бургер минтай интеррыбпродукт 370g	36552	Продукты питания (folder)/Рыба и морепродукты (folder)/Рыбные полуфабрикаты	0	
132619	4607086900567	Филе-бургер треска интеррыбпродукт 370g	36552	Продукты питания (folder)/Рыба и морепродукты (folder)/Рыбные полуфабрикаты	0	
2943661	4670026483352	Филе-кусок нерки охлажденный, кг	330591	Продукты питания (folder)/Продукты питания	0	
3573818	4607024420775	Филе-ломтики горбуша с/с ту 100g гер/уп ас соль	330591	Продукты питания (folder)/Продукты питания	0	
3573819	4607024420140	Филе-ломтики семга с/с ту 100g гер/уп ас соль	330591	Продукты питания (folder)/Продукты питания	0	
1334048	4810168005153	Филе-ломтики семги санта бремор слабосол.120g пл/уп	115797	Продукты питания (folder)/Рыба и морепродукты (folder)/Рыба	25488	Санта Бремор
132621	4007764692652	Филе-шлеммер пикенпак шампиньон 400g	36552	Продукты питания (folder)/Рыба и морепродукты (folder)/Рыбные полуфабрикаты	97154	Пикен Пак
3934274	4600625011106	Филевское blackcur. p b 0.08kg	30752	Продукты питания (folder)/Мороженое	82708	Филевское
3934275	4600625008106	Филевское cranberry p b 0.08kg	30752	Продукты питания (folder)/Мороженое	82708	Филевское
3934276	4600625000766	Филевское Cream p f 0.09kg	30752	Продукты питания (folder)/Мороженое	82708	Филевское
3934277	4600625308381	Филевское Cream p f 0.09kg #2	30752	Продукты питания (folder)/Мороженое	82708	Филевское
84890	4600625307537	Филевское Light berry diet shb ps 0.08kg	30752	Продукты питания (folder)/Мороженое	84861	Айсберри
3934278	4600625312449	Филевское Light berry diet shb ps 0.08kg #2	30752	Продукты питания (folder)/Мороженое	82708	Филевское
3934279	4607067932839	Филевское plm sn 0.08kg	30752	Продукты питания (folder)/Мороженое	82708	Филевское
3934280	4600625310209	Филевское plm ws 0.08kg	30752	Продукты питания (folder)/Мороженое	82708	Филевское
3934281	4607067935120	Филевское vanill plm ws 0.09kg	30752	Продукты питания (folder)/Мороженое	82708	Филевское
3934282	4607067935496	Филевское vanill plm ws 0.09kg #2	30752	Продукты питания (folder)/Мороженое	82708	Филевское
3934283	4607067937285	Филевское vanill plm ws 0.09kg #3	30752	Продукты питания (folder)/Мороженое	82708	Филевское
3657567	4640004761321	Филеево govyazh'i 0.4kg	113685	Продукты питания (folder)/Колбасные изделия (folder)/Сосиски, сардельки	3657566	Филеево
3657568	4640004762465	Филеево govyazh'i 0.4kg #2	113685	Продукты питания (folder)/Колбасные изделия (folder)/Сосиски, сардельки	3657566	Филеево
3657569	4640004760119	Филеево molochnye 0.4kg	113685	Продукты питания (folder)/Колбасные изделия (folder)/Сосиски, сардельки	3657566	Филеево
3657570	4640004761307	Филеево molochnye 0.4kg #2	113685	Продукты питания (folder)/Колбасные изделия (folder)/Сосиски, сардельки	3657566	Филеево
3657571	4640004761314	Филеево premim 0.4kg	113685	Продукты питания (folder)/Колбасные изделия (folder)/Сосиски, сардельки	3657566	Филеево
3657572	4640004763790	Филеево premim 0.4kg #2	113685	Продукты питания (folder)/Колбасные изделия (folder)/Сосиски, сардельки	3657566	Филеево
3657573	4640004761178	Филеево russ.trad doktor-gost колбаса bef&prk bol. bl 0.4kg	142954	Продукты питания (folder)/Колбасные изделия (folder)/Колбасные изделия	3657566	Филеево
2761797	4640004761352	Филеево ветчина говяжья 400g	330591	Продукты питания (folder)/Продукты питания	0	
2761821	4640004762472	Филеево паштет деликатесный 250g	330591	Продукты питания (folder)/Продукты питания	0	
2761823	4640004760843	Филеево строганина гов. с перцем с/к вак уп 25g	142954	Продукты питания (folder)/Колбасные изделия (folder)/Колбасные изделия	0	
2761825	4640004763516	Филеево строганина гов. с укропом с/к вак уп 25g	142954	Продукты питания (folder)/Колбасные изделия (folder)/Колбасные изделия	0	
2761826	4640004760911	Филеево строганина свин. с сыром с/к вак уп 25g	142954	Продукты питания (folder)/Колбасные изделия (folder)/Колбасные изделия	0	
853046	4607167171770	Филеечка деликатесная с/к серв 80g альмак	1183382	Продукты питания (folder)/Мясные продукты	722172	Альмак
3573808	4607167170261	Филеечка деликатесная с/к сервир 80g альмакроссия	330591	Продукты питания (folder)/Продукты питания	722172	Альмак
2943620	4680011723493	Филей (вес). продукты из свинины сыровяленые высшего сорта.	330591	Продукты питания (folder)/Продукты питания	0	
168399	4606979009639	Филей в оболочке с/к нарезке микоян 0.150	142954	Продукты питания (folder)/Колбасные изделия (folder)/Колбасные изделия	0	
2943621	4607135174789	Филей говяжий 250g п/ф мясной крупнокусковой б/к катег а охлажденный	144932	Продукты питания (folder)/Полуфабрикаты	3671512	HEREFORD (KIROVSKIY MK)
2943622	4650069407553	Филей говяжий охлажденный	330591	Продукты питания (folder)/Продукты питания	0	
2943623	4650069407560	Филей говяжий охлажденный #2	330591	Продукты питания (folder)/Продукты питания	0	
5099255	4630088700682	Филей говяжий с/к Барселона 70g касадемонт	4833848	Продукты питания (folder)/Мясные деликатесы	142959	КАСАДЕМОНТ
2943624	4650069407577	Филей говяжий халяль охлажденный	330591	Продукты питания (folder)/Продукты питания	0	
2943625	4650069407584	Филей говяжий халяль охлажденный #2	330591	Продукты питания (folder)/Продукты питания	0	
2943626	4610001906353	Филей гранд с/к катег а фас под вак 0.150kg (шт)	330591	Продукты питания (folder)/Продукты питания	0	
2943627	4607156931064	Филей из лопатки (охл)	330591	Продукты питания (folder)/Продукты питания	0	
2943628	4620767513726	Филей из свинины крупнокусковой безкостный п/ф зам	144932	Продукты питания (folder)/Полуфабрикаты	0	
2943629	4620767513603	Филей из свинины крупнокусковой безкостный п/ф охл	144932	Продукты питания (folder)/Полуфабрикаты	0	
3573809	4606420005388	Филей калининградский деликатес сыровяленый 90g пл/у	330591	Продукты питания (folder)/Продукты питания	0	
2943630	4610001907190	Филей конский янгаул с/к катег а фас под вак 0.100kg (шт)	330591	Продукты питания (folder)/Продукты питания	0	
2943631	4610001906377	Филей конский янгаул с/к катег а фас под вак 0.150kg (шт)	330591	Продукты питания (folder)/Продукты питания	0	
2943632	4610001907183	Филей олений полярная Звезда с/к катег а фас под вак 0.100kg (шт)	330591	Продукты питания (folder)/Продукты питания	0	
2943633	4610001906407	Филей олений полярная Звезда с/к катег а фас под вак 0.150kg (шт)	330591	Продукты питания (folder)/Продукты питания	0	
2943634	4610001907220	Филей по-австрийски с/к катег а фас под вак 0.100kg (шт)	330591	Продукты питания (folder)/Продукты питания	0	
2943635	4610001906384	Филей по-австрийски с/к катег а фас под вак 0.150kg (шт)	330591	Продукты питания (folder)/Продукты питания	0	
3573810	4607167172432	Филей праздничный мягуп 110g	330591	Продукты питания (folder)/Продукты питания	0	
2943636	4607030201214	Филей с перцем круп. кус с/к вак уп	330591	Продукты питания (folder)/Продукты питания	0	
5099256	4603725857469	Филей с/в из мраморной говядины с грецким орехом 70g амига	4833848	Продукты питания (folder)/Мясные деликатесы	4974435	Амига
132623	4605911007535	Филей с/к вак уп 100g лотос	142954	Продукты питания (folder)/Колбасные изделия (folder)/Колбасные изделия	0	
132624	4607040850068	Филей свиной с/к нар.100g анком	1183382	Продукты питания (folder)/Мясные продукты	37841	Анком
132625	4607040850211	Филей свиной с/к нар.130g анком	1183382	Продукты питания (folder)/Мясные продукты	37841	Анком
132626	4607163260010	Филей свиной славянское мясо вак уп 500g	37053	Продукты питания (folder)/Мясо замороженное	37054	Славянское мясо
3573811	4606420001656	Филей спинной с/к в нарезку 100g шт кд	330591	Продукты питания (folder)/Продукты питания	0	
3573812	4606420002998	Филей спиной нарезка 90g кд	330591	Продукты питания (folder)/Продукты питания	0	
2943637	4610001900306	Филей столичный к/в катег а	330591	Продукты питания (folder)/Продукты питания	0	
2943638	4610001906094	Филей столичный к/в катег а фас под вакуумом 0.150kg (шт)	330591	Продукты питания (folder)/Продукты питания	0	
2943639	4610001906100	Филей столичный с паприкой к/в катег а фас под вакуумом 0.150kg (шт)	330591	Продукты питания (folder)/Продукты питания	0	
1333815	4650061763473	Филей стрелецкий (говядина) к/в вак уп 1kg сибирский деликатес	1183382	Продукты питания (folder)/Мясные продукты	0	
2943640	4603725857384	Филей сыровяленый из мраморной говядины с трюфелем	330591	Продукты питания (folder)/Продукты питания	0	
2943641	4603725857735	Филей сыровяленый из мраморной говядины с трюфелем #2	330591	Продукты питания (folder)/Продукты питания	0	
2943642	4670014880064	Филей Царский с/в (вак.уп) 150g (нарезка)	330591	Продукты питания (folder)/Продукты питания	0	
132627	4607055650196	Филей Царский с/в нар.вак уп 150g петербурженка	1183382	Продукты питания (folder)/Мясные продукты	37829	Петербурженка
2943643	4607070198574	Филей шеи экстра prime	330591	Продукты питания (folder)/Продукты питания	0	
2943644	4607943496875	Филей янтарный из мяса цыплят-бройлеров вяленый (охлажденное, в модифицированной атмосфере, 10)	330591	Продукты питания (folder)/Продукты питания	0	
2943645	4607943492167	Филей янтарный из мяса цыплят-бройлеров вяленый (охлажденное, под вакуумом, 20)	330591	Продукты питания (folder)/Продукты питания	0	
2943646	4607943492037	Филейка варено-копченая (охлажденное, 5)	330591	Продукты питания (folder)/Продукты питания	0	
2943647	4607943496844	Филейка варено-копченая (охлажденное, в модифицированной атмосфере, 10)	330591	Продукты питания (folder)/Продукты питания	0	
2943648	4607943496851	Филейка варено-копченая (охлажденное, под вакуумом, 20)	330591	Продукты питания (folder)/Продукты питания	0	
2943649	4607155337249	Филейка индейки деликатесная, гву, охлажденная	330591	Продукты питания (folder)/Продукты питания	0	
2943650	4607155337003	Филейка индейки деликатесная, гву, охлажденная, фасовка 0.500kg	330591	Продукты питания (folder)/Продукты питания	0	
2943651	4607155336990	Филейка индейки деликатесная, гву, охлажденная, фасовка 0.700kg	330591	Продукты питания (folder)/Продукты питания	0	
2943652	4607155337010	Филейка индейки деликатесная, лоток, охлажденная	330591	Продукты питания (folder)/Продукты питания	0	
2943653	4606979031999	Филейка к/в крио	330591	Продукты питания (folder)/Продукты питания	0	
2943654	4606979031449	Филейка к/в крио круп/к	330591	Продукты питания (folder)/Продукты питания	0	
2943655	4606979022997	Филейка микоян к/в нарезка вак уп 150g	330591	Продукты питания (folder)/Продукты питания	37402	Микоян
2943657	4610007951319	Филейная по-татарски в штуках 400g	330591	Продукты питания (folder)/Продукты питания	0	
2943658	4610007951326	Филейная по-татарски вареная	330591	Продукты питания (folder)/Продукты питания	0	
2943659	4610007951302	Филейная по-татарски п/к	330591	Продукты питания (folder)/Продукты питания	0	
294570	5997001301524	Филергим р-р для внутривенного и подкожного введения 30млн.ме 1шт 795013 интас биофармасьютикалс ЛТД	210391	Лекарственные средства (folder)/Лекарственные средства	0	
294571	5997001301517	Филергим р-р для внутривенного и подкожного введения 48млн.ме 1шт 872406 интас биофармасьютикалс ЛТД	210391	Лекарственные средства (folder)/Лекарственные средства	0	
3934284	4620001173044	Филея фрикадельки говяжьи охл.250g	3739591	Продукты питания (folder)/Изделия из мяса охлажд	0	
3934285	4620001173051	Филея фрикадельки домашние охл.250g	3739591	Продукты питания (folder)/Изделия из мяса охлажд	1226889	Филея
1833285	4620001321339	Фили-бейкер торт пт.м.от ф-бей.с хал 420g	476443	Продукты питания (folder)/Кондитерские изделия (folder)/Торт	92773	Фили-Бейкер
1326539	4620001321094	Фили-бейкер торт тирамису 100g	476443	Продукты питания (folder)/Кондитерские изделия (folder)/Торт	92773	Фили-Бейкер
1706370	4620001321155	Фили-бейкер торт тирамису бисквит. 400g	476443	Продукты питания (folder)/Кондитерские изделия (folder)/Торт	92773	Фили-Бейкер
