ID	UPCEAN	Name	CategoryID	CategoryName	BrandID	BrandName
3584637	4607001832041	Чай Mix апельсин растворимый гранулированный 375g пл/б #2	21794	Продукты питания (folder)/Чай и кофе/Чай	0	
3584638	4607001832065	Чай Mix земляника растворимый гранулированный 375g пл/б #2	21794	Продукты питания (folder)/Чай и кофе/Чай	0	
3584639	4607001832119	Чай Mix лесные ягоды растворимый гранулированный 375g пл/б	21794	Продукты питания (folder)/Чай и кофе/Чай	0	
3584640	4607001832034	Чай Mix лимон растворимый гранулированный 375g пл/б	21794	Продукты питания (folder)/Чай и кофе/Чай	0	
3584641	4607001832072	Чай Mix малина растворимый гранулированный 375g пл/б	21794	Продукты питания (folder)/Чай и кофе/Чай	0	
3584642	4607001832102	Чай Mix мультивитамин растворимый гранулированный 375g пл/б	21794	Продукты питания (folder)/Чай и кофе/Чай	0	
3584643	4607001832096	Чай Mix фруктовый растворимый гранулированный 375g пл/б	21794	Продукты питания (folder)/Чай и кофе/Чай	0	
3584636	146070018320	Чай Mix черная смородина растворимый гранулированный 375g пл/б	21794	Продукты питания (folder)/Чай и кофе/Чай	0	
3584644	4607001832058	Чай Mix черная смородина растворимый гранулированный 375g пл/б #2	21794	Продукты питания (folder)/Чай и кофе/Чай	0	
3584645	4607001832089	Чай Mix экзотик растворимый гранулированный 375g пл/б	21794	Продукты питания (folder)/Чай и кофе/Чай	0	
1340081	4792175077432	Чай mlesna 3 вида черного чая матале набор (дерев кор) 75g цейлон	21794	Продукты питания (folder)/Чай и кофе/Чай	136593	Mlesna
1340082	4792175000676	Чай mlesna 6 видов черного чая цейлон дер.кор. 125g	21794	Продукты питания (folder)/Чай и кофе/Чай	136593	Mlesna
1340083	4792175000805	Чай mlesna 6 видов черный дер. кор.125g цейлон	21794	Продукты питания (folder)/Чай и кофе/Чай	136593	Mlesna
1841667	4792175057397	Чай mlesna ceyl.Gold чер.к.200g	21794	Продукты питания (folder)/Чай и кофе/Чай	136593	Mlesna
3940868	8886201057393	Чай mlesna ceyl.Gold чер.к.200g #2	21794	Продукты питания (folder)/Чай и кофе/Чай	136593	Mlesna
136627	8886201074598	Чай mlesna darjeeling 50пак*2g 100g	21794	Продукты питания (folder)/Чай и кофе/Чай	136593	Mlesna
136628	8886201047578	Чай mlesna darjeeling черн жб 100g	21794	Продукты питания (folder)/Чай и кофе/Чай	136593	Mlesna
1340088	4792175047886	Чай mlesna darjeeling черный жб 100g цейлон	21794	Продукты питания (folder)/Чай и кофе/Чай	136593	Mlesna
1340090	4792175047053	Чай mlesna earl grey 100гж/б шри ланка	21794	Продукты питания (folder)/Чай и кофе/Чай	136593	Mlesna
1340091	4792175003110	Чай mlesna earl grey дерев кор. 100g цейлон	21794	Продукты питания (folder)/Чай и кофе/Чай	136593	Mlesna
3940869	4792175006463	Чай mlesna earl grey кр.лист 200g	21794	Продукты питания (folder)/Чай и кофе/Чай	136593	Mlesna
136594	8886201057041	Чай mlesna английский завтрак 100g	21794	Продукты питания (folder)/Чай и кофе/Чай	136593	Mlesna
136596	8886201001716	Чай mlesna английский завтрак 50пак*2g 100g	21794	Продукты питания (folder)/Чай и кофе/Чай	136593	Mlesna
136595	8886201047073	Чай mlesna английский завтрак жб 100g	21794	Продукты питания (folder)/Чай и кофе/Чай	136593	Mlesna
1340084	4792175001710	Чай mlesna английский завтрак черный 50x 2g цейлон	21794	Продукты питания (folder)/Чай и кофе/Чай	136593	Mlesna
136597	8886201007176	Чай mlesna аром.бергамот зелен 100g дер.	21794	Продукты питания (folder)/Чай и кофе/Чай	136593	Mlesna
136598	8886201057287	Чай mlesna аром.бергамот зелен 200g	21794	Продукты питания (folder)/Чай и кофе/Чай	136593	Mlesna
136599	8886201006469	Чай mlesna аром.бергамот черн 200g	21794	Продукты питания (folder)/Чай и кофе/Чай	136593	Mlesna
136600	8886201005066	Чай mlesna аром.бергамот черн 50пак*2g 100g	21794	Продукты питания (folder)/Чай и кофе/Чай	136593	Mlesna
2966350	4792175005060	Чай mlesna аром.бергамот черн 50пак*2g 100g #2	21794	Продукты питания (folder)/Чай и кофе/Чай	136593	Mlesna
136601	8886201026139	Чай mlesna аром.голубика зелен 100g дер.	21794	Продукты питания (folder)/Чай и кофе/Чай	136593	Mlesna
136602	8886201057249	Чай mlesna аром.жасмин зелен 200g	21794	Продукты питания (folder)/Чай и кофе/Чай	136593	Mlesna
136603	8886201074840	Чай mlesna аром.жасмин зелен 50пак*2g 100g	21794	Продукты питания (folder)/Чай и кофе/Чай	136593	Mlesna
136604	8886201057331	Чай mlesna аром.жасмин черн 200g	21794	Продукты питания (folder)/Чай и кофе/Чай	136593	Mlesna
136605	8886201074079	Чай mlesna аром.жасмин черн 50пак*2g 100g	21794	Продукты питания (folder)/Чай и кофе/Чай	136593	Mlesna
136606	8886201003109	Чай mlesna аром.клубника 100g дер.	21794	Продукты питания (folder)/Чай и кофе/Чай	136593	Mlesna
136607	8886201026078	Чай mlesna аром.клубника зелен 100g дер.	21794	Продукты питания (folder)/Чай и кофе/Чай	136593	Mlesna
136608	8886201057294	Чай mlesna аром.клубника зелен 200g	21794	Продукты питания (folder)/Чай и кофе/Чай	136593	Mlesna
136609	8886201055122	Чай mlesna аром.клубника зелен 200g дер.	21794	Продукты питания (folder)/Чай и кофе/Чай	136593	Mlesna
136610	8886201074826	Чай mlesna аром.клубника зелен 50пак*2g 100g	21794	Продукты питания (folder)/Чай и кофе/Чай	136593	Mlesna
136611	8886201057218	Чай mlesna аром.клубника черн 200g	21794	Продукты питания (folder)/Чай и кофе/Чай	136593	Mlesna
136612	8886201074833	Чай mlesna аром.лимон 50пак*2g 100g	21794	Продукты питания (folder)/Чай и кофе/Чай	136593	Mlesna
136613	8886201026474	Чай mlesna аром.лимон зелен 100g дер.	21794	Продукты питания (folder)/Чай и кофе/Чай	136593	Mlesna
136614	8886201057270	Чай mlesna аром.персик/абрикос 200g	21794	Продукты питания (folder)/Чай и кофе/Чай	136593	Mlesna
2966351	8886201057324	Чай mlesna аром.персик/абрикос 200g #2	21794	Продукты питания (folder)/Чай и кофе/Чай	136593	Mlesna
136615	8886201026627	Чай mlesna аром.персик/абрикос зелен 100g дер.	21794	Продукты питания (folder)/Чай и кофе/Чай	136593	Mlesna
136616	8886201074123	Чай mlesna аром.персик/абрикос черн 50x 2g 100g	21794	Продукты питания (folder)/Чай и кофе/Чай	136593	Mlesna
136617	8886201026153	Чай mlesna аром.ревень/слива черн 100g дер.	21794	Продукты питания (folder)/Чай и кофе/Чай	136593	Mlesna
136618	8886201057409	Чай mlesna аром.саусеп зелен 200g	21794	Продукты питания (folder)/Чай и кофе/Чай	136593	Mlesna
136620	8886201057416	Чай mlesna аром.саусеп черн 200g	21794	Продукты питания (folder)/Чай и кофе/Чай	136593	Mlesna
136621	8886201074918	Чай mlesna аром.саусеп черн 50пак*2g 100g	21794	Продукты питания (folder)/Чай и кофе/Чай	136593	Mlesna
136622	8886201001327	Чай mlesna богатый настой черн 150g плет.корз.	21794	Продукты питания (folder)/Чай и кофе/Чай	136593	Mlesna
136623	4792175001338	Чай mlesna богатый настой черн 200g	21794	Продукты питания (folder)/Чай и кофе/Чай	136593	Mlesna
136624	8886201005714	Чай mlesna богатых первопроходцев 200g	21794	Продукты питания (folder)/Чай и кофе/Чай	136593	Mlesna
136625	8886201057126	Чай mlesna высокогорный классич черн 100g	21794	Продукты питания (folder)/Чай и кофе/Чай	136593	Mlesna
136626	8886201006773	Чай mlesna высокогорный классич черн 200g	21794	Продукты питания (folder)/Чай и кофе/Чай	136593	Mlesna
1340086	8886201047639	Чай mlesna гарматный порох зеленый жб 100g цейлон	21794	Продукты питания (folder)/Чай и кофе/Чай	136593	Mlesna
1841668	4792175770258	Чай mlesna глаз фен.зелен кит 200g	21794	Продукты питания (folder)/Чай и кофе/Чай	136593	Mlesna
1340087	4792175074240	Чай mlesna голд зеленый 50пак.*2g шри ланка	21794	Продукты питания (folder)/Чай и кофе/Чай	136593	Mlesna
136629	8886201001310	Чай mlesna димбула 100g	21794	Продукты питания (folder)/Чай и кофе/Чай	136593	Mlesna
1340089	4792175048067	Чай mlesna димбула o.p. черный жб 100g цейлон	21794	Продукты питания (folder)/Чай и кофе/Чай	136593	Mlesna
136630	8886201048063	Чай mlesna димбула черн жб 100g	21794	Продукты питания (folder)/Чай и кофе/Чай	136593	Mlesna
136631	8886201005790	Чай mlesna домик бергамот 50g	21794	Продукты питания (folder)/Чай и кофе/Чай	136593	Mlesna
136632	8886201005783	Чай mlesna домик клубника 50g	21794	Продукты питания (folder)/Чай и кофе/Чай	136593	Mlesna
136633	8886201005813	Чай mlesna домик персик/абрикос 50g	21794	Продукты питания (folder)/Чай и кофе/Чай	136593	Mlesna
136634	8886201037104	Чай mlesna домик черная смородина 50g	21794	Продукты питания (folder)/Чай и кофе/Чай	136593	Mlesna
3940870	4792175074844	Чай mlesna жасм.зелен аром. 50x 2g	21794	Продукты питания (folder)/Чай и кофе/Чай	136593	Mlesna
1340092	4792175007163	Чай mlesna жасмин зеленый (дерев кор) 100g цейлон	21794	Продукты питания (folder)/Чай и кофе/Чай	136593	Mlesna
1340093	4792175077357	Чай mlesna зеленая Коллекция 8вид. в дер.кор. 200g шри ланка	21794	Продукты питания (folder)/Чай и кофе/Чай	136593	Mlesna
136635	8886201074246	Чай mlesna зеленое Золото зелен 50пак*2g 100g	21794	Продукты питания (folder)/Чай и кофе/Чай	136593	Mlesna
1841670	4792175004490	Чай mlesna зеленый китайский 200g	21794	Продукты питания (folder)/Чай и кофе/Чай	136593	Mlesna
1841669	4792175057243	Чай mlesna зеленый с жасмином 200g	21794	Продукты питания (folder)/Чай и кофе/Чай	136593	Mlesna
3940871	8886201042153	Чай mlesna зеленый с жасмином 200g #2	21794	Продукты питания (folder)/Чай и кофе/Чай	136593	Mlesna
1340094	4792175005732	Чай mlesna зеленый цейлонский 50пак. шри ланка	21794	Продукты питания (folder)/Чай и кофе/Чай	136593	Mlesna
1340095	4792175047336	Чай mlesna зеленый чай жб 100g цейлон	21794	Продукты питания (folder)/Чай и кофе/Чай	136593	Mlesna
136636	8886201057102	Чай mlesna китайский зелен 100g	21794	Продукты питания (folder)/Чай и кофе/Чай	136593	Mlesna
136637	8886201004496	Чай mlesna китайский зелен 200g	21794	Продукты питания (folder)/Чай и кофе/Чай	136593	Mlesna
136638	8886201005738	Чай mlesna китайский зелен 50пак*2g 100g	21794	Продукты питания (folder)/Чай и кофе/Чай	136593	Mlesna
1340097	4792175047251	Чай mlesna кленовый черный жб 100g шри ланка	21794	Продукты питания (folder)/Чай и кофе/Чай	136593	Mlesna
3940872	4792175074820	Чай mlesna клуб.зелен аром. 50x 2g	21794	Продукты питания (folder)/Чай и кофе/Чай	136593	Mlesna
1841671	4792175057298	Чай mlesna клубника зеленый 200g	21794	Продукты питания (folder)/Чай и кофе/Чай	136593	Mlesna
1340098	4792175038181	Чай mlesna коллекц.3 вида 300g в плет. шри ланка	21794	Продукты питания (folder)/Чай и кофе/Чай	136593	Mlesna
1340099	4792175077333	Чай mlesna Коллекция первопроходца 150g шри ланка	21794	Продукты питания (folder)/Чай и кофе/Чай	136593	Mlesna
136639	8886201006681	Чай mlesna кр.лист черн 250g	21794	Продукты питания (folder)/Чай и кофе/Чай	136593	Mlesna
1841672	4792175770234	Чай mlesna красный личи зелен китайский 200g	21794	Продукты питания (folder)/Чай и кофе/Чай	136593	Mlesna
3706676	4792175074837	Чай mlesna лимон зеленый ароматизир.50x 2g	21794	Продукты питания (folder)/Чай и кофе/Чай	136593	Mlesna
1340100	4792175077265	Чай mlesna набор 2 вида зеленого чая 50g цейлон	21794	Продукты питания (folder)/Чай и кофе/Чай	136593	Mlesna
1340101	4792175077272	Чай mlesna набор 3 вида зеленого чая 75g цейлон	21794	Продукты питания (folder)/Чай и кофе/Чай	136593	Mlesna
136640	8886201005844	Чай mlesna набор 3 сорта*100g	21794	Продукты питания (folder)/Чай и кофе/Чай	136593	Mlesna
1340102	4792175000683	Чай mlesna набор 3вида черного цейл. чая дер. кор. 100g цейлон	21794	Продукты питания (folder)/Чай и кофе/Чай	136593	Mlesna
1340103	4792175000799	Чай mlesna набор 6вид.аромат.цейлонского чая дер.кор. 125g шри ланка	21794	Продукты питания (folder)/Чай и кофе/Чай	136593	Mlesna
1340105	4792175047039	Чай mlesna персик-абрикос черный жб 100g шри ланка	21794	Продукты питания (folder)/Чай и кофе/Чай	136593	Mlesna
1340106	4792175026676	Чай mlesna президент брю черный 100g дер.коробка шри ланка	21794	Продукты питания (folder)/Чай и кофе/Чай	136593	Mlesna
1340107	4792175074882	Чай mlesna президент брю черный цейлон 50x 2g	21794	Продукты питания (folder)/Чай и кофе/Чай	136593	Mlesna
136641	8886201057034	Чай mlesna президентский 100g	21794	Продукты питания (folder)/Чай и кофе/Чай	136593	Mlesna
1841673	4792175057038	Чай mlesna президентский 100g #2	21794	Продукты питания (folder)/Чай и кофе/Чай	136593	Mlesna
136642	8886201074888	Чай mlesna президентский 50пак*2g 100g	21794	Продукты питания (folder)/Чай и кофе/Чай	136593	Mlesna
136643	8886201005707	Чай mlesna президентский черн 200g	21794	Продукты питания (folder)/Чай и кофе/Чай	136593	Mlesna
2966352	4792175005701	Чай mlesna президентский черн 200g #2	21794	Продукты питания (folder)/Чай и кофе/Чай	136593	Mlesna
136644	8886201001334	Чай mlesna рич брю 200g	21794	Продукты питания (folder)/Чай и кофе/Чай	136593	Mlesna
1340108	4792175001178	Чай mlesna рич брю черный в кожаной сумочке 50g цейлон	21794	Продукты питания (folder)/Чай и кофе/Чай	136593	Mlesna
1340109	4792175065002	Чай mlesna ройбос черн травяной 300g	21794	Продукты питания (folder)/Чай и кофе/Чай	136593	Mlesna
136645	8886201026429	Чай mlesna с соком клена 100g дер.	21794	Продукты питания (folder)/Чай и кофе/Чай	136593	Mlesna
136647	8886201074222	Чай mlesna с соком клена черн 50пак*2g 100g	21794	Продукты питания (folder)/Чай и кофе/Чай	136593	Mlesna
2966353	4792175074226	Чай mlesna с соком клена черн 50пак*2g 100g #2	21794	Продукты питания (folder)/Чай и кофе/Чай	136593	Mlesna
136646	8886201047257	Чай mlesna с соком клена черн жб 100g	21794	Продукты питания (folder)/Чай и кофе/Чай	136593	Mlesna
136659	8886201003055	Чай mlesna с экст черн смор.100g дер.	21794	Продукты питания (folder)/Чай и кофе/Чай	136593	Mlesna
136648	8886201003086	Чай mlesna с экст.банана 100g дер.	21794	Продукты питания (folder)/Чай и кофе/Чай	136593	Mlesna
136649	8886201005110	Чай mlesna с экст.голубики 100g дер.	21794	Продукты питания (folder)/Чай и кофе/Чай	136593	Mlesna
136650	8886201047011	Чай mlesna с экст.голубики жб 100g	21794	Продукты питания (folder)/Чай и кофе/Чай	136593	Mlesna
136651	8886201026054	Чай mlesna с экст.груши 100g дер.	21794	Продукты питания (folder)/Чай и кофе/Чай	136593	Mlesna
136652	4792175047985	Чай mlesna с экст.клубники зелен жб 100g	21794	Продукты питания (folder)/Чай и кофе/Чай	136593	Mlesna
2966354	8886201047981	Чай mlesna с экст.клубники зелен жб 100g #2	21794	Продукты питания (folder)/Чай и кофе/Чай	136593	Mlesna
136653	8886201026009	Чай mlesna с экст.лайма 100g дер.	21794	Продукты питания (folder)/Чай и кофе/Чай	136593	Mlesna
136654	8886201002997	Чай mlesna с экст.лимона 100g дер.	21794	Продукты питания (folder)/Чай и кофе/Чай	136593	Mlesna
136655	8886201003451	Чай mlesna с экст.малины 100g дер.	21794	Продукты питания (folder)/Чай и кофе/Чай	136593	Mlesna
136656	8886201002980	Чай mlesna с экст.меда 100g дер.	21794	Продукты питания (folder)/Чай и кофе/Чай	136593	Mlesna
136657	8886201047585	Чай mlesna с экст.розы жб 100g	21794	Продукты питания (folder)/Чай и кофе/Чай	136593	Mlesna
136658	8886201026481	Чай mlesna с экст.саусепа зелен 100g	21794	Продукты питания (folder)/Чай и кофе/Чай	136593	Mlesna
136660	8886201026580	Чай mlesna с экст.яблока 100g дер.	21794	Продукты питания (folder)/Чай и кофе/Чай	136593	Mlesna
1340110	4792175057403	Чай mlesna саусеп зеленый 200g цейлон	21794	Продукты питания (folder)/Чай и кофе/Чай	136593	Mlesna
1340111	4792175074905	Чай mlesna саусеп зеленый 50пак.*2g шри ланка	21794	Продукты питания (folder)/Чай и кофе/Чай	136593	Mlesna
1340112	4792175074912	Чай mlesna саусеп черный 50пак 100g шри ланка	21794	Продукты питания (folder)/Чай и кофе/Чай	136593	Mlesna
136619	8886201074901	Чай mlesna саусэп зелен ароматизир.пак.50x 2g	21794	Продукты питания (folder)/Чай и кофе/Чай	136593	Mlesna
1340113	4792175026096	Чай mlesna серебрянный чай дерев кор. 100g цейлон	21794	Продукты питания (folder)/Чай и кофе/Чай	136593	Mlesna
1340114	4792175077425	Чай mlesna ува набор из 3-х видов черного чая 75g цейлон	21794	Продукты питания (folder)/Чай и кофе/Чай	136593	Mlesna
1340115	4792175000386	Чай mlesna ува черный дер. кор. 100g цейлон	21794	Продукты питания (folder)/Чай и кофе/Чай	136593	Mlesna
136661	8886201009170	Чай mlesna утренний рассвет 100g дер.	21794	Продукты питания (folder)/Чай и кофе/Чай	136593	Mlesna
136662	8886201074437	Чай mlesna фитнесс для похудения 25пак*2g 50g	21794	Продукты питания (folder)/Чай и кофе/Чай	136593	Mlesna
136663	8886201001754	Чай mlesna херб 25g	21794	Продукты питания (folder)/Чай и кофе/Чай	136593	Mlesna
1340116	4792175074264	Чай mlesna цейлон голд черный 50пак.*2g шри ланка	21794	Продукты питания (folder)/Чай и кофе/Чай	136593	Mlesna
1340117	4792175077111	Чай mlesna цейлонская Коллекция 75g шри ланка	21794	Продукты питания (folder)/Чай и кофе/Чай	136593	Mlesna
136664	8886201006063	Чай mlesna цейлонский кр.лист черн жб 400g	21794	Продукты питания (folder)/Чай и кофе/Чай	136593	Mlesna
136665	8886201074260	Чай mlesna цейлонское Золото 50пак*2g 100g	21794	Продукты питания (folder)/Чай и кофе/Чай	136593	Mlesna
136666	8886201074642	Чай mlesna чаепитие у Винни-пуха кр/кар.50x 2g 100g	21794	Продукты питания (folder)/Чай и кофе/Чай	136593	Mlesna
1841674	4792175057014	Чай mlesna японский сенча 200g	21794	Продукты питания (folder)/Чай и кофе/Чай	136593	Mlesna
136667	8886201057119	Чай mlesna японский сенча зелен 100g	21794	Продукты питания (folder)/Чай и кофе/Чай	136593	Mlesna
136668	8886201057010	Чай mlesna японский сенча зелен 200g	21794	Продукты питания (folder)/Чай и кофе/Чай	136593	Mlesna
136669	8886201074055	Чай mlesna японский сенча зелен 50пак*2g 100g	21794	Продукты питания (folder)/Чай и кофе/Чай	136593	Mlesna
3584646	4631136887584	Чай molenare индийский крупнолистовой мягуп 300g	21794	Продукты питания (folder)/Чай и кофе/Чай	0	
3584647	4631136887607	Чай molenare черный байховый индийский среднелистовой мягуп 400g	21794	Продукты питания (folder)/Чай и кофе/Чай	0	
136671	4792036000067	Чай Monarch English breakfast черный 100x 2g к/к	21794	Продукты питания (folder)/Чай и кофе/Чай	118906	Монарх
3584648	4607090163088	Чай Monarch English breakfast черный 25x 2g тв/уп	21794	Продукты питания (folder)/Чай и кофе/Чай	0	
2498763	4792036000074	Чай Monarch английский завтрак цейл 30п*2g 0.060	21794	Продукты питания (folder)/Чай и кофе/Чай	0	
3584653	4792036000159	Чай Monarch кр/лист черный 250g к/к	21794	Продукты питания (folder)/Чай и кофе/Чай	3707434	MONARCH (MONARCH FOODS INTERNATIONAL LTD/ENGLAND)
3584649	4607090163118	Чай Monarch крупнолистовой черный 100g к/к	21794	Продукты питания (folder)/Чай и кофе/Чай	3707434	MONARCH (MONARCH FOODS INTERNATIONAL LTD/ENGLAND)
1978852	4792036000043	Чай Monarch разовый 25шт 0.05	21794	Продукты питания (folder)/Чай и кофе/Чай	3707434	MONARCH (MONARCH FOODS INTERNATIONAL LTD/ENGLAND)
2498766	4792036000029	Чай Monarch цейл кр/лист в/с 100g#2	21794	Продукты питания (folder)/Чай и кофе/Чай	0	
