ID	UPCEAN	Name	CategoryID	CategoryName	BrandID	BrandName
5410247	9785171173111	Книга запри все двери 40237941	5166349	Полиграфия (folder)/Книги - детективы. боевики. Триллеры	0	
5410248	9785171041632	Книга запутанная нить ариадны 40237777	5166349	Полиграфия (folder)/Книги - детективы. боевики. Триллеры	0	
5410249	9785170854653	Книга зарубежная классика (м) на западном фронте без перемен 40222991	5120829	Полиграфия (folder)/Книги - художественная литература	0	
5410250	9785171137670	Книга зарубежная классика американская трагедия 40235374	5120829	Полиграфия (folder)/Книги - художественная литература	0	
5410251	9785171130541	Книга зарубежная классика воришка мартин. бог-скорпион 40235382	5238948	Полиграфия (folder)/Книги - Проза классическая и современная	0	
5410252	9785171023195	Книга зарубежная классика время жить и время умирать (новый перевод) 40225417	5120829	Полиграфия (folder)/Книги - художественная литература	0	
5410253	9785171125714	Книга зарубежная классика гедда габлер 40235380	5120829	Полиграфия (folder)/Книги - художественная литература	0	
5410254	9785170684878	Книга зарубежная классика граф монте-кристо. в 2 кн. кн. 1 40224110	5120829	Полиграфия (folder)/Книги - художественная литература	0	
5410255	9785170799749	Книга зарубежная классика заводной апельсин 40225034	205408	Полиграфия (folder)/Книги	0	
5410256	9785170815807	Книга зарубежная классика мартин иден 40225258	5238948	Полиграфия (folder)/Книги - Проза классическая и современная	0	
5410257	9785171020903	Книга зарубежная классика миссис дэллоуэй. на маяк 40225183	5238948	Полиграфия (folder)/Книги - Проза классическая и современная	0	
5410258	9785171161064	Книга зарубежная классика моряк в седле 40235394	5120829	Полиграфия (folder)/Книги - художественная литература	0	
5410259	9785170982882	Книга зарубежная классика пигмалион. кандида. смуглая леди сонетов 40235388	5120829	Полиграфия (folder)/Книги - художественная литература	0	
5410260	9785170578924	Книга зарубежная классика повелитель мух. шпиль 40222111	5238948	Полиграфия (folder)/Книги - Проза классическая и современная	0	
5410261	9785171011864	Книга зарубежная классика три товарища 40222142	5238948	Полиграфия (folder)/Книги - Проза классическая и современная	0	
5410262	9785171228866	Книга зарубежная классика унесенные ветром т. 2 40235414	5120829	Полиграфия (folder)/Книги - художественная литература	0	
5410263	9785171082062	Книга зарубежная классика Царь давид 40235412	5238948	Полиграфия (folder)/Книги - Проза классическая и современная	0	
5410264	9785171462567	Книга зарубежная классика чума 40071813	205408	Полиграфия (folder)/Книги	0	
5012157	9785378264537	Книга зарубежные сказки в стихах	205408	Полиграфия (folder)/Книги	331248	Проф-Пресс
5410265	9785506064183	Книга зарядка для мозга м.а. жукова. 197x255 mm Умка 978-5-506-06418-3	5239074	Полиграфия (folder)/Книга детская развивающая	712913	Умка
3824609	9785447149963	Книга зарядка для ума. король лев	205408	Полиграфия (folder)/Книги	0	
5410266	9785447162375	Книга зарядка для ума. холодное сердце 2. лев 1901 зу	5115683	Полиграфия (folder)/Книги - развивающие	5298291	лев
5410267	9785447162382	Книга зарядка для ума. холодное сердце 2. лев 1902 зу	5115683	Полиграфия (folder)/Книги - развивающие	5298291	лев
3824610	9785447150020	Книга зарядка для ума.Мой мал.пони:дев.из экв	205408	Полиграфия (folder)/Книги	0	
3824611	9785447150006	Книга зарядка для ума.робокар поли и его др.	205408	Полиграфия (folder)/Книги	0	
3824612	9785447149970	Книга зарядка для ума.тачки	205408	Полиграфия (folder)/Книги	0	
3824613	9785447150044	Книга зарядка для ума.феи	205408	Полиграфия (folder)/Книги	0	
5410268	9785170817849	Книга застава	205408	Полиграфия (folder)/Книги	48740	АСТ
5410269	9785171181604	Книга застолье петра вайля 40237391	5115208	Полиграфия (folder)/Книги - биографии и мемуары	0	
5406729	9785170980680	Книга затаившийся страх 40202305	205408	Полиграфия (folder)/Книги	48740	АСТ
3824614	9785699751143	Книга затейники	205408	Полиграфия (folder)/Книги	0	
5410270	9785171141851	Книга затерянный мир 40244333	5115744	Полиграфия (folder)/Книги - сказки, стихи, рассказы	0	
5410271	9785171146535	Книга затерянный мир 40253135	5120829	Полиграфия (folder)/Книги - художественная литература	0	
3347198	9785170772117	Книга затмение с.майер	205408	Полиграфия (folder)/Книги	0	
5410272	9785815915497	Книга зах.акунин.аристономия (16+) 40247285	5120829	Полиграфия (folder)/Книги - художественная литература	0	
5410273	9785815913424	Книга зах.акунин.другой путь 40247284	5238948	Полиграфия (folder)/Книги - Проза классическая и современная	0	
5410274	9785815915442	Книга зах.акунин.инь и ян (белая-черная версии) (16+) 40247283	5120829	Полиграфия (folder)/Книги - художественная литература	0	
5410275	9785815915480	Книга зах.акунин.планета вода (с илл.сакурова и.) (16+) 40247465	5166349	Полиграфия (folder)/Книги - детективы. боевики. Триллеры	0	
5410276	9785815911659	Книга зах.акунин.черный город (с илл.) (18+) 40247464	5166349	Полиграфия (folder)/Книги - детективы. боевики. Триллеры	0	
5410277	9785815914605	Книга зах.п-б.акунин левиафан (16+) 40247463	5166349	Полиграфия (folder)/Книги - детективы. боевики. Триллеры	0	
5410278	9785815915329	Книга зах.п-б.акунин любовница смерти 40247462	5166349	Полиграфия (folder)/Книги - детективы. боевики. Триллеры	0	
5410279	9785815915176	Книга зах.п-б.акунин смерть ахиллеса (16+) 40247461	5166349	Полиграфия (folder)/Книги - детективы. боевики. Триллеры	0	
5410280	9785815915220	Книга зах.п-б.акунин.статский советник (16+) 40247460	5166349	Полиграфия (folder)/Книги - детективы. боевики. Триллеры	0	
5410281	9785815915404	Книга зах.п-б.акунин.черный город (16+) 40247459	5166349	Полиграфия (folder)/Книги - детективы. боевики. Триллеры	0	
5410282	9785815914278	Книга зах.писатель и самоубийство.2 части в одном томе (18+) 40247458	5166349	Полиграфия (folder)/Книги - детективы. боевики. Триллеры	0	
66125	9785850662509	Книга заходер б. мохнатая азбука	205408	Полиграфия (folder)/Книги	0	
3824615	9785699777242	Книга зачарованная Принцесса	205408	Полиграфия (folder)/Книги	0	
3347199	9785501000100	Книга зачем и почему математика изд.мир книги	205408	Полиграфия (folder)/Книги	0	
3347200	9785486039232	Книга зачем и почему миграции животных изд.мир книги	205408	Полиграфия (folder)/Книги	0	
5410283	9789850323750	Книга зачем медведь лапу сосет? 40250224	5117046	Полиграфия (folder)/Книги - энциклопедии и познавательная литература	0	
5410284	9785171199692	Книга зачем нужна эта кнопка? автобиография пилота и вокалиста iron maiden 40237206	5115208	Полиграфия (folder)/Книги - биографии и мемуары	0	
5410285	9785389130142	Книга защита лужина 40234915	5120829	Полиграфия (folder)/Книги - художественная литература	0	
3347201	9785465036009	Книга заюшкина избушка	205408	Полиграфия (folder)/Книги	0	
5001578	9785353082613	Книга заюшкина избушка (веселые глазки) 40242184	205408	Полиграфия (folder)/Книги	0	
3347203	9785180011893	Книга заюшкина избушка детская	205408	Полиграфия (folder)/Книги	0	
5410286	9789851663374	Книга збор творау 1945-1980 40247281	5120829	Полиграфия (folder)/Книги - художественная литература	0	
3347205	9785699632763	Книга званный ужин в английском стиле в.вербинина	205408	Полиграфия (folder)/Книги	0	
3824617	9785447126810	Книга звезд.воины.развив.книжка с накл.	205408	Полиграфия (folder)/Книги	0	
3824618	9785447126827	Книга звезд.воины.развив.книжка с накл. #2	205408	Полиграфия (folder)/Книги	0	
3824619	9785447126834	Книга звезд.воины.развив.книжка с накл. #3	205408	Полиграфия (folder)/Книги	0	
2443017	9785765437261	Книга Звезда востока	205408	Полиграфия (folder)/Книги	0	
5410287	9785171074678	Книга Звезда интернета 40235121	5120829	Полиграфия (folder)/Книги - художественная литература	0	
2443018	9785765430514	Книга Звезда пленительна	205408	Полиграфия (folder)/Книги	0	
5410288	9785171124410	Книга Звезда по имени виктор цой 40237146	5115208	Полиграфия (folder)/Книги - биографии и мемуары	0	
5410289	9785171049515	Книга звездарунетамагия/магия на каждый день 40242646	5115744	Полиграфия (folder)/Книги - сказки, стихи, рассказы	0	
5407802	9785171012496	Книга звездарунетамагия/учебник по магии 40202218	205408	Полиграфия (folder)/Книги	48740	АСТ
5410290	9785179823735	Книга звездарунетатриллер/ловцы пыли 40237776	5120829	Полиграфия (folder)/Книги - художественная литература	0	
5410291	9785171053017	Книга звездарунетатриллер/смотрящая со стороны 40228183	5120829	Полиграфия (folder)/Книги - художественная литература	0	
5410292	9785171057497	Книга звездарунетатриллер/училка 40237774	5120829	Полиграфия (folder)/Книги - художественная литература	0	
5410293	9785170976140	Книга звездасоцсети/батенька, да вы трансформер! 40230841	5405604	публицистика	0	
5410294	9785171326999	Книга звездасоцсети/записки детектива 40253053	5166349	Полиграфия (folder)/Книги - детективы. боевики. Триллеры	0	
5410295	9785171073305	Книга звездафутбола/мы - чемпионы! 40237120	5115208	Полиграфия (folder)/Книги - биографии и мемуары	0	
3347206	4660019951111	Книга звездная кулинария меню диктуют знаки зодиака	205408	Полиграфия (folder)/Книги	0	
5410296	9785171034030	Книга звездная пыль 40202281	5120829	Полиграфия (folder)/Книги - художественная литература	0	
5410297	9785170921959	Книга звездное небо.детская энциклопедия 40213378	5117046	Полиграфия (folder)/Книги - энциклопедии и познавательная литература	0	
5349291	4680274030161	Книга звездные войны. 100 наклеек росмэн 0161	5115695	раскраски. наклейки. игры	205409	РОСМЭН
5410298	9785913394927	Книга звездные войны. том 2. столкновение на луне контрабандистов 40234739	5120829	Полиграфия (folder)/Книги - художественная литература	0	
5410299	9785171076672	Книга звездные дневники ийона тихого 40234759	5120829	Полиграфия (folder)/Книги - художественная литература	0	
5410300	9785389065796	Книга звездные дороги. истории из вселенной эндера 40233914	5221985	Полиграфия (folder)/Книги - фантастика, фентези, мистика	0	
5410301	9785171106928	Книга звездные корабли 40247076	5221985	Полиграфия (folder)/Книги - фантастика, фентези, мистика	0	
5410302	9785171023188	Книга звездный вымпел 40202310	5221985	Полиграфия (folder)/Книги - фантастика, фентези, мистика	0	
3347207	9785699687855	Книга звездный любовник м.жукова-гладкова	205408	Полиграфия (folder)/Книги	0	
5410303	9785170978533	Книга звездный прилив 40234691	5120829	Полиграфия (folder)/Книги - художественная литература	0	
5410304	9785171107383	Книга звездочеты. 100 научных сказок 40240959	5115744	Полиграфия (folder)/Книги - сказки, стихи, рассказы	0	
5410305	9785001084419	Книга звездочка для единорога 40242727	5115744	Полиграфия (folder)/Книги - сказки, стихи, рассказы	0	
5406735	9785171042882	Книга звездуха 40235071	205408	Полиграфия (folder)/Книги	48740	АСТ
3347208	9785699652570	Книга звезды в моем сердце б.картленд	205408	Полиграфия (folder)/Книги	0	
2443019	9785699080564	Книга звезды правду говорят	205408	Полиграфия (folder)/Книги	0	
5406736	9785170871636	Книга звезды светят вниз 40253021	205408	Полиграфия (folder)/Книги	48740	АСТ
5410306	9785171141967	Книга звездывека/король и шут. как в старой сказке 40237117	5115208	Полиграфия (folder)/Книги - биографии и мемуары	0	
5410307	9785171003838	Книга звездынаучфантастики (колл/огнепад: ложная слепота. зеро. боги насекомых. полковник. эхопраксия 40234190	5221985	Полиграфия (folder)/Книги - фантастика, фентези, мистика	0	
5410308	9785179826453	Книга звездынаучфантастики/сроки службы 40253608	5221985	Полиграфия (folder)/Книги - фантастика, фентези, мистика	0	
5410309	9785171073251	Книга звездыроманфэнтези/призрак на задании 40234228	5120829	Полиграфия (folder)/Книги - художественная литература	0	
5410310	9785171101206	Книга звездысовфантастики/черный человек 40234220	5221985	Полиграфия (folder)/Книги - фантастика, фентези, мистика	0	
2443020	9785224048618	Книга звезочет	205408	Полиграфия (folder)/Книги	0	
5410311	9785916782981	Книга звенья русской культуры. древняя русь (до половины xv века)	205408	Полиграфия (folder)/Книги	5029456	Ломоносовъ
727574	9785699359257	Книга зверев с. десантура против морпехов	205408	Полиграфия (folder)/Книги	0	
66126	9785699331321	Книга зверев с. президент заказан. действуйте!	205408	Полиграфия (folder)/Книги	0	
727575	9785699502400	Книга зверев с. секретный туннель (м)	205408	Полиграфия (folder)/Книги	0	
727576	9785699471300	Книга зверев с.Бастион.гавайская петля (м)	205408	Полиграфия (folder)/Книги	0	
3824620	9785699395651	Книга зверев с.воин неба и земли	205408	Полиграфия (folder)/Книги	0	
5410312	9785170979981	Книга зверивоители/вечное древо 40205920	5120829	Полиграфия (folder)/Книги - художественная литература	0	
5410313	9785171139643	Книга зверинец 40242607	5115744	Полиграфия (folder)/Книги - сказки, стихи, рассказы	0	
3824621	9785699899432	Книга зверополис. приключения джуди и ника	205408	Полиграфия (folder)/Книги	0	
5410314	9785171217051	Книга зверь 40243673	5115744	Полиграфия (folder)/Книги - сказки, стихи, рассказы	0	
66127	9785353025863	Книга зверь р. дожди-пистолеты	205408	Полиграфия (folder)/Книги	0	
3347209	9785699575633	Книга зверь,или ошибка олигарха ч.абдуллаев	205408	Полиграфия (folder)/Книги	0	
5410315	9785171133221	Книга звон теней 40235159	5238948	Полиграфия (folder)/Книги - Проза классическая и современная	0	
5410316	9785170861880	Книга звоните и приезжайте. алексин. аст	5265093	Полиграфия (folder)/Книги - художественные	48740	АСТ
2443021	9785699059270	Книга звонок с того света	205408	Полиграфия (folder)/Книги	0	
5410317	9785170946426	Книга звук и ярость 40222770	5238948	Полиграфия (folder)/Книги - Проза классическая и современная	0	
2234780	9785378122165	Книга звуки ж и ч детская	205408	Полиграфия (folder)/Книги	331248	Проф-Пресс
2234781	9785378122172	Книга звуки з с и ц детская	205408	Полиграфия (folder)/Книги	331248	Проф-Пресс
2234782	9785378122196	Книга звуки л и р детская	205408	Полиграфия (folder)/Книги	331248	Проф-Пресс
2234783	9785378122189	Книга звуки ш и щ детская	205408	Полиграфия (folder)/Книги	331248	Проф-Пресс
5410318	9785001310068	Книга здесь была бритт-мари, авт бакман ф. 40247280	5238948	Полиграфия (folder)/Книги - Проза классическая и современная	0	
5410319	9785699990481	Книга здесь и сейчас 40236647	5120829	Полиграфия (folder)/Книги - художественная литература	0	
5410320	9785389159198	Книга здесь курят 40235082	5120829	Полиграфия (folder)/Книги - художественная литература	0	
5410321	9785170840724	Книга здесь мертвецы под сводом спят 40222773	5120829	Полиграфия (folder)/Книги - художественная литература	0	
5410322	9785864716649	Книга здесь обитают призраки 40236011	5120829	Полиграфия (folder)/Книги - художественная литература	0	
3824622	9785699729159	Книга здоровые завтраки за 10 минут	205408	Полиграфия (folder)/Книги	0	
3824623	9785928717254	Книга здоровье женщины	205408	Полиграфия (folder)/Книги	0	
3824624	1323461323327	Книга здоровье и медицина 1кат.	205408	Полиграфия (folder)/Книги	0	
3824625	3162613966238	Книга здоровье и медицина 1кат. #2	205408	Полиграфия (folder)/Книги	0	
3824626	9785811213535	Книга здоровье и медицина 1кат. #3	205408	Полиграфия (folder)/Книги	0	
3824627	3746517096156	Книга здоровье и медицина 3кат.	205408	Полиграфия (folder)/Книги	0	
3824628	3848874572318	Книга здоровье и медицина 4кат.	205408	Полиграфия (folder)/Книги	0	
3824629	5815811208485	Книга здоровье и медицина 4кат. #2	205408	Полиграфия (folder)/Книги	0	
727578	1329096292908	Книга здоровье и медицина кат.1	205408	Полиграфия (folder)/Книги	0	
727579	1330971295945	Книга здоровье и медицина кат.2	205408	Полиграфия (folder)/Книги	0	
727580	1310403243256	Книга здоровье и медицина кат.3	205408	Полиграфия (folder)/Книги	0	
727581	1380141619019	Книга здоровье и медицина кат.4	205408	Полиграфия (folder)/Книги	0	
3824630	9785928717261	Книга здоровье ребенка	205408	Полиграфия (folder)/Книги	0	
1838238	1330774211180	Книга здоровье/медиц.2кат весь	205408	Полиграфия (folder)/Книги	0	
1838239	1373231015228	Книга здоровье/медиц.3кат весь	205408	Полиграфия (folder)/Книги	0	
1838240	1331365200798	Книга здоровье/медиц.4кат весь	205408	Полиграфия (folder)/Книги	0	
1838241	9785935566432	Книга здоровье/медиц.7кат.гелеос	205408	Полиграфия (folder)/Книги	0	
1838242	3519363652858	Книга здоровье/медиц.8кат.гелеос	205408	Полиграфия (folder)/Книги	0	
1838243	9785961401714	Книга здоровье/медицина 6кат.аст	205408	Полиграфия (folder)/Книги	0	
1838244	9785935564551	Книга здоровье/медицина 9кат. весь	205408	Полиграфия (folder)/Книги	0	
1838245	9785978102536	Книга здравствуй дедушка мороз	205408	Полиграфия (folder)/Книги	0	
3347210	9785170561827	Книга здравствуй, груздь! вильмонт аст	205408	Полиграфия (folder)/Книги	0	
5410323	9785699950072	Книга здравствуй, грусть 40253356	5238948	Полиграфия (folder)/Книги - Проза классическая и современная	0	
3824631	9785699975655	Книга зеленая	205408	Полиграфия (folder)/Книги	0	
315065	9785984356862	Книга зеленая игуана гуржий а.н.	315009	Полиграфия (folder)/Книги по теме Домашние животные	0	
5406738	9785170853489	Книга зеленая миля 40227586	205408	Полиграфия (folder)/Книги	48740	АСТ
5410324	9785170756377	Книга зеленая миля 40227596	5166349	Полиграфия (folder)/Книги - детективы. боевики. Триллеры	0	
3824632	9785180009166	Книга зеленая планета махаон	205408	Полиграфия (folder)/Книги	0	
5410325	9785170987771	Книга зеленые святки 40222755	5238948	Полиграфия (folder)/Книги - Проза классическая и современная	0	
