ID	UPCEAN	Name	CategoryID	CategoryName	BrandID	BrandName
2861579	6975414040208	Драже с игрушкой заводные овечки сахаристое 3g	1	Неклассифицированные/default	0	
3313735	6009699762699	Драже с игрушкой из пластмассы нло целлофан 3g Китай	1	Неклассифицированные/default	0	
3313736	6975460814112	Драже с игрушкой картинг 10g	1	Неклассифицированные/default	0	
314432	6939501803749	Драже с игрушкой конфитрейд кольцо	37145	Продукты питания (folder)/Кондитерские изделия (folder)/Карамель	0	
3313737	6957342931780	Драже с игрушкой корова-шарик с игрушкой 2g	1	Неклассифицированные/default	0	
2861684	6975463809030	Драже с игрушкой крылатая гвардия	1	Неклассифицированные/default	0	
3313738	6908820162592	Драже с игрушкой куколка 15g	1	Неклассифицированные/default	0	
3313739	6945432503016	Драже с игрушкой куколка 5g	1	Неклассифицированные/default	0	
3313740	6357932302097	Драже с игрушкой летайка 5g	1	Неклассифицированные/default	0	
3313741	4650056571977	Драже с игрушкой лига справедливости	1	Неклассифицированные/default	0	
2861686	5656865521256	Драже с игрушкой локомотив	1	Неклассифицированные/default	0	
1663537	6920115198901	Драже с игрушкой маленькая рукодельница #2	337649	Уход за детьми (folder)/Уход за детьми	0	
3313742	6920121240496	Драже с игрушкой мармеладные светлячки 8g	1	Неклассифицированные/default	0	
3313743	8809350280160	Драже с игрушкой машина 3g	1	Неклассифицированные/default	0	
2725176	6942961473131	Драже с игрушкой машинка	77	Продукты питания (folder)/Кондитерские изделия (folder)/Кондитерские изделия	0	
2432655	694963428911	Драже с игрушкой машинка 0.003	22145	Продукты питания (folder)/Кондитерские изделия (folder)/Конфеты	0	
3313744	4650062480119	Драже с игрушкой мир животных	1	Неклассифицированные/default	0	
2727757	4600416013388	Драже с игрушкой мобильный телефон для девоч	77	Продукты питания (folder)/Кондитерские изделия (folder)/Кондитерские изделия	0	
3313745	8339293953109	Драже с игрушкой монстры бездорожья 4g	1	Неклассифицированные/default	0	
3313746	8858689508087	Драже с игрушкой монстры бездорожья 4g #2	1	Неклассифицированные/default	0	
3313747	8339296311104	Драже с игрушкой монстры бездорожья-2 4g	1	Неклассифицированные/default	0	
3313748	6923649512137	Драже с игрушкой мотоцикл 2g	1	Неклассифицированные/default	0	
3313749	6944167201259	Драже с игрушкой мотоцикл поиграй-ка 2g	1	Неклассифицированные/default	0	
2725183	6924300119320	Драже с игрушкой очки xl 5g	77	Продукты питания (folder)/Кондитерские изделия (folder)/Кондитерские изделия	0	
3313750	6936268702575	Драже с игрушкой очки вампира Toys	1	Неклассифицированные/default	0	
3313727	6947070003194	Драже с игрушкой пистолет водяной револьвер 5g	1	Неклассифицированные/default	0	
2725168	6975414100636	Драже с игрушкой пистолет колибри 5g	77	Продукты питания (folder)/Кондитерские изделия (folder)/Кондитерские изделия	0	
3313751	6936268702131	Драже с игрушкой пистолет полиции	1	Неклассифицированные/default	0	
2725185	6924300120722	Драже с игрушкой планшет 5g	77	Продукты питания (folder)/Кондитерские изделия (folder)/Кондитерские изделия	0	
3313752	6933893301791	Драже с игрушкой поиграй-ка воен. кроссовер 4g	1	Неклассифицированные/default	0	
3313753	6900806160639	Драже с игрушкой поиграй-ка пушистики цыплята	1	Неклассифицированные/default	0	
3313718	6933893300695	Драже с игрушкой поиграй-ка телефон с игрой 4 вида 8g	1	Неклассифицированные/default	0	
3313754	4915635921223	Драже с игрушкой поиграй-ка хлопушка 97g	1	Неклассифицированные/default	0	
3313717	6933893301906	Драже с игрушкой поиграй-ка экскаватор 20g	1	Неклассифицированные/default	0	
3313674	6933893330159	Драже с игрушкой полицейская машина 3g	1	Неклассифицированные/default	0	
3313678	6933893315576	Драже с игрушкой полицейский патруль 5g	1	Неклассифицированные/default	0	
3313680	6949634289846	Драже с игрушкой полицейский форсаж 5g	1	Неклассифицированные/default	0	
3313755	6933893315606	Драже с игрушкой полиция сафари сахаристое 5g	1	Неклассифицированные/default	0	
3313683	6924300124270	Драже с игрушкой посиделки сахарное 3g тв/уп	1	Неклассифицированные/default	0	
2725186	6924300120784	Драже с игрушкой прыгун 5g	77	Продукты питания (folder)/Кондитерские изделия (folder)/Кондитерские изделия	0	
2861688	6942870600185	Драже с игрушкой разбитое стекло	1	Неклассифицированные/default	0	
3313756	4600416013449	Драже с игрушкой робот-квадроцикл 5g	1	Неклассифицированные/default	0	
3313677	6949634288061	Драже с игрушкой сахарное в глазури полицейский кроссовер 15g пл/уп	1	Неклассифицированные/default	0	
3313675	6924300124454	Драже с игрушкой сахарное полицейская машина 16g	1	Неклассифицированные/default	0	
1668743	6924300118866	Драже с игрушкой светлэнд лошадка 3g	980	Игрушки (folder)/Игрушка	0	
2861689	6914204337210	Драже с игрушкой скейтборд	1	Неклассифицированные/default	0	
3313757	6933893324356	Драже с игрушкой скорая помощь 3g	1	Неклассифицированные/default	0	
3313758	6936268702933	Драже с игрушкой сладкие красотки 18g	1	Неклассифицированные/default	0	
2861691	6921535693335	Драже с игрушкой сокровища пиратов	1	Неклассифицированные/default	0	
2861692	6975463809566	Драже с игрушкой спецотряд 10g	1	Неклассифицированные/default	0	
3313759	6920510424490	Драже с игрушкой танк 5g	1	Неклассифицированные/default	0	
3313760	6942971506805	Драже с игрушкой танковая дивизия 5g	1	Неклассифицированные/default	0	
3313761	6944167200160	Драже с игрушкой танцующий санта поиграй-ка 7g	1	Неклассифицированные/default	0	
3313762	6957342902285	Драже с игрушкой флаш-печать 4g Китай	1	Неклассифицированные/default	0	
3313763	6957342910686	Драже с игрушкой фонарик	1	Неклассифицированные/default	0	
2861693	6926162354826	Драже с игрушкой формула	1	Неклассифицированные/default	0	
2861694	6975463809061	Драже с игрушкой футбол	1	Неклассифицированные/default	0	
3313764	6944167203918	Драже с игрушкой футбольный горн 5g	1	Неклассифицированные/default	0	
2861696	8339293733961	Драже с игрушкой черепашка	1	Неклассифицированные/default	0	
3313765	4622112990015	Драже с игрушкой черепашки ниньдзя	1	Неклассифицированные/default	0	
3313766	6933893326671	Драже с игрушкой экскаватор	1	Неклассифицированные/default	0	
2861697	6914204112046	Драже с игрушкой юный рыбак	1	Неклассифицированные/default	0	
2432657	869742265043	Драже с игрушкой яйцо асс 0.012	22145	Продукты питания (folder)/Кондитерские изделия (folder)/Конфеты	0	
3313703	6909309061269	Драже с игрушкой яйцо растущая змейка	1	Неклассифицированные/default	0	
3313767	4607171216054	Драже с изюмом мягуп 250g	1	Неклассифицированные/default	0	
1768326	6929309011521	Драже с магнитом smile 4g	980	Игрушки (folder)/Игрушка	3308843	День игрушки
3696050	4607065000783	Драже с молочным шоколадом м&м's с арахисом, 32 упаковки по 45g	674836	Продукты питания (folder)/Кондитерские изделия (folder)/Драже	623413	M&M's
3696072	4607065000851	Драже с молочным шоколадом м&м's, в глазури, 32 упаковки по 45g	674836	Продукты питания (folder)/Кондитерские изделия (folder)/Драже	623413	M&M's
3313768	6926643000211	Драже с новым годом кислое мягуп 18g	1	Неклассифицированные/default	0	
3313769	4670008707117	Драже с пантогематогеном 250g	1	Неклассифицированные/default	0	
3313770	4670008707148	Драже с ядром подсолнечника 250g	1	Неклассифицированные/default	0	
3313772	8690146059561	Драже сosby с игрушкой 12g	1	Неклассифицированные/default	0	
3313773	6949634260982	Драже самолетик фруктовое с игрушкой 3g	1	Неклассифицированные/default	0	
3313774	6955861600033	Драже санта пищалка с шариком 2g	1	Неклассифицированные/default	0	
3313775	4650056572028	Драже сах луни тюнс 20g	1	Неклассифицированные/default	0	
2861698	6927261987724	Драже сах с игр ваза	1	Неклассифицированные/default	0	
1663540	6927260908720	Драже сах. fru-smix 25g	77	Продукты питания (folder)/Кондитерские изделия (folder)/Кондитерские изделия	0	
3313776	4650056571137	Драже сах. в капсуле лига справедливости 10g	1	Неклассифицированные/default	0	
3313777	4650056570901	Драже сах. в шаре том и джери 10g	1	Неклассифицированные/default	0	
1960076	8612564784351	Драже сах. Маша и медведь 15g	1	Неклассифицированные/default	0	
2725196	6924300121897	Драже сах.маникюр.слад.палочки 8g	77	Продукты питания (folder)/Кондитерские изделия (folder)/Кондитерские изделия	0	
3313778	6965490238156	Драже сахаристое наручники 3g	1	Неклассифицированные/default	0	
3313779	6933893315477	Драже сахаристое с игрушкой ретро автомобиль 5g	1	Неклассифицированные/default	0	
3313780	6933893326602	Драже сахаристое с игрушкой смартфон лабиринт 5g	1	Неклассифицированные/default	0	
3313781	6914204009674	Драже сахаристое с игрушкой собака-кусака 3g	1	Неклассифицированные/default	0	
3313782	6933893313909	Драже сахаристое с игрушкой танк 15g	1	Неклассифицированные/default	0	
3313783	6929309541691	Драже сахаристое сладкий цветочек мягуп 9g	1	Неклассифицированные/default	0	
3313784	8887856927055	Драже сахарная крошка клубника в капсуле мягуп 8g	1	Неклассифицированные/default	0	
3313785	8697422656322	Драже сахарное 10g тв/уп	1	Неклассифицированные/default	0	
3313786	4620031510239	Драже сахарное 20g т/у	1	Неклассифицированные/default	0	
3313787	6947070001046	Драже сахарное в игрушке военный джип 3g	1	Неклассифицированные/default	0	
3313788	6947070007284	Драже сахарное в игрушке пистолет 3g	1	Неклассифицированные/default	0	
3313789	8887856933728	Драже сахарное в игрушке пистолет 3g #2	1	Неклассифицированные/default	0	
3313790	6947070000599	Драже сахарное в игрушке танк 3g	1	Неклассифицированные/default	0	
717386	6914204339559	Драже сахарное в светящейся игрушке мягуп 15g	22145	Продукты питания (folder)/Кондитерские изделия (folder)/Конфеты	711223	Гэлакси (бак)
1206897	4650056570567	Драже сахарное в тубе shrek 10g	22145	Продукты питания (folder)/Кондитерские изделия (folder)/Конфеты	0	
3313791	6949634288559	Драже сахарное прикольные рожки в глазури с игрушкой	1	Неклассифицированные/default	0	
3313792	8887856918251	Драже сахарное с игрушкой вертолет 5g	1	Неклассифицированные/default	0	
3313793	6944167203468	Драже сахарное с игрушкой зубы 5g	1	Неклассифицированные/default	0	
3313794	6933893316368	Драже сахарное с игрушкой кукла долли	1	Неклассифицированные/default	0	
3313795	5900132518082	Драже сахарное с игрушкой куклы	1	Неклассифицированные/default	0	
3313796	5900132518075	Драже сахарное с игрушкой куклы поиграй ка монстр Коллекция	1	Неклассифицированные/default	0	
3313797	4600416013296	Драже сахарное с игрушкой огнетушитель брызгалка мягуп 5g	1	Неклассифицированные/default	0	
3313798	6933893312285	Драже сахарное с игрушкой поиграй-ка 15g	1	Неклассифицированные/default	0	
3313799	691019343051	Драже сахарное с игрушкой супер байк спорт	1	Неклассифицированные/default	0	
1768396	6924300118149	Драже сахарное с игрушкой трицикл	980	Игрушки (folder)/Игрушка	0	
3313800	8887856934053	Драже сахарное фруктово-ягодным вкусом с игрушкой 2g	1	Неклассифицированные/default	0	
3313801	8887856934084	Драже сахарное фруктово-ягодным вкусом с игрушкой 2g #2	1	Неклассифицированные/default	0	
3313802	8887856934176	Драже сахарное фруктово-ягодным вкусом с игрушкой 2g #3	1	Неклассифицированные/default	0	
2725198	4650062485305	Драже сахарное фруктовый джаз свит стар 8g	77	Продукты питания (folder)/Кондитерские изделия (folder)/Кондитерские изделия	0	
1776452	4261521199413	Драже сахарное энерджи 0.007	22145	Продукты питания (folder)/Кондитерские изделия (folder)/Конфеты	0	
2432659	6920344802358	Драже сахарное энерджи 0.007 #2	22145	Продукты питания (folder)/Кондитерские изделия (folder)/Конфеты	0	
3313803	6944167203703	Драже сахарный браслет мягуп 12g	1	Неклассифицированные/default	0	
3313804	6954302911790	Драже сахарный браслет мягуп 12g #2	1	Неклассифицированные/default	0	
2432661	6944167204021	Драже свежок ассорти 14g пл/б	22145	Продукты питания (folder)/Кондитерские изделия (folder)/Конфеты	0	
3313805	6951875200313	Драже свежок вкус клубники 6g пл/б	1	Неклассифицированные/default	0	
3313806	6951875200337	Драже свежок вкус лимона 6g	1	Неклассифицированные/default	0	
3313807	6951875200306	Драже свежок вкус черники 6g	1	Неклассифицированные/default	0	
3313808	4606157004005	Драже свежок освежающие ассорти с витамином с мягуп 15g	1	Неклассифицированные/default	0	
3313809	4606157003930	Драже свежок с витамином с освежающее 14g тв/уп	1	Неклассифицированные/default	0	
2432660	6944167200900	Драже свежок с фрктовым вкусом ассорти 14.5g	22145	Продукты питания (folder)/Кондитерские изделия (folder)/Конфеты	0	
706077	8697423120488	Драже свежок с яблочным вкусом 14g	1	Неклассифицированные/default	0	
3313810	6951875200429	Драже свежок, 4 вкуса с игрушкой, 6g, жб	1	Неклассифицированные/default	0	
3313811	6951875200412	Драже свежок, 4 вкуса, 6g, жб	1	Неклассифицированные/default	0	
3313812	6951875200320	Драже свежок, мята, 6g, пл/б	1	Неклассифицированные/default	0	
2754037	6903788921380	Драже свежок, экзотик, 12g, пл/б	330591	Продукты питания (folder)/Продукты питания	0	
3313813	6924300124331	Драже светлэнд с игрушкой 3g тв/уп	1	Неклассифицированные/default	0	
2861702	6933893316337	Драже светящаяся бетономешалка 5g	1	Неклассифицированные/default	0	
2861703	6933893322413	Драже светящаяся подводная лодка сахаристое с игрушкой 5g пл/уп	1	Неклассифицированные/default	0	
2861704	6933893322758	Драже светящийся автомат 10g	1	Неклассифицированные/default	0	
2861705	6933893322383	Драже светящийся байк 2 сахаристое с игрушкой 5g	1	Неклассифицированные/default	0	
3313814	6933893310472	Драже светящийся бронеджип с пушкой 5g	1	Неклассифицированные/default	0	
2861708	6933893322437	Драже светящийся экскаватор 15g	1	Неклассифицированные/default	0	
1206871	4823000910638	Драже свиточ арахис в какао 90g	22145	Продукты питания (folder)/Кондитерские изделия (folder)/Конфеты	1714672	Свиточ
1206872	4823000913844	Драже свиточ натс трио 45g	22145	Продукты питания (folder)/Кондитерские изделия (folder)/Конфеты	1714672	Свиточ
1206860	4823000914896	Драже свиточ натс трио свиточ 20% бесплатно 54g	22145	Продукты питания (folder)/Кондитерские изделия (folder)/Конфеты	1714672	Свиточ
1206873	4823000912502	Драже свиточ смак арахис в какао 55g	22145	Продукты питания (folder)/Кондитерские изделия (folder)/Конфеты	1714672	Свиточ
1206874	4823000906686	Драже свиточ смак арахис в какао 70g	22145	Продукты питания (folder)/Кондитерские изделия (folder)/Конфеты	1714672	Свиточ
3313815	594297150758	Драже свитэксим Disney palace pets 10g пл/у	1	Неклассифицированные/default	0	
1206875	4820042650485	Драже сгущен. молоко в какао 230g	1	Неклассифицированные/default	0	
4998589	6971066320767	Драже сгущенка 7g	674836	Продукты питания (folder)/Кондитерские изделия (folder)/Драже	0	
3313816	6920151228310	Драже секрет принцессы сахарное 45g пл/у	1	Неклассифицированные/default	0	
2861709	6975413092536	Драже секреты красоты 3g	1	Неклассифицированные/default	0	
2725200	6975413092529	Драже секреты красоты 3g/713	77	Продукты питания (folder)/Кондитерские изделия (folder)/Кондитерские изделия	0	
1663536	4650062481017	Драже семейный доктор с игрошкой 5g	337649	Уход за детьми (folder)/Уход за детьми	0	
3313817	4607089850395	Драже семечки в какао 250g	1	Неклассифицированные/default	0	
5114295	4606763002402	Драже семечки цветные /3.5/ кф эст	1	Неклассифицированные/default	0	
2861710	4607033270156	Драже семечки цветные 0.250	1	Неклассифицированные/default	3682689	Konti шоколадные истории
1674183	4600452017678	Драже сердечки микки и мнни маус 40g	22145	Продукты питания (folder)/Кондитерские изделия (folder)/Конфеты	0	
3313818	6914204113012	Драже сердечко с игрушкой фруктовое мягуп 4g	1	Неклассифицированные/default	0	
2861711	6920151240626	Драже сердечко точилка 0.003	1	Неклассифицированные/default	0	
3313819	6909699763132	Драже сказачный петушок мягуп 3g	1	Неклассифицированные/default	0	
3313822	6933893324332	Драже сказочная флейта с игрушкой 3g	1	Неклассифицированные/default	0	
3313823	4670018260091	Драже сказочные пони xxl сахарное в капсуле с игрушкой 10g	1	Неклассифицированные/default	0	
3313824	6933893316061	Драже скейтборд с игрушкой	1	Неклассифицированные/default	0	
3313825	6957342913212	Драже скиф клевики жевательная кисло фруктовое мягуп 20g	1	Неклассифицированные/default	0	
3313826	6975477936906	Драже скорая помощь с игрушкой 5g	1	Неклассифицированные/default	0	
1206876	4820046913128	Драже сладкая Коллекция вишня в какао 50g	1	Неклассифицированные/default	0	
2861714	6923649512076	Драже сладкая машинка 6g 12/30 by-d-007	1	Неклассифицированные/default	3308843	День игрушки
2877537	6963002514422	Драже сладкая соломка сахарное черника 12g	1	Неклассифицированные/default	0	
2725201	6965000761266	Драже сладкие палочки 5.5g 100шт	77	Продукты питания (folder)/Кондитерские изделия (folder)/Кондитерские изделия	0	
3313828	6957342926168	Драже сладкие палочки мягуп 6g	1	Неклассифицированные/default	0	
3313829	6957342997663	Драже сладкие трубочки со вкусом клубники банана шоколада 9g	1	Неклассифицированные/default	0	
3313830	6926643000112	Драже сладкие фрукты мягуп 12g	1	Неклассифицированные/default	0	
2861715	6936168701432	Драже сладкие часики	1	Неклассифицированные/default	0	
