ID	UPCEAN	Name	CategoryID	CategoryName	BrandID	BrandName
4889945	3282770104639	Крем для контура глаз avene sensibles возрождающий, 15ml c75709	5586	Косметика (folder)/Косметика	206708	Avene
206740	3282771200842	Крем для контура глаз avene успок 10ml	664	Косметика (folder)/Крем для лица	206708	Avene
950867	8015150240659	Крем для контура глаз collistar моделирующий с эффектом заполнения морщин 15ml	1	Неклассифицированные/default	950636	COLLISTAR
266179	4823015910593	Крем для контура глаз elfa dr.sante rosarium против морщин туб 50ml	664	Косметика (folder)/Крем для лица	261925	Elfa Dr.Sante
231661	5907609320292	Крем для контура глаз Eveline caviar Prestige легкий spf15 20ml	5586	Косметика (folder)/Косметика	9774	Eveline
2766185	3337872414039	Крем для контура глаз La roche posay redermic r 35-55 лет, 15ml m6338900	1	Неклассифицированные/default	302307	La Roche-Posay
1034571	3337872412677	Крем для контура глаз La roche posay substiane для зрелой кожи, 15ml m2947600	1	Неклассифицированные/default	302307	La Roche-Posay
1163894	7612017058283	Крем для контура глаз valmont корректирующий Премиум контур 30ml	664	Косметика (folder)/Крем для лица	1163883	VALMONT
3617468	3282779051361	Крем для контура глаз успокаивающий avene sensibles для чувствительной кожи 10ml (c05136)	5586	Косметика (folder)/Косметика	206708	Avene
266412	4823015913617	Крем для контуров тела elfa dr.sante Body therapy моделирующий фитнесс формула. туб 200ml	1682	Косметика (folder)/Крем косметический	261925	Elfa Dr.Sante
276500	4602242004820	Крем для коррекции фигуры турбослим 100ml	241824	Лекарственные средства (folder)/Аптека	876457	Эвалар Турбослим
75828	4010864020720	Крем для лаковой кожи Salamander prof lack Cream бесцветн 8109/019 /12 Германия	594	Хозяйственные товары (folder)/Уход за обувью	3255	Salamander
32269	4603541007758	Крем для легкости ног маграв spa биарриц обогащенный	10304	Косметика (folder)/Крем для ног	32265	SPA Биарриц
4819685	3337872411793	Крем для лечения себорейного дерматита La roche posay kerium ds, 40ml m0137401	5586	Косметика (folder)/Косметика	302307	La Roche-Posay
2015215	8809305082634	Крем для лица 3w clinic с экстракт слизи улитки, от морщин, 50ml 082634	664	Косметика (folder)/Крем для лица	2449136	3W Clinic
75554	4600936180126	Крем для лица 40g геронтол для сух/увядающей к.	664	Косметика (folder)/Крем для лица	3757831	Svoboda
231759	4607059920738	Крем для лица 40ml ассортим	664	Косметика (folder)/Крем для лица	0	
480166	4607040319480	Крем для лица 5 минут ультраподтягивающий для всех тип.к. 40ml 12	664	Косметика (folder)/Крем для лица	0	
5458643	3800002300941	Крем для лица 50ml bebble	664	Косметика (folder)/Крем для лица	4892031	Bebble
480167	3800038940456	Крем для лица 50ml дева для сух/ист/к календула	664	Косметика (folder)/Крем для лица	0	
480168	3800038940357	Крем для лица 50ml дева для сух/нор/к миндаль	664	Косметика (folder)/Крем для лица	0	
480169	3800038940753	Крем для лица 50ml дева для сух/нор/когурец увлажняющий	664	Косметика (folder)/Крем для лица	0	
480173	3800038940654	Крем для лица 50ml дева отбеливающий лимон для сух/нор/к	664	Косметика (folder)/Крем для лица	0	
5458644	4006303374004	Крем для лица 75мл topfer 60374	664	Косметика (folder)/Крем для лица	3762087	TOPFER
884905	80711759	Крем для лица 9337л о.c виноградные косточки	664	Косметика (folder)/Крем для лица	0	
884907	80711766	Крем для лица 9339л о.c сок граната	664	Косметика (folder)/Крем для лица	0	
884908	80711773	Крем для лица 9341л о.c мякоть сацума	664	Косметика (folder)/Крем для лица	0	
5458650	8809747922307	Крем для лица a'pieu madecassoside Cream 2x ?нтенсивно зволожуючий 120мл (8809747922307)	664	Косметика (folder)/Крем для лица	5458649	a'pieu
5458651	8809643547499	Крем для лица a'pieu madecassoside Cream 2x ?нтенсивно зволожуючий 50ml (8809643547499)	664	Косметика (folder)/Крем для лица	5458649	a'pieu
5458652	8809643538640	Крем для лица a'pieu madecassoside moisture Gel Cream 50ml (8809643538640)	664	Косметика (folder)/Крем для лица	5458649	a'pieu
5458653	8809643507639	Крем для лица a'pieu mulberry blemish clearing Cream для проблемної шк?ри 50ml (8809643507639)	664	Косметика (folder)/Крем для лица	5458649	a'pieu
5458645	3282770072686	Крем для лица a-derma hydralba uv легкий увлажняющий, 40мл c31787	664	Косметика (folder)/Крем для лица	334357	A-Derma
4807181	4603726763646	Крем для лица achromin аnti-аge гиалуроновый, 50ml 28315	5586	Косметика (folder)/Косметика	4807169	Achromin
4886286	4603726763714	Крем для лица achromin аnti-аge со стволовыми клетками, 50ml 28314 achromin	5586	Косметика (folder)/Косметика	4807169	Achromin
556326	3412242020147	Крем для лица Adidas active Skin Care man защищающий 50ml	664	Косметика (folder)/Крем для лица	3546	Adidas
5458646	4008666343451	Крем для лица alcina №1, 50ml (34345)	664	Косметика (folder)/Крем для лица	1720731	Alcina
5458648	8809519410643	Крем для лица amicell Perfect Energy expert renewal н?чний в?дновлюючий 50ml (8809519410643)	664	Косметика (folder)/Крем для лица	5458647	amicell
15951	6412600569025	Крем для лица Anytime увлажняй для сух и норм к	664	Косметика (folder)/Крем для лица	1042	ANYTIME
31267	4041900065139	Крем для лица apotheker scheller ананас увлажняющий матирующий для смешанной и проблемной кожи 75ml	664	Косметика (folder)/Крем для лица	3779	Аптекарь Шеллер
3784	4041900065160	Крем для лица apotheker scheller для зрелой кожи дневной против морщин белый чай и женьшень 50ml	664	Косметика (folder)/Крем для лица	3779	Аптекарь Шеллер
31203	4041900065023	Крем для лица apotheker scheller для нормальной кожи активный защитный увлажняющий морковь и апельсин c уф-фильтром spf10 75ml	664	Косметика (folder)/Крем для лица	3779	Аптекарь Шеллер
31266	4041900065016	Крем для лица apotheker scheller для нормальной кожи дневной увлажняющий с айвой 75ml	664	Косметика (folder)/Крем для лица	3779	Аптекарь Шеллер
31268	4041900065030	Крем для лица apotheker scheller для нормальной кожи ночной с айвой и алоэ вера 75ml	664	Косметика (folder)/Крем для лица	3779	Аптекарь Шеллер
31233	4041900065078	Крем для лица apotheker scheller для сухой кожи дневной интенсивный восстанавливающий с маслом чертополоха 75ml	664	Косметика (folder)/Крем для лица	3779	Аптекарь Шеллер
31259	4041900065061	Крем для лица apotheker scheller для сухой кожи дневной расслабляющий масло миндаля и облепиха 75ml	664	Косметика (folder)/Крем для лица	3779	Аптекарь Шеллер
31272	4041900065108	Крем для лица apotheker scheller для чувствительной кожи зеленый чай и морские водоросли дневной успокаивающий с uv-фильтром 5	664	Косметика (folder)/Крем для лица	3779	Аптекарь Шеллер
31206	4041900065115	Крем для лица apotheker scheller для чувствительной кожи спирулина и морские водоросли ночной восстанавливающий 50ml	664	Косметика (folder)/Крем для лица	3779	Аптекарь Шеллер
3376508	4602159011881	Крем для лица Aqua enerqy дневной 75ml	664	Косметика (folder)/Крем для лица	0	
3376509	4602159011904	Крем для лица Aqua enerqy ночной 75ml	664	Косметика (folder)/Крем для лица	0	
901101	8032622914863	Крем для лица aquolina дневной защищающий тонизирующий spf10 c дыней 50ml	664	Косметика (folder)/Крем для лица	639857	AQUOLINA
901102	8032622914856	Крем для лица aquolina дневной увлажняющий вяжущий с матовым эффектом с манго 50ml	664	Косметика (folder)/Крем для лица	639857	AQUOLINA
5458654	4670008494826	Крем для лица aravia professional active hydrating Cream 24h активное увлажнение, 100ml ar9004	664	Косметика (folder)/Крем для лица	5249903	aravia professional
5458655	4670008493294	Крем для лица aravia professional Gentle cold-Cream мягкий очищающий, 250ml ar6207	664	Косметика (folder)/Крем для лица	5249903	aravia professional
5458656	4670008493386	Крем для лица aravia professional moisture protecor Cream увлажняющий защитный, 150ml ar6109	664	Косметика (folder)/Крем для лица	5249903	aravia professional
902021	3141389910386	Крем для лица arnaud дневной абсолютное увлажнение для нормальной и комбинированой кожи spf5 50ml	664	Косметика (folder)/Крем для лица	901994	ARNAUD
902022	3141389910393	Крем для лица arnaud дневной абсолютное увлажнение для сухой и чувствительной кожи spf5 50ml	664	Косметика (folder)/Крем для лица	901994	ARNAUD
902023	3141389910218	Крем для лица arnaud дневной питание и восстановление против морщин для увядающей кожи spf8 50ml	664	Косметика (folder)/Крем для лица	901994	ARNAUD
902024	3141389910416	Крем для лица arnaud дневной сияние молодости подтягивающий против старения spf5 50ml	664	Косметика (folder)/Крем для лица	901994	ARNAUD
902025	3141389910379	Крем для лица arnaud защитный экстремальный климат абсолютное увлажнение 50ml	664	Косметика (folder)/Крем для лица	901994	ARNAUD
902026	3141389910225	Крем для лица arnaud ночной питание и восстановление против морщин для увядающей кожи 50ml	664	Косметика (folder)/Крем для лица	901994	ARNAUD
902027	3141389910423	Крем для лица arnaud ночной укрепляющий сияние молодости с эффектом лифтинга 50ml	664	Косметика (folder)/Крем для лица	901994	ARNAUD
3376510	4870205222424	Крем для лица aromika delicate огуречный отбеливающий 100ml туба	664	Косметика (folder)/Крем для лица	0	
5458657	3282770208795	Крем для лица avene hydrance uv20 Riche spf30 насыщенный, 40мл c15524	664	Косметика (folder)/Крем для лица	206708	Avene
4807718	3282770114195	Крем для лица avene xeracalm a.d. липидо-восполнение, 400ml c73681	5586	Косметика (folder)/Косметика	206708	Avene
330578	5050136531232	Крем для лица avon Naturals молоко и мед 125ml	664	Косметика (folder)/Крем для лица	297834	Avon
4890218	4604094031658	Крем для лица B&n нэфис целебные травы антивозр масло розы 45m	1	Неклассифицированные/default	4890217	Нэфис целебные травы
480180	4630007830711	Крем для лица baikal herbals ночной восстанавливающий 50ml	664	Косметика (folder)/Крем для лица	341242	Baikal Herbals
480179	4630007830698	Крем для лица baikal herbals ночной для жирной и комбинированной кожи 50ml	664	Косметика (folder)/Крем для лица	341242	Baikal Herbals
906864	6920031412037	Крем для лица baixiaodan anti-acne освежающ. и выравнивающ. (30g). 12	664	Косметика (folder)/Крем для лица	0	
906865	6920031412044	Крем для лица baixiaodan anti-acne увлажняющий 30g /12	664	Косметика (folder)/Крем для лица	0	
5458658	9911415653372	Крем для лица baps amrut турми дерми с куркумой (turmi dermi Cream) 9911415653372	664	Косметика (folder)/Крем для лица	5249939	baps amrut
5458659	3600523723492	Крем для лица bb 5в1 L'oreal Paris bb c'est Magic совершенство кожи, оттенок 01, очень светлый, 30мл a9827300	664	Косметика (folder)/Крем для лица	5229070	l'oreal paris
5458660	3600523723539	Крем для лица bb 5в1 L'oreal Paris bb c'est Magic совершенство кожи, оттенок 02, светлый, 30мл a9827500	664	Косметика (folder)/Крем для лица	5229070	l'oreal paris
5458661	3600523723577	Крем для лица bb 5в1 L'oreal Paris bb c'est Magic совершенство кожи, оттенок 03, медиум, 30мл a9827700	664	Косметика (folder)/Крем для лица	5229070	l'oreal paris
1731866	3600541480155	Крем для лица bb Garnier 5в1 чистая кожа актив светло-бежевый 50ml c5501402	5586	Косметика (folder)/Косметика	293253	Garnier Skin Naturals
5458662	8806334355593	Крем для лица bb holika holika аква spf25, 30мл 20016778	664	Косметика (folder)/Крем для лица	4918707	Holika holika
3672391	8806334355128	Крем для лица bb holika holika с гиалуроновой кислотой spf30, 30ml 20013821	5586	Косметика (folder)/Косметика	3672376	HOLIKA HOLIKA (ENPRANI CO/KOREA)
3672393	8806334355586	Крем для лица bb holika holika сияние spf45, 30ml 20016777	5586	Косметика (folder)/Косметика	3672376	HOLIKA HOLIKA (ENPRANI CO/KOREA)
5458663	8806334355111	Крем для лица bb holika holika упругость spf30, 30мл 20013811	664	Косметика (folder)/Крем для лица	4918707	Holika holika
5458664	8809479165195	Крем для лица bb увлажняющий limoni aquamax moisture тон 1, 40мл 816519	664	Косметика (folder)/Крем для лица	3691592	LIMONI
266352	4810090001926	Крем для лица belkosmex mirielle активно увлажняющий с маслом морошки 48g	664	Косметика (folder)/Крем для лица	260779	Belkosmex Mirielle
266353	4810090001339	Крем для лица belkosmex mirielle для жирной кожи с фрутапоном черной смородины матирующий 48g	664	Косметика (folder)/Крем для лица	260779	Belkosmex Mirielle
266354	4810090001391	Крем для лица belkosmex mirielle для жирной кожи с фрутапоном черной смородины оздоравливающий против угревой сыпи 48g	664	Косметика (folder)/Крем для лица	260779	Belkosmex Mirielle
266355	4810090001773	Крем для лица belkosmex mirielle для комбинированной кожи регулирующий 48g	664	Косметика (folder)/Крем для лица	260779	Belkosmex Mirielle
266356	4810090000301	Крем для лица belkosmex mirielle коллагеновый против морщин 48g	664	Косметика (folder)/Крем для лица	260779	Belkosmex Mirielle
266357	4810090000295	Крем для лица belkosmex mirielle липосомный увлажняющий 48g	664	Косметика (folder)/Крем для лица	260779	Belkosmex Mirielle
266358	4810090001797	Крем для лица belkosmex mirielle молочно-ореховый питание и увлажнение 48g	664	Косметика (folder)/Крем для лица	260779	Belkosmex Mirielle
266360	4810090000622	Крем для лица belkosmex mirielle отбеливающий с витамином с и маслом лаванды 48g	664	Косметика (folder)/Крем для лица	260779	Belkosmex Mirielle
266361	4810090001780	Крем для лица belkosmex mirielle с мякотью фруктов против старения 48g	664	Косметика (folder)/Крем для лица	260779	Belkosmex Mirielle
266362	4810090000370	Крем для лица belkosmex mirielle с растительными керамидами лифтинг 48g	664	Косметика (folder)/Крем для лица	260779	Belkosmex Mirielle
266363	4810090001353	Крем для лица belkosmex mirielle с экстрактом ростков бамбука дневная защита 48g	664	Косметика (folder)/Крем для лица	260779	Belkosmex Mirielle
266364	4810090001360	Крем для лица belkosmex mirielle с экстрактом ростков бамбука Люкс-гидратант 48g	664	Косметика (folder)/Крем для лица	260779	Belkosmex Mirielle
2781360	5900002071358	Крем для лица Bella Eva simply питательный с экстрактом овса, 50ml/12	664	Косметика (folder)/Крем для лица	0	
2781361	5900002071334	Крем для лица Bella Eva simply увлажняющий с экстрактом иерихонской розы, 50ml/12	664	Косметика (folder)/Крем для лица	0	
3376333	5907582900412	Крем для лица belle jardin 125ml от морщин	1	Неклассифицированные/default	3016999	belle jardin
3376511	5907582900221	Крем для лица belle jardin 200ml (бан) ассортим	664	Косметика (folder)/Крем для лица	3016999	belle jardin
3376512	5907582900238	Крем для лица belle jardin 200ml (бан) ассортим #2	664	Косметика (folder)/Крем для лица	3016999	belle jardin
3376513	5907582900252	Крем для лица belle jardin 200ml (бан) ассортим #3	664	Косметика (folder)/Крем для лица	3016999	belle jardin
3376514	5907582900269	Крем для лица belle jardin 200ml (бан) ассортим #4	664	Косметика (folder)/Крем для лица	3016999	belle jardin
3376515	5907582902638	Крем для лица belle jardin 65ml	664	Косметика (folder)/Крем для лица	3016999	belle jardin
3376524	5907582900382	Крем для лица belle jardin anti-возрастной с экстрактом зеленого чая 125ml	664	Косметика (folder)/Крем для лица	3016999	belle jardin
3376516	5907582900214	Крем для лица belle jardin алоэ вера 200ml	664	Косметика (folder)/Крем для лица	3016999	belle jardin
3376518	5907582900429	Крем для лица belle jardin защитный с оливковым маслом 125ml	664	Косметика (folder)/Крем для лица	3016999	belle jardin
3376519	5907582900436	Крем для лица belle jardin козье молоко,коллаген и эластин регенерирующий 125ml п/уп	664	Косметика (folder)/Крем для лица	3016999	belle jardin
3376335	5907582900375	Крем для лица belle jardin ромашка,коллаген и эластин для чуствительной кожи 125ml п/уп	664	Косметика (folder)/Крем для лица	3016999	belle jardin
3376520	5907582900290	Крем для лица belle jardin ростки пшеницы 200ml	664	Косметика (folder)/Крем для лица	3016999	belle jardin
3376521	5907582900443	Крем для лица belle jardin ростки пшеницы питательный 125ml	664	Косметика (folder)/Крем для лица	3016999	belle jardin
3376522	5907582903475	Крем для лица belle jardin софт восстанавливающий 200ml п/уп	664	Косметика (folder)/Крем для лица	3016999	belle jardin
3376523	5907582900405	Крем для лица belle jardin экстракт огурца+коллаген и эластин 125ml	664	Косметика (folder)/Крем для лица	3016999	belle jardin
3376525	5907582900283	Крем для лица belle jarin козье молоко 200ml	664	Косметика (folder)/Крем для лица	3016999	belle jardin
3376526	5907582900276	Крем для лица belle jarin оливковое масло 200ml	664	Косметика (folder)/Крем для лица	3016999	belle jardin
910830	4810156021813	Крем для лица belor design ночной для комб.кожи облепиховый (42g).5	664	Косметика (folder)/Крем для лица	0	
1354523	8010047115027	Крем для лица bema bio питательный 50ml бема косметичи	664	Косметика (folder)/Крем для лица	4892260	Bema
2287638	602004058409	Крем для лица benefit bb big Easy 01 Fair 35ml	664	Косметика (folder)/Крем для лица	911247	Benefit
2287639	602004058423	Крем для лица benefit bb big Easy 03 Light medium 35ml	664	Косметика (folder)/Крем для лица	911247	Benefit
2287640	602004058447	Крем для лица benefit bb big Easy 05 beige 35ml	664	Косметика (folder)/Крем для лица	911247	Benefit
2287704	602004058430	Крем для лица benefit вв big Easy 04 medium 35ml	664	Косметика (folder)/Крем для лица	911247	Benefit
2884714	6414504728430	Крем для лица berner lv дневной увл. с фактором защиты spf15 60ml	664	Косметика (folder)/Крем для лица	389126	Berner LV
1780128	6414504290166	Крем для лица berner lv увлажняющий 24 часа 75ml	664	Косметика (folder)/Крем для лица	389126	Berner LV
75496	5904879003832	Крем для лица bielenda botox ночной 50ml	664	Косметика (folder)/Крем для лица	344951	Bielenda
566662	4810151013479	Крем для лица Bielita bio flavonoids дневной 50ml	664	Косметика (folder)/Крем для лица	4241	Bielita
566663	4810151013486	Крем для лица Bielita bio flavonoids ночной 50ml	664	Косметика (folder)/Крем для лица	4241	Bielita
2369485	4810151020712	Крем для лица Bielita Oil классический с маслами авокадо и кунжута для всех типов 50ml/14	664	Косметика (folder)/Крем для лица	4241	Bielita
2369487	4810151020736	Крем для лица Bielita Oil кор морщ с масл оливы и кост.винограда для норм/комб кожи 50/14	664	Косметика (folder)/Крем для лица	4241	Bielita
2369486	4810151020729	Крем для лица Bielita Oil лифтинг с маслами арганы и жожоба для норм и сух 50ml/14	664	Косметика (folder)/Крем для лица	4241	Bielita
913317	4810151016371	Крем для лица Bielita so beauty день spf10 для всех типов кожи 50ml 16	664	Косметика (folder)/Крем для лица	4241	Bielita
913287	4810153012234	Крем для лица Bielita женьшень день 45ml 12	664	Косметика (folder)/Крем для лица	4241	Bielita
