ID	UPCEAN	Name	CategoryID	CategoryName	BrandID	BrandName
2722102	4000870988039	Лампа галоген paulmann декоцилиндр желтая gu 5.3 35w 98803	3228815	Техника (folder)/Электротехника (folder)/Лампа галогенная	2513071	Paulmann
2722103	4000870988084	Лампа галоген paulmann декоцилиндр зеленая gu 5.3 20w 98808	3228815	Техника (folder)/Электротехника (folder)/Лампа галогенная	2513071	Paulmann
2722104	4000870988091	Лампа галоген paulmann декоцилиндр зеленая gu 5.3 35w 98809	3228815	Техника (folder)/Электротехника (folder)/Лампа галогенная	2513071	Paulmann
2722105	4000870988213	Лампа галоген paulmann декоцилиндр Золотой кроколед gu 5.3 20w 98821	3228815	Техника (folder)/Электротехника (folder)/Лампа галогенная	2513071	Paulmann
2722106	4000870988510	Лампа галоген paulmann декоцилиндр Золотой кроколед gu 5.3 50w 98851	3228815	Техника (folder)/Электротехника (folder)/Лампа галогенная	2513071	Paulmann
2722107	4000870988008	Лампа галоген paulmann декоцилиндр красная gu 5.3 20w 98800	3228815	Техника (folder)/Электротехника (folder)/Лампа галогенная	2513071	Paulmann
2722108	4000870988015	Лампа галоген paulmann декоцилиндр красная gu 5.3 35w 98801	3228815	Техника (folder)/Электротехника (folder)/Лампа галогенная	2513071	Paulmann
2722109	4000870988244	Лампа галоген paulmann декоцилиндр прозрач. gu 5.3 20w 98824	3228815	Техника (folder)/Электротехника (folder)/Лампа галогенная	2513071	Paulmann
2722110	4000870988541	Лампа галоген paulmann декоцилиндр прозрач. gu 5.3 50w 98854	3228815	Техника (folder)/Электротехника (folder)/Лампа галогенная	2513071	Paulmann
2722111	4000870988220	Лампа галоген paulmann декоцилиндр прозрач. кроколед gu 5.3 20w 98822	3228815	Техника (folder)/Электротехника (folder)/Лампа галогенная	2513071	Paulmann
2722112	4000870988527	Лампа галоген paulmann декоцилиндр прозрач. кроколед gu 5.3 50w 98852	3228815	Техника (folder)/Электротехника (folder)/Лампа галогенная	2513071	Paulmann
2722113	4000870988268	Лампа галоген paulmann декоцилиндр сатин gu 5.3 20w 98826	3228815	Техника (folder)/Электротехника (folder)/Лампа галогенная	2513071	Paulmann
2722114	4000870988367	Лампа галоген paulmann декоцилиндр сатин gu 5.3 35w 98836	3228815	Техника (folder)/Электротехника (folder)/Лампа галогенная	2513071	Paulmann
2722115	4000870988565	Лампа галоген paulmann декоцилиндр сатин gu 5.3 50w 98856	3228815	Техника (folder)/Электротехника (folder)/Лампа галогенная	2513071	Paulmann
2722116	4000870988251	Лампа галоген paulmann декоцилиндр синяя gu 5.3 20w 98825	3228815	Техника (folder)/Электротехника (folder)/Лампа галогенная	2513071	Paulmann
2722117	4000870988558	Лампа галоген paulmann декоцилиндр синяя gu 5.3 50w 98855	3228815	Техника (folder)/Электротехника (folder)/Лампа галогенная	2513071	Paulmann
2722118	4000870988053	Лампа галоген paulmann декоцилиндр темносиняя gu 5.3 20w 98805	3228815	Техника (folder)/Электротехника (folder)/Лампа галогенная	2513071	Paulmann
2722119	4000870988060	Лампа галоген paulmann декоцилиндр темносиняя gu 5.3 35w 98806	3228815	Техника (folder)/Электротехника (folder)/Лампа галогенная	2513071	Paulmann
2722120	4000870988077	Лампа галоген paulmann декоцилиндр темносиняя gu 5.3 50w 98807	3228815	Техника (folder)/Электротехника (folder)/Лампа галогенная	2513071	Paulmann
3390993	8711500494337	Лампа галоген Philips 750w 230v	3228815	Техника (folder)/Электротехника (folder)/Лампа галогенная	0	
288244	8711500885753	Лампа галоген Philips dichroic 12в 20w 36° gu5.3 с отраж. и защит. стеклом	3228815	Техника (folder)/Электротехника (folder)/Лампа галогенная	39898	PHILIPS
288245	8727900252439	Лампа галоген Philips dichroic 12в 35w 36° gu5.3 с отраж. и защит. стеклом	3228815	Техника (folder)/Электротехника (folder)/Лампа галогенная	39898	PHILIPS
751987	8727900252446	Лампа галоген Philips dichroic 12в 50w 36° gu5.3 с отраж. и защит. стеклом	3228815	Техника (folder)/Электротехника (folder)/Лампа галогенная	39898	PHILIPS
288246	8711500885791	Лампа галоген Philips dichroic 12в 50w 36° gu5.3 с отраж. и защит. стеклом #2	3228815	Техника (folder)/Электротехника (folder)/Лампа галогенная	39898	PHILIPS
2183210	8727900820546	Лампа галоген Philips e14 18w 230v b 350ml eco Classic	1	Неклассифицированные/default	39898	PHILIPS
5478458	8727900925067	Лампа галоген Philips e14 28w 230v bxs 350ml ecoclassic	3228815	Техника (folder)/Электротехника (folder)/Лампа галогенная	39898	PHILIPS
5478459	8718696466360	Лампа галоген Philips e14 28w 230v nr50 30d eco Classic	3228815	Техника (folder)/Электротехника (folder)/Лампа галогенная	39898	PHILIPS
5478460	8727900252750	Лампа галоген Philips e14 28w 230v nr50 fr 1bc/10 ecoclassic (925640044202)	3228815	Техника (folder)/Электротехника (folder)/Лампа галогенная	39898	PHILIPS
5477613	8718696466308	Лампа галоген Philips e14 42w 230v bw 350ml ecoclassic (925647244208)	78022	Техника (folder)/Электротехника (folder)/Лампа электрическая	39898	PHILIPS
2183213	8727900831405	Лампа галоген Philips e27 28w 230v p 450ml ecoclassic	1	Неклассифицированные/default	39898	PHILIPS
3846427	8727900251982	Лампа галоген Philips e27 42w 230v a 550ml 1bc/10 ecoclassic (925693044202)	78022	Техника (folder)/Электротехника (folder)/Лампа электрическая	39898	PHILIPS
2183204	8727900251951	Лампа галоген Philips e27 42w 230v nr63 fr 1ct/10 ecoclassic (925636044201)	1	Неклассифицированные/default	39898	PHILIPS
2183205	8727900252255	Лампа галоген Philips e27 70w 230v a 550ml 1ct/10 ecoclassic	1	Неклассифицированные/default	39898	PHILIPS
3846430	8718696466322	Лампа галоген Philips e27 70w 230v a 550ml 1ct/15 ecoclassic	78022	Техника (folder)/Электротехника (folder)/Лампа электрическая	39898	PHILIPS
751114	8711500402103	Лампа галоген Philips g4 20w 12v cl 4000h 1ct/10x10 f caps	78022	Техника (folder)/Электротехника (folder)/Лампа электрическая	39898	PHILIPS
639370	8727900252422	Лампа галоген Philips gu5.3 20w 12v 36d 1ct/10x5 f hal-dich 2y	1	Неклассифицированные/default	39898	PHILIPS
5027207	8727900362558	Лампа галоген Philips h1 longlife ecovision 12v 55w, 2шт 12258llecos2	78022	Техника (folder)/Электротехника (folder)/Лампа электрическая	39898	PHILIPS
5478461	8711500696397	Лампа галоген Philips h1 rally (12454rac1)	3228815	Техника (folder)/Электротехника (folder)/Лампа галогенная	39898	PHILIPS
5027209	8727900363227	Лампа галоген Philips h1 vision Plus 12v 55w, 2шт 12258vps2	78022	Техника (folder)/Электротехника (folder)/Лампа электрическая	39898	PHILIPS
5478462	8711500788849	Лампа галоген Philips h1 whitevision + 60% (12258whvsm)	3228815	Техника (folder)/Электротехника (folder)/Лампа галогенная	39898	PHILIPS
5478463	8727900371666	Лампа галоген Philips h1 x-treme vision 3700k 12v 55w, 2шт 12258xv+s2	3228815	Техника (folder)/Электротехника (folder)/Лампа галогенная	39898	PHILIPS
5478464	8711559529745	Лампа галоген Philips h10 (9145c1)	3228815	Техника (folder)/Электротехника (folder)/Лампа галогенная	39898	PHILIPS
5478465	8711559526461	Лампа галоген Philips h11 Crystal vision 4300k 12v 55w + w5w 12v 5w, по 2шт 12362cvsm	3228815	Техника (folder)/Электротехника (folder)/Лампа галогенная	39898	PHILIPS
5478466	8727900360455	Лампа галоген Philips h11 Diamond vision (12362dvs2)	3228815	Техника (folder)/Электротехника (folder)/Лампа галогенная	39898	PHILIPS
5478467	8727900363104	Лампа галоген Philips h11 longlife ecovision 3100k 12v 55w, 1шт 12362llecob1	3228815	Техника (folder)/Электротехника (folder)/Лампа галогенная	39898	PHILIPS
5478468	8727900364309	Лампа галоген Philips h11 vision 3100k 12v 55w, 1шт 12362prc1	3228815	Техника (folder)/Электротехника (folder)/Лампа галогенная	39898	PHILIPS
5478469	8727900368567	Лампа галоген Philips h16 vision 12v 19w, 1шт 12366c1	3228815	Техника (folder)/Электротехника (folder)/Лампа галогенная	39898	PHILIPS
5478470	8711500774965	Лампа галоген Philips h3 Crystal vision 4300k 12v 55w pk22s, 1шт 12336cvb1	3228815	Техника (folder)/Электротехника (folder)/Лампа галогенная	39898	PHILIPS
5478471	8711500697455	Лампа галоген Philips h3 Diamond vision 5000k 12v 55w, 2шт 12336dvs2	3228815	Техника (folder)/Электротехника (folder)/Лампа галогенная	39898	PHILIPS
5478472	8727900374292	Лампа галоген Philips h4 longlife (12342elc2)	3228815	Техника (folder)/Электротехника (folder)/Лампа галогенная	39898	PHILIPS
5478473	8727900361988	Лампа галоген Philips h4 longlife ecovision 12v 60/55w, 1шт 12342llecob1	3228815	Техника (folder)/Электротехника (folder)/Лампа галогенная	39898	PHILIPS
5478474	8719018000200	Лампа галоген Philips h4 racing vision + 150% (12342rvs2)	3228815	Техника (folder)/Электротехника (folder)/Лампа галогенная	39898	PHILIPS
5478475	8711500780287	Лампа галоген Philips h4 vision (12342prc2)	3228815	Техника (folder)/Электротехника (folder)/Лампа галогенная	39898	PHILIPS
5478476	8727900354898	Лампа галоген Philips h4 White vision 12v 60/55w (p43t) блистер 1шт 12342wvub1	3228815	Техника (folder)/Электротехника (folder)/Лампа галогенная	39898	PHILIPS
5478477	8727900354904	Лампа галоген Philips h4 White vision Ultra 4200k 12v 55/60w, 2шт 12342wvusm	3228815	Техника (folder)/Электротехника (folder)/Лампа галогенная	39898	PHILIPS
5478478	8711500788863	Лампа галоген Philips h4 whitevision + 60% (12342whvsm)	3228815	Техника (folder)/Электротехника (folder)/Лампа галогенная	39898	PHILIPS
5478479	8727900355253	Лампа галоген Philips h4 x-treme vision g-Force 12v 60/55w (p43t) 2шт 12342xvgs2	3228815	Техника (folder)/Электротехника (folder)/Лампа галогенная	39898	PHILIPS
5478480	8711500221346	Лампа галоген Philips h7 longlife (12972elc2)	3228815	Техника (folder)/Электротехника (folder)/Лампа галогенная	39898	PHILIPS
5478481	8727900362596	Лампа галоген Philips h7 longlife ecovision 12v 55w, 2шт 12972llecos2	3228815	Техника (folder)/Электротехника (folder)/Лампа галогенная	39898	PHILIPS
5478482	8727900532777	Лампа галоген Philips h7 masterduty bluevision 24v-70w, px26d, 2шт 13972mdbvs2	3228815	Техника (folder)/Электротехника (folder)/Лампа галогенная	39898	PHILIPS
5478484	8727900374322	Лампа галоген Philips h7 vision (12972prc2)	3228815	Техника (folder)/Электротехника (folder)/Лампа галогенная	39898	PHILIPS
5478485	8727900399387	Лампа галоген Philips h7 vision Plus 12v 55w, 2шт 12972vps2	3228815	Техника (folder)/Электротехника (folder)/Лампа галогенная	39898	PHILIPS
5478486	8727900354935	Лампа галоген Philips h7 White vision Ultra 12v 55w (px26d) блистер 1шт 12972wvub1	3228815	Техника (folder)/Электротехника (folder)/Лампа галогенная	39898	PHILIPS
5478487	8727900371604	Лампа галоген Philips h7 White vision Ultra 12v 55w (px26d) блистер 1шт 12972wvub1 #2	3228815	Техника (folder)/Электротехника (folder)/Лампа галогенная	39898	PHILIPS
5478488	8727900354959	Лампа галоген Philips h7 White vision Ultra 4200k 12v 55w, 2шт 12972wvusm	3228815	Техника (folder)/Электротехника (folder)/Лампа галогенная	39898	PHILIPS
5478489	8711500788887	Лампа галоген Philips h7 whitevision +60% (12972whvsm)	3228815	Техника (folder)/Электротехника (folder)/Лампа галогенная	39898	PHILIPS
5478490	8727900355413	Лампа галоген Philips h7 x-treme vision g-Force 12v 55w (px26d) 2шт 12972xvgs2	3228815	Техника (folder)/Электротехника (folder)/Лампа галогенная	39898	PHILIPS
2736659	8711500475824	Лампа галоген Philips h8 (12360c1)	300445	Эксплуатация и ремонт автомобилей/Автомобильные принадлежности	39898	PHILIPS
5478491	8711500876126	Лампа галоген Philips halogen h21w (Bay9s) 12v 1шт 12356cp	3228815	Техника (folder)/Электротехника (folder)/Лампа галогенная	39898	PHILIPS
5478492	8711500876164	Лампа галоген Philips halogen h21w (Bay9s) 24v 1шт 24356cp	3228815	Техника (folder)/Электротехника (folder)/Лампа галогенная	39898	PHILIPS
5478493	8727900696530	Лампа галоген Philips halogen ps19w (pg20/1) 12v 1шт 12085c1	3228815	Техника (folder)/Электротехника (folder)/Лампа галогенная	39898	PHILIPS
5478494	8727900700466	Лампа галоген Philips halogen ps19w (pg20/1) longlife 12v 1шт 12085LLC1	3228815	Техника (folder)/Электротехника (folder)/Лампа галогенная	39898	PHILIPS
5478495	8727900700442	Лампа галоген Philips halogen ps24w (pg20/3) 12v 1шт 12086ffc1	3228815	Техника (folder)/Электротехника (folder)/Лампа галогенная	39898	PHILIPS
5478496	8711559527352	Лампа галоген Philips halogen psy19w (pg20/2) Yellow 12v 1шт 12275nac1	3228815	Техника (folder)/Электротехника (folder)/Лампа галогенная	39898	PHILIPS
5478497	8727900696684	Лампа галоген Philips halogen psy24w (pg20/4) Yellow 12v 1шт 12188nac1	3228815	Техника (folder)/Электротехника (folder)/Лампа галогенная	39898	PHILIPS
5478498	8727900703795	Лампа галоген Philips halogen psy24w (pg20/4) Yellow Silver vision 12v 1шт 12180sv+c1	3228815	Техника (folder)/Электротехника (folder)/Лампа галогенная	39898	PHILIPS
5478499	8727900696783	Лампа галоген Philips halogen py24w (pgu20/4) Yellow Silver vision 12v 1шт 12274sv+c1	3228815	Техника (folder)/Электротехника (folder)/Лампа галогенная	39898	PHILIPS
5478500	8711559529417	Лампа галоген Philips halogen t10w (ba9s) 12v 1шт 12024cp	3228815	Техника (folder)/Электротехника (folder)/Лампа галогенная	39898	PHILIPS
5478501	8711500876003	Лампа галоген Philips halogen t20w (ba9s) 12v 1шт 12025cp	3228815	Техника (folder)/Электротехника (folder)/Лампа галогенная	39898	PHILIPS
5478502	8711500247209	Лампа галоген Philips halogen t6w (ba9s) (бл. 2шт) 12v 12036b2	3228815	Техника (folder)/Электротехника (folder)/Лампа галогенная	39898	PHILIPS
5478503	8711500876034	Лампа галоген Philips halogen t6w (ba9s) 12v 1шт 12036cp	3228815	Техника (folder)/Электротехника (folder)/Лампа галогенная	39898	PHILIPS
5478504	8719018005397	Лампа галоген Philips hb4 12v-51w (p22d) White vision Ultra блистер, 1шт 9006wvub1	3228815	Техника (folder)/Электротехника (folder)/Лампа галогенная	39898	PHILIPS
5201097	8727900532487	Лампа галоген Philips hb4 Diamond vision 12v-55w p22d, 2шт 9006dvs2	3948157	Техника (folder)/Электротехника (folder)/Лампа автомобильная	39898	PHILIPS
5478505	8727900351255	Лампа галоген Philips hir2 12v-55w, px22d, 9012LLC1	3228815	Техника (folder)/Электротехника (folder)/Лампа галогенная	39898	PHILIPS
5478506	8727900852233	Лампа галоген Philips r7s 120w 230v 1bb plusline es 78mm 2y (924587244210)	3228815	Техника (folder)/Электротехника (folder)/Лампа галогенная	39898	PHILIPS
5478483	8719018000248	Лампа галоген Philips racing vision +150% h7 12v 55w (px26d) 2шт 12972rvs2	3228815	Техника (folder)/Электротехника (folder)/Лампа галогенная	39898	PHILIPS
5478507	8727900696721	Лампа галоген Philips standard p13w (pg18.5d-1) 12v 1шт 12277c1	3228815	Техника (folder)/Электротехника (folder)/Лампа галогенная	39898	PHILIPS
5478508	8727900388749	Лампа галоген Philips standard psx26w 12v 26w pg18.5d-3, 1шт 12278c1	3228815	Техника (folder)/Электротехника (folder)/Лампа галогенная	39898	PHILIPS
5478509	8727900352450	Лампа галоген Philips vision hy21w (baw9s) Yellow 12v 1шт 12146cp	3228815	Техника (folder)/Электротехника (folder)/Лампа галогенная	39898	PHILIPS
5478510	8727900392043	Лампа галоген Philips w5w White vision 4500k 12v 5w, 2шт 12961nbvb2	3228815	Техника (folder)/Электротехника (folder)/Лампа галогенная	39898	PHILIPS
5478511	9325136122725	Лампа галоген reptile One halogen Heat lamp neodymium daylight, с неодимовым напылением (28w, e26) r1-46675	3228815	Техника (folder)/Электротехника (folder)/Лампа галогенная	5320231	aquaone
5478512	9325136122756	Лампа галоген reptile One halogen Heat lamp neodymium daylight, с неодимовым напылением (72w, e26) r1-46678	3228815	Техника (folder)/Электротехника (folder)/Лампа галогенная	5320231	aquaone
2737330	4036021202020	Лампа галоген sct 202020 н3 12v 55w рк22s	300445	Эксплуатация и ремонт автомобилей/Автомобильные принадлежности	2716542	Электротовары
3390994	4612745210581	Лампа галоген selecta капсульная 35w 230в	3228815	Техника (folder)/Электротехника (folder)/Лампа галогенная	0	
3390995	4612745211236	Лампа галоген selecta точечная.jс 12v 50w g6.35	3228815	Техника (folder)/Электротехника (folder)/Лампа галогенная	0	
3390996	4751012160454	Лампа галоген slh35-gu10 с отражателем	3228815	Техника (folder)/Электротехника (folder)/Лампа галогенная	0	
3390997	4752075001999	Лампа галоген slh48-jcd-g09 без отражателя 48w-60w	3228815	Техника (folder)/Электротехника (folder)/Лампа галогенная	0	
3390998	4751012160911	Лампа галоген slh50-gu10 с отражателем	3228815	Техника (folder)/Электротехника (folder)/Лампа галогенная	0	
3390999	4751012163653	Лампа галоген smile Light 42w карт/уп	3228815	Техника (folder)/Электротехника (folder)/Лампа галогенная	0	
3391000	4751012160218	Лампа галоген smile Light для прожекторов 100w 1400lm тв/у	3228815	Техника (folder)/Электротехника (folder)/Лампа галогенная	0	
3391001	4751012160232	Лампа галоген smile Light для прожекторов 200w 2400lm тв/у	3228815	Техника (folder)/Электротехника (folder)/Лампа галогенная	0	
3391002	4751012160249	Лампа галоген smile Light для прожекторов 200w 2500lm тв/у	3228815	Техника (folder)/Электротехника (folder)/Лампа галогенная	0	
484402	4607028195228	Лампа галоген Supermax 35wgu5.3 220v	3228815	Техника (folder)/Электротехника (folder)/Лампа галогенная	0	
279886	4607028195112	Лампа галоген Supermax j118 220v 150w r7s линейная (l=118mm)	3228815	Техника (folder)/Электротехника (folder)/Лампа галогенная	421300	Super-Max
751915	4607028195242	Лампа галоген Supermax jcdr 220v 75w gu 5.3 c отраж. и защ стеклом	3228815	Техника (folder)/Электротехника (folder)/Лампа галогенная	0	
751916	4607028199516	Лампа галоген Supermax jdc 220v 40w g 90ml капсульная прозрачная	3228815	Техника (folder)/Электротехника (folder)/Лампа галогенная	0	
3391003	4680006381530	Лампа галоген sweko 100w 230в	3228815	Техника (folder)/Электротехника (folder)/Лампа галогенная	5115184	Sweko
3391004	4680006381516	Лампа галоген sweko 230в 60w g9	3228815	Техника (folder)/Электротехника (folder)/Лампа галогенная	5115184	Sweko
3391005	4680006381271	Лампа галоген sweko 50w 12 в	3228815	Техника (folder)/Электротехника (folder)/Лампа галогенная	5115184	Sweko
3391006	4680006381332	Лампа галоген sweko 75w 230 вольт	3228815	Техника (folder)/Электротехника (folder)/Лампа галогенная	5115184	Sweko
3391007	4680006381295	Лампа галоген sweko gu5.3 35w 230в	3228815	Техника (folder)/Электротехника (folder)/Лампа галогенная	5115184	Sweko
3391008	4680006381318	Лампа галоген sweko gu5.3 50w	3228815	Техника (folder)/Электротехника (folder)/Лампа галогенная	5115184	Sweko
3391009	4680006381417	Лампа галоген sweko капсульного типа shl-jc-20-12-g4-cl	3228815	Техника (folder)/Электротехника (folder)/Лампа галогенная	5115184	Sweko
3228842	4690259189012	Лампа галоген tdm капсульная jc - 10w - 12в - g4 прозрачная	3228815	Техника (folder)/Электротехника (folder)/Лампа галогенная	2691873	Tdm
3228843	4690259189876	Лампа галоген tdm капсульная jc - 10w - 12в - g4 прозрачная упаковка	3228815	Техника (folder)/Электротехника (folder)/Лампа галогенная	2691873	Tdm
3228844	4690259189258	Лампа галоген tdm капсульная jc - 20w - 12в - g4 прозрачная	3228815	Техника (folder)/Электротехника (folder)/Лампа галогенная	2691873	Tdm
3228845	4690259189944	Лампа галоген tdm капсульная jc - 20w - 12в - g4 прозрачная упаковка	3228815	Техника (folder)/Электротехника (folder)/Лампа галогенная	2691873	Tdm
3228846	4690259291616	Лампа галоген tdm капсульная jc - 50w - 12 в - gy6.35 прозрачная	3228815	Техника (folder)/Электротехника (folder)/Лампа галогенная	2691873	Tdm
