ID	UPCEAN	Name	CategoryID	CategoryName	BrandID	BrandName
5103856	4603743310571	Чай черный с добавками малина со сливками	21794	Продукты питания (folder)/Чай и кофе/Чай	5011072	Chef Tea
5103857	4603743310274	Чай черный с добавками масала	21794	Продукты питания (folder)/Чай и кофе/Чай	5011072	Chef Tea
5103858	4603743310304	Чай черный с добавками рождественский пудинг	21794	Продукты питания (folder)/Чай и кофе/Чай	5011072	Chef Tea
5103859	4603743311769	Чай черный с добавками с легким паром	21794	Продукты питания (folder)/Чай и кофе/Чай	5011072	Chef Tea
5103860	4603743311691	Чай черный с добавками с травами	21794	Продукты питания (folder)/Чай и кофе/Чай	5011072	Chef Tea
5103861	4603743310526	Чай черный с добавками саусеп	21794	Продукты питания (folder)/Чай и кофе/Чай	5011072	Chef Tea
5103862	4603743310342	Чай черный с добавками таежный сбор	21794	Продукты питания (folder)/Чай и кофе/Чай	5011072	Chef Tea
4860299	4601214005445	Чай черный с имбирем 2g №20 ф/пак	276607	Продукты питания (folder)/Чай и кофе/Фиточай	0	
3587430	6932877881175	Чай черный с клюквой жб 150g	21794	Продукты питания (folder)/Чай и кофе/Чай	0	
2947514	4607017051306	Чай черный с персиком 0.500	21794	Продукты питания (folder)/Чай и кофе/Чай	0	
3587431	4607115150598	Чай черный с персиком 500ml пл/бут	21794	Продукты питания (folder)/Чай и кофе/Чай	0	
2947516	4607167621152	Чай черный со вкусом лимона (пэт) 0.92л 0.92л	21794	Продукты питания (folder)/Чай и кофе/Чай	0	
2947517	4607167621183	Чай черный со вкусом лимона (пэт) 1.5л 1.5л	21794	Продукты питания (folder)/Чай и кофе/Чай	0	
2947515	4607167621138	Чай черный со вкусом лимона (пэт) 500ml 500ml	21794	Продукты питания (folder)/Чай и кофе/Чай	0	
3587432	4607008487947	Чай черный со вкусом персика 600ml пл/бут	21794	Продукты питания (folder)/Чай и кофе/Чай	0	
1340819	4820095770185	Чай черный со стевией и каркаде 15пак	21794	Продукты питания (folder)/Чай и кофе/Чай	0	
1340820	4820095770161	Чай черный со стевией и кизилом 15пак	21794	Продукты питания (folder)/Чай и кофе/Чай	0	
137935	8886201008982	Чай черный спб Коллекция в 3-х холщ.меш.75g	21794	Продукты питания (folder)/Чай и кофе/Чай	0	
3587433	4640000281458	Чай черный среднелистовой мягуп 1kg	21794	Продукты питания (folder)/Чай и кофе/Чай	0	
3587434	4791001068057	Чай черный среднелистовой мягуп 1kg #2	21794	Продукты питания (folder)/Чай и кофе/Чай	0	
3587435	4640000281441	Чай черный среднелистовой мягуп 800g	21794	Продукты питания (folder)/Чай и кофе/Чай	0	
2948091	5054603002003	Чай черный стандартный	1	Неклассифицированные/default	0	
2948092	5054603012002	Чай черный стандартный с сиропом	1	Неклассифицированные/default	0	
3587436	4605426002919	Чай черный травы башкирии с рябиной 20 пак 50g тв/уп	21794	Продукты питания (folder)/Чай и кофе/Чай	0	
3941252	4690495008436	Чай черный удачи в новом году! 50g нади	214672	Продукты питания (folder)/Чай и кофе/Fruit Teas	0	
1340821	4607096045838	Чай черный царица цейлона высокогорных плантаций 100g страна ввоза российская федерация Минск ООО танталит	21794	Продукты питания (folder)/Чай и кофе/Чай	0	
3587437	4792021020988	Чай черный цейлонский со вкусом черн смородины 50g	21794	Продукты питания (folder)/Чай и кофе/Чай	0	
2498838	4607051159648	Чай черный цейлонский т.з. Richard lord grey с ароматом бергамота и лимона 2g 25п пакетир	21794	Продукты питания (folder)/Чай и кофе/Чай	2498834	Ричард
3587439	4607004941160	Чай черный я со вкусом лимона негаз. 500ml пл/бут	21794	Продукты питания (folder)/Чай и кофе/Чай	0	
3941253	4690495005985	Чай черый крупнолистовой земляника со с	21794	Продукты питания (folder)/Чай и кофе/Чай	0	
3587440	6908997228886	Чай чжу е цин сян люй зеленый 250g зип/пак	21794	Продукты питания (folder)/Чай и кофе/Чай	0	
2947521	6932877886064	Чай чу хуа корова на подсол жб 100g	21794	Продукты питания (folder)/Чай и кофе/Чай	0	
3941254	4601985000229	Чай чудеса света зеленый 20x 2g	21794	Продукты питания (folder)/Чай и кофе/Чай	0	
3587441	1034947707653	Чай чудо ложка зеленый китайский среднелистовой мягуп 7g	21794	Продукты питания (folder)/Чай и кофе/Чай	0	
3587442	1034947707011	Чай чудо ложка черный 6g	21794	Продукты питания (folder)/Чай и кофе/Чай	0	
3587443	4630008800201	Чай чудо чашка индийский с сахаром 1x 10g	21794	Продукты питания (folder)/Чай и кофе/Чай	0	
3587444	4630008800164	Чай чудо чашка ту 52g	21794	Продукты питания (folder)/Чай и кофе/Чай	0	
3587445	1034947707776	Чай чудо-ложка ассортим мягуп 7g	21794	Продукты питания (folder)/Чай и кофе/Чай	0	
2947522	6932877877772	Чай чю хау Золотой оолонг дундин 0.125	21794	Продукты питания (folder)/Чай и кофе/Чай	0	
295865	6932877881014	Чай чю хуа 101 зайчата черн 150g /жб,шар/	21794	Продукты питания (folder)/Чай и кофе/Чай	93542	Чю Хуа
295866	6932877881021	Чай чю хуа 102 шар черн 150g жесть в п/уп	21794	Продукты питания (folder)/Чай и кофе/Чай	93542	Чю Хуа
295867	6932877881038	Чай чю хуа 103 шар черн 150g жесть в п/уп	21794	Продукты питания (folder)/Чай и кофе/Чай	93542	Чю Хуа
295868	6932877881069	Чай чю хуа 106 дракон на снежинке черн 100g /жб/	21794	Продукты питания (folder)/Чай и кофе/Чай	93542	Чю Хуа
295869	6925959237571	Чай чю хуа 3757 серебряные реснички зеленый жб 150g	21794	Продукты питания (folder)/Чай и кофе/Чай	93542	Чю Хуа
295870	6932877837585	Чай чю хуа 3758 бархатные реснички зеленый жб 150g	21794	Продукты питания (folder)/Чай и кофе/Чай	93542	Чю Хуа
295871	6932877837677	Чай чю хуа 3767 порох зелен жб 150g	21794	Продукты питания (folder)/Чай и кофе/Чай	93542	Чю Хуа
295872	6932877884275	Чай чю хуа 427 танцующий тигр зеленый жб 200g	21794	Продукты питания (folder)/Чай и кофе/Чай	93542	Чю Хуа
295873	6932877874375	Чай чю хуа 437 королевский порох зеленый 80g ов.жб	21794	Продукты питания (folder)/Чай и кофе/Чай	93542	Чю Хуа
295874	6932877885197	Чай чю хуа 519 заяц грибник черн 100g /фарфор,чайник/	21794	Продукты питания (folder)/Чай и кофе/Чай	93542	Чю Хуа
295875	6932877885296	Чай чю хуа 529 заяц с цветами черн 100g /фарфор,чайник/	21794	Продукты питания (folder)/Чай и кофе/Чай	93542	Чю Хуа
295876	6932877885692	Чай чю хуа 569 заячье счастье черн 100g /фарфор,чайник/	21794	Продукты питания (folder)/Чай и кофе/Чай	93542	Чю Хуа
860885	6932877886057	Чай чю хуа 605 пу-эрх медаль 357g п/у	21794	Продукты питания (folder)/Чай и кофе/Чай	93542	Чю Хуа
860886	6932877886354	Чай чю хуа 635 пу-эрх гнездо ласточки 7лет прессов.100g	21794	Продукты питания (folder)/Чай и кофе/Чай	93542	Чю Хуа
860887	6932877886453	Чай чю хуа 645 пу-эрх гнездо ласточки 10лет прессов.100g	21794	Продукты питания (folder)/Чай и кофе/Чай	93542	Чю Хуа
295877	6932877871671	Чай чю хуа 7167 пу-эрх в гнездах жб 100g	21794	Продукты питания (folder)/Чай и кофе/Чай	93542	Чю Хуа
137939	6932877867209	Чай чю хуа 720 дянь хун черн жб 200g	21794	Продукты питания (folder)/Чай и кофе/Чай	93542	Чю Хуа
295878	6932877887214	Чай чю хуа 721жасминовый зелен жб 150g	21794	Продукты питания (folder)/Чай и кофе/Чай	93542	Чю Хуа
295879	6932877867247	Чай чю хуа 724 серебряные типсы зелен жб 150g	21794	Продукты питания (folder)/Чай и кофе/Чай	93542	Чю Хуа
295880	6932877867254	Чай чю хуа 725 земляничный улун зелен жб 200g	21794	Продукты питания (folder)/Чай и кофе/Чай	93542	Чю Хуа
295881	6925959207772	Чай чю хуа 777 Золотой оолонг дун дин жб 125g	21794	Продукты питания (folder)/Чай и кофе/Чай	93542	Чю Хуа
137992	6925959280812	Чай чю хуа 808 черный дракон зелен суперсжиг. жира 35x жб 2.86g	21794	Продукты питания (folder)/Чай и кофе/Чай	93542	Чю Хуа
295882	6932877878182	Чай чю хуа 818 оолонг жб 150g	21794	Продукты питания (folder)/Чай и кофе/Чай	93542	Чю Хуа
860888	6932877878281	Чай чю хуа 828 те гуань инь-черн.дракон 150g	21794	Продукты питания (folder)/Чай и кофе/Чай	93542	Чю Хуа
295883	6932877888334	Чай чю хуа 833 оолонг с женьшенем жб 150g	21794	Продукты питания (folder)/Чай и кофе/Чай	93542	Чю Хуа
295884	6917298180229	Чай чю хуа 858 стройный тростник 20x жб 3g	21794	Продукты питания (folder)/Чай и кофе/Чай	93542	Чю Хуа
295885	6925959208687	Чай чю хуа 868 танцующий тигр 100g карт/б	21794	Продукты питания (folder)/Чай и кофе/Чай	93542	Чю Хуа
295886	6932877878786	Чай чю хуа 878 жасмин маофенг 100g карт/б	21794	Продукты питания (folder)/Чай и кофе/Чай	93542	Чю Хуа
295861	6932877898883	Чай чю хуа 888 Коллекция чая 4x 75g*жб 300g	21794	Продукты питания (folder)/Чай и кофе/Чай	93542	Чю Хуа
295887	6932877878984	Чай чю хуа 898 танцующий тигр жб 150g	21794	Продукты питания (folder)/Чай и кофе/Чай	93542	Чю Хуа
295888	6932877889010	Чай чю хуа 901 лун цзын (колодец дракона) 150g карт/б	21794	Продукты питания (folder)/Чай и кофе/Чай	93542	Чю Хуа
295889	6932877889034	Чай чю хуа 903 би ло чун 150g карт/б	21794	Продукты питания (folder)/Чай и кофе/Чай	93542	Чю Хуа
295890	6932877889065	Чай чю хуа 906 тигр на подсолнухе черн жб 100g фигурная	21794	Продукты питания (folder)/Чай и кофе/Чай	93542	Чю Хуа
295891	6932877891372	Чай чю хуа 9137 жасминовый персик с цветком 100g стекл./б	21794	Продукты питания (folder)/Чай и кофе/Чай	93542	Чю Хуа
137941	6932877891778	Чай чю хуа 9177 жемчужная ракушка 100g зеленый ст./б	21794	Продукты питания (folder)/Чай и кофе/Чай	93542	Чю Хуа
295892	6932877899910	Чай чю хуа 991 ожерелье дракона связаный жб 100g	21794	Продукты питания (folder)/Чай и кофе/Чай	93542	Чю Хуа
295893	6932877899965	Чай чю хуа 996 личжи с цветочком жб 100g 4680	21794	Продукты питания (folder)/Чай и кофе/Чай	93542	Чю Хуа
295862	6932877879981	Чай чю хуа 998 оолонг отборный 150g	21794	Продукты питания (folder)/Чай и кофе/Чай	93542	Чю Хуа
137940	6925959291375	Чай чю хуа жасмин/персик 100g стбан	21794	Продукты питания (folder)/Чай и кофе/Чай	93542	Чю Хуа
137942	6925959291771	Чай чю хуа жемчужная ракушка черн 100g	21794	Продукты питания (folder)/Чай и кофе/Чай	93542	Чю Хуа
2947523	6925959238479	Чай чю хуа зеленый 100g	21794	Продукты питания (folder)/Чай и кофе/Чай	0	
137956	6925959238172	Чай чю хуа зеленый порох жб 100g	21794	Продукты питания (folder)/Чай и кофе/Чай	93542	Чю Хуа
137957	6925959237670	Чай чю хуа зеленый порох жб 150g	21794	Продукты питания (folder)/Чай и кофе/Чай	93542	Чю Хуа
137958	6932877871978	Чай чю хуа зеленый порох с ананасом 100g	21794	Продукты питания (folder)/Чай и кофе/Чай	93542	Чю Хуа
137959	6925959271070	Чай чю хуа зеленый порох с клубникой 100g	21794	Продукты питания (folder)/Чай и кофе/Чай	93542	Чю Хуа
137944	6925959271971	Чай чю хуа зеленый с ананасом 100g	21794	Продукты питания (folder)/Чай и кофе/Чай	93542	Чю Хуа
137945	6925959271377	Чай чю хуа зеленый с жасмином 100g	21794	Продукты питания (folder)/Чай и кофе/Чай	93542	Чю Хуа
137943	6925959237878	Чай чю хуа зеленый с жасмином 125g	21794	Продукты питания (folder)/Чай и кофе/Чай	93542	Чю Хуа
137947	6925959203484	Чай чю хуа зеленый с жасмином 25пак*2g 50g	21794	Продукты питания (folder)/Чай и кофе/Чай	93542	Чю Хуа
1340822	6932877871374	Чай чю хуа зеленый с жасмином жб 100g	21794	Продукты питания (folder)/Чай и кофе/Чай	0	
137946	6925959237977	Чай чю хуа зеленый с жасмином жб 200g	21794	Продукты питания (folder)/Чай и кофе/Чай	93542	Чю Хуа
137948	6925959271278	Чай чю хуа зеленый с киви жб 100g	21794	Продукты питания (folder)/Чай и кофе/Чай	93542	Чю Хуа
137949	6932877871077	Чай чю хуа зеленый с клубникой жб 100g	21794	Продукты питания (folder)/Чай и кофе/Чай	93542	Чю Хуа
137950	6925959271476	Чай чю хуа зеленый с лимоном 100g	21794	Продукты питания (folder)/Чай и кофе/Чай	93542	Чю Хуа
2966503	6932877871473	Чай чю хуа зеленый с лимоном 100g #2	21794	Продукты питания (folder)/Чай и кофе/Чай	93542	Чю Хуа
137951	6925959271575	Чай чю хуа зеленый с лотосом 100g	21794	Продукты питания (folder)/Чай и кофе/Чай	93542	Чю Хуа
2966504	6932877871572	Чай чю хуа зеленый с лотосом 100g #2	21794	Продукты питания (folder)/Чай и кофе/Чай	93542	Чю Хуа
137952	6925959238370	Чай чю хуа зеленый с османтусом 100g	21794	Продукты питания (folder)/Чай и кофе/Чай	93542	Чю Хуа
137953	6925959271773	Чай чю хуа зеленый с персиком 100g	21794	Продукты питания (folder)/Чай и кофе/Чай	93542	Чю Хуа
1340823	6932877871770	Чай чю хуа зеленый с персиком жб 100g	21794	Продукты питания (folder)/Чай и кофе/Чай	0	
137954	6925959271872	Чай чю хуа зеленый с розой 100g	21794	Продукты питания (folder)/Чай и кофе/Чай	93542	Чю Хуа
137955	6925959271179	Чай чю хуа зеленый с фиником 100g	21794	Продукты питания (folder)/Чай и кофе/Чай	93542	Чю Хуа
3587446	6932877881182	Чай чю хуа земляника со сливками жб 150g	21794	Продукты питания (folder)/Чай и кофе/Чай	0	
137960	6932877889904	Чай чю хуа земляничный те гуань инь 150g п/у	21794	Продукты питания (folder)/Чай и кофе/Чай	93542	Чю Хуа
1340824	6932877881076	Чай чю хуа зимн.птицы шар 2x жб 75g 150g	21794	Продукты питания (folder)/Чай и кофе/Чай	93542	Чю Хуа
2271804	6932877881342	Чай чю хуа Золотые колокольчики чер.2x жб 75g ларец	21794	Продукты питания (folder)/Чай и кофе/Чай	93542	Чю Хуа
137961	6925959292570	Чай чю хуа кольца джейд зелен 50g	21794	Продукты питания (folder)/Чай и кофе/Чай	93542	Чю Хуа
137962	6932877837561	Чай чю хуа красный халат улун 100g	21794	Продукты питания (folder)/Чай и кофе/Чай	93542	Чю Хуа
137963	6925959299968	Чай чю хуа личжи с цветочками зелен 100g сундучок	21794	Продукты питания (folder)/Чай и кофе/Чай	93542	Чю Хуа
137964	6925959292174	Чай чю хуа личжи с цветочками черн 100g	21794	Продукты питания (folder)/Чай и кофе/Чай	93542	Чю Хуа
1340825	6932877881083	Чай чю хуа медвежонок и птички 2x 75g 150g шкатулка	21794	Продукты питания (folder)/Чай и кофе/Чай	93542	Чю Хуа
137965	6932877867193	Чай чю хуа молоко дракона зелен жб 150g	21794	Продукты питания (folder)/Чай и кофе/Чай	93542	Чю Хуа
137966	6932877867186	Чай чю хуа молочный улун зелен жб 200g	21794	Продукты питания (folder)/Чай и кофе/Чай	93542	Чю Хуа
137967	6925959273678	Чай чю хуа нектар богов зелен 100g	21794	Продукты питания (folder)/Чай и кофе/Чай	93542	Чю Хуа
137968	6932877873675	Чай чю хуа нектар богов зелен жб 150g	21794	Продукты питания (folder)/Чай и кофе/Чай	93542	Чю Хуа
295863	6932877889096	Чай чю хуа новогодний шар черн 150g фарфор	21794	Продукты питания (folder)/Чай и кофе/Чай	93542	Чю Хуа
137969	6925959209981	Чай чю хуа оолонг 150g зол.уп	21794	Продукты питания (folder)/Чай и кофе/Чай	93542	Чю Хуа
137970	6925959299579	Чай чю хуа оолонг женьшень зелен 100g стбан	21794	Продукты питания (folder)/Чай и кофе/Чай	93542	Чю Хуа
137971	6925959203187	Чай чю хуа оолонг зелен 25пак*2g 50g	21794	Продукты питания (folder)/Чай и кофе/Чай	93542	Чю Хуа
137972	6925959203194	Чай чю хуа оолонг зелен 50пак*2g 100g	21794	Продукты питания (folder)/Чай и кофе/Чай	93542	Чю Хуа
137973	6925959238578	Чай чю хуа оолонг с ванилью 100g	21794	Продукты питания (folder)/Чай и кофе/Чай	93542	Чю Хуа
137974	6925959274170	Чай чю хуа оолонг с цветами 100g	21794	Продукты питания (folder)/Чай и кофе/Чай	93542	Чю Хуа
137975	6925959204276	Чай чю хуа оолонг танц.тигр жб 200g	21794	Продукты питания (folder)/Чай и кофе/Чай	93542	Чю Хуа
137976	6925959203583	Чай чю хуа отборн.зелен 25пак*2g 50g	21794	Продукты питания (folder)/Чай и кофе/Чай	93542	Чю Хуа
137977	6932877879950	Чай чю хуа персиковый те гуань инь 150g п/у	21794	Продукты питания (folder)/Чай и кофе/Чай	93542	Чю Хуа
137978	6922827106380	Чай чю хуа пу-эрх зелен жасмин 80g	21794	Продукты питания (folder)/Чай и кофе/Чай	93542	Чю Хуа
137979	6925959271674	Чай чю хуа пу-эрх красн 100g	21794	Продукты питания (folder)/Чай и кофе/Чай	93542	Чю Хуа
137980	6925959203286	Чай чю хуа пу-эрх красн 25пак*2g 50g	21794	Продукты питания (folder)/Чай и кофе/Чай	93542	Чю Хуа
137981	6925959203293	Чай чю хуа пу-эрх красн 50пак*2g 100g	21794	Продукты питания (folder)/Чай и кофе/Чай	93542	Чю Хуа
137982	6925959271698	Чай чю хуа пу-эрх красн с ванилью жб 100g	21794	Продукты питания (folder)/Чай и кофе/Чай	93542	Чю Хуа
137983	6925959204177	Чай чю хуа пу-эрх черн жб 150g	21794	Продукты питания (folder)/Чай и кофе/Чай	93542	Чю Хуа
137984	6932877891471	Чай чю хуа пять золотых лепестк.100g стбан	21794	Продукты питания (folder)/Чай и кофе/Чай	93542	Чю Хуа
137985	6925959203385	Чай чю хуа с фр.вит черн 25пак*2g 50g	21794	Продукты питания (folder)/Чай и кофе/Чай	93542	Чю Хуа
137986	6925959203392	Чай чю хуа с фр.вит черн 50пак*2g 100g	21794	Продукты питания (folder)/Чай и кофе/Чай	93542	Чю Хуа
137987	6932877878083	Чай чю хуа суперсжигатель черный дракон 35x2.86g	21794	Продукты питания (folder)/Чай и кофе/Чай	93542	Чю Хуа
137988	6932877878687	Чай чю хуа танцующий тигр жб 100g	21794	Продукты питания (folder)/Чай и кофе/Чай	93542	Чю Хуа
137989	6925959208984	Чай чю хуа танцующий тигр черн 150g	21794	Продукты питания (folder)/Чай и кофе/Чай	93542	Чю Хуа
1340826	6932877881052	Чай чю хуа тройка клубн.со сливк.зелен 2x 75g 150g шкатулка	21794	Продукты питания (folder)/Чай и кофе/Чай	93542	Чю Хуа
137990	6925959291573	Чай чю хуа цзинь ху лу 100g стбан	21794	Продукты питания (folder)/Чай и кофе/Чай	93542	Чю Хуа
137991	6925959209882	Чай чю хуа чайная Радуга китая 10пак*25g 250g	21794	Продукты питания (folder)/Чай и кофе/Чай	93542	Чю Хуа
137993	6932877837592	Чай чю хуа черные реснички си ши 100g	21794	Продукты питания (folder)/Чай и кофе/Чай	93542	Чю Хуа
137994	6925959208281	Чай чю хуа черный дракон жб 150g	21794	Продукты питания (folder)/Чай и кофе/Чай	93542	Чю Хуа
2271805	6932877881298	Чай чю хуа шкатулка-подкова чер.жб 75g	21794	Продукты питания (folder)/Чай и кофе/Чай	93542	Чю Хуа
2271807	6932877881311	Чай чю хуа шкатулка-подкова чер.жб 75g #3	21794	Продукты питания (folder)/Чай и кофе/Чай	93542	Чю Хуа
2271808	6932877873118	Чай чю хуа яйцо 311 светлой пасхи! чер.жб 75g	21794	Продукты питания (folder)/Чай и кофе/Чай	93542	Чю Хуа
2271809	6932877873125	Чай чю хуа яйцо 312 светлой пасхи! чер.жб 75g	21794	Продукты питания (folder)/Чай и кофе/Чай	93542	Чю Хуа
