ID	UPCEAN	Name	CategoryID	CategoryName	BrandID	BrandName
4118333	615986010525	Bailey sales corporation working pressure Air pump	1	Неклассифицированные/default	0	
4118334	649853712021	Bailey-coenen enterprises 21lb b&c Eagle 112x092 hdrpc round head 1-1/2-inch by 0.092-inch by 15 degree plastic collated Hot di	1	Неклассифицированные/default	0	
906835	730429100998	Baileyana baileyana Chardonnay monterey 750ml /12	22133	Продукты питания (folder)/Алкогольные напитки/Вино (folder)/Вино	0	
906837	030429100999	Baileyana Wine baileyana chard 750ml /12	1	Неклассифицированные/default	0	
906838	030429200989	Baileyana Wine baileyana firepeak chard 750ml /12	1	Неклассифицированные/default	0	
906839	030429400990	Baileyana Wine baileyana firepeak p Noir 750ml /12	1	Неклассифицированные/default	0	
906840	030429700991	Baileyana Wine baileyana firepeak syrah 750ml /12	22133	Продукты питания (folder)/Алкогольные напитки/Вино (folder)/Вино	0	
906841	030429300993	Baileyana Wine baileyana Pinot Noir edna 750ml /12	22133	Продукты питания (folder)/Алкогольные напитки/Вино (folder)/Вино	0	
906842	030429600994	Baileyana Wine baileyana Sauvignon blanc edna 750ml /12	22133	Продукты питания (folder)/Алкогольные напитки/Вино (folder)/Вино	0	
906843	030429500997	Baileyana Wine baileyana syrah 750ml /12	22133	Продукты питания (folder)/Алкогольные напитки/Вино (folder)/Вино	0	
2025749	5011013510542	Baileys	1	Неклассифицированные/default	341252	Baileys
2025750	5011013507887	Baileys 0.7l 17%+2ks miniat.Dark 21%	1	Неклассифицированные/default	0	
1857731	086767210364	Baileys 1993 edition canister w/750ml bottle 750ml	1	Неклассифицированные/default	341252	Baileys
2779375	082000005209	Baileys almande 120pk 13% 050l	1	Неклассифицированные/default	0	
2779376	082000776284	Baileys almande 26p btl 750ml	1	Неклассифицированные/default	341252	Baileys
319205	5099872003566	Baileys assorted chocolate dome selection in gift Box 190g 190g	22145	Продукты питания (folder)/Кондитерские изделия (folder)/Конфеты	0	
2779377	5099872012957	Baileys assorted chocolate selection in pillow pack 94g 94g	1	Неклассифицированные/default	0	
341253	5011013926855	Baileys biscotti 17% 700ml	78617	Продукты питания (folder)/Алкогольные напитки/Алкоголь	341252	Baileys
906844	670822300123	Baileys blonde ale glass 12oz	1	Неклассифицированные/default	0	
906845	670822202243	Baileys blonde ale glass 22oz	1	Неклассифицированные/default	0	
2779378	044100106958	Baileys Bourbon van pound ck 32oz	1	Неклассифицированные/default	0	
341251	082000002673	Baileys candy cane 4/pk 50ml ea 17% 0.2l	78617	Продукты питания (folder)/Алкогольные напитки/Алкоголь	0	
563049	5011013505975	Baileys caramel irish Cream liquor* 375ml	23975	Продукты питания (folder)/Алкогольные напитки/Ликер	341252	Baileys
563050	5011013504428	Baileys caramel irish Cream liquor* 750ml	23975	Продукты питания (folder)/Алкогольные напитки/Ликер	341252	Baileys
1384573	761883080809	Baileys cheesecake	1	Неклассифицированные/default	0	
1730539	086767704436	Baileys choc Cherry 34p btl 750ml	1730524	Продукты питания (folder)/Алкогольные напитки/CORDIALS	341252	Baileys
2285345	5011013999910	Baileys chocolat luxe irish Cream liqueur 20x 50ml	23975	Продукты питания (folder)/Алкогольные напитки/Ликер	341252	Baileys
2285346	5011013999064	Baileys chocolat luxe liqueur 500ml	23975	Продукты питания (folder)/Алкогольные напитки/Ликер	341252	Baileys
4118335	756774050580	Baileys chocolate candy	1	Неклассифицированные/default	0	
563051	5011013504930	Baileys chocolate cups pack 200ml	23975	Продукты питания (folder)/Алкогольные напитки/Ликер	341252	Baileys
341254	5011013509027	Baileys coffee 1l	78617	Продукты питания (folder)/Алкогольные напитки/Алкоголь	341252	Baileys
2528966	044100106194	Baileys coffee creamer baileys mudslide	1	Неклассифицированные/default	341252	Baileys
2528967	044100107665	Baileys coffee creamer baileys mudslide #2	1	Неклассифицированные/default	341252	Baileys
2528968	044100104824	Baileys coffee creamer brown Butter pecan	1	Неклассифицированные/default	341252	Baileys
2528969	044100107542	Baileys coffee creamer caramel	1	Неклассифицированные/default	341252	Baileys
2528970	044100107634	Baileys coffee creamer caramel, non - alcoholic	1	Неклассифицированные/default	341252	Baileys
2528971	044100107801	Baileys coffee creamer chocolate	1	Неклассифицированные/default	341252	Baileys
2528972	044100118234	Baileys coffee creamer chocolatini	1	Неклассифицированные/default	341252	Baileys
3012272	044100206887	Baileys coffee creamer chocolatini #2	330591	Продукты питания (folder)/Продукты питания	341252	Baileys
2528973	044100118258	Baileys coffee creamer cinnamon Dolce	1	Неклассифицированные/default	341252	Baileys
2528974	044100107825	Baileys coffee creamer creme brulee	1	Неклассифицированные/default	341252	Baileys
2528975	044100107566	Baileys coffee creamer fat free french vanilla	1	Неклассифицированные/default	341252	Baileys
2528976	044100107573	Baileys coffee creamer fat free the Original irish Cream	1	Неклассифицированные/default	341252	Baileys
2528978	044100207525	Baileys coffee creamer french vanilla #2	1	Неклассифицированные/default	341252	Baileys
2528977	044100107504	Baileys coffee creamer french vanilla, non - alcoholic	1	Неклассифицированные/default	341252	Baileys
2528979	044100107511	Baileys coffee creamer hazelnut	1	Неклассифицированные/default	341252	Baileys
2528980	044100107535	Baileys coffee creamer hazelnut #2	1	Неклассифицированные/default	341252	Baileys
2528981	044100104800	Baileys coffee creamer latte macchiato	1	Неклассифицированные/default	341252	Baileys
3012273	044100106828	Baileys coffee creamer macadamia brittle	330591	Продукты питания (folder)/Продукты питания	341252	Baileys
2528982	044100110986	Baileys coffee creamer sweet italian biscotti	1	Неклассифицированные/default	341252	Baileys
2528983	044100107559	Baileys coffee creamer the Original irish Cream	1	Неклассифицированные/default	341252	Baileys
2528984	044100207839	Baileys coffee creamer the Original irish Cream #2	1	Неклассифицированные/default	341252	Baileys
2528985	044100107818	Baileys coffee creamer toffee almond	1	Неклассифицированные/default	341252	Baileys
2528986	044100107856	Baileys coffee creamer toffee almond Cream, non - alcoholic	1	Неклассифицированные/default	341252	Baileys
2528987	044100104817	Baileys coffee creamer triple sweet Cream	1	Неклассифицированные/default	341252	Baileys
2528988	044100106279	Baileys coffee creamer vanilla brown sugar	1	Неклассифицированные/default	341252	Baileys
2528989	044100110993	Baileys coffee creamer vanilla brown sugar #2	1	Неклассифицированные/default	341252	Baileys
4118336	098009249797	Baileys coffee tin	1	Неклассифицированные/default	0	
1384574	761883080281	Baileys Cream bars	1	Неклассифицированные/default	0	
1384575	761883080434	Baileys Cream puffs	1	Неклассифицированные/default	0	
341256	5000295140325	Baileys creme caramel Cream 180ml	78617	Продукты питания (folder)/Алкогольные напитки/Алкоголь	341252	Baileys
1889564	4802306551257	Baileys crmwfscentcn 750ml/6	1	Неклассифицированные/default	0	
1384576	5000295140349	Baileys dessert sauce ps	144938	Продукты питания (folder)/Молочные продукты (folder)/Молочные продукты	0	
2779379	086767704573	Baileys espresso creme 17% 1.00l	1	Неклассифицированные/default	0	
2528990	086767704542	Baileys espresso creme irish Cream	1	Неклассифицированные/default	0	
341269	5000295126558	Baileys ex thick Cream origina	23975	Продукты питания (folder)/Алкогольные напитки/Ликер	341252	Baileys
2779380	868891000338	Baileys first mistake imperial Black glass 22floz	1	Неклассифицированные/default	0	
2779381	5099872016603	Baileys giftwrapped Box of assorted coffee, caramel and mint chocolates 260g 260g	1	Неклассифицированные/default	0	
4335740	5011013501298	Baileys glide (irish Cream and vanilla, blended, alc 4.0%vol) 4x 200ml ean ireland	1	Неклассифицированные/default	0	
906846	082000003403	Baileys hazelnut 34p 17% btl 50ml	78617	Продукты питания (folder)/Алкогольные напитки/Алкоголь	0	
906847	086767703842	Baileys hazelnut 34p 17% btl 750ml	78617	Продукты питания (folder)/Алкогольные напитки/Алкоголь	0	
341264	5011013506132	Baileys hazelnut flavour Cream liquor 750ml	23975	Продукты питания (folder)/Алкогольные напитки/Ликер	341252	Baileys
78583	5011013100200	Baileys holiday gift set (bottle and glasses) 375ml ean ireland	23975	Продукты питания (folder)/Алкогольные напитки/Ликер	341252	Baileys
341258	086767700384	Baileys holiday wrap/Box 750ml	78617	Продукты питания (folder)/Алкогольные напитки/Алкоголь	341252	Baileys
1384577	086767701367	Baileys irish Cream 100ml 96pk 17% 100l	1	Неклассифицированные/default	0	
563053	5011013100088	Baileys irish Cream 1750ml	23975	Продукты питания (folder)/Алкогольные напитки/Ликер	341252	Baileys
563054	5011013100262	Baileys irish Cream 1l	23975	Продукты питания (folder)/Алкогольные напитки/Ликер	341252	Baileys
563059	5011013925155	Baileys irish Cream 200ml	23975	Продукты питания (folder)/Алкогольные напитки/Ликер	341252	Baileys
341259	086767210104	Baileys irish Cream 24pk 17% 200l	23975	Продукты питания (folder)/Алкогольные напитки/Ликер	341252	Baileys
3619214	088076182448	Baileys irish Cream 3pk 100ml	1	Неклассифицированные/default	341252	Baileys
563056	5011013100378	Baileys irish Cream 700ml	23975	Продукты питания (folder)/Алкогольные напитки/Ликер	341252	Baileys
341261	086767702630	Baileys irish Cream caramel 375ml	78617	Продукты питания (folder)/Алкогольные напитки/Алкоголь	341252	Baileys
341262	086767701817	Baileys irish Cream caramel 80b 50ml	78617	Продукты питания (folder)/Алкогольные напитки/Алкоголь	341252	Baileys
341263	086767701893	Baileys irish Cream caramel glass 375ml	78617	Продукты питания (folder)/Алкогольные напитки/Алкоголь	341252	Baileys
341255	086767702272	Baileys irish Cream coffiee liquor 375ml	78617	Продукты питания (folder)/Алкогольные напитки/Алкоголь	341252	Baileys
2025751	086767702586	Baileys irish Cream liq 34 pf	1	Неклассифицированные/default	0	
563055	5011013100194	Baileys irish Cream liquer 375ml	23975	Продукты питания (folder)/Алкогольные напитки/Ликер	341252	Baileys
563058	53997173	Baileys irish Cream Mini* 50ml	23975	Продукты питания (folder)/Алкогольные напитки/Ликер	341252	Baileys
341265	5011013503629	Baileys irish Cream mint chocolate 80b 50ml	23975	Продукты питания (folder)/Алкогольные напитки/Ликер	341252	Baileys
183215	086767701787	Baileys irish Cream mint chocolate gift Box 750ml	23975	Продукты питания (folder)/Алкогольные напитки/Ликер	341252	Baileys
341266	086767701886	Baileys irish Cream mint chocolate glass 375ml	23975	Продукты питания (folder)/Алкогольные напитки/Ликер	341252	Baileys
3619215	070100006110	Baileys irish Cream Original 0.35l	23975	Продукты питания (folder)/Алкогольные напитки/Ликер	341252	Baileys
3619216	5011013100651	Baileys irish Cream Original 0.5l	23975	Продукты питания (folder)/Алкогольные напитки/Ликер	341252	Baileys
3619217	5011013500390	Baileys irish Cream Original 1l	23975	Продукты питания (folder)/Алкогольные напитки/Ликер	341252	Baileys
1248829	5011013506996	Baileys irish Cream Original Box a 0.75l +glass	23975	Продукты питания (folder)/Алкогольные напитки/Ликер	341252	Baileys
183220	086767210029	Baileys irish Cream Original glass 1.75l	23975	Продукты питания (folder)/Алкогольные напитки/Ликер	341252	Baileys
183219	086767210043	Baileys irish Cream Original glass 1l	23975	Продукты питания (folder)/Алкогольные напитки/Ликер	341252	Baileys
341267	086767000347	Baileys irish Cream Original glass 375ml	23975	Продукты питания (folder)/Алкогольные напитки/Ликер	341252	Baileys
183223	086767210067	Baileys irish Cream Original glass 750ml	23975	Продукты питания (folder)/Алкогольные напитки/Ликер	341252	Baileys
3619218	5011013928149	Baileys irish Cream Original usg 0.7l #2	23975	Продукты питания (folder)/Алкогольные напитки/Ликер	341252	Baileys
3619219	5011013932177	Baileys irish Cream Original usg 0.7l #3	23975	Продукты питания (folder)/Алкогольные напитки/Ликер	341252	Baileys
3619220	5011013932870	Baileys irish Cream Original usg 0.7l #4	23975	Продукты питания (folder)/Алкогольные напитки/Ликер	341252	Baileys
2285348	086767702517	Baileys irish Cream Plus 2 limited edition glasses 750ml	78617	Продукты питания (folder)/Алкогольные напитки/Алкоголь	0	
2779382	086767704818	Baileys irish Cream w/bowls 6pk 17% 750l	1	Неклассифицированные/default	341252	Baileys
183211	086767701756	Baileys irish Cream with a hint of carmel 50ml	23975	Продукты питания (folder)/Алкогольные напитки/Ликер	341252	Baileys
183222	086767210128	Baileys irish Cream-4 pks/20 btl 17% 0.05l	23975	Продукты питания (folder)/Алкогольные напитки/Ликер	341252	Baileys
183221	086767210098	Baileys irish creme Original glass 375ml	23975	Продукты питания (folder)/Алкогольные напитки/Ликер	341252	Baileys
1384578	5099872011707	Baileys Milk chocolate egg and truffles 360g	1	Неклассифицированные/default	0	
2779383	5099872013206	Baileys Milk Mini delights in pouch 102g 102g	1	Неклассифицированные/default	0	
2779384	5099872014852	Baileys Mini crackers 6 piece gift Box 135g	1	Неклассифицированные/default	0	
1384579	5011013500536	Baileys minis the Original irish Cream (alc 17%vol) liqueur 4x 71ml ean ireland	23975	Продукты питания (folder)/Алкогольные напитки/Ликер	0	
183214	086767701770	Baileys mint chocolate irish Cream liqueur 50ml	23975	Продукты питания (folder)/Алкогольные напитки/Ликер	341252	Baileys
341268	082000755081	Baileys mudslide cocktail 12.5% 1.75l	23975	Продукты питания (folder)/Алкогольные напитки/Ликер	341252	Baileys
2528991	044100107481	Baileys non-alcoholic fat free french vanilla coffee creamer	1	Неклассифицированные/default	341252	Baileys
2528992	044100107498	Baileys non-alcoholic fat free Original irish Cream coffee creamer	1	Неклассифицированные/default	341252	Baileys
2285347	5011013928316	Baileys Orange truffle Cream liqueur 700ml	23975	Продукты питания (folder)/Алкогольные напитки/Ликер	341252	Baileys
4118337	086767701312	Baileys orig irish Cream w/ 750ml	1	Неклассифицированные/default	0	
1889565	1111199500079	Baileys origic750mlfr1 ib/1	1	Неклассифицированные/default	0	
4118338	867677013678	Baileys origiinal irish pl 100ml	1	Неклассифицированные/default	0	
4118339	867672100434	Baileys Original irish crea 1000ml	1	Неклассифицированные/default	0	
4118340	867672100298	Baileys Original irish crea 1750ml	1	Неклассифицированные/default	0	
4118341	867672101042	Baileys Original irish crea 200ml	1	Неклассифицированные/default	0	
4118342	867677009336	Baileys Original irish crea 50ml	1	Неклассифицированные/default	0	
4118343	867672100670	Baileys Original irish crea 750ml	1	Неклассифицированные/default	0	
563057	5011013100095	Baileys Original irish Cream 1140ml ean ireland	23975	Продукты питания (folder)/Алкогольные напитки/Ликер	341252	Baileys
1358646	086767703446	Baileys Original irish Cream Plus 3 Mini flavors - gift 750ml	1	Неклассифицированные/default	0	
78585	5011013100132	Baileys Original irish crm liqueur 750ml	23975	Продукты питания (folder)/Алкогольные напитки/Ликер	341252	Baileys
563052	5011013100040	Baileys Original liqueur 1.5l magnum	23975	Продукты питания (folder)/Алкогольные напитки/Ликер	341252	Baileys
341260	086767700933	Baileys Original liqueur 20x 50ml miniature pack	23975	Продукты питания (folder)/Алкогольные напитки/Ликер	341252	Baileys
563048	5011013100231	Baileys Original liqueur 50ml miniature	23975	Продукты питания (folder)/Алкогольные напитки/Ликер	341252	Baileys
4118344	867672100984	Baileys Original w/50ml bai 375ml	1	Неклассифицированные/default	0	
2528993	086767704665	Baileys pumpkin Spice 34p btl 750ml	1	Неклассифицированные/default	341252	Baileys
2779385	086767704696	Baileys pumpkin Spice 80pk 34% 050l	1	Неклассифицированные/default	0	
2779386	5099872016580	Baileys round opera Box collection of assorted chocolates 227g 227g	1	Неклассифицированные/default	0	
2779387	5099872016542	Baileys salted caramel Milk chocolate and truffle bar 90g	1	Неклассифицированные/default	0	
2779388	5099872016528	Baileys salted caramel Milk chocolate Mini delights in pouch 102g 102g	1	Неклассифицированные/default	0	
563060	5099872009018	Baileys sharing Box 170g	23975	Продукты питания (folder)/Алкогольные напитки/Ликер	341252	Baileys
2779389	5099872014838	Baileys sparkle Star of Milk chocolates 54g 54g	1	Неклассифицированные/default	0	
2779390	5099872015507	Baileys sparkle tree of Milk chocolates 350g	1	Неклассифицированные/default	0	
2779391	086767704832	Baileys strawberries and Cream 17% 750l	1	Неклассифицированные/default	341252	Baileys
4118345	756774024895	Baileys the irish Cream chocolates	1	Неклассифицированные/default	0	
2025752	9300633143923	Baileys the Original 700ml	23975	Продукты питания (folder)/Алкогольные напитки/Ликер	0	
2779392	5099872015774	Baileys Twist wrapped Milk truffles in carton 135g	1	Неклассифицированные/default	0	
2779393	5099872015798	Baileys Twist wrapped Milk truffles in tube 320g	1	Неклассифицированные/default	0	
2164711	028200300621	Baileys Ultra Light 100	116798	Табакокурение (folder)/Сигареты	193954	L&M
1384580	082000003571	Baileys vanilla cinnamon irish Cream	1	Неклассифицированные/default	0	
1384581	086767704382	Baileys vanilla cinnamon irish Cream #2	1	Неклассифицированные/default	341252	Baileys
2025754	5011013925094	Baileys with a hint of coffee 700ml	23975	Продукты питания (folder)/Алкогольные напитки/Ликер	0	
1437510	088076169357	Baileys&bushmills co-pack	78617	Продукты питания (folder)/Алкогольные напитки/Алкоголь	0	
4118346	784585000609	Baillat, corbieres Rose 750ml	1	Неклассифицированные/default	0	
4118347	784585000593	Baillat, corbieres Rouge 750ml	1	Неклассифицированные/default	0	
4118348	784585000906	Baillat, corbieres Rouge, cuvee emilien baillat 750ml	1	Неклассифицированные/default	0	
341270	8902579203016	Bailley packaged Drinking Water 1000ml	17388	Продукты питания (folder)/Напитки безалкогольные/Вода питьевая	341252	Baileys
341271	8902579205010	Bailley packaged Drinking Water 2000ml	17388	Продукты питания (folder)/Напитки безалкогольные/Вода питьевая	341252	Baileys
341272	8902579107048	Bailley packaged Drinking Water 500ml	17388	Продукты питания (folder)/Напитки безалкогольные/Вода питьевая	341252	Baileys
3619222	3371804802044	Bailly lapierre cremant de bourg. brut p 0.75l	296061	Продукты питания (folder)/Алкогольные напитки/Вино (folder)/Вино игристое	3619221	BAILLY LAPIERRE
1384582	3371808000033	Bailly lapierre Pinot Noir cremant de bourgogne glass 750ml	22133	Продукты питания (folder)/Алкогольные напитки/Вино (folder)/Вино	0	
1384583	3371808000040	Bailly lapierre reserve brut cremant de bourgogne glass 750ml	1	Неклассифицированные/default	0	
2528994	081578201037	Bailly-lapierre 'vive La joie' cremant de bourgogne brut glass 750ml	1	Неклассифицированные/default	0	
2779394	8157820103533	Bailly-lapierre cremand de bourgogne Pinot Noir brut glass 750ml	22133	Продукты питания (folder)/Алкогольные напитки/Вино (folder)/Вино	0	
2779395	8157820103397	Bailly-lapierre reserve cremant de bourgogne brut glass 750ml	1	Неклассифицированные/default	0	
2779396	815756010407	Bailly-lapierre Saint bris glass 750ml	1	Неклассифицированные/default	0	
4118349	9300633019570	Baily&baily shiraz 2006 750ml	1	Неклассифицированные/default	0	
2025753	9300601386826	Bailys Original 750ml	23975	Продукты питания (folder)/Алкогольные напитки/Ликер	0	
2285349	6950253800145	Baimiao	1	Неклассифицированные/default	0	
2285350	6950253800039	Baimiao clean towel	1	Неклассифицированные/default	0	
563061	3474630152939	Bain bio recharge био-стимулир.шампунь для комбинир.волос 1000мл	1412	Уход за волосами (folder)/Шампунь	253527	Kerastase
4118350	074300010939	Bain d soleil Orange Gel spf15 3.12oz	1	Неклассифицированные/default	0	
4118371	879876008799	Bain d'esprittm Bath collection jasmine on the vine 64oz	1	Неклассифицированные/default	0	
4118372	879876008775	Bain d'esprittm Bath collection Lavender vanilla 64oz	1	Неклассифицированные/default	0	
906848	041100720801	Bain d/s 4ozolf spf3	1	Неклассифицированные/default	0	
906849	041100018083	Bain d/s rdnc etrnl	1	Неклассифицированные/default	0	
906850	041100018564	Bain d/s rdnc etrnl #2	1	Неклассифицированные/default	0	
906852	074300010809	Bain d/s strkgd 3.12 #2	1	Неклассифицированные/default	0	
4118351	810670001814	Bain de luxe Aloe Vera&glycerin Body wash Lavender 2floz	1	Неклассифицированные/default	0	
4118352	810670003177	Bain de luxe Aloe Vera&glycerin foaming Body scrub - rosemary mint 2floz	1	Неклассифицированные/default	0	
4118353	810670001159	Bain de luxe foaming Body scr 17floz	1	Неклассифицированные/default	0	
4118354	810670001036	Bain de luxe Melon&lemngr bd* 17oz	1	Неклассифицированные/default	0	
4118355	041100016997	Bain de sol luminessence spf 3.5oz	1	Неклассифицированные/default	0	
2285351	041100770936	Bain de sol spf4org/gl liq 3.12oz	1	Неклассифицированные/default	2278721	SCH
4118356	074300777627	Bain de soleil extend protect 4oz	1	Неклассифицированные/default	297915	Bain de Soleil
