ID	UPCEAN	Name	CategoryID	CategoryName	BrandID	BrandName
1318806	4605196007633	Табурет м-пластика складной 295cm бежевый м2297	3536	Хозяйственные товары (folder)/Хозяйственные товары	3673575	М-Пластика Idea
2759068	4605196007640	Табурет м-пластика складной 295cm голубой м2297	1	Неклассифицированные/default	3673575	М-Пластика Idea
1976762	4605196007626	Табурет м-пластика универсальный со ступенькой м2296	1	Неклассифицированные/default	3673575	М-Пластика Idea
528182	4607962036045	Табурет малый	1	Неклассифицированные/default	0	
3918499	4627106331317	Табурет малый арт.2201	3536	Хозяйственные товары (folder)/Хозяйственные товары	0	
5084000	4607130118399	Табурет мебелик кросс, дуб американский, 33x33 x 44cm (гхшхв)	1	Неклассифицированные/default	4988695	Мебелик
5084001	4607130118405	Табурет мебелик кросс, дуб сонома, 33x33 x 44cm (гхшхв)	1	Неклассифицированные/default	4988695	Мебелик
5084002	4607130118375	Табурет мебелик медисон, дуб американский, 34.5x34.5x 44cm (гхшхв)	1	Неклассифицированные/default	4988695	Мебелик
5084003	4607130118382	Табурет мебелик медисон, дуб сонома, 34.5x34.5x 44cm (гхшхв)	1	Неклассифицированные/default	4988695	Мебелик
5084004	4607130111871	Табурет мебелик орион, белый, 34.5x34.5x 48cm (гхшхв)	1	Неклассифицированные/default	4988695	Мебелик
5084005	4607130111888	Табурет мебелик персей, белый, 33x33 x 48cm (гхшхв)	1	Неклассифицированные/default	4988695	Мебелик
5084006	4607130118276	Табурет мебелик рокс, дуб американский, 33.5x33.5x45.5cm (гхшхв)	1	Неклассифицированные/default	4988695	Мебелик
5084007	4607130118283	Табурет мебелик рокс, дуб сонома, 33.5x33.5x45.5cm (гхшхв)	1	Неклассифицированные/default	4988695	Мебелик
5084008	4607130118436	Табурет мебелик София, венге, 34.5x34.5x 44cm (гхшхв)	1	Неклассифицированные/default	4988695	Мебелик
5084009	4607130118498	Табурет мебелик София, дуб беленый, 34.5x34.5x 44cm (гхшхв)	1	Неклассифицированные/default	4988695	Мебелик
5084010	4607130118504	Табурет мебелик София, орех, 34.5x34.5x 44cm (гхшхв)	1	Неклассифицированные/default	4988695	Мебелик
5084011	4607130118467	Табурет мебелик тира, венге, 33x33 x 44cm (гхшхв)	1	Неклассифицированные/default	4988695	Мебелик
5084012	4607130118443	Табурет мебелик тира, дуб беленый, 33x33 x 44cm (гхшхв)	1	Неклассифицированные/default	4988695	Мебелик
5084013	4607130118450	Табурет мебелик тира, орех, 33x33 x 44cm (гхшхв)	1	Неклассифицированные/default	4988695	Мебелик
5084014	4607130118214	Табурет мебелик хайбол, дуб американский, 33.5x33.5x 77cm (гхшхв)	1	Неклассифицированные/default	4988695	Мебелик
5084015	4607130118269	Табурет мебелик хайбол, дуб сонома, 33.5x33.5x 77cm (гхшхв)	1	Неклассифицированные/default	4988695	Мебелик
5084017	4620032741168	Табурет мебельторг классика-2 арт.тк02/к (круглое сиденье) коричневый galтк02/к	1	Неклассифицированные/default	705420	НИКА
5084022	4620032741861	Табурет мебельторг классика-3 арт.тк03/к (квадратное сиденье) коричневый galтк03/к	1	Неклассифицированные/default	705420	НИКА
3547240	4607122623009	Табурет металлическая опора с мягким сиденьем квадрат	1	Неклассифицированные/default	0	
3547241	4607075644199	Табурет мягкий квадратный кожазаменитель	1	Неклассифицированные/default	0	
3547242	4607075644168	Табурет мягкий круглый кожазаменитель	1	Неклассифицированные/default	0	
3547243	4607075643420	Табурет мягкий м	1	Неклассифицированные/default	0	
1318803	4813999000168	Табурет низкий вшаи.324.335.0000	1	Неклассифицированные/default	0	
5084016	4620032741984	Табурет ника классика 2, круглое сиденье d=32cm голубой	1	Неклассифицированные/default	705420	НИКА
5084018	4620032741175	Табурет ника классика 2, круглое сиденье d=32cm слоновая кость	1	Неклассифицированные/default	705420	НИКА
5084019	4620032742011	Табурет ника классика 2, круглое сиденье d=32cm темно-серый	1	Неклассифицированные/default	705420	НИКА
5084020	4620032741878	Табурет ника классика 3, квадратное сиденье 32cm голубой	1	Неклассифицированные/default	705420	НИКА
5084021	4620032741939	Табурет ника классика 3, квадратное сиденье 32cm зеленый	1	Неклассифицированные/default	705420	НИКА
5084023	4620032742301	Табурет ника классика 3, квадратное сиденье 32cm слоновая кость	1	Неклассифицированные/default	705420	НИКА
5084024	4620032741915	Табурет ника классика 3, квадратное сиденье 32cm темно-серый	1	Неклассифицированные/default	705420	НИКА
3547244	4607583062201	Табурет ника классика арт.02	1	Неклассифицированные/default	0	
5084025	4620032741335	Табурет ника классика коричн	263522	Мебель (folder)/Мебель	0	
5084027	4620032741762	Табурет ника фабрик 1 | тф01, мягкое круглое сиденье d=32cm голубой	1	Неклассифицированные/default	705420	НИКА
5084028	4620032741755	Табурет ника фабрик 1 | тф01, мягкое круглое сиденье d=32cm коричневый	1	Неклассифицированные/default	705420	НИКА
5084029	4620032741793	Табурет ника фабрик 1 | тф01, мягкое круглое сиденье d=32cm серый	1	Неклассифицированные/default	705420	НИКА
5084030	4620032741151	Табурет ника фабрик 1 | тф01, мягкое круглое сиденье d=32cm слоновая кость	1	Неклассифицированные/default	705420	НИКА
5084031	4620032741779	Табурет ника фабрик 1 | тф01, мягкое круглое сиденье d=32cm темно-красный	1	Неклассифицированные/default	705420	НИКА
5084032	4620032741809	Табурет ника фабрик 1 | тф01, мягкое круглое сиденье d=32cm темно-серый	1	Неклассифицированные/default	705420	НИКА
5084033	4620032741649	Табурет ника фабрик 2 | тф02, мягкое круглое сиденье d=32cm голубой	1	Неклассифицированные/default	705420	НИКА
5084034	4620032741632	Табурет ника фабрик 2 | тф02, мягкое круглое сиденье d=32cm коричневый	1	Неклассифицированные/default	705420	НИКА
5084035	4620032742349	Табурет ника фабрик 2 | тф02, мягкое круглое сиденье d=32cm серый	1	Неклассифицированные/default	705420	НИКА
5084036	4620032741687	Табурет ника фабрик 2 | тф02, мягкое круглое сиденье d=32cm слоновая кость	1	Неклассифицированные/default	705420	НИКА
5084037	4620032741229	Табурет ника фабрик 3 | тф03, мягкое квадратное сиденье 32cm коричневый	1	Неклассифицированные/default	705420	НИКА
5084038	4620032741571	Табурет ника фабрик 3 | тф03, мягкое квадратное сиденье 32cm серый	1	Неклассифицированные/default	705420	НИКА
5084039	4620032741595	Табурет ника фабрик 3 | тф03, мягкое квадратное сиденье 32cm слоновая кость	1	Неклассифицированные/default	705420	НИКА
5084040	4620032741588	Табурет ника фабрик 3 | тф03, мягкое квадратное сиденье 32cm темно-серый	1	Неклассифицированные/default	705420	НИКА
5084043	4620032741083	Табурет ника эконом 2, круглое сиденье d=32cm слоновая кость	1	Неклассифицированные/default	705420	НИКА
5084044	4620032741267	Табурет ника эконом 2, круглое сиденье d=32cm темно-красный	1	Неклассифицированные/default	705420	НИКА
5084046	4620032742561	Табурет ника эконом 3, квадратное сиденье 29cm, слоновая кость	1	Неклассифицированные/default	705420	НИКА
239056	4607027581039	Табурет п/м высокий h 46cm ООО м-пластика	3536	Хозяйственные товары (folder)/Хозяйственные товары	0	
3547247	4640011874496	Табурет пенек крепкий квадратный 30x 30cm коричневый	1	Неклассифицированные/default	0	
3547248	4640011874373	Табурет пенек крепкий круглый бежевый	1	Неклассифицированные/default	0	
2759061	4650055581632	Табурет пенёк детский с рисунком 20шт	1	Неклассифицированные/default	0	
837008	4601137018676	Табурет пластик	3536	Хозяйственные товары (folder)/Хозяйственные товары	0	
5760580	4823052326777	Табурет пластиковый алеана кроха 20x24 x30.5см какао	5163211	Мебель (folder)/Мебель садовая и дачная	310438	АЛЕАНА
5760581	4823044303359	Табурет пластиковый алеана кроха 20x30.6x 24см	5163211	Мебель (folder)/Мебель садовая и дачная	310438	АЛЕАНА
5760582	4823044303298	Табурет пластиковый алеана кроха 20x30.6x 24см оливковый	5163211	Мебель (folder)/Мебель садовая и дачная	310438	АЛЕАНА
5760583	4823052326784	Табурет пластиковый алеана малыш 27x31.5x31.5см какао	5189051	Мебель (folder)/Табурет	310438	АЛЕАНА
5760584	4823052317447	Табурет пластиковый алеана малыш 27x31.9x31.9см роза	5189051	Мебель (folder)/Табурет	310438	АЛЕАНА
5760585	4823044303106	Табурет пластиковый алеана малятко 27x32 x 32см	5189051	Мебель (folder)/Табурет	310438	АЛЕАНА
5760586	4823044303052	Табурет пластиковый алеана малятко 27x32 x 32см оливковый	5189051	Мебель (folder)/Табурет	310438	АЛЕАНА
5760587	4823044304097	Табурет пластиковый алеана пиф 46.3x36.5x36.5см	5189051	Мебель (folder)/Табурет	310438	АЛЕАНА
5760588	4823044308446	Табурет пластиковый алеана пиф 46.3x36.5x36.5см кремовый	5189051	Мебель (folder)/Табурет	310438	АЛЕАНА
5760589	4823044302024	Табурет пластиковый алеана пиф 46.3x36.5x36.5см темно	5189051	Мебель (folder)/Табурет	310438	АЛЕАНА
3547250	4607016817736	Табурет пластишка Маша и медведь подставка детская 4313800	1	Неклассифицированные/default	0	
5760590	4814554104635	Табурет пластмассовый 30x27 x 46см (арт 06003, код 104635) 69458	5189051	Мебель (folder)/Табурет	0	
5760591	4610004680830	Табурет пластмассовый 30x30 x 46см (арт 06108, код 680830) 69457	5189051	Мебель (folder)/Табурет	0	
3547222	4610004680687	Табурет пластмассовый детский игровой 23x23 x 21cm (арт 06105, код 680687) 69456	1	Неклассифицированные/default	0	
3547251	4620001920327	Табурет пластмассовый разборный	1	Неклассифицированные/default	0	
5760592	4610004681134	Табурет пластмассовый складной 30x25 x 26см (арт 06005, код 681134) 72137	5189051	Мебель (folder)/Табурет	0	
5760593	4610004681141	Табурет пластмассовый складной 30x25 x 36см (арт 06006r, код 681141) 75053	5189051	Мебель (folder)/Табурет	0	
5760594	4610004681158	Табурет пластмассовый складной 30x25 x 46см (арт 06007, код 681158) 72136	5189051	Мебель (folder)/Табурет	0	
1703947	6907728098699	Табурет рождеств.дерев красн 27x21 x 24cm	36595	Товары для праздников (folder)/Новый Год и Рождество	672703	NVT Traiding
1703948	6907728098866	Табурет рождеств.дерев красно-синий 33.5x24.5x30.5cm	36595	Товары для праздников (folder)/Новый Год и Рождество	672703	NVT Traiding
837010	6907728063567	Табурет рождественский декор 33.5x24.5x 44cm kl85967	36595	Товары для праздников (folder)/Новый Год и Рождество	672703	NVT Traiding
837009	6907728063574	Табурет рождественский декор 33.5x24.5x30.5cm kl859	36595	Товары для праздников (folder)/Новый Год и Рождество	672703	NVT Traiding
3547253	4610016520872	Табурет рс01-03, черный каркас, черный кожзам 201, ш/к 20872	1	Неклассифицированные/default	0	
2759064	4650055581731	Табурет с перекладиной большой 40cm 1шт	1	Неклассифицированные/default	0	
2759065	4650055581342	Табурет с перекладиной малый 31.5cm 1шт	1	Неклассифицированные/default	0	
3547254	4627117890643	Табурет скамеечка низкий 300x250 x 300mm	1	Неклассифицированные/default	0	
1841439	8711295799624	Табурет склад.сиден/ткан 75.5x44	3536	Хозяйственные товары (folder)/Хозяйственные товары	0	
5760595	5902062793188	Табурет складаний topex 79R319	5189051	Мебель (folder)/Табурет	306818	TOPEX
3918500	6970610162068	Табурет складной 30x 45cm	5163211	Мебель (folder)/Мебель садовая и дачная	0	
5760596	4607051383180	Табурет складной fiesta camp fiesta compact тренога зеленый ff-007	5124616	Мебель (folder)/Мебель походная	5463902	fiesta camp
5760598	4690654995409	Табурет складной sheffilton sht-s6 хром/бук (металл/лдсп) sh818958	5189051	Мебель (folder)/Табурет	3281558	SHEFFILTON
5760599	4690654995416	Табурет складной sheffilton sht-s6 хром/венге (металл/лдсп) sh818960	5189051	Мебель (folder)/Табурет	3281558	SHEFFILTON
5083997	4627105059625	Табурет складной алфавит ассортим (10) м4960/4956/4962/4961/4959	1	Неклассифицированные/default	0	
1318804	6051960050974	Табурет складной высокий (бежевый мрамор) /4 (м-пластика) Россия	1	Неклассифицированные/default	0	
1318805	051960050970	Табурет складной высокий (голубой мрамор) /4 (м-пластика) Россия	1	Неклассифицированные/default	0	
3547255	4605196007657	Табурет складной высокий бежевый м2298	1	Неклассифицированные/default	0	
837011	4605196005097	Табурет складной высокий мраморный м2298	1	Неклассифицированные/default	155913	М-пластика
5760600	4606800070579	Табурет складной макси 430x355 x 460mm palisad	5189051	Мебель (folder)/Табурет	839254	Palisad
3918501	4660007831289	Табурет складной мини 325x265 x 245mm	263522	Мебель (folder)/Мебель	0	
5760601	4606800053534	Табурет складной мини, 325x265 x 245mm palisad	5189051	Мебель (folder)/Табурет	839254	Palisad
2759066	4650055581113	Табурет складной мультистул большой 44.5cm (коричневый) 10шт	1	Неклассифицированные/default	0	
2759067	4650055581106	Табурет складной мультистул малый 28cm (беж.коричнев.) 16шт	1	Неклассифицированные/default	0	
1318807	4607144890335	Табурет складной мягкий	1	Неклассифицированные/default	0	
1703949	4606224080741	Табурет складной офисмаг, 38x33 x 33cm, красн, 451028	1	Неклассифицированные/default	679195	ОФИСМАГ
837013	8717548015503	Табурет складной пластик	3536	Хозяйственные товары (folder)/Хозяйственные товары	0	
5760602	4640017122690	Табурет складной с 100 зеленый	5123018	Стул кемпинговый	5234773	zagorod
1703950	4607017564370	Табурет складной с сумкой	1	Неклассифицированные/default	0	
837014	4603994010060	Табурет складной тс 001/023	1	Неклассифицированные/default	0	
5760603	4610000264300	Табурет складной усиленный zagorod с200 (oxford 600x600) 0023535	5124616	Мебель (folder)/Мебель походная	5234773	zagorod
837015	4811901000466	Табурет складной шп	1	Неклассифицированные/default	0	
1318808	4607177761015	Табурет складной, шлифованный, липа, банные штучки (банные штучки)	21899	Гигиена (folder)/Баня и сауна	0	
3547249	4607016816432	Табурет со ступенькой volf бытпласт 472x486 x 418mm 4312607	1	Неклассифицированные/default	54486	Бытпласт
3918502	7930044640142	Табурет средний 268x330 x 270mm	5163211	Мебель (folder)/Мебель садовая и дачная	0	
3918503	4620768211805	Табурет средний 36.7x21 x 30cm	3605276	Спорт и отдых (folder)/Кемпинг	0	
5084047	4620032742936	Табурет стайл 2 тбс2 голубой	263522	Мебель (folder)/Мебель	0	
5084048	4607075836624	Табурет стайл nica тбс01	263522	Мебель (folder)/Мебель	0	
1318809	4660011271231	Табурет стремянка банные штучки 32184	21899	Гигиена (folder)/Баня и сауна	1182355	Банные штучки
3547256	8696219341595	Табурет тон тон круглый, маленький	1	Неклассифицированные/default	0	
1976761	4810468003125	Табурет трансформер (300x300 x300) арт.3.111-01	1	Неклассифицированные/default	0	
1318810	6051960048230	Табурет универсальный с ящиком (голубой мрамор) /2 (м-пластика) Россия	1	Неклассифицированные/default	0	
1318811	051960045198	Табурет универсальный складной (голубой мрамор) /8 (м-пластика) Россия	1	Неклассифицированные/default	0	
528185	4605196004519	Табурет универсальный складной (мраморный) м-пластика idea м2297	1	Неклассифицированные/default	3673575	М-Пластика Idea
5760578	4620032741281	Табурет эконом (стул) цвет бежевый nika (цвет бежевый) тэ2/б	5189051	Мебель (folder)/Табурет	3722541	NIKA
5084042	4620032741274	Табурет эконом (стул) цвет серый nika (цвет серый) тэ2/с	1	Неклассифицированные/default	705420	НИКА
5084049	4607075836433	Табурет эконом квадр. 4 ножки фисташков.	263522	Мебель (folder)/Мебель	0	
2759069	4607075832008	Табурет эконом на 4 опорах (круглое сиденье дсп)	1	Неклассифицированные/default	0	
5084050	4620032742332	Табурет эконом тэ2/ф фисташковый	263522	Мебель (folder)/Мебель	0	
2759062	4650055582479	Табурет эльфпласт ротанг большой пластиковый	1	Неклассифицированные/default	5147540	эльфпласт
2759063	4650055582486	Табурет эльфпласт ротанг малый пластиковый	1	Неклассифицированные/default	5147540	эльфпласт
528186	3253920300034	Табурет-контейнер для игрук 00300	1	Неклассифицированные/default	0	
5760604	4061349220012	Табурет-лестница stark табурет розкладний 44см	5189051	Мебель (folder)/Табурет	0	
837017	7777862010005	Табурет-подставка детская	337649	Уход за детьми (folder)/Уход за детьми	0	
2805255	4605196018608	Табурет-подставка м-пластика idea Disney пластмассовый цвет бирюзовый	1	Неклассифицированные/default	3673575	М-Пластика Idea
3547259	4605196018592	Табурет-подставка м-пластика idea Disney пластмассовый цвет коралловый	1	Неклассифицированные/default	3673575	М-Пластика Idea
528187	4605196011500	Табурет-подставка м-пластика idea детский пластиковый с ручкой цвет голубой 230x190 x 290mm	1	Неклассифицированные/default	3673575	М-Пластика Idea
1976763	4605196012200	Табурет-подставка м-пластика idea детский пластиковый с ручкой цвет розовый 230x190 x 290mm	1	Неклассифицированные/default	3673575	М-Пластика Idea
3547260	4605196012194	Табурет-подставка м-пластика idea пластиковый желтый детский с ручкой	1	Неклассифицированные/default	3673575	М-Пластика Idea
239058	4601532004151	Табурет-подставка полимербыт малыш пластиковая 335x250 x 155mm	3536	Хозяйственные товары (folder)/Хозяйственные товары	145147	Полимербыт
5760605	4605196033502	Табурет-подставка, слоник м-пластика	5189051	Мебель (folder)/Табурет	155913	М-пластика
528184	4605196003932	Табурет-стремянка 2 ступени м-пластика idea пластиковый, (в48*ш47*г 41cm) цвет серый, м 2296	1	Неклассифицированные/default	3673575	М-Пластика Idea
837016	4894237582370	Табуретка складная полиестр, сталь	1	Неклассифицированные/default	686964	Outdoor
2994416	4894237617669	Табуретка складная полиестр, сталь #2	1	Неклассифицированные/default	686964	Outdoor
1318812	8697633820161	Табуретка средняя Люкс 26x32 x34 (бежевый цвет) 50шт	2420630	Посуда (folder)/Посуда кухонная	0	
1787245	4811098001123	Тавамин капс 200mg	210391	Лекарственные средства (folder)/Лекарственные средства	0	
837018	4030685671239	Таваник 0.005/мл 100ml флак р-р для инф	210391	Лекарственные средства (folder)/Лекарственные средства	0	
