ID	UPCEAN	Name	CategoryID	CategoryName	BrandID	BrandName
1318758	4607141333996	Табак кальянный аравия платинум 3 яблоко 40g	336038	Табакокурение (folder)/Табак	1318757	Аравия
2759027	4607141334061	Табак кальянный аравия платинум банан 40g	336038	Табакокурение (folder)/Табак	0	
2759028	4607141334047	Табак кальянный аравия платинум виноград 40g	336038	Табакокурение (folder)/Табак	0	
1318759	4607141334078	Табак кальянный аравия платинум кофе 40g	336038	Табакокурение (folder)/Табак	1318757	Аравия
1318760	4607141334030	Табак кальянный аравия платинум мультифрукт 40g	336038	Табакокурение (folder)/Табак	1318757	Аравия
2759029	4605648009871	Табак кальянный аравия платинум мультифрукт 40g #2	336038	Табакокурение (folder)/Табак	0	
2759043	4605648010952	Табак кальянный арбуз 50g	336038	Табакокурение (folder)/Табак	0	
1318767	6224000118013	Табак кальянный ассортим фруктовый 50g	336038	Табакокурение (folder)/Табак	0	
836925	6291104021655	Табак кальянный гавана	336038	Табакокурение (folder)/Табак	0	
1318770	6291101060039	Табак кальянный лаялина яблоко 50g	336038	Табакокурение (folder)/Табак	0	
1318771	6291101060114	Табак кальянный лаялина яблоко 50g #2	336038	Табакокурение (folder)/Табак	0	
126961	5707294021609	Табак кальянный хабиби апельсин 40g	336038	Табакокурение (folder)/Табак	0	
836926	5707294066693	Табак кальянный хабиби арбуз 40g	336038	Табакокурение (folder)/Табак	0	
126962	5707294021616	Табак кальянный хабиби банан 40g	336038	Табакокурение (folder)/Табак	0	
126963	5712342303316	Табак кальянный хабиби виноград 40g	336038	Табакокурение (folder)/Табак	0	
836927	5707294082785	Табак кальянный хабиби вишня 40g	336038	Табакокурение (folder)/Табак	0	
126966	5707294044776	Табак кальянный хабиби лимон 40g	336038	Табакокурение (folder)/Табак	0	
836928	5707294066662	Табак кальянный хабиби персик 40g	336038	Табакокурение (folder)/Табак	0	
836929	5707294082815	Табак кальянный хабиби пина-колада 40g	336038	Табакокурение (folder)/Табак	0	
126968	5712342303514	Табак кальянный хабиби фрукт.ассорти 40g	336038	Табакокурение (folder)/Табак	3918421	HABIBI
126970	4620000880592	Табак кальянный шиша апельсин 40g	336038	Табакокурение (folder)/Табак	0	
1827555	4602050990025	Табак кальянный шиша в асс.пачка	336038	Табакокурение (folder)/Табак	3918465	ШИША
126972	4620000880691	Табак кальянный шиша виноград 40g	336038	Табакокурение (folder)/Табак	3918465	ШИША
126973	4620000880417	Табак кальянный шиша вишня 40g	336038	Табакокурение (folder)/Табак	0	
126975	4620000880295	Табак кальянный шиша малина 40g	336038	Табакокурение (folder)/Табак	0	
126976	4620000880431	Табак кальянный шиша мультифрукт 40g	336038	Табакокурение (folder)/Табак	0	
126977	4620000880585	Табак кальянный шиша мята 40g	336038	Табакокурение (folder)/Табак	0	
2759030	4605648011584	Табак кальянный эль лейла ананас 50g	336038	Табакокурение (folder)/Табак	0	
2759031	4605648011577	Табак кальянный эль лейла арбуз 50g	336038	Табакокурение (folder)/Табак	0	
2759032	4605648011706	Табак кальянный эль лейла вишня 50g	336038	Табакокурение (folder)/Табак	0	
2759033	4605648011614	Табак кальянный эль лейла двойное яблоко 50g	336038	Табакокурение (folder)/Табак	0	
2759034	4605648011621	Табак кальянный эль лейла мята 50g	336038	Табакокурение (folder)/Табак	0	
2759035	6291100730186	Табак кальянный эль фахер клубника 50g оаэ	336038	Табакокурение (folder)/Табак	0	
2759036	629110073003	Табак кальянный эль фахер мята 50g оаэ	336038	Табакокурение (folder)/Табак	0	
2759037	6291100730322	Табак кальянный эль фахер шоколад 50g оаэ	336038	Табакокурение (folder)/Табак	0	
3918466	4607141330919	Табак кальянный эмир 40g апельсин	336038	Табакокурение (folder)/Табак	0	
3918467	4607141330896	Табак кальянный эмир 40g лимон	336038	Табакокурение (folder)/Табак	0	
3918468	4607141330650	Табак кальянный эмир 40g персик	336038	Табакокурение (folder)/Табак	0	
126978	4002450229440	Табак касабланка ванила черри бленд 40g	336038	Табакокурение (folder)/Табак	0	
126981	5707294015851	Табак корсар вишня 50g	336038	Табакокурение (folder)/Табак	0	
126932	5712341044500	Табак курительный alsbo mango 50g orli	336038	Табакокурение (folder)/Табак	1318737	Alsbo
1318742	5712341134485	Табак курительный alsbo Silver 50g orl	336038	Табакокурение (folder)/Табак	1318737	Alsbo
528118	4014596001576	Табак курительный unitas excellent Apple 40g /Германия	336038	Табакокурение (folder)/Табак	0	
528119	4400064902276	Табак курительный unitas excellent Cherry	336038	Табакокурение (folder)/Табак	0	
528120	4014596004218	Табак курительный unitas excellent exotic mango	336038	Табакокурение (folder)/Табак	0	
528121	4400064902269	Табак курительный unitas excellent halfzware shag	336038	Табакокурение (folder)/Табак	0	
528122	4014596001583	Табак курительный unitas excellent kir Royal aromatic 40g /Германия	336038	Табакокурение (folder)/Табак	0	
528123	4014596004225	Табак курительный unitas excellent sweet plum	336038	Табакокурение (folder)/Табак	0	
528124	4400064902290	Табак курительный unitas excellent vanilla 40g /Германия	336038	Табакокурение (folder)/Табак	0	
2759044	4605648009444	Табак курительный рейдмонт норд черри 40g	336038	Табакокурение (folder)/Табак	3738907	REDMONT
2759045	4605648009420	Табак курительный рейдмонт фреш ванилла 40g	336038	Табакокурение (folder)/Табак	3738907	REDMONT
3918469	7310870018672	Табак кэтч драй ванилла коффе 6g	336038	Табакокурение (folder)/Табак	3604534	Catch
3918470	7310870018665	Табак кэтч драй касс.ментол 6g	336038	Табакокурение (folder)/Табак	3604534	Catch
3918471	7310870018658	Табак кэтч драй юкалиптус 6g	336038	Табакокурение (folder)/Табак	3604534	Catch
3918472	7310870018733	Табак кэтч лавендер 10g	336038	Табакокурение (folder)/Табак	3604534	Catch
126982	5712341202207	Табак ларсен классик жб 100g	336038	Табакокурение (folder)/Табак	3771317	W.O.LARSEN
126983	5712341202184	Табак ларсен коллекторс жб 100g	336038	Табакокурение (folder)/Табак	0	
1318775	5712341115958	Табак ларсен олд фэшн жб 100g #3	336038	Табакокурение (folder)/Табак	3771317	W.O.LARSEN
528134	4002153004702	Табак мак клинтон батида декоко 50g	336038	Табакокурение (folder)/Табак	0	
4856881	7622100926818	Табак нагреваемый heets Parliament Yellow Label	116798	Табакокурение (folder)/Сигареты	2258969	Филип Морис
127013	4002450115569	Табак нюхательный gawith Apricot snuff 10g	336038	Табакокурение (folder)/Табак	0	
1318781	400245011012	Табак нюхательный gletscher prise 10g +	38814	Табакокурение (folder)/Табакокурение	0	
127014	4002450110120	Табак нюхательный gletscher prise snuff	336038	Табакокурение (folder)/Табак	3918420	GLETSCHER PRISE
127016	4002450111417	Табак нюхательный ozona Cherry snuff	336038	Табакокурение (folder)/Табак	0	
127017	4002450111479	Табак нюхательный ozona prezident snuff 7g	336038	Табакокурение (folder)/Табак	0	
1318780	4002450117259	Табак нюхательный ozona Raspberry 5g	1	Неклассифицированные/default	0	
127015	4002450110564	Табак нюхательный ozona Raspberry snuff	336038	Табакокурение (folder)/Табак	0	
836938	4002450117273	Табак нюхательный ozona вишня 7g	336038	Табакокурение (folder)/Табак	0	
836939	4002450117235	Табак нюхательный ozona малина 7g	336038	Табакокурение (folder)/Табак	0	
836940	4002450111035	Табак нюхательный ozona ментол 5g	336038	Табакокурение (folder)/Табак	0	
2994415	4002450117280	Табак нюхательный ozona ментол 5g #2	336038	Табакокурение (folder)/Табак	0	
127018	4002450118546	Табак нюхательный санта катерина 10g	336038	Табакокурение (folder)/Табак	0	
1377972	070137470076	Табак Принц альберт яблоко 42.5g	1	Неклассифицированные/default	3918473	PRINCE AIBERT
166964	8723900103795	Табак самсон Mild	336038	Табакокурение (folder)/Табак	0	
528125	5707294061711	Табак сигаретный aromatic choice	336038	Табакокурение (folder)/Табак	0	
528126	5707294061773	Табак сигаретный Original choice	336038	Табакокурение (folder)/Табак	0	
528127	5707294061803	Табак сигаретный vanilla choice	336038	Табакокурение (folder)/Табак	0	
2936532	4605648015421	Табак сигаретный королевский корсар халфзвар 35g	1	Неклассифицированные/default	0	
2936533	4605648010549	Табак сигаретный королевский корсар черри 35g	1	Неклассифицированные/default	0	
528128	5707294061742	Табак сигаретный сherry choice	336038	Табакокурение (folder)/Табак	0	
166965	8723900103368	Табак сигаретный самсон халфэвар 40g	336038	Табакокурение (folder)/Табак	0	
127034	5712341312326	Табак сигаретный тэйст ванилла 35g	336038	Табакокурение (folder)/Табак	3758951	TASTE
127037	5712341005655	Табак сигаретный тэйст черри 35g	336038	Табакокурение (folder)/Табак	0	
127025	5712341318175	Табак скандинавик ванилла 50g	336038	Табакокурение (folder)/Табак	0	
127027	5712341302433	Табак скандинавик регуляр 50g	336038	Табакокурение (folder)/Табак	3751292	SKANDINAVIK
127028	5712341309746	Табак смустэсти 50g	336038	Табакокурение (folder)/Табак	0	
127029	5712341308961	Табак тру дилайт 50g	336038	Табакокурение (folder)/Табак	0	
528129	5712341141278	Табак трубочный alsbo Black	336038	Табакокурение (folder)/Табак	1318737	Alsbo
528130	5712341141216	Табак трубочный alsbo Cherry	336038	Табакокурение (folder)/Табак	1318737	Alsbo
528131	5712341141247	Табак трубочный alsbo Gold	336038	Табакокурение (folder)/Табак	1318737	Alsbo
528132	5712341141308	Табак трубочный alsbo vanilla	336038	Табакокурение (folder)/Табак	1318737	Alsbo
528133	5707294044387	Табак трубочный aromatic choice	336038	Табакокурение (folder)/Табак	0	
528136	5707294044417	Табак трубочный Black ambrosia loose cut	336038	Табакокурение (folder)/Табак	0	
528137	4002153002708	Табак трубочный Black Cherry	336038	Табакокурение (folder)/Табак	0	
166966	071737405000	Табак трубочный captain Black голд 42.5g	336038	Табакокурение (folder)/Табак	165499	Captain Black
166967	071737442005	Табак трубочный captain Black лайт 42.5g	336038	Табакокурение (folder)/Табак	165499	Captain Black
166968	071737401002	Табак трубочный captain Black регуляр 42.5g	336038	Табакокурение (folder)/Табак	165499	Captain Black
166969	071737408001	Табак трубочный captain Black роял 42.5g	336038	Табакокурение (folder)/Табак	165499	Captain Black
528138	4002153001930	Табак трубочный cellini classico reserva	336038	Табакокурение (folder)/Табак	0	
528139	4002153009714	Табак трубочный cellini forte	336038	Табакокурение (folder)/Табак	0	
528140	5707294044448	Табак трубочный Cherry ambrosia mixture	336038	Табакокурение (folder)/Табак	0	
3918474	5712341076419	Табак трубочный clan highland Gold 50g	336038	Табакокурение (folder)/Табак	0	
528141	5707294061629	Табак трубочный cube Gold	336038	Табакокурение (folder)/Табак	0	
528142	5707294061834	Табак трубочный cube Silver	336038	Табакокурение (folder)/Табак	0	
528144	5707294044493	Табак трубочный Golden ambrosia ready rubbed	336038	Табакокурение (folder)/Табак	0	
528145	4002153000209	Табак трубочный holger danske Black and Bourbon luxury	336038	Табакокурение (folder)/Табак	0	
528146	4002153016149	Табак трубочный holger danske Cherry vanilla aromatic	336038	Табакокурение (folder)/Табак	0	
528147	4002153010406	Табак трубочный holger danske mango and vanilla tropic	336038	Табакокурение (folder)/Табак	0	
528148	4002153000605	Табак трубочный holger danske Original Honey dew mellow	336038	Табакокурение (folder)/Табак	2739371	PLANTA
528149	4002153010307	Табак трубочный holger danske Red kirsberry Wine aromatic	336038	Табакокурение (folder)/Табак	2739371	PLANTA
1318773	5710840010279	Табак трубочный larsen Classic 100g ж/	336038	Табакокурение (folder)/Табак	3771317	W.O.LARSEN
3771324	5712341119499	Табак трубочный larsen Old belt 100g ж	336038	Табакокурение (folder)/Табак	3771317	W.O.LARSEN
3771328	5712341119451	Табак трубочный larsen sweet aromatic 1	336038	Табакокурение (folder)/Табак	3771317	W.O.LARSEN
528152	5707294044554	Табак трубочный Original choice	336038	Табакокурение (folder)/Табак	0	
528153	4002153001718	Табак трубочный pergamon (classical tobacco)	336038	Табакокурение (folder)/Табак	2739371	PLANTA
3918479	4002153004412	Табак трубочный planta 100g сан суси	336038	Табакокурение (folder)/Табак	2739371	PLANTA
528135	4002153000506	Табак трубочный planta 50g блэк энд брайт	336038	Табакокурение (folder)/Табак	2739371	PLANTA
3918480	4002153005105	Табак трубочный planta 50g вирджиния лайт	336038	Табакокурение (folder)/Табак	2739371	PLANTA
528143	4002153000100	Табак трубочный planta 50g германская микстур	336038	Табакокурение (folder)/Табак	2739371	PLANTA
3918481	4002153003569	Табак трубочный planta 50g иль камино	336038	Табакокурение (folder)/Табак	2739371	PLANTA
528151	4002153000308	Табак трубочный planta 50g кентукки клуб	336038	Табакокурение (folder)/Табак	2739371	PLANTA
528150	4002153009509	Табак трубочный planta jacaranda 50g	336038	Табакокурение (folder)/Табак	2739371	PLANTA
1827542	4002153006485	Табак трубочный planta дизайн берлин ван 50g	336038	Табакокурение (folder)/Табак	2739371	PLANTA
1827543	4002153009837	Табак трубочный planta дизайн берлин тропик 50g	336038	Табакокурение (folder)/Табак	2739371	PLANTA
1827552	4002153006454	Табак трубочный planta дизайн берлин черри 50g	336038	Табакокурение (folder)/Табак	2739371	PLANTA
3918482	4002153002715	Табак трубочный planta жб 100g блэк черри	336038	Табакокурение (folder)/Табак	2739371	PLANTA
3918483	4002153002814	Табак трубочный planta жб 100g вилд черри	336038	Табакокурение (folder)/Табак	2739371	PLANTA
3918484	4002153009516	Табак трубочный planta жб 100g джакаранда	336038	Табакокурение (folder)/Табак	2739371	PLANTA
528154	4002153009707	Табак трубочный sans souci	336038	Табакокурение (folder)/Табак	0	
3918475	5712341089716	Табак трубочный skandinavik arabica 50g	336038	Табакокурение (folder)/Табак	3751292	SKANDINAVIK
127024	5712341302235	Табак трубочный skandinavik mildly arom	336038	Табакокурение (folder)/Табак	3751292	SKANDINAVIK
127026	5712341302334	Табак трубочный skandinavik mixture 50g	336038	Табакокурение (folder)/Табак	3751292	SKANDINAVIK
528155	5710840001826	Табак трубочный stanwell classik	336038	Табакокурение (folder)/Табак	0	
3918476	5712341044579	Табак трубочный stanwell kir&Apple 50g	336038	Табакокурение (folder)/Табак	0	
528156	5710840001796	Табак трубочный stanwell melange	336038	Табакокурение (folder)/Табак	0	
3918477	5712341332355	Табак трубочный stanwell melange 50g	336038	Табакокурение (folder)/Табак	0	
3918478	5712341332980	Табак трубочный stanwell vanilla 50g	336038	Табакокурение (folder)/Табак	0	
2759047	4605648009499	Табак трубочный stevenson vanilla cavendish	336038	Табакокурение (folder)/Табак	3755802	STEVENSON
528157	5707294061681	Табак трубочный vanilla choice	336038	Табакокурение (folder)/Табак	0	
528158	5707294044646	Табак трубочный vanilla Cream loose cut	336038	Табакокурение (folder)/Табак	0	
126989	5712342522670	Табак трубочный virginia flake 50g mac	336038	Табакокурение (folder)/Табак	1714517	Mac Baren
528159	5712341141339	Табак трубочный w.o.larsen classics Fine&elegant	336038	Табакокурение (folder)/Табак	0	
528160	5712341143432	Табак трубочный w.o.larsen classics simply unique	336038	Табакокурение (folder)/Табак	0	
528161	5710840013966	Табак трубочный w.o.larsen luxury collection signature	336038	Табакокурение (folder)/Табак	0	
528162	5712341152984	Табак трубочный w.o.larsen luxury edition 2011	336038	Табакокурение (folder)/Табак	0	
528163	5710840002038	Табак трубочный w.o.larsen the masters Blend Golden Dream	336038	Табакокурение (folder)/Табак	0	
528164	5712341145283	Табак трубочный w.o.larsen the masters Blend sweet aromatic	336038	Табакокурение (folder)/Табак	0	
127030	5712341328372	Табак трубочный w.o.larsen перфект миксче 100g	336038	Табакокурение (folder)/Табак	3771317	W.O.LARSEN
127031	5712341768017	Табак трубочный w.o.larsen сигнатюр винтаже миксче 100g	336038	Табакокурение (folder)/Табак	3771317	W.O.LARSEN
1318782	5710840014741	Табак трубочный w.o.larsen сигнатюр винтаже миксче 100g #2	336038	Табакокурение (folder)/Табак	3771317	W.O.LARSEN
127032	5712341026469	Табак трубочный w.o.larsen фрэш&элегант 50g	336038	Табакокурение (folder)/Табак	3771317	W.O.LARSEN
528165	4002153000407	Табак трубочный wellauer's English Blend	336038	Табакокурение (folder)/Табак	0	
528166	4002153002807	Табак трубочный Wild Cherry	336038	Табакокурение (folder)/Табак	0	
126984	5712341202191	Табак трубочный ларсен 100g фашионед	336038	Табакокурение (folder)/Табак	3771317	W.O.LARSEN
127033	5707294028417	Табак трубочный мак барен ванилла чойс 40g	336038	Табакокурение (folder)/Табак	3918430	MB
3918485	8594047390795	Табак трубочный станислав брайт ириш кофе 40g	336038	Табакокурение (folder)/Табак	3909617	СТАНИСЛАВ
836942	5712341088696	Табак тэйст зеленый чай 35g	336038	Табакокурение (folder)/Табак	0	
127035	5712341312333	Табак тэйст мокко 35g	336038	Табакокурение (folder)/Табак	3758951	TASTE
127036	5712341047709	Табак тэйст черная смородина 35g	336038	Табакокурение (folder)/Табак	0	
836943	5710840023842	Табак тэйст черри 35g	336038	Табакокурение (folder)/Табак	0	
2491255	5411786019202	Табак фландрия вирджиния 40g	336038	Табакокурение (folder)/Табак	2491254	Фландрия
2491256	5411786019004	Табак фландрия саваж 30g	336038	Табакокурение (folder)/Табак	2491254	Фландрия
127038	4002450443006	Табак эксклюзив шерри/вишня 50g	336038	Табакокурение (folder)/Табак	0	
127039	5712341940116	Табак эксорт вайт 50g	336038	Табакокурение (folder)/Табак	0	
5073748	9785090699358	Табаков, ломакина самбо-в школу. примерная программа учебного предмета физическая культура для общеобр.организаций	205408	Полиграфия (folder)/Книги	4969304	Просвещение
2936534	4607004310591	Табакум гран. гомеоп. 8g №1	1	Неклассифицированные/default	0	
528167	4820015790064	Табакум Плюс гран. 10g	1	Неклассифицированные/default	0	
275052	4820105210045	Табари нони капс 0.6g №60	241824	Лекарственные средства (folder)/Аптека	0	
275053	4820105210014	Табари нони чай 1g №25	241824	Лекарственные средства (folder)/Аптека	0	
513385	4607077940053	Табачная пыль 1kg (3л) (от сосущих и листогрызущих насекомых) (костромской химзавод) /15 Россия	1	Неклассифицированные/default	0	
5083945	4603725783102	Табачная пыль 1kg /15 (биуд) Россия	1	Неклассифицированные/default	0	
5083946	4627085351269	Табачная пыль 3л /15 (агроритейлгрупп) Россия	1	Неклассифицированные/default	0	
3547111	4670004830093	Табачная пыль агрооптторг 1kg пакет	1	Неклассифицированные/default	0	
3595572	7930056150028	Табачная шашка гефест (мини) 160g /40 Россия	1	Неклассифицированные/default	0	
5083947	7930056150004	Табачная шашка гефест 220g (для теплиц) /30 Россия	1	Неклассифицированные/default	0	
5083948	7930056150073	Табачная шашка фитофторник (для теплиц) 220g /30 Россия	1	Неклассифицированные/default	0	
5083949	4603725185036	Табачное мыло 250ml (от болезней и вредителей) (фхи) /20 Россия	1	Неклассифицированные/default	0	
