ID	UPCEAN	Name	CategoryID	CategoryName	BrandID	BrandName
4690611	080878016587	Spec Pantene Pro-v Conditioner clsc car 28.8floz	28	Уход за волосами (folder)/Уход за волосами	12837	Pantene Pro-V
4690612	080878016631	Spec Pantene Pro-v Conditioner dly mst rn 28.8floz	28	Уход за волосами (folder)/Уход за волосами	12837	Pantene Pro-V
4690613	080878015924	Spec Pantene Pro-v Conditioner full&t 32.20floz	28	Уход за волосами (folder)/Уход за волосами	12837	Pantene Pro-V
4690614	080878016594	Spec Pantene Pro-v Conditioner hydrt cr 28.8floz	28	Уход за волосами (folder)/Уход за волосами	12837	Pantene Pro-V
4690615	080878106608	Spec Pantene Pro-v Conditioner sheer volume 28.8floz	28	Уход за волосами (folder)/Уход за волосами	12837	Pantene Pro-V
1566939	080878024223	Spec Pantene Pro-v Conditioner smooth slee 16.9floz	28	Уход за волосами (folder)/Уход за волосами	12837	Pantene Pro-V
4690617	080878024186	Spec Pantene Pro-v daily moisture 16.9floz	28	Уход за волосами (folder)/Уход за волосами	12837	Pantene Pro-V
4690623	080878010301	Spec Pantene Pro-v Shampoo cls cln w/ 32.2oz	28	Уход за волосами (folder)/Уход за волосами	12837	Pantene Pro-V
4690626	080878012299	Spec Pantene Pro-v Shampoo col reviv w/ 13.5oz	28	Уход за волосами (folder)/Уход за волосами	12837	Pantene Pro-V
4690620	080878010486	Spec Pantene Pro-v Shampoo dly mstr 13.5oz	28	Уход за волосами (folder)/Уход за волосами	12837	Pantene Pro-V
4690627	080878012268	Spec Pantene Pro-v Shampoo hyd curls w/ 400ml	28	Уход за волосами (folder)/Уход за волосами	12837	Pantene Pro-V
4690628	080878012305	Spec Pantene Pro-v Shampoo mst renew w/ 400ml	28	Уход за волосами (folder)/Уход за волосами	12837	Pantene Pro-V
4690624	080878012251	Spec Pantene Pro-v Shampoo Pro vclsc w cn 13.5oz	28	Уход за волосами (folder)/Уход за волосами	12837	Pantene Pro-V
4690618	080878013616	Spec Pantene Pro-v Shampoo relxd&nat 400ml	28	Уход за волосами (folder)/Уход за волосами	12837	Pantene Pro-V
4690621	080878010455	Spec Pantene Pro-v Shampoo sheer volume 13.5oz	28	Уход за волосами (folder)/Уход за волосами	12837	Pantene Pro-V
1566937	080878024162	Spec Pantene Pro-v Shampoo sheer volume 16.9floz	28	Уход за волосами (folder)/Уход за волосами	12837	Pantene Pro-V
4690629	080878021178	Spec Pantene Pro-v Shampoo sheer volume w/ 13.5oz	28	Уход за волосами (folder)/Уход за волосами	12837	Pantene Pro-V
4690630	080878012275	Spec Pantene Pro-v Shampoo sheer volume w/ 13.5oz 6ct	28	Уход за волосами (folder)/Уход за волосами	12837	Pantene Pro-V
4690622	080878010462	Spec Pantene Pro-v Shampoo smth&sl 13.5oz	28	Уход за волосами (folder)/Уход за волосами	12837	Pantene Pro-V
4690619	080878024155	Spec Pantene Pro-v Shampoo smth&sleek 16.9floz	28	Уход за волосами (folder)/Уход за волосами	12837	Pantene Pro-V
4690625	080878010431	Spec Pantene Pro-v Shampoo w/ condtio 13.5oz	28	Уход за волосами (folder)/Уход за волосами	12837	Pantene Pro-V
4690631	033200224457	Spec pepsodent 7.2oz	1	Неклассифицированные/default	0	
4690632	033200224303	Spec pepsodent bns pk whitening 8oz	1	Неклассифицированные/default	0	
4690633	033200223658	Spec pepsodent complete 7.2oz	1	Неклассифицированные/default	0	
4690634	300241429166	Spec phazym 180mg Soft Gel 60+2 80ct	1	Неклассифицированные/default	0	
4690635	078300089728	Spec playtex gld Deo reg w/ppc 20ct	1	Неклассифицированные/default	304899	Playtex
4690636	018515242242	Spec pls wht thpst coffee drink 3.5oz	1	Неклассифицированные/default	0	
4690637	310158034308	Spec polident ovrnt/cmfrt se 102ct	1	Неклассифицированные/default	0	
4690638	305732868851	Spec prep h Max crm/4 fr wipe 1ct	1	Неклассифицированные/default	0	
4690639	037000428497	Spec prilosec 14ct w/fuji ca 16ct	1	Неклассифицированные/default	0	
4690640	037000445906	Spec prilosec 14ct w/fuji ca 16ct 1ct	1	Неклассифицированные/default	0	
4690641	037000038399	Spec prt pls shm+med cnd bns 32.2oz	1	Неклассифицированные/default	0	
4690642	037000038412	Spec prt pls shm+med cnd bns 32.2oz #2	1	Неклассифицированные/default	0	
4690643	037000038405	Spec prt pls shmp pls lte cnd 32.2oz	1	Неклассифицированные/default	0	
4690644	036602302143	Spec ricola sf 1ct	1	Неклассифицированные/default	0	
4690646	021130784905	Spec safeway fish Oil Gel banded 60ct	1	Неклассифицированные/default	0	
1597785	012547852721	Spec schick intuition norm sknbonu 1ct	1105	Гигиена (folder)/Средства для бритья	16988	Schick
4690650	012547852738	Spec schick intuition sens/d 1ct	1	Неклассифицированные/default	0	
4690649	012547851281	Spec schick xtreme 3 dsp rz4+2 6ct	1	Неклассифицированные/default	0	
4690648	012547851311	Spec schick xtreme 3 wmns 4+2 6ct	1	Неклассифицированные/default	0	
4690651	020525118752	Spec schiff move free 1ct	1	Неклассифицированные/default	0	
4690652	020525118882	Spec schiff move free 1ct 8ct	1	Неклассифицированные/default	0	
4690653	037000039631	Spec scope citrus-crest + wht 1l	1	Неклассифицированные/default	0	
4690654	037000421900	Spec scope peppermint mouthwsh 33.8floz	1	Неклассифицированные/default	0	
4690655	037000025238	Spec scrt plat sft solid 1ct	1	Неклассифицированные/default	0	
1599543	037000025320	Spec scrt skn rwnl Deo sft s 2.6oz	1	Неклассифицированные/default	6297	Secret
4690656	071641571686	Spec sdfd uniball jetstrm pen 1ct	1	Неклассифицированные/default	0	
4690657	071641275379	Spec sdfd vsbt 5ct mech pen 1ct	1	Неклассифицированные/default	0	
4690658	319810051141	Spec sea breze sens bns sze 16floz	1	Неклассифицированные/default	0	
4690659	037000118503	Spec Secret plat a/p Deo 5.2oz	1	Неклассифицированные/default	6297	Secret
4690660	037000071815	Spec Secret plat Deo Gel 2.7oz	1	Неклассифицированные/default	6297	Secret
4690661	037000118510	Spec Secret plat&olay a/p Deo 5.2oz	1	Неклассифицированные/default	6297	Secret
4690662	037000118527	Spec Secret Platinum a/p Deo 5.2oz	1	Неклассифицированные/default	6297	Secret
4690663	037000040163	Spec Secret pp clr Gel trop 2.7oz	1	Неклассифицированные/default	6297	Secret
4690664	037000443551	Spec Secret Shower Fresh Deo 2.6oz	1	Неклассифицированные/default	6297	Secret
4690665	310158077916	Spec sensodyne Original33% b 5.5oz	1	Неклассифицированные/default	18573	Sensodyne
4690666	021130891689	Spec sfway slct batteries AA 10ct	1	Неклассифицированные/default	0	
4690667	381370009764	Spec Shower to Shower Fresh Powder 9oz	1	Неклассифицированные/default	0	
4690668	381370009771	Spec Shower to Shower mornfrsh pw 9oz	1	Неклассифицированные/default	0	
4690669	045893081439	Spec shp/cond Coconut 2ct	1	Неклассифицированные/default	0	
4690670	045893103292	Spec shp/cond Coconut 2ct 6ct	1	Неклассифицированные/default	0	
4690671	045893081446	Spec shp/cond Lavender 2ct	1	Неклассифицированные/default	0	
4690672	045893104008	Spec shp/cond Lavender 2ct 6ct	1	Неклассифицированные/default	0	
4690673	046500159831	Spec skintimate shave Gel 9.3oz	1	Неклассифицированные/default	0	
4690674	046500159855	Spec skintimate shave Gel ult 9.3oz	1	Неклассифицированные/default	0	
4690675	046500625428	Spec skintimate sig glstn pea 9.3oz	1	Неклассифицированные/default	0	
4690676	046500159848	Spec skntmate shve Gel Lavender 9.3oz	1	Неклассифицированные/default	0	
4690677	046500130496	Spec skntmte citrus aromathp 9.3oz	1	Неклассифицированные/default	0	
1607245	046500625466	Spec skntmte shave Gel mln brst 9.3oz	1	Неклассифицированные/default	2506138	Skintimate
4690678	603084264384	Spec sleek&Shine shpoo w/Gel 13floz	1	Неклассифицированные/default	0	
4690679	083462096446	Spec slim fast optima meal bar 6+2fr bp 8ct	1	Неклассифицированные/default	0	
4690680	083462676204	Spec slim fast optima rtd 6+2 fr 1/3p b 88oz	1	Неклассифицированные/default	0	
4690681	071641571730	Spec sndfd acnt retrcr highlt 2ct	1	Неклассифицированные/default	0	
4690682	071641571594	Spec sndfd Dry Line correctio 1ct	1	Неклассифицированные/default	0	
4690683	075486600037	Spec sprt sunblk spray spf30+ 7.9floz	1	Неклассифицированные/default	0	
4690684	380040734005	Spec stayfree reg 33% free 32ct	1	Неклассифицированные/default	0	
4690685	380040733008	Spec stayfree Super 33%free 32ct	1	Неклассифицированные/default	0	
4690686	380040732001	Spec stayfree Ultra thin Max 24ct	1	Неклассифицированные/default	0	
4690688	052105900068	Spec suave Aloe Lotion 1ct	1	Неклассифицированные/default	0	
4690689	079400905208	Spec suave Aloe Vera Conditioner 27.00 fo 6ct	1	Неклассифицированные/default	656402	SUAVE
1618296	079400856302	Spec suave Aloe Vera Conditioner 27floz	1	Неклассифицированные/default	656402	SUAVE
4690690	079400905307	Spec suave Aloe Vera Shampoo 27.00 fo 6ct	1	Неклассифицированные/default	656402	SUAVE
4690691	079400855305	Spec suave Aloe Vera Shampoo 27floz	1	Неклассифицированные/default	656402	SUAVE
4690692	079400841360	Spec suave Aroma shmp ref 25 18.10oz 6ct	1	Неклассифицированные/default	656402	SUAVE
4690693	079400841308	Spec suave Aroma shmp ref 25 18.1oz	1	Неклассифицированные/default	656402	SUAVE
4690694	079400753663	Spec suave awapuhi condition 18.10 fo 6ct	1	Неклассифицированные/default	656402	SUAVE
4690695	079400753601	Spec suave awapuhi condition 18.1floz	1	Неклассифицированные/default	656402	SUAVE
4690696	079400914903	Spec suave citrus smoothie s 18floz	1	Неклассифицированные/default	656402	SUAVE
4690697	079400905505	Spec suave daily clarify sh 27.00 fo 6ct	1	Неклассифицированные/default	656402	SUAVE
4690698	079400855404	Spec suave daily clarify sh 27floz	1	Неклассифицированные/default	656402	SUAVE
4690699	079400961600	Spec suave jucy grn Apple co 27floz	1	Неклассифицированные/default	656402	SUAVE
4690700	079400961501	Spec suave jucy grn Apple sh 27floz	1	Неклассифицированные/default	656402	SUAVE
4690701	079400890306	Spec suave kids chrry 2in1 b 14.5oz	1	Неклассифицированные/default	656402	SUAVE
4690702	305210662001	Spec suave ltn Powder Fresh 22.50 fo 6ct	1	Неклассифицированные/default	656402	SUAVE
4690703	305210409002	Spec suave ltn Powder Fresh 22.5floz	1	Неклассифицированные/default	656402	SUAVE
4690704	079400915306	Spec suave Milk&Honey cond 18floz	1	Неклассифицированные/default	656402	SUAVE
4690705	079400915207	Spec suave Milk&Honey shmp 18floz	1	Неклассифицированные/default	656402	SUAVE
4690706	079400906106	Spec suave mtn strawberry sh 27floz	1	Неклассифицированные/default	656402	SUAVE
4690707	079400753960	Spec suave prof cond biobasi 18.1floz	1	Неклассифицированные/default	656402	SUAVE
4690708	079400808363	Spec suave prof cond humectan 18.1oz	1	Неклассифицированные/default	656402	SUAVE
4690709	079400752765	Spec suave prof shp humectant 18.1floz	1	Неклассифицированные/default	656402	SUAVE
4690710	045893081415	Spec suave sch/cond strawber 2ct	1	Неклассифицированные/default	656402	SUAVE
4690711	045893103285	Spec suave sch/cond strawber 2ct 6ct	1	Неклассифицированные/default	656402	SUAVE
4690712	045893081200	Spec suave sh/cond Green app 2ct	1	Неклассифицированные/default	656402	SUAVE
4690713	045893104022	Spec suave sh/cond Green app 2ct 6ct	1	Неклассифицированные/default	656402	SUAVE
4690714	079400905802	Spec suave trop Coconut cond 27.00 fo 6ct	1	Неклассифицированные/default	656402	SUAVE
4690715	079400856203	Spec suave trop Coconut cond 27floz	1	Неклассифицированные/default	656402	SUAVE
4690716	079400905901	Spec suave trop Coconut sham 27.00 fo 6ct	1	Неклассифицированные/default	656402	SUAVE
4690717	079400855206	Spec suave trop Coconut sham 27floz	1	Неклассифицированные/default	656402	SUAVE
4690718	046135114816	Spec sylvania 100w dblf m05 1ct	1	Неклассифицированные/default	0	
4690719	046135108587	Spec sylvania 40w dbllf m05 1ct	1	Неклассифицированные/default	0	
4690720	046135114793	Spec sylvania 60w dbllf m05 1ct	1	Неклассифицированные/default	0	
4690721	046135151798	Spec sylvania 65w buy 1g 1fre 2ct	1	Неклассифицированные/default	0	
4690722	300030813503	Spec t	1	Неклассифицированные/default	0	
4690723	300030841506	Spec t #2	1	Неклассифицированные/default	0	
4690724	300030848116	Spec t #3	1	Неклассифицированные/default	0	
4690725	073010005082	Spec Tampax prl mult scntd/lnr 36ct	278661	Гигиена (folder)/Тампоны женские	15602	Tampax
4690726	073010005068	Spec Tampax prl mult unscnt/lnr* 36ct	278661	Гигиена (folder)/Тампоны женские	15602	Tampax
4690727	073010005570	Spec Tampax tpns reg w/liners 40ct	278661	Гигиена (folder)/Тампоны женские	15602	Tampax
4690728	073010005600	Spec Tampax tpns Super w/liner 40ct	278661	Гигиена (folder)/Тампоны женские	15602	Tampax
4690729	036800102033	Spec tc Gold antibacterial soap 64oz	1	Неклассифицированные/default	0	
4690731	079400088901	Spec thrmslk cond most w/f s 25.4oz	1	Неклассифицированные/default	0	
4690732	300450444127	Spec tlnl es cl cplt 100+25 b 125ct	1	Неклассифицированные/default	0	
4690735	022400649498	Spec tresemme Conditioner mstre ric 40oz	1	Неклассифицированные/default	203688	Tresemme
4690736	022400649450	Spec tresemme deep cond 40oz	1	Неклассифицированные/default	203688	Tresemme
4690737	022400621593	Spec tresemme hy sh/cnd gnt 14oz	1	Неклассифицированные/default	203688	Tresemme
4690740	022400649429	Spec tresemme nat vitamin a c E shm* 40floz	1	Неклассифицированные/default	0	
4690733	022400649580	Spec tresemme provit b5Al cnd 32 48oz	1	Неклассифицированные/default	0	
4690738	022400649405	Spec tresemme shmp deep clean 40floz	1	Неклассифицированные/default	203688	Tresemme
4690734	022400649566	Spec tresemme vitamin E moist Rich c 48oz	1	Неклассифицированные/default	0	
4690741	022400649443	Spec tresemme vitamin E moist Shampoo 40oz	1	Неклассифицированные/default	0	
4690739	066746377202	Spec trimspa x32 bonus pk 90ct	1	Неклассифицированные/default	0	
1655123	049832551298	Spec Turkey zz619	1	Неклассифицированные/default	0	
4690743	045893021220	Spec vasline in Care ltn/ren 31.8floz	1	Неклассифицированные/default	0	
4690744	305213325002	Spec vic hand/Body Care 14.30 fo 6ct	1	Неклассифицированные/default	0	
4690745	045893050671	Spec vicl advnc heal+ttl mois 31.3oz	1	Неклассифицированные/default	0	
4690746	045893050688	Spec vicl Aloe Cool+ttl mois 31.3oz	1	Неклассифицированные/default	0	
4690747	305214315002	Spec vicl Lotion advanced he 17.7oz	1	Неклассифицированные/default	0	
4690748	305214316009	Spec vicl Lotion Aloe Cool&17.7oz	1	Неклассифицированные/default	0	
4690749	305214317006	Spec vicl Lotion renew&Pro 17.7oz	1	Неклассифицированные/default	0	
4690750	045893050664	Spec vicl ttl moist+ttl mois 31.3oz	1	Неклассифицированные/default	0	
4690751	074300004686	Spec visine v 30% more fre 1ct	1	Неклассифицированные/default	0	
4690752	312547521666	Spec vnll-mint listerine w/wh 1l 6ct	1	Неклассифицированные/default	0	
1648618	365632803079	Spec White rain Apple blosm shp bns s 19.95oz	1	Неклассифицированные/default	668768	White Rain
1648548	365632803086	Spec White rain Apple blossom cond bn 19.95oz	1	Неклассифицированные/default	668768	White Rain
1648568	365632800566	Spec White rain ctrsshampoobonu 19.95oz	1	Неклассифицированные/default	668768	White Rain
4690753	365632801143	Spec White rain enrch sunflower cond b 19.95floz	1	Неклассифицированные/default	668768	White Rain
1651509	365632800597	Spec White rain lav van cond bns sz 19.95oz	1	Неклассифицированные/default	668768	White Rain
1651510	365632800580	Spec White rain lav van shmp bns sz 19.95oz	1	Неклассифицированные/default	668768	White Rain
1651485	365632800658	Spec White rain nat pearberry cond 19.95floz	1	Неклассифицированные/default	668768	White Rain
4690754	365632800764	Spec White rain pass flwr cnd bns sz 19.95oz	1	Неклассифицированные/default	668768	White Rain
4690755	365632800757	Spec White rain pass flwr shm bns sz 19.95oz	1	Неклассифицированные/default	668768	White Rain
4690756	365632803109	Spec White rain trop coco cnd bns sz 19.95oz	1	Неклассифицированные/default	668768	White Rain
1648596	365632800542	Spec White rain xtra Body bns 19.95oz	1	Неклассифицированные/default	668768	White Rain
4690757	094805040286	Spec x baileys cocoa mug set 1ct	1	Неклассифицированные/default	0	
4690758	094805040354	Spec x baileys stacking mug 1ct	1	Неклассифицированные/default	0	
4690759	094805040323	Spec x bhg recipe Box gift se 1ct	1	Неклассифицированные/default	0	
4690760	094805040309	Spec x budweiser stein w snac 1ct	1	Неклассифицированные/default	0	
4690761	094805039297	Spec x ghirardelli 2 mug coco 1ct	1	Неклассифицированные/default	0	
4690762	094805039600	Spec x ghirardelli 3 Box towe 1ct	1	Неклассифицированные/default	0	
4690763	094805040316	Spec x hrshy cocao mug 1ct	1	Неклассифицированные/default	0	
4690764	094805040361	Spec x hstn Cafe mug lndt cho 2.1floz	1	Неклассифицированные/default	0	
4690765	094805040279	Spec x Nestle cocoa pot w Mix 1ct	1	Неклассифицированные/default	0	
4690766	027084332520	Spec x puzzle scrmblrs assort 1ct	1	Неклассифицированные/default	0	
4690767	079400900500	Spec xtra vlm cond w/bar soa 12oz	1	Неклассифицированные/default	0	
3214450	726093777369	Spec's select, chocolate mixed nuts	330591	Продукты питания (folder)/Продукты питания	0	
3214451	726093777352	Spec's select, cinnaberry Blend	330591	Продукты питания (folder)/Продукты питания	0	
3214452	726093777154	Spec's select, spicy Club Mix	330591	Продукты питания (folder)/Продукты питания	0	
3214453	726093777246	Spec's select, wasabi peas	330591	Продукты питания (folder)/Продукты питания	0	
1613330	4806517700084	Spec-ace tab 25mg	1	Неклассифицированные/default	0	
883471	082360505166	Spec-ctr 54035-g	1	Неклассифицированные/default	0	
4690975	086947147749	Spec-ops de luxe combat knife boys no size	1	Неклассифицированные/default	0	
4690976	086947148494	Spec-ops de luxe combat knife&holster boys no size	1	Неклассифицированные/default	0	
4690977	086947148470	Spec-ops laser cannon and holster boys no size	1	Неклассифицированные/default	0	
4690978	086947148487	Spec-ops rapid fire bolter&holster boys no size	1	Неклассифицированные/default	0	
4690982	300030813510	Spec-t 16	1	Неклассифицированные/default	0	
4690768	073360506611	Spec. exp Light	1	Неклассифицированные/default	0	
4690770	800216002979	Spec.-ops. sling 101 m4	1	Неклассифицированные/default	0	
883463	082360501410	Spec.ctr 54001-d	1	Неклассифицированные/default	0	
883464	082360502264	Spec.ctr 54001-m	1	Неклассифицированные/default	0	
883465	082360502332	Spec.ctr 54001-n	1	Неклассифицированные/default	0	
883466	082360502882	Spec.ctr 54018-a	1	Неклассифицированные/default	0	
883467	082360503636	Spec.ctr 54018-j	1	Неклассифицированные/default	0	
883468	082360503704	Spec.ctr 54018-k	1	Неклассифицированные/default	0	
883469	082360504930	Spec.ctr 54035-e	1	Неклассифицированные/default	0	
883470	082360505098	Spec.ctr 54035-f	1	Неклассифицированные/default	0	
883472	082360505234	Spec.ctr 54035-h	1	Неклассифицированные/default	0	
1138645	571058908773	Spec.jel coupon $1.00	1	Неклассифицированные/default	0	
4690772	681131175593	Specail Kitty premium Cat Food	1	Неклассифицированные/default	0	
2396110	8028997004476	Specchio Da borsetta Bella	1	Неклассифицированные/default	0	
2396111	8028997304347	Specchio Da borsetta Bella quadrato	1	Неклассифицированные/default	0	
4690775	030519405485	Speceo technololies vl648irvf cctv camera	1	Неклассифицированные/default	0	
2836151	3760197880133	Specht Grand cru mandel rielsing 6% 750l	1	Неклассифицированные/default	0	
4690776	8594825001790	Speci??ln?? prost??edek na o??et??en?? a ??i??t??n?? n??bydku 300ml	1	Неклассифицированные/default	0	
1782570	4607171671556	Specia фирма sota для выпечки d-24cm	2420630	Посуда (folder)/Посуда кухонная	3754104	SPECIA
1613331	705432002911	Special	1	Неклассифицированные/default	0	
653843	022735500167	Special achievement award	1	Неклассифицированные/default	0	
1993421	671241073896	Special affair Red o/s couples	1980175	Adult/Lingerie	0	
4690777	089218487094	Special Agent (DVD)	1	Неклассифицированные/default	0	
1613332	061541083334	Special Agent set	1	Неклассифицированные/default	0	
653844	022735620797	Special award	1	Неклассифицированные/default	0	
3214332	084533535512	Special barbecue sauce	330591	Продукты питания (folder)/Продукты питания	0	
418531	4013356236876	Special bebe стир. вода для глажения детск белья 1л	1	Неклассифицированные/default	0	
1613333	5026309001727	Special birthday wishes	1	Неклассифицированные/default	0	
623247	02895224	Special Blend	116798	Табакокурение (folder)/Сигареты	195341	Marlboro
4690778	051933294851	Special Blend #2	1	Неклассифицированные/default	0	
3214333	015166011555	Special Blend chicken sausage	330591	Продукты питания (folder)/Продукты питания	0	
4690779	051933174603	Special Blend Food for cats - chicken cuts in gravey 5.5oz	1	Неклассифицированные/default	0	
4690780	639001432277	Special Blend Orange jucie 32floz	1	Неклассифицированные/default	0	
3214334	084971234008	Special Blend taco sauce	330591	Продукты питания (folder)/Продукты питания	0	
3214335	092825014102	Special Blend trail Mix	330591	Продукты питания (folder)/Продукты питания	0	
3214336	077890328033	Special blends Baby Blue salad kit	330591	Продукты питания (folder)/Продукты питания	3002056	Wegmans
3214338	077890382097	Special blends grilled vegetables #2	330591	Продукты питания (folder)/Продукты питания	3002056	Wegmans
3214339	077890367940	Special blends italian chopped salad kit	330591	Продукты питания (folder)/Продукты питания	3002056	Wegmans
3214340	077890415443	Special blends petite brussels sprouts	330591	Продукты питания (folder)/Продукты питания	3002056	Wegmans
