ID	UPCEAN	Name	CategoryID	CategoryName	BrandID	BrandName
3792014	8002915002485	Вино tos.прос.иг.бел брют 11% 750мл+2бок.	296061	Продукты питания (folder)/Алкогольные напитки/Вино (folder)/Вино игристое	3792013	toso
3285333	4001432027036	Вино toscanello Chardonnay белое полусухое 11.5% 750мл ст/б	22133	Продукты питания (folder)/Алкогольные напитки/Вино (folder)/Вино	0	
3285334	8021376702239	Вино toscano rosso красное сухое 12% 750мл	22133	Продукты питания (folder)/Алкогольные напитки/Вино (folder)/Вино	0	
1759936	7791670003752	Вино toso Chardonnay бел сух 750мл	22133	Продукты питания (folder)/Алкогольные напитки/Вино (folder)/Вино	3792013	toso
3792015	7791670022555	Вино toso Chardonnay бел сух 750мл #2	22133	Продукты питания (folder)/Алкогольные напитки/Вино (folder)/Вино	3792013	toso
1191697	8002915010008	Вино toso gavi 2008 бел сух 750мл (с ндс-119.21)	22133	Продукты питания (folder)/Алкогольные напитки/Вино (folder)/Вино	0	
1759937	7791670003462	Вино toso Malbec/bonar. красн сух 750мл	22133	Продукты питания (folder)/Алкогольные напитки/Вино (folder)/Вино	3792013	toso
3792016	7791670015410	Вино toso Malbec/bonar. красн сух 750мл #2	22133	Продукты питания (folder)/Алкогольные напитки/Вино (folder)/Вино	3792013	toso
3792017	7791670022524	Вино toso sangiovese красн сух 750мл	22133	Продукты питания (folder)/Алкогольные напитки/Вино (folder)/Вино	3792013	toso
3792018	7791670022517	Вино toso tempranillo красн сух 750мл	22133	Продукты питания (folder)/Алкогольные напитки/Вино (folder)/Вино	3792013	toso
3792019	7791670022531	Вино toso torrontes бел сух 13% 750мл	22133	Продукты питания (folder)/Алкогольные напитки/Вино (folder)/Вино	3792013	toso
46597	7791670019234	Вино toso torrontes, сухое белое, 13%, 750мл ст/б	282251	Продукты питания (folder)/Алкогольные напитки/Вино (folder)/Вина Аргентины	46593	ТОСО
46596	7791670019210	Вино toso, tempranillo, сухое красное, 12.5%, 750мл ст/б	282251	Продукты питания (folder)/Алкогольные напитки/Вино (folder)/Вина Аргентины	46593	ТОСО
3285335	5901064774041	Вино totino лайм травяное 14.5% 500мл ст/б	22133	Продукты питания (folder)/Алкогольные напитки/Вино (folder)/Вино	0	
3285336	5901064764509	Вино totino оранж сладкое 14.5% 1л ст/б	22133	Продукты питания (folder)/Алкогольные напитки/Вино (folder)/Вино	3762392	TOTINO
1957977	5901064764257	Вино totino персик белое спец 14.5% tetrapak 1л	22446	Продукты питания (folder)/Алкогольные напитки/Вино (folder)/Вермут	0	
1660185	5901064000270	Вино totino россо сладкое 14.5% 1л ст/б	22133	Продукты питания (folder)/Алкогольные напитки/Вино (folder)/Вино	3762392	TOTINO
1957978	5901064764400	Вино totino тропикал розовое сладкое 14.5% 1л ст/б	22446	Продукты питания (folder)/Алкогольные напитки/Вино (folder)/Вермут	0	
1191699	3540528600087	Вино tour de mandelotte bordeaux белое 12.5% 750мл	22133	Продукты питания (folder)/Алкогольные напитки/Вино (folder)/Вино	0	
1191700	3540528600063	Вино tour de mandelotte bordeaux красное 12.5% 750мл	22133	Продукты питания (folder)/Алкогольные напитки/Вино (folder)/Вино	0	
1472477	020886001168	Вино tour de mandelotte бордо бел полусладк 750мл	1	Неклассифицированные/default	3792020	Tour de Mandelotte
3792021	020886003162	Вино tour de mandelotte бордо бел полусладк 750мл #2	22133	Продукты питания (folder)/Алкогольные напитки/Вино (folder)/Вино	3792020	Tour de Mandelotte
3792022	3251091001552	Вино tour de mandelotte бордо бел сух 750мл	22133	Продукты питания (folder)/Алкогольные напитки/Вино (folder)/Вино	3792020	Tour de Mandelotte
1760255	043055606049	Вино tour de mandelotte бордо красн сух 750мл	22133	Продукты питания (folder)/Алкогольные напитки/Вино (folder)/Вино	3792020	Tour de Mandelotte
3792023	097958008165	Вино tour de mandelotte бордо красн сух 750мл #2	22133	Продукты питания (folder)/Алкогольные напитки/Вино (folder)/Вино	3792020	Tour de Mandelotte
3792024	097958008172	Вино tour de mandelotte бордо красн сух 750мл #3	22133	Продукты питания (folder)/Алкогольные напитки/Вино (folder)/Вино	3792020	Tour de Mandelotte
1194480	3540528600094	Вино tour de mandelotte медок 12.5% крас. сух 750мл (Франция)	22133	Продукты питания (folder)/Алкогольные напитки/Вино (folder)/Вино	0	
3285337	3295890166975	Вино tour des pierres bordeaux сухое белое 12% 750мл стекло	22133	Продукты питания (folder)/Алкогольные напитки/Вино (folder)/Вино	0	
3285338	3295890166968	Вино tour des pierres bordeaux сухое красное 12.5 750мл стекло	22133	Продукты питания (folder)/Алкогольные напитки/Вино (folder)/Вино	0	
3285339	3021891001935	Вино tour du roi, белое полусладк 10.5%, tetrapak 1л	22133	Продукты питания (folder)/Алкогольные напитки/Вино (folder)/Вино	0	
3285340	3021891001942	Вино tour du roi, красное полусладк 11%, tetrapak 1л	22133	Продукты питания (folder)/Алкогольные напитки/Вино (folder)/Вино	0	
283431	3120581367013	Вино tour du vosc Cabernet Sauvignon красн сух 750мл 12.5% /Франция/	22133	Продукты питания (folder)/Алкогольные напитки/Вино (folder)/Вино	0	
283432	3120581366375	Вино tour du vosc cuvee Prestige столов белое п/с 10.5% 750мл с/б	22133	Продукты питания (folder)/Алкогольные напитки/Вино (folder)/Вино	3792025	tour du vosc
283434	3120581366313	Вино tour du vosc cuvee Престиж красн полусладк 750мл 10.5% /Франция/	22133	Продукты питания (folder)/Алкогольные напитки/Вино (folder)/Вино	0	
283435	3120581366344	Вино tour du vosc cuvee Престиж красн сух 750мл 11% /Франция/	22133	Продукты питания (folder)/Алкогольные напитки/Вино (folder)/Вино	3794532	ТУР ДЮ ВОСК
283436	3120581367044	Вино tour du vosc Merlot красн сух 750мл 12.5% /Франция/	22133	Продукты питания (folder)/Алкогольные напитки/Вино (folder)/Вино	0	
1759938	3760078210370	Вино tour-amb.roug.с.к12% 750мл	41821	Продукты питания (folder)/Алкогольные напитки/Вино (folder)/Вина Франции	0	
3285341	3260570100013	Вино touraine La tinotiere 2011 сухое розовое 12% 750мл ст/б	22133	Продукты питания (folder)/Алкогольные напитки/Вино (folder)/Вино	0	
3285342	4605883005423	Вино traditionelle duftend столов полусладк белое 11% tetrapak 2л	22133	Продукты питания (folder)/Алкогольные напитки/Вино (folder)/Вино	0	
3285343	4605883005430	Вино traditionelle exquisite столов полусладк белое 11% tetrapak 2л	22133	Продукты питания (folder)/Алкогольные напитки/Вино (folder)/Вино	0	
171233	3800127861464	Вино trakia Chardonnay столов красное п сл 12% 750мл Болгария	1759169	Продукты питания (folder)/Алкогольные напитки/Вино (folder)/Вина Болгарии	0	
171231	3800127862461	Вино trakia мускат столов белое полусладк 12% 750мл	1759169	Продукты питания (folder)/Алкогольные напитки/Вино (folder)/Вина Болгарии	0	
2262383	8013365037002	Вино tramin Chardonnay alto adige док 750мл 13.0%, сухое	22470	Продукты питания (folder)/Алкогольные напитки/Вино (folder)/Вина Италии	0	
2262382	8013365103752	Вино tramin Chardonnay alto adige док, 0.375л, 13.0%, сухое	22470	Продукты питания (folder)/Алкогольные напитки/Вино (folder)/Вина Италии	0	
691108	8013365137009	Вино tramin Merlot alto adige красн сух 750мл	22470	Продукты питания (folder)/Алкогольные напитки/Вино (folder)/Вина Италии	691106	Трамин
2262377	8013365187004	Вино tramin Sauvignon alto adige док 750мл 13.0%, сухое	22470	Продукты питания (folder)/Алкогольные напитки/Вино (folder)/Вина Италии	0	
2262373	8013365157007	Вино tramin лагрейн alto adige док 750мл 14.0%, сухое	22470	Продукты питания (folder)/Алкогольные напитки/Вино (folder)/Вина Италии	0	
691110	8013365067009	Вино tramin мюллер-тургау alto adige бел сух 750мл	22470	Продукты питания (folder)/Алкогольные напитки/Вино (folder)/Вина Италии	691106	Трамин
2262374	8013365297000	Вино tramin нюссбаумер гевюрцтраминер док 750мл 13.0%, полусухое	22470	Продукты питания (folder)/Алкогольные напитки/Вино (folder)/Вина Италии	3793851	NUSSBAUM
691111	8013365347002	Вино tramin пино гриджио alto adige бел сух 750мл	22470	Продукты питания (folder)/Алкогольные напитки/Вино (folder)/Вина Италии	691106	Трамин
2262375	8013365343707	Вино tramin пино гриджио alto adige док, 0.375л, 13.0%, сухое	22470	Продукты питания (folder)/Алкогольные напитки/Вино (folder)/Вина Италии	0	
2262378	8013365237006	Вино tramin стоан alto adige док 750мл 13.0%, сухое	22470	Продукты питания (folder)/Алкогольные напитки/Вино (folder)/Вина Италии	0	
2262379	8013365357001	Вино tramin т россо доломити ижт 750мл 14.0%, сухое	22470	Продукты питания (folder)/Алкогольные напитки/Вино (folder)/Вина Италии	0	
2262380	8013365217008	Вино tramin т'бьянко доломити ижт 750мл 13.0%, сухое	22470	Продукты питания (folder)/Алкогольные напитки/Вино (folder)/Вина Италии	0	
2262381	8013365267003	Вино tramin урбан лагрейн док 750мл 14.0%, сухое	22470	Продукты питания (folder)/Алкогольные напитки/Вино (folder)/Вина Италии	3794541	УРБАН ЛАГРЕЙН
3291741	4600068009487	Вино traminer 750мл 12% бел сух Россия	22133	Продукты питания (folder)/Алкогольные напитки/Вино (folder)/Вино	0	
283423	8006031071318	Вино traminer ароматико симболи бел сух 750мл	22470	Продукты питания (folder)/Алкогольные напитки/Вино (folder)/Вина Италии	22473	Casa Girelli
2855000	4605883001364	Вино traminer аттика бел/полусладк 750мл	22133	Продукты питания (folder)/Алкогольные напитки/Вино (folder)/Вино	0	
1660187	4600632040441	Вино traminer бел полусладк 0.75 11.5%	22133	Продукты питания (folder)/Алкогольные напитки/Вино (folder)/Вино	0	
283425	4600068009319	Вино traminer бел полусладк 700мл /очаково/	22133	Продукты питания (folder)/Алкогольные напитки/Вино (folder)/Вино	0	
2855001	4840267002012	Вино traminer бел/пд 16% 750мл	22133	Продукты питания (folder)/Алкогольные напитки/Вино (folder)/Вино	0	
3794512	4680020411534	Вино traminer джаз трио кон.б.полусладк 750мл	22133	Продукты питания (folder)/Алкогольные напитки/Вино (folder)/Вино	0	
3291742	4820004924043	Вино traminer коблево белое сухое 11% 750мл стбут	22133	Продукты питания (folder)/Алкогольные напитки/Вино (folder)/Вино	0	
2427199	4840267001763	Вино traminer крикова акорекс бел сух 13% 750мл	22133	Продукты питания (folder)/Алкогольные напитки/Вино (folder)/Вино	0	
151706	3800082205006	Вино traminer Премиум риком бел сух 12.5% 750мл	1759169	Продукты питания (folder)/Алкогольные напитки/Вино (folder)/Вина Болгарии	150392	РИКОМ 42
3291743	4630017431960	Вино traminer столов белое полусладк 12.5% 750мл стекло	22133	Продукты питания (folder)/Алкогольные напитки/Вино (folder)/Вино	0	
1195594	8070920040181	Вино traminer фриули аквилеа ca bolani 2002 белое 750мл	22133	Продукты питания (folder)/Алкогольные напитки/Вино (folder)/Вино	0	
3291744	4607062867044	Вино traminer шато тамань белое полусухое 12.5% 750мл	22133	Продукты питания (folder)/Алкогольные напитки/Вино (folder)/Вино	0	
1195595	4607062865699	Вино traminer шато тамань спец 16.5% 750мл	22133	Продукты питания (folder)/Алкогольные напитки/Вино (folder)/Вино	690275	Кубань-Вино
3285344	8437006281638	Вино tramuz rivera Del duero красное сухое 13.5% 750мл стбут	22133	Продукты питания (folder)/Алкогольные напитки/Вино (folder)/Вино	0	
3285345	8003295005752	Вино tratoria italiana Chardonnay белое сухое 12% 750мл ст/б	22133	Продукты питания (folder)/Алкогольные напитки/Вино (folder)/Вино	0	
1759941	8410492002697	Вино trencav. красн сух 12% 750мл	22133	Продукты питания (folder)/Алкогольные напитки/Вино (folder)/Вино	0	
1759939	8410492002727	Вино trencav.б.полусладк 11.5% 750мл	22133	Продукты питания (folder)/Алкогольные напитки/Вино (folder)/Вино	0	
1759940	8410492002703	Вино trencav.к.полусладк 11.5% 750мл	22133	Продукты питания (folder)/Алкогольные напитки/Вино (folder)/Вино	0	
2855010	4690491055663	Вино trimbach gewurztraminer бел п/ сух 750мл/эльзас #2	22133	Продукты питания (folder)/Алкогольные напитки/Вино (folder)/Вино	3792026	TRIMBACH
3792027	4690491015636	Вино trimbach gewurztraminer эльз.б.п/ сух 750мл	22133	Продукты питания (folder)/Алкогольные напитки/Вино (folder)/Вино	3792026	TRIMBACH
3792028	4690491023730	Вино trimbach gewurztraminer эльз.б.п/ сух 750мл #2	22133	Продукты питания (folder)/Алкогольные напитки/Вино (folder)/Вино	3792026	TRIMBACH
3792029	4690491039526	Вино trimbach gewurztraminer эльз.б.п/ сух 750мл #3	22133	Продукты питания (folder)/Алкогольные напитки/Вино (folder)/Вино	3792026	TRIMBACH
3792030	4690491050552	Вино trimbach gewurztraminer эльз.б.п/ сух 750мл #4	22133	Продукты питания (folder)/Алкогольные напитки/Вино (folder)/Вино	3792026	TRIMBACH
46621	087000311824	Вино trimbach мюска рез. бел сух 750мл/эльзас	41821	Продукты питания (folder)/Алкогольные напитки/Вино (folder)/Вина Франции	46618	Тримбах
1660189	4690491004784	Вино trimbach пино гри резерв бел п/ сух 750мл/эльзас	689475	Продукты питания (folder)/Алкогольные напитки/Вино (folder)/Вина Франции Эльзас	46618	Тримбах
1660190	4690491019269	Вино trimbach пино гри резерв бел п/ сух 750мл/эльзас #2	689475	Продукты питания (folder)/Алкогольные напитки/Вино (folder)/Вина Франции Эльзас	46618	Тримбах
1660191	4690491023747	Вино trimbach пино гри резерв бел п/ сух 750мл/эльзас #3	689475	Продукты питания (folder)/Алкогольные напитки/Вино (folder)/Вина Франции Эльзас	46618	Тримбах
2227421	4690491030356	Вино trimbach пино гри резерв бел п/ сух 750мл/эльзас #4	689475	Продукты питания (folder)/Алкогольные напитки/Вино (folder)/Вина Франции Эльзас	46618	Тримбах
1759942	8004300641644	Вино trinacr.sic.бел сух 12% 750мл	22133	Продукты питания (folder)/Алкогольные напитки/Вино (folder)/Вино	3792031	TRINACRIA
3792032	8004300673546	Вино trinacr.sic.бел сух 12% 750мл #2	22133	Продукты питания (folder)/Алкогольные напитки/Вино (folder)/Вино	3792031	TRINACRIA
46616	779803859077	Вино trivento Chardonnay торрон бел сух 13% 750мл	22133	Продукты питания (folder)/Алкогольные напитки/Вино (folder)/Вино	46614	Trivento
203781	7798039590779	Вино trivento mixtus Chardonnay торронтес белое полусухое 12.5% 750мл ст/б	22133	Продукты питания (folder)/Алкогольные напитки/Вино (folder)/Вино	46614	Trivento
46617	7798039590731	Вино trivento mixtus шираз мальбек красное полусухое 12.5% 750мл ст/б	22133	Продукты питания (folder)/Алкогольные напитки/Вино (folder)/Вино	46614	Trivento
203782	7798039590342	Вино trivento reserve Malbec oak barrel aged 750ml 13.5%vol	22133	Продукты питания (folder)/Алкогольные напитки/Вино (folder)/Вино	46614	Trivento
203783	7798039590762	Вино trivento sangiovese bonarda 750ml 12.5%vol	22133	Продукты питания (folder)/Алкогольные напитки/Вино (folder)/Вино	46614	Trivento
224302	3378481000855	Вино trn Sauvignon org lesmbrules 750ml	41821	Продукты питания (folder)/Алкогольные напитки/Вино (folder)/Вина Франции	0	
3285346	4605654008479	Вино trois vallees белое полусладк столов 11% 700мл стекло	22133	Продукты питания (folder)/Алкогольные напитки/Вино (folder)/Вино	0	
3285347	4605654008493	Вино trois vallees белое сухое столов 11% 700мл стекло	22133	Продукты питания (folder)/Алкогольные напитки/Вино (folder)/Вино	0	
3285348	4605654008509	Вино trois vallees красное сухое столов 11% 700мл стекло	22133	Продукты питания (folder)/Алкогольные напитки/Вино (folder)/Вино	0	
3285349	4605654008486	Вино trois vallees столов красное полусладк 11% 700мл ст/б	22133	Продукты питания (folder)/Алкогольные напитки/Вино (folder)/Вино	0	
151063	5201021641752	Вино tsantalis makedonikos бел сух 11.5% 750мл греция	22133	Продукты питания (folder)/Алкогольные напитки/Вино (folder)/Вино	46630	Tsantalis
151064	5201021661750	Вино tsantalis makedonikos розов псух 11.5% 750мл греция	22133	Продукты питания (folder)/Алкогольные напитки/Вино (folder)/Вино	46630	Tsantalis
151713	5201021714814	Вино tsantalis атлос грец. бел сух 750мл	22133	Продукты питания (folder)/Алкогольные напитки/Вино (folder)/Вино	46630	Tsantalis
151714	5201021713800	Вино tsantalis атлос грец. красн сух 11.5% 750мл	22133	Продукты питания (folder)/Алкогольные напитки/Вино (folder)/Вино	46630	Tsantalis
46631	5201021687750	Вино tsantalis гора афон кагор красн десертн 16% 750мл	22133	Продукты питания (folder)/Алкогольные напитки/Вино (folder)/Вино	46630	Tsantalis
150809	5201021611700	Вино tsantalis кава красн сух 12.5% 750мл греция	22133	Продукты питания (folder)/Алкогольные напитки/Вино (folder)/Вино	46630	Tsantalis
46632	5201021680706	Вино tsantalis мавр.патрас кагор красн п/дес.16% 750мл	22133	Продукты питания (folder)/Алкогольные напитки/Вино (folder)/Вино	46630	Tsantalis
151715	5201021711783	Вино tsantalis муза грец бел полусладк 11.5% 750мл	22133	Продукты питания (folder)/Алкогольные напитки/Вино (folder)/Вино	46630	Tsantalis
151716	5201021710779	Вино tsantalis муза грец. красн полусладк 11% 750мл	22133	Продукты питания (folder)/Алкогольные напитки/Вино (folder)/Вино	46630	Tsantalis
46633	5201021726015	Вино tsantalis мускат бел сух 12% 700мл	22133	Продукты питания (folder)/Алкогольные напитки/Вино (folder)/Вино	46630	Tsantalis
46634	5201021726213	Вино tsantalis мускат красн полусладк 12% 700мл	22133	Продукты питания (folder)/Алкогольные напитки/Вино (folder)/Вино	46630	Tsantalis
46636	5201021726114	Вино tsantalis мускат розов полусладк 12% 700мл	22133	Продукты питания (folder)/Алкогольные напитки/Вино (folder)/Вино	46630	Tsantalis
46637	5201021685503	Вино tsantalis мускат самос бел десерт 15% 500мл	22133	Продукты питания (folder)/Алкогольные напитки/Вино (folder)/Вино	46630	Tsantalis
151717	5201021712797	Вино tsantalis одиссей грец. красн полусладк 11% 750мл	22133	Продукты питания (folder)/Алкогольные напитки/Вино (folder)/Вино	46630	Tsantalis
691117	5201021670707	Вино tsantalis ретсина бел сух 11.5% 750мл (греция)	22133	Продукты питания (folder)/Алкогольные напитки/Вино (folder)/Вино	46630	Tsantalis
1759286	4860099001403	Вино tsinandali белое сухое 11-13% 750мл стекло	282274	Продукты питания (folder)/Алкогольные напитки/Вино (folder)/Вина Грузии	0	
3285350	4003301037467	Вино turmalke дорнфельдер полусладк розовое 10.5% 750мл ст/б	22133	Продукты питания (folder)/Алкогольные напитки/Вино (folder)/Вино	0	
691119	9331727010890	Вино two hands сэкси бист Cabernet Sauvignon красн сух 750мл	282286	Продукты питания (folder)/Алкогольные напитки/Вино (folder)/Вина Австралии	691118	Ту Хэндс
2227422	9331727015529	Вино two hands сэкси бист Cabernet Sauvignon красн сух 750мл #2	282286	Продукты питания (folder)/Алкогольные напитки/Вино (folder)/Вина Австралии	691118	Ту Хэндс
2227423	9331727015925	Вино two hands сэкси бист Cabernet Sauvignon красн сух 750мл #3	282286	Продукты питания (folder)/Алкогольные напитки/Вино (folder)/Вина Австралии	691118	Ту Хэндс
