ID	UPCEAN	Name	CategoryID	CategoryName	BrandID	BrandName
5032832	4626015503495	Мастерская олеси мустаевой. Lavender гель для душа лаванда, алоэ вера, ромашка, 280мл	1	Неклассифицированные/default	4978727	Мастерская Олеси Мустаевой
5032833	4626015502238	Мастерская олеси мустаевой. Lavender гель для лица очищающий алоэ вера, череда, лаванда, 140мл	1	Неклассифицированные/default	4978727	Мастерская Олеси Мустаевой
5032834	4626015502580	Мастерская олеси мустаевой. Lavender гель очищающий для интимной гигиены пребиотик басаболол лаванда, 45мл	1	Неклассифицированные/default	4978727	Мастерская Олеси Мустаевой
5032835	4626015503815	Мастерская олеси мустаевой. Lavender Крем для тела бисабол, пантенол и витамин f, 70мл	1	Неклассифицированные/default	4978727	Мастерская Олеси Мустаевой
5032836	4626015503648	Мастерская олеси мустаевой. Lavender тоник для лица минеральный комплекс, бисабол и серебро, 90мл	1	Неклассифицированные/default	4978727	Мастерская Олеси Мустаевой
5032837	4626015504959	Мастерская олеси мустаевой. Lavender шампунь-концентрат сера и аллантоин, 70г	1	Неклассифицированные/default	4978727	Мастерская Олеси Мустаевой
5032838	4626015503235	Мастерская олеси мустаевой. Lavender. гель очищающий для лица алоэ вера, череда, лаванда, 45г	1	Неклассифицированные/default	4978727	Мастерская Олеси Мустаевой
5032839	4626015502269	Мастерская олеси мустаевой. Lavender. Крем для лица бисаболол экстракт магнолии, 43мл	1	Неклассифицированные/default	4978727	Мастерская Олеси Мустаевой
5032840	4626015502535	Мастерская олеси мустаевой. Lavender. натуральное мыло, 60г	1	Неклассифицированные/default	4978727	Мастерская Олеси Мустаевой
5032841	4626015502139	Мастерская олеси мустаевой. Lavender. очищающий гель для интимной гигиены 170мл	1	Неклассифицированные/default	4978727	Мастерская Олеси Мустаевой
5032842	4626015506403	Мастерская олеси мустаевой. Rose гель для душа протеин шелка и масло розы, 270мл	1	Неклассифицированные/default	4978727	Мастерская Олеси Мустаевой
5032843	4626015502122	Мастерская олеси мустаевой. Rose гель для очищения кожи увлажняющий с пептидами, 170мл	1	Неклассифицированные/default	4978727	Мастерская Олеси Мустаевой
5032844	4626015506502	Мастерская олеси мустаевой. Rose кондиционер для волос масла арганы и макадамии, 120мл	1	Неклассифицированные/default	4978727	Мастерская Олеси Мустаевой
5032845	4626015502306	Мастерская олеси мустаевой. Rose Крем для лица с гиалуроновой кислотой и пептидами шелка, 43мл	1	Неклассифицированные/default	4978727	Мастерская Олеси Мустаевой
5032846	4626015502047	Мастерская олеси мустаевой. Rose Крем для тела увлажняющий с пептидами шелка, 120мл	1	Неклассифицированные/default	4978727	Мастерская Олеси Мустаевой
5032847	4626015502030	Мастерская олеси мустаевой. Rose маска для волос с шелком и аминокислотами, 120мл	1	Неклассифицированные/default	4978727	Мастерская Олеси Мустаевой
5032848	4626015501972	Мастерская олеси мустаевой. Rose очищающее гидрофильное масло с шелком и маслом розы, 70мл	1	Неклассифицированные/default	4978727	Мастерская Олеси Мустаевой
5032849	4626015501996	Мастерская олеси мустаевой. Rose скраб для тела с шелком и маслом розы, 250г	1	Неклассифицированные/default	4978727	Мастерская Олеси Мустаевой
5032850	4626015503655	Мастерская олеси мустаевой. Rose тоник для лица увлажняющий с гиалуроновой кислотой и шелком, 90мл	1	Неклассифицированные/default	4978727	Мастерская Олеси Мустаевой
5032851	4626015506465	Мастерская олеси мустаевой. Rose шампунь бессульфатный масло макадамии, протеин шелка, пантенол, 185мл	1	Неклассифицированные/default	4978727	Мастерская Олеси Мустаевой
5032852	4626015505277	Мастерская олеси мустаевой. Rose шампунь-концентрат с шелком и маслом розы, 70г	1	Неклассифицированные/default	4978727	Мастерская Олеси Мустаевой
5032853	4626015503501	Мастерская олеси мустаевой. Rose. гель для очищения кожи увлажняющий с шелком, 45мл	1	Неклассифицированные/default	4978727	Мастерская Олеси Мустаевой
5032854	4626015503822	Мастерская олеси мустаевой. Sensitive гель очищающий для лица 140мл	1	Неклассифицированные/default	4978727	Мастерская Олеси Мустаевой
5032855	4626015503853	Мастерская олеси мустаевой. Sensitive гель очищающий для лица 45мл	1	Неклассифицированные/default	4978727	Мастерская Олеси Мустаевой
5032856	4626015504027	Мастерская олеси мустаевой. Sensitive очищающее гель-молочко, 45мл	1	Неклассифицированные/default	4978727	Мастерская Олеси Мустаевой
5032857	4626015503730	Мастерская олеси мустаевой. бальзам-кондиционер с маслом брокколи	1	Неклассифицированные/default	4978727	Мастерская Олеси Мустаевой
5032858	4626015500371	Мастерская олеси мустаевой. воск для волос	1	Неклассифицированные/default	4978727	Мастерская Олеси Мустаевой
5032859	4626015501965	Мастерская олеси мустаевой. еловой хвои вода с серебром 150мл	1	Неклассифицированные/default	4978727	Мастерская Олеси Мустаевой
5032860	4626015504737	Мастерская олеси мустаевой. еловой хвои вода с серебром, 45мл	1	Неклассифицированные/default	4978727	Мастерская Олеси Мустаевой
5032861	4626015501781	Мастерская олеси мустаевой. имбирная вода с серебром 150мл	1	Неклассифицированные/default	4978727	Мастерская Олеси Мустаевой
5032862	4626015504751	Мастерская олеси мустаевой. имбирная вода с серебром, 45мл	1	Неклассифицированные/default	4978727	Мастерская Олеси Мустаевой
5032870	4626015505338	Мастерская олеси мустаевой. Крем для ног 45мл	1	Неклассифицированные/default	4978727	Мастерская Олеси Мустаевой
5032871	4626015505345	Мастерская олеси мустаевой. Крем для рук защитный с церамидами и витамином в3, 45мл	1	Неклассифицированные/default	4978727	Мастерская Олеси Мустаевой
5032872	4626015502115	Мастерская олеси мустаевой. Крем для рук увлажняющий с аминокислотами и облепихой, 70мл	1	Неклассифицированные/default	4978727	Мастерская Олеси Мустаевой
5032873	4626015505703	Мастерская олеси мустаевой. Крем для тела sunray 25spf, 120г	1	Неклассифицированные/default	4978727	Мастерская Олеси Мустаевой
5032874	4626015503785	Мастерская олеси мустаевой. Крем для тела семейный, 120мл	1	Неклассифицированные/default	4978727	Мастерская Олеси Мустаевой
5032875	4626015503709	Мастерская олеси мустаевой. Крем ночной для лица	1	Неклассифицированные/default	4978727	Мастерская Олеси Мустаевой
5032863	4626015505307	Мастерская олеси мустаевой. Крем №1, 43мл	1	Неклассифицированные/default	4978727	Мастерская Олеси Мустаевой
5032864	4626015505352	Мастерская олеси мустаевой. Крем №14, 43мл	1	Неклассифицированные/default	4978727	Мастерская Олеси Мустаевой
5032865	4626015505253	Мастерская олеси мустаевой. Крем №2, 43мл	1	Неклассифицированные/default	4978727	Мастерская Олеси Мустаевой
5032866	4626015505383	Мастерская олеси мустаевой. Крем №3, 120мл	1	Неклассифицированные/default	4978727	Мастерская Олеси Мустаевой
5032867	4626015503679	Мастерская олеси мустаевой. Крем №3, 43мл	1	Неклассифицированные/default	4978727	Мастерская Олеси Мустаевой
5032868	4626015503587	Мастерская олеси мустаевой. Крем №7	1	Неклассифицированные/default	4978727	Мастерская Олеси Мустаевой
5032869	4626015505505	Мастерская олеси мустаевой. Крем №8, 15г	1	Неклассифицированные/default	4978727	Мастерская Олеси Мустаевой
5032876	4626015503747	Мастерская олеси мустаевой. Крем-маска для волос моной и алоэ вера, 120мл	1	Неклассифицированные/default	4978727	Мастерская Олеси Мустаевой
5032877	4626015505321	Мастерская олеси мустаевой. Крем-флюид №10, 43мл	1	Неклассифицированные/default	4978727	Мастерская Олеси Мустаевой
5032878	4626015504744	Мастерская олеси мустаевой. лавандовая вода органическая, 45мл	1	Неклассифицированные/default	4978727	Мастерская Олеси Мустаевой
5032879	4626015501330	Мастерская олеси мустаевой. масло моной 150мл	1	Неклассифицированные/default	4978727	Мастерская Олеси Мустаевой
5032880	4626015503952	Мастерская олеси мустаевой. масло моной, 60мл	1	Неклассифицированные/default	4978727	Мастерская Олеси Мустаевой
5032881	4626015500289	Мастерская олеси мустаевой. мыло старый Лекарь	1	Неклассифицированные/default	4978727	Мастерская Олеси Мустаевой
5032882	4626015505086	Мастерская олеси мустаевой. она иная. гель для душа с маслом жасмина и нероли, 185мл	1	Неклассифицированные/default	4978727	Мастерская Олеси Мустаевой
5032883	4626015505598	Мастерская олеси мустаевой. она иная. жидкий бессульфатный шампунь, 185мл	1	Неклассифицированные/default	4978727	Мастерская Олеси Мустаевой
5032884	4626015503761	Мастерская олеси мустаевой. она иная. кондиционер для волос, 120мл	1	Неклассифицированные/default	4978727	Мастерская Олеси Мустаевой
5032885	4626015504805	Мастерская олеси мустаевой. она иная. маска для волос интенсивного воздействия креатин и аминокислоты, 43мл	1	Неклассифицированные/default	4978727	Мастерская Олеси Мустаевой
5032886	4626015505949	Мастерская олеси мустаевой. она иная. маска для волос интенсивного воздействия, 120мл	1	Неклассифицированные/default	4978727	Мастерская Олеси Мустаевой
5032887	4626015504003	Мастерская олеси мустаевой. она иная. мягкий очищающий гель для лица эксфолиант, 130мл	1	Неклассифицированные/default	4978727	Мастерская Олеси Мустаевой
5032888	4626015504010	Мастерская олеси мустаевой. она иная. мягкий очищающий гель для лица эксфолиант, 45мл	1	Неклассифицированные/default	4978727	Мастерская Олеси Мустаевой
5032889	4626015505635	Мастерская олеси мустаевой. она иная. сыворотка для лица мультикомплекс 30мл	1	Неклассифицированные/default	4978727	Мастерская Олеси Мустаевой
5032890	4626015505376	Мастерская олеси мустаевой. она иная. укрепляющий несмываемый Крем для волос b6 + пептид гороха, 120мл	1	Неклассифицированные/default	4978727	Мастерская Олеси Мустаевой
5032891	4626015505369	Мастерская олеси мустаевой. она иная. укрепляющий несмываемый Крем для волос в6 и пептид гороха, 40мл	1	Неклассифицированные/default	4978727	Мастерская Олеси Мустаевой
5032892	4626015505048	Мастерская олеси мустаевой. она иная. шампунь-концентрат в6+пептид гороха, 70г	1	Неклассифицированные/default	4978727	Мастерская Олеси Мустаевой
5032893	4626015501651	Мастерская олеси мустаевой. природная маска таёжная 200г	1	Неклассифицированные/default	4978727	Мастерская Олеси Мустаевой
5032894	4626015501095	Мастерская олеси мустаевой. природная минеральная маска сульфидно-иловая 220г	1	Неклассифицированные/default	4978727	Мастерская Олеси Мустаевой
5032895	4626015501828	Мастерская олеси мустаевой. розмариновая вода с серебром 150мл	1	Неклассифицированные/default	4978727	Мастерская Олеси Мустаевой
5032896	4626015504768	Мастерская олеси мустаевой. розмариновая вода с серебром, 45мл	1	Неклассифицированные/default	4978727	Мастерская Олеси Мустаевой
5032897	4626015501422	Мастерская олеси мустаевой. розовая вода болгарская 50мл	1	Неклассифицированные/default	4978727	Мастерская Олеси Мустаевой
5032898	4626015503778	Мастерская олеси мустаевой. сыворотка для кожи головы, 70мл	1	Неклассифицированные/default	4978727	Мастерская Олеси Мустаевой
5032899	4626015503341	Мастерская олеси мустаевой. твердый шампунь амла	1	Неклассифицированные/default	4978727	Мастерская Олеси Мустаевой
5032900	4626015503358	Мастерская олеси мустаевой. твердый шампунь березка, 70г	1	Неклассифицированные/default	4978727	Мастерская Олеси Мустаевой
5032901	4626015502528	Мастерская олеси мустаевой. твердый шампунь розмариновый	1	Неклассифицированные/default	4978727	Мастерская Олеси Мустаевой
5032902	4626015503464	Мастерская олеси мустаевой. твердый шампунь ромашковый	1	Неклассифицированные/default	4978727	Мастерская Олеси Мустаевой
5032903	4626015500319	Мастерская олеси мустаевой. хозяйственное мыло	1	Неклассифицированные/default	4978727	Мастерская Олеси Мустаевой
5032904	4626015501804	Мастерская олеси мустаевой. шалфейная вода с серебром 150мл	1	Неклассифицированные/default	4978727	Мастерская Олеси Мустаевой
5032905	4626015504928	Мастерская олеси мустаевой. шалфейная вода с серебром, 45мл	1	Неклассифицированные/default	4978727	Мастерская Олеси Мустаевой
5032907	9785905685910	Мастерская постановки голоса 5класс комплект из 2-х рабочих тетрадей. (наша новая школа.	4969322	Полиграфия (folder)/Учебное пособие (folder)/Учебник	4969310	РОСТкнига
5032908	9785905685972	Мастерская постановки голоса 6класс комплект из 2-х рабочих тетрадей. (наша новая школа.	4969322	Полиграфия (folder)/Учебное пособие (folder)/Учебник	4969310	РОСТкнига
5032912	9785905279898	Мастерская речевого творчества: р/т 3класс играем, мечтаем, рассказываем	4969322	Полиграфия (folder)/Учебное пособие (folder)/Учебник	4969310	РОСТкнига
5032913	9785780409731	Мастерская речевого творчества: р/т 4класс играем, мечтаем, рассказываем	4969322	Полиграфия (folder)/Учебное пособие (folder)/Учебник	4969310	РОСТкнига
5037363	9785408038398	Мастерская учителя 1-2кл. олимпиадные задания по математике, р/я, и курсу окружающий мир/максимова т н. (изд-во вако)	4898049	Полиграфия (folder)/Учебное пособие (folder)/Методические пособия	0	
5037364	9785408022151	Мастерская учителя 1-4кл. игровой модульный курс по ПДД фгос ковалько (изд-во вако)	4898049	Полиграфия (folder)/Учебное пособие (folder)/Методические пособия	0	
5037365	9785408043934	Мастерская учителя 1-4кл. интеллектуальный марафон. все учебные предметы фгос тверд обл/максимова т н. (изд-во вако)	4898049	Полиграфия (folder)/Учебное пособие (folder)/Методические пособия	0	
5037366	9785408017133	Мастерская учителя 1-4кл. новые 135 уроков здоровья, школа докторов природы.фгос обухова л а. (изд-во вако)	4898049	Полиграфия (folder)/Учебное пособие (folder)/Методические пособия	0	
5037367	9785408038541	Мастерская учителя 1класс графические диктанты фгос никифорова (изд-во вако)	4898049	Полиграфия (folder)/Учебное пособие (folder)/Методические пособия	0	
5037369	9785408037513	Мастерская учителя 3-4класс группа продленного дня. фгос гайдина (изд-во вако)	4898049	Полиграфия (folder)/Учебное пособие (folder)/Методические пособия	0	
5037370	9785408041275	Мастерская учителя 3-4класс олимпиадные задания по математике, р/я, и курсу окружающий мир фгос максимова т н. (изд-во вако)	4898049	Полиграфия (folder)/Учебное пособие (folder)/Методические пособия	0	
5037371	9785408044528	Мастерская учителя задания школьных олимпиад 1-4класс фгос 7бц/ пупышева о.н. (изд-во вако)	4898049	Полиграфия (folder)/Учебное пособие (folder)/Методические пособия	0	
5037374	9785408047505	Мастерская учителя сборник диктантов и проверочных работ по русскому языку 2-4класс фгос 7бц/ максимук н.н (изд-во вако)	4898049	Полиграфия (folder)/Учебное пособие (folder)/Методические пособия	0	
5037375	9785408043910	Мастерская учителя сборник текстов для изложений 2-4кл. фгос 7бц/яценко и.ф. (изд-во вако)	4898049	Полиграфия (folder)/Учебное пособие (folder)/Методические пособия	0	
5037376	9785408043927	Мастерская учителя словарная работа 1-4класс фгос тверд обл/мельникова с.м. (изд-во вако)	4898049	Полиграфия (folder)/Учебное пособие (folder)/Методические пособия	0	
5037377	9785408025138	Мастерская учителя школа физкультминуток 1-4класс фгос ковалько в и. (изд-во вако)	4898049	Полиграфия (folder)/Учебное пособие (folder)/Методические пособия	0	
3853228	4630004340787	Мастерфиш корюшка неразд.охл.450г	97152	Продукты питания (folder)/Рыба и морепродукты (folder)/Рыба живая и охлажденная	3853225	МАСТЕРФИШ
3853226	4630004340565	Мастерфиш треска кусок мороженый 800г	3609100	Продукты питания (folder)/Рыба и морепродукты (folder)/Рыба замороженная	3853225	МАСТЕРФИШ
3853229	4630004341340	Мастерфиш треска стейк н/к зам.500г	3609100	Продукты питания (folder)/Рыба и морепродукты (folder)/Рыба замороженная	3853225	МАСТЕРФИШ
3853227	4630004341036	Мастерфиш треска филе б/к порц.морож.800г	3609100	Продукты питания (folder)/Рыба и морепродукты (folder)/Рыба замороженная	3853225	МАСТЕРФИШ
759180	8713184085412	Мастиет форте intervet лечение отитов, дерматитов, маститов инжектор (шприц) 8г (1x20)	337596	Товары для животных (folder)/Pets	0	
3405685	4690405059060	Мастика Aqua mast битумная для фундамента 10кг	489685	Строительные и отделочные материалы (folder)/Мастика	0	
759182	4690405059268	Мастика Aqua mast гидроизоляция для кровли 10кг жб	489685	Строительные и отделочные материалы (folder)/Мастика	759181	AQUAMAST
759183	4690405059305	Мастика Aqua mast гидроизоляция для кровли 18кг жб	489685	Строительные и отделочные материалы (folder)/Мастика	759181	AQUAMAST
