ID	UPCEAN	Name	CategoryID	CategoryName	BrandID	BrandName
5478720	4052899339828	Лампа ксеноновая Osram d1r 35w pk32d-3 xenon xenarc 4300k 85v, 66150	3948157	Техника (folder)/Электротехника (folder)/Лампа автомобильная	78069	Osram
5478721	4052899439207	Лампа ксеноновая Osram d1s 35w pk32d-2 xenon Cool Blue boost 7000k, 2шт 12v 66140cbb2 66140cbb-hcb	3948157	Техника (folder)/Электротехника (folder)/Лампа автомобильная	78069	Osram
5478722	4052899429611	Лампа ксеноновая Osram d1s 35w pk32d-2 xenon Ultra Life, 2шт 12v 66140ult2 66140ult-hcb	3948157	Техника (folder)/Электротехника (folder)/Лампа автомобильная	78069	Osram
5478723	4052899431621	Лампа ксеноновая Osram d1s 35w pk32d-2+20% xenon Cool Blue intense 6000k 85v, 2шт, 66140cbi2 66140cbi-hcb	3948157	Техника (folder)/Электротехника (folder)/Лампа автомобильная	78069	Osram
5478724	4052899992870	Лампа ксеноновая Osram d1s 35w pk32d-2+200% xenarc Night breaker laser 4500k 85v, 66140xnl	3948157	Техника (folder)/Электротехника (folder)/Лампа автомобильная	78069	Osram
5478725	4052899075382	Лампа ксеноновая Osram d1s xenarc Classic 85v 35w, 66140clc	3948157	Техника (folder)/Электротехника (folder)/Лампа автомобильная	78069	Osram
5478726	4052899220720	Лампа ксеноновая Osram d1s xenarc Cool Blue intense 6000k 85v 35w, 1шт 66140cbi	3948157	Техника (folder)/Электротехника (folder)/Лампа автомобильная	78069	Osram
5478727	4008321184276	Лампа ксеноновая Osram d1s xenarc Original 12v-35w, 1шт pk32d-2, 66140	3948157	Техника (folder)/Электротехника (folder)/Лампа автомобильная	78069	Osram
5478728	4052899425514	Лампа ксеноновая Osram d1s xenarc Ultra Life 4350k 85v 35w, 1шт 66140ult	3948157	Техника (folder)/Электротехника (folder)/Лампа автомобильная	78069	Osram
5478729	4008321401533	Лампа ксеноновая Osram d2r 35w p32d-3+20% xenon Cool Blue intense 6000k 85v, 66250cbi	3948157	Техника (folder)/Электротехника (folder)/Лампа автомобильная	78069	Osram
5478730	4052899992917	Лампа ксеноновая Osram d2s 35w p32d-2 xenarc Night breaker laser 4500k, 2шт 85v, 66240xnl2 66240xnl-hcb	3948157	Техника (folder)/Электротехника (folder)/Лампа автомобильная	78069	Osram
5478731	4052899441040	Лампа ксеноновая Osram d2s 35w p32d-2 xenon Cool Blue boost 7000k, 2шт 12v 66240cbb2 66240cbb-hcb	3948157	Техника (folder)/Электротехника (folder)/Лампа автомобильная	78069	Osram
5478732	4052899431706	Лампа ксеноновая Osram d2s 35w p32d-2+20% xenon Cool Blue intense 6000k, 2шт 85v, 66240cbi2 66240cbi-hcb	3948157	Техника (folder)/Электротехника (folder)/Лампа автомобильная	78069	Osram
5478733	4052899075443	Лампа ксеноновая Osram d2s xenarc Classic 85v-35w, 1шт p32d-2, 66240clc	3948157	Техника (folder)/Электротехника (folder)/Лампа автомобильная	78069	Osram
5478734	4052899993259	Лампа ксеноновая Osram d2s xenarc Night breaker laser 85v-35w, 1шт p32d-2, 66240xnl	3948157	Техника (folder)/Электротехника (folder)/Лампа автомобильная	78069	Osram
5478735	4052899199569	Лампа ксеноновая Osram d3s 35w p32d-5 xenon xenarc 4300k 42v, 66340	3948157	Техника (folder)/Электротехника (folder)/Лампа автомобильная	78069	Osram
5478736	4052899527584	Лампа ксеноновая Osram d3s 35w pk32d-5 xenon Cool Blue boost 7000k, 2шт 12v 66340cbb2 66340cbb-hcb	3948157	Техника (folder)/Электротехника (folder)/Лампа автомобильная	78069	Osram
5478737	4052899431782	Лампа ксеноновая Osram d3s 35w pk32d-5 xenon Cool Blue intense 6000k 42v, 2шт, 66340cbi2 66340cbi-hcb	3948157	Техника (folder)/Электротехника (folder)/Лампа автомобильная	78069	Osram
5478738	4052899148710	Лампа ксеноновая Osram d3s 35w pk32d-5 xenon Cool Blue intense 6000k 42v, 66340cbi	3948157	Техника (folder)/Электротехника (folder)/Лампа автомобильная	78069	Osram
5478739	4052899429734	Лампа ксеноновая Osram d3s 35w pk32d-5+70% xenon Ultra Life 4150k, 2шт 42v, 66340ult2	3948157	Техника (folder)/Электротехника (folder)/Лампа автомобильная	78069	Osram
5478740	4052899397989	Лампа ксеноновая Osram d3s xenarc Classic 42v-35w, 1шт pk32d-5, 66340clc	3948157	Техника (folder)/Электротехника (folder)/Лампа автомобильная	78069	Osram
5478741	4052899993112	Лампа ксеноновая Osram d3s xenarc Night braker laser 35w pk32d-5+200% 4400k, 2шт 66340xnl2 66340xnl-hcb	3948157	Техника (folder)/Электротехника (folder)/Лампа автомобильная	78069	Osram
5478742	4052899425606	Лампа ксеноновая Osram d3s xenarc Ultra Life 42v-35w, 1шт pk32d-5, 66340ult	3948157	Техника (folder)/Электротехника (folder)/Лампа автомобильная	78069	Osram
5478743	4008321349576	Лампа ксеноновая Osram d4r 35w p32d-6 xenon xenarc 4300k 42v, 66450	3948157	Техника (folder)/Электротехника (folder)/Лампа автомобильная	78069	Osram
5478744	4052899527546	Лампа ксеноновая Osram d4s 35w p32d-5 xenon Cool Blue boost 7000k, 2шт 12v 66440cbb2 66440cbb-hcb	3948157	Техника (folder)/Электротехника (folder)/Лампа автомобильная	78069	Osram
5478745	4052899431874	Лампа ксеноновая Osram d4s 35w p32d-5 xenon Cool Blue intense 6000k 42v, 2шт, 66440cbi2 66440cbi-hcb	3948157	Техника (folder)/Электротехника (folder)/Лампа автомобильная	78069	Osram
5478746	4052899125582	Лампа ксеноновая Osram d4s 35w p32d-5 xenon Cool Blue intense 6000k 42v, 66440cbi	3948157	Техника (folder)/Электротехника (folder)/Лампа автомобильная	78069	Osram
5197321	4052899992993	Лампа ксеноновая Osram d4s 35w p32d-5+200% xenarc Night braker laser 4400k 85v, 66440xnl	3948157	Техника (folder)/Электротехника (folder)/Лампа автомобильная	78069	Osram
5478747	4052899398054	Лампа ксеноновая Osram d4s xenarc Classic 42v-35w, 1шт p32d-5, 66440clc	3948157	Техника (folder)/Электротехника (folder)/Лампа автомобильная	78069	Osram
3727049	4008321401359	Лампа ксеноновая Osram xenon Cool Blue intense d2s 35w p32d-2+20% 6000k 85v, 66240cbi	3948157	Техника (folder)/Электротехника (folder)/Лампа автомобильная	78069	Osram
5478748	4052899429796	Лампа ксеноновая Osram xenon Ultra Life d4s 35w p32d-5 4300k 42v, 2шт 66440ult2 66440ult-hcb	3948157	Техника (folder)/Электротехника (folder)/Лампа автомобильная	78069	Osram
5478749	8727900364934	Лампа ксеноновая Philips 85126vis1, d2r vision 4400k 85v 35w для фар головного освещения	3948157	Техника (folder)/Электротехника (folder)/Лампа автомобильная	39898	PHILIPS
5478750	8727900364897	Лампа ксеноновая Philips d1s vision 4600k 85v 35w, 1шт 85415vis1	3948157	Техника (folder)/Электротехника (folder)/Лампа автомобильная	39898	PHILIPS
5478751	8727900375039	Лампа ксеноновая Philips d1s White vision (85415whvs1)	78022	Техника (folder)/Электротехника (folder)/Лампа электрическая	39898	PHILIPS
5201094	8727900376975	Лампа ксеноновая Philips d1s x-tremevision gen2 4800k 85v 35w, 1шт 85415xv2s1	3948157	Техника (folder)/Электротехника (folder)/Лампа автомобильная	39898	PHILIPS
5478752	8727900377255	Лампа ксеноновая Philips d1s xenon whitevision gen2 5000к 85v 35w, 1шт 85415whv2c1	3948157	Техника (folder)/Электротехника (folder)/Лампа автомобильная	39898	PHILIPS
5478755	8727900377095	Лампа ксеноновая Philips d2r x-tremevision gen 2 85v-35w, p32d-3, 85126xv2s1	3948157	Техника (folder)/Электротехника (folder)/Лампа автомобильная	39898	PHILIPS
5478753	8727900377330	Лампа ксеноновая Philips d2r xenon whitevision gen2 5000k 85v 35w, 1шт 85126whv2c1	3948157	Техника (folder)/Электротехника (folder)/Лампа автомобильная	39898	PHILIPS
5478754	8727900377316	Лампа ксеноновая Philips d2r xenon whitevision gen2 5000k 85v 35w, 1шт 85126whv2s1	3948157	Техника (folder)/Электротехника (folder)/Лампа автомобильная	39898	PHILIPS
5478756	8727900364910	Лампа ксеноновая Philips d2s vision 4400k 85v 35w, 1шт 85122vis1	3948157	Техника (folder)/Электротехника (folder)/Лампа автомобильная	39898	PHILIPS
5478757	8727900377279	Лампа ксеноновая Philips d2s whitevision gen2 85v-35w, p32d-2, 85122whv2s1	3948157	Техника (folder)/Электротехника (folder)/Лампа автомобильная	39898	PHILIPS
5478759	8727900377033	Лампа ксеноновая Philips d2s x-tremevision gen 2 4800k 85v 35w, 1шт 85122xv2s1	3948157	Техника (folder)/Электротехника (folder)/Лампа автомобильная	39898	PHILIPS
5478758	8727900377293	Лампа ксеноновая Philips d2s xenon whitevision gen2 5000k 85v 35w, 1шт 85122whv2c1	3948157	Техника (folder)/Электротехника (folder)/Лампа автомобильная	39898	PHILIPS
5478760	8727900364958	Лампа ксеноновая Philips d3s vision 4100k 42v 35w, 1шт 42403vis1	3948157	Техника (folder)/Электротехника (folder)/Лампа автомобильная	39898	PHILIPS
5478764	8727900377132	Лампа ксеноновая Philips d3s x-tremevision gen 2 4800к, 42v-35w, pk32d-5, 42403xv2s1	3948157	Техника (folder)/Электротехника (folder)/Лампа автомобильная	39898	PHILIPS
5478761	928531424402	Лампа ксеноновая Philips d3s xenon whitevision gen2 5000k 42v 35w, 1шт 42403whv2c1	3948157	Техника (folder)/Электротехника (folder)/Лампа автомобильная	39898	PHILIPS
5478762	8727900377378	Лампа ксеноновая Philips d3s xenon whitevision gen2 5000k 42v 35w, 1шт 42403whv2c1 #2	3948157	Техника (folder)/Электротехника (folder)/Лампа автомобильная	39898	PHILIPS
5478763	8727900377354	Лампа ксеноновая Philips d3s xenon whitevision gen2 5000k 42v 35w, 1шт 42403whv2s1	3948157	Техника (folder)/Электротехника (folder)/Лампа автомобильная	39898	PHILIPS
5478765	8727900364859	Лампа ксеноновая Philips d4s vision 4100k 42v 35w, 1шт 42402vic1	78022	Техника (folder)/Электротехника (folder)/Лампа электрическая	39898	PHILIPS
5478766	8727900353921	Лампа ксеноновая Philips d5s 12v-25w (pk32d-2) x-tremevision gen 2, 1шт 12410xv+c1	3948157	Техника (folder)/Электротехника (folder)/Лампа автомобильная	39898	PHILIPS
752053	8111123329724	Лампа кухня масляная декор lcs3900-cr-Al	3541537	Сувениры и подарки (folder)/Сувенир	38271	LCS
232154	5055118207112	Лампа лайнер 11w энергосбер.спираль дн.свет	78022	Техника (folder)/Электротехника (folder)/Лампа электрическая	0	
232155	4607082522299	Лампа лайнер 23w энергосбер.спираль дн.свет	78022	Техника (folder)/Электротехника (folder)/Лампа электрическая	0	
232158	8697451404376	Лампа лб (лд)-40 vito цветные	78022	Техника (folder)/Электротехника (folder)/Лампа электрическая	232126	VITO
232159	6932143308450	Лампа лд 16w/54	78022	Техника (folder)/Электротехника (folder)/Лампа электрическая	0	
3391107	6941472806292	Лампа летучая мышь 20465	1	Неклассифицированные/default	0	
752054	8111123329748	Лампа лимоны масляная декор lcs3900-l-Al	3541537	Сувениры и подарки (folder)/Сувенир	38271	LCS
2738112	4000870009840	Лампа линейная 1 цоколь, опал, 300mm, 35w 730301	1	Неклассифицированные/default	2513071	Paulmann
2738113	4000870009857	Лампа линейная 1 цоколь, опал, 500mm, 60w 730601	1	Неклассифицированные/default	2513071	Paulmann
2738109	4000870730201	Лампа линейная 2 цоколя, опал, 1000mm, 120w 73020	1	Неклассифицированные/default	2513071	Paulmann
2738110	4000870730300	Лампа линейная 2 цоколя, опал, 300mm, 35w 73030	1	Неклассифицированные/default	2513071	Paulmann
2738111	4000870730607	Лампа линейная 2 цоколя, опал, 500mm, 60w 73060	1	Неклассифицированные/default	2513071	Paulmann
3391108	4670000010369	Лампа лисма 40w дс	1	Неклассифицированные/default	0	
3391109	4670000010444	Лампа лисма 40w цоколь е14	1	Неклассифицированные/default	0	
2737334	4810053027574	Лампа лисма 95w e27 230v	1	Неклассифицированные/default	0	
3391111	4670000010468	Лампа лисма дш 230-60 е14	1	Неклассифицированные/default	0	
3391112	4670000013698	Лампа лисма лиминесцентная двухцокольная 18w/765 цоколь g13	1	Неклассифицированные/default	0	
3391113	4670000013735	Лампа лисма лиминесцентная двухцокольная 36w/765 цоколь g13	1	Неклассифицированные/default	0	
3391114	4660034522792	Лампа лисма термоизлучатель 150w т/у	1	Неклассифицированные/default	0	
3391115	4670000010451	Лампа лисма электрическая 40w	1	Неклассифицированные/default	0	
1354824	4630009430070	Лампа лонгевита ультрафол/бактериц/озонир	1	Неклассифицированные/default	0	
5478767	015561220590	Лампа лунного света Night Heat lamp 150w pt2059 (h220590)	314252	Товары для животных (folder)/Аквариум (folder)/Светильники и лампы для аквариума	5295820	hagen exo terra
751572	015561221207	Лампа лунного света Night Heat lamp 15w pt2120 (h221207)	601806	Товары для животных (folder)/Предметы содержания животных	309115	Hagen
751573	015561221221	Лампа лунного света Night Heat lamp 25w pt2122 (h221221)	601806	Товары для животных (folder)/Предметы содержания животных	309115	Hagen
751571	015561221269	Лампа лунного света Night Heat lamp 50w pt2126 (h221269)	601806	Товары для животных (folder)/Предметы содержания животных	309115	Hagen
5478768	015561221306	Лампа лунного света Night Heat lamp 75w pt2130 (h221306)	314252	Товары для животных (folder)/Аквариум (folder)/Светильники и лампы для аквариума	5295820	hagen exo terra
484481	4607173890733	Лампа Люкс 40w е27 шарик матовый	78022	Техника (folder)/Электротехника (folder)/Лампа электрическая	0	
232160	6932251902649	Лампа люминесцентная 10в vito	3391116	Техника (folder)/Электротехника (folder)/Лампа люминесцентная	0	
752055	3800712042308	Лампа люминесцентная 13w	3391116	Техника (folder)/Электротехника (folder)/Лампа люминесцентная	0	
484483	8711500469267	Лампа люминесцентная 14w е27 Philips econ827 13834	3391116	Техника (folder)/Электротехника (folder)/Лампа люминесцентная	39898	PHILIPS
752056	4044572995179	Лампа люминесцентная 18w	3391116	Техника (folder)/Электротехника (folder)/Лампа люминесцентная	0	
2984799	4044572998545	Лампа люминесцентная 18w #2	3391116	Техника (folder)/Электротехника (folder)/Лампа люминесцентная	0	
2984800	4044572998521	Лампа люминесцентная 18w #3	3391116	Техника (folder)/Электротехника (folder)/Лампа люминесцентная	0	
2984801	4044572998507	Лампа люминесцентная 18w #4	3391116	Техника (folder)/Электротехника (folder)/Лампа люминесцентная	0	
752057	3800712042315	Лампа люминесцентная 21w	3391116	Техника (folder)/Электротехника (folder)/Лампа люминесцентная	0	
752058	3800712042322	Лампа люминесцентная 28w	3391116	Техника (folder)/Электротехника (folder)/Лампа люминесцентная	0	
3391117	6932143310224	Лампа люминесцентная 30w/33 ft4 4200k	3391116	Техника (folder)/Электротехника (folder)/Лампа люминесцентная	0	
752059	4044572998491	Лампа люминесцентная 36w	3391116	Техника (folder)/Электротехника (folder)/Лампа люминесцентная	0	
484487	5903969032653	Лампа люминесцентная 36w/54 39578 pila lf g13	3391116	Техника (folder)/Электротехника (folder)/Лампа люминесцентная	0	
1965993	4814133000198	Лампа люминесцентная 8sm3u711е27	3391116	Техника (folder)/Электротехника (folder)/Лампа люминесцентная	0	
752060	3800712042292	Лампа люминесцентная 8w	3391116	Техника (folder)/Электротехника (folder)/Лампа люминесцентная	0	
2984802	3800712042346	Лампа люминесцентная 8w #2	3391116	Техника (folder)/Электротехника (folder)/Лампа люминесцентная	0	
1965994	4814133000174	Лампа люминесцентная 8wm3u7e27	3391116	Техника (folder)/Электротехника (folder)/Лампа люминесцентная	0	
1965995	4814133000440	Лампа люминесцентная 8wsp18e27	3391116	Техника (folder)/Электротехника (folder)/Лампа люминесцентная	0	
1965996	4814133000396	Лампа люминесцентная 8ysp11e27	3391116	Техника (folder)/Электротехника (folder)/Лампа люминесцентная	0	
1965997	4814133000518	Лампа люминесцентная 8ysp25e27	3391116	Техника (folder)/Электротехника (folder)/Лампа люминесцентная	0	
2452146	4814133000143	Лампа люминесцентная arondie 8w2u18e27	3391116	Техника (folder)/Электротехника (folder)/Лампа люминесцентная	0	
2452147	4814133000259	Лампа люминесцентная arondie 8w3u20e27	3391116	Техника (folder)/Электротехника (folder)/Лампа люминесцентная	0	
2452148	4814133000389	Лампа люминесцентная arondie 8wsp11e27	3391116	Техника (folder)/Электротехника (folder)/Лампа люминесцентная	0	
2452149	4814133000419	Лампа люминесцентная arondie 8wsp15e27	3391116	Техника (folder)/Электротехника (folder)/Лампа люминесцентная	0	
573282	4895117846780	Лампа люминесцентная Camelion ft 5-6 w blacklight Blue ультрафиолетовая 6w	3391116	Техника (folder)/Электротехника (folder)/Лампа люминесцентная	226050	Camelion
752061	4895117846667	Лампа люминесцентная Camelion ft4 30w/33g 5 Cool Light холодного белого света, d12.5mm	3391116	Техника (folder)/Электротехника (folder)/Лампа люминесцентная	226050	Camelion
573275	4895117846629	Лампа люминесцентная Camelion ft4-12w/33 Cool Light 4200k 12w	3391116	Техника (folder)/Электротехника (folder)/Лампа люминесцентная	226050	Camelion
573276	4895117846636	Лампа люминесцентная Camelion ft4-16w/33 Cool Light 4200k 16w	3391116	Техника (folder)/Электротехника (folder)/Лампа люминесцентная	226050	Camelion
573277	4895117846568	Лампа люминесцентная Camelion ft4-16w/54 daylight 6500k 16w	3391116	Техника (folder)/Электротехника (folder)/Лампа люминесцентная	226050	Camelion
573278	4895117846643	Лампа люминесцентная Camelion ft4-20w/33 Cool Light 4200 k 20w	3391116	Техника (folder)/Электротехника (folder)/Лампа люминесцентная	226050	Camelion
573280	4895117846582	Лампа люминесцентная Camelion ft4-24w/54 daylight 6500k 24w	3391116	Техника (folder)/Электротехника (folder)/Лампа люминесцентная	226050	Camelion
573281	4895117846599	Лампа люминесцентная Camelion ft4-30w/54 daylight 6500k 30w	3391116	Техника (folder)/Электротехника (folder)/Лампа люминесцентная	226050	Camelion
752062	4895117846773	Лампа люминесцентная Camelion ft5 28w/33g 5 Cool Light холодного белого света, d 16mm	3391116	Техника (folder)/Электротехника (folder)/Лампа люминесцентная	226050	Camelion
484482	4895117846735	Лампа люминесцентная Camelion ft5-13w/33 Cool Light 4200k 13w	3391116	Техника (folder)/Электротехника (folder)/Лампа люминесцентная	226050	Camelion
573283	4895117846704	Лампа люминесцентная Camelion ft5-13w/54 daylight 6500k 13w	3391116	Техника (folder)/Электротехника (folder)/Лампа люминесцентная	226050	Camelion
484484	4895117846766	Лампа люминесцентная Camelion ft5-21w/33 Cool Light 4200k 21w	3391116	Техника (folder)/Электротехника (folder)/Лампа люминесцентная	226050	Camelion
573284	4895117846742	Лампа люминесцентная Camelion ft5-21w/54 daylight 6500k 21w	3391116	Техника (folder)/Электротехника (folder)/Лампа люминесцентная	226050	Camelion
573285	4895117846759	Лампа люминесцентная Camelion ft5-28w/54 daylight 6500k 28w	3391116	Техника (folder)/Электротехника (folder)/Лампа люминесцентная	226050	Camelion
484488	4895117846711	Лампа люминесцентная Camelion ft5-6w/33 Cool Light 4200k 6w	3391116	Техника (folder)/Электротехника (folder)/Лампа люминесцентная	226050	Camelion
573286	4895117846681	Лампа люминесцентная Camelion ft5-6w/54 daylight 6500k 6w	3391116	Техника (folder)/Электротехника (folder)/Лампа люминесцентная	226050	Camelion
484489	4895117846728	Лампа люминесцентная Camelion ft5-8w/33 Cool Light 4200k 8w	3391116	Техника (folder)/Электротехника (folder)/Лампа люминесцентная	226050	Camelion
573287	4895117846698	Лампа люминесцентная Camelion ft5-8w/54 daylight 6500k 8w	3391116	Техника (folder)/Электротехника (folder)/Лампа люминесцентная	226050	Camelion
573288	4895117846841	Лампа люминесцентная Camelion ft8-10w/33 Cool Light 4200k 10w	3391116	Техника (folder)/Электротехника (folder)/Лампа люминесцентная	226050	Camelion
573289	4895117846797	Лампа люминесцентная Camelion ft8-10w/54 daylight 6500k 10w	3391116	Техника (folder)/Электротехника (folder)/Лампа люминесцентная	226050	Camelion
