ID	UPCEAN	Name	CategoryID	CategoryName	BrandID	BrandName
3284365	8420209016251	Вино espada real красное сухое 11% 750ml ст/б	22133	Продукты питания (folder)/Алкогольные напитки/Вино (folder)/Вино	0	
3284366	8420209016299	Вино espada real красное сухое 11% tetrapak 1л	22133	Продукты питания (folder)/Алкогольные напитки/Вино (folder)/Вино	0	
3292407	8431356002387	Вино espada бланка белое полусладк 11% 750ml ст/б	22133	Продукты питания (folder)/Алкогольные напитки/Вино (folder)/Вино	0	
3292408	8431356002363	Вино espada бланка белое сухое 11% 750ml ст/б	22133	Продукты питания (folder)/Алкогольные напитки/Вино (folder)/Вино	0	
3292409	8431356002356	Вино espada бланка крас. сух 9-11% 750ml	22133	Продукты питания (folder)/Алкогольные напитки/Вино (folder)/Вино	0	
3292410	8431356002370	Вино espada бланка красное полусладк 11% 750ml	22133	Продукты питания (folder)/Алкогольные напитки/Вино (folder)/Вино	0	
3292411	8431356009515	Вино espada бланка столов белое сухое 11% 1.5л стекло	22133	Продукты питания (folder)/Алкогольные напитки/Вино (folder)/Вино	0	
3292412	8431356009522	Вино espada бланка столов красное полусладк 11% 1.5л стекло	22133	Продукты питания (folder)/Алкогольные напитки/Вино (folder)/Вино	0	
3284367	8431356003445	Вино espada негра, белое полусладк 11%, 750ml ст/б	22133	Продукты питания (folder)/Алкогольные напитки/Вино (folder)/Вино	0	
3284368	8431356003841	Вино espada негра, белое сухое, 11%, 750ml ст/б	22133	Продукты питания (folder)/Алкогольные напитки/Вино (folder)/Вино	0	
3284369	8431356003421	Вино espada негра, столов белое полусухое, 11%, 750ml ст/б	22133	Продукты питания (folder)/Алкогольные напитки/Вино (folder)/Вино	0	
2854060	4607125541874	Вино espania La vinchi столов белое полусладк 12% 750ml стбут	22133	Продукты питания (folder)/Алкогольные напитки/Вино (folder)/Вино	0	
43269	7809579801253	Вино espiritu de chile Cabernet Sauvignon гр.рез. красн псух 750ml	22133	Продукты питания (folder)/Алкогольные напитки/Вино (folder)/Вино	43268	Еспириту Де Чили
1196169	7809579803219	Вино espiritu de chile Cabernet Sauvignon красн полусладк 10-15% 750ml	22133	Продукты питания (folder)/Алкогольные напитки/Вино (folder)/Вино	3792892	АРЕСТИ ЧИЛИ
43270	7809579801215	Вино espiritu de chile Cabernet Sauvignon красн псух 12.5% 750ml	22133	Продукты питания (folder)/Алкогольные напитки/Вино (folder)/Вино	43268	Еспириту Де Чили
43271	7809579801222	Вино espiritu de chile carmener полусухое красное 13% 750ml стекло	22133	Продукты питания (folder)/Алкогольные напитки/Вино (folder)/Вино	43268	Еспириту Де Чили
3284370	7809579801352	Вино espiritu de chile Chardonnay белое сухое 13% 750ml ст/б	22133	Продукты питания (folder)/Алкогольные напитки/Вино (folder)/Вино	0	
1760327	7809579801260	Вино espiritu de chile Merlot красн п/ сух 13-15% 750ml	22133	Продукты питания (folder)/Алкогольные напитки/Вино (folder)/Вино	3791268	ESPIRITU DE CHILE
43274	7809579801246	Вино espiritu de chile Sauvignon blanc сухое белое 750ml стекло	22133	Продукты питания (folder)/Алкогольные напитки/Вино (folder)/Вино	43268	Еспириту Де Чили
1196170	7809579803226	Вино espiritu de chile Sauvignon блан белое полусладк 10-15% 750ml	22133	Продукты питания (folder)/Алкогольные напитки/Вино (folder)/Вино	3792892	АРЕСТИ ЧИЛИ
43272	7809579801239	Вино espiritu de chile мер. красн п/ сух 13-15% 750ml	22133	Продукты питания (folder)/Алкогольные напитки/Вино (folder)/Вино	43268	Еспириту Де Чили
1192878	7809579801277	Вино espiritu de chile сов.блан гр.рез.бел сух 13% 750ml	22133	Продукты питания (folder)/Алкогольные напитки/Вино (folder)/Вино	43268	Еспириту Де Чили
2855295	4605654010090	Вино espiritu de espana столов белое полусладк 11% 700ml ст/б	22133	Продукты питания (folder)/Алкогольные напитки/Вино (folder)/Вино	0	
2855296	4605654010076	Вино espiritu de espana столов белое сухое 11% 700ml ст/б	22133	Продукты питания (folder)/Алкогольные напитки/Вино (folder)/Вино	0	
2855297	4605654010106	Вино espiritu de espana столов полусладк красное 11% 700ml ст/б	22133	Продукты питания (folder)/Алкогольные напитки/Вино (folder)/Вино	0	
2855298	4605654010083	Вино espiritu de espana столов сухое красное 11% 700ml ст/б	22133	Продукты питания (folder)/Алкогольные напитки/Вино (folder)/Вино	0	
3284371	8011510010658	Вино espoleo столов белое полусладк 10% 750ml ст/б	22133	Продукты питания (folder)/Алкогольные напитки/Вино (folder)/Вино	0	
3284372	8011510010641	Вино espoleo столов белое сухое 10.5% 750ml ст/б	22133	Продукты питания (folder)/Алкогольные напитки/Вино (folder)/Вино	0	
3284373	8011510010672	Вино espoleo столов красное полусладк 10.5% 750ml ст/б	22133	Продукты питания (folder)/Алкогольные напитки/Вино (folder)/Вино	0	
3284374	8011510010665	Вино espoleo столов красное сухое 11% 750ml ст/б	22133	Продукты питания (folder)/Алкогольные напитки/Вино (folder)/Вино	0	
3284375	4660017890214	Вино esse Cabernet столов красное сухое 10-14% 750ml ст/б	22133	Продукты питания (folder)/Алкогольные напитки/Вино (folder)/Вино	0	
2427564	4660017890252	Вино esse бастардо столов красное сухое 10-14% 750ml ст/б	22133	Продукты питания (folder)/Алкогольные напитки/Вино (folder)/Вино	2427563	Эссе
3284376	4660017890276	Вино esse сухое белое 10-14% 750ml ст/б	22133	Продукты питания (folder)/Алкогольные напитки/Вино (folder)/Вино	0	
3791270	4605513005748	Вино est!d'montef.doc бел сух 12% 750ml	22133	Продукты питания (folder)/Алкогольные напитки/Вино (folder)/Вино	3791269	EST!
3791271	4607053043747	Вино est!d'montef.doc бел сух 12% 750ml #2	22133	Продукты питания (folder)/Алкогольные напитки/Вино (folder)/Вино	3791269	EST!
691438	7790314056598	Вино estancia, mendoza, Cabernet мальбек, сухое красное, 13%, 750ml ст/б	22133	Продукты питания (folder)/Алкогольные напитки/Вино (folder)/Вино	0	
691440	7790314055393	Вино estancia, mendoza, Chardonnay шенин, сухое белое, 13%, 750ml ст/б	22133	Продукты питания (folder)/Алкогольные напитки/Вино (folder)/Вино	3794762	ШЕНИН
47566	4601249002051	Вино Estrella Cabernet Sauvignon красн сух 11% 700ml	22133	Продукты питания (folder)/Алкогольные напитки/Вино (folder)/Вино	47564	Эстрелла вино
47568	4601249002068	Вино Estrella Malbec красн сух 11% 700ml	22133	Продукты питания (folder)/Алкогольные напитки/Вино (folder)/Вино	47564	Эстрелла вино
1196172	4601211004212	Вино Estrella Malbec красн сух 11-13% 700ml	22133	Продукты питания (folder)/Алкогольные напитки/Вино (folder)/Вино	0	
1196173	810541144794	Вино Estrella Merlot красн п/сух 750ml	22133	Продукты питания (folder)/Алкогольные напитки/Вино (folder)/Вино	691441	Эстрелла
1196174	4602573000010	Вино Estrella Merlot красн п/сух 750ml #2	22133	Продукты питания (folder)/Алкогольные напитки/Вино (folder)/Вино	691441	Эстрелла
47570	4601249002044	Вино Estrella Merlot красн сух 11% 700ml	22133	Продукты питания (folder)/Алкогольные напитки/Вино (folder)/Вино	47564	Эстрелла вино
47572	081054114509	Вино Estrella Sauvignon блан бел псух 750ml	22169	Продукты питания (folder)/Алкогольные напитки/Вино (folder)/Вина Новый Свет	2274862	Estrella Wines
47565	4601249002099	Вино Estrella бел полусладк 10-12% 0.700	22133	Продукты питания (folder)/Алкогольные напитки/Вино (folder)/Вино	47564	Эстрелла вино
3794768	4601211004175	Вино Estrella бел полусладк 10-12% 700ml	22133	Продукты питания (folder)/Алкогольные напитки/Вино (folder)/Вино	26476	Estrella
3794769	4605654007403	Вино Estrella бел полусладк 10-12% 700ml #2	22133	Продукты питания (folder)/Алкогольные напитки/Вино (folder)/Вино	26476	Estrella
227469	8410492002376	Вино Estrella дель мар бел полусладк 11.5% 750ml	22133	Продукты питания (folder)/Алкогольные напитки/Вино (folder)/Вино	0	
227470	8410492002369	Вино Estrella дель мар бел сух 12% 750ml	22133	Продукты питания (folder)/Алкогольные напитки/Вино (folder)/Вино	0	
227471	8410492002390	Вино Estrella дель мар красн полусладк 11.5% 750ml	22133	Продукты питания (folder)/Алкогольные напитки/Вино (folder)/Вино	0	
227472	8410492002383	Вино Estrella дель мар красн сух 12% 750ml	22133	Продукты питания (folder)/Алкогольные напитки/Вино (folder)/Вино	0	
47567	4601249002082	Вино Estrella красн полусладк 10-12% 700ml	22133	Продукты питания (folder)/Алкогольные напитки/Вино (folder)/Вино	47564	Эстрелла вино
3794770	4605654007427	Вино Estrella красн полусладк 10-12% 700ml #2	22133	Продукты питания (folder)/Алкогольные напитки/Вино (folder)/Вино	26476	Estrella
1196171	4601211004168	Вино Estrella красное полусладк 10.5-12.5% 700ml	22133	Продукты питания (folder)/Алкогольные напитки/Вино (folder)/Вино	26476	Estrella
47571	4601249002075	Вино Estrella мускат бел полусладк 10-12% 0.700	22133	Продукты питания (folder)/Алкогольные напитки/Вино (folder)/Вино	47564	Эстрелла вино
1196175	4601211004199	Вино Estrella мускат бел полусладк 10-12% 700ml	22133	Продукты питания (folder)/Алкогольные напитки/Вино (folder)/Вино	26476	Estrella
3794771	4605654007410	Вино Estrella мускат бел полусладк 10-12% 700ml #2	22133	Продукты питания (folder)/Алкогольные напитки/Вино (folder)/Вино	26476	Estrella
283433	3120581366283	Вино eurowine тур дю воск кюве Престиж белое сухое 11% 750ml ст/б	22133	Продукты питания (folder)/Алкогольные напитки/Вино (folder)/Вино	3792025	tour du vosc
1191591	4840109300719	Вино ev Земфира красн крепл. 17% 750ml (Молдова)	22133	Продукты питания (folder)/Алкогольные напитки/Вино (folder)/Вино	0	
1191592	4840109300603	Вино ev кагор красн дес. 16% 750ml (Молдова)	22133	Продукты питания (folder)/Алкогольные напитки/Вино (folder)/Вино	0	
1191593	4840109301655	Вино ev мускат аскони бел п/дес. 16% 750ml (Молдова)	22133	Продукты питания (folder)/Алкогольные напитки/Вино (folder)/Вино	0	
1191594	4840109300689	Вино ev мускат бел дес. 16% 750ml (Молдова)	22133	Продукты питания (folder)/Алкогольные напитки/Вино (folder)/Вино	0	
1191595	4840109301808	Вино ev мускат рубиновый красн п/дес. 16% 750ml (Молдова)	22133	Продукты питания (folder)/Алкогольные напитки/Вино (folder)/Вино	0	
3655327	8003971461001	Вино f&p игр бел сл.750ml	296061	Продукты питания (folder)/Алкогольные напитки/Вино (folder)/Вино игристое	3655326	F&P (CANTINE QUATTRO VALLI/ITALY)
3791273	4840045006553	Вино f.lamb Cabernet Sauvignon ф.н.м. красн полусладк 750ml	22133	Продукты питания (folder)/Алкогольные напитки/Вино (folder)/Вино	0	
3791274	4840045006546	Вино f.lamb муск.от.р.ф.а.бел полусладк 750ml	22133	Продукты питания (folder)/Алкогольные напитки/Вино (folder)/Вино	0	
3284377	3274430102413	Вино fabregeou, белое сухое, 11%, 750ml ст/б	22133	Продукты питания (folder)/Алкогольные напитки/Вино (folder)/Вино	0	
3284378	8003207111939	Вино falconello chianti красное сухое 12.5% 750ml стбут	22133	Продукты питания (folder)/Алкогольные напитки/Вино (folder)/Вино	0	
3284379	8003822007501	Вино falconello soave белое сухое 12.5% 750ml стбут	22133	Продукты питания (folder)/Алкогольные напитки/Вино (folder)/Вино	0	
3284380	8003822006252	Вино falconello veneto столов белое полусладк 12% 750ml ст/б	22133	Продукты питания (folder)/Алкогольные напитки/Вино (folder)/Вино	0	
3284381	3800016681395	Вино falern Cabernet Sauvignon столов красное сухое 10-12% 750ml ст/б	1759169	Продукты питания (folder)/Алкогольные напитки/Вино (folder)/Вина Болгарии	0	
3284383	3800009404819	Вино falern Chardonnay столов белое сухое 11-12% 750ml стекло	1759169	Продукты питания (folder)/Алкогольные напитки/Вино (folder)/Вина Болгарии	0	
3284382	3800016680985	Вино falern кадарка столов красное полусладк 10-12% 750ml ст/б	1759169	Продукты питания (folder)/Алкогольные напитки/Вино (folder)/Вина Болгарии	0	
691169	3211209127598	Вино famille castel Cabernet Sauvignon красн п/сух 12.5% 750ml	41821	Продукты питания (folder)/Алкогольные напитки/Вино (folder)/Вина Франции	691168	Фами Кастель
691172	3211209127659	Вино famille castel Chardonnay бел псух 750ml	41821	Продукты питания (folder)/Алкогольные напитки/Вино (folder)/Вина Франции	691168	Фами Кастель
691173	3211209117902	Вино famille castel Chardonnay мускат бел полусладк 750ml	41821	Продукты питания (folder)/Алкогольные напитки/Вино (folder)/Вина Франции	691168	Фами Кастель
3291796	3211209127864	Вино famille castel cuvee де франс vdf бел п сл. 11% 750ml стекло	22133	Продукты питания (folder)/Алкогольные напитки/Вино (folder)/Вино	2081330	Famille Castel
1195639	3211209127895	Вино famille castel cuvee де франс vdf крас. п сл. 11.5% 750ml стекло	22133	Продукты питания (folder)/Алкогольные напитки/Вино (folder)/Вино	2081330	Famille Castel
691170	3211209127741	Вино famille castel Merlot красн псух 750ml	41821	Продукты питания (folder)/Алкогольные напитки/Вино (folder)/Вина Франции	691168	Фами Кастель
3794570	3211209219538	Вино famille castel игр розов п.с.с.9-15 750ml	296061	Продукты питания (folder)/Алкогольные напитки/Вино (folder)/Вино игристое	0	
2425824	3211201048365	Вино famille castel кот де гасгонь вдп бел п/сух 11.5% 750ml	22133	Продукты питания (folder)/Алкогольные напитки/Вино (folder)/Вино	2081330	Famille Castel
1951241	3211201046255	Вино famille castel кюве де фр. красн сух9-15%750ml	1	Неклассифицированные/default	3794568	ФАМИЛЬ КАСТЕЛЬ
3794569	3211209205852	Вино famille castel кюве де фр. красн сух9-15%750ml #2	22133	Продукты питания (folder)/Алкогольные напитки/Вино (folder)/Вино	3794568	ФАМИЛЬ КАСТЕЛЬ
691171	3211209117841	Вино famille castel сира гренаж красн полусладк 750ml	41821	Продукты питания (folder)/Алкогольные напитки/Вино (folder)/Вина Франции	691168	Фами Кастель
3284384	4603040010402	Вино fanagoria reserve сухое красное 12-14% 750ml стекло	22133	Продукты питания (folder)/Алкогольные напитки/Вино (folder)/Вино	0	
3284385	4603040010167	Вино fanagoria черный Лекарь ликерное красное слад 15% 750ml стекло	22133	Продукты питания (folder)/Алкогольные напитки/Вино (folder)/Вино	0	
3284386	4660013286127	Вино Fashion rain Merlot саперави столов сухое красное 11-13% 750ml стбут	22133	Продукты питания (folder)/Алкогольные напитки/Вино (folder)/Вино	0	
3284387	4660013286110	Вино Fashion rain Sauvignon пино столов сухое белое 11-13% 750ml стбут	22133	Продукты питания (folder)/Алкогольные напитки/Вино (folder)/Вино	0	
46922	3700067803145	Вино fat bastard Cabernet Sauvignon красн сух 13% 750ml	41821	Продукты питания (folder)/Алкогольные напитки/Вино (folder)/Вина Франции	46921	Фэт Бастард
46924	3700067800045	Вино fat bastard Chardonnay бел сух 13.5% 750ml	41821	Продукты питания (folder)/Алкогольные напитки/Вино (folder)/Вина Франции	46921	Фэт Бастард
46923	3700067800717	Вино fat bastard сира красн сух 13% 750ml	41821	Продукты питания (folder)/Алкогольные напитки/Вино (folder)/Вина Франции	46921	Фэт Бастард
1191596	8002235015646	Вино fattoria il palagio Chardonnay Тоскана 2002 бел сухое 750ml Италия	22133	Продукты питания (folder)/Алкогольные напитки/Вино (folder)/Вино	0	
225333	3380330001302	Вино faugeres org domlaborief красн 750ml	41821	Продукты питания (folder)/Алкогольные напитки/Вино (folder)/Вина Франции	0	
3284388	8412276488062	Вино fayenzas красное сухое 13% 750ml ст/б	22133	Продукты питания (folder)/Алкогольные напитки/Вино (folder)/Вино	0	
3284389	3438931016918	Вино fb dumontигристое белое полусладк.10.5% 750ml с/б	22133	Продукты питания (folder)/Алкогольные напитки/Вино (folder)/Вино	3655332	F.B. DUMONT
3791677	8410702008457	Вино felix solis penasol Red сух красн 12% 1.0л #3	22133	Продукты питания (folder)/Алкогольные напитки/Вино (folder)/Вино	46716	Felix Solis
283194	8410702013840	Вино felix solis penasol бел полусладк столов 750ml 11% /Испания/	41484	Продукты питания (folder)/Алкогольные напитки/Вино (folder)/Вина Испании	46716	Felix Solis
691200	8410702015660	Вино felix solis penasol бел сух 1л	41484	Продукты питания (folder)/Алкогольные напитки/Вино (folder)/Вина Испании	46716	Felix Solis
46725	8410702006552	Вино felix solis penasol бел сух столов 1.0л 11.5% /Испания/	41484	Продукты питания (folder)/Алкогольные напитки/Вино (folder)/Вина Испании	46716	Felix Solis
151420	8410702004558	Вино felix solis penasol виура-айрен бел сух 11.5% 750ml	41484	Продукты питания (folder)/Алкогольные напитки/Вино (folder)/Вина Испании	46716	Felix Solis
283195	8410702013833	Вино felix solis penasol красн полусладк столов 750ml 11% /Испания/	41484	Продукты питания (folder)/Алкогольные напитки/Вино (folder)/Вина Испании	46716	Felix Solis
46726	8410702006545	Вино felix solis penasol красн сух столов 1.0л 12.5% /Испания/	41484	Продукты питания (folder)/Алкогольные напитки/Вино (folder)/Вина Испании	46716	Felix Solis
46727	8410702005012	Вино felix solis penasol сангрия вин/напиток крас 7% 1.0	41484	Продукты питания (folder)/Алкогольные напитки/Вино (folder)/Вина Испании	46716	Felix Solis
151424	8410702004541	Вино felix solis penasol темпранильо-гар красн сух 12% 750ml	41484	Продукты питания (folder)/Алкогольные напитки/Вино (folder)/Вина Испании	46716	Felix Solis
2426542	8410702011983	Вино felix solis penasol темпранильо-каберне красн сух 12.5% 750ml	22133	Продукты питания (folder)/Алкогольные напитки/Вино (folder)/Вино	46716	Felix Solis
151423	8410702009256	Вино felix solis penasol тинто красн сух столов 750ml 11.5% /Испания/русьимпорт/	41484	Продукты питания (folder)/Алкогольные напитки/Вино (folder)/Вина Испании	46716	Felix Solis
46717	8410702009331	Вино felix solis вилли Мария бел псух 11% 750ml	41484	Продукты питания (folder)/Алкогольные напитки/Вино (folder)/Вина Испании	46716	Felix Solis
46718	8410702002660	Вино felix solis вилли Мария красн псух 12% 750ml	41484	Продукты питания (folder)/Алкогольные напитки/Вино (folder)/Вина Испании	46716	Felix Solis
691193	8410702008242	Вино felix solis винья морена бел сух 750ml	41484	Продукты питания (folder)/Алкогольные напитки/Вино (folder)/Вина Испании	46716	Felix Solis
691192	8410702001922	Вино felix solis винья морена белое полусладк 10.5% 750ml стекло	41484	Продукты питания (folder)/Алкогольные напитки/Вино (folder)/Вина Испании	46716	Felix Solis
691194	8410702004480	Вино felix solis винья морена красн полусладк.750ml	41484	Продукты питания (folder)/Алкогольные напитки/Вино (folder)/Вина Испании	46716	Felix Solis
691195	8410702008235	Вино felix solis винья морена красн сух 750ml	41484	Продукты питания (folder)/Алкогольные напитки/Вино (folder)/Вина Испании	46716	Felix Solis
46719	8410702000741	Вино felix solis Дон солис бел псух 11% 700ml	41484	Продукты питания (folder)/Алкогольные напитки/Вино (folder)/Вина Испании	46716	Felix Solis
