ID	UPCEAN	Name	CategoryID	CategoryName	BrandID	BrandName
4923193	731509569605	Kiss broadway лiтл дiва Star стайл набор накладних нiгтiв 01/kiss 24pcs	1	Неклассифицированные/default	302239	Kiss
4923194	731509569612	Kiss broadway лiтл дiва Star стайл набор накладних нiгтiв 02/kiss 24pcs	1	Неклассифицированные/default	302239	Kiss
4923195	731509569629	Kiss broadway лiтл дiва Star стайл набор накладних нiгтiв 03/kiss 24pcs	1	Неклассифицированные/default	302239	Kiss
4923196	731509567120	Kiss broadway лiтл дiва бест френд набор накладних нiгтiв 02/kiss 28pcs	1	Неклассифицированные/default	302239	Kiss
2540485	731509606898	Kiss broadway лiтл дiва гель кендi набор накладних нiгтiв дит.01/ 20pcs	1	Неклассифицированные/default	2540478	Broadway Nails
2540486	731509607000	Kiss broadway лiтл дiва гель кендi набор накладних нiгтiв дит.02/ 20pcs	1	Неклассифицированные/default	2540478	Broadway Nails
4923197	731509607017	Kiss broadway лiтл дiва гель кендi набор накладних нiгтiв дит.03/ 20pcs	1	Неклассифицированные/default	302239	Kiss
4923198	731509023701	Kiss broadway лiтл дiва набор накладних нiгтiв та стикерiв 03/kis 28pcs	1	Неклассифицированные/default	302239	Kiss
4923199	731509537819	Kiss broadway ластiнг френч набор накладних нiгтiв m 05c/kiss bro 28pcs*2g	1	Неклассифицированные/default	302239	Kiss
4923200	731509537796	Kiss broadway ластiнг френч набор накладних нiгтiв s 01c/kiss bro 28pcs*2g	1	Неклассифицированные/default	302239	Kiss
4923201	731509005394	Kiss broadway средство для видалення штучних ногтей/kiss broadway arti 70ml	1	Неклассифицированные/default	302239	Kiss
4923202	731509531275	Kiss broadway фешн дiва Color набор стикерiв для ногтей 01/kiss bro 80pcs	1	Неклассифицированные/default	302239	Kiss
4923203	731509531282	Kiss broadway фешн дiва Color набор стикерiв для ногтей 02/kiss bro 80pcs	1	Неклассифицированные/default	302239	Kiss
4923204	731509531299	Kiss broadway фешн дiва Color набор стикерiв для ногтей 03/kiss bro 80pcs	1	Неклассифицированные/default	302239	Kiss
628902	731509020977	Kiss broadway фешн експресс набор накладних нiгтiв б/кл.m 01/kiss 24pcs	1	Неклассифицированные/default	302239	Kiss
628901	731509021868	Kiss broadway фешн експресс набор накладних нiгтiв б/кл.m 03/kiss 24pcs	1	Неклассифицированные/default	302239	Kiss
4923205	731509021875	Kiss broadway фешн експресс набор накладних нiгтiв б/кл.m 04/kiss 24pcs	1	Неклассифицированные/default	302239	Kiss
4923206	731509520729	Kiss broadway фешн експресс набор накладних нiгтiв б/кл.m 09/kiss 24pcs	1	Неклассифицированные/default	302239	Kiss
4923207	731509521085	Kiss broadway фешн експресс набор накладних нiгтiв б/кл.m 11/kiss 24pcs	1	Неклассифицированные/default	302239	Kiss
4923208	731509521115	Kiss broadway фешн експресс набор накладних нiгтiв б/кл.m 14/kiss 24pcs	1	Неклассифицированные/default	302239	Kiss
4923209	731509545029	Kiss broadway фешн експресс набор накладних нiгтiв б/кл.m 15/kiss 24pcs	1	Неклассифицированные/default	302239	Kiss
4923210	731509604092	Kiss broadway фешн експресс набор накладних нiгтiв б/кл.m 23/kiss 24pcs	1	Неклассифицированные/default	302239	Kiss
4460316	6923572519487	Kiss by sex in the city 3.3oz / 100ml (EDP) eau de Parfum spray New in retail Box (sealed) 3.3oz	1	Неклассифицированные/default	0	
1913096	5060066347902	Kiss caress Lip balm 3pk orig/Cherry/strawberry	1	Неклассифицированные/default	0	
4460317	731509800029	Kiss carnival Water decals 1ct	1	Неклассифицированные/default	0	
1513543	028367831907	Kiss cheap kisses 7p	1	Неклассифицированные/default	0	
2347922	731509520125	Kiss ciglia finte eyelusions	1	Неклассифицированные/default	0	
2162749	8594002480301	Kiss Classic sampon 1l breza	1	Неклассифицированные/default	0	
2162750	8594002480318	Kiss Classic sampon 1l zihlava	1	Неклассифицированные/default	0	
2162751	8594002480240	Kiss Classic sampon 500ml brezovy	1	Неклассифицированные/default	0	
2162752	8594002480066	Kiss Classic sampon 500ml chmel	1	Неклассифицированные/default	0	
2162753	8595245405328	Kiss Classic sampon 500ml harmancek	1	Неклассифицированные/default	0	
2162754	8595245405304	Kiss Classic sampon 500ml Jasmin	1	Неклассифицированные/default	0	
2162755	8594002480257	Kiss Classic sampon 500ml zihlavovy	1	Неклассифицированные/default	0	
2162756	8595245405748	Kiss Classic tek.m.1l citrus	1	Неклассифицированные/default	0	
2162757	8595245405755	Kiss Classic tek.m.1l mandla	1	Неклассифицированные/default	0	
2162758	8595245405779	Kiss Classic tek.m.1l north sea	1	Неклассифицированные/default	0	
2162759	8595245405762	Kiss Classic tek.m.1l oliva	1	Неклассифицированные/default	0	
2162760	8595245405700	Kiss Classic tek.m.500ml limet davk.	1	Неклассифицированные/default	0	
2162761	8595245405717	Kiss Classic tek.m.500ml mandla dav.	1	Неклассифицированные/default	0	
2162762	8594002481605	Kiss Classic tek.m.500ml north sea	1	Неклассифицированные/default	0	
2162763	8595245405724	Kiss Classic tek.m.500ml oliva davk.	1	Неклассифицированные/default	0	
4460318	731509910018	Kiss clear rhinestones 1ct	1	Неклассифицированные/default	0	
4460319	731455619225	Kiss clublife 2001 2 disc CD	1	Неклассифицированные/default	0	
2347923	731509520217	Kiss colla per ciglia finte	1	Неклассифицированные/default	0	
2347924	731509510959	Kiss colla per unghie Pure	1	Неклассифицированные/default	0	
4460320	602498617090	Kiss collection (DVD)	1	Неклассифицированные/default	0	
614092	877216000441	Kiss cologne sp for men 3.4floz	1	Неклассифицированные/default	302239	Kiss
2347925	731509515145	Kiss Color bonding base coat	1	Неклассифицированные/default	0	
4460321	731509901115	Kiss cosmetics dangle kit 1ct	1	Неклассифицированные/default	0	
4460322	837101030021	Kiss cover to cover CD (kiss tribute album)	1	Неклассифицированные/default	0	
2347926	731509003895	Kiss custom fit french	1	Неклассифицированные/default	0	
253572	731509005417	Kiss custom fit self Stick french nails for flat nails, fast fix (2-pack)	1	Неклассифицированные/default	302239	Kiss
253570	731509003840	Kiss customfit french beige 48u+peg una norm y pl	1	Неклассифицированные/default	0	
2347927	731509003871	Kiss customfit french Nail kit 04	1	Неклассифицированные/default	0	
2347928	731509003888	Kiss customfit french Nail kit 05	1	Неклассифицированные/default	0	
253571	731509003857	Kiss customfit french rosa 48u+peg una norm y pl	1	Неклассифицированные/default	0	
253573	731509005400	Kiss customfit self-Stick french beige 30u unas	1	Неклассифицированные/default	0	
216760	731509003864	Kiss customfit virtual Nail kit (na)	7943	Неклассифицированные/COSMETIC	0	
1031976	082700000863	Kiss d/p plsh a/gr	1	Неклассифицированные/default	0	
1031977	082700000856	Kiss d/p plsh b/yl	1	Неклассифицированные/default	0	
1031978	082700000986	Kiss d/p plsh d/wh	1	Неклассифицированные/default	0	
1031979	082700000993	Kiss d/p plsh g/pr	1	Неклассифицированные/default	0	
1031980	082700000832	Kiss d/p plsh h/bl	1	Неклассифицированные/default	0	
1031982	082700000849	Kiss d/p plsh s/pn	1	Неклассифицированные/default	0	
1031983	082700000412	Kiss d/p plsh t/ct	1	Неклассифицированные/default	0	
1031984	731509103380	Kiss d/p stckr #1	1	Неклассифицированные/default	0	
1031985	731509103397	Kiss d/p stckr #2	1	Неклассифицированные/default	0	
4460323	674945123539	Kiss daddy Good bye (DVD)	1	Неклассифицированные/default	0	
4460324	012236148838	Kiss daddy goodnight (DVD)	1	Неклассифицированные/default	0	
4460325	731509410020	Kiss dangles Nail kit loop 1 1ct	1	Неклассифицированные/default	0	
1913097	831527004154	Kiss dclnsr Blue 24ct/24	1	Неклассифицированные/default	0	
1913098	831527004161	Kiss dclnsr grn 24ct/24	1	Неклассифицированные/default	0	
1031986	571058903686	Kiss decals coupon	1	Неклассифицированные/default	0	
2347931	4710731060018	Kiss dehumidifier 650ml	278591	Хозяйственные товары (folder)/Бытовая химия (folder)/Освежитель воздуха	0	
2347932	6922075551383	Kiss dehumidifier florl scent 450ml	278591	Хозяйственные товары (folder)/Бытовая химия (folder)/Освежитель воздуха	0	
2347933	6922075551345	Kiss dehumidifier Lemon scent 450ml	278591	Хозяйственные товары (folder)/Бытовая химия (folder)/Освежитель воздуха	0	
2347934	6922075551369	Kiss dehumidifier Ocean scent 450ml	278591	Хозяйственные товары (folder)/Бытовая химия (folder)/Освежитель воздуха	0	
2347935	4710731060100	Kiss dehumidifier refill 650ml	278591	Хозяйственные товары (folder)/Бытовая химия (folder)/Освежитель воздуха	0	
2347936	6922075551376	Kiss dehumidifier Rose scent 450ml	278591	Хозяйственные товары (folder)/Бытовая химия (folder)/Освежитель воздуха	0	
2347937	4710731050101	Kiss dehumidifier unscented 450ml	278591	Хозяйственные товары (folder)/Бытовая химия (folder)/Освежитель воздуха	0	
2614231	731509604313	Kiss design perfection guides - 86ct	1	Неклассифицированные/default	302239	Kiss
2614232	5705589918450	Kiss dp-1600 kiss1600-eu	1	Неклассифицированные/default	0	
1031987	730509104038	Kiss Easy step col	1	Неклассифицированные/default	0	
1031988	731509103977	Kiss Easy step col #2	1	Неклассифицированные/default	0	
1031989	731509103984	Kiss Easy step col #3	1	Неклассифицированные/default	0	
1031990	731509103991	Kiss Easy step col #4	1	Неклассифицированные/default	0	
1031991	731509104004	Kiss Easy step col #5	1	Неклассифицированные/default	0	
1031992	731509104011	Kiss Easy step col #6	1	Неклассифицированные/default	0	
1031993	731509104028	Kiss Easy step col #7	1	Неклассифицированные/default	0	
1031994	731509104172	Kiss Easy step col #8	1	Неклассифицированные/default	0	
1031995	731509104189	Kiss Easy step col #9	1	Неклассифицированные/default	0	
1031996	731500103907	Kiss Easy step dec	1	Неклассифицированные/default	0	
1031997	731509103892	Kiss Easy step dec #2	1	Неклассифицированные/default	0	
1031998	731509103922	Kiss Easy step dec #3	1	Неклассифицированные/default	0	
1031999	731509104165	Kiss Easy step dec #4	1	Неклассифицированные/default	0	
1032000	731509103885	Kiss Easy step nls	1	Неклассифицированные/default	0	
1032001	731509103915	Kiss Easy step nls #2	1	Неклассифицированные/default	0	
1032002	731509103939	Kiss Easy step nls #3	1	Неклассифицированные/default	0	
1032003	731509103946	Kiss Easy step nls #4	1	Неклассифицированные/default	0	
1032004	731509103953	Kiss Easy step nls #5	1	Неклассифицированные/default	0	
1032005	731509103960	Kiss Easy step nls #6	1	Неклассифицированные/default	0	
1032006	731509104158	Kiss Easy step nls #7	1	Неклассифицированные/default	0	
614093	877216000519	Kiss EDP sp for women 3.4floz	4385	Парфюмерия (folder)/Парфюмерная вода	302239	Kiss
2614233	731509578997	Kiss ever ez lashes	1	Неклассифицированные/default	302239	Kiss
2614234	731509566307	Kiss ever ez lashes double pack 02	1	Неклассифицированные/default	302239	Kiss
2614235	731509566291	Kiss ever ez lashes double pack 03	1	Неклассифицированные/default	302239	Kiss
2614236	731509566284	Kiss ever ez lashes double pack 05	1	Неклассифицированные/default	302239	Kiss
2614237	731509579277	Kiss ever ez lashes medium combo - 30ct	1	Неклассифицированные/default	302239	Kiss
2614238	731509579260	Kiss ever ez lashes short combo - 30ct	1	Неклассифицированные/default	302239	Kiss
2347939	731509532388	Kiss ever lasting flat ef03	1	Неклассифицированные/default	0	
2347940	731509532395	Kiss ever lasting flat ef04	1	Неклассифицированные/default	0	
2347944	731509513837	Kiss everday french Black bewitching	1	Неклассифицированные/default	0	
2347945	731509513851	Kiss everday french Black onyx	1	Неклассифицированные/default	0	
2347946	731509513820	Kiss everday Nail Black Satin	1	Неклассифицированные/default	0	
2347941	731509532364	Kiss everlasting french Nail self tabs real short length - 28ct	1	Неклассифицированные/default	302239	Kiss
2347943	731509532401	Kiss everlasting french nails medium length - 28ct	1	Неклассифицированные/default	302239	Kiss
2614239	731509553604	Kiss everlasting french pearl french tip nails real short length - 28ct	1	Неклассифицированные/default	302239	Kiss
2614240	731509542448	Kiss everlasting french petites nails petite length - 28ct	1	Неклассифицированные/default	302239	Kiss
2614241	731509542486	Kiss everlasting french square shape nails real short length - 28ct	1	Неклассифицированные/default	302239	Kiss
2614243	731509566826	Kiss everlasting french wrap kit - 28ct	1	Неклассифицированные/default	302239	Kiss
2614244	731509588668	Kiss everlasting Gel polish	1	Неклассифицированные/default	302239	Kiss
2614245	731509582215	Kiss everlasting Gel polish Color Gel starter System	1	Неклассифицированные/default	302239	Kiss
2614246	731509582284	Kiss everlasting Gel polish french	1	Неклассифицированные/default	302239	Kiss
2614247	731509582222	Kiss everlasting Gel polish french manicare kit	1	Неклассифицированные/default	302239	Kiss
2614248	731509582338	Kiss everlasting Gel polish Galaxy	1	Неклассифицированные/default	302239	Kiss
2614249	731509582246	Kiss everlasting Gel polish lush	1	Неклассифицированные/default	302239	Kiss
2614250	731509582345	Kiss everlasting Gel polish onyx	1	Неклассифицированные/default	302239	Kiss
2614251	731509582314	Kiss everlasting Gel polish sweet	1	Неклассифицированные/default	302239	Kiss
2614252	731509588651	Kiss everlasting Gel polish top Gel	1	Неклассифицированные/default	302239	Kiss
2347942	731509532371	Kiss everlasting regular ef02	1	Неклассифицированные/default	302239	Kiss
2347947	731509506815	Kiss every Day 01	1	Неклассифицированные/default	0	
2347948	731509506822	Kiss every Day 02	1	Неклассифицированные/default	0	
2347949	731509506839	Kiss every Day 03	1	Неклассифицированные/default	0	
2347950	731509506846	Kiss every Day 04	1	Неклассифицированные/default	0	
2347951	731509510379	Kiss express on quick	1	Неклассифицированные/default	0	
253574	731509510355	Kiss express on sticker nails Lady epn01	1	Неклассифицированные/default	302239	Kiss
253575	731509510362	Kiss express on sticker nails Lady epn02	1	Неклассифицированные/default	0	
2347952	649674008075	Kiss Fashion toe Nail tn01	1	Неклассифицированные/default	0	
2347953	649674008082	Kiss Fashion toe Nail tn02	1	Неклассифицированные/default	0	
2347954	731509504811	Kiss Fashion toe nails 14	1	Неклассифицированные/default	0	
253576	731509022001	Kiss Fashion toe nails rojo chanel 24u unas pies	1	Неклассифицированные/default	0	
253577	731509021998	Kiss Fashion toe nails rosa 24u unas pies+decorac	1	Неклассифицированные/default	0	
2347955	731509520330	Kiss feather Light short 52033	1	Неклассифицированные/default	0	
2347956	731509520347	Kiss feather Light short 52034	1	Неклассифицированные/default	0	
1032007	571058901507	Kiss file $1.99coupon	1	Неклассифицированные/default	0	
4460326	034000127221	Kiss filled w/Peanut Butter drc * 11oz 36ct	1	Неклассифицированные/default	0	
4460327	731509136173	Kiss flares Water decals 1ct	1	Неклассифицированные/default	0	
4460328	731509171013	Kiss fnch lace/Rose decal 1ct	1	Неклассифицированные/default	0	
1032008	667175000244	Kiss fnger&toe 3	1353121	Галантерея (folder)/Bodyart	0	
2347957	731509505177	Kiss forbicine rounded tip	1	Неклассифицированные/default	0	
4460329	731509171006	Kiss forever fnch Water dsn 1ct	1	Неклассифицированные/default	0	
2614253	731509579086	Kiss french artist pen kit White	1	Неклассифицированные/default	302239	Kiss
253578	731509172010	Kiss french manic beige 3 lacas+plantillas+calcom	1	Неклассифицированные/default	0	
253579	731509172003	Kiss french manic rosa 3 lacas+plantillas+calcom	1	Неклассифицированные/default	0	
2347958	731509519204	Kiss french manicure kit perla	1	Неклассифицированные/default	0	
2347959	731509017755	Kiss french manucure kit 04	1	Неклассифицированные/default	0	
2347960	731509509557	Kiss french Nail kit 24pz	1	Неклассифицированные/default	0	
2347961	649674011662	Kiss french Nail tip gn13	1	Неклассифицированные/default	0	
2347962	649674011679	Kiss french Nail tip gn14	1	Неклассифицированные/default	0	
2347963	649674011686	Kiss french Nail tip gn15	1	Неклассифицированные/default	0	
1032184	731509135152	Kiss french overlap nails 40ct	1	Неклассифицированные/default	0	
2614254	731509604320	Kiss french tip extensions french tip - 24ct	1	Неклассифицированные/default	302239	Kiss
2614255	731509604337	Kiss french tip extensions Natural tip - 24ct	1	Неклассифицированные/default	302239	Kiss
2162764	46153524	Kiss Fresh Apple superslims/80/p 21%	1	Неклассифицированные/default	0	
1032009	731509172041	Kiss frnch man kit	1	Неклассифицированные/default	0	
2614256	731509604351	Kiss Galaxy effects kit	1	Неклассифицированные/default	302239	Kiss
4460330	731509171044	Kiss Garden/gld roses decal 1ct	1	Неклассифицированные/default	0	
2614257	731509604665	Kiss Gel dress full/Art strips rise&Shine - 40ct	1	Неклассифицированные/default	302239	Kiss
2614258	731509604610	Kiss Gel dress full/Art strips sugar&Spice - 40ct	1	Неклассифицированные/default	302239	Kiss
2614259	731509604634	Kiss Gel dress full/d.i.y. strips Royal flush - 40ct	1	Неклассифицированные/default	302239	Kiss
2614260	731509604603	Kiss Gel dress full/french strips after midnight - 40ct	1	Неклассифицированные/default	302239	Kiss
2614261	731509604658	Kiss Gel dress full/french strips cold springs - 40ct	1	Неклассифицированные/default	302239	Kiss
2614262	731509604566	Kiss Gel dress full/french strips disco lights - 40ct	1	Неклассифицированные/default	302239	Kiss
2614263	731509604672	Kiss Gel dress full/french strips fairy dust - 40ct	1	Неклассифицированные/default	302239	Kiss
2614264	731509604559	Kiss Gel dress full/french strips glisten up - 40ct	1	Неклассифицированные/default	302239	Kiss
2614265	731509604580	Kiss Gel dress full/french strips majestic - 40ct	1	Неклассифицированные/default	302239	Kiss
2614266	731509604573	Kiss Gel dress full/french strips moon Shine - 40ct	1	Неклассифицированные/default	302239	Kiss
2614267	731509604597	Kiss Gel dress full/french strips starry Night - 40ct	1	Неклассифицированные/default	302239	Kiss
2614268	731509604641	Kiss Gel dress full/french strips sweet melody - 40ct	1	Неклассифицированные/default	302239	Kiss
253580	731509020649	Kiss glitter sticker (calcomanias) ref.xmns01	1	Неклассифицированные/default	0	
253581	731509020656	Kiss glitter sticker (calcomanias) ref.xmns02	1	Неклассифицированные/default	0	
253582	731509110128	Kiss glue Nail maximum Speed 3g	1	Неклассифицированные/default	0	
4460331	731509135510	Kiss Gold lines Water decal 1ct	1	Неклассифицированные/default	0	
2614269	731509580853	Kiss gradation polishes	1	Неклассифицированные/default	302239	Kiss
2614270	731509583670	Kiss gradation polishes #2	1	Неклассифицированные/default	302239	Kiss
1032010	667175001098	Kiss Halloween tattoo	1353121	Галантерея (folder)/Bodyart	0	
1032011	667175001111	Kiss Halloween tattoo #2	1353121	Галантерея (folder)/Bodyart	0	
1032012	667175001135	Kiss Halloween tattoo #3	1353121	Галантерея (folder)/Bodyart	0	
2347966	731509002164	Kiss heel, toe&elbow pumice	1	Неклассифицированные/default	0	
1032013	731509136463	Kiss henna decal	1	Неклассифицированные/default	0	
4460332	877216000533	Kiss her lovin Body Lotion	1	Неклассифицированные/default	0	
1799072	877216000434	Kiss him (Rock band) EDC m spray 1.7oz	4835	Парфюмерия (folder)/Одеколон	0	
4460333	601215760521	Kiss house nation 2000 - various artists (2CD)	1	Неклассифицированные/default	0	
4923211	731509540680	Kiss i-енвi premium класiк накладнi пучки чорнi m/kiss i-envy pr 70pcs	1	Неклассифицированные/default	302239	Kiss
4923212	731509540673	Kiss i-енвi premium класiк накладнi пучки чорнi s/kiss i-envy pr 70pcs	1	Неклассифицированные/default	302239	Kiss
4923213	731509540697	Kiss i-енвi premium класiк накладнi пучки чорнi s/m/l/kiss i-env 70pcs	1	Неклассифицированные/default	302239	Kiss
4923214	731509541090	Kiss i-енвi premium накладнi вiї juicy volume 02/kiss i-envy prem 2pcs	1	Неклассифицированные/default	302239	Kiss
4923215	731509541045	Kiss i-енвi premium накладнi вiї о натюрель 01/kiss i-envy premi 2pcs	1	Неклассифицированные/default	302239	Kiss
4923216	731509541052	Kiss i-енвi premium накладнi вiї о натюрель 02/kiss i-envy premi 2pcs	1	Неклассифицированные/default	302239	Kiss
4923217	731509541137	Kiss i-енвi premium накладнi вiї папарацi 01/kiss i-envy premium 2pcs	1	Неклассифицированные/default	302239	Kiss
4923218	731509541144	Kiss i-енвi premium накладнi вiї папарацi 02/kiss i-envy premium 2pcs	1	Неклассифицированные/default	302239	Kiss
4923219	731509541236	Kiss i-енвi клей для накладних пучкiв прозорий/kiss i-envy Long La 3.5g	1	Неклассифицированные/default	302239	Kiss
4460334	731458551829	Kiss ibiza 2001 - various artists (2CD)	1	Неклассифицированные/default	0	
1032014	667175001036	Kiss instant tattoo	1353121	Галантерея (folder)/Bodyart	0	
1032015	667175001050	Kiss instant tattoo #2	1353121	Галантерея (folder)/Bodyart	0	
1032016	667175001074	Kiss instant tattoo #3	1353121	Галантерея (folder)/Bodyart	0	
