ID	UPCEAN	Name	CategoryID	CategoryName	BrandID	BrandName
3516910	4610008699401	Семена евро-семена кабачок золотинка 10шт м/у #2	324395	Растениеводство (folder)/Семена	0	
3516911	4690698006697	Семена евро-семена кабачок изумрудный мягуп 1g	324395	Растениеводство (folder)/Семена	0	
3516912	4690698008103	Семена евро-семена кабачок квентин 10шт м/у	324395	Растениеводство (folder)/Семена	0	
3516913	4690698010007	Семена евро-семена кабачок любимчик 10шт м/у	324395	Растениеводство (folder)/Семена	0	
3516914	4660004418186	Семена евро-семена кабачок нефрит f1 5шт м/у	324395	Растениеводство (folder)/Семена	0	
3516915	4610008691702	Семена евро-семена кабачок скворушка 10шт м/у	324395	Растениеводство (folder)/Семена	0	
3516916	4690698003962	Семена евро-семена кабачок цубода 10шт м/у	324395	Растениеводство (folder)/Семена	0	
3516917	4660004411064	Семена евро-семена кабачок цукеша 10шт м/у	324395	Растениеводство (folder)/Семена	0	
3516918	4660004411071	Семена евро-семена кабачок цукеша 10шт м/у #2	324395	Растениеводство (folder)/Семена	0	
3516919	4660004411088	Семена евро-семена кабачок черный красавец 10шт м/у	324395	Растениеводство (folder)/Семена	0	
3516920	4660004411095	Семена евро-семена кабачок черный красавец 10шт м/уп	324395	Растениеводство (folder)/Семена	0	
3516921	4610008698558	Семена евро-семена кабачок якорь 10шт м/у	324395	Растениеводство (folder)/Семена	0	
3516922	4660004411101	Семена евро-семена кабачок якорь 10шт м/у #2	324395	Растениеводство (folder)/Семена	0	
3516923	4610008696271	Семена евро-семена календула гейша лекарственная мягуп 0.5g	324395	Растениеводство (folder)/Семена	0	
3516924	4690698005652	Семена евро-семена календула гитана оранжевая лекарственная мягуп 0.5g	324395	Растениеводство (folder)/Семена	0	
3516925	4690698003511	Семена евро-семена календула денди лекарственная мягуп 0.5g	324395	Растениеводство (folder)/Семена	0	
3516926	4660004416069	Семена евро-семена календула лимонная красавица лекарственная мягуп 1g	324395	Растениеводство (folder)/Семена	0	
3516927	4690698003290	Семена евро-семена календула оранжевый леденец лекарственная мягуп 0.3g	324395	Растениеводство (folder)/Семена	0	
3516928	4610008695731	Семена евро-семена календула радио лекарственная мягуп 0.5g	324395	Растениеводство (folder)/Семена	0	
3516929	4690698003528	Семена евро-семена календула самоцветы лекарственная смесь мягуп 0.3g	324395	Растениеводство (folder)/Семена	0	
3516930	4690698003283	Семена евро-семена календула самоцветы смесь 0.5g т/у	324395	Растениеводство (folder)/Семена	0	
3516931	4660004416090	Семена евро-семена календула суприм лекарственная мягуп 1g	324395	Растениеводство (folder)/Семена	0	
3516932	4690698011813	Семена евро-семена календула тач оф ред лекарственная мягуп 0.3g	324395	Растениеводство (folder)/Семена	0	
3516933	4610008694642	Семена евро-семена календула фиеста гитана лекарственная мягуп 0.5g	324395	Растениеводство (folder)/Семена	0	
3516934	4660004416106	Семена евро-семена камнеломка красная мягуп 0.02g	324395	Растениеводство (folder)/Семена	0	
3516935	4660004416113	Семена евро-семена камнеломка пурпурная мягуп 0.02g	324395	Растениеводство (folder)/Семена	0	
3516936	4690698003597	Семена евро-семена кампанула гломерата акаулис колокольчик скученный мягуп 0.05g	324395	Растениеводство (folder)/Семена	0	
3516937	4660004411286	Семена евро-семена капуста f1 Колобок белокочанная 0.1g т/у	324395	Растениеводство (folder)/Семена	0	
3516938	4660004411385	Семена евро-семена капуста f1 слава белокочанная мягуп 0.5g	324395	Растениеводство (folder)/Семена	0	
3516939	4610008699395	Семена евро-семена капуста аванград f1 краснокочанная мягуп 0.2g	324395	Растениеводство (folder)/Семена	0	
3516940	4660004411132	Семена евро-семена капуста амагер 611 белокочанная мягуп 0.5g	324395	Растениеводство (folder)/Семена	0	
3516941	4610008699319	Семена евро-семена капуста белокочанная сб-3 f1 мягуп 1g	324395	Растениеводство (folder)/Семена	0	
3516942	4660004411392	Семена евро-семена капуста белокочанная слава 1305	324395	Растениеводство (folder)/Семена	0	
3516943	4660004411156	Семена евро-семена капуста белорусская 455 белокочанная мягуп 0.5g	324395	Растениеводство (folder)/Семена	0	
3516944	4660004411569	Семена евро-семена капуста бокал пекинская мягуп 0.3g	324395	Растениеводство (folder)/Семена	0	
3516945	4660004411477	Семена евро-семена капуста брокколи тонус мягуп 0.3g	324395	Растениеводство (folder)/Семена	0	
3516946	4660004418445	Семена евро-семена капуста брокколи цезар мягуп 0.3g	324395	Растениеводство (folder)/Семена	0	
3516947	4660004411187	Семена евро-семена капуста Валентина f1 белокочанная мягуп 0.1g	324395	Растениеводство (folder)/Семена	0	
3516948	4660004411491	Семена евро-семена капуста венская белая 1350 кольраби мягуп 0.5g	324395	Растениеводство (folder)/Семена	0	
3516949	4690698007229	Семена евро-семена капуста ворожея пекинская 3шт м/у	324395	Растениеводство (folder)/Семена	0	
3516950	4660004411194	Семена евро-семена капуста вьюга белокочанная мягуп 0.3g	324395	Растениеводство (folder)/Семена	0	
3516951	4610008691979	Семена евро-семена капуста грибовская цветная ранняя мягуп 0.3g	324395	Растениеводство (folder)/Семена	0	
3516952	4660004411125	Семена евро-семена капуста грибовский номер первый белокочанная мягуп 0.5g	324395	Растениеводство (folder)/Семена	0	
3516953	4690698013824	Семена евро-семена капуста джесси цветная мягуп 0.3g	324395	Растениеводство (folder)/Семена	0	
3516954	4690698008493	Семена евро-семена капуста задумка кольраби мягуп 0.3g	324395	Растениеводство (folder)/Семена	0	
3516955	4690698019734	Семена евро-семена капуста зеленый сугроб цветная мягуп 0.3g	324395	Растениеводство (folder)/Семена	0	
3516956	4660004411217	Семена евро-семена капуста зимовка 1474 белокочанная 0.5g т/у	324395	Растениеводство (folder)/Семена	0	
3516957	4690698008479	Семена евро-семена капуста зимушка брюссельская 0.5g	324395	Растениеводство (folder)/Семена	0	
3516958	4660004418254	Семена евро-семена капуста Золотой гектар 1432 белокочанная 5шт м/у	324395	Растениеводство (folder)/Семена	0	
3516959	4610008691764	Семена евро-семена капуста Золотой гектар белокочанная мягуп 0.5g	324395	Растениеводство (folder)/Семена	0	
3516960	4660004411231	Семена евро-семена капуста июньская белокочанная мягуп 0.5g	324395	Растениеводство (folder)/Семена	0	
3516961	4660004411538	Семена евро-семена капуста калибос краснокочанная мягуп 0.3g	324395	Растениеводство (folder)/Семена	0	
3516962	4610008691771	Семена евро-семена капуста каменна глова белокочанная мягуп 0.3g	324395	Растениеводство (folder)/Семена	0	
3516963	4660004418452	Семена евро-семена капуста касио брюссельская мягуп 0.3g	324395	Растениеводство (folder)/Семена	0	
3516964	4660004411514	Семена евро-семена капуста кольраби виолета мягуп 0.5g	324395	Растениеводство (folder)/Семена	0	
3516965	4690698008196	Семена евро-семена капуста кольраби виталина мягуп 0.3g	324395	Растениеводство (folder)/Семена	0	
3516966	4660004418476	Семена евро-семена капуста кольраби гигант	324395	Растениеводство (folder)/Семена	0	
3516967	4690698008202	Семена евро-семена капуста кольраби неженка мягуп 0.3g	324395	Растениеводство (folder)/Семена	0	
3516968	4690698008486	Семена евро-семена капуста мальвина краснокочанная мягуп 0.3g	324395	Растениеводство (folder)/Семена	0	
3516969	4690698007755	Семена евро-семена капуста марфушка белокочанная мягуп 0.3g	324395	Растениеводство (folder)/Семена	0	
3516970	4660004411309	Семена евро-семена капуста московская поздняя 15 белокочанная мягуп 0.5g	324395	Растениеводство (folder)/Семена	0	
3516971	4660004411316	Семена евро-семена капуста московская поздняя 15 белокочанная мягуп 0.5g #2	324395	Растениеводство (folder)/Семена	0	
3516972	4660004411330	Семена евро-семена капуста надежда белокочанная мягуп 0.5g	324395	Растениеводство (folder)/Семена	0	
3516973	4690698005874	Семена евро-семена капуста певунья белая f1 декоративная 5шт м/у	324395	Растениеводство (folder)/Семена	0	
3516974	4660004411354	Семена евро-семена капуста подарок белокочанная мягуп 0.5g	324395	Растениеводство (folder)/Семена	0	
3516975	4610008691832	Семена евро-семена капуста ринда белокочанная f1 15шт м/уп	324395	Растениеводство (folder)/Семена	0	
3516976	4610008694635	Семена евро-семена капуста смесь декоративная мягуп 0.1g	324395	Растениеводство (folder)/Семена	0	
3516977	4660004418384	Семена евро-семена капуста сулейка f1 белокочанная 15шт м/у	324395	Растениеводство (folder)/Семена	0	
3516978	4660004411446	Семена евро-семена капуста трансфер f1 белокочанная мягуп 0.1g	324395	Растениеводство (folder)/Семена	0	
3516979	4610008698244	Семена евро-семена капуста фаворит f1 белокочанная мягуп 0.1g	324395	Растениеводство (folder)/Семена	0	
3516980	4690698007762	Семена евро-семена капуста фермерша белокочанная мягуп 0.3g	324395	Растениеводство (folder)/Семена	0	
3516981	4660004417455	Семена евро-семена капуста харьковская зимняя белокочанная мягуп 0.5g	324395	Растениеводство (folder)/Семена	0	
3516982	4690698007236	Семена евро-семена капуста царевна цветная мягуп 0.3g	324395	Растениеводство (folder)/Семена	0	
3516984	4660004418506	Семена евро-семена капуста юбилейная 2170 савойская мягуп 0.5g	324395	Растениеводство (folder)/Семена	0	
3516985	4610008698091	Семена евро-семена кларкия красный король изящная мягуп 0.5g	324395	Растениеводство (folder)/Семена	0	
3516986	4660004416137	Семена евро-семена кларкия радость изящная мягуп 0.5g	324395	Растениеводство (folder)/Семена	0	
3516987	4610008695793	Семена евро-семена клеома цветной фонтан колючая мягуп 0.1g	324395	Растениеводство (folder)/Семена	0	
3516988	4610008697551	Семена евро-семена клещевина занзибарская 4шт м/у	324395	Растениеводство (folder)/Семена	0	
3516989	4610008694772	Семена евро-семена кобея фиолетовая лазающая мягуп 0.3g	324395	Растениеводство (folder)/Семена	0	
3516990	4690698000787	Семена евро-семена колеус визард мозаика 7шт м/у	324395	Растениеводство (folder)/Семена	0	
3516991	4690698000794	Семена евро-семена колеус визард скарлет 7шт м/у	324395	Растениеводство (folder)/Семена	0	
3516992	4690698000800	Семена евро-семена колеус черный дракон 7шт м/у	324395	Растениеводство (folder)/Семена	0	
3516993	4610008696400	Семена евро-семена космея вега мягуп 0.5g	324395	Растениеводство (folder)/Семена	0	
3516994	4660004416212	Семена евро-семена космея ковер мягуп 0.5g	324395	Растениеводство (folder)/Семена	0	
3516995	4660004416236	Семена евро-семена космея пикоти мягуп 0.5g	324395	Растениеводство (folder)/Семена	0	
3516996	4690698001883	Семена евро-семена космея рубенза мягуп 0.1g	324395	Растениеводство (folder)/Семена	0	
3516997	4690698013060	Семена евро-семена космея снежное облако дабл клик мягуп 0.05g	324395	Растениеводство (folder)/Семена	0	
3516998	4660004411651	Семена евро-семена кресс-салат данский мягуп 1g	324395	Растениеводство (folder)/Семена	0	
3516999	4690698003634	Семена евро-семена кресс-салат зимний мягуп 0.5g	324395	Растениеводство (folder)/Семена	0	
3517000	4660004418582	Семена евро-семена кукуруза кубанский сахарный 210 f1 мягуп 5g	324395	Растениеводство (folder)/Семена	0	
3517001	4660004411675	Семена евро-семена кукуруза сахарная утренняя песня мягуп 3g	324395	Растениеводство (folder)/Семена	0	
3517002	4610008694451	Семена евро-семена левкой маттиола карилковая смесь мягуп 0.1g	324395	Растениеводство (folder)/Семена	0	
3517003	4610008697070	Семена евро-семена лихнис халцедонский красный мягуп 0.1g	324395	Растениеводство (folder)/Семена	0	
3517004	4660004416311	Семена евро-семена лобелия каскад белый ежевидная мягуп 0.01g	324395	Растениеводство (folder)/Семена	0	
3517005	4660004416366	Семена евро-семена лобелия нити жемчуга ежевидная мягуп 0.01g	324395	Растениеводство (folder)/Семена	0	
3517006	4660004416373	Семена евро-семена лобелия розамонд ежевидная мягуп 0.02g	324395	Растениеводство (folder)/Семена	0	
3517007	4660004411712	Семена евро-семена лук батун апрельский мягуп 0.3g	324395	Растениеводство (folder)/Семена	0	
3517008	4660004418612	Семена евро-семена лук батун нежность мягуп 1g	324395	Растениеводство (folder)/Семена	0	
3517009	4660004418681	Семена евро-семена лук брунсвик репчатый мягуп 1g	324395	Растениеводство (folder)/Семена	0	
3517010	4690698006727	Семена евро-семена лук жираф порей 1g	324395	Растениеводство (folder)/Семена	0	
3517011	4660004411729	Семена евро-семена лук порей казимир мягуп 1g	324395	Растениеводство (folder)/Семена	0	
3517012	4610008698435	Семена евро-семена лук порей премьер мягуп 1g	324395	Растениеводство (folder)/Семена	0	
3517013	4610008698749	Семена евро-семена лук порей премьер мягуп 1g #2	324395	Растениеводство (folder)/Семена	0	
3517014	4610008693973	Семена евро-семена лук репчатый даниловский 1g	324395	Растениеводство (folder)/Семена	0	
3517015	4690698011950	Семена евро-семена лук шалот изумруд мягуп 0.3g	324395	Растениеводство (folder)/Семена	0	
3517016	4660004411880	Семена евро-семена лук штуттгартер репчатый ризен мягуп 1g	324395	Растениеводство (folder)/Семена	0	
3517017	4660004411873	Семена евро-семена лук штуттгартер ризен репчатый мягуп 1g	324395	Растениеводство (folder)/Семена	0	
3517018	4610008696134	Семена евро-семена львиный зев алый гигант мягуп 0.1g	324395	Растениеводство (folder)/Семена	0	
3517019	4610008696141	Семена евро-семена львиный зев брайтон рок мягуп 0.1g	324395	Растениеводство (folder)/Семена	0	
3517020	4610008694093	Семена евро-семена львиный зев волшебный ковер мягуп 0.1g	324395	Растениеводство (folder)/Семена	0	
3517021	4690698003986	Семена евро-семена львиный зев кимоси алый мягуп 0.05g	324395	Растениеводство (folder)/Семена	0	
3517022	4690698003993	Семена евро-семена львиный зев кимоси белый мягуп 0.05g	324395	Растениеводство (folder)/Семена	0	
3517023	4690698004013	Семена евро-семена львиный зев кимоси яблоневый цвет мягуп 0.05g	324395	Растениеводство (folder)/Семена	0	
3517024	4610008695557	Семена евро-семена львиный зев маджестик мягуп 0.1g	324395	Растениеводство (folder)/Семена	0	
3517025	4690698004037	Семена евро-семена львиный зев Радуга смесь мягуп 0.1g	324395	Растениеводство (folder)/Семена	0	
3517026	4610008696110	Семена евро-семена львиный зев снежок мягуп 0.1g	324395	Растениеводство (folder)/Семена	0	
3517027	4690698004136	Семена евро-семена львиный зев твинни f1 смесь 10шт м/у	324395	Растениеводство (folder)/Семена	0	
3517028	4610008695526	Семена евро-семена львиный зев тетра мягуп 0.1g	324395	Растениеводство (folder)/Семена	0	
3517029	4610008693980	Семена евро-семена майоран лакомка садовый мягуп 0.2g	324395	Растениеводство (folder)/Семена	0	
3517030	4690698012117	Семена евро-семена мальва чернавка мягуп 0.1g	324395	Растениеводство (folder)/Семена	0	
3517031	4660004416519	Семена евро-семена маргаритка сюрприз помпонная смесь мягуп 0.01g	324395	Растениеводство (folder)/Семена	0	
3517032	4690698000251	Семена евро-семена маттиола/левкой винтаж смесь мягуп 0.02g	324395	Растениеводство (folder)/Семена	0	
3517033	4690698010250	Семена евро-семена маттиола/левкой люсинда дип блу махровая мягуп 0.02g	324395	Растениеводство (folder)/Семена	0	
3517034	4660004411903	Семена евро-семена морковь амстердамска мягуп 1g	324395	Растениеводство (folder)/Семена	0	
3517035	4660004411910	Семена евро-семена морковь витаминная 6 мягуп 2g	324395	Растениеводство (folder)/Семена	0	
3517036	4610008695601	Семена евро-семена морковь детская сладость 2g т/у	324395	Растениеводство (folder)/Семена	0	
3517037	4610008692143	Семена евро-семена морковь долянка 1g т/у	324395	Растениеводство (folder)/Семена	0	
3517038	4660004411941	Семена евро-семена морковь карлена мягуп 1g	324395	Растениеводство (folder)/Семена	0	
3517039	4690698014326	Семена евро-семена морковь коляда мягуп 1g	324395	Растениеводство (folder)/Семена	0	
3517040	4690698007519	Семена евро-семена морковь королева осени мягуп 2g	324395	Растениеводство (folder)/Семена	0	
3517041	4660004411965	Семена евро-семена морковь лосиноостровская 13 мягуп 2g	324395	Растениеводство (folder)/Семена	0	
3517042	4610008692198	Семена евро-семена морковь марлинка мягуп 2g	324395	Растениеводство (folder)/Семена	0	
3517043	4660004411972	Семена евро-семена морковь московская зимняя а 515 мягуп 2g	324395	Растениеводство (folder)/Семена	0	
3517044	4660004411996	Семена евро-семена морковь нантская 4 мягуп 2g	324395	Растениеводство (folder)/Семена	0	
3517045	4660004412009	Семена евро-семена морковь нантская 4 мягуп 2g #2	324395	Растениеводство (folder)/Семена	0	
3517046	4610008696059	Семена евро-семена морковь нантская без сердцевины мягуп 2g	324395	Растениеводство (folder)/Семена	0	
3517047	4660004412016	Семена евро-семена морковь нииох 336 мягуп 2g	324395	Растениеводство (folder)/Семена	0	
3517048	4610008692204	Семена евро-семена морковь осенний король мягуп 2g	324395	Растениеводство (folder)/Семена	0	
3517049	4690698010052	Семена евро-семена морковь Принцесса мягуп 2g	324395	Растениеводство (folder)/Семена	0	
3517050	4660004412061	Семена евро-семена морковь роте ризен (красный великан) мягуп 2g	324395	Растениеводство (folder)/Семена	0	
