ID	UPCEAN	Name	CategoryID	CategoryName	BrandID	BrandName
42046	7798105341021	Вино артина сира гран рез красн сух 13% 750мл	22169	Продукты питания (folder)/Алкогольные напитки/Вино (folder)/Вина Новый Свет	42042	Артина
42047	7798105347108	Вино артина сира красн сух 12.8% 750мл	22169	Продукты питания (folder)/Алкогольные напитки/Вино (folder)/Вина Новый Свет	42042	Артина
42048	7798105347122	Вино артина торронтес столов сухое белое 12.5% 750мл стекло	22169	Продукты питания (folder)/Алкогольные напитки/Вино (folder)/Вина Новый Свет	42042	Артина
688867	7798105347610	Вино артина торронтес, 3л 12% сухое	22133	Продукты питания (folder)/Алкогольные напитки/Вино (folder)/Вино	0	
42050	7798105349331	Вино артина шенин блан белое сухое 12.5% 750мл	22169	Продукты питания (folder)/Алкогольные напитки/Вино (folder)/Вина Новый Свет	42042	Артина
1759969	7798055688238	Вино артинамальбек к.с13% 750мл	22133	Продукты питания (folder)/Алкогольные напитки/Вино (folder)/Вино	0	
1759970	7798055688269	Вино артинаторрон.б.с 12.5% 750мл	22133	Продукты питания (folder)/Алкогольные напитки/Вино (folder)/Вино	0	
2854273	4607154481523	Вино артисан Merlot столов полусладк красное 10-12% 1л т\пак	22133	Продукты питания (folder)/Алкогольные напитки/Вино (folder)/Вино	0	
2854837	4607154481509	Вино артисан Sauvignon столов белое полусладк 10-12% tetrapak 1л	22133	Продукты питания (folder)/Алкогольные напитки/Вино (folder)/Вино	0	
1195080	4607154481486	Вино артисан Изабелла столов полусладк красное 10-12% tetrapak 1л	22133	Продукты питания (folder)/Алкогольные напитки/Вино (folder)/Вино	3794777	ЮЖНЫЙ ВИНОДЕЛ
282348	8437010128509	Вино аруспайд нэйче айрен бел сух 750мл 11.5% /Испания/	22133	Продукты питания (folder)/Алкогольные напитки/Вино (folder)/Вино	0	
282349	8437010128523	Вино аруспайд нэйче темпранильо красн сух 750мл 13.5% /Испания/	22133	Продукты питания (folder)/Алкогольные напитки/Вино (folder)/Вино	0	
3285965	4606285008210	Вино арфан столов белое полусладк 10-12% 750мл стбут	22133	Продукты питания (folder)/Алкогольные напитки/Вино (folder)/Вино	0	
3285966	4606285008227	Вино арфан столов красное полусладк 10-12% 750мл стбут	22133	Продукты питания (folder)/Алкогольные напитки/Вино (folder)/Вино	0	
150263	4006542006995	Вино архиепископ трирский безалкогольн б/сл 750мл	22133	Продукты питания (folder)/Алкогольные напитки/Вино (folder)/Вино	0	
3285967	4601162003739	Вино архиерейский собор кагор красное сладкое 13-15% 700мл стекло	22133	Продукты питания (folder)/Алкогольные напитки/Вино (folder)/Вино	0	
3285968	4601162001940	Вино архиерейский собор кагор сладк красн 15% 700мл	22133	Продукты питания (folder)/Алкогольные напитки/Вино (folder)/Вино	0	
2853036	4850001271093	Вино арцруни айгеван красн сух 11% 750мл	22133	Продукты питания (folder)/Алкогольные напитки/Вино (folder)/Вино	0	
282350	4850001273127	Вино арцруни арени королевский арени столов сухое красное 11% 750мл ст/б	22133	Продукты питания (folder)/Алкогольные напитки/Вино (folder)/Вино	0	
282351	4850001273066	Вино арцруни кишмиш королевск. кишмиш красн полусладк 750мл 12% /Армения/	22133	Продукты питания (folder)/Алкогольные напитки/Вино (folder)/Вино	0	
2853037	4850001271079	Вино арцруни кишмиш красн полусладк 750мл	22133	Продукты питания (folder)/Алкогольные напитки/Вино (folder)/Вино	0	
42051	4850001273035	Вино арцруни королевский харджи белое полусладк 11% 750мл	22133	Продукты питания (folder)/Алкогольные напитки/Вино (folder)/Вино	0	
2853038	4850001271116	Вино арцруни харджи королевский бел полусладк 750мл	22133	Продукты питания (folder)/Алкогольные напитки/Вино (folder)/Вино	0	
3285969	4850001273028	Вино арцруни харджи королевский харджи белое сухое 11% 750мл	22133	Продукты питания (folder)/Алкогольные напитки/Вино (folder)/Вино	0	
3285970	7802940006349	Вино ас carmenere столов красное сухое 13% 750мл ст/б	22133	Продукты питания (folder)/Алкогольные напитки/Вино (folder)/Вино	0	
3285971	7802940013897	Вино ас Chardonnay столов белое сухое 13% 750мл ст/б	22133	Продукты питания (folder)/Алкогольные напитки/Вино (folder)/Вино	0	
3792256	8437003154065	Вино ас.д.арт.тем.хов. красн сух 9-15% 750мл	22133	Продукты питания (folder)/Алкогольные напитки/Вино (folder)/Вино	0	
3792258	8420839001139	Вино асиен.зор.вег.де ла рейн. бел сух 750мл	22133	Продукты питания (folder)/Алкогольные напитки/Вино (folder)/Вино	3792257	АСИЕНТА
3792259	8410396206047	Вино асиен.зор.криадо эн бар. красн сух 750мл	22133	Продукты питания (folder)/Алкогольные напитки/Вино (folder)/Вино	3792257	АСИЕНТА
3792260	4860053013794	Вино аскан.ахашени красн полусладк 11-12% 750мл	22133	Продукты питания (folder)/Алкогольные напитки/Вино (folder)/Вино	42052	Асканели
1659658	4860053011080	Вино асканели алазанская Долина бел полусладк 10.5-12% 750мл	282274	Продукты питания (folder)/Алкогольные напитки/Вино (folder)/Вина Грузии	42052	Асканели
42054	4860053010038	Вино асканели киндзмараули красн полусладк 10.5-12% 750мл	282274	Продукты питания (folder)/Алкогольные напитки/Вино (folder)/Вина Грузии	42052	Асканели
2853039	4860053014104	Вино асканели манави артвайн бел сух 750мл	282274	Продукты питания (folder)/Алкогольные напитки/Вино (folder)/Вина Грузии	0	
2853040	4860053014128	Вино асканели ркацители квеври артвайн бел сух 750мл	282274	Продукты питания (folder)/Алкогольные напитки/Вино (folder)/Вина Грузии	0	
4989309	4860053014623	Вино асканели ркацители мцване гранд резерв бел сух 750мл	282274	Продукты питания (folder)/Алкогольные напитки/Вино (folder)/Вина Грузии	42052	Асканели
4989310	4860053014616	Вино асканели саперави гранд резерв красн сух 750мл	282274	Продукты питания (folder)/Алкогольные напитки/Вино (folder)/Вина Грузии	42052	Асканели
42056	4860053010069	Вино асканели саперави красн сух 12% 750мл	282274	Продукты питания (folder)/Алкогольные напитки/Вино (folder)/Вина Грузии	42052	Асканели
2853041	4860053014166	Вино асканели саперави мускат артвайн красн полусладк 750мл	282274	Продукты питания (folder)/Алкогольные напитки/Вино (folder)/Вина Грузии	0	
2853042	4860053014159	Вино асканели саперави Премиум артвайн красн сух 750мл	282274	Продукты питания (folder)/Алкогольные напитки/Вино (folder)/Вина Грузии	0	
42058	4860053010076	Вино асканели хванчкара красн полусладк 11-12% 750мл	282274	Продукты питания (folder)/Алкогольные напитки/Вино (folder)/Вина Грузии	42052	Асканели
2853043	4860053014111	Вино асканели чхавери артвайн бел сух 750мл	282274	Продукты питания (folder)/Алкогольные напитки/Вино (folder)/Вина Грузии	0	
1191983	4840044002402	Вино аскони Cabernet национальное достояние красн сух 700мл	22133	Продукты питания (folder)/Алкогольные напитки/Вино (folder)/Вино	0	
1191984	4840109301075	Вино аскони Cabernet п/ сух 750мл (Молдова)	22133	Продукты питания (folder)/Алкогольные напитки/Вино (folder)/Вино	0	
1192018	4840109300979	Вино аскони Chardonnay бел сух 750мл (Молдова)	22133	Продукты питания (folder)/Алкогольные напитки/Вино (folder)/Вино	0	
1191994	4840044002419	Вино аскони Merlot национальное достояние сух красн 700мл	22133	Продукты питания (folder)/Алкогольные напитки/Вино (folder)/Вино	0	
1191946	4840052001060	Вино аскони v.h.v.v Cabernet полусладк красное 750мл (молдавия)	22133	Продукты питания (folder)/Алкогольные напитки/Вино (folder)/Вино	0	
1191947	4840052001077	Вино аскони v.h.v.v Merlot полусладк красное 750мл (молдавия)	22133	Продукты питания (folder)/Алкогольные напитки/Вино (folder)/Вино	0	
1191948	4840052001084	Вино аскони v.h.v.v пино фран полусладк красное 750мл (молдавия)	22133	Продукты питания (folder)/Алкогольные напитки/Вино (folder)/Вино	0	
1191949	4840052001220	Вино аскони v.h.v.v тамянка белое полусладк 750мл (молдавия)	22133	Продукты питания (folder)/Алкогольные напитки/Вино (folder)/Вино	0	
1191950	4840052001213	Вино аскони v.h.v.v. кадарка полусладк красн 750мл (Молдова)	22133	Продукты питания (folder)/Алкогольные напитки/Вино (folder)/Вино	0	
1191951	4840052000841	Вино аскони vdok Merlot хынчешты красное 750мл	22133	Продукты питания (folder)/Алкогольные напитки/Вино (folder)/Вино	0	
1191952	4840052000513	Вино аскони vdok шато-манук белое 750мл	22133	Продукты питания (folder)/Алкогольные напитки/Вино (folder)/Вино	0	
1191953	4840052000520	Вино аскони vdok шато-манук красное 750мл	22133	Продукты питания (folder)/Алкогольные напитки/Вино (folder)/Вино	0	
1191954	4840052001251	Вино аскони аромат молд. мистик Cabernet красн полусладк 750мл	22133	Продукты питания (folder)/Алкогольные напитки/Вино (folder)/Вино	0	
1191955	4840052001633	Вино аскони аромат молд. мистик кадарка красн полусладк 750мл	22133	Продукты питания (folder)/Алкогольные напитки/Вино (folder)/Вино	0	
1191956	4840052001305	Вино аскони аромат молд. мистик Лидия красн полусладк 750мл	22133	Продукты питания (folder)/Алкогольные напитки/Вино (folder)/Вино	0	
1191962	4840358004901	Вино аскони голд Chardonnay бел п/сух 750мл	22133	Продукты питания (folder)/Алкогольные напитки/Вино (folder)/Вино	0	
1191957	4840358000316	Вино аскони голд Земфира. креп. красн 750мл	22133	Продукты питания (folder)/Алкогольные напитки/Вино (folder)/Вино	0	
1191958	4840358004895	Вино аскони голд кадарка полусладк красн 750мл	22133	Продукты питания (folder)/Алкогольные напитки/Вино (folder)/Вино	0	
1191959	4840358005786	Вино аскони голд мускат аскони п/дес. красн 750мл	22133	Продукты питания (folder)/Алкогольные напитки/Вино (folder)/Вино	0	
1191960	4840358004925	Вино аскони голд мускат п/сух бел 750мл	22133	Продукты питания (folder)/Алкогольные напитки/Вино (folder)/Вино	0	
1191961	4840358005748	Вино аскони голд пино фран п/сух красн 750мл	22133	Продукты питания (folder)/Алкогольные напитки/Вино (folder)/Вино	0	
1191973	4840028000721	Вино аскони Золотая подкова Cabernet красн полусладк 750мл	22133	Продукты питания (folder)/Алкогольные напитки/Вино (folder)/Вино	0	
1191974	4840358003249	Вино аскони Золотая подкова Cabernet красн полусладк 750мл #2	22133	Продукты питания (folder)/Алкогольные напитки/Вино (folder)/Вино	0	
1191980	4840358001030	Вино аскони Золотая подкова Chardonnay полусладк бел 750мл	22133	Продукты питания (folder)/Алкогольные напитки/Вино (folder)/Вино	0	
1191981	4840358003188	Вино аскони Золотая подкова Chardonnay полусладк бел 750мл #2	22133	Продукты питания (folder)/Алкогольные напитки/Вино (folder)/Вино	0	
1191968	4840028000820	Вино аскони Золотая подкова Chardonnay полусладк бел 750мл #3	22133	Продукты питания (folder)/Алкогольные напитки/Вино (folder)/Вино	0	
1191964	4840358003232	Вино аскони Золотая подкова Merlot красн полусладк 750мл	22133	Продукты питания (folder)/Алкогольные напитки/Вино (folder)/Вино	0	
1191976	4840028000745	Вино аскони Золотая подкова Merlot полусладк крас 750мл	22133	Продукты питания (folder)/Алкогольные напитки/Вино (folder)/Вино	0	
1191979	4840028000455	Вино аскони Золотая подкова Sauvignon полусладк бел 750мл	22133	Продукты питания (folder)/Алкогольные напитки/Вино (folder)/Вино	0	
1191969	4840028000875	Вино аскони Золотая подкова Земфира креп. красн 750мл	22133	Продукты питания (folder)/Алкогольные напитки/Вино (folder)/Вино	0	
1191970	4840358003263	Вино аскони Золотая подкова Земфира креп. красн 750мл #2	22133	Продукты питания (folder)/Алкогольные напитки/Вино (folder)/Вино	0	
1191971	4840028000868	Вино аскони Золотая подкова Изабелла красн креп 750мл	22133	Продукты питания (folder)/Алкогольные напитки/Вино (folder)/Вино	0	
1191972	4840358003270	Вино аскони Золотая подкова Изабелла красн креп 750мл #2	22133	Продукты питания (folder)/Алкогольные напитки/Вино (folder)/Вино	0	
1191975	4840358004017	Вино аскони Золотая подкова красн п/дес. 750мл	22133	Продукты питания (folder)/Алкогольные напитки/Вино (folder)/Вино	0	
1191963	4840358003256	Вино аскони Золотая подкова Лидия красн п/дес 750мл	22133	Продукты питания (folder)/Алкогольные напитки/Вино (folder)/Вино	0	
1191977	4840358003218	Вино аскони Золотая подкова мускат аскони п/дес 750мл	22133	Продукты питания (folder)/Алкогольные напитки/Вино (folder)/Вино	0	
1191965	4840028000783	Вино аскони Золотая подкова мускат бел полусладк 750мл	22133	Продукты питания (folder)/Алкогольные напитки/Вино (folder)/Вино	0	
1191966	4840358003195	Вино аскони Золотая подкова мускат бел полусладк 750мл #2	22133	Продукты питания (folder)/Алкогольные напитки/Вино (folder)/Вино	0	
1191978	4840028000448	Вино аскони Золотая подкова мускат молдавский красн п/дес 750мл	22133	Продукты питания (folder)/Алкогольные напитки/Вино (folder)/Вино	0	
1191967	4840358003225	Вино аскони Золотая подкова пино фран красн полусладк 750мл	22133	Продукты питания (folder)/Алкогольные напитки/Вино (folder)/Вино	0	
1191982	4840028000431	Вино аскони Золотая подковка мускат молдавский бел п/дес. 750мл	22133	Продукты питания (folder)/Алкогольные напитки/Вино (folder)/Вино	0	
1191985	4840358000651	Вино аскони марочное Cabernet красн сух 750мл	22133	Продукты питания (folder)/Алкогольные напитки/Вино (folder)/Вино	0	
1191986	4840052002289	Вино аскони марочное Cabernet сухое красное 750мл	22133	Продукты питания (folder)/Алкогольные напитки/Вино (folder)/Вино	0	
1191992	4840052002425	Вино аскони марочное Chardonnay бел сух 750мл	22133	Продукты питания (folder)/Алкогольные напитки/Вино (folder)/Вино	0	
1191993	4840358000552	Вино аскони марочное Chardonnay бел сух 750мл #2	22133	Продукты питания (folder)/Алкогольные напитки/Вино (folder)/Вино	0	
1191988	4840052002395	Вино аскони марочное Merlot сух крас. 750мл	22133	Продукты питания (folder)/Алкогольные напитки/Вино (folder)/Вино	0	
1191989	4840358005915	Вино аскони марочное Merlot сух красн 750мл	22133	Продукты питания (folder)/Алкогольные напитки/Вино (folder)/Вино	0	
1191987	4840358001160	Вино аскони марочное кодру красн сух 750мл	22133	Продукты питания (folder)/Алкогольные напитки/Вино (folder)/Вино	0	
1191990	4840052002401	Вино аскони марочное пино фран красн сух 750мл	22133	Продукты питания (folder)/Алкогольные напитки/Вино (folder)/Вино	0	
1191991	4840358000514	Вино аскони марочное рислинг бел сух 750мл	22133	Продукты питания (folder)/Алкогольные напитки/Вино (folder)/Вино	0	
1191995	4840028000615	Вино аскони молдавская ночь красное полусладк 750мл	22133	Продукты питания (folder)/Алкогольные напитки/Вино (folder)/Вино	0	
1191996	4840028001230	Вино аскони молдавский погреб Изабелла красное п/сух 750мл	22133	Продукты питания (folder)/Алкогольные напитки/Вино (folder)/Вино	0	
1191997	4840028000479	Вино аскони молдавский погреб кадарка красное полусладк 750мл	22133	Продукты питания (folder)/Алкогольные напитки/Вино (folder)/Вино	0	
1191998	4840028001247	Вино аскони молдавский погреб Лидия красное полусладк 750мл	22133	Продукты питания (folder)/Алкогольные напитки/Вино (folder)/Вино	0	
1191999	4840028000639	Вино аскони молдавский погреб серебряная свадьба бел полусладк 750мл	22133	Продукты питания (folder)/Алкогольные напитки/Вино (folder)/Вино	0	
1192000	4840028000462	Вино аскони молдавский погреб тамянка бел полусладк 750мл	22133	Продукты питания (folder)/Алкогольные напитки/Вино (folder)/Вино	0	
1192001	4840044002457	Вино аскони национальное дотояние муска сух бел 700мл	22133	Продукты питания (folder)/Алкогольные напитки/Вино (folder)/Вино	0	
1192002	4840028000653	Вино аскони орхей молд.погреб молдавский рубин красное п/десерт. 750мл	22133	Продукты питания (folder)/Алкогольные напитки/Вино (folder)/Вино	0	
1192003	4840044002426	Вино аскони пино фран нац достояние красн сух 700мл	22133	Продукты питания (folder)/Алкогольные напитки/Вино (folder)/Вино	0	
1192004	4840459002431	Вино аскони рубин гарлинг 750мл	22133	Продукты питания (folder)/Алкогольные напитки/Вино (folder)/Вино	0	
1759475	4840358009074	Вино аскони столов полусладк белое Chardonnay 1л 12%	1759450	Продукты питания (folder)/Алкогольные напитки/Вино (folder)/Вина Молдовы	0	
1759474	4840358009067	Вино аскони столов полусладк белое мускат 1л 12%	1759450	Продукты питания (folder)/Алкогольные напитки/Вино (folder)/Вина Молдовы	0	
1759476	4840358009036	Вино аскони столов полусладк крас.каберне 1л 12%	1759450	Продукты питания (folder)/Алкогольные напитки/Вино (folder)/Вина Молдовы	0	
1759477	4840358009043	Вино аскони столов полусладк крас.мерло 1л 12%	1759450	Продукты питания (folder)/Алкогольные напитки/Вино (folder)/Вина Молдовы	0	
1192005	4840052002111	Вино аскони ханчешты Sauvignon белое сух рез. 750мл	22133	Продукты питания (folder)/Алкогольные напитки/Вино (folder)/Вино	0	
1192007	4840052002142	Вино аскони хынчешты Cabernet Sauvignon красн сух 750мл (Молдова)	22133	Продукты питания (folder)/Алкогольные напитки/Вино (folder)/Вино	0	
1192006	4840052001879	Вино аскони хынчешты Cabernet Sauvignon красн сух мар. 750мл	22133	Продукты питания (folder)/Алкогольные напитки/Вино (folder)/Вино	0	
1192013	4840052001923	Вино аскони хынчешты Chardonnay бел сух мар. 750мл	22133	Продукты питания (folder)/Алкогольные напитки/Вино (folder)/Вино	0	
1192014	4840052002104	Вино аскони хынчешты Chardonnay хынчешты бел/сух рез 750мл (Молдова)	22133	Продукты питания (folder)/Алкогольные напитки/Вино (folder)/Вино	0	
1192008	4840052002128	Вино аскони хынчешты Merlot красн 750мл	22133	Продукты питания (folder)/Алкогольные напитки/Вино (folder)/Вино	0	
