ID	UPCEAN	Name	CategoryID	CategoryName	BrandID	BrandName
821604	4601887096252	Семена поиск астра помпонная суприм микс 0.3g цв/п 10/	324395	Растениеводство (folder)/Семена	3517971	Поиск
821612	4601887056492	Семена поиск астра Принцесса борнелла	324395	Растениеводство (folder)/Семена	3517971	Поиск
821614	4601887010272	Семена поиск астра Принцесса карина	324395	Растениеводство (folder)/Семена	3517971	Поиск
821615	4601887094920	Семена поиск астра Принцесса лайт блю	324395	Растениеводство (folder)/Семена	3517971	Поиск
3902896	4601887200925	Семена поиск астра Принцесса сказка	3619917	Растениеводство (folder)/Семена и луковичные	3517971	Поиск
821620	4601887015130	Семена поиск астра Принцесса смесь окрасок 0.3g цв/п 10/	324395	Растениеводство (folder)/Семена	3517971	Поиск
821621	4601887015123	Семена поиск астра Принцесса хильда	324395	Растениеводство (folder)/Семена	3517971	Поиск
821625	4601887095248	Семена поиск астра рэйнбоу микс	324395	Растениеводство (folder)/Семена	3517971	Поиск
3518005	4601887200918	Семена поиск астра сентябрьский букет помпонная 0.3g т/у	324395	Растениеводство (folder)/Семена	3517971	Поиск
3902897	4601887200871	Семена поиск астра смесь окрасок июльск.	3619917	Растениеводство (folder)/Семена и луковичные	3517971	Поиск
3518006	4601887014713	Семена поиск астра смесь окрасок коготковая мягуп 0.3g	324395	Растениеводство (folder)/Семена	3517971	Поиск
3518007	4601887014706	Семена поиск астра смесь окрасок пионовидная мягуп 0.3g	324395	Растениеводство (folder)/Семена	3517971	Поиск
3518008	4601887001850	Семена поиск астра смесь сортов мягуп 0.5g	324395	Растениеводство (folder)/Семена	3517971	Поиск
821637	4601887015154	Семена поиск астра страусово перо 0.3g лазурная цв/п 10/	324395	Растениеводство (folder)/Семена	3517971	Поиск
821638	4601887015161	Семена поиск астра страусово перо рубиново-красная	324395	Растениеводство (folder)/Семена	3517971	Поиск
821646	4601887095033	Семена поиск астра уникум виолет	324395	Растениеводство (folder)/Семена	3517971	Поиск
3518009	4601887130352	Семена поиск астра фламир смесь окрасок мягуп 0.3g	324395	Растениеводство (folder)/Семена	3517971	Поиск
3902898	4601887200864	Семена поиск астра флорист	3619917	Растениеводство (folder)/Семена и луковичные	3517971	Поиск
821657	4601887111825	Семена поиск астра французское сердце мягуп 3g	324395	Растениеводство (folder)/Семена	3517971	Поиск
1656353	4601887098386	Семена поиск астра харлекин микс 0.2g цв/п 10/ Германия	324395	Растениеводство (folder)/Семена	3517971	Поиск
821660	4601887010487	Семена поиск астра харц изольда	324395	Растениеводство (folder)/Семена	3517971	Поиск
821661	4601887014997	Семена поиск астра харц кримхильда	324395	Растениеводство (folder)/Семена	3517971	Поиск
821663	4601887010500	Семена поиск астра харц лоэнгрин	324395	Растениеводство (folder)/Семена	3517971	Поиск
821664	4601887019770	Семена поиск астра харц парсифаль	324395	Растениеводство (folder)/Семена	3517971	Поиск
821666	4601887015000	Семена поиск астра харц сента	324395	Растениеводство (folder)/Семена	3517971	Поиск
821667	4601887052494	Семена поиск астра харц серебристо-синяя	324395	Растениеводство (folder)/Семена	3517971	Поиск
821668	4601887010302	Семена поиск астра харц смесь окрасок 0.3g цв/п 10/	324395	Растениеводство (folder)/Семена	3517971	Поиск
821669	4601887010494	Семена поиск астра харц холлендер	324395	Растениеводство (folder)/Семена	3517971	Поиск
821670	4601887015178	Семена поиск астра художественная белая	324395	Растениеводство (folder)/Семена	3517971	Поиск
821672	4601887015185	Семена поиск астра художественная красная	324395	Растениеводство (folder)/Семена	3517971	Поиск
821673	4601887015192	Семена поиск астра художественная розовая	324395	Растениеводство (folder)/Семена	3517971	Поиск
821675	4601887086604	Семена поиск астра художественная светло-желтая	324395	Растениеводство (folder)/Семена	3517971	Поиск
1656355	4601887028949	Семена поиск астра художественная смесь окрасок 0.3g цв/п 10/ Нидерланды	324395	Растениеводство (folder)/Семена	3517971	Поиск
3518010	4601887222330	Семена поиск астра ювел аметрин мягуп 0.2g	324395	Растениеводство (folder)/Семена	3517971	Поиск
821690	4601887017455	Семена поиск аубреция красный каскад	324395	Растениеводство (folder)/Семена	3517971	Поиск
821691	4601887003540	Семена поиск аубреция смесь окрасок мягуп 0.1g	324395	Растениеводство (folder)/Семена	3517971	Поиск
821737	4601887026501	Семена поиск бадан/бергения красная Звезда сердцелистный мягуп 0.01g	324395	Растениеводство (folder)/Семена	3517971	Поиск
1656572	4601887028680	Семена поиск базилик (2014) Арарат (а) (фиолетовый) 0.5g цв/п 10/ Италия	324395	Растениеводство (folder)/Семена	3517971	Поиск
3518011	4607189275005	Семена поиск базилик ароматы востока мягуп 0.3g	324395	Растениеводство (folder)/Семена	3517971	Поиск
3518012	4601887154679	Семена поиск базилик гурман анисовый овощной мягуп 0.25g	324395	Растениеводство (folder)/Семена	3517971	Поиск
3518013	4601887211877	Семена поиск базилик гурман мятный овощной	324395	Растениеводство (folder)/Семена	3517971	Поиск
3902899	4601887016564	Семена поиск базилик нцс	3619917	Растениеводство (folder)/Семена и луковичные	3517971	Поиск
3902900	4601887125914	Семена поиск базилик нцс #2	3619917	Растениеводство (folder)/Семена и луковичные	3517971	Поиск
821768	4601887028673	Семена поиск базилик тонус (а)(зеленый)	324395	Растениеводство (folder)/Семена	3517971	Поиск
3902901	4601887025573	Семена поиск баклаж.нцс черн красав.(а)	3619917	Растениеводство (folder)/Семена и луковичные	3517971	Поиск
3902902	4601887025580	Семена поиск баклаж.нцс черн красав.(а) #2	3619917	Растениеводство (folder)/Семена и луковичные	3517971	Поиск
3902903	4601887032212	Семена поиск баклаж.нцс черн красав.(а) #3	3619917	Растениеводство (folder)/Семена и луковичные	3517971	Поиск
3902904	4601887032236	Семена поиск баклаж.нцс черн красав.(а) #4	3619917	Растениеводство (folder)/Семена и луковичные	3517971	Поиск
821775	4601887003656	Семена поиск баклажан алмаз (среднеспелый) 0.25g цв/п 10/ Китай минимум	324395	Растениеводство (folder)/Семена	3517971	Поиск
821776	4601887025566	Семена поиск баклажан алмаз 0.25g б/п 20/ Китай	324395	Растениеводство (folder)/Семена	3517971	Поиск
821779	4601887004578	Семена поиск баклажан альбатрос	324395	Растениеводство (folder)/Семена	3517971	Поиск
1656579	4601887021599	Семена поиск баклажан анет f1 (среднеспелый) 10шт цв/п 1/	324395	Растениеводство (folder)/Семена	3517971	Поиск
821781	4601887030423	Семена поиск баклажан арап (а)	324395	Растениеводство (folder)/Семена	3517971	Поиск
3518014	4601887152705	Семена поиск баклажан арап мягуп 0.25g	324395	Растениеводство (folder)/Семена	3517971	Поиск
821786	4601887014812	Семена поиск баклажан вера (сиб.серия) 0.25g цв/п 10/	324395	Растениеводство (folder)/Семена	3517971	Поиск
3902905	4601887153849	Семена поиск баклажан галич	3619917	Растениеводство (folder)/Семена и луковичные	3517971	Поиск
1823339	4601887166573	Семена поиск баклажан диамант f1 12шт м/у	324395	Растениеводство (folder)/Семена	3517971	Поиск
821789	4601887096894	Семена поиск баклажан кашалот	324395	Растениеводство (folder)/Семена	3517971	Поиск
821794	4601887096900	Семена поиск баклажан робин гуд хит	324395	Растениеводство (folder)/Семена	3517971	Поиск
821803	4601887011637	Семена поиск баклажан универсал 6	324395	Растениеводство (folder)/Семена	3517971	Поиск
821808	4601887001607	Семена поиск баклажан черный красавец мягуп 0.25g	324395	Растениеводство (folder)/Семена	3517971	Поиск
3518015	4601887230342	Семена поиск баклажан черный красавец мягуп 0.25g #2	324395	Растениеводство (folder)/Семена	3517971	Поиск
3518016	4601887153863	Семена поиск баклажан черный опал мягуп 0.25g	324395	Растениеводство (folder)/Семена	3517971	Поиск
821812	4601887095637	Семена поиск бальзамин бизи лиззи стар микс 10шт цв/п 5/	324395	Растениеводство (folder)/Семена	3517971	Поиск
3518017	4601887152859	Семена поиск бальзамин искры 10шт м/у	324395	Растениеводство (folder)/Семена	3517971	Поиск
821813	4601887087212	Семена поиск бальзамин красная милашка 0.1g цв/п 5/	324395	Растениеводство (folder)/Семена	3517971	Поиск
821814	4601887087243	Семена поиск бальзамин милашка смесь окрасок	324395	Растениеводство (folder)/Семена	3517971	Поиск
821815	4601887087229	Семена поиск бальзамин оранжевая милашка	324395	Растениеводство (folder)/Семена	3517971	Поиск
821816	4601887087236	Семена поиск бальзамин розовая милашка	324395	Растениеводство (folder)/Семена	3517971	Поиск
3518018	4601887087182	Семена поиск бальзамин том самб белый мягуп 0.1g	324395	Растениеводство (folder)/Семена	3517971	Поиск
3518019	4601887206965	Семена поиск бальзамин том самб двуцветный мягуп 0.1g	324395	Растениеводство (folder)/Семена	3517971	Поиск
3902906	4601887087205	Семена поиск бальзамин том самб розовый	3619917	Растениеводство (folder)/Семена и луковичные	3517971	Поиск
3518020	4601887087199	Семена поиск бальзамин том самб фиолетовый мягуп 0.1g	324395	Растениеводство (folder)/Семена	3517971	Поиск
821817	4601887032663	Семена поиск бальзаминтом самб 0.1g	324395	Растениеводство (folder)/Семена	3517971	Поиск
3518021	4601887221487	Семена поиск бархатцы аляска прямостоячие мягуп 0.4g	324395	Растениеводство (folder)/Семена	3517971	Поиск
3518022	4601887206880	Семена поиск бархатцы бой Золотые отклоненные махровые 0.4g т/у	324395	Растениеводство (folder)/Семена	3517971	Поиск
3518023	4601887206897	Семена поиск бархатцы бой отклоненные махровые смесь мягуп 0.4g	324395	Растениеводство (folder)/Семена	3517971	Поиск
3518024	4601887201083	Семена поиск бархатцы болеро отклоненные махровые мягуп 0.4g	324395	Растениеводство (folder)/Семена	3517971	Поиск
3518025	4601887018179	Семена поиск бархатцы гавайи прямостоячие мягуп 0.4g	324395	Растениеводство (folder)/Семена	3517971	Поиск
3518026	4601887147404	Семена поиск бархатцы двухцветный гигант махровые отклоненные 0.4g т/у	324395	Растениеводство (folder)/Семена	3517971	Поиск
1656855	4601887018209	Семена поиск бархатцы Золотая головка отклоненные махровые мягуп 0.4g	324395	Растениеводство (folder)/Семена	3517971	Поиск
3518027	4601887018186	Семена поиск бархатцы кармен отклоненные махровые 0.4g т/у	324395	Растениеводство (folder)/Семена	3517971	Поиск
3518028	4601887115403	Семена поиск бархатцы квин София отклоненные махровые мягуп 0.4g	324395	Растениеводство (folder)/Семена	3517971	Поиск
3518029	4601887104728	Семена поиск бархатцы килиманджаро прямостоячие мягуп 0.1g	324395	Растениеводство (folder)/Семена	3517971	Поиск
1656856	4601887072492	Семена поиск бархатцы максимикс прямостоячие 0.3g цв/п	324395	Растениеводство (folder)/Семена	3517971	Поиск
3518030	4601887018193	Семена поиск бархатцы оранжевое пламя махровые отклоненные мягуп 0.4g	324395	Растениеводство (folder)/Семена	3517971	Поиск
3902907	4601887018230	Семена поиск бархатцы отклон.махр.петит ора	3619917	Растениеводство (folder)/Семена и луковичные	3517971	Поиск
3902908	4601887018223	Семена поиск бархатцы отклонен.махровые Mix	3619917	Растениеводство (folder)/Семена и луковичные	3517971	Поиск
3902909	4601887048145	Семена поиск бархатцы отклонен.махровые Mix #2	3619917	Растениеводство (folder)/Семена и луковичные	3517971	Поиск
821834	4601887096375	Семена поиск бархатцы отклонен.немахровые сильвиа	324395	Растениеводство (folder)/Семена	3517971	Поиск
821835	4601887018247	Семена поиск бархатцы отклонен.немахровые шаловливая мариэтта цв/п 0.4g	324395	Растениеводство (folder)/Семена	3517971	Поиск
821836	4601887043362	Семена поиск бархатцы отклоненные махровые смесь окрасок 0.3g цв/п 10/	324395	Растениеводство (folder)/Семена	3517971	Поиск
3518031	4601887054788	Семена поиск бархатцы пепит отклоненные махровые смесь 0.3g цв/п	324395	Растениеводство (folder)/Семена	3517971	Поиск
3518032	4601887242253	Семена поиск бархатцы петит смесь окрасок отклоненные махровые 0.4g т/у	324395	Растениеводство (folder)/Семена	3517971	Поиск
3518033	4601887087120	Семена поиск бархатцы прямостоячие	324395	Растениеводство (folder)/Семена	3517971	Поиск
3902910	4601887097686	Семена поиск бархатцы прямостоячие Mix	3619917	Растениеводство (folder)/Семена и луковичные	3517971	Поиск
821838	4601887087113	Семена поиск бархатцы прямостоячие альбатрос 0.1g цв/п 10/	324395	Растениеводство (folder)/Семена	3517971	Поиск
3518034	4601887096696	Семена поиск бархатцы прямостоячие спун микс	324395	Растениеводство (folder)/Семена	3517971	Поиск
3518035	4601887030812	Семена поиск бархатцы прямостоячие хлопушка 0.4g	324395	Растениеводство (folder)/Семена	3517971	Поиск
1841599	4601887098393	Семена поиск бархатцы ред черри махровые однолетник мягуп 0.3g	324395	Растениеводство (folder)/Семена	3517971	Поиск
3518036	4601887116684	Семена поиск бархатцы скарлет София отклоненные махровые мягуп 0.4g	324395	Растениеводство (folder)/Семена	3517971	Поиск
3518037	4601887206217	Семена поиск бархатцы спун Золотые прямостоячие мягуп 0.1g	324395	Растениеводство (folder)/Семена	3517971	Поиск
821844	4601887096368	Семена поиск бархатцы старфайер микс тонколистные 0.1g т/у	324395	Растениеводство (folder)/Семена	3517971	Поиск
821842	4601887018261	Семена поиск бархатцы тонколистные Золотой самоцвет	324395	Растениеводство (folder)/Семена	3517971	Поиск
821843	4601887086512	Семена поиск бархатцы тонколистные оранжевый самоцвет	324395	Растениеводство (folder)/Семена	3517971	Поиск
3518038	4601887206989	Семена поиск бархатцы хохлома красные мягуп 0.4g	324395	Растениеводство (folder)/Семена	3517971	Поиск
3518039	4601887152897	Семена поиск бегония вечноцветущая	324395	Растениеводство (folder)/Семена	3517971	Поиск
821848	4601887096719	Семена поиск бегония вечноцветущая амбассадор микс 10шт цв/п 10/	324395	Растениеводство (folder)/Семена	3517971	Поиск
821849	4601887087762	Семена поиск бегония клубневая версальская история 15шт цв/п 5/	324395	Растениеводство (folder)/Семена	3517971	Поиск
3518040	4601887202622	Семена поиск бегония шансон темно-красная клубневая ампельная 10шт м/у	324395	Растениеводство (folder)/Семена	3517971	Поиск
1657918	4601887019633	Семена поиск бобы (2014) овощные белорусские 7шт цв/п 10/ Италия	324395	Растениеводство (folder)/Семена	3517971	Поиск
116245	4601887003663	Семена поиск бобы русские черные овощные 10шт м/у	324395	Растениеводство (folder)/Семена	3517971	Поиск
821851	4601887020127	Семена поиск бораго (огуречная трава) гном (а)	324395	Растениеводство (folder)/Семена	3517971	Поиск
821852	4601887046639	Семена поиск броваллия красивая океан микс 10шт цв/п /1	324395	Растениеводство (folder)/Семена	3517971	Поиск
821854	4601887119067	Семена поиск брюква новгородская столовая мягуп 0.5g	324395	Растениеводство (folder)/Семена	3517971	Поиск
821853	4601887011644	Семена поиск брюква столовая красносельская мягуп 0.5g	324395	Растениеводство (folder)/Семена	3517971	Поиск
821855	4601887027294	Семена поиск буддлея давида смесь окрасок 10шт цв/п 10/	324395	Растениеводство (folder)/Семена	3517971	Поиск
821857	4601887019626	Семена поиск валериана кардиола лекарственная м/у	324395	Растениеводство (folder)/Семена	3517971	Поиск
3902911	4601887047315	Семена поиск василек Mix	3619917	Растениеводство (folder)/Семена и луковичные	3517971	Поиск
3902912	4601887095217	Семена поиск василек Mix #2	3619917	Растениеводство (folder)/Семена и луковичные	3517971	Поиск
821860	4601887094951	Семена поиск василек вайт бол	324395	Растениеводство (folder)/Семена	3517971	Поиск
3902913	4601887212393	Семена поиск василек капитан	3619917	Растениеводство (folder)/Семена и луковичные	3517971	Поиск
821862	4601887047278	Семена поиск василек карлик белый	324395	Растениеводство (folder)/Семена	3517971	Поиск
821863	4601887047285	Семена поиск василек карлик красный 0.1g цв/п 10/	324395	Растениеводство (folder)/Семена	3517971	Поиск
821864	4601887047292	Семена поиск василек карлик пурпурный	324395	Растениеводство (folder)/Семена	3517971	Поиск
821865	4601887047308	Семена поиск василек карлик розовый	324395	Растениеводство (folder)/Семена	3517971	Поиск
3902914	4601887200956	Семена поиск василек летние каникулы 1g	3619917	Растениеводство (folder)/Семена и луковичные	3517971	Поиск
3518041	4601887105992	Семена поиск василек многолетний микс мягуп 0.3g	324395	Растениеводство (folder)/Семена	3517971	Поиск
821867	4601887029120	Семена поиск василек мускусный Императорская смесь окрасок цв/п 0.2g	324395	Растениеводство (folder)/Семена	3517971	Поиск
821870	4601887094944	Семена поиск василек ред бол	324395	Растениеводство (folder)/Семена	3517971	Поиск
3518042	4601887001973	Семена поиск василек смесь окрасок мягуп 1g	324395	Растениеводство (folder)/Семена	3517971	Поиск
1659012	4601887097006	Семена поиск вашингтония робуста 3шт цв/п 5/ Нидерланды	324395	Растениеводство (folder)/Семена	3517971	Поиск
3518043	4601887021728	Семена поиск венидиум смесь зулу пышный мягуп 0.1g	324395	Растениеводство (folder)/Семена	3517971	Поиск
821876	4601887001980	Семена поиск вербена гибридная идеал (2014) (однолетник) 0.2g цв/п 10/ Польша	324395	Растениеводство (folder)/Семена	3517971	Поиск
3518044	4601887152934	Семена поиск вербена мерло крупноцветковая 10шт т/у	324395	Растениеводство (folder)/Семена	3517971	Поиск
