ID	UPCEAN	Name	CategoryID	CategoryName	BrandID	BrandName
2810656	882971782563	Liz flex/liz claiborne lia crinkle patent Black 9 m 12800212	1	Неклассифицированные/default	0	
2810657	882971784260	Liz flex/liz claiborne lia metallic patent lt/pas Red 12800219	1	Неклассифицированные/default	0	
2810658	882971783430	Liz flex/liz claiborne lia pearlized patent rustcopper 10 m 12800217	1	Неклассифицированные/default	0	
2810659	882971783546	Liz flex/liz claiborne lia pearlized patent rustcopper 12800217	1	Неклассифицированные/default	0	
2810660	882971783478	Liz flex/liz claiborne lia pearlized patent rustcopper 6 m 12800217	1	Неклассифицированные/default	0	
2810661	882971783485	Liz flex/liz claiborne lia pearlized patent rustcopper 6.5 m 12800217	1	Неклассифицированные/default	0	
2810662	882971783492	Liz flex/liz claiborne lia pearlized patent rustcopper 7 m 12800217	1	Неклассифицированные/default	0	
2810663	882971783508	Liz flex/liz claiborne lia pearlized patent rustcopper 7.5 m 12800217	1	Неклассифицированные/default	0	
2810664	882971783515	Liz flex/liz claiborne lia pearlized patent rustcopper 8 m 12800217	1	Неклассифицированные/default	0	
2810665	882971783522	Liz flex/liz claiborne lia pearlized patent rustcopper 8.5 m 12800217	1	Неклассифицированные/default	0	
2810666	882971783539	Liz flex/liz claiborne lia pearlized patent rustcopper 9 m 12800217	1	Неклассифицированные/default	0	
2810667	882971353152	Liz flex/liz claiborne margarete sharon/s Black 12610517	1	Неклассифицированные/default	0	
2810668	882971353084	Liz flex/liz claiborne margarete sharon/s Black 6 m 12610517	1	Неклассифицированные/default	0	
2810669	882971353145	Liz flex/liz claiborne margarete sharon/s Black 9 m 12610517	1	Неклассифицированные/default	0	
2810670	882971744608	Liz flex/liz claiborne maribel diverse Black 6.5 m 14710395	1	Неклассифицированные/default	0	
2810671	882971744622	Liz flex/liz claiborne maribel diverse Black 7.5 m 14710395	1	Неклассифицированные/default	0	
2810672	882971744646	Liz flex/liz claiborne maribel diverse Black 8.5 m 14710395	1	Неклассифицированные/default	0	
2810673	882971744653	Liz flex/liz claiborne maribel diverse Black 9 m 14710395	1	Неклассифицированные/default	0	
2810674	882971744806	Liz flex/liz claiborne maribel diverse brown 7.5 m 14710395	1	Неклассифицированные/default	0	
2810675	882971744189	Liz flex/liz claiborne maribel kid suede Orange 10 m 14710390	1	Неклассифицированные/default	0	
2810676	882971744295	Liz flex/liz claiborne maribel kid suede Orange 14710390	1	Неклассифицированные/default	0	
2810677	882971744226	Liz flex/liz claiborne maribel kid suede Orange 6 m 14710390	1	Неклассифицированные/default	0	
2810678	882971744271	Liz flex/liz claiborne maribel kid suede Orange 8.5 m 14710390	1	Неклассифицированные/default	0	
2810679	882971744288	Liz flex/liz claiborne maribel kid suede Orange 9 m 14710390	1	Неклассифицированные/default	0	
2810680	882971856257	Liz flex/liz claiborne marishka metallic pa med beige 7.5 m 12800471	1	Неклассифицированные/default	0	
2810681	882971856288	Liz flex/liz claiborne marishka metallic pa med beige 9 m 12800471	1	Неклассифицированные/default	0	
2810682	882971514546	Liz flex/liz claiborne mya sanibel White 7 m 12700320	1	Неклассифицированные/default	0	
2810683	882971693173	Liz flex/liz claiborne philicia crinkum gray 7.5 m 12710429	1	Неклассифицированные/default	0	
2810684	882971699175	Liz flex/liz claiborne racquel antilope sue lt/pas yel 10 m 14710630	1	Неклассифицированные/default	0	
2810685	882971699281	Liz flex/liz claiborne racquel antilope sue lt/pas yel 14710630	1	Неклассифицированные/default	0	
2810686	882971699212	Liz flex/liz claiborne racquel antilope sue lt/pas yel 6 m 14710630	1	Неклассифицированные/default	0	
2810687	882971699236	Liz flex/liz claiborne racquel antilope sue lt/pas yel 7 m 14710630	1	Неклассифицированные/default	0	
2810688	882971729827	Liz flex/liz claiborne racquel Glamour Black 5 m 14710639	1	Неклассифицированные/default	0	
2810689	882971729841	Liz flex/liz claiborne racquel Glamour Black 6 m 14710639	1	Неклассифицированные/default	0	
2810690	882971729872	Liz flex/liz claiborne racquel Glamour Black 7.5 m 14710639	1	Неклассифицированные/default	0	
2810691	882971729896	Liz flex/liz claiborne racquel Glamour Black 8.5 m 14710639	1	Неклассифицированные/default	0	
2810692	882971434684	Liz flex/liz claiborne sarong eel Black 6.5 m 12600156	1	Неклассифицированные/default	0	
2810693	882971702004	Liz flex/liz claiborne whitley roma Black 8.5 m 12710480	1	Неклассифицированные/default	0	
4488783	741952617594	Liz gillies core fitness - progressive pilates 10-minute target-tone workout	1	Неклассифицированные/default	0	
3151864	893410003088	Liz lovely, snicker dude sugar cookie, cinnamon	330591	Продукты питания (folder)/Продукты питания	0	
4488784	724352208401	Liz phair	1	Неклассифицированные/default	0	
4488785	724385355424	Liz phair - whitechocolatespaceegg	1	Неклассифицированные/default	0	
1745681	843379068079	Liz Rene couture women's angelina sandal,White,5 m us	15348	Одежда и обувь (folder)/Обувь (folder)/Обувь	0	
1917390	746480996982	Liz Sport women 3.4oz spray tester by liz claiborne	1	Неклассифицированные/default	569440	Liz Claiborne
4488786	022891989790	Liz story-solid colours (DVD)	1	Неклассифицированные/default	0	
4488787	023663780690	Liz&co sunglasses	1	Неклассифицированные/default	0	
4488788	098687339667	Liz&co. purse	1	Неклассифицированные/default	0	
4488789	616551156327	Liz&co. sweater	1	Неклассифицированные/default	0	
4488790	788762289610	Liz&co., skirt	1	Неклассифицированные/default	0	
2167688	8594046322803	Liz.ch.ch.xxl trio+zvyk.29g/40 15%	1	Неклассифицированные/default	0	
2167689	8594046322827	Liz.ch.ch.xxl+zvyk.jah+cola+jabl.29g/40 15%	1	Неклассифицированные/default	0	
2167690	8413178048545	Liz.pali Color kys. 7.5g/200 nebal 15%	1	Неклассифицированные/default	0	
2167691	8413178096799	Liz.pali neon kys+zvy 10.5g/150 neb 15%	1	Неклассифицированные/default	0	
2623509	602527394398	Liza minelli - confessions CD 2739432	4093300	Медиа (folder)/Media	0	
2623510	5099749588028	Liza minnelli - xxi-veintiun grandes exi CD son2495880	4093300	Медиа (folder)/Media	0	
1776093	59029533	Lizak (astra/poland) deseniowy hp l 0.014kg sr	22145	Продукты питания (folder)/Кондитерские изделия (folder)/Конфеты	3692572	LIZAK (ASTRA/POLAND)
1766562	59021841	Lizak (astra/poland) deseniowy hp l 0.026kg sr	22145	Продукты питания (folder)/Кондитерские изделия (folder)/Конфеты	3692572	LIZAK (ASTRA/POLAND)
4488791	014381460322	Lizard (DVD)	1	Неклассифицированные/default	0	
4488792	718416746121	Lizard collection	1	Неклассифицированные/default	0	
4488793	660770000220	Lizard heart records CD still: i don't mind	1	Неклассифицированные/default	0	
4488794	660770000121	Lizard heart records CD still: the distance	1	Неклассифицированные/default	0	
1525568	687950003017	Lizard lips clip str	1	Неклассифицированные/default	0	
4488795	085761592230	Lizard squishimal toy	1	Неклассифицированные/default	0	
3692574	4605756001187	Lizard панама джинс мал. р50-54	3613136	Одежда и обувь (folder)/Одежда джинсовая	3692573	LIZARD
3692575	4605756001231	Lizard шляпа солома р50-54	1761966	Одежда и обувь (folder)/Головной убор	3692573	LIZARD
1525569	075656017047	Lizards	1	Неклассифицированные/default	0	
2167692	4033500101362	Lizatka hroznove ovoc.Mix 7.5g/100 15%	1	Неклассифицированные/default	0	
2167693	8590311200517	Lizatko brain pop+zvykacka 16g/50 15%	1	Неклассифицированные/default	0	
2167694	8410031955170	Lizatko Chupa Chups smoula+samolep 12g/20 15%	1	Неклассифицированные/default	1670056	Chupa Chups
2167695	4004641102822	Lizatko Flash pop svitici 12g/24 n 15%	1	Неклассифицированные/default	0	
2167696	8424621005732	Lizatko horror fizz+osv.prasek 12g/100 15%	1	Неклассифицированные/default	0	
2167697	8590311200982	Lizatko hroznove 2pop 10g/125 15%	1	Неклассифицированные/default	0	
2167698	8595081302706	Lizatko krtek+samolepka 8g/100 15%	1	Неклассифицированные/default	0	
2167699	8590311201767	Lizatko Mix+prask.prasek 10g/36 n 15%	1	Неклассифицированные/default	0	
2167700	5999555777671	Lizatko smajlik 20g/42 15%	1	Неклассифицированные/default	0	
2167701	8413209317268	Lizatko space Duo pruh 11.2g/150 15%	1	Неклассифицированные/default	0	
2167702	8413209317640	Lizatko space+zvykacka 10.5g/150 15%	1	Неклассифицированные/default	0	
2167703	8590311201545	Lizatko zmrzlinka fizzy jahoda 12g/150 15%	1	Неклассифицированные/default	0	
2933718	4812695000083	Lizavetinskiy i goa.mlk che.bl. u wp 0.21kg	142810	Продукты питания (folder)/Молочные продукты (folder)/Сыр	3692576	LIZAVETINSKIY (DAK (FERMERSKOE KHOZYAYSTVO)/BELORUS)
4488796	098689041704	Lizclaiborne handbag	1	Неклассифицированные/default	0	
1917391	4806522830202	Lizelle fc tab 3mg/20mcg	1	Неклассифицированные/default	0	
2623511	5060092030847	Lizi's gluten free granola 8x 400g	1	Неклассифицированные/default	387744	Lizi's
2623512	5060092030687	Lizi's low sugar granola 8x 500g	1	Неклассифицированные/default	387744	Lizi's
4488797	071158081012	Lizio brothers div. 0.5gal hiland-roberts Ice Cream	1	Неклассифицированные/default	0	
387752	8901396111504	Lizol all purpose cleaner 500ml	6693	Хозяйственные товары (folder)/Бытовая химия (folder)/Чистящие моющие средства	387746	Lizol
1525570	8901396115007	Lizol dfc citrus 2l	1	Неклассифицированные/default	387746	Lizol
619731	8901396112136	Lizol dfc citrus 650ml	25023	Хозяйственные товары (folder)/Бытовая химия (folder)/Бытовая химия	387746	Lizol
619732	8901396117407	Lizol dfc Lavender 500ml	25023	Хозяйственные товары (folder)/Бытовая химия (folder)/Бытовая химия	387746	Lizol
1525571	8901396117209	Lizol dfc Lavender 975ml	1	Неклассифицированные/default	387746	Lizol
1525572	8901396138105	Lizol dfc pine 975ml+200lz	1	Неклассифицированные/default	387746	Lizol
1525573	8901396115502	Lizol dfc sandal 2l	1	Неклассифицированные/default	387746	Lizol
1525574	8901396139508	Lizol dfc sandal 975ml	1	Неклассифицированные/default	387746	Lizol
387754	890139611600	Lizol disinfectant floor cleaner citrus 2l	6693	Хозяйственные товары (folder)/Бытовая химия (folder)/Чистящие моющие средства	387746	Lizol
387755	8901396116004	Lizol disinfectant floor cleaner Floral 2l	6693	Хозяйственные товары (folder)/Бытовая химия (folder)/Чистящие моющие средства	387746	Lizol
387756	8901396114505	Lizol disinfectant floor cleaner jasmine 2l	6693	Хозяйственные товары (folder)/Бытовая химия (folder)/Чистящие моющие средства	387746	Lizol
387757	8901396117001	Lizol disinfectant floor cleaner Lavender 2l	6693	Хозяйственные товары (folder)/Бытовая химия (folder)/Чистящие моющие средства	387746	Lizol
387758	8901396114000	Lizol disinfectant floor cleaner pine 2l	6693	Хозяйственные товары (folder)/Бытовая химия (folder)/Чистящие моющие средства	387746	Lizol
387759	8901396125006	Lizol disinfectant Power cleaner 500ml	6693	Хозяйственные товары (folder)/Бытовая химия (folder)/Чистящие моющие средства	387746	Lizol
387760	8901396139003	Lizol disinfectant surface cleaner 3in1 citrus 975ml	6693	Хозяйственные товары (folder)/Бытовая химия (folder)/Чистящие моющие средства	387746	Lizol
387747	8901396112006	Lizol disinfectant surface cleaner 3in1 citrus fragrance 500ml	6693	Хозяйственные товары (folder)/Бытовая химия (folder)/Чистящие моющие средства	387746	Lizol
387748	8901396113003	Lizol disinfectant surface cleaner 3in1 Floral 500ml	6693	Хозяйственные товары (folder)/Бытовая химия (folder)/Чистящие моющие средства	387746	Lizol
387761	8901396140009	Lizol disinfectant surface cleaner 3in1 Floral 975ml	6693	Хозяйственные товары (folder)/Бытовая химия (folder)/Чистящие моющие средства	387746	Lizol
387749	8901396122500	Lizol disinfectant surface cleaner 3in1 jasmine 500ml	6693	Хозяйственные товары (folder)/Бытовая химия (folder)/Чистящие моющие средства	387746	Lizol
387762	8901396138501	Lizol disinfectant surface cleaner 3in1 jasmine 975ml	6693	Хозяйственные товары (folder)/Бытовая химия (folder)/Чистящие моющие средства	387746	Lizol
387750	8901396117414	Lizol disinfectant surface cleaner 3in1 Lavender 500ml	6693	Хозяйственные товары (folder)/Бытовая химия (folder)/Чистящие моющие средства	387746	Lizol
387763	8901396117261	Lizol disinfectant surface cleaner 3in1 Lavender 975ml	6693	Хозяйственные товары (folder)/Бытовая химия (folder)/Чистящие моющие средства	387746	Lizol
387751	8901396122005	Lizol disinfectant surface cleaner 3in1 pine 500ml	6693	Хозяйственные товары (folder)/Бытовая химия (folder)/Чистящие моющие средства	387746	Lizol
387764	8901396138006	Lizol disinfectant surface cleaner 3in1 pine 975ml	6693	Хозяйственные товары (folder)/Бытовая химия (folder)/Чистящие моющие средства	387746	Lizol
387753	8901396146001	Lizol floor and bathroom cleaner citrus 200ml	6693	Хозяйственные товары (folder)/Бытовая химия (folder)/Чистящие моющие средства	387746	Lizol
387765	8901396147008	Lizol floor and bathroom cleaner Floral 200ml	6693	Хозяйственные товары (folder)/Бытовая химия (folder)/Чистящие моющие средства	387746	Lizol
387766	8901396121503	Lizol floor and bathroom cleaner jasmine 200ml	6693	Хозяйственные товары (folder)/Бытовая химия (folder)/Чистящие моющие средства	387746	Lizol
387767	8901396117612	Lizol floor and bathroom cleaner Lavender 200ml	6693	Хозяйственные товары (folder)/Бытовая химия (folder)/Чистящие моющие средства	387746	Lizol
387768	8901396121008	Lizol floor and bathroom cleaner pinea 200ml	6693	Хозяйственные товары (folder)/Бытовая химия (folder)/Чистящие моющие средства	387746	Lizol
619733	8901396113133	Lizol Floral 500ml	25023	Хозяйственные товары (folder)/Бытовая химия (folder)/Бытовая химия	387746	Lizol
619734	30050020	Lizol kitchn cleaner 500m+lizol cit 200m op	25023	Хозяйственные товары (folder)/Бытовая химия (folder)/Бытовая химия	387746	Lizol
4488798	716453063829	Lizwear petite sportswear	1	Неклассифицированные/default	0	
3692578	4607169352184	Lizz choclt ws 0.07kg	30752	Продукты питания (folder)/Мороженое	3692577	LIZZ (KALINOV MOST/DZERZHINSK)
4488799	786936223293	Lizz mcguire movie vhs	1	Неклассифицированные/default	0	
4488800	735395100539	Lizzard Valley productions asta La pasta	1	Неклассифицированные/default	0	
4488801	735395100522	Lizzard Valley productions morning glory	1	Неклассифицированные/default	0	
4488802	735395100546	Lizzard Valley productions snack attack	1	Неклассифицированные/default	0	
4488803	735395100553	Lizzard Valley productions Super sampler	1	Неклассифицированные/default	0	
4488804	735395100515	Lizzard Valley productions tea time	1	Неклассифицированные/default	0	
1043347	502857911527	Lizzie c/d browns	1	Неклассифицированные/default	0	
1043348	502857911510	Lizzie c/d pinks	1	Неклассифицированные/default	0	
1043349	502857909654	Lizzie frnch CD v1	1	Неклассифицированные/default	0	
1043350	502857910414	Lizzie frnch CD v1 #2	1	Неклассифицированные/default	0	
1049180	502857909562	Lizzie frnch stcks	1	Неклассифицированные/default	0	
1049179	502857912173	Lizzie frnch znc stk	1	Неклассифицированные/default	0	
4488805	067103339390	Lizzie l bug	1	Неклассифицированные/default	0	
4488806	822333004506	Lizzie mcg gogocam	1	Неклассифицированные/default	0	
4488807	043100336365	Lizzie mcquire portf 1ct	1	Неклассифицированные/default	0	
4488808	681949032408	Lizzie rox jacket	1	Неклассифицированные/default	0	
3151865	850368005069	Lizzie's Cheese straws, cheddar habanero straws, crushed Red pepper	330591	Продукты питания (folder)/Продукты питания	0	
3151866	850368005045	Lizzie's Cheese straws, Cheese straws	330591	Продукты питания (folder)/Продукты питания	0	
3151867	850368005014	Lizzie's Cheese straws, Cheese straws, White cheddar&rosemarry	330591	Продукты питания (folder)/Продукты питания	0	
3151868	850368005007	Lizzie's Cheese straws, Classic cheddar	330591	Продукты питания (folder)/Продукты питания	0	
4488809	5028579002947	Lizzie? heart soap 20g	1	Неклассифицированные/default	0	
4488810	602595748598	Ljj inc small s/s hd henley vintage cotton	1	Неклассифицированные/default	0	
2810695	074826030206	Ljmn st ptrck 2-bt van ck 10.5oz	1	Неклассифицированные/default	0	
2167704	3800036908809	Ljutenica pik.zelen.smes 300g/6 15%	1	Неклассифицированные/default	0	
4488811	616618221074	Ljuti ajvar	1	Неклассифицированные/default	0	
4488812	042799815793	Lk and fnd crs pl int lf 1ct	1	Неклассифицированные/default	0	
4488813	718602159483	Lk Baby Powder Shampoo 16oz	1	Неклассифицированные/default	0	
619736	037712671174	Lk canoe country Blend coffee	19716	Продукты питания (folder)/Чай и кофе/Кофе	0	
4488814	033200152200	Lk Cat liter deodorizer 20oz	1	Неклассифицированные/default	0	
619737	037712671143	Lk foggy morning Blend coffee	19716	Продукты питания (folder)/Чай и кофе/Кофе	0	
619738	037712671402	Lk great lakes vanilla coffee	19716	Продукты питания (folder)/Чай и кофе/Кофе	0	
619739	037712671426	Lk heartland hazelnut coffee	19716	Продукты питания (folder)/Чай и кофе/Кофе	0	
4488815	071860611620	Lk housebreaking pads brk * 14ct	1	Неклассифицированные/default	0	
619740	037712671204	Lk kouba country Blend coffee	19716	Продукты питания (folder)/Чай и кофе/Кофе	0	
619741	037712671150	Lk lakeshore french rst coffee	19716	Продукты питания (folder)/Чай и кофе/Кофе	0	
4488816	701197220690	Lk legnami eco fuoco	1	Неклассифицированные/default	0	
4488817	071860141059	Lk linatone Plus Food supplement for dogs 32floz	1	Неклассифицированные/default	0	
4488818	310541003096	Lk lks dm swiss 12g	1	Неклассифицированные/default	0	
4488819	250141024322	Lk lks mozarela 6g	1	Неклассифицированные/default	0	
619742	037712671181	Lk moose country Blend coffee	19716	Продукты питания (folder)/Чай и кофе/Кофе	0	
619743	037712671648	Lk morning tranquil blnd coffee	19716	Продукты питания (folder)/Чай и кофе/Кофе	0	
619744	037712671105	Lk north country Blend coffee	19716	Продукты питания (folder)/Чай и кофе/Кофе	0	
4488820	071860453404	Lk pet odor absorber 6oz	1	Неклассифицированные/default	0	
4488821	011111060005	Lk roll up lunch bag 1ct	1	Неклассифицированные/default	0	
4488822	718602158189	Lk Shampoo/rinse puppy 16oz	1	Неклассифицированные/default	0	
619745	037712671129	Lk sportsman Blend coffee	19716	Продукты питания (folder)/Чай и кофе/Кофе	0	
619746	037712671419	Lk toasted marshmallow coffee	19716	Продукты питания (folder)/Чай и кофе/Кофе	0	
619747	037712671624	Lk twi-Light decaf blnd coffee	19716	Продукты питания (folder)/Чай и кофе/Кофе	0	
619748	037712671235	Lk White Tail buck blnd coffee	19716	Продукты питания (folder)/Чай и кофе/Кофе	0	
4488823	746777821102	Lk Wild Rice	1	Неклассифицированные/default	0	
4488824	746777821300	Lk Wild Rice #2	1	Неклассифицированные/default	0	
3692584	4607061240138	Lk-0202 блиц-цинк (лекар)	1	Неклассифицированные/default	0	
3692588	4607061241272	Lk-0206 смзка графит.высокотемп.с алюмин, 520ml (лекар)	1	Неклассифицированные/default	0	
3692589	4607061240305	Lk-0302 герметик-фиксатор высокотемпер. 2ml	1	Неклассифицированные/default	0	
1978630	4607061240015	Lk-0412 полирем-пластик, 50g,туба металлопластилин	8230	Клей (folder)/Клей	0	
4488827	045351000446	Lk-4 lumilite krypton flashlight bulbs	1	Неклассифицированные/default	0	
4488825	394441217715	Lk/sv pyrthrn lice trt crmrns 2.5oz	1	Неклассифицированные/default	3954048	Savon
4488826	076812001726	Lk25c linoleum knife	1	Неклассифицированные/default	1715344	Great Neck
4488828	689167000520	Lkay records CD lisa kemp: keep the faith	1	Неклассифицированные/default	0	
5179507	4712931010213	Lkc кнопка 100шт цветные в коробке (1021)	1	Неклассифицированные/default	0	
5179508	4712931010060	Lkc кнопка 10шт крючок декоративная (1006)	1	Неклассифицированные/default	0	
5179509	4871039010058	Lkc кнопка 20шт шестигранная декоративная (1005)	1	Неклассифицированные/default	0	
5179510	4712931010183	Lkc кнопки 100шт шарик декоративные 0.6cm (1018)	1	Неклассифицированные/default	0	
5179511	4712931010121	Lkc кнопки 45шт декоративные прозрачные разноцветные (1012)	1	Неклассифицированные/default	0	
5179512	4871039010362	Lkc скрепка 50mm 25шт цветная полоска (1036)	5135714	скрепки и зажимы для бумаги	0	
3692604	4690314034844	Lkd куртка мужская 50%п/э 50%х/б р46-54	687653	Одежда и обувь (folder)/Куртка	3692603	LKD
4488829	795104010054	Lkg 2.2lb puriety enriched flour	1	Неклассифицированные/default	0	
4488830	038000125935	Lkg froot loops shulish 11oz	1	Неклассифицированные/default	0	
4488831	078895132151	Lkk sweet&sour sauce * 11.6oz	1	Неклассифицированные/default	0	
4488832	029274000332	Lkkl	1	Неклассифицированные/default	0	
4488833	760750666665	Lkl innovations LTD ukcsb swiss + tech utili-key 6in1 polished stainless steel key ring companion multi-tool	1	Неклассифицированные/default	0	
1525582	8002040043124	Lkorneez mega bites 18g	1	Неклассифицированные/default	0	
4488834	011170024901	Lks generic taco seasoning 35g	1	Неклассифицированные/default	0	
