ID	UPCEAN	Name	CategoryID	CategoryName	BrandID	BrandName
3602218	4605035002140	Эльбрусинка детская пит/вода 330ml соска пл/б	1	Неклассифицированные/default	3946680	эльбрусинка (AKVALAYN/ CHERKESSK)
3946696	4605035001860	Эльбрусинка целебная c E 1.5l bo p us	17388	Продукты питания (folder)/Напитки безалкогольные/Вода питьевая	3946680	эльбрусинка (AKVALAYN/ CHERKESSK)
211837	3577051580388	Эльгидиум полоскание для удал зуб налета 200ml	19414	Гигиена (folder)/Уход за зубами и ртом (folder)/Ополаскиватель для рта	211831	ELGYDIUM
463684	3577051070865	Эльгифлуор паста зуб. 75ml/100g №1	209	Гигиена (folder)/Уход за зубами и ртом (folder)/Зубная паста	0	
2767068	4607003242602	Эльжина 500mg+65000ме+3mg+100mg №6 табл вагин	1	Неклассифицированные/default	0	
2951801	4607003242619	Эльжина 500mg+65000ме+3mg+100mg №9 табл вагин	1	Неклассифицированные/default	0	
1346267	4670008162336	Элькар 0.1/мл 5ml n10 амп р-р для ин в/в в/м	1	Неклассифицированные/default	0	
1712665	4670000361195	Элькар 0.1/мл 5ml n10 амп р-р для ин в/в в/м #2	1	Неклассифицированные/default	0	
4861899	4605080000719	Элькар 0.2/мл 100ml флак р-р	241824	Лекарственные средства (folder)/Аптека	0	
4861900	4602862000134	Элькар 0.2/мл 50ml флак р-р	241824	Лекарственные средства (folder)/Аптека	0	
870238	4603761001437	Элькар 0.3/мл 25ml n10 флак р-р	210391	Лекарственные средства (folder)/Лекарственные средства	0	
4861901	4620013730051	Элькар 1000mg №10 пак	204841	Лекарственные средства (folder)/Витамины и минералы	0	
5112334	4605080000672	Элькар 20% 25ml	204841	Лекарственные средства (folder)/Витамины и минералы	0	
4861902	4620013730129	Элькар 5.0 №10 пак шип гранулы для р-ра	241824	Лекарственные средства (folder)/Аптека	0	
5112335	4630016120308	Элькар р-р 30% 100ml	1	Неклассифицированные/default	0	
2012833	4670008162343	Элькар р-р для в/в и в/м прим 100mg/мл 5ml №10 (ООО эллара)	1	Неклассифицированные/default	0	
870239	4606322000443	Элькар р-р для инъекций в/в в/м 0.1/мл 5ml n10 амп	210391	Лекарственные средства (folder)/Лекарственные средства	0	
5112336	46500571	Элькар р-р для пр внутрь 300mg/мл 50ml (ООО про пик фарма)	4933670	Лекарственные средства (folder)/Метаболические средства	0	
544672	4605080000481	Элькар р-р для приема внутрь 200mg/мл 100ml №1 флаконы	204841	Лекарственные средства (folder)/Витамины и минералы	0	
544673	4605080000573	Элькар р-р для приема внутрь 200mg/мл 25ml №1 флаконы	204841	Лекарственные средства (folder)/Витамины и минералы	0	
330306	4605080000474	Элькар р-р для приема внутрь 200mg/мл 50ml №1 флаконы	1	Неклассифицированные/default	0	
1712666	4650057490109	Элькар р-р для приема внутрь 300mg/мл 25ml №1 флаконы, пик-фарма ООО	1	Неклассифицированные/default	5486051	пик-фарма про
5112337	74901234	Элькар, р-р для вн. пр 300mg/мл 100ml (пик-фарма ООО)	4933670	Лекарственные средства (folder)/Метаболические средства	0	
4861903	4603679006784	Элькардио №60 капс	241824	Лекарственные средства (folder)/Аптека	0	
2505448	4601365018080	Эльман MP3 - (rmg)	1	Неклассифицированные/default	0	
67398	8850450131708	Эльмарино морской коктейль жб 0.290	48	Продукты питания (folder)/Рыба и морепродукты (folder)/Консервы рыбные	63023	Pan Asia
1840560	4607024970317	Эльмика биохлебцы 7 злаков 80g	49503	Продукты питания (folder)/Хлебцы	29092	ЭЛЬМИКА
1840561	4607024970324	Эльмика биохлебцы кукурузные 70g	49503	Продукты питания (folder)/Хлебцы	29092	ЭЛЬМИКА
1840562	4607024970348	Эльмика биохлебцы овсяные 80g	49503	Продукты питания (folder)/Хлебцы	29092	ЭЛЬМИКА
4861905	4605077012398	Эльмуцин 0.3 №20 капс	241824	Лекарственные средства (folder)/Аптека	0	
4861906	4605077012763	Эльмуцин 300mg №20 капс	4832463	Лекарственные средства (folder)/Обезболивающие, жаропонижающие спазмалитики, НПВС	0	
5858523	6955185808856	Эльф elf wy-a034 синий	5116881	Рюкзак	5135798	upixel
544674	4602010128871	Эльф Маркет 207001 скульптор ежик	90098	Товары для творчества (folder)/Набор для творчества	331287	Эльф Маркет
544681	4602010164992	Эльф Маркет 207008 скульптор лягушка	90098	Товары для творчества (folder)/Набор для творчества	331287	Эльф Маркет
544683	4607012713544	Эльф Маркет 217002 гончар подсвечники	90098	Товары для творчества (folder)/Набор для творчества	331287	Эльф Маркет
544686	4607012710086	Эльф Маркет 377003 выращивание кристаллов. зеленый	331286	Игрушки (folder)/Игра обучающая и развивающая	331287	Эльф Маркет
544687	4607012710093	Эльф Маркет 377004 выращивание кристаллов. фиолетовый	331286	Игрушки (folder)/Игра обучающая и развивающая	331287	Эльф Маркет
544688	4607012710109	Эльф Маркет 377005 выращивание кристаллов. красный	331286	Игрушки (folder)/Игра обучающая и развивающая	331287	Эльф Маркет
544689	4607012710116	Эльф Маркет 377006 химические опыты	754410	Игрушки (folder)/Игра логическая	331287	Эльф Маркет
544690	4607012710130	Эльф Маркет 377008 ботаника	90098	Товары для творчества (folder)/Набор для творчества	331287	Эльф Маркет
544693	4602010253009	Эльф Маркет 387005 папье-маше листья	90098	Товары для творчества (folder)/Набор для творчества	331287	Эльф Маркет
544694	4607012710178	Эльф Маркет 394002 набор №2 морское путешествие	90098	Товары для творчества (folder)/Набор для творчества	331287	Эльф Маркет
544697	4607012718624	Эльф Маркет 394005 набор №5 усатый лежебока	90098	Товары для творчества (folder)/Набор для творчества	331287	Эльф Маркет
544698	4607012718631	Эльф Маркет 394006 набор №6 жил был пес	90098	Товары для творчества (folder)/Набор для творчества	331287	Эльф Маркет
544699	4650057901162	Эльф Маркет 394007 набор №7 летние каникулы	90098	Товары для творчества (folder)/Набор для творчества	331287	Эльф Маркет
544700	4650057901179	Эльф Маркет 394008 набор №8 голубая лагуна	90098	Товары для творчества (folder)/Набор для творчества	331287	Эльф Маркет
544701	4650057901186	Эльф Маркет 394009 набор №9 братец кролик	90098	Товары для творчества (folder)/Набор для творчества	331287	Эльф Маркет
544714	4650057900998	Эльф Маркет 407035 фреска вершки и корешки	90098	Товары для творчества (folder)/Набор для творчества	331287	Эльф Маркет
544715	4650057901001	Эльф Маркет 407036 фреска танец на льду	90098	Товары для творчества (folder)/Набор для творчества	331287	Эльф Маркет
2765311	4650057905726	Эльф Маркет qbstory. cars. самосвал	1	Неклассифицированные/default	331287	Эльф Маркет
2765312	4650057905399	Эльф Маркет qbstory. firemen. пожарная машина	1	Неклассифицированные/default	331287	Эльф Маркет
2765313	4650057902381	Эльф Маркет вот так заморочка! 9 карточек набор №7	1	Неклассифицированные/default	331287	Эльф Маркет
884925	4650057902923	Эльф Маркет живая картина 3D морозный день /55 956028	980	Игрушки (folder)/Игрушка	331287	Эльф Маркет
555504	4650057902909	Эльф Маркет живая картина 3D огненный букет /55 956026	1	Неклассифицированные/default	331287	Эльф Маркет
2765314	4650057905993	Эльф Маркет живописная лепка. обитаемая земля (стегозавр)	1	Неклассифицированные/default	331287	Эльф Маркет
883140	4650057906051	Эльф Маркет живописная лепка. прогулка по саванне (жираф)	980	Игрушки (folder)/Игрушка	331287	Эльф Маркет
331947	4607012711298	Эльф Маркет картина из пластилина белка	331286	Игрушки (folder)/Игра обучающая и развивающая	331287	Эльф Маркет
464057	4650057902022	Эльф Маркет логические игры в дорогу №1 едем, плаваем, летаем	56347	Игрушки (folder)/Игра настольная	331287	Эльф Маркет
332932	4650057902039	Эльф Маркет логические игры. удивительный зоопарк 948002	754410	Игрушки (folder)/Игра логическая	331287	Эльф Маркет
553962	4607012711014	Эльф Маркет металлопластика длинноухий /40 437013	90098	Товары для творчества (folder)/Набор для творчества	331287	Эльф Маркет
3651848	4607012718310	Эльф Маркет набор вышив.крест.мини для д.тв	56347	Игрушки (folder)/Игра настольная	3651524	ELF MARKET
332469	4602010265125	Эльф Маркет начала евклида гармоникус 777012	754410	Игрушки (folder)/Игра логическая	331287	Эльф Маркет
332470	4602010265132	Эльф Маркет начала евклида геометрикс 777014	754410	Игрушки (folder)/Игра логическая	331287	Эльф Маркет
332468	4602010265118	Эльф Маркет начала евклида колорикс 777011	754410	Игрушки (folder)/Игра логическая	331287	Эльф Маркет
544723	4650057901131	Эльф Маркет свеча гелевая восточная ночь 294004	90098	Товары для творчества (folder)/Набор для творчества	331287	Эльф Маркет
544724	4650057901117	Эльф Маркет свеча гелевая Сады эдема 294002	90098	Товары для творчества (folder)/Набор для творчества	331287	Эльф Маркет
2765315	4607012713681	Эльф Маркет скульптор лягушка	1	Неклассифицированные/default	331287	Эльф Маркет
544726	4607012711397	Эльф Маркет смальта кошечка 307003	90098	Товары для творчества (folder)/Набор для творчества	331287	Эльф Маркет
553984	4602010245455	Эльф Маркет солнечная поляна 447004	980	Игрушки (folder)/Игрушка	331287	Эльф Маркет
2072644	4600797006122	Эльф Маркет фантазер decofresco часы бабочки	1356639	Товары для творчества (folder)/Творчество	3933312	Эльф Маркет Фантазер
2072645	4600797006139	Эльф Маркет фантазер decofresco часы Космос	1356639	Товары для творчества (folder)/Творчество	3933312	Эльф Маркет Фантазер
2072646	4600797006115	Эльф Маркет фантазер decofresco часы мыши	1356639	Товары для творчества (folder)/Творчество	3933312	Эльф Маркет Фантазер
2220865	4650057903210	Эльф Маркет фантазер азбука лепки №5	1356639	Товары для творчества (folder)/Творчество	3933312	Эльф Маркет Фантазер
2221487	4600797006412	Эльф Маркет фантазер аппликация с пайетками овечка /55 257041	1356639	Товары для творчества (folder)/Творчество	3933312	Эльф Маркет Фантазер
5096292	4600797007549	Эльф Маркет фантазер аппликация самоклеящаяся маленький агроном	1	Неклассифицированные/default	3933312	Эльф Маркет Фантазер
1956274	4607012716422	Эльф Маркет фантазер африканские цветы, набор 1	1	Неклассифицированные/default	3933312	Эльф Маркет Фантазер
1956275	4607012716446	Эльф Маркет фантазер африканские цветы, набор 3	1	Неклассифицированные/default	3933312	Эльф Маркет Фантазер
1956276	4607012716507	Эльф Маркет фантазер африканские цветы, набор 9	1	Неклассифицированные/default	3933312	Эльф Маркет Фантазер
5096293	4640015376163	Эльф Маркет фантазер блестяшки очаровашки поздравмяу	1	Неклассифицированные/default	3933312	Эльф Маркет Фантазер
5096294	4640015376170	Эльф Маркет фантазер блестяшки очаровашки сладкий сон	1	Неклассифицированные/default	3933312	Эльф Маркет Фантазер
5096295	4640015376156	Эльф Маркет фантазер блестяшки очаровашки яркий полет	1	Неклассифицированные/default	3933312	Эльф Маркет Фантазер
5096296	4640015374398	Эльф Маркет фантазер блестящее искусство бабетта	1	Неклассифицированные/default	3933312	Эльф Маркет Фантазер
5096297	4640015374367	Эльф Маркет фантазер блестящее искусство сладкая парочка	1	Неклассифицированные/default	3933312	Эльф Маркет Фантазер
2225639	4607012713919	Эльф Маркет фантазер бусы волшебная страна /40 223002	1356639	Товары для творчества (folder)/Творчество	3933312	Эльф Маркет Фантазер
2225640	4607012714015	Эльф Маркет фантазер бусы деревянные бусинки /40 223012	1356639	Товары для творчества (folder)/Творчество	3933312	Эльф Маркет Фантазер
2225641	4607012713957	Эльф Маркет фантазер бусы стеклянная ягода /40 223006	1356639	Товары для творчества (folder)/Творчество	3933312	Эльф Маркет Фантазер
2226348	4607012712257	Эльф Маркет фантазер ваятель домашние птички	1356639	Товары для творчества (folder)/Творчество	3933312	Эльф Маркет Фантазер
2226349	4607012712035	Эльф Маркет фантазер ваятель киска умывается	1356639	Товары для творчества (folder)/Творчество	3933312	Эльф Маркет Фантазер
2226350	4607012712288	Эльф Маркет фантазер ваятель сапожок с подарками	1356639	Товары для творчества (folder)/Творчество	3933312	Эльф Маркет Фантазер
2226351	4607012713674	Эльф Маркет фантазер ваятель транспорт	1356639	Товары для творчества (folder)/Творчество	3933312	Эльф Маркет Фантазер
1957560	4607012712233	Эльф Маркет фантазер ваятель-рамка круглая с цветами	1	Неклассифицированные/default	3933312	Эльф Маркет Фантазер
5096298	4640015375753	Эльф Маркет фантазер веселые завитушки из пластилина набор №1	1	Неклассифицированные/default	3933312	Эльф Маркет Фантазер
2227541	4600797004296	Эльф Маркет фантазер винтажный декупаж ретромобиль	1356639	Товары для творчества (folder)/Творчество	3933312	Эльф Маркет Фантазер
5096299	4640015372370	Эльф Маркет фантазер витраж из песка дружить со звездами	1	Неклассифицированные/default	3933312	Эльф Маркет Фантазер
5096300	4640015372387	Эльф Маркет фантазер витраж из песка сказочный друг	1	Неклассифицированные/default	3933312	Эльф Маркет Фантазер
2228224	4600797003626	Эльф Маркет фантазер гадания на цветах альпийский луг	1356639	Товары для творчества (folder)/Творчество	3933312	Эльф Маркет Фантазер
2228225	4600797003619	Эльф Маркет фантазер гадания на цветах Русское Поле	1356639	Товары для творчества (folder)/Творчество	3933312	Эльф Маркет Фантазер
2228870	4600797007303	Эльф Маркет фантазер гончар со свечами подсвечники этна /6 217007	1356639	Товары для творчества (folder)/Творчество	3933312	Эльф Маркет Фантазер
2228871	4600797007327	Эльф Маркет фантазер гончар со свечами свеча лесная сказка /6 217009	1356639	Товары для творчества (folder)/Творчество	3933312	Эльф Маркет Фантазер
552658	4607012713568	Эльф Маркет фантазер гончар чайный сервиз в кор.6шт	326170	Посуда (folder)/Сервиз	3933312	Эльф Маркет Фантазер
2228968	4650057909755	Эльф Маркет фантазер гравюра №29 восточная царица	1356639	Товары для творчества (folder)/Творчество	3933312	Эльф Маркет Фантазер
2228969	4650057909762	Эльф Маркет фантазер гравюра №30 ночная карру	1356639	Товары для творчества (folder)/Творчество	3933312	Эльф Маркет Фантазер
2229024	4650057909670	Эльф Маркет фантазер гравюра. №14 ночная карру	1356639	Товары для творчества (folder)/Творчество	3933312	Эльф Маркет Фантазер
2229025	4600797005293	Эльф Маркет фантазер гравюры A4 с трафаретом №1 прогулка с любимцем	1356639	Товары для творчества (folder)/Творчество	3933312	Эльф Маркет Фантазер
2229026	4600797005309	Эльф Маркет фантазер гравюры A4 с трафаретом №2 рядом всегда	1356639	Товары для творчества (folder)/Творчество	3933312	Эльф Маркет Фантазер
2229027	4600797005330	Эльф Маркет фантазер гравюры A4 с трафаретом №5 киноприключения	1356639	Товары для творчества (folder)/Творчество	3933312	Эльф Маркет Фантазер
2229028	4600797005347	Эльф Маркет фантазер гравюры A4 с трафаретом №6 зубастый мир	1356639	Товары для творчества (folder)/Творчество	3933312	Эльф Маркет Фантазер
3933313	4600797004258	Эльф Маркет фантазер декупаж винтажный	90098	Товары для творчества (folder)/Набор для творчества	3933312	Эльф Маркет Фантазер
3933314	4600797004265	Эльф Маркет фантазер декупаж винтажный #2	90098	Товары для творчества (folder)/Набор для творчества	3933312	Эльф Маркет Фантазер
5096301	4640015375593	Эльф Маркет фантазер живопись и золочение бабочка-монарх	1	Неклассифицированные/default	3933312	Эльф Маркет Фантазер
5096302	4640015376569	Эльф Маркет фантазер живопись и золочение Золотые паруса	1	Неклассифицированные/default	3933312	Эльф Маркет Фантазер
5792745	4640015371168	Эльф Маркет фантазер загадки в деревне	5115683	Полиграфия (folder)/Книги - развивающие	494342	Фантазер
5792746	4640015371212	Эльф Маркет фантазер загадки в море	5115683	Полиграфия (folder)/Книги - развивающие	494342	Фантазер
5792747	4640015371205	Эльф Маркет фантазер загадки зоопарк	5115683	Полиграфия (folder)/Книги - развивающие	494342	Фантазер
5792748	4640015371182	Эльф Маркет фантазер загадки путешествие	5115683	Полиграфия (folder)/Книги - развивающие	494342	Фантазер
332430	4650057901490	Эльф Маркет фантазер игр живописная миниатюра набор для тв.	90098	Товары для творчества (folder)/Набор для творчества	331287	Эльф Маркет
3933315	4650057901452	Эльф Маркет фантазер игр живопись на холсте набор для творчества	90098	Товары для творчества (folder)/Набор для творчества	3933312	Эльф Маркет Фантазер
332414	4650057901254	Эльф Маркет фантазер игр зол.хохл.наб.для творч.росп.тарел	90098	Товары для творчества (folder)/Набор для творчества	331287	Эльф Маркет
494628	4607012718181	Эльф Маркет фантазер игр коллаж набор для творчества из сер.аппл.	90098	Товары для творчества (folder)/Набор для творчества	3933312	Эльф Маркет Фантазер
3933319	4650057901650	Эльф Маркет фантазер игр мастерская лепки укр.наб.для твор	90098	Товары для творчества (folder)/Набор для творчества	3933312	Эльф Маркет Фантазер
3933316	4607012714152	Эльф Маркет фантазер игра классика фокус.асс	56347	Игрушки (folder)/Игра настольная	3933312	Эльф Маркет Фантазер
3933317	4607012714725	Эльф Маркет фантазер игра классика фокус.асс #2	56347	Игрушки (folder)/Игра настольная	3933312	Эльф Маркет Фантазер
3933318	4607078716817	Эльф Маркет фантазер игра классика фокус.асс #3	56347	Игрушки (folder)/Игра настольная	3933312	Эльф Маркет Фантазер
3933320	4650057902145	Эльф Маркет фантазер игра мемо наст.-печатная	56347	Игрушки (folder)/Игра настольная	3933312	Эльф Маркет Фантазер
