ID	UPCEAN	Name	CategoryID	CategoryName	BrandID	BrandName
3771354	6942655500990	Wahaha Black Lemon s 500ml bo p #6	186980	Продукты питания (folder)/Напитки безалкогольные/Холодный чай	3771348	WAHAHA (WAHAHA/KNR)
3771355	6934004600703	Wahaha Green s 500ml bo p	186980	Продукты питания (folder)/Напитки безалкогольные/Холодный чай	3771348	WAHAHA (WAHAHA/KNR)
3771356	6934004611792	Wahaha Green s 500ml bo p #2	186980	Продукты питания (folder)/Напитки безалкогольные/Холодный чай	3771348	WAHAHA (WAHAHA/KNR)
3771358	6999036477235	Wahfay бумага упаковочная нг 7x 20cm	542785	Товары для праздников (folder)/Украшение новогоднее	3771357	WAHFAY
3771359	6999035307779	Wahfay пакеты крафт нг 11x 14cm	542785	Товары для праздников (folder)/Украшение новогоднее	0	
3771360	6999035470206	Wahfay пакеты нг 16x 18cm	542785	Товары для праздников (folder)/Украшение новогоднее	3771357	WAHFAY
3771361	6999035600146	Wahfay пакеты нг 18x 23cm	542785	Товары для праздников (folder)/Украшение новогоднее	3771357	WAHFAY
3771362	6999035924990	Wahfay пакеты нг 26x 32cm	542785	Товары для праздников (folder)/Украшение новогоднее	3771357	WAHFAY
3771363	6999036152385	Wahfay пакеты нг 33x 45cm	542785	Товары для праздников (folder)/Украшение новогоднее	3771357	WAHFAY
3771364	6999035730089	Wahfay пакеты с конвертом нг 18x 23cm	542785	Товары для праздников (folder)/Украшение новогоднее	3771357	WAHFAY
2216324	8716221091018	Wahid	1	Неклассифицированные/default	2216323	Wahid
2216325	8716221091056	Wahid #2	1	Неклассифицированные/default	2216323	Wahid
2216326	8716221091070	Wahid #3	1	Неклассифицированные/default	2216323	Wahid
2216327	8716221091087	Wahid #4	1	Неклассифицированные/default	2216323	Wahid
2216328	8716221091100	Wahid #5	1	Неклассифицированные/default	2216323	Wahid
2216329	8716221091148	Wahid #6	1	Неклассифицированные/default	2216323	Wahid
4771027	8784252212535	Wahida clark	1	Неклассифицированные/default	0	
4771028	070628281013	Wahington post magazine barack obama inauguration issue	1	Неклассифицированные/default	0	
4771029	043917233208	Wahl #15 clipper blade set, competition series, #2375-100	1	Неклассифицированные/default	0	
5231530	4015110017547	Wahl + триммер Home Pro 100 combo черный/красный	36297	Уход за волосами (folder)/Машинка для стрижки	297271	Wahl
1170693	4015110006893	Wahl 1247-0477 машинка для стрижки животных 45w, 2-х скоростная, роторная, работа от сети	463706	Товары для животных (folder)/Груминг	297271	Wahl
2843764	4015110007319	Wahl 1247-7440 набор из 8 металлических насадок от 3-25mm	1	Неклассифицированные/default	297271	Wahl
4960944	5037127021675	Wahl 14in1 chromium multi groomer	1742887	Неклассифицированные/Personal Care Appliances	0	
667530	043917963341	Wahl 16pcs complete haircut kit	1	Неклассифицированные/default	297271	Wahl
1170662	4015110008750	Wahl 2in1 ez Nail clipper&filer - когтерез и пилочка в одном,с питанием от бат	463706	Товары для животных (folder)/Груминг	297271	Wahl
1170663	4015110008330	Wahl 2in1 rake/blade - комбинированная скребница с триммером	463706	Товары для животных (folder)/Груминг	297271	Wahl
308554	043917226507	Wahl 3-hole adjusto-lock clipper blade set	1742887	Неклассифицированные/Personal Care Appliances	297271	Wahl
4960945	5055528577195	Wahl 300 series mains Hair clipper kit and 9246-810	1742887	Неклассифицированные/Personal Care Appliances	297271	Wahl
5231536	4015110010159	Wahl 3214-0471 micro groomsman белый	36297	Уход за волосами (folder)/Машинка для стрижки	297271	Wahl
4960946	5037127022320	Wahl 3in1 Hot Air styler	1742887	Неклассифицированные/Personal Care Appliances	297271	Wahl
5231537	4015110011255	Wahl 4020-0470 icon серебристый/черный	36297	Уход за волосами (folder)/Машинка для стрижки	297271	Wahl
308555	043917419619	Wahl 4196-1101 de luxe Heat therapy massager	489646	Спорт и отдых (folder)/Массажер	297271	Wahl
1742972	043917429601	Wahl 4296 de luxe wand full-size therapeutic massager, Color may vary	1742887	Неклассифицированные/Personal Care Appliances	0	
308556	074108068231	Wahl 5 Star bump free shaver	1757047	Гигиена (folder)/Бритва	297271	Wahl
308559	043917703114	Wahl 5 Star replacement foil / cutter bar assembly for shaver (burgandy)	1757047	Гигиена (folder)/Бритва	297271	Wahl
308558	043917845104	Wahl 5-Star Magic clip clipper	1742887	Неклассифицированные/Personal Care Appliances	297271	Wahl
308560	043917106267	Wahl 5-Star t-shaped trimmer blade	535118	Галантерея (folder)/Триммер	297271	Wahl
1742973	043917553795	Wahl 5537-1801 cordless battery operated beard trimmer with bonus ear, nose and brow trimmer	535118	Галантерея (folder)/Триммер	0	
308557	043917553726	Wahl 5537-5001 all-in-One battery grooming kit, Black	1742887	Неклассифицированные/Personal Care Appliances	297271	Wahl
4960947	4673496825363	Wahl 5545-427 3in1 nose ear and eyebrow Hair battery trimmer	1742887	Неклассифицированные/Personal Care Appliances	0	
308561	043917255248	Wahl 79524 24-piece de luxe Hair clipper kit	1742887	Неклассифицированные/Personal Care Appliances	297271	Wahl
308562	043917795270	Wahl 79524-500 chrome Pro 24-piece complete haircut kit	1742887	Неклассифицированные/Personal Care Appliances	297271	Wahl
297272	043917850108	Wahl 8501 - reflections-v 5000.0 overlap	1742887	Неклассифицированные/Personal Care Appliances	297271	Wahl
308563	043917924366	Wahl 9243-517n homepro 22-piece complete haircut kit	1742887	Неклассифицированные/Personal Care Appliances	297271	Wahl
1173908	043917924342	Wahl 9247-009 230v 11 piece haircutting kit	360487	Уход за волосами (folder)/Парикмахерская	0	
565340	043917990675	Wahl 9906-717 groomsman cordless/battery mustache	1	Неклассифицированные/default	297271	Wahl
5231532	043917002255	Wahl < 5642-135 > триммер для стрижки волос в области носа и ушей	5116026	бритвы, машинки для стрижки	297271	Wahl
5231533	439170022558	Wahl < 5642-135 > триммер для стрижки волос в области носа и ушей #2	5116026	бритвы, машинки для стрижки	297271	Wahl
4960948	5037127018330	Wahl afro 5000 powerpik Pro dryer	1742887	Неклассифицированные/Personal Care Appliances	297271	Wahl
4960949	5037127010372	Wahl afro Electric Hot comb/straightening comb, Gold/Black	1742887	Неклассифицированные/Personal Care Appliances	297271	Wahl
308564	043917419718	Wahl all Body massager	489646	Спорт и отдых (folder)/Массажер	297271	Wahl
2706648	043917412061	Wahl all-Body massage powerful therapeutic massager	1	Неклассифицированные/default	297271	Wahl
1170664	5996415016918	Wahl animal clipper 230v 50-60hz chg/bl - машинка для стрижки	463706	Товары для животных (folder)/Груминг	297271	Wahl
1170667	4015110008903	Wahl animal clipper contour - машинка для стрижки	463706	Товары для животных (folder)/Груминг	297271	Wahl
1170668	4015110005247	Wahl animal clipper multi cut - машинка для стрижки	463706	Товары для животных (folder)/Груминг	297271	Wahl
1170669	4015110005261	Wahl animal clipper Pro series Blue - машинка для стрижки,голубая	463706	Товары для животных (folder)/Груминг	297271	Wahl
1170670	4015110007340	Wahl animal clipper Super groom chg/Black - машинка для стрижки	463706	Товары для животных (folder)/Груминг	297271	Wahl
1170671	4015110007357	Wahl animal clipper Super trim chg/Black - машинка для стрижки	463706	Товары для животных (folder)/Груминг	297271	Wahl
1170673	4015110005223	Wahl animal clipper trimmer show Pro White/Black - машинка для стрижки	463706	Товары для животных (folder)/Груминг	297271	Wahl
1170674	4015110005230	Wahl animal clipper u-clip Black/Blue-машинка для стрижки	463706	Товары для животных (folder)/Груминг	297271	Wahl
1170675	4015110005278	Wahl animal trimmer stylique Light grey-машинка для стрижки	463706	Товары для животных (folder)/Груминг	297271	Wahl
4960950	5037127023570	Wahl Aqua blade beard and stubble trimmer	1742887	Неклассифицированные/Personal Care Appliances	297271	Wahl
4960951	5037127023693	Wahl baldfader Plus Ultra close cut clipper kit	1742887	Неклассифицированные/Personal Care Appliances	297271	Wahl
308565	043917865539	Wahl Black Peanut clipper&trimmer canada model	5586	Косметика (folder)/Косметика	297271	Wahl
308566	043917898612	Wahl bling trimmer	535118	Галантерея (folder)/Триммер	297271	Wahl
308567	043917706078	Wahl bump-free shaver rechargeable cord or cordless	1757047	Гигиена (folder)/Бритва	297271	Wahl
1170690	4015110008170	Wahl Cat nylon slicker brush - нейлоновая щетка для кошек	463706	Товары для животных (folder)/Груминг	297271	Wahl
1170691	4015110008361	Wahl Cat scissors - когтерез для кошек	463706	Товары для животных (folder)/Груминг	297271	Wahl
1170692	4015110008408	Wahl Cat shedding blade - триммер для кошек	463706	Товары для животных (folder)/Груминг	297271	Wahl
4960952	5055325950702	Wahl charge Pro mains rechargeable clipper, Black	1742887	Неклассифицированные/Personal Care Appliances	297271	Wahl
4771030	043917795560	Wahl chrome Pro complete Hair cutting kit	1	Неклассифицированные/default	0	
667531	043917795164	Wahl chromepro 25pcs haircut ki	1	Неклассифицированные/default	297271	Wahl
4771031	043917790077	Wahl clip and trim	1	Неклассифицированные/default	0	
4771032	043917100609	Wahl clipper corporation 2 hole clipper blade (standard)	1	Неклассифицированные/default	0	
4771033	043917843629	Wahl clipper lid	1	Неклассифицированные/default	0	
308568	043917930701	Wahl clipper Mini Pro 12pcs	1742887	Неклассифицированные/Personal Care Appliances	297271	Wahl
4960953	5037127019368	Wahl close cut Hair clipper	1742887	Неклассифицированные/Personal Care Appliances	297271	Wahl
5231539	043917002361	Wahl close cut Pro 79111-1616	36297	Уход за волосами (folder)/Машинка для стрижки	297271	Wahl
2706649	043917791098	Wahl close cut Pro Ultra-close haircutting&grooming kit	1	Неклассифицированные/default	297271	Wahl
2706650	043917793092	Wahl Color Pro Color coded haircutting kit	1	Неклассифицированные/default	297271	Wahl
4960954	5037127021798	Wahl colour Pro cordless Hair clipper	1742887	Неклассифицированные/Personal Care Appliances	297271	Wahl
308569	043917795300	Wahl corded chrome Pro 24-piece haircut kit	297057	Лекарственные средства (folder)/Health & Personal Care	297271	Wahl
2706651	043917791463	Wahl cordless clipper heavy duty battery haircutting kit	1	Неклассифицированные/default	297271	Wahl
2706652	043917986265	Wahl de luxe detailer advanced rechargeable	1	Неклассифицированные/default	297271	Wahl
4771034	043917795621	Wahl de luxe haircutting kit	1	Неклассифицированные/default	0	
5231541	043917000176	Wahl de luxe lighted < 5546-216 > триммер для стрижки волос в области носа и ушей	5116026	бритвы, машинки для стрижки	297271	Wahl
5231542	4015110017578	Wahl de luxe lighted < 5546-216 > триммер для стрижки волос в области носа и ушей #2	5116026	бритвы, машинки для стрижки	297271	Wahl
1170694	4015110008187	Wahl de luxe pedicure kit - набор когтерез+пилочка de luxe	463706	Товары для животных (folder)/Груминг	297271	Wahl
5231543	5037127007884	Wahl detailer коричневый/серебристый	36297	Уход за волосами (folder)/Машинка для стрижки	297271	Wahl
667532	043917554556	Wahl ear,nose&brow trimmer	1	Неклассифицированные/default	297271	Wahl
4771035	064132055420	Wahl Easy groom basic - nose, ear&eyebrow trimmer	1	Неклассифицированные/default	0	
308570	043917832906	Wahl essentials professional clipper and trimmer kit	360487	Уход за волосами (folder)/Парикмахерская	297271	Wahl
4960956	5037127023709	Wahl fade Pro clipper kit	1742887	Неклассифицированные/Personal Care Appliances	297271	Wahl
1170695	4015110008293	Wahl flea comb - расческа от блох с коротким частым зубом	463706	Товары для животных (folder)/Груминг	297271	Wahl
4960957	5055769081222	Wahl grooming contains clipper/trimmer/ear and nose trimmer gift set	1742887	Неклассифицированные/Personal Care Appliances	297271	Wahl
1643742	043917991658	Wahl groomsman 9916	1	Неклассифицированные/default	297271	Wahl
1643741	043917991054	Wahl groomsman ii	1	Неклассифицированные/default	297271	Wahl
5231545	4015110007517	Wahl groomsman Pro < 9855-1216 > триммер универсальный	5116026	бритвы, машинки для стрижки	297271	Wahl
308571	043917998053	Wahl Hair doodles Hair design kit	297057	Лекарственные средства (folder)/Health & Personal Care	297271	Wahl
5231546	043917963556	Wahl haircut&beard clipper черный	36297	Уход за волосами (folder)/Машинка для стрижки	297271	Wahl
4771036	043917795003	Wahl haircutting kit, de luxe chrome Pro, model 79524-1001, 27 piece set	1	Неклассифицированные/default	1714609	Moser
308572	043917806495	Wahl Half pint - battery operated trimmer (#8064-900)	5586	Косметика (folder)/Косметика	297271	Wahl
4771037	039152000088	Wahl Home product clippers Power Pro	1	Неклассифицированные/default	0	
2706653	043917564111	Wahl Home products micro groomsman lithium Power	1	Неклассифицированные/default	297271	Wahl
4960958	5055259124415	Wahl homepro basic mains Hair clipper set	1742887	Неклассифицированные/Personal Care Appliances	297271	Wahl
1643743	043917925554	Wahl homepro kit	1	Неклассифицированные/default	297271	Wahl
4960959	5037127021958	Wahl Hot brush, 19 mm	1742887	Неклассифицированные/Personal Care Appliances	297271	Wahl
2706654	043917994536	Wahl Hot-cold massage vibrating therapeutic Gel pack	1	Неклассифицированные/default	297271	Wahl
4960960	5037127019795	Wahl ladies personal trimmer	1742887	Неклассифицированные/Personal Care Appliances	297271	Wahl
1170696	4015110008224	Wahl large seft clean brush for dogs - самоочищающая щетка для собак	463706	Товары для животных (folder)/Груминг	297271	Wahl
1170697	4015110008200	Wahl large slicker brush - большая щетка для собак	463706	Товары для животных (folder)/Груминг	297271	Wahl
4960961	5037127019665	Wahl lithium all-in-One trimmer	1742887	Неклассифицированные/Personal Care Appliances	297271	Wahl
2706655	043917700014	Wahl lithium ion cordless clipper - 23 piece	1	Неклассифицированные/default	297271	Wahl
4960962	5037127018200	Wahl lithium ion micro finisher detail trimmer	1742887	Неклассифицированные/Personal Care Appliances	297271	Wahl
4960963	5037127024065	Wahl lithium ion precision multigroomer kit	1742887	Неклассифицированные/Personal Care Appliances	297271	Wahl
2706656	043917796116	Wahl lithium ion Pro complete cordless haircutting kit	1	Неклассифицированные/default	297271	Wahl
2706657	043917985473	Wahl lithium-ion trimmer kit	1	Неклассифицированные/default	297271	Wahl
5231549	4015110078456	Wahl Magic clip коричневый/серебристый 8451-016	36297	Уход за волосами (folder)/Машинка для стрижки	297271	Wahl
308573	043917874609	Wahl manscaper rechargeable full Body Hair trimmer	535118	Галантерея (folder)/Триммер	297271	Wahl
1643744	043917419633	Wahl massage kit	1	Неклассифицированные/default	297271	Wahl
308574	043917412047	Wahl massager 2-Speed 7-attachment	489646	Спорт и отдых (folder)/Массажер	297271	Wahl
5231550	4015110010012	Wahl micro finish trimmer лиловый	5134252	Триммер для волос	297271	Wahl
308575	043917997179	Wahl mustache cordless battery powered travel trimmer with convenient travel pouch	535118	Галантерея (folder)/Триммер	297271	Wahl
4771038	043917553740	Wahl mustache&beard trimmer model 5537-420	1	Неклассифицированные/default	0	
1643745	043917556055	Wahl nose hr trimmer	1	Неклассифицированные/default	297271	Wahl
5231552	043917002156	Wahl nosetrimmer micro lithium серый	36297	Уход за волосами (folder)/Машинка для стрижки	297271	Wahl
1170698	4015110008262	Wahl Palm slicker brush - пуходерка	463706	Товары для животных (folder)/Груминг	297271	Wahl
308576	043917868615	Wahl Peanut clipper&trimmer model	5586	Косметика (folder)/Косметика	297271	Wahl
308577	043917866307	Wahl Peanut cordless clipper/trimmer combo model 8663	535118	Галантерея (folder)/Триммер	297271	Wahl
308578	043917865508	Wahl Peanut shaped clipper	5586	Косметика (folder)/Косметика	297271	Wahl
308579	043917206837	Wahl Peanut standard blades	1742887	Неклассифицированные/Personal Care Appliances	297271	Wahl
1170699	4015110008309	Wahl pet grooming comb - расческа с длинным частым зубом	463706	Товары для животных (folder)/Груминг	297271	Wahl
1170700	4015110008156	Wahl pet Nail clipper&file (scissors style)- набор когтерез+пилочка	463706	Товары для животных (folder)/Груминг	297271	Wahl
4960964	5037127006795	Wahl pocket Pro Hair trimmer battery Black rubberised 8066-717	1742887	Неклассифицированные/Personal Care Appliances	297271	Wahl
308580	411378010162	Wahl Pro Peanut Palm size Hair trimmer clipper 8685	535118	Галантерея (folder)/Триммер	297271	Wahl
308581	072874404406	Wahl Pro senior premium Hair trimmer and clipper - 8500	535118	Галантерея (folder)/Триммер	297271	Wahl
4771039	043917955018	Wahl Pro series cordless Hair clippers, model 9550-501	1	Неклассифицированные/default	0	
308582	043917847016	Wahl professional Super taper ii powerful clipper with taper lever (model: 8470-500)	1742887	Неклассифицированные/Personal Care Appliances	297271	Wahl
1170701	4015110008194	Wahl puppy slicker brush - металлическая щетка для щенков	463706	Товары для животных (folder)/Груминг	297271	Wahl
4960965	5037127022979	Wahl rechargeable clipper gift set with battery beard trimmer and nose Hair trimmer	1742887	Неклассифицированные/Personal Care Appliances	0	
308583	043917104331	Wahl replacement blade set #1045 for Home clippers * Plus 4oz Oil	1742887	Неклассифицированные/Personal Care Appliances	297271	Wahl
1170702	4015110008255	Wahl rubber Palm pad with pins - резиновая щетка - рукавица	463706	Товары для животных (folder)/Груминг	297271	Wahl
1170703	4015110008248	Wahl shedding tools/deshedder - триммер скребница	463706	Товары для животных (folder)/Груминг	297271	Wahl
4960966	5060291602623	Wahl showman tea tree Shampoo 5 litre	1742887	Неклассифицированные/Personal Care Appliances	297271	Wahl
1170704	4015110010388	Wahl smart trim pet ws/sw - машинка для стрижки	463706	Товары для животных (folder)/Груминг	297271	Wahl
4960967	5037127022689	Wahl spl 4in1 multigroomer, stainless steel	1742887	Неклассифицированные/Personal Care Appliances	297271	Wahl
4960968	5037127022658	Wahl spl Power Hair clipper	1742887	Неклассифицированные/Personal Care Appliances	297271	Wahl
308584	043917872513	Wahl sterling eclipse clipper #8725 * lithium ion battery * New Black Color	36297	Уход за волосами (folder)/Машинка для стрижки	297271	Wahl
5231553	5996415031898	Wahl Super taper белый	36297	Уход за волосами (folder)/Машинка для стрижки	297271	Wahl
4771040	043917888132	Wahl switchblade pet grooming clippers	1	Неклассифицированные/default	0	
4960969	5037127023716	Wahl t-Pro rechargeable trimmer kit	1742887	Неклассифицированные/Personal Care Appliances	0	
1743412	043917206820	Wahl tid-bit clipper replacement blade	337596	Товары для животных (folder)/Pets	0	
308585	411378027474	Wahl trim n vac vacuuming beard trimmer rechargeable cord / cordless with durachrome finish	535118	Галантерея (folder)/Триммер	297271	Wahl
4771041	064132032186	Wahl trim'nvac (model 3218)	1	Неклассифицированные/default	0	
308586	043917988023	Wahl triple Play 23pcs lithium ion powered shaver, trimmer, clipper and detailer	5586	Косметика (folder)/Косметика	297271	Wahl
5231554	4015110017561	Wahl vario < 1541.0460 > триммер	5116026	бритвы, машинки для стрижки	297271	Wahl
5231555	5996415020458	Wahl vario trimmer li-ion черный/серебристый	5116026	бритвы, машинки для стрижки	297271	Wahl
1170705	295390000000	Wahluke Wine company milbrandt Cabernet Sauvignon legacy 05 milbrandt Cabernet Sauvignon legacy 05 750ml /12	22133	Продукты питания (folder)/Алкогольные напитки/Вино (folder)/Вино	393013	Milbrandt
1170706	295420000000	Wahluke Wine company milbrandt syrah lgcy 05 milbrandt syrah lgcy 05 750ml /12	22133	Продукты питания (folder)/Алкогольные напитки/Вино (folder)/Вино	393013	Milbrandt
1170707	3264500000008	Wahluke Wine company milbrandt trdns Cabernet Sauvignon 06 milbrandt trdns Cabernet Sauvignon 06 750ml /12	22133	Продукты питания (folder)/Алкогольные напитки/Вино (folder)/Вино	393013	Milbrandt
393022	896280001079	Wahluke Wine company milbrandt trdns chard 06 milbrandt trdns chard 06 750ml /12	22133	Продукты питания (folder)/Алкогольные напитки/Вино (folder)/Вино	393013	Milbrandt
1170708	896280001055	Wahluke Wine company milbrandt trdns Merlot 06 milbrandt trdns Merlot 06 750ml /12	22133	Продукты питания (folder)/Алкогольные напитки/Вино (folder)/Вино	393013	Milbrandt
393023	896280001086	Wahluke Wine company milbrandt trdns Pinot Grigio 06 750ml /12	22133	Продукты питания (folder)/Алкогольные напитки/Вино (folder)/Вино	393013	Milbrandt
393024	896280001062	Wahluke Wine company milbrandt trdns ries 06 milbrandt trdns ries 06 750ml /12	22133	Продукты питания (folder)/Алкогольные напитки/Вино (folder)/Вино	393013	Milbrandt
1170709	3264600000007	Wahluke Wine company milbrandt trdns syrah 06 milbrandt trdns syrah 06 750ml /12	22133	Продукты питания (folder)/Алкогольные напитки/Вино (folder)/Вино	393013	Milbrandt
5231556	853988006454	Wahoo fitness tickr	5129686	Пульсометр	5148136	wahoo fitness
5231557	857335002984	Wahoo fitness стол с креплением	5124628	запасные части для тренажеров	5148136	wahoo fitness
2413338	672438000558	Wahoo Wheat glass 12floz	1	Неклассифицированные/default	0	
