ID	UPCEAN	Name	CategoryID	CategoryName	BrandID	BrandName
2967216	4860001740383	Вино iosif алазанская Долина красное полусладк 10.5-12.5% 750ml ст/б	282274	Продукты питания (folder)/Алкогольные напитки/Вино (folder)/Вина Грузии	0	
3284594	4860001740406	Вино iosif саперави красное сухое 10-12% 750ml ст/б	282274	Продукты питания (folder)/Алкогольные напитки/Вино (folder)/Вина Грузии	0	
3284595	4860001740413	Вино iosif цинандали белое сухое 10.5-12% 750ml ст/б	282274	Продукты питания (folder)/Алкогольные напитки/Вино (folder)/Вина Грузии	0	
2425623	7808765706709	Вино isla de pascua Cabernet Sauvignon красное сухое 12% 750ml ст/б	22133	Продукты питания (folder)/Алкогольные напитки/Вино (folder)/Вино	0	
1193289	7808765706754	Вино isla de pascua Sauvignon блан белое сухое 13% 750ml ст/б	22133	Продукты питания (folder)/Алкогольные напитки/Вино (folder)/Вино	0	
1193288	7808765706716	Вино isla de pascua карменер красное сухое 13% 750ml	22133	Продукты питания (folder)/Алкогольные напитки/Вино (folder)/Вино	0	
2720798	7808765706747	Вино isla de pascua столов Chardonnay бел сух 750ml 13%	22133	Продукты питания (folder)/Алкогольные напитки/Вино (folder)/Вино	0	
1504397	7804320442273	Вино isla negra cab.sauv. красн п/ сух 13% 750ml	22133	Продукты питания (folder)/Алкогольные напитки/Вино (folder)/Вино	609206	Isla Negra
43726	7804320125688	Вино isla negra Cabernet Sauvignon-мерло красн псух 3л 12.5% /Чили/	282291	Продукты питания (folder)/Алкогольные напитки/Вино (folder)/Вина Чили	43724	Исла Негра
43725	7804320099880	Вино isla negra Cabernet Sauvignon-мерло красное п/сух 12-12.5% 750ml ст/б	282291	Продукты питания (folder)/Алкогольные напитки/Вино (folder)/Вина Чили	43724	Исла Негра
282692	7804320404509	Вино isla negra Merlot резерва красн сух 750ml 12.5% /Чили/	282291	Продукты питания (folder)/Алкогольные напитки/Вино (folder)/Вина Чили	609206	Isla Negra
1659854	7804320184258	Вино isla negra Sauvignon blanc Chardonnay белое п/сух 12.5-13% 750ml ст/б	282291	Продукты питания (folder)/Алкогольные напитки/Вино (folder)/Вина Чили	43724	Исла Негра
2227050	7804320581354	Вино isla negra Sauvignon блан Chardonnay бел п/ сух 3л т/п	282291	Продукты питания (folder)/Алкогольные напитки/Вино (folder)/Вина Чили	43724	Исла Негра
43727	7804320125695	Вино isla negra Sauvignon блан семийон бел псух 13% 3л	282291	Продукты питания (folder)/Алкогольные напитки/Вино (folder)/Вина Чили	43724	Исла Негра
43728	7804320099873	Вино isla negra Sauvignon блан-семийон бел псух 750ml 12.5% /Чили/	282291	Продукты питания (folder)/Алкогольные напитки/Вино (folder)/Вина Чили	43724	Исла Негра
2853665	7804320629599	Вино isla negra вест бэй Cabernet Sauvignon-мерло п/ сух 0.187л	22133	Продукты питания (folder)/Алкогольные напитки/Вино (folder)/Вино	0	
2853666	7804320626079	Вино isla negra вест бэй Chardonnay п/ сух 0.187л	22133	Продукты питания (folder)/Алкогольные напитки/Вино (folder)/Вино	0	
3793023	7804320625799	Вино isla negra вест бэй б.п/сух12% 1.0л	22133	Продукты питания (folder)/Алкогольные напитки/Вино (folder)/Вино	609206	Isla Negra
3793024	7804320625782	Вино isla negra вест бэй к.п/сух12% 1.0л	22133	Продукты питания (folder)/Алкогольные напитки/Вино (folder)/Вино	609206	Isla Negra
2425534	7804320625959	Вино isla negra вест бэй розе розовое п/сух 12% 750ml ст/б	22133	Продукты питания (folder)/Алкогольные напитки/Вино (folder)/Вино	43724	Исла Негра
3284596	8437005574656	Вино isla oro Merlot красное сухое 12.5% 750ml стекло	22133	Продукты питания (folder)/Алкогольные напитки/Вино (folder)/Вино	0	
2853669	8437005574052	Вино isla oro tempranillo красное сухое 12.5% 750ml стекло	22133	Продукты питания (folder)/Алкогольные напитки/Вино (folder)/Вино	0	
2853667	8437005574045	Вино isla oro айрен белое сухое 12% 750ml стекло	22133	Продукты питания (folder)/Алкогольные напитки/Вино (folder)/Вино	0	
3287931	8437005574663	Вино isla oro красное сухое 12.5% 750ml ст/б	22133	Продукты питания (folder)/Алкогольные напитки/Вино (folder)/Вино	0	
2853668	8437005574069	Вино isla oro крианса темпранилло сухое красное 13% 750ml ст/б	22133	Продукты питания (folder)/Алкогольные напитки/Вино (folder)/Вино	0	
3284597	4860013083232	Вино iveria kindzmarauli красное полусладк 11-12% 750ml ст/б	282274	Продукты питания (folder)/Алкогольные напитки/Вино (folder)/Вина Грузии	0	
3284598	4860038077322	Вино iveriuli Тбилиси столов сухое белое 11.5% 700ml стекло	282274	Продукты питания (folder)/Алкогольные напитки/Вино (folder)/Вина Грузии	0	
3284599	4840044004376	Вино izumrud garling столов белое полусладк 11% 750ml стбут	22133	Продукты питания (folder)/Алкогольные напитки/Вино (folder)/Вино	0	
2424871	4840058002023	Вино j совино бел полусладк 10-12%(Modern) 750ml	22133	Продукты питания (folder)/Алкогольные напитки/Вино (folder)/Вино	0	
46928	7804444001172	Вино j.bouchon Cabernet Sauvignon красное сухое 750ml 14% ст/б	282291	Продукты питания (folder)/Алкогольные напитки/Вино (folder)/Вина Чили	46925	J.Bouchon
46927	7804444001141	Вино j.bouchon Cabernet Sauvignon резерва эспесиаль сухое 14% 750ml	282291	Продукты питания (folder)/Алкогольные напитки/Вино (folder)/Вина Чили	46925	J.Bouchon
1195745	7804444001257	Вино j.bouchon Cabernet Sauvignon розе reserva розовое сухое 13.5% 750ml ст/б	282291	Продукты питания (folder)/Алкогольные напитки/Вино (folder)/Вина Чили	0	
46929	7804444001158	Вино j.bouchon carmenere reserva эспесьяль сухое красное 14% 750ml ст/б	282291	Продукты питания (folder)/Алкогольные напитки/Вино (folder)/Вина Чили	46925	J.Bouchon
46930	7804444001240	Вино j.bouchon carmenere syrah reserva красное сухое 14% 750ml ст/б	282291	Продукты питания (folder)/Алкогольные напитки/Вино (folder)/Вина Чили	46925	J.Bouchon
3283856	7804444001684	Вино j.bouchon carmenere syrah reserva красное сухое 14% 750ml ст/б #2	22133	Продукты питания (folder)/Алкогольные напитки/Вино (folder)/Вино	0	
691264	7804444001226	Вино j.bouchon Chardonnay reserva сухое белое 12% 750ml ст/б	282291	Продукты питания (folder)/Алкогольные напитки/Вино (folder)/Вина Чили	46925	J.Bouchon
1195746	780444400122	Вино j.bouchon Chardonnay бел/сух 13.5% 750ml	282291	Продукты питания (folder)/Алкогольные напитки/Вино (folder)/Вина Чили	1193538	ЛУДИНГ
46934	7804444001165	Вино j.bouchon Chardonnay рез.эспесьяль бел сух 750ml	282291	Продукты питания (folder)/Алкогольные напитки/Вино (folder)/Вина Чили	46925	J.Bouchon
46931	7804444001134	Вино j.bouchon Malbec reserva эспесьяль сухое красное 13% 750ml ст/б	282291	Продукты питания (folder)/Алкогольные напитки/Вино (folder)/Вина Чили	46925	J.Bouchon
2227222	7804444001349	Вино j.bouchon Malbec резерва 2011 красн/сух 0.75 13% 1/6	282291	Продукты питания (folder)/Алкогольные напитки/Вино (folder)/Вина Чили	0	
46932	7804444001189	Вино j.bouchon Merlot reserva сухое красное 14% 750ml ст/б	282291	Продукты питания (folder)/Алкогольные напитки/Вино (folder)/Вина Чили	46925	J.Bouchon
3283857	7804444001691	Вино j.bouchon Sauvignon блан reserva 2016 сухое белое 13% 750ml п/у	22133	Продукты питания (folder)/Алкогольные напитки/Вино (folder)/Вино	0	
46933	7804444001202	Вино j.bouchon Sauvignon блан reserva сухое белое 13% 750ml ст/б	282291	Продукты питания (folder)/Алкогольные напитки/Вино (folder)/Вина Чили	46925	J.Bouchon
46926	7804444001233	Вино j.bouchon ассамбляж красн сух 13.5% 750ml	282291	Продукты питания (folder)/Алкогольные напитки/Вино (folder)/Вина Чили	46925	J.Bouchon
691263	7804444001295	Вино j.bouchon мингре сухое 13% 750ml	282291	Продукты питания (folder)/Алкогольные напитки/Вино (folder)/Вина Чили	46925	J.Bouchon
192526	3500610001628	Вино j.j.&c. Rouge 750ml	22133	Продукты питания (folder)/Алкогольные напитки/Вино (folder)/Вино	0	
3284600	3500610092923	Вино j.jencguel&cie столов белое полусладк 10.5% 750ml ст/б	22133	Продукты питания (folder)/Алкогольные напитки/Вино (folder)/Вино	0	
43324	4607087150084	Вино j.p.chenet 750ml+j.p.chenet игр 250ml п/у	41821	Продукты питания (folder)/Алкогольные напитки/Вино (folder)/Вина Франции	382491	J.P.Chenet
1192198	3500610075490	Вино j.p.chenet beaujolais nouveau красн сух под.бут 750ml 12% /Франция/	22133	Продукты питания (folder)/Алкогольные напитки/Вино (folder)/Вино	382491	J.P.Chenet
192528	3500610031427	Вино j.p.chenet blanc de blanc 3l	41821	Продукты питания (folder)/Алкогольные напитки/Вино (folder)/Вина Франции	382491	J.P.Chenet
43328	3263286301316	Вино j.p.chenet blanc de blanc белое сухое 2002 750ml (Франция)	41821	Продукты питания (folder)/Алкогольные напитки/Вино (folder)/Вина Франции	382491	J.P.Chenet
43327	3263286324223	Вино j.p.chenet blanc de blancs белое сухое 11% 250ml	41821	Продукты питания (folder)/Алкогольные напитки/Вино (folder)/Вина Франции	382491	J.P.Chenet
43330	3500610036057	Вино j.p.chenet Cabernet Merlot красн сух 14% 750ml	41821	Продукты питания (folder)/Алкогольные напитки/Вино (folder)/Вина Франции	382491	J.P.Chenet
192529	3263289992719	Вино j.p.chenet Cabernet syrah 2x750 m	22133	Продукты питания (folder)/Алкогольные напитки/Вино (folder)/Вино	382491	J.P.Chenet
192530	3500610027468	Вино j.p.chenet Cabernet syrah 3l	41821	Продукты питания (folder)/Алкогольные напитки/Вино (folder)/Вина Франции	382491	J.P.Chenet
43331	3263289993112	Вино j.p.chenet Cabernet сира красн сух 12% 1.5л	22133	Продукты питания (folder)/Алкогольные напитки/Вино (folder)/Вино	382491	J.P.Chenet
43332	3500610032769	Вино j.p.chenet Cabernet сира красн сух 13% 375ml	41821	Продукты питания (folder)/Алкогольные напитки/Вино (folder)/Вина Франции	382491	J.P.Chenet
43344	3500610032271	Вино j.p.chenet Chardonnay бел сух 12.5% 750ml	41821	Продукты питания (folder)/Алкогольные напитки/Вино (folder)/Вина Франции	382491	J.P.Chenet
151853	3263286329006	Вино j.p.chenet Chardonnay премьер де кюви 12% 750ml бел сух	22133	Продукты питания (folder)/Алкогольные напитки/Вино (folder)/Вино	382491	J.P.Chenet
43337	3263286321284	Вино j.p.chenet le Grand медиум свит белое полусладк 11.5% 750ml ст/б	22133	Продукты питания (folder)/Алкогольные напитки/Вино (folder)/Вино	382491	J.P.Chenet
43329	3263286324247	Вино j.p.chenet medium sweet белое полусладк 11% 250ml	41821	Продукты питания (folder)/Алкогольные напитки/Вино (folder)/Вина Франции	382491	J.P.Chenet
43336	3263286328405	Вино j.p.chenet Merlot красн псух 13% 750ml	41821	Продукты питания (folder)/Алкогольные напитки/Вино (folder)/Вина Франции	382491	J.P.Chenet
3794719	3263286347413	Вино j.p.chenet shiraz вдп к.п/с.12% 750ml	22133	Продукты питания (folder)/Алкогольные напитки/Вино (folder)/Вино	382491	J.P.Chenet
382511	3263289998711	Вино j.p.chenet shiraz красн п/ сух 750ml	22133	Продукты питания (folder)/Алкогольные напитки/Вино (folder)/Вино	382491	J.P.Chenet
43326	3263286350659	Вино j.p.chenet блан бел безалкогольн 750ml	41821	Продукты питания (folder)/Алкогольные напитки/Вино (folder)/Вина Франции	382491	J.P.Chenet
1659686	3500610052972	Вино j.p.chenet блан муалле белое полусладк 10.5% 750ml ст/б	22133	Продукты питания (folder)/Алкогольные напитки/Вино (folder)/Вино	382491	J.P.Chenet
1509278	3263280105262	Вино j.p.chenet гр-сен.р.п/ сух 0.187л	22133	Продукты питания (folder)/Алкогольные напитки/Вино (folder)/Вино	382491	J.P.Chenet
1509269	3263286350611	Вино j.p.chenet каб-сир.к.п/сух0.187л	22133	Продукты питания (folder)/Алкогольные напитки/Вино (folder)/Вино	382491	J.P.Chenet
43333	3263286301323	Вино j.p.chenet каберне-сира красн п/ сух 13% 750ml	41821	Продукты питания (folder)/Алкогольные напитки/Вино (folder)/Вина Франции	382491	J.P.Chenet
1509270	3263286350598	Вино j.p.chenet кол-шар б.п/сух0.187л	22133	Продукты питания (folder)/Алкогольные напитки/Вино (folder)/Вино	382491	J.P.Chenet
609417	3263286346683	Вино j.p.chenet коломбар Chardonnay виноградное столов белое полусухое 12-12.5% 750ml ст/б	41821	Продукты питания (folder)/Алкогольные напитки/Вино (folder)/Вина Франции	382491	J.P.Chenet
43339	3263286350666	Вино j.p.chenet красн безалкогольн 0.5% 750ml	41821	Продукты питания (folder)/Алкогольные напитки/Вино (folder)/Вина Франции	382491	J.P.Chenet
282557	3500610052965	Вино j.p.chenet ле жен красн псух 750ml 11.5% /Франция/	22133	Продукты питания (folder)/Алкогольные напитки/Вино (folder)/Вино	382491	J.P.Chenet
2720423	3263280107976	Вино j.p.chenet медиум свит бел полусладк 187ml 12%	22133	Продукты питания (folder)/Алкогольные напитки/Вино (folder)/Вино	0	
2720424	3500610063084	Вино j.p.chenet медиум свит крас полусладк 187ml 12%	22133	Продукты питания (folder)/Алкогольные напитки/Вино (folder)/Вино	382491	J.P.Chenet
43338	3500610035111	Вино j.p.chenet медиум свит ле гранд ше дефр розов полусладк 11.5% 750ml	41821	Продукты питания (folder)/Алкогольные напитки/Вино (folder)/Вина Франции	382491	J.P.Chenet
2720425	3263280105279	Вино j.p.chenet медиум свит розов полусладк 187ml 12%	22133	Продукты питания (folder)/Алкогольные напитки/Вино (folder)/Вино	0	
43325	3500610033384	Вино j.p.chenet медиум свит. кот де то бел полусладк 750ml 11%	41821	Продукты питания (folder)/Алкогольные напитки/Вино (folder)/Вина Франции	382491	J.P.Chenet
43340	3500610033346	Вино j.p.chenet медиум свит. медитерране красн полусладк 750ml 11.5%	41821	Продукты питания (folder)/Алкогольные напитки/Вино (folder)/Вина Франции	382491	J.P.Chenet
151125	3500610014789	Вино j.p.chenet премьер де кюви Cabernet Merlot 750ml 13% красн сух	22133	Продукты питания (folder)/Алкогольные напитки/Вино (folder)/Вино	382491	J.P.Chenet
1192885	3500610052989	Вино j.p.chenet руж муалле ле жен красное полусладк 11% 750ml с/б	22133	Продукты питания (folder)/Алкогольные напитки/Вино (folder)/Вино	382491	J.P.Chenet
151541	3500610032882	Вино j.p.chenet сено гренаш розов/сухое 750ml	22133	Продукты питания (folder)/Алкогольные напитки/Вино (folder)/Вино	382491	J.P.Chenet
609416	3263286301385	Вино j.p.chenet сенсо гренаж розовое п/сух 12.5% 750ml	41821	Продукты питания (folder)/Алкогольные напитки/Вино (folder)/Вина Франции	382491	J.P.Chenet
43341	3500610032776	Вино j.p.chenet сенсо гренаш розов сух 12.5% 375ml	41821	Продукты питания (folder)/Алкогольные напитки/Вино (folder)/Вина Франции	382491	J.P.Chenet
43342	3263286328399	Вино j.p.chenet сира красн сух 750ml (Франция)	41821	Продукты питания (folder)/Алкогольные напитки/Вино (folder)/Вина Франции	382491	J.P.Chenet
2345375	3500610085338	Вино j.p.chenet хо белое/п/сух 10.5% 750ml ст/б	296061	Продукты питания (folder)/Алкогольные напитки/Вино (folder)/Вино игристое	382491	J.P.Chenet
2424875	3262850043164	Вино jacgues ler. красн сух 11%750ml	22133	Продукты питания (folder)/Алкогольные напитки/Вино (folder)/Вино	0	
2424873	3262850043171	Вино jacgues ler.бел сух 11%750ml	22133	Продукты питания (folder)/Алкогольные напитки/Вино (folder)/Вино	0	
2424872	3262850043195	Вино jacgues levallier бел полусладк 10.5% 750ml	22133	Продукты питания (folder)/Алкогольные напитки/Вино (folder)/Вино	0	
2424874	3262850043188	Вино jacgues levallier. красн полусладк 10.5% 750ml	22133	Продукты питания (folder)/Алкогольные напитки/Вино (folder)/Вино	0	
43013	9300727513137	Вино jacob's Creek Cabernet Sauvignon 2006g красн сух 750ml 14% (Австралия)	282286	Продукты питания (folder)/Алкогольные напитки/Вино (folder)/Вина Австралии	43010	Jacob's Creek
688709	9300727513212	Вино jacob's Creek Cabernet Sauvignon 2009g красн сух 750ml 14% (Австралия)	282286	Продукты питания (folder)/Алкогольные напитки/Вино (folder)/Вина Австралии	43010	Jacob's Creek
1192765	9300727013316	Вино jacob's Creek Cabernet Sauvignon красн сух 14% 750ml	22133	Продукты питания (folder)/Алкогольные напитки/Вино (folder)/Вино	43010	Jacob's Creek
3791408	9300727013347	Вино jacob's Creek Chardonnay бел п/ сух 750ml	22133	Продукты питания (folder)/Алкогольные напитки/Вино (folder)/Вино	43010	Jacob's Creek
43011	9300727406002	Вино jacob's Creek Chardonnay бел сух 12% 750ml	282286	Продукты питания (folder)/Алкогольные напитки/Вино (folder)/Вина Австралии	43010	Jacob's Creek
380841	9300727406538	Вино jacob's Creek Chardonnay бел сух 750ml 12.5% (Австралия)	282286	Продукты питания (folder)/Алкогольные напитки/Вино (folder)/Вина Австралии	43010	Jacob's Creek
688710	9300727406149	Вино jacob's Creek Chardonnay рез. бел сух 750ml	282286	Продукты питания (folder)/Алкогольные напитки/Вино (folder)/Вина Австралии	43010	Jacob's Creek
43012	9300727135537	Вино jacob's Creek Chardonnay резерва бел сух 11% 750ml	282286	Продукты питания (folder)/Алкогольные напитки/Вино (folder)/Вина Австралии	43010	Jacob's Creek
43016	9300727135544	Вино jacob's Creek Chardonnay резерва бел сух 13.5% 750ml	282286	Продукты питания (folder)/Алкогольные напитки/Вино (folder)/Вина Австралии	43010	Jacob's Creek
43014	9300727508140	Вино jacob's Creek Merlot красн сух 13.5% 750ml	282286	Продукты питания (folder)/Алкогольные напитки/Вино (folder)/Вина Австралии	43010	Jacob's Creek
1192767	9300727453174	Вино jacob's Creek shiraz Cabernet красн сух 12.5-14% 750ml	22133	Продукты питания (folder)/Алкогольные напитки/Вино (folder)/Вино	43010	Jacob's Creek
43017	930072748800	Вино jacob's Creek shiraz Cabernet красн сух 750ml	282286	Продукты питания (folder)/Алкогольные напитки/Вино (folder)/Вина Австралии	43010	Jacob's Creek
1192768	9300727013323	Вино jacob's Creek shiraz Cabernet красн сух 750ml 13.5% /Австралия	22133	Продукты питания (folder)/Алкогольные напитки/Вино (folder)/Вино	43010	Jacob's Creek
380863	9300727453600	Вино jacob's Creek shiraz Cabernet красн сух 750ml 14% (Австралия)	282286	Продукты питания (folder)/Алкогольные напитки/Вино (folder)/Вина Австралии	43010	Jacob's Creek
43018	9300727488206	Вино jacob's Creek shiraz красн сух 750ml 13.5% (Австралия)	282286	Продукты питания (folder)/Алкогольные напитки/Вино (folder)/Вина Австралии	43010	Jacob's Creek
43019	9300727516114	Вино jacob's Creek shiraz резерва красн сух 14.5% 750ml	282286	Продукты питания (folder)/Алкогольные напитки/Вино (folder)/Вина Австралии	43010	Jacob's Creek
688711	9300727618016	Вино jacob's Creek shiraz розе 750ml 12%	282286	Продукты питания (folder)/Алкогольные напитки/Вино (folder)/Вина Австралии	43010	Jacob's Creek
380854	9300727008640	Вино jacob's Creek клас.сов.бл. бел сух 750ml	282286	Продукты питания (folder)/Алкогольные напитки/Вино (folder)/Вина Австралии	43010	Jacob's Creek
1192766	9300727013330	Вино jacob's Creek рислинг бел сух 750ml 11.4% /Австралия	22133	Продукты питания (folder)/Алкогольные напитки/Вино (folder)/Вино	43010	Jacob's Creek
170575	9300727389275	Вино jacob's Creek рислинг бел сух 750ml 13% (Австралия)	282286	Продукты питания (folder)/Алкогольные напитки/Вино (folder)/Вина Австралии	43010	Jacob's Creek
43015	9300727367143	Вино jacob's Creek семильон Chardonnay бел сух 11% 750ml	282286	Продукты питания (folder)/Алкогольные напитки/Вино (folder)/Вина Австралии	43010	Jacob's Creek
