ID	UPCEAN	Name	CategoryID	CategoryName	BrandID	BrandName
1699749	4601887047162	Семена поиск сельдерей листовой бодрость (а) (среднеранний) 0.5g цв/п 10/ Польша	324395	Растениеводство (folder)/Семена	3517971	Поиск
824257	4601887057130	Семена поиск сельдерей листовой бодрость б/п	324395	Растениеводство (folder)/Семена	3517971	Поиск
3518331	4601887202714	Семена поиск сельдерей нежный листовой мягуп 0.5g	324395	Растениеводство (folder)/Семена	3517971	Поиск
3518332	4601887280989	Семена поиск сельдерей нежный листовой мягуп 0.5g #2	324395	Растениеводство (folder)/Семена	3517971	Поиск
824253	4601887047155	Семена поиск сельдерей силач корневой мягуп 0.5g	324395	Растениеводство (folder)/Семена	3517971	Поиск
1699750	4601887063704	Семена поиск сельдерей черешковый юта (а) (среднеспелый) 0.5g цв/п 10/ минимум Франция	324395	Растениеводство (folder)/Семена	3517971	Поиск
824264	4601887070948	Семена поиск сельдерей черешковый юта б/п	324395	Растениеводство (folder)/Семена	3517971	Поиск
3518333	4601887025597	Семена поиск серия бп бобы русские черные овощные 10шт м/у	324395	Растениеводство (folder)/Семена	3517971	Поиск
3518334	4601887148067	Семена поиск серия бп горох иловецкий овощной мягуп 10g	324395	Растениеводство (folder)/Семена	3517971	Поиск
3518335	4601887025825	Семена поиск серия бп капуста f1 трансфер белокочанная мягуп 0.5g	324395	Растениеводство (folder)/Семена	3517971	Поиск
3518336	4601887025726	Семена поиск серия бп капуста белорусская 455 белокочанная мягуп 0.5g	324395	Растениеводство (folder)/Семена	3517971	Поиск
3518337	4601887263838	Семена поиск серия бп капуста июньская белокочанная мягуп 0.5g	324395	Растениеводство (folder)/Семена	3517971	Поиск
3518338	4601887024194	Семена поиск серия бп капуста надежда белокочанная мягуп 0.5g	324395	Растениеводство (folder)/Семена	3517971	Поиск
823311	4601887001447	Семена поиск серия бп огурец f1 маринда 10шт м/у	324395	Растениеводство (folder)/Семена	3517971	Поиск
3518339	4601887026327	Семена поиск серия бп огурец f1 стелла 12шт м/у	324395	Растениеводство (folder)/Семена	3517971	Поиск
3518340	4601887264064	Семена поиск серия бп редька зимняя круглая черная мягуп 1g	324395	Растениеводство (folder)/Семена	3517971	Поиск
3518341	4601887023272	Семена поиск серия бп укроп узоры мягуп 3g	324395	Растениеводство (folder)/Семена	3517971	Поиск
3518342	4601887057246	Семена поиск серия бп укроп фейерверк мягуп 2g	324395	Растениеводство (folder)/Семена	3517971	Поиск
3518343	4601887217701	Семена поиск серия вкуснотека томат зефир в шоколаде 10шт м/у	324395	Растениеводство (folder)/Семена	3517971	Поиск
3518344	4601887217688	Семена поиск серия вкуснотека томат румянец 10шт м/у	324395	Растениеводство (folder)/Семена	3517971	Поиск
3518345	4601887230304	Семена поиск серия огородное изобилие арбуз огонек мягуп 1g	324395	Растениеводство (folder)/Семена	3517971	Поиск
3518346	4601887230311	Семена поиск серия огородное изобилие базилик Арарат овощной мягуп 0.25g	324395	Растениеводство (folder)/Семена	3517971	Поиск
3518347	4601887230328	Семена поиск серия огородное изобилие базилик тонус овощной мягуп 0.25g	324395	Растениеводство (folder)/Семена	3517971	Поиск
3518348	4601887230335	Семена поиск серия огородное изобилие баклажан алмаз мягуп 0.25g	324395	Растениеводство (folder)/Семена	3517971	Поиск
3518349	4601887230359	Семена поиск серия огородное изобилие горох амброзия овощной мягуп 10g	324395	Растениеводство (folder)/Семена	3517971	Поиск
3518350	4601887230366	Семена поиск серия огородное изобилие горох воронежский зеленый овощной мягуп 10g	324395	Растениеводство (folder)/Семена	3517971	Поиск
3518351	4601887230373	Семена поиск серия огородное изобилие горох глориоза овощной мягуп 10g	324395	Растениеводство (folder)/Семена	3517971	Поиск
3518352	4601887230380	Семена поиск серия огородное изобилие дайкон миноваси рс мягуп 1g	324395	Растениеводство (folder)/Семена	3517971	Поиск
3518353	4601887280682	Семена поиск серия огородное изобилие дайкон саша 1g цв/п	324395	Растениеводство (folder)/Семена	3517971	Поиск
3518354	4601887230397	Семена поиск серия огородное изобилие кабачок грибовские 37 мягуп 2g	324395	Растениеводство (folder)/Семена	3517971	Поиск
3518355	4601887230403	Семена поиск серия огородное изобилие кабачок цукеша мягуп 2g	324395	Растениеводство (folder)/Семена	3517971	Поиск
3518356	4601887230410	Семена поиск серия огородное изобилие кабачок черный красавец мягуп 2g	324395	Растениеводство (folder)/Семена	3517971	Поиск
3518357	4601887230427	Семена поиск серия огородное изобилие капуста амагер 611 белокочанная мягуп 0.5g	324395	Растениеводство (folder)/Семена	3517971	Поиск
3518358	4601887230472	Семена поиск серия огородное изобилие капуста гарантия цветная мягуп 0.5g	324395	Растениеводство (folder)/Семена	3517971	Поиск
3518359	4601887230489	Семена поиск серия огородное изобилие капуста дачница цветная мягуп 0.5g	324395	Растениеводство (folder)/Семена	3517971	Поиск
3518360	4601887230434	Семена поиск серия огородное изобилие капуста июньская белокочанная мягуп 0.5g	324395	Растениеводство (folder)/Семена	3517971	Поиск
3518361	4601887280736	Семена поиск серия огородное изобилие капуста Колобок f1 белокочанная мягуп 0.2g	324395	Растениеводство (folder)/Семена	3517971	Поиск
3518362	4601887230441	Семена поиск серия огородное изобилие капуста московская поздняя 9 белокочанная мягуп 0.5g	324395	Растениеводство (folder)/Семена	3517971	Поиск
3518363	4601887230465	Семена поиск серия огородное изобилие капуста слава 1305 белокочанная мягуп 0.5g	324395	Растениеводство (folder)/Семена	3517971	Поиск
3518364	4601887230540	Семена поиск серия огородное изобилие морковь лосиноостровская 13 мягуп 2g	324395	Растениеводство (folder)/Семена	3517971	Поиск
3518365	4601887230557	Семена поиск серия огородное изобилие морковь нантская 4 мягуп 2g	324395	Растениеводство (folder)/Семена	3517971	Поиск
3518366	4601887230564	Семена поиск серия огородное изобилие морковь шантенэ королевская мягуп 2g	324395	Растениеводство (folder)/Семена	3517971	Поиск
3518367	4601887230526	Семена поиск серия огородное изобилие морковья витаминная 6 мягуп 2g	324395	Растениеводство (folder)/Семена	3517971	Поиск
3518368	4601887230588	Семена поиск серия огородное изобилие огурец вязниковский 37 мягуп 0.5g	324395	Растениеводство (folder)/Семена	3517971	Поиск
3518369	4601887230601	Семена поиск серия огородное изобилие огурец засолочный мягуп 0.5g	324395	Растениеводство (folder)/Семена	3517971	Поиск
3518370	4601887230618	Семена поиск серия огородное изобилие огурец зозуля f1 мягуп 0.5g	324395	Растениеводство (folder)/Семена	3517971	Поиск
3518371	4601887230625	Семена поиск серия огородное изобилие огурец изящный мягуп 0.5g	324395	Растениеводство (folder)/Семена	3517971	Поиск
3518372	4601887230632	Семена поиск серия огородное изобилие огурец кустовой мягуп 0.5g	324395	Растениеводство (folder)/Семена	3517971	Поиск
3518373	4601887230649	Семена поиск серия огородное изобилие огурец либелле f1 мягуп 0.5g	324395	Растениеводство (folder)/Семена	3517971	Поиск
3518374	4601887230687	Семена поиск серия огородное изобилие перец болгарец сладкий мягуп 0.25g	324395	Растениеводство (folder)/Семена	3517971	Поиск
3518375	4601887230694	Семена поиск серия огородное изобилие перец Золотое чудо сладкий мягуп 0.25g	324395	Растениеводство (folder)/Семена	3517971	Поиск
3518376	4601887230724	Семена поиск серия огородное изобилие петрушка обыкновенная листовая мягуп 3g	324395	Растениеводство (folder)/Семена	3517971	Поиск
3518377	4601887230748	Семена поиск серия огородное изобилие редис 18 дней мягуп 3g	324395	Растениеводство (folder)/Семена	3517971	Поиск
3518378	4601887230755	Семена поиск серия огородное изобилие редис жара мягуп 3g	324395	Растениеводство (folder)/Семена	3517971	Поиск
3518379	4601887230762	Семена поиск серия огородное изобилие редис кармен мягуп 3g	324395	Растениеводство (folder)/Семена	3517971	Поиск
3518380	4601887280880	Семена поиск серия огородное изобилие редис меркадо мягуп 3g	324395	Растениеводство (folder)/Семена	3517971	Поиск
3518381	4601887280897	Семена поиск серия огородное изобилие редис снегирек мягуп 3g	324395	Растениеводство (folder)/Семена	3517971	Поиск
3518382	4601887230779	Семена поиск серия огородное изобилие редька зимняя круглая черная мягуп 1g	324395	Растениеводство (folder)/Семена	3517971	Поиск
3518383	4601887230786	Семена поиск серия огородное изобилие репа петровская 1 мягуп 1g	324395	Растениеводство (folder)/Семена	3517971	Поиск
3518384	4601887230793	Семена поиск серия огородное изобилие салат витаминный мягуп 1g	324395	Растениеводство (folder)/Семена	3517971	Поиск
3518385	4601887230809	Семена поиск серия огородное изобилие салат кучерявец одесский мягуп 1g	324395	Растениеводство (folder)/Семена	3517971	Поиск
3518386	4601887230816	Семена поиск серия огородное изобилие салат лолло росса мягуп 1g	324395	Растениеводство (folder)/Семена	3517971	Поиск
3518387	4601887230823	Семена поиск серия огородное изобилие свекла бордо 237 столовая мягуп 3g	324395	Растениеводство (folder)/Семена	3517971	Поиск
3518388	4601887230847	Семена поиск серия огородное изобилие свекла мулатка столовая мягуп 3g	324395	Растениеводство (folder)/Семена	3517971	Поиск
3518389	4601887230854	Семена поиск серия огородное изобилие свекла цилиндра столовая мягуп 3g	324395	Растениеводство (folder)/Семена	3517971	Поиск
3518390	4601887230861	Семена поиск серия огородное изобилие томат белый налив 241 мягуп 0.1g	324395	Растениеводство (folder)/Семена	3517971	Поиск
3518391	4601887230878	Семена поиск серия огородное изобилие томат бычье сердце мягуп 0.1g	324395	Растениеводство (folder)/Семена	3517971	Поиск
3518392	4601887230892	Семена поиск серия огородное изобилие томат дачник мягуп 0.1g	324395	Растениеводство (folder)/Семена	3517971	Поиск
3518393	4601887230946	Семена поиск серия огородное изобилие томат сибирский скороспелый мягуп 0.1g	324395	Растениеводство (folder)/Семена	3517971	Поиск
3518394	4601887230953	Семена поиск серия огородное изобилие томат хурма мягуп 0.1g	324395	Растениеводство (folder)/Семена	3517971	Поиск
3518395	4601887230960	Семена поиск серия огородное изобилие томат челнок мягуп 0.1g	324395	Растениеводство (folder)/Семена	3517971	Поиск
3518396	4601887230984	Семена поиск серия огородное изобилие тыква витаминная мускатная мягуп 2g	324395	Растениеводство (folder)/Семена	3517971	Поиск
3518397	4601887230991	Семена поиск серия огородное изобилие укроп аллигатор мягуп 2g	324395	Растениеводство (folder)/Семена	3517971	Поиск
3518398	4601887231004	Семена поиск серия огородное изобилие укроп грибовский мягуп 3g	324395	Растениеводство (folder)/Семена	3517971	Поиск
3518399	4601887231028	Семена поиск серия огородное изобилие укроп обильнолистный мягуп 3g	324395	Растениеводство (folder)/Семена	3517971	Поиск
3518400	4601887231042	Семена поиск серия огородное изобилие щавель широколистный мягуп 1g	324395	Растениеводство (folder)/Семена	3517971	Поиск
3518401	4601887192145	Семена поиск серия семетра морковь лосиноостровская 13 мягуп 2g	324395	Растениеводство (folder)/Семена	3517971	Поиск
3518402	4601887210993	Семена поиск серия семетра морковь тушон мягуп 2g	324395	Растениеводство (folder)/Семена	3517971	Поиск
3518403	4601887211044	Семена поиск серия семетра огурец засолочный мягуп 0.5g	324395	Растениеводство (folder)/Семена	3517971	Поиск
3518404	4601887192459	Семена поиск серия семетра редис кармен мягуп 3g	324395	Растениеводство (folder)/Семена	3517971	Поиск
3518405	4601887192480	Семена поиск серия семетра салат витаминный мягуп 1g	324395	Растениеводство (folder)/Семена	3517971	Поиск
3518406	4601887192527	Семена поиск серия семетра свекла бордо 237 столовая мягуп 3g	324395	Растениеводство (folder)/Семена	3517971	Поиск
3518407	4601887211709	Семена поиск серия семетра свекла укроп лесногородский мягуп 3g	324395	Растениеводство (folder)/Семена	3517971	Поиск
3518408	4601887211686	Семена поиск серия семетра укроп аллигатор мягуп 3g	324395	Растениеводство (folder)/Семена	3517971	Поиск
3518409	4601887192671	Семена поиск серия семетра укроп грибовский мягуп 3g	324395	Растениеводство (folder)/Семена	3517971	Поиск
3518410	4601887211778	Семена поиск серия семетра щавель бельвильский мягуп 1g	324395	Растениеводство (folder)/Семена	3517971	Поиск
3518411	4601887192732	Семена поиск серия семетра щавель широколистный мягуп 1g	324395	Растениеводство (folder)/Семена	3517971	Поиск
824265	4601887098089	Семена поиск смесь ароматных цветов фрагрант 0.5g цв/п 10/	324395	Растениеводство (folder)/Семена	3517971	Поиск
3518412	4601887207092	Семена поиск солнцецвет акварель мягуп 0.1g	324395	Растениеводство (folder)/Семена	3517971	Поиск
824275	4601887003465	Семена поиск статица радужная смесь 0.1g цв/п 10/	324395	Растениеводство (folder)/Семена	3517971	Поиск
824276	4601887046530	Семена поиск статица суприм голубая 0.15g цв/п 10/	324395	Растениеводство (folder)/Семена	3517971	Поиск
824277	4601887098317	Семена поиск стиломекон купер квин	324395	Растениеводство (folder)/Семена	3517971	Поиск
824280	4601887012788	Семена поиск сухоцветы злаковые 0.3g цв/п 10/	324395	Растениеводство (folder)/Семена	3517971	Поиск
824281	4601887022541	Семена поиск схизантус визетонский гибридная смесьf1	324395	Растениеводство (folder)/Семена	3517971	Поиск
824282	4601887096306	Семена поиск табак душистый лайм грин	324395	Растениеводство (folder)/Семена	3517971	Поиск
1703928	4601887004769	Семена поиск табак душистый сенсация (однолетник) 0.25g цв/п 10/ Нидерланды минимум	324395	Растениеводство (folder)/Семена	3517971	Поиск
3903009	4601887087618	Семена поиск табак нцс сенсация душистый	3619917	Растениеводство (folder)/Семена и луковичные	3517971	Поиск
3518413	4601887161516	Семена поиск табак сандер парфюм микс 15шт м/у	324395	Растениеводство (folder)/Семена	3517971	Поиск
3518414	4601887166443	Семена поиск табак юбилейный новый 142 мягуп 0.01g	324395	Растениеводство (folder)/Семена	3517971	Поиск
3518415	4601887138945	Семена поиск тимьян медок овощной мягуп 0.25g	324395	Растениеводство (folder)/Семена	3517971	Поиск
824287	4601887034346	Семена поиск тимьян ползучий (чабрец) медок (а) 0.25g б/п 20/	324395	Растениеводство (folder)/Семена	3517971	Поиск
3518416	4601887146049	Семена поиск титония рыжий фонарь 0.3g т/у	324395	Растениеводство (folder)/Семена	3517971	Поиск
1705783	4601887043157	Семена поиск томат (2014) барнаульский консервный б/п 20/ Россия	324395	Растениеводство (folder)/Семена	3517971	Поиск
1705785	4601887019343	Семена поиск томат (2014) волгоградец б/п 20/ Китай	324395	Растениеводство (folder)/Семена	3517971	Поиск
3903010	4601887001294	Семена поиск томат Mix нцс	3619917	Растениеводство (folder)/Семена и луковичные	3517971	Поиск
824295	4601887077299	Семена поиск томат аделина (2014) (среднеспелый) 0.1g цв/п 10/ минимум	324395	Растениеводство (folder)/Семена	3517971	Поиск
3903011	4601887211624	Семена поиск томат алеша попович	3619917	Растениеводство (folder)/Семена и луковичные	3517971	Поиск
824298	4601887016205	Семена поиск томат алеша попович (а) б/п	324395	Растениеводство (folder)/Семена	3517971	Поиск
3518417	4601887299233	Семена поиск томат алтайский мед мягуп 0.1g	324395	Растениеводство (folder)/Семена	3517971	Поиск
3518418	4601887139300	Семена поиск томат алтайский оранжевый 0.1g	324395	Растениеводство (folder)/Семена	3517971	Поиск
824297	4601887001195	Семена поиск томат алёша попович (2014) (среднеспелый) 0.1g цв/п 10/ минимум	324395	Растениеводство (folder)/Семена	3517971	Поиск
824305	4601887015840	Семена поиск томат амико f1	324395	Растениеводство (folder)/Семена	3517971	Поиск
824310	4601887011910	Семена поиск томат апельсин	324395	Растениеводство (folder)/Семена	3517971	Поиск
824312	4601887018896	Семена поиск томат апельсин б/п	324395	Растениеводство (folder)/Семена	3517971	Поиск
824313	4601887053064	Семена поиск томат атаман (а)	324395	Растениеводство (folder)/Семена	3517971	Поиск
824314	4601887093893	Семена поиск томат Афродита f 1 (а)	324395	Растениеводство (folder)/Семена	3517971	Поиск
824318	4601887010890	Семена поиск томат баллада 0.1g цв/п 10/	324395	Растениеводство (folder)/Семена	3517971	Поиск
824319	4601887016236	Семена поиск томат балтимор (а) б/п	324395	Растениеводство (folder)/Семена	3517971	Поиск
824321	4601887013877	Семена поиск томат барнаульский консервный (сиб.серия)	324395	Растениеводство (folder)/Семена	3517971	Поиск
824325	4601887001157	Семена поиск томат белый налив 241	324395	Растениеводство (folder)/Семена	3517971	Поиск
824326	4601887001287	Семена поиск томат белый налив 241 0.1g б/п (ул.пак)	324395	Растениеводство (folder)/Семена	3517971	Поиск
824328	4601887094562	Семена поиск томат бенито f1	324395	Растениеводство (folder)/Семена	3517971	Поиск
824331	4601887030447	Семена поиск томат бифштекс (2014) (среднеранний) 0.1g цв/п 10/ Нидерланды	324395	Растениеводство (folder)/Семена	3517971	Поиск
824333	4601887029915	Семена поиск томат бифштекс (а) 12шт б/п 20/ хит	324395	Растениеводство (folder)/Семена	3517971	Поиск
