ID	UPCEAN	Name	CategoryID	CategoryName	BrandID	BrandName
3793761	8425132130012	Вино муриэль гран рез 12% красн сух 750ml	22133	Продукты питания (folder)/Алкогольные напитки/Вино (folder)/Вино	45135	Муриэль
45136	8425132130050	Вино муриэль гран резерва красн сух 750ml 13% риоха /Испания/	41484	Продукты питания (folder)/Алкогольные напитки/Вино (folder)/Вина Испании	45135	Муриэль
45137	8425132110946	Вино муриэль крианца риоха 2001 красн сух мар. 750ml 13% /исп./	41484	Продукты питания (folder)/Алкогольные напитки/Вино (folder)/Вина Испании	45135	Муриэль
45138	8425132119505	Вино муриэль резерва риоха красн сух мар 750ml 13% /исп./	41484	Продукты питания (folder)/Алкогольные напитки/Вино (folder)/Вина Испании	45135	Муриэль
283097	8425132060050	Вино муриэль селексьон красн сух 750ml 13.5% риоха /исп./	22133	Продукты питания (folder)/Алкогольные напитки/Вино (folder)/Вино	3791632	МУРЕЛ
45139	8425132750012	Вино муриэль селексьон риоха красн сух 13.5% 750ml	41484	Продукты питания (folder)/Алкогольные напитки/Вино (folder)/Вина Испании	45135	Муриэль
1958074	5604242006162	Вино мурос де винья дуро 2010 вин.нат.выс.кач.крас. сух 750ml контр.наим.по происх.	22133	Продукты питания (folder)/Алкогольные напитки/Вино (folder)/Вино	0	
3793762	5604242007398	Вино мурос де винья дуро 2011 13% 750ml	1	Неклассифицированные/default	0	
2854360	5604242008685	Вино мурос де винья дуро 2015 выс.кач. розов сух 13% 750ml	22133	Продукты питания (folder)/Алкогольные напитки/Вино (folder)/Вино	0	
2854361	5604242008593	Вино мурос де винья дуро 2015 выс.кач.бел сух 12.5% 750ml	22133	Продукты питания (folder)/Алкогольные напитки/Вино (folder)/Вино	0	
3793763	5604242009316	Вино мурос де винья дуро высококачественное 2014 12.5% 750ml	1	Неклассифицированные/default	0	
3793764	5604242001280	Вино мурос де винья дуро высококачественное 2014 13% 750ml	1	Неклассифицированные/default	0	
151248	4840454000562	Вино мурфалат бел полусладк Дионис 700ml	22133	Продукты питания (folder)/Алкогольные напитки/Вино (folder)/Вино	0	
151249	4840454000555	Вино мурфалат красн полусладк Дионис 700ml	22133	Продукты питания (folder)/Алкогольные напитки/Вино (folder)/Вино	0	
151253	5942048111155	Вино мурфатер Chardonnay бел сух рум/аром 700ml	22133	Продукты питания (folder)/Алкогольные напитки/Вино (folder)/Вино	0	
151250	5942048200033	Вино мурфатер Merlot красн сух рум/аром 750ml	22133	Продукты питания (folder)/Алкогольные напитки/Вино (folder)/Вино	0	
151252	5942048800028	Вино мурфатер Sauvignon-бланк бел сух рум/аром 700ml	22133	Продукты питания (folder)/Алкогольные напитки/Вино (folder)/Вино	0	
151251	5942048111179	Вино мурфатер пино-нуар красн сух рум/аром 750ml	22133	Продукты питания (folder)/Алкогольные напитки/Вино (folder)/Вино	0	
45140	5942048001241	Вино мурфатлар Merlot красн сух 12% 750ml	22133	Продукты питания (folder)/Алкогольные напитки/Вино (folder)/Вино	0	
2426352	4820006970055	Вино мурфатлар мускат бел полусладк 10-12% 0.700	22133	Продукты питания (folder)/Алкогольные напитки/Вино (folder)/Вино	0	
2426353	4820006970246	Вино мурфатлар мускат бел полусладк 10-12% 0.700 #2	22133	Продукты питания (folder)/Алкогольные напитки/Вино (folder)/Вино	0	
45141	5942048001227	Вино мурфатлар мускат оттонел бел 11% 750ml	22133	Продукты питания (folder)/Алкогольные напитки/Вино (folder)/Вино	0	
690475	5942002000877	Вино мурфатлар мускат оттонель белое полусладк 12% 750ml ст/б	22133	Продукты питания (folder)/Алкогольные напитки/Вино (folder)/Вино	690474	Мурфатлар
151254	5942048900032	Вино мурфатлар пино гри бел полусладк рум/аром 750ml	22133	Продукты питания (folder)/Алкогольные напитки/Вино (folder)/Вино	0	
690478	8410537190327	Вино мусеум крианса 750ml 13% сухое	22133	Продукты питания (folder)/Алкогольные напитки/Вино (folder)/Вино	0	
690479	8410537150222	Вино мусеум реаль резерва (этикетка из металла) 750ml 14% сухое	22133	Продукты питания (folder)/Алкогольные напитки/Вино (folder)/Вино	0	
3709174	4600735003053	Вино муск.цимл.игр бел полусладк 12.5% 750ml	296061	Продукты питания (folder)/Алкогольные напитки/Вино (folder)/Вино игристое	3709171	MUSKAT TSIMLYANSKIY
173730	3250390569084	Вино мускадэ сэвр и мэн бел сух 11.5% 750ml 6шт	22133	Продукты питания (folder)/Алкогольные напитки/Вино (folder)/Вино	173657	Ла Фи Де Луа СА
3289931	4607050325709	Вино мускат 10-12% 1л т/п	22133	Продукты питания (folder)/Алкогольные напитки/Вино (folder)/Вино	0	
45144	4840454001620	Вино мускат 12 бокалов бел полусладк 9-11% 2л	22133	Продукты питания (folder)/Алкогольные напитки/Вино (folder)/Вино	0	
3289932	4840472001459	Вино мускат 16% 0.75ml Молдова стекло	22133	Продукты питания (folder)/Алкогольные напитки/Вино (folder)/Вино	0	
45145	3800006114223	Вино мускат 2002 бел сух 12.5% 750ml дб	1759169	Продукты питания (folder)/Алкогольные напитки/Вино (folder)/Вина Болгарии	0	
3289933	3800003408981	Вино мускат 3л	1759169	Продукты питания (folder)/Алкогольные напитки/Вино (folder)/Вина Болгарии	0	
283098	4840454004041	Вино мускат Bella Natura бел полусладк столов 750ml 13% /Молдова/Дионис клуб/	22133	Продукты питания (folder)/Алкогольные напитки/Вино (folder)/Вино	3791209	DIONIS CLUB
3289935	5999073103518	Вино мускат boron оттонель белое полусладк 11% 750ml ст/б	22133	Продукты питания (folder)/Алкогольные напитки/Вино (folder)/Вино	3793787	МУСКАТ ОТТОНЕЛЬ
3290143	4607062864012	Вино мускат chateau тамань полусладк белое 12% 750ml стекло	22133	Продукты питания (folder)/Алкогольные напитки/Вино (folder)/Вино	0	
283099	8004300492543	Вино мускат lc пьемонте бел сладк 750ml 5.5% caldirola /итал./мозель/	22133	Продукты питания (folder)/Алкогольные напитки/Вино (folder)/Вино	0	
3289936	4840182005143	Вино мускат pikaturi полусладк белое 10-12% 700ml стекло	22133	Продукты питания (folder)/Алкогольные напитки/Вино (folder)/Вино	0	
2426354	484032500026	Вино мускат va бел полусладк лавина 9% 0.700	22133	Продукты питания (folder)/Алкогольные напитки/Вино (folder)/Вино	0	
3289937	4670007932626	Вино мускат villa ponti белое полусладк 10-12% 1л ст/б	22133	Продукты питания (folder)/Алкогольные напитки/Вино (folder)/Вино	0	
151267	4840058004898	Вино мускат алов нетрадицион.б/дес. 750ml	22133	Продукты питания (folder)/Алкогольные напитки/Вино (folder)/Вино	150237	АЛОВ
2426355	4840325001995	Вино мускат амадор бел п/сух 9% 750ml	22133	Продукты питания (folder)/Алкогольные напитки/Вино (folder)/Вино	0	
2426356	4840325002152	Вино мускат амадор бел сух 9% 750ml	22133	Продукты питания (folder)/Алкогольные напитки/Вино (folder)/Вино	0	
2426357	4840325001483	Вино мускат амадор дес бел полусладк 16% 750ml	22133	Продукты питания (folder)/Алкогольные напитки/Вино (folder)/Вино	0	
2426358	484032500200	Вино мускат амадор розов дес полусладк 16% 750ml	22133	Продукты питания (folder)/Алкогольные напитки/Вино (folder)/Вино	0	
2426359	4840325002015	Вино мускат амадор розов полусладк 9% 750ml	22133	Продукты питания (folder)/Алкогольные напитки/Вино (folder)/Вино	0	
2854362	3800003405645	Вино мускат амфора бел полусладк 750ml	1759169	Продукты питания (folder)/Алкогольные напитки/Вино (folder)/Вина Болгарии	0	
2854363	4605883002040	Вино мускат антель бел/ красн 15% 0.700	22133	Продукты питания (folder)/Алкогольные напитки/Вино (folder)/Вино	0	
1194647	3800003408745	Вино мускат АО вини бел полусладк 10.5-12% 750ml	1759169	Продукты питания (folder)/Алкогольные напитки/Вино (folder)/Вина Болгарии	0	
2854364	3800003406420	Вино мускат аркад бел полусладк 750ml	1759169	Продукты питания (folder)/Алкогольные напитки/Вино (folder)/Вина Болгарии	0	
2854365	3800003408127	Вино мускат аркадия бел десерт 12% 750ml	1759169	Продукты питания (folder)/Алкогольные напитки/Вино (folder)/Вина Болгарии	0	
2854366	3800003407564	Вино мускат аркадия бел п/дес 12% 750ml	1759169	Продукты питания (folder)/Алкогольные напитки/Вино (folder)/Вина Болгарии	0	
1194648	380000340642	Вино мускат аркадия бел полусладк 10.5-12% 750ml	1759169	Продукты питания (folder)/Алкогольные напитки/Вино (folder)/Вина Болгарии	0	
46981	4840052001053	Вино мускат аромат молд бел полусладк 9-11% 1.500	22133	Продукты питания (folder)/Алкогольные напитки/Вино (folder)/Вино	46977	Хинчешты
2426361	4840109001654	Вино мускат аскони бел п/дес 16% 0.750 #2	22133	Продукты питания (folder)/Алкогольные напитки/Вино (folder)/Вино	0	
2426360	484035800451	Вино мускат аскони бел п/дес 16% 750ml	22133	Продукты питания (folder)/Алкогольные напитки/Вино (folder)/Вино	0	
2426362	4840358004505	Вино мускат аскони бел полусладк 9-11% 750ml	22133	Продукты питания (folder)/Алкогольные напитки/Вино (folder)/Вино	0	
2854367	4605883003931	Вино мускат атанель бел полусладк 10-12% 2.0	22133	Продукты питания (folder)/Алкогольные напитки/Вино (folder)/Вино	0	
3289938	4605883004068	Вино мускат атанель белое полусладк 10-12% 750ml ст/б	22133	Продукты питания (folder)/Алкогольные напитки/Вино (folder)/Вино	0	
1194649	3800214140199	Вино мускат бабочка бел полусладк 10-12% 750ml	1759169	Продукты питания (folder)/Алкогольные напитки/Вино (folder)/Вина Болгарии	0	
151272	3800082203255	Вино мускат балканский красн полусладк болг. 750ml	1759169	Продукты питания (folder)/Алкогольные напитки/Вино (folder)/Вина Болгарии	0	
151273	3800008359172	Вино мускат балканский красн полусладк болг.2.025	1759169	Продукты питания (folder)/Алкогольные напитки/Вино (folder)/Вина Болгарии	0	
283104	3800006901816	Вино мускат барбарис белое полусладк 11.5% 750ml стекло	1759169	Продукты питания (folder)/Алкогольные напитки/Вино (folder)/Вина Болгарии	0	
3289939	3800007812968	Вино мускат бархат столов красное полусладк 10-12% 750ml стекло	1759169	Продукты питания (folder)/Алкогольные напитки/Вино (folder)/Вина Болгарии	0	
3289940	3800016679897	Вино мускат бархатный белое полусладк 10-12% 750ml стекло	1759169	Продукты питания (folder)/Алкогольные напитки/Вино (folder)/Вина Болгарии	0	
3289941	3800016677657	Вино мускат бархатный столов белое полусладк 10-12% 750ml стекло	1759169	Продукты питания (folder)/Алкогольные напитки/Вино (folder)/Вина Болгарии	0	
171245	4603040007204	Вино мускат бархатный столов белое полусладк 12% 1л фанагория	688533	Продукты питания (folder)/Алкогольные напитки/Вино (folder)/Вина России и ближнего зарубежья	38020	Фанагория
151274	4840058001729	Вино мускат бассар.рубин. красн/п/дес. молд.16% 0.	22133	Продукты питания (folder)/Алкогольные напитки/Вино (folder)/Вино	0	
3289942	4680016071544	Вино мускат бахчисарай столов полусладк розовое 10-13% 700ml ст/б	22133	Продукты питания (folder)/Алкогольные напитки/Вино (folder)/Вино	0	
2426364	4820009932135	Вино мускат бахчисарайский бел дес 16% 750ml	22133	Продукты питания (folder)/Алкогольные напитки/Вино (folder)/Вино	0	
3289943	4670015952425	Вино мускат бахчиэм столов белое полусладк 750ml стекло	22133	Продукты питания (folder)/Алкогольные напитки/Вино (folder)/Вино	0	
3289953	4840205001633	Вино мускат белое 12% 700ml	22133	Продукты питания (folder)/Алкогольные напитки/Вино (folder)/Вино	0	
2426365	3800082200353	Вино мускат белое дес риком 16% 750ml	1759169	Продукты питания (folder)/Алкогольные напитки/Вино (folder)/Вина Болгарии	0	
151256	4840325000288	Вино мускат белое дес/полусладк леон-гри16% 700ml	22133	Продукты питания (folder)/Алкогольные напитки/Вино (folder)/Вино	0	
3289944	4606440003210	Вино мускат белое п сл 10-12% 1л	22133	Продукты питания (folder)/Алкогольные напитки/Вино (folder)/Вино	0	
3289945	4607152010824	Вино мускат белое п сл 10-12% 1л #2	22133	Продукты питания (folder)/Алкогольные напитки/Вино (folder)/Вино	0	
3289946	4605650002822	Вино мускат белое п сл 10-12% 700ml	22133	Продукты питания (folder)/Алкогольные напитки/Вино (folder)/Вино	0	
3289947	4607132732098	Вино мускат белое п/с 10-12%	22133	Продукты питания (folder)/Алкогольные напитки/Вино (folder)/Вино	0	
2426366	4803580045296	Вино мускат белое п/сух аскони 9-11% 750ml	22133	Продукты питания (folder)/Алкогольные напитки/Вино (folder)/Вино	0	
2426367	4840234000966	Вино мускат белое п/сух бархат 9-12% 750ml	22133	Продукты питания (folder)/Алкогольные напитки/Вино (folder)/Вино	0	
2426368	3800049517470	Вино мускат белое п/сух Болгария 10.5-12% 1.500	1759169	Продукты питания (folder)/Алкогольные напитки/Вино (folder)/Вина Болгарии	0	
2426369	4840234001239	Вино мускат белое п/сух виниа 9-12% 1.500	22133	Продукты питания (folder)/Алкогольные напитки/Вино (folder)/Вино	0	
150484	4840249001255	Вино мускат белое п/сух Дионис 11% 750ml	22133	Продукты питания (folder)/Алкогольные напитки/Вино (folder)/Вино	0	
1192033	4840454003310	Вино мускат белое п/сух Дионис 9-11% 750ml	22133	Продукты питания (folder)/Алкогольные напитки/Вино (folder)/Вино	0	
2426370	484003000142	Вино мускат белое п/сух Дионис византия 10-12% 750ml	22133	Продукты питания (folder)/Алкогольные напитки/Вино (folder)/Вино	0	
42289	3800111172484	Вино мускат белое п/сух хана крум 11.5% 750ml	1759169	Продукты питания (folder)/Алкогольные напитки/Вино (folder)/Вина Болгарии	42284	Паскаль Жоливе
2426371	4840052000629	Вино мускат белое п/сух хинчешты 9-11% 750ml	22133	Продукты питания (folder)/Алкогольные напитки/Вино (folder)/Вино	0	
2426372	3800016624637	Вино мускат белое п/сух эдем русе 9-11% 750ml	1759169	Продукты питания (folder)/Алкогольные напитки/Вино (folder)/Вина Болгарии	0	
2720641	3800012920672	Вино мускат белое полусладк 0.75 11% /времена года	1759169	Продукты питания (folder)/Алкогольные напитки/Вино (folder)/Вина Болгарии	0	
1660000	3800024934162	Вино мускат белое полусладк 0.75 11% /Молдова	1759169	Продукты питания (folder)/Алкогольные напитки/Вино (folder)/Вина Болгарии	0	
2720642	4670007932541	Вино мускат белое полусладк 1.0 9-11% /лазурный бутылка	22133	Продукты питания (folder)/Алкогольные напитки/Вино (folder)/Вино	0	
1194652	4840526001398	Вино мускат белое полусладк 1.0 фляга	22133	Продукты питания (folder)/Алкогольные напитки/Вино (folder)/Вино	0	
1194660	4620760180345	Вино мускат белое полусладк 1.0л 10-12% /гуляй город/Россия/ бум пак.	22133	Продукты питания (folder)/Алкогольные напитки/Вино (folder)/Вино	0	
1194662	4670001250559	Вино мускат белое полусладк 1.0л 9-12% /дербентский вино-коньяч. комб./Россия/	22133	Продукты питания (folder)/Алкогольные напитки/Вино (folder)/Вино	0	
283117	4840267004924	Вино мускат белое полусладк 1.5л магнум	1759450	Продукты питания (folder)/Алкогольные напитки/Вино (folder)/Вина Молдовы	0	
3289954	3800003413268	Вино мускат белое полусладк 10% 1л стекло	1759169	Продукты питания (folder)/Алкогольные напитки/Вино (folder)/Вина Болгарии	0	
2426374	4607116231814	Вино мускат белое полусладк 10-12% 0.750 #2	22133	Продукты питания (folder)/Алкогольные напитки/Вино (folder)/Вино	0	
1194654	4840526003460	Вино мускат белое полусладк 10-12% 1.0	22133	Продукты питания (folder)/Алкогольные напитки/Вино (folder)/Вино	0	
2426375	4607127220753	Вино мускат белое полусладк 10-12% 1.000	22133	Продукты питания (folder)/Алкогольные напитки/Вино (folder)/Вино	0	
2426376	4607159661890	Вино мускат белое полусладк 10-12% 1.000 #2	22133	Продукты питания (folder)/Алкогольные напитки/Вино (folder)/Вино	0	
2426377	4630000330836	Вино мускат белое полусладк 10-12% 1.000 #3	22133	Продукты питания (folder)/Алкогольные напитки/Вино (folder)/Вино	0	
1194667	4600785000668	Вино мускат белое полусладк 10-12% 1.0л надежда	22133	Продукты питания (folder)/Алкогольные напитки/Вино (folder)/Вино	0	
1194668	3800011307368	Вино мускат белое полусладк 10-12% 1л Болгария лудинг 400	1759169	Продукты питания (folder)/Алкогольные напитки/Вино (folder)/Вина Болгарии	3793778	HEBROS VINPROM
2426378	4660003840254	Вино мускат белое полусладк 10-12% 1л винный тд	22133	Продукты питания (folder)/Алкогольные напитки/Вино (folder)/Вино	0	
151311	4840526003811	Вино мускат белое полусладк 10-12% 1л глина фляга	22133	Продукты питания (folder)/Алкогольные напитки/Вино (folder)/Вино	0	
3289948	3800007811978	Вино мускат белое полусладк 10-12% 1л ООО рвкк 400	1759169	Продукты питания (folder)/Алкогольные напитки/Вино (folder)/Вина Болгарии	0	
2426380	4670000687639	Вино мускат белое полусладк 10-12% 1л ромашка	22133	Продукты питания (folder)/Алкогольные напитки/Вино (folder)/Вино	0	
1194669	4650000450310	Вино мускат белое полусладк 10-12% 1л русьалко	22133	Продукты питания (folder)/Алкогольные напитки/Вино (folder)/Вино	0	
2426382	4840463004650	Вино мускат белое полусладк 10-12% 1л томай	22133	Продукты питания (folder)/Алкогольные напитки/Вино (folder)/Вино	0	
2854370	4840526001473	Вино мускат белое полусладк 10-12% 2.0	22133	Продукты питания (folder)/Алкогольные напитки/Вино (folder)/Вино	0	
151257	3800008359264	Вино мускат белое полусладк 10-12% 2.025	1759169	Продукты питания (folder)/Алкогольные напитки/Вино (folder)/Вина Болгарии	150380	ВЕДА МАРКЕТ
1760040	4630000330690	Вино мускат белое полусладк 10-12% 2.0л	22133	Продукты питания (folder)/Алкогольные напитки/Вино (folder)/Вино	3790027	ВИНОГОР
3289955	3800016674380	Вино мускат белое полусладк 10-12% 2л #2	1759169	Продукты питания (folder)/Алкогольные напитки/Вино (folder)/Вина Болгарии	0	
3289956	4607152010015	Вино мускат белое полусладк 10-12% 2л #3	22133	Продукты питания (folder)/Алкогольные напитки/Вино (folder)/Вино	0	
2426383	4660003840537	Вино мускат белое полусладк 10-12% 2л винный тд	22133	Продукты питания (folder)/Алкогольные напитки/Вино (folder)/Вино	0	
3289957	3800016679927	Вино мускат белое полусладк 10-12% 750ml	1759169	Продукты питания (folder)/Алкогольные напитки/Вино (folder)/Вина Болгарии	0	
