ID	UPCEAN	Name	CategoryID	CategoryName	BrandID	BrandName
3213460	011213022321	Spartan Fresh selections Spring frosted sugar cookies	330591	Продукты питания (folder)/Продукты питания	3090104	Spartan
3213461	011213023366	Spartan Fresh selections sugar cookies	330591	Продукты питания (folder)/Продукты питания	3090104	Spartan
3213462	011213026886	Spartan Fresh selections, Angel Food cake ring	330591	Продукты питания (folder)/Продукты питания	3090104	Spartan
3213463	011213023892	Spartan Fresh selections, Cherry berry Mix	330591	Продукты питания (folder)/Продукты питания	3090104	Spartan
3213464	011213023854	Spartan Fresh selections, dried cherries	330591	Продукты питания (folder)/Продукты питания	3090104	Spartan
3213465	011213023915	Spartan Fresh selections, dried pineapple tidbits	330591	Продукты питания (folder)/Продукты питания	3090104	Spartan
3213466	011213023830	Spartan Fresh selections, Milk chocolate cherries	330591	Продукты питания (folder)/Продукты питания	3090104	Spartan
3213467	011213023403	Spartan Fresh selections, Peanut crunch Mix	330591	Продукты питания (folder)/Продукты питания	3090104	Spartan
3213468	011213147789	Spartan Fresh selections, raw almonds	330591	Продукты питания (folder)/Продукты питания	3090104	Spartan
3213469	011213147802	Spartan Fresh selections, roasted&salted cashews	330591	Продукты питания (folder)/Продукты питания	3090104	Spartan
3213470	011213023359	Spartan Fresh selections, shortcake frosted cookies, strawberry	330591	Продукты питания (folder)/Продукты питания	3090104	Spartan
3213471	011213032177	Spartan Fresh selections. coffee cake, Apple danish	330591	Продукты питания (folder)/Продукты питания	3090104	Spartan
3213472	011213899756	Spartan Fresh vegetable salsa	330591	Продукты питания (folder)/Продукты питания	3090104	Spartan
3213473	011213191003	Spartan frosted flakes, frosted corn cereal	330591	Продукты питания (folder)/Продукты питания	3090104	Spartan
3213474	011213350691	Spartan frozen concentrate Juice, lemonade	330591	Продукты питания (folder)/Продукты питания	3090104	Spartan
3213475	011213350967	Spartan frozen concentrate Juice, pink lemonade	330591	Продукты питания (folder)/Продукты питания	3090104	Spartan
3213478	011213024387	Spartan Fruit bars #3	330591	Продукты питания (folder)/Продукты питания	3090104	Spartan
3213476	011213024363	Spartan Fruit bars made with real Fruit	330591	Продукты питания (folder)/Продукты питания	3090104	Spartan
3213477	011213024370	Spartan Fruit bars made with real Fruit grape	330591	Продукты питания (folder)/Продукты питания	3090104	Spartan
3213479	011213038384	Spartan Fruit cocktail	330591	Продукты питания (folder)/Продукты питания	3090104	Spartan
3213480	011213026114	Spartan Fruit cocktail in Extra Light syrup	330591	Продукты питания (folder)/Продукты питания	3090104	Spartan
3213481	011213038247	Spartan Fruit cocktail in heavy syrup	330591	Продукты питания (folder)/Продукты питания	3090104	Spartan
3213482	011213038322	Spartan Fruit cocktail, Light	330591	Продукты питания (folder)/Продукты питания	3090104	Spartan
3213483	011213085692	Spartan Fruit flavored snacks	330591	Продукты питания (folder)/Продукты питания	3090104	Spartan
3213484	011213085685	Spartan Fruit flavored snacks naturally&artificially flavored	330591	Продукты питания (folder)/Продукты питания	3090104	Spartan
3213485	011213027173	Spartan Fruit flavored snacks with real Juice, assorted	330591	Продукты питания (folder)/Продукты питания	3090104	Spartan
3213486	011213065533	Spartan Fruit punch	330591	Продукты питания (folder)/Продукты питания	3090104	Spartan
3213487	011213350134	Spartan Fruit punch #2	330591	Продукты питания (folder)/Продукты питания	3090104	Spartan
3213488	011213191058	Spartan Fruit rolls	330591	Продукты питания (folder)/Продукты питания	3090104	Spartan
3213489	011213185200	Spartan Fruit&grain cereal bars	330591	Продукты питания (folder)/Продукты питания	3090104	Spartan
3213490	011213189918	Spartan Fruit&grain cereal bars #2	330591	Продукты питания (folder)/Продукты питания	3090104	Spartan
3213491	011213189925	Spartan Fruit&grain cereal bars #3	330591	Продукты питания (folder)/Продукты питания	3090104	Spartan
3213492	011213189932	Spartan Fruit&grain cereal bars #4	330591	Продукты питания (folder)/Продукты питания	3090104	Spartan
3213493	011213189949	Spartan Fruit&grain cereal bars #5	330591	Продукты питания (folder)/Продукты питания	3090104	Spartan
3213494	011213037974	Spartan Fruit&multigrain cereal	330591	Продукты питания (folder)/Продукты питания	3090104	Spartan
3213495	011213146744	Spartan Fruit&nut trail Mix	330591	Продукты питания (folder)/Продукты питания	3090104	Spartan
3213496	011213164083	Spartan fudge brownies	330591	Продукты питания (folder)/Продукты питания	3090104	Spartan
3213497	011213037790	Spartan fudge pops	330591	Продукты питания (folder)/Продукты питания	3090104	Spartan
3213498	011213186115	Spartan fully cooked cocktail smokies	330591	Продукты питания (folder)/Продукты питания	3090104	Spartan
3213499	011213856025	Spartan garbanzo beans chick peas	330591	Продукты питания (folder)/Продукты питания	3090104	Spartan
3213500	011213335476	Spartan garlic bread	330591	Продукты питания (folder)/Продукты питания	3090104	Spartan
3213501	011213017624	Spartan garlic summer sausage	330591	Продукты питания (folder)/Продукты питания	3090104	Spartan
3213502	011213083223	Spartan garlic toast	330591	Продукты питания (folder)/Продукты питания	3090104	Spartan
3213503	011213014821	Spartan gelatin dessert	330591	Продукты питания (folder)/Продукты питания	3090104	Spartan
3213512	011213093598	Spartan gelatin dessert #10	330591	Продукты питания (folder)/Продукты питания	3090104	Spartan
3213513	011213093611	Spartan gelatin dessert #11	330591	Продукты питания (folder)/Продукты питания	3090104	Spartan
3213514	011213093659	Spartan gelatin dessert #12	330591	Продукты питания (folder)/Продукты питания	3090104	Spartan
3213504	011213014838	Spartan gelatin dessert #2	330591	Продукты питания (folder)/Продукты питания	3090104	Spartan
3213505	011213014845	Spartan gelatin dessert #3	330591	Продукты питания (folder)/Продукты питания	3090104	Spartan
3213506	011213014852	Spartan gelatin dessert #4	330591	Продукты питания (folder)/Продукты питания	3090104	Spartan
3213507	011213014869	Spartan gelatin dessert #5	330591	Продукты питания (folder)/Продукты питания	3090104	Spartan
3213508	011213093536	Spartan gelatin dessert #6	330591	Продукты питания (folder)/Продукты питания	3090104	Spartan
3213509	011213093550	Spartan gelatin dessert #7	330591	Продукты питания (folder)/Продукты питания	3090104	Spartan
3213510	011213093567	Spartan gelatin dessert #8	330591	Продукты питания (folder)/Продукты питания	3090104	Spartan
3213511	011213093581	Spartan gelatin dessert #9	330591	Продукты питания (folder)/Продукты питания	3090104	Spartan
3213515	011213093543	Spartan gelatin dessert 3oz	330591	Продукты питания (folder)/Продукты питания	3090104	Spartan
3213516	011213093574	Spartan gelatin dessert Cherry	330591	Продукты питания (folder)/Продукты питания	3090104	Spartan
3213517	011213013718	Spartan gluten free Rice pasta&cheddar	330591	Продукты питания (folder)/Продукты питания	3090104	Spartan
3213518	011213056043	Spartan Golden hominy	330591	Продукты питания (folder)/Продукты питания	3090104	Spartan
3213519	011213055244	Spartan Golden sweet corn	330591	Продукты питания (folder)/Продукты питания	3090104	Spartan
3213520	011213055084	Spartan Golden sweet corn Cream style	330591	Продукты питания (folder)/Продукты питания	3090104	Spartan
3213521	011213055268	Spartan Golden sweet corn, whole kernel	330591	Продукты питания (folder)/Продукты питания	3090104	Spartan
3213522	011213052700	Spartan Golden wax beans	330591	Продукты питания (folder)/Продукты питания	3090104	Spartan
3213523	011213410166	Spartan grade a eggs	330591	Продукты питания (folder)/Продукты питания	3090104	Spartan
3213524	011213420288	Spartan grade a fancy brussels sprouts	330591	Продукты питания (folder)/Продукты питания	3090104	Spartan
3213525	011213420608	Spartan grade a fancy chopped spinach	330591	Продукты питания (folder)/Продукты питания	3090104	Spartan
3213526	011213515175	Spartan grade a Light fat free yogurt	330591	Продукты питания (folder)/Продукты питания	3090104	Spartan
3213527	011213382098	Spartan grade a sour Cream	330591	Продукты питания (folder)/Продукты питания	3090104	Spartan
3213528	011213260471	Spartan graham crackers	330591	Продукты питания (folder)/Продукты питания	3090104	Spartan
3213529	011213260501	Spartan graham crackers #2	330591	Продукты питания (folder)/Продукты питания	3090104	Spartan
3213530	011213260518	Spartan graham crackers #3	330591	Продукты питания (folder)/Продукты питания	3090104	Spartan
3213531	011213859965	Spartan granola bars	330591	Продукты питания (folder)/Продукты питания	3090104	Spartan
3213532	011213191201	Spartan granola cereal	330591	Продукты питания (folder)/Продукты питания	3090104	Spartan
3213533	011213105833	Spartan granulated bouillon, chicken flavor with other Natural flavors	330591	Продукты питания (folder)/Продукты питания	3090104	Spartan
3213534	011213083124	Spartan grape drink	330591	Продукты питания (folder)/Продукты питания	3090104	Spartan
3213535	011213022505	Spartan gravy Mix with Natural spices	330591	Продукты питания (folder)/Продукты питания	3090104	Spartan
3213536	011213053387	Spartan great northern beans	330591	Продукты питания (folder)/Продукты питания	3090104	Spartan
3213537	011213053400	Spartan great northern beans #2	330591	Продукты питания (folder)/Продукты питания	3090104	Spartan
3213538	011213021874	Spartan greek non far yogurt	23326	Продукты питания (folder)/Молочные продукты (folder)/Йогурт	3090104	Spartan
3213539	011213021881	Spartan greek non fat yogurt	23326	Продукты питания (folder)/Молочные продукты (folder)/Йогурт	3090104	Spartan
3213540	011213021898	Spartan greek non fat yogurt #2	23326	Продукты питания (folder)/Молочные продукты (folder)/Йогурт	3090104	Spartan
3213541	011213021904	Spartan greek non fat yogurt #3	23326	Продукты питания (folder)/Молочные продукты (folder)/Йогурт	3090104	Spartan
3213542	011213021911	Spartan greek non fat yogurt #4	23326	Продукты питания (folder)/Молочные продукты (folder)/Йогурт	3090104	Spartan
3213543	011213021959	Spartan greek non fat yogurt #5	23326	Продукты питания (folder)/Молочные продукты (folder)/Йогурт	3090104	Spartan
3213544	011213024547	Spartan greek non fat yogurt #6	23326	Продукты питания (folder)/Молочные продукты (folder)/Йогурт	3090104	Spartan
3213545	011213025681	Spartan greek non fat yogurt #7	23326	Продукты питания (folder)/Молочные продукты (folder)/Йогурт	3090104	Spartan
3213546	011213025698	Spartan greek vanilla non fat yogurt	330591	Продукты питания (folder)/Продукты питания	3090104	Spartan
3213547	011213023274	Spartan Green enchilada sauce	330591	Продукты питания (folder)/Продукты питания	3090104	Spartan
3213548	011213069845	Spartan Green split peas	330591	Продукты питания (folder)/Продукты питания	3090104	Spartan
3213549	011213025117	Spartan grill style beans	330591	Продукты питания (folder)/Продукты питания	3090104	Spartan
3213550	011213025124	Spartan grill style beans #2	330591	Продукты питания (folder)/Продукты питания	3090104	Spartan
3213551	011213017662	Spartan gummi bears	330591	Продукты питания (folder)/Продукты питания	3090104	Spartan
3213552	011213022741	Spartan gummi bears candy	330591	Продукты питания (folder)/Продукты питания	3090104	Spartan
3213553	011213022581	Spartan gummi worms candy	330591	Продукты питания (folder)/Продукты питания	3090104	Spartan
3213554	011213037479	Spartan Half&Half Ultra-pasteurized	330591	Продукты питания (folder)/Продукты питания	3090104	Spartan
3213158	011213256320	Spartan halves&pieces cashews, salted	330591	Продукты питания (folder)/Продукты питания	3090104	Spartan
3213555	011213015286	Spartan hamburger dill chips	330591	Продукты питания (folder)/Продукты питания	3090104	Spartan
3213556	011213015064	Spartan hamburger dills chips	330591	Продукты питания (folder)/Продукты питания	3090104	Spartan
3213557	011213086309	Spartan hamburger skillet dinner	330591	Продукты питания (folder)/Продукты питания	3090104	Spartan
3213558	011213855929	Spartan hamburger skillet dinner #2	330591	Продукты питания (folder)/Продукты питания	3090104	Spartan
3213559	011213162263	Spartan hamburger, skillet dinner	330591	Продукты питания (folder)/Продукты питания	3090104	Spartan
3213560	011213026596	Spartan hard cooked peeled eggs	330591	Продукты питания (folder)/Продукты питания	3090104	Spartan
3213561	011213425573	Spartan hash brown patties	330591	Продукты питания (folder)/Продукты питания	3090104	Spartan
3213562	011213031712	Spartan healthy Cream of chicken condensed soup	330591	Продукты питания (folder)/Продукты питания	3090104	Spartan
3213563	011213354835	Spartan hearth baked garlic bread	330591	Продукты питания (folder)/Продукты питания	3090104	Spartan
3213564	011213037493	Spartan heavy whipping Cream	330591	Продукты питания (folder)/Продукты питания	3090104	Spartan
3213565	011213017730	Spartan holiday Green frosted sugar cookies	330591	Продукты питания (folder)/Продукты питания	3090104	Spartan
3213566	011213014937	Spartan homade style pizza sauce	545856	Продукты питания (folder)/Соус	3090104	Spartan
3213567	011213856001	Spartan homestyle baked beans	330591	Продукты питания (folder)/Продукты питания	3090104	Spartan
3213568	011213031743	Spartan homestyle chicken Noodle condensed soup	330591	Продукты питания (folder)/Продукты питания	3090104	Spartan
3213569	011213169101	Spartan homestyle chicken seasoned coating Mix	330591	Продукты питания (folder)/Продукты питания	3090104	Spartan
3213570	011213065052	Spartan homestyle corned beef hash	330591	Продукты питания (folder)/Продукты питания	3090104	Spartan
3213571	011213022116	Spartan homestyle fully cooked bite size meatballs	330591	Продукты питания (folder)/Продукты питания	3090104	Spartan
3213572	011213354446	Spartan homestyle waffles	330591	Продукты питания (folder)/Продукты питания	3090104	Spartan
3213573	011213056005	Spartan hominy	330591	Продукты питания (folder)/Продукты питания	3090104	Spartan
3213574	011213011295	Spartan Honey and oat crunch cereal	330591	Продукты питания (folder)/Продукты питания	3090104	Spartan
3213575	011213011301	Spartan Honey and oat crunch with almonds	330591	Продукты питания (folder)/Продукты питания	3090104	Spartan
3213384	011213022390	Spartan Honey mustard dressing&dip	330591	Продукты питания (folder)/Продукты питания	3090104	Spartan
3213576	011213191010	Spartan Honey nut toasted oats	330591	Продукты питания (folder)/Продукты питания	3090104	Spartan
3213577	011213256306	Spartan Honey roasted peanuts, salted	330591	Продукты питания (folder)/Продукты питания	3090104	Spartan
3213578	011213020730	Spartan horseradish	330591	Продукты питания (folder)/Продукты питания	3090104	Spartan
3213579	011213020747	Spartan horseradish #2	330591	Продукты питания (folder)/Продукты питания	3090104	Spartan
3213580	011213026022	Spartan Hot cocoa drink Mix	330591	Продукты питания (folder)/Продукты питания	3090104	Spartan
3213581	011213032528	Spartan Hot cocoa drink Mix, salted caramel	330591	Продукты питания (folder)/Продукты питания	3090104	Spartan
3213582	011213181141	Spartan Hot cocoa Mix	330591	Продукты питания (folder)/Продукты питания	3090104	Spartan
3213583	011213902739	Spartan Hot cocoa Mix with Mini marshmallows	330591	Продукты питания (folder)/Продукты питания	3090104	Spartan
3213584	011213181103	Spartan Hot cocoa Mix, Milk chocolate	330591	Продукты питания (folder)/Продукты питания	3090104	Spartan
3213585	011213181127	Spartan Hot cocoa Mix, Mini marshmallows	330591	Продукты питания (folder)/Продукты питания	3090104	Spartan
4689936	011213456720	Spartan Hot dogs 16oz	1	Неклассифицированные/default	0	
3213586	011213410128	Spartan i dozen Farm Fresh eggs	330591	Продукты питания (folder)/Продукты питания	3090104	Spartan
3213587	011213011417	Spartan Ice Cream	30752	Продукты питания (folder)/Мороженое	3090104	Spartan
3213596	011213011530	Spartan Ice Cream #10	30752	Продукты питания (folder)/Мороженое	3090104	Spartan
3213597	011213011547	Spartan Ice Cream #11	30752	Продукты питания (folder)/Мороженое	3090104	Spartan
3213588	011213011424	Spartan Ice Cream #2	30752	Продукты питания (folder)/Мороженое	3090104	Spartan
3213589	011213011431	Spartan Ice Cream #3	30752	Продукты питания (folder)/Мороженое	3090104	Spartan
3213590	011213011455	Spartan Ice Cream #4	30752	Продукты питания (folder)/Мороженое	3090104	Spartan
3213591	011213011462	Spartan Ice Cream #5	30752	Продукты питания (folder)/Мороженое	3090104	Spartan
3213592	011213011479	Spartan Ice Cream #6	30752	Продукты питания (folder)/Мороженое	3090104	Spartan
3213593	011213011493	Spartan Ice Cream #7	30752	Продукты питания (folder)/Мороженое	3090104	Spartan
3213594	011213011516	Spartan Ice Cream #8	30752	Продукты питания (folder)/Мороженое	3090104	Spartan
3213595	011213011523	Spartan Ice Cream #9	30752	Продукты питания (folder)/Мороженое	3090104	Spartan
3213598	011213037769	Spartan Ice Cream sandwiches	30752	Продукты питания (folder)/Мороженое	3090104	Spartan
3213599	011213037776	Spartan Ice Cream sandwiches #2	30752	Продукты питания (folder)/Мороженое	3090104	Spartan
3213600	011213037783	Spartan Ice Cream sandwiches #3	30752	Продукты питания (folder)/Мороженое	3090104	Spartan
3213601	011213011448	Spartan Ice Cream, Butter pecan	30752	Продукты питания (folder)/Мороженое	3090104	Spartan
3213602	011213011509	Spartan Ice Cream, Peanut Butter	30752	Продукты питания (folder)/Мороженое	3090104	Spartan
3213603	011213501116	Spartan individually wrapped american singles	330591	Продукты питания (folder)/Продукты питания	3090104	Spartan
3213604	011213380612	Spartan individually wrapped singles swiss Cheese	330591	Продукты питания (folder)/Продукты питания	3090104	Spartan
3213605	011213013411	Spartan indulgent creations a premium Ice Cream, michigan Blueberry	30752	Продукты питания (folder)/Мороженое	3090104	Spartan
3213606	011213013381	Spartan indulgent creations Ice Cream	30752	Продукты питания (folder)/Мороженое	3090104	Spartan
3213607	011213013473	Spartan indulgent creations premium Ice Cream, brownies&fudge	30752	Продукты питания (folder)/Мороженое	3090104	Spartan
3213608	011213070940	Spartan instant boil-in-bag White Rice	330591	Продукты питания (folder)/Продукты питания	3090104	Spartan
3213609	011213070933	Spartan instant brown Rice	330591	Продукты питания (folder)/Продукты питания	3090104	Spartan
3213610	011213110301	Spartan instant non fat Dry Milk	330591	Продукты питания (folder)/Продукты питания	3090104	Spartan
3213611	011213191348	Spartan instant oatmeal, apples&cinnamon	330591	Продукты питания (folder)/Продукты питания	3090104	Spartan
3213612	011213110912	Spartan instant oatmeal, cranberry, Apple, walnut&multigrain oatmeal	330591	Продукты питания (folder)/Продукты питания	3090104	Spartan
3213613	011213191362	Spartan instant oatmeal, maple&brown sugar	330591	Продукты питания (folder)/Продукты питания	3090104	Spartan
3213614	011213110882	Spartan instant oatmeal, mixed berry	330591	Продукты питания (folder)/Продукты питания	3090104	Spartan
3213615	011213191386	Spartan instant oatmeal, Original	330591	Продукты питания (folder)/Продукты питания	3090104	Spartan
3213616	011213012629	Spartan instant oatmeal, peaches&Cream	330591	Продукты питания (folder)/Продукты питания	3090104	Spartan
3213617	011213012612	Spartan instant oatmeal, straeberries&Cream	330591	Продукты питания (folder)/Продукты питания	3090104	Spartan
3213618	011213014876	Spartan instant pudding	330591	Продукты питания (folder)/Продукты питания	3090104	Spartan
3213619	011213014883	Spartan instant pudding #2	330591	Продукты питания (folder)/Продукты питания	3090104	Spartan
3213620	011213101484	Spartan instant pudding #3	330591	Продукты питания (folder)/Продукты питания	3090104	Spartan
3213621	011213101491	Spartan instant pudding #4	330591	Продукты питания (folder)/Продукты питания	3090104	Spartan
3213622	011213101507	Spartan instant pudding #5	330591	Продукты питания (folder)/Продукты питания	3090104	Spartan
3213623	011213101514	Spartan instant pudding #6	330591	Продукты питания (folder)/Продукты питания	3090104	Spartan
3213624	011213101521	Spartan instant pudding #7	330591	Продукты питания (folder)/Продукты питания	3090104	Spartan
3213625	011213101538	Spartan instant pudding #8	330591	Продукты питания (folder)/Продукты питания	3090104	Spartan
3213626	011213101552	Spartan instant pudding #9	330591	Продукты питания (folder)/Продукты питания	3090104	Spartan
3213627	011213083025	Spartan instant White Rice	330591	Продукты питания (folder)/Продукты питания	3090104	Spartan
3213628	011213177021	Spartan iodized salt	330591	Продукты питания (folder)/Продукты питания	3090104	Spartan
