ID	UPCEAN	Name	CategoryID	CategoryName	BrandID	BrandName
2426608	4811086003559	Вино плодовое крепленое крепкое улучшенного качества беларускiя напевы 17% 500ml	22133	Продукты питания (folder)/Алкогольные напитки/Вино (folder)/Вино	0	
2854569	4810549003198	Вино плодовое лесная ягода крепленое 500ml 4810549003198	22133	Продукты питания (folder)/Алкогольные напитки/Вино (folder)/Вино	0	
2854570	4810549003181	Вино плодовое лесная ягода крепленое 700ml 4810549003181	22133	Продукты питания (folder)/Алкогольные напитки/Вино (folder)/Вино	0	
2854216	4607009151694	Вино плодовое малиновое полусладк 1.0	22133	Продукты питания (folder)/Алкогольные напитки/Вино (folder)/Вино	0	
1194929	4607072975012	Вино плодовое облепиха с фруктами полусладк 11% 750ml	22133	Продукты питания (folder)/Алкогольные напитки/Вино (folder)/Вино	0	
2426601	4660003840797	Вино плодовое праздник сакуры абрикос полусладк 8.5-9% 1л винный тд	22133	Продукты питания (folder)/Алкогольные напитки/Вино (folder)/Вино	0	
2426606	4660003840902	Вино плодовое праздник сакуры абрикос полусладк 8.5-9% 1л винный тд бут	22133	Продукты питания (folder)/Алкогольные напитки/Вино (folder)/Вино	0	
2426602	4660003840773	Вино плодовое праздник сакуры вишня полусладк 8.5-9% 1л винный тд	22133	Продукты питания (folder)/Алкогольные напитки/Вино (folder)/Вино	0	
2426603	4660003840780	Вино плодовое праздник сакуры слива полусладк 8.5-9% 1л винный тд	22133	Продукты питания (folder)/Алкогольные напитки/Вино (folder)/Вино	0	
46411	6922664079687	Вино плодовое ротор хаус из красной сливы красное сладкое 750ml 12% стекло	22133	Продукты питания (folder)/Алкогольные напитки/Вино (folder)/Вино	46409	Тан Фунг
1194901	4607072974800	Вино плодовое с фруктами айва бел полусладк 11% 750ml	22133	Продукты питания (folder)/Алкогольные напитки/Вино (folder)/Вино	0	
2853506	4607072975623	Вино плодовое с фруктами земляника п сл 11% 0.75 лс б	22133	Продукты питания (folder)/Алкогольные напитки/Вино (folder)/Вино	0	
3290481	4607072978334	Вино плодовое с фруктами кизил п сл 11% 750ml с б	22133	Продукты питания (folder)/Алкогольные напитки/Вино (folder)/Вино	0	
1659636	4670007933661	Вино плодовое сливовое (лазурный) полусладк 1л	22133	Продукты питания (folder)/Алкогольные напитки/Вино (folder)/Вино	3794777	ЮЖНЫЙ ВИНОДЕЛ
1194934	4602284003027	Вино плодовое сливовое полусладк 10-12% 1л бозан	22133	Продукты питания (folder)/Алкогольные напитки/Вино (folder)/Вино	0	
1194935	4603040001981	Вино плодовое сливовое полусладк 10-12% 1л фанагория	22133	Продукты питания (folder)/Алкогольные напитки/Вино (folder)/Вино	0	
1194936	4602284003140	Вино плодовое сливовое полусладк 10-12% 2л бозан	22133	Продукты питания (folder)/Алкогольные напитки/Вино (folder)/Вино	0	
1194902	4670000686014	Вино плодовое сливовое полусладк 10-12% 750ml	22133	Продукты питания (folder)/Алкогольные напитки/Вино (folder)/Вино	0	
2426605	1055902370873	Вино плодовое сливовое полусладк 8.5-10.5% 1л олимп	22133	Продукты питания (folder)/Алкогольные напитки/Вино (folder)/Вино	0	
3794365	4607009152097	Вино плодовое сливовое полусладк 9-11% 1.0л	1759520	Продукты питания (folder)/Алкогольные напитки/Вино (folder)/Вино плодовое	0	
3794366	4607009152103	Вино плодовое сливовое полусладк 9-11% 1.0л #2	1759520	Продукты питания (folder)/Алкогольные напитки/Вино (folder)/Вино плодовое	0	
3794367	4607009153568	Вино плодовое сливовое полусладк 9-11% 1.0л #3	1759520	Продукты питания (folder)/Алкогольные напитки/Вино (folder)/Вино плодовое	0	
3794368	4607009154640	Вино плодовое сливовое полусладк 9-11% 1.0л #4	1759520	Продукты питания (folder)/Алкогольные напитки/Вино (folder)/Вино плодовое	0	
2854571	4810549004447	Вино плодовое смуглянка крепленое крепкое улучшеного качества 500ml 4810549004447	22133	Продукты питания (folder)/Алкогольные напитки/Вино (folder)/Вино	0	
2854572	4810549003273	Вино плодовое солнцедар крепленое 500ml	22133	Продукты питания (folder)/Алкогольные напитки/Вино (folder)/Вино	0	
2854573	4810549003280	Вино плодовое солнцедар крепленое 700ml	22133	Продукты питания (folder)/Алкогольные напитки/Вино (folder)/Вино	0	
1194937	4602284003713	Вино плодовое столов 72 бел полусладк 13% 2л	22133	Продукты питания (folder)/Алкогольные напитки/Вино (folder)/Вино	0	
1194938	4602284003737	Вино плодовое столов 777 бел полусладк 13% 2л	22133	Продукты питания (folder)/Алкогольные напитки/Вино (folder)/Вино	0	
1660045	4670007933654	Вино плодовое столов полусладк пьяная вишня (кпп лазурный) 1л	22133	Продукты питания (folder)/Алкогольные напитки/Вино (folder)/Вино	3794777	ЮЖНЫЙ ВИНОДЕЛ
2426590	4630000331444	Вино плодовое столов полусладк сангрия спел/вишня 10-12% 1.000	22133	Продукты питания (folder)/Алкогольные напитки/Вино (folder)/Вино	0	
1660046	4607154484470	Вино плодовое столов полусладк сливовое (ппк северский) 1л	22133	Продукты питания (folder)/Алкогольные напитки/Вино (folder)/Вино	3794777	ЮЖНЫЙ ВИНОДЕЛ
1799275	4607086672020	Вино плодовое столов полусладк яблочное вино 1л 15%	688533	Продукты питания (folder)/Алкогольные напитки/Вино (folder)/Вина России и ближнего зарубежья	0	
1194903	4670000687332	Вино плодовое умаи абрикосовое полусладк 10-12% 1.0	22133	Продукты питания (folder)/Алкогольные напитки/Вино (folder)/Вино	0	
1194904	4670000687363	Вино плодовое умаи абрикосовое полусладк 10-12% 2.0	22133	Продукты питания (folder)/Алкогольные напитки/Вино (folder)/Вино	0	
1194905	4670000687394	Вино плодовое умаи абрикосовое полусладк 10-12% 3.0	22133	Продукты питания (folder)/Алкогольные напитки/Вино (folder)/Вино	0	
1194906	4670000687400	Вино плодовое умаи вишневое полусладк 10-12% 3.0	22133	Продукты питания (folder)/Алкогольные напитки/Вино (folder)/Вино	0	
1194907	4670000687370	Вино плодовое умаи вишня/слива полусладк 10-12% 2.0	22133	Продукты питания (folder)/Алкогольные напитки/Вино (folder)/Вино	0	
1194908	4670000687387	Вино плодовое умаи вишня/слива полусладк 10-12% 2.0 #2	22133	Продукты питания (folder)/Алкогольные напитки/Вино (folder)/Вино	0	
1194909	467000068735	Вино плодовое умаи сливовое полусладк 10-12% 1.0	22133	Продукты питания (folder)/Алкогольные напитки/Вино (folder)/Вино	0	
1194910	4670000687417	Вино плодовое умаи сливовое полусладк 10-12% 3.0	22133	Продукты питания (folder)/Алкогольные напитки/Вино (folder)/Вино	0	
2854575	4810549004492	Вино плодовое цыганское 500ml 4810549004492	22133	Продукты питания (folder)/Алкогольные напитки/Вино (folder)/Вино	0	
2854576	4810549004348	Вино плодовое черная ночь крепленое улучшеного качества 500ml 4810549004348	22133	Продукты питания (folder)/Алкогольные напитки/Вино (folder)/Вино	0	
1194940	4602284003256	Вино плодовое черносмородиновое полусладк 10-12% 2л бозан	22133	Продукты питания (folder)/Алкогольные напитки/Вино (folder)/Вино	0	
2854577	4810549004218	Вино плодовое яблочно-виноградное августовское 700ml 4810549004218	22133	Продукты питания (folder)/Алкогольные напитки/Вино (folder)/Вино	0	
3290482	4606440004163	Вино плодовый бачонок сливовое красное полусладк 10-12%1л ст/б	22133	Продукты питания (folder)/Алкогольные напитки/Вино (folder)/Вино	0	
3290483	4606440004156	Вино плодовый бочонок абрикосовое белое плодовое полусладк 10-12% tetrapak 1л	22133	Продукты питания (folder)/Алкогольные напитки/Вино (folder)/Вино	0	
3290484	4606440004170	Вино плодовый бочонок бел полусладк 2л т/п	22133	Продукты питания (folder)/Алкогольные напитки/Вино (folder)/Вино	0	
3290485	4606440004842	Вино плодовый бочонок вишневое плодовое столов красное полусладк 3л тет/пак	22133	Продукты питания (folder)/Алкогольные напитки/Вино (folder)/Вино	0	
3290486	4606440004811	Вино плодовый бочонок вишневое полусладк красное 10-12% 2л тв/уп	22133	Продукты питания (folder)/Алкогольные напитки/Вино (folder)/Вино	0	
3290487	4606440004781	Вино плодовый бочонок вишневое фруктовое красное полусладк 10-12% tetrapak 1л	22133	Продукты питания (folder)/Алкогольные напитки/Вино (folder)/Вино	0	
3290488	4606440004767	Вино плодовый бочонок грушевое белое полусладк 10-12% tetrapak 1л	22133	Продукты питания (folder)/Алкогольные напитки/Вино (folder)/Вино	0	
3290489	4606440004798	Вино плодовый бочонок грушевое белое полусладк 10-12% tetrapak 2л	22133	Продукты питания (folder)/Алкогольные напитки/Вино (folder)/Вино	0	
3290490	4606440004187	Вино плодовый бочонок сливовое 11.5% tetrapak 2л	22133	Продукты питания (folder)/Алкогольные напитки/Вино (folder)/Вино	0	
3290491	4606440004774	Вино плодовый бочонок яблочное 11.5% 1л тет/пак	22133	Продукты питания (folder)/Алкогольные напитки/Вино (folder)/Вино	0	
3290492	4606440004804	Вино плодовый бочонок яблочное белое полусладк 10-12% tetrapak 2л	22133	Продукты питания (folder)/Алкогольные напитки/Вино (folder)/Вино	0	
3290493	4606440004835	Вино плодовый бочонок яблочное плодовое столов белое полусладк 3л тет/пак	22133	Продукты питания (folder)/Алкогольные напитки/Вино (folder)/Вино	0	
45439	3264065101714	Вино плюи д ор бел сух столов 11% 750ml	22133	Продукты питания (folder)/Алкогольные напитки/Вино (folder)/Вино	45438	Плюи де Ор
45440	3264065101929	Вино плюи де ор бел сух 11% 3л	22133	Продукты питания (folder)/Алкогольные напитки/Вино (folder)/Вино	45438	Плюи де Ор
45441	3264065101653	Вино плюи де ор красн псух 11% 750ml	22133	Продукты питания (folder)/Алкогольные напитки/Вино (folder)/Вино	45438	Плюи де Ор
45442	3264065101936	Вино плюи де ор красн сух 11% 3л	22133	Продукты питания (folder)/Алкогольные напитки/Вино (folder)/Вино	45438	Плюи де Ор
4989747	5604885098302	Вино плюма верде бел псух 750ml	688768	Продукты питания (folder)/Алкогольные напитки/Вино (folder)/Вина Португалии	4989450	Нордэкс
4989748	5604885098401	Вино плюма верде розов п/ сух 750ml	688768	Продукты питания (folder)/Алкогольные напитки/Вино (folder)/Вина Португалии	4989450	Нордэкс
690618	3760146571099	Вино пляс руаяль bordeaux бел сух 11.5% (Франция) 750ml	41821	Продукты питания (folder)/Алкогольные напитки/Вино (folder)/Вина Франции	3791729	Place Royalle
690619	3192040386972	Вино пляс руаяль бордо красн/ сух 11-13% (Франция) 750ml	22133	Продукты питания (folder)/Алкогольные напитки/Вино (folder)/Вино	3791729	Place Royalle
2426609	4260056590146	Вино пм глитвейн 8.5-9% 1.000	22133	Продукты питания (folder)/Алкогольные напитки/Вино (folder)/Вино	0	
2426610	4003301028366	Вино пм мадонна красн полусладк 9.5% 750ml	22133	Продукты питания (folder)/Алкогольные напитки/Вино (folder)/Вино	0	
451638	4003301008559	Вино повардарски кадарка красн полусладк 750ml виногр.натур.македония	22133	Продукты питания (folder)/Алкогольные напитки/Вино (folder)/Вино	3620273	BARTON & GUESTIER
1759250	4003301057427	Вино повардарски кадарка полусладк крас 10.5% 750ml	688696	Продукты питания (folder)/Алкогольные напитки/Вино (folder)/Вина Германии и Австрии	0	
3290494	4606860001773	Вино повесть о алиготе сухое белое 10.0-11.0% 700ml стбут	22133	Продукты питания (folder)/Алкогольные напитки/Вино (folder)/Вино	0	
3290495	4606860001827	Вино повесть о саперави сухое красное 10.0-11.0% 700ml стбут	22133	Продукты питания (folder)/Алкогольные напитки/Вино (folder)/Вино	0	
45443	8028730010009	Вино поггио пино р.солис негроамаро сух 14% 750ml	22133	Продукты питания (folder)/Алкогольные напитки/Вино (folder)/Вино	0	
3290496	4860106800203	Вино погреб шио саперави красное сухое 12% 750ml ст/б	282274	Продукты питания (folder)/Алкогольные напитки/Вино (folder)/Вина Грузии	0	
3290497	4860106800296	Вино погреб шио цинандали белое сухое 12% 750ml ст/б	282274	Продукты питания (folder)/Алкогольные напитки/Вино (folder)/Вина Грузии	0	
2854578	1460716189007	Вино подарочный набор асс 4.5л	22133	Продукты питания (folder)/Алкогольные напитки/Вино (folder)/Вино	0	
3793931	4699301416038	Вино подв.саук-дере мер. красн сух 12.5% 750ml	22133	Продукты питания (folder)/Алкогольные напитки/Вино (folder)/Вино	3793930	ПОДВАЛЫ САУК-ДЕРЕ
3793932	4699301416045	Вино подв.саук-дере рисл. бел сух 12% 750ml	22133	Продукты питания (folder)/Алкогольные напитки/Вино (folder)/Вино	3790357	САУК-ДЕРЕ
3793933	4699301416052	Вино подв.саук-дере шард. бел сух 12% 750ml	22133	Продукты питания (folder)/Алкогольные напитки/Вино (folder)/Вино	3793930	ПОДВАЛЫ САУК-ДЕРЕ
690621	8033171690284	Вино подере матэ брунелло ди монтальч. красн сух 750ml	22470	Продукты питания (folder)/Алкогольные напитки/Вино (folder)/Вина Италии	690620	Подере Иль Фальконайо
2977127	8033171690369	Вино подере матэ брунелло ди монтальч. красн сух 750ml #2	22470	Продукты питания (folder)/Алкогольные напитки/Вино (folder)/Вина Италии	690620	Подере Иль Фальконайо
2977128	8033171690314	Вино подере матэ брунелло ди монтальч. красн сух 750ml #3	22470	Продукты питания (folder)/Алкогольные напитки/Вино (folder)/Вина Италии	690620	Подере Иль Фальконайо
690622	8032937583105	Вино поджио ай джинепри 750ml 0% сухое	22133	Продукты питания (folder)/Алкогольные напитки/Вино (folder)/Вино	0	
171036	8027733038119	Вино поджио алле сугере морелино ди скансано 750ml 13% красн сух	22133	Продукты питания (folder)/Алкогольные напитки/Вино (folder)/Вино	0	
171037	8027733018302	Вино поджио алле сугере сплендидо 750ml 14% красн сух	22133	Продукты питания (folder)/Алкогольные напитки/Вино (folder)/Вино	0	
690623	8030967006212	Вино поджио арджентато 750ml 0% псух	22133	Продукты питания (folder)/Алкогольные напитки/Вино (folder)/Вино	0	
690624	8030967004416	Вино поджио валенте ризерва 750ml 0% сухое	22133	Продукты питания (folder)/Алкогольные напитки/Вино (folder)/Вино	0	
690626	8032919070012	Вино поджио веррано дромос маремма красн сух 750ml/Тоскана	22470	Продукты питания (folder)/Алкогольные напитки/Вино (folder)/Вина Италии	690625	Тенута Поджио Веррано
45449	8033049450019	Вино поджо аль тезоро дедикато вальтер в красн сух 14.5% 750ml	22470	Продукты питания (folder)/Алкогольные напитки/Вино (folder)/Вина Италии	45448	Поджо аль Тезоро
45450	8033049450026	Вино поджо аль тезоро сондрайя красн сух 14.5% 750ml	22470	Продукты питания (folder)/Алкогольные напитки/Вино (folder)/Вина Италии	45448	Поджо аль Тезоро
171038	8004375305038	Вино подиум вердикки classico 750ml 13% бел сух	22133	Продукты питания (folder)/Алкогольные напитки/Вино (folder)/Вино	0	
45451	3262151013750	Вино пойак aoc б.филипп красн сух 12% 750ml	41821	Продукты питания (folder)/Алкогольные напитки/Вино (folder)/Вина Франции	0	
3793935	3296321106102	Вино пойяк резерв спесьяль красн сух 750ml	22133	Продукты питания (folder)/Алкогольные напитки/Вино (folder)/Вино	0	
3793936	3296321107109	Вино пойяк резерв спесьяль красн сух 750ml #2	22133	Продукты питания (folder)/Алкогольные напитки/Вино (folder)/Вино	0	
3793937	3077051502811	Вино пол десм.сомюр шамп. красн сух12% 750ml	22133	Продукты питания (folder)/Алкогольные напитки/Вино (folder)/Вино	43281	Joseph Verdier
1194950	897941000158	Вино пол хоббс Chardonnay бел сух 750ml/ривер вэлли	22133	Продукты питания (folder)/Алкогольные напитки/Вино (folder)/Вино	1194944	Пол Хоббс
1194948	897941000165	Вино пол хоббс Pinot Noir красн сух 750ml/ривер вэлли	22133	Продукты питания (folder)/Алкогольные напитки/Вино (folder)/Вино	1194944	Пол Хоббс
1194945	897941000127	Вино пол хоббс кроссбан бай Cabernet Sauvignon красн сух 750ml/ напа вэлли	22133	Продукты питания (folder)/Алкогольные напитки/Вино (folder)/Вино	1194944	Пол Хоббс
1194947	897941000110	Вино пол хоббс кроссбан бай Chardonnay бел сух 750ml/сонома коаст	22133	Продукты питания (folder)/Алкогольные напитки/Вино (folder)/Вино	1194944	Пол Хоббс
1194946	897941000271	Вино пол хоббс кроссбан бай Pinot Noir красн сух 750ml/сонома коаст	22133	Продукты питания (folder)/Алкогольные напитки/Вино (folder)/Вино	1194944	Пол Хоббс
1194949	897941000417	Вино пол хоббс сира кик рэнч красн сух 750ml/сонома кантри	22133	Продукты питания (folder)/Алкогольные напитки/Вино (folder)/Вино	1194944	Пол Хоббс
2426616	4003841001379	Вино полев/терновник красн п/сух 12% 750ml	22133	Продукты питания (folder)/Алкогольные напитки/Вино (folder)/Вино	0	
4989750	8002312056067	Вино полициано кьянти красн сух 750ml	4836311	Продукты питания (folder)/Алкогольные напитки/Вино (folder)/Вина Италии Тоскана	4989749	Полициано
4989751	8002313336007	Вино полициано кьянти красн сух 750ml #2	4836311	Продукты питания (folder)/Алкогольные напитки/Вино (folder)/Вина Италии Тоскана	4989749	Полициано
3290499	4850008151015	Вино полусладк Армения белое алк. 12% 750ml	22133	Продукты питания (folder)/Алкогольные напитки/Вино (folder)/Вино	0	
2854582	4607072975555	Вино полусладк плод мандарин с фрукт 11% 750ml	22133	Продукты питания (folder)/Алкогольные напитки/Вино (folder)/Вино	0	
45297	3433210002019	Вино поль бланк рислинг бел сух 12% 750ml	41821	Продукты питания (folder)/Алкогольные напитки/Вино (folder)/Вина Франции	45296	Поль Бланк
2954384	3433210002118	Вино поль бланк рислинг бел сух 12% 750ml #2	41821	Продукты питания (folder)/Алкогольные напитки/Вино (folder)/Вина Франции	45296	Поль Бланк
45298	3433210002316	Вино поль бланк рислинг шлосберг гр.крю бел псух 12.5 % 750ml	41821	Продукты питания (folder)/Алкогольные напитки/Вино (folder)/Вина Франции	45296	Поль Бланк
151456	3211203423931	Вино поль вальмера красн полусладк 11.5% 750ml	22133	Продукты питания (folder)/Алкогольные напитки/Вино (folder)/Вино	150212	ХОЛДИНГ ВИН 64
