ID	UPCEAN	Name	CategoryID	CategoryName	BrandID	BrandName
2233004	4607020620346	Игра настольная скоро в школу	56347	Игрушки (folder)/Игра настольная	0	
805755	4607020622036	Игра настольная скоро в школу-2 (математика) с-445	56347	Игрушки (folder)/Игра настольная	486	Радуга
2233006	9785378090464	Игра настольная слово за слово	56347	Игрушки (folder)/Игра настольная	0	
2233007	4630002069161	Игра настольная слово за слово 1302b	56347	Игрушки (folder)/Игра настольная	2232900	Дрим Макерс
2233008	4812501071375	Игра настольная слово за слово 1302b #2	56347	Игрушки (folder)/Игра настольная	2232900	Дрим Макерс
2864111	4812501103311	Игра настольная слово за слово 1302b #3	56347	Игрушки (folder)/Игра настольная	0	
3322679	4665295400568	Игра настольная слово за слово к/кор	56347	Игрушки (folder)/Игра настольная	0	
2436233	4606088010786	Игра настольная словодел великан	56347	Игрушки (folder)/Игра настольная	0	
5355353	4813880003674	Игра настольная словодел малый магнитный макси 10367	56347	Игрушки (folder)/Игра настольная	53202	Макси
1946052	6416739026176	Игра настольная смарт 7 дети против взрослых /smart 7	56347	Игрушки (folder)/Игра настольная	3919720	ТАСТIC
1946053	6416739026183	Игра настольная смарт 7 природа и животные /smart 7	56347	Игрушки (folder)/Игра настольная	3919720	ТАСТIC
712819	794764108514	Игра настольная смарт антимонополия арт.10851 /6	56347	Игрушки (folder)/Игра настольная	0	
1768271	4610000140185	Игра настольная смарт гольф мания арт.4018 /8	56347	Игрушки (folder)/Игра настольная	0	
712820	4610000140352	Игра настольная смарт город синей луны арт.4035 /5	56347	Игрушки (folder)/Игра настольная	0	
712823	4610000140574	Игра настольная смарт каркассон.дети каркассона арт.4057 /8	56347	Игрушки (folder)/Игра настольная	0	
712827	4610000140475	Игра настольная смарт каркассон.охотники и собиратели арт.4047 /8	56347	Игрушки (folder)/Игра настольная	0	
712830	4610000140741	Игра настольная смарт колонизаторы.города и рыцари арт.4074 /5	56347	Игрушки (folder)/Игра настольная	0	
712831	4610000140734	Игра настольная смарт колонизаторы.купцы и варвары арт.4073	56347	Игрушки (folder)/Игра настольная	0	
712836	4610000140215	Игра настольная смарт крылья войны.зарево второй мировой арт.4021	56347	Игрушки (folder)/Игра настольная	0	
712838	4610000140680	Игра настольная смарт пингвин арт.4068 /8	56347	Игрушки (folder)/Игра настольная	0	
1666609	4610000140857	Игра настольная смарт энергосеть арт.4085	56347	Игрушки (folder)/Игра настольная	0	
1352210	4814722000455	Игра настольная Смешарики домик кроша pdm150	56347	Игрушки (folder)/Игра настольная	0	
1352211	4814722000479	Игра настольная Смешарики домик нюши pdm152	56347	Игрушки (folder)/Игра настольная	0	
712840	4607155183655	Игра настольная смурфики + CD диск в подарок (задира)	56347	Игрушки (folder)/Игра настольная	0	
2726956	1977860029009	Игра настольная смута.времена и эпохи арт 1001	56347	Игрушки (folder)/Игра настольная	0	
2233013	4660007010578	Игра настольная снежная королева	56347	Игрушки (folder)/Игра настольная	0	
712841	4602010200164	Игра настольная снежная королева арт. р6638	56347	Игрушки (folder)/Игра настольная	444389	ГНОМ
712842	4602933036475	Игра настольная снм ай да ярмарка арт.03647	56347	Игрушки (folder)/Игра настольная	0	
712843	4602933036499	Игра настольная снм двенадцать месяцев арт.03649	56347	Игрушки (folder)/Игра настольная	0	
712844	4602933036482	Игра настольная снм с хрюшей через дорогу арт.03648	56347	Игрушки (folder)/Игра настольная	0	
4960872	4820195057704	Игра настольная со звонком зоркий глаз vladi Toys vt8010-01	1	Неклассифицированные/default	2412911	Vladi Toys
5355354	4630115520269	Игра настольная собери слово. малышарики. увеличенные фишки 50шт 4630115520269 умные игры	56347	Игрушки (folder)/Игра настольная	0	
712845	4607100589488	Игра настольная создай слово 9036	56347	Игрушки (folder)/Игра настольная	712735	Комета Плюс
1666610	4630002065415	Игра настольная создай слово 9036 #2	56347	Игрушки (folder)/Игра настольная	712735	Комета Плюс
2979487	4630002063800	Игра настольная создай слово 9036 #3	56347	Игрушки (folder)/Игра настольная	712735	Комета Плюс
5003047	4602827765481	Игра настольная сокровища семи морей степ паззл	56347	Игрушки (folder)/Игра настольная	2686764	STEPpazzle
829693	4607037664401	Игра настольная солдаты игрико 4401/10	56347	Игрушки (folder)/Игра настольная	0	
3322680	4812501024807	Игра настольная солнечный город	56347	Игрушки (folder)/Игра настольная	0	
2436234	5900221010046	Игра настольная сомбреро или котелок? народы мира	56347	Игрушки (folder)/Игра настольная	0	
1961079	4650057905795	Игра настольная сочинялкин 30 карточек 201002	56347	Игрушки (folder)/Игра настольная	0	
1961080	4650057905788	Игра настольная сочинялкин 60 карточек 201001	56347	Игрушки (folder)/Игра настольная	0	
524112	4602010275254	Игра настольная союзмультфильм 10816:возвращение блудного попугая аст 1028065	56347	Игрушки (folder)/Игра настольная	331420	Astrel
524113	4602010275346	Игра настольная союзмультфильм 10868:маугли аст 1029640	56347	Игрушки (folder)/Игра настольная	331420	Astrel
1309823	4602010275278	Игра настольная союзмультфильм.10819:как львенок и черепаха пели п аст 1028110	56347	Игрушки (folder)/Игра настольная	331420	Astrel
3322681	4607037665750	Игра настольная спецназ б012	56347	Игрушки (folder)/Игра настольная	0	
5355355	778988318331	Игра настольная спин Мастер водяная пушка spin master 6059136	56347	Игрушки (folder)/Игра настольная	464501	SPIN MASTER
5355356	4690590119129	Игра настольная спокойно, больной! играем вместе b1354573-r	56347	Игрушки (folder)/Игра настольная	1791899	Играем Вместе
464086	4602933036468	Игра настольная спокойной ночи,малыши! Золотая рыбка 03646	56347	Игрушки (folder)/Игра настольная	0	
464060	4607118510085	Игра настольная спорт тойз за рулем 82x100/32	56347	Игрушки (folder)/Игра настольная	464059	Омский хоккей
1213168	8888882492340	Игра настольная спортивная 11в1 в кор 25107	56347	Игрушки (folder)/Игра настольная	0	
263886	073050022124	Игра настольная справа-слева сверху-снизу *мпи* суперсерия дрофа 3318	56347	Игрушки (folder)/Игра настольная	0	
1975974	4607038276344	Игра настольная стану отличником английская азбука	56347	Игрушки (folder)/Игра настольная	0	
757253	4602827760066	Игра настольная степ паззл развивающая мои первые цифры	56347	Игрушки (folder)/Игра настольная	1583102	Step
832926	4015682299006	Игра настольная стиль жизни 10 свинок (pig 10)	56347	Игрушки (folder)/Игра настольная	0	
1976111	5425016921890	Игра настольная стиль жизни 7 чудес (7 wonders)	56347	Игрушки (folder)/Игра настольная	0	
2758007	5425016922378	Игра настольная стиль жизни 7 чудес (7 wonders) #2	56347	Игрушки (folder)/Игра настольная	5353147	asmodee
712714	3558380008194	Игра настольная стиль жизни jungle Speed (думай быстро)	56347	Игрушки (folder)/Игра настольная	0	
1976112	3558380019893	Игра настольная стиль жизни jungle Speed safari (думай быстро сафари)	56347	Игрушки (folder)/Игра настольная	0	
1702745	3558380012689	Игра настольная стиль жизни jungle Speed-дополнение 80 новых карт (думай быстро)	56347	Игрушки (folder)/Игра настольная	0	
1314272	3421271400714	Игра настольная стиль жизни panic lab (паника в лаборатории)	56347	Игрушки (folder)/Игра настольная	0	
1702746	3558380019329	Игра настольная стиль жизни абалон	56347	Игрушки (folder)/Игра настольная	0	
1702747	7612577103003	Игра настольная стиль жизни августус (augustus)	56347	Игрушки (folder)/Игра настольная	0	
5355357	4650000321375	Игра настольная стиль жизни акваланч ут100027108	56347	Игрушки (folder)/Игра настольная	5331026	стиль жизни
2260299	4650000320590	Игра настольная стиль жизни артифициум (artificium)	56347	Игрушки (folder)/Игра настольная	0	
832928	4650000320125	Игра настольная стиль жизни барабашка (320125)	56347	Игрушки (folder)/Игра настольная	5354787	zoch
1702749	4650000320330	Игра настольная стиль жизни башня с привидениями	56347	Игрушки (folder)/Игра настольная	0	
1314273	4650000320040	Игра настольная стиль жизни блиц! (день)	56347	Игрушки (folder)/Игра настольная	0	
1702750	4650000320057	Игра настольная стиль жизни блиц! (ночь)	56347	Игрушки (folder)/Игра настольная	0	
832929	4650000320026	Игра настольная стиль жизни бонанза (картон) ут100028372	56347	Игрушки (folder)/Игра настольная	5331026	стиль жизни
2260300	4650000320491	Игра настольная стиль жизни бонанза делюкс (жестяная коробка)	56347	Игрушки (folder)/Игра настольная	0	
5355358	4650000321450	Игра настольная стиль жизни бумажник бп-00001758	56347	Игрушки (folder)/Игра настольная	5331026	стиль жизни
5355359	4650000321832	Игра настольная стиль жизни бумажные кварталы ут100027513	56347	Игрушки (folder)/Игра настольная	5331026	стиль жизни
5355360	4650000320743	Игра настольная стиль жизни бюро находок ут100002655	56347	Игрушки (folder)/Игра настольная	5331026	стиль жизни
5355361	4650000322211	Игра настольная стиль жизни война и сыр ут100027927	56347	Игрушки (folder)/Игра настольная	5331026	стиль жизни
5355362	4650000322716	Игра настольная стиль жизни все на ладони ут100028320	56347	Игрушки (folder)/Игра настольная	5331026	стиль жизни
5355364	4650000322532	Игра настольная стиль жизни второй шанс. 1 серия. проклятие прошлого ут100028170	56347	Игрушки (folder)/Игра настольная	5331026	стиль жизни
5355365	4650000322549	Игра настольная стиль жизни второй шанс. 1 серия. смерть музыканта ут100028169	56347	Игрушки (folder)/Игра настольная	5331026	стиль жизни
5355366	4650000322907	Игра настольная стиль жизни второй шанс. 2 серия. 600 секунд ут100028348	56347	Игрушки (folder)/Игра настольная	5331026	стиль жизни
5355367	4650000322884	Игра настольная стиль жизни второй шанс. 2 серия. запретное знание. ут100028349	56347	Игрушки (folder)/Игра настольная	5331026	стиль жизни
5355368	4650000322112	Игра настольная стиль жизни ганимед ут100027711	56347	Игрушки (folder)/Игра настольная	5331026	стиль жизни
5355369	4650000321351	Игра настольная стиль жизни герои и сокровища ут100027095	56347	Игрушки (folder)/Игра настольная	5331026	стиль жизни
1976114	4650000320507	Игра настольная стиль жизни гномы-вредители (жестяная коробка)	56347	Игрушки (folder)/Игра настольная	182324	Amigo
1976115	3760032260243	Игра настольная стиль жизни гоббит	56347	Игрушки (folder)/Игра настольная	0	
1702751	4650000320248	Игра настольная стиль жизни голубой бриллиант	56347	Игрушки (folder)/Игра настольная	0	
5355370	4650000322556	Игра настольная стиль жизни дальние рубежи ут100028139	56347	Игрушки (folder)/Игра настольная	5331026	стиль жизни
832930	4650000320071	Игра настольная стиль жизни держись на плаву	56347	Игрушки (folder)/Игра настольная	0	
1976116	7640131630054	Игра настольная стиль жизни джайпур (jaipur)	56347	Игрушки (folder)/Игра настольная	0	
832931	3760032260076	Игра настольная стиль жизни диксит	56347	Игрушки (folder)/Игра настольная	0	
1314274	3558380010524	Игра настольная стиль жизни диксит #2	56347	Игрушки (folder)/Игра настольная	0	
832932	3558380011729	Игра настольная стиль жизни диксит-2 (дополнит. 84 карты)	56347	Игрушки (folder)/Игра настольная	0	
1702753	9782914849685	Игра настольная стиль жизни диксит-2 (дополнит. 84 карты) #2	56347	Игрушки (folder)/Игра настольная	0	
2436236	3558380024743	Игра настольная стиль жизни диксит-2 открытие (дополнит. 84 карты)	56347	Игрушки (folder)/Игра настольная	5353147	asmodee
1702754	3558380016014	Игра настольная стиль жизни диксит-3 (дополнит. 84 карты)	56347	Игрушки (folder)/Игра настольная	0	
2436237	3558380024675	Игра настольная стиль жизни диксит-3 путешествие (дополнит. 84 карты)	56347	Игрушки (folder)/Игра настольная	5353147	asmodee
1976117	3558380021094	Игра настольная стиль жизни диксит-4 (дополнит. 84 карты)	56347	Игрушки (folder)/Игра настольная	0	
2436238	3558380024514	Игра настольная стиль жизни диксит-4 истоки (дополнит. 84 карты)	56347	Игрушки (folder)/Игра настольная	5353147	asmodee
2260301	3558380024392	Игра настольная стиль жизни диксит-5 грёзы (дополнит. 84 карты)	56347	Игрушки (folder)/Игра настольная	5353147	asmodee
2436239	3558380031307	Игра настольная стиль жизни диксит-6 воспоминания (84 новых карт)	56347	Игрушки (folder)/Игра настольная	5353147	asmodee
2758008	3558380036289	Игра настольная стиль жизни доббль 1.2.3inch	56347	Игрушки (folder)/Игра настольная	0	
1976118	3558380014379	Игра настольная стиль жизни доббль 5 игр в 1	56347	Игрушки (folder)/Игра настольная	0	
2436240	4650000320545	Игра настольная стиль жизни догони обед	56347	Игрушки (folder)/Игра настольная	0	
5355371	4650000321344	Игра настольная стиль жизни ерундень рождения ут100027118	56347	Игрушки (folder)/Игра настольная	5331026	стиль жизни
5355372	4650000321924	Игра настольная стиль жизни жадюги ут100027622	56347	Игрушки (folder)/Игра настольная	5331026	стиль жизни
5355373	4650000322181	Игра настольная стиль жизни жемчужина ут100027907	56347	Игрушки (folder)/Игра настольная	5331026	стиль жизни
5355374	4650000322501	Игра настольная стиль жизни живые истории (story tailors ru) бп-00002762	56347	Игрушки (folder)/Игра настольная	5331026	стиль жизни
5355375	4650000323058	Игра настольная стиль жизни живые истории. навстречу новым приключениям! (дополнение) ут100028599	56347	Игрушки (folder)/Игра настольная	5331026	стиль жизни
2758009	4650000320798	Игра настольная стиль жизни жирафометр	56347	Игрушки (folder)/Игра настольная	0	
1976119	4650000320392	Игра настольная стиль жизни запретная пустыня бп000008204	56347	Игрушки (folder)/Игра настольная	5331026	стиль жизни
5355376	4650000321986	Игра настольная стиль жизни запретное небо (Forbidden sky) ут100027864	56347	Игрушки (folder)/Игра настольная	5331026	стиль жизни
832933	4650000320095	Игра настольная стиль жизни запретный Остров	56347	Игрушки (folder)/Игра настольная	0	
832934	8718026300449	Игра настольная стиль жизни затерянный храм	56347	Игрушки (folder)/Игра настольная	0	
5355377	4650000320804	Игра настольная стиль жизни зачарованные тропинки ут100027451	56347	Игрушки (folder)/Игра настольная	5331026	стиль жизни
2758010	4650000320774	Игра настольная стиль жизни звонго	56347	Игрушки (folder)/Игра настольная	0	
5355378	4650000322174	Игра настольная стиль жизни здесь был гном (do you gnome me) бп-00002499	56347	Игрушки (folder)/Игра настольная	5331026	стиль жизни
2436241	4650000320484	Игра настольная стиль жизни зевс на каникулах	56347	Игрушки (folder)/Игра настольная	0	
5355379	4650000322235	Игра настольная стиль жизни зевс на каникулах (картон) ут100027937	56347	Игрушки (folder)/Игра настольная	5331026	стиль жизни
5350578	4650000322945	Игра настольная стиль жизни зомби в городе ут100028656	56347	Игрушки (folder)/Игра настольная	5331026	стиль жизни
5350581	4650000322495	Игра настольная стиль жизни зомби в школе ут100028132	205408	Полиграфия (folder)/Книги	5331026	стиль жизни
5355380	4650000321573	Игра настольная стиль жизни игра №9 ут100027414	56347	Игрушки (folder)/Игра настольная	5331026	стиль жизни
5355381	4650000321627	Игра настольная стиль жизни калейдос ут100027392	56347	Игрушки (folder)/Игра настольная	5331026	стиль жизни
832941	4650000320019	Игра настольная стиль жизни карточная корова 006 (картон. кор.)	56347	Игрушки (folder)/Игра настольная	0	
5355382	4650000321726	Игра настольная стиль жизни каруба ут100027457	56347	Игрушки (folder)/Игра настольная	5331026	стиль жизни
5355383	4650000322327	Игра настольная стиль жизни каучук бп-00002638	56347	Игрушки (folder)/Игра настольная	5331026	стиль жизни
5355384	4650000322006	Игра настольная стиль жизни кахут ут100027760	56347	Игрушки (folder)/Игра настольная	5331026	стиль жизни
5355386	4650000322709	Игра настольная стиль жизни квадригами 2 ут100028275	56347	Игрушки (folder)/Игра настольная	5331026	стиль жизни
5355385	4650000320866	Игра настольная стиль жизни квадригами бп-00000192 стиль жизни	56347	Игрушки (folder)/Игра настольная	5331026	стиль жизни
1976120	4650000320422	Игра настольная стиль жизни квадрики.песики	56347	Игрушки (folder)/Игра настольная	0	
2758012	4650000320415	Игра настольная стиль жизни квадрики.свинки	56347	Игрушки (folder)/Игра настольная	0	
5355387	4650000321771	Игра настольная стиль жизни квестмайстер 3. пограбування в венец?ї (321771)	56347	Игрушки (folder)/Игра настольная	5331026	стиль жизни
5355388	4650000321290	Игра настольная стиль жизни квестмайстер. таємниця доктора тайма (321290)	56347	Игрушки (folder)/Игра настольная	5331026	стиль жизни
5355389	4650000322259	Игра настольная стиль жизни квестмастер: за кулисами ут100027993	56347	Игрушки (folder)/Игра настольная	5331026	стиль жизни
5355390	4650000322129	Игра настольная стиль жизни квестмастер: загадка эльдорадо ут100027851	56347	Игрушки (folder)/Игра настольная	5331026	стиль жизни
5355391	4650000322877	Игра настольная стиль жизни квестмастер: побег из алькатраса ут100028328	56347	Игрушки (folder)/Игра настольная	5331026	стиль жизни
5355392	4650000322594	Игра настольная стиль жизни квестмастер: проклятие сфинкса ут100028278	56347	Игрушки (folder)/Игра настольная	5331026	стиль жизни
5355393	4650000321658	Игра настольная стиль жизни квестмастер: судьба лондона ут100027350	56347	Игрушки (folder)/Игра настольная	5331026	стиль жизни
2758013	4650000320897	Игра настольная стиль жизни коварный лис ут100028189	56347	Игрушки (folder)/Игра настольная	5331026	стиль жизни
