ID	UPCEAN	Name	CategoryID	CategoryName	BrandID	BrandName
2171720	088586006784	Merlot petit verdot glass 750ml	22133	Продукты питания (folder)/Алкогольные напитки/Вино (folder)/Вино	0	
392433	8006393307049	Merlot Pinot Grigio Red 750ml	22133	Продукты питания (folder)/Алкогольные напитки/Вино (folder)/Вино	0	
392434	8006393307032	Merlot Pinot Grigio White 750ml	22133	Продукты питания (folder)/Алкогольные напитки/Вино (folder)/Вино	0	
392436	722358000258	Merlot rutini glass 750ml	22133	Продукты питания (folder)/Алкогольные напитки/Вино (folder)/Вино	0	
195756	3333780203291	Merlot the bbq Wine 750ml	22133	Продукты питания (folder)/Алкогольные напитки/Вино (folder)/Вино	0	
1057982	891341000022	Merlot vistorta conti brandolini d'adda friuli gra Rouge 2005	22133	Продукты питания (folder)/Алкогольные напитки/Вино (folder)/Вино	0	
4519228	780876700012	Merlot Wine	1	Неклассифицированные/default	0	
4933434	757170186057	Mermaid bag - purple	1	Неклассифицированные/default	0	
4933435	757170186040	Mermaid bag - Silver	1	Неклассифицированные/default	0	
4519229	070908005056	Mermaid ball	1	Неклассифицированные/default	0	
4519230	032692006374	Mermaid barbie girls m (7-8)	1	Неклассифицированные/default	0	
4519231	032692006367	Mermaid barbie girls s (4-6x)	1	Неклассифицированные/default	0	
392442	5051790850776	Mermaid Bay tuna chunks in brine 185g	48	Продукты питания (folder)/Рыба и морепродукты (folder)/Консервы рыбные	0	
392443	5051898350451	Mermaid Bay tuna chunks in sunflower Oil 185g	48	Продукты питания (folder)/Рыба и морепродукты (folder)/Консервы рыбные	0	
428443	30547414	Mermaid Bay tuna flakes with tomato&onion 85g	1	Неклассифицированные/default	423300	Tesco
4519232	715606059535	Mermaid clock	1	Неклассифицированные/default	0	
4519233	787643093209	Mermaid creations 1ct	1	Неклассифицированные/default	0	
2002743	716770051905	Mermaid Dream (d)	363351	Adult/Sex-Shop	0	
4933436	613153785979	Mermaid egg toy	1	Неклассифицированные/default	0	
4519234	074299478635	Mermaid fantasy	1	Неклассифицированные/default	0	
4933437	731015216499	Mermaid Fashion doll with accessories	1	Неклассифицированные/default	0	
4519235	719719565341	Mermaid flounder nylon 1ct	1	Неклассифицированные/default	0	
4519236	013023243194	Mermaid forest v01 (DVD) nla	1	Неклассифицированные/default	0	
4519237	013023243392	Mermaid forest v03-unquenchable thirst (DVD) nla	1	Неклассифицированные/default	0	
4519238	013023243293	Mermaid forest vol. 2	1	Неклассифицированные/default	0	
4519239	013023243491	Mermaid forest vol.4 - unending nightmare	1	Неклассифицированные/default	0	
4933438	089775706133	Mermaid Hair don t Care sequins cinch bag	1	Неклассифицированные/default	0	
4519240	718732697589	Mermaid handbag 1ct	1	Неклассифицированные/default	0	
4933439	191124381134	Mermaid hopscotch sprinkler	1	Неклассифицированные/default	0	
4519241	074299411212	Mermaid inlay puzzle asst 1ct	1	Неклассифицированные/default	0	
2362985	9557422140018	Mermaid Lotion&safflower Oil 60ml	1	Неклассифицированные/default	0	
2001882	716770015037	Mermaid masturbator	363351	Adult/Sex-Shop	0	
4519242	718732697756	Mermaid Mini backpack 1ct	1	Неклассифицированные/default	0	
4519243	715606059511	Mermaid plate	1	Неклассифицированные/default	0	
4933440	731015257812	Mermaid Princess doll	1	Неклассифицированные/default	0	
4519244	688618000225	Mermaid productions CD ru-ra: ru-ra	1	Неклассифицированные/default	0	
4519245	633870085190	Mermaid puzzle&a book by kid journeys 32oz	1	Неклассифицированные/default	0	
4519246	094075134210	Mermaid sea products inc 8oz sea-maids Old fashioned cocktail sauce	1	Неклассифицированные/default	0	
4933441	192040315173	Mermaid sleep mask fizzer set	1	Неклассифицированные/default	0	
4933442	795229379159	Mermaid Tail cosmetic brush-Silver	1	Неклассифицированные/default	0	
1996630	603912187342	Mermaid vibe (d)	363351	Adult/Sex-Shop	0	
1539201	079808013079	Mermaid whale storyb	1	Неклассифицированные/default	0	
1539202	626898037074	Mermaids	1	Неклассифицированные/default	0	
1539203	626898041095	Mermaids #2	1	Неклассифицированные/default	0	
625579	814625012085	Mermaids coloring&activity book	457262	Полиграфия (folder)/Раскраска	0	
4933443	814625012313	Mermaids foil&embossed coloring&activity book	1	Неклассифицированные/default	0	
392445	613103018201	Mermaids song glass 750ml	1	Неклассифицированные/default	0	
392446	800759465552	Mermaids stained glass coloring book	457262	Полиграфия (folder)/Раскраска	0	
4933444	731015217960	Mermaids with accessories set	1	Неклассифицированные/default	0	
392444	800759469901	Mermaids-sirens of the sea	331156	Товары для творчества (folder)/Живопись и рисования (folder)/Товары для художников	0	
4519248	630915201270	Mermax each ideclare talking pet tag	1	Неклассифицированные/default	0	
4519249	630915201683	Mermax each ideclare talking pet tag #2	1	Неклассифицированные/default	0	
4519250	630915501127	Mermax each mermax talking pet tag asst.	1	Неклассифицированные/default	0	
4519251	7501000380213	Mermelada carmel fresa 250g	1	Неклассифицированные/default	0	
4519252	7501000380220	Mermelada carmel pina 250g	1	Неклассифицированные/default	0	
4519253	7501052474007	Mermelada clemente Jacques fresa 300g	1	Неклассифицированные/default	0	
4519254	7501052474212	Mermelada clemente Jacques zarza 500g	1	Неклассифицированные/default	0	
4519255	058897091465	Mermelada corina fresa 320g	1	Неклассифицированные/default	0	
4519256	605388716484	Mermelada de durazno (Peach jam) 500g	1	Неклассифицированные/default	0	
3159332	8411187415150	Mermelada de mora con Cafe	330591	Продукты питания (folder)/Продукты питания	0	
4519257	7501006530285	Mermelada Del Monte fresa 270g	1	Неклассифицированные/default	36678	Del Monte
4519258	7501006537987	Mermelada Del Monte pina 270g	1	Неклассифицированные/default	36678	Del Monte
4519259	051500037959	Mermelada fresa smucker's 142g jm smucker	1	Неклассифицированные/default	0	
2631908	021893796634	Mermelada glass 750ml	1	Неклассифицированные/default	0	
4519260	7501003336125	Mermelada mccormick fresa 270g	1	Неклассифицированные/default	0	
4519261	7501003336323	Mermelada mccormick pina 270g	1	Неклассифицированные/default	0	
4519262	7506141600015	Mermelada Star fruts fresa 350g	1	Неклассифицированные/default	0	
4519263	741948300103	Mermory card	1	Неклассифицированные/default	0	
625580	5012509979584	Merocaine lozenges x 24	1	Неклассифицированные/default	0	
1057983	5012509979607	Merocet lozenges 24	1	Неклассифицированные/default	0	
1057984	5012509979614	Merocet Plus lozenges (merothol) 24	1	Неклассифицированные/default	0	
2171721	4800021061020	Meroget pdr iv inj vial 1g	1371731	Лекарственные средства (folder)/MERCURY BRANDED	0	
2171722	4800021061013	Meroget pdr iv inj vial 500mg	1371731	Лекарственные средства (folder)/MERCURY BRANDED	0	
1057985	893928002061	Meroi Chardonnay glass 750ml	22133	Продукты питания (folder)/Алкогольные напитки/Вино (folder)/Вино	0	
1057986	893928002078	Meroi ros di buri glass 750ml	1	Неклассифицированные/default	0	
4519264	091641141498	Merona	1	Неклассифицированные/default	0	
4519265	771263491996	Merona 3 pack a-shirts - xl	1	Неклассифицированные/default	0	
4519266	098593961822	Merona Fashion bikini briefs, Red, xl 5ct	1	Неклассифицированные/default	0	
4519267	098593961518	Merona Fashion low-rise briefs, grape, xl 5ct	1	Неклассифицированные/default	0	
4519268	098593961464	Merona Fashion low-rise briefs, Red, xl 5ct	1	Неклассифицированные/default	0	
4519269	025343327492	Merona socks 6 pack Black	1	Неклассифицированные/default	0	
4519270	091641141450	Merona thermal crew shirt	1	Неклассифицированные/default	0	
4519271	091641141481	Merona thermal crew shirt #2	1	Неклассифицированные/default	0	
4519272	091641145908	Merona thermal crew shirt #3	1	Неклассифицированные/default	0	
4519273	091641141375	Merona thermal pants	1	Неклассифицированные/default	0	
4519274	490240616282	Meronaв large satchel - ivory	1	Неклассифицированные/default	0	
2631909	8595106400936	Meronem inj plv sol 10x 1g	210391	Лекарственные средства (folder)/Лекарственные средства	0	
2631910	8595106400929	Meronem inj plv sol 10x 500mg	210391	Лекарственные средства (folder)/Лекарственные средства	0	
1539204	304093506013	Meropenem inj usp 1g 30ml ftv	1	Неклассифицированные/default	0	
1539205	304093505016	Meropenem inj usp 500mg 20ml	1	Неклассифицированные/default	0	
4519275	787364659395	Meros meros pandilleros (DVD) (6 peliculas)	1	Неклассифицированные/default	0	
3704818	8021056000068	Merotto cartizze val.Super. Dry w 750ml	296061	Продукты питания (folder)/Алкогольные напитки/Вино (folder)/Вино игристое	3704817	MEROTTO (CASA VINICOLA MEROTTO/ITALY)
2813488	8787250200320	Merotto colbelo glass 750ml	1	Неклассифицированные/default	0	
2813489	818725020032	Merotto colbelo prosecco docg 5.5% 750l	1	Неклассифицированные/default	0	
3704819	8021056000013	Merotto colbelo val.pros.sup. Extra Dry w 750ml	296061	Продукты питания (folder)/Алкогольные напитки/Вино (folder)/Вино игристое	3704817	MEROTTO (CASA VINICOLA MEROTTO/ITALY)
2813490	818725020056	Merotto cuvee Del fondatore spk 6pk 5.5% 750l	1	Неклассифицированные/default	0	
3704820	8021056009979	Merotto furlo prosecco Extra Dry w 750ml Box	296061	Продукты питания (folder)/Алкогольные напитки/Вино (folder)/Вино игристое	3704817	MEROTTO (CASA VINICOLA MEROTTO/ITALY)
3704822	8021056002611	Merotto La primav.di bar. prosecco Dry w 1.5l Box	296061	Продукты питания (folder)/Алкогольные напитки/Вино (folder)/Вино игристое	3704817	MEROTTO (CASA VINICOLA MEROTTO/ITALY)
3704821	8021056000082	Merotto La primav.di bar. prosecco Dry w 750ml	296061	Продукты питания (folder)/Алкогольные напитки/Вино (folder)/Вино игристое	3704817	MEROTTO (CASA VINICOLA MEROTTO/ITALY)
2813491	818725020070	Merotto La primavera di Barbara glass 750ml	1	Неклассифицированные/default	0	
3704823	8021056000112	Merotto le fare brut w 750ml	296061	Продукты питания (folder)/Алкогольные напитки/Вино (folder)/Вино игристое	3704817	MEROTTO (CASA VINICOLA MEROTTO/ITALY)
3704824	8021056061113	Merotto raye brut w 750ml Box	296061	Продукты питания (folder)/Алкогольные напитки/Вино (folder)/Вино игристое	3704817	MEROTTO (CASA VINICOLA MEROTTO/ITALY)
3704825	8021056000044	Merotto Rose brut grani rosa di nero brut p 750ml	296061	Продукты питания (folder)/Алкогольные напитки/Вино (folder)/Вино игристое	3704817	MEROTTO (CASA VINICOLA MEROTTO/ITALY)
4519276	018473430545	Merrell jungle primo	1	Неклассифицированные/default	0	
1745758	098682388813	Merrell men's moab ventilator hiking shoe - beluga/ denim Blue (10.5, beluga/denim Blue)	15348	Одежда и обувь (folder)/Обувь (folder)/Обувь	0	
1745759	773984684954	Merrell mens slip on shoes driving rally moc Dark Earth brown sz 9 m	15348	Одежда и обувь (folder)/Обувь (folder)/Обувь	0	
4519277	098682042012	Merrell outland mid gtx	1	Неклассифицированные/default	0	
4519278	098771865713	Merrell pulse ii smoke	1	Неклассифицированные/default	0	
2813492	098682343843	Merrell/wolverine worldwide inc encore breeze gray 8 m j66406	1	Неклассифицированные/default	0	
2813493	018468411979	Merrell/wolverine worldwide inc palmetto brown 10 m j33172	1	Неклассифицированные/default	0	
2813494	098681138105	Merrell/wolverine worldwide inc Paris Black 8.5 m j70222	1	Неклассифицированные/default	0	
2813495	098681138112	Merrell/wolverine worldwide inc Paris Black 9 m j70222	1	Неклассифицированные/default	0	
2813496	098681138129	Merrell/wolverine worldwide inc Paris Black j70222	1	Неклассифицированные/default	0	
2813497	018466826416	Merrell/wolverine worldwide inc plaza peak Black 7 m j46424	1	Неклассифицированные/default	0	
2813498	018467320944	Merrell/wolverine worldwide inc sadie brown 13 m q82791	1	Неклассифицированные/default	0	
2813499	098681155430	Merrell/wolverine worldwide inc Spirit tibet hi Green 6.5 m j20048	1	Неклассифицированные/default	0	
2813500	098682369294	Merrell/wolverine worldwide inc valetta med beige 9 m j76780	1	Неклассифицированные/default	0	
2813501	098681121909	Merrell/wolverine worldwide inc zodiac Black 6 m j73078	1	Неклассифицированные/default	0	
2813502	098681121923	Merrell/wolverine worldwide inc zodiac Black 7 m j73078	1	Неклассифицированные/default	0	
2813503	098681121947	Merrell/wolverine worldwide inc zodiac Black 8 m j73078	1	Неклассифицированные/default	0	
2813504	098681122234	Merrell/wolverine worldwide inc zodiac Orange 8.5 m j73072	1	Неклассифицированные/default	0	
2813505	098681162094	Merrell/wolverine worldwide inc zurich brown 8 m j70634	1	Неклассифицированные/default	0	
1057987	031003213036	Merrem 1g 10vl	1	Неклассифицированные/default	0	
1057988	620641010697	Merrem 1g vial 20ml	1	Неклассифицированные/default	0	
1057989	031003252028	Merrem 500mg 10vl 20	1	Неклассифицированные/default	0	
1057990	620641010680	Merrem 500mg vial 20ml	1	Неклассифицированные/default	0	
1057991	303100321304	Merrem vl 1g 30ml 10	1	Неклассифицированные/default	0	
1057992	303100325203	Merrem vl 500mg 20ml 10	1	Неклассифицированные/default	0	
2171723	9789660851351	Merri holidays at school. сценарии-школьный праздник	36536	Полиграфия (folder)/Печатная продукция	0	
392447	838294000228	Merriam vineyards Cabernet franc glass 750ml	22133	Продукты питания (folder)/Алкогольные напитки/Вино (folder)/Вино	0	
392448	838294000259	Merriam vineyards Chardonnay glass 750ml	22133	Продукты питания (folder)/Алкогольные напитки/Вино (folder)/Вино	0	
2631911	838294000945	Merriam vineyards cuvec glass 750ml	1	Неклассифицированные/default	0	
392449	838294000136	Merriam vineyards Merlot glass 750ml	22133	Продукты питания (folder)/Алкогольные напитки/Вино (folder)/Вино	0	
392450	838294000204	Merriam vineyards miktos glass 750ml	1	Неклассифицированные/default	0	
2362986	838294001102	Merriam vineyards Rose of Pinot Noir glass 750ml	22133	Продукты питания (folder)/Алкогольные напитки/Вино (folder)/Вино	0	
1539206	838294000754	Merriam vineyards Sauvignon blanc glass 750ml	22133	Продукты питания (folder)/Алкогольные напитки/Вино (folder)/Вино	0	
2631912	838294001119	Merriam vineyards Sauvignon blanc glass 750ml #2	1	Неклассифицированные/default	0	
392451	838294000389	Merriam vineyards sned Red glass 750ml	1	Неклассифицированные/default	0	
1747442	081413009293	Merriam webster 4th edition scrabble dictionary	550638	Спорт и отдых (folder)/Спорт	0	
2362988	081413006520	Merriam-webster atlas notebook size 6521	1	Неклассифицированные/default	2362987	Merriam-Webster
2362989	9780877790235	Merriam-webster book alphabet bk ages 2+ 023x	1	Неклассифицированные/default	2362987	Merriam-Webster
2362990	9780877799177	Merriam-webster book dictionary french/English 9172	1	Неклассифицированные/default	2362987	Merriam-Webster
2362991	081413009163	Merriam-webster book dictionary span/English 9164	1	Неклассифицированные/default	2362987	Merriam-Webster
2362992	9780877798514	Merriam-webster book dictionary&thesaurus 8516	1	Неклассифицированные/default	2362987	Merriam-Webster
2362993	081413006704	Merriam-webster book how to use a dictionary 670x	1	Неклассифицированные/default	2362987	Merriam-Webster
2362995	081413006711	Merriam-webster book paperback thesaurus 6718	1	Неклассифицированные/default	2362987	Merriam-Webster
2362996	081413000474	Merriam-webster book pronouncing dictionary 0477	1	Неклассифицированные/default	2362987	Merriam-Webster
2362997	9780877795469	Merriam-webster dictionary hb geographical 5469	1	Неклассифицированные/default	2362987	Merriam-Webster
2362998	081413006735	Merriam-webster dictionary notebook sz fren/engl 6734	1	Неклассифицированные/default	2362987	Merriam-Webster
2362999	081413006728	Merriam-webster dictionary notebook sz span/engl 6726	1	Неклассифицированные/default	2362987	Merriam-Webster
2363000	9780877796756	Merriam-webster elementary dictionary 6756	1	Неклассифицированные/default	2362987	Merriam-Webster
4519279	081413004793	Merriam-webster intermediate dictionary	1	Неклассифицированные/default	0	
2363001	00814138	Merriam-webster pocket dictionary 5308	1	Неклассифицированные/default	2362987	Merriam-Webster
2363002	9780877790761	Merriam-webster thesaurus intermediate hardbnd 0760	1	Неклассифицированные/default	2362987	Merriam-Webster
4519280	081413007145	Merriam-webster's collegiate dictionary	1	Неклассифицированные/default	0	
4519281	9780877797098	Merriam-webster's collegiate dictionary (merri...	1	Неклассифицированные/default	0	
4519282	081413007091	Merriam-webster's collegiate dictionary tenth ed.	1	Неклассифицированные/default	0	
4519283	798694895803	Merriam-webster's collegiate dictionary&thesaurus de luxe audio edition on CD	1	Неклассифицированные/default	0	
586020	081413008098	Merriam-webster's collegiate dictionary, eleventh edition, jacketed hardcover with cdrom	1	Неклассифицированные/default	0	
4519284	081413006995	Merriam-webster's medical dictionary	1	Неклассифицированные/default	0	
1089097	081413003956	Merriam-webster's notebook dictionary 4oz	205408	Полиграфия (folder)/Книги	0	
4519285	081413005004	Merriam-webster's pocket dictionary 1ct	1	Неклассифицированные/default	0	
4519286	081413008128	Merriam-webster's premium gift set	1	Неклассифицированные/default	0	
4519287	081413009132	Merriam-webster's rhyming dictionary	1	Неклассифицированные/default	0	
4519288	081413006384	Merriam-webster's student atlas, paperback	1	Неклассифицированные/default	0	
4519289	798694887358	Merrian-webster's spanish-English dictionary	1	Неклассифицированные/default	0	
4519290	018643000004	Merrick 10pk tube hanger asst	1	Неклассифицированные/default	0	
1743254	022808291237	Merrick 12-pack texas toothpicks, 12 count	337596	Товары для животных (folder)/Pets	0	
1743255	022808160137	Merrick 7 to 9-inch g.i. bone, 12 count	337596	Товары для животных (folder)/Pets	0	
1539207	018643906016	Merrick attachable hangers	1	Неклассифицированные/default	0	
1743256	022808382379	Merrick grain free 12-pound real buffalo and sweet potato Dog Food 1 bag	19035	Товары для животных (folder)/Корм для животных (folder)/Корм для собак	0	
1743257	022808382454	Merrick grain free 25-pound real buffalo and sweet potato Dog Food 1 bag	19035	Товары для животных (folder)/Корм для животных (folder)/Корм для собак	0	
1743258	022808382492	Merrick grain free 25-pound real duck and Green pea Dog Food 1 bag	19035	Товары для животных (folder)/Корм для животных (folder)/Корм для собак	0	
4519291	041250646839	Merrick plastic tubular hangers 15ct	1	Неклассифицированные/default	0	
4519292	022808202806	Merrick puppy plate 80oz	1	Неклассифицированные/default	0	
4519293	018643873240	Merrick set of 30 plastic hangers	1	Неклассифицированные/default	0	
1539208	018643991203	Merrick shoe rack	1	Неклассифицированные/default	0	
4519294	022808672012	Merrick snausages venison holiday stew 35g	1	Неклассифицированные/default	0	
1539209	018643893217	Merrick swivel hangers	1	Неклассифицированные/default	0	
4933445	089775293817	Merrick tubular hanger 10-pack - asst	1	Неклассифицированные/default	0	
4933446	089775696694	Merrick tubular hanger 10-pack - medium size	1	Неклассифицированные/default	0	
4933447	018643873110	Merrick White medium plastic hanger 30-pack	1	Неклассифицированные/default	0	
1743259	022808854425	Merrick whole Earth farms senior Dry Dog Food 8-pound bag	19035	Товары для животных (folder)/Корм для животных (folder)/Корм для собак	0	
1539210	5020713110136	Merrie england Cream 13%	1396417	Продукты питания (folder)/Алкогольные напитки/Вино (folder)/Fortified Wine	0	
1539211	5020713110167	Merrie england Cream 13% #2	1396417	Продукты питания (folder)/Алкогольные напитки/Вино (folder)/Fortified Wine	0	
1539212	5020713110143	Merrie england medium 13%	1396417	Продукты питания (folder)/Алкогольные напитки/Вино (folder)/Fortified Wine	0	
1539213	5020713110174	Merrie england medium 13% #2	1396417	Продукты питания (folder)/Алкогольные напитки/Вино (folder)/Fortified Wine	0	
3704826	4602006241171	Merries giant/ xl 12-22kg 38 u n	458	Гигиена (folder)/Подгузники	271451	Merries
3704827	4901301323033	Merries giant/ xl 12-22kg 38 u n #2	458	Гигиена (folder)/Подгузники	271451	Merries
3704828	4901301323019	Merries giant/ xl 15-28kg 26 u n	458	Гигиена (folder)/Подгузники	271451	Merries
3704829	4691301230638	Merries l 9-14kg 44 u n	458	Гигиена (folder)/Подгузники	271451	Merries
3704830	4901301323057	Merries l 9-14kg 44 u n #2	458	Гигиена (folder)/Подгузники	271451	Merries
3704831	4901301323002	Merries Maxi 9-14kg 54 u t	458	Гигиена (folder)/Подгузники	271451	Merries
3704832	4691301239983	Merries w/lot. alc.fr. b y tk s st/zip 64pcs	340956	Уход за детьми (folder)/Салфетки детские	271451	Merries
519957	4901301239860	Merries детские влажные гигиенические салфетки (мягкая эконом. упаковка) 3x 64шт 1/12	499	Гигиена (folder)/Салфетки влажные	271451	Merries
509497	4901301253415	Merries подгузники для детей р.xl 12-20kg	458	Гигиена (folder)/Подгузники	271451	Merries
106446	4901301738295	Merries трусики для приучения к горшку l 9-14kg, 19шт	458	Гигиена (folder)/Подгузники	271451	Merries
106444	4901301743824	Merries трусики для приучения к горшку xl 12-18kg, 19шт	458	Гигиена (folder)/Подгузники	271451	Merries
