ID	UPCEAN	Name	CategoryID	CategoryName	BrandID	BrandName
5390699	4610018812173	Картридж из полипропиленового шнура 10 10 микрон, unicorn (картридж механической очистки.) pp1010	5387079	Картридж для очистки воды	3879243	UNICORN
5390700	5900905194536	Картридж из полипропиленового шнура 10 20 микрон av engineering (картридж механической очистки.) ave119n1020	5387079	Картридж для очистки воды	5126064	av engineering
5390701	5900905194581	Картридж из полипропиленового шнура 10 5 микрон av engineering (картридж механической очистки.) ave119n1005	5387079	Картридж для очистки воды	5126064	av engineering
5390702	4610018812180	Картридж из полипропиленового шнура 10 5 микрон, unicorn (картридж механической очистки.) pp1005	5387079	Картридж для очистки воды	3879243	UNICORN
5009670	4627080116467	Картридж из полипропиленового шнура аквабрайт вп-20m-л 20inch	179917	Хозяйственные товары (folder)/Фильтр для воды	5113781	Аквабрайт
3336950	4627080110335	Картридж из полипропиленового шнура аквабрайт вп-5m 10inch	1	Неклассифицированные/default	0	
5390703	4610018812241	Картридж из полипропиленового шнура для фильтров типа 20bb, 20микрон, unicorn (картридж механической очистки. big Blue 20) ppbb	5387079	Картридж для очистки воды	3879243	UNICORN
5390704	4610018812937	Картридж из скорлупы кокосовых орехов 10, unicorn (картридж с углем из скорлупы кокосовых орехов) fcb10	5387079	Картридж для очистки воды	3879243	UNICORN
2729727	4640001711978	Картридж к игровой тв-приставке vtech spider-man руссифиц в русс. пласт кор. в кор.4x 6шт	1351406	Медиа (folder)/Компьютерные игры	0	
2729725	4640001711961	Картридж к игровой тв-приставке vtech Золушка руссифиц Disney в русс. пласт кор в кор.4x 6шт	1351406	Медиа (folder)/Компьютерные игры	0	
2729756	4640001711954	Картридж к игровой тв-приставке vtech тачки руссифиц Disney в русс. пласт кор в кор 4x 6шт	1351406	Медиа (folder)/Компьютерные игры	0	
470175	4607020403000	Картридж к кувш.galant к990	1	Неклассифицированные/default	0	
314538	4607056501299	Картридж к кувшину гейзер жест. вода 502, ресурс 300л	179917	Хозяйственные товары (folder)/Фильтр для воды	5615	Гейзер
1221567	4607056501930	Картридж к кувшину гейзер жест. вода мини 302, 200л	179917	Хозяйственные товары (folder)/Фильтр для воды	0	
1221568	4607056501282	Картридж к кувшину гейзер обеззараживание 505, ресурс 250л	179917	Хозяйственные товары (folder)/Фильтр для воды	5615	Гейзер
314536	4607056501923	Картридж к кувшину гейзер универсал. мини 301, ресурс 200л	179917	Хозяйственные товары (folder)/Фильтр для воды	5615	Гейзер
314537	4607056500452	Картридж к кувшину гейзер универсальный 501, ресурс 300л	179917	Хозяйственные товары (folder)/Фильтр для воды	5615	Гейзер
5390705	4211125576189	Картридж к прибору световой эпиляции Beurer ipl 9000 Plus spare Light cartridge	5387070	Картридж (general)	207511	BEURER
2234836	4640011641067	Картридж к ф/кувшину к990 (унив.), шт	1	Неклассифицированные/default	0	
2234837	4640011641098	Картридж к ф/кувшину к993 (умягч.), шт	1	Неклассифицированные/default	0	
722927	4607056500391	Картридж к фильтру 10inch угольный	1	Неклассифицированные/default	5615	Гейзер
2234839	4640011640633	Картридж к110 мех.5inch на хол.воду, шт	1	Неклассифицированные/default	0	
2234840	4640011640664	Картридж к140 мех.10inch вв на хол.воду, шт	1	Неклассифицированные/default	0	
2234841	4640011640671	Картридж к150 мех.20inch вв на хол.воду, шт	1	Неклассифицированные/default	0	
2234842	4640011640725	Картридж к205 gac (гран.уголь), шт	1	Неклассифицированные/default	0	
2234843	4640011640800	Картридж к300 (ионообмен. смола), шт	1	Неклассифицированные/default	0	
2234844	4640011640855	Картридж к601 (рр+технич.смола), шт	1	Неклассифицированные/default	0	
2234845	4640011640879	Картридж к604 (рр+уголь), шт	1	Неклассифицированные/default	0	
2234846	4640011640909	Картридж к700 мех.на гор.воду, шт	1	Неклассифицированные/default	0	
2234847	4640011640992	Картридж к896 (уголь для е310, е312), шт	1	Неклассифицированные/default	0	
2440670	4603299253087	Картридж керамич 40mm	1	Неклассифицированные/default	0	
2440671	4603299100640	Картридж керамический 35mm на мален.корпус	1	Неклассифицированные/default	0	
2440672	4603299100633	Картридж керамический 40mm на большой корпус	1	Неклассифицированные/default	0	
2164072	4960999047034	Картридж кр-36ip for ср-400/500 (комплект) canon (7737a001)	2023918	Техника (folder)/Электротехника (folder)/Цифровая техника (folder)/Other Consumables	177631	CANON
314544	4820056800401	Картридж кудх чистая вода 170л	179917	Хозяйственные товары (folder)/Фильтр для воды	314516	НАША ВОДА
314545	4820056800418	Картридж кум мягкая вода 200л	179917	Хозяйственные товары (folder)/Фильтр для воды	314516	НАША ВОДА
3336788	4620747118545	Картридж лазерный brother (tn1075) hl-1110r/1112r/dcp-1512/mfc-1815 рес 1000стр, nv print совместимый	230307	Техника (folder)/Электротехника (folder)/Цифровая техника (folder)/Расходные материалы для цифровой техники (folder)/Картридж для принтера	1670917	NV PRINT
2440570	4977766721721	Картридж лазерный brother (tn1075) hl-1110r/1112r/dcp-1512r/mfc-1815r и др, ориг. ресурс 1000 стр.	230307	Техника (folder)/Электротехника (folder)/Цифровая техника (folder)/Расходные материалы для цифровой техники (folder)/Картридж для принтера	179421	BROTHER
3336789	4690207170925	Картридж лазерный brother (tn2080) hl-2130r/dcp-7055r и др, ресурс 700стр cactus совместимый	230307	Техника (folder)/Электротехника (folder)/Цифровая техника (folder)/Расходные материалы для цифровой техники (folder)/Картридж для принтера	2729362	Cactus
722928	4977766662413	Картридж лазерный brother (tn2085) hl-2035r и другие, ориг., ресурс 1500 стр.	230307	Техника (folder)/Электротехника (folder)/Цифровая техника (folder)/Расходные материалы для цифровой техники (folder)/Картридж для принтера	179421	BROTHER
722929	4977766682978	Картридж лазерный brother (tn2090) dcp-7057r и другие, ориг., ресурс 1000 стр.	230307	Техника (folder)/Электротехника (folder)/Цифровая техника (folder)/Расходные материалы для цифровой техники (folder)/Картридж для принтера	179421	BROTHER
3336790	4620747115001	Картридж лазерный brother (tn2090) dcp-7057r/hl-2132r и др.ресурс 1000 стр. nv print совместимый	230307	Техника (folder)/Электротехника (folder)/Цифровая техника (folder)/Расходные материалы для цифровой техники (folder)/Картридж для принтера	1670917	NV PRINT
1670919	4620747111492	Картридж лазерный brother (tn2275) hl-2240r и другие, ресурс 2600 стр. nv print совместимый	230307	Техника (folder)/Электротехника (folder)/Цифровая техника (folder)/Расходные материалы для цифровой техники (folder)/Картридж для принтера	1670917	NV PRINT
722931	4977766666954	Картридж лазерный brother (tn230bk) dcp-9010cn/mfc-9120cn и другие, черный, ориг., ресурс 2200 стр.	230307	Техника (folder)/Электротехника (folder)/Цифровая техника (folder)/Расходные материалы для цифровой техники (folder)/Картридж для принтера	179421	BROTHER
722932	4977766666985	Картридж лазерный brother (tn230c) dcp-9010cn/mfc-9120cn и другие, голубой, ориг., ресурс 1400 стр.	230307	Техника (folder)/Электротехника (folder)/Цифровая техника (folder)/Расходные материалы для цифровой техники (folder)/Картридж для принтера	179421	BROTHER
722933	4977766666978	Картридж лазерный brother (tn230m) dcp-9010cn/mfc-9120cn и другие, пурпурный, ориг., ресурс 1400 стр	230307	Техника (folder)/Электротехника (folder)/Цифровая техника (folder)/Расходные материалы для цифровой техники (folder)/Картридж для принтера	179421	BROTHER
722934	4977766666961	Картридж лазерный brother (tn230y) dcp-9010cn/mfc-9120cn и другие, желтый, ориг., ресурс 1400 стр.	230307	Техника (folder)/Электротехника (folder)/Цифровая техника (folder)/Расходные материалы для цифровой техники (folder)/Картридж для принтера	179421	BROTHER
3336791	4977766739009	Картридж лазерный brother (tn2335) hl-l2300dr/l2340dwr/dcp-l2500 dr.и др, ориг. ресурс 1200 стр.	230307	Техника (folder)/Электротехника (folder)/Цифровая техника (folder)/Расходные материалы для цифровой техники (folder)/Картридж для принтера	179421	BROTHER
5388276	4630061446132	Картридж лазерный cactus cs-054 h голубой 2300стр для canon lbp 621cw/623cdw/641cw/643cdw cs-c054hc	230307	Техника (folder)/Электротехника (folder)/Цифровая техника (folder)/Расходные материалы для цифровой техники (folder)/Картридж для принтера	2729362	Cactus
5390706	4630061446095	Картридж лазерный cactus cs-054 h желтый 2300стр для canon lbp 621cw/623cdw/641cw/643cdw cs-c054hy	5192970	картриджи и тонеры совместимые	2729362	Cactus
5390707	4630061446118	Картридж лазерный cactus cs-054 h пурпурный 2300стр для canon lbp 621cw/623cdw/641cw/643cdw cs-c054hm	5192970	картриджи и тонеры совместимые	2729362	Cactus
5390708	4630061446156	Картридж лазерный cactus cs-054 черный 3100стр для canon lbp 621cw/ 623cdw/641cw/643cdw cs-c054hbk	5192970	картриджи и тонеры совместимые	2729362	Cactus
5388277	4610026049141	Картридж лазерный cactus cs-725 черный 3000стр для canon lbp 6000/6020/6030b i-sensys cs-c725x-mps	230307	Техника (folder)/Электротехника (folder)/Цифровая техника (folder)/Расходные материалы для цифровой техники (folder)/Картридж для принтера	2729362	Cactus
5390709	4630088985409	Картридж лазерный cactus cs-ce278x-mps черный 3000стр для hp laserjet p1566/p1606w	5192970	картриджи и тонеры совместимые	2729362	Cactus
5390710	4610026049127	Картридж лазерный cactus cs-ce285x черный 3000стр для hp laserjet m1130 mfp/ m1132mfp Pro/p1102s pr cs-ce285x-mps	5192970	картриджи и тонеры совместимые	2729362	Cactus
5390711	4610026047260	Картридж лазерный cactus cs-cf244x черный 2000стр для hp laserjet m15 Pro/m15a Pro/m28a Pro mfp/m28w pr	5192970	картриджи и тонеры совместимые	2729362	Cactus
5390712	4630061444022	Картридж лазерный cactus cs-cf259x черный 10000стр для hp laserjet m304/m404/mfp m428	5192970	картриджи и тонеры совместимые	2729362	Cactus
5390713	4610026049110	Картридж лазерный cactus cs-q2612x черный 3000стр для hp laserjet 1010/1012/1015/1018/1020 cs-q2612x-mps	5192970	картриджи и тонеры совместимые	2729362	Cactus
5390714	4630088984259	Картридж лазерный cactus cs-tn217c голубой 2300стр для brother hl3230 / dcp3550 / mfc3770	5254478	Расходные материалы	2729362	Cactus
5390715	4630088984266	Картридж лазерный cactus cs-tn217y желтый 2300стр для brother hl3230 / dcp3550 / mfc3770	5254478	Расходные материалы	2729362	Cactus
5390716	4630088984310	Картридж лазерный cactus cs-tn321c голубой 1500стр для brother hl-l8250cdn / mfc-l8650cdw	5254478	Расходные материалы	2729362	Cactus
5390717	4630088984303	Картридж лазерный cactus cs-tn321m пурпурный 1500стр для brother hl-l8250cdn / mfc-l8650cdw	5254478	Расходные материалы	2729362	Cactus
5390718	4630088984297	Картридж лазерный cactus cs-tn321y желтый 1500стр для brother hl-l8250cdn / mfc-l8650cdw	5254478	Расходные материалы	2729362	Cactus
5390719	4670089301129	Картридж лазерный cactus cs-tn421c голубой 1800стр для brother hl-l8260cdw / hl-l8360cdw / dcp-l8410cdw / mfc-l8690	5254478	Расходные материалы	2729362	Cactus
5390720	4670089301136	Картридж лазерный cactus cs-tn421m пурпурный 1800стр для brother hl-l8260cdw / hl-l8360cdw / dcp-l8410cdw / mfc-l86	5254478	Расходные материалы	2729362	Cactus
5387085	4670089301143	Картридж лазерный cactus cs-tn421y желтый 1800стр для brother hl-l8260cdw / hl-l8360cdw / dcp-l8410cdw / mfc-l8690c	230307	Техника (folder)/Электротехника (folder)/Цифровая техника (folder)/Расходные материалы для цифровой техники (folder)/Картридж для принтера	2729362	Cactus
5390721	4670089301167	Картридж лазерный cactus cs-tn910c голубой 9000стр для brother hl-l9310cdw / brother mfc-l9570cdw	5254478	Расходные материалы	2729362	Cactus
5390722	4670089301174	Картридж лазерный cactus cs-tn910m пурпурный 9000стр для brother hl-l9310cdw / brother mfc-l9570cdw	5254478	Расходные материалы	2729362	Cactus
5390723	4670089301181	Картридж лазерный cactus cs-tn910y желтый 9000стр для brother hl-l9310cdw / brother mfc-l9570cdw	5254478	Расходные материалы	2729362	Cactus
5390725	4630088984464	Картридж лазерный cactus cs-w1106-mps черный 2000стр для hp laser 107a/107r/107w/135a mfp/135r mf	5192970	картриджи и тонеры совместимые	2729362	Cactus
5390724	4630088981449	Картридж лазерный cactus cs-w1106a черный 1000стр для hp laser 107a/107r/107w/135a mfp/135r mfp/135w mfp/137fnw mfp	5192970	картриджи и тонеры совместимые	2729362	Cactus
1670922	4620747110549	Картридж лазерный canon (703) lbp-2900/3000, ресурс 2000 стр. nv print совместимый	230307	Техника (folder)/Электротехника (folder)/Цифровая техника (folder)/Расходные материалы для цифровой техники (folder)/Картридж для принтера	1670917	NV PRINT
1962413	4960999403717	Картридж лазерный canon (711y) lbp5300/5360/mf9130/9170, желтый, ориг., ресурс 6000 стр.	1	Неклассифицированные/default	177631	CANON
722939	4960999417646	Картридж лазерный canon (712) lbp-3010/3100 и др., ориг., ресурс 1500 стр.	230307	Техника (folder)/Электротехника (folder)/Цифровая техника (folder)/Расходные материалы для цифровой техники (folder)/Картридж для принтера	177631	CANON
3336793	4690207251891	Картридж лазерный canon (712) lbp-3010/3100, ресурс 1500 стр. cactus совместимый	230307	Техника (folder)/Электротехника (folder)/Цифровая техника (folder)/Расходные материалы для цифровой техники (folder)/Картридж для принтера	2729362	Cactus
1670923	4620747111119	Картридж лазерный canon (712) lbp-3010/3100, ресурс 1500 стр. nv print совместимый	230307	Техника (folder)/Электротехника (folder)/Цифровая техника (folder)/Расходные материалы для цифровой техники (folder)/Картридж для принтера	1670917	NV PRINT
722940	4960999417660	Картридж лазерный canon (713) lbp-3250, черный ориг ресурс 2000стр	230307	Техника (folder)/Электротехника (folder)/Цифровая техника (folder)/Расходные материалы для цифровой техники (folder)/Картридж для принтера	177631	CANON
722941	4960999351636	Картридж лазерный canon (714) l3000/3000ip, черный ориг ресурс 4500стр	230307	Техника (folder)/Электротехника (folder)/Цифровая техника (folder)/Расходные материалы для цифровой техники (folder)/Картридж для принтера	177631	CANON
470064	4960999628639	Картридж лазерный canon (718bk) lbp7200cdn/mf8330cdn/mf8350cdn, черный, ориг., ресурс 3400 стр.	230307	Техника (folder)/Электротехника (folder)/Цифровая техника (folder)/Расходные материалы для цифровой техники (folder)/Картридж для принтера	177631	CANON
722946	4960999628608	Картридж лазерный canon (718c) lbp7200cdn/mf8330cdn/mf8350cdn, голубой, ориг., ресурс 2900 стр.	230307	Техника (folder)/Электротехника (folder)/Цифровая техника (folder)/Расходные материалы для цифровой техники (folder)/Картридж для принтера	177631	CANON
722947	4960999628578	Картридж лазерный canon (718m) lbp7200cdn/mf8330cdn/mf8350cdn, пурпурный, ориг., ресурс 2900 стр.	230307	Техника (folder)/Электротехника (folder)/Цифровая техника (folder)/Расходные материалы для цифровой техники (folder)/Картридж для принтера	177631	CANON
722948	4960999628547	Картридж лазерный canon (718y) lbp7200cdn/mf8330cdn/mf8350cdn, желтый, ориг., ресурс 2900 стр.	230307	Техника (folder)/Электротехника (folder)/Цифровая техника (folder)/Расходные материалы для цифровой техники (folder)/Картридж для принтера	177631	CANON
3336794	4690207148191	Картридж лазерный canon (719) lbp6300dn/6650dn/mf5840dn/5880dn черный рес 2100стр cactus совместимый	230307	Техника (folder)/Электротехника (folder)/Цифровая техника (folder)/Расходные материалы для цифровой техники (folder)/Картридж для принтера	2729362	Cactus
722949	4960999650289	Картридж лазерный canon (719) lbp6300dn/lbp6650dn/mf5840dn/mf5880dn, черный, ориг., ресурс 2100 стр.	230307	Техника (folder)/Электротехника (folder)/Цифровая техника (folder)/Расходные материалы для цифровой техники (folder)/Картридж для принтера	177631	CANON
1670924	4620747111997	Картридж лазерный canon (725) lbp6000, ресурс 1600 стр. nv print совместимый	230307	Техника (folder)/Электротехника (folder)/Цифровая техника (folder)/Расходные материалы для цифровой техники (folder)/Картридж для принтера	1670917	NV PRINT
2729398	4960999684321	Картридж лазерный canon (729c) lbp7010c/7018c голубой ориг. ресурс 1000 стр.	230307	Техника (folder)/Электротехника (folder)/Цифровая техника (folder)/Расходные материалы для цифровой техники (folder)/Картридж для принтера	177631	CANON
2729401	4960999904733	Картридж лазерный canon (731c) lbp7100/7110/mf8230/8280 голубой ориг. ресурс 1500 стр.	230307	Техника (folder)/Электротехника (folder)/Цифровая техника (folder)/Расходные материалы для цифровой техники (folder)/Картридж для принтера	177631	CANON
2729403	4960999904702	Картридж лазерный canon (731m) lbp7100/7110/mf8230/8280 пурпурный ориг. ресурс 1500 стр.	230307	Техника (folder)/Электротехника (folder)/Цифровая техника (folder)/Расходные материалы для цифровой техники (folder)/Картридж для принтера	177631	CANON
2729404	4960999904665	Картридж лазерный canon (731y) lbp7100/7110/mf8230/8280 желтый ориг. ресурс 1500 стр.	230307	Техника (folder)/Электротехника (folder)/Цифровая техника (folder)/Расходные материалы для цифровой техники (folder)/Картридж для принтера	177631	CANON
3336797	4690207266529	Картридж лазерный canon (737) mf211/212w/216n/217w/226dn/229dw ресурс 2400 стр cactus совместимый	230307	Техника (folder)/Электротехника (folder)/Цифровая техника (folder)/Расходные материалы для цифровой техники (folder)/Картридж для принтера	2729362	Cactus
2440573	4549292017052	Картридж лазерный canon (737) mf211/212w/216n/217w/226dn/229dw, ориг. ресурс 2400 стр.	230307	Техника (folder)/Электротехника (folder)/Цифровая техника (folder)/Расходные материалы для цифровой техники (folder)/Картридж для принтера	177631	CANON
177117	4960999820033	Картридж лазерный canon (e-16) fc-108/128/pc750/880 и другие, ориг., ресурс 2000 стр.	230307	Техника (folder)/Электротехника (folder)/Цифровая техника (folder)/Расходные материалы для цифровой техники (folder)/Картридж для принтера	177631	CANON
