ID	UPCEAN	Name	CategoryID	CategoryName	BrandID	BrandName
597323	5000159378680	Galaxy minstrels vending 1.2kg	1	Неклассифицированные/default	369911	GALAXY
1474522	5000159390699	Galaxy mistletoe kisses	883240	Продукты питания (folder)/Кондитерские изделия (folder)/Confectionery	369911	GALAXY
597324	5000159394031	Galaxy mistletoe kisses hod 6x24 s	1	Неклассифицированные/default	369911	GALAXY
4376457	743999103153	Galaxy multi-pack	1	Неклассифицированные/default	0	
4376458	678258345671	Galaxy not sweet vanilla mnch 16oz	1	Неклассифицированные/default	0	
1474527	077172641553	Galaxy nutritional food's process Cheese Food alternative - swiss flavor	1	Неклассифицированные/default	0	
1376245	077172641423	Galaxy nutritional Foods american flavor Rice slices	1	Неклассифицированные/default	0	
1474523	077172667539	Galaxy nutritional Foods cheddar Cheese with jalapenos soy base (filtered Water isolated soy protein, soy solids), casein (add	1	Неклассифицированные/default	2592047	Go Veggie!
1474524	077172641409	Galaxy nutritional Foods mozzarella flavor Rice slices Rice Beverage (filtered Water brown Rice maltodextrin and protein), cas	1	Неклассифицированные/default	0	
1474526	077172667188	Galaxy nutritional Foods pepper Jack flavor veggie slices	1	Неклассифицированные/default	2592047	Go Veggie!
597331	077172641492	Galaxy nutritional Foods Rice grated topping - parmesan flavor casein (adds a trivial amount of cholesterol and lactose.) (a dr	1	Неклассифицированные/default	369911	GALAXY
597283	077172667706	Galaxy nutritional Foods veggie shreds mozzarella Cheese	1	Неклассифицированные/default	369911	GALAXY
1483062	077172641232	Galaxy nutritional Foods veggy grated topping - parmesan flavor casein (a dried skim Milk protein), soy base (filtered Water s	1	Неклассифицированные/default	0	
4376459	743999137806	Galaxy of games - 1001 exciting games	1	Неклассифицированные/default	0	
4376460	743999016002	Galaxy of games CD-rom	1	Неклассифицированные/default	0	
4376461	743999121102	Galaxy of games Gold edition-pc Game CD	1	Неклассифицированные/default	0	
4376462	743999009653	Galaxy of games mahjongg	1	Неклассифицированные/default	0	
4376463	743999100350	Galaxy of games Red edition Game CD	1	Неклассифицированные/default	0	
4376464	743999009707	Galaxy of games tetrimania	1	Неклассифицированные/default	0	
4376465	743999009905	Galaxy of games: solitaire card games (CD-rom)	1	Неклассифицированные/default	0	
4376466	743999011106	Galaxy of games: win 95 games	1	Неклассифицированные/default	0	
4376467	011111915909	Galaxy of mahjongg 1ct	1	Неклассифицированные/default	0	
4376468	787364643691	Galaxy of terror 4movie set (DVD) (4movies on 2 discs)	1	Неклассифицированные/default	0	
4376469	011111100404	Galaxy of win games 1ct	1	Неклассифицированные/default	0	
2799665	752830314054	Galaxy onesie ipa metal 16floz	1	Неклассифицированные/default	0	
597326	5900951135743	Galaxy Orange&s/cake 120g	1	Неклассифицированные/default	369911	GALAXY
2587691	041165235456	Galaxy plastic cup 15/100 15ct 10oz	1	Неклассифицированные/default	0	
2587692	041165001860	Galaxy plastic cup 20/40 cs20 20oz	1	Неклассифицированные/default	0	
2587693	041165001792	Galaxy plastic cup 20/50 cs20 12oz	1	Неклассифицированные/default	2310531	DART CONTAINER
2587694	041165001808	Galaxy plastic cup 20/50 cs20 14oz	1	Неклассифицированные/default	0	
369942	4800574043788	Galaxy plastic spoon/fork 12's	337189	Продукты питания (folder)/Кондитерские изделия (folder)/Biscuits & Confectionary	369911	GALAXY
369943	4800574043528	Galaxy plastic spoon/fork 25's	337189	Продукты питания (folder)/Кондитерские изделия (folder)/Biscuits & Confectionary	369911	GALAXY
4376470	5900951017841	Galaxy promises caramel (chocolate) 100g	1	Неклассифицированные/default	0	
4376471	5900951017865	Galaxy promises cocoa crisp (chocolate) 100g	1	Неклассифицированные/default	0	
4376472	5900951017872	Galaxy promises coffee (chocolate) 100g	1	Неклассифицированные/default	0	
4376473	5900951017858	Galaxy promises roast hazelnut (chocolate) 100g	1	Неклассифицированные/default	0	
597327	5900951025488	Galaxy r/car hazelnut pm99 120g	1	Неклассифицированные/default	369911	GALAXY
190250	5900951024269	Galaxy r/caramelised hazel 47g	22145	Продукты питания (folder)/Кондитерские изделия (folder)/Конфеты	369911	GALAXY
4376474	704400058608	Galaxy railways Box set (DVD)	1	Неклассифицированные/default	0	
4376475	704400058523	Galaxy railways v01 (DVD)	1	Неклассифицированные/default	0	
4376476	704400058547	Galaxy railways v02-his fathers son (DVD)	1	Неклассифицированные/default	0	
4376477	704400058561	Galaxy railways v03-vastness within (DVD)	1	Неклассифицированные/default	0	
4376478	704400058585	Galaxy railways v04-leaps of faith (DVD)	1	Неклассифицированные/default	0	
4376479	704400058622	Galaxy railways v05-manabus decision (DVD)	1	Неклассифицированные/default	0	
4376480	704400058646	Galaxy railways v06-eternal hope (DVD)	1	Неклассифицированные/default	0	
4376481	704400058509	Galaxy railways-ss (DVD)	1	Неклассифицированные/default	0	
4376482	704400058615	Galaxy railways-viridian collection Box set (DVD)	1	Неклассифицированные/default	0	
369944	5900951024283	Galaxy raisin almond hazelnut 120g	337189	Продукты питания (folder)/Кондитерские изделия (folder)/Biscuits & Confectionary	369911	GALAXY
190260	5900951024948	Galaxy raisin almond&hazel 47g	22145	Продукты питания (folder)/Кондитерские изделия (folder)/Конфеты	369911	GALAXY
1474531	5900951027765	Galaxy raisin&nut 120g	883240	Продукты питания (folder)/Кондитерские изделия (folder)/Confectionery	0	
597329	077172641768	Galaxy Rice Cheese Black cheddar 8oz	1	Неклассифицированные/default	369911	GALAXY
597330	077172641775	Galaxy Rice Cheese Black mozzarella 8oz	1	Неклассифицированные/default	369911	GALAXY
369945	5000159394499	Galaxy ripple 4 pack 132g	337189	Продукты питания (folder)/Кондитерские изделия (folder)/Biscuits & Confectionary	369911	GALAXY
2587697	5060122037730	Galaxy ripple pieces Hot chocolate drink 140g	334545	Продукты питания (folder)/Hot Drinks	369911	GALAXY
2587698	5060122037747	Galaxy ripple pieces Hot chocolate drink 140g #2	334545	Продукты питания (folder)/Hot Drinks	369911	GALAXY
190261	5000159022521	Galaxy ripple single bar 33g	1	Неклассифицированные/default	369911	GALAXY
190262	5000159219051	Galaxy ripple single chocolate 4/36/33g bar	1	Неклассифицированные/default	369911	GALAXY
369947	5000159356664	Galaxy ripple snacksize 10 pack 170g	337189	Продукты питания (folder)/Кондитерские изделия (folder)/Biscuits & Confectionary	369911	GALAXY
190248	5900951024252	Galaxy roasted&caramelisted hazelnuts bar 120g	22145	Продукты питания (folder)/Кондитерские изделия (folder)/Конфеты	369911	GALAXY
369931	5900951027024	Galaxy roasted&caramelisted hazelnuts bar 45g	337189	Продукты питания (folder)/Кондитерские изделия (folder)/Biscuits & Confectionary	369911	GALAXY
2587699	5900951255656	Galaxy salted caramel 135g	2514427	Продукты питания (folder)/Кондитерские изделия (folder)/Confec Chocolate	369911	GALAXY
2587700	5900951255663	Galaxy salted caramel 135g #2	2514427	Продукты питания (folder)/Кондитерские изделия (folder)/Confec Chocolate	369911	GALAXY
2587701	5900951255687	Galaxy salted caramel 135g #3	336091	Продукты питания (folder)/Sweets and Deserts	0	
2587702	5900951255632	Galaxy salted caramel 48g	2514427	Продукты питания (folder)/Кондитерские изделия (folder)/Confec Chocolate	369911	GALAXY
2587703	5900951255649	Galaxy salted caramel 48g #2	2514427	Продукты питания (folder)/Кондитерские изделия (folder)/Confec Chocolate	369911	GALAXY
4376483	077172450179	Galaxy sandwich slices 10.23oz	1	Неклассифицированные/default	0	
4376484	077172667393	Galaxy sl american fat free 8oz	1	Неклассифицированные/default	0	
4376485	097138635174	Galaxy slime	1	Неклассифицированные/default	0	
190241	5000159392686	Galaxy smooth Dark 125g	22145	Продукты питания (folder)/Кондитерские изделия (folder)/Конфеты	369911	GALAXY
2587704	722868814642	Galaxy tab micro cla 2.1a	1	Неклассифицированные/default	0	
2587705	8713439177626	Galaxy tab screen protector	1	Неклассифицированные/default	0	
597342	5060122033114	Galaxy thick shake 400ml	1	Неклассифицированные/default	369911	GALAXY
1474534	9021750000004	Galaxy thick shake 400ml #2	330591	Продукты питания (folder)/Продукты питания	369911	GALAXY
369948	5060122031479	Galaxy thick shake 440ml	337189	Продукты питания (folder)/Кондитерские изделия (folder)/Biscuits & Confectionary	369911	GALAXY
190263	5060122030137	Galaxy thick shake 475ml	17371	Продукты питания (folder)/Напитки безалкогольные/Напитки	0	
4376486	5000159370172	Galaxy twin pack (2x 150g)	1	Неклассифицированные/default	0	
369950	5060122032810	Galaxy Ultra smooth Hot chocolate 150ml	337189	Продукты питания (folder)/Кондитерские изделия (folder)/Biscuits & Confectionary	369911	GALAXY
190265	5000159303408	Galaxy vanilla / chocolate Ice Cream cone 20/76g cone	30752	Продукты питания (folder)/Мороженое	369911	GALAXY
4376487	678258123453	Galaxy vanilla almond munch 16oz	1	Неклассифицированные/default	0	
597343	6294001807384	Galaxy vanilla cake 30g	1	Неклассифицированные/default	369911	GALAXY
597344	6294001807414	Galaxy vanilla cake 5x 30g	77	Продукты питания (folder)/Кондитерские изделия (folder)/Кондитерские изделия	369911	GALAXY
3029505	077172667577	Galaxy veggie grd Cream Cheese 8oz	330591	Продукты питания (folder)/Продукты питания	0	
4376488	077172667324	Galaxy veggie Milk Original * 32oz	1	Неклассифицированные/default	0	
1474535	077172667287	Galaxy veggie veggie sour Cream	1	Неклассифицированные/default	0	
2002803	716770014191	Galaxy vibe jupiter (d)	363351	Adult/Sex-Shop	0	
2002805	716770014207	Galaxy vibe saturn (d)	363351	Adult/Sex-Shop	0	
2002804	716770014214	Galaxy vibe uranus (d)	363351	Adult/Sex-Shop	0	
2086517	5391519009055	Galaxy warrior robot (ty00905)	1	Неклассифицированные/default	0	
2587706	5391511539765	Galaxy wars breast plate armour ty53976	146199	Игрушки (folder)/Игрушечное оружие	0	
2587707	5391511539727	Galaxy wars face mask (ty53972)	146199	Игрушки (folder)/Игрушечное оружие	0	
2587709	5391511539680	Galaxy wars fighter figure (ty53968)	1364437	Игрушки (folder)/Фигурки, роботы, животные	0	
2587710	5391511539673	Galaxy wars figure (ty53967)	1364437	Игрушки (folder)/Фигурки, роботы, животные	0	
2587711	5391511539741	Galaxy wars laser sabre (ty53974)	146199	Игрушки (folder)/Игрушечное оружие	0	
2587712	5391511539734	Galaxy wars laser Sword (ty53973)	146199	Игрушки (folder)/Игрушечное оружие	0	
2587713	5391511540754	Galaxy wars money tin (fg54075)	476373	Сувениры и подарки (folder)/Копилка	0	
2587714	5391511539697	Galaxy wars space gun 12inch (ty53969	146199	Игрушки (folder)/Игрушечное оружие	0	
2587715	5391511539703	Galaxy wars space gun 8.5 in (ty53970)	146199	Игрушки (folder)/Игрушечное оружие	0	
2587716	5391511539710	Galaxy wars space gun&mask ty53971	146199	Игрушки (folder)/Игрушечное оружие	0	
2587717	5391511539772	Galaxy wars space gun&mask ty53977	146199	Игрушки (folder)/Игрушечное оружие	0	
2587718	5391511539789	Galaxy wars space mask (ty53978)	980	Игрушки (folder)/Игрушка	0	
2587719	5391511540143	Galaxy wars Water gun (ty54014)	278582	Спорт и отдых (folder)/Спорт и отдых	0	
2587720	5391511539758	Galaxy wars weapon set (ty53975)	146199	Игрушки (folder)/Игрушечное оружие	0	
1474536	086891082141	Galaxy White Wine Blend glass 750ml	22133	Продукты питания (folder)/Алкогольные напитки/Вино (folder)/Вино	0	
4376489	077172667959	Galaxy Wild string Cheese 8oz	1	Неклассифицированные/default	0	
4913174	849037000160	Galaxy wireless Black micro USB car charger	1	Неклассифицированные/default	0	
597346	5060122031417	Galaxy with real chocolate 388ml	1	Неклассифицированные/default	369911	GALAXY
5161109	4680005041695	Galaxy виват 3 красный	5161108	Спорт и отдых (folder)/Велосипед (folder)/Велосипед детский	369911	GALAXY
1474484	5900951139246	Galaxy, caramel collection Milk chocolate, caramel	883240	Продукты питания (folder)/Кондитерские изделия (folder)/Confectionery	369911	GALAXY
2587721	4000870097168	Galaxy-set 60 chrom	1	Неклассифицированные/default	2513071	Paulmann
2086518	8000430133257	Galbani	1	Неклассифицированные/default	124948	Galbani
2086519	8000430135060	Galbani #2	1	Неклассифицированные/default	124948	Galbani
2086520	8000430392661	Galbani #3	1	Неклассифицированные/default	124948	Galbani
2086521	8000430900231	Galbani #4	1	Неклассифицированные/default	124948	Galbani
2587722	738824818456	Galbani Cheese slc mozzarella	1	Неклассифицированные/default	124948	Galbani
2587723	738824910860	Galbani Cheese wdg grana panado	1	Неклассифицированные/default	124948	Galbani
2587724	738824910891	Galbani Cheese wdg parm reggiano	1	Неклассифицированные/default	124948	Galbani
1612099	074030081827	Galbani Fresh mozzarella Cheese	1	Неклассифицированные/default	2203140	SORRENTO
3115428	074030814388	Galbani Fresh mozzarella Cheese #2	330591	Продукты питания (folder)/Продукты питания	124948	Galbani
2587725	074030000552	Galbani low moisture part skim mozzarella Cheese	142810	Продукты питания (folder)/Молочные продукты (folder)/Сыр	124948	Galbani
1612124	074030066107	Galbani low moisture part skim mozzarella string Cheese	1	Неклассифицированные/default	2203140	SORRENTO
1474537	837659000163	Galbani mascarpone Cheese	1	Неклассифицированные/default	124948	Galbani
2260662	4607022661590	Galbani mozz. 20 Mini mozzarella y che.bl. p s 0.15kg	2238224	Продукты питания (folder)/Молочные продукты (folder)/Сыр свежий	836385	Гальбани
1317206	4607022661422	Galbani mozzar.affumicata burrata burrata mozzarella y che.bl. p ve 0.2kg	142810	Продукты питания (folder)/Молочные продукты (folder)/Сыр	836385	Гальбани
2587726	074030001306	Galbani mozzarella Cheese 32oz	142810	Продукты питания (folder)/Молочные продукты (folder)/Сыр	124948	Galbani
2587727	738824064266	Galbani mozzarella fresca Cheese mozzarella Fresh #2	1	Неклассифицированные/default	124948	Galbani
1545127	738824064112	Galbani mozzarella fresca, Fresh mozzarella Natural Cheese	1	Неклассифицированные/default	124948	Galbani
1470232	738824026622	Galbani mozzarella fresca, marinated all Natural Cheese	1	Неклассифицированные/default	124948	Galbani
1612104	074030000040	Galbani part skim mozzarella Cheese	1	Неклассифицированные/default	2203140	SORRENTO
4376490	074550000575	Galbani precious mozz reduce fat 16oz	1	Неклассифицированные/default	124948	Galbani
2822094	074550001039	Galbani precious mozz whl Milk 80oz	1	Неклассифицированные/default	124948	Galbani
1578482	074550000148	Galbani precious mozzarella brick 32oz	1	Неклассифицированные/default	124948	Galbani
1578484	074550000032	Galbani precious mozzarella chs ball 12oz	1	Неклассифицированные/default	124948	Galbani
2822093	074550002036	Galbani precious mozzarella loaf p/s 80oz	1	Неклассифицированные/default	124948	Galbani
2822088	074550069336	Galbani precious pepper Jack stk Cheese 12oz	1	Неклассифицированные/default	124948	Galbani
1578497	074550000087	Galbani precious ricota Cheese 15floz	1	Неклассифицированные/default	124948	Galbani
4376491	074550069343	Galbani precious shapesters, dinosau 9oz	1	Неклассифицированные/default	124948	Galbani
4376492	074550069381	Galbani precious shapesters, sea 9oz	1	Неклассифицированные/default	124948	Galbani
2822096	074550161238	Galbani precious shred cheddar/Jack - 80oz	1	Неклассифицированные/default	124948	Galbani
2835921	074550160330	Galbani precious shredded mozzarella 80oz	1	Неклассифицированные/default	124948	Galbani
199177	074550065413	Galbani precious strg Cheese 16oz	142810	Продукты питания (folder)/Молочные продукты (folder)/Сыр	124948	Galbani
4376493	074550066113	Galbani precious string Cheese mx pk 36oz	1	Неклассифицированные/default	124948	Galbani
1578502	074550065406	Galbani precious string Cheese trivia/riddles 24oz	1	Неклассифицированные/default	124948	Galbani
4376494	074550000117	Galbani precious whl Milk ricotta 32oz	1	Неклассифицированные/default	124948	Galbani
2187401	074550000100	Galbani precious whole Milk ricotta Cheese	1	Неклассифицированные/default	2187398	PRECIOUS
2187400	074550818248	Galbani precious, all Natural sliced Fresh mozzarella Cheese	1	Неклассифицированные/default	2187398	PRECIOUS
1578477	074550081833	Galbani precious, Fresh mozzarella Cheese	1	Неклассифицированные/default	124948	Galbani
1578485	074550000056	Galbani precious, part skim mozzarella Cheese	1	Неклассифицированные/default	124948	Galbani
2587729	074030005779	Galbani precious, reduced fat mozzarella Cheese	142810	Продукты питания (folder)/Молочные продукты (folder)/Сыр	124948	Galbani
1578498	074550000124	Galbani precious, ricotta Cheese, part skim	1	Неклассифицированные/default	124948	Galbani
1578481	074550102460	Galbani preciuos low fat ricotta Cheese	1	Неклассифицированные/default	124948	Galbani
3115429	074030642509	Galbani snack Cheese, mozzarella&parmesan	330591	Продукты питания (folder)/Продукты питания	124948	Galbani
1612123	074030066091	Galbani string Cheese, low moisture part skim mozzarella Cheese	1	Неклассифицированные/default	124948	Galbani
2587728	074030000651	Galbani whole Milk low moisture mozzarella Cheese	142810	Продукты питания (folder)/Молочные продукты (folder)/Сыр	124948	Galbani
3662706	8000430125030	Galbani моцарелла том/тр.рис.пан 2x 90g	2260623	Продукты питания (folder)/Молочные продукты (folder)/Сыр рассольный	124948	Galbani
2326015	6421830004299	Galbenele 40cps favisan	1	Неклассифицированные/default	0	
190292	5350080999912	Galbest c'tail onions Red/yell	1	Неклассифицированные/default	0	
190289	5350080999905	Galbest capers 156g	1	Неклассифицированные/default	0	
190290	5350080999950	Galbest capers in vinegar 314g	1	Неклассифицированные/default	0	
190291	8001123040005	Galbest caponata 400g	1	Неклассифицированные/default	0	
3115430	852665394174	Galbi sauce&marinade for beef	330591	Продукты питания (folder)/Продукты питания	0	
4816227	035255588874	Galblk gjo58887 binpush12	4806277	Хозяйственные товары (folder)/Breakroom & Cleaning Supplies	4806355	S.P.RICHARDS
4376495	773803701015	Galbocca ir5 soaker Bath tub	1	Неклассифицированные/default	0	
190293	8002190001852	Galbusera biscuits leg Plus 27	1	Неклассифицированные/default	0	
190294	8002190001517	Galbusera buonicosi 330g	1	Неклассифицированные/default	0	
190295	8002190001692	Galbusera buonicosi+nocc 150g	1	Неклассифицированные/default	0	
190296	8002190002613	Galbusera crackers zero sale 3	316470	Продукты питания (folder)/Крекер	0	
190297	8002190002378	Galbusera magretti 380g	1	Неклассифицированные/default	0	
190298	8002190002545	Galbusera mais crackers 400g	316470	Продукты питания (folder)/Крекер	0	
190299	8002190001616	Galbusera meglio cosi 330g	1	Неклассифицированные/default	0	
190300	8002190002361	Galbusera oliva crackers 400g	316470	Продукты питания (folder)/Крекер	0	
190301	8002190001449	Galbusera piu leggeri 350g	1	Неклассифицированные/default	0	
190302	80436782	Galbusera tra crackers x 25g	316470	Продукты питания (folder)/Крекер	0	
190303	8002190003313	Galbusera wafercosi nocciola 1	1	Неклассифицированные/default	0	
190304	8002190001715	Galbusera zero gi 160g	1	Неклассифицированные/default	0	
4376496	601299094178	Galco gunleather s3h shoulder holster component. right handed, tan.	1	Неклассифицированные/default	0	
997967	5011309870213	Galcodine linctus 87025 2l	1	Неклассифицированные/default	0	
997968	5011309870312	Galcodine linctus paed 87033 2l	1	Неклассифицированные/default	0	
597347	3499320000383	Galder diferine Gel 30gms	1	Неклассифицированные/default	0	
2972709	3499320003551	Galder diferine Gel 30gms #2	1	Неклассифицированные/default	0	
597348	32972368	Galder hydracort Cream 30	1	Неклассифицированные/default	0	
597349	33366920	Galder rozex Gel 30gms	1	Неклассифицированные/default	0	
597350	5020465000303	Galder tetralysal caps x 28	1	Неклассифицированные/default	0	
4376497	659819104166	Gale Force mens room ii	1	Неклассифицированные/default	0	
4913175	603531281049	Gale hayman delicious all american Apple 240ml Body Mist (l)	1	Неклассифицированные/default	0	
2326016	8595665022198	Gale hayman delicious cotton candy Body Lotion femme 100ml	486634	Косметика (folder)/Лосьон для тела	962587	GALE HAYMAN
2326017	8595664922185	Gale hayman delicious cotton candy Shower Gel femme 100ml	401	Гигиена (folder)/Гель для душа	962587	GALE HAYMAN
597356	011873000127	Gale's root beer	17371	Продукты питания (folder)/Напитки безалкогольные/Напитки	2587768	Gale's
597351	8002410050332	Galeffi effervescente	1	Неклассифицированные/default	0	
997969	5016298912777	Galenamox caps 500mg 21	1	Неклассифицированные/default	0	
997970	5016298321838	Galenamox susp 125mg 100ml	1	Неклассифицированные/default	0	
3662708	3282771071527	Galenic c d 0.2l tu	337447	Гигиена (folder)/Товары для душа и ванны	3662707	GALENIC (PIERRE FABRE/FRANCE)
369953	3282779010344	Galenic арган Крем интенс омолаж 40ml	5586	Косметика (folder)/Косметика	369952	Galenic
369954	3282779037259	Galenic арган Крем ночной 30ml	5586	Косметика (folder)/Косметика	369952	Galenic
369955	3282779024327	Galenic арган Крем от морщин для конт губ 15ml	5586	Косметика (folder)/Косметика	369952	Galenic
369956	3282779010368	Galenic арган маска восстанавл 40ml	5586	Косметика (folder)/Косметика	369952	Galenic
369957	3282771070568	Galenic арган эмульсия от морщин 40ml	5586	Косметика (folder)/Косметика	369952	Galenic
