ID	UPCEAN	Name	CategoryID	CategoryName	BrandID	BrandName
2474163	9785378012169	Проф-пресс картонка. репка (кошка и собака) карт обложка	205408	Полиграфия (folder)/Книги	331248	Проф-Пресс
2255993	9785378030071	Проф-пресс картонка. репка.	36536	Полиграфия (folder)/Печатная продукция	331248	Проф-Пресс
728096	9785378017119	Проф-пресс картонка. репка. курочка ряба карт обложка	36536	Полиграфия (folder)/Печатная продукция	331248	Проф-Пресс
1225613	9785378008797	Проф-пресс картонка. рикки-тикки-тави карт обложка	36536	Полиграфия (folder)/Печатная продукция	331248	Проф-Пресс
2749350	9785378017287	Проф-пресс картонка. серенький козлик (желтая)	1	Неклассифицированные/default	331248	Проф-Пресс
2234801	9785378015375	Проф-пресс картонка. серенький козлик (красный уголок) карт обложка	36536	Полиграфия (folder)/Печатная продукция	331248	Проф-Пресс
2749351	9785378010080	Проф-пресс картонка. серенький козлик (синяя)	1	Неклассифицированные/default	331248	Проф-Пресс
66799	9785378012213	Проф-пресс картонка. сказка о рыбаке и рыбке карт обложка	36536	Полиграфия (folder)/Печатная продукция	331248	Проф-Пресс
2234802	9785378024575	Проф-пресс картонка. сказочная азбука	36536	Полиграфия (folder)/Печатная продукция	331248	Проф-Пресс
2749352	9785378024582	Проф-пресс картонка. скороговорки	1	Неклассифицированные/default	331248	Проф-Пресс
2234804	9785378007936	Проф-пресс картонка. скорый поезд карт обложка	36536	Полиграфия (folder)/Печатная продукция	331248	Проф-Пресс
804277	9785378011100	Проф-пресс картонка. снеговик и его друзья	1	Неклассифицированные/default	331248	Проф-Пресс
2749353	9785378011056	Проф-пресс картонка. снегурочкины загадки	1	Неклассифицированные/default	331248	Проф-Пресс
2474164	9785378007974	Проф-пресс картонка. сорока-белобока (домик) карт обложка	205408	Полиграфия (folder)/Книги	331248	Проф-Пресс
727982	9785378015061	Проф-пресс картонка. сорока-белобока (красный уголок) карт обложка	36536	Полиграфия (folder)/Печатная продукция	331248	Проф-Пресс
2474165	9785378005543	Проф-пресс картонка. сорока-сорока (желтый горшок) карт обложка	205408	Полиграфия (folder)/Книги	331248	Проф-Пресс
2749354	9785378011698	Проф-пресс картонка. спать пора!	1	Неклассифицированные/default	331248	Проф-Пресс
727032	9785378011674	Проф-пресс картонка. спи, Мой мальчик!	205408	Полиграфия (folder)/Книги	331248	Проф-Пресс
66645	9785378012084	Проф-пресс картонка. спи, моя радость, усни	205408	Полиграфия (folder)/Книги	331248	Проф-Пресс
2474166	9785378011667	Проф-пресс картонка. спи-ка на здоровьице! карт обложка	205408	Полиграфия (folder)/Книги	331248	Проф-Пресс
726950	9785378010042	Проф-пресс картонка. спят усталые игрушки карт обложка	36536	Полиграфия (folder)/Печатная продукция	331248	Проф-Пресс
66789	9785378015191	Проф-пресс картонка. стихи для девоч (красный уголок)	205408	Полиграфия (folder)/Книги	331248	Проф-Пресс
2234811	9785378015276	Проф-пресс картонка. стихи для мальч (красный уголок)	36536	Полиграфия (folder)/Печатная продукция	331248	Проф-Пресс
728248	9785378015054	Проф-пресс картонка. стихи малышам (красный уголок)	205408	Полиграфия (folder)/Книги	331248	Проф-Пресс
2234812	9785378012442	Проф-пресс картонка. стишата о зверятах	36536	Полиграфия (folder)/Печатная продукция	331248	Проф-Пресс
727879	9785378011087	Проф-пресс картонка. сюрприз от дедушки мороза	205408	Полиграфия (folder)/Книги	331248	Проф-Пресс
66814	9785945820593	Проф-пресс картонка. тараканище (белая) карт обложка	36536	Полиграфия (folder)/Печатная продукция	331248	Проф-Пресс
728566	9785378017072	Проф-пресс картонка. тараканище (медведи)	205408	Полиграфия (folder)/Книги	331248	Проф-Пресс
66822	9785945820920	Проф-пресс картонка. телефон (голубой телефон) карт обложка	36536	Полиграфия (folder)/Печатная продукция	331248	Проф-Пресс
728567	9785378017041	Проф-пресс картонка. телефон (красный телефон)	205408	Полиграфия (folder)/Книги	331248	Проф-Пресс
2474167	9785378007905	Проф-пресс картонка. теремок (желтый) карт обложка	205408	Полиграфия (folder)/Книги	331248	Проф-Пресс
2749356	9785378012404	Проф-пресс картонка. теремок (сиреневый)	1	Неклассифицированные/default	331248	Проф-Пресс
2474168	9785378005529	Проф-пресс картонка. топ-топ, топотушки (котенок) карт обложка	205408	Полиграфия (folder)/Книги	331248	Проф-Пресс
727855	9785378004324	Проф-пресс картонка. транспорт (вертолет)	205408	Полиграфия (folder)/Книги	331248	Проф-Пресс
2749357	9785378003983	Проф-пресс картонка. транспорт (машина)	1	Неклассифицированные/default	331248	Проф-Пресс
728435	9785378018734	Проф-пресс картонка. три медведя (без девочки) карт обложка	36536	Полиграфия (folder)/Печатная продукция	331248	Проф-Пресс
2474169	9785378007967	Проф-пресс картонка. три поросенка (волк) карт обложка	205408	Полиграфия (folder)/Книги	331248	Проф-Пресс
727894	9785378001934	Проф-пресс картонка. три поросенка (заяц)	205408	Полиграфия (folder)/Книги	331248	Проф-Пресс
66798	9785378001453	Проф-пресс картонка. у лукоморья дуб зеленый карт обложка	36536	Полиграфия (folder)/Печатная продукция	331248	Проф-Пресс
2749358	9785378013432	Проф-пресс картонка. Умница и ленивица	1	Неклассифицированные/default	331248	Проф-Пресс
2749359	9785378008117	Проф-пресс картонка. учим цвета	1	Неклассифицированные/default	331248	Проф-Пресс
2749360	9785378008032	Проф-пресс картонка. учимся говорить (медведь)	1	Неклассифицированные/default	331248	Проф-Пресс
2749361	9785378008506	Проф-пресс картонка. учимся говорить (собака)	1	Неклассифицированные/default	331248	Проф-Пресс
2234816	9785378002283	Проф-пресс картонка. учимся переходить дорогу	36536	Полиграфия (folder)/Печатная продукция	331248	Проф-Пресс
728513	9785378017089	Проф-пресс картонка. федорино горе (синяя) карт обложка	36536	Полиграфия (folder)/Печатная продукция	331248	Проф-Пресс
2474170	9785378021253	Проф-пресс картонка. царевна-лягушка карт обложка	205408	Полиграфия (folder)/Книги	331248	Проф-Пресс
726853	9785378011094	Проф-пресс картонка. что за праздник - новый год!	205408	Полиграфия (folder)/Книги	331248	Проф-Пресс
66356	9785378012190	Проф-пресс картонка. что такое хорошо и что такое плохо (птиц	205408	Полиграфия (folder)/Книги	331248	Проф-Пресс
2474171	9785378022250	Проф-пресс картонка. чудо - дерево карт обложка	205408	Полиграфия (folder)/Книги	331248	Проф-Пресс
2749362	9785378008513	Проф-пресс картонка. это кто? (лось)	1	Неклассифицированные/default	331248	Проф-Пресс
66207	9785378008476	Проф-пресс картонка. это кто? (слоненок)	205408	Полиграфия (folder)/Книги	331248	Проф-Пресс
2749363	9785378005239	Проф-пресс картонка. это цвет какой?	1	Неклассифицированные/default	331248	Проф-Пресс
727272	9785945822627	Проф-пресс картонка. ёж-портняжка	205408	Полиграфия (folder)/Книги	331248	Проф-Пресс
727181	9785378014736	Проф-пресс картонка. ёжики смеются	205408	Полиграфия (folder)/Книги	331248	Проф-Пресс
804278	9785378026395	Проф-пресс карусель. загадки малышам	1	Неклассифицированные/default	331248	Проф-Пресс
2749365	9785378026425	Проф-пресс карусель. потешки малышам	1	Неклассифицированные/default	331248	Проф-Пресс
2749366	9785378026401	Проф-пресс карусель. стихи на ночь малышам	1	Неклассифицированные/default	331248	Проф-Пресс
2474172	9785378106776	Проф-пресс касса букв (арт. нр-0677) карт обложка	205408	Полиграфия (folder)/Книги	331248	Проф-Пресс
2474173	9785378106783	Проф-пресс касса букв и цифр (арт. нр-0678) карт обложка	205408	Полиграфия (folder)/Книги	331248	Проф-Пресс
2474174	9785378106790	Проф-пресс касса цифр (арт. нр-0679) карт обложка	205408	Полиграфия (folder)/Книги	331248	Проф-Пресс
5065224	4665305773156	Проф-пресс квест. в поисках белого кролика 82x100/32	1	Неклассифицированные/default	331248	Проф-Пресс
5065225	4610144849982	Проф-пресс квест. в поисках космического клада	1	Неклассифицированные/default	331248	Проф-Пресс
2749377	9785378002849	Проф-пресс кн-панорама:гадкий утёнок	1	Неклассифицированные/default	331248	Проф-Пресс
2749378	9785378026319	Проф-пресс кн-панорама:заюшкина избушка	1	Неклассифицированные/default	331248	Проф-Пресс
2749379	9785378011322	Проф-пресс кн-панорама:Колобок	1	Неклассифицированные/default	331248	Проф-Пресс
66885	9785378002818	Проф-пресс кн-панорама:кот в сапогах	36536	Полиграфия (folder)/Печатная продукция	331248	Проф-Пресс
2474175	9785378015993	Проф-пресс кн-панорама:кошкин дом карт обложка	205408	Полиграфия (folder)/Книги	331248	Проф-Пресс
66886	9785378002832	Проф-пресс кн-панорама:красная шапочка карт обложка	36536	Полиграфия (folder)/Печатная продукция	331248	Проф-Пресс
2474176	9785378026296	Проф-пресс кн-панорама:курочка ряба карт обложка	205408	Полиграфия (folder)/Книги	331248	Проф-Пресс
2749380	9785378026289	Проф-пресс кн-панорама:петушок Золотой гребешок	1	Неклассифицированные/default	331248	Проф-Пресс
2749381	9785378016006	Проф-пресс кн-панорама:репка	1	Неклассифицированные/default	331248	Проф-Пресс
2749382	9785378011339	Проф-пресс кн-панорама:теремок	1	Неклассифицированные/default	331248	Проф-Пресс
66887	9785378002825	Проф-пресс кн-панорама:три поросёнка карт обложка	36536	Полиграфия (folder)/Печатная продукция	331248	Проф-Пресс
804279	9785378011520	Проф-пресс книжка с DVD. волк и семеро козлят	1	Неклассифицированные/default	331248	Проф-Пресс
804280	9785378019168	Проф-пресс книжка с DVD. дюймовочка	1	Неклассифицированные/default	331248	Проф-Пресс
804281	9785378005093	Проф-пресс книжка с DVD. Колобок	1	Неклассифицированные/default	331248	Проф-Пресс
2749367	9785378006533	Проф-пресс книжка с DVD. кот в сапогах	1	Неклассифицированные/default	331248	Проф-Пресс
2749368	9785378015702	Проф-пресс книжка с DVD. красная шапочка (зеленая)	1	Неклассифицированные/default	331248	Проф-Пресс
804282	9785378006540	Проф-пресс книжка с DVD. лисичка-сестричка	1	Неклассифицированные/default	331248	Проф-Пресс
2749369	9785378006458	Проф-пресс книжка с DVD. мама для мамонтёнка	1	Неклассифицированные/default	331248	Проф-Пресс
804283	9785378006526	Проф-пресс книжка с DVD. Маша и медведь	1	Неклассифицированные/default	331248	Проф-Пресс
2749370	9785378006441	Проф-пресс книжка с DVD. по щучьему велению	1	Неклассифицированные/default	331248	Проф-Пресс
2749371	9785378008148	Проф-пресс книжка с DVD. рикки-тикки-тави	1	Неклассифицированные/default	331248	Проф-Пресс
2749372	9785378019151	Проф-пресс книжка с DVD. спящая красавица	1	Неклассифицированные/default	331248	Проф-Пресс
804284	9785378006465	Проф-пресс книжка с DVD. три медведя	1	Неклассифицированные/default	331248	Проф-Пресс
804285	9785378019144	Проф-пресс книжка с DVD. царевна - лягушка (зеленая)	1	Неклассифицированные/default	331248	Проф-Пресс
804286	9785378017614	Проф-пресс книжка с DVD. человек-паук в опасности	1	Неклассифицированные/default	331248	Проф-Пресс
2749373	9785378020041	Проф-пресс книжка с DVD. человек-паук. чудовищное превращение	1	Неклассифицированные/default	331248	Проф-Пресс
2749374	9785378019953	Проф-пресс книжка с DVD. черепашки-ниндзя. победить или погиб	1	Неклассифицированные/default	331248	Проф-Пресс
2749375	9785378019946	Проф-пресс книжка с DVD. черепашки-ниндзя. прыжок в будущее	1	Неклассифицированные/default	331248	Проф-Пресс
5065226	9785378309252	Проф-пресс книжки на пене. курочка ряба	1	Неклассифицированные/default	331248	Проф-Пресс
5065227	9785378309269	Проф-пресс книжки на пене. репка	1	Неклассифицированные/default	331248	Проф-Пресс
5065228	9785378300075	Проф-пресс книжки на пене. синий трактор. кто сказал хрю-хрю?	1	Неклассифицированные/default	331248	Проф-Пресс
5065229	9785378304790	Проф-пресс книжки на пене. синий трактор. лево-право	1	Неклассифицированные/default	331248	Проф-Пресс
5065230	9785378304783	Проф-пресс книжки на пене. синий трактор. фрукты	1	Неклассифицированные/default	331248	Проф-Пресс
5065231	9785378309283	Проф-пресс книжки на пене. три поросенка	1	Неклассифицированные/default	331248	Проф-Пресс
5065232	9785378313686	Проф-пресс книжки-панорамки 4 разворота. оранжевая корова. вместе весело играть 82x100/32	1	Неклассифицированные/default	331248	Проф-Пресс
2749383	9785378025107	Проф-пресс колесики. важные машины	1	Неклассифицированные/default	331248	Проф-Пресс
2474177	9785378008469	Проф-пресс колесики. машины-помощники карт обложка	205408	Полиграфия (folder)/Книги	331248	Проф-Пресс
2749385	9785378008452	Проф-пресс колесики. милиция	1	Неклассифицированные/default	331248	Проф-Пресс
2474178	9785378008445	Проф-пресс колесики. нужные машинки карт обложка	205408	Полиграфия (folder)/Книги	331248	Проф-Пресс
2443222	9785378008421	Проф-пресс колесики. скорая помощь карт обложка	980	Игрушки (folder)/Игрушка	331248	Проф-Пресс
2749388	9785378025473	Проф-пресс колесики. стихи про машины	1	Неклассифицированные/default	331248	Проф-Пресс
2474180	9785378025114	Проф-пресс колесики. экскаватор карт обложка	205408	Полиграфия (folder)/Книги	331248	Проф-Пресс
5065233	9785378313679	Проф-пресс Коллекция лучших сказок	1	Неклассифицированные/default	331248	Проф-Пресс
2749389	9785378042562	Проф-пресс Коллекция любимых сказок	1	Неклассифицированные/default	331248	Проф-Пресс
2749390	9785378047659	Проф-пресс Коллекция поучительных сказок	1	Неклассифицированные/default	331248	Проф-Пресс
804288	9785378006618	Проф-пресс колобки. Колобок	1	Неклассифицированные/default	331248	Проф-Пресс
2749391	9785378006656	Проф-пресс колобки. мои часики	1	Неклассифицированные/default	331248	Проф-Пресс
2749392	9785378006625	Проф-пресс колобки. на дороге не играйте	1	Неклассифицированные/default	331248	Проф-Пресс
2749393	9785378006632	Проф-пресс колобки. считаем до пяти	1	Неклассифицированные/default	331248	Проф-Пресс
2749394	9785378050635	Проф-пресс Колобок	1	Неклассифицированные/default	331248	Проф-Пресс
2749397	9785378072439	Проф-пресс Колобок. зимовье зверей. рукавичка	1	Неклассифицированные/default	331248	Проф-Пресс
2749398	9785378052103	Проф-пресс Колобок. курочка ряба (пухл.)	1	Неклассифицированные/default	331248	Проф-Пресс
2749399	9785378017980	Проф-пресс колокольчики. веселый новый год	1	Неклассифицированные/default	331248	Проф-Пресс
804289	9785378017997	Проф-пресс колокольчики. зимние загадки	36536	Полиграфия (folder)/Печатная продукция	331248	Проф-Пресс
804290	9785378017973	Проф-пресс колокольчики. новогодние сны	36536	Полиграфия (folder)/Печатная продукция	331248	Проф-Пресс
2749400	9785378018000	Проф-пресс колокольчики. скоро, скоро новый год!	1	Неклассифицированные/default	331248	Проф-Пресс
2749401	9785378028139	Проф-пресс колыбельные для малышей	1	Неклассифицированные/default	331248	Проф-Пресс
66206	9785378011285	Проф-пресс корнеева о.т. глазки (мини) учимся различать цвета 82x100/32 10лист	205408	Полиграфия (folder)/Книги	331248	Проф-Пресс
2749403	9785378082452	Проф-пресс корней чуковский. сказки	1	Неклассифицированные/default	331248	Проф-Пресс
5065234	9785378314645	Проф-пресс кошечки-собачки. прописи для малышей. веселые рисунки 82x100/32	1	Неклассифицированные/default	331248	Проф-Пресс
5065235	9785378314652	Проф-пресс кошечки-собачки. прописи для малышей. для девоч 82x100/32 16лист	1	Неклассифицированные/default	331248	Проф-Пресс
5065236	9785378314669	Проф-пресс кошечки-собачки. прописи для малышей. для мальч 82x100/32	1	Неклассифицированные/default	331248	Проф-Пресс
5065237	9785378314676	Проф-пресс кошечки-собачки. прописи для малышей. первые картинки 82x100/32	1	Неклассифицированные/default	331248	Проф-Пресс
5065238	9785378313440	Проф-пресс кошечки-собачки. прописи с наклейками. готовим руку к письму 82x100/32	1	Неклассифицированные/default	331248	Проф-Пресс
5065239	9785378313457	Проф-пресс кошечки-собачки. прописи с наклейками. развиваем мелкую моторику 82x100/32	1	Неклассифицированные/default	331248	Проф-Пресс
5065240	9785378313471	Проф-пресс кошечки-собачки. прописи с наклейками. рисуем по клеточкам 82x100/32	1	Неклассифицированные/default	331248	Проф-Пресс
5065241	9785378313464	Проф-пресс кошечки-собачки. прописи с наклейками. счет 82x100/32	1	Неклассифицированные/default	331248	Проф-Пресс
2749406	9785945826588	Проф-пресс кошки-мышки	1	Неклассифицированные/default	331248	Проф-Пресс
2749408	9785378033348	Проф-пресс кошкин дом #2	1	Неклассифицированные/default	331248	Проф-Пресс
2749412	9785378113170	Проф-пресс краденое Солнце. паззл с замком	1	Неклассифицированные/default	331248	Проф-Пресс
2749414	9785378113187	Проф-пресс красавица и чудовище. паззл с замком	1	Неклассифицированные/default	331248	Проф-Пресс
5065242	9785378318728	Проф-пресс кроссворды, игры, ребусы. игры для ума	5113779	Полиграфия (folder)/Сборник головоломок	331248	Проф-Пресс
5065243	9785378318735	Проф-пресс кроссворды, игры, ребусы. развиваем интеллект	5113779	Полиграфия (folder)/Сборник головоломок	331248	Проф-Пресс
5065244	9785378308989	Проф-пресс кроссворды, игры, ребусы. развиваем логику 82x100/32 32лист	5113779	Полиграфия (folder)/Сборник головоломок	331248	Проф-Пресс
5065245	9785378308996	Проф-пресс кроссворды, игры, ребусы. развиваем мышление 82x100/32 32лист	5113779	Полиграфия (folder)/Сборник головоломок	331248	Проф-Пресс
