ID	UPCEAN	Name	CategoryID	CategoryName	BrandID	BrandName
1969268	4606782163214	Набор разделителей листов пластик A4 Berlingo январь-декабрь в пленке	2	Канцелярские товары (folder)/Канцелярские товары	176778	BERLINGO
1969269	4606782163221	Набор разделителей листов пластик A4 Berlingo январь-декабрь в пленке #2	2	Канцелярские товары (folder)/Канцелярские товары	176778	BERLINGO
1969270	4606782163238	Набор разделителей листов пластик A5 Berlingo цветовой 5цв в пленке	2	Канцелярские товары (folder)/Канцелярские товары	176778	BERLINGO
1969271	4606782163245	Набор разделителей листов пластик A5 Berlingo цветовой 5цв в пленке #2	2	Канцелярские товары (folder)/Канцелярские товары	176778	BERLINGO
5041345	4606782245293	Набор разделителей листов пластик A5 Hatber цветовой 5цв в пленке	272108	Канцелярские товары (folder)/Разделитель листов	36916	Hatber
5041346	4606782245309	Набор разделителей листов пластик A5 Hatber цветовой 5цв в пленке #2	2	Канцелярские товары (folder)/Канцелярские товары	36916	Hatber
2249094	4006664127509	Набор разделоч.поверхностей 4шт 12750 gefu	2420630	Посуда (folder)/Посуда кухонная	1190579	Gefu
5555688	4009977739780	Набор разделочных досок 2предм axentia 38x 30см (291119)	19096	Посуда (folder)/Доска разделочная	0	
3428383	4607074300973	Набор разделочных досок 2шт пластик	1	Неклассифицированные/default	0	
5555689	4058022031249	Набор разделочных досок 3предм gipfel Bright (3124)	19096	Посуда (folder)/Доска разделочная	0	
5333262	5706631049672	Набор разделочных досок 3шт Eva solo (520400)	1	Неклассифицированные/default	5248057	eva solo
5555690	4009977988409	Набор разделочных досок 6предм axentia 22x 14см (260467)	19096	Посуда (folder)/Доска разделочная	0	
1685540	5019370004728	Набор разделочных досок apollo /ide-01/	1	Неклассифицированные/default	0	
2461625	5019370007071	Набор разделочных досок apollo метод с подставкой 3предм	2420630	Посуда (folder)/Посуда кухонная	182550	Apollo
2461626	5019370004865	Набор разделочных досок apollo океан с подставкой 3предм	2420630	Посуда (folder)/Посуда кухонная	182550	Apollo
2461627	5019370004902	Набор разделочных досок apollo санте с подставкой 3предм	2420630	Посуда (folder)/Посуда кухонная	182550	Apollo
5555691	5706631207058	Набор разделочных досок Eva solo Green tool, 2шт	19096	Посуда (folder)/Доска разделочная	5248057	eva solo
5174411	5028420601497	Набор разделочных досок joseph joseph doorstore 2шт	19096	Посуда (folder)/Доска разделочная	5174386	joseph joseph
5555692	5028420004274	Набор разделочных досок joseph joseph folio large sage	19096	Посуда (folder)/Доска разделочная	5174386	joseph joseph
5555693	5028420003130	Набор разделочных досок joseph joseph folio large sky	19096	Посуда (folder)/Доска разделочная	5174386	joseph joseph
5555694	5028420002089	Набор разделочных досок joseph joseph folio large графит	19096	Посуда (folder)/Доска разделочная	5174386	joseph joseph
5174450	5028420002096	Набор разделочных досок joseph joseph folio large серебристый	19096	Посуда (folder)/Доска разделочная	5174386	joseph joseph
5555695	5028420003475	Набор разделочных досок joseph joseph folio regular белый	19096	Посуда (folder)/Доска разделочная	5174386	joseph joseph
5174451	5028420002102	Набор разделочных досок joseph joseph folio regular графит	19096	Посуда (folder)/Доска разделочная	5174386	joseph joseph
5555696	5028420002119	Набор разделочных досок joseph joseph folio regular серебристый	19096	Посуда (folder)/Доска разделочная	5174386	joseph joseph
5555697	5028420001211	Набор разделочных досок joseph joseph folio steel золотистый	19096	Посуда (folder)/Доска разделочная	5174386	joseph joseph
5555698	5028420001198	Набор разделочных досок joseph joseph folio steel нержав сталь	19096	Посуда (folder)/Доска разделочная	5174386	joseph joseph
5555699	5028420001204	Набор разделочных досок joseph joseph folio steel черный	19096	Посуда (folder)/Доска разделочная	5174386	joseph joseph
5174461	5028420601350	Набор разделочных досок joseph joseph index 17 large графит	19096	Посуда (folder)/Доска разделочная	5174386	joseph joseph
5174462	5028420601343	Набор разделочных досок joseph joseph index 17 large серебристый	19096	Посуда (folder)/Доска разделочная	5174386	joseph joseph
5174464	5028420601329	Набор разделочных досок joseph joseph index 17 regular графит	19096	Посуда (folder)/Доска разделочная	5174386	joseph joseph
5174463	5028420601312	Набор разделочных досок joseph joseph index 17 regular серебристый	19096	Посуда (folder)/Доска разделочная	5174386	joseph joseph
5174465	5028420000412	Набор разделочных досок joseph joseph index large sky	19096	Посуда (folder)/Доска разделочная	5174386	joseph joseph
5333860	5028420600971	Набор разделочных досок joseph joseph index Mini серебристый	19096	Посуда (folder)/Доска разделочная	5174386	joseph joseph
5333856	5028420601411	Набор разделочных досок joseph joseph index бамбук	19096	Посуда (folder)/Доска разделочная	5174386	joseph joseph
5174460	5028420600957	Набор разделочных досок joseph joseph index в стальном кейсе	19096	Посуда (folder)/Доска разделочная	5174386	joseph joseph
5174471	5028420601640	Набор разделочных досок joseph joseph nest large зеленый, 3шт	19096	Посуда (folder)/Доска разделочная	5174386	joseph joseph
5174470	5028420601473	Набор разделочных досок joseph joseph nest large серый, 3шт	19096	Посуда (folder)/Доска разделочная	5174386	joseph joseph
5174474	5028420601633	Набор разделочных досок joseph joseph nest regular зеленый, 3шт	19096	Посуда (folder)/Доска разделочная	5174386	joseph joseph
5333864	5028420601466	Набор разделочных досок joseph joseph nest regular серый, 3шт	19096	Посуда (folder)/Доска разделочная	5174386	joseph joseph
5174475	5028420601220	Набор разделочных досок joseph joseph nest опал 3шт	19096	Посуда (folder)/Доска разделочная	5174386	joseph joseph
5555700	4626013167057	Набор разделочных досок на подставке 4шт 23x15 x 1см bravo (br-136)	19096	Посуда (folder)/Доска разделочная	0	
5555701	4660005313497	Набор разделочных досок селфи гайка в кассете 38x22x1.8см 34x20x1.8см 30x18 x1.8см	19096	Посуда (folder)/Доска разделочная	5334097	селфи
5555702	4660005314395	Набор разделочных досок селфи круг в кассете 25x1.8см 30x1.8см 35x1.8см	19096	Посуда (folder)/Доска разделочная	5334097	селфи
5555703	4660005314432	Набор разделочных досок селфи круг металлическая ручка в кассете 25x1.8см 30x1.8см 35x1.8см	19096	Посуда (folder)/Доска разделочная	5334097	селфи
5555704	4660005313374	Набор разделочных досок селфи прямоугольник 36x22x1.8см 33x20x1.8см 28x18 x1.8см	19096	Посуда (folder)/Доска разделочная	5334097	селфи
5555705	4660005313459	Набор разделочных досок селфи ромб в кассете 38x22x1.8см 34x20x1.8см 30x18 x1.8см	19096	Посуда (folder)/Доска разделочная	5334097	селфи
5555706	4034229050733	Набор разметочный stayer с синей краской 115гх 30м (2-06383-h2)	5268062	Инструменты (folder)/Инструмент штукатурно-малярный	0	
5555707	4893925523596	Набор разметочный для посадки семян grinda 8-422363-h3, веревка садовая разметочная, два колышка	5317353	посадочный материал	514502	Grinda
5555708	4893925529802	Набор разметочный для посадки семян grinda 8-422363-h3_z01, веревка садовая разметочная, два колышка	5317353	посадочный материал	514502	Grinda
5555709	4606373017544	Набор разметочный Зубр в наборе с синей краской 30м (4-06375-h2)	5268062	Инструменты (folder)/Инструмент штукатурно-малярный	103197	Зубр
5555710	4607110532191	Набор размыкателей втулок автокондиционера мастак 105-00009, 9предм	5344729	инструмент для автокондиционера и климатических систем автомобиля	5316203	мастак
5555711	4670019431599	Набор размыкателей для топливной системы и системы кондиционирования мастак 105-01007, 7предм	5316202	специнструмент для двигателя и топливной системы	5316203	мастак
5555712	4607110537301	Набор размыкателей для топливной системы мастак 105-01006c кейс, 6предм	5316202	специнструмент для двигателя и топливной системы	5316203	мастак
2461628	8711915026338	Набор разноцветный детский Сад	980	Игрушки (folder)/Игрушка	0	
772723	4603299188082	Набор разноцветных молний 20cm 6шт	285832	Товары для творчества (folder)/Швейные принадлежности	0	
772724	4024526640065	Набор разноцветных светящихся браслетов 5шт 20cm	1	Неклассифицированные/default	673578	ACTION!
495715	4024526640089	Набор разноцветных светящихся ожерелий, 2шт 56cm цвета ассортим	1	Неклассифицированные/default	0	
3428384	6961005965067	Набор разные игрушки доктор 6предм тв/уп	1	Неклассифицированные/default	0	
3428385	6961005965043	Набор разные игрушки доктор 7предм тв/уп	1	Неклассифицированные/default	0	
1266316	201808400003	Набор разовой посуды №12 (с/к) 1347шт	1	Неклассифицированные/default	0	
5555713	4710591933798	Набор разрезных ключей King tony 8-22мм 6предм 1306mr	5127734	Ключ инструментальный	3948162	King Tony
5555714	4710591969711	Набор разрезных ключей King tony 9-34128fr ударная отвертка и съемник масляных фильтров, 14 предмет	5127734	Ключ инструментальный	3948162	King Tony
5555715	4712755687554	Набор разрезных ключей King tony 9-90135mrv шестигранники г-образные, 15предм	5127734	Ключ инструментальный	3948162	King Tony
5555716	4711671592775	Набор разрезных ключей-насадок 10-19мм 10шт под вороток 3/8 на планке toptul (gaar1001) gaar1001	3822276	Инструменты (folder)/Ключ разрезной	5226211	Toptul
3428386	6961000509099	Набор разумные игрушки доктор 4предм пластмассовый м/уп	1	Неклассифицированные/default	0	
3428387	6914011410144	Набор разумные игрушки музыкальные инструменты	1	Неклассифицированные/default	0	
3428388	6961006198488	Набор разумные игрушки рыбалка 5предм пластмассовый м/уп	1	Неклассифицированные/default	0	
1685541	8034073883484	Набор разъемных форм для выпечки 24cm forno granchio	538831	Посуда (folder)/Форма кулинарная	0	
1685542	8034073883323	Набор разъемных форм для выпечки 26cm argento granchio	538831	Посуда (folder)/Форма кулинарная	0	
3428389	4606900824690	Набор райский Сад банок для сыпучих продуктов керамика 3шт	1	Неклассифицированные/default	0	
3861626	4600123054735	Набор райт карповый	562237	Спорт и отдых (folder)/Рыбалка (folder)/Рыбалка	0	
1969272	4893669287037	Набор ракета на воздушном топливе 38540 пироткрытий	1	Неклассифицированные/default	0	
495926	4602010180725	Набор ракетка для пинг-понга 2шт 0.6cm шар,сетка с креплен в pvc сумке,арт.sh013	495925	Спорт и отдых (folder)/Пинг-понг	0	
495927	4602010180657	Набор ракетка для пинг-понга 2шт 3 шара pvc арт.f138	495925	Спорт и отдых (folder)/Пинг-понг	0	
495928	4602010180664	Набор ракетка для пинг-понга 2шт 3 шара, pvc-card, арт.f148	495925	Спорт и отдых (folder)/Пинг-понг	0	
772725	4602010307498	Набор ракетка, мяч, волан в чехле 64x 30cm, арт.zy1638b.	443587	Спорт и отдых (folder)/Бадминтон	0	
1685977	4006592702083	Набор ракетки + 2 мячика, 33cm, д:8cm, 6/24	980	Игрушки (folder)/Игрушка	651699	Simba
3428390	6927714707299	Набор ракетки детские 2 мяча	1	Неклассифицированные/default	0	
3428391	9785170920334	Набор ракетки детские 2 мяча #2	1	Неклассифицированные/default	0	
772726	4606471881337	Набор ракетки для бадминтона 2шт 51460	980	Игрушки (folder)/Игрушка	675204	Тойс
772727	4606471197469	Набор ракетки для наст.тенниса 2шт 2806	980	Игрушки (folder)/Игрушка	675204	Тойс
3428392	4006592701420	Набор ракеток	1	Неклассифицированные/default	0	
3428393	6927715559583	Набор ракеток #2	1	Неклассифицированные/default	0	
3861627	6438240643109	Набор ракеток angry birds	1	Неклассифицированные/default	0	
1266317	8888882315083	Набор ракеток волан/мячик10002+	980	Игрушки (folder)/Игрушка	0	
1266318	1135202005641	Набор ракеток д наст.тенниса 2шт,мяч.4cm	980	Игрушки (folder)/Игрушка	0	
3428394	1135201203444	Набор ракеток д настольного тениса вн09005	1	Неклассифицированные/default	0	
772728	6952138865171	Набор ракеток для бадминтона +	550638	Спорт и отдых (folder)/Спорт	0	
2986163	8725140377707	Набор ракеток для бадминтона + #2	550638	Спорт и отдых (folder)/Спорт	0	
91592	6952130023289	Набор ракеток для бадминтона szr0d9k	980	Игрушки (folder)/Игрушка	0	
5555717	5056192023438	Набор ракеток для фрескобола bork hp502	5543467	Набор (general)	0	
3861628	6937493921830	Набор ракеток медуза мяч, волан	1	Неклассифицированные/default	0	
1266319	8888882315106	Набор ракеток с воланчиком и мячом 10003+	980	Игрушки (folder)/Игрушка	0	
1266320	8888881651076	Набор ракеток с мячом 10881а+	980	Игрушки (folder)/Игрушка	0	
3428395	4600648570956	Набор ракконд фру семь карамели 200g мяг\уп	1	Неклассифицированные/default	0	
1266321	4690002220016	Набор раковин дары моря 4 рафия	337596	Товары для животных (folder)/Pets	0	
3428396	4680259005078	Набор раковина керамические блюда 6шт а-57	1	Неклассифицированные/default	0	
3861629	6905505544063	Набор ракушек	2228248	Растениеводство (folder)/Садовые предметы интерьера	0	
3861630	6905505544070	Набор ракушек #2	2228248	Растениеводство (folder)/Садовые предметы интерьера	0	
3861631	6905505544087	Набор ракушек #3	2228248	Растениеводство (folder)/Садовые предметы интерьера	0	
3861632	6905505544094	Набор ракушек #4	2228248	Растениеводство (folder)/Садовые предметы интерьера	0	
3861633	6905505544100	Набор ракушек #5	2228248	Растениеводство (folder)/Садовые предметы интерьера	0	
3861634	6905505544124	Набор ракушек #6	2228248	Растениеводство (folder)/Садовые предметы интерьера	0	
3861635	6905505544131	Набор ракушек #7	2228248	Растениеводство (folder)/Садовые предметы интерьера	0	
3861636	6905505544148	Набор ракушек #8	2228248	Растениеводство (folder)/Садовые предметы интерьера	0	
3861637	6905505544162	Набор ракушек #9	2228248	Растениеводство (folder)/Садовые предметы интерьера	0	
5041347	4690000180015	Набор ракушек 6 рафия 018	311529	Товары для животных (folder)/Аквариум (folder)/Грунт для аквариума	0	
5041348	4690000170016	Набор ракушек 8 рафия 017	311529	Товары для животных (folder)/Аквариум (folder)/Грунт для аквариума	0	
772729	8711295166570	Набор ракушек декор 13.5cm	1	Неклассифицированные/default	0	
91593	6904037730050	Набор ракушек декор 73005	3541537	Сувениры и подарки (folder)/Сувенир	0	
91594	026102857861	Набор ракушка 7предм с0291	38328	Посуда (folder)/Посуда столовая, предметы сервировки	38318	Luminarc
3428397	4680259214456	Набор ракушки декоративные натуральные в корзинке 12x11 x 5cm	1	Неклассифицированные/default	0	
772730	6944260010932	Набор рамка (масса для лепки 7x 8g, фоторамка, инструменты, декоративная краска, инструкция) 1093	1	Неклассифицированные/default	0	
2901826	8711295793202	Набор рамок для фото koopman 15.5x11x 19cm/15.5x11 x17.5cm 2шт дер.	1	Неклассифицированные/default	0	
5555718	3501170699539	Набор рапидографов rotring college set s0699530 в комплекте: 0.25/0.35/0.5мм/аксессуары	517324	Канцелярские товары (folder)/Рапидограф	260760	Rotring
772731	6940304800316	Набор рапунцель 2предм :бокал 440ml с труб.и кр.+фляга 440ml +2 подст.под чашкуnp1 и-контакт	337649	Уход за детьми (folder)/Уход за детьми	680920	И-КОНТАКТ
3428398	9785378267224	Набор рапунцель для детского творчества вырежи и одень куклу	1	Неклассифицированные/default	0	
5555720	4627079777365	Набор раскопки dig-1 древние ящерицы	5357551	Набор для опытов и экспериментов	5555719	раскопки
5555721	4620039150406	Набор раскопки dig-19 динозаврыки мини	5357551	Набор для опытов и экспериментов	5555719	раскопки
5555722	4627079777433	Набор раскопки dig-6 сокровища пиратов	5357551	Набор для опытов и экспериментов	5555719	раскопки
441390	4606016042179	Набор раскраска для раскрашивания водой русалочка	457262	Полиграфия (folder)/Раскраска	19066	АЛЬТ
2538551	4895136015990	Набор раскрасок антистресс bondibon в лесу, 6лист 30x 21cm, арт cpa2316 вв1711	1	Неклассифицированные/default	439738	Bondibon
2538553	4895136016027	Набор раскрасок антистресс bondibon достопримечательности мира, 6лист 30x 21cm, арт cpa вв1714	1	Неклассифицированные/default	439738	Bondibon
2538552	4895136016010	Набор раскрасок антистресс bondibon чудесная Европа, 6лист 30x 21cm, арт cpa2307v вв1713	1	Неклассифицированные/default	439738	Bondibon
5555723	4895136018717	Набор раскрасок антистресс животные вв1977 bondibon	5141737	рисование, роспись, гравюры	439738	Bondibon
5555724	4895136018687	Набор раскрасок антистресс морские обитатели вв1974 bondibon	5141737	рисование, роспись, гравюры	439738	Bondibon
5555725	4895136018694	Набор раскрасок антистресс птицы и бабочки вв1975 bondibon	5141737	рисование, роспись, гравюры	439738	Bondibon
5555726	4895136018700	Набор раскрасок антистресс райский Сад вв1976 bondibon	5141737	рисование, роспись, гравюры	439738	Bondibon
5555727	4627079776122	Набор раскрась и подари сделай сам украшение для комнаты путешествие к звездам z104 раскрась и подари	90098	Товары для творчества (folder)/Набор для творчества	5549480	раскрась и подари
5555728	4627079776108	Набор раскрась и подари сделай сам украшение для комнаты цветные сны z102 раскрась и подари	90098	Товары для творчества (folder)/Набор для творчества	5549480	раскрась и подари
5555729	4620039150147	Набор раскрась и подари сделай сам украшение солнечная система z200 раскрась и подари	90098	Товары для творчества (folder)/Набор для творчества	5549480	раскрась и подари
1846307	731346019622	Набор раскрась китайский фонарик, от 6 лет/alex 196n	90098	Товары для творчества (folder)/Набор для творчества	0	
1848107	731346050434	Набор раскрась клатч конфетки с 6 водост.флом., от 7 лет/alex 504d	1	Неклассифицированные/default	0	
3861638	6438240667631	Набор раскрась паззл + волшебная картинка 2в1 minion	1	Неклассифицированные/default	0	
3861639	6438240667655	Набор раскрась паззл + волшебная картинка 2в1 mlp	1	Неклассифицированные/default	0	
3861640	6438240677869	Набор раскрась паззл + волшебная картинка 2в1 холодное сердце	1	Неклассифицированные/default	0	
5555730	4030969848937	Набор раскрась рюкзачок centrum холодное сердце, состав набора: сумка 28x28 x 10см,фломастеры 12цв 4030969848937	5141737	рисование, роспись, гравюры	1721254	Centrum
