ID	UPCEAN	Name	CategoryID	CategoryName	BrandID	BrandName
472792	651032045110	Книга screen printing contemporary methods and materials	472476	Полиграфия (folder)/Книги по теме Искусство	0	
472793	9780855329204	Книга sea and sky in watercolour	472476	Полиграфия (folder)/Книги по теме Искусство	0	
472794	050283380030	Книга sea creatures&animals	472476	Полиграфия (folder)/Книги по теме Искусство	0	
728591	9785953949033	Книга shrek навсегда №ру 1080.умная раскраска.egmont	205408	Полиграфия (folder)/Книги	726834	Egmont
3346474	4690448020799	Книга Silwerhof телефонная 752010-55	205408	Полиграфия (folder)/Книги	0	
472795	9781560107415	Книга Soft pastel getting started	472476	Полиграфия (folder)/Книги по теме Искусство	0	
472796	9781560106623	Книга spongebob squarepants drawing	472476	Полиграфия (folder)/Книги по теме Искусство	0	
1224625	9785170734665	Книга stalker группа тревиля (тв)	205408	Полиграфия (folder)/Книги	727664	Нева-Пресс
1224626	9785170733644	Книга stalker клеймо зоны (тв)	205408	Полиграфия (folder)/Книги	727664	Нева-Пресс
1224627	9785170734856	Книга stalker палачи (тв)	205408	Полиграфия (folder)/Книги	727664	Нева-Пресс
1224628	9785170736348	Книга stalker тварь (тв)	205408	Полиграфия (folder)/Книги	727664	Нева-Пресс
472797	9781903975237	Книга starting to paint	472476	Полиграфия (folder)/Книги по теме Искусство	0	
472798	9780855328467	Книга step-by-step drawing landscapes	472476	Полиграфия (folder)/Книги по теме Искусство	0	
472799	9781903975565	Книга step-by-step drawing pets	472476	Полиграфия (folder)/Книги по теме Искусство	0	
472800	9781903975824	Книга step-by-step drawing trees	472476	Полиграфия (folder)/Книги по теме Искусство	0	
472801	050283050476	Книга steps to success in watercolor	472476	Полиграфия (folder)/Книги по теме Искусство	0	
472802	9781903975596	Книга still Life in watercolour	472476	Полиграфия (folder)/Книги по теме Искусство	0	
472803	9781844481484	Книга successful&creative washes	472476	Полиграфия (folder)/Книги по теме Искусство	0	
3346475	6957643601511	Книга talkoвые игрушки найди противоположность	205408	Полиграфия (folder)/Книги	0	
3346476	6957643600491	Книга talkoвые игрушки электронный букварь	205408	Полиграфия (folder)/Книги	0	
3346477	6957643600828	Книга talkовые игрушки большие знания для маленьких ребят	205408	Полиграфия (folder)/Книги	0	
3346478	6957643600736	Книга talkовые игрушки маленькая леди	205408	Полиграфия (folder)/Книги	0	
472804	9781844483204	Книга terry harrison complete guide to paint landscape in w/c	472476	Полиграфия (folder)/Книги по теме Искусство	0	
472805	9781844480975	Книга terry harrison watercolor flowers	472476	Полиграфия (folder)/Книги по теме Искусство	0	
472806	9781844483426	Книга terry harrisons rustic buildings&barns in watercolour	472476	Полиграфия (folder)/Книги по теме Искусство	0	
472807	9781844481989	Книга terry harrisons sea&sky in watercolour	472476	Полиграфия (folder)/Книги по теме Искусство	0	
472808	9781844481002	Книга terry harrisons watercolor mountains,valleys&streams	472476	Полиграфия (folder)/Книги по теме Искусство	0	
472809	9781844480500	Книга terry harrisons watercolor trees	472476	Полиграфия (folder)/Книги по теме Искусство	0	
472810	9781844483358	Книга terry harrisonstop tips for watercolor artists	472476	Полиграфия (folder)/Книги по теме Искусство	0	
472811	9781844484638	Книга terrys top tips for acrylic artist	472476	Полиграфия (folder)/Книги по теме Искусство	0	
472812	9781844484270	Книга the Art of abstract painting acrylic	472476	Полиграфия (folder)/Книги по теме Искусство	0	
472813	9781560109143	Книга the Art of acrylic painting	472476	Полиграфия (folder)/Книги по теме Искусство	0	
472814	050283006077	Книга the Art of basic drawing	472476	Полиграфия (folder)/Книги по теме Искусство	0	
472815	9781560108214	Книга the Art of chinese brush painting	472476	Полиграфия (folder)/Книги по теме Искусство	0	
472816	050283006114	Книга the Art of drawing animals	472476	Полиграфия (folder)/Книги по теме Искусство	0	
472817	050283006091	Книга the Art of drawing dragons	472476	Полиграфия (folder)/Книги по теме Искусство	0	
472818	9781844481866	Книга the Art of drawing drawing drawing Light and shade	472476	Полиграфия (folder)/Книги по теме Искусство	0	
472819	9781844480715	Книга the Art of drawing drawing hands and feet	472476	Полиграфия (folder)/Книги по теме Искусство	0	
472820	9781903975091	Книга the Art of drawing drawing portraits	472476	Полиграфия (folder)/Книги по теме Искусство	0	
472821	050283006121	Книга the Art of drawing fantasy characters	472476	Полиграфия (folder)/Книги по теме Искусство	0	
472822	9781844482443	Книга the Art of drawing the nude	472476	Полиграфия (folder)/Книги по теме Искусство	0	
472823	9781560107514	Книга the Art of Oil painting	472476	Полиграфия (folder)/Книги по теме Искусство	0	
472824	050283006138	Книга the Art of pastels	472476	Полиграфия (folder)/Книги по теме Искусство	0	
472825	9780855329921	Книга the encaustic Art project	472476	Полиграфия (folder)/Книги по теме Искусство	0	
472826	9780855329617	Книга the encyclopedia of acrylic techniques	472476	Полиграфия (folder)/Книги по теме Искусство	0	
472827	9780855329600	Книга the encyclopedia of Oil painting techniques	472476	Полиграфия (folder)/Книги по теме Искусство	0	
472828	9780855329594	Книга the encyclopedia of pastel techniques	472476	Полиграфия (folder)/Книги по теме Искусство	0	
472829	9781844482276	Книга the winsor colour mixing guides acrylics	472476	Полиграфия (folder)/Книги по теме Искусство	0	
472830	9781844482269	Книга the winsor colour mixing guides oils	472476	Полиграфия (folder)/Книги по теме Искусство	0	
472831	9781844481767	Книга the winsor colour mixing guides watercolour	472476	Полиграфия (folder)/Книги по теме Искусство	0	
472832	9780929261058	Книга the world of Color and how to use it	472476	Полиграфия (folder)/Книги по теме Искусство	0	
472833	9781903975190	Книга traditional and contemporary chinese brush painting	472476	Полиграфия (folder)/Книги по теме Искусство	0	
473366	4607156835355	Книга tukzar записная A6 120л дв спир тверд обл 7бц цвет индекс стр tz 136	473063	Канцелярские товары (folder)/Книга записная	237416	Tukzar
472834	9781844482597	Книга twenty to make artists trading cards	472476	Полиграфия (folder)/Книги по теме Искусство	0	
472835	9781844484782	Книга twenty to make sugar animals	472476	Полиграфия (folder)/Книги по теме Искусство	0	
472836	9781844483471	Книга twenty to make:glass painted projects	472476	Полиграфия (folder)/Книги по теме Искусство	0	
1838065	9785953942614	Книга w.i.t.c.h.чар.рк 1011 (волш/р)	205408	Полиграфия (folder)/Книги	0	
1838066	9785953942621	Книга w.i.t.c.h.чар.рк 1012 (волш/р)	205408	Полиграфия (folder)/Книги	0	
1838067	9785953942638	Книга w.i.t.c.h.чар.рк 1013 (волш/р)	205408	Полиграфия (folder)/Книги	0	
1838063	9785953942447	Книга w.i.t.c.h.чар.№нр 1003.накл.	205408	Полиграфия (folder)/Книги	0	
1838064	9785953942454	Книга w.i.t.c.h.чар.№нр 1004.накл.	205408	Полиграфия (folder)/Книги	0	
472840	050283112105	Книга watch me draw a magical fairy world	472476	Полиграфия (folder)/Книги по теме Искусство	0	
472841	9781560107880	Книга watch me draw boys adventure	472476	Полиграфия (folder)/Книги по теме Искусство	0	
472842	050283112044	Книга watch me draw dinosaurs	472476	Полиграфия (folder)/Книги по теме Искусство	0	
472843	050283112013	Книга watch me draw favorite pets	472476	Полиграфия (folder)/Книги по теме Искусство	0	
472844	9781560107972	Книга watch me draw outer space	472476	Полиграфия (folder)/Книги по теме Искусство	0	
472845	9781560107859	Книга watch me draw rainfrest	472476	Полиграфия (folder)/Книги по теме Искусство	0	
472846	050283112112	Книга watch me draw robots	472476	Полиграфия (folder)/Книги по теме Искусство	0	
472847	9781560107811	Книга watch me draw spongebobs underwater escapades	472476	Полиграфия (folder)/Книги по теме Искусство	0	
472848	050283112099	Книга watch me draw the monsters under my bed	472476	Полиграфия (folder)/Книги по теме Искусство	0	
472849	9781560107989	Книга watch me draw the zoo	472476	Полиграфия (folder)/Книги по теме Искусство	0	
472850	9781560109501	Книга watch me draw things girls Love	472476	Полиграфия (folder)/Книги по теме Искусство	0	
472851	9781560109495	Книга watch me draw whales dolphins fish and more	472476	Полиграфия (folder)/Книги по теме Искусство	0	
472852	9780855328450	Книга Water in watercolour	472476	Полиграфия (folder)/Книги по теме Искусство	0	
472853	9780855329631	Книга Water soluble pencils	472476	Полиграфия (folder)/Книги по теме Искусство	0	
472854	9780929261027	Книга watercolor	472476	Полиграфия (folder)/Книги по теме Искусство	0	
472855	9781844484089	Книга watercolor barns	472476	Полиграфия (folder)/Книги по теме Искусство	0	
472856	9781844484294	Книга watercolor botanical flowers	472476	Полиграфия (folder)/Книги по теме Искусство	0	
472857	9781844480661	Книга watercolor Flower portraits	472476	Полиграфия (folder)/Книги по теме Искусство	0	
472858	9781844482726	Книга watercolor Fruit&vegetable portraits	472476	Полиграфия (folder)/Книги по теме Искусство	0	
472859	9781560107361	Книга watercolor getting started	472476	Полиграфия (folder)/Книги по теме Искусство	0	
472860	9781844484317	Книга watercolor landscape tips&techniques	472476	Полиграфия (folder)/Книги по теме Искусство	0	
472837	050283128014	Книга watercolor made Easy 30 minute landscape	472476	Полиграфия (folder)/Книги по теме Искусство	0	
472861	050283128038	Книга watercolor made Easy express Color	472476	Полиграфия (folder)/Книги по теме Искусство	0	
472838	050283128045	Книга watercolor made Easy fairies&fantasy	472476	Полиграфия (folder)/Книги по теме Искусство	0	
472839	050283128052	Книга watercolor made Easy horses and ponies	472476	Полиграфия (folder)/Книги по теме Искусство	0	
472862	9781844484386	Книга watercolor painting step-by-step	472476	Полиграфия (folder)/Книги по теме Искусство	0	
2970827	9781560106579	Книга watercolor painting step-by-step #2	472476	Полиграфия (folder)/Книги по теме Искусство	0	
472863	9781560108023	Книга watercolor pencil step-by-step	472476	Полиграфия (folder)/Книги по теме Искусство	0	
472864	9781844483037	Книга watercolor tips&techniques	472476	Полиграфия (folder)/Книги по теме Искусство	0	
472865	9781844481576	Книга wendy jelberts Line and wash	472476	Полиграфия (folder)/Книги по теме Искусство	0	
472866	9781903975046	Книга Wild flowers in watercolour	472476	Полиграфия (folder)/Книги по теме Искусство	0	
669306	9785953952729	Книга Winx Club секрет потерянного королевства каменный великан	472873	Полиграфия (folder)/Книги детские	726834	Egmont
669307	9785953952736	Книга Winx Club секрет потерянного королевства книга судьбы	472873	Полиграфия (folder)/Книги детские	726834	Egmont
1838616	9785953943185	Книга Winx волшеб.приключения 1	205408	Полиграфия (folder)/Книги	0	
1838617	9785953943192	Книга Winx волшеб.приключения 2	205408	Полиграфия (folder)/Книги	0	
1838618	9785953943208	Книга Winx волшеб.приключения 3	205408	Полиграфия (folder)/Книги	0	
1838619	9785953943055	Книга Winx тесты и головолом.№6	205408	Полиграфия (folder)/Книги	0	
1838620	9785953943062	Книга Winx тесты и головолом.№7	205408	Полиграфия (folder)/Книги	0	
726835	9785953949422	Книга witch №рк 10116. волш.раскраска.egmont	205408	Полиграфия (folder)/Книги	726834	Egmont
472867	9781560108863	Книга your favorite Disney pixar characters	472476	Полиграфия (folder)/Книги по теме Искусство	0	
472868	9781600582493	Книга your first steps in acrylic kit	472476	Полиграфия (folder)/Книги по теме Искусство	0	
472869	9781600582516	Книга your first steps in pencil drawing kit	472476	Полиграфия (folder)/Книги по теме Искусство	0	
472870	9781600582509	Книга your first steps in watercolor kit	472476	Полиграфия (folder)/Книги по теме Искусство	0	
472871	707310500243	Книга zoo animal portrait booklet	472476	Полиграфия (folder)/Книги по теме Искусство	0	
1838068	9785953941020	Книга а ты кто? Маша и медведь	205408	Полиграфия (folder)/Книги	0	
2442919	9785765427613	Книга а я верну тебе свободу	205408	Полиграфия (folder)/Книги	0	
3346479	9785389013278	Книга а я говорю, вероятно, за многтх: ахматова поэзия	205408	Полиграфия (folder)/Книги	0	
3822738	9785445310587	Книга а.аринушкин/с.махотин я сам!	205408	Полиграфия (folder)/Книги	0	
3822739	9785040040193	Книга а.барто стихи	205408	Полиграфия (folder)/Книги	0	
225622	9785353029717	Книга а.барто.наша таня громко плачет (колокольчик) росмэн	205408	Полиграфия (folder)/Книги	205409	РОСМЭН
3822740	9785699934201	Книга а.в.белякова выс.гряд.саж.и отдыхаем	205408	Полиграфия (folder)/Книги	0	
3822741	9785699959228	Книга а.дюма семейство ченчи	205408	Полиграфия (folder)/Книги	0	
3822742	9785699886715	Книга а.зурабова начни с десерта!	205408	Полиграфия (folder)/Книги	0	
3346480	9785813810497	Книга а.куприн белый пудель	205408	Полиграфия (folder)/Книги	0	
3822743	9785699821563	Книга а.маринина за все надо платить	205408	Полиграфия (folder)/Книги	0	
3822744	9785699807031	Книга а.маринина смерть ради смерти	205408	Полиграфия (folder)/Книги	0	
3822745	9785699419937	Книга а.олейников тайна ледяной химеры	205408	Полиграфия (folder)/Книги	0	
3822747	9785040040179	Книга а.с.пушкин сказки #2	205408	Полиграфия (folder)/Книги	0	
3822748	9785699874194	Книга а.спирина национальные пироги	205408	Полиграфия (folder)/Книги	0	
2752346	9785353058243	Книга а.усачев лучшие стихи	1	Неклассифицированные/default	205409	РОСМЭН
1838069	9785699341504	Книга абдулаев ч.а. в поисках бафоса	205408	Полиграфия (folder)/Книги	0	
65751	9785699273324	Книга абдуллаев возвращение олигарха	205408	Полиграфия (folder)/Книги	0	
1838070	9785699352463	Книга абдуллаев год обезьяны эксмо	205408	Полиграфия (folder)/Книги	0	
726836	9785699366408	Книга абдуллаев ч. разорванная связь	205408	Полиграфия (folder)/Книги	0	
726837	9785699474448	Книга абдуллаев ч.берлинский транзит (м)	205408	Полиграфия (folder)/Книги	0	
726838	9785699469499	Книга абдуллаев ч.выбери себе смерть	205408	Полиграфия (folder)/Книги	0	
726839	9785170551149	Книга абдуллаев ч.день гнева	205408	Полиграфия (folder)/Книги	0	
726840	9785699472529	Книга абдуллаев ч.исповедь сатурна	205408	Полиграфия (folder)/Книги	0	
726841	9785699435258	Книга абдуллаев ч.камни последней стены (м)	205408	Полиграфия (folder)/Книги	0	
726842	9785699385140	Книга абдуллаев ч.мечта делитантов	205408	Полиграфия (folder)/Книги	0	
726843	9785170561612	Книга абдуллаев ч.мрак под солнцем	205408	Полиграфия (folder)/Книги	0	
726844	9785699434497	Книга абдуллаев ч.обозначенное присутствие	205408	Полиграфия (folder)/Книги	0	
726845	9785170568154	Книга абдуллаев ч.обретение ада	205408	Полиграфия (folder)/Книги	0	
726846	9785170551200	Книга абдуллаев ч.океан ненависти	205408	Полиграфия (folder)/Книги	0	
726847	9785170560677	Книга абдуллаев ч.охота на человека	205408	Полиграфия (folder)/Книги	0	
726848	9785170561650	Книга абдуллаев ч.пепел надежды	205408	Полиграфия (folder)/Книги	0	
726849	9785170561551	Книга абдуллаев ч.пройти чистилище	205408	Полиграфия (folder)/Книги	0	
726850	9785170564927	Книга абдуллаев ч.стандарт возмездия	205408	Полиграфия (folder)/Книги	0	
726851	9785699454853	Книга абдуллаев ч.тверской Бульвар	205408	Полиграфия (folder)/Книги	0	
726852	9785699472451	Книга абдуллаев ч.три осенних дня	205408	Полиграфия (folder)/Книги	0	
3822749	9785386037994	Книга абрамова б.и.гшпаргалка.Русский язык	205408	Полиграфия (folder)/Книги	0	
3346481	9785170505364	Книга аванта иллюстрированная энциклопедия древний рим	205408	Полиграфия (folder)/Книги	0	
726854	9785353046745	Книга авиация 3D	205408	Полиграфия (folder)/Книги	0	
3822750	9785699839803	Книга авоська с алмазным фондом	205408	Полиграфия (folder)/Книги	0	
1838071	9785953942737	Книга аврора.№нр 1013.наклей и раскрась!	205408	Полиграфия (folder)/Книги	0	
3346482	9785903813186	Книга авто руководство по ремонту ваз 21213, 21214 Нива до 2009г косарев за рулем	205408	Полиграфия (folder)/Книги	0	
3346483	9785916850840	Книга авто руководство по ремонту ваз lada granta фото с каталогом мир автокниг	205408	Полиграфия (folder)/Книги	0	
1773209	9785876631268	Книга авто.атлас.алтайский край (1:20 000)	205408	Полиграфия (folder)/Книги	1761750	Новосиб.карт.фабрика
1773210	9858766313053	Книга авто.карта автомобильных дорог.алтайский край (1:500 000)	205408	Полиграфия (folder)/Книги	1761750	Новосиб.карт.фабрика
1963269	9785699676514	Книга авто.ПДД-2013 (эксмо) особая система запоминания.(01.09.2013г)	1	Неклассифицированные/default	407029	ЭКСМО
1963270	9785699675869	Книга авто.ПДД-2013 (эксмо) с комментариями и иллюстрациями (с посл.измен.)	1	Неклассифицированные/default	407029	ЭКСМО
1773211	9785437404249	Книга авто.ПДД-2014 (суи) с иллюстрациями и комментариями	205408	Полиграфия (folder)/Книги	0	
1773212	9785699765522	Книга авто.ПДД-2015 (эксмо) особая система запоминания (с посл.измен.) желтые	205408	Полиграфия (folder)/Книги	407029	ЭКСМО
1773213	9785699765577	Книга авто.ПДД-2015 (эксмо) офиц.текст с коммент.и илл.(с посл.измен.) синие	205408	Полиграфия (folder)/Книги	407029	ЭКСМО
1773214	9785699758432	Книга авто.ПДД-2015 (эксмо) ПДД и штрафы.только самое важное и необходимое	205408	Полиграфия (folder)/Книги	407029	ЭКСМО
1963271	9785904873103	Книга авто.экз.билеты (2013) ПДД CD с коммент (с посл.измен.) рецепт-холди	1	Неклассифицированные/default	0	
1773215	9785904873097	Книга авто.экз.билеты (2014) ПДД ab с коммент (с посл.измен.) рецепт-холд.	205408	Полиграфия (folder)/Книги	1770240	Атберг
1963273	9785904873080	Книга авто.экз.билеты (2014) ПДД CD с коммент (с посл.измен.) рецепт-холди	1	Неклассифицированные/default	1963272	Рецепт-Холдинг
1773217	9785437405147	Книга авто.экз.билеты (2014) ПДД ав с комметариями и изменениями:суи	205408	Полиграфия (folder)/Книги	1773216	Сиб.универ.изд-во
65752	9785389003743	Книга автомоб.и др.машины	205408	Полиграфия (folder)/Книги	0	
3822751	9785766806301	Книга автомобили ведущих производителей	205408	Полиграфия (folder)/Книги	0	
3822752	9785904481407	Книга автомобили ведущих производителей #2	205408	Полиграфия (folder)/Книги	0	
3822753	9785904481414	Книга автомобили ведущих производителей #3	205408	Полиграфия (folder)/Книги	0	
3822754	9785904481421	Книга автомобили ведущих производителей #4	205408	Полиграфия (folder)/Книги	0	
3822755	9785904481438	Книга автомобили ведущих производителей #5	205408	Полиграфия (folder)/Книги	0	
3822756	9785993018478	Книга автомобили прошлых лет раскр+накл.	205408	Полиграфия (folder)/Книги	0	
804302	9785378008209	Книга автомобили раскраска с наклейками	1	Неклассифицированные/default	331248	Проф-Пресс
3346484	9785971103875	Книга автомобили раскрась водой теремок	205408	Полиграфия (folder)/Книги	0	
1838072	9785953935760	Книга автороб,впер.магн.карт egmont	205408	Полиграфия (folder)/Книги	726834	Egmont
65753	9785170589005	Книга авторский коллектив Русская фэнтези 2009	205408	Полиграфия (folder)/Книги	0	
