ID	UPCEAN	Name	CategoryID	CategoryName	BrandID	BrandName
3602762	4660000616517	Эмаль алкидная квил пф-266 золотисто-желтая жб 1.9kg	296462	Строительные и отделочные материалы (folder)/Эмаль алкидная	0	
5446091	4823093910317	Эмаль алкидная корабельная metalprof enamel пф-133 белый глянец 0tchk 75л	296462	Строительные и отделочные материалы (folder)/Эмаль алкидная	0	
5446092	4823093900059	Эмаль алкидная корабельная пф-115 белый глянец 2.8kg	296462	Строительные и отделочные материалы (folder)/Эмаль алкидная	0	
3602763	4690417011056	Эмаль алкидная красиво пф-115 белая быстросохнущая жб 1.8kg	296462	Строительные и отделочные материалы (folder)/Эмаль алкидная	0	
3602764	4690417019335	Эмаль алкидная красиво пф-115 вишневая жб 0.8kg	296462	Строительные и отделочные материалы (folder)/Эмаль алкидная	0	
3602765	4690417011094	Эмаль алкидная красиво пф-115 голубая жб 1.8kg	296462	Строительные и отделочные материалы (folder)/Эмаль алкидная	0	
3602766	4690417011292	Эмаль алкидная красиво пф-115 зеленая жб 1.8kg	296462	Строительные и отделочные материалы (folder)/Эмаль алкидная	0	
3602767	4690417011131	Эмаль алкидная красиво пф-115 серая жб 1.8kg	296462	Строительные и отделочные материалы (folder)/Эмаль алкидная	0	
3602776	4690417011216	Эмаль алкидная красиво пф-115 синяя быстросохнущая жб 1.8kg	296462	Строительные и отделочные материалы (folder)/Эмаль алкидная	0	
3602768	4690417011179	Эмаль алкидная красиво пф-115 черная быстросохнущая жб 1.8kg	296462	Строительные и отделочные материалы (folder)/Эмаль алкидная	0	
3374651	4650001278517	Эмаль алкидная краска status пф-115 глянцевая 1.8kg	296462	Строительные и отделочные материалы (folder)/Эмаль алкидная	0	
3374652	4650001278555	Эмаль алкидная краска status пф-115 глянцевая 1.8kg #2	296462	Строительные и отделочные материалы (folder)/Эмаль алкидная	0	
1240246	4823048000421	Эмаль алкидная краска зебра зеленая 0.9	296462	Строительные и отделочные материалы (folder)/Эмаль алкидная	0	
3602778	4607023392745	Эмаль алкидная краски квил пф-115 универсальная цвет светло-серый жб 0.9kg	296462	Строительные и отделочные материалы (folder)/Эмаль алкидная	0	
3602780	4607023393988	Эмаль алкидная краски квил пф-115 цвет красный универсальная жб 1.01kg	296462	Строительные и отделочные материалы (folder)/Эмаль алкидная	0	
3602781	4607023390123	Эмаль алкидная краски квил пф-266 для пола глянцевая желто-коричневая жб 2.8kg	296462	Строительные и отделочные материалы (folder)/Эмаль алкидная	0	
3602786	4630005665483	Эмаль алкидная лайт белая для внутренних и наружных работ 0.9kg	296462	Строительные и отделочные материалы (folder)/Эмаль алкидная	0	
3602787	4630005668521	Эмаль алкидная лайт для пола желто-коричневая 2.7kg	296462	Строительные и отделочные материалы (folder)/Эмаль алкидная	0	
3602788	4630005668774	Эмаль алкидная лайт золотисто-коричневая для пола жб 900g	296462	Строительные и отделочные материалы (folder)/Эмаль алкидная	0	
3602789	4630005665490	Эмаль алкидная лайт цвет белый 1.9kg	296462	Строительные и отделочные материалы (folder)/Эмаль алкидная	0	
3602790	4603292012865	Эмаль алкидная лакра для радиаторов отопления белый №130017862 жб 0.9kg	296462	Строительные и отделочные материалы (folder)/Эмаль алкидная	544986	Лакра
3602808	4603292001647	Эмаль алкидная лакра пф-266 для пола желто-коричневая жб 1kg	296462	Строительные и отделочные материалы (folder)/Эмаль алкидная	544986	Лакра
870387	4603292001890	Эмаль алкидная лакра пф-266 для пола желто-коричневая жб 2.0kg	296462	Строительные и отделочные материалы (folder)/Эмаль алкидная	544986	Лакра
544874	4601541138069	Эмаль алкидная ленинградские краски оптиум пф-115 цвет красно-коричневый жб 1.9kg	296462	Строительные и отделочные материалы (folder)/Эмаль алкидная	444813	Ленинградские Краски
544873	4601541137666	Эмаль алкидная ленинградские краски оптиум пф-115 цвет красно-коричневый жб 900g	296462	Строительные и отделочные материалы (folder)/Эмаль алкидная	444813	Ленинградские Краски
544916	4601541138045	Эмаль алкидная ленинградские краски пф-115 оптиум цвет шоколадный жб 900g	296462	Строительные и отделочные материалы (folder)/Эмаль алкидная	444813	Ленинградские Краски
3602817	4690233012855	Эмаль алкидная май пф-115 универсальная цвет желтый 1.9kg т/у	296462	Строительные и отделочные материалы (folder)/Эмаль алкидная	5319846	ярославские краски
3602818	4690233013005	Эмаль алкидная май пф-115 универсальная цвет синий 1.9kg т/у	296462	Строительные и отделочные материалы (folder)/Эмаль алкидная	5319846	ярославские краски
3602822	4820128940011	Эмаль алкидная микс белая 0.9kg	296462	Строительные и отделочные материалы (folder)/Эмаль алкидная	0	
3602829	4820128941865	Эмаль алкидная микс для радиаторов белая 0.9kg	296462	Строительные и отделочные материалы (folder)/Эмаль алкидная	0	
3602823	4820128940233	Эмаль алкидная микс желтая 0.9kg	296462	Строительные и отделочные материалы (folder)/Эмаль алкидная	0	
3602824	4820128940042	Эмаль алкидная микс зеленая 0.9kg	296462	Строительные и отделочные материалы (folder)/Эмаль алкидная	0	
3602825	4820128940271	Эмаль алкидная микс кремовая 0.9kg	296462	Строительные и отделочные материалы (folder)/Эмаль алкидная	0	
3602826	4820128940165	Эмаль алкидная микс серая 0.9kg	296462	Строительные и отделочные материалы (folder)/Эмаль алкидная	0	
3602827	4820128940141	Эмаль алкидная микс серебро 0.9kg	296462	Строительные и отделочные материалы (folder)/Эмаль алкидная	0	
3602828	4820128940301	Эмаль алкидная микс сиреневая 0.9kg	296462	Строительные и отделочные материалы (folder)/Эмаль алкидная	0	
3602831	4630005660181	Эмаль алкидная невские краски пф-115 цвет белый 2.7kg ведро	296462	Строительные и отделочные материалы (folder)/Эмаль алкидная	0	
3602832	4630005667487	Эмаль алкидная невские краски пф-115 цвет белый 6kg ведро	296462	Строительные и отделочные материалы (folder)/Эмаль алкидная	0	
3602833	4630005660266	Эмаль алкидная невские краски пф-115 цвет желтый 0.9kg	296462	Строительные и отделочные материалы (folder)/Эмаль алкидная	0	
3602834	4630005660211	Эмаль алкидная невские краски пф-115 цвет красный 0.9kg	296462	Строительные и отделочные материалы (folder)/Эмаль алкидная	0	
3602835	4630005666664	Эмаль алкидная невские краски пф-115 цвет оранжевый 0.9kg	296462	Строительные и отделочные материалы (folder)/Эмаль алкидная	0	
3602836	4630005660150	Эмаль алкидная невские краски пф-115 цвет синий 1.9kg	296462	Строительные и отделочные материалы (folder)/Эмаль алкидная	0	
3602838	4665294032111	Эмаль алкидная новоколор пф-115 голубая жб 900g	296462	Строительные и отделочные материалы (folder)/Эмаль алкидная	0	
544756	4607100770497	Эмаль алкидная олеколор пф-115 желтая жб 800g	296462	Строительные и отделочные материалы (folder)/Эмаль алкидная	455324	Olecolor
479097	4607100770916	Эмаль алкидная олеколор пф-115 салатный №11033-3 жб 0.8kg	296462	Строительные и отделочные материалы (folder)/Эмаль алкидная	455324	Olecolor
544787	4607065879044	Эмаль алкидная олимп белая глянцевая 0.9л 13343	296462	Строительные и отделочные материалы (folder)/Эмаль алкидная	37492	Олимп
544788	4607065879068	Эмаль алкидная олимп белая глянцевая 2.7л 13344	296462	Строительные и отделочные материалы (folder)/Эмаль алкидная	37492	Олимп
544789	4607065879143	Эмаль алкидная олимп белая п/матовая 0.9л 13706	296462	Строительные и отделочные материалы (folder)/Эмаль алкидная	37492	Олимп
544790	4607065879167	Эмаль алкидная олимп белая п/матовая 2.7л 13707	296462	Строительные и отделочные материалы (folder)/Эмаль алкидная	37492	Олимп
544791	4607065879099	Эмаль алкидная олимп глянцевая база с 0.9л 13203	296462	Строительные и отделочные материалы (folder)/Эмаль алкидная	37492	Олимп
544792	4607065879112	Эмаль алкидная олимп глянцевая база с 2.7л 13204	296462	Строительные и отделочные материалы (folder)/Эмаль алкидная	37492	Олимп
544793	4607065879198	Эмаль алкидная олимп п/матовая база с 0.9л 15885	296462	Строительные и отделочные материалы (folder)/Эмаль алкидная	37492	Олимп
544794	4607065879211	Эмаль алкидная олимп п/матовая база с 2.7л 15886	296462	Строительные и отделочные материалы (folder)/Эмаль алкидная	37492	Олимп
3602868	4605365005323	Эмаль алкидная ореол для пола цвет золотисто-коричневый 0.9kg	296462	Строительные и отделочные материалы (folder)/Эмаль алкидная	0	
3602871	4610001251002	Эмаль алкидная палитра пф-115 голубая жб 2.7kg	296462	Строительные и отделочные материалы (folder)/Эмаль алкидная	0	
3602606	4610001522454	Эмаль алкидная пейзаж пф-115цв черный ту жб 900g краски черноземья	296462	Строительные и отделочные материалы (folder)/Эмаль алкидная	0	
3602876	4627112940848	Эмаль алкидная первая линия аэрозольная 520ml	296462	Строительные и отделочные материалы (folder)/Эмаль алкидная	0	
3602877	4627112940855	Эмаль алкидная первая линия аэрозольная 520ml #2	296462	Строительные и отделочные материалы (folder)/Эмаль алкидная	0	
3602878	4627112940893	Эмаль алкидная первая линия аэрозольная 520ml #3	296462	Строительные и отделочные материалы (folder)/Эмаль алкидная	0	
3602879	4627112940909	Эмаль алкидная первая линия аэрозольная 520ml #4	296462	Строительные и отделочные материалы (folder)/Эмаль алкидная	0	
3602880	4627112940923	Эмаль алкидная первая линия аэрозольная 520ml #5	296462	Строительные и отделочные материалы (folder)/Эмаль алкидная	0	
3602881	4627112940954	Эмаль алкидная первая линия аэрозольная 520ml #6	296462	Строительные и отделочные материалы (folder)/Эмаль алкидная	0	
5858850	4002381965295	Эмаль алкидная по ржавчине alpina директ оф рост, alpina direkt auf rost, ral3000 красный 2.5л / 2.425kg	296462	Строительные и отделочные материалы (folder)/Эмаль алкидная	182203	Alpina
5858851	4002381965301	Эмаль алкидная по ржавчине alpina директ оф рост, alpina direkt auf rost, ral3000 красный 750ml / 0.728kg	296462	Строительные и отделочные материалы (folder)/Эмаль алкидная	182203	Alpina
5858852	4002381965615	Эмаль алкидная по ржавчине alpina директ оф рост, alpina direkt auf rost, ral9006 серебряный 2.5л / 2.34kg	296462	Строительные и отделочные материалы (folder)/Эмаль алкидная	182203	Alpina
5858853	4002381965622	Эмаль алкидная по ржавчине alpina директ оф рост, alpina direkt auf rost, ral9006 серебряный 750ml / 0.702kg	296462	Строительные и отделочные материалы (folder)/Эмаль алкидная	182203	Alpina
5120770	4002381965653	Эмаль алкидная по ржавчине alpina директ оф рост, alpina direkt auf rost, ral9016 яркий белый 2.5л / 2.875kg	296462	Строительные и отделочные материалы (folder)/Эмаль алкидная	182203	Alpina
3602917	4607145930016	Эмаль алкидная Престиж premium универсальная белая жб 0.4kg	296462	Строительные и отделочные материалы (folder)/Эмаль алкидная	0	
3602918	4607145930252	Эмаль алкидная Престиж premium универсальная голубая жб 0.4kg	296462	Строительные и отделочные материалы (folder)/Эмаль алкидная	0	
3602919	4607145930405	Эмаль алкидная Престиж premium универсальная зеленая жб 0.4kg	296462	Строительные и отделочные материалы (folder)/Эмаль алкидная	0	
3602920	4607145931860	Эмаль алкидная Престиж premium универсальная розовая жб 0.9kg	296462	Строительные и отделочные материалы (folder)/Эмаль алкидная	0	
3602927	4607145930115	Эмаль алкидная Престиж глянцевая пф-115 0.9 желтая	296462	Строительные и отделочные материалы (folder)/Эмаль алкидная	0	
3602928	4607145930191	Эмаль алкидная Престиж глянцевая пф-115 0.9 красная	296462	Строительные и отделочные материалы (folder)/Эмаль алкидная	0	
3602942	4607145930665	Эмаль алкидная Престиж пф-115 глянцевая бежевая жб 900g	296462	Строительные и отделочные материалы (folder)/Эмаль алкидная	0	
5650127	4823071913132	Эмаль алкидная промфарба пф-115 серый глянец 2tchk 8kg	296462	Строительные и отделочные материалы (folder)/Эмаль алкидная	0	
3602985	4605544013460	Эмаль алкидная пф-115 0.9kg	296462	Строительные и отделочные материалы (folder)/Эмаль алкидная	0	
3602986	4690417011322	Эмаль алкидная пф-115 0.9kg желтая	296462	Строительные и отделочные материалы (folder)/Эмаль алкидная	0	
2765370	4690416047964	Эмаль алкидная пф-115 1.9kg голуб farbitex	296462	Строительные и отделочные материалы (folder)/Эмаль алкидная	0	
2505478	4690416050353	Эмаль алкидная пф-115 1.9kg ежевичный	296462	Строительные и отделочные материалы (folder)/Эмаль алкидная	0	
2505479	4690416048145	Эмаль алкидная пф-115 1.9kg зелен farbitex	296462	Строительные и отделочные материалы (folder)/Эмаль алкидная	0	
2765372	4690416050681	Эмаль алкидная пф-115 1.9kg изумрудный	296462	Строительные и отделочные материалы (folder)/Эмаль алкидная	0	
2505481	4690416050261	Эмаль алкидная пф-115 1.9kg малиновый	296462	Строительные и отделочные материалы (folder)/Эмаль алкидная	0	
2505482	4690416049142	Эмаль алкидная пф-115 1.9kg морская волна	296462	Строительные и отделочные материалы (folder)/Эмаль алкидная	0	
2505483	4690416049999	Эмаль алкидная пф-115 1.9kg оранжевый	296462	Строительные и отделочные материалы (folder)/Эмаль алкидная	0	
2505484	4690416050087	Эмаль алкидная пф-115 1.9kg персиковый	296462	Строительные и отделочные материалы (folder)/Эмаль алкидная	0	
2505485	4690416049418	Эмаль алкидная пф-115 1.9kg розовый	296462	Строительные и отделочные материалы (folder)/Эмаль алкидная	0	
2505487	4690416048237	Эмаль алкидная пф-115 1.9kg синий	296462	Строительные и отделочные материалы (folder)/Эмаль алкидная	0	
2505488	4690416049500	Эмаль алкидная пф-115 1.9kg сиреневый	296462	Строительные и отделочные материалы (folder)/Эмаль алкидная	0	
2505489	4690416050599	Эмаль алкидная пф-115 1.9kg слоновая кость	296462	Строительные и отделочные материалы (folder)/Эмаль алкидная	0	
2505490	4690416050445	Эмаль алкидная пф-115 1.9kg терракотовый	296462	Строительные и отделочные материалы (folder)/Эмаль алкидная	0	
2505491	4690416049593	Эмаль алкидная пф-115 1.9kg фиолетовый	296462	Строительные и отделочные материалы (folder)/Эмаль алкидная	0	
2765374	4690416050179	Эмаль алкидная пф-115 1.9kg хаки farbitex	296462	Строительные и отделочные материалы (folder)/Эмаль алкидная	0	
2505494	4690416050704	Эмаль алкидная пф-115 2.7kg изумрудный	296462	Строительные и отделочные материалы (folder)/Эмаль алкидная	0	
544980	4607100770022	Эмаль алкидная пф-115 olecolor 1.9kg цв белый	296462	Строительные и отделочные материалы (folder)/Эмаль алкидная	455324	Olecolor
3603032	4640010674912	Эмаль алкидная пф-115 белая 0.8kg	296462	Строительные и отделочные материалы (folder)/Эмаль алкидная	0	
3602607	4610001490012	Эмаль алкидная пф-115 белая 1л	296462	Строительные и отделочные материалы (folder)/Эмаль алкидная	0	
3602608	4610001497622	Эмаль алкидная пф-115 белая 2.3л belcolor	296462	Строительные и отделочные материалы (folder)/Эмаль алкидная	0	
3603016	4660000537454	Эмаль алкидная пф-115 глянцевая 1.9kg	296462	Строительные и отделочные материалы (folder)/Эмаль алкидная	0	
3603017	4610007802901	Эмаль алкидная пф-115 глянцевая зеленая 5kg	296462	Строительные и отделочные материалы (folder)/Эмаль алкидная	0	
3603018	4660000536754	Эмаль алкидная пф-115 глянцевая красная 1.9kg	296462	Строительные и отделочные материалы (folder)/Эмаль алкидная	0	
3603019	4660000536969	Эмаль алкидная пф-115 глянцевая парижская зелень 1.9kg	296462	Строительные и отделочные материалы (folder)/Эмаль алкидная	0	
3603020	4660000537102	Эмаль алкидная пф-115 глянцевая цвет светло-голубой,1.9kg	296462	Строительные и отделочные материалы (folder)/Эмаль алкидная	0	
3603021	4660000537379	Эмаль алкидная пф-115 глянцевая цвет феолетовый, 0.8kg	296462	Строительные и отделочные материалы (folder)/Эмаль алкидная	0	
3603022	4610007802208	Эмаль алкидная пф-115 глянцевая, цвет оранжевый,0.8kg	296462	Строительные и отделочные материалы (folder)/Эмаль алкидная	0	
3603023	4640007585160	Эмаль алкидная пф-115 голубой жб 0.9kg	296462	Строительные и отделочные материалы (folder)/Эмаль алкидная	0	
3602609	4610001497684	Эмаль алкидная пф-115 зеленая 2.3л belcolor	296462	Строительные и отделочные материалы (folder)/Эмаль алкидная	0	
3602610	4690416050667	Эмаль алкидная пф-115 изумрудный 0.9kg	296462	Строительные и отделочные материалы (folder)/Эмаль алкидная	0	
3603024	4690417019342	Эмаль алкидная пф-115 коричневая 0.92kg	296462	Строительные и отделочные материалы (folder)/Эмаль алкидная	0	
3603025	4607127240553	Эмаль алкидная пф-115 коричневая жб 0.9kg	296462	Строительные и отделочные материалы (folder)/Эмаль алкидная	0	
544767	4607100770923	Эмаль алкидная пф-115 олеколор цв салатный жб авс фарбен	296462	Строительные и отделочные материалы (folder)/Эмаль алкидная	455324	Olecolor
3602612	4660000537041	Эмаль алкидная пф-115 салатный 2.7kg	296462	Строительные и отделочные материалы (folder)/Эмаль алкидная	0	
3603026	4640007586471	Эмаль алкидная пф-115 серая 2.8kg	296462	Строительные и отделочные материалы (folder)/Эмаль алкидная	0	
3602613	4690416049487	Эмаль алкидная пф-115 сиреневый 0.9kg	296462	Строительные и отделочные материалы (folder)/Эмаль алкидная	0	
