ID	UPCEAN	Name	CategoryID	CategoryName	BrandID	BrandName
283208	5949475000328	Вино Pinot Grigio резерв башус бел сух 750ml 12% /Румыния/	22133	Продукты питания (folder)/Алкогольные напитки/Вино (folder)/Вино	0	
3791721	4670003270401	Вино Pinot Grigio резерв бел п/ сух 13% 750ml	22133	Продукты питания (folder)/Алкогольные напитки/Вино (folder)/Вино	0	
3791722	8009620832284	Вино Pinot Grigio розе д.венец. розов сух 750ml	22133	Продукты питания (folder)/Алкогольные напитки/Вино (folder)/Вино	3647683	DUCENTO
283209	8003545996984	Вино Pinot Grigio розе каналетто розов сух 750ml	22470	Продукты питания (folder)/Алкогольные напитки/Вино (folder)/Вина Италии	0	
1194856	8007890924449	Вино Pinot Grigio санвиджилио бел сух 750ml 12% Италия	22133	Продукты питания (folder)/Алкогольные напитки/Вино (folder)/Вино	3794269	CAVIT S.C.
3285016	4607940840657	Вино Pinot Grigio столов сухое белое 11-13% 750ml стекло	22133	Продукты питания (folder)/Алкогольные напитки/Вино (folder)/Вино	0	
690613	4006975170751	Вино Pinot Grigio страда дель вино белое полусухое столов 10.5% 750ml стекло	22133	Продукты питания (folder)/Алкогольные напитки/Вино (folder)/Вино	0	
1194858	8021507738601	Вино Pinot Grigio сухое 13% 750ml	22133	Продукты питания (folder)/Алкогольные напитки/Вино (folder)/Вино	0	
3285019	8003971513007	Вино Pinot Grigio сухое белое 12% 750ml ст/б	22133	Продукты питания (folder)/Алкогольные напитки/Вино (folder)/Вино	0	
283210	8021871111093	Вино Pinot Grigio тифенбруннер бел сух 750ml 12.5% Италия	22133	Продукты питания (folder)/Алкогольные напитки/Вино (folder)/Вино	0	
2854545	8004006001339	Вино Pinot Grigio тре фили игт провинция павия геогр. указ. бел сух 12% 750ml (Италия)	22133	Продукты питания (folder)/Алкогольные напитки/Вино (folder)/Вино	0	
283211	4840454002641	Вино Pinot Grigio фаерберд бел сух 750ml 12.5% /Молдова/	22133	Продукты питания (folder)/Алкогольные напитки/Вино (folder)/Вино	0	
1194867	4603040009376	Вино Pinot Noir Merlot фанагории красн сух 750ml 12-14% /авторское вино/Россия/	22133	Продукты питания (folder)/Алкогольные напитки/Вино (folder)/Вино	0	
2854546	4840254002209	Вино Pinot Noir бон вояж кра/пс 1.0	22133	Продукты питания (folder)/Алкогольные напитки/Вино (folder)/Вино	0	
283213	3250670000191	Вино Pinot Noir буpгундское красное сухое 12.5% 750ml стекло	41821	Продукты питания (folder)/Алкогольные напитки/Вино (folder)/Вина Франции	0	
2426559	4840635001937	Вино Pinot Noir вилла красн сух 10-13% 750ml	22133	Продукты питания (folder)/Алкогольные напитки/Вино (folder)/Вино	0	
151429	4840325002916	Вино Pinot Noir винатерра п/сух красн 11% 750ml	22133	Продукты питания (folder)/Алкогольные напитки/Вино (folder)/Вино	149689	Русьимпорт
1194861	4840325007263	Вино Pinot Noir городешты красн п/ сух 10-12% 750ml	22133	Продукты питания (folder)/Алкогольные напитки/Вино (folder)/Вино	0	
690615	4840472005556	Вино Pinot Noir де пуркарь 750ml 0% сухое выдержанное	22133	Продукты питания (folder)/Алкогольные напитки/Вино (folder)/Вино	5294853	Purcari
690616	3566921003010	Вино Pinot Noir домейн де вальмуазин луи латур 750ml 0% сухое	22133	Продукты питания (folder)/Алкогольные напитки/Вино (folder)/Вино	0	
2426560	484026700371	Вино Pinot Noir зол/фонд красн сух 11% 750ml	22133	Продукты питания (folder)/Алкогольные напитки/Вино (folder)/Вино	0	
2426561	4840249003594	Вино Pinot Noir Коллекция виста красн п/сух 11.5% 750ml	22133	Продукты питания (folder)/Алкогольные напитки/Вино (folder)/Вино	0	
3290428	4606285005745	Вино Pinot Noir Коллекция мильстрим розовое сухое 10-12% 750ml ст/б	22133	Продукты питания (folder)/Алкогольные напитки/Вино (folder)/Вино	0	
2426562	4840234001031	Вино Pinot Noir красн п/сух бархат 9-12% 750ml	22133	Продукты питания (folder)/Алкогольные напитки/Вино (folder)/Вино	0	
2426563	484023400137	Вино Pinot Noir красн п/сух виниа 9-12% 1.500	22133	Продукты питания (folder)/Алкогольные напитки/Вино (folder)/Вино	0	
2426564	4840234002038	Вино Pinot Noir красн п/сух виниа 9-12% 1.500 #2	22133	Продукты питания (folder)/Алкогольные напитки/Вино (folder)/Вино	0	
2426565	4840635001883	Вино Pinot Noir красн полусладк 10-13% 750ml	22133	Продукты питания (folder)/Алкогольные напитки/Вино (folder)/Вино	0	
2854547	4840635002347	Вино Pinot Noir красн полусладк 10-13% 750ml #2	22133	Продукты питания (folder)/Алкогольные напитки/Вино (folder)/Вино	0	
2426566	4840234002014	Вино Pinot Noir красн полусладк виниа барх 9-12% 750ml	22133	Продукты питания (folder)/Алкогольные напитки/Вино (folder)/Вино	0	
151428	4840519000315	Вино Pinot Noir красн полусладк лист молд. 750ml	22133	Продукты питания (folder)/Алкогольные напитки/Вино (folder)/Вино	0	
2426567	3800750998636	Вино Pinot Noir красн полусладк мон/легенда 10-12% 0.700	1759169	Продукты питания (folder)/Алкогольные напитки/Вино (folder)/Вина Болгарии	0	
45400	4840454002276	Вино Pinot Noir красн сух 12.5% 750ml аурвин	22133	Продукты питания (folder)/Алкогольные напитки/Вино (folder)/Вино	0	
1194863	5319990921253	Вино Pinot Noir красн сух 13% повардария 750ml	22133	Продукты питания (folder)/Алкогольные напитки/Вино (folder)/Вино	0	
2854548	4840635000916	Вино Pinot Noir красн сух 750ml	22133	Продукты питания (folder)/Алкогольные напитки/Вино (folder)/Вино	0	
2854549	5942048002040	Вино Pinot Noir красн сух 750ml #2	22133	Продукты питания (folder)/Алкогольные напитки/Вино (folder)/Вино	0	
3793923	4840045006041	Вино Pinot Noir красн сух 750ml #3	22133	Продукты питания (folder)/Алкогольные напитки/Вино (folder)/Вино	0	
1194862	3800008162833	Вино Pinot Noir красн сух 750ml 13% /Дионис/Болгария/	1759169	Продукты питания (folder)/Алкогольные напитки/Вино (folder)/Вина Болгарии	0	
43073	4840454000616	Вино Pinot Noir красн сух 750ml 13% /Молдова/	22133	Продукты питания (folder)/Алкогольные напитки/Вино (folder)/Вино	43032	Дионис клуб
2426568	4840358004710	Вино Pinot Noir красн сух аскони 12% 750ml	22133	Продукты питания (folder)/Алкогольные напитки/Вино (folder)/Вино	0	
151430	4840519000131	Вино Pinot Noir красн сух гончар молд. 750ml	22133	Продукты питания (folder)/Алкогольные напитки/Вино (folder)/Вино	149689	Русьимпорт
2426569	4840052000377	Вино Pinot Noir красн сух хинчешты 9-11% 750ml	22133	Продукты питания (folder)/Алкогольные напитки/Вино (folder)/Вино	0	
3290429	4841451000234	Вино Pinot Noir красное полусладк 10-12% 750ml	22133	Продукты питания (folder)/Алкогольные напитки/Вино (folder)/Вино	0	
3290430	5310357000710	Вино Pinot Noir красное сухое 10.5% 750ml	22133	Продукты питания (folder)/Алкогольные напитки/Вино (folder)/Вино	0	
3290431	4623721125089	Вино Pinot Noir крымский красное полусладк 10-12% 750ml ст/б	22133	Продукты питания (folder)/Алкогольные напитки/Вино (folder)/Вино	0	
3290432	4623721254635	Вино Pinot Noir крымский красное полусладк 10-12% 750ml стекло	22133	Продукты питания (folder)/Алкогольные напитки/Вино (folder)/Вино	0	
2720667	4680016072671	Вино Pinot Noir крымский столов полусладк красное 10-13% 750ml стекло	22133	Продукты питания (folder)/Алкогольные напитки/Вино (folder)/Вино	0	
283216	9008303004689	Вино Pinot Noir курцберг красн сух 750ml 13% /Австрия/	22133	Продукты питания (folder)/Алкогольные напитки/Вино (folder)/Вино	0	
1194865	4840526004436	Вино Pinot Noir префератэ красн/сух 12% 750ml	22133	Продукты питания (folder)/Алкогольные напитки/Вино (folder)/Вино	3793991	ПРЕФЕРАТЭ
2426570	5998811510861	Вино Pinot Noir роял красн сух 11% 750ml	22133	Продукты питания (folder)/Алкогольные напитки/Вино (folder)/Вино	0	
283217	9421008351054	Вино Pinot Noir сателлит красн сух 750ml 13.5% /нов.зеландия/	22133	Продукты питания (folder)/Алкогольные напитки/Вино (folder)/Вино	0	
3290433	3800118140714	Вино Pinot Noir столов красн сух 750ml 12% тв	1759169	Продукты питания (folder)/Алкогольные напитки/Вино (folder)/Вина Болгарии	0	
3290434	4841451000135	Вино Pinot Noir столов красное полусладк 10-12% 750ml стбут	22133	Продукты питания (folder)/Алкогольные напитки/Вино (folder)/Вино	0	
3290435	4607111461759	Вино Pinot Noir столов сухое красное 12.5% 0.75 с/бут	22133	Продукты питания (folder)/Алкогольные напитки/Вино (folder)/Вино	0	
3290436	4670015959295	Вино Pinot Noir столов сухое красное 14% 750ml стбут	22133	Продукты питания (folder)/Алкогольные напитки/Вино (folder)/Вино	0	
3285020	4606285006797	Вино Pinot Noir столов сухое розовое 11-13% 750ml стекло	22133	Продукты питания (folder)/Алкогольные напитки/Вино (folder)/Вино	0	
283219	4603040009321	Вино Pinot Noir фанагории номерной резерв красн сух 700ml 12-14% /Россия/	22133	Продукты питания (folder)/Алкогольные напитки/Вино (folder)/Вино	0	
4836912	4627152490778	Вино Pinot Noir фламинго павел швец красн сух 750ml	688533	Продукты питания (folder)/Алкогольные напитки/Вино (folder)/Вина России и ближнего зарубежья	4836699	Уппа Вайнери
3285021	5602154651432	Вино pintus сухое белое 13% 750ml стбут	22133	Продукты питания (folder)/Алкогольные напитки/Вино (folder)/Вино	0	
3285022	5602154652446	Вино pintus сухое красное 13% 750ml стбут	22133	Продукты питания (folder)/Алкогольные напитки/Вино (folder)/Вино	0	
3793723	8000013006176	Вино pirovano montepulciano dabruzzo красн сух 250ml	22133	Продукты питания (folder)/Алкогольные напитки/Вино (folder)/Вино	3792679	PIROVANO
3791725	8056838577124	Вино piz.past.vino ст. красн полусладк 10% 750ml	22133	Продукты питания (folder)/Алкогольные напитки/Вино (folder)/Вино	3791724	CASA DEL VINO
3791726	8056838577131	Вино piz.past.vino ст. красн сух 12% 750ml	22133	Продукты питания (folder)/Алкогольные напитки/Вино (folder)/Вино	3791724	CASA DEL VINO
3791727	8056838577148	Вино piz.past.vino ст.бел полусладк 10% 750ml	22133	Продукты питания (folder)/Алкогольные напитки/Вино (folder)/Вино	3791724	CASA DEL VINO
3791728	8056838577155	Вино piz.past.vino ст.бел сух 12% 750ml	22133	Продукты питания (folder)/Алкогольные напитки/Вино (folder)/Вино	3791724	CASA DEL VINO
2274442	8008863044638	Вино pizza pasta vino italia столов белое полусладк 11% 750ml стекло	22133	Продукты питания (folder)/Алкогольные напитки/Вино (folder)/Вино	0	
2274443	8008863044645	Вино pizza pasta vino italia столов красное полусладк 11% 750ml стекло	22133	Продукты питания (folder)/Алкогольные напитки/Вино (folder)/Вино	0	
227398	7809625200047	Вино pknt Cabernet Sauvignon красн сух 13% 750ml	22133	Продукты питания (folder)/Алкогольные напитки/Вино (folder)/Вино	330713	PKNT
1194845	7809625200061	Вино pknt Chardonnay столов белое п/сухое 13.5% 750ml ст/б	22133	Продукты питания (folder)/Алкогольные напитки/Вино (folder)/Вино	0	
227400	7809625200054	Вино pknt Merlot красн сух 13% 750ml	22133	Продукты питания (folder)/Алкогольные напитки/Вино (folder)/Вино	330713	PKNT
227401	7809625200092	Вино pknt Sauvignon blanc столов белое п/сухое 13.5% 750ml ст/б	22133	Продукты питания (folder)/Алкогольные напитки/Вино (folder)/Вино	330713	PKNT
227399	7809625200078	Вино pknt карминер красн сух 13% 750ml	22133	Продукты питания (folder)/Алкогольные напитки/Вино (folder)/Вино	330713	PKNT
227402	7809625200108	Вино pknt сомильон Chardonnay бел сух 13% 750ml	22133	Продукты питания (folder)/Алкогольные напитки/Вино (folder)/Вино	330713	PKNT
3791730	3760146571686	Вино place royalle бордо бел сух 750ml	22133	Продукты питания (folder)/Алкогольные напитки/Вино (folder)/Вино	3791729	Place Royalle
1760197	3192040327869	Вино place royalle бордо красн сух 750ml	22133	Продукты питания (folder)/Алкогольные напитки/Вино (folder)/Вино	3791729	Place Royalle
3791731	3192040345658	Вино place royalle бордо красн сух 750ml #2	22133	Продукты питания (folder)/Алкогольные напитки/Вино (folder)/Вино	3791729	Place Royalle
3791732	3192040420980	Вино place royalle бордо красн сух 750ml #3	22133	Продукты питания (folder)/Алкогольные напитки/Вино (folder)/Вино	3791729	Place Royalle
3791733	3192040435595	Вино place royalle бордо красн сух 750ml #4	22133	Продукты питания (folder)/Алкогольные напитки/Вино (folder)/Вино	3791729	Place Royalle
3791734	3192040450390	Вино place royalle бордо красн сух 750ml #5	22133	Продукты питания (folder)/Алкогольные напитки/Вино (folder)/Вино	3791729	Place Royalle
3791735	3192040475058	Вино place royalle бордо красн сух 750ml #6	22133	Продукты питания (folder)/Алкогольные напитки/Вино (folder)/Вино	3791729	Place Royalle
2720480	4630003651631	Вино plaisance Cabernet столов сухое красное 10-12% tetrapak 1л	22133	Продукты питания (folder)/Алкогольные напитки/Вино (folder)/Вино	0	
2720954	4630003651655	Вино plaisance Chardonnay столов полусухое белое 10-12% tetrapak 1л	22133	Продукты питания (folder)/Алкогольные напитки/Вино (folder)/Вино	0	
2720445	4630003651624	Вино plaisance изабеллла столов полусладк красное 10-12% tetrapak 1л	22133	Продукты питания (folder)/Алкогольные напитки/Вино (folder)/Вино	0	
283229	4630003650023	Вино plaisance мускат белое полусладк 9-11% tetrapak 1л	22133	Продукты питания (folder)/Алкогольные напитки/Вино (folder)/Вино	0	
3285023	4630003651648	Вино plaisance мускат столов полусладк белое 10-12% tetrapak 1л	22133	Продукты питания (folder)/Алкогольные напитки/Вино (folder)/Вино	0	
2227067	3899003001032	Вино plantaze Cabernet географ красн сух 0.75 1/6 13.5%	22133	Продукты питания (folder)/Алкогольные напитки/Вино (folder)/Вино	0	
171034	8600143001036	Вино plantaze Cabernet черногорское красн сух 13.5% 750ml /черногория/	22133	Продукты питания (folder)/Алкогольные напитки/Вино (folder)/Вино	0	
2227473	3899003002053	Вино plantaze Chardonnay баррик бел сух 0.75 1/6	22133	Продукты питания (folder)/Алкогольные напитки/Вино (folder)/Вино	0	
2227472	3899003002015	Вино plantaze Chardonnay географ бел сух 0.75 1/6	22133	Продукты питания (folder)/Алкогольные напитки/Вино (folder)/Вино	0	
171035	8600143002019	Вино plantaze Chardonnay черногорское бел сух 750ml 13.5% /ченогор./	22133	Продукты питания (folder)/Алкогольные напитки/Вино (folder)/Вино	0	
2227248	3899003001025	Вино plantaze Merlot географ красн сух 0.75 1/6	22133	Продукты питания (folder)/Алкогольные напитки/Вино (folder)/Вино	0	
283053	8600143001029	Вино plantaze Merlot черногорское красн сух 750ml 13.5% /черногория/	22133	Продукты питания (folder)/Алкогольные напитки/Вино (folder)/Вино	0	
2227392	3899003002022	Вино plantaze Sauvignon бел/сух 0.75 13.5% 1/6	22133	Продукты питания (folder)/Алкогольные напитки/Вино (folder)/Вино	0	
2226917	3899003001131	Вино plantaze вранац баррик красн сух 0.75 1/6	22133	Продукты питания (folder)/Алкогольные напитки/Вино (folder)/Вино	0	
1192567	3899003001001	Вино plantaze вранац красн сух 750ml	22133	Продукты питания (folder)/Алкогольные напитки/Вино (folder)/Вино	3791736	ПЛАНТАЖЕ
45425	8600143001012	Вино plantaze вранац про корде красн сух орд. 750ml 13.5% /черногор./	22133	Продукты питания (folder)/Алкогольные напитки/Вино (folder)/Вино	45423	Плантазе
45424	8600143001005	Вино plantaze вранац черногорское красн сух 13% 750ml /черногория/	22133	Продукты питания (folder)/Алкогольные напитки/Вино (folder)/Вино	45423	Плантазе
45426	8600143002002	Вино plantaze крстач черногорское бел сух 750ml 12.5% /черногория/	22133	Продукты питания (folder)/Алкогольные напитки/Вино (folder)/Вино	45423	Плантазе
1194483	3899003006037	Вино plantaze медун красн сл.выд. 500ml 15% под/уп /черногория/	22133	Продукты питания (folder)/Алкогольные напитки/Вино (folder)/Вино	0	
3791738	3899003002169	Вино plantaze монтен.вайт бел полусладк 750ml	22133	Продукты питания (folder)/Алкогольные напитки/Вино (folder)/Вино	3791737	PLANTAZE
283088	8600143001128	Вино plantaze монтенегрин блэк красн полусладк орд. 750ml 12% /черногория/	22133	Продукты питания (folder)/Алкогольные напитки/Вино (folder)/Вино	3791736	ПЛАНТАЖЕ
2227269	3899003001117	Вино plantaze монтенегрин блэк красн сух 0.75 1/6	22133	Продукты питания (folder)/Алкогольные напитки/Вино (folder)/Вино	3791736	ПЛАНТАЖЕ
283089	8600143001111	Вино plantaze монтенегрин блэк красн сух орд. 750ml 11.5% /черногория	22133	Продукты питания (folder)/Алкогольные напитки/Вино (folder)/Вино	0	
283090	3899003001186	Вино plantaze монтенегрин шевал красн сух орд. 750ml 13.5% /черногория	22133	Продукты питания (folder)/Алкогольные напитки/Вино (folder)/Вино	0	
3285024	8410775500018	Вино plaza alta столов белое 11% 750ml	22133	Продукты питания (folder)/Алкогольные напитки/Вино (folder)/Вино	0	
1194889	8422795000492	Вино plaza de corrida соловое белое полусладк 9% 750ml стбут	22133	Продукты питания (folder)/Алкогольные напитки/Вино (folder)/Вино	0	
3285025	4650061340100	Вино plum Rose сливовое розовое фруктовое полусладк 10-12% 1.5л ст/б	22133	Продукты питания (folder)/Алкогольные напитки/Вино (folder)/Вино	0	
3285026	4650061340674	Вино plum White сливовое белое полусладк 11% 700ml стекло	22133	Продукты питания (folder)/Алкогольные напитки/Вино (folder)/Вино	0	
1659761	8020735008005	Вино plumbago регион сицилия igt красное сухое 13.5% Италия 750ml	22133	Продукты питания (folder)/Алкогольные напитки/Вино (folder)/Вино	0	
283232	8008530010270	Вино poggese бел полусладк столов 1.0л 10% Италия русьимпорт/	22470	Продукты питания (folder)/Алкогольные напитки/Вино (folder)/Вина Италии	0	
45445	8008530008826	Вино poggese бьянко бел сух 1.0л 11% Италия	22470	Продукты питания (folder)/Алкогольные напитки/Вино (folder)/Вина Италии	45444	Подджезе
283233	8008530010287	Вино poggese красн полусладк столов 1.0л 10% Италия	22470	Продукты питания (folder)/Алкогольные напитки/Вино (folder)/Вина Италии	0	
45446	8008530008833	Вино poggese красн сух столов 1.0л 11.5% Италия	22470	Продукты питания (folder)/Алкогольные напитки/Вино (folder)/Вина Италии	45444	Подджезе
3791740	8008530010829	Вино poggese сух бел 10% 1.0л	22133	Продукты питания (folder)/Алкогольные напитки/Вино (folder)/Вино	3791739	POGGESE
3285027	8002793009194	Вино poggio Al sale chianti красное сухое 13% 750ml стекло	22133	Продукты питания (folder)/Алкогольные напитки/Вино (folder)/Вино	0	
3285028	8002793006810	Вино poggio Al sale красное сухое 13% 750ml стекло	22133	Продукты питания (folder)/Алкогольные напитки/Вино (folder)/Вино	0	
3285029	8002793007114	Вино poggio Al sale столов белое полусладк 12.5% 750ml стекло	22133	Продукты питания (folder)/Алкогольные напитки/Вино (folder)/Вино	0	
