ID	UPCEAN	Name	CategoryID	CategoryName	BrandID	BrandName
330500	5902062200396	Ящик для инструментов topex 400мм 5-секционный	344013	Инструменты (folder)/Ящик для инструментов	306818	TOPEX
330501	5902062200402	Ящик для инструментов topex 550мм, 5-секционный	344013	Инструменты (folder)/Ящик для инструментов	306818	TOPEX
330499	5902062791290	Ящик для инструментов topex 60x29 x 33см	344013	Инструменты (folder)/Ящик для инструментов	306818	TOPEX
330502	5902062200419	Ящик для инструментов topex 7-секционный	344013	Инструменты (folder)/Ящик для инструментов	306818	TOPEX
330492	5902062791207	Ящик для инструментов topex малый (79R120)	344013	Инструменты (folder)/Ящик для инструментов	306818	TOPEX
1980065	5902062791535	Ящик для инструментов topex малый с органайзером (79R123)	344013	Инструменты (folder)/Ящик для инструментов	0	
330503	5902062791160	Ящик для инструментов topex металлический, 520x220 x 300мм, 3 выдвижных ящика	344013	Инструменты (folder)/Ящик для инструментов	306818	TOPEX
3948128	4607110270031	Ящик для инструментов vira 13 800013	344013	Инструменты (folder)/Ящик для инструментов	3769123	VIRA
1832930	4607110270024	Ящик для инструментов vira 19 с органайз	344013	Инструменты (folder)/Ящик для инструментов	3769123	VIRA
5113726	4680001118568	Ящик для инструментов а-42 лотком и 2 органайзера на крышке zolder	41797	Инструменты (folder)/Инструмент	4862374	Zolder
545749	4607135610010	Ящик для инструментов а-50 универсальный	344013	Инструменты (folder)/Ящик для инструментов	297592	Matrix
5113727	4627122728016	Ящик для инструментов альтернатива (упак 6)	1	Неклассифицированные/default	149661	Альтернатива
3604339	4627102506436	Ящик для инструментов альтернатива универсальный с крышкой 415x210 x 210см	344013	Инструменты (folder)/Ящик для инструментов	149661	Альтернатива
2850818	4607016816913	Ящик для инструментов бытпласт 19 volf желтый/2	344013	Инструменты (folder)/Ящик для инструментов	0	
1980066	4607023592343	Ящик для инструментов гефест 18inch	344013	Инструменты (folder)/Ящик для инструментов	0	
1980067	4607023592350	Ящик для инструментов гефест 21inch	344013	Инструменты (folder)/Ящик для инструментов	0	
3604367	4620002021030	Ящик для инструментов дельта пластиковый 13inch (33x17.5x12.5см) 1/12 20190	344013	Инструменты (folder)/Ящик для инструментов	0	
545763	4620002021047	Ящик для инструментов дельта пластиковый 16inch (39x20 x 17см) 1/6 20200	344013	Инструменты (folder)/Ящик для инструментов	0	
3604369	4620002021061	Ящик для инструментов дельта пластиковый 16inch (41x21 x18.5см) 1/9 20220	344013	Инструменты (folder)/Ящик для инструментов	0	
3604370	4620002021078	Ящик для инструментов дельта пластиковый 19inch (48.5x24.5x21.5см) 1/9 20230	344013	Инструменты (folder)/Ящик для инструментов	0	
3604368	4620002021054	Ящик для инструментов дельта пластиковый 39x20 x 17см	344013	Инструменты (folder)/Ящик для инструментов	0	
3604310	4630017900510	Ящик для инструментов и мелочей martika	344013	Инструменты (folder)/Ящик для инструментов	0	
871436	7290103659127	Ящик для инструментов кетеr ex pose l51 хd 20.8 х н31 сm	344013	Инструменты (folder)/Ящик для инструментов	783628	КЕТЕR
871437	7290000235677	Ящик для инструментов кетеr falcon l 52.9xd 25.9xh 25.3 cm	344013	Инструменты (folder)/Ящик для инструментов	783628	КЕТЕR
871439	7290000229188	Ящик для инструментов кетеr hammer l 40.9xd 22.8xh 21.1 cm	344013	Инструменты (folder)/Ящик для инструментов	783628	КЕТЕR
871438	7290000229355	Ящик для инструментов кетеr hammer l 48.6 х d 26.2 хh 25.1 cm	344013	Инструменты (folder)/Ящик для инструментов	783628	КЕТЕR
871440	7290000237718	Ящик для инструментов кетеr Hawk l 54.5xd 27.9xh 24.4 cm	344013	Инструменты (folder)/Ящик для инструментов	783628	КЕТЕR
871441	7290103657574	Ящик для инструментов кетеr hobgreen l 39.7 х d 21.3 х h 20.6 cm	344013	Инструменты (folder)/Ящик для инструментов	783628	КЕТЕR
871442	7290005451911	Ящик для инструментов кетеr titan l 35.3xd 17.4 xh13.7 cm	344013	Инструменты (folder)/Ящик для инструментов	783628	КЕТЕR
871443	7290103656669	Ящик для инструментов кетеr рower l 41.9xd 32.7xh 20.5 cm	344013	Инструменты (folder)/Ящик для инструментов	783628	КЕТЕR
871444	7290005449338	Ящик для инструментов кетеr сlassic l 39.7xd 21.3xh 20.6 cm	344013	Инструменты (folder)/Ящик для инструментов	783628	КЕТЕR
545760	4607023590943	Ящик для инструментов м-пластик титан 13 324x165 x 137мм	344013	Инструменты (folder)/Ящик для инструментов	555296	М-Пластик
3604429	4607023590875	Ящик для инструментов м-пластика уран-21 арт м2925	344013	Инструменты (folder)/Ящик для инструментов	0	
545752	4607023590912	Ящик для инструментов м2931 титан 16	344013	Инструменты (folder)/Ящик для инструментов	3673575	М-Пластика Idea
545769	4606373073755	Ящик для инструментов Мастер Зубр 38180-16	344013	Инструменты (folder)/Ящик для инструментов	0	
3948145	4607023592497	Ящик для инструментов персей 16	344013	Инструменты (folder)/Ящик для инструментов	3673575	М-Пластика Idea
3948146	4607023594170	Ящик для инструментов персей 16 #2	344013	Инструменты (folder)/Ящик для инструментов	3673575	М-Пластика Idea
1980061	4034229020026	Ящик для инструментов пласт 16inch Мастер stayer 38110-16	344013	Инструменты (folder)/Ящик для инструментов	447542	Stayer
1980062	4606800033840	Ящик для инструментов пласт 20inch стелс 500x260 x260 90705	344013	Инструменты (folder)/Ящик для инструментов	0	
1832931	4690232021667	Ящик для инструментов пласт 315x150 x18	344013	Инструменты (folder)/Ящик для инструментов	0	
2765663	8404880655213	Ящик для инструментов пластиковый 16inch (41x22 x 19см), без органайзеров	344013	Инструменты (folder)/Ящик для инструментов	0	
5113728	4601787488799	Ящик для инструментов пластиковый 19 (48.5x24.5x21.5см)	3536	Хозяйственные товары (folder)/Хозяйственные товары	0	
2765664	8404880654971	Ящик для инструментов пластиковый 32.5x14.5x11.5	344013	Инструменты (folder)/Ящик для инструментов	0	
1712983	4690231069141	Ящик для инструментов пластиковый gw - 6618	344013	Инструменты (folder)/Ящик для инструментов	0	
871447	8711295869396	Ящик для инструментов пластм 30.5x15.5x 12см	344013	Инструменты (folder)/Ящик для инструментов	0	
871448	8013213002954	Ящик для инструментов пластм 40x23 x 20см	344013	Инструменты (folder)/Ящик для инструментов	0	
545755	4607145277715	Ящик для инструментов практик 19	344013	Инструменты (folder)/Ящик для инструментов	0	
330479	4690231007280	Ящик для инструментов пц3733 16.5 Grand	344013	Инструменты (folder)/Ящик для инструментов	309375	ООО Пи энд Си
545758	4607016811789	Ящик для инструментов с12250	344013	Инструменты (folder)/Ящик для инструментов	0	
545759	4607016815367	Ящик для инструментов с12260	344013	Инструменты (folder)/Ящик для инструментов	0	
545751	4607023590905	Ящик для инструментов титан м-13м 2930	344013	Инструменты (folder)/Ящик для инструментов	0	
3604379	4607023590851	Ящик для инструментов уран-21м 2923	344013	Инструменты (folder)/Ящик для инструментов	0	
1712981	8718158027757	Ящик для ключей 19x25.1x6.7см	1	Неклассифицированные/default	0	
180127	4005546103730	Ящик для ключей настенный 302x280 x 118мм на 18 ключей c 6-ю брелками в комплекте закрывается на ключ серебристый металлик	539687	Галантерея (folder)/Ключницы	65635	Durable
278355	4005546103761	Ящик для ключей настенный 302x400 x 118мм на 48 ключей c 6-ю брелками в комплекте два отделения закрывается на ключ серебристый	539687	Галантерея (folder)/Ключницы	65635	Durable
180129	4005546103778	Ящик для ключей настенный 302x400 x 118мм на 72 ключа c 6-ю брелками в комплекте два отделения закрывается на ключ серебристый	539687	Галантерея (folder)/Ключницы	65635	Durable
5113729	4620002022181	Ящик для крепежа (органайзер) 12 с замком	3536	Хозяйственные товары (folder)/Хозяйственные товары	0	
1346805	4606800033895	Ящик для крепежа (органайзер) stels (31x25 x50)	1	Неклассифицированные/default	3755599	STELS
1346806	4690335001962	Ящик для крепежа (органайзер) двухсторон кф, 32 секции (29.5x22 x7.6)	1	Неклассифицированные/default	3836574	КОНТРФОРС
2765665	8404880656418	Ящик для крепежа (органайзер) прозрачный 10inch (27.5x18.5x4.2см)	41797	Инструменты (folder)/Инструмент	0	
307797	5902062791634	Ящик для крепежа topex (органайзер) 36x25 x5.5см (79R163)	303859	Инструменты (folder)/Транспортировка и складирование	306818	TOPEX
1346807	8404880656555	Ящик для крепежа, 14inch., черный	1	Неклассифицированные/default	0	
3604380	4607023592831	Ящик для лекарств пластиковый 13.7x16.5x32.4см	1	Неклассифицированные/default	0	
1346808	3253922903011	Ящик для мастерской 43x29 x37 арт 02903	3536	Хозяйственные товары (folder)/Хозяйственные товары	0	
1346809	3253922910002	Ящик для мастерской 46x20 x40 арт 02910	3536	Хозяйственные товары (folder)/Хозяйственные товары	0	
1712982	6948743231043	Ящик для мелочей 35x27 x 9см/макст/36	3536	Хозяйственные товары (folder)/Хозяйственные товары	0	
330504	5701922202675	Ящик для мелочей hobbi с крышкой большой	3536	Хозяйственные товары (folder)/Хозяйственные товары	1575181	Plast Team
545764	5706773202485	Ящик для мелочей twin 2024двой.малый 290x220 x70	1	Неклассифицированные/default	0	
545765	8007633990076	Ящик для мелочей мал. хобби 17x24.5x 27см	1	Неклассифицированные/default	0	
5113730	4627179704230	Ящик для метизов 160x115 x 82мм (оранжевый) (упак 20)	1	Неклассифицированные/default	0	
5113731	4627179704254	Ящик для метизов 160x115 x 82мм (синий) (упак 20)	1	Неклассифицированные/default	0	
5113732	4627179704278	Ящик для метизов 160x115 x 82мм черный (упак 20)	1	Неклассифицированные/default	0	
2505991	6906967020003	Ящик для метизов 25x16 x 13см м450	344013	Инструменты (folder)/Ящик для инструментов	0	
3604381	4607016818801	Ящик для обуви 330x190 x 120мм	1	Неклассифицированные/default	54486	Бытпласт
3604433	4607084509632	Ящик для обуви альтернатива палермо 16.5x 38см м1893	1	Неклассифицированные/default	149661	Альтернатива
3604436	4627084473610	Ящик для обуви альтернатива палермо 3шт м2090	1	Неклассифицированные/default	0	
1346810	4811221000337	Ящик для овощей 550x360 x255	3536	Хозяйственные товары (folder)/Хозяйственные товары	0	
1346811	4811221000320	Ящик для овощей 600x400 x282	3536	Хозяйственные товары (folder)/Хозяйственные товары	0	
1346812	4811221004526	Ящик для овощей 600x400 x282 с кр	3536	Хозяйственные товары (folder)/Хозяйственные товары	0	
3604437	4627084473856	Ящик для овощей альтернатива палермо 4шт м2102	1	Неклассифицированные/default	0	
3604434	4607084509670	Ящик для овощей альтернатива палермо м1895 а м1895	1	Неклассифицированные/default	149661	Альтернатива
871449	4820006403355	Ящик для пищевый продуктов тип 1 гм	1	Неклассифицированные/default	0	
545767	4824004019082	Ящик для подвесных файлов 380x365 x 265мм, металл черный	1	Неклассифицированные/default	445184	BUROMAX
2505994	4607061981307	Ящик для рассады 16 ячеек	561877	Растениеводство/Товары для садоводства	0	
2505995	4607084471694	Ящик для рассады 160x250 x 85мм м087	561877	Растениеводство/Товары для садоводства	0	
3948129	4640003077102	Ящик для рассады 16яч.26x 26см	3608246	Растениеводство/Кашпо,горшки и держатели	0	
1726297	4660006140269	Ящик для рассады 380x190 x100/интерм/30	561877	Растениеводство/Товары для садоводства	0	
3604383	4660006141235	Ящик для рассады 390x195 x120 пластик	1	Неклассифицированные/default	0	
673721	4607084491197	Ящик для рассады 410x185 x90 2сорт а м1014 альтернатива	561877	Растениеводство/Товары для садоводства	149661	Альтернатива
3604384	4607084478532	Ящик для рассады 410x185 x90 а м433** альтернатива	1	Неклассифицированные/default	149661	Альтернатива
5113733	4660006143086	Ящик для рассады 420x210 x100 белый	310878	Растениеводство/Горшок цветочный	0	
3604385	4630008140475	Ящик для рассады 43x22 x11	1	Неклассифицированные/default	0	
3604386	4630008140512	Ящик для рассады 43x22 x11 #2	1	Неклассифицированные/default	0	
330516	4607168310369	Ящик для рассады 450x190 x87 черный	561877	Растениеводство/Товары для садоводства	310447	ООО Инвис-К
3604387	4660006140511	Ящик для рассады 480x240 x 70мм коричневый	1	Неклассифицированные/default	0	
1346813	4811221005363	Ящик для рассады 500x220 x 90мм 13	561877	Растениеводство/Товары для садоводства	0	
3948130	4640003077133	Ящик для рассады 50x15 x 10см	3608246	Растениеводство/Кашпо,горшки и держатели	0	
3604388	4660006140320	Ящик для рассады 600x150 x 120мм	1	Неклассифицированные/default	0	
5113734	4660006143024	Ящик для рассады 640x140 x100 белый	310878	Растениеводство/Горшок цветочный	0	
1726300	4660006140306	Ящик для рассады 640x140 x100/интерм/30	561877	Растениеводство/Товары для садоводства	0	
1821067	4607049782018	Ящик для рассады martika 40см колор	561877	Растениеводство/Товары для садоводства	3279457	martika
1821069	4607049781363	Ящик для рассады martika 40см мрамор	561877	Растениеводство/Товары для садоводства	3279457	martika
3702726	4630017901357	Ящик для рассады martika сиена подс17403зел 81см	3608246	Растениеводство/Кашпо,горшки и держатели	3279457	martika
2505996	4623720907099	Ящик для рассады агропласт урожай Люкс 22x45 x 10см 6л	561877	Растениеводство/Товары для садоводства	0	
3604333	4607084491272	Ящик для рассады альтернатива 2 сорт арт.м1017 530x185 x90	1	Неклассифицированные/default	149661	Альтернатива
1726298	4660006140276	Ящик для рассады альтернатива пластиковый 420x210 x100	561877	Растениеводство/Товары для садоводства	149661	Альтернатива
3604464	4627138643587	Ящик для рассады альтернатива эконом 285x155 x 85мм (упак 50)	1	Неклассифицированные/default	149661	Альтернатива
5113736	4627138643563	Ящик для рассады альтернатива эконом 360x150 x 125мм (без поддона) (упак 15)	1	Неклассифицированные/default	149661	Альтернатива
5113735	4627138643600	Ящик для рассады альтернатива эконом 410x185 x 90мм (упак 20)	3536	Хозяйственные товары (folder)/Хозяйственные товары	149661	Альтернатива
5113737	4627138643624	Ящик для рассады альтернатива эконом 530x185 x 90мм (упак 15)	1	Неклассифицированные/default	149661	Альтернатива
3604344	4620752490278	Ящик для рассады атлантис с ручками 450x208 x 95мм	1	Неклассифицированные/default	0	
3604389	4607084491173	Ящик для рассады б п 360x150 x125 (2сорт) м1013 а м1013 альтернатива	1	Неклассифицированные/default	149661	Альтернатива
3604390	4607084491296	Ящик для рассады без под.550x150 x125	1	Неклассифицированные/default	149661	Альтернатива
5113738	4607168314732	Ящик для рассады дом и дача 247x166 x82 (цветной цвет) /10 (радиан) Россия	1	Неклассифицированные/default	0	
5113739	4607168314749	Ящик для рассады дом и дача 322x166 x82 (оранжевый цвет) /10 (радиан) Россия	1	Неклассифицированные/default	0	
5113740	4607168314756	Ящик для рассады дом и дача 470x166 x84 (шоколадный цвет) /10 (радиан) Россия	1	Неклассифицированные/default	0	
3604405	4609804795479	Ящик для рассады елпласт черный 50x20 x10	1	Неклассифицированные/default	0	
3604411	4604450000588	Ящик для рассады интехпром малая пластик	1	Неклассифицированные/default	0	
3604417	4623721484308	Ящик для рассады Люкс 20x45 x 10см 6л	1	Неклассифицированные/default	0	
3604446	4607116630464	Ящик для рассады полипласт №1 40x20 x 10см	1	Неклассифицированные/default	0	
545768	4607116630471	Ящик для рассады полипласт №2	561877	Растениеводство/Товары для садоводства	0	
330505	4607116630068	Ящик для рассады прямоуг /20 (тэ) Россия	561877	Растениеводство/Товары для садоводства	0	
311186	4607168310772	Ящик для рассады радиан с поддоном 12.5л	310878	Растениеводство/Горшок цветочный	309661	ООО Радиан
3604392	4650055591419	Ящик для рассады с дренажной решеткой #2	1	Неклассифицированные/default	0	
1726299	4660006140597	Ящик для рассады с перегородками 480x240 x70/интерм/30	561877	Растениеводство/Товары для садоводства	0	
3604457	4623721733642	Ящик для рассады супер урожай 40x20 x10 /100 (агропласт) Россия	1	Неклассифицированные/default	0	
2505997	4623720907105	Ящик для рассады урожай-1 18.5x41 x10 /100 (агропласт) Россия	561877	Растениеводство/Товары для садоводства	0	
5113741	4623721616273	Ящик для рассады урожай-10 35x29 x9.5 /100 (агропласт) Россия	1	Неклассифицированные/default	0	
2505998	4623720907112	Ящик для рассады урожай-2 45x21 x10 /100 (агропласт) Россия	561877	Растениеводство/Товары для садоводства	0	
5113742	4623722764546	Ящик для рассады урожай-2м 45x21 x10 /100 (агропласт) Россия	1	Неклассифицированные/default	0	
2505999	4623720907129	Ящик для рассады урожай-3 50x20 x10 (большой) /100 (агропласт) Россия	561877	Растениеводство/Товары для садоводства	149661	Альтернатива
5113743	4623722764553	Ящик для рассады урожай-3м 50x20 x10 /100 (агропласт) Россия	1	Неклассифицированные/default	0	
2506000	4623720907136	Ящик для рассады урожай-4 40x26 x10 /100 (агропласт) Россия	561877	Растениеводство/Товары для садоводства	0	
5113744	4623722764560	Ящик для рассады урожай-4м 40x26 x10 /100 (агропласт) Россия	1	Неклассифицированные/default	0	
2506001	4623720907143	Ящик для рассады урожай-5 50x15 x10 /100 (агропласт) Россия	561877	Растениеводство/Товары для садоводства	0	
2506002	4623720907150	Ящик для рассады урожай-6 с ручками 45x21 x9.5 /100 (агропласт) Россия	561877	Растениеводство/Товары для садоводства	0	
2505992	4623720907167	Ящик для рассады урожай-7 14x 36см /100 (агропласт) Россия	561877	Растениеводство/Товары для садоводства	0	
2505993	4623720907174	Ящик для рассады урожай-8 полипропилен 15x 50см	561877	Растениеводство/Товары для садоводства	0	
2506015	4623720907037	Ящик для рассады феерия-1 2.8л 30x15 x13 с поддоном /100 (агропласт) Россия	1	Неклассифицированные/default	0	
2506016	4623720907051	Ящик для рассады феерия-2 4.5л 32x18 x14.5 с поддоном /50 (агропласт) Россия	1	Неклассифицированные/default	0	
3604465	4650055590917	Ящик для рассады эконом 285x155 x85 #2	1	Неклассифицированные/default	0	
