ID	UPCEAN	Name	CategoryID	CategoryName	BrandID	BrandName
4208556	669910235720	Cd Linda ciofalo take the high road	4093300	Медиа (folder)/Media	0	
4208557	634479609022	Cd Linda cullum obsessed	4093300	Медиа (folder)/Media	0	
4208558	775020488625	Cd Linda dickson kudzu	4093300	Медиа (folder)/Media	0	
4208559	634479429224	Cd Linda draper patchwork	4093300	Медиа (folder)/Media	0	
4208560	634479211522	Cd Linda draper ricochet	4093300	Медиа (folder)/Media	0	
4208561	075678358029	Cd Linda eder broadway, my way	4093300	Медиа (folder)/Media	0	
4208562	724356334021	Cd Linda eder by myself the songs of judy garland	4093300	Медиа (folder)/Media	0	
4208563	081227998394	Cd Linda eder greatest hits	4093300	Медиа (folder)/Media	0	
4208564	602517848856	Cd Linda eder other side of me	4093300	Медиа (folder)/Media	0	
4208565	783707594620	Cd Linda finkle piece of me	4093300	Медиа (folder)/Media	0	
4208566	783707466125	Cd Linda foy amazon calling	4093300	Медиа (folder)/Media	0	
4208567	634479013720	Cd Linda geleris the trouble with Love	4093300	Медиа (folder)/Media	0	
4208568	826688012926	Cd Linda holley who shall separate us	4093300	Медиа (folder)/Media	0	
4208569	880959002238	Cd Linda kay burk Sunshine is Love	4093300	Медиа (folder)/Media	0	
4208570	098709000025	Cd Linda kosut Life is but a Dream	4093300	Медиа (folder)/Media	0	
4208571	783707536521	Cd Linda Nelson molasses	4093300	Медиа (folder)/Media	0	
4208572	884501208505	Cd Linda noyes take you to paradise	4093300	Медиа (folder)/Media	0	
4208573	606949006129	Cd Linda perry in flight	4093300	Медиа (folder)/Media	0	
4208574	075596087223	Cd Linda ronstadt cry like a rainstorm, howl like the wind	4093300	Медиа (folder)/Media	0	
4208575	081227998462	Cd Linda ronstadt greatest hits 1&2	4093300	Медиа (folder)/Media	0	
4208576	075596051224	Cd Linda ronstadt greatest hits, vol. 1	4093300	Медиа (folder)/Media	0	
4208577	730531151123	Cd Linda scott the complete hits of Linda scott	4093300	Медиа (folder)/Media	0	
4208578	783707386423	Cd Linda sharar any second street	4093300	Медиа (folder)/Media	0	
4208579	634479145926	Cd Linda smith cry Baby cry	4093300	Медиа (folder)/Media	0	
4208580	829757227221	Cd Linda smith greatest hits journey to now	4093300	Медиа (folder)/Media	0	
4208581	794214981223	Cd Linda storey willow tree	4093300	Медиа (folder)/Media	0	
4208582	783707483023	Cd Linda*&*jeanie in Spirit at the wall	4093300	Медиа (folder)/Media	0	
4208583	774718129529	Cd lindemann, jens flying solo	4093300	Медиа (folder)/Media	0	
4208584	696998061521	Cd linden, colin big mouth	4093300	Медиа (folder)/Media	0	
4208585	074648032921	Cd linden, colin raised by wolves	4093300	Медиа (folder)/Media	0	
4208586	074648052226	Cd linden, colin sad and beautiful world 1975-1999	4093300	Медиа (folder)/Media	0	
4208587	074648022526	Cd linden, colin through the storm through the Night	4093300	Медиа (folder)/Media	0	
4208588	074648027125	Cd linden, colin when the Spirit comes	4093300	Медиа (folder)/Media	0	
4208589	745099699420	Cd lindenberg, udo Star festival...	4093300	Медиа (folder)/Media	0	
4208590	060651002006	Cd linder&brock	4093300	Медиа (folder)/Media	0	
1862031	7896013538370	Cd lindinhas cab cach 210ml	1	Неклассифицированные/default	0	
1862032	7896013538356	Cd lindinhas cab lisos 210ml	1	Неклассифицированные/default	0	
4208591	075596057325	Cd lindley, david el rayo-x	4093300	Медиа (folder)/Media	0	
4208592	075596076821	Cd lindley, david very greasy	4093300	Медиа (folder)/Media	0	
4208593	075596017824	Cd lindley, david win this record	4093300	Медиа (folder)/Media	0	
4208594	783707373225	Cd lindon-sherman flute&guitar Duo a wedding sampler	4093300	Медиа (folder)/Media	0	
4208595	776127142526	Cd lindsay morgan the shore	4093300	Медиа (folder)/Media	0	
4208596	783707327129	Cd lindsay smith tales from the fruitbat vat	4093300	Медиа (folder)/Media	0	
4208597	776127012522	Cd lindsay Thomas morgan i never dreamed	4093300	Медиа (folder)/Media	0	
4208598	093624983347	Cd lindsey buckingham gift of screws	4093300	Медиа (folder)/Media	0	
4208599	075596456128	Cd lindsey buckingham law and order	4093300	Медиа (folder)/Media	0	
4208600	884501049382	Cd lindsey yung opal essence	4093300	Медиа (folder)/Media	0	
4208601	600116845924	Cd lindstr??m real Life is no Cool	4093300	Медиа (folder)/Media	0	
4208602	641444937424	Cd lindy gravelle a lindy christmas	4093300	Медиа (folder)/Media	0	
4208603	634479666728	Cd lindy gravelle ancient hist'ry	4093300	Медиа (folder)/Media	0	
4208604	641444904228	Cd lindy gravelle Little ol' girl	4093300	Медиа (folder)/Media	0	
4208605	641444904129	Cd lindy gravelle spanish rain	4093300	Медиа (folder)/Media	0	
4208606	641444913428	Cd lindy gravelle the change	4093300	Медиа (folder)/Media	0	
4208607	634479627521	Cd lindy hop with rusty&peter, level two lindy hop with rusty&peter, level two	4093300	Медиа (folder)/Media	0	
4208608	634479627422	Cd lindy hop with rusty&peter, One lindy hop with rusty&peter, level One	4093300	Медиа (folder)/Media	0	
4208609	634479627729	Cd lindy hop with rusty&peter, three lindy hop with rusty&peter, three	4093300	Медиа (folder)/Media	0	
4208610	060270058521	Cd lindy lindy	4093300	Медиа (folder)/Media	0	
4208611	634479418822	Cd lindy, Linda, lindsay gardner and John booth cowboy jam ii	4093300	Медиа (folder)/Media	0	
4208612	634479449123	Cd lineage feels like rain	4093300	Медиа (folder)/Media	0	
4208613	075678238222	Cd linear caught in the middle	4093300	Медиа (folder)/Media	0	
4208614	078636705729	Cd lines, aaron living out loud	4093300	Медиа (folder)/Media	0	
4208617	093624826729	Cd linkin park 'hybrid theory' Special edition	4093300	Медиа (folder)/Media	0	
4208615	054391994073	Cd linkin park given up	4093300	Медиа (folder)/Media	0	
4208616	777495403691	Cd linkin park hybrid theory	4093300	Медиа (folder)/Media	0	
4208618	093624818625	Cd linkin park meteora	4093300	Медиа (folder)/Media	0	
4208619	093624846222	Cd linkin park meteora #2	4093300	Медиа (folder)/Media	0	
4208620	093624844327	Cd linkin park meteora #3	4093300	Медиа (folder)/Media	0	
4208621	093624846321	Cd linkin park meteora limited ed.	4093300	Медиа (folder)/Media	0	
4208622	093624844228	Cd linkin park meteora with bonus DVD	4093300	Медиа (folder)/Media	0	
3632553	4607173153753	Cd linkin park minutes to midni	4093300	Медиа (folder)/Media	0	
3632554	4601250352831	Cd linkin park minutes to midnight (лиц)	4093300	Медиа (folder)/Media	0	
4208623	093624496328	Cd linkin park One step closer Maxi single	4093300	Медиа (folder)/Media	0	
4208624	054391669322	Cd linkin park points of authority	4093300	Медиа (folder)/Media	0	
4208625	093624832621	Cd linkin park reanimation CD	4093300	Медиа (folder)/Media	0	
4208626	093624980957	Cd linkin park road to revolution live at milton keynes	4093300	Медиа (folder)/Media	0	
4208627	054391996091	Cd linkin park Shadow of the Day [CD single 1]	4093300	Медиа (folder)/Media	0	
4208628	093624991205	Cd linkin park Shadow of the Day [CD single 2]	4093300	Медиа (folder)/Media	0	
4208629	054391666420	Cd linkin park somewhere i belong	4093300	Медиа (folder)/Media	0	
4208630	093624261322	Cd linkin park somewhere i belong #2	4093300	Медиа (folder)/Media	0	
4208631	093624981039	Cd linkin park songs from the underground CD-best buy exclusive	4093300	Медиа (folder)/Media	0	
4208632	054391612328	Cd linkin park&jay-z numb / encore	4093300	Медиа (folder)/Media	0	
4208633	093624896227	Cd linkin park/jay-z collision course (CD/DVD)	4093300	Медиа (folder)/Media	0	
4208634	743037212922	Cd linna gong chinese folk songs	4093300	Медиа (folder)/Media	0	
4208635	601143100529	Cd linnell John state songs	4093300	Медиа (folder)/Media	0	
4208636	783707726328	Cd linq war machine	4093300	Медиа (folder)/Media	0	
4208637	634479357428	Cd linsey furry takin' the longview	4093300	Медиа (folder)/Media	0	
4208638	699057002121	Cd liona boyd a guitar for christmas	4093300	Медиа (folder)/Media	0	
4208639	776974801522	Cd liona boyd baroque favorites	4093300	Медиа (folder)/Media	0	
4208640	075021951327	Cd liona boyd christmas dreams	4093300	Медиа (folder)/Media	0	
4208641	620467951822	Cd liona boyd classically yours	4093300	Медиа (folder)/Media	0	
4208642	770301951720	Cd liona boyd dancing on the edge	4093300	Медиа (folder)/Media	0	
4208643	075021950924	Cd liona boyd encore	4093300	Медиа (folder)/Media	0	
4208644	075021951020	Cd liona boyd highlights	4093300	Медиа (folder)/Media	0	
4208645	776974800327	Cd liona boyd miniatures	4093300	Медиа (folder)/Media	0	
4208646	776574003227	Cd liona boyd paddle to the sea	4093300	Медиа (folder)/Media	0	
4208647	699057001124	Cd liona boyd passport to serenity	4093300	Медиа (folder)/Media	0	
4208648	699057000424	Cd liona boyd persona	4093300	Медиа (folder)/Media	0	
4208649	699057004224	Cd liona boyd the Romantic guitar	4093300	Медиа (folder)/Media	0	
4208650	776974801423	Cd liona boyd the spanish album	4093300	Медиа (folder)/Media	0	
4208651	776974801621	Cd liona boyd whispers of Love	4093300	Медиа (folder)/Media	0	
4208652	046172002220	Cd lionel hampton flying Home [lrc]	4093300	Медиа (folder)/Media	0	
4208653	634479258329	Cd lionel hampton-ernie andrews-gerald wiggins trio-Harry 'sweets' lionel hampton and his band live at the John anson ford amph	4093300	Медиа (folder)/Media	0	
4208654	634479700620	Cd lionel lodge brother bro beautiful world	4093300	Медиа (folder)/Media	0	
4208655	634479807824	Cd lionel lodge naked	4093300	Медиа (folder)/Media	0	
4208656	634479807725	Cd lionel lodge she's no Game	4093300	Медиа (folder)/Media	0	
4208657	634479700729	Cd lionel lodge somewhere in vienna and doing Fine	4093300	Медиа (folder)/Media	0	
4208658	4988005584007	Cd lionel richie best of lionel richie	4093300	Медиа (folder)/Media	0	
4208659	602517809819	Cd lionel richie definitive collection [motown]	4093300	Медиа (folder)/Media	0	
4208660	602498879603	Cd lionel richie Gold	4093300	Медиа (folder)/Media	0	
4208661	602498623718	Cd lionel richie just for you	4093300	Медиа (folder)/Media	0	
4208662	602517827455	Cd lionel richie just go	4093300	Медиа (folder)/Media	0	
4208663	731453084629	Cd lionel richie truly the Love songs	4093300	Медиа (folder)/Media	0	
4208664	724357356824	Cd lionel rogg bach toccata&fugue in d minor&other favorite organ works	4093300	Медиа (folder)/Media	0	
4208665	633537200027	Cd lionel&leslie personal relationship	4093300	Медиа (folder)/Media	0	
4208666	633537200324	Cd lionel&leslie this moment	4093300	Медиа (folder)/Media	0	
4208667	633537200126	Cd lionel&leslie will you be ready?	4093300	Медиа (folder)/Media	0	
4208668	743214283721	Cd lionrock project now (undefinable Modern music)	4093300	Медиа (folder)/Media	0	
4208669	600665769726	Cd lior navok meditations over shore	4093300	Медиа (folder)/Media	0	
4208670	634479498220	Cd Lip Stick technology for a girl	4093300	Медиа (folder)/Media	0	
4208671	060270059924	Cd Liquid better days	4093300	Медиа (folder)/Media	0	
4208672	671196029528	Cd Liquid Blue supernova	4093300	Медиа (folder)/Media	0	
4208673	783707716527	Cd Liquid Cheese lost in the music	4093300	Медиа (folder)/Media	0	
4208674	829757491226	Cd Liquid ginger Liquid ginger	4093300	Медиа (folder)/Media	0	
4208675	677516534529	Cd Liquid pie diggin in	4093300	Медиа (folder)/Media	0	
4208676	677516512923	Cd Liquid pie just the crust	4093300	Медиа (folder)/Media	0	
4208677	747014438121	Cd Liquid sand aura	4093300	Медиа (folder)/Media	0	
4208678	750458217320	Cd Liquid sound company exploring the psychedelic	4093300	Медиа (folder)/Media	0	
4208679	614286906026	Cd Liquid trio experiment spontaneous combustion	4093300	Медиа (folder)/Media	0	
4208680	634479233920	Cd Liquid*tri*psycle lik'wid tri si'kal	4093300	Медиа (folder)/Media	0	
4208681	8590442044394	Cd liquido at the rocks	4093300	Медиа (folder)/Media	0	
4208682	727361136703	Cd liquido float	4093300	Медиа (folder)/Media	0	
4208683	634479090127	Cd liquorice sea sacred Touch	4093300	Медиа (folder)/Media	0	
4208684	783707282527	Cd lis harvey human after all	4093300	Медиа (folder)/Media	0	
1862033	7896522022995	Cd lis in fluido alis 20ml	1	Неклассифицированные/default	0	
1862034	7896522023282	Cd lis in leite alis 100ml	1	Неклассифицированные/default	0	
1862035	7896522023251	Cd lis in pomad alisad 50g	1	Неклассифицированные/default	0	
4208685	635759122422	Cd lisa addeo hotel California	4093300	Медиа (folder)/Media	0	
4208686	635759135224	Cd lisa addeo in a heartbeat	4093300	Медиа (folder)/Media	0	
4208687	783707647524	Cd lisa alice that thing in your hand	4093300	Медиа (folder)/Media	0	
4208688	765481898323	Cd lisa and Paul fenstermacher a promise for tomorrow	4093300	Медиа (folder)/Media	0	
4208689	600445011625	Cd lisa angelle lisa angelle	4093300	Медиа (folder)/Media	0	
4208690	765481616125	Cd lisa asher let the Mystery be	4093300	Медиа (folder)/Media	0	
4208691	829757238722	Cd lisa atkinson&George kincheloe simple as that	4093300	Медиа (folder)/Media	0	
4208692	724101915321	Cd lisa baney lisa baney	4093300	Медиа (folder)/Media	0	
4208693	783707621326	Cd lisa barter spaar awakening	4093300	Медиа (folder)/Media	0	
4208694	711517650021	Cd lisa bastoni gather round	4093300	Медиа (folder)/Media	0	
4208695	794112000026	Cd lisa Bell a Grand affair	4093300	Медиа (folder)/Media	0	
4208696	634479695285	Cd lisa bevill/when the healing comes	4093300	Медиа (folder)/Media	0	
4208697	735885566227	Cd lisa bouchelle&october Baby tales from the pumpkin patch	4093300	Медиа (folder)/Media	0	
4208698	715187888623	Cd lisa brokop hey, do you know me	4093300	Медиа (folder)/Media	0	
4208699	783707726625	Cd lisa cerbone ordinary days	4093300	Медиа (folder)/Media	0	
4208700	634479681622	Cd lisa coppola a Rose by any other name	4093300	Медиа (folder)/Media	0	
4208701	634479443923	Cd lisa cornelio lisa cornelio	4093300	Медиа (folder)/Media	0	
4208702	634479819827	Cd lisa dery montage	4093300	Медиа (folder)/Media	0	
4208703	724101843426	Cd lisa deveaux shakin' that jazz	4093300	Медиа (folder)/Media	0	
4208704	709363654423	Cd lisa dewey lola cuki	4093300	Медиа (folder)/Media	0	
4208705	783707640129	Cd lisa fenstermacher glimpses	4093300	Медиа (folder)/Media	0	
4208706	5021456072309	Cd lisa gerrard the Mirror pool	4093300	Медиа (folder)/Media	0	
4208707	093624685425	Cd lisa gerrard&pieter bourke duality	4093300	Медиа (folder)/Media	0	
4208708	880882164324	Cd lisa hannigan sea sew	4093300	Медиа (folder)/Media	0	
4208709	075678178221	Cd lisa hartman til my heart stops	4093300	Медиа (folder)/Media	0	
4208710	634479565724	Cd lisa hayes where angels fear to go	4093300	Медиа (folder)/Media	0	
4208711	783707626925	Cd lisa hindmarsh lost in a summer Night	4093300	Медиа (folder)/Media	0	
4208712	783707294223	Cd lisa hindmarsh now i know	4093300	Медиа (folder)/Media	0	
4208713	735885724023	Cd lisa hogan the other way	4093300	Медиа (folder)/Media	0	
4208714	634479582325	Cd lisa Jackson&girl friday i am aok	4093300	Медиа (folder)/Media	0	
4208715	783707402420	Cd lisa joy persian carnival	4093300	Медиа (folder)/Media	0	
4208716	650687251327	Cd lisa kelly&jb scott memories of tomorrow	4093300	Медиа (folder)/Media	0	
4208717	634479407628	Cd lisa La shawn hop on the train	4093300	Медиа (folder)/Media	0	
4208718	093624327127	Cd lisa lampanelli dirty girl	4093300	Медиа (folder)/Media	0	
4208719	064328710928	Cd lisa Lauren my own Twist	4093300	Медиа (folder)/Media	0	
4208720	064328710720	Cd lisa Lauren what comesaround	4093300	Медиа (folder)/Media	0	
4208721	140805005142	Cd lisa lauter whisper	1	Неклассифицированные/default	0	
4208722	094922106643	Cd lisa left Eye lopes Eye legacy	4093300	Медиа (folder)/Media	0	
4208723	094634296427	Cd lisa lisa	4093300	Медиа (folder)/Media	0	
4208724	074646526828	Cd lisa lisa Super hits	4093300	Медиа (folder)/Media	0	
4208725	074644013528	Cd lisa lisa&cult jam lisa lisa&cult jam w/ full Force	4093300	Медиа (folder)/Media	0	
4208726	699675199029	Cd lisa loeb catch the moon [CD/ DVD]	4093300	Медиа (folder)/Media	0	
4208727	720641941622	Cd lisa loeb i do	4093300	Медиа (folder)/Media	0	
4208728	720642228623	Cd lisa loeb i do #2	4093300	Медиа (folder)/Media	0	
4208729	720641942421	Cd lisa loeb let's forget about it	4093300	Медиа (folder)/Media	0	
4208730	602498899700	Cd lisa loeb very best of lisa loeb	4093300	Медиа (folder)/Media	0	
4208731	634479376429	Cd lisa lynn verzella twentieth Century trumpet	4093300	Медиа (folder)/Media	0	
4208732	634479323720	Cd lisa m. robbin facets	4093300	Медиа (folder)/Media	0	
4208733	634479779022	Cd lisa Marie baratta struttin'	4093300	Медиа (folder)/Media	0	
4208734	724359381329	Cd lisa Marie presley now what	4093300	Медиа (folder)/Media	0	
4208735	724349666801	Cd lisa Marie presley to whom it may concern	4093300	Медиа (folder)/Media	0	
4208736	783707324128	Cd lisa Martin set me on fire	4093300	Медиа (folder)/Media	0	
4208737	634479612220	Cd lisa mccormick sacred	4093300	Медиа (folder)/Media	0	
4208738	9399602411125	Cd lisa miller as far as a Life goes	4093300	Медиа (folder)/Media	0	
4208739	9329355001038	Cd lisa miller car tape	4093300	Медиа (folder)/Media	0	
4208740	9332727003653	Cd lisa miller pushover	1	Неклассифицированные/default	0	
4208741	5021456086665	Cd lisa miller quiet girl with a credit card	4093300	Медиа (folder)/Media	0	
4208742	9332727001901	Cd lisa miller version originale	1	Неклассифицированные/default	0	
4208743	713746305826	Cd lisa moore wolfe Dark full ride	4093300	Медиа (folder)/Media	0	
4208744	783707578927	Cd lisa moritz Dream of Blue	4093300	Медиа (folder)/Media	0	
4208745	783707628226	Cd lisa moscatiello/fred lieder what happens after Love	4093300	Медиа (folder)/Media	0	
4208746	783707404929	Cd lisa o'kane am i too Blue	4093300	Медиа (folder)/Media	0	
4208747	661937580227	Cd lisa page brooks lisa page brooks	4093300	Медиа (folder)/Media	0	
4208748	783707283821	Cd lisa reagan satori	4093300	Медиа (folder)/Media	0	
4208749	687474063320	Cd lisa simpson steeping orion	4093300	Медиа (folder)/Media	0	
4208750	783707831428	Cd lisa sokolov presence	4093300	Медиа (folder)/Media	0	
4208751	078221867924	Cd lisa stansfield real Love	4093300	Медиа (folder)/Media	0	
4208752	743211723121	Cd lisa stansfield so Natural [74321172312]	4093300	Медиа (folder)/Media	0	
4208753	824258020128	Cd lisa tucker please come Home for christmas	1	Неклассифицированные/default	0	
4208754	634479062728	Cd lisa verzella womyn's work	4093300	Медиа (folder)/Media	0	
4208755	634479647321	Cd lisa winter Shine	4093300	Медиа (folder)/Media	0	
4208756	634479226427	Cd lisa winters sings a musical tribute to the big band era	4093300	Медиа (folder)/Media	0	
4208757	634479011122	Cd lisa&bob benoit fragrant offering	4093300	Медиа (folder)/Media	0	
4208758	786851997828	Cd lisabeth weber the almost live sessions	4093300	Медиа (folder)/Media	0	
4208759	093624454427	Cd lisahall comatose-Maxi	4093300	Медиа (folder)/Media	0	
4208760	093624453826	Cd lisahall i know i can do it	4093300	Медиа (folder)/Media	0	
4208761	093624693420	Cd lisahall is this real	4093300	Медиа (folder)/Media	0	
4208762	037628481621	Cd lisandro meza el embajador	4093300	Медиа (folder)/Media	0	
4208763	074645345321	Cd lisette melendez true to Life music CD ok53453 12 tracks columbia	4093300	Медиа (folder)/Media	0	
1862036	7896046711917	Cd liss man kanit 5000ml	1	Неклассифицированные/default	0	
1862037	7897915300133	Cd liss Mix use 1 240ml	1	Неклассифицированные/default	0	
1862038	7897915300454	Cd liss Mix use 2 240ml	1	Неклассифицированные/default	0	
4208765	634479088322	Cd lissa holloway my way	4093300	Медиа (folder)/Media	0	
4208766	767981120423	Cd lissie why you running	4093300	Медиа (folder)/Media	0	
4208767	765481804423	Cd lissy lissy abraham	4093300	Медиа (folder)/Media	0	
4208768	724385171024	Cd listen louder	4093300	Медиа (folder)/Media	0	
4208769	614511723121	Cd listing ship dance class revolution	4093300	Медиа (folder)/Media	0	
4208770	747313201426	Cd liszt etudes gnomenreigen, waldesrauschen, etudes de concert (William wolfram)	4093300	Медиа (folder)/Media	0	
4208771	634479401824	Cd liszt laughing? brown&White eggs sold here	4093300	Медиа (folder)/Media	0	
4208772	803763019926	Cd liszt laughing? fantasy of 1811	4093300	Медиа (folder)/Media	0	
4208773	789368843725	Cd liszt mazeppa	4093300	Медиа (folder)/Media	0	
4208774	090317734026	Cd liszt, franz dante sym. and sonata	4093300	Медиа (folder)/Media	0	
4208775	639842294829	Cd liszt, franz eine faust-symphonie..	4093300	Медиа (folder)/Media	0	
4208776	078636777528	Cd lit a place in the Sun	4093300	Медиа (folder)/Media	0	
4208777	078636808628	Cd lit atomic	4093300	Медиа (folder)/Media	0	
4208778	078636791425	Cd lit tripping the Light fantastic	4093300	Медиа (folder)/Media	0	
4208779	078636102528	Cd lita ford dangerous curves	4093300	Медиа (folder)/Media	0	
4208780	616892053064	Cd lita ford wicked wonderland [bonus tracks]	4093300	Медиа (folder)/Media	0	
4208781	063200201127	Cd lite 99.1 holiday music volume One	4093300	Медиа (folder)/Media	0	
4208782	641444934522	Cd literati x sound of literati	4093300	Медиа (folder)/Media	0	
4208783	706301945124	Cd litfiba viva litfiba (best of)	4093300	Медиа (folder)/Media	0	
4208784	081227820824	Cd lithgow, John farkle&friends	4093300	Медиа (folder)/Media	0	
4208785	074646350126	Cd lithgow, John singin' in the bathtub	4093300	Медиа (folder)/Media	0	
4208786	718750991225	Cd lithivm threshold to disharmony	4093300	Медиа (folder)/Media	0	
4208787	5013929774322	Cd Little angels don???t prey for me	4093300	Медиа (folder)/Media	0	
4208788	081227091927	Cd Little Anthony&the imperials best of	4093300	Медиа (folder)/Media	0	
4208789	634479160622	Cd Little atlas surface serene	4093300	Медиа (folder)/Media	0	
4208790	078636646022	Cd Little big League [Original soundtrack]	4093300	Медиа (folder)/Media	0	
4208791	696998537422	Cd Little big town Little big town	4093300	Медиа (folder)/Media	0	
4208792	5099922786425	Cd Little big town place to land [bonus tracks]	4093300	Медиа (folder)/Media	0	
4208793	671678103821	Cd Little brother the listening	4093300	Медиа (folder)/Media	0	
4208794	5018524010806	Cd Little caesar the whole of the moon (eaucd1)	4093300	Медиа (folder)/Media	0	
4208795	014551482925	Cd Little charlie&the nightcats straight up!	4093300	Медиа (folder)/Media	0	
4208796	886975924226	Cd Little comets demos ep	4093300	Медиа (folder)/Media	0	
4208797	634479637629	Cd Little doc thornton big doc Little doc	4093300	Медиа (folder)/Media	0	
4208798	634479284823	Cd Little doc thornton hurricane	4093300	Медиа (folder)/Media	0	
4208799	075678235887	Cd Little earthquakes (1992) by tori amos	1	Неклассифицированные/default	0	
4208800	794465706323	Cd Little egypt straight out the sands	4093300	Медиа (folder)/Media	0	
4208801	081227080426	Cd Little feat best of Little feat	4093300	Медиа (folder)/Media	0	
4208802	075992727020	Cd Little feat dixie chicken	4093300	Медиа (folder)/Media	0	
4208803	821797078467	Cd Little feat dixie chicken #2	4093300	Медиа (folder)/Media	0	
4208804	075992334525	Cd Little feat down on the Farm	4093300	Медиа (folder)/Media	0	
4208805	075992728423	Cd Little feat feats don't fail me now	4093300	Медиа (folder)/Media	0	
4208806	081227991227	Cd Little feat hotcakes&outtakes:30 yr...	4093300	Медиа (folder)/Media	0	
4208807	075992741323	Cd Little feat hoy-hoy	4093300	Медиа (folder)/Media	0	
4208808	795041773524	Cd Little feat join the band [bonus track]	4093300	Медиа (folder)/Media	0	
4208809	075992729628	Cd Little feat last record album	4093300	Медиа (folder)/Media	0	
4208810	075992575027	Cd Little feat let it roll	4093300	Медиа (folder)/Media	0	
4208811	075992718929	Cd Little feat Little feat	4093300	Медиа (folder)/Media	0	
4208812	081227988005	Cd Little feat Little feat #2	4093300	Медиа (folder)/Media	0	
4208813	075992616324	Cd Little feat representing the mambo	4093300	Медиа (folder)/Media	0	
4208814	664140261624	Cd Little feat representing the mambo #2	4093300	Медиа (folder)/Media	0	
4208815	075992725828	Cd Little feat sailin' shoes	4093300	Медиа (folder)/Media	0	
4208816	075992731423	Cd Little feat time loves a hero	4093300	Медиа (folder)/Media	0	
4208817	081227990084	Cd Little feat time loves a hero #2	4093300	Медиа (folder)/Media	0	
4208818	075992734424	Cd Little feat waiting for columbus	4093300	Медиа (folder)/Media	0	
4208819	081227827427	Cd Little feat waiting for columbus-de luxe..	4093300	Медиа (folder)/Media	0	
4208820	884501193238	Cd Little fyodor peace is boring	4093300	Медиа (folder)/Media	0	
4208821	677516534321	Cd Little hercules Little hercules	4093300	Медиа (folder)/Media	0	
4208822	807315300128	Cd Little jackie stoop	4093300	Медиа (folder)/Media	0	
