ID	UPCEAN	Name	CategoryID	CategoryName	BrandID	BrandName
5458559	8901428002091	Крем боро фреш ластик для удаления шрамов и растяжек 25г 87605	5248998	лечебные кремы, мази, бальзамы, лосьоны и лаки	5458556	боро фреш
2850071	8901428000103	Крем боро фреш ножки 25g, аюшакти аюрвед пвт	1	Неклассифицированные/default	0	
448108	8901177410208	Крем боро-натурель 20g	1	Неклассифицированные/default	0	
4844199	8901177400254	Крем боро-софт 25g	241824	Лекарственные средства (folder)/Аптека	0	
4844200	8901177400407	Крем боро-софт 40g	241824	Лекарственные средства (folder)/Аптека	0	
4844201	8901201410099	Крем борототал 25g	241824	Лекарственные средства (folder)/Аптека	0	
4844202	8901201410600	Крем борототал с тулси 25g	241824	Лекарственные средства (folder)/Аптека	0	
310020	818428000041	Крем борофреш календула антисептич 25.0	1	Неклассифицированные/default	0	
310024	818428000058	Крем борофреш ромашка антисептич 25.0	1	Неклассифицированные/default	0	
2449153	4002309008912	Крем буренка слив-орех дуо с/б 0.330	29993	Продукты питания (folder)/Паста шоколадная	0	
2449154	4002309008462	Крем буренка слив-орех с/б 0.330	29993	Продукты питания (folder)/Паста шоколадная	0	
2449155	4002309008479	Крем буренка слив-орех с/б 0.330 #2	29993	Продукты питания (folder)/Паста шоколадная	0	
2449156	4002309009094	Крем буренка слив-орех с/б 0.700	29993	Продукты питания (folder)/Паста шоколадная	0	
6965	4602666731401	Крем бэби-дэта от всех летающих алоэ с 2х лет пл/туб 50ml/химик/24	102	Борьба с насекомыми и грызунами/Средства против насекомых	6951	Дэта
9811	4600702003697	Крем в тубе календула	5586	Косметика (folder)/Косметика	620	Прочие Калина
9818	4600702001839	Крем в тубе норд-ост бал пэтритья	130	Гигиена (folder)/После бритья	4139	Норд-Ост
2953091	4600702022438	Крем в тубе норд-ост бал пэтритья #2	130	Гигиена (folder)/После бритья	4139	Норд-Ост
685948	4612726440099	Крем вальгусстоп (косточка) Крем для стоп 15ml 4612726440099	1	Неклассифицированные/default	5458561	эманси лаборатория
14195	4601313006992	Крем весна акватель дневн. увл. зелен чай/виногрдля норм кожи 0.045	5586	Косметика (folder)/Косметика	3609	Весна Акватель
14184	4601313006084	Крем весна акватель ночной реген для нор и комб к	5586	Косметика (folder)/Косметика	3609	Весна Акватель
742540	4811230009871	Крем ветkа саkуры (2) дhевhой регулирующ 5.000	1	Неклассифицированные/default	3789610	ветка сакуры (VILSEN GROUP)
174473	4810153007506	Крем вечерний на красном вине,75ml ,н линия vino-spa	1	Неклассифицированные/default	174469	Витэкс VINO - SPA
480249	4600697407807	Крем виноградный для нормальной и комб. кожи увлажняющий 40ml	664	Косметика (folder)/Крем для лица	20651	Невская Косметика
452070	4603699000175	Крем виросепт антигерпесный 10ml 14944681	441260	Лекарственные средства (folder)/Противовирусные наружного применения	5311731	инфарма 2000
2884725	7751553002821	Крем виру из перуанского перца пикильо 190g с/б	1	Неклассифицированные/default	0	
1240779	4820026140858	Крем виталифтинг bioton 100ml	1	Неклассифицированные/default	480185	Bioton
1353811	4620002181628	Крем витамин ф жирный 50ml (ООО дина+)	1	Неклассифицированные/default	2352545	Librederm
310653	4607010243012	Крем витамин ф99 жирный 50ml ЗАО реалкосметикс	1	Неклассифицированные/default	0	
157168	4607038541220	Крем вкуснятина сливочная тянучка пл 0.31	29993	Продукты питания (folder)/Паста шоколадная	0	
2449163	4607038541060	Крем вкуснятина тянучка кофе п/э 0.350	29993	Продукты питания (folder)/Паста шоколадная	0	
2449164	4607038541022	Крем вкуснятина тянучка сливочная п/э 0.350	29993	Продукты питания (folder)/Паста шоколадная	0	
5019183	4607030110547	Крем вмп гидрофильный 100ml туба	300445	Эксплуатация и ремонт автомобилей/Автомобильные принадлежности	0	
5458562	4607013973442	Крем возбуждающий sextaz-m для мужчин в одноразовой упаковке - 1.5г	363351	Adult/Sex-Shop	93921	Биоритм
5458563	4607013975781	Крем возбуждающий для женщин clitos Cream - 25г lb-23149	363351	Adult/Sex-Shop	93921	Биоритм
5458564	3548960030714	Крем возбуждающий для женщин nymp-orgasmic - 15мл 003071	363351	Adult/Sex-Shop	2193019	Ruf
5458565	4042342005073	Крем возбуждающий для женщин stimulation Cream - 30мл 67201	363351	Adult/Sex-Shop	5244469	shiatsu
5458566	4742902010805	Крем возбуждающий для женщин viamax Sensitive Gel - 15мл 1107	363351	Adult/Sex-Shop	5312021	viamax
5458567	4742902010720	Крем возбуждающий для женщин viamax Sensitive Gel - 2мл 1103-m	363351	Adult/Sex-Shop	5312021	viamax
5458568	4742902010812	Крем возбуждающий для женщин viamax Sensitive Gel - 50ml 1106	363351	Adult/Sex-Shop	5312021	viamax
5458570	3479228260522	Крем возбуждающий для мужчин nuit ardente creme performante plaisirs secrets - 60мл 826052	363351	Adult/Sex-Shop	5458569	plaisir secret
5458571	5600298351225	Крем возбуждающий для мужчин orgie touro - 15мл 21265	363351	Adult/Sex-Shop	5257779	orgie
5458572	4042342005097	Крем возбуждающий для мужчин penis Power Cream - 30мл 67202	363351	Adult/Sex-Shop	5244469	shiatsu
5458573	4607013975590	Крем возбуждающий для мужчин stand up - 25г lb-80006	363351	Adult/Sex-Shop	93921	Биоритм
5458574	4607013974241	Крем возбуждающий для мужчин сила геракла - 15г lb-80001	363351	Adult/Sex-Shop	93921	Биоритм
4807195	4603726763738	Крем вокруг глаз achromin аnti-аge с коллагеном, 20ml 28316	5586	Косметика (folder)/Косметика	4807169	Achromin
4886287	4603726763677	Крем вокруг глаз achromin аnti-аge со стволовыми клетками, 20ml 28319	5586	Косметика (folder)/Косметика	4807169	Achromin
335988	7640109990210	Крем вокруг глаз amadoris 30ml	5586	Косметика (folder)/Косметика	335984	AmaDoris
585933	4820008315588	Крем вокруг глаз diamant de La mer против морщин 15ml	664	Косметика (folder)/Крем для лица	0	
362265	4823015919985	Крем вокруг глаз dr.olivio ухаживающий 50ml	664	Косметика (folder)/Крем для лица	0	
2569327	4823015929410	Крем вокруг глаз elfa dr.sante 0% 15ml	1	Неклассифицированные/default	261925	Elfa Dr.Sante
479973	5901964010119	Крем вокруг глаз Eveline q10 ночной 30ml	664	Косметика (folder)/Крем для лица	9774	Eveline
9782	5901964073411	Крем вокруг глаз Eveline q10 против морщин 30ml	664	Косметика (folder)/Крем для лица	9774	Eveline
479974	5901964002411	Крем вокруг глаз Eveline аква дневной 30ml	664	Косметика (folder)/Крем для лица	9774	Eveline
1460265	5907609388865	Крем вокруг глаз Eveline масло аргана от морщин spf15. 15ml 40	5586	Косметика (folder)/Косметика	9774	Eveline
1903	4105710021973	Крем вокруг глаз florena актив 15ml	5586	Косметика (folder)/Косметика	1876	FLORENA
75939	4105710022055	Крем вокруг глаз florena п/морщин для прид.упруг.кожи 15ml	664	Косметика (folder)/Крем для лица	1876	FLORENA
597842	3600540381415	Крем вокруг глаз Garnier основной уход от морщин 15	664	Косметика (folder)/Крем для лица	5473	Garnier
597880	3600540736765	Крем вокруг глаз Garnier сила орхидеи 15 (н)	5586	Косметика (folder)/Косметика	5473	Garnier
1008565	3346470600546	Крем вокруг глаз Guerlain подтягивающий кожу abeille royale 15ml	1	Неклассифицированные/default	251846	Guerlain
13296	3600520238036	Крем вокруг глаз L'oreal Dermo Expertise age Perfect банка 15ml	5586	Косметика (folder)/Косметика	388370	L'Oreal Dermo Expertise
479978	3600521823781	Крем вокруг глаз L'oreal Dermo Expertise age Perfect в период менопаузы банка 15ml	664	Косметика (folder)/Крем для лица	388370	L'Oreal Dermo Expertise
388388	3600521993149	Крем вокруг глаз L'oreal Dermo Expertise роскошь питания питание+защита+сияние 15ml	664	Косметика (folder)/Крем для лица	388370	L'Oreal Dermo Expertise
1763150	3600522632511	Крем вокруг глаз L'oreal Paris возраст Эксперт 45+ против морщин, лифтинг-уход, 15ml a8128200	5586	Косметика (folder)/Косметика	388370	L'Oreal Dermo Expertise
1837920	3600520463131	Крем вокруг глаз L'oreal мимич морщ 15ml	5586	Косметика (folder)/Косметика	2626	L'Oreal
2639476	4607174434325	Крем вокруг глаз Natura Siberica ночной отбеливание 30ml	1	Неклассифицированные/default	629499	Natura Siberica
9887	4600697400617	Крем вокруг глаз nc ворожея 15ml	5586	Косметика (folder)/Косметика	220	Невская Косметика Ворожея
480251	4600697407685	Крем вокруг глаз nc женьшеневый 25ml в пластиковой тубе и футляре	664	Косметика (folder)/Крем для лица	20651	Невская Косметика
1070797	6920031411573	Крем вокруг глаз New face увлажняющий (25g).12	1	Неклассифицированные/default	0	
634431	5410076852895	Крем вокруг глаз olay total effects 7in1 преображающий 15ml	5586	Косметика (folder)/Косметика	12158	Olay
479979	4820074621859	Крем вокруг глаз вкусные секреты viva oliva 45+ 30ml против морщин	664	Косметика (folder)/Крем для лица	443794	Вкусные Секреты
479977	3800038935551	Крем вокруг глаз дева 40ml	664	Косметика (folder)/Крем для лица	0	
479975	3800038933243	Крем вокруг глаз дева с маслом жожоба 30ml	664	Косметика (folder)/Крем для лица	0	
479980	4603541001596	Крем вокруг глаз маграв 30ml н/биокомпаненты	664	Косметика (folder)/Крем для лица	20195	МАГРАВ
479976	4607005830180	Крем вокруг глаз маркелл против морщин 32g	664	Косметика (folder)/Крем для лица	0	
1241562	4105710022550	Крем вокруг глаз флорена 15ml	5586	Косметика (folder)/Косметика	0	
715	4600702048902	Крем вокруг глаз черный Жемчуг аквабаланс 15ml	664	Косметика (folder)/Крем для лица	151	Черный Жемчуг
870485	4811230006283	Крем вокруг глаз энергия трав от морщин 30ml (рб)/50	1	Неклассифицированные/default	0	
3376405	4606304003097	Крем волшебная плита для чистки стеклокерамики 300ml тв/уп	1	Неклассифицированные/default	0	
3376406	4607062581186	Крем волшебная пчела для жирной и проблемной кожи лица 75ml	1	Неклассифицированные/default	0	
3376407	4607062581780	Крем волшебная пчела для проблемной юношеской кожи 75ml	1	Неклассифицированные/default	0	
5019184	4660043250693	Крем волшебное дерево взбитые сливки для прослойки/декорир.45g	622408	Продукты питания (folder)/Бакалея	38427	Волшебное Дерево
3376408	4607003767846	Крем волшебное дерево заварной ванильный мягуп 120g	1	Неклассифицированные/default	38427	Волшебное Дерево
5019185	4660043250594	Крем волшебное дерево заварной шоколадный 120g	622408	Продукты питания (folder)/Бакалея	38427	Волшебное Дерево
5373	4607086560792	Крем волшебное зернышко от морщин ночной злаково-витаминный бан. 50ml	5586	Косметика (folder)/Косметика	0	
19761	4607012140272	Крем восстанавл гипоаллергенный 50ml	5586	Косметика (folder)/Косметика	18723	КОРА
742544	8011607101535	Крем восстанавливащий защита против старения 200ml	5586	Косметика (folder)/Косметика	18029	PUPA
5458575	1395745013699	Крем восстанавливающий beauty style после процедуры лазерной и rf коррекции кожи, 130мл 4515501k	5242128	Косметика (folder)/Косметика аппаратная	342690	Beauty Style
5458576	8801053200230	Крем восстанавливающий beauty style после процедуры лазерной и rf коррекции кожи, 130мл 4515501k #2	5242128	Косметика (folder)/Косметика аппаратная	342690	Beauty Style
742545	8011607116898	Крем восстанавливающий против сухости кожи 200ml	5586	Косметика (folder)/Косметика	18029	PUPA
5019186	4640028990103	Крем восстанавливающий с маслом арганы и маслом сладкого миндаляя 300ml (87760)	5203	Косметика (folder)/Депиляция	4910265	DepilTouch
1240780	8690511971993	Крем гала сосна 500g	1	Неклассифицированные/default	0	
75537	4605059014785	Крем галенофарм антицеллюлитный 130g	5586	Косметика (folder)/Косметика	50272	Галенофарм
75538	4605059002751	Крем галенофарм антицеллюлитный 30g	5586	Косметика (folder)/Косметика	50272	Галенофарм
75541	4605059010268	Крем галенофарм отбеливающий 30g	5586	Косметика (folder)/Косметика	50272	Галенофарм
4844204	8001116432718	Крем галлетти бальзамич.модена аль чето 250ml п/б	26041	Продукты питания (folder)/Уксус	4844203	Галлетти
5468	4607023070537	Крем Гармония трав дневной 40ml	5586	Косметика (folder)/Косметика	0	
3376409	4603084001435	Крем гиалюкс 50ml (флакон,дозатор)	1	Неклассифицированные/default	0	
5019187	3838989624385	Крем гидробаланс ночной vitaskin basic (№11) 50ml	5586	Косметика (folder)/Косметика	0	
454554	4820008311115	Крем гирудо-бальзам при ранах, ссадинах, ожогах 30g	362341	Лекарственные средства (folder)/Дерматологические средства прочие	0	
479982	4820008310637	Крем гирудотонус туба 100g	1	Неклассифицированные/default	0	
4838378	4670030870063	Крем гистан при аллергии на коже 30ml 358010	4806371	Лекарственные средства (folder)/Парафармацевтика	5458577	гистан
479984	4820058762264	Крем глицериновый персиковый 100g	1	Неклассифицированные/default	0	
479985	4820058760338	Крем глицериновый персиковый 44g	1	Неклассифицированные/default	0	
1503	4015000529815	Крем глобальное действие 9 концентрат 10x 1ml	5586	Косметика (folder)/Косметика	360614	Diademine
3376410	4607013280229	Крем гоу аут от комаров 30ml	1	Неклассифицированные/default	599920	Go Out
32342	4603541006171	Крем гринмар виноградный для молодости кожи	1	Неклассифицированные/default	32341	Гринмар
32343	4603541006164	Крем гринмар лимонный отбеливающий	1	Неклассифицированные/default	32341	Гринмар
32344	4603541006096	Крем гринмар смородинный длительно-увлажняющего действия	1	Неклассифицированные/default	32341	Гринмар
32345	4603541006102	Крем гринмар яблочный витаминный	1	Неклассифицированные/default	32341	Гринмар
9253	3243651733096	Крем дарвин версатайл жен 100	3068	Парфюмерия (folder)/Парфюмерия	4689	Brocard
740997	324365173309	Крем дарвин версатайл жен 100 #2	5586	Косметика (folder)/Косметика	4689	Brocard
9254	3243657539098	Крем дарвин зора жен 100	3068	Парфюмерия (folder)/Парфюмерия	4689	Brocard
369095	7290100250884	Крем дезодорирующий Fresh look с дозатором 50ml	5586	Косметика (folder)/Косметика	369086	Fresh Look
742548	460070207820	Крем део контроль смягчающ 80ml	1682	Косметика (folder)/Крем косметический	0	
75611	041670261964	Крем деп для легкой фикс.волос	28	Уход за волосами (folder)/Уход за волосами	49444	Деп
75612	041670261803	Крем деп для экстремальн.фикс.волос	28	Уход за волосами (folder)/Уход за волосами	49444	Деп
456965	8030009040020	Крем депилирующий Easy depil для чувствит. обл 75ml /12 Италия	5203	Косметика (folder)/Депиляция	3643517	DEPIL EASY
3376413	4670006721962	Крем депилятор авокадо ментол 35g	5203	Косметика (folder)/Депиляция	3749354	SHARY (AMIDASOL)
3376414	4670006721948	Крем депилятор кокос ментол 35g	5203	Косметика (folder)/Депиляция	3749354	SHARY (AMIDASOL)
3376415	4670006722006	Крем депилятор хлопок ментол 35g	5203	Косметика (folder)/Депиляция	3749354	SHARY (AMIDASOL)
3376416	4660014254286	Крем деревенский с творогом 30% 500g пл/бан	1	Неклассифицированные/default	0	
2449167	4602112101765	Крем десерт персик Русский продукт 0.120	2422387	Продукты питания (folder)/Концентраты сухие	0	
2449168	4602112101727	Крем десерт ром Русский продукт 0.120	2422387	Продукты питания (folder)/Концентраты сухие	0	
2449169	4602112101710	Крем десерт шок/ликер Русский продукт 0.120	2422387	Продукты питания (folder)/Концентраты сухие	0	
75446	4607038541046	Крем десертн академия шоколада тянучка сливочная 330g пэт	1280112	Продукты питания (folder)/Паста	41034	Академия Шоколада
1240788	8003267902577	Крем десертн.вилла реале кофейный 200g с/б	1280112	Продукты питания (folder)/Паста	682438	Вилла Реале
1240789	8003267902553	Крем десертн.вилла реале лимонный 200g с/б	1280112	Продукты питания (folder)/Паста	682438	Вилла Реале
1240790	8003267902560	Крем десертн.вилла реале мандариновый 200g с/б	1280112	Продукты питания (folder)/Паста	682438	Вилла Реале
1240791	8003267902515	Крем десертн.вилла реале фисташковый 200g с/б	1280112	Продукты питания (folder)/Паста	682438	Вилла Реале
5019188	4650068539811	Крем десертный лакоминка карамель 3.5kg	1	Неклассифицированные/default	0	
5019189	4650068539774	Крем десертный лакоминка тирамиссу 3.5kg	1	Неклассифицированные/default	0	
5019190	4650068539767	Крем десертный лакоминка шоколад 3.5kg	1	Неклассифицированные/default	0	
5019191	4607041022273	Крем десткая аптека зимний для прогулок 75ml ООО дина+	5586	Косметика (folder)/Косметика	0	
31219	046007020269	Крем детский	5586	Косметика (folder)/Косметика	18324	КАЛИНА
479990	4820022904690	Крем детский + витамин a, d2 туба 40g	278498	Уход за детьми (folder)/Крем детский	0	
1240793	4810340002802	Крем детский 100ml б/н с ромашкой и d-пантен. с ромашкой и d-пантен.	278498	Уход за детьми (folder)/Крем детский	2158687	Iris
742551	4810340002796	Крем детский 100ml б/н с чередой,витам.f с чередой,витам.f	278498	Уход за детьми (folder)/Крем детский	2158687	Iris
479991	4820013190040	Крем детский 40g с витамином a и e	278498	Уход за детьми (folder)/Крем детский	0	
9726	4600936182304	Крем детский 40g с экстрактом ромаш и вит а для сух и чувст кожи	278498	Уход за детьми (folder)/Крем детский	3757831	Svoboda
4844205	460070202627	Крем детский 42ml	241824	Лекарственные средства (folder)/Аптека	0	
479993	4607017940662	Крем детский 44ml	278498	Уход за детьми (folder)/Крем детский	0	
4844206	4606179140422	Крем детский 46ml /футляр/	241824	Лекарственные средства (folder)/Аптека	0	
4844207	4607017940648	Крем детский 46ml /футляр/ #2	241824	Лекарственные средства (folder)/Аптека	0	
2229544	4607018761587	Крем детский 46ml до 01.03.17	278498	Уход за детьми (folder)/Крем детский	3802138	Детский (ADELEYD)
75614	4606711140422	Крем детский 46ml с витаминами и экстр ромашки	278498	Уход за детьми (folder)/Крем детский	75436	Аванта
479994	4607011663949	Крем детский 50g (ромаш.+череда+лаванда)	278498	Уход за детьми (folder)/Крем детский	0	
3376417	4607059923449	Крем детский 50ml	278498	Уход за детьми (folder)/Крем детский	0	
4844208	4650070510372	Крем детский 50ml/рк	241824	Лекарственные средства (folder)/Аптека	0	
4844209	460093618184	Крем детский 68.0	241824	Лекарственные средства (folder)/Аптека	0	
5019192	4810090011604	Крем детский 75g для нежной кожи под подгузник классная цена ш/к4810090011604	278498	Уход за детьми (folder)/Крем детский	0	
1240794	4605108002749	Крем детский 75ml	278498	Уход за детьми (folder)/Крем детский	0	
75616	4606711140316	Крем детский 75ml с витаминами и экстр ромашки	278498	Уход за детьми (folder)/Крем детский	75436	Аванта
