ID	UPCEAN	Name	CategoryID	CategoryName	BrandID	BrandName
2761865	9771038370038	Фильтр масляный dextrim dx3-7003w	3620768	Эксплуатация и ремонт автомобилей/Фильтр масляный	2761838	DEXTRIM
2761866	9771038360206	Фильтр масляный dextrim dx3-oa602	3620768	Эксплуатация и ремонт автомобилей/Фильтр масляный	2761838	DEXTRIM
2761867	9771038370106	Фильтр масляный dextrim dx3-ob701	3620768	Эксплуатация и ремонт автомобилей/Фильтр масляный	2761838	DEXTRIM
2761868	9771038501258	Фильтр масляный dextrim dx3-ob701 #2	3620768	Эксплуатация и ремонт автомобилей/Фильтр масляный	2761838	DEXTRIM
2761869	9771038376306	Фильтр масляный dextrim dx3-oe763	3620768	Эксплуатация и ремонт автомобилей/Фильтр масляный	2761838	DEXTRIM
2761870	9771038378300	Фильтр масляный dextrim dx3-oe783	3620768	Эксплуатация и ремонт автомобилей/Фильтр масляный	2761838	DEXTRIM
2761871	9771038395604	Фильтр масляный dextrim dx3-oe956	3620768	Эксплуатация и ремонт автомобилей/Фильтр масляный	2761838	DEXTRIM
2761872	9771038370601	Фильтр масляный dextrim dx3-og706	3620768	Эксплуатация и ремонт автомобилей/Фильтр масляный	2761838	DEXTRIM
2761873	9771038394508	Фильтр масляный dextrim dx3-og945	3620768	Эксплуатация и ремонт автомобилей/Фильтр масляный	2761838	DEXTRIM
2761874	9771038360107	Фильтр масляный dextrim dx3-оа601	3620768	Эксплуатация и ремонт автомобилей/Фильтр масляный	2761838	DEXTRIM
2761875	9771038306013	Фильтр масляный dextrim dx3-ое601	3620768	Эксплуатация и ремонт автомобилей/Фильтр масляный	2761838	DEXTRIM
2761876	9771038365218	Фильтр масляный dextrim dx3-ое652	3620768	Эксплуатация и ремонт автомобилей/Фильтр масляный	2761838	DEXTRIM
2761877	9771038501234	Фильтр масляный dextrim dxз-3003н	3620768	Эксплуатация и ремонт автомобилей/Фильтр масляный	2761838	DEXTRIM
2761878	9771038501319	Фильтр масляный dextrim dxз-3008н	3620768	Эксплуатация и ремонт автомобилей/Фильтр масляный	2761838	DEXTRIM
2761879	9771038140822	Фильтр масляный dextrim dxз-7001н	3620768	Эксплуатация и ремонт автомобилей/Фильтр масляный	2761838	DEXTRIM
2761880	9771038371356	Фильтр масляный dextrim каз-0003н	3620768	Эксплуатация и ремонт автомобилей/Фильтр масляный	2761838	DEXTRIM
5797228	5904608036407	Фильтр масляный filtron oe640/3 для mb	3620768	Эксплуатация и ремонт автомобилей/Фильтр масляный	5796225	filtron
5797229	5904608056481	Фильтр масляный filtron oe648/4	3620768	Эксплуатация и ремонт автомобилей/Фильтр масляный	5796225	filtron
5797230	5904608005205	Фильтр масляный filtron op520	3620768	Эксплуатация и ремонт автомобилей/Фильтр масляный	5796225	filtron
5797231	5904608125200	Фильтр масляный filtron op520/1t без упаковки (ваз 2108-09)	3620768	Эксплуатация и ремонт автомобилей/Фильтр масляный	5796225	filtron
5797232	9900003284739	Фильтр масляный filtron op520/1t без упаковки (ваз 2108-09) #2	3620768	Эксплуатация и ремонт автомобилей/Фильтр масляный	5796225	filtron
5797233	5904608045676	Фильтр масляный filtron op567/3 для nissan	3620768	Эксплуатация и ремонт автомобилей/Фильтр масляный	5796225	filtron
168411	4041715102104	Фильтр масляный finwhale lf 105m (2108-09)	3620768	Эксплуатация и ремонт автомобилей/Фильтр масляный	155666	FINWHALE
1713271	4041715113025	Фильтр масляный finwhale lf302 ford focus 1 1.6/1.8/2.0/1070521 1455760/	3620768	Эксплуатация и ремонт автомобилей/Фильтр масляный	0	
1465489	4041715113063	Фильтр масляный finwhale lf306 ford focus 2 1.8/2.0/1250507/	3620768	Эксплуатация и ремонт автомобилей/Фильтр масляный	0	
1465490	4041715114138	Фильтр масляный finwhale lf413 chewrolet aveo 1.4 (101ph)/93185674/	3620768	Эксплуатация и ремонт автомобилей/Фильтр масляный	155666	FINWHALE
1465491	4041715115029	Фильтр масляный finwhale lf502 kia spectra /26300-2y500/	3620768	Эксплуатация и ремонт автомобилей/Фильтр масляный	155666	FINWHALE
1465492	4041715117023	Фильтр масляный finwhale lf702 renault logan /7700274177/	3620768	Эксплуатация и ремонт автомобилей/Фильтр масляный	155666	FINWHALE
5797234	031508522671	Фильтр масляный ford AA5z6714a	3620768	Эксплуатация и ремонт автомобилей/Фильтр масляный	1656083	FORD
5797235	5022650272922	Фильтр масляный fram ch10075eco	3620768	Эксплуатация и ремонт автомобилей/Фильтр масляный	1679925	FRAM
5797236	5022650273974	Фильтр масляный fram ch10246eco	3620768	Эксплуатация и ремонт автомобилей/Фильтр масляный	1679925	FRAM
5797237	5022650278306	Фильтр масляный fram ch10358eco	3620768	Эксплуатация и ремонт автомобилей/Фильтр масляный	1679925	FRAM
5797238	5022650282631	Фильтр масляный fram ch10717aeco	3620768	Эксплуатация и ремонт автомобилей/Фильтр масляный	1679925	FRAM
5797239	5022650278276	Фильтр масляный fram ch10759eco	3620768	Эксплуатация и ремонт автомобилей/Фильтр масляный	1679925	FRAM
5797240	5022650282686	Фильтр масляный fram ch9463aeco	3620768	Эксплуатация и ремонт автомобилей/Фильтр масляный	1679925	FRAM
5797241	5022650279310	Фильтр масляный fram ch9973aeco	3620768	Эксплуатация и ремонт автомобилей/Фильтр масляный	1679925	FRAM
1469670	5022650200017	Фильтр масляный fram ph-2857a ваз 2101-07 6	3620768	Эксплуатация и ремонт автомобилей/Фильтр масляный	1679925	FRAM
1469671	5022650227670	Фильтр масляный fram ph-5822 ваз 2108-12 6	3620768	Эксплуатация и ремонт автомобилей/Фильтр масляный	1679925	FRAM
1469672	091003800810	Фильтр масляный fram ph-8a газ дв 406 12	3620768	Эксплуатация и ремонт автомобилей/Фильтр масляный	0	
5797242	5022650278351	Фильтр масляный fram ph10757	3620768	Эксплуатация и ремонт автомобилей/Фильтр масляный	1679925	FRAM
5797243	5022650202103	Фильтр масляный fram ph2870a, 1шт	3620768	Эксплуатация и ремонт автомобилей/Фильтр масляный	1679925	FRAM
5797244	5022650200031	Фильтр масляный fram ph4722, 1шт	3620768	Эксплуатация и ремонт автомобилей/Фильтр масляный	1679925	FRAM
5797245	5022650203063	Фильтр масляный fram ph4997, 1шт	3620768	Эксплуатация и ремонт автомобилей/Фильтр масляный	1679925	FRAM
5797246	5022650203070	Фильтр масляный fram ph4998	3620768	Эксплуатация и ремонт автомобилей/Фильтр масляный	1679925	FRAM
5797247	5022650203254	Фильтр масляный fram ph5317, 1шт	3620768	Эксплуатация и ремонт автомобилей/Фильтр масляный	1679925	FRAM
5797248	5022650227229	Фильтр масляный fram ph5796, 1шт	3620768	Эксплуатация и ремонт автомобилей/Фильтр масляный	1679925	FRAM
5797249	5022650227847	Фильтр масляный fram ph5803, 1шт	3620768	Эксплуатация и ремонт автомобилей/Фильтр масляный	1679925	FRAM
5797250	5022650227731	Фильтр масляный fram ph5833	3620768	Эксплуатация и ремонт автомобилей/Фильтр масляный	1679925	FRAM
5797251	5022650203087	Фильтр масляный fram ph6355, 1шт	3620768	Эксплуатация и ремонт автомобилей/Фильтр масляный	1679925	FRAM
5797252	5022650213130	Фильтр масляный fram ph6811, 1шт	3620768	Эксплуатация и ремонт автомобилей/Фильтр масляный	1679925	FRAM
5797253	5022650202011	Фильтр масляный fram ph8a (газ 406 двигатель) ph8a.	3620768	Эксплуатация и ремонт автомобилей/Фильтр масляный	1679925	FRAM
5099375	3500635533500	Фильтр масляный francecar cr210134	3620768	Эксплуатация и ремонт автомобилей/Фильтр масляный	0	
5797255	707773193907	Фильтр масляный gm (general motors) 12605566	3620768	Эксплуатация и ремонт автомобилей/Фильтр масляный	5797254	gm (general motors)
1481540	5094632790069	Фильтр масляный Good will og - 214 газель	3620768	Эксплуатация и ремонт автомобилей/Фильтр масляный	1481529	Good will
1481541	5094632791615	Фильтр масляный Good will og - 220 валдай	3620768	Эксплуатация и ремонт автомобилей/Фильтр масляный	1481529	Good will
1481542	509463279003	Фильтр масляный Good will og-212 газ двиг.chrysler ford f focus	3620768	Эксплуатация и ремонт автомобилей/Фильтр масляный	1481529	Good will
1481543	5094632790243	Фильтр масляный Good will og-400 ваз 2101-07 8\32	3620768	Эксплуатация и ремонт автомобилей/Фильтр масляный	1481529	Good will
1481544	5094632790328	Фильтр масляный Good will og-403.402 газ двиг 406 8\32	3620768	Эксплуатация и ремонт автомобилей/Фильтр масляный	1481529	Good will
1481545	5094632790267	Фильтр масляный Good will og-411 ваз 2108-15 8\32	3620768	Эксплуатация и ремонт автомобилей/Фильтр масляный	1481529	Good will
5099376	4059421026409	Фильтр масляный Green Filter ok0100	3620768	Эксплуатация и ремонт автомобилей/Фильтр масляный	0	
5099377	4059421026416	Фильтр масляный Green Filter oк0132	3620768	Эксплуатация и ремонт автомобилей/Фильтр масляный	0	
5797256	7391883116951	Фильтр масляный husqvarna на трактор (5310295-03)	3620768	Эксплуатация и ремонт автомобилей/Фильтр масляный	5169905	husqvarna
5797258	465465654654	Фильтр масляный hyundai/kia mobis 2630035505 (замена 2630035504) 1шт 26300-35505	3620768	Эксплуатация и ремонт автомобилей/Фильтр масляный	5797257	mobis
5797259	027067912046	Фильтр масляный knecht/mahle oc 1063 для ford, land rover	3620768	Эксплуатация и ремонт автомобилей/Фильтр масляный	5796048	knecht/mahle
5797260	4009026924259	Фильтр масляный knecht/mahle oc 1183	3620768	Эксплуатация и ремонт автомобилей/Фильтр масляный	5796048	knecht/mahle
5797261	4009026939451	Фильтр масляный knecht/mahle oc 1254	3620768	Эксплуатация и ремонт автомобилей/Фильтр масляный	5796048	knecht/mahle
5797262	4009026936221	Фильтр масляный knecht/mahle oc 1255	3620768	Эксплуатация и ремонт автомобилей/Фильтр масляный	5796048	knecht/mahle
5797263	757522238564	Фильтр масляный knecht/mahle oc 195 для mazda, subaru	3620768	Эксплуатация и ремонт автомобилей/Фильтр масляный	5796048	knecht/mahle
5797264	757522218313	Фильтр масляный knecht/mahle oc 196 для mazda	3620768	Эксплуатация и ремонт автомобилей/Фильтр масляный	5796048	knecht/mahle
5797265	027067667656	Фильтр масляный knecht/mahle oc 264 для vag	3620768	Эксплуатация и ремонт автомобилей/Фильтр масляный	5796048	knecht/mahle
5797266	4009026000168	Фильтр масляный knecht/mahle oc 28 (uaz patriot mot.2.7 l zmz409.10)	3620768	Эксплуатация и ремонт автомобилей/Фильтр масляный	5796048	knecht/mahle
5797267	4009026026960	Фильтр масляный knecht/mahle oc 47 of для audi, vw	3620768	Эксплуатация и ремонт автомобилей/Фильтр масляный	5796048	knecht/mahle
5182707	4009026000038	Фильтр масляный knecht/mahle oc 90 of для opel	1	Неклассифицированные/default	5182695	Mahle
5797268	4009026972953	Фильтр масляный knecht/mahle oc1051a	3620768	Эксплуатация и ремонт автомобилей/Фильтр масляный	5796048	knecht/mahle
5797269	4009026918425	Фильтр масляный knecht/mahle oc1053	3620768	Эксплуатация и ремонт автомобилей/Фильтр масляный	5796048	knecht/mahle
5797270	4009026887554	Фильтр масляный knecht/mahle oc1063	3620768	Эксплуатация и ремонт автомобилей/Фильтр масляный	5796048	knecht/mahle
5797271	4009026923252	Фильтр масляный knecht/mahle oc1177 (d=65.5 h=86.2 h=85 d2=62.6 d3=52.4 m1=m 20x1.5)	3620768	Эксплуатация и ремонт автомобилей/Фильтр масляный	5796048	knecht/mahle
5797272	4009026015698	Фильтр масляный knecht/mahle oc194 (d=65.5 h=86.5 h=85 d2=62.9 d3=54.5 m1=m 20x1.5)	3620768	Эксплуатация и ремонт автомобилей/Фильтр масляный	5796048	knecht/mahle
5182699	4009026015667	Фильтр масляный knecht/mahle oc195 (d=65.5 h=66.5 h=65 d2=62.9 d3=54.5 m1=m 20x1.5)	1	Неклассифицированные/default	5182695	Mahle
5182700	4009026015674	Фильтр масляный knecht/mahle oc196 (d=65.5 h=86.5 h=85 d2=62.9 d3=54.5 m1=m 20x1.5)	1	Неклассифицированные/default	5182695	Mahle
5797273	4009026972915	Фильтр масляный knecht/mahle oc205a (d=76 h=73.6 h=73 d2=63 d3=51.5 m1=m 20x1.5)	3620768	Эксплуатация и ремонт автомобилей/Фильтр масляный	5796048	knecht/mahle
5797274	4009026022054	Фильтр масляный knecht/mahle oc215 (d=65.5 h=65 d2=62.9 d3=54.5 m1=3/4-16 unf-2b)	3620768	Эксплуатация и ремонт автомобилей/Фильтр масляный	5796048	knecht/mahle
5797275	4009026972960	Фильтр масляный knecht/mahle oc217/6a (d=65.5 h=85 d2=62.9 d3=54.5 m1=3/4-16 unf-2b)	3620768	Эксплуатация и ремонт автомобилей/Фильтр масляный	5796048	knecht/mahle
5797276	4009026033463	Фильтр масляный knecht/mahle oc236 (d=93.2 h=96 h=94.5 d2=72 d3=62 m1=3/4-16 unf-2b)	3620768	Эксплуатация и ремонт автомобилей/Фильтр масляный	5796048	knecht/mahle
5182702	4009026095973	Фильтр масляный knecht/mahle oc264 (d=76 h=119.5 h=118 d2=72 d3=62 m1=3/4-16 unf-2b)	1	Неклассифицированные/default	5182695	Mahle
5797277	4009026108284	Фильтр масляный knecht/mahle oc274 (d=102 h=127.5 h=125 d2=73.7 m1=m 26x1.5 p)	3620768	Эксплуатация и ремонт автомобилей/Фильтр масляный	5796048	knecht/mahle
5797278	4009026008300	Фильтр масляный knecht/mahle oc288	3620768	Эксплуатация и ремонт автомобилей/Фильтр масляный	5796048	knecht/mahle
5797279	027067790521	Фильтр масляный knecht/mahle oc295 (d=76 h=89.5 h=78.5 d2=72 d3=62 m1=3/4-16 unf-2b)	3620768	Эксплуатация и ремонт автомобилей/Фильтр масляный	5796048	knecht/mahle
5797280	4009026972601	Фильтр масляный knecht/mahle oc384a (ваз 2108-15) (d=86.5 h=74 h=72.5 d2=72 d3=62 m1=3/4-16 unf-2b)	3620768	Эксплуатация и ремонт автомобилей/Фильтр масляный	5796048	knecht/mahle
5797281	4009026026953	Фильтр масляный knecht/mahle oc47 (d=76 h=119.5 h=118 d2=72 d3=62 m1=3/4-16 unf-2b) oc47.	3620768	Эксплуатация и ремонт автомобилей/Фильтр масляный	5796048	knecht/mahle
5797282	4009026504314	Фильтр масляный knecht/mahle oc470 (d=93.2 h=150.5 h=139.5 d2=72 d3=62 m1=3/4-16 unf-2b)	3620768	Эксплуатация и ремонт автомобилей/Фильтр масляный	5796048	knecht/mahle
5797283	027067667960	Фильтр масляный knecht/mahle oc501 (d=76 h=92 d2=72 d3=62 m1=3/4-16 unf-2b)	3620768	Эксплуатация и ремонт автомобилей/Фильтр масляный	5796048	knecht/mahle
5797284	4009026972922	Фильтр масляный knecht/mahle oc534a (d=65.5 h=76.5 h=75 d2=62.5 d3=54.5 m1=3/4-16 unf-2b)	3620768	Эксплуатация и ремонт автомобилей/Фильтр масляный	5796048	knecht/mahle
5797285	027067862730	Фильтр масляный knecht/mahle oc570 (d=93.2 h=71 h=69.5 d2=72 d3=62 m1=m 22x1.5)	3620768	Эксплуатация и ремонт автомобилей/Фильтр масляный	5796048	knecht/mahle
5797286	4009026885765	Фильтр масляный knecht/mahle oc593/3 (d=76 h=98.3 h=80 d2=54 d3=34 m1=3/4-16 unf-2b)	3620768	Эксплуатация и ремонт автомобилей/Фильтр масляный	5796048	knecht/mahle
5797287	4009026718643	Фильтр масляный knecht/mahle oc606 (d=76 h=72 d2=72 d3=62 m1=3/4-16 unf-2b)	3620768	Эксплуатация и ремонт автомобилей/Фильтр масляный	5796048	knecht/mahle
5797288	4009026727850	Фильтр масляный knecht/mahle oc615 (d=76 h=101 h=99.5 d2=72 d3=62 m1=3/4-16 unf-2b)	3620768	Эксплуатация и ремонт автомобилей/Фильтр масляный	5796048	knecht/mahle
5797289	4009026719664	Фильтр масляный knecht/mahle oc617 (d=65.5 h=86.5 h=85 d2=62.6 d3=52.4 m1=m 20x1.5)	3620768	Эксплуатация и ремонт автомобилей/Фильтр масляный	5796048	knecht/mahle
5797290	4009026934081	Фильтр масляный knecht/mahle oc727 (d=76 h=63.5 h=62 d2=72 d3=62 m1=m 20x1.5)	3620768	Эксплуатация и ремонт автомобилей/Фильтр масляный	5796048	knecht/mahle
5182706	4009026037935	Фильтр масляный knecht/mahle oc90 (d=76 h=80 h=78.5 d2=72 d3=62 m1=m 18x1.5) oc90.	1	Неклассифицированные/default	5182695	Mahle
5797291	4009026887516	Фильтр масляный knecht/mahle oc977/1 (d=76 h=80 h=78.5 d2=72 d3=62 m1=3/4-16 unf 2b)	3620768	Эксплуатация и ремонт автомобилей/Фильтр масляный	5796048	knecht/mahle
5797292	4009026834190	Фильтр масляный knecht/mahle ox 353/7d для bmw	3620768	Эксплуатация и ремонт автомобилей/Фильтр масляный	5796048	knecht/mahle
5797293	4009026724965	Фильтр масляный knecht/mahle ox 388d для audi, vw	3620768	Эксплуатация и ремонт автомобилей/Фильтр масляный	5796048	knecht/mahle
5797294	4009026039816	Фильтр масляный knecht/mahle ox133d (d=62 h=157.5 d3=26 h1=157.5)	3620768	Эксплуатация и ремонт автомобилей/Фильтр масляный	5796048	knecht/mahle
5797295	027067000989	Фильтр масляный knecht/mahle ox143d (d=65 h=153 d3=19.5 h1=153)	3620768	Эксплуатация и ремонт автомобилей/Фильтр масляный	5796048	knecht/mahle
5797296	4009026083512	Фильтр масляный knecht/mahle ox149d	3620768	Эксплуатация и ремонт автомобилей/Фильтр масляный	5796048	knecht/mahle
5797297	4009026203453	Фильтр масляный knecht/mahle ox153/7d (замена ox 153d, ox 153/12d) (d=64.3 h=115 d3=31.4 h1=105.1)	3620768	Эксплуатация и ремонт автомобилей/Фильтр масляный	5796048	knecht/mahle
5797298	4009026885208	Фильтр масляный knecht/mahle ox183/5d (d=46.3 h=156.6 d3=21 h1=148)	3620768	Эксплуатация и ремонт автомобилей/Фильтр масляный	5796048	knecht/mahle
5797299	4009026309339	Фильтр масляный knecht/mahle ox258d (d=62 h=88.9 d3=10.6 h1=66)	3620768	Эксплуатация и ремонт автомобилей/Фильтр масляный	5796048	knecht/mahle
5797300	4009026506141	Фильтр масляный knecht/mahle ox339/2d (d=67 h=69 d3=24 h1=69)	3620768	Эксплуатация и ремонт автомобилей/Фильтр масляный	5796048	knecht/mahle
5797301	4009026877944	Фильтр масляный knecht/mahle ox345/7d	3620768	Эксплуатация и ремонт автомобилей/Фильтр масляный	5796048	knecht/mahle
5797302	4009026508015	Фильтр масляный knecht/mahle ox370d (d=63.5 h=125 d3=31 h1=121.1)	3620768	Эксплуатация и ремонт автомобилей/Фильтр масляный	5796048	knecht/mahle
5797303	4009026509975	Фильтр масляный knecht/mahle ox380d (d=72 h=95 d3=24.5 h1=95)	3620768	Эксплуатация и ремонт автомобилей/Фильтр масляный	5796048	knecht/mahle
5797304	4009026509326	Фильтр масляный knecht/mahle ox381d (d=63.5 h=155 d3=31)	3620768	Эксплуатация и ремонт автомобилей/Фильтр масляный	5796048	knecht/mahle
5797305	027067000606	Фильтр масляный knecht/mahle ox387d (d=74 h=77.4 d3=41 h1=74.1)	3620768	Эксплуатация и ремонт автомобилей/Фильтр масляный	5796048	knecht/mahle
5797306	027067001351	Фильтр масляный knecht/mahle ox388d (d=65 h=101 h1=101)	3620768	Эксплуатация и ремонт автомобилей/Фильтр масляный	5796048	knecht/mahle
5797307	270670013512	Фильтр масляный knecht/mahle ox388d (d=65 h=101 h1=101) #2	3620768	Эксплуатация и ремонт автомобилей/Фильтр масляный	5796048	knecht/mahle
5797308	4009026728239	Фильтр масляный knecht/mahle ox413d1 (d=68.8 h=82 d3=27.5 h1=78.1)	3620768	Эксплуатация и ремонт автомобилей/Фильтр масляный	5796048	knecht/mahle
5797309	4009026728345	Фильтр масляный knecht/mahle ox414d1 (d=68.8 h=67 d3=27.5 h1=63.1)	3620768	Эксплуатация и ремонт автомобилей/Фильтр масляный	5796048	knecht/mahle
5797310	4009026718889	Фильтр масляный knecht/mahle ox433d (d=83 h=105 d3=42)	3620768	Эксплуатация и ремонт автомобилей/Фильтр масляный	5796048	knecht/mahle
5797311	4009026724231	Фильтр масляный knecht/mahle ox560d (d=63.5 h=155 d3=28.5 h1=146.5)	3620768	Эксплуатация и ремонт автомобилей/Фильтр масляный	5796048	knecht/mahle
5099378	4680002692654	Фильтр масляный luxe lx-18-m kia/renault/nissan (аналог w67/1)	3620768	Эксплуатация и ремонт автомобилей/Фильтр масляный	2625768	LUXE
1334087	4680002690018	Фильтр масляный luxoil lx-01-м ваз 01-07 пласти.уп	3620768	Эксплуатация и ремонт автомобилей/Фильтр масляный	2625768	LUXE
2761928	4680002691503	Фильтр масляный luxoil lx-01-м ваз 01-07 Премиум	3620768	Эксплуатация и ремонт автомобилей/Фильтр масляный	2625768	LUXE
