ID	UPCEAN	Name	CategoryID	CategoryName	BrandID	BrandName
3705082	4607065970819	Mezhdurechenskoe жигулевское 500ml j bo l x #2	22186	Продукты питания (folder)/Алкогольные напитки/Пиво	3705078	MEZHDURECHENSKOE
3705083	4607065110017	Mezhdurechenskoe светлое 500ml j bo l x	22186	Продукты питания (folder)/Алкогольные напитки/Пиво	3705078	MEZHDURECHENSKOE
3705085	4620004402875	Mezheninovskay pf (sibirskiy p bedro pieces chicken 1kg	1201445	Продукты питания (folder)/Мясо	3705084	MEZHENINOVSKAY PF (SIBIRSKIY PREM'ER GK)
3705086	4620004402905	Mezheninovskay pf (sibirskiy p chetvrtin-zadnaya pieces chicken 1kg	1201445	Продукты питания (folder)/Мясо	3705084	MEZHENINOVSKAY PF (SIBIRSKIY PREM'ER GK)
3705087	4620004402936	Mezheninovskay pf (sibirskiy p dly-tushnia-na-kost pieces chicken 1kg	1201445	Продукты питания (folder)/Мясо	3705084	MEZHENINOVSKAY PF (SIBIRSKIY PREM'ER GK)
3705088	4620004402127	Mezheninovskay pf (sibirskiy p farsh minced chicken 1kg	1201445	Продукты питания (folder)/Мясо	3705084	MEZHENINOVSKAY PF (SIBIRSKIY PREM'ER GK)
3705089	4620004402943	Mezheninovskay pf (sibirskiy p farsh minced chicken 1kg #2	1201445	Продукты питания (folder)/Мясо	3705084	MEZHENINOVSKAY PF (SIBIRSKIY PREM'ER GK)
3705090	4620004402912	Mezheninovskay pf (sibirskiy p file pieces chicken 1kg	1201445	Продукты питания (folder)/Мясо	3705084	MEZHENINOVSKAY PF (SIBIRSKIY PREM'ER GK)
3705091	4620004402899	Mezheninovskay pf (sibirskiy p golen' legs chicken 1kg	1201445	Продукты питания (folder)/Мясо	3705084	MEZHENINOVSKAY PF (SIBIRSKIY PREM'ER GK)
3705092	4620004403995	Mezheninovskay pf (sibirskiy p grudka pieces chicken 1kg	1201445	Продукты питания (folder)/Мясо	3705084	MEZHENINOVSKAY PF (SIBIRSKIY PREM'ER GK)
3705093	4620004402882	Mezheninovskay pf (sibirskiy p krylo wings chicken 1kg	1201445	Продукты питания (folder)/Мясо	3705084	MEZHENINOVSKAY PF (SIBIRSKIY PREM'ER GK)
3705095	4620004403322	Mezheninovskaya pf/tomsk.o. hmmd.stuff.cabb. 0.5kg d	3610261	Продукты питания (folder)/замороженные блюда и замороженные мясные полуфабрикаты	3705094	MEZHENINOVSKAYA PF/TOMSKAYA OBL.
3705096	4620004400840	Mezheninovskaya pf/tomsk.o. kiev.cotl. 0.5kg v	3610261	Продукты питания (folder)/замороженные блюда и замороженные мясные полуфабрикаты	3705094	MEZHENINOVSKAYA PF/TOMSKAYA OBL.
3705097	4620004401656	Mezheninovskaya pf/tomsk.o. kiev.cotl. 0.5kg v #2	3610261	Продукты питания (folder)/замороженные блюда и замороженные мясные полуфабрикаты	3705094	MEZHENINOVSKAYA PF/TOMSKAYA OBL.
3355079	4620004404206	Mezheninovskie prod (sibir.pr) bavarskie klbsk chicken&prk s/s bl 0.2kg	1	Неклассифицированные/default	3705098	MEZHENINOVSKIE PRODUKTY (SIBIRSKIY PREM'ER GK)
3705099	4620004404992	Mezheninovskie prod (sibir.pr) bavarskie klbsk chicken&prk s/s bl 0.2kg #2	1183382	Продукты питания (folder)/Мясные продукты	3705098	MEZHENINOVSKIE PRODUKTY (SIBIRSKIY PREM'ER GK)
3355082	4620004404565	Mezheninovskie prod (sibir.pr) eger'skie klbsk chicken&prk s/s bl 250g	1	Неклассифицированные/default	3705098	MEZHENINOVSKIE PRODUKTY (SIBIRSKIY PREM'ER GK)
3705100	4620004408440	Mezheninovskie prod (sibir.pr) eger'skie klbsk chicken&prk s/s bl 250g #2	1183382	Продукты питания (folder)/Мясные продукты	3705098	MEZHENINOVSKIE PRODUKTY (SIBIRSKIY PREM'ER GK)
3353346	4620004403537	Mezheninovskie prod (sibir.pr) kamskay kolb. chicken s/s bl 0.45kg	142954	Продукты питания (folder)/Колбасные изделия (folder)/Колбасные изделия	3705098	MEZHENINOVSKIE PRODUKTY (SIBIRSKIY PREM'ER GK)
3353791	4620004404572	Mezheninovskie prod (sibir.pr) krakvsky kolb. chicken&prk s/s bl 0.4kg	265598	Продукты питания (folder)/Колбасные изделия (folder)/Колбаса полукопченая	3705098	MEZHENINOVSKIE PRODUKTY (SIBIRSKIY PREM'ER GK)
3705101	4620004408433	Mezheninovskie prod (sibir.pr) krakvsky колбаса chicken&prk s/s bl 0.4kg #2	142954	Продукты питания (folder)/Колбасные изделия (folder)/Колбасные изделия	3705098	MEZHENINOVSKIE PRODUKTY (SIBIRSKIY PREM'ER GK)
3354464	4620004408426	Mezheninovskie prod (sibir.pr) shvytsr.serv.s.syr kolb. chicken&prk b/s bl 0.4kg	142954	Продукты питания (folder)/Колбасные изделия (folder)/Колбасные изделия	3705098	MEZHENINOVSKIE PRODUKTY (SIBIRSKIY PREM'ER GK)
3353785	4620004403551	Mezheninovskie prod (sibir.pr) vetchno-rublnaya kolb. chicken&prk s/s bl 0.4kg	265598	Продукты питания (folder)/Колбасные изделия (folder)/Колбаса полукопченая	3705098	MEZHENINOVSKIE PRODUKTY (SIBIRSKIY PREM'ER GK)
3354384	4620004408419	Mezheninovskie prod (sibir.pr) zernis.serv. kolb. chicken&prk s/s bl 0.4kg	142954	Продукты питания (folder)/Колбасные изделия (folder)/Колбасные изделия	3705098	MEZHENINOVSKIE PRODUKTY (SIBIRSKIY PREM'ER GK)
3705105	4612750530278	Mezhozyornoe moloko bilberry yn 0.5kg p sq bo 3.5%f	144938	Продукты питания (folder)/Молочные продукты (folder)/Молочные продукты	3705104	MEZHOZYORNOE MOLOKO (MEZHOZYORNOE MOLOKO/LENINGRADSKAYA OB
3705106	4612750530315	Mezhozyornoe moloko Cherry yn 0.5kg p sq bo 3.5%f	144938	Продукты питания (folder)/Молочные продукты (folder)/Молочные продукты	3705104	MEZHOZYORNOE MOLOKO (MEZHOZYORNOE MOLOKO/LENINGRADSKAYA OB
3705107	4612750530261	Mezhozyornoe moloko strawberry yn 0.5kg p sq bo 3.5%f	144938	Продукты питания (folder)/Молочные продукты (folder)/Молочные продукты	3705104	MEZHOZYORNOE MOLOKO (MEZHOZYORNOE MOLOKO/LENINGRADSKAYA OB
4520427	803571183628	Mezmerize by magnetik	1	Неклассифицированные/default	0	
625754	010369831634	Mezotrace balanced-Formula multi-vitamin - 90 tablets	1	Неклассифицированные/default	625745	MEZTRC
625749	010369831412	Mezotrace calcium and magnesium - 180 tablets	1	Неклассифицированные/default	625745	MEZTRC
625748	010369821833	Mezotrace calcium magnesium powdered minerals - 1lb	1	Неклассифицированные/default	625745	MEZTRC
625750	010369821727	Mezotrace calcium magnesium powdered minerals - 8oz	1	Неклассифицированные/default	625745	MEZTRC
625753	010369207828	Mezotrace calcium magnesium with vitamin d - 180 tablets	1	Неклассифицированные/default	625745	MEZTRC
625751	010369988048	Mezotrace Natural minerals and trace elements - 120 tablets	1	Неклассифицированные/default	625745	MEZTRC
4520428	073214061426	Mezta deli sliced Hot chry pprs 16oz 6ct	1	Неклассифицированные/default	1059779	Mezzetta
625746	010369988314	Meztrc mezotrace mezo g 120 tab	1	Неклассифицированные/default	625745	MEZTRC
625747	010369831504	Meztrc mezotrace min&trace ele 120 tab	1	Неклассифицированные/default	625745	MEZTRC
625752	010369207811	Meztrc mezotrace min&Vita d 120 tab	1	Неклассифицированные/default	625745	MEZTRC
4520429	773681611512	Mezuzah pewter oblong	1	Неклассифицированные/default	0	
3705109	813297000611	Mezza di mezzacorona bubbly 187ml	1	Неклассифицированные/default	0	
2813572	813297000628	Mezza di mezzacorona glass 750ml	1	Неклассифицированные/default	0	
2813573	081329700062	Mezza di mezzacorona xtra Dry spk 6.5% 750l	1	Неклассифицированные/default	0	
392632	087241881117	Mezzacorona Cabernet Sauvignon glass 1.5l	22133	Продукты питания (folder)/Алкогольные напитки/Вино (folder)/Вино	392631	Mezzacorona
1539736	087241881575	Mezzacorona forte alto Pinot Grigio glass 1.5l	22133	Продукты питания (folder)/Алкогольные напитки/Вино (folder)/Вино	0	
392641	087241881315	Mezzacorona Pinot Grigio riseva glass 1.5l	22133	Продукты питания (folder)/Алкогольные напитки/Вино (folder)/Вино	392631	Mezzacorona
625755	8004305000248	Mezzacorona Pinot Grigio trentino doc 1500ml	22133	Продукты питания (folder)/Алкогольные напитки/Вино (folder)/Вино	0	
392642	087241881278	Mezzacorona Pinot Noir glass 1.5l	22133	Продукты питания (folder)/Алкогольные напитки/Вино (folder)/Вино	392631	Mezzacorona
1539737	087241881445	Mezzacorona riesling glass 750ml	1	Неклассифицированные/default	0	
392644	087241881018	Mezzacorona rosato 1.5l	22133	Продукты питания (folder)/Алкогольные напитки/Вино (folder)/Вино	392631	Mezzacorona
392645	087241881025	Mezzacorona rosato 750ml	22133	Продукты питания (folder)/Алкогольные напитки/Вино (folder)/Вино	392631	Mezzacorona
392646	087241881070	Mezzacorona teroldego rotaliano riserva glass 750ml	22133	Продукты питания (folder)/Алкогольные напитки/Вино (folder)/Вино	392631	Mezzacorona
4520430	080172017518	Mezzaluna limoncello 750ml	1	Неклассифицированные/default	0	
3159640	077886301460	Mezzaluna ravioli	330591	Продукты питания (folder)/Продукты питания	0	
3159641	077886301590	Mezzaluna ravioli #2	330591	Продукты питания (folder)/Продукты питания	0	
3159642	077886301699	Mezzaluna ravioli #3	330591	Продукты питания (folder)/Продукты питания	0	
3159643	077886301767	Mezzaluna ravioli italian sausage and four cheeses	330591	Продукты питания (folder)/Продукты питания	0	
1539738	081072175094	Mezzaluna vodka	1	Неклассифицированные/default	0	
4520431	080172010502	Mezzaluna vodka 50ml	1	Неклассифицированные/default	0	
392647	081072017509	Mezzaluna vodka 6b 750ml	22581	Продукты питания (folder)/Алкогольные напитки/Водка	0	
3159644	785514006020	Mezzaluna with basil pesto filling	330591	Продукты питания (folder)/Продукты питания	0	
195787	5350085000453	Mezzan amaretto dessert 1.2kg	1	Неклассифицированные/default	0	
195788	5350085000002	Mezzan cassata	1	Неклассифицированные/default	0	
195789	5350085000101	Mezzan delight small	1	Неклассифицированные/default	0	
195790	5350085000491	Mezzan delux creme caramel 2l	1	Неклассифицированные/default	0	
195791	5350085000392	Mezzan diet 1l	1	Неклассифицированные/default	0	
195792	5350085000040	Mezzan Family pack (2 litre)	1	Неклассифицированные/default	0	
195793	5350085000064	Mezzan Family pack 1 litre	1	Неклассифицированные/default	0	
195794	5350085000422	Mezzan goloso	1	Неклассифицированные/default	0	
195795	5350085000590	Mezzan goppa gelato x4	1	Неклассифицированные/default	0	
195796	5350085000514	Mezzan il pinguino 2l	1	Неклассифицированные/default	0	
195797	5350085000507	Mezzan rosella Ice Cream 2l	30752	Продукты питания (folder)/Мороженое	0	
195798	5350085000071	Mezzan torta gelato	1	Неклассифицированные/default	0	
195799	5350085000088	Mezzan torta gelato small	1	Неклассифицированные/default	0	
1386169	076808502954	Mezze penne, enriched macaroni product	24086	Продукты питания (folder)/Макароны	26014	Barilla
3159645	075450088731	Mezzelune	330591	Продукты питания (folder)/Продукты питания	0	
3156212	073214007189	Mezzetta artichoke hearts 6.5oz	330591	Продукты питания (folder)/Продукты питания	1059779	Mezzetta
1539743	073214009411	Mezzetta bistro gourmet Garden rustica pasta sauce	1	Неклассифицированные/default	1059779	Mezzetta
628997	073214009459	Mezzetta bistro gourmet roasted garlic pasta sauce	1	Неклассифицированные/default	1059779	Mezzetta
628999	073214009473	Mezzetta bistro gourmet tomato basil pasta sauce	1	Неклассифицированные/default	1059779	Mezzetta
1539710	073214009466	Mezzetta bistro siciliano pasta sauce 25oz	1	Неклассифицированные/default	1059779	Mezzetta
2632265	073214006335	Mezzetta bleu Cheese stuffed olives	1	Неклассифицированные/default	1059779	Mezzetta
4520432	073214063321	Mezzetta blu chs stfd olives 6.5oz	1	Неклассифицированные/default	1059779	Mezzetta
1539758	073214006205	Mezzetta broccoli flowert 16oz	1	Неклассифицированные/default	1059779	Mezzetta
1539712	073214006106	Mezzetta cal reg Hot sau	1	Неклассифицированные/default	1059779	Mezzetta
1539718	073214001033	Mezzetta California grape leaves	1	Неклассифицированные/default	1059779	Mezzetta
1539754	073214001255	Mezzetta California Hot mixed vegetables 16floz	1	Неклассифицированные/default	1059779	Mezzetta
2632268	073214001132	Mezzetta caper non pareil	1	Неклассифицированные/default	1059779	Mezzetta
2632267	073214004027	Mezzetta capote capers 4oz	1	Неклассифицированные/default	1059779	Mezzetta
1539714	073214008025	Mezzetta cocktail onions #2	1	Неклассифицированные/default	1059779	Mezzetta
4520433	073214005505	Mezzetta crm sty hrserdsh 4oz	1	Неклассифицированные/default	1059779	Mezzetta
4520434	073214006083	Mezzetta crushed garlic 4.25oz	1	Неклассифицированные/default	1059779	Mezzetta
2632297	073214001347	Mezzetta deli-slcd ht jalapen ppr 16oz	1	Неклассифицированные/default	1059779	Mezzetta
1539747	073214001606	Mezzetta deli-sliced Golden greek pepperoncini peppers, Water Distilled vinegar, salt, fd&c Yellow 5, sodium bisulfite added a	1	Неклассифицированные/default	1059779	Mezzetta
1539742	073214001620	Mezzetta deli-sliced Mild pepper rings	1	Неклассифицированные/default	1059779	Mezzetta
2632270	073214004638	Mezzetta deli-sliced Mild pepper rings #2	1	Неклассифицированные/default	1059779	Mezzetta
2632262	073214001446	Mezzetta deli-sliced roasted Bell pepper strips	2511557	Продукты питания (folder)/Fruits and Vegetables Canned	1059779	Mezzetta
1539748	073214001293	Mezzetta deli-sliced tamed jalapeno peppers 16floz	1	Неклассифицированные/default	1059779	Mezzetta
4520435	073214066223	Mezzetta dilld brussel sprou 16oz 6ct	1	Неклассифицированные/default	1059779	Mezzetta
1539744	073214006229	Mezzetta dilled brussels sprouts 16floz	1	Неклассифицированные/default	1059779	Mezzetta
1539746	073214001262	Mezzetta dilled cauliflower 16floz	1	Неклассифицированные/default	1059779	Mezzetta
4520436	073214066353	Mezzetta eextra virgin olive Oil 17oz 6ct	1	Неклассифицированные/default	1059779	Mezzetta
2632271	073214005703	Mezzetta express deli style sweet Bell pepper relish all nat	1	Неклассифицированные/default	1059779	Mezzetta
1539722	073214006359	Mezzetta Extra virgin italian olive Oil	1	Неклассифицированные/default	1059779	Mezzetta
4520437	073214006403	Mezzetta Extra virgin olv Oil 34oz	1	Неклассифицированные/default	1059779	Mezzetta
4520438	073214063505	Mezzetta feta chs stfd olives 6.5oz	1	Неклассифицированные/default	1059779	Mezzetta
1539719	073214001194	Mezzetta gar&dill Golden peperoncin 16oz	1	Неклассифицированные/default	1059779	Mezzetta
4520439	073214061198	Mezzetta gar&dill Golden peperoncin 16oz 6ct	1	Неклассифицированные/default	1059779	Mezzetta
4520440	073214008186	Mezzetta garlic exspicey pickle 8oz	1	Неклассифицированные/default	1059779	Mezzetta
4520441	014100001553	Mezzetta garlic olives	1	Неклассифицированные/default	1059779	Mezzetta
1539671	073214001644	Mezzetta garlic olives 9.5floz	1	Неклассифицированные/default	1059779	Mezzetta
1539716	073214006182	Mezzetta garlic stuffed olives	1	Неклассифицированные/default	1059779	Mezzetta
1539717	073214001323	Mezzetta Golden greek pepper 22oz	1	Неклассифицированные/default	1059779	Mezzetta
4520442	073214061051	Mezzetta Golden grk peperoncini * 16oz 6ct	1	Неклассифицированные/default	1059779	Mezzetta
1059785	073214003617	Mezzetta gourmet deli tri-Color roasted Bell pepper strips	1	Неклассифицированные/default	1059779	Mezzetta
2632274	073214006342	Mezzetta greek-style feta Cheese stuffed olives	1	Неклассифицированные/default	1059779	Mezzetta
1539672	073214001651	Mezzetta grlc jal olives 9.5floz	1	Неклассифицированные/default	1059779	Mezzetta
4520443	073214006267	Mezzetta grmt Baby carrots 16oz	1	Неклассифицированные/default	1059779	Mezzetta
4520444	073214066261	Mezzetta grmt Baby carrots 16oz 6ct	1	Неклассифицированные/default	1059779	Mezzetta
4520445	073214006557	Mezzetta habanero grl olives 10oz	1	Неклассифицированные/default	1059779	Mezzetta
4520446	073214005604	Mezzetta habanero mustard 10oz	1	Неклассифицированные/default	1059779	Mezzetta
1539720	073214008308	Mezzetta habanero peppers 8oz	1	Неклассифицированные/default	1059779	Mezzetta
4520447	073214068302	Mezzetta habanero peppers 8oz 6ct	1	Неклассифицированные/default	1059779	Mezzetta
4520448	073214008803	Mezzetta habanero salsa 8.25oz	1	Неклассифицированные/default	1059779	Mezzetta
4520449	073214006120	Mezzetta homestyle pt olives 10oz	1	Неклассифицированные/default	1059779	Mezzetta
4520450	073214008032	Mezzetta hors d ouevres 8oz	1	Неклассифицированные/default	1059779	Mezzetta
1539739	073214001149	Mezzetta Hot banana wax peppers peppers, Water Distilled vinegar, salt, calcium chloride, sodium bisulfite add as a Color stab	1	Неклассифицированные/default	1059779	Mezzetta
1539668	073214001279	Mezzetta Hot cauliflower 16floz	1	Неклассифицированные/default	1059779	Mezzetta
4520451	073214061174	Mezzetta Hot chili peppers 16oz 6ct	1	Неклассифицированные/default	1059779	Mezzetta
1539753	073214001170	Mezzetta Hot chili pepprs 16oz	1	Неклассифицированные/default	1059779	Mezzetta
4520452	073214061303	Mezzetta Hot serrano chili p 16oz 6ct	1	Неклассифицированные/default	1059779	Mezzetta
1539669	073214006038	Mezzetta imported calamata greek olives tree ripened olives, Water Distilled and Red Wine vinegar, salt, olive Oil. 7602	1	Неклассифицированные/default	1059779	Mezzetta
1539713	073214001071	Mezzetta imported cocktail onions	1	Неклассифицированные/default	1059779	Mezzetta
1539751	073214001057	Mezzetta imported Golden greek peperoncini	1	Неклассифицированные/default	1059779	Mezzetta
1539745	073214004034	Mezzetta imported gourmet non-pareil capers	1	Неклассифицированные/default	1059779	Mezzetta
1539677	073214006144	Mezzetta imported spanish Queen marinated with Dry vermouth martini olives	1	Неклассифицированные/default	1059779	Mezzetta
1539750	073214003211	Mezzetta ital giardiniera 32oz	1	Неклассифицированные/default	1059779	Mezzetta
1539724	073214001019	Mezzetta ital peperoncin	1	Неклассифицированные/default	1059779	Mezzetta
1539725	073214001064	Mezzetta italeno peppers 16oz	1	Неклассифицированные/default	1059779	Mezzetta
2632275	073214006113	Mezzetta italian castelvetrano whole Green olives	1	Неклассифицированные/default	1059779	Mezzetta
1539723	073214005840	Mezzetta italian olive antipasto marinated with Fresh garlic, herbs&napa Valley Chardonnay	22133	Продукты питания (folder)/Алкогольные напитки/Вино (folder)/Вино	1059779	Mezzetta
3157606	073214006489	Mezzetta italian olive Oil Extra virgin	330591	Продукты питания (folder)/Продукты питания	1059779	Mezzetta
4520453	073214061020	Mezzetta itl Mix giardiniera 16oz 6ct	1	Неклассифицированные/default	1059779	Mezzetta
1539749	073214001026	Mezzetta itln Mix giardiniera 12oz	1	Неклассифицированные/default	1059779	Mezzetta
4520454	073214006502	Mezzetta jal/garlic olive 16oz	1	Неклассифицированные/default	1059779	Mezzetta
1539721	073214006014	Mezzetta jalapeno en escabech 16oz	1	Неклассифицированные/default	1059779	Mezzetta
4520455	073214003204	Mezzetta kshr dill pickle 32oz	1	Неклассифицированные/default	1059779	Mezzetta
4520456	073214008063	Mezzetta manz olv w/pimiento 5oz	1	Неклассифицированные/default	1059779	Mezzetta
4520457	073214068067	Mezzetta manz olv w/pimiento 5oz 6ct	1	Неклассифицированные/default	1059779	Mezzetta
2632269	073214008087	Mezzetta maraschino cher w/stem * 9oz	1	Неклассифицированные/default	1059779	Mezzetta
4520458	073214068081	Mezzetta maraschino cher w/stem * 9oz 6ct	1	Неклассифицированные/default	1059779	Mezzetta
1539727	073214001460	Mezzetta marnd rstd Red Yellow peppers 16oz	1	Неклассифицированные/default	1059779	Mezzetta
4520459	073214066469	Mezzetta mex Hot chili peppr 16oz 6ct	1	Неклассифицированные/default	1059779	Mezzetta
1539756	073214001286	Mezzetta mexi Mix vegetables 16floz	1	Неклассифицированные/default	1059779	Mezzetta
4520460	073214061297	Mezzetta nacho rings 16oz	1	Неклассифицированные/default	1059779	Mezzetta
1539709	073214005826	Mezzetta napa Valley almond stuffed olive 7.5oz	1	Неклассифицированные/default	1059779	Mezzetta
2632276	073214009626	Mezzetta napa Valley bistro all Natural authentic pizza sauce	1	Неклассифицированные/default	1059779	Mezzetta
1539715	073214005888	Mezzetta napa Valley bistro all Natural garlic stuffed olives	1	Неклассифицированные/default	1059779	Mezzetta
628998	073214009527	Mezzetta napa Valley bistro all Natural homemade style basil pesto	1	Неклассифицированные/default	1059779	Mezzetta
1539726	073214005895	Mezzetta napa Valley bistro all Natural jalapeno stuffed olives	1	Неклассифицированные/default	1059779	Mezzetta
2632277	073214005864	Mezzetta napa Valley bistro all Natural pitted kalamata olives	1	Неклассифицированные/default	1059779	Mezzetta
628995	073214009435	Mezzetta napa Valley bistro all Natural porcini mushroom sauce	1	Неклассифицированные/default	1059779	Mezzetta
628994	073214009404	Mezzetta napa Valley bistro all Natural spicy arrabbiata sauce	1	Неклассифицированные/default	1059779	Mezzetta
2632278	073214009619	Mezzetta napa Valley bistro all Natural Sun ripened dried tomato pesto	1	Неклассифицированные/default	1059779	Mezzetta
2632279	073214009695	Mezzetta napa Valley bistro amatriciana with pancetta&sauteed Red onions sauce	1	Неклассифицированные/default	1059779	Mezzetta
628990	073214009497	Mezzetta napa Valley bistro artichoke parmesan marinara sauce	1	Неклассифицированные/default	1059779	Mezzetta
628993	073214009503	Mezzetta napa Valley bistro creamy vodka style marinara sauce	545856	Продукты питания (folder)/Соус	1059779	Mezzetta
628991	073214009510	Mezzetta napa Valley bistro fire-roasted marinara sauce	1	Неклассифицированные/default	1059779	Mezzetta
628992	073214009480	Mezzetta napa Valley bistro homemade style marinara sauce	1	Неклассифицированные/default	1059779	Mezzetta
4520461	073214003846	Mezzetta napa Valley bistro italian antipasto olives 32floz	1	Неклассифицированные/default	1059779	Mezzetta
1539729	073214009428	Mezzetta napa Valley bistro mediterrn olive pasta sc 25oz	1	Неклассифицированные/default	1059779	Mezzetta
2639089	073214005789	Mezzetta napa Valley bistro olive 2flvr dsp 36pcs	1	Неклассифицированные/default	1059779	Mezzetta
2639090	073214005772	Mezzetta napa Valley bistro olive 2vrty dsp 36pcs	1	Неклассифицированные/default	1059779	Mezzetta
2639091	073214007714	Mezzetta napa Valley bistro olive 4flvr dsp 36pcs	1	Неклассифицированные/default	1059779	Mezzetta
2639092	073214005949	Mezzetta napa Valley bistro olive applewood smkd	1	Неклассифицированные/default	1059779	Mezzetta
