ID	UPCEAN	Name	CategoryID	CategoryName	BrandID	BrandName
5410013	9786177678358	Книга жорис шамблен щоденники вишеньки. том 2. таємнича книга 978-617-7678-35-8 шамблен жорис	205408	Полиграфия (folder)/Книги	0	
5410014	9785171084363	Книга жребий праведных грешниц. наследники 40236903	5120829	Полиграфия (folder)/Книги - художественная литература	0	
5410015	9785171016760	Книга жребий праведных грешниц. стать огнем 40247221	5120829	Полиграфия (folder)/Книги - художественная литература	0	
3347118	9785699687510	Книга жребий рубикона ч.абдулаев	205408	Полиграфия (folder)/Книги	0	
5406714	9785170888467	Книга жребий салема 40229076	205408	Полиграфия (folder)/Книги	48740	АСТ
5410016	9785171115432	Книга жук в муравейнике 40234622	5120829	Полиграфия (folder)/Книги - художественная литература	0	
5410017	9785171200794	Книга жук в муравейнике 40234720	5120829	Полиграфия (folder)/Книги - художественная литература	0	
3824512	9785170700226	Книга жуков касат.щигель моя перв.энцикл	205408	Полиграфия (folder)/Книги	0	
1838644	9785699250264	Книга жукова н. первая после букваря кни	205408	Полиграфия (folder)/Книги	0	
66117	9785699166442	Книга жукова н.с. букварь	205408	Полиграфия (folder)/Книги	0	
66118	9785699264667	Книга жукова н.с. букварь #2	205408	Полиграфия (folder)/Книги	0	
727279	9785699372058	Книга жукова н.с. букварь #3	205408	Полиграфия (folder)/Книги	0	
3824513	9785040028689	Книга жукова н.с. букварь средний формат	205408	Полиграфия (folder)/Книги	0	
3824514	9785978001273	Книга жукова н.с. букварь средний формат #2	205408	Полиграфия (folder)/Книги	0	
1838643	9785699204861	Книга жукова н.с. букварь тв	205408	Полиграфия (folder)/Книги	0	
1838233	9785699349517	Книга жукова н.с. букварь эксмо	205408	Полиграфия (folder)/Книги	0	
3824515	9785896481096	Книга жукова н.с.пропись 1.для детей 6-7лет	205408	Полиграфия (folder)/Книги	0	
3824516	9785978003987	Книга жукова н.с.пропись 1.для детей 6-7лет #2	205408	Полиграфия (folder)/Книги	0	
3824517	9785896481102	Книга жукова н.с.пропись 2.для детей 6-7лет	205408	Полиграфия (folder)/Книги	0	
3824518	9785978003994	Книга жукова н.с.пропись 2.для детей 6-7лет #2	205408	Полиграфия (folder)/Книги	0	
3824519	9785896481119	Книга жукова н.с.пропись 3.для детей 6-7лет	205408	Полиграфия (folder)/Книги	0	
3824520	9785978004007	Книга жукова н.с.пропись 3.для детей 6-7лет #2	205408	Полиграфия (folder)/Книги	0	
3824521	9785699365494	Книга жукова н.уроки логопеда.испр.нар.речи	205408	Полиграфия (folder)/Книги	0	
66119	9785699350094	Книга жукова-гладкова м. африканск.охота для дам	205408	Полиграфия (folder)/Книги	0	
727281	9785699372638	Книга жукова-гладкова м. гарем чужих мужей	205408	Полиграфия (folder)/Книги	0	
727282	9785699364152	Книга жукова-гладкова м. клуб заграничных мужей	205408	Полиграфия (folder)/Книги	0	
66120	9785699343331	Книга жукова-гладкова м. побег из тропического рая	205408	Полиграфия (folder)/Книги	0	
66121	9785699356133	Книга жукова-гладкова м. сыщица по амурным делам	205408	Полиграфия (folder)/Книги	0	
727283	9785699468881	Книга жукова-гладкова м.12 жертв (м)	205408	Полиграфия (folder)/Книги	0	
727284	9785699505982	Книга жукова-гладкова м.в гости по ночам... (м)	205408	Полиграфия (folder)/Книги	0	
727286	9785699494446	Книга жукова-гладкова м.где цезарь кровью истекал (м)	205408	Полиграфия (folder)/Книги	0	
727287	9785699510382	Книга жукова-гладкова м.легенда о 2-м отражении.сильные страсти	205408	Полиграфия (folder)/Книги	0	
727288	9785699504145	Книга жукова-гладкова м.одна женщ.и много мужчин.звезд.любовник (м)	205408	Полиграфия (folder)/Книги	0	
727289	9785699498116	Книга жукова-гладкова м.Остров острых ощущений.	205408	Полиграфия (folder)/Книги	0	
5410018	9785170996742	Книга журавли и карлики 40224285	5238948	Полиграфия (folder)/Книги - Проза классическая и современная	0	
5410019	9785171131128	Книга журавли и карлики 40236107	5238948	Полиграфия (folder)/Книги - Проза классическая и современная	0	
1767004	4607021888646	Книга журнал приема и сдачи ключей, 50л, A4 204x 290mm прошит п/печать,обл лак.картон, греб, 2338	473053	Канцелярские товары (folder)/Книга канцелярская	39373	Полином
461775	4606008081261	Книга журнал продленного дня 20л A4 205x 282mm мел карт обл блок офсет 15854	461769	Канцелярские товары (folder)/Школа/Журналы школьные	37020	Феникс
3347119	4607021889506	Книга журнал регистр. инструктажа по тб, 50л, A4 204x 290mm прошит п/печать, гребень, 19с11-50	1	Неклассифицированные/default	39373	Полином
3347120	4607021889469	Книга журнал регистр. инструктажей по пожар.без, 50л, A4 204x 290mm прошит п/печать, греб, 18с1-50	1	Неклассифицированные/default	39373	Полином
3347121	4607021889728	Книга журнал регистрации документов, 50л, A4 204x 290mm обл лак. картон, гребень, 13с16-50	1	Неклассифицированные/default	39373	Полином
176266	4607021880480	Книга журнал регистрации документов, 96л, A4 204x 290mm, обл лак. картон, блок офсет греб, 13с16	262842	Канцелярские товары (folder)/Бухгалтерские книги, бланки	39373	Полином
176267	4607021884280	Книга журнал регистрации инструктажей по пожар.без 96л, A4 204x 290mm,прошит под печать,греб, 18с1	262842	Канцелярские товары (folder)/Бухгалтерские книги, бланки	39373	Полином
3347122	4607021889711	Книга журнал регистрации корреспонденции, 50л, A4 204x 290mm обл лак. картон, гребень, 13с15-50	1	Неклассифицированные/default	39373	Полином
176268	4607021880473	Книга журнал регистрации корреспонденции, 96л, A4 204x 290mm,обл лак.картон,блок офсет греб, 13с15	262842	Канцелярские товары (folder)/Бухгалтерские книги, бланки	0	
176269	4607021880510	Книга журнал регистрации посетителей, 96л, A4 204x 290mm, обл лак. картон, блок офсет греб, 13с18	262842	Канцелярские товары (folder)/Бухгалтерские книги, бланки	39373	Полином
445729	4606016087996	Книга журнал учета для розн.торговли 96л, A4 195x 280mm альт, бумвинил синий,фольга, 7-96-138	262842	Канцелярские товары (folder)/Бухгалтерские книги, бланки	19066	АЛЬТ
461780	4607021884303	Книга журнал учета персонала, 96л, A4 204x 290mm, обл лак. картон, блок офсет греб, 18с3	262842	Канцелярские товары (folder)/Бухгалтерские книги, бланки	39373	Полином
727293	4607021884297	Книга журнал учета розничной торговли 96л, A4 204x 290mm, обл лак. картон, блок офсет греб, 18с2	1	Неклассифицированные/default	441488	BG
461782	4606008081278	Книга журнал факультативных занятий, 24л, A4 205x 282mm, мел карт обл, блок офсет 15855	461769	Канцелярские товары (folder)/Школа/Журналы школьные	37020	Феникс
5410020	9785171135478	Книга жуткая история проспера реддинга 40244160	5115744	Полиграфия (folder)/Книги - сказки, стихи, рассказы	0	
5410021	9785171106195	Книга жуткий король 40237535	5166349	Полиграфия (folder)/Книги - детективы. боевики. Триллеры	0	
5410022	9789851841925	Книга жывая прырода 40250233	5117046	Полиграфия (folder)/Книги - энциклопедии и познавательная литература	0	
5410023	9789851842557	Книга жывелы 40250234	5117046	Полиграфия (folder)/Книги - энциклопедии и познавательная литература	0	
5410024	9789851841857	Книга жывелы 40250235	5117046	Полиграфия (folder)/Книги - энциклопедии и познавательная литература	0	
5410025	9789851841758	Книга жывелы 40250236	5117046	Полиграфия (folder)/Книги - энциклопедии и познавательная литература	0	
5410026	9786170923479	Книга жюльет парашини-дени сокровища пирата моргана 978-617-09-2347-9 парашини-дени жюльет	205408	Полиграфия (folder)/Книги	0	
5410027	9786170947710	Книга з нал?пками знайомся... автомоб?л? укр ранок (9786170947710) татьяна маслова	205408	Полиграфия (folder)/Книги	0	
5410028	9786170947673	Книга з нал?пками знайомся... корабл? укр ранок (9786170947673) маслова т. в.	205408	Полиграфия (folder)/Книги	0	
2443003	9785699044597	Книга за всеми зайцами	205408	Полиграфия (folder)/Книги	0	
2443004	9785040052882	Книга за всеми зайцами м/обложка	205408	Полиграфия (folder)/Книги	0	
5410029	9785353093015	Книга за городом. виммельбух 40241445	5117045	Полиграфия (folder)/Книги-игры	0	
5410031	9785699853427	Книга за кроликом в сказочный лес 40247011	5410030	антистресс-раскраски. раскраски для взрослых	0	
5410032	9785906947642	Книга за ленинград! за сталинград! за Крым!	205408	Полиграфия (folder)/Книги	4970770	Алгоритм
5410033	9785171231422	Книга за миллиард лет до конца света 40253331	5120829	Полиграфия (folder)/Книги - художественная литература	0	
5410034	9785699912575	Книга за радугой	205408	Полиграфия (folder)/Книги	4927678	Like book
3830548	9785859074013	Книга за рулем атлас автодорог.	205408	Полиграфия (folder)/Книги	0	
3830549	9785969800267	Книга за рулем атлас автодорог. #2	205408	Полиграфия (folder)/Книги	0	
5410035	9785171076894	Книга за то, что я руки твои не сумел удержать... 40247147	5120829	Полиграфия (folder)/Книги - художественная литература	0	
5410036	9785170997169	Книга за тремя зайцами 40227738	5166349	Полиграфия (folder)/Книги - детективы. боевики. Триллеры	0	
3824522	9785993010922	Книга забавная азбука. азбука с наклейками	205408	Полиграфия (folder)/Книги	0	
3824523	9785699733521	Книга забавные животные	205408	Полиграфия (folder)/Книги	0	
3824524	9785699975754	Книга забавные животные #2	205408	Полиграфия (folder)/Книги	0	
5410037	9785506047933	Книга забавные животные активити с 3D наклейками 30шт 180x236 mm Умка 9785506047933	494440	Полиграфия (folder)/Наклейки	712913	Умка
228871	9785353038474	Книга забавные малыши (веселое купание) росмэн	205408	Полиграфия (folder)/Книги	205409	РОСМЭН
5410038	9785506049005	Книга забавные пони активити с 3D наклейками 30шт 180x236 mm Умка 9785506049005	494440	Полиграфия (folder)/Наклейки	712913	Умка
3347123	9785864155790	Книга забавные раскраски	205408	Полиграфия (folder)/Книги	0	
3347124	9785864155813	Книга забавные раскраски #2	205408	Полиграфия (folder)/Книги	0	
3824525	9785699848393	Книга забавные тесты в дор.	205408	Полиграфия (folder)/Книги	0	
5410039	9785171079864	Книга забавныемордашки/я люблю свою лошадку 40242625	5115744	Полиграфия (folder)/Книги - сказки, стихи, рассказы	0	
5410040	9785171060626	Книга заблудившийся автобус 40236350	5120829	Полиграфия (folder)/Книги - художественная литература	0	
5410041	9785171129491	Книга забудь мое имя 40237720	5166349	Полиграфия (folder)/Книги - детективы. боевики. Триллеры	0	
5410042	9785353083764	Книга забытые царства. 1. дочь белого меча 40234205	5221985	Полиграфия (folder)/Книги - фантастика, фентези, мистика	0	
5410043	9785353086369	Книга забытые царства. 2. стальная метель 40234204	5221985	Полиграфия (folder)/Книги - фантастика, фентези, мистика	0	
5410044	9785389162716	Книга забытый Сад 40247318	5120829	Полиграфия (folder)/Книги - художественная литература	0	
2443005	9785765434048	Книга завещание ворона	205408	Полиграфия (folder)/Книги	0	
3347125	9785699229949	Книга завещание олигарха ч.абдуллаев	205408	Полиграфия (folder)/Книги	0	
5410045	9785521009312	Книга завещание шекспира	205408	Полиграфия (folder)/Книги	3593119	ПАЛЬМИРА
5410046	9785171041519	Книга заводной апельсин 40224239	5120829	Полиграфия (folder)/Книги - художественная литература	0	
3824526	9785170801091	Книга заводной апельсин 40236349	205408	Полиграфия (folder)/Книги	0	
2443006	9785948496115	Книга завоевание	205408	Полиграфия (folder)/Книги	0	
5410047	9785171026240	Книга завтра я буду скучать по тебе 40237904	5120829	Полиграфия (folder)/Книги - художественная литература	0	
3824528	9785389022508	Книга завтрак у тиффани	205408	Полиграфия (folder)/Книги	0	
3347126	9785386060473	Книга завтраки для детей вкусно и полезно	205408	Полиграфия (folder)/Книги	0	
5410048	9785386106041	Книга завтрашний день кошки	205408	Полиграфия (folder)/Книги	5068403	Рипол-Классик
3824529	9785445105770	Книга загад,послов,погов,обо всем на свете	205408	Полиграфия (folder)/Книги	0	
5410049	9785389150805	Книга загадай желание! 40243571	5115744	Полиграфия (folder)/Книги - сказки, стихи, рассказы	0	
5410050	9785171010140	Книга загадай меня 40247342	5120829	Полиграфия (folder)/Книги - художественная литература	0	
3824530	9785699508051	Книга загадалкина книжка	205408	Полиграфия (folder)/Книги	0	
5410051	9785040886142	Книга загадка сбежавшего сейфа (#3) 40243751	5115744	Полиграфия (folder)/Книги - сказки, стихи, рассказы	0	
5410052	9785699904785	Книга загадка снежного города 40212151	5115744	Полиграфия (folder)/Книги - сказки, стихи, рассказы	0	
2443007	9785699048687	Книга загадка сорвавшейся встречи	205408	Полиграфия (folder)/Книги	0	
5058022	9789851714601	Книга загадка черных часовщиков книга 2 побег из лабиринта.	205408	Полиграфия (folder)/Книги	4969482	Книжный Дом
4986757	9789851714618	Книга загадка черных часовщиков книга 3 в поисках Золотой цапли	205408	Полиграфия (folder)/Книги	4969482	Книжный Дом
5027525	9789851714625	Книга загадка черных часовщиков книга 4 ларец девяти муз	205408	Полиграфия (folder)/Книги	4969482	Книжный Дом
4990760	9789851714632	Книга загадка черных часовщиков книга 5 волшебный плюмбум	205408	Полиграфия (folder)/Книги	4969482	Книжный Дом
5033886	9789851714649	Книга загадка черных часовщиков книга 6 машина потерянного времени	205408	Полиграфия (folder)/Книги	4969482	Книжный Дом
3347127	9785444402528	Книга загадки 11 сентября (аргументы и факты)	205408	Полиграфия (folder)/Книги	0	
1224772	9785699516674	Книга загадки деда мороза (тв)	205408	Полиграфия (folder)/Книги	726820	СЗКО
3824531	9785445105589	Книга загадки для малышей	205408	Полиграфия (folder)/Книги	0	
2749321	9785378013418	Книга загадки для мальч татьяна коваль	1	Неклассифицированные/default	331248	Проф-Пресс
5410053	9789669251534	Книга загадки з нал?пками: знайди малюка 978-966-925-153-4	205408	Полиграфия (folder)/Книги	0	
5410054	9789669251541	Книга загадки з нал?пками: нагодуй мене 978-966-925-154-1	205408	Полиграфия (folder)/Книги	0	
3870462	9785928715298	Книга загадки и раскраски же	205408	Полиграфия (folder)/Книги	3785719	НФ
3870463	9785928715328	Книга загадки и раскраски зе	205408	Полиграфия (folder)/Книги	3785719	НФ
3870464	9785928715311	Книга загадки и раскраски кр	205408	Полиграфия (folder)/Книги	3785719	НФ
3870465	9785928715304	Книга загадки и раскраски ро	205408	Полиграфия (folder)/Книги	3785719	НФ
3347128	9785170419661	Книга загадки любви и привидений	205408	Полиграфия (folder)/Книги	0	
3347129	9785783312236	Книга загадки он не слон не лев не птица фламинго	205408	Полиграфия (folder)/Книги	441371	Фламинго
5410055	9785389150690	Книга загадки пирамиды 40243574	5115744	Полиграфия (folder)/Книги - сказки, стихи, рассказы	0	
3349086	9785170793532	Книга загадки с.маршак харвест	1	Неклассифицированные/default	5247934	харвест
3824533	9785906901071	Книга загадки,скорог,считалки.я учусь выгов	205408	Полиграфия (folder)/Книги	0	
3824534	9785906901088	Книга загадки,скорог,считалки.я учусь выгов #2	205408	Полиграфия (folder)/Книги	0	
3824535	9785906901095	Книга загадки,скорог,считалки.я учусь выгов #3	205408	Полиграфия (folder)/Книги	0	
3824536	9785906901101	Книга загадки,скорог,считалки.я учусь выгов #4	205408	Полиграфия (folder)/Книги	0	
3824537	9785995125761	Книга загадки,скорог,считалки.я учусь выгов #5	205408	Полиграфия (folder)/Книги	0	
3824538	9785995125778	Книга загадки,скорог,считалки.я учусь выгов #6	205408	Полиграфия (folder)/Книги	0	
3824539	9785995125785	Книга загадки,скорог,считалки.я учусь выгов #7	205408	Полиграфия (folder)/Книги	0	
3824540	9785995125792	Книга загадки,скорог,считалки.я учусь выгов #8	205408	Полиграфия (folder)/Книги	0	
3824541	9785446103089	Книга загадоч.океан один день-один зендудл	205408	Полиграфия (folder)/Книги	0	
5410056	9785171011383	Книга загадочная история бенджамина баттона 40222004	5238948	Полиграфия (folder)/Книги - Проза классическая и современная	0	
66123	9785699298099	Книга загадочная отеч.война	205408	Полиграфия (folder)/Книги	0	
5410057	9785699850297	Книга загадочный Остров 40242399	5115744	Полиграфия (folder)/Книги - сказки, стихи, рассказы	0	
5410058	9785171192464	Книга загнанных лошадей пристреливают, не правда ли? 40236348	5120829	Полиграфия (folder)/Книги - художественная литература	0	
2443008	9785224041879	Книга заговор дилетантов	205408	Полиграфия (folder)/Книги	0	
2443009	9785040078905	Книга заговор небес	205408	Полиграфия (folder)/Книги	0	
5410059	9785171221003	Книга заговор сионских мудрецов 40235166	5120829	Полиграфия (folder)/Книги - художественная литература	0	
2751350	9785790545672	Книга заговоры сибирской целительницы №21 н.степанова	1	Неклассифицированные/default	2751102	Рипол
2751368	9785386000974	Книга заговоры сибирской целительницы №23 н.степанова	1	Неклассифицированные/default	2751102	Рипол
5410060	9789851838949	Книга задания для знайки харвест	5243917	Полиграфия (folder)/Книга детская обучающая	5247934	харвест
3824542	9785928718275	Книга задания и раскр.львен-непос.	205408	Полиграфия (folder)/Книги	0	
5410061	9785171039851	Книга задача выжить 40202308	5221985	Полиграфия (folder)/Книги - фантастика, фентези, мистика	0	
5410062	9785040891122	Книга задача трех тел 40233720	205408	Полиграфия (folder)/Книги	4910904	fanzon
5410063	9785506025146	Книга задвижки-раздвижки, 4 разворота, 4 задвижки. ми-ми-мишки Умка 5146	5269892	Полиграфия (folder)/Книги детские игровые	712913	Умка
727295	9785170651313	Книга задорнов михаил пиар во время чумы или кому на руси жить?	205408	Полиграфия (folder)/Книги	0	
5410064	9785171223076	Книга зажги меня 40235874	5120829	Полиграфия (folder)/Книги - художественная литература	0	
5410065	9785170961726	Книга зажги мое сердце 40219181	5405283	Полиграфия (folder)/Книги - романтическая проза	0	
