ID	UPCEAN	Name	CategoryID	CategoryName	BrandID	BrandName
47153	7804342002516	Вино maule walley алтуе Chardonnay бел сух 750ml	282291	Продукты питания (folder)/Алкогольные напитки/Вино (folder)/Вина Чили	149689	Русьимпорт
1195959	780434200251	Вино maule walley алтуе Chardonnay бел сух 750ml #2	282291	Продукты питания (folder)/Алкогольные напитки/Вино (folder)/Вина Чили	149689	Русьимпорт
150921	7804342002509	Вино maule walley алтуе карменера красн сух 750ml	282291	Продукты питания (folder)/Алкогольные напитки/Вино (folder)/Вина Чили	149718	БАХУС
3284838	3800005800202	Вино mavryd&pamid столов красное полусладк 11.5% 750ml стбут	1759169	Продукты питания (folder)/Алкогольные напитки/Вино (folder)/Вина Болгарии	0	
1958059	4003301051340	Вино maybach riesling белое сухое 12% 750ml ст/б	22133	Продукты питания (folder)/Алкогольные напитки/Вино (folder)/Вино	0	
1759896	4607056602958	Вино maz.chamb.g.c.к.с12% 750ml	22133	Продукты питания (folder)/Алкогольные напитки/Вино (folder)/Вино	0	
3791563	8004300113240	Вино mc frascati бел сух 750ml	22133	Продукты питания (folder)/Алкогольные напитки/Вино (folder)/Вино	3790013	CASA VINICOLA
283456	8004300112243	Вино mc frascati супериор мс бел сух 750ml 12% /мозель/	22133	Продукты питания (folder)/Алкогольные напитки/Вино (folder)/Вино	0	
3791565	8004300534267	Вино mc lambrusco красн сл. 750ml	296061	Продукты питания (folder)/Алкогольные напитки/Вино (folder)/Вино игристое	3790013	CASA VINICOLA
1759897	3303290022583	Вино med.ch.bes.s.к.с 12.5% 750ml	22133	Продукты питания (folder)/Алкогольные напитки/Вино (folder)/Вино	1721254	Centrum
3284840	4001432037233	Вино medinet Merlot красное полусладк 13.5% tetrapak 1л	22133	Продукты питания (folder)/Алкогольные напитки/Вино (folder)/Вино	0	
3284839	4001432036236	Вино medinet белое 10% 1л стбут	22133	Продукты питания (folder)/Алкогольные напитки/Вино (folder)/Вино	0	
2423325	3035136014000	Вино medoc reserve Томас бартон красное сухое 13.5% 750ml ст/б	1	Неклассифицированные/default	0	
3791568	3760029451265	Вино medocaine мас бель розов сух13% 750ml	22133	Продукты питания (folder)/Алкогольные напитки/Вино (folder)/Вино	3791567	MEDOCAINE МАС БЕЛЬ
3284841	8436043581749	Вино megavin collection toro borracho столов белое сухое 9% 750ml стбут	22133	Продукты питания (folder)/Алкогольные напитки/Вино (folder)/Вино	0	
3284842	6910614500961	Вино mei yan сливовое фруктовое белое сладкое 10.5% 750ml стекло	22133	Продукты питания (folder)/Алкогольные напитки/Вино (folder)/Вино	0	
3284843	4650067390130	Вино melange мускат белое полусладк алк.10-12% tetrapak 3л	22133	Продукты питания (folder)/Алкогольные напитки/Вино (folder)/Вино	0	
3284844	3531380067514	Вино melusine красное полусладк 10.5% 750ml	22133	Продукты питания (folder)/Алкогольные напитки/Вино (folder)/Вино	0	
3284845	3800214146405	Вино mendes кадарка столов красное полусладк 10-12% 750ml стекло	1759169	Продукты питания (folder)/Алкогольные напитки/Вино (folder)/Вина Болгарии	0	
3284846	4840358009777	Вино mendes мускат столов белое полусладк 10-12% 750ml стекло	22133	Продукты питания (folder)/Алкогольные напитки/Вино (folder)/Вино	0	
44974	3760003855263	Вино menuet пино де шарант 10лет спец.дес.17% 750ml	41821	Продукты питания (folder)/Алкогольные напитки/Вино (folder)/Вина Франции	44973	Menuet
44975	3760003855164	Вино menuet пино де шарант 5лет спец.дес.17% 750ml	41821	Продукты питания (folder)/Алкогольные напитки/Вино (folder)/Вина Франции	44973	Menuet
5294851	4860004901637	Вино meomari алазанская Долина белое полусладк, 750ml (4860004901637)	22133	Продукты питания (folder)/Алкогольные напитки/Вино (folder)/Вино	0	
5294852	4860004901569	Вино meomari алазанская Долина красное полусладк, 750ml (4860004901569)	22133	Продукты питания (folder)/Алкогольные напитки/Вино (folder)/Вино	0	
3284847	4607062867167	Вино mer noiare сухое розовое 11% 0.75m л стекло	22133	Продукты питания (folder)/Алкогольные напитки/Вино (folder)/Вино	0	
3284848	4607062867143	Вино mer Noir (черное море) столов сух красн 11-13% 750ml с б шт	22133	Продукты питания (folder)/Алкогольные напитки/Вино (folder)/Вино	0	
2854972	4860001686278	Вино merani алазанская Долина столов белое полусладк 10-12% 750ml стбут	282274	Продукты питания (folder)/Алкогольные напитки/Вино (folder)/Вина Грузии	0	
2854973	4860001686285	Вино merani алазанская Долина столов красное полусладк 10-12% 750ml ст/б	282274	Продукты питания (folder)/Алкогольные напитки/Вино (folder)/Вина Грузии	0	
2720397	4860001686292	Вино merani саперави столов 10-12.5% красное сухое 750ml с/б	282274	Продукты питания (folder)/Алкогольные напитки/Вино (folder)/Вина Грузии	0	
45873	7804330341108	Вино Merlot 120 санта рита красн сух 14% 750ml	282291	Продукты питания (folder)/Алкогольные напитки/Вино (folder)/Вина Чили	45865	Санта Рита
3791569	8008900005554	Вино Merlot 2014 красн п/ сух 0.187л	22133	Продукты питания (folder)/Алкогольные напитки/Вино (folder)/Вино	0	
3791570	7804320064970	Вино Merlot 2015 к.п/ сух 12.5% 750ml	22133	Продукты питания (folder)/Алкогольные напитки/Вино (folder)/Вино	3790329	VINA MAIPO
3791571	7804320646923	Вино Merlot 2015 к.п/ сух 12.5% 750ml #2	22133	Продукты питания (folder)/Алкогольные напитки/Вино (folder)/Вино	3790329	VINA MAIPO
1194487	3800026328518	Вино Merlot barrell fermented sp res, 750ml 0.0% сухое, столов	1759169	Продукты питания (folder)/Алкогольные напитки/Вино (folder)/Вина Болгарии	0	
283015	4840454004010	Вино Merlot Bella Natura красн полусладк столов 750ml /Молдова/Дионис клуб/	22133	Продукты питания (folder)/Алкогольные напитки/Вино (folder)/Вино	3791209	DIONIS CLUB
3289591	3800118125223	Вино Merlot bulgarian Coast красное сухое 10-13% 750ml стекло	1759169	Продукты питания (folder)/Алкогольные напитки/Вино (folder)/Вина Болгарии	0	
3791581	3500610033674	Вино Merlot Cabernet шене п.с.с 9-15 750ml	22133	Продукты питания (folder)/Алкогольные напитки/Вино (folder)/Вино	382491	J.P.Chenet
151182	4840342006171	Вино Merlot Chardonnay крас-бел/полусладк мигдал 2x2.0	22133	Продукты питания (folder)/Алкогольные напитки/Вино (folder)/Вино	0	
151183	4840342008205	Вино Merlot Chardonnay крас-бел/сух мигдал 2x2.0	22133	Продукты питания (folder)/Алкогольные напитки/Вино (folder)/Вино	0	
3791599	4607062869741	Вино Merlot chateau тамань рез. красн сух 750ml	22133	Продукты питания (folder)/Алкогольные напитки/Вино (folder)/Вино	0	
283016	3170870000084	Вино Merlot couleurs du sud красн сух 750ml 13.5% /skalli//Франция/	22133	Продукты питания (folder)/Алкогольные напитки/Вино (folder)/Вино	0	
2720600	4699301415055	Вино Merlot cresta costiera красн полусладк 750ml	22133	Продукты питания (folder)/Алкогольные напитки/Вино (folder)/Вино	0	
3791572	6905701320416	Вино Merlot Del veneto красн сух 12% 750ml	22133	Продукты питания (folder)/Алкогольные напитки/Вино (folder)/Вино	0	
3791573	8005357040282	Вино Merlot Del veneto красн сух 12% 750ml #2	22133	Продукты питания (folder)/Алкогольные напитки/Вино (folder)/Вино	0	
3289592	4623721002205	Вино Merlot export collection столов сухое красное 10-13% 750ml	22133	Продукты питания (folder)/Алкогольные напитки/Вино (folder)/Вино	0	
22463	4840454002610	Вино Merlot firebird красн сух 750ml /вулканешть/Молдова/	22133	Продукты питания (folder)/Алкогольные напитки/Вино (folder)/Вино	0	
1789902	4840526007741	Вино Merlot Green lee Merlot красное полусладк столов 1л 10-12% 35-45g/дм стбут	1759450	Продукты питания (folder)/Алкогольные напитки/Вино (folder)/Вина Молдовы	0	
151180	4840342006829	Вино Merlot Sauvignon крас-бел/полусладк мигдал 2x2.0	22133	Продукты питания (folder)/Алкогольные напитки/Вино (folder)/Вино	0	
151181	4840342008199	Вино Merlot Sauvignon крас-бел/сух мигдал 2x2.0	22133	Продукты питания (folder)/Алкогольные напитки/Вино (folder)/Вино	0	
1194488	3800026300156	Вино Merlot st сухое столов 0.0% 750ml	1759169	Продукты питания (folder)/Алкогольные напитки/Вино (folder)/Вина Болгарии	0	
46330	8004300652947	Вино Merlot sushi красн сух 12% 750ml	22133	Продукты питания (folder)/Алкогольные напитки/Вино (folder)/Вино	46329	Суши
1255695	4840042003180	Вино Merlot sweet pres столов красное полусладк 750ml	22133	Продукты питания (folder)/Алкогольные напитки/Вино (folder)/Вино	0	
3289593	4670000688490	Вино Merlot terra-petraкрасное столов сухое 10-12% 700ml стекло	22133	Продукты питания (folder)/Алкогольные напитки/Вино (folder)/Вино	0	
2426170	4840325000684	Вино Merlot va красн полусладк лавина 9% 0.700	22133	Продукты питания (folder)/Алкогольные напитки/Вино (folder)/Вино	0	
151109	4840062002699	Вино Merlot алов крас/полусладк 2.0	22133	Продукты питания (folder)/Алкогольные напитки/Вино (folder)/Вино	150237	АЛОВ
2854271	3800003405638	Вино Merlot амфора красн полусладк 12% 750ml	1759169	Продукты питания (folder)/Алкогольные напитки/Вино (folder)/Вина Болгарии	0	
2854272	4600870115017	Вино Merlot ариант красн сух 1.0	22133	Продукты питания (folder)/Алкогольные напитки/Вино (folder)/Вино	0	
46980	4840052001015	Вино Merlot аромат молд красн полусладк 9-11% 1.500	22133	Продукты питания (folder)/Алкогольные напитки/Вино (folder)/Вино	46977	Хинчешты
1194489	4840052001886	Вино Merlot аскони красн сух мар. 750ml	22133	Продукты питания (folder)/Алкогольные напитки/Вино (folder)/Вино	0	
151110	4840454002092	Вино Merlot аурвин молд. красн полусладк 750ml	22133	Продукты питания (folder)/Алкогольные напитки/Вино (folder)/Вино	0	
283019	3800006902400	Вино Merlot барбарис красн полусладк 750ml 11.5% /Болгария/	1759169	Продукты питания (folder)/Алкогольные напитки/Вино (folder)/Вина Болгарии	0	
3289594	3800010008433	Вино Merlot барбарис красное сладкое 11% 750ml ст/б	1759169	Продукты питания (folder)/Алкогольные напитки/Вино (folder)/Вина Болгарии	0	
283020	5949475000373	Вино Merlot бахус красн сух 750ml 12% /Румыния/	22133	Продукты питания (folder)/Алкогольные напитки/Вино (folder)/Вино	0	
3289595	4607140755195	Вино Merlot белое полусладк 12% 1л	22133	Продукты питания (folder)/Алкогольные напитки/Вино (folder)/Вино	0	
151111	5022711014478	Вино Merlot блуридж красн сух 13% 750ml	22133	Продукты питания (folder)/Алкогольные напитки/Вино (folder)/Вино	150722	НЕВСКИЙ ПРОСТОР 639
151112	5022711014416	Вино Merlot блюридж красн сух 13% 750ml	22133	Продукты питания (folder)/Алкогольные напитки/Вино (folder)/Вино	150722	НЕВСКИЙ ПРОСТОР 639
283022	4606285001341	Вино Merlot боспор красн сух столов 3л /Россия/	22133	Продукты питания (folder)/Алкогольные напитки/Вино (folder)/Вино	0	
283023	4840472008083	Вино Merlot боставан красн полусладк 750ml 10-13% /Молдова/	22133	Продукты питания (folder)/Алкогольные напитки/Вино (folder)/Вино	0	
3791577	4840342018235	Вино Merlot бочковое 750ml	22133	Продукты питания (folder)/Алкогольные напитки/Вино (folder)/Вино	0	
1192275	7802940001979	Вино Merlot бравый жеребец красн сух 750ml 13% /Чили/	22133	Продукты питания (folder)/Алкогольные напитки/Вино (folder)/Вино	3792279	БРАВЫЙ ЖЕРЕБЕЦ
3289596	3800125405653	Вино Merlot вайн хиллс красное полусухое столов 10-12% 750ml ст/б	1759169	Продукты питания (folder)/Алкогольные напитки/Вино (folder)/Вина Болгарии	0	
151113	9784426200008	Вино Merlot валле сенте красн сух 750ml	22133	Продукты питания (folder)/Алкогольные напитки/Вино (folder)/Вино	149689	Русьимпорт
2854275	8006393302051	Вино Merlot венето делла рокка красн сух 750ml/igt	22133	Продукты питания (folder)/Алкогольные напитки/Вино (folder)/Вино	3792048	ДЕЛЛА РОККА
1759899	8002235473552	Вино Merlot венето терре палладиане зонин красн сух 12% 700ml	22133	Продукты питания (folder)/Алкогольные напитки/Вино (folder)/Вино	3790214	САРТОРИ
3791579	8004300252659	Вино Merlot венетт. красн сух 12% 750ml	22133	Продукты питания (folder)/Алкогольные напитки/Вино (folder)/Вино	3791578	МЕРЛО
2426248	8007880215809	Вино Merlot венец. красн сух 12%750ml геогр.указ.	22133	Продукты питания (folder)/Алкогольные напитки/Вино (folder)/Вино	0	
3289597	4620016190920	Вино Merlot вечерний Крым красное полусладк 10-12% 750ml ст/б	22133	Продукты питания (folder)/Алкогольные напитки/Вино (folder)/Вино	0	
1958063	4840463007569	Вино Merlot вин.натур. красное п/сухое 750ml	22133	Продукты питания (folder)/Алкогольные напитки/Вино (folder)/Вино	0	
1958064	4840463006852	Вино Merlot вин.натур. красное полусладк 750ml	22133	Продукты питания (folder)/Алкогольные напитки/Вино (folder)/Вино	0	
151114	4606651000985	Вино Merlot винелла красн полусладк 10.5% 700ml	22133	Продукты питания (folder)/Алкогольные напитки/Вино (folder)/Вино	150299	винелла 921
2854279	4607125540891	Вино Merlot винелла красн полусладк 3.0	22133	Продукты питания (folder)/Алкогольные напитки/Вино (folder)/Вино	0	
151115	4606651002095	Вино Merlot винелла красн сух 9.5-11.5 3.0	22133	Продукты питания (folder)/Алкогольные напитки/Вино (folder)/Вино	0	
2854280	4607159663283	Вино Merlot винникоф красн полусладк 700ml	22133	Продукты питания (folder)/Алкогольные напитки/Вино (folder)/Вино	0	
2854281	3800204430743	Вино Merlot виноградец красн полусладк 1.0	1759169	Продукты питания (folder)/Алкогольные напитки/Вино (folder)/Вина Болгарии	0	
2854282	3800204430798	Вино Merlot виноградец красн полусладк 2.0	1759169	Продукты питания (folder)/Алкогольные напитки/Вино (folder)/Вина Болгарии	0	
1194491	3800003413633	Вино Merlot винтегра красн сух 1л 9% /Болгария/	1759169	Продукты питания (folder)/Алкогольные напитки/Вино (folder)/Вина Болгарии	0	
1194492	4840454004317	Вино Merlot вльс цветов красн полусладк 11% 750ml	22133	Продукты питания (folder)/Алкогольные напитки/Вино (folder)/Вино	0	
151160	4840526003682	Вино Merlot выдержанное, географического наименования южного региона, каушанского района красное сухое (Молдова) 750ml	22133	Продукты питания (folder)/Алкогольные напитки/Вино (folder)/Вино	150380	ВЕДА МАРКЕТ
2227250	3531380033922	Вино Merlot вэн де франс красн/полусладк 0.75 15% 1/6	22133	Продукты питания (folder)/Алкогольные напитки/Вино (folder)/Вино	0	
3289599	4630017483068	Вино Merlot гарлинг п сл красное 750ml	22133	Продукты питания (folder)/Алкогольные напитки/Вино (folder)/Вино	0	
2720612	4630017481262	Вино Merlot географического наименования красное сухое 12.5% 750ml ст/б	22133	Продукты питания (folder)/Алкогольные напитки/Вино (folder)/Вино	0	
1194493	4670000686694	Вино Merlot гранд бокал красн полусладк 10-12% графин 0.800	22133	Продукты питания (folder)/Алкогольные напитки/Вино (folder)/Вино	0	
151118	4840068001924	Вино Merlot гранд/хаус красн сух 2.0	22133	Продукты питания (folder)/Алкогольные напитки/Вино (folder)/Вино	150508	ЛЯ ВИНЧИ
151117	4840090001435	Вино Merlot гранд/хаус красн сух 700ml	22133	Продукты питания (folder)/Алкогольные напитки/Вино (folder)/Вино	150508	ЛЯ ВИНЧИ
283025	4600446001324	Вино Merlot грапелабел красн сух 700ml 10-12% /ммвз/Россия/	22133	Продукты питания (folder)/Алкогольные напитки/Вино (folder)/Вино	3791578	МЕРЛО
4989252	4660017311450	Вино Merlot гуд стейк столов сухое красн 12% 750ml	22133	Продукты питания (folder)/Алкогольные напитки/Вино (folder)/Вино	0	
3289601	4670005100485	Вино Merlot даглар красное сухое 12% 750ml	22133	Продукты питания (folder)/Алкогольные напитки/Вино (folder)/Вино	0	
44986	5029188003820	Вино Merlot даймонд грув красн сух 13% 750ml	22133	Продукты питания (folder)/Алкогольные напитки/Вино (folder)/Вино	0	
44987	8002645539060	Вино Merlot дел венето красн сух 11.5% 750ml	22470	Продукты питания (folder)/Алкогольные напитки/Вино (folder)/Вина Италии	0	
3289603	8008820152437	Вино Merlot делле венецие ронзони красное сухое 11.5% 750ml стекло	22133	Продукты питания (folder)/Алкогольные напитки/Вино (folder)/Вино	0	
151119	8005357041296	Вино Merlot делле Венеция красн сух Италия 750ml	22133	Продукты питания (folder)/Алкогольные напитки/Вино (folder)/Вино	150315	МБГ
2854283	5990500777166	Вино Merlot джулианис красн сух 750ml	22133	Продукты питания (folder)/Алкогольные напитки/Вино (folder)/Вино	0	
2426171	4840155002544	Вино Merlot дикая роза красн полусладк 11% 750ml	22133	Продукты питания (folder)/Алкогольные напитки/Вино (folder)/Вино	0	
2854284	4610001601128	Вино Merlot Дионис красн полусладк 2.0	22133	Продукты питания (folder)/Алкогольные напитки/Вино (folder)/Вино	0	
2854285	4610001601227	Вино Merlot Дионис красн сух 2.0	22133	Продукты питания (folder)/Алкогольные напитки/Вино (folder)/Вино	0	
44999	7804414381594	Вино Merlot Долина колчагуа резерва красн сух 750ml 14% /Чили/	282291	Продукты питания (folder)/Алкогольные напитки/Вино (folder)/Вина Чили	3736375	ЛУИС ФЕЛИПЕ ЭДВАРДС
2854072	3800016680022	Вино Merlot домашнее столов красное полусладк 10-12% 750ml стбут	1759169	Продукты питания (folder)/Алкогольные напитки/Вино (folder)/Вина Болгарии	0	
3289604	4620018473632	Вино Merlot душа кавказа столов сухое красное 11% 750ml ст/б	22133	Продукты питания (folder)/Алкогольные напитки/Вино (folder)/Вино	0	
1194495	4699301415413	Вино Merlot дюльбер красн сух 750ml 11-13% /Россия/	22133	Продукты питания (folder)/Алкогольные напитки/Вино (folder)/Вино	0	
1194496	4699301415406	Вино Merlot дюльберг красн полусладк 750ml 10-12% /Россия/	22133	Продукты питания (folder)/Алкогольные напитки/Вино (folder)/Вино	0	
2426173	4840358007131	Вино Merlot евровин красн сл 10-12% 750ml	22133	Продукты питания (folder)/Алкогольные напитки/Вино (folder)/Вино	0	
151120	3800024903779	Вино Merlot евровин красн сух т/п 9-11% 2.0	1759169	Продукты питания (folder)/Алкогольные напитки/Вино (folder)/Вина Болгарии	150257	ЭКСПО ВИН 207
2854286	3800008360024	Вино Merlot зол кувшин красн полусладк 0.700	1759169	Продукты питания (folder)/Алкогольные напитки/Вино (folder)/Вина Болгарии	0	
2426174	4840267003705	Вино Merlot зол/фонд красн сух 11% 750ml	22133	Продукты питания (folder)/Алкогольные напитки/Вино (folder)/Вино	0	
2426175	380008220090	Вино Merlot и памид красн полусладк 11-12% 1.500	1759169	Продукты питания (folder)/Алкогольные напитки/Вино (folder)/Вина Болгарии	0	
151123	4840084001427	Вино Merlot изумрудный город красн псух 750ml	22133	Продукты питания (folder)/Алкогольные напитки/Вино (folder)/Вино	0	
