ID	UPCEAN	Name	CategoryID	CategoryName	BrandID	BrandName
4695915	070826191626	Staining pads	1	Неклассифицированные/default	0	
4695916	737729273766	Stainles steel pizza c* 1ct	1	Неклассифицированные/default	0	
4695917	662989076164	Stainless 308l 3/32inch dia, 36inch Long welding rod 160oz	1	Неклассифицированные/default	0	
4695918	8801038200088	Stainless blade	1	Неклассифицированные/default	0	
4695919	076753506502	Stainless Bowl set	1	Неклассифицированные/default	0	
4695920	053687978308	Stainless bracelet	1	Неклассифицированные/default	0	
4695921	645420791505	Stainless briefcase bottle17o 1ct	1	Неклассифицированные/default	0	
4695922	645420791352	Stainless briefcse bottle 12oz 1ct	1	Неклассифицированные/default	0	
4695923	645420791253	Stainless Color kids vbattle 1ct	1	Неклассифицированные/default	0	
1140765	056871657157	Stainless d/oven	1	Неклассифицированные/default	0	
570917	079423466502	Stainless detail brush st 46650	1	Неклассифицированные/default	0	
1617025	039208976473	Stainless discus padlock lock bri 153-70001	1	Неклассифицированные/default	0	
1140766	010001104027	Stainless file-10402	1	Неклассифицированные/default	0	
4695924	020972033714	Stainless flatware	1	Неклассифицированные/default	0	
1140767	056871657164	Stainless frypan	1	Неклассифицированные/default	0	
4695925	722233552599	Stainless handle	1	Неклассифицированные/default	0	
4953011	795229405599	Stainless iron clock-12 d-2 assortments	1	Неклассифицированные/default	0	
4695926	078915221216	Stainless odor bar 1ct	1	Неклассифицированные/default	0	
1140768	056871657140	Stainless saucepot	1	Неклассифицированные/default	0	
2396872	4800471239567	Stainless shelf barcket h.d 10'	1980132	Инструменты (folder)/Hardware	0	
2396873	4800471239673	Stainless shelf barcket h.d 12'	1980132	Инструменты (folder)/Hardware	0	
2396874	4800471239895	Stainless shelf barcket h.d 8'	1980132	Инструменты (folder)/Hardware	0	
1140769	056871645437	Stainless st/cw s	1	Неклассифицированные/default	0	
4695927	851322000564	Stainless steal firebowl from target	1	Неклассифицированные/default	0	
4695928	721110590464	Stainless steel	1	Неклассифицированные/default	0	
4695929	764271095003	Stainless steel (18/8) canisters - 4 with acrylic tops	1	Неклассифицированные/default	0	
654977	047669202697	Stainless steel 1/2 pint candy/pet dish	1	Неклассифицированные/default	0	
2686171	444444321640	Stainless steel 10-inch whisk	1	Неклассифицированные/default	0	
419090	614121060302	Stainless steel 12x30 0.002 roll	331156	Товары для творчества (folder)/Живопись и рисования (folder)/Товары для художников	0	
4695930	079171631856	Stainless steel 18inch heavy duty grab bar	1	Неклассифицированные/default	0	
2686172	021248256202	Stainless steel 20-jar Spice rack	1	Неклассифицированные/default	0	
4695931	832386013585	Stainless steel 26oz Water bottle 26oz	1	Неклассифицированные/default	0	
1615391	4800471765653	Stainless steel 40cm #555	2420630	Посуда (folder)/Посуда кухонная	0	
1615392	796515820089	Stainless steel 600ml bottle	1	Неклассифицированные/default	0	
4695932	091712253136	Stainless steel 7/8 ballcock 3/8 comp	1	Неклассифицированные/default	0	
4953012	731015119080	Stainless steel all purpose scissors display	1	Неклассифицированные/default	0	
4953013	795229345529	Stainless steel and plastic tongs-Orange/Silver	1	Неклассифицированные/default	0	
2000939	895152013288	Stainless steel ankle&wrist bondage set	1980215	Adult/Bondage	0	
4695933	706569000443	Stainless steel anti-magnetic 2a tweezers 12ct	1	Неклассифицированные/default	0	
4695934	722233880074	Stainless steel arch pull - 488mm	1	Неклассифицированные/default	0	
654978	5013737075321	Stainless steel balti dish 16cm	1	Неклассифицированные/default	0	
4695935	033789220925	Stainless steel bamboo bread Box	1	Неклассифицированные/default	0	
4695936	087318001509	Stainless steel bar sink only	1	Неклассифицированные/default	0	
4953014	731015273942	Stainless steel barbecue tongs	1	Неклассифицированные/default	0	
4953015	731015037131	Stainless steel barber scissors	1	Неклассифицированные/default	0	
1615393	4800471750543	Stainless steel basin 28 cm (thin)	2420630	Посуда (folder)/Посуда кухонная	0	
1615394	4800471689546	Stainless steel basin 28cm	2420630	Посуда (folder)/Посуда кухонная	0	
1615395	4800471689652	Stainless steel basin 32cm	2420630	Посуда (folder)/Посуда кухонная	0	
1615396	4800471765325	Stainless steel basin 34cm #555	2420630	Посуда (folder)/Посуда кухонная	0	
1615397	4800471765431	Stainless steel basin 36cm #555	2420630	Посуда (folder)/Посуда кухонная	0	
1615398	4800471750437	Stainless steel basin 38 cm (thin)	2420630	Посуда (folder)/Посуда кухонная	0	
1615399	4800471765547	Stainless steel basin 38cm #555	2420630	Посуда (folder)/Посуда кухонная	0	
1615400	4800471765769	Stainless steel basin 42cm #555	2420630	Посуда (folder)/Посуда кухонная	0	
654979	060107164456	Stainless steel bbq spatula	1	Неклассифицированные/default	0	
4695937	648352677664	Stainless steel best friends pend w/18inch chain	1	Неклассифицированные/default	0	
2396875	9555191201435	Stainless steel blades	1	Неклассифицированные/default	0	
2000940	895152014261	Stainless steel bondage set large	1980215	Adult/Bondage	0	
2000941	895152013110	Stainless steel bondage set small	1980215	Adult/Bondage	0	
4695938	746851392443	Stainless steel bottle 750ml	1	Неклассифицированные/default	0	
4695939	746851279393	Stainless steel bottle pourers	1	Неклассифицированные/default	0	
4695940	755576004722	Stainless steel Bowl	1	Неклассифицированные/default	0	
4695941	780824041020	Stainless steel Bowl 32floz	1	Неклассифицированные/default	0	
1615401	4800471833215	Stainless steel Bowl big	2420630	Посуда (folder)/Посуда кухонная	0	
1615402	4800471833109	Stainless steel Bowl small	2420630	Посуда (folder)/Посуда кухонная	0	
4056635	833368005826	Stainless steel btl 1ct 750ml	1	Неклассифицированные/default	0	
4695942	609613807787	Stainless steel buckle with bolt (dm truck curtains)	1	Неклассифицированные/default	0	
4695943	070000005121	Stainless steel buffet server and warming tray	1	Неклассифицированные/default	0	
4953016	089775386113	Stainless steel campsite mug 10oz	1	Неклассифицированные/default	0	
4695944	023873200117	Stainless steel cleaner	1	Неклассифицированные/default	0	
3951214	654249743923	Stainless steel cleaner (spray) 18oz (510g)	1	Неклассифицированные/default	0	
4953017	048155928060	Stainless steel cleaner-10oz	1	Неклассифицированные/default	0	
4827850	718103271639	Stainless steel clnr/maintainr bpr50877-a	2281065	Неклассифицированные/Generic Breakroom & Cleaning Supplies	4810437	CLAIRE MANUFACTURING
2000929	895152013318	Stainless steel cock cage	1980215	Adult/Bondage	0	
654980	5020403050551	Stainless steel cocktail shaker 1s	1	Неклассифицированные/default	0	
2686173	5025301540517	Stainless steel cocktail shaker set	3536	Хозяйственные товары (folder)/Хозяйственные товары	0	
2000932	895152013332	Stainless steel collar w/nipple clamps	1980215	Adult/Bondage	0	
4695945	076903400216	Stainless steel condiment tray 1ct	1	Неклассифицированные/default	0	
4953018	795229355603	Stainless steel cooking spatula-6 assortments	1	Неклассифицированные/default	0	
4695946	011644009533	Stainless steel cookware set (emerilware) 10ct	1	Неклассифицированные/default	0	
4953019	600719002854	Stainless steel cordless Electric kettle-1.7l	1	Неклассифицированные/default	0	
4953020	600719002861	Stainless steel cordless Electric kettle-1.7l #2	1	Неклассифицированные/default	0	
419091	652695539985	Stainless steel cork backed ruler 12inch	331156	Товары для творчества (folder)/Живопись и рисования (folder)/Товары для художников	0	
419093	652695539992	Stainless steel cork backed ruler 18inch	331156	Товары для творчества (folder)/Живопись и рисования (folder)/Товары для художников	0	
419094	652695540004	Stainless steel cork backed ruler 24inch	331156	Товары для творчества (folder)/Живопись и рисования (folder)/Товары для художников	0	
419095	088359006270	Stainless steel cork backed ruler 36inch	331156	Товары для творчества (folder)/Живопись и рисования (folder)/Товары для художников	0	
419096	088359006171	Stainless steel cork backed ruler 6inch	331156	Товары для творчества (folder)/Живопись и рисования (folder)/Товары для художников	1430463	C-THRU
4695947	081492034025	Stainless steel corner Bath shelf	1	Неклассифицированные/default	0	
4695948	697495347071	Stainless steel cross pendant	1	Неклассифицированные/default	0	
1140770	5391511517077	Stainless steel cruset set	1	Неклассифицированные/default	0	
4695949	076657697832	Stainless steel cup	1	Неклассифицированные/default	0	
4953021	089775292476	Stainless steel curved tip tweezers	1	Неклассифицированные/default	0	
654981	5020403051800	Stainless steel deep stockpot 16l 1s	1	Неклассифицированные/default	0	
654982	5020403051824	Stainless steel deep stockpot 20l 1s	1	Неклассифицированные/default	0	
654983	5020403051831	Stainless steel deep stockpot 24l 1s	1	Неклассифицированные/default	0	
4695950	053796104346	Stainless steel dip cup 2oz	1	Неклассифицированные/default	0	
419097	5051622017186	Stainless steel dish drainer	1	Неклассифицированные/default	0	
1615403	4800401351031	Stainless steel Dog dish sb-3 per piece	337596	Товары для животных (folder)/Pets	0	
4695951	764271070567	Stainless steel dome top step on can	1	Неклассифицированные/default	0	
4953022	048552569675	Stainless steel double wall travel mug-21oz	1	Неклассифицированные/default	0	
4953023	048552573986	Stainless steel double wall travel mug-21oz #2	1	Неклассифицированные/default	0	
4953024	048552573993	Stainless steel double wall travel mug-21oz #3	1	Неклассифицированные/default	0	
4953025	048552580281	Stainless steel double wall travel mug-21oz #4	1	Неклассифицированные/default	0	
4953026	048552569613	Stainless steel double wall travel mug-21oz-Blue	1	Неклассифицированные/default	0	
4953027	048552573979	Stainless steel double wall travel mug-21oz-Blue #2	1	Неклассифицированные/default	0	
4953028	048552580298	Stainless steel double wall travel mug-21oz-gray	1	Неклассифицированные/default	0	
4953029	048552569651	Stainless steel double wall travel mug-21oz-Red	1	Неклассифицированные/default	0	
4953030	048552573962	Stainless steel double wall travel mug-21oz-Red #2	1	Неклассифицированные/default	0	
4953031	048552580953	Stainless steel double wall travel mug-27oz	1	Неклассифицированные/default	0	
4953032	048552580960	Stainless steel double wall travel mug-27oz #2	1	Неклассифицированные/default	0	
4953033	048552580977	Stainless steel double wall travel mug-27oz #3	1	Неклассифицированные/default	0	
4953034	048552580984	Stainless steel double wall travel mug-27oz #4	1	Неклассифицированные/default	0	
4953035	048552448123	Stainless steel double wall travel mug-27oz-gray	1	Неклассифицированные/default	0	
4953036	048552569576	Stainless steel double wall travel mug-30oz	1	Неклассифицированные/default	0	
4953037	048552448093	Stainless steel double wall travel mug-42oz	1	Неклассифицированные/default	0	
4953038	048552580717	Stainless steel double wall travel mug-42oz #2	1	Неклассифицированные/default	0	
4953039	048552580724	Stainless steel double wall travel mug-42oz #3	1	Неклассифицированные/default	0	
4953040	048552580700	Stainless steel double wall travel mug-42oz-Red	1	Неклассифицированные/default	0	
4953041	795229316130	Stainless steel double wall vacuum flask 16oz	1	Неклассифицированные/default	0	
4953042	849306007821	Stainless steel dual chamber travel mug-18oz	1	Неклассифицированные/default	0	
4953043	048552569606	Stainless steel dual chamber travel mug-25oz	1	Неклассифицированные/default	0	
4953044	048552569620	Stainless steel dual chamber travel mug-25oz #2	1	Неклассифицированные/default	0	
4953045	048552569637	Stainless steel dual chamber travel mug-25oz #3	1	Неклассифицированные/default	0	
4695952	785007855654	Stainless steel duplex receptacle coverplate	1	Неклассифицированные/default	0	
4695953	737729312724	Stainless steel eggslicer 1ct	1	Неклассифицированные/default	0	
2000934	895152013349	Stainless steel enhanced length anal hook	1980215	Adult/Bondage	0	
419098	038236032311	Stainless steel erasing shield 15 hole	331156	Товары для творчества (folder)/Живопись и рисования (folder)/Товары для художников	0	
2204565	081942112792	Stainless steel Field adj framing angle, 2-1/4inch x2-1/4inch x 4-5/8inch mp5-ss	1980132	Инструменты (folder)/Hardware	3948195	MiTek
2204566	081942114659	Stainless steel Field adj framing angle, 2-1/4inch x2-1/4inch x 4-5/8inch mp5-ss #2	1980132	Инструменты (folder)/Hardware	3948195	MiTek
4695954	636730240845	Stainless steel flask 8oz	1	Неклассифицированные/default	0	
4953046	731015229383	Stainless steel flask set 7oz	1	Неклассифицированные/default	0	
1615404	796515820171	Stainless steel Food container	1	Неклассифицированные/default	0	
654984	5020403070085	Stainless steel gastronorm pan 1/1 1s	1	Неклассифицированные/default	0	
654985	5020403070122	Stainless steel gastronorn lid 1/1 1s	1	Неклассифицированные/default	0	
654986	5020403070269	Stainless steel gastronorn lid 1/3 1s	1	Неклассифицированные/default	0	
654987	5020403070320	Stainless steel gastronorn lid 1/4 1s	1	Неклассифицированные/default	0	
654988	5020403070375	Stainless steel gastronorn lid 1/6 1s	1	Неклассифицированные/default	0	
654989	5020403070412	Stainless steel gastronorn lid 1/9 1s	1	Неклассифицированные/default	0	
654990	5020403070191	Stainless steel gastronorn lid 1s	1	Неклассифицированные/default	0	
654991	5020403070153	Stainless steel gastronorn pan 1/2 1s	1	Неклассифицированные/default	0	
654992	5020403070221	Stainless steel gastronorn pan 1/3 1s	1	Неклассифицированные/default	0	
654993	5020403070276	Stainless steel gastronorn pan 1/4 1s	1	Неклассифицированные/default	0	
654994	5020403070337	Stainless steel gastronorn pan 1/6 1s	1	Неклассифицированные/default	0	
654995	5020403070382	Stainless steel gastronorn pan 1/9 1s	1	Неклассифицированные/default	0	
654996	5020403070443	Stainless steel gastronorn pan 2/3 1s	1	Неклассифицированные/default	0	
2686174	5391519006733	Stainless steel grater (ho00673)	2420630	Посуда (folder)/Посуда кухонная	0	
4695955	7316839142006	Stainless steel grater - rakostjarn sveico	1	Неклассифицированные/default	0	
4953047	795229455037	Stainless steel grater with handle	1	Неклассифицированные/default	0	
4953048	795229455044	Stainless steel grater with handle #2	1	Неклассифицированные/default	0	
4953049	795229455068	Stainless steel grater with handle #3	1	Неклассифицированные/default	0	
4953050	795229454955	Stainless steel grater with handle-2 assortments	1	Неклассифицированные/default	0	
4953051	795229454962	Stainless steel grater with handle-2 assortments #2	1	Неклассифицированные/default	0	
4953052	795229454979	Stainless steel grater with handle-2 assortments #3	1	Неклассифицированные/default	0	
4953053	795229454986	Stainless steel grater with handle-2 assortments #4	1	Неклассифицированные/default	0	
4953054	795229455082	Stainless steel grater with handle-2 assortments #5	1	Неклассифицированные/default	0	
4953055	795229455075	Stainless steel grater with handle-4 assortments	1	Неклассифицированные/default	0	
4953056	795229455051	Stainless steel grater with handle-7.75	1	Неклассифицированные/default	0	
4953057	795229454948	Stainless steel grater-9	1	Неклассифицированные/default	0	
4953058	795229453897	Stainless steel handle broom-43	1	Неклассифицированные/default	0	
4695956	030699319015	Stainless steel hex nut, sae 1/4-20	1	Неклассифицированные/default	0	
1615405	4800471753544	Stainless steel hinges Al 3-1/2x3 1/2	1201379	Хозяйственные товары (folder)/Скобяные изделия	0	
1944301	5391517134063	Stainless steel hip flask 5oz	1	Неклассифицированные/default	0	
4695957	024409005725	Stainless steel hip flask 8oz	1	Неклассифицированные/default	0	
4953059	731015016570	Stainless steel hose clamps	1	Неклассифицированные/default	0	
4695958	728594200025	Stainless steel insulated bottle	1	Неклассифицированные/default	0	
4695959	843836052696	Stainless steel invicta men's invicta ii chronograph stainless steel	1	Неклассифицированные/default	0	
4695960	018068165593	Stainless steel jars	1	Неклассифицированные/default	0	
4695961	874291009093	Stainless steel jet burner	1	Неклассифицированные/default	0	
4695962	883049132563	Stainless steel kenmore 25.1 cu. ft side-by-side refrigerator w/ Pure Water filtration	1	Неклассифицированные/default	0	
4695963	656982121693	Stainless steel kitchen scale	1	Неклассифицированные/default	0	
4953060	795229377551	Stainless steel kitchen tools	1	Неклассифицированные/default	0	
2204567	5391519006757	Stainless steel knife set 5 pk (ho00675	1	Неклассифицированные/default	0	
4953061	795229176161	Stainless steel ladle-13.5 l	1	Неклассифицированные/default	0	
4695964	694202101537	Stainless steel lined heated travel mug	1	Неклассифицированные/default	0	
4695965	070048191220	Stainless steel Magic	1	Неклассифицированные/default	0	
1615406	070048191961	Stainless steel Magic all-in-One cleaner&polish	1	Неклассифицированные/default	0	
579743	070048114205	Stainless steel Magic cleaner 17oz	6693	Хозяйственные товары (folder)/Бытовая химия (folder)/Чистящие моющие средства	0	
945949	070048191947	Stainless steel Magic ss64	1	Неклассифицированные/default	0	
1140771	5391511523788	Stainless steel masher	1	Неклассифицированные/default	0	
4695966	041226684445	Stainless steel measuring cups/spoons	1	Неклассифицированные/default	0	
4695967	057517146455	Stainless steel mechanical Ice Cream scoop	1	Неклассифицированные/default	0	
4953062	840021007424	Stainless steel mixing Bowl - 16.5	1	Неклассифицированные/default	0	
4695968	021614007339	Stainless steel mixing Bowl set by metro 5ct	1	Неклассифицированные/default	0	
4695969	075611145204	Stainless steel mm met. sp	1	Неклассифицированные/default	0	
4695970	075611140209	Stainless steel mm met.buf.	1	Неклассифицированные/default	0	
1727775	017874006458	Stainless steel money clip wallet	150026	Одежда и обувь (folder)/Одежда	0	
4695971	084389052089	Stainless steel mud pan	1	Неклассифицированные/default	0	
4695972	050122405719	Stainless steel mug with photo insert and lid	1	Неклассифицированные/default	0	
2000937	895152013363	Stainless steel neck&wrist restraint	1980215	Adult/Bondage	0	
4695973	706256240503	Stainless steel necklace	1	Неклассифицированные/default	0	
2204351	077234060360	Stainless steel no slip pet dish 24oz	337596	Товары для животных (folder)/Pets	0	
2204352	077234060377	Stainless steel no slip pet dish 32oz	337596	Товары для животных (folder)/Pets	0	
419099	038236017042	Stainless steel nonslip ruler 12inch 32/64	331156	Товары для творчества (folder)/Живопись и рисования (folder)/Товары для художников	0	
419100	038236018063	Stainless steel nonslip ruler 15inch 32/64	331156	Товары для творчества (folder)/Живопись и рисования (folder)/Товары для художников	0	
419101	038236018087	Stainless steel nonslip ruler 18inch 32/64	331156	Товары для творчества (folder)/Живопись и рисования (folder)/Товары для художников	0	
419102	038236018100	Stainless steel nonslip ruler 24inch 32/64	331156	Товары для творчества (folder)/Живопись и рисования (folder)/Товары для художников	0	
419103	038236017127	Stainless steel nonslip ruler 36inch 32/64	331156	Товары для творчества (folder)/Живопись и рисования (folder)/Товары для художников	0	
419104	038236018025	Stainless steel nonslip ruler 6inch 32/64	331156	Товары для творчества (folder)/Живопись и рисования (folder)/Товары для художников	0	
419105	038236017165	Stainless steel nonslip ruler inch / metric 12inch	331156	Товары для творчества (folder)/Живопись и рисования (folder)/Товары для художников	0	
419106	038236017189	Stainless steel nonslip ruler inch / metric 15inch	331156	Товары для творчества (folder)/Живопись и рисования (folder)/Товары для художников	0	
419107	038236017202	Stainless steel nonslip ruler inch / metric 18inch	331156	Товары для творчества (folder)/Живопись и рисования (folder)/Товары для художников	0	
419108	038236017226	Stainless steel nonslip ruler inch / metric 24inch	331156	Товары для творчества (folder)/Живопись и рисования (folder)/Товары для художников	0	
419109	038236018247	Stainless steel nonslip ruler inch / metric 36inch	331156	Товары для творчества (folder)/Живопись и рисования (folder)/Товары для художников	0	
419110	038236017141	Stainless steel nonslip ruler inch / metric 6inch	331156	Товары для творчества (folder)/Живопись и рисования (folder)/Товары для художников	0	
4695974	612615027237	Stainless steel notepad	1	Неклассифицированные/default	0	
2686175	823420961337	Stainless steel oval 40-liter pedal trash bin	1	Неклассифицированные/default	0	
4953063	718550112721	Stainless steel oval slotter turner	1	Неклассифицированные/default	0	
2000944	895152016579	Stainless steel paddle	1980215	Adult/Bondage	0	
4695975	3660831433605	Stainless steel palett	1	Неклассифицированные/default	0	
654997	5038037089175	Stainless steel patio heater with co 1s	1	Неклассифицированные/default	0	
654998	5019939000567	Stainless steel pedal bin 3l	1	Неклассифицированные/default	0	
4953064	798525641401	Stainless steel pedicure file (inc 15 of each refill pads)	5586	Косметика (folder)/Косметика	0	
