ID	UPCEAN	Name	CategoryID	CategoryName	BrandID	BrandName
2203452	041433001806	Sp deli express hameggchs croissant 4oz	1	Неклассифицированные/default	2506341	Deli Express
2203453	041433004739	Sp deli express mega omelet sandwich 6.7oz	1	Неклассифицированные/default	2506341	Deli Express
2203454	041433000977	Sp deli express sausageeggchs muffin 5oz	1	Неклассифицированные/default	2506341	Deli Express
2203455	041330006706	Sp deli express sausgechs biscuit 4.9oz	1	Неклассифицированные/default	2506341	Deli Express
2203456	041433005439	Sp deli express sausgeeggchs croissant	1	Неклассифицированные/default	2506341	Deli Express
2203457	041433023785	Sp deli express sausgegg chs bagel 5.7oz	1	Неклассифицированные/default	2506341	Deli Express
2203458	041433021088	Sp deli express western omelett cabatta	1	Неклассифицированные/default	2506341	Deli Express
2203460	041433023624	Sp deli express xxl charbroil/Cheese 9.6oz	1	Неклассифицированные/default	2506341	Deli Express
2072804	041433123638	Sp deli express xxl chicken/Cheese 9.5oz	1	Неклассифицированные/default	2506341	Deli Express
2203461	041433023655	Sp deli express xxl italian sand. 8oz	1	Неклассифицированные/default	2506341	Deli Express
2203462	041433021095	Sp deli express xxl sg/eg/ch ciabatta 6.5	1	Неклассифицированные/default	2506341	Deli Express
1943670	032664561344	Sp dimatrol (ul) eag 6000v-k	1	Неклассифицированные/default	0	
2203464	038900719227	Sp dole Apple/crml creme parfait 7oz	1	Неклассифицированные/default	0	
2203465	038900004095	Sp dole pineapple chunks 8.25oz	1	Неклассифицированные/default	361101	Dole
2203467	027086168035	Sp don miguel fajita de pollo 7oz	1	Неклассифицированные/default	2568339	Don Miguel
4689134	080047449550	Sp dp burg sat valsp 44-28866	1	Неклассифицированные/default	0	
1455698	074465061098	Sp eda's sugar free licorice 6oz	1	Неклассифицированные/default	0	
4689135	080047449567	Sp eng Rose sat valsp 44-28867	1	Неклассифицированные/default	0	
4689136	798051481106	Sp enterprises each lolliopop	1	Неклассифицированные/default	0	
1591068	798051999366	Sp enterprises Rock candy Crystal	1	Неклассифицированные/default	0	
1641750	798051220248	Sp enterprises viper venom	1	Неклассифицированные/default	0	
1641751	798051220361	Sp enterprises viper vials	1	Неклассифицированные/default	0	
4689137	079941933074	Sp ext Satin zar poly 93307	1	Неклассифицированные/default	0	
4689138	883399560191	Sp Fashion basic	1	Неклассифицированные/default	0	
2203473	037000197515	Sp febreze refresh regular 16.9oz	1	Неклассифицированные/default	366472	Febreze
2203488	097488008185	Sp first st chnky chicken salad sdw 10oz	1	Неклассифицированные/default	0	
2203489	097488008178	Sp first st chnky tuna salad sdw 10oz	1	Неклассифицированные/default	0	
2203490	097488008130	Sp first st Club ham/swiss/ched 10oz	1	Неклассифицированные/default	0	
2203491	097488008147	Sp first st Club tky/ham/mont jk 10oz	1	Неклассифицированные/default	0	
2203492	097488008161	Sp first st egg salad sandw 10oz	1	Неклассифицированные/default	0	
2203493	097488008154	Sp first st italian Club 10oz	1	Неклассифицированные/default	0	
2203494	097488008192	Sp first st Turkey/provolone sdw 10oz	1	Неклассифицированные/default	0	
4689139	071915206870	Sp flat Black 14402	1	Неклассифицированные/default	0	
4689140	080047449307	Sp flat Black valspar 44-28826	1	Неклассифицированные/default	0	
4689141	071915206894	Sp flat White 14404	1	Неклассифицированные/default	0	
4689142	080047442506	Sp flat White a/r 44-21921	1	Неклассифицированные/default	0	
4689143	078435450530	Sp flat White enamel sp004160	1	Неклассифицированные/default	0	
4689144	080047449291	Sp flat White valspar 44-28821	1	Неклассифицированные/default	0	
653694	043100070467	Sp flirty florals 10x8 cr 80ct	1	Неклассифицированные/default	0	
2203495	9999919196410	Sp Foam hand soap 1250ml dispenser	1	Неклассифицированные/default	0	
4689145	080047183836	Sp ford Blue 18-5339-12	1	Неклассифицированные/default	0	
4689146	080047183867	Sp ford gray 18-5339-13	1	Неклассифицированные/default	0	
4689147	080047449260	Sp gl White valspar 44-28800	1	Неклассифицированные/default	0	
4689148	071915205927	Sp glass frosting 18200	1	Неклассифицированные/default	0	
4689149	071915206863	Sp Gloss Black 14400	1	Неклассифицированные/default	0	
4689150	080047183959	Sp Gloss Black 18-5339-16	1	Неклассифицированные/default	0	
4689151	080047449468	Sp Gloss Black valspa 44-28860	1	Неклассифицированные/default	0	
4689152	080047270970	Sp Gloss laquer 27-8050	1	Неклассифицированные/default	0	
4689153	080047270932	Sp Gloss polyurethane 27-8010	1	Неклассифицированные/default	0	
4689154	080047270956	Sp Gloss spar varnish 27-8040	1	Неклассифицированные/default	0	
4689155	071915206887	Sp Gloss White 14403	1	Неклассифицированные/default	0	
4689156	080047183898	Sp Gloss White 18-5339-14	1	Неклассифицированные/default	0	
4689157	080047449598	Sp Gold metal valspar 44-28870	1	Неклассифицированные/default	0	
1481382	010700702166	Sp Good&plenty peg 7z 70216	1	Неклассифицированные/default	0	
2203501	041331091442	Sp goya chicken fricassee w/Rice 11oz	1	Неклассифицированные/default	373448	Goya
2203503	041331026284	Sp goya Rice Gold canila parboil 3lb	1	Неклассифицированные/default	373448	Goya
4689158	732573483774	Sp GP9	1	Неклассифицированные/default	0	
4689159	071915211577	Sp gray primer 14412	1	Неклассифицированные/default	0	
4689160	080047449406	Sp gray primer valspr 44-28853	1	Неклассифицированные/default	0	
4689161	071915210143	Sp gray traffic paint 11710	1	Неклассифицированные/default	0	
4689162	080047449475	Sp gray valspar 44-28861	1	Неклассифицированные/default	0	
4689163	071915210136	Sp Green traffic paint 11709	1	Неклассифицированные/default	0	
4689164	711141468931	Sp Honey generic-jar 32oz	1	Неклассифицированные/default	0	
2203530	073260000059	Sp Honey Golden blossom 8oz	1	Неклассифицированные/default	2592403	Golden Blossom Honey
4689165	628159126381	Sp hos/soc:	1	Неклассифицированные/default	0	
2203531	1004369503300	Sp Hot pockets pepperoni pizza 4oz	1	Неклассифицированные/default	0	
2203532	071121960108	Sp Hot shot bedbug killer 17.5oz	1	Неклассифицированные/default	2602945	Hot Shot
4689166	884888158622	Sp Hot spot crews	1	Неклассифицированные/default	0	
1496459	070970472572	Sp Hot tamales peg 5oz	1	Неклассифицированные/default	0	
2203533	743854011920	Sp hugger linzer dust hugger drywall/dand tool	1	Неклассифицированные/default	0	
2203534	011140872068	Sp hungry Jack inst.mash/potato 6.6oz	1	Неклассифицированные/default	0	
4689167	080047449581	Sp hunt Green sat val 44-28869	1	Неклассифицированные/default	0	
4689168	080047449345	Sp hunt Green valspar 44-28844	1	Неклассифицированные/default	0	
4689169	080047448157	Sp Hunter gr alk enl 44-21944	1	Неклассифицированные/default	0	
4066157	076606625381	Sp Hunter Spice shipp 96ea	1	Неклассифицированные/default	0	
4689170	080047183508	Sp int l harv Red 18-5339-01	1	Неклассифицированные/default	0	
2203536	851458001046	Sp island coffee travel mug 16oz	1	Неклассифицированные/default	0	
4689171	080047449543	Sp java brown valspar 44-28865	1	Неклассифицированные/default	0	
2203538	026104710300	Sp joey's Mini Black/White cookie 9oz	1	Неклассифицированные/default	0	
2203539	026104715824	Sp joey's Mini linzer tarts 10oz	1	Неклассифицированные/default	0	
4689172	080047183775	Sp John deere Green 18-5339-10	1	Неклассифицированные/default	0	
4689173	080047183652	Sp John deere yello 18-5339-06	1	Неклассифицированные/default	0	
1511269	030100038979	Sp Keebler Club crackers elfin 5.25 z	1	Неклассифицированные/default	1511221	Keebler
4689174	638325950702	Sp kids ap: ls 2fr heart scr sca	1	Неклассифицированные/default	0	
2203544	070160515164	Sp King pine oven cleaner 16oz	1	Неклассифицированные/default	0	
4689175	754351211188	Sp King sauce broad bean 8oz	1	Неклассифицированные/default	0	
4689176	011141580122	Sp kitchen bag 13gal 215ct	1	Неклассифицированные/default	0	
2203546	075130543352	Sp kr coffee instant 4oz	1	Неклассифицированные/default	0	
2203547	075130195148	Sp kr ketchup 14oz	1	Неклассифицированные/default	0	
2203548	075130308050	Sp kr vegetable Oil 32oz	1	Неклассифицированные/default	0	
2203549	075130466545	Sp kr wide egg noodles 12oz	1	Неклассифицированные/default	0	
2203550	075130682051	Sp kr zip bag gal 15cr pp$2.19	1	Неклассифицированные/default	0	
2203553	075130483429	Sp kras Black pepper 1oz	1	Неклассифицированные/default	0	
2203554	075130689500	Sp kras cake pan 13x9 x2 pp 0.79	1	Неклассифицированные/default	0	
2203555	075130688640	Sp kras cass/lasgna pan pp.59	1	Неклассифицированные/default	0	
2203556	075130286051	Sp kras cherries Red maraschino 6oz	1	Неклассифицированные/default	0	
2203557	075130483061	Sp kras curry Powder pp.99 2.5oz	1	Неклассифицированные/default	0	
2203558	075130448497	Sp kras devils Food cake Mix 18.25	1	Неклассифицированные/default	0	
2203559	075130653648	Sp kras dish liq antibacterial pp.99 25oz	1	Неклассифицированные/default	0	
2203560	075130546995	Sp kras evaporated Milk tall 12oz	1	Неклассифицированные/default	0	
2203561	075130650258	Sp kras fab Soft sht Fresh pp1.69 40'	1	Неклассифицированные/default	0	
2203562	075130650241	Sp kras fab Soft sht Lavender pp1.69	1	Неклассифицированные/default	0	
2203563	075130688732	Sp kras Foam Bowl 12oz 30ct	1	Неклассифицированные/default	0	
2203564	075130688756	Sp kras Foam plate 8 7/8 pp.99 25ct	1	Неклассифицированные/default	0	
2203565	075130685038	Sp kras forks 48ct pp $1.29	1	Неклассифицированные/default	0	
2203566	075130483092	Sp kras garlic salt pp.99 5.75oz	1	Неклассифицированные/default	0	
2203567	075130483078	Sp kras gran garlic pp.99 3oz	1	Неклассифицированные/default	0	
2203568	075130241579	Sp kras grape jelly 12oz	1	Неклассифицированные/default	0	
2203569	075130309071	Sp kras gratd parm Cheese pp 2.99 8oz	1	Неклассифицированные/default	0	
2203570	075130483054	Sp kras grd cinnamon pp 0.99 2.5oz	1	Неклассифицированные/default	0	
2203571	075130682303	Sp kras heavy duty aluminium foil 37.5ft	1	Неклассифицированные/default	0	
2203572	075130306278	Sp kras Honey bear sqz 12oz	1	Неклассифицированные/default	0	
2203573	075130480589	Sp kras imit vanilla ext pp.99 8oz	1	Неклассифицированные/default	0	
2203574	075130689104	Sp kras lawn/leaf bag pp$2.69 10ct	1	Неклассифицированные/default	0	
2203575	075130468914	Sp kras mac&Cheese dinner 7.25oz	1	Неклассифицированные/default	0	
2203576	075130300542	Sp kras mayonnaise 8oz	1	Неклассифицированные/default	0	
2203577	075130689371	Sp kras medium oval roaster pp1.09	1	Неклассифицированные/default	0	
2203578	075130528816	Sp kras micr popcorn Butter 3/3.5oz	199047	Продукты питания (folder)/Попкорн	0	
2203579	075130547237	Sp kras non dairy creamer 16oz	1	Неклассифицированные/default	3968332	Krasdale
2203580	075130263939	Sp kras olives blk med pitted 60oz	1	Неклассифицированные/default	0	
2203581	075130483115	Sp kras onion Powder pp 0.99 2.4oz	1	Неклассифицированные/default	0	
2203582	075130483122	Sp kras oregano pp 0.99 1oz	1	Неклассифицированные/default	0	
2203583	075130306841	Sp kras pancake syrup 12oz	1	Неклассифицированные/default	0	
2203584	075130242279	Sp kras Peanut Butter creamy 18oz	1	Неклассифицированные/default	0	
2203585	075130688657	Sp kras roaster/baker pan 2/1.00	1	Неклассифицированные/default	0	
2203586	075130689111	Sp kras sandwich bags pp1.49 100ct	1	Неклассифицированные/default	0	
2203587	075130483160	Sp kras seasoned salt pp.99 7.5oz	1	Неклассифицированные/default	0	
2203588	075130688954	Sp kras sm garbage bags $1.79 30 gal	1	Неклассифицированные/default	0	
2203589	075130480602	Sp kras vanilla extract 1oz	1	Неклассифицированные/default	0	
2203590	075130679174	Sp kras White napkins 500ct pp 2.99	1	Неклассифицированные/default	0	
2203591	075130448480	Sp kras Yellow cake Mix 18.25oz	1	Неклассифицированные/default	0	
2203611	034500461986	Sp land o'lakes american Cheese 5lb	1	Неклассифицированные/default	0	
4689177	044211684277	Sp lanyard tan	1	Неклассифицированные/default	0	
4689178	080047449376	Sp lawn Green valspar 44-28848	1	Неклассифицированные/default	0	
4689179	041310570036	Sp Lemon dish detergent 25floz	1	Неклассифицированные/default	0	
4689180	080047449369	Sp Light Blue valspar 44-28847	1	Неклассифицированные/default	0	
2203598	080893211134	Sp lil 2in1 screwdriver	1	Неклассифицированные/default	0	
2203599	080893210151	Sp lil auto bulb back up #1156	1	Неклассифицированные/default	0	
2203600	792554222006	Sp lil sewing kit	1	Неклассифицированные/default	0	
2203601	080893012359	Sp lil tire repair kit plug style	1	Неклассифицированные/default	0	
2203602	792554701440	Sp lil toothpaste crest 0.85oz	1	Неклассифицированные/default	0	
2203610	077341970026	Sp lock deicer carded	1	Неклассифицированные/default	0	
4689181	080047184048	Sp low Gloss Black 18-5339-19	1	Неклассифицированные/default	0	
4689182	882262837644	Sp lowrise denim	1	Неклассифицированные/default	0	
1943671	078477048122	Sp LTD rotary dimr leviton 6682 sanr00	1	Неклассифицированные/default	1980105	Leviton
2203616	300676281629	Sp maalox Liquid 5oz	1	Неклассифицированные/default	0	
4689183	828073500032	Sp magazine video-v01 (DVD)	1	Неклассифицированные/default	0	
2203617	041433024348	Sp market italian sub 5.7oz	1	Неклассифицированные/default	0	
2203618	041433009550	Sp market sandwich bl forest ham/chz	1	Неклассифицированные/default	0	
2203619	041433009574	Sp market sandwich mega italian 6.3oz	1	Неклассифицированные/default	0	
2203620	041433009567	Sp market sandwich mega sm turk/chz	1	Неклассифицированные/default	0	
2203621	041433009536	Sp market sandwich ranch chicken salad	1	Неклассифицированные/default	0	
1538790	073390026462	Sp mentos Mini Fruit peg 3.52oz	1	Неклассифицированные/default	20357	Mentos
4689184	882262840002	Sp military denm	1	Неклассифицированные/default	0	
3753813	4606447001622	Sp mirniy/moscow creamy horseradish sauce j 0.18kg	143343	Продукты питания (folder)/Хрен	3753812	СП МИРНЫЙ
2847714	4606447001523	Sp mirniy/moscow crema de vinagre dr.balsamic p bo 0.22kg	1	Неклассифицированные/default	3753812	СП МИРНЫЙ
3753814	4606447001646	Sp mirniy/moscow rus.mustard j 0.17kg	28300	Продукты питания (folder)/Горчица	3753812	СП МИРНЫЙ
2847716	4606447001547	Sp mirniy/moscow сливочный dr.balsamic p bo 0.22kg	1	Неклассифицированные/default	3753812	СП МИРНЫЙ
3753815	4606447000915	Sp mirniy/moscow столовый horserad&beetroo.sauce j 0.17kg	143343	Продукты питания (folder)/Хрен	3753812	СП МИРНЫЙ
3753816	4606447000922	Sp mirniy/moscow столовый horserad&lem.sauce j 0.17kg	143343	Продукты питания (folder)/Хрен	3753812	СП МИРНЫЙ
3753817	4606447000908	Sp mirniy/moscow столовый horseradish sauce j 0.17kg	143343	Продукты питания (folder)/Хрен	3753812	СП МИРНЫЙ
3753818	4606447000960	Sp mirniy/moscow столовый yadryoniy horserad. sauce j 0.17kg	143343	Продукты питания (folder)/Хрен	3753812	СП МИРНЫЙ
4689185	074892904852	Sp mket sea jewel stones 1#	1	Неклассифицированные/default	0	
4689186	721366409107	Sp momnt cucumber brz bthlite	1	Неклассифицированные/default	0	
4689187	721366409152	Sp momnt srene troprain bthli	1	Неклассифицированные/default	0	
4689188	721366409121	Sp momnt swt hny mango bthlit	1	Неклассифицированные/default	0	
4689189	721366409169	Sp momnt tranql chammle bthli	1	Неклассифицированные/default	0	
2203651	072627971568	Sp mop head Blue Maxi clean	1	Неклассифицированные/default	0	
2203652	037000499459	Sp mr.clean 28oz	1	Неклассифицированные/default	0	
4689190	080047449574	Sp navy Blue sat vals 44-28868	1	Неклассифицированные/default	0	
2203653	9999919257715	Sp nectar marshmallow topper	1	Неклассифицированные/default	0	
667518	044000048372	Sp nilla wafers 3.5oz #4837	1	Неклассифицированные/default	1351581	Nabisco
653695	079784129528	Sp notebook sasquatch recyc 7x5 (80	1	Неклассифицированные/default	0	
4689191	034800601181	Sp of nor 2-l sild sard 3.75 ea 12ct	1	Неклассифицированные/default	0	
4689192	080047449222	Sp Oil int/ext primer 44-993	1	Неклассифицированные/default	0	
4689193	071915210129	Sp Orange traffic paint 11708	1	Неклассифицированные/default	0	
4689194	080047449338	Sp Orange valspar 44-28837	1	Неклассифицированные/default	0	
4689195	080047446894	Sp osha (regal) Blue 44-21938	1	Неклассифицированные/default	0	
4689196	080047443558	Sp osha Orange a/r 44-21937	1	Неклассифицированные/default	0	
4689197	080047449437	Sp pacif Blue valspar 44-28856	1	Неклассифицированные/default	0	
2203657	018026101007	Sp paper plates 6 100ct	1	Неклассифицированные/default	0	
2203658	726459830806	Sp paper towel 1's ----	1	Неклассифицированные/default	0	
4689198	041240194531	Sp paper towel bundle 3pk521 210ct	1	Неклассифицированные/default	0	
1569259	070970913129	Sp Peanut chew org drk peg 4oz	1	Неклассифицированные/default	0	
2203660	041426341100	Sp penley flexible straws 40ct	1	Неклассифицированные/default	0	
4689199	041240201710	Sp pep pizza 6.5oz	1	Неклассифицированные/default	0	
2203663	077443200083	Sp petroleum jelly 8oz	1	Неклассифицированные/default	0	
1138464	035140406672	Sp pine gleam c&Deo 65oz cs9	1	Неклассифицированные/default	0	
2203669	646563907617	Sp pizza cutter 4inch w/Wood handle	1	Неклассифицированные/default	0	
2203670	646563473815	Sp pizza spatula w/9 1/2inch Wood handl	1	Неклассифицированные/default	0	
2203671	646563690618	Sp pizza tray aluminium 18inch	1	Неклассифицированные/default	0	
3531552	4626010369317	Sp Plus Baby an.allergy b p k 0.4kg l	1	Неклассифицированные/default	3753819	SP PLUS (BALTIYSKAYA KHIMICHESKAYA KOMPANIYA)
3531551	4626010369645	Sp Plus Baby an.allergy b p s 2.4kg l	1	Неклассифицированные/default	3753819	SP PLUS (BALTIYSKAYA KHIMICHESKAYA KOMPANIYA)
3531556	4626010369652	Sp Plus kolor col.save cc p s 2.4kg l	1	Неклассифицированные/default	3753819	SP PLUS (BALTIYSKAYA KHIMICHESKAYA KOMPANIYA)
3753820	4626010360796	Sp Plus p s 2.4kg h	163	Хозяйственные товары (folder)/Бытовая химия (folder)/Средство для стирки	3753819	SP PLUS (BALTIYSKAYA KHIMICHESKAYA KOMPANIYA)
3753821	4626010369638	Sp Plus p s 2.4kg l	163	Хозяйственные товары (folder)/Бытовая химия (folder)/Средство для стирки	3753819	SP PLUS (BALTIYSKAYA KHIMICHESKAYA KOMPANIYA)
4689200	080047449451	Sp porcelain valspar 44-28858	1	Неклассифицированные/default	0	
2203673	037002300906	Sp Pringles salt&vin Super stack 6.3	1	Неклассифицированные/default	0	
2203676	017800130486	Sp purina puppy chow 2lb	1	Неклассифицированные/default	0	
1943672	078477979389	Sp push dimmer leviton 705-w sanlo2	1	Неклассифицированные/default	1980105	Leviton
653696	8906008350111	Sp putta Powder White	1	Неклассифицированные/default	0	
2203680	050700086408	Sp r&w cut Green beans 15oz	1	Неклассифицированные/default	0	
2203681	050700550244	Sp r&w dish detergent yllw pp.99 18oz	1	Неклассифицированные/default	0	
2203682	050700553467	Sp r&w Fresh liq laundry w/blch 50oz	1	Неклассифицированные/default	0	
2203683	050700498218	Sp r&w pine ammonia 32oz	1	Неклассифицированные/default	0	
2203684	050700086620	Sp r&w sweet peas 15oz	1	Неклассифицированные/default	0	
2203685	050700075334	Sp r&w window cleaner w/trigger 32oz	1	Неклассифицированные/default	0	
653697	8906008350104	Sp ragi flour	1	Неклассифицированные/default	0	
4689201	080047449390	Sp Red ox prime valsp 44-28851	1	Неклассифицированные/default	0	
4689202	071915210099	Sp Red traffic paint 11705	1	Неклассифицированные/default	0	
1523190	041364002323	Sp Red vines twists jumbo Red8	1	Неклассифицированные/default	0	
4689203	071915210150	Sp Red/Orange trafic pnt 11711	1	Неклассифицированные/default	0	
3753822	4056800596027	Sp repair m 0.25l p	1412	Уход за волосами (folder)/Шампунь	3753807	SP
3753823	4015600134020	Sp repair m wot mc 0.4l j	2187	Уход за волосами (folder)/Кондиционер для волос	3753807	SP
4689204	038949606038	Sp rflctn refreshg ft crm 6.10oz 1ct	1	Неклассифицированные/default	0	
4689205	038949606007	Sp rflctn refreshg ft crm 6.1oz	1	Неклассифицированные/default	0	
2684202	029404136795	Sp richards file,2-drwr,highside,hirsh,blk hid16181	2	Канцелярские товары (folder)/Канцелярские товары	2684201	SP RICHARDS
2684203	735854772703	Sp richards file,vert,2drwr,ltr,25inch d,putty hid17247	2	Канцелярские товары (folder)/Канцелярские товары	2684201	SP RICHARDS
1943673	078477979372	Sp rotary dimmer White leviton 700-w san lo2	1	Неклассифицированные/default	1980105	Leviton
4689206	712256253221	Sp safer deglosser dg22 22oz	1	Неклассифицированные/default	0	
4689207	080047449352	Sp sand valspar 44-28846	1	Неклассифицированные/default	0	
4689208	080047270994	Sp sanding sealer 27-8065	1	Неклассифицированные/default	0	
2203695	032100086479	Sp sara lee banana cke frstd 2.2oz	1	Неклассифицированные/default	0	
653699	079784129511	Sp sasquatch recy 8x6 3 sub (120	1	Неклассифицированные/default	0	
4689209	080047449284	Sp sat White valspar 44-28820	1	Неклассифицированные/default	0	
4689210	080047442520	Sp Satin Black enamel 44-21925	1	Неклассифицированные/default	0	
4689211	080047449482	Sp Satin Black valsp 44-28863	1	Неклассифицированные/default	0	
4689212	080047270949	Sp Satin polyurethane 27-8012	1	Неклассифицированные/default	0	
4689213	080047270963	Sp Satin spar varnish 27-8042	1	Неклассифицированные/default	0	
