ID	UPCEAN	Name	CategoryID	CategoryName	BrandID	BrandName
4431923	070845019956	Ien enam ware rk&rst pn dis 1ct	1	Неклассифицированные/default	0	
4431924	070845019895	Ien oval rst with handle dis 1ct	1	Неклассифицированные/default	0	
4431925	070845918945	Ienneco cas &lasg pan disp 1ct	1	Неклассифицированные/default	0	
4431926	070845008912	Ienneco pasta pan disp 1ct	1	Неклассифицированные/default	0	
2605700	7897917000062	Ierobina 100ml-bel	1	Неклассифицированные/default	0	
2605701	7897917000475	Ierobina 20cpr belfar	1	Неклассифицированные/default	0	
4431927	614140252993	Ies international, inc dm street guide	1	Неклассифицированные/default	0	
4919480	758302065875	Iessentials Black auxiliary audio cable	1	Неклассифицированные/default	0	
4431928	758302633029	Iessentialsmp-hfm fm-transmitter/charger	1	Неклассифицированные/default	0	
1727404	845836094157	Iextreme outfitters men's ski bib, Black, large	150026	Одежда и обувь (folder)/Одежда	0	
4431929	715515024426	If (DVD) (eng/1:66.1)	1	Неклассифицированные/default	0	
4431930	023700643704	If bone/skinless breast w/rib 72oz	1	Неклассифицированные/default	0	
4431931	609728239992	If buddha had headphones (www.ifbuddhahadheadphones.co.uk) if buddha had headphones CD (deep relaxation CD)	1	Неклассифицированные/default	0	
4431932	807624203691	If by chance (DVD/ws/eng-sp-sub/2008)	1	Неклассифицированные/default	0	
4431933	5035393009120	If cardboard creations LTD cardmarks pisces magnetic bookmark	1	Неклассифицированные/default	0	
1989281	825116011197	If darla had modeled for irving DVD (sale)	363351	Adult/Sex-Shop	0	
3673773	8859015700052	If Fruit.напит.лимон.соррен.с/сод.280мл	17371	Продукты питания (folder)/Напитки безалкогольные/Напитки	3673772	IF FRUIT
3673774	8859015700069	If Fruit.напит.манго топ.дил.с/сод.280мл	17371	Продукты питания (folder)/Напитки безалкогольные/Напитки	3673772	IF FRUIT
3673775	8859015700083	If Fruit.напит.мияс.лет.пунш с/сод.280мл	17371	Продукты питания (folder)/Напитки безалкогольные/Напитки	3673772	IF FRUIT
3673776	8859015700038	If Fruit.напит.ср.бел виногр.с/сод.280мл	17371	Продукты питания (folder)/Напитки безалкогольные/Напитки	3673772	IF FRUIT
4431934	631595065572	If i see you in my dreams (DVD) (economy pack (ova&tv series) DVD	1	Неклассифицированные/default	0	
4431935	842994005575	If i were a digger	1	Неклассифицированные/default	0	
4431936	024543520054	If im Lucky (DVD/1946/sac/fs-1.33/eng-sp sub)	1	Неклассифицированные/default	0	
4431937	883904106753	If its tuesday this must be belgium (DVD/fs-1.33/ws-1.85/sm/eng-sp-fr sub)	1	Неклассифицированные/default	0	
4431938	883929014934	If Love hadnt left me loney (DVD)	1	Неклассифицированные/default	0	
4431939	043396281066	If lucy fell/Life without dick/striking distance-Box set (DVD/3 disc)	1	Неклассифицированные/default	0	
4431940	5060186260099	If only	1	Неклассифицированные/default	0	
4431941	043396145597	If only (DVD/ff 1.33/dd 5.1/eng-fr-sub)	1	Неклассифицированные/default	0	
4431942	735340600619	If only men could read	1	Неклассифицированные/default	0	
4431943	030306771397	If someone had known (DVD/true stories)	1	Неклассифицированные/default	0	
4431944	049489234414	If the flip flop fits	1	Неклассифицированные/default	0	
4431945	634991316828	If the shoe fits wear it (DVD) (master p)	1	Неклассифицированные/default	0	
4431946	092091122433	If tomorrow comes (vhs)	1	Неклассифицированные/default	0	
4431947	084296411405	If you believe/holiday for Love (DVD) (side by side/2discs)	1	Неклассифицированные/default	0	
4431948	776606913548	If you Care #4 Filter shipr 100ct	1	Неклассифицированные/default	0	
2605702	770009250347	If you Care 28 firelighters - non toxic Wood&veg Oil 12x28	1	Неклассифицированные/default	379303	If You Care
209879	5412533001624	If you Care 72 firelighters - non toxic Wood&veg Oil 12x72	25023	Хозяйственные товары (folder)/Бытовая химия (folder)/Бытовая химия	379303	If You Care
608175	770009050015	If you Care all Natural cooking twine 200ft	1	Неклассифицированные/default	379303	If You Care
608176	770009250187	If you Care all Natural Mini baking cups 90ct	1	Неклассифицированные/default	379303	If You Care
608178	770009010200	If you Care all Natural parchment paper 70sqft	1	Неклассифицированные/default	379303	If You Care
608179	770009250255	If you Care all Natural unbleached wax paper 75sqft	1	Неклассифицированные/default	379303	If You Care
608180	770009260018	If you Care aluminium foil - 100% recycled - 12mx30cm 12x1	1	Неклассифицированные/default	379303	If You Care
4431949	070009010201	If you Care baking paper 1ct	1	Неклассифицированные/default	0	
379304	5412533003925	If you Care baking sheets - pre-cut 12x24 sheets	1	Неклассифицированные/default	379303	If You Care
2605703	770009250644	If you Care certified compostable Food waste bags 3 gallon - 30ct	1	Неклассифицированные/default	379303	If You Care
2605704	770009250668	If you Care certified compostable lawn&leaf bags 33 gallon bags - 8ct	1	Неклассифицированные/default	379303	If You Care
608184	770009250651	If you Care certified compostable tall kitchen bags 13 gallon - 12ct	1	Неклассифицированные/default	379303	If You Care
609335	770009050046	If you Care cheesecloth unblchd 2sq yd 1pcs	1	Неклассифицированные/default	379303	If You Care
1021160	770009001116	If you Care coffee Filter basket 8in 100pc	1	Неклассифицированные/default	379303	If You Care
2605705	770009250491	If you Care coffee Filter bskt 8in dsp	1	Неклассифицированные/default	379303	If You Care
2605706	770009250460	If you Care coffee Filter no2 dsp 60p	1	Неклассифицированные/default	379303	If You Care
2605707	770009250484	If you Care coffee Filter no2&4 dsp 52pcs	1	Неклассифицированные/default	379303	If You Care
2605708	770009250477	If you Care coffee Filter no4 dsp 48pcs	1	Неклассифицированные/default	379303	If You Care
1021161	770009001161	If you Care coffee Filter no6 100pc	1	Неклассифицированные/default	379303	If You Care
2605709	770009250866	If you Care dish detrgnt free&clear	1	Неклассифицированные/default	379303	If You Care
2605710	770009250873	If you Care dish detrgnt Lavender	1	Неклассифицированные/default	379303	If You Care
2605711	770009250897	If you Care dishwasher detrgnt	1	Неклассифицированные/default	379303	If You Care
1021162	770009250330	If you Care firelighters 100% biomass 12x72	978229	Хозяйственные товары (folder)/Kitchen - Cookware & Fuel	379303	If You Care
1021163	770009120114	If you Care foil aluminium 100% rcycld 50sf 1ea	1	Неклассифицированные/default	379303	If You Care
2605712	770009250453	If you Care foil aluminium 100% rcycld dsp	1	Неклассифицированные/default	379303	If You Care
2605713	770009250354	If you Care foil aluminium rcyld heavy duty dsp 48	1	Неклассифицированные/default	379303	If You Care
438494	770009010484	If you Care fsc certified compostable large baking cups - 60ct	1	Неклассифицированные/default	438493	wow!bab
608181	770009001123	If you Care fsc certified unbleached totally chlorine-free no. 2 size coffee filters - 100ct	1	Неклассифицированные/default	379303	If You Care
439321	770009001147	If you Care fsc certified unbleached totally chlorine-free no. 4 size coffee filters - 100ct	1	Неклассифицированные/default	439318	Yummy Earth
1021164	770009250286	If you Care Gloves household med 1pr 1ea	1	Неклассифицированные/default	379303	If You Care
225142	5412533001921	If you Care heavy duty aluminium foil - 100% recycled - 7mx40cm 12x1	33227	Материалы (folder)/Фольга	379303	If You Care
2605714	770009250293	If you Care household Gloves - large - 1 pair	1	Неклассифицированные/default	379303	If You Care
2605715	770009250279	If you Care household Gloves - small - 1 pair	1	Неклассифицированные/default	379303	If You Care
608182	770009250194	If you Care jumbo baking cups 24ct	1	Неклассифицированные/default	379303	If You Care
4431950	070009010485	If you Care larg baking cup 48ct	1	Неклассифицированные/default	0	
379306	5412533004618	If you Care large baking cups - unbleached 24x60 p #2	25023	Хозяйственные товары (folder)/Бытовая химия (folder)/Бытовая химия	363793	Ecover
4431951	776606913562	If you Care LG baking cups 48ct	1	Неклассифицированные/default	0	
210443	5412533004052	If you Care Mini baking cups 24x90 cups	25023	Хозяйственные товары (folder)/Бытовая химия (folder)/Бытовая химия	363793	Ecover
379307	5412533009033	If you Care no2 unbleached coffee Filter cone-style - small 12x100 p	315	Хозяйственные товары (folder)/Бытовая химия (folder)/Кондиционер для белья	363793	Ecover
379308	5412533003109	If you Care no4 unbleached coffee Filter cone-style - large 12x100 p #2	1	Неклассифицированные/default	379303	If You Care
439319	770009250262	If you Care paper snack&sandwich bags 100% unbleached 48bags	1426363	Хозяйственные товары (folder)/SANDWICH BAG	439318	Yummy Earth
223130	5412533002652	If you Care parchment paper - unbleached - 19.8mx33cm 12x1	25023	Хозяйственные товары (folder)/Бытовая химия (folder)/Бытовая химия	379303	If You Care
2605716	770009250507	If you Care parchment paper dsp 56pcs	1	Неклассифицированные/default	379303	If You Care
429484	770009250200	If you Care recycled aluminium foil - heavy duty 12x1	1	Неклассифицированные/default	429481	The GCHC
2605717	770009250521	If you Care sandwich bag dsp 42pcs	1	Неклассифицированные/default	379303	If You Care
608183	770009250613	If you Care sponge cloths - cellulose&cotton 12x5 p	1	Неклассифицированные/default	379303	If You Care
2605718	770009250248	If you Care sub/Mini baguette sandwich bags - paper - New! 12x30 p	1	Неклассифицированные/default	379303	If You Care
608177	770009011924	If you Care unbleached baking paper in sheets, 24-count boxes (pack of 12)	1	Неклассифицированные/default	379303	If You Care
2605719	770009250408	If you Care wax paper dsp 42pcs	1	Неклассифицированные/default	379303	If You Care
4431952	799615004915	If you dare	1	Неклассифицированные/default	0	
4431953	8788139046213	If you give a pig a pancake	1	Неклассифицированные/default	0	
4431954	978006026686	If you give a pig a pancake (book)	1	Неклассифицированные/default	0	
4431955	825766000206	If you have diabetes-comprehensive guide for Life (DVD/2 disc)	1	Неклассифицированные/default	0	
3673777	896599002149	If you see kay Red blnd 750m	1	Неклассифицированные/default	0	
4431956	037429183229	If you were young-rage (DVD/2.35/mono/1970/eng-sub)	1	Неклассифицированные/default	0	
4431957	884501146746	If you will - above the Earth ep	1	Неклассифицированные/default	0	
1499021	032076050184	If16-250-3n-20pr disconnect mf 16-14awg 20-153p	1	Неклассифицированные/default	0	
4431958	8480030831867	Ifa espa Ola s.a. 3.5oz White chocolate	1	Неклассифицированные/default	0	
4431959	8420078315004	Ifam w-15 padlocks 12pack 700g	1	Неклассифицированные/default	0	
4431960	032884150045	Ifant seat	1	Неклассифицированные/default	0	
2605722	888000984977	Ifantis eggplant w feta Cheese	1	Неклассифицированные/default	2605721	Ifantis
2605723	888000984861	Ifantis moussaka vegetarian	1	Неклассифицированные/default	2605721	Ifantis
4431961	023700675156	Ifb/s ckn bst all nt 7200-928 160oz	1	Неклассифицированные/default	0	
4431962	023700675163	Ifb/s ckn bst all nt 7202-928 72oz	1	Неклассифицированные/default	0	
608185	5281091021012	Ifco hommos tahina chickpeas dip 180g	1	Неклассифицированные/default	0	
4431963	097855009135	Ifeel mouseman optical USB	1	Неклассифицированные/default	0	
1021165	363044198622	Iferex 150 forte cap ud	1	Неклассифицированные/default	0	
1021166	363044203616	Iferex-150 caps ud	1	Неклассифицированные/default	0	
1021171	303383991010	Ifex (ifosfamide for injection, usp) baxter healthcare 1g	1	Неклассифицированные/default	0	
1021167	809080719303	Ifex 1g vial each	1	Неклассифицированные/default	0	
1021168	300150557417	Ifex 3g 1vl	1	Неклассифицированные/default	0	
1021169	809080719358	Ifex 3g vial each	1	Неклассифицированные/default	0	
1021170	300150556052	Ifex sdv 1g 0556-05	1	Неклассифицированные/default	0	
1021172	303383993014	Ifex sdv 3g 3993-01	1	Неклассифицированные/default	0	
1021173	300153556264	Ifex/mesnex	1	Неклассифицированные/default	0	
1021174	300153554277	Ifex/mesnex 1-1g kit	1	Неклассифицированные/default	0	
1021175	300153558411	Ifex/mesnex kit	1	Неклассифицированные/default	0	
1021176	300153559418	Ifex/mesnex kit #2	1	Неклассифицированные/default	0	
1021177	300153564153	Ifex/mesnex kit #3	1	Неклассифицированные/default	0	
2344185	9556589611065	Iffah Gold&Platinum Gel kontur mata 15g	1	Неклассифицированные/default	0	
2344186	9556589611010	Iffah Gold&Platinum Gel pengelupasan 40g	1	Неклассифицированные/default	0	
2344187	9556589611041	Iffah Gold&Platinum krim pelembab malam 40g	1	Неклассифицированные/default	0	
2344188	9556589611034	Iffah Gold&Platinum krim pencerah siang 40g	1	Неклассифицированные/default	0	
2344189	9556589611072	Iffah Gold&Platinum masker lembapan tidur 40g	1	Неклассифицированные/default	0	
2344190	9556589611003	Iffah Gold&Platinum pembersih muka 100g	1	Неклассифицированные/default	0	
2344191	9556589611089	Iffah Gold&Platinum pembersih muka 50g	1	Неклассифицированные/default	0	
2344192	9556589611058	Iffah Gold&Platinum pen&tanpa alkohol 90ml	1	Неклассифицированные/default	0	
2344193	9556589155699	Iffah Gold&Platinum promo p.malam	1	Неклассифицированные/default	0	
2344194	9556589155682	Iffah Gold&Platinum promo p.siang	1	Неклассифицированные/default	0	
2344195	9556589611027	Iffah Gold&Platinum serum 20g	1	Неклассифицированные/default	0	
4431964	873106001079	Iffco inc 24ct piccadeli - mango Juice * 8.75oz	1	Неклассифицированные/default	0	
4431965	873106001086	Iffco inc 8.75oz piccadeli - mango Juice	1	Неклассифицированные/default	0	
4431966	020459224420	Ifg	1	Неклассифицированные/default	0	
2605725	888000901479	Ifi gourmet choc drk shavings	1	Неклассифицированные/default	2605724	Ifi Gourmet
2605726	888000901486	Ifi gourmet choc wht shavings	1	Неклассифицированные/default	2605724	Ifi Gourmet
2605727	875000007775	Ifi gourmet Coconut flake swtnd	1	Неклассифицированные/default	2605724	Ifi Gourmet
2605728	676670002042	Ifi gourmet Cream puff vnlla Mini	1	Неклассифицированные/default	2605724	Ifi Gourmet
2605729	875900000067	Ifi gourmet donut sugar	1	Неклассифицированные/default	2605724	Ifi Gourmet
2605730	676670002011	Ifi gourmet eclair choc topped Mini	1	Неклассифицированные/default	2605724	Ifi Gourmet
2605731	600837560007	Ifi gourmet Mix Mousse neutral	1	Неклассифицированные/default	2605724	Ifi Gourmet
2605732	875900000029	Ifi gourmet seed poppy	1	Неклассифицированные/default	2605724	Ifi Gourmet
2605733	875900000036	Ifi gourmet seed sesame wht hulled	1	Неклассифицированные/default	2605724	Ifi Gourmet
2605734	875900000074	Ifi gourmet sugar White Crystal AA	1	Неклассифицированные/default	2605724	Ifi Gourmet
4431967	711888319664	Ifile poly folder Lemon Color	1	Неклассифицированные/default	0	
4431969	074345734999	Ifit universal ipod connector #258819	1	Неклассифицированные/default	0	
4431970	085391159858	Ifl-championship 2007 (DVD)	1	Неклассифицированные/default	0	
4431971	085391159841	Ifl-greatest knockouts&Extreme Action (DVD)	1	Неклассифицированные/default	0	
2344197	854503002005	Ifn athletic multi, 56 caps	204841	Лекарственные средства (folder)/Витамины и минералы	2344196	iForce Nutrition
2344198	854503001398	Ifn tribulus 2400, 90 caps	279363	Продукты питания (folder)/Специальное и спортивное питание/Специальные продукты	2344196	iForce Nutrition
2344199	854503001725	Ifn tt 33, 90 caps	2279915	Продукты питания (folder)/Специальное и спортивное питание/Жиросжигатели	2344196	iForce Nutrition
2344200	4856951578060	Ifone candy 24pcs	1	Неклассифицированные/default	0	
3537553	8936057701015	Ifood ostro-zhguchiy sauce chilli p bo 0.2kg	545856	Продукты питания (folder)/Соус	3673778	IFOOD (HERO GREEN COMPANY LIMITED)
3537554	8936057701022	Ifood острый sauce chilli p bo 0.2kg	545856	Продукты питания (folder)/Соус	3673778	IFOOD (HERO GREEN COMPANY LIMITED)
1021178	310019926025	Ifosfam sdv 3g bax 75ml	1	Неклассифицированные/default	0	
1021179	307033427119	Ifosfam sdv 50mg/ml sic 20ml@	1	Неклассифицированные/default	0	
1021180	307033429113	Ifosfam sdv 50mg/ml sic 60ml@	1	Неклассифицированные/default	0	
1021181	363323142100	Ifosfam vial 1g app 30ml	1	Неклассифицированные/default	0	
1021182	307034100486	Ifosfam/mesna sic kit@	1	Неклассифицированные/default	0	
1021183	307034100585	Ifosfam/mesna sic kit@ #2	1	Неклассифицированные/default	0	
1021184	307034100684	Ifosfam/mesna tev kit@	1	Неклассифицированные/default	0	
2344201	063323142109	Ifosfamide 1g sdv 30ml	1	Неклассифицированные/default	2278715	APP
1021185	310019925011	Ifosfamide 30ml	1	Неклассифицированные/default	0	
1499022	300694495220	Ifosfamide inj 50mg/ml 20ml	1	Неклассифицированные/default	0	
1499023	300694496227	Ifosfamide inj 50mg/ml 60ml	1	Неклассифицированные/default	0	
2344202	063323142123	Ifosfamide n+ 1g sdv 30ml	1	Неклассифицированные/default	2278715	APP
1021186	070341005842	Ifosfamide/mes 1-1g	1	Неклассифицированные/default	0	
1021187	070341004852	Ifosfamide/mesna 1-1	1	Неклассифицированные/default	0	
1021188	070341006832	Ifosfamide/mesna 3-1	1	Неклассифицированные/default	0	
2157508	4806524219654	Ifp bag o'joy snack pack per pack	18673	Продукты питания (folder)/Чипсы и снэки	0	
1730277	4806524219630	Ifp Halloween asstd chocolates/pack	19677	Продукты питания (folder)/Кондитерские изделия (folder)/Шоколад	0	
1499024	4809011292192	Ifp lumpia shanghai cereal Cheese-24's	18673	Продукты питания (folder)/Чипсы и снэки	0	
1499025	4809011292215	Ifp lumpia shanghai cereal choco-24's	18673	Продукты питания (folder)/Чипсы и снэки	0	
1499026	4809011292246	Ifp lumpia shanghai cereal lfln-24's	18673	Продукты питания (folder)/Чипсы и снэки	0	
2605736	811275016494	Ifrogz - luxe case - etui rigide pour ipod Touch 4g - teal/Noir	1	Неклассифицированные/default	0	
2605737	811275012243	Ifrogz casque ferme earpollution cs40 - Blue	1	Неклассифицированные/default	0	
2605738	811275012250	Ifrogz casque ferme earpollution cs40 - pink	1	Неклассифицированные/default	0	
2605739	811275012236	Ifrogz casque ferme earpollution cs40 - Red	1	Неклассифицированные/default	0	
2605740	811275012502	Ifrogz casque ferme earpollution nerve pipe fuzzy - graffiti-blk/Gold	1	Неклассифицированные/default	0	
2605741	811275015022	Ifrogz casque ferme mogul - snow machine	1	Неклассифицированные/default	0	
2605742	811275015039	Ifrogz casque ferme mogul - stealth	1	Неклассифицированные/default	0	
2605743	811275015046	Ifrogz casque ferme ronin - brightblue/Red	1	Неклассифицированные/default	0	
2603270	811275010737	Ifrogz coque bicolore Rose et Noir luxe iphone 3g 3gs	1	Неклассифицированные/default	177134	Hewlett Packard
2549340	811275010577	Ifrogz earpollution toxix - hoofdtelefoon (oorkap) - goud	1	Неклассифицированные/default	0	
2605744	811275014742	Ifrogz housse ipad softgloss transparent	1	Неклассифицированные/default	0	
1741307	811275016487	Ifrogz it4lo-gmt/blk luxe Original for ipod Touch 4g - iron/Black	1741292	Техника (folder)/Электротехника/Цифровая техника (folder)/Mobile Electronics	0	
4431972	888063975035	Ifrogz myfrogz iphone case	1	Неклассифицированные/default	0	
1741308	811275011048	Ifrogz Touch luxe case for ipod Touch 2g, 3g (Red/Black)	1741292	Техника (folder)/Электротехника/Цифровая техника (folder)/Mobile Electronics	0	
2605735	811275011949	Ifr_chargercar_red chargeur allume-cigare USB Rouge	1	Неклассифицированные/default	0	
4431973	043289009753	Ig 9inch paneld bud vase #00975 1ct	1	Неклассифицированные/default	0	
4431974	043289008367	Ig fl illusions gingr #00836	1	Неклассифицированные/default	0	
2157510	672935310075	Ig hand sanitizer w/moist 8oz	1382000	Гигиена (folder)/HAND SANITIZER	0	
4431975	043289057211	Ig ivy Bowl Crystal 4.5inch diam	1	Неклассифицированные/default	0	
4431976	018894220954	Ig y towels 24/1/96 96ct	1	Неклассифицированные/default	0	
4432589	781164990429	Ig-mod records CD Michael zilber: two coasts	1	Неклассифицированные/default	0	
4432590	781164980529	Ig-mod records CD tom dempsey: blues in the slope	1	Неклассифицированные/default	0	
4432591	781164970124	Ig-mod records doug hall three wishes CD	1	Неклассифицированные/default	0	
4431977	041270461283	Iga 0.5 ga ic chocolate	1	Неклассифицированные/default	379310	IGA
4431978	041270460972	Iga 0.5 ga ic chocolate chi	1	Неклассифицированные/default	379310	IGA
4431979	041270461184	Iga 0.5 ga ic chocolate swi	1	Неклассифицированные/default	379310	IGA
4431980	041270020268	Iga 0.5 ga ic cookies n cre	1	Неклассифицированные/default	379310	IGA
4431981	041270461443	Iga 0.5 ga ic neopolitan	1	Неклассифицированные/default	379310	IGA
4431982	041270461689	Iga 0.5 ga ic strawberry	1	Неклассифицированные/default	379310	IGA
4431983	041270461023	Iga 0.5 ga ic tin roof sund	1	Неклассифицированные/default	379310	IGA
4431984	041270462006	Iga 0.5 ga Ice Cream vanill	1	Неклассифицированные/default	379310	IGA
2344244	041270058445	Iga 0.5 ga Milk 3.25 homg e	67200	Продукты питания (folder)/Молочные продукты (folder)/Молоко, сливки	379310	IGA
4431985	041270460927	Iga 0.5 ga mint chocolate c	1	Неклассифицированные/default	379310	IGA
3137670	041270025447	Iga 0.53oz cocoa Mix sf/Hot	330591	Продукты питания (folder)/Продукты питания	379310	IGA
4431986	041270038874	Iga 0.75oz parsley flakes	1	Неклассифицированные/default	379310	IGA
3137491	041270040617	Iga 0.875oz gravy Mix brown	330591	Продукты питания (folder)/Продукты питания	379310	IGA
4431987	041270791687	Iga 1 big rl sas Ultra ppr tw 165ct	1	Неклассифицированные/default	379310	IGA
4431988	041270791366	Iga 1 big roll towel 105ct	1	Неклассифицированные/default	379310	IGA
