ID	UPCEAN	Name	CategoryID	CategoryName	BrandID	BrandName
3346086	4612729496963	Клубника Золото глобуса отборная в легком сиропе 530г ст/б	1	Неклассифицированные/default	0	
3346087	4620749622101	Клубника и зимой и летом замороженная 400г мяг/уп	1	Неклассифицированные/default	0	
40969	4607025800149	Клубника и черника эко продукт протертые с сахаром стб твист 325мл	22284	Продукты питания (folder)/Консервы (folder)/Консервы фруктовые	37563	Эко Продукт
65675	4002442110855	Клубника иска в сиропе жб 820г	22284	Продукты питания (folder)/Консервы (folder)/Консервы фруктовые	36688	Иска
155239	05850099	Клубника Испания 1 упаковка	36707	Продукты питания (folder)/Фрукты свежие	0	
3346088	4612497002359	Клубника кантарелла свежезамороженная 300г м/у	1	Неклассифицированные/default	0	
3346089	4670010540412	Клубника карнавал в легком сиропе 530г стекло	1	Неклассифицированные/default	0	
3346090	4670010540405	Клубника карнавал в легком сиропе жб 425мл	1	Неклассифицированные/default	0	
3346091	4670010540429	Клубника карнавал в легком сиропе жб 850мл	1	Неклассифицированные/default	0	
2871022	6911072955546	Клубника консерватор 0.410	1	Неклассифицированные/default	0	
2871023	6918605955516	Клубника консерватор 0.425	1	Неклассифицированные/default	0	
2871024	6918605955530	Клубника консерватор 0.700	1	Неклассифицированные/default	0	
2871025	6918605955523	Клубника консерватор 0.850	1	Неклассифицированные/default	0	
3346092	4620759205615	Клубника консервлэнд в легком сиропе 580мл стекло	1	Неклассифицированные/default	0	
726612	4606530472100	Клубника кормилица компотная 425мл	1	Неклассифицированные/default	673827	Кормилица
726613	4607160462653	Клубника краски лета с/м 0.3кг	3605983	Продукты питания (folder)/Овощи и фрукты замороженные	673757	Краски Лета
726614	4607160460253	Клубника краски лета с/м 0.4кг	3605983	Продукты питания (folder)/Овощи и фрукты замороженные	673757	Краски Лета
4842686	4741513040058	Клубника красная 10см 04005	542785	Товары для праздников (folder)/Украшение новогоднее	4833197	Карлсбах
3840541	6944190900457	Клубника красная цена 400г #2	2230206	Продукты питания (folder)/Ягоды замороженые	3391836	Красная Цена
3840545	6944190900396	Клубника красная цена замороженная 900г #4	2230206	Продукты питания (folder)/Ягоды замороженые	3391836	Красная Цена
155240	07750007	Клубника круглый год 0.450	988413	Продукты питания (folder)/Фрукты и овощи	0	
29358	4607176890501	Клубника круглый год 400г	3605983	Продукты питания (folder)/Овощи и фрукты замороженные	29295	КАЙРОС
3842191	6944190907296	Клубника круглый год аппетитно б/зам.400г #2	2230206	Продукты питания (folder)/Ягоды замороженые	3795503	Круглый год аппетитно
2871026	4607127411472	Клубника кулинар туризм 0.400	1	Неклассифицированные/default	0	
3346093	4607037240261	Клубника лесное чудо, замороженная, 300г м/у	1	Неклассифицированные/default	0	
3346094	6922907402210	Клубника Любимый бегемот в сладком сиропе 1500мл с/бан.	1	Неклассифицированные/default	0	
3346095	4620748760101	Клубника Любимый медведь в сладком серопе жб 425мл	1	Неклассифицированные/default	0	
65680	0880730140548	Клубника лютик в сиропе жб 825г	22284	Продукты питания (folder)/Консервы (folder)/Консервы фруктовые	36994	Lutik
3346096	4620018841332	Клубника мака протертая с сахаром 800г пл/уп	1	Неклассифицированные/default	0	
3346097	4630009767497	Клубника мариайс быстрозамороженная 300г мяг/уп	1	Неклассифицированные/default	0	
2442872	4620748760118	Клубника медведь Любимый 580мл ст/б	22284	Продукты питания (folder)/Консервы (folder)/Консервы фруктовые	2416568	Медведь Любимый
3346098	4620748766769	Клубника медведь Любимый протертая с сахаром 320г	1	Неклассифицированные/default	0	
3520010	7930041235631	Клубника медовое лето крупноплодная 5шт цв/п 1/ сибирский Сад Россия	324395	Растениеводство/Семена	821399	Сибирский Сад
2871027	4607030005119	Клубника медовый дом дробленая 290г с/б	1	Неклассифицированные/default	0	
726617	4610007561037	Клубника Мона Лиза 1кг	36707	Продукты питания (folder)/Фрукты свежие	726616	Акция
3346099	4620749682761	Клубника мэйсан протертая с сахаром 300г стекло	1	Неклассифицированные/default	0	
3346100	4607182345774	Клубника нерия-торг замороженная 300г м/уп	1	Неклассифицированные/default	0	
3346101	6938596320360	Клубника овощной огород в легком сиропе жб 425мл	1	Неклассифицированные/default	0	
65683	5902019003247	Клубника огород, 400г м/у	3605983	Продукты питания (folder)/Овощи и фрукты замороженные	39709	Огород
2442873	4607088056347	Клубника огородников в сиропе жб 0.410	1229537	Продукты питания (folder)/Консервы (folder)/Консервы	28177	Огородников
65650	8400047033504	Клубника пл.кор. 250г (тропик)	36707	Продукты питания (folder)/Фрукты свежие	0	
3346102	4607070251446	Клубника планета витаминов 1кг	1	Неклассифицированные/default	0	
2235483	8857122511141	Клубника планета витаминов в шоколаде 227г к/кор.	2230206	Продукты питания (folder)/Ягоды замороженые	2221953	Планета Витаминов
3346103	6941278000252	Клубника Премиум в сиропе 425мл	1	Неклассифицированные/default	0	
2871028	4603533004468	Клубника примьера протертая с сахаром 900г ведро	1	Неклассифицированные/default	0	
3346104	6939256801397	Клубника прозапас в сиропе 580мл стекло/винт	1	Неклассифицированные/default	0	
726619	4606180007240	Клубника протертая с сахаром (гп ст/б)(упак 12) 550г	1	Неклассифицированные/default	50305	Главпродукт
23620	4810484007039	Клубника протертая с сахаром 0.5	1	Неклассифицированные/default	0	
2871030	4606735772319	Клубника протертая с сахаром 0.5 #2	1	Неклассифицированные/default	0	
1204857	4620001500710	Клубника протертая с сахаром 0.55кг ст/тв Россия арт. 471 Минск ООО лайтфуд	1	Неклассифицированные/default	0	
726620	4606180010004	Клубника протертая с сахаром 330г гп ст/б	1	Неклассифицированные/default	50305	Главпродукт
3346105	4627088584206	Клубника протертая с сахаром 400г ст/б	1	Неклассифицированные/default	0	
3346106	4607102630287	Клубника протертая с сахаром 550г ст б	1	Неклассифицированные/default	0	
3346107	4607174423015	Клубника протертая с сахаром 550г ст б #2	1	Неклассифицированные/default	0	
726618	4607091973211	Клубника протертая с сахаром 650г с/б невские купола	22284	Продукты питания (folder)/Консервы (folder)/Консервы фруктовые	50148	Невские купола
2860829	4612634500847	Клубника протертая с сахаром 900г ведро отборная ягода	1	Неклассифицированные/default	0	
2871029	4603533005137	Клубника протертая с сахаром doypack 500г	1	Неклассифицированные/default	0	
3346108	4612588501549	Клубника протертая с сахаром голд чойс 600г	1	Неклассифицированные/default	0	
1672210	4630007730448	Клубника протертая с сахаром господин витамин ст/б т/офф 12x 550г	22284	Продукты питания (folder)/Консервы (folder)/Консервы фруктовые	0	
2442875	4603533004437	Клубника протертая с сахаром премьер с/б 0.550	261517	Продукты питания (folder)/Варенье и джемы	0	
2442876	4620002290160	Клубника протертая с сахаром с/б 0.600	261517	Продукты питания (folder)/Варенье и джемы	0	
1224542	4607091973037	Клубника протертая с сахаром ст/б 0.650	261517	Продукты питания (folder)/Варенье и джемы	0	
2442874	4813194001540	Клубника протертая с сахаром твб 540г	1	Неклассифицированные/default	0	
726621	4607039093094	Клубника протертая с сахаром твист богородская трапеза 420г	1	Неклассифицированные/default	22681	Богородская трапеза
4842687	4627105441628	Клубника псков 500г	2228838	Продукты питания (folder)/Ягоды свежие	0	
1840088	4607053290363	Клубника ранет протертая с сахаром 600г ст/б	22284	Продукты питания (folder)/Консервы (folder)/Консервы фруктовые	0	
822509	7930041233996	Клубника ремонтантная тристар крупноплодная 10шт цв/п 1/ (сибирский Сад) Россия минимум	324395	Растениеводство/Семена	821399	Сибирский Сад
822510	4601729027161	Клубника ремонтантная флориан крупноплодная f1 (2014) 5шт цв/п 1/ (а) Россия	324395	Растениеводство/Семена	0	
3822204	6223000990025	Клубника Россия 250г	3647474	Продукты питания (folder)/Ягоды	3822202	КЛУБНИКА
3822205	6224000487010	Клубника Россия 250г #2	3647474	Продукты питания (folder)/Ягоды	3822202	КЛУБНИКА
65684	4607018591504	Клубника россо 200г	25936	Продукты питания (folder)/Сухофрукты	0	
3346109	4607817140712	Клубника Русский холод свежемороженная, 400г мяг/уп	1	Неклассифицированные/default	0	
3346110	4607031411308	Клубника русь восточная в легком сиропе жб 425мл	1	Неклассифицированные/default	0	
3346111	4607031411292	Клубника русь восточная отборная в легком сиропе жб 820г	1	Неклассифицированные/default	0	
85514	4607034700508	Клубника с клубникой мороженое пломбир 17% 1/1/1300г	30752	Продукты питания (folder)/Мороженое	37988	Престиж
2871031	4607149580286	Клубника с натур ароматом земляника з.м.ж. 12% в ваф стаканчике 80г п/эт 1/30шт	1	Неклассифицированные/default	0	
2871032	9900000057114	Клубника с шокол.кремом 350г	1	Неклассифицированные/default	0	
2442878	6924516500813	Клубника санфил в сиропе с/б 0.580	1229537	Продукты питания (folder)/Консервы (folder)/Консервы	1713783	Sunfeel
65694	4602891000396	Клубника св/замороженная эликом 0.400	3605983	Продукты питания (folder)/Овощи и фрукты замороженные	0	
65661	5903154540277	Клубника св/м бауер 0.450	3605983	Продукты питания (folder)/Овощи и фрукты замороженные	0	
65693	5907431380099	Клубника св/м хортино 0.450	3605983	Продукты питания (folder)/Овощи и фрукты замороженные	50801	Хортино
3346112	4607193010340	Клубника свой урожай быстрозамороженная 300г м/у	1	Неклассифицированные/default	0	
65685	7290011181239	Клубника сердечко 300г	36707	Продукты питания (folder)/Фрукты свежие	0	
65686	8437005016002	Клубника сердце 340г	36707	Продукты питания (folder)/Фрукты свежие	0	
2442880	4607067551061	Клубника скатерть-самобранка сироп отбор жб 0.820	1229537	Продукты питания (folder)/Консервы (folder)/Консервы	36738	Скатерть-Самобранка
1672211	4620762990171	Клубника со сгущенкой 5 баллов йошкар-ола ту 8.5% пэт/б 30x 500г	1	Неклассифицированные/default	0	
3822207	4607111910387	Клубника со сливками (akkond/cheb.) cr&strawberry hf 1kg	22145	Продукты питания (folder)/Кондитерские изделия (folder)/Конфеты	3822206	клубника со сливками (AKKOND/CHEBOKSARY)
3822208	4670014400361	Клубника со сливками (akkond/cheb.) cr&strawberry hf 1kg #2	22145	Продукты питания (folder)/Кондитерские изделия (folder)/Конфеты	3822206	клубника со сливками (AKKOND/CHEBOKSARY)
3822209	4670014404109	Клубника со сливками (akkond/cheb.) cr&strawberry hf 1kg #3	22145	Продукты питания (folder)/Кондитерские изделия (folder)/Конфеты	3822206	клубника со сливками (AKKOND/CHEBOKSARY)
3822211	4607112701649	Клубника со сливками (kdv) cr&strawberry hf 0.25kg s	22145	Продукты питания (folder)/Кондитерские изделия (folder)/Конфеты	3822210	клубника со сливками (KDV ( KONDITERSKIY DOM VOSTOK))
3822212	4607112704428	Клубника со сливками (kdv) cr&strawberry hf 0.25kg s #2	22145	Продукты питания (folder)/Кондитерские изделия (folder)/Конфеты	3822210	клубника со сливками (KDV ( KONDITERSKIY DOM VOSTOK))
3822213	4607054124964	Клубника со сливками (kdv) cr&strawberry hf 1kg	22145	Продукты питания (folder)/Кондитерские изделия (folder)/Конфеты	3822210	клубника со сливками (KDV ( KONDITERSKIY DOM VOSTOK))
3822214	4640005651928	Клубника со сливками (kdv) cr&strawberry hf 1kg #2	22145	Продукты питания (folder)/Кондитерские изделия (folder)/Конфеты	3822210	клубника со сливками (KDV ( KONDITERSKIY DOM VOSTOK))
3822216	4606115005020	Клубника со сливками (konfil/volg.) cr&strawberry hf 1kg	22145	Продукты питания (folder)/Кондитерские изделия (folder)/Конфеты	3822215	клубника со сливками (KONFIL/VOLGOGRAD)
3822217	4606115012844	Клубника со сливками (konfil/volg.) cr&strawberry hf 1kg #2	22145	Продукты питания (folder)/Кондитерские изделия (folder)/Конфеты	3822215	клубника со сливками (KONFIL/VOLGOGRAD)
3822218	4606115016477	Клубника со сливками (konfil/volg.) cr&strawberry hf 1kg #3	22145	Продукты питания (folder)/Кондитерские изделия (folder)/Конфеты	3822215	клубника со сливками (KONFIL/VOLGOGRAD)
3822219	4606115021747	Клубника со сливками (konfil/volg.) cr&strawberry hf 1kg #4	22145	Продукты питания (folder)/Кондитерские изделия (folder)/Конфеты	3822215	клубника со сливками (KONFIL/VOLGOGRAD)
3334315	4600795010541	Клубника со сливками (konti) cr&strawberry hf 1kg	37145	Продукты питания (folder)/Кондитерские изделия (folder)/Карамель	3476704	Konti
3822221	4607070750826	Клубника со сливками (konti) cr&strawberry hf 1kg #2	22145	Продукты питания (folder)/Кондитерские изделия (folder)/Конфеты	3822220	клубника со сливками (KONTI)
3822222	4607084362244	Клубника со сливками (konti) cr&strawberry hf 1kg #3	22145	Продукты питания (folder)/Кондитерские изделия (folder)/Конфеты	3822220	клубника со сливками (KONTI)
3822223	4607193771418	Клубника со сливками (konti) cr&strawberry hf 1kg #4	22145	Продукты питания (folder)/Кондитерские изделия (folder)/Конфеты	3822220	клубника со сливками (KONTI)
3822224	4610003021627	Клубника со сливками (konti) cr&strawberry hf 1kg #5	22145	Продукты питания (folder)/Кондитерские изделия (folder)/Конфеты	3822220	клубника со сливками (KONTI)
3822225	4650057450752	Клубника со сливками (konti) cr&strawberry hf 1kg #6	22145	Продукты питания (folder)/Кондитерские изделия (folder)/Конфеты	3822220	клубника со сливками (KONTI)
3822227	4640005652864	Клубника со сливками (rakhat/kazk) cr&strawberry hf 1kg	22145	Продукты питания (folder)/Кондитерские изделия (folder)/Конфеты	3822226	клубника со сливками (RAKHAT/KAZAKHSTAN)
3822228	4870036006842	Клубника со сливками (rakhat/kazk) cr&strawberry hf 1kg #2	22145	Продукты питания (folder)/Кондитерские изделия (folder)/Конфеты	3822226	клубника со сливками (RAKHAT/KAZAKHSTAN)
3822230	4627091003794	Клубника со сливками (roshen) cr&strawberry hf 1kg	22145	Продукты питания (folder)/Кондитерские изделия (folder)/Конфеты	3822229	клубника со сливками (ROSHEN)
3822231	7777000036997	Клубника со сливками (roshen) cr&strawberry hf 1kg #2	22145	Продукты питания (folder)/Кондитерские изделия (folder)/Конфеты	3822229	клубника со сливками (ROSHEN)
2765611	4610011181863	Клубника спело зрело протертая с сахаром 320г ст/б	22284	Продукты питания (folder)/Консервы (folder)/Консервы фруктовые	2419076	Спело Зрело
3346113	4610011180378	Клубника спело зрело протертая с сахаром 340г ст/б	1	Неклассифицированные/default	2419076	Спело Зрело
726622	8715512000753	Клубника суприма голд 500г	36707	Продукты питания (folder)/Фрукты свежие	0	
2442881	4607091199017	Клубника суш орехо-град 0.150	25936	Продукты питания (folder)/Сухофрукты	0	
3346114	4603019003541	Клубника сушеная 130г м/у	1	Неклассифицированные/default	0	
3346115	4620002230203	Клубника сушеная дар солнца 200г	1	Неклассифицированные/default	0	
3822232	8717496040053	Клубника США 450г	3647474	Продукты питания (folder)/Ягоды	3822202	КЛУБНИКА
726623	4607008173963	Клубника термер сушеная 25г	25936	Продукты питания (folder)/Сухофрукты	51635	Термер
155241	5999002630665	Клубника топ тэн в сиропе жб 0.425	1229537	Продукты питания (folder)/Консервы (folder)/Консервы	0	
1963128	6934541101664	Клубника топ-тен в сиропе 0.425 1/24	1	Неклассифицированные/default	0	
3346116	4620001503223	Клубника торгус потертая в сахаром 300г с/б	1	Неклассифицированные/default	0	
65687	4607073410093	Клубника туесок гурмана с/м 450г	3605983	Продукты питания (folder)/Овощи и фрукты замороженные	0	
3346117	4607168991339	Клубника тульский продукт протертая с сахаром 550г ст/б	1	Неклассифицированные/default	0	
3346118	6941278000405	Клубника ты и я 560г ст/б	1	Неклассифицированные/default	0	
3346119	6941278000221	Клубника ты и я в сиропе 425г	1	Неклассифицированные/default	0	
3346120	6941278000207	Клубника ты и я в сиропе жб 850г	1	Неклассифицированные/default	0	
3346121	6938519400742	Клубника ты и я в сиропе консервированная 1500мл ст/б	1	Неклассифицированные/default	0	
2442882	5901028100053	Клубника фелко св/м 0.450	39904	Продукты питания (folder)/Полуфабрикаты овощные замороженные	0	
1672212	8606006081702	Клубника фриком зам.300г	3605983	Продукты питания (folder)/Овощи и фрукты замороженные	1660344	Фриком
65690	5901828000225	Клубника фритар с/м 450г	3605983	Продукты питания (folder)/Овощи и фрукты замороженные	0	
3346122	4603533005182	Клубника Царь ягода протертая с сахаром 900г	1	Неклассифицированные/default	0	
4842689	4678599540038	Клубника чистоягода 250г	2228838	Продукты питания (folder)/Ягоды свежие	4842688	ЧистоЯгода
3346124	4612588503055	Клубника юлианна протертая с сахаром 1000г	1	Неклассифицированные/default	0	
5011734	9789851716018	Клубничка первая раскраска малыша (новая	457262	Полиграфия (folder)/Раскраска	4969482	Книжный Дом
1224543	4810677011478	Клубнично-яблочный с мякотью 730мл,то Беларусь	1	Неклассифицированные/default	0	
2871033	4607034700744	Клубничное мороженое пломбир классика 12% 1/1/2250г	30752	Продукты питания (folder)/Мороженое	0	
686222	6924516500561	Клубничное санберри варенье 435г ст/б	261517	Продукты питания (folder)/Варенье и джемы	40931	Санберри
26985	8410727001235	Клубничный джем Eva стекло	1	Неклассифицированные/default	0	
2235484	4606066171348	Клумба-кашпо природа 56x20 x 35см	2228248	Растениеводство/Садовые предметы интерьера	3768891	VILLAGE PEOPLE
2235485	4606066171331	Клумба-кашпо природа 76x20 x 35см	2228248	Растениеводство/Садовые предметы интерьера	3768891	VILLAGE PEOPLE
230879	4823056612364	Клупп maxtool для нарезания резьбы, 1-1/4inch	41797	Инструменты (folder)/Инструмент	225652	MaxTool
230877	4823056612340	Клупп maxtool для нарезания резьбы, 1/2inch	41797	Инструменты (folder)/Инструмент	225652	MaxTool
230878	4823056612326	Клупп maxtool для нарезания резьбы, 1/4inch	41797	Инструменты (folder)/Инструмент	225652	MaxTool
