ID	UPCEAN	Name	CategoryID	CategoryName	BrandID	BrandName
137695	9062300105817	Чай Hipp из фенхеля с 4-го мес 200g	135886	Продукты питания (folder)/Чай и кофе/Чай детский	206888	Hipp
137704	9062300109839	Чай Hipp из черники с 6 месяцев (хипп) 200g	135886	Продукты питания (folder)/Чай и кофе/Чай детский	206888	Hipp
378134	9062300039211	Чай Hipp их фенхеля с 4-го мес 200g	22738	Продукты питания (folder)/Детское питание (folder)/Детское питание	206888	Hipp
1824158	9062300039617	Чай Hipp лип.цвет с мелис.с 4-х мес.200g	497666	Продукты питания (folder)/Напитки безалкогольные/Сок детский	206888	Hipp
168814	9062300105763	Чай Hipp липовый с 4-го мес 200g	22738	Продукты питания (folder)/Детское питание (folder)/Детское питание	206888	Hipp
137699	9062300105848	Чай Hipp от кашля с 4 мес 200g	135886	Продукты питания (folder)/Чай и кофе/Чай детский	206888	Hipp
137700	9062300039716	Чай Hipp от кашля с 4-го месяца 200g	135886	Продукты питания (folder)/Чай и кофе/Чай детский	206888	Hipp
168815	4062300040717	Чай Hipp фенхелевый с 1-го мес 100g	22738	Продукты питания (folder)/Детское питание (folder)/Детское питание	206888	Hipp
2012546	9062300127772	Чай Hipp фруктовый для кормящих мам 200g 2346	21794	Продукты питания (folder)/Чай и кофе/Чай	206888	Hipp
541111	9062300114420	Чай Hipp черная смородина с клубникой с 6 месяцев (хипп) 200g	22738	Продукты питания (folder)/Детское питание (folder)/Детское питание	206888	Hipp
1338721	4792007917189	Чай hotlips biak 25пак.*2g	21794	Продукты питания (folder)/Чай и кофе/Чай	0	
223702	7610313901081	Чай hrblhlth jandevrs bioforce 25bags	276607	Продукты питания (folder)/Чай и кофе/Фиточай	210260	Bioforce
137830	4031244730404	Чай humana still-tee для повышения лактации для кормящих грудью мам 200g	135886	Продукты питания (folder)/Чай и кофе/Чай детский	378850	Humana
277547	4791045001102	Чай Hyleys 100% черный цейлонский с/н 100пак*1.5g	21794	Продукты питания (folder)/Чай и кофе/Чай	137832	Hyleys
5102620	4607807011145	Чай Hyleys 1001 мистери, черный листовой с добавками, 100g	21794	Продукты питания (folder)/Чай и кофе/Чай	137832	Hyleys
5102621	4607807011190	Чай Hyleys 1001 мистери, черный листовой с добавками, жб, 100g	21794	Продукты питания (folder)/Чай и кофе/Чай	137832	Hyleys
2945967	4791045012214	Чай Hyleys 100g черный с малиной	21794	Продукты питания (folder)/Чай и кофе/Чай	137832	Hyleys
2945968	4791045012238	Чай Hyleys 100g черный шип/каркадэ	21794	Продукты питания (folder)/Чай и кофе/Чай	137832	Hyleys
2498399	4607807010070	Чай Hyleys 25 пак черн гордость англии	21794	Продукты питания (folder)/Чай и кофе/Чай	137832	Hyleys
2945970	4607807010063	Чай Hyleys 25 пак черн горный юньнань	21794	Продукты питания (folder)/Чай и кофе/Чай	137832	Hyleys
2945972	4791045012597	Чай Hyleys 25 пак черный с душицей	21794	Продукты питания (folder)/Чай и кофе/Чай	137832	Hyleys
2945973	4791045012153	Чай Hyleys 25 пак черный с липой	21794	Продукты питания (folder)/Чай и кофе/Чай	137832	Hyleys
3940775	4791045012573	Чай Hyleys 9 вкусов ассорти 100x1.5g	21794	Продукты питания (folder)/Чай и кофе/Чай	137832	Hyleys
137833	4791045003021	Чай Hyleys c новым годом жб 340g	21794	Продукты питания (folder)/Чай и кофе/Чай	137832	Hyleys
1338723	4791045010838	Чай Hyleys c новым годом новог.матрешки 100g туба	21794	Продукты питания (folder)/Чай и кофе/Чай	137832	Hyleys
277585	4791045001577	Чай Hyleys earl gray 100g/50	21794	Продукты питания (folder)/Чай и кофе/Чай	137832	Hyleys
137892	4791045002246	Чай Hyleys earl gray жб 100g	21794	Продукты питания (folder)/Чай и кофе/Чай	137832	Hyleys
137893	4791045003373	Чай Hyleys earl gray жб 125g/16	21794	Продукты питания (folder)/Чай и кофе/Чай	137832	Hyleys
277586	4791045002253	Чай Hyleys earl gray жб 200g	21794	Продукты питания (folder)/Чай и кофе/Чай	137832	Hyleys
277587	4791045002192	Чай Hyleys earl gray ф/п 2g*20 конв.	21794	Продукты питания (folder)/Чай и кофе/Чай	137832	Hyleys
277589	4791045003571	Чай Hyleys earl gray ф/п конв 2g*500	21794	Продукты питания (folder)/Чай и кофе/Чай	137832	Hyleys
3673229	4791045012405	Чай Hyleys earl grey pk 0.2kg bl lft #2	21794	Продукты питания (folder)/Чай и кофе/Чай	137832	Hyleys
3673230	4791045001515	Чай Hyleys earl grey pk 25tb 50g bl	21794	Продукты питания (folder)/Чай и кофе/Чай	137832	Hyleys
137891	4791045001775	Чай Hyleys earl grey байхов черн 25x 2g к/к	21794	Продукты питания (folder)/Чай и кофе/Чай	137832	Hyleys
277588	4791045003236	Чай Hyleys earl grey крупнолист. 20пак*2.5g (шри-ланка)	21794	Продукты питания (folder)/Чай и кофе/Чай	137832	Hyleys
137890	4791045003182	Чай Hyleys earl grey особокрупнолистовой черн 100g к/к	21794	Продукты питания (folder)/Чай и кофе/Чай	137832	Hyleys
3583934	4607807010407	Чай Hyleys earl grey черный крупнолистовой бергамот 100g к/к	21794	Продукты питания (folder)/Чай и кофе/Чай	137832	Hyleys
3673228	4607807010216	Чай Hyleys earl grey черный крупнолистовой, 200g	21794	Продукты питания (folder)/Чай и кофе/Чай	137832	Hyleys
2945982	4791045011286	Чай Hyleys emotlons нежность + любовь ассорти жб 100g	21794	Продукты питания (folder)/Чай и кофе/Чай	137832	Hyleys
2945984	4791045011293	Чай Hyleys emotlons экстаз+страсть жб 100g	21794	Продукты питания (folder)/Чай и кофе/Чай	137832	Hyleys
169006	4791045006220	Чай Hyleys for you подарочный черн жб 125g	21794	Продукты питания (folder)/Чай и кофе/Чай	137832	Hyleys
3583935	4607807011152	Чай Hyleys Golden assam черный среднелистовой высший сорт мягуп 100g	21794	Продукты питания (folder)/Чай и кофе/Чай	137832	Hyleys
2945979	4791045011712	Чай Hyleys nov.god&rozhd&Star.nov.god assrtd b 0.135kg Mix lft	21794	Продукты питания (folder)/Чай и кофе/Чай	137832	Hyleys
3673231	4791045011729	Чай Hyleys nov.god&rozhd&Star.nov.god assrtd b 0.135kg Mix lft #2	21794	Продукты питания (folder)/Чай и кофе/Чай	137832	Hyleys
3673234	4791045006923	Чай Hyleys plod strasti Passion Fruit pk 25tb 0.0375kg gr	21794	Продукты питания (folder)/Чай и кофе/Чай	137832	Hyleys
1338736	4791045010807	Чай Hyleys s nov.god! crem&Raspberry&strawberry&wld-strawberry pk 100g bl lft	21794	Продукты питания (folder)/Чай и кофе/Чай	137832	Hyleys
295800	4791045009009	Чай Hyleys Spring feelings черный с календулой с ароматом персика и ванили жб 100g	21794	Продукты питания (folder)/Чай и кофе/Чай	137832	Hyleys
3673218	4607807010544	Чай Hyleys анг.кор.к черн ар.ц.кр/л 100g	21794	Продукты питания (folder)/Чай и кофе/Чай	137832	Hyleys
2498244	4607807010018	Чай Hyleys англ.клас черн м/л 25x1.5 37.5g	21794	Продукты питания (folder)/Чай и кофе/Чай	137832	Hyleys
3940776	4607807010414	Чай Hyleys английск.зелен кр/лист.в/с 100g	21794	Продукты питания (folder)/Чай и кофе/Чай	137832	Hyleys
277510	4791045007784	Чай Hyleys английская Коллекция ассорт (дш) 1.8x80/6	21794	Продукты питания (folder)/Чай и кофе/Чай	137832	Hyleys
1338724	479104500332	Чай Hyleys английские типсы 125g	21794	Продукты питания (folder)/Чай и кофе/Чай	137832	Hyleys
137834	4791045003328	Чай Hyleys английские типсы ср.лист жб 125g	21794	Продукты питания (folder)/Чай и кофе/Чай	137832	Hyleys
3673219	4791045002284	Чай Hyleys английский osob.kupaz. pk 100tb 0.2kg bl	21794	Продукты питания (folder)/Чай и кофе/Чай	137832	Hyleys
137846	4791045003168	Чай Hyleys английский аристократ 100g/45 жасмин	21794	Продукты питания (folder)/Чай и кофе/Чай	137832	Hyleys
3673223	4791045004646	Чай Hyleys английский аристократ pk 0.5kg bl lft #2	21794	Продукты питания (folder)/Чай и кофе/Чай	137832	Hyleys
3673221	4791045004288	Чай Hyleys английский аристократ pk 250g bl lft #2	21794	Продукты питания (folder)/Чай и кофе/Чай	137832	Hyleys
3673226	4791045004295	Чай Hyleys английский аристократ pk 25tb 50g bl	21794	Продукты питания (folder)/Чай и кофе/Чай	137832	Hyleys
137840	4791045003311	Чай Hyleys английский аристократ жб 125g/16	21794	Продукты питания (folder)/Чай и кофе/Чай	137832	Hyleys
137839	4791045001874	Чай Hyleys английский аристократ ф/п 2g*100 (набор)	21794	Продукты питания (folder)/Чай и кофе/Чай	137832	Hyleys
277496	4791045003298	Чай Hyleys английский аристократ ф/п 2g*100 конв.	21794	Продукты питания (folder)/Чай и кофе/Чай	137832	Hyleys
277497	4791045002178	Чай Hyleys английский аристократ ф/п 2g*20 в конв.	21794	Продукты питания (folder)/Чай и кофе/Чай	137832	Hyleys
277499	4791045003618	Чай Hyleys английский аристократ ф/п 2гх100/ б/я	21794	Продукты питания (folder)/Чай и кофе/Чай	137832	Hyleys
277500	4791045003649	Чай Hyleys английский аристократ ф/п 2гх20/40 б/я	21794	Продукты питания (folder)/Чай и кофе/Чай	137832	Hyleys
277501	4791045003595	Чай Hyleys английский аристократ ф/п конв 2g*500	21794	Продукты питания (folder)/Чай и кофе/Чай	137832	Hyleys
277498	4791045003304	Чай Hyleys английский аристократический 50пак*2g	21794	Продукты питания (folder)/Чай и кофе/Чай	137832	Hyleys
137858	4791045001836	Чай Hyleys английский аристократический жб 400g	21794	Продукты питания (folder)/Чай и кофе/Чай	137832	Hyleys
137842	4791045001539	Чай Hyleys английский аристократический кр/лист черн 250g к/к	21794	Продукты питания (folder)/Чай и кофе/Чай	137832	Hyleys
137841	4791045002468	Чай Hyleys английский аристократический крупный 20пак*2.5g	21794	Продукты питания (folder)/Чай и кофе/Чай	137832	Hyleys
137844	4791045002611	Чай Hyleys английский аристократический особо крупнолистовой 300g пл/бан	21794	Продукты питания (folder)/Чай и кофе/Чай	137832	Hyleys
3583937	4607807010049	Чай Hyleys английский аристократический черн 200g к/к	21794	Продукты питания (folder)/Чай и кофе/Чай	137832	Hyleys
137843	4791045001584	Чай Hyleys английский аристократический черный 25 пак	21794	Продукты питания (folder)/Чай и кофе/Чай	137832	Hyleys
137838	4791045001454	Чай Hyleys английский аристократический черный*20шт крупный лист 100g (страна ввоза шри-ланка) Минск ип караван	21794	Продукты питания (folder)/Чай и кофе/Чай	137832	Hyleys
3673225	4607807010377	Чай Hyleys английский аристократический, 100 пакетиков по 2g	21794	Продукты питания (folder)/Чай и кофе/Чай	137832	Hyleys
3583848	4607807010490	Чай Hyleys английский аристократический, черный крупнолистовой, 100g	21794	Продукты питания (folder)/Чай и кофе/Чай	137832	Hyleys
3673220	4607807010384	Чай Hyleys английский аристократический, черный крупнолистовой, 250g	21794	Продукты питания (folder)/Чай и кофе/Чай	137832	Hyleys
3673222	4607807010391	Чай Hyleys английский аристократический, черный крупнолистовой, 500g	21794	Продукты питания (folder)/Чай и кофе/Чай	137832	Hyleys
3583936	4607807010483	Чай Hyleys английский аристократический, черный, 25 пакетиков	21794	Продукты питания (folder)/Чай и кофе/Чай	137832	Hyleys
137845	4791045002321	Чай Hyleys английский аристрократический черный крупнолистовой 500g к/к	21794	Продукты питания (folder)/Чай и кофе/Чай	137832	Hyleys
137847	4791045002314	Чай Hyleys английский ган паудер зелен крупнолист. 100g	21794	Продукты питания (folder)/Чай и кофе/Чай	137832	Hyleys
277503	4791045003632	Чай Hyleys английский завтрак 1.5g х100/16 б/я	21794	Продукты питания (folder)/Чай и кофе/Чай	137832	Hyleys
277504	4791045003663	Чай Hyleys английский завтрак 1.5g х20/40 б/я	21794	Продукты питания (folder)/Чай и кофе/Чай	137832	Hyleys
137849	4791045001553	Чай Hyleys английский завтрак 25пак*1.5g	21794	Продукты питания (folder)/Чай и кофе/Чай	137832	Hyleys
277502	4791045003267	Чай Hyleys английский завтрак 50x1.5g к/к	21794	Продукты питания (folder)/Чай и кофе/Чай	137832	Hyleys
137848	4791045001560	Чай Hyleys английский завтрак зелен 100x1.5g к/к	21794	Продукты питания (folder)/Чай и кофе/Чай	137832	Hyleys
137850	4791045001546	Чай Hyleys английский завтрак лист черн 100g к/к	21794	Продукты питания (folder)/Чай и кофе/Чай	137832	Hyleys
2498398	4607807010025	Чай Hyleys английский завтрак черный 100 пак	21794	Продукты питания (folder)/Чай и кофе/Чай	137832	Hyleys
3583938	4791045010630	Чай Hyleys английский завтрак черный 200g #2	21794	Продукты питания (folder)/Чай и кофе/Чай	137832	Hyleys
137852	4791045002628	Чай Hyleys английский зеленый 25x1.5g	21794	Продукты питания (folder)/Чай и кофе/Чай	137832	Hyleys
3673236	4791045005421	Чай Hyleys английский зеленый Jasmin pk 25tb 0.0375kg gr	21794	Продукты питания (folder)/Чай и кофе/Чай	137832	Hyleys
3673238	4791045008019	Чай Hyleys английский зеленый pk 0.2kg gr lft #2	21794	Продукты питания (folder)/Чай и кофе/Чай	137832	Hyleys
277552	4791045003335	Чай Hyleys английский зеленый жб 125g	21794	Продукты питания (folder)/Чай и кофе/Чай	137832	Hyleys
137853	4791045002642	Чай Hyleys английский зеленый с жасмином 100g пач.	21794	Продукты питания (folder)/Чай и кофе/Чай	137832	Hyleys
137854	4791045002635	Чай Hyleys английский зеленый с жасмином 25пак*1.5g	21794	Продукты питания (folder)/Чай и кофе/Чай	137832	Hyleys
277556	4791045003342	Чай Hyleys английский зеленый с жасмином жб 125g	21794	Продукты питания (folder)/Чай и кофе/Чай	137832	Hyleys
1338733	4791045008781	Чай Hyleys английский клубника со сливками 100g	21794	Продукты питания (folder)/Чай и кофе/Чай	137832	Hyleys
137836	4791045003250	Чай Hyleys английский королевский купаж крупнолист. 20пак*2.5g	21794	Продукты питания (folder)/Чай и кофе/Чай	137832	Hyleys
137835	4791045003380	Чай Hyleys английский королевский купаж лист черн жб 125g	21794	Продукты питания (folder)/Чай и кофе/Чай	137832	Hyleys
137855	4791045003175	Чай Hyleys английский королевский купаж особокрупнолист. 100g	21794	Продукты питания (folder)/Чай и кофе/Чай	137832	Hyleys
137857	4791045002000	Чай Hyleys английский королевский купаж черн 25x 2g к/к	21794	Продукты питания (folder)/Чай и кофе/Чай	137832	Hyleys
277507	4791045002222	Чай Hyleys английский особый купаж 100g/24 жб	21794	Продукты питания (folder)/Чай и кофе/Чай	137832	Hyleys
137837	4791045001782	Чай Hyleys английский особый купаж 100g/50	21794	Продукты питания (folder)/Чай и кофе/Чай	137832	Hyleys
277508	4791045002239	Чай Hyleys английский особый купаж 200g/12 жб	21794	Продукты питания (folder)/Чай и кофе/Чай	137832	Hyleys
277506	4791045003274	Чай Hyleys английский особый купаж 50 пак 100g к/к	21794	Продукты питания (folder)/Чай и кофе/Чай	137832	Hyleys
277505	4791045002185	Чай Hyleys английский особый купаж ф/п 2g*20 конв.	21794	Продукты питания (folder)/Чай и кофе/Чай	137832	Hyleys
277509	4791045003557	Чай Hyleys английский особый купаж ф/п конв 2g*500	21794	Продукты питания (folder)/Чай и кофе/Чай	137832	Hyleys
137856	4791045002154	Чай Hyleys английский особый купаж черн 100x 2g к/к	21794	Продукты питания (folder)/Чай и кофе/Чай	137832	Hyleys
137887	4791045003403	Чай Hyleys английский фаворит черн 100g к/к	21794	Продукты питания (folder)/Чай и кофе/Чай	137832	Hyleys
1338725	4791045009412	Чай Hyleys английский фаворит черн 25x1.8g к/к	21794	Продукты питания (folder)/Чай и кофе/Чай	137832	Hyleys
5102622	4607807010056	Чай Hyleys английский фаворит, черный среднелистовой, 200g	21794	Продукты питания (folder)/Чай и кофе/Чай	137832	Hyleys
1338726	479104500158	Чай Hyleys аристократ 25п*2g	21794	Продукты питания (folder)/Чай и кофе/Чай	137832	Hyleys
277559	4791045006572	Чай Hyleys аристократический английский зеленый пак 100x1.5g к/к	21794	Продукты питания (folder)/Чай и кофе/Чай	137832	Hyleys
2945974	4607807010155	Чай Hyleys букет роз черный байховый крупнолистовой жб 90g	21794	Продукты питания (folder)/Чай и кофе/Чай	137832	Hyleys
2945977	4791045012658	Чай Hyleys вечер у камина цейлонский черный среднелистовой жб 100g	21794	Продукты питания (folder)/Чай и кофе/Чай	137832	Hyleys
3940777	4607807010995	Чай Hyleys волш.нов.год чер.кр/лист.100g	21794	Продукты питания (folder)/Чай и кофе/Чай	137832	Hyleys
3583939	4607807010360	Чай Hyleys волшебный ларец 24x 2g тв/уп	21794	Продукты питания (folder)/Чай и кофе/Чай	137832	Hyleys
295798	4791045008873	Чай Hyleys волшебный новый год лист черн жб 100g	21794	Продукты питания (folder)/Чай и кофе/Чай	137832	Hyleys
277514	4791045000945	Чай Hyleys высокогорный цейлонский черн 50x 2g к/к	21794	Продукты питания (folder)/Чай и кофе/Чай	137832	Hyleys
137851	4791045002536	Чай Hyleys ган паудер зеленый п/б 230g/10	21794	Продукты питания (folder)/Чай и кофе/Чай	137832	Hyleys
3673239	4791045007111	Чай Hyleys Гармония природы assrtd pk 25tb 0.0375kg Mix	21794	Продукты питания (folder)/Чай и кофе/Чай	137832	Hyleys
1338732	4791045010074	Чай Hyleys Гармония природы bilberry pk 100g gr lft	21794	Продукты питания (folder)/Чай и кофе/Чай	137832	Hyleys
2945966	4791045012139	Чай Hyleys Гармония природы Lemon pk 100g bl lft	21794	Продукты питания (folder)/Чай и кофе/Чай	137832	Hyleys
3673243	4791045012290	Чай Hyleys Гармония природы Lemon pk 100g gr lft	21794	Продукты питания (folder)/Чай и кофе/Чай	137832	Hyleys
137860	4791045005551	Чай Hyleys Гармония природы Lemon pk 25tb 0.0375kg gr	21794	Продукты питания (folder)/Чай и кофе/Чай	137832	Hyleys
3673247	4791045007913	Чай Hyleys Гармония природы melss&mnt pk 100g bl lft #2	21794	Продукты питания (folder)/Чай и кофе/Чай	137832	Hyleys
3673250	4791045012115	Чай Hyleys Гармония природы pk 100g bl lft	21794	Продукты питания (folder)/Чай и кофе/Чай	137832	Hyleys
2945965	4791045012276	Чай Hyleys Гармония природы pk 100g gr lft	21794	Продукты питания (folder)/Чай и кофе/Чай	137832	Hyleys
3673251	4791045009405	Чай Hyleys Гармония природы Raspberry pk 100g bl lft	21794	Продукты питания (folder)/Чай и кофе/Чай	137832	Hyleys
3673252	4791045009313	Чай Hyleys Гармония природы Raspberry pk 25tb 0.0375kg bl	21794	Продукты питания (folder)/Чай и кофе/Чай	137832	Hyleys
2945981	4791045010456	Чай Hyleys Гармония природы thyme pk 100g bl lft	21794	Продукты питания (folder)/Чай и кофе/Чай	137832	Hyleys
3673254	4791045010494	Чай Hyleys Гармония природы thyme pk 25tb 0.0375kg bl #2	21794	Продукты питания (folder)/Чай и кофе/Чай	137832	Hyleys
5102623	4607807011107	Чай Hyleys Гармония природы | 7 вкусов, ассорти, 100 пакетиков по 1.5g	21794	Продукты питания (folder)/Чай и кофе/Чай	137832	Hyleys
5102624	4607807010872	Чай Hyleys Гармония природы | 7 вкусов, ассорти, 25 пакетиков по 1.5g	21794	Продукты питания (folder)/Чай и кофе/Чай	137832	Hyleys
3673249	4607807010681	Чай Hyleys Гармония природы | зеленый с мятой, 25 пакетиков по 1.5g	21794	Продукты питания (folder)/Чай и кофе/Чай	137832	Hyleys
5102625	4607807010940	Чай Hyleys Гармония природы | зеленый с мятой, листовой, 100g	21794	Продукты питания (folder)/Чай и кофе/Чай	137832	Hyleys
3673241	4607807010834	Чай Hyleys Гармония природы | зеленый с ромашкой, 25 пакетиков по 1.5g	21794	Продукты питания (folder)/Чай и кофе/Чай	137832	Hyleys
5102626	4607807010865	Чай Hyleys Гармония природы | черный с малиной, 25 пакетиков по 1.5g	21794	Продукты питания (folder)/Чай и кофе/Чай	137832	Hyleys
