ID	UPCEAN	Name	CategoryID	CategoryName	BrandID	BrandName
5391147	4813088000260	Кассета фильтрующая крынi максiма комплекс (в моей воде большое содержание железа/хлора. подходит к старым и новым кувшинам bri	5391146	фильтры и кувшины для очистки воды	5275529	крынi
5391148	4813088000307	Кассета фильтрующая крынi максiма стандарт в пленке (у меня нормальная вода, но мне нужна пригодная для питья! подходит к кувши	5391146	фильтры и кувшины для очистки воды	0	
1221598	4810519001216	Кассета электросушилки polly	203752	Техника (folder)/Бытовая техника	0	
470247	4612747650057	Кассета эфм 250-10 для горячей воды	1	Неклассифицированные/default	0	
470248	4612747650040	Кассета эфм 508-20вв 20мкр. промфильтры	1	Неклассифицированные/default	0	
5009725	4627115080572	Кассета-вставка 1 ячейка/афп	561877	Растениеводство (folder)/Товары для садоводства	4994457	АгроФлораПак
5009726	4627115080596	Кассета-вставка 4 ячейки/афп	561877	Растениеводство (folder)/Товары для садоводства	4994457	АгроФлораПак
5009727	4627115080619	Кассета-вставка 6 ячеек/афп	561877	Растениеводство (folder)/Товары для садоводства	4994457	АгроФлораПак
5009728	4627115080633	Кассета-вставка 9 ячеек/афп	561877	Растениеводство (folder)/Товары для садоводства	4994457	АгроФлораПак
723198	4008332110165	Кассетный плеер караоке	980	Игрушки (folder)/Игрушка	0	
1221599	4602010342482	Кассетный хлыст kl-9729	334627	Спорт и отдых (folder)/Велосипед (folder)/Велосипедные аксессуары	0	
5009729	3086123644885	Кассеты BIC flex 5 hybrid 4шт New	1	Неклассифицированные/default	123096	BIC
3337207	4902430526913	Кассеты Gillette mach-3 8шт тв\уп	1	Неклассифицированные/default	4881237	Gillette Mach-3
598675	7702018037964	Кассеты Gillette mach-3 Sensitive сменные для бритья 1x 8шт	1105	Гигиена (folder)/Средства для бритья	4881237	Gillette Mach-3
3337210	4740017917200	Кассеты Gillette mach-3 сменные блистер	1	Неклассифицированные/default	4881237	Gillette Mach-3
3049081	8801038565064	Кассеты lsx a1040 для бритья жен dorco shai 3+3, 4шт***, шт 65064	278768	Гигиена (folder)/Станок бритвенный	361674	Dorco
2850225	8801038569529	Кассеты sva1040 для бритья dorco pace 7, 4шт***, шт 69529	278768	Гигиена (folder)/Станок бритвенный	361674	Dorco
5009732	4902430592970	Кассеты vector Sensor 3 8шт (импорт) подходит к Sensor excel/10	1	Неклассифицированные/default	0	
3337211	4600987006987	Кассеты аквафор в6 в100-6 набор 4шт	1	Неклассифицированные/default	0	
2792481	4600104035326	Кассеты арнест deonica for men для бритья сменные 3 лезвия 2шт	1	Неклассифицированные/default	2312321	Арнест Deonica
2792482	4600104035340	Кассеты арнест deonica for men для бритья сменные 5 лезвий 2шт	1	Неклассифицированные/default	2312321	Арнест Deonica
3337205	4600104035395	Кассеты арнест deonica for women для бритья сменные 5 лезвий 2шт	1	Неклассифицированные/default	2312321	Арнест Deonica
5009733	4601032995201	Кассеты барьер сменные 4-стандарт 3+1шт/9	1	Неклассифицированные/default	314528	БАРЬЕР
4985332	7702018510160	Кассеты для бритья сменные Gillette mach-3 Turbo, 6шт 0050002248	1	Неклассифицированные/default	4881237	Gillette Mach-3
2440702	1300000092937	Кассеты для рассады 18 ячеек	1	Неклассифицированные/default	0	
2440703	1300000092944	Кассеты для рассады 40 ячеек	1	Неклассифицированные/default	0	
2440704	1300000092951	Кассеты для рассады 54 ячейки	1	Неклассифицированные/default	0	
723199	402780031180	Кассеты протектор fx diamont 4шт	278768	Гигиена (folder)/Станок бритвенный	0	
5009734	9785604446195	Кассиль л кондуит и швамбрания. серия школьная библиотека новинка	1	Неклассифицированные/default	0	
3348298	4610008525106	Кассовая книга (форма ко-4) 48л, горизонтальная, блок газетный	205408	Полиграфия (folder)/Книги	0	
3820053	4610008525113	Кассовая книга (форма ко-4) 96л, горизонтальная, блок газетный	1	Неклассифицированные/default	0	
1962441	4798033003407	Кассовая книга 100л офсет тверд обл карт тб-100	1	Неклассифицированные/default	0	
1962442	4798033003988	Кассовая книга 50л офсет мягк обл карт мб-50	1	Неклассифицированные/default	0	
176263	4606224022062	Кассовая книга, форма ко-4, 48лист A4 203x285 mm горизонтальная картон, офсет, Brauberg 130078 130078сн	262842	Канцелярские товары (folder)/Бухгалтерские книги, бланки	175956	BRAUBERG
5391151	4680062220118	Кассовый аппарат атол 92ф. черный. без фн/без енвд. (wifi, bt, 2g, ethernet) ft24625	5391149	ккм и фискальные регистраторы	5391150	атол
5391152	6927876119503	Кассовый аппарат детский наша игрушка m7447-2 торговый центр, 15 деталей (ассортим)	5356521	Игрушка - детский супермаркет	3864600	НАША ИГРУШКА
5391153	6940510423613	Кассовый аппарат детский наша игрушка yy6002-1 дракоша 18предм	5356521	Игрушка - детский супермаркет	3864600	НАША ИГРУШКА
2729782	6934522198454	Кассовый аппарат на батар свет и звук, руссифиц ж/к дисплей в русс. кор. 43x18x 18cm в кор.2x 6шт	980	Игрушки (folder)/Игрушка	0	
2729783	6934522091687	Кассовый аппарат на батар свет и звук, руссифиц с аксессуарами 7017 в русс. кор. 38x18x 18cm в кор.2x 6шт	980	Игрушки (folder)/Игрушка	0	
1671090	3032160229509	Кассовый аппарат свет и звук.,на бат.1/6	980	Игрушки (folder)/Игрушка	0	
3337212	4606224115276	Кассовый лоток м1 приема-выдачи денег 350x290 x 45mm 6 ячеек для банкнот, 7отд для монет	1	Неклассифицированные/default	0	
3337213	4606224115283	Кассовый лоток м3 приема-выдачи денег 340x305 x 45mm 6 ячеек для банкнот, 8отд для монет	1	Неклассифицированные/default	0	
3337214	4606224115290	Кассовый лоток м9 приема-выдачи денег, 340x180 x 45mm 8 ячеек для монет 290571cm	1	Неклассифицированные/default	0	
5009737	4607038610087	Кассон конструктор комби блок 500 рюкзак	1	Неклассифицированные/default	5009735	Кассон
5391154	4607038611350	Кассон конструктор макси блок 120 мешок 4-735	147541	Игрушки (folder)/Игрушка конструктор	0	
5009738	4607038611336	Кассон конструктор макси блок 168 мешок	1	Неклассифицированные/default	5009735	Кассон
3820054	4607038611473	Кассон набор песочный лопат/3 форм/граб.	3605276	Спорт и отдых (folder)/Кемпинг	0	
3820055	4607038611138	Кассон набор песочный лопатка/3 формочки	3605276	Спорт и отдых (folder)/Кемпинг	0	
3820056	4607038617086	Кассон набор песочный лопатка/грабельки	3605276	Спорт и отдых (folder)/Кемпинг	0	
5009739	4607038613354	Кассон самосвал мини, 19cm, ассортим, сетка	1	Неклассифицированные/default	5009735	Кассон
723200	4607038611091	Кассон.лейка большая арт.2-108	1	Неклассифицированные/default	0	
1221608	4607038612166	Кассон.мельница большая арт.2-120	980	Игрушки (folder)/Игрушка	0	
723201	4607038610803	Кассон.песочный набор с мельницей,лопата,грабли,2 форм арт.2-219	1	Неклассифицированные/default	0	
2455424	4605404000944	Каст-ое масло вн. и нар /прим 30ml фл (йодные тех-ии и Марк-г)	2417850	Лекарственные средства (folder)/Желудочно-кишечный тракт	0	
3820058	4602807801222	Каст.цил.выс обод 1512/4 3.0л	314257	Посуда (folder)/Кастрюля	0	
1697031	4897045390137	Кастаньеты (Солнышко) с307	1	Неклассифицированные/default	0	
5391155	3830054901919	Кастаньеты flight fcw-55n	5221796	перкуссия	5251046	flight
1962443	7290002582526	Кастаньеты с животными, 24+	1	Неклассифицированные/default	0	
723203	8004767003849	Кастельшпек нар.80g левони	1183382	Продукты питания (folder)/Мясные продукты	723202	Левони
3820060	13100278	Кастерс ликер пина колада 700ml	23975	Продукты питания (folder)/Алкогольные напитки/Ликер	3820059	PINA COLADA
3794822	8436016350600	Кастильо Sauvignon айрен-вердехо защ.геогр.указ 2017g 750ml	1	Неклассифицированные/default	0	
4846927	4603720937258	Касторовое био масло косметич касторовое 30ml	343183	Материалы (folder)/Масло эфирное	0	
2868515	4603373000279	Касторовое масло 10%-30ml тверская фармфабрика	1	Неклассифицированные/default	0	
4842316	4601026072673	Касторовое масло 1g №10 капс	241824	Лекарственные средства (folder)/Аптека	0	
1786390	4810201000619	Касторовое масло 30g	210391	Лекарственные средства (folder)/Лекарственные средства	0	
5009743	4603380006257	Касторовое масло 30ml	5032230	Косметика (folder)/Масло косметическое	0	
5009744	4603933007014	Касторовое масло 30ml #2	1	Неклассифицированные/default	0	
2868516	4603905000333	Касторовое масло 30ml №1	1	Неклассифицированные/default	0	
2868517	039050024124	Касторовое масло 30ml №1, тульская фармфабрика гуп	1	Неклассифицированные/default	0	
489065	4602546002058	Касторовое масло 30ml №1, эколаб ООО	1	Неклассифицированные/default	0	
4842318	4600828002420	Касторовое масло 50g	241824	Лекарственные средства (folder)/Аптека	0	
2455425	4602546007046	Касторовое масло 50ml №1, эколаб ООО	343183	Материалы (folder)/Масло эфирное	0	
1786391	4841049000424	Касторовое масло во фл 25g в уп №1 фл, №1	210391	Лекарственные средства (folder)/Лекарственные средства	0	
3820061	4634444158513	Касторовое масло для пр внут фл 30ml х1	1	Неклассифицированные/default	0	
4842317	4603905011148	Касторовое масло для пр/вн 30ml фл (ООО тульская фф)	210391	Лекарственные средства (folder)/Лекарственные средства	0	
2729784	4620006501682	Касторовое масло косметич экотекс 30ml	1	Неклассифицированные/default	0	
2012621	4650001791498	Касторовое масло косметическое mirrolla 25ml	1	Неклассифицированные/default	3403004	mirrolla
1221611	9120027340369	Кастр. улучш. качества кл4036	314257	Посуда (folder)/Кастрюля	0	
2440712	4602807807590	Кастрлюля лысьва стальная эмалированная с деколью 1.5л	314257	Посуда (folder)/Кастрюля	0	
723634	5068254501594	Кастрюл 2.3л zd-50159 нержав сталь	314257	Посуда (folder)/Кастрюля	0	
3820063	4606100126020	Кастрюл.swift vend.жар руч 650ml	314257	Посуда (folder)/Кастрюля	3758095	SWIFT VENDOR
3337216	4763124417104	Кастрюли Bekker набор 3шт bk-1710	314257	Посуда (folder)/Кастрюля	1207002	Bekker
3337217	4690317008620	Кастрюли bohmann bh-0104 из нержав стали в наборе 7предм т/у	314257	Посуда (folder)/Кастрюля	1671248	Bohmann
3337218	4690317003953	Кастрюли bohmann bh-0306 из нержав стали 3предм 2.1л/3.9л/6.5л т/у	314257	Посуда (folder)/Кастрюля	1671248	Bohmann
3337219	4690317003977	Кастрюли bohmann bh-0308 из нержав стали 4предм 2.1/2.9/3.9л т/у	314257	Посуда (folder)/Кастрюля	1671248	Bohmann
3337222	4690317000860	Кастрюли bohmann bh-06-175 из нержав стали 6предм 2.1л 2.9л 3.9л т/у	314257	Посуда (folder)/Кастрюля	1671248	Bohmann
3337220	4690317004561	Кастрюли bohmann bh-0601 из нержав стали в наборе 6предм т/у	314257	Посуда (folder)/Кастрюля	1671248	Bohmann
1266168	4690317004578	Кастрюли bohmann bh-0602 из нержав стали в наборе 6предм т/у	2420630	Посуда (folder)/Посуда кухонная	1671248	Bohmann
3337221	4690317009481	Кастрюли bohmann bh-0609 из нержав стали в наборе 6предм т/у	314257	Посуда (folder)/Кастрюля	1671248	Bohmann
3337223	4690317000891	Кастрюли bohmann bh-08-475 из нержав стали в наборе 2.1л, 2.9л, 3.9л, 5.1л т/у	314257	Посуда (folder)/Кастрюля	1671248	Bohmann
3337224	4690317008330	Кастрюли bohmann в наборе из нержав стали 2.0л 3.5л 6.5л т/у	314257	Посуда (folder)/Кастрюля	1671248	Bohmann
3337225	4690317000877	Кастрюли bohmann в наборе из нержав стали 2.9л 3.5л 5.1л т/у	314257	Посуда (folder)/Кастрюля	1671248	Bohmann
1266182	4895124425695	Кастрюли Classic набор Bekker bk-252	2420630	Посуда (folder)/Посуда кухонная	1207002	Bekker
3337226	5904134688163	Кастрюли domotti stock pot с крышкой 26cm 12л карт/кор	314257	Посуда (folder)/Кастрюля	0	
3337227	4602807060735	Кастрюли elros daniela даниэлла стальные эмалированные 1.5/2.0/3.0л 3шт т/у	314257	Посуда (folder)/Кастрюля	0	
2742506	4602807044858	Кастрюли elros Golden leaves Золотые лепестки стальные эмалированные 1.5/2.0/3.0л 3шт т/у	1	Неклассифицированные/default	0	
3337228	4602807055403	Кастрюли elros Golden leaves Золотые лепестки стальные эмалированные 1.5/2.0/3.0л 3шт т/у #2	314257	Посуда (folder)/Кастрюля	0	
3337229	4602807041499	Кастрюли elros Green Apple зеленое яблоко стальные эмалированные 1.5/2.0/3.0л 3шт т/у	314257	Посуда (folder)/Кастрюля	0	
3337230	4602807055007	Кастрюли elros Solar солнечный стальные эмалированные 2.0/2.5/3.0л 3шт т/у	314257	Посуда (folder)/Кастрюля	0	
3337231	4602807054994	Кастрюли elros сoral коралловый стальные эмалированные 2.0/2.5/3.0л 3шт т/у	314257	Посуда (folder)/Кастрюля	0	
2743309	4604403000368	Кастрюли helpina из термостойкого стекла с крышками в наборе из 6предм 1л/1.5л/2л т/у	1	Неклассифицированные/default	0	
3337232	4824042000035	Кастрюли idillia Мой Париж стальные эмалированные в наборе 3предм т/у	314257	Посуда (folder)/Кастрюля	0	
3337233	4824042000042	Кастрюли idillia римские каникулы стальные эмалированные в наборе 3предм т/у	314257	Посуда (folder)/Кастрюля	0	
3337234	6944979920355	Кастрюли lermony жаропрочные с декором набор 2шт	314257	Посуда (folder)/Кастрюля	3378922	lermony
3337235	4690203134082	Кастрюли mayer&boch mb23663 6шт тв/уп	314257	Посуда (folder)/Кастрюля	0	
3337236	4602807003558	Кастрюли mayer&boch ласковый май набор посуды эмаль 2л+3л	314257	Посуда (folder)/Кастрюля	0	
3337237	4690203151713	Кастрюли mayer&boch со стеклянной крышкой набор 6предм	314257	Посуда (folder)/Кастрюля	0	
772616	8600034068186	Кастрюли metrot набор 6элем арт.120077	2420630	Посуда (folder)/Посуда кухонная	723242	Эмина
3337239	8600034027558	Кастрюли metrot стальные эмалированный в наборе 4предм 2.0л 3.5л 5.5л 1.5л т/у	314257	Посуда (folder)/Кастрюля	0	
1264862	4610001546955	Кастрюли vitross bon appetit №13 стальные эмалированные 2.0/3.0/4.0л т/у	2420630	Посуда (folder)/Посуда кухонная	0	
3337240	4690460014066	Кастрюли vitross bon appetit №16 стальные цилиндрические эмалированные 3.0/4.0/5.5л 3шт т/у	314257	Посуда (folder)/Кастрюля	0	
3337241	6957221297617	Кастрюли wellberg из нержав стали 16x10.5cm 1.8л/18x11.5cm 2.5л/20x12.5cm 3.5л набор из 6 предм	314257	Посуда (folder)/Кастрюля	1671282	WELLBERG
3337242	5021849506114	Кастрюли zenidan из нержав стали в наборе 6предм 2.1л 3.0л 4.0л т/у	314257	Посуда (folder)/Кастрюля	3338012	Zeidan
3337243	5021849508033	Кастрюли zenidan из нержав стали в наборе 8предм 1.5л 2.1л 3.0л 4.0л т/у	314257	Посуда (folder)/Кастрюля	0	
3337244	5021849506107	Кастрюли ziedan z50610 из нержав стали в наборе 6предм 2.1л 30л 4.0л т/у	314257	Посуда (folder)/Кастрюля	0	
3337245	4602807064849	Кастрюли арбузный фреш эмалированные набор 1.0x2.0x3.0л т/у	314257	Посуда (folder)/Кастрюля	0	
3337246	4601056800000	Кастрюли катунь альта из нержав стали 16cm 1.6л/18cm 2.2л/20cm 3.2л набор из 6шт т/у	314257	Посуда (folder)/Кастрюля	0	
3337247	4622589000026	Кастрюли катунь гретта из нержав стали 16cm 1.6л/18cm 2.2л/20cm 3.2л/22cm 4.2л набор из 8 предм	314257	Посуда (folder)/Кастрюля	3836039	катунь
851844	4607132115464	Кастрюли катунь Лира из нержав стали в наборе 2.2л 3.2л 4.4л т/у	2420630	Посуда (folder)/Посуда кухонная	536248	Универсал
3337248	4622587600082	Кастрюли катунь нержавейка набор 3.2+4.2+5.2л тв/уп	314257	Посуда (folder)/Кастрюля	0	
3337249	4622587600075	Кастрюли катунь ника из нержав стали 18cm 2.2л/20cm 3.2л/22cm 4.2л набор из 6предм т/у	314257	Посуда (folder)/Кастрюля	3836039	катунь
3337250	4626015830393	Кастрюли керченский мк валенсия-1 стальные эмалированные 2.0/3.0/4.0л 3шт т/у	314257	Посуда (folder)/Кастрюля	0	
3337251	4626015830591	Кастрюли кмк даша-1 стальные эмалированные 1.5/2.3/3.0л 3шт т/у	314257	Посуда (folder)/Кастрюля	0	
3337252	4626015830805	Кастрюли кмк лотос-1 стальные эмалированные 1.0/1.5/2.3л 3шт т/у	314257	Посуда (folder)/Кастрюля	0	
3337253	4602807006054	Кастрюли лео стальные эмалированные 1.5/2.0/3.0л набор 3шт т/у	314257	Посуда (folder)/Кастрюля	0	
2742472	4602807049167	Кастрюли лысьва вкус лета стальные эмалированные цилиндрические 1.5/2/3л в наборе из 3шт т/у	1	Неклассифицированные/default	0	
3337254	4602807064856	Кастрюли лысьва дынный фреш в наборе 1.5л 2.0л 3.0л т/у	314257	Посуда (folder)/Кастрюля	0	
3337255	4602807066850	Кастрюли лысьва земляника стальные эмалированные в наборе 3шт 1.5л 2л 3л т/у	314257	Посуда (folder)/Кастрюля	0	
3337256	4602807634073	Кастрюли лысьва итальянская кухня стальные эмалированные 1.5/2.0/3.0л 3шт т/у	314257	Посуда (folder)/Кастрюля	0	
3337257	4602807066331	Кастрюли лысьва красава эмалированные в наборе 1.45л, 2.9л, 4.3л т/у	314257	Посуда (folder)/Кастрюля	0	
2742474	4602807627518	Кастрюли лысьва лайм стальные эмалированные цилиндрические 1.5/2/3л в наборе из 3шт т/у	1	Неклассифицированные/default	0	
1262414	4602807561690	Кастрюли лысьва ландыш серебристые стальные эмалированные 1.5/2.0/3.0л 3шт т/у	2420630	Посуда (folder)/Посуда кухонная	0	
3337258	4602807066867	Кастрюли лысьва лесная стальные эмалированные в наборе 3шт 1.5л 2л 3л т/у	314257	Посуда (folder)/Кастрюля	0	
3337259	4602807076934	Кастрюли лысьва ромашковое Поле стальные эмалированные в наборе 3шт 1.5л 2л 3л т/у	314257	Посуда (folder)/Кастрюля	0	
3337260	4602807074374	Кастрюли лысьва Сочная клубника эмалированные в наборе 1.45л, 2.9л, 4.3л т/у	314257	Посуда (folder)/Кастрюля	0	
3337261	4602807066034	Кастрюли лысьва тропики стальные эмалированные 3предм 1.5/2.0/3.0л т/у	314257	Посуда (folder)/Кастрюля	0	
1262550	4602807534137	Кастрюли лысьва цветы сирени стальные эмалированные в наборе 3предм 2.0л/3.0л/4.5л т/у	2420630	Посуда (folder)/Посуда кухонная	0	
1262506	4602807464373	Кастрюли лысьвенские эмали Золотая маргаритка стальные эмалированные 2.0/3.0/4.5л 3шт т/у	2420630	Посуда (folder)/Посуда кухонная	0	
1262405	4602807461877	Кастрюли лысьвенские эмали китайская роза стальные эмалированные 1.5/2.0/3.0л 3шт т/у	2420630	Посуда (folder)/Посуда кухонная	0	
3337262	4602807039793	Кастрюли лысьвенские эмали кристин стальные эмалированные 1.5/2.0/3.0л 3шт т/у	314257	Посуда (folder)/Кастрюля	0	
2742480	4602807627631	Кастрюли лысьвенские эмали лайм стальные эмалированные 2.0/3.0/4.5л 3шт т/у	1	Неклассифицированные/default	0	
3337263	4602807062470	Кастрюли лысьвенские эмали орхидея стальные эмалированные 1.5/2.0/3.0л 3шт т/у	314257	Посуда (folder)/Кастрюля	0	
