ID	UPCEAN	Name	CategoryID	CategoryName	BrandID	BrandName
26371	4605246006371	Чай Принцесса канди вишня сингл с/я 25п*1.5g	21794	Продукты питания (folder)/Чай и кофе/Чай	31971	Принцесса Канди
31977	4605246006364	Чай Принцесса канди клубника 25п*1.5g 0.0375	21794	Продукты питания (folder)/Чай и кофе/Чай	31971	Принцесса Канди
26372	4605246004506	Чай Принцесса канди клубника strawberry pk 25tb 0.0375kg bl	21794	Продукты питания (folder)/Чай и кофе/Чай	31971	Принцесса Канди
1340341	460524600450	Чай Принцесса канди клубника б/я 24п*1.5g +	21794	Продукты питания (folder)/Чай и кофе/Чай	31971	Принцесса Канди
31978	4605246006395	Чай Принцесса канди лесные ягоды 25п*1.5g 0.0375	21794	Продукты питания (folder)/Чай и кофе/Чай	31971	Принцесса Канди
31979	4605246006524	Чай Принцесса канди лимон 25п*1.5g 0.0375	21794	Продукты питания (folder)/Чай и кофе/Чай	31971	Принцесса Канди
31981	4605246000515	Чай Принцесса канди лист медиум 200g цейл. черн байхов. листов. ломаный	21794	Продукты питания (folder)/Чай и кофе/Чай	31971	Принцесса Канди
168955	4605246006401	Чай Принцесса канди малина 25п*1.5g 0.0375	21794	Продукты питания (folder)/Чай и кофе/Чай	31971	Принцесса Канди
26376	4870001060473	Чай Принцесса канди медиум 0.045x150 п.	21794	Продукты питания (folder)/Чай и кофе/Чай	31971	Принцесса Канди
26378	4870001060060	Чай Принцесса канди медиум 0.250x30 п.	21794	Продукты питания (folder)/Чай и кофе/Чай	31971	Принцесса Канди
1340352	4820022860255	Чай Принцесса канди медиум 180g	21794	Продукты питания (folder)/Чай и кофе/Чай	31971	Принцесса Канди
1340353	4820022860316	Чай Принцесса канди медиум 45g	21794	Продукты питания (folder)/Чай и кофе/Чай	31971	Принцесса Канди
1340354	4820022860170	Чай Принцесса канди медиум 90g	21794	Продукты питания (folder)/Чай и кофе/Чай	31971	Принцесса Канди
26377	4870001060206	Чай Принцесса канди медиум стс 100g	21794	Продукты питания (folder)/Чай и кофе/Чай	31971	Принцесса Канди
1339830	4605246007316	Чай Принцесса канди медиум стс 100g*39 пач 0731-39	21794	Продукты питания (folder)/Чай и кофе/Чай	31971	Принцесса Канди
31980	4605246000508	Чай Принцесса канди медиум цейлонский черный байховый (100g) Россия страна ввоза Россия, ООО юмабел	21794	Продукты питания (folder)/Чай и кофе/Чай	31971	Принцесса Канди
1340355	4820022860941	Чай Принцесса канди мелисса черный 90g	21794	Продукты питания (folder)/Чай и кофе/Чай	31971	Принцесса Канди
168954	4605246006821	Чай Принцесса канди пакет лимон 25пак.*1.5g 37.5g цейлон. черн байховый с ярл.	21794	Продукты питания (folder)/Чай и кофе/Чай	31971	Принцесса Канди
548957	4605246006869	Чай Принцесса канди пакет черная смородина 25пак.*1.5g 37.5g цейлон. черн с ярл.	21794	Продукты питания (folder)/Чай и кофе/Чай	31971	Принцесса Канди
1339832	4605246006883	Чай Принцесса канди персик и абрикос (1.5x25 x32) single 0688-32	21794	Продукты питания (folder)/Чай и кофе/Чай	31971	Принцесса Канди
31984	4605246006418	Чай Принцесса канди персик/абрикос 25x1.5g с/я пак.	21794	Продукты питания (folder)/Чай и кофе/Чай	31971	Принцесса Канди
2498810	460524600641	Чай Принцесса канди персик/абрикос 25п*1.5g 0.0375	21794	Продукты питания (folder)/Чай и кофе/Чай	31971	Принцесса Канди
1710418	4605246029844	Чай Принцесса канди разовый 25пак	21794	Продукты питания (folder)/Чай и кофе/Чай	31971	Принцесса Канди
1763731	4605246006845	Чай Принцесса канди разовый вишня сингл 25x 2g	21794	Продукты питания (folder)/Чай и кофе/Чай	31971	Принцесса Канди
1340351	4605246006838	Чай Принцесса канди разовый малина сингл 25x 2g	21794	Продукты питания (folder)/Чай и кофе/Чай	31971	Принцесса Канди
26380	4870001060213	Чай Принцесса канди стс 0.090x120 п.	21794	Продукты питания (folder)/Чай и кофе/Чай	31971	Принцесса Канди
26381	4870001060183	Чай Принцесса канди стс 0.225x30 п.	21794	Продукты питания (folder)/Чай и кофе/Чай	31971	Принцесса Канди
2498811	4605246002281	Чай Принцесса канди цейлонский 100п*2g 200g	21794	Продукты питания (folder)/Чай и кофе/Чай	31971	Принцесса Канди
2498812	4605246002267	Чай Принцесса канди цейлонский 25п*2g 0.050	21794	Продукты питания (folder)/Чай и кофе/Чай	31971	Принцесса Канди
137040	4605246001598	Чай Принцесса канди цейлонский pk 25tb 50g bl	21794	Продукты питания (folder)/Чай и кофе/Чай	31971	Принцесса Канди
137039	4605246001611	Чай Принцесса канди цейлонский yarlychok pk 100tb 0.2kg bl	21794	Продукты питания (folder)/Чай и кофе/Чай	31971	Принцесса Канди
168956	4605246002274	Чай Принцесса канди цейлонский yarlychok pk 50tb 100g bl	21794	Продукты питания (folder)/Чай и кофе/Чай	31971	Принцесса Канди
3888662	4791006000113	Чай Принцесса канди цейлонский yarlychok pk 50tb 100g bl #2	21794	Продукты питания (folder)/Чай и кофе/Чай	31971	Принцесса Канди
137041	4605246002991	Чай Принцесса канди цейлонский черный 50x 2g тв/уп	21794	Продукты питания (folder)/Чай и кофе/Чай	31971	Принцесса Канди
31983	4605246000492	Чай Принцесса канди цейлонский черный байховый медиум 50g листовой Россия Минск ООО юмабел	21794	Продукты питания (folder)/Чай и кофе/Чай	31971	Принцесса Канди
3888663	4791006000021	Чай Принцесса канди чай медиум чер.байх.цейл.200g	21794	Продукты питания (folder)/Чай и кофе/Чай	31971	Принцесса Канди
31985	4605246006388	Чай Принцесса канди черная смородина 25x1.5g с/я пак.	21794	Продукты питания (folder)/Чай и кофе/Чай	31971	Принцесса Канди
1339831	4605246007323	Чай Принцесса канди черный гранулированный 250g тв/уп	21794	Продукты питания (folder)/Чай и кофе/Чай	31971	Принцесса Канди
31974	4605246002984	Чай Принцесса канди черный для разовой заварки цейлон (2грx25п.) double [*72] 0298-72	21794	Продукты питания (folder)/Чай и кофе/Чай	31971	Принцесса Канди
548956	4605246006852	Чай Принцесса канди черный клубника пакетированный 25x1.5g	21794	Продукты питания (folder)/Чай и кофе/Чай	31971	Принцесса Канди
168953	4605246006876	Чай Принцесса канди черный лесная ягода пакетированный 25x1.5g	21794	Продукты питания (folder)/Чай и кофе/Чай	31971	Принцесса Канди
31982	4605246000522	Чай Принцесса канди черный цейлонский листовой 250g	21794	Продукты питания (folder)/Чай и кофе/Чай	31971	Принцесса Канди
31973	4605246003004	Чай Принцесса канди черный цейлонский, 100 пакетиков с ярлычками по 2g, ш/к 03004	21794	Продукты питания (folder)/Чай и кофе/Чай	31971	Принцесса Канди
1339833	4820022860958	Чай Принцесса канди черный эхинацея 90g	21794	Продукты питания (folder)/Чай и кофе/Чай	31971	Принцесса Канди
5817614	4605246015304	Чай Принцесса нури 100г завтрак в бенгалии листовой	21794	Продукты питания (folder)/Чай и кофе/Чай	21818	Принцесса Нури
2947013	4605246012020	Чай Принцесса нури 2 вида кенийский и earl grey 200пак*2g т/у	21794	Продукты питания (folder)/Чай и кофе/Чай	21818	Принцесса Нури
5103565	4460524600197	Чай Принцесса нури 25пак 1x18 высокогорный листовой_ (180) !!!	21794	Продукты питания (folder)/Чай и кофе/Чай	21818	Принцесса Нури
137043	4605246002724	Чай Принцесса нури 25пак*2g 50g бопфса	21794	Продукты питания (folder)/Чай и кофе/Чай	21818	Принцесса Нури
2763223	4605246011146	Чай Принцесса нури 3 вида кенийский отборный высокогорный черный 75x 2g	21794	Продукты питания (folder)/Чай и кофе/Чай	21818	Принцесса Нури
3586733	4605246014048	Чай Принцесса нури 3 вида лимон черника-мята абрикосовый десерт черный 75x1.5g т/у	21794	Продукты питания (folder)/Чай и кофе/Чай	21818	Принцесса Нури
137044	4605246002731	Чай Принцесса нури 50пак*2g 100g дв.пакет	21794	Продукты питания (folder)/Чай и кофе/Чай	21818	Принцесса Нури
21823	4605246003264	Чай Принцесса нури 50пак*2g*36шт с/я цейлонский отборный dc /0326/	21794	Продукты питания (folder)/Чай и кофе/Чай	21818	Принцесса Нури
31524	4605246002915	Чай Принцесса нури 50пак*2g*48шт б/я высокогорный /0291/	21794	Продукты питания (folder)/Чай и кофе/Чай	21818	Принцесса Нури
31991	4605246003295	Чай Принцесса нури 50пак*2g*48шт б/я цейлонский отборный /0329/	21794	Продукты питания (folder)/Чай и кофе/Чай	21818	Принцесса Нури
1841794	4605246002601	Чай Принцесса нури apel.i lim. lem&or pk 25tb 0.0375kg bl	21794	Продукты питания (folder)/Чай и кофе/Чай	21818	Принцесса Нури
3888672	4605246000485	Чай Принцесса нури bergamot earl grey pk 25tb 0.0375kg bl	21794	Продукты питания (folder)/Чай и кофе/Чай	21818	Принцесса Нури
3888673	4791037518342	Чай Принцесса нури bergamot earl grey pk 25tb 0.0375kg bl #2	21794	Продукты питания (folder)/Чай и кофе/Чай	21818	Принцесса Нури
137045	4605246000058	Чай Принцесса нури best pk 100g bl lft	21794	Продукты питания (folder)/Чай и кофе/Чай	21818	Принцесса Нури
3888674	4605246003813	Чай Принцесса нури best pk 100g bl lft #2	21794	Продукты питания (folder)/Чай и кофе/Чай	21818	Принцесса Нури
31526	4605246003158	Чай Принцесса нури best крупнолистовой 250g*16шт /0315/	21794	Продукты питания (folder)/Чай и кофе/Чай	21818	Принцесса Нури
2498814	460524600313	Чай Принцесса нури best цейл кр/лист 0.050	21794	Продукты питания (folder)/Чай и кофе/Чай	21818	Принцесса Нури
137047	4605246000010	Чай Принцесса нури best цейл кр/лист 100g	21794	Продукты питания (folder)/Чай и кофе/Чай	21818	Принцесса Нури
2498816	4605246000041	Чай Принцесса нури best цейл кр/лист 250g#2	21794	Продукты питания (folder)/Чай и кофе/Чай	21818	Принцесса Нури
31987	4605246003141	Чай Принцесса нури best черный байховый цейлонский (100g) Россия страна ввоза Россия, ООО юмабел	21794	Продукты питания (folder)/Чай и кофе/Чай	21818	Принцесса Нури
3888675	4605246003806	Чай Принцесса нури buket pk 100g bl lft	21794	Продукты питания (folder)/Чай и кофе/Чай	21818	Принцесса Нури
3888676	4605246004070	Чай Принцесса нури ceylon pk 25tb 50g bl	21794	Продукты питания (folder)/Чай и кофе/Чай	21818	Принцесса Нури
2498823	4605246000188	Чай Принцесса нури ceylon pk 50tb 100g bl	21794	Продукты питания (folder)/Чай и кофе/Чай	21818	Принцесса Нури
3888677	4605246004018	Чай Принцесса нури ceylon pk 50tb 100g bl #2	21794	Продукты питания (folder)/Чай и кофе/Чай	21818	Принцесса Нури
26396	4605246004933	Чай Принцесса нури earl grey 100пак*2g*18шт с/я /0493/	21794	Продукты питания (folder)/Чай и кофе/Чай	21818	Принцесса Нури
3888678	4605246011672	Чай Принцесса нури earl grey pk 25tb 50g bl	21794	Продукты питания (folder)/Чай и кофе/Чай	21818	Принцесса Нури
31532	4605246003240	Чай Принцесса нури earl grey отборный 250g тв/у	21794	Продукты питания (folder)/Чай и кофе/Чай	21818	Принцесса Нури
31993	4605246003233	Чай Принцесса нури earl grey чай листовой черный ароматизированный 100g [*36] 0323-36	21794	Продукты питания (folder)/Чай и кофе/Чай	21818	Принцесса Нури
3888679	4605246011665	Чай Принцесса нури keniyskiy pk 25tb 50g bl	21794	Продукты питания (folder)/Чай и кофе/Чай	21818	Принцесса Нури
3888680	7605236009433	Чай Принцесса нури limon Lemon pk 20tb prmd 0.036kg bl	21794	Продукты питания (folder)/Чай и кофе/Чай	21818	Принцесса Нури
3888681	4605246004100	Чай Принцесса нури limon Lemon pk 25tb 0.0375kg bl	21794	Продукты питания (folder)/Чай и кофе/Чай	21818	Принцесса Нури
137046	4605246000065	Чай Принцесса нури pekoe цейлон.чер.байх.250g	21794	Продукты питания (folder)/Чай и кофе/Чай	21818	Принцесса Нури
1763735	4605246009419	Чай Принцесса нури pekoe цейлонский черный байховый 20 пакетиков-пирамидок 36g	21794	Продукты питания (folder)/Чай и кофе/Чай	21818	Принцесса Нури
1763732	4605246009815	Чай Принцесса нури pekoe черный байховый крупнолистовой 200g тв/уп	21794	Продукты питания (folder)/Чай и кофе/Чай	21818	Принцесса Нури
3586734	4605246013508	Чай Принцесса нури айва и мята черный байховый 20x1.8g тв/уп	21794	Продукты питания (folder)/Чай и кофе/Чай	21818	Принцесса Нури
2498813	4605246002618	Чай Принцесса нури ароматиз асс 25x1.5g 0.0.375	21794	Продукты питания (folder)/Чай и кофе/Чай	21818	Принцесса Нури
168957	4605246002830	Чай Принцесса нури ассам жб 150g#2	21794	Продукты питания (folder)/Чай и кофе/Чай	21818	Принцесса Нури
1340357	460524600283	Чай Принцесса нури ассам инд жб 150g	21794	Продукты питания (folder)/Чай и кофе/Чай	21818	Принцесса Нури
1340373	460524600252	Чай Принцесса нури бергамот 25x1.5g 0.0.375	21794	Продукты питания (folder)/Чай и кофе/Чай	21818	Принцесса Нури
1340358	4820022860910	Чай Принцесса нури бест черный цейлонский 90g	21794	Продукты питания (folder)/Чай и кофе/Чай	21818	Принцесса Нури
1340359	7820272860910	Чай Принцесса нури бест черный цейлонский 90g #2	21794	Продукты питания (folder)/Чай и кофе/Чай	21818	Принцесса Нури
2498817	4605246001727	Чай Принцесса нури букет 0.050	21794	Продукты питания (folder)/Чай и кофе/Чай	21818	Принцесса Нури
1340360	4820022860903	Чай Принцесса нури букет с чайной почкой 90g	21794	Продукты питания (folder)/Чай и кофе/Чай	21818	Принцесса Нури
2498818	4605246003189	Чай Принцесса нури букет цейл лист 0.050	21794	Продукты питания (folder)/Чай и кофе/Чай	21818	Принцесса Нури
137048	4605246000072	Чай Принцесса нури букет цейл лист 100g	21794	Продукты питания (folder)/Чай и кофе/Чай	21818	Принцесса Нури
2498819	460524600320	Чай Принцесса нури букет цейл лист 250g	21794	Продукты питания (folder)/Чай и кофе/Чай	21818	Принцесса Нури
31529	4605246003196	Чай Принцесса нури букет цейлонский черный байховый 100g, Россия Минск ООО юмабел	21794	Продукты питания (folder)/Чай и кофе/Чай	21818	Принцесса Нури
1340361	201000000001	Чай Принцесса нури вишня черный 25 пак. 37.5g	21794	Продукты питания (folder)/Чай и кофе/Чай	21818	Принцесса Нури
1340363	4820022861283	Чай Принцесса нури высокогорный 100пак+25пак*2g	21794	Продукты питания (folder)/Чай и кофе/Чай	21818	Принцесса Нури
1340364	4820022860842	Чай Принцесса нури высокогорный 180g	21794	Продукты питания (folder)/Чай и кофе/Чай	21818	Принцесса Нури
2947015	4605246011368	Чай Принцесса нури высокогорный 200 пак без нитки	21794	Продукты питания (folder)/Чай и кофе/Чай	21818	Принцесса Нури
1340365	4820022861290	Чай Принцесса нури высокогорный 25пак*2g	21794	Продукты питания (folder)/Чай и кофе/Чай	21818	Принцесса Нури
1340366	4820022863546	Чай Принцесса нури высокогорный 25пак*2g + высокогорный 25пак*2g	21794	Продукты питания (folder)/Чай и кофе/Чай	21818	Принцесса Нури
1340367	4820022861306	Чай Принцесса нури высокогорный 50пак*2g	21794	Продукты питания (folder)/Чай и кофе/Чай	21818	Принцесса Нури
1841745	4605246000119	Чай Принцесса нури высокогорный pk 100g bl lft	21794	Продукты питания (folder)/Чай и кофе/Чай	21818	Принцесса Нури
1841747	4605246000249	Чай Принцесса нури высокогорный pk 100tb 0.2kg bl	21794	Продукты питания (folder)/Чай и кофе/Чай	21818	Принцесса Нури
3888682	4605246003837	Чай Принцесса нури высокогорный pk 250g bl lft #2	21794	Продукты питания (folder)/Чай и кофе/Чай	21818	Принцесса Нури
3888683	4603846001970	Чай Принцесса нури высокогорный pk 25tb 50g bl	21794	Продукты питания (folder)/Чай и кофе/Чай	21818	Принцесса Нури
3888684	4605246000256	Чай Принцесса нури высокогорный pk 25tb 50g bl #2	21794	Продукты питания (folder)/Чай и кофе/Чай	21818	Принцесса Нури
3888685	4605246001987	Чай Принцесса нури высокогорный pk 25tb 50g bl #3	21794	Продукты питания (folder)/Чай и кофе/Чай	21818	Принцесса Нури
3888686	4605246003974	Чай Принцесса нури высокогорный pk 25tb 50g bl #4	21794	Продукты питания (folder)/Чай и кофе/Чай	21818	Принцесса Нури
3888687	7605236001970	Чай Принцесса нури высокогорный pk 25tb 50g bl #5	21794	Продукты питания (folder)/Чай и кофе/Чай	21818	Принцесса Нури
2498821	4605246000195	Чай Принцесса нури высокогорный yarlychok pk 100tb 0.2kg bl	21794	Продукты питания (folder)/Чай и кофе/Чай	21818	Принцесса Нури
3888688	5601216002014	Чай Принцесса нури высокогорный yarlychok pk 100tb 0.2kg bl #2	21794	Продукты питания (folder)/Чай и кофе/Чай	21818	Принцесса Нури
3888689	4605246003981	Чай Принцесса нури высокогорный yarlychok pk 50tb 100g bl	21794	Продукты питания (folder)/Чай и кофе/Чай	21818	Принцесса Нури
31989	4605246003011	Чай Принцесса нури высокогорный байховый черный без ярлычка 30x 2g	21794	Продукты питания (folder)/Чай и кофе/Чай	21818	Принцесса Нури
1340368	4820022860750	Чай Принцесса нури высокогорный вор 45g	21794	Продукты питания (folder)/Чай и кофе/Чай	21818	Принцесса Нури
1340369	4820022860774	Чай Принцесса нури высокогорный гранулированый 90g	21794	Продукты питания (folder)/Чай и кофе/Чай	21818	Принцесса Нури
137050	4605246002410	Чай Принцесса нури высокогорный лист 50g	21794	Продукты питания (folder)/Чай и кофе/Чай	21818	Принцесса Нури
1340362	4820022860743	Чай Принцесса нури высокогорный лист 90g	21794	Продукты питания (folder)/Чай и кофе/Чай	21818	Принцесса Нури
1340370	4820022860934	Чай Принцесса нури высокогорный листовой 150g	21794	Продукты питания (folder)/Чай и кофе/Чай	21818	Принцесса Нури
31988	4605246002014	Чай Принцесса нури высокогорный цейлонский черный байховый пакетированные с/я 100x 2g	21794	Продукты питания (folder)/Чай и кофе/Чай	21818	Принцесса Нури
1841746	4605246000126	Чай Принцесса нури высокогорный черн байх.250g	21794	Продукты питания (folder)/Чай и кофе/Чай	21818	Принцесса Нури
1763733	4605246009396	Чай Принцесса нури высокогорный черн байх.цейлонск.с/я (100x 2g)+кружка	21794	Продукты питания (folder)/Чай и кофе/Чай	21818	Принцесса Нури
31519	4605246002441	Чай Принцесса нури высокогорный черный байховый 250g [*24] 0244-24-а1	21794	Продукты питания (folder)/Чай и кофе/Чай	21818	Принцесса Нури
