ID	UPCEAN	Name	CategoryID	CategoryName	BrandID	BrandName
2930572	4604060000091	Спазгель гель для наруж прим 2.5% 30g туба	1	Неклассифицированные/default	0	
2930573	4604060000107	Спазгель гель для наруж прим 2.5% 50g туба	1	Неклассифицированные/default	0	
4856079	4604060003603	Спазгель тхфп гель 2.5% 30g	210391	Лекарственные средства (folder)/Лекарственные средства	0	
525131	8901872000025	Спазго табл №100	1	Неклассифицированные/default	0	
525132	4820099170530	Спазмадол табл №24	1	Неклассифицированные/default	0	
525133	3800010613781	Спазмалгон р-р для в/в и в/м введ. 5ml №10 ампулы, фармахим холдинг еао, софарма АО	336954	Лекарственные средства (folder)/Анальгетики (НПВС и др. группы)	0	
525134	3800010612708	Спазмалгон р-р для ин в амп.2ml в уп №10x1 ампл 2ml, №10	210391	Лекарственные средства (folder)/Лекарственные средства	0	
525136	3800010613736	Спазмалгон р-р для ин в амп.5ml в уп №10x1 ампл 5ml, №10	210391	Лекарственные средства (folder)/Лекарственные средства	0	
525135	3800010613330	Спазмалгон р-р для инъекций амп. 2ml №5	210391	Лекарственные средства (folder)/Лекарственные средства	0	
525137	3800010613620	Спазмалгон р-р для инъекций амп. 5ml №5	210391	Лекарственные средства (folder)/Лекарственные средства	0	
525139	3800712040113	Спазмалгон табл №20	1	Неклассифицированные/default	0	
5081101	4630013790580	Спазмалгон табл №50	1	Неклассифицированные/default	0	
1354734	3800712440111	Спазмалгон табл №50 (балканфарма-дупница ад)	1	Неклассифицированные/default	0	
5081102	3850114240239	Спазмалгон эффект табл покр пленочной обол №10	1	Неклассифицированные/default	0	
525138	3800712840119	Спазмалгон №10 табл (балканфарма - дупница ад)	1	Неклассифицированные/default	0	
2757725	4607141998690	Спазмалгон №10 табл (здравле хфз АО)	1	Неклассифицированные/default	0	
5081100	4630013790597	Спазмалгон №20 таб	4832463	Лекарственные средства (folder)/Обезболивающие, жаропонижающие спазмалитики, НПВС	5486112	спазмалгон
2757726	4607141998706	Спазмалгон №20 табл (АО хфз здравле)	1	Неклассифицированные/default	0	
2757727	4607141998713	Спазмалгон №50 табл (АО хфз здравле)	1	Неклассифицированные/default	0	
525140	4602656000326	Спазмалин 5ml №25 амп раствор для инъекций торрент фармасьютикалс ЛТД	1	Неклассифицированные/default	0	
2766563	4602656001309	Спазмалин 5ml №5 амп	1	Неклассифицированные/default	0	
1701942	4602656001293	Спазмалин табл №20, торрент фармасьютикалс ЛТД	1	Неклассифицированные/default	0	
830988	4602656000319	Спазмалин №100 табл (торрент фармасьютикалс ЛТД)	1	Неклассифицированные/default	0	
2488393	4810201012827	Спазматон нео таб №20 бзмп до 01.02.18	1	Неклассифицированные/default	0	
5081104	4810201017228	Спазматон р-р для в/в и в/м введ амп 5ml №5 (ограниченный срок)	1	Неклассифицированные/default	0	
1787197	4810201008646	Спазматон р-р для ин 5ml, №10	210391	Лекарственные средства (folder)/Лекарственные средства	0	
2757728	4810201010779	Спазматон табл, №20	210391	Лекарственные средства (folder)/Лекарственные средства	0	
1787198	4810201008035	Спазматон табл, №50	210391	Лекарственные средства (folder)/Лекарственные средства	0	
4856080	4810201016214	Спазматон №20 табл	241824	Лекарственные средства (folder)/Аптека	0	
830989	09003804	Спазмекс 0.005 30табл	1	Неклассифицированные/default	0	
830990	09003834	Спазмекс 0.015 30 табл покр обол	210391	Лекарственные средства (folder)/Лекарственные средства	0	
326739	4028305000064	Спазмекс табл 5mg №30, про.мед.цс прага а.о., произведено др.р.пфлегер, химическая фабрика гмбх	1	Неклассифицированные/default	0	
326740	4028305000095	Спазмекс табл покр обол 15mg №30, про.мед.цс прага а.о., произведено др.р.пфлегер, химическая фабрика гмбх	1	Неклассифицированные/default	0	
1787199	4028305000125	Спазмекс табл покр обол 30mg №30, про.мед.цс прага а.о., произведено др.р.пфлегер, химическая фабрика гмбх	210391	Лекарственные средства (folder)/Лекарственные средства	0	
4856081	4602389000129	Спазмоанальган 0.5 №100 табл	241824	Лекарственные средства (folder)/Аптека	0	
2259979	3800089811255	Спазмоблок табл х20	1	Неклассифицированные/default	0	
525141	5413989190368	Спазмобрю р-р для инъекций 20mg амп. 2ml №10	210391	Лекарственные средства (folder)/Лекарственные средства	0	
525142	5413989190320	Спазмобрю табл 10mg №20	1	Неклассифицированные/default	0	
4856082	8584005125507	Спазмовералгин нео №10 табл	241824	Лекарственные средства (folder)/Аптека	0	
525143	8901087672345	Спазмогард р-р для инъекций амп. 5ml №5	210391	Лекарственные средства (folder)/Лекарственные средства	0	
525144	8901087672369	Спазмогард табл №100	1	Неклассифицированные/default	0	
293484	4601669001641	Спазмол табл 20шт упак контурн ячейк, пачка картон - фармстандарт-лексредства ОАО	210391	Лекарственные средства (folder)/Лекарственные средства	0	
293483	4601669002075	Спазмол табл 40mg пач. n100 фармстандарт лексредства, Россия	210391	Лекарственные средства (folder)/Лекарственные средства	0	
5081105	90016417	Спазмол табл 40mg №20 (фармстандарт-лексрества ОАО)	453365	Лекарственные средства (folder)/Спазмолитики, холецистолитики	0	
525145	8902006011238	Спазмолекс табл покр обол №200	210391	Лекарственные средства (folder)/Лекарственные средства	0	
1787200	4840456000546	Спазмолизин суппозиторий ректальныйв конт.яч.уп №5x2 суппозиторий ректальный 40mg, №10	210391	Лекарственные средства (folder)/Лекарственные средства	0	
525146	4013054001417	Спазмомен табл покр обол 40mg №30	210391	Лекарственные средства (folder)/Лекарственные средства	0	
293485	4607055132135	Спазмонет табл 10шт упак контурн ячейк (10) пачка картон - крка-рус ООО	210391	Лекарственные средства (folder)/Лекарственные средства	0	
293486	4607055132128	Спазмонет табл 10шт упак контурн ячейк (2) пачка картон - крка-рус ООО	210391	Лекарственные средства (folder)/Лекарственные средства	0	
5081106	51321420	Спазмонет форте 80mg №20 табл (ООО крка-рус)	453365	Лекарственные средства (folder)/Спазмолитики, холецистолитики	0	
293487	4607055132159	Спазмонет форте таблетки 80mg 10шт упак контурн ячейк (10) пачки картон	210391	Лекарственные средства (folder)/Лекарственные средства	0	
293488	4607055132142	Спазмонет форте таблетки 80mg 10шт упак контурн ячейк (2) пачки картон	210391	Лекарственные средства (folder)/Лекарственные средства	0	
2930574	3800021100140	Спазмофарм 500mg/мл+2mg/мл+0.02mg/мл в/м р-р 2ml №10 амп	1	Неклассифицированные/default	0	
525147	8594737351112	Спазмоцистенал 10ml капли	445741	Лекарственные средства (folder)/Урологические (выводящие мочевые конкременты...)	0	
293489	8906000570043	Спазоверин табл 100шт контейнер полистироловый, пачка картон - шрея лайф сайенсиз пвт.ЛТД	210391	Лекарственные средства (folder)/Лекарственные средства	0	
293491	8906000570067	Спазоверин табл 10шт упак контурн ячейк (2) пачка картон - шрея лайф сайенсиз пвт.ЛТД	210391	Лекарственные средства (folder)/Лекарственные средства	0	
293492	8906000571644	Спазоверин табл 10шт упак контурн ячейк (3) пачка картон - шрея лайф сайенсиз пвт.ЛТД	210391	Лекарственные средства (folder)/Лекарственные средства	0	
293490	8906000571668	Спазоверин табл 50шт контейнер полистироловый, пачка картон - шрея лайф сайенсиз пвт.ЛТД	210391	Лекарственные средства (folder)/Лекарственные средства	0	
293493	8906000571651	Спазоверин таблетки 80mg 10шт упак контурн ячейк (2) пачки картон	210391	Лекарственные средства (folder)/Лекарственные средства	0	
236730	4607126902964	Спайдер рубит для уничтожения мух 16g	276445	Растениеводство (folder)/Удобрение	0	
49439	8411104014541	Спайка byly воск для тела банка + салфетки для интимной гигиены в подарок	5586	Косметика (folder)/Косметика	1333	BYLY
5081108	4607005326492	Спайка кр баттер для рук мечта питат +жидкость для снятия лака мечта 100	1051	Косметика (folder)/Демакияж	0	
2488395	4605922311683	Спайка ополаскиватель для десен лб с экстр.коры дуба и пихты	203	Гигиена (folder)/Уход за зубами и ртом (folder)/Уход за зубами и ртом	7461	Лесной бальзам
1124113	4015000993647	Спайка семейная Schauma 7трав 380ml+для муж 380ml+для девоч 225	1	Неклассифицированные/default	11814	Schauma
3914274	4604049091584	Спайка сред-воaos бальзамж.м.1000+500ml	274405	Хозяйственные товары (folder)/Бытовая химия (folder)/Средство для мытья посуды	14967	AOS
3754091	4612740560049	Спайс p 50g tb	2310657	Продукты питания (folder)/CULINARY	3754089	SPAYS
3754093	4612740560018	Спайс pepper Black pepper p bb 50g #2	30882	Продукты питания (folder)/Приправы и специи	3754089	SPAYS
3754094	4612740560520	Спайс pepper Black pepper p bb 50g #3	30882	Продукты питания (folder)/Приправы и специи	3754089	SPAYS
3537661	4612740560094	Спайс перец душистый горошком 30g	1	Неклассифицированные/default	0	
4856083	8901767210263	Спаковин 0.02/мл 2ml №25 амп	241824	Лекарственные средства (folder)/Аптека	0	
293494	8901767211062	Спаковин раствор для инъекций 20mg/мл 2ml ампулы темного стекла (25) пачки картон	210391	Лекарственные средства (folder)/Лекарственные средства	0	
293495	8901767211055	Спаковин раствор для инъекций 20mg/мл 2ml ампулы темного стекла (5) пачки картон	210391	Лекарственные средства (folder)/Лекарственные средства	0	
4856084	4603779009180	Спалгин форте №10 табл покр обол	241824	Лекарственные средства (folder)/Аптека	0	
5739190	4627150948875	Спальник FHM Group Galaxy, -5 синий/серый l 000049-0021-l	5118674	Спорт и отдых (folder)/Спальный мешок	5281847	fhm group
5739191	4627150948851	Спальник FHM Group Galaxy, -5 синий/серый, r 000048-0021-r	5118674	Спорт и отдых (folder)/Спальный мешок	5281847	fhm group
5739192	4001167822616	Спальник zapf для куклы Baby born спок?йн? сни (113428)	712606	Игрушки (folder)/Игрушка кукла	0	
830994	4690347026328	Спальник-кокон novus solo 250 230x 80cm (190т with r pol, х/ф 125g/см2, 2-сл)	278582	Спорт и отдых (folder)/Спорт и отдых	0	
830995	4690347026359	Спальник-одеяло novus large 250 200x 85cm (170t with r pol, х/ф 250g/см2, 1слой)	278582	Спорт и отдых (folder)/Спорт и отдых	0	
830996	4690347026380	Спальник-одеяло novus standart 200 190x 75cm (170t with r pol, х/ф 200g/см2, 1слой)	278582	Спорт и отдых (folder)/Спорт и отдых	0	
5739193	4013331822537	Спальник-одеяло solex 82253	1	Неклассифицированные/default	0	
5739194	4823081502111	Спальник-одеяло terra incognita asleep 200	1	Неклассифицированные/default	5225177	Terra incognita
5739196	4823081502166	Спальник-одеяло terra incognita asleep 300	1	Неклассифицированные/default	5225177	Terra incognita
5739197	4823081502197	Спальник-одеяло terra incognita asleep 400	1	Неклассифицированные/default	5225177	Terra incognita
5739199	4823081503576	Спальник-одеяло terra incognita asleep jr 300	1	Неклассифицированные/default	5225177	Terra incognita
5739200	4823081502333	Спальник-одеяло terra incognita asleep wide 400	1	Неклассифицированные/default	5225177	Terra incognita
5739202	4823081502364	Спальник-одеяло terra incognita co 200 #2	1	Неклассифицированные/default	5225177	Terra incognita
5739201	4823081502357	Спальник-одеяло terra incognita co 200 army	1	Неклассифицированные/default	5225177	Terra incognita
5739203	4823081502388	Спальник-одеяло terra incognita co 300	1	Неклассифицированные/default	5225177	Terra incognita
5739205	4743131057791	Спальник-одеяло tramp King regular	1	Неклассифицированные/default	3785778	TRAMP
5739206	4823082700370	Спальник-одеяло кемпинг scout	1	Неклассифицированные/default	0	
5739207	4627173950817	Спальное место выдвижное cilek Black с полками 90x 190см 20.58.1308.00	5121371	Кровать детская	5249578	cilek
5739208	4627152091364	Спальное место выдвижное cilek flora 90x 180см 20.01.1320.00	5121371	Кровать детская	5249578	cilek
5739209	4627152097625	Спальное место выдвижное cilek Romantic с полками 190x 90см 20.21.1314.00	5121371	Кровать детская	5249578	cilek
5739210	4627152097830	Спальное место выдвижное cilek White 190x 90см 20.54.1303.00	5121371	Кровать детская	5249578	cilek
5739211	4627152097847	Спальное место выдвижное cilek White с полками 190x 90см 20.54.1304.00	5121371	Кровать детская	5249578	cilek
5134847	4000984208160	Спальный блок britax romer smile iii Frost grey, brown 2000033608	5134846	люльки-модули	5134665	britax romer
5739212	4000984201222	Спальный блок britax romer smile iii Pure beige 2000032754	5494032	люльки для колясок	5134665	britax romer
5446576	4251158227917	Спальный блок cybex для коляски priam lux autumn Gold 517000253	1	Неклассифицированные/default	5117026	cybex
5739213	6931993644589	Спальный мешок 2-к-ув флис, вояж equipment	5118674	Спорт и отдых (folder)/Спальный мешок	0	
3914275	6970610162174	Спальный мешок 200x 150cm	5163211	Мебель (folder)/Мебель садовая и дачная	0	
5739214	6931958988642	Спальный мешок 3-к с сеткой, вояж equipment	5118674	Спорт и отдых (folder)/Спальный мешок	0	
5739215	6931993641007	Спальный мешок 4, вояж equipment 200x 75см	5118674	Спорт и отдых (folder)/Спальный мешок	0	
5739216	4260286161109	Спальный мешок alexika aleut oliv, правый	5118674	Спорт и отдых (folder)/Спальный мешок	5313420	alexika
5739217	4260286161673	Спальный мешок alexika alpha (Platinum) (8208.10102)	5118674	Спорт и отдых (folder)/Спальный мешок	5313420	alexika
5739218	4260286161413	Спальный мешок alexika canada Plus одеяло серый, левая 9266.01072/alexika	5118674	Спорт и отдых (folder)/Спальный мешок	5313420	alexika
5739219	4260286161420	Спальный мешок alexika canada Plus правый (9266.01071) 9266.01071/alexika	5118674	Спорт и отдых (folder)/Спальный мешок	5313420	alexika
5739220	4260286161390	Спальный мешок alexika comet (9261.01052)	5118674	Спорт и отдых (folder)/Спальный мешок	5313420	alexika
5739221	4260286161628	Спальный мешок alexika delta (Platinum) (8204.10101)	5118674	Спорт и отдых (folder)/Спальный мешок	5313420	alexika
5739222	4260286161611	Спальный мешок alexika delta (Platinum) (8204.10102)	5118674	Спорт и отдых (folder)/Спальный мешок	5313420	alexika
5739223	4260286161642	Спальный мешок alexika delta compact (Platinum) (8205.1010)	5118674	Спорт и отдых (folder)/Спальный мешок	5313420	alexika
5739224	4260286161079	Спальный мешок alexika forest compact левосторонняя молния 9231.01052	5118674	Спорт и отдых (folder)/Спальный мешок	5313420	alexika
5739225	4260286161086	Спальный мешок alexika forester compact (9231.01051)	5118674	Спорт и отдых (folder)/Спальный мешок	5313420	alexika
5739226	4260286161055	Спальный мешок alexika forester, левый	5118674	Спорт и отдых (folder)/Спальный мешок	5313420	alexika
5739227	4260286161062	Спальный мешок alexika forester, правый	5118674	Спорт и отдых (folder)/Спальный мешок	5313420	alexika
5739228	4260286165183	Спальный мешок alexika iceland (9228.01071)	5118674	Спорт и отдых (folder)/Спальный мешок	5313420	alexika
5424093	4260286165190	Спальный мешок alexika iceland (9228.01072)	1	Неклассифицированные/default	5313420	alexika
5739229	4260286161178	Спальный мешок alexika iceland красный, левый	5118674	Спорт и отдых (folder)/Спальный мешок	5313420	alexika
5739230	4260286161185	Спальный мешок alexika iceland красный, правый	5118674	Спорт и отдых (folder)/Спальный мешок	5313420	alexika
5739231	4260286161048	Спальный мешок alexika mountain Baby (9226.01011)	5118674	Спорт и отдых (folder)/Спальный мешок	5313420	alexika
5739233	4260286161017	Спальный мешок alexika mountain child левосторонняя молния 9225.01052	5118674	Спорт и отдых (folder)/Спальный мешок	5313420	alexika
5739232	4260286161024	Спальный мешок alexika mountain child правосторонняя молния 9225.01051	5118674	Спорт и отдых (folder)/Спальный мешок	5313420	alexika
5739234	4260286160980	Спальный мешок alexika mountain compact (9223.01051)	5118674	Спорт и отдых (folder)/Спальный мешок	5313420	alexika
5739235	4260286160973	Спальный мешок alexika mountain compact левый (9223.01052) 9223.01052/alexika	5118674	Спорт и отдых (folder)/Спальный мешок	5313420	alexika
5739236	4260286160997	Спальный мешок alexika mountain scout левосторонняя молния 9224.01052	5118674	Спорт и отдых (folder)/Спальный мешок	5313420	alexika
5739237	4260286160935	Спальный мешок alexika mountain левосторонняя молния 9221.01012	5118674	Спорт и отдых (folder)/Спальный мешок	5313420	alexika
5739238	4260286161581	Спальный мешок alexika omega Ice (Platinum) (8209.10101)	5118674	Спорт и отдых (folder)/Спальный мешок	5313420	alexika
5739239	4260286161574	Спальный мешок alexika omega Ice (Platinum) (8209.10102)	5118674	Спорт и отдых (folder)/Спальный мешок	5313420	alexika
5739240	4260286161543	Спальный мешок alexika omicron (Platinum) (8202.10101)	5118674	Спорт и отдых (folder)/Спальный мешок	5313420	alexika
5739241	4260286161536	Спальный мешок alexika omicron (Platinum) (8202.10102)	5118674	Спорт и отдых (folder)/Спальный мешок	5313420	alexika
5739243	4260286161192	Спальный мешок alexika siberia (9251.01012)	5118674	Спорт и отдых (folder)/Спальный мешок	5313420	alexika
5739245	4260286162960	Спальный мешок alexika siberia compact Plus (9272.01012)	5118674	Спорт и отдых (folder)/Спальный мешок	5313420	alexika
5739244	4260286162762	Спальный мешок alexika siberia compact Plus зеленый, правый (для детей и подростков) 9272.01011	5118674	Спорт и отдых (folder)/Спальный мешок	5313420	alexika
5739246	4260286161246	Спальный мешок alexika siberia Plus (9252.01011)	5118674	Спорт и отдых (folder)/Спальный мешок	5313420	alexika
5739247	4260286161239	Спальный мешок alexika siberia Plus (9252.01012)	5118674	Спорт и отдых (folder)/Спальный мешок	5313420	alexika
5739249	4260286161253	Спальный мешок alexika siberia wide Plus одеяло серый, левая 9254.01072	5118674	Спорт и отдых (folder)/Спальный мешок	5313420	alexika
5739250	4260286161260	Спальный мешок alexika siberia wide Plus одеяло серый, правая 9254.01071	5118674	Спорт и отдых (folder)/Спальный мешок	5313420	alexika
5739251	4260286161284	Спальный мешок alexika siberia wide transformer (9255.01071)	5118674	Спорт и отдых (folder)/Спальный мешок	5313420	alexika
5739252	4260286161277	Спальный мешок alexika siberia wide transformer (9255.01072)	5118674	Спорт и отдых (folder)/Спальный мешок	5313420	alexika
5739248	4260286161222	Спальный мешок alexika siberia wide правосторонняя молния 9253.01071	5118674	Спорт и отдых (folder)/Спальный мешок	5313420	alexika
5739242	4260286161208	Спальный мешок alexika siberia правосторонняя молния 9251.01011	5118674	Спорт и отдых (folder)/Спальный мешок	5313420	alexika
