ID	UPCEAN	Name	CategoryID	CategoryName	BrandID	BrandName
4189634	5099921202322	Cd Diana damrau donna opera and concert arias by mozart	4093300	Медиа (folder)/Media	0	
4189635	828766449020	Cd Diana degarmo Blue skies	4093300	Медиа (folder)/Media	0	
4189636	068944005024	Cd Diana krall featuring John clayton&Jeff hamilton stepping out	4093300	Медиа (folder)/Media	0	
4189637	602517037120	Cd Diana krall from this moment on	4093300	Медиа (folder)/Media	0	
4189638	602498620465	Cd Diana krall girl in the other room	4093300	Медиа (folder)/Media	0	
4189639	602498648247	Cd Diana krall girl in the other room [dualdisc]	4093300	Медиа (folder)/Media	0	
4189640	068944845125	Cd Diana krall only trust your heart	4093300	Медиа (folder)/Media	0	
4189641	602527157405	Cd Diana krall quiet nights [de luxe edition]	4093300	Медиа (folder)/Media	0	
4189642	602498615331	Cd Diana krall the girl in the other room	4093300	Медиа (folder)/Media	0	
4189643	725095221825	Cd Diana krall, vince benedette meets Diana krall, 2002 1990 tcbrecords inc	4093300	Медиа (folder)/Media	0	
4189644	641444908523	Cd Diana lorden fighting gravity	4093300	Медиа (folder)/Media	0	
4189645	5050467690127	Cd Diana navarro no te olvides de mi	4093300	Медиа (folder)/Media	0	
4189646	666740712223	Cd Diana rae a noel nighty Night	4093300	Медиа (folder)/Media	0	
4189647	602517078598	Cd Diana ross 20th Century masters the millennium collection the best of Diana ross&the supremes	4093300	Медиа (folder)/Media	0	
4189648	602498870037	Cd Diana ross Blue	4093300	Медиа (folder)/Media	0	
4189649	602498790786	Cd Diana ross definitive collection [hip-o]	4093300	Медиа (folder)/Media	0	
4189650	602517805422	Cd Diana ross definitive collection [motown]	4093300	Медиа (folder)/Media	0	
4189651	077779339129	Cd Diana ross greatest hits live	4093300	Медиа (folder)/Media	0	
4189652	737463115728	Cd Diana ross someday we'll be together (remix)	4093300	Медиа (folder)/Media	0	
4189653	737463512428	Cd Diana ross&marvin gaye Diana&marvin	4093300	Медиа (folder)/Media	0	
4189654	783707322025	Cd Diana senechal fish wigs hats rats	4093300	Медиа (folder)/Media	0	
4189655	724349306721	Cd Diana sings previn plays/somebody l dinah shore	4093300	Медиа (folder)/Media	0	
4189656	634479511929	Cd Diana wee your Love remains	4093300	Медиа (folder)/Media	0	
4189657	634479273629	Cd Diana williamson deer in the headlights	4093300	Медиа (folder)/Media	0	
4189658	765481239720	Cd Diana&eli rimas Del corazon	4093300	Медиа (folder)/Media	0	
4189659	802593352128	Cd diane arkenstone best of diane arkenstone	4093300	Медиа (folder)/Media	0	
4189660	807315110123	Cd diane birch bible belt	4093300	Медиа (folder)/Media	0	
4189661	783707385921	Cd diane devlin tidal moon	4093300	Медиа (folder)/Media	0	
4189662	829757386324	Cd diane durrett chill	4093300	Медиа (folder)/Media	0	
4189663	634479640322	Cd diane falcone a promise of no Secret	4093300	Медиа (folder)/Media	0	
4189664	634479486128	Cd diane falcone release	4093300	Медиа (folder)/Media	0	
4189665	635759127328	Cd diane gentes a lifetime left to cry	4093300	Медиа (folder)/Media	0	
4189666	783707517322	Cd diane hubka you inspire me	4093300	Медиа (folder)/Media	0	
4189667	789577037625	Cd diane jarvi flying into Blue	4093300	Медиа (folder)/Media	0	
4189668	789577009226	Cd diane jarvi revontuli (northern lights)	4093300	Медиа (folder)/Media	0	
4189669	623667202282	Cd diane lum beautiful hate	4093300	Медиа (folder)/Media	0	
4189670	634479440328	Cd diane marino quartet a sleepin' bee	4093300	Медиа (folder)/Media	0	
4189671	634479594526	Cd diane ponzio thanks to you	4093300	Медиа (folder)/Media	0	
4189672	621365056923	Cd diane ransdell Diana canta La venganza nada mas que ver	4093300	Медиа (folder)/Media	0	
4189673	829757487823	Cd diane scanlon diane scanlon	4093300	Медиа (folder)/Media	0	
4189674	4988005516923	Cd diane schuur diane schuur&the count basie orchestra	4093300	Медиа (folder)/Media	0	
4189675	888072306141	Cd diane schuur some other time	4093300	Медиа (folder)/Media	0	
4189676	829757255026	Cd diane silva haroutunian gakavig-educational&traditional songs for children in armenian	4093300	Медиа (folder)/Media	0	
4189677	664980008120	Cd diane steinberg-lewis the lord's prayer (a tribute to the Queen)	4093300	Медиа (folder)/Media	0	
4189678	634479399725	Cd diane tatum and kidz 4 kidz the Magic Garden	4093300	Медиа (folder)/Media	0	
4189679	829757174822	Cd diane willis and John fish improvisations from the other side	4093300	Медиа (folder)/Media	0	
4189680	786851347227	Cd diane zeigler these are the roots	4093300	Медиа (folder)/Media	0	
4189681	634479832420	Cd dianna heart to heart	4093300	Медиа (folder)/Media	0	
4189682	626776722023	Cd dianne de las casas jambalaya stories with louisiana flavor	4093300	Медиа (folder)/Media	0	
4189683	634479192524	Cd dianne dugaw dangerous examples--fighting&sailing women in song	4093300	Медиа (folder)/Media	0	
4189684	641444932221	Cd dianne gire the simple Life	4093300	Медиа (folder)/Media	0	
4189685	634479496929	Cd dianne killen pattern of my heart	4093300	Медиа (folder)/Media	0	
4189686	094637554425	Cd dianne reeves music for lovers	4093300	Медиа (folder)/Media	0	
4189687	094638965824	Cd dianne reeves when you know	4093300	Медиа (folder)/Media	0	
4189691	075992456623	Cd dibango, manu wakafrika	4093300	Медиа (folder)/Media	0	
4189692	809274485823	Cd dicaire, veronic veronic dicaire	4093300	Медиа (folder)/Media	0	
4189693	090771625120	Cd dick dale King of the surf guitar [sundazed]	4093300	Медиа (folder)/Media	0	
4189694	090771118424	Cd dick dale surfer???s choice [bonus tracks]	4093300	Медиа (folder)/Media	0	
4189695	634479578083	Cd dick dedrick hymnbook history	4093300	Медиа (folder)/Media	0	
4189696	783707441221	Cd dick derry house of fiction	4093300	Медиа (folder)/Media	0	
4189697	783707393827	Cd dick derry moon	4093300	Медиа (folder)/Media	0	
4189698	880059002428	Cd dick eliot hushabye (never issued)	4093300	Медиа (folder)/Media	0	
4189699	880059002329	Cd dick eliot Night and Day (never issued)	4093300	Медиа (folder)/Media	0	
4189700	880059002220	Cd dick eliot tenderly (never issued)	4093300	Медиа (folder)/Media	0	
4189701	611587101822	Cd dick gaughan a different kind of Love song	4093300	Медиа (folder)/Media	0	
4189702	714577110122	Cd dick gaughan live in edinburgh	4093300	Медиа (folder)/Media	0	
4189703	611587105820	Cd dick gaughan outlaws&dreamers	4093300	Медиа (folder)/Media	0	
4189704	611587102720	Cd dick gaughan redwood cathedral	4093300	Медиа (folder)/Media	0	
4189705	611587101624	Cd dick gaughan sail on	4093300	Медиа (folder)/Media	0	
4189706	611587101723	Cd dick gaughan/andy irvine parallel lines	4093300	Медиа (folder)/Media	0	
4189707	634479077425	Cd dick griffin a Dream for rashaan	4093300	Медиа (folder)/Media	0	
4189708	634479077326	Cd dick griffin all blues	4093300	Медиа (folder)/Media	0	
4189709	634479348723	Cd dick hindman Secret Garden	4093300	Медиа (folder)/Media	0	
4189710	634479532528	Cd dick hindman sheena's song	4093300	Медиа (folder)/Media	0	
4189711	780941134827	Cd dick hyman Century of jazz piano [6 discs] [bonus DVD]	4093300	Медиа (folder)/Media	0	
4189712	602977056624	Cd dick Lopez past Perfect gladiolas	4093300	Медиа (folder)/Media	0	
4189713	820215829124	Cd dick mcdonough chronological order	4093300	Медиа (folder)/Media	0	
4189714	786497001422	Cd dick mitchell East meets West	4093300	Медиа (folder)/Media	0	
4189715	649288202524	Cd dick siegel a Little pain never hurt	4093300	Медиа (folder)/Media	0	
4189716	783707620725	Cd dick smith smoke damage	4093300	Медиа (folder)/Media	0	
4189718	8712705054654	Cd dick van altena sn?w ien mien hart	4093300	Медиа (folder)/Media	0	
4189719	634479551321	Cd dick van dick dicktastrophe	4093300	Медиа (folder)/Media	0	
4189720	634479313028	Cd dick weller New West	4093300	Медиа (folder)/Media	0	
4189721	731383597923	Cd dick, andy andy dick&the bitches of the Century	4093300	Медиа (folder)/Media	0	
4189726	634479449321	Cd dick-n-jayne meet...dick-n-jayne enhanced CD	4093300	Медиа (folder)/Media	0	
4189722	682161022628	Cd dickens hazel it's hard to tell the sing	4093300	Медиа (folder)/Media	0	
4189723	731455992922	Cd dickerson walt impressions of a patch of	4093300	Медиа (folder)/Media	0	
4189724	053993320525	Cd dickie goodman&friends greatest fables	4093300	Медиа (folder)/Media	0	
4189725	696998646421	Cd Dickinson, bruce tattooed millionaire (expanded)	4093300	Медиа (folder)/Media	0	
4189727	652017774124	Cd dicky overbey honkytonkmemories.com	4093300	Медиа (folder)/Media	0	
4189728	074643334822	Cd dictators go girl crazy	4093300	Медиа (folder)/Media	0	
4189729	053436824726	Cd dictators New york New york	4093300	Медиа (folder)/Media	0	
4189730	076732916926	Cd diddley / waters / wolf Super Super blues band	4093300	Медиа (folder)/Media	0	
4189731	076732937327	Cd diddley bo his best-remastered	4093300	Медиа (folder)/Media	0	
4189732	076731950228	Cd diddley bo the chess Box	4093300	Медиа (folder)/Media	0	
4189733	711952710038	Cd didjworks citizen of the world	4093300	Медиа (folder)/Media	0	
4189734	711952100723	Cd didjworks collective unconscious	4093300	Медиа (folder)/Media	0	
4189735	711952710021	Cd didjworks Grand central live	4093300	Медиа (folder)/Media	0	
4189736	711952100822	Cd didjworks tranceformation	4093300	Медиа (folder)/Media	0	
4189737	886973070925	Cd dido safe trip Home	4093300	Медиа (folder)/Media	0	
4189738	886974032120	Cd dido safe trip Home [CD/ DVD]	4093300	Медиа (folder)/Media	0	
4189739	4019593893728	Cd die ?rzte komm zur?ck / die banane (unplugged)	4093300	Медиа (folder)/Media	0	
4189740	731458786429	Cd die ?rzte manchmal haben frauen	4093300	Медиа (folder)/Media	0	
4189741	731458705628	Cd die ?rzte rock'n'roll-?bermensch	4093300	Медиа (folder)/Media	0	
4189742	4019593893421	Cd die ?rzte unplugged rock'n'roll realschule	4093300	Медиа (folder)/Media	0	
4189743	731458775522	Cd die ?rzte wie es geht	4093300	Медиа (folder)/Media	0	
4189744	731458764823	Cd die ?rzte yoko ono	4093300	Медиа (folder)/Media	0	
4189745	654436700623	Cd die apokalyptischen reiter licht [bonus tracks]	4093300	Медиа (folder)/Media	0	
4189746	727361171407	Cd die apokalyptischen reiter riders on the storm (limited digipak)	4093300	Медиа (folder)/Media	0	
4189747	886975449026	Cd die fantastischen vier 4 dimension [anniversary edition]	4093300	Медиа (folder)/Media	0	
4189748	886975734320	Cd die flippers aloha he-stern der s??dsee	4093300	Медиа (folder)/Media	0	
4189749	743219636126	Cd die Happy cry for more	4093300	Медиа (folder)/Media	0	
4189750	9399603112526	Cd die krupps a tribute to metallica	4093300	Медиа (folder)/Media	0	
4189751	743219420527	Cd die schafer am heiligen abend	4093300	Медиа (folder)/Media	0	
4189752	606627810321	Cd die schlauberger (dsb) call it what you want	1	Неклассифицированные/default	0	
4189753	660662785525	Cd die schlauberger total kaos	4093300	Медиа (folder)/Media	0	
4189754	880532010124	Cd die symphony the everlasting shame	4093300	Медиа (folder)/Media	0	
4189755	880978000017	Cd die warzau : convenience	1	Неклассифицированные/default	0	
4189756	075678229527	Cd die warzau big Electric metal bass face	4093300	Медиа (folder)/Media	0	
4189757	044006650524	Cd die г rzte unplugged rock'n'roll realschule	4093300	Медиа (folder)/Media	0	
4189758	624060951197	Cd diego James the cypress Hills of saskatchewan	4093300	Медиа (folder)/Media	0	
4189759	633913992225	Cd diego's umbrella like the taste	1	Неклассифицированные/default	0	
4189760	711574463121	Cd diegrinder goin' down	4093300	Медиа (folder)/Media	0	
4189761	724353981402	Cd dierks bentley dierks bentley	4093300	Медиа (folder)/Media	0	
4189762	5099950215829	Cd dierks bentley feel that fire	4093300	Медиа (folder)/Media	0	
4189763	5099920907020	Cd dierks bentley greatest hits every mile a memory	4093300	Медиа (folder)/Media	0	
4189764	094636732008	Cd dierks bentley Long trip alone	4093300	Медиа (folder)/Media	0	
4189765	820997800120	Cd dieselboy project human	4093300	Медиа (folder)/Media	0	
4189766	820997802421	Cd dieselboy substance d	4093300	Медиа (folder)/Media	0	
4189767	016900016447	Cd diet chrr gingr ale 2l 67.6oz	1	Неклассифицированные/default	0	
4189768	4047179373920	Cd dieter moebius neumeier	4093300	Медиа (folder)/Media	0	
4189769	4047179374323	Cd dieter moebius tonspuren	4093300	Медиа (folder)/Media	0	
4189770	795967777026	Cd dietmar scherf nice to meet ya!	4093300	Медиа (folder)/Media	0	
4189771	724357475426	Cd dietrich fischer-dieskau schubert lieder	4093300	Медиа (folder)/Media	0	
4189772	074645320922	Cd dietrich, marlene the cosmopolitan	4093300	Медиа (folder)/Media	0	
4189773	696998617124	Cd diffie, Joe 16 biggest hits	4093300	Медиа (folder)/Media	0	
4189774	074646981528	Cd diffie, Joe a Night to remember	4093300	Медиа (folder)/Media	0	
4189775	074646913727	Cd diffie, Joe greatest hits	4093300	Медиа (folder)/Media	0	
4189776	696998537323	Cd diffie, Joe in another world	4093300	Медиа (folder)/Media	0	
4189777	074644747720	Cd diffie, Joe regular Joe	4093300	Медиа (folder)/Media	0	
4189778	720616224620	Cd diffuser injury loves melody	4093300	Медиа (folder)/Media	0	
4189779	601215318722	Cd dig Life like	4093300	Медиа (folder)/Media	0	
4189780	634479522321	Cd digable Cat skratch traxx	4093300	Медиа (folder)/Media	0	
4189781	724382775829	Cd digable planets reachin' (New refutation..)	4093300	Медиа (folder)/Media	0	
4189782	821960008628	Cd digby wallace sweet talk	4093300	Медиа (folder)/Media	0	
4189783	783707290027	Cd digger lou Hot runnin' Water stories of tennessee	4093300	Медиа (folder)/Media	0	
4189784	634479302725	Cd digger phelps see you in may	4093300	Медиа (folder)/Media	0	
4189785	801056707826	Cd digi pak opeth still Life	4093300	Медиа (folder)/Media	0	
4189786	711517671026	Cd digidred Love in dialects (ep version)	4093300	Медиа (folder)/Media	0	
4189787	789577083523	Cd diginova our hamburg years	4093300	Медиа (folder)/Media	0	
4189788	666449573521	Cd digipack audio CD smoke signals to satellites by icarus jones&dbeat	4093300	Медиа (folder)/Media	0	
2539064	696998632226	Cd digipack boston boston (remaster)	4093300	Медиа (folder)/Media	0	
4189789	780014482824	Cd digital activity christmas vol. 1	4093300	Медиа (folder)/Media	0	
4189790	687474050122	Cd digital audible point mogul run (CD single)	4093300	Медиа (folder)/Media	0	
4189791	884501158183	Cd digital audio scott mclean Rock and roll karma album	4093300	Медиа (folder)/Media	0	
4189792	694769001325	Cd digital bear mondrian	4093300	Медиа (folder)/Media	0	
4189793	634479155420	Cd digital beat underground industry	4093300	Медиа (folder)/Media	0	
4189794	634479363023	Cd digital Black the chaotic method	4093300	Медиа (folder)/Media	0	
4189795	829757434926	Cd digital droo active lancer Original soundtrack	4093300	Медиа (folder)/Media	0	
4189796	053436822227	Cd digital k King tubby's in the house	4093300	Медиа (folder)/Media	0	
4189797	634479245428	Cd digital music pioneers exploring the universe	4093300	Медиа (folder)/Media	0	
4189798	098700339827	Cd digital rockers because i Love you	4093300	Медиа (folder)/Media	0	
4189799	634479454028	Cd digital starr&dj erx conflation e.p.	4093300	Медиа (folder)/Media	0	
4189800	076753364256	Cd digital timer A5m6 1ct	1	Неклассифицированные/default	0	
4189801	4006758451725	Cd digital underground by sons of the p	4093300	Медиа (folder)/Media	0	
4189802	634479555121	Cd digitalis season of the reason	4093300	Медиа (folder)/Media	0	
4189803	5032617001625	Cd digitalis the third state	4093300	Медиа (folder)/Media	0	
4189804	634479082924	Cd digitalpr algorithm	4093300	Медиа (folder)/Media	0	
4189805	619981050326	Cd dignen dignen	4093300	Медиа (folder)/Media	0	
4189806	791022134926	Cd dignus looking for a New way	4093300	Медиа (folder)/Media	0	
4189807	783707494623	Cd dignus mudhouse serenade	4093300	Медиа (folder)/Media	0	
3632489	4607059092183	Cd digweed John transitions 4	4093300	Медиа (folder)/Media	0	
4189808	081227818524	Cd digweed, John mmii	4093300	Медиа (folder)/Media	0	
1861769	7896046701055	Cd diiscipline Care liss 250ml	1	Неклассифицированные/default	0	
4189809	634479580024	Cd dijitol kitchin snax for the masses	4093300	Медиа (folder)/Media	0	
4189810	724353147723	Cd dilated peoples expansion Team	4093300	Медиа (folder)/Media	0	
4189811	724354088926	Cd dilated peoples neighborhood watch	4093300	Медиа (folder)/Media	0	
4189812	724352331024	Cd dilated peoples the platform	4093300	Медиа (folder)/Media	0	
4189813	688717000621	Cd dillinger, daz this is the Life i lead	4093300	Медиа (folder)/Media	0	
4189814	634479607226	Cd dillon woods seasons	4093300	Медиа (folder)/Media	0	
4189815	5026618100555	Cd dilwale dulhania le jayenge	4093300	Медиа (folder)/Media	0	
4189816	619981107129	Cd dim mak epoch	4093300	Медиа (folder)/Media	0	
4189817	634479631320	Cd dimbodius not Love ep	4093300	Медиа (folder)/Media	0	
4189818	829757451220	Cd dimdred nameless faces	4093300	Медиа (folder)/Media	0	
4189819	825083160225	Cd dimensi????n latina exitos de oro	4093300	Медиа (folder)/Media	0	
4189820	074646355626	Cd dimeola, Al anthology	4093300	Медиа (folder)/Media	0	
4189821	074644748222	Cd dimeola, Al casino	4093300	Медиа (folder)/Media	0	
4189822	074643765428	Cd dimeola, Al Electric rendezvous	4093300	Медиа (folder)/Media	0	
4189823	074643446129	Cd dimeola, Al elegant gypsy	4093300	Медиа (folder)/Media	0	
4189824	074643407427	Cd dimeola, Al land of the midnight Sun	4093300	Медиа (folder)/Media	0	
4189825	075679274427	Cd dimeola, Al plays piazzolla	4093300	Медиа (folder)/Media	0	
4189826	074643894425	Cd dimeola, Al scenario	4093300	Медиа (folder)/Media	0	
4189827	074644611724	Cd dimeola, Al splendido hotel	4093300	Медиа (folder)/Media	0	
4189828	074643837323	Cd dimeola, Al tour de Force live	4093300	Медиа (folder)/Media	0	
4189829	724384912222	Cd dimitri from Paris a Night at the Playboy mansion	4093300	Медиа (folder)/Media	0	
4189830	724381171226	Cd dimitri from Paris after the Playboy mansion	4093300	Медиа (folder)/Media	0	
4189831	075678308123	Cd dimitri from Paris sacrebleu	4093300	Медиа (folder)/Media	0	
4189832	706301783221	Cd dimitri from Paris sacrebleu #2	4093300	Медиа (folder)/Media	0	
4189833	793018550727	Cd dimitri from Paris united dj's ?/rewind	4093300	Медиа (folder)/Media	0	
4189834	675754916824	Cd dimitri mitropoulos mahler symphony no. 3	4093300	Медиа (folder)/Media	0	
4189835	8427328604024	Cd dimitri tiomkin friendly persuasion	4093300	Медиа (folder)/Media	0	
4189836	677516523523	Cd dimmer spot you in the crowd	4093300	Медиа (folder)/Media	0	
4189837	634479636929	Cd dimmerswitch how beautiful we are	4093300	Медиа (folder)/Media	0	
4189838	727361624729	Cd dimmu borgir enthrone darkness triumphant	4093300	Медиа (folder)/Media	0	
4189839	727361219123	Cd dimmu borgir enthrone darkness triumphant [reloaded]	4093300	Медиа (folder)/Media	0	
4189840	727361186227	Cd dimmu borgir in sorte diaboli	4093300	Медиа (folder)/Media	0	
4189841	727361652722	Cd dimmu borgir puritanical euphoric misanthropia	4093300	Медиа (folder)/Media	0	
4189842	727361154523	Cd dimmu borgir stormbl?st mmv	4093300	Медиа (folder)/Media	0	
4189843	634479098826	Cd din the high end	4093300	Медиа (folder)/Media	0	
4189844	060325012928	Cd dina blade s'wonderful	4093300	Медиа (folder)/Media	0	
4189845	634479064425	Cd dina torok the state i get in	4093300	Медиа (folder)/Media	0	
4189846	5012498053623	Cd dinah shore buttons and bows	4093300	Медиа (folder)/Media	0	
4189847	634479297120	Cd dinky woo woo productions the wizard of og-adventures in rhymeland	4093300	Медиа (folder)/Media	0	
4189848	020626718752	Cd dino defender pc CD-rom	4093300	Медиа (folder)/Media	0	
4189849	687606001428	Cd dino govoni in the library	4093300	Медиа (folder)/Media	0	
4189850	636671201325	Cd dino just piano praise	4093300	Медиа (folder)/Media	0	
3870056	4607153918150	Cd dino mc 47 вне номинации	4093300	Медиа (folder)/Media	3785719	НФ
4189851	697527300104	Cd dino palazzi&friends roots&wings	4093300	Медиа (folder)/Media	0	
4189852	634479228223	Cd dino romanelli standing still	4093300	Медиа (folder)/Media	0	
4189853	602517799271	Cd dino saluzzi kultrum	4093300	Медиа (folder)/Media	0	
4189854	641444930227	Cd dino soldo thread	4093300	Медиа (folder)/Media	0	
4189855	678588888824	Cd dino&terry featuring various artists house de luxe vol. 2	4093300	Медиа (folder)/Media	0	
4189856	090771103420	Cd dino, desi&billy the rebel kind the best of dino, desi&billy	4093300	Медиа (folder)/Media	0	
4189858	090317344829	Cd dinosaur jr Green mind	4093300	Медиа (folder)/Media	0	
4189859	081227839529	Cd dinosaur jr the best of	4093300	Медиа (folder)/Media	0	
4189860	745099162726	Cd dinosaur jr where you been	4093300	Медиа (folder)/Media	0	
4189861	745099693329	Cd dinosaur jr without a sound	4093300	Медиа (folder)/Media	0	
4189862	767981108124	Cd dinosaur jr. beyond	4093300	Медиа (folder)/Media	0	
4189857	5099950757121	Cd dinosaur [soundtrack]	4093300	Медиа (folder)/Media	0	
4189863	724356777521	Cd dinu lipatti schumann piano concerto	4093300	Медиа (folder)/Media	0	
4189864	724358682625	Cd dinu lipatti the complete chopin recordings	4093300	Медиа (folder)/Media	0	
4189866	670211502121	Cd dio angry machines	4093300	Медиа (folder)/Media	0	
4189867	081227991982	Cd dio Dream evil	4093300	Медиа (folder)/Media	0	
4189868	5907785035706	Cd dio evil or divine [metal mind]	4093300	Медиа (folder)/Media	0	
4189869	670211502220	Cd dio inferno last in live	4093300	Медиа (folder)/Media	0	
4189870	670211519921	Cd dio killing the Dragon	4093300	Медиа (folder)/Media	0	
4189871	5036369502027	Cd dio killing the Dragon #2	4093300	Медиа (folder)/Media	0	
4189872	081227988753	Cd dio lock up the wolves	4093300	Медиа (folder)/Media	0	
4189873	670211502022	Cd dio magica	4093300	Медиа (folder)/Media	0	
4189874	081227385521	Cd dio stand up and shout the dio anthology	4093300	Медиа (folder)/Media	0	
4189875	081227998325	Cd dio the very beast of dio	4093300	Медиа (folder)/Media	0	
4189876	075992561228	Cd dio, ronnie James Dream evil	4093300	Медиа (folder)/Media	0	
4189877	075992383622	Cd dio, ronnie James holy diver	4093300	Медиа (folder)/Media	0	
4189878	075992621229	Cd dio, ronnie James lock up the wolves	4093300	Медиа (folder)/Media	0	
4189879	075992529228	Cd dio, ronnie James sacred heart	4093300	Медиа (folder)/Media	0	
4189880	093624552727	Cd dio, ronnie James strange highways	4093300	Медиа (folder)/Media	0	
4189881	075992510028	Cd dio, ronnie James the last in Line	4093300	Медиа (folder)/Media	0	
4189882	074648032020	Cd diodes, the tired of waking up tired the best of the diodes	4093300	Медиа (folder)/Media	0	
4189883	724383803422	Cd dion best of dion and the belmonts [2001]	4093300	Медиа (folder)/Media	0	
4189884	074644697223	Cd dion bronx blues the columbia recordings (1962-1965)	4093300	Медиа (folder)/Media	0	
4189885	793018296021	Cd dion bronx in Blue	4093300	Медиа (folder)/Media	0	
4189886	828767762227	Cd dion Essential dion	4093300	Медиа (folder)/Media	0	
4189887	724352867721	Cd dion King of the New york streets (3 CD)	4093300	Медиа (folder)/Media	0	
4189888	602517491595	Cd dion son of skip James	4093300	Медиа (folder)/Media	0	
4189889	074646145425	Cd dion Super hits	4093300	Медиа (folder)/Media	0	
4189890	074646488928	Cd dion the road i'm on a retrospective	4093300	Медиа (folder)/Media	0	
936975	724381872529	Cd dion/rick nelsn	1	Неклассифицированные/default	0	
4189891	600665761621	Cd dionysios skaliotis focus your thoughts i	4093300	Медиа (folder)/Media	0	
1413053	793613280005	Cd dip aztec salsa 12oz	1	Неклассифицированные/default	0	
563347	793613200027	Cd dip balsamic Black bean 13oz	1	Неклассифицированные/default	0	
1413054	793613260007	Cd dip mango salsa 12oz	1	Неклассифицированные/default	0	
1413055	793613230000	Cd dip portobello mushroom 12oz	1	Неклассифицированные/default	0	
4189892	795103001428	Cd dipsomaniacs freakin eureka	4093300	Медиа (folder)/Media	0	
4189893	795103000728	Cd dipsomaniacs smaller than Life	4093300	Медиа (folder)/Media	0	
4189894	795103001329	Cd dipsomaniacs the Life you're faking	4093300	Медиа (folder)/Media	0	
4189895	795103000926	Cd dipsomaniacs undertow	4093300	Медиа (folder)/Media	0	
4189896	075992668026	Cd dire straights on every street	4093300	Медиа (folder)/Media	0	
4189897	075992737722	Cd dire straits	4093300	Медиа (folder)/Media	0	
4189898	075992526425	Cd dire straits brothers in arms	4093300	Медиа (folder)/Media	0	
4189899	093624777328	Cd dire straits brothers in arms #2	4093300	Медиа (folder)/Media	0	
4189900	075992739320	Cd dire straits communique	4093300	Медиа (folder)/Media	0	
4189901	093624776925	Cd dire straits dire straits	4093300	Медиа (folder)/Media	0	
