ID	UPCEAN	Name	CategoryID	CategoryName	BrandID	BrandName
274281	4606031396202	Спонж Cherie ma Cherie круглый для нанесения пудры и тональных средств №620	5586	Косметика (folder)/Косметика	260540	Cherie ma Cherie
274194	4606040396040	Спонж Cherie ma Cherie овальный для пудры и тонального крема №604	336150	Галантерея (folder)/Косметические аксессуары	260540	Cherie ma Cherie
274200	4606031396196	Спонж Cherie ma Cherie полукруглые для нанесения тональных средств 2шт №619	5586	Косметика (folder)/Косметика	260540	Cherie ma Cherie
3537888	6912595126635	Спонж Christian csp-663	1	Неклассифицированные/default	0	
3537889	6912595126482	Спонж Christian большой	1	Неклассифицированные/default	0	
3537890	6912595126727	Спонж Christian груша мелкопористый	1	Неклассифицированные/default	0	
3537891	6912595126758	Спонж Christian для макияжа	1	Неклассифицированные/default	0	
3537892	6912595126444	Спонж Christian круглый латекс	1	Неклассифицированные/default	0	
3537893	6912595126598	Спонж Christian латекс	1	Неклассифицированные/default	0	
3537894	6912595126529	Спонж Christian мелкопористый	1	Неклассифицированные/default	0	
3537895	6912595126680	Спонж Christian мелкопористый #2	1	Неклассифицированные/default	0	
3537896	6912595126703	Спонж Christian яйцо мелкопористый	1	Неклассифицированные/default	0	
3537897	4627109582778	Спонж cleola для пудры	1	Неклассифицированные/default	0	
3537898	4627109582730	Спонж cleola латекс	1	Неклассифицированные/default	0	
3537899	4627109582716	Спонж cleola латекс 2шт	1	Неклассифицированные/default	0	
3537900	6912595126666	Спонж cristian мелкопористый	1	Неклассифицированные/default	0	
3537901	4670009322890	Спонж divalore для нанесения тональных средств 6шт	1	Неклассифицированные/default	3261751	di valore
3537923	4607041566180	Спонж ellis cosmetic 15	1	Неклассифицированные/default	3472008	Ellis cosmetic
3537903	5937161500566	Спонж french science 2шт	1	Неклассифицированные/default	0	
3537904	4680259095291	Спонж galante арт.357-014 2шт	1	Неклассифицированные/default	0	
2488453	4606033077499	Спонж inf-puf-203 для снятия мкияжа	1	Неклассифицированные/default	0	
2488454	4606033094144	Спонж inf-puf-416-asst для нанесения тон.крема (4 формы)	1	Неклассифицированные/default	0	
2488455	4606033094182	Спонж inf-puf-464 в виде цветка для нанесения тон.средств	1	Неклассифицированные/default	0	
180642	4017863178483	Спонж koppa-8 на ручке kaizer (1-шт 10-упак)	1	Неклассифицированные/default	38676	KAIZER
5081291	4811329020947	Спонж lux	5586	Косметика (folder)/Косметика	2420429	lux Visage
3537905	6912595126697	Спонж maxmar	1	Неклассифицированные/default	0	
3537906	6912595126765	Спонж maxmar груша	1	Неклассифицированные/default	0	
1824949	26637020	Спонж nouba большой	336150	Галантерея (folder)/Косметические аксессуары	1074365	NOUBA
3537907	6907038000108	Спонж pleasure мочалка для лица арт. с 003	1	Неклассифицированные/default	2500911	Галант
525208	4690327005817	Спонж ruta для нанисения декоративной косметики	2439	Косметика (folder)/Румяна	3259829	Ruta
1314850	6937265300542	Спонж triumpf для снятия макияжа 1 штука	1	Неклассифицированные/default	915575	Triumpf
3537913	8435328152773	Спонж Victoria shu для пудры	1	Неклассифицированные/default	1167135	VICTORIA SHU
1313323	7640139356390	Спонж Vivienne Sabo косметический набор 4шт	5586	Косметика (folder)/Косметика	666784	Vivienne Sabo
2930701	3048093200034	Спонж балнайс конняку	1	Неклассифицированные/default	0	
121686	4017863142903	Спонж большой латексный (1/4) kaizer (1-шт 10-упак)	5586	Косметика (folder)/Косметика	38676	KAIZER
180649	4017863144983	Спонж большой овальный kaizer (1-шт 20-упак)	1	Неклассифицированные/default	38676	KAIZER
274280	4606031396189	Спонж для демакияжа и умывания Cherie ma Cherie круглый №618	5586	Косметика (folder)/Косметика	260540	Cherie ma Cherie
121692	9001378200642	Спонж для демакияжа калипсо 2шт 20064	5586	Косметика (folder)/Косметика	121691	Калипсо
121695	5900323003618	Спонж для демакияжа сирена 2шт	5586	Косметика (folder)/Косметика	0	
3537916	4620768020117	Спонж для лица 20117	1	Неклассифицированные/default	0	
3737394	6938294683828	Спонж для лица QVS большой очищающий со шнуром, шт 82-10-1707	1	Неклассифицированные/default	1106872	QVS
3537908	4607104470034	Спонж для лица rendy р-10	1	Неклассифицированные/default	0	
3537909	4607104470058	Спонж для лица rendy р-12	1	Неклассифицированные/default	0	
3537910	4607104470195	Спонж для лица rendy р-44	1	Неклассифицированные/default	0	
326747	4606519002236	Спонж для лица из крапивы гладкая кожа /30 (фибропласт) New	3536	Хозяйственные товары (folder)/Хозяйственные товары	0	
326748	4606519002281	Спонж для лица из льна пиллинг /30 (фибропласт) New	3536	Хозяйственные товары (folder)/Хозяйственные товары	0	
2260019	4660011273051	Спонж для лица из люфы банные штучки /100	1	Неклассифицированные/default	1182355	Банные штучки
326749	4606519002243	Спонж для лица из люфы молодая кожа /30 (фиброполимер) Россия	3536	Хозяйственные товары (folder)/Хозяйственные товары	0	
2260020	4660011272658	Спонж для лица из целлюлозы банные штучки /100	1	Неклассифицированные/default	1182355	Банные штучки
831177	4603299203518	Спонж для лица фешин	5586	Косметика (folder)/Косметика	0	
2488456	4660011279732	Спонж для лица, с углём из бамбука, очищающий, d=90	596271	Галантерея (folder)/Галантерея	0	
1824947	032550067615	Спонж для макияжа artdeco набор 8шт #2	336150	Галантерея (folder)/Косметические аксессуары	560528	Artdeco
902376	4019674060865	Спонж для макияжа artdeco овальный	336150	Галантерея (folder)/Косметические аксессуары	560528	Artdeco
1824948	032550067608	Спонж для макияжа artdeco овальный #2	336150	Галантерея (folder)/Косметические аксессуары	560528	Artdeco
1702002	4630011451087	Спонж для макияжа beauty style 2шт (45108)	1	Неклассифицированные/default	342690	Beauty Style
963274	7391715047316	Спонж для макияжа depend	5586	Косметика (folder)/Косметика	299480	Depend
3537918	4607041566159	Спонж для макияжа ellis cosmetic 08	1	Неклассифицированные/default	3472008	Ellis cosmetic
4881399	4627137573397	Спонж для макияжа farres 011 прорезиненный шт	1	Неклассифицированные/default	3105669	Farres
5081292	4811329020923	Спонж для макияжа lux Visage 3D к1	1	Неклассифицированные/default	2420429	lux Visage
5740239	5412058199189	Спонж для макияжа sibel Diva make up blender 3r perfection салатовый, (5412058199189) (6600538_perf)	1	Неклассифицированные/default	415718	Sibel
5740240	5412058192821	Спонж для макияжа sibel Diva make up blender оранжевый, (5412058192821)	1	Неклассифицированные/default	415718	Sibel
5740241	5060504725897	Спонж для макияжа solomeya меняющий цвет Blue-pink, 1шт 06-950	336150	Галантерея (folder)/Косметические аксессуары	2683268	SOLOMEYA
4856145	5060504723879	Спонж для макияжа solomeya мультифункциональный, 1шт 06-919	5586	Косметика (folder)/Косметика	2683268	SOLOMEYA
5740242	5060504725279	Спонж для макияжа solomeya со срезом лиловый, 1шт 06-947	336150	Галантерея (folder)/Косметические аксессуары	2683268	SOLOMEYA
4856144	5060504723237	Спонж для макияжа solomeya со срезом, 1шт 06-912	5586	Косметика (folder)/Косметика	2683268	SOLOMEYA
4856146	5060504723886	Спонж для макияжа solomeya универсальный, 1шт 06-920	5586	Косметика (folder)/Косметика	2683268	SOLOMEYA
5740243	5905710035784	Спонж для макияжа top choice 2шт цвет ассортим 35784	336150	Галантерея (folder)/Косметические аксессуары	5226040	Top choice
5740244	5905710035807	Спонж для макияжа top choice 35807 35807	336150	Галантерея (folder)/Косметические аксессуары	5226040	Top choice
5740245	5905710006449	Спонж для макияжа top choice 4шт 6449	336150	Галантерея (folder)/Косметические аксессуары	5226040	Top choice
5740246	5905710035869	Спонж для макияжа top choice цвет ассортим 35869	336150	Галантерея (folder)/Косметические аксессуары	5226040	Top choice
3537917	4895125911890	Спонж для макияжа басикар	1	Неклассифицированные/default	0	
2930702	4607041566234	Спонж для макияжа клиновидная форма 80mm	1	Неклассифицированные/default	0	
5740247	6925438245257	Спонж для макияжа силиконовый parisa для тональных средств 10618 parisa	336150	Галантерея (folder)/Косметические аксессуары	3178467	Parisa
121698	4607194470235	Спонж для макияжа тренди 5шт а-4	5586	Косметика (folder)/Косметика	0	
3914639	3201025011980	Спонж для макияжа флоранс	596271	Галантерея (folder)/Галантерея	3809639	ФЛОРАНС
3914640	3201025011997	Спонж для макияжа флоранс #2	596271	Галантерея (folder)/Галантерея	3809639	ФЛОРАНС
2488450	4606033077185	Спонж для нанесения макияжа inf-mj-502 в форме капли	1	Неклассифицированные/default	0	
2488451	4606033077192	Спонж для нанесения макияжа inf-mj-503 круглой формы	1	Неклассифицированные/default	0	
2260017	4606033099859	Спонж для нанесения макияжа Zinger fpu-601	336150	Галантерея (folder)/Косметические аксессуары	19388	ZINGER
2260170	4743164004380	Спонж для нанесения макияжа круглый сс0438	1	Неклассифицированные/default	0	
2488457	4670009322777	Спонж для нанесения пудры и тональных средств (латекс) бежевый к30 115-005	1	Неклассифицированные/default	0	
5081293	4670009322913	Спонж для нанесения тональных средств, (латекс) цветной (115-018)	1	Неклассифицированные/default	0	
5740248	8806334375461	Спонж для очищения кожи holika holika Magic tool cleansing puff, 1шт 20016568	336150	Галантерея (folder)/Косметические аксессуары	4918707	Holika holika
3914641	7614006632252	Спонж для полировки zm115	300445	Эксплуатация и ремонт автомобилей/Автомобильные принадлежности	3725711	Ombra
3259426	4607079337646	Спонж для полировки, диам. 14cm zm115	1	Неклассифицированные/default	5297783	zeus
1313320	8435328150885	Спонж для пудры и тональной основы круглый 2шт sp005	5586	Косметика (folder)/Косметика	0	
1313321	8435328150854	Спонж для пудры и тональной основы овальный 2шт sp002	5586	Косметика (folder)/Косметика	0	
1313322	8435328150861	Спонж для пудры и тональной основы овальный sp003	5586	Косметика (folder)/Косметика	0	
360561	4099999304851	Спонж для снятия макияжа dewal целлюлоза, большой	336150	Галантерея (folder)/Косметические аксессуары	36374	DEWAL
360562	4000000129691	Спонж для снятия макияжа dewal целлюлоза,квадратный,цветной, 2шт	336150	Галантерея (folder)/Косметические аксессуары	36374	DEWAL
1837532	4000000129721	Спонж для снятия макияжа dewal целлюлоза,круглый,цветной, 2шт\уп	28	Уход за волосами (folder)/Уход за волосами	36374	DEWAL
1837533	6900000419106	Спонж для снятия макияжа dewal целлюлоза,овальный,цветной, 2шт\уп	28	Уход за волосами (folder)/Уход за волосами	36374	DEWAL
2488452	4606033077246	Спонж для снятия макияжа inf-mj-701 круглой формы	1	Неклассифицированные/default	0	
2260015	5412058001079	Спонж для снятия макияжа rosa 2шт/уп 904113	360487	Уход за волосами (folder)/Парикмахерская	415718	Sibel
326746	4607050178237	Спонж для снятия макияжа Zinger	1	Неклассифицированные/default	19388	ZINGER
2260018	4606033093499	Спонж для снятия макияжа Zinger puf-201	336150	Галантерея (folder)/Косметические аксессуары	19388	ZINGER
274282	4606031396110	Спонж для снятия макияжа и умывания Cherie ma Cherie круглый №611	5586	Косметика (folder)/Косметика	260540	Cherie ma Cherie
2260021	6900999998194	Спонж для снятия макияжа сердце 2шт/уп (sp-01) dewal	336150	Галантерея (folder)/Косметические аксессуары	36374	DEWAL
2302957	3348901191609	Спонж для тонального крема Christian Dior diorskin Star	5586	Косметика (folder)/Косметика	565370	Christian Dior
831179	6943965300133	Спонж для умывания (целлюлоза) желтый прямоугольник 443008	1	Неклассифицированные/default	0	
1702003	4630011451070	Спонж для умывания beauty style /45107/	1	Неклассифицированные/default	342690	Beauty Style
274195	4606031396127	Спонж для умывания Cherie ma Cherie фигурный №612	366026	Гигиена (folder)/Средство для умывания	260540	Cherie ma Cherie
831178	6934700450015	Спонж для умывания с пластиковой ручкой	1	Неклассифицированные/default	0	
3537919	4607050175359	Спонж из латекса 27901	1	Неклассифицированные/default	0	
2757787	4606532008444	Спонж из микрофибры felix для чистки и полировки	300445	Эксплуатация и ремонт автомобилей/Автомобильные принадлежности	366510	FELIX
3537920	4895125911906	Спонж инфлюкс индастри инк ля макияжа 20шт мяг/уп	1	Неклассифицированные/default	0	
3537921	4895125910473	Спонж инфлюкс индастри инк ля макияжа мяг/уп	1	Неклассифицированные/default	0	
5081294	6970236980282	Спонж конняку 0282	1	Неклассифицированные/default	0	
2260022	4607054701165	Спонж косметический Mini Soft Care 1шт	1	Неклассифицированные/default	0	
5081295	4602001085213	Спонж косметический для макияжа фигурный скошенный, шт c013	1	Неклассифицированные/default	2506087	Lavelle
5081296	4810151014780	Спонж косметический к5	1	Неклассифицированные/default	4241	Bielita
5081297	4602001070509	Спонж косметический фигурный малый, шт с002	1	Неклассифицированные/default	0	
871243	460706862256	Спонж косметический я самая 2шт треуг.	217	Гигиена (folder)/Вата и ватные изделия	599	Я Самая
180641	4017863145508	Спонж латексный большой овальный kaizer (1-шт 10-упак)	1	Неклассифицированные/default	38676	KAIZER
121685	4017863143986	Спонж латексный маленький kaizer (1-шт 25-упак)	5586	Косметика (folder)/Косметика	38676	KAIZER
180645	4017863145515	Спонж латексный маленький прямоуг kaizer (1-шт 25-упак)	1	Неклассифицированные/default	38676	KAIZER
180646	4017863144969	Спонж латексный прямоуг бежевый kaizer (1-шт 30-упак)	1	Неклассифицированные/default	38676	KAIZER
180647	4017863142897	Спонж латексный сердце kaizer (1-шт 30-упак)	1	Неклассифицированные/default	38676	KAIZER
121687	4017863142880	Спонж маленький латексный (1/4) kaizer (1-шт 10-упак)	5586	Косметика (folder)/Косметика	38676	KAIZER
121688	4017863145409	Спонж натуральный большой kaizer (1-шт 20-упак)	5586	Косметика (folder)/Косметика	38676	KAIZER
121689	4017863142910	Спонж натуральный диаметр 75 kaizer (1-шт 20-упак)	5586	Косметика (folder)/Косметика	38676	KAIZER
180651	4017863145447	Спонж натуральный квадратн kaizer (1-шт 30-упак)	1	Неклассифицированные/default	38676	KAIZER
121690	4017863145379	Спонж натуральный сердце kaizer (1-шт 25-упак)	5586	Косметика (folder)/Косметика	38676	KAIZER
180650	4017863145355	Спонж натуральный цветок kaizer (1-шт 30-упак)	1	Неклассифицированные/default	38676	KAIZER
3537922	4606519002250	Спонж нежный для лица из целлюлозы	1	Неклассифицированные/default	0	
5740249	4630079241132	Спонж с ручкой lukky для нанесения косметики, 6цв ассортим т18102	5140578	косметика декоративная детская	4930298	Lukky
121693	4607813600197	Спонж сердце с массажным слоем	337447	Гигиена (folder)/Товары для душа и ванны	14858	Спа
121694	4607813570025	Спонж сердце с целлюлозным слоем	337447	Гигиена (folder)/Товары для душа и ванны	14858	Спа
5081298	5060504725255	Спонж соломея вельветовый косметический для макияжа персик	336150	Галантерея (folder)/Косметические аксессуары	2683268	SOLOMEYA
5081299	5060504725262	Спонж соломея вельветовый косметический для макияжа тиффани	336150	Галантерея (folder)/Косметические аксессуары	2683268	SOLOMEYA
4856143	5060504723244	Спонж соломея Капля 2-сторонний косметич.для макияжа	5586	Косметика (folder)/Косметика	2683268	SOLOMEYA
5081300	5060504725880	Спонж соломея косметический для макияжа меняющий цвет purple-pink	336150	Галантерея (folder)/Косметические аксессуары	2683268	SOLOMEYA
121696	4604520300037	Спонж спалиния 5203-0003/0007	5586	Косметика (folder)/Косметика	51877	Спалиния
2963954	4605520300072	Спонж спалиния 5203-0003/0007 #2	5586	Косметика (folder)/Косметика	51877	Спалиния
121697	4606520300154	Спонж спалиния 5203-0015	5586	Косметика (folder)/Косметика	51877	Спалиния
831180	4608512800024	Спонж спалиния целюлоза 5128-0002	5586	Косметика (folder)/Косметика	51877	Спалиния
3537924	4650001682642	Спонж я самая двухсторон косметич 2шт	1	Неклассифицированные/default	0	
17282	4607068622555	Спонж я самая косм сектор. 4шт	217	Гигиена (folder)/Вата и ватные изделия	599	Я Самая
17285	4607068622524	Спонж я самая косм уголок	217	Гигиена (folder)/Вата и ватные изделия	599	Я Самая
17286	4607068622531	Спонж я самая косм уголок больш.	217	Гигиена (folder)/Вата и ватные изделия	599	Я Самая
5740250	4049775003775	Спонж-аппликатор для макияжа wet n Wild, 1шт ww002604	336150	Галантерея (folder)/Косметические аксессуары	1173206	Wet n Wild
1313324	4820048481021	Спонж-мочалка натура вита рамми шт.	1	Неклассифицированные/default	0	
2930704	4607041566241	Спонж-пуховка micro fibre 60mm	1	Неклассифицированные/default	0	
2260024	6926807824042	Спонж-салфетка для кухни 20x 20cm 3шт хаузманн	3536	Хозяйственные товары (folder)/Хозяйственные товары	2260023	Хаузманн
3537925	6938294688212	Спонжи севи для макияжа 2шт	1	Неклассифицированные/default	0	
4856147	5060504723190	Спонжи соломея косметическ.для макияжа 2макаруна	5586	Косметика (folder)/Косметика	2683268	SOLOMEYA
3537926	4607050175397	Спонжи цв набор 4шт 27910	1	Неклассифицированные/default	0	
17284	4607068622562	Спонжи я самая косметические двухсторонние треугольные 2шт	217	Гигиена (folder)/Вата и ватные изделия	599	Я Самая
17280	4607068622616	Спонжи я самая косметические овальные 2шт мяг/уп	217	Гигиена (folder)/Вата и ватные изделия	599	Я Самая
17281	4607068622548	Спонжи я самая косметические прямоуг 2шт мяг/уп	217	Гигиена (folder)/Вата и ватные изделия	599	Я Самая
3537927	5905710006456	Спонжик для макияжа	1	Неклассифицированные/default	0	
5081301	4620006940412	Спонжики для нанесения макияжа №6 ООО ригла	2418507	Изделия медицинского назначения (folder)/Изделия медицинского назначения	0	
525212	4823045200114	Спорагал капс 100mg №10	1	Неклассифицированные/default	0	
525213	4823045201852	Спорагал капс 100mg №30	1	Неклассифицированные/default	0	
525214	8901296013250	Споридекс капс 0.25g №30	210391	Лекарственные средства (folder)/Лекарственные средства	0	
4856148	4607022930023	Споробактерин 2ml №5 флак сусп	241824	Лекарственные средства (folder)/Аптека	0	
2011328	4607022930061	Споробактерин жидк сусп 10ml фл для вн. пр бакорен ООО	1	Неклассифицированные/default	0	
