ID	UPCEAN	Name	CategoryID	CategoryName	BrandID	BrandName
5064432	9785392350070	Проспект агапов а.б., стандзонь л.в. лицензионно-разрешительная деятельность органов исполнительной власти 82x100/32 224лист	205408	Полиграфия (folder)/Книги	5064423	Проспект
5064433	9785392349555	Проспект акимова и.в., артемьев и.ю., москвитин о.а., пузыревский с.а. взыскание убытков, причиненных нарушениями антимонопольн	205408	Полиграфия (folder)/Книги	5064423	Проспект
5064434	9785392260898	Проспект александрова л.и., ашиткова т.в., галаева о.с. деятельность прокуратуры по предупреждению преступлений и иных правона	205408	Полиграфия (folder)/Книги	5064423	Проспект
5064435	9785392348763	Проспект алексеев и.а., арутюнян р.э., белявский д.с. избирательное право рф и зарубежных стран 60x90/16 272лист	205408	Полиграфия (folder)/Книги	5064423	Проспект
5064436	9785392330546	Проспект андреева л.в. государственные закупки в россии: правовое регулирование и меры по его 60x90/16 232лист	205408	Полиграфия (folder)/Книги	5064423	Проспект
5064437	9785392350261	Проспект анисина к.т., бадмаев б.г., цинделиани и.а. финансовое право в условиях развития цифровой экономики.монография 82x100/	205408	Полиграфия (folder)/Книги	5064423	Проспект
5064438	9785392214181	Проспект антимирова о.а., маннапов а.г. фитогормоны в пчеловодстве. монография 60x90/16 112лист	205408	Полиграфия (folder)/Книги	5064423	Проспект
5064439	9785392330485	Проспект антонян е.а., антонян ю.м., афанасьева о.р., гончарова м.в. личность преступника и профилактика преступлений. монограф	205408	Полиграфия (folder)/Книги	5064423	Проспект
5064440	9785392350131	Проспект антонян проспект.особо опасный преступник 82x100/32 312лист	205408	Полиграфия (folder)/Книги	5064423	Проспект
5064441	9785392345526	Проспект антонян ю.м. насилие в семье. монография 60x90/16 232лист	205408	Полиграфия (folder)/Книги	5064423	Проспект
5064442	9785392327973	Проспект арапова е.я. Россия в азии и тихоокеанском регионе. тенденции торгового сотруд-ва 60x90/16 312лист	205408	Полиграфия (folder)/Книги	5064423	Проспект
5064443	9785392201129	Проспект аринцева о.п., блех е.м., шерешовец е.в. конкуренция на рынке услуг жкх 60x90/16 80лист	205408	Полиграфия (folder)/Книги	5064423	Проспект
5064444	9785998807787	Проспект аронов а.в., баркалая в.р., беспалов а.ю., беспалов ю.ф. семья и семейные ценности в рф: социально-правовой аспект 82x	205408	Полиграфия (folder)/Книги	5064423	Проспект
5064445	9785392331147	Проспект артеменкова т.а., гусев а.ю. правовые основы противодействия коррупции. учебно-практич. поcобие 60x90/16 144лист	205408	Полиграфия (folder)/Книги	5064423	Проспект
5064446	9785392274680	Проспект артемов н.м., корнев а.д. финансово-правовое регулирование парафискальных платежей в рф 60x90/16 112лист	205408	Полиграфия (folder)/Книги	5064423	Проспект
5064447	9785392281954	Проспект артемов н.м., кудлаев д.в., ситник а.а. финансово-правовое регулирование обращения драгоценных металлов в рф 60x90/16	205408	Полиграфия (folder)/Книги	5064423	Проспект
5064448	9785392337439	Проспект артемова д.и. правовые основы стратегического развития субъектов рф	205408	Полиграфия (folder)/Книги	5064423	Проспект
5064449	9785392349272	Проспект артемьев и.ю., москвитин о.а., пузыревский с.а., юдина ю.в. правовые позиции фас россии по вопросам тарифообразования	205408	Полиграфия (folder)/Книги	5064423	Проспект
5064450	9785392351312	Проспект ашурбеков р.а., круглинский и.к., семченко е.е. оценка интеллектуального труда в системе подготовки кадров. проблемы к	205408	Полиграфия (folder)/Книги	5064423	Проспект
5064451	9785392331970	Проспект аюшеева и.з., богданова е.е., булаевский б.а. гражданское право. уч в 2 т. т.1 60x90/16 440лист	205408	Полиграфия (folder)/Книги	5064423	Проспект
5064452	9785392348398	Проспект байттебье как экономика стала проблемой (и что с этим делать) монография 82x100/32 128лист	205408	Полиграфия (folder)/Книги	5064423	Проспект
5064453	9785392336081	Проспект балашова и.н., кусков а.с., сирик н.в. взыскание неустойки и штрафа по делам о защите прав потребителей.научн 60x90/16	205408	Полиграфия (folder)/Книги	5064423	Проспект
5064454	9785392305964	Проспект баранов п.п., кожокарь и.п., овчинников а.и. философия права в современной россии: некоторые подходы и направления 60x	205408	Полиграфия (folder)/Книги	5064423	Проспект
5064455	9785392242900	Проспект баринов е.х. дорогой мистер холмс (портрет) 60x90/16 208лист	205408	Полиграфия (folder)/Книги	5064423	Проспект
5064456	9785392327416	Проспект барков а.в., гришина я.с., лескова ю.г. легализация социального предпринимательства в россии и за рубежом 60x90/16 216	205408	Полиграфия (folder)/Книги	5064423	Проспект
5064457	9785392348725	Проспект башанкаев б.н., морозов п.е., рустамов б.е., чанышев а.с. актуальные проблемы правового регулирования управления медиц	205408	Полиграфия (folder)/Книги	5064423	Проспект
5064458	9785392349371	Проспект башлаков коллективное доминирование: вопросы теории и практики. монография	205408	Полиграфия (folder)/Книги	5064423	Проспект
5064459	9785392348947	Проспект безрукова о.в., капитонова е.а., кулешова г.п., подольный н.а. терроризм и современное право. актуальные вопросы проти	205408	Полиграфия (folder)/Книги	5064423	Проспект
5064460	9785392241446	Проспект безрукова о.в., романовская о.в. конституционные принципы регулирования экономических отношений. моногр 60x90/16 192ли	205408	Полиграфия (folder)/Книги	5064423	Проспект
5064461	9785392295739	Проспект бекяшев д.к. международное трудовое право (публично-правовые аспекты)	205408	Полиграфия (folder)/Книги	5064423	Проспект
5064462	9785392234615	Проспект бекяшев д.к., бекяшев к.а. международно-правовые проблемы борьбы с незаконным рыболовством 60x90/16 480лист	205408	Полиграфия (folder)/Книги	5064423	Проспект
5064463	9785392350902	Проспект бекяшев к.а., моисеев е.г. международное публичное право в вопросах и ответах. учебное пособие	205408	Полиграфия (folder)/Книги	5064423	Проспект
5064464	9785392348909	Проспект белозеров с.а., кузнецова н.п. страхование и управление рисками: проблемы и перспективы. монография 60x90/16 528лист	205408	Полиграфия (folder)/Книги	5064423	Проспект
5064465	9785392297115	Проспект белопухов с.л., бочкарев а.в., дмитревская и.и., елисеева о.в., пржевальский н.м., старых с.э. химия: сборник информац	205408	Полиграфия (folder)/Книги	5064423	Проспект
5064466	9785392341962	Проспект белопухова коллоидная химия. учебник 82x100/32 144лист	205408	Полиграфия (folder)/Книги	5064423	Проспект
5064467	9785392331031	Проспект белых в.с., блажеев в.в., егорова м.а. цифровое право	205408	Полиграфия (folder)/Книги	5064423	Проспект
5064468	9785392314676	Проспект беляева о.а., боголюбов с.а., галиновская е.а. о рыболовстве и сохранении водных биологических ресурсов.научно-практи	205408	Полиграфия (folder)/Книги	5064423	Проспект
5064469	9785392337668	Проспект берг л.н. судебное усмотрение и его пределы: общетеоретический аспект.монография 60x90/16 128лист	205408	Полиграфия (folder)/Книги	5064423	Проспект
5064470	9785392348831	Проспект беспалов а.ю., беспалов ю.ф., касаткина а.ю. правовое положение российского ребенка, находящегося в трудной жизненн 60	205408	Полиграфия (folder)/Книги	5064423	Проспект
5064471	9785392349609	Проспект беспалов ю.ф. жилищные споры. путеводитель по законодательству и судебной практике 82x100/32 368лист	205408	Полиграфия (folder)/Книги	5064423	Проспект
5064472	9785392328963	Проспект беспалов ю.ф. настольная книга российского судьи по гражданскому судопроизводству 60x90/16 368лист	205408	Полиграфия (folder)/Книги	5064423	Проспект
5064473	9785392329045	Проспект беспалов ю.ф. несовершенство российс-го законодательства о семье, семейных ценностях	205408	Полиграфия (folder)/Книги	5064423	Проспект
5064474	9785392205943	Проспект беспалов ю.ф., егорова о.а. возбуждение, подготовка, разбирательство гражданских дел 60x90/16 128лист	205408	Полиграфия (folder)/Книги	5064423	Проспект
5064475	9785392344024	Проспект бимбинов а.а., боженок с.а., грачева ю.в., звечаровский и.э. уголовное право рф. особенная часть	205408	Полиграфия (folder)/Книги	5064423	Проспект
5064476	9785392350919	Проспект бирюков сравнительное правоведение (7бц)	205408	Полиграфия (folder)/Книги	5064423	Проспект
5064477	9785392310869	Проспект блажеев в.в., егорова м.а. цифровое право: глоссарий понятий 60x90/16 64лист	205408	Полиграфия (folder)/Книги	5064423	Проспект
5064478	9785392331987	Проспект богданов д.е., богданова е.е., василевская л.ю. гражданское право. уч в 2 т. т.2 60x90/16 448лист	205408	Полиграфия (folder)/Книги	5064423	Проспект
5064479	9785392348770	Проспект богданов е.в. договоры в сфере предпринимательства. монография 60x90/16 304лист	205408	Полиграфия (folder)/Книги	5064423	Проспект
5064480	9785392349395	Проспект богданова искусственная репродукция человека: поиск оптимальной модели правового 82x100/32 216лист	205408	Полиграфия (folder)/Книги	5064423	Проспект
5064481	9785392218059	Проспект божченко ж.а. механизм реализации экономических интересов в сельскохозяйственных орг 60x90/16 128лист	205408	Полиграфия (folder)/Книги	5064423	Проспект
5064482	9785392351022	Проспект большаков о времени и о себе: о моей жизни и нашей культуре	205408	Полиграфия (folder)/Книги	5064423	Проспект
5064483	9785482020517	Проспект борисова с.а. формулы по физике, химии, математике учебное пособие мяг	4969322	Полиграфия (folder)/Учебное пособие (folder)/Учебник	5064423	Проспект
5064484	9785392348916	Проспект борисова т.е. суррогатное материнство в рф: проблемы теории и практики 60x90/16 144лист	205408	Полиграфия (folder)/Книги	5064423	Проспект
5064485	9785392314492	Проспект бочков а.а., гурщенков п.в. теория государства и права: сборник тестовых заданий	205408	Полиграфия (folder)/Книги	5064423	Проспект
5064486	9785392348671	Проспект бриллиантов а.в., четвертакова е.ю. должностное лицо в уголовном законодательстве россии и зарубежн. стран 60x90/16 19	205408	Полиграфия (folder)/Книги	5064423	Проспект
5064487	9785392335633	Проспект бураков м.в. системы искусственного интеллекта	205408	Полиграфия (folder)/Книги	5064423	Проспект
5064488	9785392348206	Проспект бурашникова н.а. судебный контроль за соблюдением права на свободу и личную неприкоснов 60x90/16 224лист	205408	Полиграфия (folder)/Книги	5064423	Проспект
5064489	9785392350803	Проспект бучило н.ф., исаев и.а. история и философия науки. учебное пособие	205408	Полиграфия (folder)/Книги	5064423	Проспект
5064490	9785392278428	Проспект быков а.ю. лоббистика для президентов 60x90/8 200лист	205408	Полиграфия (folder)/Книги	5064423	Проспект
5064491	9785392239320	Проспект валитова л.а. связь процесса генерирования данных и результирующего распределения со 60x90/16 224лист	205408	Полиграфия (folder)/Книги	5064423	Проспект
5064492	9785392348978	Проспект васев и.н. коллизионное правовое регулирование в россии: вопросы теории 60x90/16 192лист	205408	Полиграфия (folder)/Книги	5064423	Проспект
5064493	9785392346295	Проспект василевская л.ю., подузова е.б. цифровизация гражданского оборота: проблемы и тенденции. в 5т. 2т 60x90/16 280лист	205408	Полиграфия (folder)/Книги	5064423	Проспект
5064494	9785392349067	Проспект васильев в.в., войниканис е.а., грязнов а.ф., зотов а.ф. западная философия xix века 60x90/16 504лист	205408	Полиграфия (folder)/Книги	5064423	Проспект
5064495	9785392350308	Проспект васильев правовая доктрина как источник права: вопросы теории и истории 82x100/32 232лист	205408	Полиграфия (folder)/Книги	5064423	Проспект
5064496	9785392343911	Проспект васильченко д.а., луговик в.ф., чечетин а.е. методика раскрытия преступлений подразделениями уголовного розыска 60x90/	205408	Полиграфия (folder)/Книги	5064423	Проспект
5064497	9785392349586	Проспект ведель дип. защита и консульское содействие в междунар.праве. diplomatic 82x100/32 176лист	205408	Полиграфия (folder)/Книги	5064423	Проспект
5064498	9785392342488	Проспект вениаминов а.г. особенности использования результатов оперативно-розыскной деятельност	205408	Полиграфия (folder)/Книги	5064423	Проспект
5064499	9785392219261	Проспект вершило н.д., вершило т.а., горбунова о.н. бюджетное право 60x90/16 400лист	205408	Полиграфия (folder)/Книги	5064423	Проспект
5064500	9785392350933	Проспект веснин в.р. менеджмент	205408	Полиграфия (folder)/Книги	5064423	Проспект
5064501	9785392333301	Проспект веснин в.р. стратегическое управление. учебник	205408	Полиграфия (folder)/Книги	5064423	Проспект
5064502	9785392200955	Проспект ветошкин а.п., некрасов с.и., некрасова н.а. философия 70x100/32 560лист	205408	Полиграфия (folder)/Книги	5064423	Проспект
5064503	9785998813535	Проспект ветошкин а.п., некрасов с.и., некрасова н.а. философия с иллюстрациями	205408	Полиграфия (folder)/Книги	5064423	Проспект
5064504	9785392348527	Проспект вишневский м.в. все о грибах. популярная энциклопедия 82x100/32 624лист	205408	Полиграфия (folder)/Книги	5064423	Проспект
5064505	9785392316090	Проспект вишневский м.в. самые популярные вкусные Рецепты домашних грибных заготовок: индивидуа 60x90/32 16лист	205408	Полиграфия (folder)/Книги	5064423	Проспект
5064506	9785392350001	Проспект вишневский м.в. самые распространенные и вкусные грибы россии: как правильно отличить 82x100/32	205408	Полиграфия (folder)/Книги	5064423	Проспект
5064507	9785392348558	Проспект вишневский м.в. чага: звездный час. современные сведения об уникальном грибе 60x90/16 128лист	205408	Полиграфия (folder)/Книги	5064423	Проспект
5064508	9785392218837	Проспект власов а.е., зеленков ю.а., солнцев и.в. развитие массового спорта в современной россии 60x90/16 128лист	205408	Полиграфия (folder)/Книги	5064423	Проспект
5064509	9785392350025	Проспект войнарович а.б., луцик в.в., савченко в.а., самарин в.и. уголовный процесс европейских государств 60x90/16 752лист	205408	Полиграфия (folder)/Книги	5064423	Проспект
5064510	9785392340422	Проспект волина с.а., садовникова е.в. межкультурная коммуникация - это актуально. уч /магистров на немецком 60x90/16 192лист	205408	Полиграфия (folder)/Книги	5064423	Проспект
5064511	9785392349074	Проспект волков а.м. как написать жалобу: образцы с комментариями на все случаи жизни 82x100/32 208лист	205408	Полиграфия (folder)/Книги	5064423	Проспект
5064512	9785392351107	Проспект волкова н.с., журавлева о.о., путило н.в. правовое регулирование трансплантации в рф. научно-практич. пос	205408	Полиграфия (folder)/Книги	5064423	Проспект
5064513	9785392349524	Проспект вольфсон в.л. недобросовестность как диагноз злоупотребления субъективным гр/правом 60x90/16 80лист	205408	Полиграфия (folder)/Книги	5064423	Проспект
5064514	9785392351220	Проспект ворожевич а.с. если ты изобретатель. как обеспечить права на изобретения.научно-метод	205408	Полиграфия (folder)/Книги	5064423	Проспект
5064515	9785392273263	Проспект все о банкротстве граждан (выдержки из нормативных правовых актов по с	205408	Полиграфия (folder)/Книги	5064423	Проспект
5064516	9785392305148	Проспект вылегжанин в.н. покупка/продажа квартиры: правила безопасности	205408	Полиграфия (folder)/Книги	5064423	Проспект
5064517	9785392155095	Проспект габуева л.а., зимина э.в. оплата труда персонала медицинских организаций: эффективный контракт.у	205408	Полиграфия (folder)/Книги	5064423	Проспект
5064518	9785392286041	Проспект георгиев в.а., георгиева н.г., орлов а.с., сивохина т.а. хрестоматия по истории россии	205408	Полиграфия (folder)/Книги	5064423	Проспект
5064519	9785392348534	Проспект гиренок ф.и. клиповое сознание 60x90/16 256лист	205408	Полиграфия (folder)/Книги	5064423	Проспект
5064520	9785392327133	Проспект гиренок ф.и. Свобода и судьба. что мы поняли благодаря пандемии? монография	205408	Полиграфия (folder)/Книги	5064423	Проспект
5064521	9785392350797	Проспект глазьев за горизонтом конца истории. монография (обл.)	205408	Полиграфия (folder)/Книги	5064423	Проспект
5064522	9785392306404	Проспект головина а.а., нанба с.б., тихомиров ю.а. юридическая концепция роботизации 60x90/16 240лист	205408	Полиграфия (folder)/Книги	5064423	Проспект
5064523	9785392134786	Проспект голоскоков л.в. государство, конституция, родина. к поискам национальной идеи и новой 60x90/16 320лист	205408	Полиграфия (folder)/Книги	5064423	Проспект
5064524	9785392348596	Проспект гольдфарб а.а. финансовое право. конспект лекций 70x100/32 128лист	205408	Полиграфия (folder)/Книги	5064423	Проспект
5064525	9785392299218	Проспект гончаров и.в., какителашвили м.м., карпов н.н. конституционное право.уч. пос. университет прокуратуры российской феде	205408	Полиграфия (folder)/Книги	5064423	Проспект
