ID	UPCEAN	Name	CategoryID	CategoryName	BrandID	BrandName
150333	3258691280196	Вино delor reserve bordeaux 2004 красн сух 12.5% 750мл	22133	Продукты питания (folder)/Алкогольные напитки/Вино (folder)/Вино	0	
1195932	4840046001052	Вино demidulce alb Chardonnay белое полусладк 10-13% 750мл ст/б	22133	Продукты питания (folder)/Алкогольные напитки/Вино (folder)/Вино	0	
2425222	318612773961	Вино des lys бел полусладк 11% 750мл	22133	Продукты питания (folder)/Алкогольные напитки/Вино (folder)/Вино	0	
1816230	3186127739676	Вино des lys белое сухое 12% 750мл ст/б	22133	Продукты питания (folder)/Алкогольные напитки/Вино (folder)/Вино	0	
1839997	3186127743420	Вино des lys красное сухое 750мл 11.5% неско	41821	Продукты питания (folder)/Алкогольные напитки/Вино (folder)/Вина Франции	0	
2853402	3186127739645	Вино des lys столов полусл.красн 11% 750мл	22133	Продукты питания (folder)/Алкогольные напитки/Вино (folder)/Вино	0	
1659777	3186127739614	Вино des lys столов полусладк белое 11% 750мл ст/б	22133	Продукты питания (folder)/Алкогольные напитки/Вино (folder)/Вино	0	
46937	8437004566256	Вино descendientes de jose palacios petalos красн сух 14% 750мл	41484	Продукты питания (folder)/Алкогольные напитки/Вино (folder)/Вина Испании	46935	Descendientes de Jose Palacios
46936	8437004566133	Вино descendientes de jose palacios вилла дкорульон красн сух 14% 750мл	41484	Продукты питания (folder)/Алкогольные напитки/Вино (folder)/Вина Испании	46935	Descendientes de Jose Palacios
3284241	4660003846911	Вино deserto blackberry фруктовое полусладк 8.5-9.5% 700мл ст/б	22133	Продукты питания (folder)/Алкогольные напитки/Вино (folder)/Вино	0	
3284242	4660003846898	Вино deserto Cherry фруктовое полусладк 8.5-9.5% 700мл ст/б	22133	Продукты питания (folder)/Алкогольные напитки/Вино (folder)/Вино	0	
3284243	4660003846928	Вино deserto Raspberry фруктовое полусладк 8.5-9.5% 700мл ст/б	22133	Продукты питания (folder)/Алкогольные напитки/Вино (folder)/Вино	0	
3284244	4660003846935	Вино deserto вишня фруктовое полусладк 9% 1л т/п	22133	Продукты питания (folder)/Алкогольные напитки/Вино (folder)/Вино	0	
3284245	4660003846959	Вино deserto ежевика фруктовое полусладк 9% 1л т/п	22133	Продукты питания (folder)/Алкогольные напитки/Вино (folder)/Вино	0	
3284246	4660003846966	Вино deserto малина фруктовое полусладк 9% 1л т/п	22133	Продукты питания (folder)/Алкогольные напитки/Вино (folder)/Вино	0	
3284247	8436541010291	Вино detunda Cabernet Sauvignon темпранильо красное сухое 12.5% tetrapak 3л	22133	Продукты питания (folder)/Алкогольные напитки/Вино (folder)/Вино	0	
3284248	8436541010284	Вино detunda Sauvignon блан белое сухое 12.5% tetrapak 3л	22133	Продукты питания (folder)/Алкогольные напитки/Вино (folder)/Вино	0	
3284249	3308440045641	Вино deux freres blanc столов белое сухое 11% 750мл стбут	22133	Продукты питания (folder)/Алкогольные напитки/Вино (folder)/Вино	0	
3284250	3308440045658	Вино deux freres Rouge столов красное сухое 11% 750мл стбут	22133	Продукты питания (folder)/Алкогольные напитки/Вино (folder)/Вино	0	
1191579	4840249005468	Вино devine Sauvignon белое полусладк 1л	22133	Продукты питания (folder)/Алкогольные напитки/Вино (folder)/Вино	0	
1191580	4840249005475	Вино devine traminer бел полусладк 1л	22133	Продукты питания (folder)/Алкогольные напитки/Вино (folder)/Вино	0	
1191578	4840249005499	Вино devine мускат розов полусладк 1л	22133	Продукты питания (folder)/Алкогольные напитки/Вино (folder)/Вино	0	
3791210	3800008352234	Вино dion.Club каг.благ. красн спец.16% 750мл	1759169	Продукты питания (folder)/Алкогольные напитки/Вино (folder)/Вина Болгарии	3791209	DIONIS CLUB
3284251	4840325007508	Вино diona grande диона гранд красное п/сух 10-12% 750мл ст/б	22133	Продукты питания (folder)/Алкогольные напитки/Вино (folder)/Вино	0	
3284252	4840325007522	Вино diona grande столов полусл бел 10-12% 750мл стекло	22133	Продукты питания (folder)/Алкогольные напитки/Вино (folder)/Вино	0	
3791211	661540003175	Вино dioni.Club каг.вк красн спец.16% 750мл	3789981	Продукты питания (folder)/Алкогольные напитки/Вино (folder)/Вино крепленое	3791209	DIONIS CLUB
3284253	4620016483848	Вино dionis Cabernet крымское красное сухое 10-12% 750мл стекло	22133	Продукты питания (folder)/Алкогольные напитки/Вино (folder)/Вино	0	
1191581	4840454003303	Вино dionis Club мускат молдавский красн полусладк 750мл	22133	Продукты питания (folder)/Алкогольные напитки/Вино (folder)/Вино	0	
3284255	4620016483985	Вино dionis Merlot крымское красное полусладк 10-12% 750мл стекло	22133	Продукты питания (folder)/Алкогольные напитки/Вино (folder)/Вино	0	
3284254	4620016484005	Вино dionis крымская лоза белое полусладк 9-11% 750мл стекло	22133	Продукты питания (folder)/Алкогольные напитки/Вино (folder)/Вино	0	
282241	6001495000326	Вино distell durbanville Hills Cabernet Sauvignon красн сух 750мл	225281	Продукты питания (folder)/Алкогольные напитки/Вино (folder)/Вина ЮАР	282240	Distell
282245	6001495000357	Вино distell durbanville Hills Chardonnay бел сух 750мл	225281	Продукты питания (folder)/Алкогольные напитки/Вино (folder)/Вина ЮАР	282240	Distell
282242	6001495000388	Вино distell durbanville Hills Merlot красн сух 750мл	225281	Продукты питания (folder)/Алкогольные напитки/Вино (folder)/Вина ЮАР	282240	Distell
282244	6001495000449	Вино distell durbanville Hills Sauvignon блан бел сух 750мл	225281	Продукты питания (folder)/Алкогольные напитки/Вино (folder)/Вина ЮАР	282240	Distell
282243	6001495000418	Вино distell durbanville Hills пинотаж красн сух 750мл	225281	Продукты питания (folder)/Алкогольные напитки/Вино (folder)/Вина ЮАР	282240	Distell
282246	6001108002846	Вино distell obikwa Cabernet Sauvignon красное сухое 13.5% 0.75 стбут	225281	Продукты питания (folder)/Алкогольные напитки/Вино (folder)/Вина ЮАР	282240	Distell
282249	6001108002907	Вино distell obikwa Chardonnay белое сухое 12.5% 750мл ст/б	225281	Продукты питания (folder)/Алкогольные напитки/Вино (folder)/Вина ЮАР	282240	Distell
282247	6001108002860	Вино distell obikwa Merlot красное сухое 13.5% 750мл ст/б	225281	Продукты питания (folder)/Алкогольные напитки/Вино (folder)/Вина ЮАР	282240	Distell
634197	6001108004031	Вино distell obikwa Sauvignon блан белое сухое 12.5% 750мл ст/б	22133	Продукты питания (folder)/Алкогольные напитки/Вино (folder)/Вино	3793852	ОБИКВА
282248	6001108002884	Вино distell obikwa пинотаж 2017 красное сухое 13.5% 750мл ст/б	225281	Продукты питания (folder)/Алкогольные напитки/Вино (folder)/Вина ЮАР	282240	Distell
2227294	6001108025166	Вино distell obikwa пинотаж розов/сух 0.75 12% 1/6	225281	Продукты питания (folder)/Алкогольные напитки/Вино (folder)/Вина ЮАР	0	
282250	6001108002921	Вино distell obikwa шенин блан бел сух 750мл	225281	Продукты питания (folder)/Алкогольные напитки/Вино (folder)/Вина ЮАР	282240	Distell
634199	6001108004079	Вино distell obikwa шираз красное сухое 12% 750мл ст/б	22133	Продукты питания (folder)/Алкогольные напитки/Вино (folder)/Вино	0	
3284256	3249381046277	Вино divine expression белое сухое 11% 750мл стекло	22133	Продукты питания (folder)/Алкогольные напитки/Вино (folder)/Вино	0	
3284257	3249381046284	Вино divine expression красное полусладк 10.5% 750мл стекло	22133	Продукты питания (folder)/Алкогольные напитки/Вино (folder)/Вино	0	
3284258	3249381046291	Вино divine expression красное сухое 11% 750мл стекло	22133	Продукты питания (folder)/Алкогольные напитки/Вино (folder)/Вино	0	
3284259	3249381046260	Вино divine expression столов белое полусладк 10.5% 750мл стекло	22133	Продукты питания (folder)/Алкогольные напитки/Вино (folder)/Вино	0	
1659720	8025862070055	Вино doc Тоскана красное сухое rosso di casanova di neri (россо ди казанова ди нери) 14.5% Италия 0.	22133	Продукты питания (folder)/Алкогольные напитки/Вино (folder)/Вино	0	
227421	4601249002471	Вино Dolce amore Изабелла красн полусладк 11% 3л	22133	Продукты питания (folder)/Алкогольные напитки/Вино (folder)/Вино	0	
227420	4601249002273	Вино Dolce amore Изабелла красн полусладк 11% 700мл	22133	Продукты питания (folder)/Алкогольные напитки/Вино (folder)/Вино	0	
227422	4601249002129	Вино Dolce amore Изабелла красн полусладк 11% tetrapak 1л	22133	Продукты питания (folder)/Алкогольные напитки/Вино (folder)/Вино	0	
227412	4601249002495	Вино Dolce amore красн полусладк 11% 3л	22133	Продукты питания (folder)/Алкогольные напитки/Вино (folder)/Вино	0	
227413	4601249002112	Вино Dolce amore красн полусладк 11% tetrapak 1л	22133	Продукты питания (folder)/Алкогольные напитки/Вино (folder)/Вино	0	
227443	4601249002457	Вино Dolce amore мускат бел сл 11% 3л	22133	Продукты питания (folder)/Алкогольные напитки/Вино (folder)/Вино	0	
227442	4601249002297	Вино Dolce amore мускат бел сл 11% 700мл	22133	Продукты питания (folder)/Алкогольные напитки/Вино (folder)/Вино	0	
227444	4601249002105	Вино Dolce amore мускат бел сл 11% tetrapak 1л	22133	Продукты питания (folder)/Алкогольные напитки/Вино (folder)/Вино	0	
227411	4601249002310	Вино Dolce amore столов полусладк красное 10-12% 700мл ст/б	22133	Продукты питания (folder)/Алкогольные напитки/Вино (folder)/Вино	0	
3791212	4650061342241	Вино Dolce notte Cherry фр.полусладк 750мл	1759520	Продукты питания (folder)/Алкогольные напитки/Вино (folder)/Вино плодовое	0	
1957992	8033116400404	Вино Dolce Vita натур.красное полусладк 750мл	22133	Продукты питания (folder)/Алкогольные напитки/Вино (folder)/Вино	0	
225317	3760028360032	Вино dom brau vdplaude fr c vn org красн 750ml	41821	Продукты питания (folder)/Алкогольные напитки/Вино (folder)/Вина Франции	0	
227383	4601249001252	Вино dom yago Cabernet красн сух 12.5% 700мл	22133	Продукты питания (folder)/Алкогольные напитки/Вино (folder)/Вино	0	
150555	4601249001245	Вино dom yago Merlot красн сух 12.5% 700мл	22133	Продукты питания (folder)/Алкогольные напитки/Вино (folder)/Вино	150443	Бодегас Вальдепабло 294
150553	4601249000903	Вино dom yago бел полусладк 10-12% 3л	22133	Продукты питания (folder)/Алкогольные напитки/Вино (folder)/Вино	0	
42381	4601249001085	Вино dom yago бел полусладк 11% tetrapak 1л	41484	Продукты питания (folder)/Алкогольные напитки/Вино (folder)/Вина Испании	42380	Дом Яго
150554	4601249000897	Вино dom yago красн полусладк 10-12% 3л	22133	Продукты питания (folder)/Алкогольные напитки/Вино (folder)/Вино	0	
2425263	4601249000859	Вино dom yago красн полусладк 10-12% 750мл	22133	Продукты питания (folder)/Алкогольные напитки/Вино (folder)/Вино	0	
227384	4601249001214	Вино dom yago красн полусладк 11% 700мл	22133	Продукты питания (folder)/Алкогольные напитки/Вино (folder)/Вино	0	
42382	4601249001092	Вино dom yago красн полусладк 11% tetrapak 1л	22133	Продукты питания (folder)/Алкогольные напитки/Вино (folder)/Вино	42380	Дом Яго
227385	4601249001269	Вино dom yago мальбек красн сух 12.5% 700мл	22133	Продукты питания (folder)/Алкогольные напитки/Вино (folder)/Вино	0	
227386	4601249001207	Вино dom yago сухое белое 11% 700мл	22133	Продукты питания (folder)/Алкогольные напитки/Вино (folder)/Вино	0	
151688	4601249001238	Вино dom yago темпранильо красн сух 12.5% 700мл	22133	Продукты питания (folder)/Алкогольные напитки/Вино (folder)/Вино	150443	Бодегас Вальдепабло 294
227387	4601249001276	Вино dom yago торронтес белое п/сухое 12.5% 700мл	22133	Продукты питания (folder)/Алкогольные напитки/Вино (folder)/Вино	0	
3791213	3760036380114	Вино dom.de cal.La tour. красн сух 14.5% 750мл	22133	Продукты питания (folder)/Алкогольные напитки/Вино (folder)/Вино	0	
1191582	3100620050434	Вино domaine chupin анжу блан 2003 белое 750мл (Франция)	22133	Продукты питания (folder)/Алкогольные напитки/Вино (folder)/Вино	0	
1191583	3540528442984	Вино domaine de La genestiere 2002г 13.5% крас. сух 0.75г (Франция)	22133	Продукты питания (folder)/Алкогольные напитки/Вино (folder)/Вино	0	
1191584	3540528446234	Вино domaine de La genestiere 2004г 13.5% розов сух 750мл (Франция)	22133	Продукты питания (folder)/Алкогольные напитки/Вино (folder)/Вино	0	
3791216	3176481010276	Вино domaine de lam.бел сух 11.5% 750мл	22133	Продукты питания (folder)/Алкогольные напитки/Вино (folder)/Вино	3791215	PIERRE DUMONT
1659642	3760094280098	Вино domaine de menard colombard ugni blanc igp coles de gascogne (домен де менар коломбар уни блан,с защищенным географически	41821	Продукты питания (folder)/Алкогольные напитки/Вино (folder)/Вина Франции	0	
1660028	3760094280081	Вино domaine de menaro gros manseng igp colas de gascogne натуральное	22133	Продукты питания (folder)/Алкогольные напитки/Вино (folder)/Вино	0	
1759851	3475371011844	Вино domaine du Grand pouget bergerac красн сух 750мл	22133	Продукты питания (folder)/Алкогольные напитки/Вино (folder)/Вино	3791217	Domaine du Grand Pouget
3791226	3475371013183	Вино domaine du Grand pouget bergerac красн сух 750мл #10	22133	Продукты питания (folder)/Алкогольные напитки/Вино (folder)/Вино	3791217	Domaine du Grand Pouget
3791218	3475371012032	Вино domaine du Grand pouget bergerac красн сух 750мл #2	22133	Продукты питания (folder)/Алкогольные напитки/Вино (folder)/Вино	3791217	Domaine du Grand Pouget
3791219	3475371012216	Вино domaine du Grand pouget bergerac красн сух 750мл #3	22133	Продукты питания (folder)/Алкогольные напитки/Вино (folder)/Вино	3791217	Domaine du Grand Pouget
3791220	3475371012377	Вино domaine du Grand pouget bergerac красн сух 750мл #4	22133	Продукты питания (folder)/Алкогольные напитки/Вино (folder)/Вино	3791217	Domaine du Grand Pouget
3791221	3475371012537	Вино domaine du Grand pouget bergerac красн сух 750мл #5	22133	Продукты питания (folder)/Алкогольные напитки/Вино (folder)/Вино	3791217	Domaine du Grand Pouget
3791222	3475371012797	Вино domaine du Grand pouget bergerac красн сух 750мл #6	22133	Продукты питания (folder)/Алкогольные напитки/Вино (folder)/Вино	3791217	Domaine du Grand Pouget
3791223	3475371012865	Вино domaine du Grand pouget bergerac красн сух 750мл #7	22133	Продукты питания (folder)/Алкогольные напитки/Вино (folder)/Вино	3791217	Domaine du Grand Pouget
3791224	3475371013039	Вино domaine du Grand pouget bergerac красн сух 750мл #8	22133	Продукты питания (folder)/Алкогольные напитки/Вино (folder)/Вино	3791217	Domaine du Grand Pouget
3791225	3475371013121	Вино domaine du Grand pouget bergerac красн сух 750мл #9	22133	Продукты питания (folder)/Алкогольные напитки/Вино (folder)/Вино	3791217	Domaine du Grand Pouget
3284260	8410702016452	Вино domaine du moulin белое полусладк 10.5% 1л	22133	Продукты питания (folder)/Алкогольные напитки/Вино (folder)/Вино	0	
691025	3359880123307	Вино domaine du tariquet Chardonnay бел сух 750мл/гасконь	41821	Продукты питания (folder)/Алкогольные напитки/Вино (folder)/Вина Франции	691024	Domaine du tariquet
283382	3359880123314	Вино domaine du tariquet Sauvignon белое сух 750мл 12% /Франция/	22133	Продукты питания (folder)/Алкогольные напитки/Вино (folder)/Вино	691024	Domaine du tariquet
283383	3359880123406	Вино domaine du tariquet шен Chardonnay бел сух 750мл 11.5% /Франция/	22133	Продукты питания (folder)/Алкогольные напитки/Вино (folder)/Вино	691024	Domaine du tariquet
3791228	3760054831193	Вино domaine La suffrene красн сух 750мл	22133	Продукты питания (folder)/Алкогольные напитки/Вино (folder)/Вино	3791227	DOMAINE LA SUFFRENE
3791229	3760054831360	Вино domaine La suffrene красн сух 750мл #2	22133	Продукты питания (folder)/Алкогольные напитки/Вино (folder)/Вино	3791227	DOMAINE LA SUFFRENE
3791230	3760054831575	Вино domaine La suffrene красн сух 750мл #3	22133	Продукты питания (folder)/Алкогольные напитки/Вино (folder)/Вино	3791227	DOMAINE LA SUFFRENE
3791231	4607020790308	Вино domaine La suffrene красн сух 750мл #4	22133	Продукты питания (folder)/Алкогольные напитки/Вино (folder)/Вино	3791227	DOMAINE LA SUFFRENE
44696	4607020790384	Вино domaine La suffrene розов сух 14% 750мл	41821	Продукты питания (folder)/Алкогольные напитки/Вино (folder)/Вина Франции	44695	Ля Сюффрен
42941	3292060015767	Вино domaine laroche chablis Grand cru л.бланшо бел сух 13% 750мл	41821	Продукты питания (folder)/Алкогольные напитки/Вино (folder)/Вина Франции	42939	Domaine Laroche
2954231	3292060027463	Вино domaine laroche chablis Grand cru л.бланшо бел сух 13% 750мл #2	41821	Продукты питания (folder)/Алкогольные напитки/Вино (folder)/Вина Франции	42939	Domaine Laroche
689374	3292060014333	Вино domaine laroche chablis Grand cru л.бланшо рез. бел сух 750мл	688362	Продукты питания (folder)/Алкогольные напитки/Вино (folder)/Вина Франции Бургундия	42939	Domaine Laroche
2976981	3292060024912	Вино domaine laroche chablis Grand cru л.бланшо рез. бел сух 750мл #2	688362	Продукты питания (folder)/Алкогольные напитки/Вино (folder)/Вина Франции Бургундия	42939	Domaine Laroche
1659774	3292060031842	Вино domaine laroche chablis Grand cru л.бланшо рез.бел сух 750мл	688362	Продукты питания (folder)/Алкогольные напитки/Вино (folder)/Вина Франции Бургундия	42939	Domaine Laroche
2226948	3292060056067	Вино domaine laroche chablis Grand cru л.бланшо рез.бел сух 750мл #2	688362	Продукты питания (folder)/Алкогольные напитки/Вино (folder)/Вина Франции Бургундия	42939	Domaine Laroche
2229904	3292060048789	Вино domaine laroche chablis Grand cru ле бланшо сухое 12.0% 750мл	22133	Продукты питания (folder)/Алкогольные напитки/Вино (folder)/Вино	42939	Domaine Laroche
2229905	3292060049144	Вино domaine laroche chablis Grand cru ле кло сухое 12.0% 750мл	22133	Продукты питания (folder)/Алкогольные напитки/Вино (folder)/Вино	42939	Domaine Laroche
42943	3292060026268	Вино domaine laroche chablis Grand cru лекло бел сух 12.5% 1.5л	41821	Продукты питания (folder)/Алкогольные напитки/Вино (folder)/Вина Франции	42939	Domaine Laroche
2954233	3292060027852	Вино domaine laroche chablis Grand cru лекло бел сух 12.5% 1.5л #2	41821	Продукты питания (folder)/Алкогольные напитки/Вино (folder)/Вина Франции	42939	Domaine Laroche
42942	3292060014692	Вино domaine laroche chablis Grand cru лекло бел сух 12.5% 750мл	41821	Продукты питания (folder)/Алкогольные напитки/Вино (folder)/Вина Франции	42939	Domaine Laroche
2954232	3292060027753	Вино domaine laroche chablis Grand cru лекло бел сух 12.5% 750мл #2	41821	Продукты питания (folder)/Алкогольные напитки/Вино (folder)/Вина Франции	42939	Domaine Laroche
2229906	3292060048345	Вино domaine laroche chablis Grand cru резерв де л'обэдиенс 750мл 12.0%, сухое	22133	Продукты питания (folder)/Алкогольные напитки/Вино (folder)/Вино	42939	Domaine Laroche
42950	3292060026244	Вино domaine laroche chablis Grand cru резерв л.бланшо бел сух 13% 750мл п/у	41821	Продукты питания (folder)/Алкогольные напитки/Вино (folder)/Вина Франции	42939	Domaine Laroche
2229908	3292060034119	Вино domaine laroche chablis Premier cru 750мл 11.0%, сухое	22133	Продукты питания (folder)/Алкогольные напитки/Вино (folder)/Вино	42939	Domaine Laroche
