ID	UPCEAN	Name	CategoryID	CategoryName	BrandID	BrandName
2274331	9789666793853	Ящер - 3D-паззл на изолоне	36536	Полиграфия (folder)/Печатная продукция	0	
871401	4605885302421	Ящерица 28см k93009a plush Apple	980	Игрушки (folder)/Игрушка	0	
871402	4605885298113	Ящерица 4511gt ассортим 33см 12 ш	980	Игрушки (folder)/Игрушка	0	
1346786	4602010341003	Ящерица геккон 138x 91см от 3 лет	2228566	Игрушки (folder)/Игрушки надувные	309610	Intex
2765653	4690590011881	Ящерица играем вместе 20см цвет ассортим в дисплее уп-60шт в кор.24уп	980	Игрушки (folder)/Игрушка	1791899	Играем Вместе
2765654	6934522969467	Ящерица играем вместе пищалка, ассортим 23-42см в дисплее уп-12шт в кор.18уп	980	Игрушки (folder)/Игрушка	1791899	Играем Вместе
2765655	6934614435276	Ящерица надувная 138x 91см в кор. (боится холода) в кор.6шт	1793353	Спорт и отдых (folder)/Надувные изделия	0	
149241	6925654023080	Ящерица тянущаяся, 4 вида	1364437	Игрушки (folder)/Фигурки, роботы, животные	59447	Rinzo
545746	4602010233223	Ящерица увеличив. 600%, crd 22x 15см, 4 вида, арт.w6328-g129.	1364437	Игрушки (folder)/Фигурки, роботы, животные	0	
2765656	4690383001082	Ящерица-тянучка играем вместе ассортим на карт. (русс. уп) 28x 17см в кор.2x 72шт	1	Неклассифицированные/default	1791899	Играем Вместе
871506	8711295627088	Ящик 16л	3536	Хозяйственные товары (folder)/Хозяйственные товары	0	
871403	8412497037902	Ящик 26л	3536	Хозяйственные товары (folder)/Хозяйственные товары	0	
871404	4811221000030	Ящик 40л 21с131-3567 шк4811221000030	1	Неклассифицированные/default	0	
5113707	4627179700775	Ящик 425x224 x 200мм раздвижной бежевый (упак 4)	1	Неклассифицированные/default	0	
5113706	4627114775424	Ящик 425x224 x 200мм раздвижной черный (упак 4)	1	Неклассифицированные/default	0	
871405	4605244020812	Ящик 600x400 x300 хоз	3536	Хозяйственные товары (folder)/Хозяйственные товары	0	
871507	8711295627064	Ящик 80x40 x 17см	3536	Хозяйственные товары (folder)/Хозяйственные товары	0	
3604279	6907001421015	Ящик arti-m для хранения сталь арт.142-101	1	Неклассифицированные/default	0	
3604280	6907001421206	Ящик arti-m для хранения сталь арт.142-120	1	Неклассифицированные/default	0	
3604281	6907001421312	Ящик arti-m для хранения сталь арт.142-131	1	Неклассифицированные/default	0	
3625200	4690231098554	Ящик blocker mast.tour 16inch+орган.hobby Box 9inch	344013	Инструменты (folder)/Ящик для инструментов	3625198	BLOCKER
3625201	4690231143742	Ящик blocker master tour 16inch+орган.hobby Box 9inch #2	344013	Инструменты (folder)/Ящик для инструментов	3625198	BLOCKER
3625608	4690231142813	Ящик blocker master tour для рыб.камуф.19	3608221	Спорт и отдых (folder)/Аксессуары для водного спорта	3625198	BLOCKER
805246	4607177049083	Ящик blocker master tour №24 пластиковый 610x320 x 300мм	344013	Инструменты (folder)/Ящик для инструментов	54493	Пластик-Центр
3604286	4680014231339	Ящик bubble boom универсальный 400x335 x 85мм	1	Неклассифицированные/default	0	
871406	5996093388949	Ящик craft house	1	Неклассифицированные/default	0	
330467	3253924706214	Ящик curver pets кошка deco Madrid s декоративный для аксессуаров	1	Неклассифицированные/default	315707	Curver Pets
330468	3253920035059	Ящик curver pets кошка оптима хобби для аксессуаров для животных 15л	1	Неклассифицированные/default	315707	Curver Pets
3604288	5901110613164	Ящик curver складной красный	1	Неклассифицированные/default	309635	Curver
3604289	5901110613133	Ящик curver складной синий	1	Неклассифицированные/default	309635	Curver
871479	4607097620058	Ящик darel с крышкой на колесах 56л 61x40 x 31см	3536	Хозяйственные товары (folder)/Хозяйственные товары	0	
3604290	4601532810554	Ящик Disney 10л 81055	1	Неклассифицированные/default	0	
1712972	4601532810776	Ящик Disney тачки 10л c81077	3536	Хозяйственные товары (folder)/Хозяйственные товары	145147	Полимербыт
278354	4607110960123	Ящик ekko plast тарный 0.13 куб.м. непищевой	3536	Хозяйственные товары (folder)/Хозяйственные товары	260754	Ekko Plast
1346815	4607146490403	Ящик Eva industry вензель складной для хранения 43x35 x 16см	3536	Хозяйственные товары (folder)/Хозяйственные товары	1260240	Арт де Лис
1346816	4607146490380	Ящик Eva industry вензель складной для хранения 60x50 x 30см	3536	Хозяйственные товары (folder)/Хозяйственные товары	1260240	Арт де Лис
3604292	8404880656456	Ящик fit для крепежа 10 17.5x10.6x4.6см	1	Неклассифицированные/default	0	
3604293	5901110614130	Ящик form складной синий	1	Неклассифицированные/default	0	
3948109	4607137039154	Ящик helios рыболова двухполоч.красный	562237	Спорт и отдых (folder)/Рыбалка (folder)/Рыбалка	0	
1980059	4607023592312	Ящик idea детский для мелочей	476072	Хозяйственные товары (folder)/Контейнер для игрушек	0	
3677143	8711295012204	Ящик jelenia plast для хран.скл.48x35 x 24см	33235	Растениеводство/Садовый инвентарь	3677137	JELENIA PLAST
3677144	5900791000010	Ящик jelenia plast скл.для хозтоваров 32л	3536	Хозяйственные товары (folder)/Хозяйственные товары	3677137	JELENIA PLAST
3677145	5900791000027	Ящик jelenia plast скл.для хозтоваров 45л	3536	Хозяйственные товары (folder)/Хозяйственные товары	3677137	JELENIA PLAST
3677146	5900791003011	Ящик jelenia plast скл.для хозтоваров 60л	3536	Хозяйственные товары (folder)/Хозяйственные товары	3677137	JELENIA PLAST
3604307	4690290004411	Ящик junior дино на роликах с крышкой 30л	1	Неклассифицированные/default	0	
3683927	8718158547422	Ящик koopman 29x19.5x3.5см	542785	Товары для праздников (folder)/Украшение новогоднее	3682723	KOOPMAN
3683928	8714143791115	Ящик koopman Disney для хран.игр.60x30 x32.5	263522	Мебель (folder)/Мебель	3682723	KOOPMAN
3683929	8714143792112	Ящик koopman Disney для хран.игр.60x30 x32.5 #2	263522	Мебель (folder)/Мебель	3682723	KOOPMAN
3683930	8714143793119	Ящик koopman Disney для хран.игр.60x30 x32.5 #3	263522	Мебель (folder)/Мебель	3682723	KOOPMAN
736534	8718158095978	Ящик koopman для хр.прин.для шит.27.5x19.5x 4см	1	Неклассифицированные/default	3682723	KOOPMAN
3683931	8718158263261	Ящик koopman для хран.не пищ.прод.20x16 x 6см	542785	Товары для праздников (folder)/Украшение новогоднее	3682723	KOOPMAN
3683932	8711295898778	Ящик koopman складной 48x35 x 24см	3608246	Растениеводство/Кашпо,горшки и держатели	3682723	KOOPMAN
3683933	8711295987434	Ящик koopman складной 48x35 x 24см #2	3608246	Растениеводство/Кашпо,горшки и держатели	3682723	KOOPMAN
3683934	8711295164033	Ящик koopman складной 49x35 x 24см	3608246	Растениеводство/Кашпо,горшки и держатели	3682723	KOOPMAN
3692422	4690231112830	Ящик Little Angel bears для хран.12л	3536	Хозяйственные товары (folder)/Хозяйственные товары	3692408	Little Angel
3692423	4690231159538	Ящик Little Angel мои сокровища для игр.	3536	Хозяйственные товары (folder)/Хозяйственные товары	3692408	Little Angel
3692424	4690231164808	Ящик Little Angel обучайка для хран.17л	3536	Хозяйственные товары (folder)/Хозяйственные товары	3692408	Little Angel
3604312	4630017901067	Ящик martika массимо пластмассовый для медикаментов	1	Неклассифицированные/default	0	
3604313	4607049784388	Ящик martika фелиция для растений с поддоном пластиковый желтый 40см	1	Неклассифицированные/default	3279457	martika
1575220	5701922200428	Ящик plast Team (п) hobby Box jumbo 43x35 x 20см	3536	Хозяйственные товары (folder)/Хозяйственные товары	1575181	Plast Team
1575221	5701922221300	Ящик plast Team (п) hobby Box turn &stac 11.5л	3536	Хозяйственные товары (folder)/Хозяйственные товары	1575181	Plast Team
1575222	5706773221400	Ящик plast Team (п) hobby Box turn &stac 20л	3536	Хозяйственные товары (folder)/Хозяйственные товары	1575181	Plast Team
330475	5701922201128	Ящик plast Team (п) pirate на роликах с крышкой 30л	3536	Хозяйственные товары (folder)/Хозяйственные товары	1575181	Plast Team
1575223	5706773228010	Ящик plast Team (п) pirate с крышкой и ручкой 4.5л	3536	Хозяйственные товары (folder)/Хозяйственные товары	1575181	Plast Team
1575224	5706773227204	Ящик plast Team (п) premium Maxi 55.0л	3536	Хозяйственные товары (folder)/Хозяйственные товары	1575181	Plast Team
1575227	5701922239909	Ящик plast Team (п) с крышкой bedroller 70x39.4x15.5см	3536	Хозяйственные товары (folder)/Хозяйственные товары	1575181	Plast Team
1575228	5701922239008	Ящик plast Team (п) с крышкой tagstore 1.5л	3536	Хозяйственные товары (folder)/Хозяйственные товары	1575181	Plast Team
1575229	5701922239404	Ящик plast Team (п) с крышкой tagstore 12.0л	3536	Хозяйственные товары (folder)/Хозяйственные товары	1575181	Plast Team
1575230	5701922239107	Ящик plast Team (п) с крышкой tagstore 3.0л	3536	Хозяйственные товары (folder)/Хозяйственные товары	1575181	Plast Team
1575231	5701922239800	Ящик plast Team (п) с крышкой tagstore 70.0л	3536	Хозяйственные товары (folder)/Хозяйственные товары	1575181	Plast Team
1575232	5701922239305	Ящик plast Team (п) с крышкой tagstore 8.0л	3536	Хозяйственные товары (folder)/Хозяйственные товары	1575181	Plast Team
1575257	4607126319014	Ящик plast Team (р) junior на роликах с крышкой 30л	3536	Хозяйственные товары (folder)/Хозяйственные товары	1575181	Plast Team
1575258	4607126319045	Ящик plast Team (р) junior на роликах с крышкой 60л	3536	Хозяйственные товары (folder)/Хозяйственные товары	1575181	Plast Team
1575259	4607126316013	Ящик plast Team (р) pirate на роликах с крышкой 60л	3536	Хозяйственные товары (folder)/Хозяйственные товары	1575181	Plast Team
330512	4690290198110	Ящик plast Team (р) для хранения мелочей 8.5л	3536	Хозяйственные товары (folder)/Хозяйственные товары	309375	ООО Пи энд Си
1575260	4690290198011	Ящик plast Team (р) для хранения обуви 8.5л	3536	Хозяйственные товары (folder)/Хозяйственные товары	1575181	Plast Team
1840783	5701922201234	Ящик plast Team pirat дет.на рол. 80л	3536	Хозяйственные товары (folder)/Хозяйственные товары	0	
1840790	5706773229000	Ящик plast Team pirat Премиум 4.5л	3536	Хозяйственные товары (folder)/Хозяйственные товары	0	
3733255	4607126319229	Ящик plast Team для хранения штабелир.60л	231359	Посуда (folder)/Контейнер для продуктов	1575181	Plast Team
3604324	5707672229566	Ящик poland с крышкой 13л	1	Неклассифицированные/default	0	
1832465	3253561932663	Ящик stanley Classic Line 15inch	41797	Инструменты (folder)/Инструмент	306099	Stanley
1832928	3253561929052	Ящик stanley jumbo16 мет.замки 192905	41797	Инструменты (folder)/Инструмент	306099	Stanley
1832929	3253561929069	Ящик stanley jumbo19 мет.замки 192906	41797	Инструменты (folder)/Инструмент	306099	Stanley
1832466	3253561921674	Ящик stanley series 2000 19inch	41797	Инструменты (folder)/Инструмент	306099	Stanley
1832927	3253561920653	Ящик stanley series2000 16inch 192065	41797	Инструменты (folder)/Инструмент	0	
3755178	3253561956133	Ящик stanley металлопластик.для инстр.23inch	344013	Инструменты (folder)/Ящик для инструментов	306099	Stanley
330470	5701922202415	Ящик twin двухсторон для мелочей	3536	Хозяйственные товары (folder)/Хозяйственные товары	1575181	Plast Team
142754	8013183758639	Ящик абм фанни на колесиках 60л ab008630	3536	Хозяйственные товары (folder)/Хозяйственные товары	41308	АБМ
142755	8013183208646	Ящик абм фанни на колесиках 80л ab008640	3536	Хозяйственные товары (folder)/Хозяйственные товары	41308	АБМ
3948110	4607156360581	Ящик агро ассорти складной	33235	Растениеводство/Садовый инвентарь	0	
3604435	4627084473696	Ящик альтернатива палермо для мужских мелочей 3шт м2094	1	Неклассифицированные/default	0	
3604338	4627114775486	Ящик альтернатива сине-желтый раздвижной 425x224 x 200мм	1	Неклассифицированные/default	149661	Альтернатива
3604343	4607049785491	Ящик астело универсальный на колесиках 600x400 x 180мм	1	Неклассифицированные/default	0	
871407	4811221000535	Ящик балконный	3536	Хозяйственные товары (folder)/Хозяйственные товары	0	
2505986	4607016671123	Ящик балконный (мраморный) с поддоном 500x130 x 160мм	3536	Хозяйственные товары (folder)/Хозяйственные товары	0	
330471	4607002130542	Ящик балконный 100см	3536	Хозяйственные товары (folder)/Хозяйственные товары	309375	ООО Пи энд Си
330472	4607002130511	Ящик балконный 40см	3536	Хозяйственные товары (folder)/Хозяйственные товары	309375	ООО Пи энд Си
1822234	4607065070335	Ящик балконный 45см 7л	3536	Хозяйственные товары (folder)/Хозяйственные товары	0	
3604347	4607027580483	Ящик балконный 50см с поддоном ассортим у31850	1	Неклассифицированные/default	0	
1346787	4605196006391	Ящик балконный 60см	3536	Хозяйственные товары (folder)/Хозяйственные товары	0	
3604299	4605196013023	Ящик балконный 60см с поддоном с подливом мрамор м/3221	1	Неклассифицированные/default	3673575	М-Пластика Idea
5113708	4690231104255	Ящик балконный 60см салатовый ing 1806-сл	3536	Хозяйственные товары (folder)/Хозяйственные товары	0	
3604349	4607027582456	Ящик балконный 75см уз 1875 #2	1	Неклассифицированные/default	0	
3604350	5907474320465	Ящик балконный 75см уз 1875 #3	1	Неклассифицированные/default	0	
1346791	5900791008719	Ящик балконный 80x20 x17	3536	Хозяйственные товары (folder)/Хозяйственные товары	0	
1346792	5900791008757	Ящик балконный 80x30 x32	3536	Хозяйственные товары (folder)/Хозяйственные товары	0	
330474	4607002130535	Ящик балконный 80см	3536	Хозяйственные товары (folder)/Хозяйственные товары	309375	ООО Пи энд Си
3604351	5907474320540	Ящик балконный 80см #2	1	Неклассифицированные/default	0	
1346789	4605196006407	Ящик балконный 80см зелен	3536	Хозяйственные товары (folder)/Хозяйственные товары	0	
5113709	4690231053539	Ящик балконный 80см мрамор ing1803	3536	Хозяйственные товары (folder)/Хозяйственные товары	0	
1346790	4605196005271	Ящик балконный 80см мраморн.	3536	Хозяйственные товары (folder)/Хозяйственные товары	0	
2505987	4690227002442	Ящик балконный c поддоном,25см, глина	3536	Хозяйственные товары (folder)/Хозяйственные товары	0	
608667	4690231021996	Ящик балконный ing1801 тзл 40см	3536	Хозяйственные товары (folder)/Хозяйственные товары	3674504	INGREEN
608669	4690231022047	Ящик балконный ing1803 мр 80см	3536	Хозяйственные товары (folder)/Хозяйственные товары	3674504	INGREEN
608670	4690231022085	Ящик балконный ing1804 тзл 100см	3536	Хозяйственные товары (folder)/Хозяйственные товары	0	
1822232	4606100147865	Ящик балконный ingreen 40см	3536	Хозяйственные товары (folder)/Хозяйственные товары	3674504	INGREEN
3674512	4690231153925	Ящик балконный ingreen 40см #2	3649594	Растениеводство/Поддоны и балконные ящики	3674504	INGREEN
1822233	4606100147872	Ящик балконный ingreen 60см	3536	Хозяйственные товары (folder)/Хозяйственные товары	3674504	INGREEN
608668	4690231022009	Ящик балконный ingreen 60см ing1802	3536	Хозяйственные товары (folder)/Хозяйственные товары	3674504	INGREEN
3674513	4690231053546	Ящик балконный ingreen 80см	3649594	Растениеводство/Поддоны и балконные ящики	3674504	INGREEN
3674514	4690231107027	Ящик балконный ingreen с поддоном 40см	3608246	Растениеводство/Кашпо,горшки и держатели	3674504	INGREEN
3604352	4690231085264	Ящик балконный ingreen с поддоном 60см	1	Неклассифицированные/default	0	
3674515	4690231107041	Ящик балконный ingreen с поддоном 60см #2	3608246	Растениеводство/Кашпо,горшки и держатели	3674504	INGREEN
3674511	4690231053508	Ящик балконный ingreen терракот.40см	3649594	Растениеводство/Поддоны и балконные ящики	3674504	INGREEN
3604322	8711252454436	Ящик балконный paragon на перила 29x29 x 20см ш45443	1	Неклассифицированные/default	0	
3604330	4627093620135	Ящик балконный авс-комплект 70см терракотовый арт kd117	1	Неклассифицированные/default	0	
3604422	4605196016581	Ящик балконный алиция 400мм с поддоном бел глина м/3214	1	Неклассифицированные/default	3673575	М-Пластика Idea
3604426	4605196016604	Ящик балконный алиция 600мм с поддоном бел глина м/3215	1	Неклассифицированные/default	3673575	М-Пластика Idea
3604424	4605196017946	Ящик балконный алиция 800мм с поддоном бел глина м/3216	1	Неклассифицированные/default	3673575	М-Пластика Idea
3604342	4650055591327	Ящик балконный ангора классик 71см 10л	1	Неклассифицированные/default	0	
3604340	4650055591426	Ящик балконный ангора с дренажем 8.5л а5420мр	1	Неклассифицированные/default	0	
3604341	4650055591433	Ящик балконный ангора с дренажной решеткой терракот 8.5л	1	Неклассифицированные/default	0	
2505988	4690227021702	Ящик балконный без поддона,25см, глина	3536	Хозяйственные товары (folder)/Хозяйственные товары	0	
3948113	4605196003871	Ящик балконный братек 40см	3649594	Растениеводство/Поддоны и балконные ящики	0	
3604346	4607115265964	Ящик балконный гусеница 40см с поддоном (1) (1) бп640	1	Неклассифицированные/default	0	
3604365	4607115265971	Ящик балконный гусеница с поддоном 60см	1	Неклассифицированные/default	0	
5113710	4660006143062	Ящик балконный декор 640x170 x120 белый	310878	Растениеводство/Горшок цветочный	0	
5113711	4660006141167	Ящик балконный декор 640x170 x120 терракот	310878	Растениеводство/Горшок цветочный	0	
5113712	4660006143017	Ящик балконный декор белый 600x150 x120	310878	Растениеводство/Горшок цветочный	0	
3948111	4607016671185	Ящик балконный для цв б/поддона 13.5x50 x 16см	3649594	Растениеводство/Поддоны и балконные ящики	0	
3604353	4640002375605	Ящик балконный для цветов 420x200 x120	1	Неклассифицированные/default	0	
3604414	4650055590993	Ящик балконный классик мраморный 7.5л	1	Неклассифицированные/default	0	
3604415	4650055591006	Ящик балконный классик терракотовый 7.5л	1	Неклассифицированные/default	0	
3604425	4605196013047	Ящик балконный м-пластика 80см мраморный арт м3222	1	Неклассифицированные/default	3673575	М-Пластика Idea
3604297	4605196015140	Ящик балконный м-пластика idea пластиковый 40см белый арт.м3225	1	Неклассифицированные/default	3673575	М-Пластика Idea
2765658	4605196014716	Ящик балконный м-пластика idea пластиковый 60см коричневый арт.м3226	1	Неклассифицированные/default	3673575	М-Пластика Idea
3604302	4605196013009	Ящик балконный м-пластика idea пластиковый с поддоном цвет мраморный 400мм	1	Неклассифицированные/default	3673575	М-Пластика Idea
3604298	4605196012996	Ящик балконный м-пластика idea пластиковый с поддоном цвет терракотовый 400мм	1	Неклассифицированные/default	3673575	М-Пластика Idea
3604304	4605196015133	Ящик балконный м-пластика idea ротанг с поддоном коричневый 60cм	1	Неклассифицированные/default	3673575	М-Пластика Idea
