ID	UPCEAN	Name	CategoryID	CategoryName	BrandID	BrandName
3782616	4607069890274	Лещ подвяленый белгородрыба 200г	1661897	Продукты питания (folder)/Рыба и морепродукты (folder)/Рыба сушеная вяленая	3782596	БЕЛГОРОДРЫБА
2888095	4627093151844	Лещ подкопченный потрошеный	1	Неклассифицированные/default	0	
3394585	4640005251449	Лещ рыба-хит сушеный неразделанный средний 100г	115797	Продукты питания (folder)/Рыба и морепродукты (folder)/Рыба	0	
2888092	4612753193524	Лещ рыбный двор обжаренный в томатном соусе жб 230г	1	Неклассифицированные/default	0	
2888096	4814900001076	Лещ с овощн.гарн.в т.с. 240г	1	Неклассифицированные/default	0	
2888097	4640014700662	Лещ с/г непотр. охл 800+, Россия	1	Неклассифицированные/default	0	
2888098	4640014700679	Лещ с/г непотр. охл до 1кг, Россия	1	Неклассифицированные/default	0	
2888099	4607018023722	Лещ с/с тм вяленки вак уп 240г	1	Неклассифицированные/default	3798143	ВЯЛЕНКИ
2888100	4630001580759	Лещ сибирский н/р холодного копчения	1	Неклассифицированные/default	0	
2888101	4630001580742	Лещ сибирский пласт холодного копчения	1	Неклассифицированные/default	0	
3394588	4640013200347	Лещ сойма обжаренный в томатном соусе жб 230г	115797	Продукты питания (folder)/Рыба и морепродукты (folder)/Рыба	0	
2888102	4602009046285	Лещ солено-сушеный (в)(каспий):10	1	Неклассифицированные/default	0	
157896	4606471297015	Лещ солено-сушеный 250г (каспий):10	115797	Продукты питания (folder)/Рыба и морепродукты (folder)/Рыба	0	
3394566	4603720590231	Лещ солено-сушеный snack beer 180г мяг/уп	115797	Продукты питания (folder)/Рыба и морепродукты (folder)/Рыба	0	
2888104	4607018023128	Лещ солено-сушеный вак уп тм вяленки 160г	1	Неклассифицированные/default	3798143	ВЯЛЕНКИ
2888103	4607018023098	Лещ солено-сушеный вак уп тм вяленки, 160г	1	Неклассифицированные/default	3798143	ВЯЛЕНКИ
1819758	4607018023753	Лещ солено-сушеный вяленки 130г	37056	Продукты питания (folder)/Снэки рыбные и мясные	3798143	ВЯЛЕНКИ
1819759	4607018023746	Лещ солено-сушеный вяленки 160г м/у	37056	Продукты питания (folder)/Снэки рыбные и мясные	3798143	ВЯЛЕНКИ
3394571	4607018023470	Лещ солено-сушеный вяленки соломка 30г м/у	115797	Продукты питания (folder)/Рыба и морепродукты (folder)/Рыба	3798143	ВЯЛЕНКИ
753694	4607029201690	Лещ солено-сушеный вялеха тушка с икрой 80г	37056	Продукты питания (folder)/Снэки рыбные и мясные	725005	Вялеха
3394578	4680003840290	Лещ солено-сушеный джентри вак уп 160г	115797	Продукты питания (folder)/Рыба и морепродукты (folder)/Рыба	0	
2452747	4607029200488	Лещ солено-сушеный Знатный Улов 140г мяг/уп	37056	Продукты питания (folder)/Снэки рыбные и мясные	48100	Знатный Улов
1248783	4607029200174	Лещ солено-сушеный Знатный Улов 180г мяг/уп	37056	Продукты питания (folder)/Снэки рыбные и мясные	48100	Знатный Улов
2452743	4607029200181	Лещ солено-сушеный Знатный Улов 200г м/уп	37056	Продукты питания (folder)/Снэки рыбные и мясные	48100	Знатный Улов
78544	4607029200204	Лещ солено-сушеный Знатный Улов 240г мяг/уп	37056	Продукты питания (folder)/Снэки рыбные и мясные	48100	Знатный Улов
3394580	4607029200310	Лещ солено-сушеный Знатный Улов 280г мяг/уп	115797	Продукты питания (folder)/Рыба и морепродукты (folder)/Рыба	48100	Знатный Улов
78549	4607029200730	Лещ солено-сушеный Знатный Улов соломка вак уп 50г	37056	Продукты питания (folder)/Снэки рыбные и мясные	48100	Знатный Улов
3394581	4607014511407	Лещ солено-сушеный наша рыбка 300г м/у	115797	Продукты питания (folder)/Рыба и морепродукты (folder)/Рыба	0	
3394584	4640005251463	Лещ солено-сушеный рыба-хит 120г м/уп	115797	Продукты питания (folder)/Рыба и морепродукты (folder)/Рыба	0	
1819757	4607014517126	Лещ солено-сушеный рыбацкое дело 120г	37056	Продукты питания (folder)/Снэки рыбные и мясные	0	
1819760	4607014517133	Лещ солено-сушеный рыбацкое дело 160г	37056	Продукты питания (folder)/Снэки рыбные и мясные	0	
1819762	4607014517140	Лещ солено-сушеный рыбацкое дело 240г	37056	Продукты питания (folder)/Снэки рыбные и мясные	3742800	RYBATSKOE DELO
1819763	4607014517157	Лещ солено-сушеный рыбацкое дело 240г #2	37056	Продукты питания (folder)/Снэки рыбные и мясные	0	
1819764	4607014517164	Лещ солено-сушеный рыбацкое дело 280г	37056	Продукты питания (folder)/Снэки рыбные и мясные	0	
1819765	4607014517171	Лещ солено-сушеный рыбацкое дело 320г	37056	Продукты питания (folder)/Снэки рыбные и мясные	0	
1819766	4607014517195	Лещ солено-сушеный рыбацкое дело 400г	37056	Продукты питания (folder)/Снэки рыбные и мясные	0	
1819761	4607058193812	Лещ солено-сушеный саша и алеша 160г	37056	Продукты питания (folder)/Снэки рыбные и мясные	0	
3394589	4670003631059	Лещ солено-сушеный тд чайка 140г	115797	Продукты питания (folder)/Рыба и морепродукты (folder)/Рыба	0	
2888106	4607047213675	Лещ средний неразделанный горячего копчения	1	Неклассифицированные/default	0	
2243686	4680003840306	Лещ сушеный джентри 240г	37056	Продукты питания (folder)/Снэки рыбные и мясные	836427	Джентри
753698	4607019902552	Лещ т/с 240г кл.,фрегат,48,арт.14037,балтфишплюс	48	Продукты питания (folder)/Рыба и морепродукты (folder)/Консервы рыбные	63635	Фрегат
2888107	4607019902880	Лещ т/с 350г, т.боцман ,36,арт.13965,балтфишплюс	1	Неклассифицированные/default	0	
78552	4607019900169	Лещ толстый боцман обжар в томатном соусе 230г новгород	48	Продукты питания (folder)/Рыба и морепродукты (folder)/Консервы рыбные	40367	Толстый Боцман
78551	4607019902064	Лещ толстый боцман обжаренный в томатном соусе жб 230г	48	Продукты питания (folder)/Рыба и морепродукты (folder)/Консервы рыбные	40367	Толстый Боцман
2888108	4607014510356	Лещ тушка 100г вак./упак. xxl	1	Неклассифицированные/default	0	
2888109	4607029202659	Лещ тушка с икрой с/с 80г	1	Неклассифицированные/default	0	
78553	4607026020188	Лещ филе н/к вак уп 500г ленрыбопродукт	3609100	Продукты питания (folder)/Рыба и морепродукты (folder)/Рыба замороженная	50606	Ленрыбопродукт
2888110	4607148873914	Лещ филе. вяленая пищевая рыбная продукция. вак уп 500г	330591	Продукты питания (folder)/Продукты питания	0	
2888111	4607136333666	Лещ х/к непотр. средний а 3.5кг	1	Неклассифицированные/default	0	
2888112	4631111144978	Лещ х/к рыбный дом	1	Неклассифицированные/default	0	
2888113	4630001469146	Лещ х/к, ., уп 5кг	1	Неклассифицированные/default	0	
1966255	4612736420289	Лещ хозяин морей натуральный с добавлением масла 230г ж\б	1	Неклассифицированные/default	2271203	Хозяин морей
2888114	4604209200337	Лещ холодного копчения	1	Неклассифицированные/default	0	
2888046	4607014106771	Лещ хххl вак./упак. 140г	1	Неклассифицированные/default	0	
3394590	4665297320086	Лещ хэппи фиш соломка к пиву вак уп 40г	115797	Продукты питания (folder)/Рыба и морепродукты (folder)/Рыба	0	
753695	4612604500198	Лещ чайка вяленый отборный 1 сорт вак уп 300г	37056	Продукты питания (folder)/Снэки рыбные и мясные	692397	Вяльково
2452756	4601365029802	Лещенко лев диск1 - (rmg)	1	Неклассифицированные/default	0	
4845535	4607041020309	Лещина бальзам-гель для ног антиварикозный 75мл	241824	Лекарственные средства (folder)/Аптека	0	
485868	4607041020699	Лещина форте гель-бальзам для отекших и усталых ног 7 нот здоровья, 75мл	1	Неклассифицированные/default	3606685	7 НОТ ЗДОРОВЬЯ
4845536	4607011661068	Лещина форте №40 табл	241824	Лекарственные средства (folder)/Аптека	0	
3394592	4603260001594	Лещь вяленый аморе 150г мяг/уп	115797	Продукты питания (folder)/Рыба и морепродукты (folder)/Рыба	0	
2766094	8594739221567	Лея 3мг+ 0.02мг №84 таб	1	Неклассифицированные/default	0	
4845537	3582910090793	Лея 3мг+ 0.02мг №84 таб #2	2416725	Лекарственные средства (folder)/Женские (противозачат.,гормоны, раст.)	0	
4845538	3582910090809	Лея 3мг+0.02мг №28 таб #2	2416725	Лекарственные средства (folder)/Женские (противозачат.,гормоны, раст.)	0	
2766088	8594739221543	Лея табл покр пленочной обол 3мг +0.02мг х28	1	Неклассифицированные/default	0	
2888115	4627093531738	Лж-019 usond лежанка с бортом №13 малая с вырезом (бязь) 32x52 x15	337596	Товары для животных (folder)/Pets	550653	Usond
2888116	4627093531752	Лж-021 usond лежанка с бортом №15 большая с вырезом (бязь)	337596	Товары для животных (folder)/Pets	550653	Usond
2888117	4627093531691	Лж-022 usond дом для кошек мягкий (Китай крыша) 35x35 x39	337596	Товары для животных (folder)/Pets	550653	Usond
2888118	4627093531806	Лж-038 usond эстрада №1 малая (бязь) 38x33 x29	337596	Товары для животных (folder)/Pets	550653	Usond
2888119	4627093531813	Лж-039 usond эстрада №2 средняя (бязь) 45x37 x31	337596	Товары для животных (folder)/Pets	550653	Usond
2888120	4627093531820	Лж-040 usond эстрада №3 большая (бязь) 52x40 x36	337596	Товары для животных (folder)/Pets	550653	Usond
2888121	4627093531837	Лж-070 usond дом для кошек цирк (бязь) 35x43	337596	Товары для животных (folder)/Pets	550653	Usond
2888122	4627093531844	Лж-071 usond дом для кошек шалаш №1 малый (бязь) 39x47 x36	337596	Товары для животных (folder)/Pets	550653	Usond
2888123	4627093531851	Лж-072 usond дом для кошек шалаш №2 средний (бязь) 44x53 x45	337596	Товары для животных (folder)/Pets	550653	Usond
2888124	4627093531868	Лж-073 usond дом для кошек юрта №1 малая (бязь) 38x38 x40	337596	Товары для животных (folder)/Pets	550653	Usond
2888125	4627093531875	Лж-074 usond дом для кошек юрта №2 средняя (бязь) 44x44 x48	337596	Товары для животных (folder)/Pets	550653	Usond
2888126	4627093531899	Лж-076 usond дом для кошек вигвам №1 (бязь) 39x45 x43	337596	Товары для животных (folder)/Pets	550653	Usond
2888127	4627093531905	Лж-077 usond дом для кошек вигвам №2 (бязь) 45x51 x47	337596	Товары для животных (folder)/Pets	550653	Usond
2888128	4627093531912	Лж-078 usond дом для кошек вигвам №3 (бязь) 54x63 x56	337596	Товары для животных (folder)/Pets	550653	Usond
485869	6937200120075	Ли да капс 350мг №30	1	Неклассифицированные/default	0	
266894	6937200120105	Ли да чай 2г №25	241824	Лекарственные средства (folder)/Аптека	0	
288419	8901114127206	Ли-бутол табл 400мг 10шт упаковки безъячейковые контурные (10) пачки картон	210391	Лекарственные средства (folder)/Лекарственные средства	0	
4845539	4680013243920	Лиаква форте для рта и горла аэрозоль 125мл	210391	Лекарственные средства (folder)/Лекарственные средства	0	
3394593	4680259279110	Лиана La decor 2.4м искусственная	1	Неклассифицированные/default	0	
3394594	4680259232276	Лиана La decor 2м искусственная	1	Неклассифицированные/default	0	
3394595	4680259279134	Лиана La decor искуссвенная 2.5м полиэстер пластик	1	Неклассифицированные/default	0	
3394596	4680259279141	Лиана La decor искуссвенная 2.5м полиэстер пластик #2	1	Неклассифицированные/default	0	
3394597	4680259279172	Лиана La decor с цветами искуссвенная 2.4м полиэстер пластик	1	Неклассифицированные/default	0	
3394598	4680259187569	Лиана La decor с цветами искусственная 1.7м пластик	1	Неклассифицированные/default	0	
3394599	4680259279165	Лиана La decor цветочная 2м искусственная	1	Неклассифицированные/default	0	
3847700	4607165520525	Лиана арка угловая 250x125 x 35см	2228248	Растениеводство/Садовые предметы интерьера	0	
4845540	4601003030252	Лиана большая 10г гранулы гомеопат	241824	Лекарственные средства (folder)/Аптека	0	
2768525	1950076001298	Лиарсин нарушение обмена веществ 100мл (хелвет)	309086	Товары для животных (folder)/Ветеринарные препараты (folder)/Ветеринарные препараты	0	
753699	1950076001335	Лиарсин табл 0.1 №50-гомеопатический препарат для лечения нарушения обмена веществ,заболеваня печени,поджел. железы 012	337596	Товары для животных (folder)/Pets	1762243	Helvet
485870	4820082560027	Лиастен пор. для ин. 2мг фл. №5	210391	Лекарственные средства (folder)/Лекарственные средства	0	
1678255	4601729080210	Лиатрис колосковая фламинго (многолетник) 0.1г цв/п 10/ (а) Россия	324395	Растениеводство/Семена	448645	Аэлита
3847701	4750571003196	Либава лещ в желейной заливке ключ 180г	48	Продукты питания (folder)/Рыба и морепродукты (folder)/Консервы рыбные	720768	Либава
3847702	4750571003462	Либава налим в желейн.заливке ключ 180г	48	Продукты питания (folder)/Рыба и морепродукты (folder)/Консервы рыбные	720768	Либава
2243689	4750571003219	Либава плотва в желейной заливке жб ключ 180г	48	Продукты питания (folder)/Рыба и морепродукты (folder)/Консервы рыбные	720768	Либава
2243690	4750571002441	Либава плотва в томатном соусе жб ключ 180г	48	Продукты питания (folder)/Рыба и морепродукты (folder)/Консервы рыбные	720768	Либава
2243694	4750571003714	Либава семга филе кусок с овощами в томатном соусе жб ключ 180г	48	Продукты питания (folder)/Рыба и морепродукты (folder)/Консервы рыбные	720768	Либава
2243695	4750571000775	Либава скумбрия атлантическая натуральная с добавлением масла жб 240г	48	Продукты питания (folder)/Рыба и морепродукты (folder)/Консервы рыбные	720768	Либава
3847703	4750571007989	Либава сом мраморный в желейн.зал.180г	48	Продукты питания (folder)/Рыба и морепродукты (folder)/Консервы рыбные	720768	Либава
2243696	4750571005350	Либава стерлядь в желейной заливке жб ключ 180г	48	Продукты питания (folder)/Рыба и морепродукты (folder)/Консервы рыбные	720768	Либава
2243697	4750571001277	Либава филе трески в масле жб ключ 180г	48	Продукты питания (folder)/Рыба и морепродукты (folder)/Консервы рыбные	720768	Либава
2243698	4750571001260	Либава филе трески в томатном соусе жб ключ 180г	48	Продукты питания (folder)/Рыба и морепродукты (folder)/Консервы рыбные	720768	Либава
2243699	4750571001178	Либава фрикадельки в томатном соусе жб ключ 240г	48	Продукты питания (folder)/Рыба и морепродукты (folder)/Консервы рыбные	720768	Либава
1775637	4750571003547	Либава щука в томатном соусе ключ 180г	48	Продукты питания (folder)/Рыба и морепродукты (folder)/Консервы рыбные	720768	Либава
5028480	59970866	Либексин 100мг №20 табл	362333	Лекарственные средства (folder)/Противокашлевые (бронхолитики, секретолитики...)	0	
5028481	61031814	Либексин 100мг №20 табл (хиноин завод фармацевтических и химических продуктов ЗАО)	362333	Лекарственные средства (folder)/Противокашлевые (бронхолитики, секретолитики...)	0	
485871	3582910005841	Либексин муко 5% 125мл фл для взрослых (санофи-авенсис)	362333	Лекарственные средства (folder)/Противокашлевые (бронхолитики, секретолитики...)	0	
317681	3582910005834	Либексин муко сироп 100 мг| 5мл 125мл №1, санофи-винтроп индустрия	210391	Лекарственные средства (folder)/Лекарственные средства	0	
2452758	3582910069324	Либексин муко сироп детск 125мл (100мг/5мл) х1	2418078	Лекарственные средства (folder)/Отхаркивающие, противокашлевые	0	
2243708	3582910038573	Либексин муко сироп для взр. 125мл (250мг/5мл) х1 #2	210391	Лекарственные средства (folder)/Лекарственные средства	0	
2243709	3582910069331	Либексин муко сироп для взрослых 50мг/мл 125мл (санофи-авентис франс)	210391	Лекарственные средства (folder)/Лекарственные средства	0	
2452757	3582910038566	Либексин муко, сироп для детей 20мг/мл 125мл (юнитер ликвид мануфэкчуринг)	2418078	Лекарственные средства (folder)/Отхаркивающие, противокашлевые	0	
317680	5997086103181	Либексин №20 табл (хиноин завод фарм. и хим продуктов ЗАО)	1	Неклассифицированные/default	0	
4845541	4823002225013	Либерум 0.0075 №20 табл	241824	Лекарственные средства (folder)/Аптека	0	
4845542	4823002223187	Либерум 0.01/мл 1.5мл №5 амп в/м	241824	Лекарственные средства (folder)/Аптека	0	
4845543	4823002224979	Либерум 0.015 №20 табл	241824	Лекарственные средства (folder)/Аптека	0	
753700	4620752990068	Либидомин 5мл контрацептив без лицензия /1 Россия	210391	Лекарственные средства (folder)/Лекарственные средства	0	
3847705	4607016670157	Либра горшок лотос для цветов 250мл	3608246	Растениеводство/Кашпо,горшки и держатели	3847704	ЛИБРА
5028483	9785990979338	Либри пэр бамбини толстой л.н. библиотечка школьника. кавказский пленник 82x100/32 64лист	1	Неклассифицированные/default	5028482	Либри пэр бамбини
5028485	4650059080551	Либрофарм под ред вышковского г.л. доктор акушерство и гинекология рлс 2012 вып 16 мяг	4892913	Полиграфия (folder)/Книги по теме Медицина	5028484	Либрофарм
5028486	4650059080575	Либрофарм под ред вышковского г.л. доктор гастроэнтерология и гепатология рлс 2012/2013 вып 16 мяг	4892913	Полиграфия (folder)/Книги по теме Медицина	5028484	Либрофарм
5028487	4650059080469	Либрофарм под ред вышковского г.л. доктор кардиология рлс 2012 вып 16 мяг	4892913	Полиграфия (folder)/Книги по теме Медицина	5028484	Либрофарм
5028488	4650059080568	Либрофарм под ред вышковского г.л. доктор неврология и психиатрия рлс 2012 вып 16 мяг	4892913	Полиграфия (folder)/Книги по теме Медицина	5028484	Либрофарм
5028489	4650059080544	Либрофарм под ред вышковского г.л. доктор онкология и гематология рлс 2012 вып 16 мяг	4892913	Полиграфия (folder)/Книги по теме Медицина	5028484	Либрофарм
5028490	4650059080513	Либрофарм под ред вышковского г.л. доктор оториноларингология и пульмонология 2012 вып 16 мяг	4892913	Полиграфия (folder)/Книги по теме Медицина	5028484	Либрофарм
5028491	4650059080506	Либрофарм под ред вышковского г.л. доктор педиатрия рлс 2012 вып 16 мяг	4892913	Полиграфия (folder)/Книги по теме Медицина	5028484	Либрофарм
5028492	4650059080582	Либрофарм под ред вышковского г.л. доктор ревматология рлс 2012/2013 вып 16 мяг	4892913	Полиграфия (folder)/Книги по теме Медицина	5028484	Либрофарм
5028493	4650059080483	Либрофарм под ред вышковского г.л. доктор эндокринология рлс 2012 вып 16 мяг	4892913	Полиграфия (folder)/Книги по теме Медицина	5028484	Либрофарм
