ID	UPCEAN	Name	CategoryID	CategoryName	BrandID	BrandName
4213893	634479257223	Cd mister marek majestic mountain	4093300	Медиа (folder)/Media	0	
4213894	619981122320	Cd mistress quickly onus	4093300	Медиа (folder)/Media	0	
4213895	634479657023	Cd misty mysterious	4093300	Медиа (folder)/Media	0	
4213896	619981072526	Cd misty river live at the backgate stage	4093300	Медиа (folder)/Media	0	
4213897	619981039420	Cd misty river rising	4093300	Медиа (folder)/Media	0	
4213898	660662519724	Cd misuniverse all's well that ends	4093300	Медиа (folder)/Media	0	
4213899	650687122023	Cd misure Love chronicles	4093300	Медиа (folder)/Media	0	
4213900	776127175128	Cd mitch dorge as trees walking	4093300	Медиа (folder)/Media	0	
4213901	634479205828	Cd mitch elrod and the hick engine ears gone fictioncouched in the wordling series	4093300	Медиа (folder)/Media	0	
4213902	659696054127	Cd mitch felton i don't know why:	4093300	Медиа (folder)/Media	0	
4213903	625989127922	Cd mitch frasier dreamer or a fool	4093300	Медиа (folder)/Media	0	
4213904	725518210092	Cd mitch Hansen band endless Day	4093300	Медиа (folder)/Media	0	
4213905	824363006321	Cd mitch hedberg do you believe in Gosh?	4093300	Медиа (folder)/Media	0	
4213906	824363002521	Cd mitch hedberg strategic grill locations	4093300	Медиа (folder)/Media	0	
4213907	886972396927	Cd mitch miller 16 most requested songs	4093300	Медиа (folder)/Media	0	
4213908	617742051629	Cd mitch miller 50 all-american favorites	4093300	Медиа (folder)/Media	0	
4213909	090431680322	Cd mitch miller more sing-along with mitch/ still more! sing-along	4093300	Медиа (folder)/Media	0	
4213910	886972379128	Cd mitch miller sing along with mitch	4093300	Медиа (folder)/Media	0	
4213911	634479455124	Cd mitch reilly Da happnin' tone of the maximophone	4093300	Медиа (folder)/Media	0	
4213912	081227270025	Cd mitch ryder devil with a Blue dress on&other hits	4093300	Медиа (folder)/Media	0	
4213913	050087133788	Cd mitchel musso mitchel musso	4093300	Медиа (folder)/Media	0	
4213914	634479686122	Cd mitchell e. gibson releasement	4093300	Медиа (folder)/Media	0	
4213915	634479685620	Cd mitchell e. gibson remembering inner peace	4093300	Медиа (folder)/Media	0	
4213916	634479686221	Cd mitchell e. gibson the miracle prayer	4093300	Медиа (folder)/Media	0	
4213917	634479686023	Cd mitchell e. gibson words of Power healing	4093300	Медиа (folder)/Media	0	
4213918	634479684524	Cd mitchell e. gibson words of Power prosperity	4093300	Медиа (folder)/Media	0	
4213919	634479686320	Cd mitchell e. gibson&vernon barksdale the fourth domain:divine awareness meditation exercise volume One	4093300	Медиа (folder)/Media	0	
4213920	731452710024	Cd mitchell eddy big band (casino de Paris	4093300	Медиа (folder)/Media	0	
4213921	731452191229	Cd mitchell eddy casino de Paris	4093300	Медиа (folder)/Media	0	
4213922	731452709929	Cd mitchell eddy country Rock (olympia 94)	4093300	Медиа (folder)/Media	0	
4213923	731455717228	Cd mitchell eddy eddy rocker	4093300	Медиа (folder)/Media	0	
4213924	731452309327	Cd mitchell eddy en etranger dans le texte	4093300	Медиа (folder)/Media	0	
4213925	731455788822	Cd mitchell eddy et s'il n'en reste qu'un	4093300	Медиа (folder)/Media	0	
4213926	731455799620	Cd mitchell eddy La derniere seance	4093300	Медиа (folder)/Media	0	
4213927	731455717020	Cd mitchell eddy lover-rocker	4093300	Медиа (folder)/Media	0	
4213928	731452189721	Cd mitchell eddy olympia 69	4093300	Медиа (folder)/Media	0	
4213929	731452189820	Cd mitchell eddy olympia 75	4093300	Медиа (folder)/Media	0	
4213930	731452190024	Cd mitchell eddy olympia 80	4093300	Медиа (folder)/Media	0	
4213931	731452189929	Cd mitchell eddy palais des sports 77	4093300	Медиа (folder)/Media	0	
4213932	731452190321	Cd mitchell eddy palais des sports 84	4093300	Медиа (folder)/Media	0	
4213933	731452374127	Cd mitchell eddy retrouvons nos heros (berc	4093300	Медиа (folder)/Media	0	
4213934	731452374226	Cd mitchell eddy retrouvons nos heros (berc #2	4093300	Медиа (folder)/Media	0	
4213935	731452717122	Cd mitchell eddy tout eddy best of	4093300	Медиа (folder)/Media	0	
4213936	731452710123	Cd mitchell eddy zenith 94	4093300	Медиа (folder)/Media	0	
4213937	751937220428	Cd mitchell howard someday	4093300	Медиа (folder)/Media	0	
4213938	720642417225	Cd mitchell joni chalk mark in a rainstorm	4093300	Медиа (folder)/Media	0	
4213939	720642201923	Cd mitchell joni Wild things run fast	4093300	Медиа (folder)/Media	0	
4213940	061528100122	Cd mitchell Kim akimbo alogo	4093300	Медиа (folder)/Media	0	
4213941	061528102720	Cd mitchell Kim greatest hits	4093300	Медиа (folder)/Media	0	
4213942	061528101723	Cd mitchell Kim i am a Wild party (live)	4093300	Медиа (folder)/Media	0	
4213943	061528102423	Cd mitchell Kim itch	4093300	Медиа (folder)/Media	0	
4213944	061528101020	Cd mitchell Kim rockland	4093300	Медиа (folder)/Media	0	
4213945	061528100429	Cd mitchell Kim shakin' like a human being	4093300	Медиа (folder)/Media	0	
4213946	074644609622	Cd mitchell, guy 16 most requested songs	4093300	Медиа (folder)/Media	0	
4213947	093624360025	Cd mitchell, joni big Yellow taxi (from friends)	4093300	Медиа (folder)/Media	0	
4213948	075992719926	Cd mitchell, joni Blue	4093300	Медиа (folder)/Media	0	
4213949	093624762027	Cd mitchell, joni both sides now	4093300	Медиа (folder)/Media	0	
4213950	093624764021	Cd mitchell, joni both sides now (LTD ed.)	4093300	Медиа (folder)/Media	0	
4213951	075992744621	Cd mitchell, joni clouds	4093300	Медиа (folder)/Media	0	
4213952	075596059329	Cd mitchell, joni court and spark	4093300	Медиа (folder)/Media	0	
4213953	075596058728	Cd mitchell, joni don juan's reckless	4093300	Медиа (folder)/Media	0	
4213954	075596062428	Cd mitchell, joni for the roses	4093300	Медиа (folder)/Media	0	
4213955	075596061421	Cd mitchell, joni hejira	4093300	Медиа (folder)/Media	0	
4213956	075596060622	Cd mitchell, joni hissing of summer lawns	4093300	Медиа (folder)/Media	0	
4213957	093624632627	Cd mitchell, joni hits	4093300	Медиа (folder)/Media	0	
4213958	075992744126	Cd mitchell, joni joni mitchell	4093300	Медиа (folder)/Media	0	
4213959	075992745024	Cd mitchell, joni ladies of the canyon	4093300	Медиа (folder)/Media	0	
4213960	075596053921	Cd mitchell, joni miles of aisles	4093300	Медиа (folder)/Media	0	
4213961	075596055727	Cd mitchell, joni mingus	4093300	Медиа (folder)/Media	0	
4213962	093624635826	Cd mitchell, joni misses	4093300	Медиа (folder)/Media	0	
4213963	075596059022	Cd mitchell, joni shadows and Light	4093300	Медиа (folder)/Media	0	
4213964	093624578628	Cd mitchell, joni turbulent indigo	4093300	Медиа (folder)/Media	0	
4213965	093624532521	Cd mitchell, waddie buckaroo poet	4093300	Медиа (folder)/Media	0	
4213966	075992693424	Cd mitchell, waddie lone driftin' rider	4093300	Медиа (folder)/Media	0	
4213967	634479224225	Cd mitchell/mcrae in times like these (smooth classics)	4093300	Медиа (folder)/Media	0	
4213968	783707202525	Cd mitchelle tanner dawn of the Night flyers	4093300	Медиа (folder)/Media	0	
4213969	852819003754	Cd mitchy slick Yellow tape	4093300	Медиа (folder)/Media	0	
4213970	074646275924	Cd mitropolous, dmitri berg wozzak. mitropolous	4093300	Медиа (folder)/Media	0	
4213971	074646426326	Cd mitropolous, dmitri mozart don giovanni. sap, corena, grummer, simoneau, della	4093300	Медиа (folder)/Media	0	
4213972	078635789928	Cd mitropolous, dmitri Vanessa (barber)	4093300	Медиа (folder)/Media	0	
4213973	731452638021	Cd mitropoulos dimitris 24 zeibekika	4093300	Медиа (folder)/Media	0	
4213974	028947586623	Cd mitsuko uchida beethoven piano sonatas nos. 28&29	4093300	Медиа (folder)/Media	0	
4213975	028947582601	Cd mitsuko uchida schumann carnaval	4093300	Медиа (folder)/Media	0	
4213976	810270010285	Cd mixed currency staring lavalle	4093300	Медиа (folder)/Media	0	
4213977	714255100827	Cd mixed messages patch of Sunshine	4093300	Медиа (folder)/Media	0	
4213978	634479578021	Cd mixed signals don't say no	4093300	Медиа (folder)/Media	0	
4213979	821681005128	Cd mixmaster pep mixmaster pep phase 3	4093300	Медиа (folder)/Media	0	
4213980	634479255823	Cd mj bishop hometown address	4093300	Медиа (folder)/Media	0	
4213981	765481732726	Cd mj12 big stars	4093300	Медиа (folder)/Media	0	
4213982	639126049725	Cd mj12 pink mj12	1	Неклассифицированные/default	0	
4213983	634479088728	Cd mj12 the Secret Life of ester steven's	4093300	Медиа (folder)/Media	0	
4213984	601215310528	Cd mjg no more glory	4093300	Медиа (folder)/Media	0	
4213985	829757299723	Cd mjstk clear	4093300	Медиа (folder)/Media	0	
4213986	783707652122	Cd mlum innocent boys	4093300	Медиа (folder)/Media	0	
4213987	783707516820	Cd mnemonic device	4093300	Медиа (folder)/Media	0	
4213988	634479158926	Cd mno mno sleeps...marimba sessions	4093300	Медиа (folder)/Media	0	
4213989	724384761325	Cd mo b. d. gangsta harmony	4093300	Медиа (folder)/Media	0	
4213990	783707790923	Cd mo rebo get a grip	4093300	Медиа (folder)/Media	0	
4213991	074649118921	Cd mo thugs Family reunion	4093300	Медиа (folder)/Media	0	
4213992	749794243926	Cd mo&alex midnight cactus	4093300	Медиа (folder)/Media	0	
4214114	743214413821	Cd mo'funk weird	4093300	Медиа (folder)/Media	0	
4214522	702987012921	Cd mo'rockin sands of time	4093300	Медиа (folder)/Media	0	
4213993	075678353024	Cd moa, anika thinking room	4093300	Медиа (folder)/Media	0	
4213994	184150000421	Cd mob figaz animal Planet	4093300	Медиа (folder)/Media	0	
4213995	884860013727	Cd mob rules radical peace	4093300	Медиа (folder)/Media	0	
4213996	829757236421	Cd mob4 mob4	4093300	Медиа (folder)/Media	0	
4213997	074649131227	Cd mobb deep hell on Earth	4093300	Медиа (folder)/Media	0	
4213998	696998588929	Cd mobb deep infamy	4093300	Медиа (folder)/Media	0	
4213999	074649127022	Cd mobb deep murda muzik	4093300	Медиа (folder)/Media	0	
4214000	078636648026	Cd mobb deep the infamous	4093300	Медиа (folder)/Media	0	
4214001	634479313929	Cd mobboss outcold 1.8.7	4093300	Медиа (folder)/Media	0	
4214002	634479294327	Cd mobeats.com illbanginfuturisticlycrunk beats v1.0	4093300	Медиа (folder)/Media	0	
4214003	724352453924	Cd mobley, hank no room for squares	4093300	Медиа (folder)/Media	0	
4214004	724354003028	Cd mobley, hank roll call	4093300	Медиа (folder)/Media	0	
4214005	724349534322	Cd mobley, hank soul station	4093300	Медиа (folder)/Media	0	
4214006	724352454020	Cd mobley, hank the turnaround	4093300	Медиа (folder)/Media	0	
4214007	724354053122	Cd mobley, hank thinking of Home	4093300	Медиа (folder)/Media	0	
4214008	077778408024	Cd mobley, hank workout	4093300	Медиа (folder)/Media	0	
4214009	634479228629	Cd mobquest:	4093300	Медиа (folder)/Media	0	
4214010	634479131226	Cd mobstile records underground vol.1 screwed&chopped	4093300	Медиа (folder)/Media	0	
4214011	094637506509	Cd moby / amaral escapar (slipping away)	4093300	Медиа (folder)/Media	0	
4214012	094638359005	Cd moby / myl?ne farmer slipping away (crier La vie)	4093300	Медиа (folder)/Media	0	
4214013	094637607503	Cd moby / myl?ne farmer slipping away (crier La vie) #2	4093300	Медиа (folder)/Media	0	
4214014	5016025612024	Cd moby 18	4093300	Медиа (folder)/Media	0	
4214015	638812712721	Cd moby 18 #2	4093300	Медиа (folder)/Media	0	
4214016	638812717320	Cd moby 18 b sides (+DVD)	4093300	Медиа (folder)/Media	0	
4214017	720841025320	Cd moby ambient	4093300	Медиа (folder)/Media	0	
4214018	075596203128	Cd moby animal rights	4093300	Медиа (folder)/Media	0	
4214019	724347242328	Cd moby bring back my happiness	4093300	Медиа (folder)/Media	0	
4214020	720841052326	Cd moby daft electro	4093300	Медиа (folder)/Media	0	
4214021	075596183826	Cd moby disk	4093300	Медиа (folder)/Media	0	
4214022	090771119025	Cd moby grape	4093300	Медиа (folder)/Media	0	
4214023	075596209427	Cd moby i like to score	4093300	Медиа (folder)/Media	0	
3632573	5099921625220	Cd moby last Night	4093300	Медиа (folder)/Media	0	
4214024	724596938324	Cd moby last Night #2	4093300	Медиа (folder)/Media	0	
4214025	724596940020	Cd moby last Night remixed	4093300	Медиа (folder)/Media	0	
4214026	094634321723	Cd moby moby	4093300	Медиа (folder)/Media	0	
4214027	720841241027	Cd moby moby (1992) (audio CD)	4093300	Медиа (folder)/Media	0	
4214028	075596255424	Cd moby moby songs 1993-1998	4093300	Медиа (folder)/Media	0	
4214029	5016025601585	Cd moby move	4093300	Медиа (folder)/Media	0	
4214030	075596156820	Cd moby move ep	4093300	Медиа (folder)/Media	0	
4214031	5016025611720	Cd moby Play	4093300	Медиа (folder)/Media	0	
4214032	638812704924	Cd moby Play #2	4093300	Медиа (folder)/Media	0	
4214033	878037010428	Cd moby Play/ Play the b sides	4093300	Медиа (folder)/Media	0	
4214034	094635348125	Cd moby slipping away	4093300	Медиа (folder)/Media	0	
4214035	638812767424	Cd moby southside	4093300	Медиа (folder)/Media	0	
4214036	075596209229	Cd moby the end of everything	4093300	Медиа (folder)/Media	0	
4214037	5018766711127	Cd moby the story so far	4093300	Медиа (folder)/Media	0	
4214038	724596941621	Cd moby wait for me	4093300	Медиа (folder)/Media	0	
4214039	724596942727	Cd moby wait for me [de luxe edition] [CD/ DVD]	4093300	Медиа (folder)/Media	0	
4214040	783707849522	Cd mocean 8 mocean 8 ep	4093300	Медиа (folder)/Media	0	
4214041	660200204822	Cd mocean worker aural&hearty	4093300	Медиа (folder)/Media	0	
4214042	660200201128	Cd mocean worker mixed emotional features	4093300	Медиа (folder)/Media	0	
4214043	783707847221	Cd mock turtle soup of both worlds	4093300	Медиа (folder)/Media	0	
4214044	623667202640	Cd mocking shadows caught in the act	4093300	Медиа (folder)/Media	0	
4214045	623667204699	Cd mocking shadows Long way	4093300	Медиа (folder)/Media	0	
4214046	783707780528	Cd mockingblue for now	4093300	Медиа (folder)/Media	0	
4214047	707541053990	Cd mod amish no use for Sunshine	4093300	Медиа (folder)/Media	0	
4214048	618403007221	Cd model rockets tell the kids the cops are here	4093300	Медиа (folder)/Media	0	
4214049	880319409523	Cd moderat moderat [bonus tracks]	4093300	Медиа (folder)/Media	0	
4214050	829757254920	Cd Modern culture boxing	4093300	Медиа (folder)/Media	0	
4214051	791022196429	Cd Modern groove syndicate Modern groove syndicate	4093300	Медиа (folder)/Media	0	
4214052	783707361222	Cd Modern hicks tornado alley	4093300	Медиа (folder)/Media	0	
4214053	075678253829	Cd Modern jazz quartet anniversary celebration	4093300	Медиа (folder)/Media	0	
4214054	075678139321	Cd Modern jazz quartet blues on bach	4093300	Медиа (folder)/Media	0	
4214055	075678197628	Cd Modern jazz quartet complete last concert (2 CD)	4093300	Медиа (folder)/Media	0	
4214056	075678276323	Cd Modern jazz quartet dedicated to connie	4093300	Медиа (folder)/Media	0	
4214057	075678132926	Cd Modern jazz quartet fontessa	4093300	Медиа (folder)/Media	0	
4214058	075679066527	Cd Modern jazz quartet lonely woman	4093300	Медиа (folder)/Media	0	
4214059	075678133121	Cd Modern jazz quartet Modern jazz...	4093300	Медиа (folder)/Media	0	
4214060	075678134029	Cd Modern jazz quartet pyramid	4093300	Медиа (folder)/Media	0	
4214061	731455983425	Cd Modern jazz quartet the Modern jazz sextet	4093300	Медиа (folder)/Media	0	
4214062	075678176128	Cd Modern jazz quartet three windows	4093300	Медиа (folder)/Media	0	
4214063	075678133527	Cd Modern jazz quartet with sonny rollins	4093300	Медиа (folder)/Media	0	
4214064	731455982725	Cd Modern jazz society presents a concert of cont	4093300	Медиа (folder)/Media	0	
4214065	786851993721	Cd Modern man Modern maturity	4093300	Медиа (folder)/Media	0	
4214066	634479824128	Cd Modern primitives music for the Modern primitive	4093300	Медиа (folder)/Media	0	
4214067	079892650921	Cd Modern Rock	4093300	Медиа (folder)/Media	0	
4214068	634479137020	Cd Modern sleeping positions&practices for better living	4093300	Медиа (folder)/Media	0	
3632574	743217878429	Cd Modern talking collection	4093300	Медиа (folder)/Media	0	
4214069	743219414625	Cd Modern talking the Golden years 1985-87	4093300	Медиа (folder)/Media	0	
4214070	828765081429	Cd Modern talking tv makes the superstar	4093300	Медиа (folder)/Media	0	
4214071	743219250025	Cd Modern talking Victory	4093300	Медиа (folder)/Media	0	
4214072	765481741421	Cd Modern tribe groove on	4093300	Медиа (folder)/Media	0	
4214073	885189302325	Cd moderndog	4093300	Медиа (folder)/Media	0	
4214074	8857122666025	Cd moderndog ting nong noy	4093300	Медиа (folder)/Media	0	
4214075	608917231724	Cd moderntimes_1800 Johann gottlieb graun concertos for strings	4093300	Медиа (folder)/Media	0	
4214076	827969208922	Cd modest mouse baron von bullshit rides again	4093300	Медиа (folder)/Media	0	
4214077	696998712522	Cd modest mouse Good news for people who Love bad news	4093300	Медиа (folder)/Media	0	
4214078	796818004421	Cd modest mouse lonesome crowded West	4093300	Медиа (folder)/Media	0	
4214079	886974628927	Cd modest mouse no One???s first and you???re next	4093300	Медиа (folder)/Media	0	
4214080	744861033028	Cd modest mouse the lonesome crowded West	4093300	Медиа (folder)/Media	0	
4214081	074646387122	Cd modest mouse the moon and antartica	4093300	Медиа (folder)/Media	0	
4214082	828768613924	Cd modest mouse we were dead before the ship even sank	4093300	Медиа (folder)/Media	0	
4214083	886970729222	Cd modest mouse we were dead before the ship even sank [de luxe edition]	4093300	Медиа (folder)/Media	0	
4214084	807297454512	Cd modeste a mountain of convenience	4093300	Медиа (folder)/Media	0	
4214085	731458706021	Cd modjo chillin' revisited	4093300	Медиа (folder)/Media	0	
4214086	731458905226	Cd modjo modjo	4093300	Медиа (folder)/Media	0	
4214087	623235210626	Cd mods, the twenty 2 months	4093300	Медиа (folder)/Media	0	
4214088	803571970129	Cd modus dei legend of rome	4093300	Медиа (folder)/Media	0	
4214089	775020488328	Cd modwheelmood ?	4093300	Медиа (folder)/Media	0	
4214090	715187725928	Cd moe bandy greatest hits [curb]	4093300	Медиа (folder)/Media	0	
4214091	793018209625	Cd moe bandy honky tonk amnesia the hard country sound of moe bandy	4093300	Медиа (folder)/Media	0	
4214092	074646915721	Cd moe tin cans&car tires	4093300	Медиа (folder)/Media	0	
4214093	801655061527	Cd moe! all the way live!	4093300	Медиа (folder)/Media	0	
4214094	809819402124	Cd moe! staiano's moe!kestra! two forms of multitudes conducted improvisations	4093300	Медиа (folder)/Media	0	
4214095	650869664525	Cd moe. conch	4093300	Медиа (folder)/Media	0	
4214096	650869663429	Cd moe. dither	4093300	Медиа (folder)/Media	0	
4214097	650869663221	Cd moe. fatboy	4093300	Медиа (folder)/Media	0	
4214098	650869663122	Cd moe. headseed	4093300	Медиа (folder)/Media	0	
4214099	650869663320	Cd moe. l	4093300	Медиа (folder)/Media	0	
4214100	074646774427	Cd moe. no doy	4093300	Медиа (folder)/Media	0	
4214101	650869664921	Cd moe. sticks and stones	4093300	Медиа (folder)/Media	0	
4214102	650869663528	Cd moe. warts&all vol. 1	4093300	Медиа (folder)/Media	0	
4214103	650869663726	Cd moe. warts&all vol. 2	4093300	Медиа (folder)/Media	0	
4214104	650869663924	Cd moe. warts&all vol. 3	4093300	Медиа (folder)/Media	0	
4214105	620638012628	Cd moffatt katy midnight radio	4093300	Медиа (folder)/Media	0	
4214106	731452737427	Cd moffatts the it's a wonderful world	4093300	Медиа (folder)/Media	0	
4214107	731452737328	Cd moffatts the the moffatts	4093300	Медиа (folder)/Media	0	
4214108	724349793903	Cd moffatts, the chapter 1 a New beginning	4093300	Медиа (folder)/Media	0	
4214109	724352856923	Cd moffatts, the submodalities	4093300	Медиа (folder)/Media	0	
4214110	089408334320	Cd moffett cody evidence	4093300	Медиа (folder)/Media	0	
4214111	078635783124	Cd moffo, Anna canteloube songs of the auvergne	4093300	Медиа (folder)/Media	0	
4214112	078635664621	Cd moffo, Anna luisa miller (verdi)	4093300	Медиа (folder)/Media	0	
4214113	078635414523	Cd moffo, Anna madama Butterfly (puccini)	4093300	Медиа (folder)/Media	0	
4214115	807297133622	Cd moguai punx up the volume	4093300	Медиа (folder)/Media	0	
4214116	020286100126	Cd mogwai come on die young	4093300	Медиа (folder)/Media	0	
4214117	744861083221	Cd mogwai Hawk is howling	4093300	Медиа (folder)/Media	0	
4214118	020286118220	Cd mogwai kicking a dead pig mogwai songs remixed + fear satan remixes	4093300	Медиа (folder)/Media	0	
4214119	744861049029	Cd mogwai Rock Action	4093300	Медиа (folder)/Media	0	
4214120	020286117025	Cd mogwai young Team [bonus tracks]	4093300	Медиа (folder)/Media	0	
4214121	622202001625	Cd mohamed mounir embareh ... kan omri eshreen	4093300	Медиа (folder)/Media	0	
4214122	618685010629	Cd mohammad Al hasan abo abid master of egyptian bellydance	4093300	Медиа (folder)/Media	0	
4214123	634479559624	Cd moir fortepiano Duo duets of clementi&mozart	4093300	Медиа (folder)/Media	0	
4214124	620067234523	Cd moira Nelson after the fall	4093300	Медиа (folder)/Media	0	
4214125	634479754623	Cd moira Nelson time calls my name	4093300	Медиа (folder)/Media	0	
4214126	641444985821	Cd moira smiley rua	4093300	Медиа (folder)/Media	0	
4214127	724384160029	Cd moise, teri teri moise	4093300	Медиа (folder)/Media	0	
4214128	724384677725	Cd moise, teri teri moise 2	4093300	Медиа (folder)/Media	0	
4214129	724383618828	Cd moist creature	4093300	Медиа (folder)/Media	0	
4214130	724353454227	Cd moist machine punch through the singles	4093300	Медиа (folder)/Media	0	
4214131	724353690328	Cd moist machine punch through the singles (LTD)	4093300	Медиа (folder)/Media	0	
4214132	724349629523	Cd moist mercedes five and dime	4093300	Медиа (folder)/Media	0	
4214133	724382960829	Cd moist Silver	4093300	Медиа (folder)/Media	0	
4214134	639842598323	Cd mojado/abracadabra encuentro romantico	4093300	Медиа (folder)/Media	0	
4214135	802114135728	Cd mojo Filter mojo Filter	4093300	Медиа (folder)/Media	0	
4214136	090771103222	Cd mojo men, the sit down...it's the mojo men	4093300	Медиа (folder)/Media	0	
4214137	090771102829	Cd mojo men, the whys ain't supposed to be	4093300	Медиа (folder)/Media	0	
4214138	625989324024	Cd mojo perry closer to the far away	4093300	Медиа (folder)/Media	0	
4214139	824767128827	Cd mojo rib mojo rib	4093300	Медиа (folder)/Media	0	
4214140	821507200126	Cd mojo stu Good gravy	4093300	Медиа (folder)/Media	0	
4214141	669910900727	Cd mojo&the boogieman keep it in your soul	4093300	Медиа (folder)/Media	0	
4214142	680215323820	Cd mojoe Classic.ghetto.soul.	4093300	Медиа (folder)/Media	0	
4214143	664980016125	Cd mojogoon Good clean livin'	4093300	Медиа (folder)/Media	0	
4214144	634479635427	Cd mojuice the nocc Life	4093300	Медиа (folder)/Media	0	
4214145	665907665327	Cd moke moke	4093300	Медиа (folder)/Media	0	
4214146	634479735721	Cd molding trilogy	4093300	Медиа (folder)/Media	0	
4214147	731452801326	Cd molina anicetcaluz roja de mis 14 exitos de oro	4093300	Медиа (folder)/Media	0	
4214148	634479242823	Cd mollie baxter hating Baby	4093300	Медиа (folder)/Media	0	
4214149	829757408323	Cd mollie magee the Star carol	4093300	Медиа (folder)/Media	0	
4214150	829757301921	Cd mollie weaver and mack bailey wish you were here	4093300	Медиа (folder)/Media	0	
4214151	075678297229	Cd mollies revenge every dirty word	4093300	Медиа (folder)/Media	0	
4214152	783707781129	Cd molly andrews Blue morning glory	4093300	Медиа (folder)/Media	0	
4214153	641444926626	Cd molly bryant take it Easy	4093300	Медиа (folder)/Media	0	
4214154	634479581823	Cd molly cheshire treat her right	4093300	Медиа (folder)/Media	0	
4214155	074643657228	Cd molly hatchet beatin' the odds	4093300	Медиа (folder)/Media	0	
4214156	074644013726	Cd molly hatchet double trouble live	4093300	Медиа (folder)/Media	0	
4214157	696998718029	Cd molly hatchet Essential molly hatchet	4093300	Медиа (folder)/Media	0	
4214158	074643611022	Cd molly hatchet flirtin' with disaster	4093300	Медиа (folder)/Media	0	
4214159	696998538528	Cd molly hatchet flirtin' with disaster (remastered)	4093300	Медиа (folder)/Media	0	
4214160	074644694925	Cd molly hatchet greatest hits	4093300	Медиа (folder)/Media	0	
4214161	696998538429	Cd molly hatchet greatest hits (remastered)	4093300	Медиа (folder)/Media	0	
4214162	074643534727	Cd molly hatchet molly hatchet	4093300	Медиа (folder)/Media	0	
4214163	074643842921	Cd molly hatchet no guts, no glory	4093300	Медиа (folder)/Media	0	
4214164	074646527122	Cd molly hatchet Super hits	4093300	Медиа (folder)/Media	0	
4214165	074643748025	Cd molly hatchet take no prisoners	4093300	Медиа (folder)/Media	0	
4214166	074643962124	Cd molly hatchet the deed is done	4093300	Медиа (folder)/Media	0	
4214167	789577092426	Cd molly maher ghosts of my town	4093300	Медиа (folder)/Media	0	
4214168	783707346120	Cd molly pitcher watching the rain	4093300	Медиа (folder)/Media	0	
4214170	666449329722	Cd molly's revenge live at the espresso Garden	4093300	Медиа (folder)/Media	0	
4214171	776127165228	Cd molly's revenge revenge is sweet	4093300	Медиа (folder)/Media	0	
