ID	UPCEAN	Name	CategoryID	CategoryName	BrandID	BrandName
652610	3606485010649	Sm клавиша для модуля 2кн.вык рис вв/вн,1/0,антр mtn625714	1	Неклассифицированные/default	593284	Schneider Electric WDSYSTEMS
652611	3606485013893	Sm клавиша для модуля 2кн.вык с стр-к вв/вн,алюмин mtn625860	1	Неклассифицированные/default	593284	Schneider Electric WDSYSTEMS
652613	3606485099606	Sm клавиша для модуля 2кн.вык, вв/вн,1/0, ак.бел mtn619625	1	Неклассифицированные/default	593284	Schneider Electric WDSYSTEMS
652614	3606485099620	Sm клавиша для модуля 2кн.вык, вв/вн,1/0, ак.бел mtn619725	1	Неклассифицированные/default	593284	Schneider Electric WDSYSTEMS
652616	3606485099590	Sm клавиша для модуля 2кн.вык, вв/вн,1/0, п.бел mtn619619	1	Неклассифицированные/default	593284	Schneider Electric WDSYSTEMS
652617	3606485099613	Sm клавиша для модуля 2кн.вык, вв/вн,1/0, п.бел mtn619719	1	Неклассифицированные/default	593284	Schneider Electric WDSYSTEMS
652618	3606485099583	Sm клавиша для модуля 2кн.вык, вв/вн,1/0,ак.бел mtn619525	1	Неклассифицированные/default	593284	Schneider Electric WDSYSTEMS
652619	3606485099576	Sm клавиша для модуля 2кн.вык, вв/вн,1/0,п.бел mtn619519	1	Неклассифицированные/default	593284	Schneider Electric WDSYSTEMS
652620	3606485010977	Sm клавиша для модуля 2кн.вык, рис вв/вн, алюмин mtn626860	1	Неклассифицированные/default	593284	Schneider Electric WDSYSTEMS
652621	3606485014036	Sm клавиша для модуля 2кн.вык, рис вв/вн, беж mtn626844	1	Неклассифицированные/default	593284	Schneider Electric WDSYSTEMS
652622	3606485010960	Sm клавиша для модуля 2кн.вык, рис вв/вн, сталь mtn626846	1	Неклассифицированные/default	593284	Schneider Electric WDSYSTEMS
652623	3606485010724	Sm клавиша для модуля 2кн.вык, рис вв/вн,1/0,алю mtn625760	1	Неклассифицированные/default	593284	Schneider Electric WDSYSTEMS
652624	3606485013862	Sm клавиша для модуля 2кн.вык, рис вв/вн,1/0,ант mtn625814	1	Неклассифицированные/default	593284	Schneider Electric WDSYSTEMS
652625	3606485014111	Sm клавиша для модуля 2кн.вык, рис вв/вн,пол.бел mtn626819	1	Неклассифицированные/default	593284	Schneider Electric WDSYSTEMS
652577	3606485010526	Sm модуль для выключатель кнопочный 1 пост mtn625199	297628	Техника (folder)/Электротехника (folder)/Электрооборудование	593284	Schneider Electric WDSYSTEMS
652578	3606485010571	Sm модуль для выключатель кнопочный 2 поста mtn625299	297628	Техника (folder)/Электротехника (folder)/Электрооборудование	593284	Schneider Electric WDSYSTEMS
652579	3606485099330	Sm мул-й 4 кн выкл с терм., акт.бел mtn616725	1	Неклассифицированные/default	593284	Schneider Electric WDSYSTEMS
652580	3606485099361	Sm мул-й 4 кн выкл с терм., алюмин mtn616860	1	Неклассифицированные/default	593284	Schneider Electric WDSYSTEMS
652581	3606485099354	Sm мул-й 4 кн выкл с терм., антрацит mtn616814	1	Неклассифицированные/default	593284	Schneider Electric WDSYSTEMS
652582	3606485099323	Sm мул-й 4 кн выкл с терм., пол.бел mtn616719	1	Неклассифицированные/default	593284	Schneider Electric WDSYSTEMS
652583	3606480351709	Sm терморегулятор с 4-кн. интерфейсом mtn616744	686230	Техника (folder)/Электротехника (folder)/Электронные компоненты	593284	Schneider Electric WDSYSTEMS
652628	3606485016917	Sm этикетки для 1-, 2-или 4-кн.выкл,бел mtn618319	545503	Канцелярские товары (folder)/Этикетки, этикет лента	593284	Schneider Electric WDSYSTEMS
652629	3606485016924	Sm этикетки для 1-, 2-или 4-кн.выкл,сер mtn618320	545503	Канцелярские товары (folder)/Этикетки, этикет лента	593284	Schneider Electric WDSYSTEMS
652630	3606485016931	Sm этикетки для мн-х выключатель кнопочный с ик-прм, бел mtn618419	297628	Техника (folder)/Электротехника (folder)/Электрооборудование	593284	Schneider Electric WDSYSTEMS
652631	3606485016948	Sm этикетки для мн-х выключатель кнопочный с ик-прм,сере mtn618420	297628	Техника (folder)/Электротехника (folder)/Электрооборудование	593284	Schneider Electric WDSYSTEMS
1134156	038949122200	Sm&cov b/st w/ltr	1	Неклассифицированные/default	0	
1134157	038949122309	Sm&cov b/st w/trv	1	Неклассифицированные/default	0	
1134158	038949122408	Sm&cov crm cnt/pln	1	Неклассифицированные/default	0	
1134159	038949122507	Sm&cov sc cr/st/pt	1	Неклассифицированные/default	0	
1134160	038949122606	Sm&cov soap/dsh st	1	Неклассифицированные/default	0	
1942560	8901595873456	Sm&jon tamarind	1	Неклассифицированные/default	0	
652564	3606480210693	Sm, выключатель 2-кнопочн Plus с терморегулят, беж mtn6212-0344	297628	Техника (folder)/Электротехника (folder)/Электрооборудование	593284	Schneider Electric WDSYSTEMS
652565	3606480210761	Sm, выключатель 4-кнопочн Plus с терморегулят, беж mtn6214-0344	297628	Техника (folder)/Электротехника (folder)/Электрооборудование	593284	Schneider Electric WDSYSTEMS
652584	3606480210624	Sm, терморегулятор с дисплеем, беж mtn6241-0344	686230	Техника (folder)/Электротехника (folder)/Электронные компоненты	593284	Schneider Electric WDSYSTEMS
652585	3606480210648	Sm, терморегулятор с дисплеем, пол. бел mtn6241-0419	686230	Техника (folder)/Электротехника (folder)/Электронные компоненты	593284	Schneider Electric WDSYSTEMS
3208149	815712014623	Sm,all Garden salad	330591	Продукты питания (folder)/Продукты питания	0	
652626	3606480210556	Sm,терморегулятор без органов управл, беж mtn6221-0344	686230	Техника (folder)/Электротехника (folder)/Электронные компоненты	593284	Schneider Electric WDSYSTEMS
652627	3606480210570	Sm,терморегулятор без органов управл, пол. бел mtn6221-0419	686230	Техника (folder)/Электротехника (folder)/Электронные компоненты	593284	Schneider Electric WDSYSTEMS
4675458	6906598000009	Sm-1 vincent van gogh - a Field of Yellow flowers	1	Неклассифицированные/default	0	
1125380	790664200136	Sm-1100 scoot mole 32oz-qt-repellent	1	Неклассифицированные/default	0	
1608310	790664200143	Sm-1110 scoot mole refill 1/2gal bottle	1	Неклассифицированные/default	0	
1608312	790664200150	Sm-1120 gallon scoot mole evacuator	1	Неклассифицированные/default	0	
1608313	029069110925	Sm-2 no snowmobiles violtrs prosctd sign	1	Неклассифицированные/default	0	
4675459	6906598000108	Sm-2 vincent van gogh - a Field of Yellow flowers	1	Неклассифицированные/default	0	
1133440	93369367	Sm-33 Gel 10g	1	Неклассифицированные/default	0	
1133441	93369374	Sm-33 Liquid 10ml	1	Неклассифицированные/default	0	
4951842	698054220606	Sm-6 6-lb splitting maul	1	Неклассифицированные/default	4881764	SEYMOUR
4675461	073950359719	Sm-601 flex massage showerhead	1	Неклассифицированные/default	0	
4951843	698054220828	Sm-8sg 8-lb splitting maul w/sg grip	1	Неклассифицированные/default	4881764	SEYMOUR
4678432	076158241411	Sm-med designer collar 1ct	1	Неклассифицированные/default	0	
4678433	076158245846	Sm-med designer lead 1ct	1	Неклассифицированные/default	0	
4675418	049392100127	Sm. / 50g wind up chattering teeth	1	Неклассифицированные/default	0	
4675419	723764117608	Sm. 12oz fossil seasonal purse	1	Неклассифицированные/default	0	
4675420	055421012255	Sm. chicken caesar 8.8oz	1	Неклассифицированные/default	0	
1134161	082365772594	Sm. christmas fuse 3mmx10mm	1	Неклассифицированные/default	0	
4675421	098553010287	Sm. coe/40' rfr. sea cont. chaquita	1	Неклассифицированные/default	0	
4675422	099233105231	Sm. deli drop in arrang 1ct	1	Неклассифицированные/default	0	
4675423	048051120032	Sm. display case (2020)	1	Неклассифицированные/default	0	
4675424	098354130405	Sm. feeder	1	Неклассифицированные/default	0	
4675425	099233105712	Sm. growers choice bq 1ct	1	Неклассифицированные/default	0	
4675426	646444827737	Sm. hd leather pouch w/steel d-ring swivel - sm phones	1	Неклассифицированные/default	0	
4675427	833823003350	Sm. oval carry all	1	Неклассифицированные/default	0	
4675428	4950344701407	Sm. pulley set	1	Неклассифицированные/default	0	
4675429	081492303008	Sm. soap saver 303 1ct	1	Неклассифицированные/default	0	
4675430	081492303015	Sm. soap saver 303 1ct #2	1	Неклассифицированные/default	0	
4675431	074175053963	Sm. square Box simply Soft facial tissue by stater bros.	1	Неклассифицированные/default	0	
4675432	077071019101	Sm. summer shade trees	1	Неклассифицированные/default	0	
4675433	099233100328	Sm. thanks. arrangement 1ct	1	Неклассифицированные/default	0	
4675434	086786251126	Sm. tree trunk witch 1ct	1	Неклассифицированные/default	0	
4675435	086786025116	Sm. tree trunk witch 1ct 6ct	1	Неклассифицированные/default	0	
4675436	011111140936	Sm.b/lf planter pp499 1ct	1	Неклассифицированные/default	0	
416926	079946008371	Sm.bristol pad 11x14	331156	Товары для творчества (folder)/Живопись и рисования (folder)/Товары для художников	0	
416927	079946049954	Sm.bristol pad 14x17	331156	Товары для творчества (folder)/Живопись и рисования (folder)/Товары для художников	0	
4675437	011111140813	Sm.ceram.plantr pp499 1ct	1	Неклассифицированные/default	0	
3751847	4607180523228	Sm.child туфли дет.dc-o-050-015 р30-35	3614960	Одежда и обувь (folder)/Обувь (folder)/Обувь домашняя	0	
3751848	4607180523235	Sm.child туфли дет.dc-o-050-019 р30-35	3614960	Одежда и обувь (folder)/Обувь (folder)/Обувь домашняя	0	
4675438	011111004009	Sm.hsehld.angle broom 1ct	1	Неклассифицированные/default	0	
3751849	4670026757385	Sm.milady галоши эва жен 088-002у р36-41	3618301	Одежда и обувь (folder)/Обувь (folder)/Галоши	0	
3751850	4607180524522	Sm.milady пант.эва пл.жен 098-801 р35-41	3607980	Одежда и обувь (folder)/Обувь (folder)/Обувь для бассейна	0	
3751852	4607180522818	Sm.milady сапожки дет.дев.191-001 р28-35	3612913	Одежда и обувь (folder)/Обувь (folder)/Сапоги резиновые	0	
3751853	4670026755329	Sm.milady туф.жен кома-70 в22-500 р36-41	3614960	Одежда и обувь (folder)/Обувь (folder)/Обувь домашняя	0	
3751854	4607146626000	Sm.milady туфли ком.дет.а-70f-001-1 р30-35	3614960	Одежда и обувь (folder)/Обувь (folder)/Обувь домашняя	0	
3751856	4607146626314	Sm.milady туфли комн.для мал.а-70f-001 р30-35	3614960	Одежда и обувь (folder)/Обувь (folder)/Обувь домашняя	0	
3751857	4607180526847	Sm.mister пант.эва пл.муж 097-801 р39-45	3607980	Одежда и обувь (folder)/Обувь (folder)/Обувь для бассейна	0	
3751858	4670026755497	Sm.mister сапож.дет.мал191-001-02 р28-35	3612913	Одежда и обувь (folder)/Обувь (folder)/Сапоги резиновые	0	
3751859	4607180529923	Sm.mister туф.для к.sm107-111/108-031 р36-45	3607980	Одежда и обувь (folder)/Обувь (folder)/Обувь для бассейна	0	
3751860	4670026755312	Sm.mister туф.муж ком.а-89-100 р40-45	3614960	Одежда и обувь (folder)/Обувь (folder)/Обувь домашняя	0	
3751862	4607180528537	Sm.mister туфли муж комн.а-89-001 р40-45	3614960	Одежда и обувь (folder)/Обувь (folder)/Обувь домашняя	0	
3751863	4690667026329	Sm.of m.пантол.dw-o-3-10 жен дом.р.36-40	3614960	Одежда и обувь (folder)/Обувь (folder)/Обувь домашняя	0	
4675439	011111140905	Sm.r/lf planter pp499 1ct	1	Неклассифицированные/default	0	
3751865	4660005281703	Sm.way раств.смен для ловушки ос/шершн/мух	309084	Растениеводство (folder)/Средства защиты растений	3751864	SMART WAY
3751871	4620009896211	Sm.печ.конф.пес.с/слив.вк.сг.мол ван 240g	40119	Продукты питания (folder)/Хлебо-булочные изделия	0	
4675440	843466086467	Sm/md Black raider hat flex fit	1	Неклассифицированные/default	0	
4675441	843466086443	Sm/md Black up front hat flex fit	1	Неклассифицированные/default	0	
1982447	883124086323	Sm/md naughty maid costume from coquette intl	363351	Adult/Sex-Shop	0	
4675442	742702293570	Sm/md/LG set lifestyle decor candle holders	1	Неклассифицированные/default	0	
4675443	733804123933	Sm/med aw cargo flp bp [backpack]	1	Неклассифицированные/default	0	
4675444	834389068739	Sm/med/large walnut basket with handles beige basket coverlet sold by michaels	1	Неклассифицированные/default	0	
416929	6009678812223	Sm/Spice Black pepprcrn grinder 50g	30882	Продукты питания (folder)/Приправы и специи	416928	SM/SPICE
416930	6009678812216	Sm/Spice sea salt glas grindr 90g	30882	Продукты питания (folder)/Приправы и специи	416928	SM/SPICE
4675445	070450911218	Sm/sunsweet dried Fruit energycenter	1	Неклассифицированные/default	0	
652632	7894993001068	Sm200.0007.03 блюдо круглое глубокое 285mm аттитюд прозрачн.	1	Неклассифицированные/default	0	
652634	7894993145205	Sm200.0127.00 кружка 350ml гурме прозрачн.	1	Неклассифицированные/default	0	
652635	7894993021462	Sm200.0214.00 стакан низкий Бриз прозрачн.	1	Неклассифицированные/default	0	
652636	7894993025767	Sm200.0257.00. стакан высокий 300ml конус прозрачн.	1	Неклассифицированные/default	0	
652639	7894993957501	Sm200.2007.03 блюдо круглое глубокое д=285mm янтарь	1	Неклассифицированные/default	0	
652641	7894993961904	Sm200.6114.00 чашка чайная 246ml с блюдцем аттитюд синий	1	Неклассифицированные/default	0	
4675460	688955306790	Sm2830679	1	Неклассифицированные/default	0	
4675446	090086602915	Sm:4inch blming plnts/select var 1ct	1	Неклассифицированные/default	0	
4675447	728217666689	Sm:5-6 / md:7-8 / LG:9-10 esny toddler girl's White bunny slippers	1	Неклассифицированные/default	0	
4675448	048519620029	Sm:corn hsk pmpk asst w/dsplay 1ct	1	Неклассифицированные/default	0	
4675449	048519093069	Sm:corn hsk pmpk asst w/dsplay 1ct 28ct	1	Неклассифицированные/default	0	
4675450	470306639028	Sm:f:arrng Rose/carn bud vase 1ct	1	Неклассифицированные/default	0	
4675451	470306625779	Sm:theme balloon kit 1ct	1	Неклассифицированные/default	0	
4675452	470306604804	Sm:vases blu/grn stubby 1ct	1	Неклассифицированные/default	0	
4675453	470306604811	Sm:vases grn/blu pattern 1ct	1	Неклассифицированные/default	0	
4675454	470306604828	Sm:vases grn/blu w/hole 1ct	1	Неклассифицированные/default	0	
4675455	7044248880102	Sm??godt	1	Неклассифицированные/default	0	
4675456	7310865005250	Sm??r normalsaltat arla 250g	1	Неклассифицированные/default	0	
4675457	7310770764457	Sm??rg??sgurka mor annas ??nos 590g	1	Неклассифицированные/default	0	
4675462	097987939737	Sma	1	Неклассифицированные/default	0	
2384211	9556159100807	Sma 1.2kg pib s26	1	Неклассифицированные/default	0	
2384212	9556159100784	Sma 600g pib s26	1	Неклассифицированные/default	0	
1134165	066063043002	Sma cnc 12x 385ml	1	Неклассифицированные/default	0	
1134167	066063028801	Sma concentrate 12x 385ml	1	Неклассифицированные/default	0	
1134166	066063023004	Sma concentrate with iron 12x 385ml	1	Неклассифицированные/default	0	
1134168	571058903273	Sma coupon	1	Неклассифицированные/default	0	
2681636	7613034562586	Sma ex hungry rtf Liquid 200ml	337649	Уход за детьми (folder)/Уход за детьми	416931	SMA
2681637	7613034562593	Sma ex hungry rtf Liquid 200ml #2	337649	Уход за детьми (folder)/Уход за детьми	416931	SMA
416934	50478750	Sma Extra hungry infant Milk ready to feed 250ml	337649	Уход за детьми (folder)/Уход за детьми	416931	SMA
2681638	7613034642028	Sma Extra hungry Milk Powder 400g	337649	Уход за детьми (folder)/Уход за детьми	416931	SMA
2681639	7613034642035	Sma Extra hungry Milk Powder 400g #2	337649	Уход за детьми (folder)/Уход за детьми	416931	SMA
2681640	7613034675996	Sma Extra hungry Milk Powder 900g	337649	Уход за детьми (folder)/Уход за детьми	416931	SMA
2681641	7613034676009	Sma Extra hungry Milk Powder 900g #2	337649	Уход за детьми (folder)/Уход за детьми	416931	SMA
416935	5010981003278	Sma Extra hungry ready to feed 1l	337649	Уход за детьми (folder)/Уход за детьми	416931	SMA
416938	5010981003148	Sma first infant Milk 900g	337649	Уход за детьми (folder)/Уход за детьми	416931	SMA
416939	50478682	Sma first infant Milk ready to feed 250ml	337649	Уход за детьми (folder)/Уход за детьми	416931	SMA
416936	5010981003124	Sma first infant Milk ready to feed 4x 500ml	337649	Уход за детьми (folder)/Уход за детьми	416931	SMA
1608314	50478798	Sma first infant ready to use	1	Неклассифицированные/default	0	
2681642	7613034562562	Sma first infant rtf Liquid 200ml	337649	Уход за детьми (folder)/Уход за детьми	416931	SMA
2681643	7613034562579	Sma first infant rtf Liquid 200ml #2	337649	Уход за детьми (folder)/Уход за детьми	416931	SMA
2681644	7613034675231	Sma first Milk Powder 900g	337649	Уход за детьми (folder)/Уход за детьми	416931	SMA
2681645	7613034675941	Sma first Milk Powder 900g #2	337649	Уход за детьми (folder)/Уход за детьми	416931	SMA
2681646	7613034642332	Sma first Powder Milk 400g	337649	Уход за детьми (folder)/Уход за детьми	416931	SMA
2681647	7613034642646	Sma first Powder Milk 400g #2	337649	Уход за детьми (folder)/Уход за детьми	416931	SMA
1608315	50478781	Sma follow on ex hungry ready	458	Гигиена (folder)/Подгузники	0	
416940	5010981003360	Sma follow on Milk 1l	337649	Уход за детьми (folder)/Уход за детьми	416931	SMA
2681648	7613034642745	Sma follow on Milk Powder 400g	337649	Уход за детьми (folder)/Уход за детьми	416931	SMA
2681649	7613034642752	Sma follow on Milk Powder 400g #2	337649	Уход за детьми (folder)/Уход за детьми	416931	SMA
416941	5010981003155	Sma follow on Milk Powder 450g	337649	Уход за детьми (folder)/Уход за детьми	416931	SMA
416942	5010981003162	Sma follow on Milk Powder 900g	337649	Уход за детьми (folder)/Уход за детьми	416931	SMA
2681650	7613034675958	Sma follow on Milk Powder 900g #2	337649	Уход за детьми (folder)/Уход за детьми	416931	SMA
2681651	7613034675965	Sma follow on Milk Powder 900g #3	337649	Уход за детьми (folder)/Уход за детьми	416931	SMA
416943	50478699	Sma follow on Milk ready to feed 250ml	337649	Уход за детьми (folder)/Уход за детьми	416931	SMA
2681652	7613034562609	Sma follow on ready to feed Liquid 200ml	337649	Уход за детьми (folder)/Уход за детьми	416931	SMA
2681653	7613034562616	Sma follow on ready to feed Liquid 200ml #2	337649	Уход за детьми (folder)/Уход за детьми	416931	SMA
1608316	50478804	Sma follow on ready to use liq	1	Неклассифицированные/default	0	
1134169	571058902030	Sma form coupon 1.00	1	Неклассифицированные/default	0	
1134171	5010981751414	Sma Gold cap rtf 1l	1	Неклассифицированные/default	416931	SMA
201608	5010981911054	Sma Gold first infant Milk (Yellow tin) 450g	1	Неклассифицированные/default	416931	SMA
201609	5010981001618	Sma Gold Powder sachets 18x 17g sachets	1	Неклассифицированные/default	416931	SMA
201610	50478439	Sma Gold ready/feed step 1 250ml	330591	Продукты питания (folder)/Продукты питания	0	
1134170	5010981911108	Sma Gold/ first Milk Powder 900g	1	Неклассифицированные/default	416931	SMA
416937	5010981003131	Sma Gold/first Milk Powder 450g	337649	Уход за детьми (folder)/Уход за детьми	416931	SMA
1134172	50478491	Sma high Energy ready to use 250ml	1	Неклассифицированные/default	0	
652645	5010981003223	Sma lf 430g	1	Неклассифицированные/default	416931	SMA
201611	5010981000710	Sma lf Baby Milk 430g	1	Неклассифицированные/default	416931	SMA
4675463	773736052055	Sma maya 7 v_upgrade-nsn	1	Неклассифицированные/default	0	
1134173	066063043101	Sma pd 6x 450g	1	Неклассифицированные/default	0	
1134175	571058904751	Sma pdr coupon $.75	1	Неклассифицированные/default	0	
1134176	066063028900	Sma Powder 450g	1	Неклассифицированные/default	0	
1134177	571058904072	Sma Powder coupon	1	Неклассифицированные/default	0	
1134174	066063023103	Sma Powder with iron 450g	1	Неклассифицированные/default	0	
2835384	7613035477742	Sma Pro 2 follow on Milk 6 months 800g	1	Неклассифицированные/default	0	
2835385	7613035477759	Sma Pro 2 follow on Milk 6 months 800g #2	1	Неклассифицированные/default	0	
201612	5010981767385	Sma progress infant Milk 6 months 2 years 900g	1	Неклассифицированные/default	416931	SMA
652646	300081126058	Sma progress kids	1	Неклассифицированные/default	0	
652647	300086899094	Sma progress kids 1-4	1	Неклассифицированные/default	0	
201614	50478477	Sma progress Milk 6-24months 250ml	330591	Продукты питания (folder)/Продукты питания	0	
652648	5010981767330	Sma progress Milk 6-24months 450g	1	Неклассифицированные/default	416931	SMA
201613	5010981001632	Sma progress Milk Powder Box 16x 28g = 448g	267828	Продукты питания (folder)/Молочные продукты (folder)/Молоко сухое	416931	SMA
1134178	066063029259	Sma ready to use 12x 385ml	1	Неклассифицированные/default	0	
1134179	066063029600	Sma ready to use with iron 12x 385ml	1	Неклассифицированные/default	0	
2201784	045663592721	Sma safety seat harness Black	337596	Товары для животных (folder)/Pets	0	
201615	5010981002073	Sma stay down infant Milk 900g	1	Неклассифицированные/default	416931	SMA
1134180	9315850673009	Sma step 1 0-6mth 900g	1	Неклассифицированные/default	0	
