ID	UPCEAN	Name	CategoryID	CategoryName	BrandID	BrandName
1805062	9785811202812	Айрис-пресс плакат алфавит.печатные и рукописные буквы мал нач.шк	507397	Полиграфия (folder)/Плакат	1831818	Айрис-пресс
1805063	9785811226818	Айрис-пресс плакат английская азбука	507397	Полиграфия (folder)/Плакат	1831818	Айрис-пресс
1805064	9785811205202	Айрис-пресс плакат английские неправильные глаголы нач.шк	507397	Полиграфия (folder)/Плакат	1831818	Айрис-пресс
1805065	9785811204717	Айрис-пресс плакат английские предлоги движения	507397	Полиграфия (folder)/Плакат	1831818	Айрис-пресс
1805066	9785811203833	Айрис-пресс плакат английские предлоги места	507397	Полиграфия (folder)/Плакат	1831818	Айрис-пресс
1805067	9785811240272	Айрис-пресс плакат английский язык.Food 2011	507397	Полиграфия (folder)/Плакат	1831818	Айрис-пресс
1805068	9785811240265	Айрис-пресс плакат английский язык.животные animals 2010	507397	Полиграфия (folder)/Плакат	1831818	Айрис-пресс
1805069	9785811238729	Айрис-пресс плакат английский язык.моя комната my room 2010	507397	Полиграфия (folder)/Плакат	1831818	Айрис-пресс
1805070	9785811214617	Айрис-пресс плакат виды сложного предложения и знаки препин.в нем	507397	Полиграфия (folder)/Плакат	1831818	Айрис-пресс
1805071	9785811211401	Айрис-пресс плакат вов.битва за берлин.16 апреля-8 мая 1945	507397	Полиграфия (folder)/Плакат	1831818	Айрис-пресс
1805072	9785811211418	Айрис-пресс плакат вов.битва за москву	507397	Полиграфия (folder)/Плакат	1831818	Айрис-пресс
1805073	9785811211579	Айрис-пресс плакат вов.курская битва	507397	Полиграфия (folder)/Плакат	1831818	Айрис-пресс
1805074	9785811211845	Айрис-пресс плакат вов.сталинградская битва	507397	Полиграфия (folder)/Плакат	1831818	Айрис-пресс
1805075	9785811238804	Айрис-пресс плакат города-герои 2010	507397	Полиграфия (folder)/Плакат	1831818	Айрис-пресс
1805076	9785811212903	Айрис-пресс плакат государственное устройство древней спарты	507397	Полиграфия (folder)/Плакат	1831818	Айрис-пресс
1805077	9785811214044	Айрис-пресс плакат движение декабристов	507397	Полиграфия (folder)/Плакат	1831818	Айрис-пресс
1805078	9785811209644	Айрис-пресс плакат живая и неживая природа	507397	Полиграфия (folder)/Плакат	1831818	Айрис-пресс
1805079	9785811212804	Айрис-пресс плакат жизненный цикл растений а1	507397	Полиграфия (folder)/Плакат	1831818	Айрис-пресс
1805080	9785811226917	Айрис-пресс плакат испанская азбука нач.шк.	507397	Полиграфия (folder)/Плакат	1831818	Айрис-пресс
1805081	9785811218660	Айрис-пресс плакат как вести себя при большом скоплении людей мал	507397	Полиграфия (folder)/Плакат	1831818	Айрис-пресс
1805082	9785811221578	Айрис-пресс плакат как питаются живые организмы	507397	Полиграфия (folder)/Плакат	1831818	Айрис-пресс
1805083	9785811226023	Айрис-пресс плакат конструирование и моделирование плечевых изделий 2007	507397	Полиграфия (folder)/Плакат	1831818	Айрис-пресс
1805084	9785811225972	Айрис-пресс плакат конструирование и моделирование рабочей одежды 2007	507397	Полиграфия (folder)/Плакат	1831818	Айрис-пресс
1805085	9785811233076	Айрис-пресс плакат лента букв нач.шк 2008	507397	Полиграфия (folder)/Плакат	1831818	Айрис-пресс
1805086	9785811213573	Айрис-пресс плакат лента цифр нач.шк	507397	Полиграфия (folder)/Плакат	1831818	Айрис-пресс
1180515	9785811205141	Айрис-пресс плакат математика.таблица классов и разрядов нач.шк	1	Неклассифицированные/default	1831818	Айрис-пресс
1805087	9785811223428	Айрис-пресс плакат меры величин	507397	Полиграфия (folder)/Плакат	1831818	Айрис-пресс
1805088	9785811238040	Айрис-пресс плакат ордена великой отечественной войны 2011	507397	Полиграфия (folder)/Плакат	1831818	Айрис-пресс
1805089	9785811217687	Айрис-пресс плакат основные действия при пожаре нач.шк	507397	Полиграфия (folder)/Плакат	1831818	Айрис-пресс
1805090	9785811218134	Айрис-пресс плакат основные правила пожарной безопасности нач.школ	507397	Полиграфия (folder)/Плакат	1831818	Айрис-пресс
1805091	9785811211623	Айрис-пресс плакат пищевые связи в экосистеме 2008	507397	Полиграфия (folder)/Плакат	1831818	Айрис-пресс
1805092	9785811210091	Айрис-пресс плакат правила безопасности для дошкольников	507397	Полиграфия (folder)/Плакат	1831818	Айрис-пресс
1805093	9785811244522	Айрис-пресс плакат правила гигиены для детей 2011	507397	Полиграфия (folder)/Плакат	1831818	Айрис-пресс
1805094	9785811234219	Айрис-пресс плакат правила поведения за столом	507397	Полиграфия (folder)/Плакат	1831818	Айрис-пресс
1805095	9785811221028	Айрис-пресс плакат правила поведения за столом мал	507397	Полиграфия (folder)/Плакат	1831818	Айрис-пресс
1805096	9785811210268	Айрис-пресс плакат правила поведения при пожаре для детей	507397	Полиграфия (folder)/Плакат	1831818	Айрис-пресс
1805097	9785811214228	Айрис-пресс плакат правила пожарной безопасности для дошкольника	507397	Полиграфия (folder)/Плакат	1831818	Айрис-пресс
1180516	9785811215508	Айрис-пресс плакат правильная осанка	1	Неклассифицированные/default	1831818	Айрис-пресс
1805098	9785811203895	Айрис-пресс плакат правильная посадка во время занятий мал нач.шк	507397	Полиграфия (folder)/Плакат	1831818	Айрис-пресс
1805099	9785811216963	Айрис-пресс плакат правописание наречий	507397	Полиграфия (folder)/Плакат	1831818	Айрис-пресс
1805100	9785811213108	Айрис-пресс плакат предписывающие и запрещающие дорожные знаки	507397	Полиграфия (folder)/Плакат	1831818	Айрис-пресс
1805101	9785811222698	Айрис-пресс плакат признаки глагола и наречия у деепричастия	507397	Полиграфия (folder)/Плакат	1831818	Айрис-пресс
1805102	9785811208999	Айрис-пресс плакат природные зоны россии рф.тундра	507397	Полиграфия (folder)/Плакат	1831818	Айрис-пресс
1805103	9785811225743	Айрис-пресс плакат прямоуг треугольник 8кл 2007	507397	Полиграфия (folder)/Плакат	1831818	Айрис-пресс
1805104	9785811224500	Айрис-пресс плакат разметка деталей из бумаги и картона нач.шк 2007	507397	Полиграфия (folder)/Плакат	1831818	Айрис-пресс
1805105	9785811227754	Айрис-пресс плакат разрезная Русская азбука 2007	507397	Полиграфия (folder)/Плакат	1831818	Айрис-пресс
1805106	9785811213870	Айрис-пресс плакат Русский язык.падежи а1	507397	Полиграфия (folder)/Плакат	1831818	Айрис-пресс
1805107	9785811244591	Айрис-пресс плакат Русский язык.разбор слова по составу нач.шк	507397	Полиграфия (folder)/Плакат	1831818	Айрис-пресс
1805108	9785811242009	Айрис-пресс плакат свойства арифметических действий.вычитание 2011	507397	Полиграфия (folder)/Плакат	1831818	Айрис-пресс
1805109	9785811241989	Айрис-пресс плакат свойства арифметических действий.сложение 2011	507397	Полиграфия (folder)/Плакат	1831818	Айрис-пресс
1805110	9785811211333	Айрис-пресс плакат свойства арифметических действий.умножение	507397	Полиграфия (folder)/Плакат	1831818	Айрис-пресс
1805111	9785811222179	Айрис-пресс плакат соединенное королевство Великобритания	507397	Полиграфия (folder)/Плакат	1831818	Айрис-пресс
1805112	9785811242054	Айрис-пресс плакат состав числа.от 1 до 10 нач.шк 2011	507397	Полиграфия (folder)/Плакат	1831818	Айрис-пресс
1805113	9785811240357	Айрис-пресс плакат строение солнечной системы	507397	Полиграфия (folder)/Плакат	1831818	Айрис-пресс
1805114	9785811238460	Айрис-пресс плакат строение тела человека.my Body нач.шк	507397	Полиграфия (folder)/Плакат	1831818	Айрис-пресс
1805115	9785811244751	Айрис-пресс плакат таблица простых чисел	507397	Полиграфия (folder)/Плакат	1831818	Айрис-пресс
1180518	9785811222377	Айрис-пресс плакат таблица умножения для заучивания нач.шк 2009	1	Неклассифицированные/default	1831818	Айрис-пресс
1805116	9785811244737	Айрис-пресс плакат таблица умножения мал 2011	507397	Полиграфия (folder)/Плакат	1831818	Айрис-пресс
1805117	9785811211159	Айрис-пресс плакат таблица умножения,квадратов натуральных чисел от 10 до 99	507397	Полиграфия (folder)/Плакат	1831818	Айрис-пресс
1805118	9785811203819	Айрис-пресс плакат техника плавания способом кроль на спине	507397	Полиграфия (folder)/Плакат	1831818	Айрис-пресс
1805119	9785811211340	Айрис-пресс плакат физика.прямолинейное движение тела	507397	Полиграфия (folder)/Плакат	1831818	Айрис-пресс
1805120	9785811204489	Айрис-пресс плакат фонетический разбор слова нач.шк	507397	Полиграфия (folder)/Плакат	1831818	Айрис-пресс
1805121	9785811219360	Айрис-пресс плакат хорошие манеры для малышей	507397	Полиграфия (folder)/Плакат	1831818	Айрис-пресс
1805122	9785811202850	Айрис-пресс плакат цифры нач.шк	507397	Полиграфия (folder)/Плакат	1831818	Айрис-пресс
1805123	9785811244539	Айрис-пресс плакат части речи нач.шк	507397	Полиграфия (folder)/Плакат	1831818	Айрис-пресс
1805124	9785811217021	Айрис-пресс плакат чередование гласных в корнях слов	507397	Полиграфия (folder)/Плакат	1831818	Айрис-пресс
1805125	9785811244744	Айрис-пресс плакат чередующиеся гласные в корне слова мал 2011	507397	Полиграфия (folder)/Плакат	1831818	Айрис-пресс
1805126	9785811222193	Айрис-пресс плакат черчение.ортогональные изображения.от рисунка к чертежу	507397	Полиграфия (folder)/Плакат	1831818	Айрис-пресс
1805127	9785811221929	Айрис-пресс плакат черчение.стандартные аксонометрические проекции	507397	Полиграфия (folder)/Плакат	1831818	Айрис-пресс
1805128	9785811210534	Айрис-пресс плакат шкала электромагнитных колебаний	507397	Полиграфия (folder)/Плакат	1831818	Айрис-пресс
2714097	9785811256617	Айрис-пресс пластиковое лото половинки (3+) комплект из трех игр	1	Неклассифицированные/default	1831818	Айрис-пресс
2714098	9785811256600	Айрис-пресс пластиковое лото силуэты (4+) комплект из трех игр	1	Неклассифицированные/default	1831818	Айрис-пресс
2417051	9785811230068	Айрис-пресс поздравления на все случаи жизни страна советов тверд обл	205408	Полиграфия (folder)/Книги	1831818	Айрис-пресс
1805129	9785811235100	Айрис-пресс популярлогопед герасимова популярная логопедия.занятия с дошкольниками 2009	36536	Полиграфия (folder)/Печатная продукция	1831818	Айрис-пресс
1805130	9785811241927	Айрис-пресс популярлогопед лазаренко о.и. артикуляционно-пальчиковая гимнастика.комплекс упражнений 2011	36536	Полиграфия (folder)/Печатная продукция	1831818	Айрис-пресс
1805131	9785811241378	Айрис-пресс пособ songbirds песни для детей на английском языке кн.1 2009	36536	Полиграфия (folder)/Печатная продукция	1831818	Айрис-пресс
1805132	9785811241385	Айрис-пресс пособ songbirds песни для детей на английском языке кн.2 2009	36536	Полиграфия (folder)/Печатная продукция	1831818	Айрис-пресс
1805133	9785811242375	Айрис-пресс пособ songbirds песни для детей на английском языке кн.3 2011	36536	Полиграфия (folder)/Печатная продукция	1831818	Айрис-пресс
1805134	9785811242382	Айрис-пресс пособ songbirds песни для детей на английском языке кн.4 2011	36536	Полиграфия (folder)/Печатная продукция	1831818	Айрис-пресс
1805135	9785811242399	Айрис-пресс пособ songbirds песни для детей на английском языке кн.5 2011	36536	Полиграфия (folder)/Печатная продукция	1831818	Айрис-пресс
1805136	9785811241514	Айрис-пресс пособ songbirds песни для детей на английском языке кн.6 2008	36536	Полиграфия (folder)/Печатная продукция	1831818	Айрис-пресс
1805137	9785811236664	Айрис-пресс пособ англклуб гасина разговорный английский для продолжающих 2009	36536	Полиграфия (folder)/Печатная продукция	1831818	Айрис-пресс
1805138	9785811242771	Айрис-пресс пособ англклуб угарова е.в. английская грамматика в таблицах 2011	36536	Полиграфия (folder)/Печатная продукция	1831818	Айрис-пресс
1805139	9785811220731	Айрис-пресс пособ бабкина оценка психологич.готовности детей к школе 2006	36536	Полиграфия (folder)/Печатная продукция	1831818	Айрис-пресс
1805140	9785811243815	Айрис-пресс пособ высшобраз гроше ю.в. итальянский язык для начинающих.самоучитель.разговорник 2010	36536	Полиграфия (folder)/Печатная продукция	1831818	Айрис-пресс
1805141	9785811241538	Айрис-пресс пособ высшобраз може г. ускорнный курс французского языка 2011	36536	Полиграфия (folder)/Печатная продукция	1831818	Айрис-пресс
1805142	9785811241774	Айрис-пресс пособ высшобраз нуждин г. испанский язык для начинающих.самоучитель.разговорник.словарик 2011	36536	Полиграфия (folder)/Печатная продукция	1831818	Айрис-пресс
1805143	9785811235964	Айрис-пресс пособ детпразд нечипоренко выпускные праздники в школе 2009	36536	Полиграфия (folder)/Печатная продукция	1831818	Айрис-пресс
1805144	9785811243662	Айрис-пресс пособ домреп гиа глизбург в.и. математика. комплексная подготовка 2012	36536	Полиграфия (folder)/Печатная продукция	1831818	Айрис-пресс
1805145	9785811244430	Айрис-пресс пособ домреп гиа маркин с.а. обществознание. комплексная подготовка 2012	36536	Полиграфия (folder)/Печатная продукция	1831818	Айрис-пресс
1805146	9785811242764	Айрис-пресс пособ домреп гиа чернова м.н. история россии. повторение и проверка знаний 2011	36536	Полиграфия (folder)/Печатная продукция	1831818	Айрис-пресс
1805147	9785811238156	Айрис-пресс пособ домреп егэ занина английский язык.устные темы 2010	36536	Полиграфия (folder)/Печатная продукция	1831818	Айрис-пресс
1805148	9785811242023	Айрис-пресс пособ домреп егэ занина е.л. егэ английский язык эссе:темы и аргументы 2011	36536	Полиграфия (folder)/Печатная продукция	1831818	Айрис-пресс
1805149	9785811235698	Айрис-пресс пособ домреп егэ романова английский язык.грамматика и лексика 2009	36536	Полиграфия (folder)/Печатная продукция	1831818	Айрис-пресс
1805150	9785811238620	Айрис-пресс пособ домреп егэ романова английский язык.письмо 2010	36536	Полиграфия (folder)/Печатная продукция	1831818	Айрис-пресс
1805151	9785811240012	Айрис-пресс пособ домрепетит мещерякова м.и. литература в таблицах и схемах 2010	36536	Полиграфия (folder)/Печатная продукция	1831818	Айрис-пресс
1805152	9785811241507	Айрис-пресс пособ домрепетит павлов пособие по обществознанию для поступающих в вузы 2011	36536	Полиграфия (folder)/Печатная продукция	1831818	Айрис-пресс
1805153	9785811240487	Айрис-пресс пособ домрепетит розенталь д.э. Русский язык.орфография и пунктуация красная мяг 2012	36536	Полиграфия (folder)/Печатная продукция	1831818	Айрис-пресс
1805154	9785811244041	Айрис-пресс пособ домрепетит ткаченко н.г. тесты по грамматике русского языка ч.1 2011	36536	Полиграфия (folder)/Печатная продукция	1831818	Айрис-пресс
1805155	9785811244263	Айрис-пресс пособ домрепетит ткаченко н.г. тесты по грамматике русского языка ч.2 2010	36536	Полиграфия (folder)/Печатная продукция	1831818	Айрис-пресс
1805156	9785811238200	Айрис-пресс пособ домрепетит чешко л. Русский язык для абитуриентов 2010	36536	Полиграфия (folder)/Печатная продукция	1831818	Айрис-пресс
1805157	9785811240753	Айрис-пресс пособ дошквоспит виноградова н.а. сюжетно-ролевые игры для старших дошкольников 2009	36536	Полиграфия (folder)/Печатная продукция	1831818	Айрис-пресс
1805158	9785811232116	Айрис-пресс пособ дошквоспит подрезова т.и. материал к занятиям по развитию речи.дикие животные и птицы 2010	36536	Полиграфия (folder)/Печатная продукция	1831818	Айрис-пресс
1805159	9785811240579	Айрис-пресс пособ егэ лозовский л.ш. обществознание.активный тренинг 2012	36536	Полиграфия (folder)/Печатная продукция	1831818	Айрис-пресс
1805160	9785811240500	Айрис-пресс пособ зинкевич н.а. курс английского языка для магистрантов+CD 2011	36536	Полиграфия (folder)/Печатная продукция	1831818	Айрис-пресс
1805161	9785811240470	Айрис-пресс пособ кзсд аверина физкультурные минутки в детском саду 2009	36536	Полиграфия (folder)/Печатная продукция	1831818	Айрис-пресс
1805162	9785811241880	Айрис-пресс пособ от а до я розенталь говорите и пишите по-русски правильно 2011	36536	Полиграфия (folder)/Печатная продукция	1831818	Айрис-пресс
1805163	9785811236367	Айрис-пресс пособ от а до я розенталь д.э. современный Русский язык тв 2009	36536	Полиграфия (folder)/Печатная продукция	1831818	Айрис-пресс
1805164	9785811244270	Айрис-пресс пособ от а до я розенталь д.э. справочник по русскому языку. правописание. произношение 2010	36536	Полиграфия (folder)/Печатная продукция	1831818	Айрис-пресс
1805165	9785811239719	Айрис-пресс пособ песни для детей на английском языке.книга для учителя 2008	36536	Полиграфия (folder)/Печатная продукция	1831818	Айрис-пресс
1805166	9785811241910	Айрис-пресс пособ ступуспех литвинов п.п. 3500 немецких слов.техника запоминания 2011	36536	Полиграфия (folder)/Печатная продукция	1831818	Айрис-пресс
1805167	9785811241156	Айрис-пресс пособ ступуспех петроченков а.в. 2000 самых употребительных английских слов 2010	36536	Полиграфия (folder)/Печатная продукция	1831818	Айрис-пресс
1805168	9785811240203	Айрис-пресс пособ школолимп артемов а.в. химия 8-11 кл 2011	36536	Полиграфия (folder)/Печатная продукция	1831818	Айрис-пресс
1805169	9785811245055	Айрис-пресс пособ школолимп белицкая н.г. начальная школа 2-4 кл 2010	36536	Полиграфия (folder)/Печатная продукция	1831818	Айрис-пресс
1805170	9785811244690	Айрис-пресс пособ школолимп власова английский язык 5-8 кл 2010	36536	Полиграфия (folder)/Печатная продукция	1831818	Айрис-пресс
