ID	UPCEAN	Name	CategoryID	CategoryName	BrandID	BrandName
4186906	765481773446	Cd crete g to feel this is to understand this	4093300	Медиа (folder)/Media	0	
4186907	743219786326	Cd cri cri coleccion rca 100 anos de musica	4093300	Медиа (folder)/Media	0	
4186908	078635327328	Cd cri cri grandes exitos, digital 2	4093300	Медиа (folder)/Media	0	
4186909	093624429821	Cd crime mob hated on mostly [pa]	4093300	Медиа (folder)/Media	0	
4186910	661390900921	Cd criminal nation resurrection	4093300	Медиа (folder)/Media	0	
4186911	880336000543	Cd crimson Guard clan of arashikage	4093300	Медиа (folder)/Media	0	
4186912	727361598723	Cd crimson relic purgatory's reign	4093300	Медиа (folder)/Media	0	
4186913	707541775724	Cd crimson thorn unearthed for dissection	4093300	Медиа (folder)/Media	0	
4186914	775020422728	Cd cris cuddy come along carmelita	4093300	Медиа (folder)/Media	0	
4186915	829757168623	Cd cris torres strother left tomorrow	4093300	Медиа (folder)/Media	0	
4186916	634479645716	Cd cris williamson fringe	4093300	Медиа (folder)/Media	0	
4186917	634479506826	Cd crisis crisis and Diana tyler	4093300	Медиа (folder)/Media	0	
4186918	651787011224	Cd crisman music Box	4093300	Медиа (folder)/Media	0	
4186919	687474046927	Cd crisp-burmeister pick from my tree	4093300	Медиа (folder)/Media	0	
4186920	8712474115129	Cd criss cross records, artist peter bernstein trio	1	Неклассифицированные/default	0	
4186921	634479088025	Cd crissie mccree One woman riot	4093300	Медиа (folder)/Media	0	
1861756	7896009180606	Cd cristal Gloss Vita a 300ml	1	Неклассифицированные/default	0	
1861757	7898449224551	Cd cristal Line 200ml ponto|9	1	Неклассифицированные/default	0	
1861758	7898449224711	Cd cristal Line choc 200ml ponto|9	1	Неклассифицированные/default	0	
4186922	600753228883	Cd cristian 6 Super hits	4093300	Медиа (folder)/Media	0	
4186923	886975302826	Cd cristian dos clasicos	4093300	Медиа (folder)/Media	0	
4186924	743219578723	Cd cristian grandes exitos	4093300	Медиа (folder)/Media	0	
4186925	634479832529	Cd cristina hernandez colores	4093300	Медиа (folder)/Media	0	
4186926	783707740126	Cd cristina orbe sway	4093300	Медиа (folder)/Media	0	
4186927	747313200979	Cd cristina ortiz cesar franck string quartet	4093300	Медиа (folder)/Media	0	
4186928	800001000326	Cd cristopolis metamorphosis	1	Неклассифицированные/default	0	
4186929	648401008128	Cd criteria when we break	4093300	Медиа (folder)/Media	0	
4186930	634479737428	Cd critical fuse critical fuse ep	4093300	Медиа (folder)/Media	0	
4186931	782388022026	Cd critical m@55 metropolis budget priced Label sampler volume 2	4093300	Медиа (folder)/Media	0	
4186932	634479782428	Cd critical mass juxtaposition	4093300	Медиа (folder)/Media	0	
4186933	602977059021	Cd critikill vigilance	4093300	Медиа (folder)/Media	0	
4186934	783707806921	Cd crizzy&the punx 13	4093300	Медиа (folder)/Media	0	
4186935	086162132100	Cd croc 2pcs CD-rom	4093300	Медиа (folder)/Media	0	
4186936	782388026727	Cd croc shop world	4093300	Медиа (folder)/Media	0	
4186937	081227433123	Cd croce, Jim collection	4093300	Медиа (folder)/Media	0	
4186938	708234018326	Cd crockett frizzell Old Love turned brand New	4093300	Медиа (folder)/Media	0	
4186939	089408055423	Cd crofut bill dance of a moonbeam:a coll	4093300	Медиа (folder)/Media	0	
4186940	634479497520	Cd crook it Nail full moon	4093300	Медиа (folder)/Media	0	
4186941	626570916000	Cd crooked Creek Lucky Stone	4093300	Медиа (folder)/Media	0	
4186942	628740658826	Cd crooked crow running to mercury	4093300	Медиа (folder)/Media	0	
4186943	656605867724	Cd crooked fingers forfeit/ fortune	4093300	Медиа (folder)/Media	0	
4186944	673885023329	Cd crooked ni@@#$ ransom	4093300	Медиа (folder)/Media	0	
4186945	829757492520	Cd crooked river the pyramid Eye	4093300	Медиа (folder)/Media	0	
4186946	076732162026	Cd crosby bing greatest hits	4093300	Медиа (folder)/Media	0	
4186947	886973354421	Cd crosby loggins time to move	4093300	Медиа (folder)/Media	0	
4186948	075678151729	Cd crosby stills nash &young-deja vu	4093300	Медиа (folder)/Media	0	
4186949	081227653729	Cd crosby stills&nash greatest hits	4093300	Медиа (folder)/Media	0	
4186950	075678077029	Cd crosby&nash graham nash/ david crosby	4093300	Медиа (folder)/Media	0	
4186951	074644897425	Cd crosby, bing 16 most requested songs	4093300	Медиа (folder)/Media	0	
4186952	715187734029	Cd crosby, bing all-time best of	4093300	Медиа (folder)/Media	0	
4186953	724353360023	Cd crosby, bing i wish you a merry christmas	4093300	Медиа (folder)/Media	0	
4186954	715187761728	Cd crosby, bing the best of (with fred astaire)	4093300	Медиа (folder)/Media	0	
4186955	075678141522	Cd crosby, david if only i could remember my...	4093300	Медиа (folder)/Media	0	
4186956	075678262029	Cd crosby, david it's all coming back ...	4093300	Медиа (folder)/Media	0	
4186957	707108800722	Cd crosby, david King biscuit Flower hour presents..	4093300	Медиа (folder)/Media	0	
4186958	075678248429	Cd crosby, david thousand roads	4093300	Медиа (folder)/Media	0	
4186959	075678151620	Cd crosby, stills&nash	4093300	Медиа (folder)/Media	0	
4186960	075678007521	Cd crosby, stills&nash allies	4093300	Медиа (folder)/Media	0	
4186961	075678150920	Cd crosby, stills&nash csn	4093300	Медиа (folder)/Media	0	
4186962	075678159527	Cd crosby, stills&nash daylight again	4093300	Медиа (folder)/Media	0	
4186963	075678265426	Cd crosby, stills, & nash after the storm	4093300	Медиа (folder)/Media	0	
4186964	075678265129	Cd crosby, stills, & nash crosby, stills&nash (remaste	4093300	Медиа (folder)/Media	0	
4186965	075678231926	Cd crosby, stills, & nash crosby, stills&nash Box	4093300	Медиа (folder)/Media	0	
4186966	075678265020	Cd crosby, stills, & nash csn (remaster)	4093300	Медиа (folder)/Media	0	
4186967	075678267222	Cd crosby, stills, & nash daylight again	4093300	Медиа (folder)/Media	0	
4186968	075678151828	Cd crosby, stills, nash and young so far	4093300	Медиа (folder)/Media	0	
4186969	075678240829	Cd crosby, stills, nash&young 4-way street	4093300	Медиа (folder)/Media	0	
4186970	075678188824	Cd crosby, stills, nash&young american Dream	4093300	Медиа (folder)/Media	0	
4186971	075678264924	Cd crosby, stills, nash&young deja vu	4093300	Медиа (folder)/Media	0	
4186972	093624743620	Cd crosby, stills, nash&young looking forward	4093300	Медиа (folder)/Media	0	
4186973	075678264825	Cd crosby, stills, nash&young so far-best of ...	4093300	Медиа (folder)/Media	0	
4186974	662582701326	Cd cross canadian ragweed carney	4093300	Медиа (folder)/Media	0	
4186975	602527134635	Cd cross canadian ragweed happiness and all the other things	4093300	Медиа (folder)/Media	0	
4186976	602517324954	Cd cross canadian ragweed mission California	4093300	Медиа (folder)/Media	0	
4186977	634479545429	Cd cross Da traxxx click ridin'	4093300	Медиа (folder)/Media	0	
4186978	634479381829	Cd cross fire sabotage	4093300	Медиа (folder)/Media	0	
4186979	724358265422	Cd cross movement holy culture	4093300	Медиа (folder)/Media	0	
4186980	783707800325	Cd cross rising fog following orpheus	4093300	Медиа (folder)/Media	0	
4186981	075992375726	Cd cross, christopher another page	4093300	Медиа (folder)/Media	0	
4186982	075992568524	Cd cross, christopher back of my mind	4093300	Медиа (folder)/Media	0	
4186983	075992338325	Cd cross, christopher christopher cross	4093300	Медиа (folder)/Media	0	
4186984	081227833527	Cd cross, christopher very best of, the	4093300	Медиа (folder)/Media	0	
4186985	791022177022	Cd crosscurrent rituals	4093300	Медиа (folder)/Media	0	
4186986	789577089129	Cd crosseyed Liquid	4093300	Медиа (folder)/Media	0	
4186987	696998714823	Cd crossfade crossfade	4093300	Медиа (folder)/Media	0	
4186988	090771606228	Cd crossfires, the out of control	4093300	Медиа (folder)/Media	0	
4186989	709363682525	Cd crosstops cloverleaf fandango	4093300	Медиа (folder)/Media	0	
4186990	652718736926	Cd crosstronic put on the armor of god	4093300	Медиа (folder)/Media	0	
4186991	600385112925	Cd crossway worship band all Day Long	4093300	Медиа (folder)/Media	0	
4186992	600385126021	Cd crossway worship band amazed	4093300	Медиа (folder)/Media	0	
4186993	600385131124	Cd crossway worship band on bended knee	4093300	Медиа (folder)/Media	0	
4186994	634479441226	Cd crosswindz Hot acoustic nite	4093300	Медиа (folder)/Media	0	
4186995	093624543220	Cd crouch, andrae mercy	4093300	Медиа (folder)/Media	0	
4186996	054391715128	Cd crouch, andrae pray	4093300	Медиа (folder)/Media	0	
4186997	093624592426	Cd crouch, andrae pray #2	4093300	Медиа (folder)/Media	0	
4186998	696998934726	Cd crouching Tiger, hidden Dragon Original motion picture sound track	4093300	Медиа (folder)/Media	0	
4186999	783707588728	Cd crow Johnson hearsay	4093300	Медиа (folder)/Media	0	
4187000	606949057428	Cd crow sheryl &friends live from central	4093300	Медиа (folder)/Media	0	
4187001	606949326029	Cd crow sheryl c'mon c'mon	4093300	Медиа (folder)/Media	0	
4187002	731458276326	Cd crow sheryl my favorite mistake	4093300	Медиа (folder)/Media	0	
4187003	606949768829	Cd crow sheryl soak up the Sun (ecdm)	4093300	Медиа (folder)/Media	0	
4187004	606949773229	Cd crow sheryl steve mcqueen (ecdm)	4093300	Медиа (folder)/Media	0	
4187005	634479147524	Cd crow44 ani	4093300	Медиа (folder)/Media	0	
4187006	634479550027	Cd crow44 hey ho	4093300	Медиа (folder)/Media	0	
4187007	634479550522	Cd crow44 look, i'm over here	4093300	Медиа (folder)/Media	0	
4187008	634479120626	Cd crow44 this way, that way	4093300	Медиа (folder)/Media	0	
4187009	670211501629	Cd crowbar equilibrium	4093300	Медиа (folder)/Media	0	
4187010	634479260629	Cd crowbar hotel other lives	4093300	Медиа (folder)/Media	0	
4187011	670211500523	Cd crowbar odd fellows rest	4093300	Медиа (folder)/Media	0	
4187012	5907785035690	Cd crowbar odd fellows rest #2	4093300	Медиа (folder)/Media	0	
4187013	823195000590	Cd crowbar sonic excess in its purest form/ odd fellows rest	4093300	Медиа (folder)/Media	0	
4187014	670211517729	Cd crowbar sonic express in it's purest form	4093300	Медиа (folder)/Media	0	
4187015	724352372225	Cd crowded house afterglow	4093300	Медиа (folder)/Media	0	
4187016	077774669320	Cd crowded house crowded house	4093300	Медиа (folder)/Media	0	
4187017	724383825028	Cd crowded house recurring Dream the best of.	4093300	Медиа (folder)/Media	0	
4187018	077774876322	Cd crowded house temple of low men	4093300	Медиа (folder)/Media	0	
4187019	880882158026	Cd crowded house time on Earth	4093300	Медиа (folder)/Media	0	
4187020	724382704829	Cd crowded house together alone	4093300	Медиа (folder)/Media	0	
4187021	077779355921	Cd crowded house woodface	4093300	Медиа (folder)/Media	0	
4187022	074646161227	Cd crowell, rodney diamonds and dirt (remastered)	4093300	Медиа (folder)/Media	0	
4187023	054391714923	Cd crowell, rodney i walk the Line (revisited)	4093300	Медиа (folder)/Media	0	
4187024	074646149126	Cd crowell, rodney keys to the highway	4093300	Медиа (folder)/Media	0	
4187025	074646149027	Cd crowell, rodney Life is messy	4093300	Медиа (folder)/Media	0	
4187026	075992596527	Cd crowell, rodney rodney crowell collection	4093300	Медиа (folder)/Media	0	
4187027	074646713228	Cd crowell, rodney Super hits	4093300	Медиа (folder)/Media	0	
4187028	015775152328	Cd crown of creation mobile fidelity sound lab udcd 523	4093300	Медиа (folder)/Media	0	
4187029	634479352928	Cd crownclassic crownclassic	4093300	Медиа (folder)/Media	0	
4187030	634479828225	Cd cru Chicago rappers united Chicago gangsters versus the rap industry	4093300	Медиа (folder)/Media	0	
4187031	803341227484	Cd cruachan morrigan???s call	4093300	Медиа (folder)/Media	0	
4187032	601215316322	Cd crucial conflict Good side bad side	4093300	Медиа (folder)/Media	0	
4187033	601215300628	Cd crucial conflict the final tic	4093300	Медиа (folder)/Media	0	
4187034	765481181821	Cd crucial massive reality music	4093300	Медиа (folder)/Media	0	
4187035	634479876325	Cd crucible forthcoming	4093300	Медиа (folder)/Media	0	
4187036	727701602127	Cd crucified Barbara in distortion we trust	4093300	Медиа (folder)/Media	0	
4187037	634479442827	Cd crucified saints Life of a Christian	4093300	Медиа (folder)/Media	0	
4187038	687259562925	Cd cruciform injection critical	4093300	Медиа (folder)/Media	0	
4187039	078636104324	Cd crudup, Arthur that's all right mama	4093300	Медиа (folder)/Media	0	
4187040	606949301729	Cd cruise pablo the best of pablo cruise	4093300	Медиа (folder)/Media	0	
4187041	075992585927	Cd cruise, julee floating into the Night	4093300	Медиа (folder)/Media	0	
4187042	093624539025	Cd cruise, julee the voice of Love	4093300	Медиа (folder)/Media	0	
4187043	805996000252	Cd cruiserweight this will undoubtedly come out wrong	4093300	Медиа (folder)/Media	0	
4187044	724352741625	Cd cruisn' 4 blockbusters	4093300	Медиа (folder)/Media	0	
4187045	076741707324	Cd crusaders free as the wind	4093300	Медиа (folder)/Media	0	
4187046	076741707225	Cd crusaders scratch	4093300	Медиа (folder)/Media	0	
4187047	076732601624	Cd crusaders southern comforter	4093300	Медиа (folder)/Media	0	
4187048	076732164921	Cd crusaders those southern knights	4093300	Медиа (folder)/Media	0	
4187049	627915092229	Cd crush here	4093300	Медиа (folder)/Media	0	
4187050	783707853628	Cd crush n run crush n run	4093300	Медиа (folder)/Media	0	
4187051	634479333224	Cd crushcoat monster platoon	4093300	Медиа (folder)/Media	0	
4187052	606041992528	Cd crust-o-matic!	4093300	Медиа (folder)/Media	0	
4187053	074649158521	Cd cruz, celia La negra teine tumbao	4093300	Медиа (folder)/Media	0	
4187054	074649145125	Cd cruz, celia siempre vivire	4093300	Медиа (folder)/Media	0	
4187055	081227281625	Cd cruz, celia the best of	4093300	Медиа (folder)/Media	0	
4187056	685738267125	Cd cruz, charlie asi soy	4093300	Медиа (folder)/Media	0	
4187057	639842618922	Cd cruz, charlie presentimiento	4093300	Медиа (folder)/Media	0	
4187058	634479842429	Cd cry after the storm	4093300	Медиа (folder)/Media	0	
4187059	634479606229	Cd cry cry	4093300	Медиа (folder)/Media	0	
4187060	793018284028	Cd cry cry cry cry cry cry	4093300	Медиа (folder)/Media	0	
4187061	074645340425	Cd cry of Love brother	4093300	Медиа (folder)/Media	0	
4187062	074646688120	Cd cry of Love diamonds&debris	4093300	Медиа (folder)/Media	0	
4187063	090771618726	Cd cryan' shames, the a scratch in the sky	4093300	Медиа (folder)/Media	0	
4187064	090771618627	Cd cryan' shames, the sugar&Spice	4093300	Медиа (folder)/Media	0	
4187065	090771618825	Cd cryan' shames, the synthesis	4093300	Медиа (folder)/Media	0	
4187066	643052001023	Cd crybaby no means yes	4093300	Медиа (folder)/Media	0	
4187067	783707454429	Cd cryin Blue Wine mad married circle	4093300	Медиа (folder)/Media	0	
4187068	634479810329	Cd cryptic vision moments of clarity	4093300	Медиа (folder)/Media	0	
4187069	634479610028	Cd cryptic visions cryptic visions	4093300	Медиа (folder)/Media	0	
4187070	794465548022	Cd cryptomeria cryptomeria	4093300	Медиа (folder)/Media	0	
4187071	727361118327	Cd Crystal ball hellvetia	4093300	Медиа (folder)/Media	0	
4187072	634479140525	Cd Crystal brandt bessie's last stand	4093300	Медиа (folder)/Media	0	
4187073	634479201424	Cd Crystal cartier Love story act One + 2	4093300	Медиа (folder)/Media	0	
4187074	5099950245925	Cd Crystal gayle greatest hits [capitol]	4093300	Медиа (folder)/Media	0	
4187075	813411010489	Cd Crystal gayle top 10 country hits	4093300	Медиа (folder)/Media	0	
4187076	606949322922	Cd Crystal method the tweekend (bonus remix disc	4093300	Медиа (folder)/Media	0	
4187077	634479312229	Cd Crystal phoenix apache	4093300	Медиа (folder)/Media	0	
4187078	042285871128	Cd Crystal waters 100% Pure Love	4093300	Медиа (folder)/Media	0	
4187079	042285662320	Cd Crystal waters what i need	4093300	Медиа (folder)/Media	0	
4187080	634479845123	Cd Crystal witch Crystal witch	4093300	Медиа (folder)/Media	0	
4187081	035711353022	Cd crystavox crystavox	4093300	Медиа (folder)/Media	0	
4187082	080688217327	Cd crystavox the bottom Line	4093300	Медиа (folder)/Media	0	
4187083	634479122224	Cd cs3 it's all on you	4093300	Медиа (folder)/Media	0	
4187084	098787071726	Cd css cansei de ser sexy	4093300	Медиа (folder)/Media	0	
4187085	098787077025	Cd css donkey	4093300	Медиа (folder)/Media	0	
4187086	743037213424	Cd csurg???? zenekar folk music from hungary	4093300	Медиа (folder)/Media	0	
4187087	634479684821	Cd ct Apple the road	4093300	Медиа (folder)/Media	0	
4187088	5021958802022	Cd cti -- library of sound edition 4 point Seven	4093300	Медиа (folder)/Media	0	
4187089	5021958810027	Cd cti -- the library of sound edition 1 metaphysical -- conspiracy international	4093300	Медиа (folder)/Media	0	
4187090	5021958830025	Cd cti -- the library of sound edition 2 chronomanic -- conspiracy international	4093300	Медиа (folder)/Media	0	
4187091	5021958840024	Cd cti -- the library of sound edition 3 in continuum -- conspiracy international	4093300	Медиа (folder)/Media	0	
4187092	783707575827	Cd ctraffik the bumrush	4093300	Медиа (folder)/Media	0	
4187093	712136200420	Cd cuarto espacio cuarto espacio	4093300	Медиа (folder)/Media	0	
1413103	790248014920	Cd cuba	1	Неклассифицированные/default	0	
4187094	634479833526	Cd cuba Cafe express what about cuba!	4093300	Медиа (folder)/Media	0	
4187095	724384965921	Cd cuba l.a. dos	4093300	Медиа (folder)/Media	0	
4187096	5033606005129	Cd cuban Cool	4093300	Медиа (folder)/Media	0	
4187097	5033606001824	Cd cuban rhythm	4093300	Медиа (folder)/Media	0	
4187098	884501251372	Cd cubillos, julian youth	4093300	Медиа (folder)/Media	0	
4187099	629048021022	Cd cucanandy contented minds	4093300	Медиа (folder)/Media	0	
4187100	629048005220	Cd cucanandy he didnt dance	4093300	Медиа (folder)/Media	0	
4187101	859701454694	Cd cucu diamantes cuculand	4093300	Медиа (folder)/Media	0	
4187102	731458051725	Cd cud neurotica [580517-2]	4093300	Медиа (folder)/Media	0	
4187103	731458072928	Cd cud One giant Love (CD1)	4093300	Медиа (folder)/Media	0	
4187104	639842310727	Cd cuddy, Jim all in time	4093300	Медиа (folder)/Media	0	
4187105	074644713022	Cd cugat, xavier 16 most requested songs	4093300	Медиа (folder)/Media	0	
4187106	696998534124	Cd cugat, xavier xavier cugat-the orginal latin dance King	4093300	Медиа (folder)/Media	0	
4187107	651047145522	Cd culann's hounds culann's hounds	4093300	Медиа (folder)/Media	0	
4187108	075678344428	Cd culbertson, brian nice&slow	4093300	Медиа (folder)/Media	0	
4187109	075679277527	Cd culbertson, brian secrets	4093300	Медиа (folder)/Media	0	
4187110	634479588624	Cd cullen knight the Life and times of cullen knight vol/1	4093300	Медиа (folder)/Media	0	
4187111	634479600821	Cd cullen knight the Life and times of cullen knight vol/2	4093300	Медиа (folder)/Media	0	
4187112	634479636622	Cd culprit guilty as charged	4093300	Медиа (folder)/Media	0	
4187113	634479013522	Cd cult of soul walkin' my Planet	4093300	Медиа (folder)/Media	0	
4187114	765481024425	Cd cult of the wrong note cult of the wrong note	4093300	Медиа (folder)/Media	0	
4187115	075678344022	Cd cult, the beyond Good and evil	4093300	Медиа (folder)/Media	0	
4187116	5012093300122	Cd cult, the the manor sessions ep	4093300	Медиа (folder)/Media	0	
4187117	5099765972122	Cd culture beat got to get it (659721 2)	4093300	Медиа (folder)/Media	0	
4187118	5099765946826	Cd culture beat mr.vain (659468 2)	4093300	Медиа (folder)/Media	0	
4187119	074645759128	Cd culture beat serenity	4093300	Медиа (folder)/Media	0	
4187120	077778715825	Cd culture Club 12inch mixes collection	4093300	Медиа (folder)/Media	0	
2539367	724383901425	Cd culture Club at worst .. the best of boy George&culture Club	4093300	Медиа (folder)/Media	0	
4187121	4988006831841	Cd culture Club colour by numbers	4093300	Медиа (folder)/Media	0	
4187122	724354376122	Cd culture Club culture Club (4 CD Box)	4093300	Медиа (folder)/Media	0	
4187123	724384619121	Cd culture Club vh-1 storytellers / the best of ?	4093300	Медиа (folder)/Media	0	
4187124	054645158626	Cd culture humble african	4093300	Медиа (folder)/Media	0	
4187125	074648035021	Cd cummings, burton burton cummings (remastered)	4093300	Медиа (folder)/Media	0	
4187126	081227171728	Cd cummings, burton burton cummings collection	4093300	Медиа (folder)/Media	0	
4187127	074648035229	Cd cummings, burton Dream of a child (remastered)	4093300	Медиа (folder)/Media	0	
4187128	074648035120	Cd cummings, burton my own way to Rock (remastered)	4093300	Медиа (folder)/Media	0	
4187129	074648101528	Cd cummings, burton the best of burton cummings	4093300	Медиа (folder)/Media	0	
4187130	074648035328	Cd cummings, burton woman Love (remastered)	4093300	Медиа (folder)/Media	0	
4187131	093624667223	Cd cummings, chris chris cummings	4093300	Медиа (folder)/Media	0	
4187132	093624763727	Cd cummings, chris lonesomeville	4093300	Медиа (folder)/Media	0	
4187133	809274334923	Cd cummings, chris ooh!.. cost him the Gold, bob	4093300	Медиа (folder)/Media	0	
4187134	093624701026	Cd cunningham, wes 12 ways to win ...	4093300	Медиа (folder)/Media	0	
4187135	075992467520	Cd cunninghams, the zeroed out	4093300	Медиа (folder)/Media	0	
4187136	947477000129	Cd cunninlynguists southernunderground	4093300	Медиа (folder)/Media	0	
4187137	600445011229	Cd cupcakes cupcakes	4093300	Медиа (folder)/Media	0	
4187138	639842313827	Cd cura, jose anhelo	4093300	Медиа (folder)/Media	0	
4187139	685738582129	Cd cura, jose boleros	4093300	Медиа (folder)/Media	0	
4187140	706301883822	Cd cura, jose puccini arias	4093300	Медиа (folder)/Media	0	
4187141	685738023226	Cd cura, jose verdi arias/cura	4093300	Медиа (folder)/Media	0	
4187142	639842731720	Cd cura, jose verismo	4093300	Медиа (folder)/Media	0	
4187143	634479153020	Cd curable interns curable interns	4093300	Медиа (folder)/Media	0	
4187144	724352131624	Cd curci, freddy then and now	4093300	Медиа (folder)/Media	0	
4187145	953073848003	Cd cure in Orange (vcd)	4093300	Медиа (folder)/Media	0	
4187146	075596223621	Cd cure, the bloodflowers	4093300	Медиа (folder)/Media	0	
4187147	075596078627	Cd cure, the boys don't cry	4093300	Медиа (folder)/Media	0	
4187148	075596658225	Cd cure, the close to me	4093300	Медиа (folder)/Media	0	
4187149	075596272520	Cd cure, the cure greatest hits, the	4093300	Медиа (folder)/Media	0	
4187150	075596085526	Cd cure, the disintegration	4093300	Медиа (folder)/Media	0	
4187151	075596078320	Cd cure, the faith	4093300	Медиа (folder)/Media	0	
4187152	075596670227	Cd cure, the fascination street	4093300	Медиа (folder)/Media	0	
4187153	075596211727	Cd cure, the galore	4093300	Медиа (folder)/Media	0	
4187154	075596272629	Cd cure, the greatest hits	4093300	Медиа (folder)/Media	0	
4187155	075596668729	Cd cure, the Love song	4093300	Медиа (folder)/Media	0	
4187156	075596666428	Cd cure, the lullaby	4093300	Медиа (folder)/Media	0	
4187157	075596660426	Cd cure, the nevr enough	4093300	Медиа (folder)/Media	0	
4187158	075596155229	Cd cure, the Paris	4093300	Медиа (folder)/Media	0	
4187159	075596663922	Cd cure, the pictures of you	4093300	Медиа (folder)/Media	0	
4187160	075596078528	Cd cure, the pornography	4093300	Медиа (folder)/Media	0	
4187161	075596155120	Cd cure, the show	4093300	Медиа (folder)/Media	0	
4187162	075596603621	Cd cure, the the 13th	4093300	Медиа (folder)/Media	0	
4187163	075596043526	Cd cure, the the head on the door	4093300	Медиа (folder)/Media	0	
4187164	075596174428	Cd cure, the Wild mood swings	4093300	Медиа (folder)/Media	0	
4187165	634479016820	Cd curfew curfew	4093300	Медиа (folder)/Media	0	
4187166	078221461429	Cd curfman, shannon loud guitars, big suspicions	4093300	Медиа (folder)/Media	0	
4187167	776127068925	Cd curiosity shop above the glass	4093300	Медиа (folder)/Media	0	
4187168	9399084396224	Cd curious (Yellow) charms&blues	4093300	Медиа (folder)/Media	0	
4187169	621617506022	Cd current 93 Black ships ate the sky	4093300	Медиа (folder)/Media	0	
4187170	634479696725	Cd current communion	4093300	Медиа (folder)/Media	0	
4187171	783707628424	Cd curse curse	4093300	Медиа (folder)/Media	0	
4187172	4050486006504	Cd curse ov dialect crisis tales	4093300	Медиа (folder)/Media	0	
4187173	783707628523	Cd curse with Special guests david amram and marc ribot pull my daisy / graveyard shuffle	4093300	Медиа (folder)/Media	0	
4187174	623235211029	Cd curse, the teenage meat	4093300	Медиа (folder)/Media	0	
4187175	648401003123	Cd cursive cursive's domestica	4093300	Медиа (folder)/Media	0	
4187176	686354216016	Cd cursor 700mb/80min CD-RW 4x	4093300	Медиа (folder)/Media	0	
4187177	805558255021	Cd curt berg at stagg street Studio	4093300	Медиа (folder)/Media	0	
4187178	626776728827	Cd curt erickson mixed messages	4093300	Медиа (folder)/Media	0	
4187179	634479331527	Cd curt klinghoffer panorama isle	4093300	Медиа (folder)/Media	0	
