ID	UPCEAN	Name	CategoryID	CategoryName	BrandID	BrandName
985134	027131867371	Estee Lauder сыворотка для лица выравнивающая тон кожи идеалист 30ml	1	Неклассифицированные/default	4695	Estee Lauder
255064	027131612261	Estee Lauder сыворотка корректирующая, повышающая упругость кожи, перфекционист сп +, 30ml	1	Неклассифицированные/default	4695	Estee Lauder
255065	027131612278	Estee Lauder сыворотка корректирующая, повышающая упругость кожи, перфекционист сп +, 50ml	1	Неклассифицированные/default	4695	Estee Lauder
2796429	027131935346	Estee Lauder сыворотка против морщин, повышающая упругость кожи perfectionist cp+r 30ml	1	Неклассифицированные/default	4695	Estee Lauder
1898397	027131935353	Estee Lauder сыворотка против морщин, повышающая упругость кожи perfectionist cp+r 50ml	1	Неклассифицированные/default	4695	Estee Lauder
2578153	887167023710	Estee Lauder твердые духи дужка pleasures	1	Неклассифицированные/default	4695	Estee Lauder
2578154	887167023734	Estee Lauder твердые духи сверчок tuberose gardenia	1	Неклассифицированные/default	4695	Estee Lauder
2796391	027131988106	Estee Lauder тейк iт евей лосьон для зняття макiяжу/*Estee Lauder 200ml	1	Неклассифицированные/default	4695	Estee Lauder
985136	027131509103	Estee Lauder тени-карандаш double wear pink taupe	1249	Косметика (folder)/Тени для век	4695	Estee Lauder
255006	027131018148	Estee Lauder трiпл крiм маска iнтенс.звол./Estee Lauder triple c 50ml	1	Неклассифицированные/default	4695	Estee Lauder
985140	027131501299	Estee Lauder укрепляющий корректор резилиенс лифт экстрим spf15 01 2.5g	5586	Косметика (folder)/Косметика	4695	Estee Lauder
254956	027131396550	Estee Lauder укрепляющий Крем для глаз future Perfect, 15ml	1	Неклассифицированные/default	4695	Estee Lauder
1898389	027131264637	Estee Lauder универсальный восстанавливающий комплекс advanced Night repair ii 30ml	1	Неклассифицированные/default	4695	Estee Lauder
1898390	027131267256	Estee Lauder универсальный восстанавливающий комплекс advanced Night repair ii 50ml	1	Неклассифицированные/default	4695	Estee Lauder
2796435	887167292093	Estee Lauder универсальный восстанавливающий комплекс advanced Night repare ii 50ml (Золотой флакон)	1	Неклассифицированные/default	0	
2320492	887167022836	Estee Lauder универсальный восстанавливающий комплекс для кожи вокруг глаз ii 15ml	5586	Косметика (folder)/Косметика	4695	Estee Lauder
2320493	887167031586	Estee Lauder универсальный восстанавливающий комплекс для кожи вокруг глаз ii сыворотка 15ml	5586	Косметика (folder)/Косметика	4695	Estee Lauder
4909600	887167343160	Estee Lauder холiдей найтс Golden айс набор (туш+тiн+карандаш) /el holiday ni 8mlx 2x0.8g	5586	Косметика (folder)/Косметика	4695	Estee Lauder
254943	027131331940	Estee Lauder эксфолиант для тела антицеллюлит. Body perfomance 200ml	5586	Косметика (folder)/Косметика	4695	Estee Lauder
985142	027131471448	Estee Lauder эксфолиант увлажняющий 75ml	1	Неклассифицированные/default	4695	Estee Lauder
2796437	887167080904	Estee Lauder эссенция, корректирующая пигментацию 30ml	1	Неклассифицированные/default	0	
4909601	887167451681	Estee Lauder/double wear make up set advanced Night repair Eye Care serum 0.5oz the smoother universal perfecting primer 0.5oz	5586	Косметика (folder)/Косметика	4695	Estee Lauder
4346269	041147008689	Estee Lemon creme wafers 3.2oz	1	Неклассифицированные/default	0	
1459782	041147004216	Estee Milk chocolate bar 2.8oz	1	Неклассифицированные/default	0	
2796439	887167096066	Estee Modern muse l 0.68 EDP spr	3068	Парфюмерия (folder)/Парфюмерия	0	
4346270	041147736018	Estee no salt added ketchup 22oz	1	Неклассифицированные/default	0	
4346273	041147008696	Estee p-nut btr wafers 3.2oz	1	Неклассифицированные/default	0	
4346271	041147270000	Estee Peanut Butter 18oz	1	Неклассифицированные/default	0	
1459789	041147004506	Estee Peanut Butter cups 3.5oz	1	Неклассифицированные/default	0	
4346272	041147003950	Estee peprmnt swirl candy 4oz	1	Неклассифицированные/default	0	
2079730	027131660521	Estee private collection amber ylang ylang l 2.5 EDP spr [w2ew] (very small qty)	4385	Парфюмерия (folder)/Парфюмерная вода	4695	Estee Lauder
2320734	027131424260	Estee re-nutriv ultimate lift creme fond	1	Неклассифицированные/default	4695	Estee Lauder
2796440	5045114860190	Estee resilience lift Night tester 50ml	1	Неклассифицированные/default	0	
1459790	041147003974	Estee sf asst hard c	1	Неклассифицированные/default	0	
4346274	041147004209	Estee sf Dark chocolate bar 2.8oz	1	Неклассифицированные/default	0	
4346275	070106155218	Estee sf maple syrup * 12oz	1	Неклассифицированные/default	0	
4346276	070106270003	Estee sodium free Peanut Butter creamy 18oz	1	Неклассифицированные/default	0	
4346277	041147025600	Estee st cookies-choc ch 6oz	1	Неклассифицированные/default	0	
4346278	041147003035	Estee sugar free chocolate caramel delights 1oz	1	Неклассифицированные/default	0	
4346279	041147003059	Estee sugar free chocolate Raspberry delights 1oz	1	Неклассифицированные/default	0	
4346280	041147003011	Estee sugar free double chocolate delights 1oz	1	Неклассифицированные/default	0	
1459791	070106155317	Estee syrup blueberr	1	Неклассифицированные/default	0	
2796441	5045110768759	Estee take i/a Eye&Lip remov test 100ml	1	Неклассифицированные/default	0	
1459786	041147003936	Estee Tropical Mix 4oz	1	Неклассифицированные/default	0	
1459779	041147008733	Estee van/strawberry wafers 3.3oz	1	Неклассифицированные/default	0	
1459792	041147008757	Estee vanilla wafers 3.25oz	1	Неклассифицированные/default	0	
985143	768455105595	Esteem 1pcs drainable pouch+inv/cls 10!	1	Неклассифицированные/default	4695	Estee Lauder
985144	768455071333	Esteem s5001 1p cl sml opq 20mm 30	1	Неклассифицированные/default	0	
985145	768455071340	Esteem s5002 1p cl sml opq 25mm 30	1	Неклассифицированные/default	0	
985146	768455071357	Esteem s5003 1p cl sml opq 30mm 30	1	Неклассифицированные/default	0	
985147	768455071364	Esteem s5004 1p cl sml opq 40mm 30	1	Неклассифицированные/default	0	
985148	768455071371	Esteem s5005 1p cl sml opq 50mm 30	1	Неклассифицированные/default	0	
985149	768455071432	Esteem s5006 1p cl med clr 20mm 30	1	Неклассифицированные/default	0	
985150	768455071449	Esteem s5007 1p cl med clr 25mm 30	1	Неклассифицированные/default	0	
985151	768455071456	Esteem s5008 1p cl med clr 30mm 30	1	Неклассифицированные/default	0	
985152	768455071463	Esteem s5009 1p cl med clr 40mm 30	1	Неклассифицированные/default	0	
985153	768455071470	Esteem s5010 1p cl med clr 50mm 30	1	Неклассифицированные/default	0	
985154	768455079810	Esteem s5012 1p cl med clr 35mm 30	1	Неклассифицированные/default	0	
985155	768455071388	Esteem s5013 1p cl med opq 20mm 30	1	Неклассифицированные/default	0	
985156	768455071395	Esteem s5014 1p cl med opq 25mm 30	1	Неклассифицированные/default	0	
985157	768455071401	Esteem s5015 1p cl med opq 30mm 30	1	Неклассифицированные/default	0	
985158	768455071418	Esteem s5016 1p cl med opq 40mm 30	1	Неклассифицированные/default	0	
985159	768455071425	Esteem s5017 1p cl med opq 50mm 30	1	Неклассифицированные/default	0	
985160	768455079797	Esteem s5018 1p cl med opq 35mm 30	1	Неклассифицированные/default	0	
985161	768455071555	Esteem s5020 1p cl lge clr 20mm 30	1	Неклассифицированные/default	0	
985162	768455071487	Esteem s5027 1p cl lge opq 20mm 30	1	Неклассифицированные/default	0	
985163	768455071494	Esteem s5028 1p cl lge opq 25mm 30	1	Неклассифицированные/default	0	
985164	768455071500	Esteem s5029 1p cl lge opq 30mm 30	1	Неклассифицированные/default	0	
985165	768455071517	Esteem s5030 1p cl lge opq 40mm 30	1	Неклассифицированные/default	0	
985166	768455071524	Esteem s5031 1p cl lge opq 50mm 30	1	Неклассифицированные/default	0	
985167	768455071531	Esteem s5032 1p cl lge opq 60mm 30	1	Неклассифицированные/default	0	
985168	768455079803	Esteem s5034 1p cl lge opq 35mm 30	1	Неклассифицированные/default	0	
985169	768455072439	Esteem s5040 1p drn sml clr 20mm 10	1	Неклассифицированные/default	0	
985170	768455072446	Esteem s5041 1p drn sml opq 20mm 10	1	Неклассифицированные/default	0	
985171	768455072453	Esteem s5042 1p drn sml opq 25mm 10	1	Неклассифицированные/default	0	
985172	768455072460	Esteem s5043 1p drn sml opq 30mm 10	1	Неклассифицированные/default	0	
985173	768455072477	Esteem s5044 1p drn sml opq 40mm 10	1	Неклассифицированные/default	0	
985174	768455072484	Esteem s5045 1p drn sml opq 50mm 10	1	Неклассифицированные/default	0	
985175	768455081219	Esteem s5046 1p drn sml opq 35mm 10	1	Неклассифицированные/default	0	
985176	768455072491	Esteem s5047 1p drn med clr 20mm 10	1	Неклассифицированные/default	0	
985177	768455072507	Esteem s5048 1p drn med opq 20mm 10	1	Неклассифицированные/default	0	
985178	768455072514	Esteem s5049 1p drn med opq 25mm 10	1	Неклассифицированные/default	0	
985179	768455072521	Esteem s5050 1p drn med opq 30mm 10	1	Неклассифицированные/default	0	
985180	768455072538	Esteem s5051 1p drn med opq 40mm 10	1	Неклассифицированные/default	0	
985181	768455072545	Esteem s5052 1p drn med opq 50mm 10	1	Неклассифицированные/default	0	
985182	768455072552	Esteem s5053 1p drn med opq 60mm 10	1	Неклассифицированные/default	0	
985183	768455081226	Esteem s5054 1p drn med opq 35mm 10	1	Неклассифицированные/default	0	
985184	768455072569	Esteem s5055 1p drn lge clr 20mm 10	1	Неклассифицированные/default	0	
985185	768455072583	Esteem s5057 1p drn lge clr 30mm 10	1	Неклассифицированные/default	0	
985186	768455072590	Esteem s5058 1p drn lge clr 40mm 10	1	Неклассифицированные/default	0	
985187	768455072606	Esteem s5059 1p drn lge clr 50mm 10	1	Неклассифицированные/default	0	
985188	768455072613	Esteem s5060 1p drn lge clr 60mm 10	1	Неклассифицированные/default	0	
985189	768455072620	Esteem s5061 1p drn lge clr 70mm 10	1	Неклассифицированные/default	0	
985190	768455072637	Esteem s5062 1p drn lge opq 20mm 10	1	Неклассифицированные/default	0	
985191	768455072644	Esteem s5063 1p drn lge opq 25mm 10	1	Неклассифицированные/default	0	
985192	768455072651	Esteem s5064 1p drn lge opq 30mm 10	1	Неклассифицированные/default	0	
985193	768455072668	Esteem s5065 1p drn lge opq 40mm 10	1	Неклассифицированные/default	0	
985194	768455072682	Esteem s5067 1p drn lge opq 60mm 10	1	Неклассифицированные/default	0	
985195	768455072699	Esteem s5068 1p drn lge opq 70mm 10	1	Неклассифицированные/default	0	
985196	768455081264	Esteem s5069 1p drn lge clr 35mm 10	1	Неклассифицированные/default	0	
985197	768455081240	Esteem s5070 1p drn lge opq 35mm 10	1	Неклассифицированные/default	0	
985198	768455092987	Esteem s5071 dr.sml tr 20-50mm 30	1	Неклассифицированные/default	0	
985199	768455092994	Esteem s5072 dr.sml opq 20-50mm 30	1	Неклассифицированные/default	0	
985200	768455093007	Esteem s5073 dr.sml opq 25mm 30	1	Неклассифицированные/default	0	
985201	768455093014	Esteem s5074 dr.sml opq 30mm 30	1	Неклассифицированные/default	0	
985202	768455093021	Esteem s5075 dr.sml opq 35mm 30	1	Неклассифицированные/default	0	
985203	768455093038	Esteem s5076 dr.sml opq 40mm 30	1	Неклассифицированные/default	0	
985204	768455093045	Esteem s5077 dr.sml opq 50mm 30	1	Неклассифицированные/default	0	
985205	768455093052	Esteem s5078 dr.med tr 20-70mm 30	1	Неклассифицированные/default	0	
985206	768455093069	Esteem s5079 dr.med opq 20-70mm 30	1	Неклассифицированные/default	0	
985207	768455093076	Esteem s5080 dr.med opq 25mm 30	1	Неклассифицированные/default	0	
985208	768455093083	Esteem s5081 dr.med opq 30mm 30	1	Неклассифицированные/default	0	
985209	768455093090	Esteem s5082 dr.med opq 35mm 30	1	Неклассифицированные/default	0	
985210	768455093106	Esteem s5083 dr.med opq 40mm 30	1	Неклассифицированные/default	0	
985211	768455093113	Esteem s5084 dr.med opq 50mm 30	1	Неклассифицированные/default	0	
985212	768455090716	Esteem s5110 uro pch sml tr 13-45m 10	1	Неклассифицированные/default	0	
985213	768455090723	Esteem s5111 uro pch sml tr 20mm 10	1	Неклассифицированные/default	0	
985214	768455090730	Esteem s5112 uro pch sml tr 25mm 10	1	Неклассифицированные/default	0	
985215	768455090747	Esteem s5113 uro pch sml tr 30mm 10	1	Неклассифицированные/default	0	
985216	768455090754	Esteem s5114 uro pch sml tr 35mm 10	1	Неклассифицированные/default	0	
985217	768455090792	Esteem s5121 fut sml opq 20mm 10	1	Неклассифицированные/default	0	
985218	768455090808	Esteem s5122 fut sml opq 25mm 10	1	Неклассифицированные/default	0	
985219	768455090815	Esteem s5123 fut sml opq 30mm 10	1	Неклассифицированные/default	0	
985220	768455090822	Esteem s5124 fut sml opq 35mm 10	1	Неклассифицированные/default	0	
985221	768455090594	Esteem s5132 uro pch std tr 25mm 10	1	Неклассифицированные/default	0	
985222	768455090600	Esteem s5133 uro pch std tr 30mm 10	1	Неклассифицированные/default	0	
985223	768455090617	Esteem s5134 uro pch std tr 35mm 10	1	Неклассифицированные/default	0	
985224	768455090655	Esteem s5141 fut std opq 20mm 10	1	Неклассифицированные/default	0	
985225	768455090662	Esteem s5142 fut std opq 25mm 10	1	Неклассифицированные/default	0	
985226	768455090679	Esteem s5143 fut std opq 30mm 10	1	Неклассифицированные/default	0	
985227	768455090686	Esteem s5144 fut std opq 35mm 10	1	Неклассифицированные/default	0	
985228	768455088911	Esteem syn inv s1220f r 1s 13-55mm 30	1	Неклассифицированные/default	0	
985229	768455081905	Esteem syn s1006f tr std r 13-48mm 10	1	Неклассифицированные/default	0	
985230	768455084906	Esteem syn s1020f opq std r 13-35m 10	1	Неклассифицированные/default	0	
985231	768455085118	Esteem syn s1020n opq std r 13-35m 10	1	Неклассифицированные/default	0	
985232	768455084944	Esteem syn s1021f opq std r 13-48m 10	1	Неклассифицированные/default	0	
985233	768455084982	Esteem syn s1022f opq std r 13-61m 10	1	Неклассифицированные/default	0	
985234	768455085187	Esteem syn s1027n opq std l 13-61m 10	1	Неклассифицированные/default	0	
985235	768455085200	Esteem syn s1040f opq sml r 13-35m 10	1	Неклассифицированные/default	0	
985236	768455085330	Esteem syn s1041n opq sml r 13-48m 10	1	Неклассифицированные/default	0	
985237	768455086603	Esteem syn s1051f trans std 13-48m 30	1	Неклассифицированные/default	0	
985238	768455086665	Esteem syn s1054f opq sml 13-48mm 30	1	Неклассифицированные/default	0	
985239	768455086634	Esteem syn s1054n opq sml 13-48mm 30	1	Неклассифицированные/default	0	
985240	768455086696	Esteem syn s1057f trans sml 13-48m 30	1	Неклассифицированные/default	0	
985241	768455086702	Esteem syn s1058f trans sml 13-61m 30	1	Неклассифицированные/default	0	
985242	768455082476	Esteem syn s1062f opq std 13-35mm 30	1	Неклассифицированные/default	0	
985243	768455082506	Esteem syn s1063f opq std 13-48mm 30	1	Неклассифицированные/default	0	
985244	768455082537	Esteem syn s1064f opq std 13-61mm 30	1	Неклассифицированные/default	0	
985245	768455083022	Esteem syn s1100 stomah+flx 13-35m 10	1	Неклассифицированные/default	0	
985246	768455083046	Esteem syn s1101 stomah+flx 13-48m 10	1	Неклассифицированные/default	0	
985247	768455083060	Esteem syn s1102 stomah+flx 13-61m 10	1	Неклассифицированные/default	0	
985248	768455083091	Esteem syn s1106 durah+flx 13-48mm 10	1	Неклассифицированные/default	0	
985249	768455083466	Esteem syn s1131 stomah 13-48mm 10	1	Неклассифицированные/default	0	
985250	768455083497	Esteem syn s1132 stomah 13-61mm 10	1	Неклассифицированные/default	0	
985251	768455085460	Esteem syn s1180 barrier 13-22mm 10	1	Неклассифицированные/default	0	
985252	768455086313	Esteem syn s1181 barrier 22-33mm 10	1	Неклассифицированные/default	0	
985253	768455091614	Esteem syn s1190 stomah+flx 13-35m 10	1	Неклассифицированные/default	0	
985254	768455091621	Esteem syn s1191 stomah+flx 13-48m 10	1	Неклассифицированные/default	0	
985255	768455091638	Esteem syn s1192 stomah+flx 13-61m 10	1	Неклассифицированные/default	0	
985257	833379001268	Esteemia Dry heel away! cracked heel repair crs&d&horny c 0.059l j	1	Неклассифицированные/default	985256	ESTEEMIA
985258	833379001145	Esteemia средство для удаления ороговевшей кожи на ногах и руках 30ml на блистере	461	Косметика (folder)/Маникюр и педикюр (folder)/Маникюр и педикюр	985256	ESTEEMIA
4346281	074645721897	Estefan g-gloria estefan-live&unwrapped (DVD)	1	Неклассифицированные/default	0	
4346282	886971680591	Estefan g-live in atlantis (DVD)	1	Неклассифицированные/default	0	
2021132	4606453032139	Estel airex бриллиантовый блеск для волос, б/фиксации abr 75m 75ml	225	Уход за волосами (folder)/Моделирование прически	8595	Estel
35134	4606453012445	Estel airex гель для укладки сильн фиксация 200ml ag200/2	28	Уход за волосами (folder)/Уход за волосами	8595	Estel
2021135	4606453016405	Estel airex глина для моделирования пластичн фиксация, 75ml acl65	225	Уход за волосами (folder)/Моделирование прически	8595	Estel
2021138	4606453026428	Estel airex моделирующий Крем для волос 3D-hairs 150ml	225	Уход за волосами (folder)/Моделирование прически	8595	Estel
2021139	4606453026497	Estel airex молочко airex для укладки легкая фиксац 250ml amo250	225	Уход за волосами (folder)/Моделирование прически	8595	Estel
2021140	4606453031019	Estel airex мусс для создания локонов сильной фиксации, 316ml	225	Уход за волосами (folder)/Моделирование прически	8595	Estel
2021142	4606453016412	Estel airex стрейч-гель для дизайна вол пластичн фиксац 75ml	225	Уход за волосами (folder)/Моделирование прически	8595	Estel
2021143	4606453026442	Estel airex стрейч-гель для дизайна вол пластичн фиксац 75ml #2	225	Уход за волосами (folder)/Моделирование прически	8595	Estel
2021144	4606453026466	Estel airex эластик-гель для моделирования суперсильн.пластичная фиксац 75ml	225	Уход за волосами (folder)/Моделирование прически	8595	Estel
2578156	4606453034072	Estel alpha homme тонизир шамп с охлажд эфф для волос и тела 250ml ah.1	28	Уход за волосами (folder)/Уход за волосами	8595	Estel
2179729	4606453023236	Estel alpha homme шампунь д|волос от перхоти 250ml ah.2	28	Уход за волосами (folder)/Уход за волосами	8595	Estel
2578157	4606453034102	Estel alpha homme шампунь д|волос от перхоти 250ml ah.2 #2	28	Уход за волосами (folder)/Уход за волосами	8595	Estel
2179731	4606453023243	Estel alpha homme шампунь-активатор роста волос 250ml ah.3	28	Уход за волосами (folder)/Уход за волосами	8595	Estel
2022063	4606453027784	Estel Always on-Line мусс для создан локонов сильн фикса 250ml	225	Уход за волосами (folder)/Моделирование прически	8595	Estel
2022064	4606453027791	Estel Always on-Line спрей вуаль для бриллиантового блеска волос, 250ml	225	Уход за волосами (folder)/Моделирование прически	8595	Estel
2022065	4606453027807	Estel Always on-Line спрей мусс для прикорн объема вол сильн фиксац 250ml	225	Уход за волосами (folder)/Моделирование прически	8595	Estel
4814798	4606453047195	Estel beauty Hair lab aurum маска для волос 250ml	241824	Лекарственные средства (folder)/Аптека	8595	Estel
4814799	4606453043388	Estel beauty Hair lab detox therapi маска-детокс для волос 250ml	241824	Лекарственные средства (folder)/Аптека	8595	Estel
4814800	4606453043203	Estel beauty Hair lab detox therapi шампунь-детокс для волос 250ml	241824	Лекарственные средства (folder)/Аптека	8595	Estel
4814801	4606453043319	Estel beauty Hair lab sebo therapi тоник от перхоти 100ml	241824	Лекарственные средства (folder)/Аптека	8595	Estel
2796442	4606453043173	Estel beauty Hair lab бальзам-антистресс для волос 200ml	1	Неклассифицированные/default	8595	Estel
2796444	4606453043166	Estel beauty Hair lab бальзам-контроль здоровья волос 200ml	1	Неклассифицированные/default	8595	Estel
4814802	4606453043357	Estel beauty Hair lab Крем мульти-эффект для волос 30ml	241824	Лекарственные средства (folder)/Аптека	8595	Estel
2890639	4606453043418	Estel beauty Hair lab маска-антистресс для волос 250ml	1	Неклассифицированные/default	8595	Estel
2890640	4606453043401	Estel beauty Hair lab маска-защита цвета волос 250ml	1	Неклассифицированные/default	8595	Estel
4814803	4606453043333	Estel beauty Hair lab сканер-эликсир для восстановления волос 30ml	241824	Лекарственные средства (folder)/Аптека	8595	Estel
3654388	4606453043272	Estel beauty Hair lab спрей активатор роста и укрепления волос 100ml	28	Уход за волосами (folder)/Уход за волосами	8595	Estel
