ID	UPCEAN	Name	CategoryID	CategoryName	BrandID	BrandName
3663164	8713492161587	Gardenvision inter.bv тюльпан бург.лайсе 10/11 2шт	3619917	Растениеводство (folder)/Семена и луковичные	3663000	GARDENVISION
3663165	8713492161648	Gardenvision inter.bv тюльпан вашингтон 10/11 2шт	3619917	Растениеводство (folder)/Семена и луковичные	3663000	GARDENVISION
3663166	8713492161389	Gardenvision inter.bv тюльпан дарв.ап.эл.10/11 2шт	3619917	Растениеводство (folder)/Семена и луковичные	3663000	GARDENVISION
3663167	8713492161617	Gardenvision inter.bv тюльпан Дон куишот 10/11 2шт	3619917	Растениеводство (folder)/Семена и луковичные	3663000	GARDENVISION
3663168	8713492161594	Gardenvision inter.bv тюльпан куин оф н.10/11 2шт	3619917	Растениеводство (folder)/Семена и луковичные	3663000	GARDENVISION
3663169	8713492161624	Gardenvision inter.bv тюльпан лаки стр.10/11 2шт	3619917	Растениеводство (folder)/Семена и луковичные	3663000	GARDENVISION
3663170	8713492161556	Gardenvision inter.bv тюльпан миранда 10/11 2шт	3619917	Растениеводство (folder)/Семена и луковичные	3663000	GARDENVISION
3663171	8713492161761	Gardenvision inter.bv тюльпан ор.кассини 10/11 2шт	3619917	Растениеводство (folder)/Семена и луковичные	3663000	GARDENVISION
3663172	8713492165080	Gardenvision inter.bv тюльпан трис чик 10/11 2шт	3619917	Растениеводство (folder)/Семена и луковичные	3663000	GARDENVISION
3663173	8713492161433	Gardenvision inter.bv тюльпан триумф йок.10/11 2шт	3619917	Растениеводство (folder)/Семена и луковичные	3663000	GARDENVISION
3663174	8713492161549	Gardenvision inter.bv тюльпан фриман 10/11 2шт	3619917	Растениеводство (folder)/Семена и луковичные	3663000	GARDENVISION
3663176	3287116000118	Gardet (gardet) blanc de blancs brut w 750ml	296061	Продукты питания (folder)/Алкогольные напитки/Вино (folder)/Вино игристое	3663175	GARDET (GARDET&CIE/FRANCE)
3663177	3287114000110	Gardet (gardet) brut p 750ml Box a	296061	Продукты питания (folder)/Алкогольные напитки/Вино (folder)/Вино игристое	3663175	GARDET (GARDET&CIE/FRANCE)
3663178	3287117000421	Gardet (gardet) brut w 0.375l	296061	Продукты питания (folder)/Алкогольные напитки/Вино (folder)/Вино игристое	3663175	GARDET (GARDET&CIE/FRANCE)
3663179	3287111200117	Gardet (gardet) Premier cru brut w 750ml Box a	296061	Продукты питания (folder)/Алкогольные напитки/Вино (folder)/Вино игристое	3663175	GARDET (GARDET&CIE/FRANCE)
4377980	677543091019	Gardetto hry garl br 3.5oz	1	Неклассифицированные/default	0	
1475262	070489071754	Gardetto's 1.65oz gardetto's pretzel Mix mustard	1	Неклассифицированные/default	3115922	Gardetto's
4377981	070489300267	Gardetto's 1.65oz gardetto's reduced fat snak-ens snack Mix (Original)	1	Неклассифицированные/default	3115922	Gardetto's
1475260	070489400264	Gardetto's 1.65oz gardetto's snack Mix italian	1	Неклассифицированные/default	3115922	Gardetto's
969380	070489021759	Gardetto's 1.75oz gardetto's snack Mix Original	1	Неклассифицированные/default	3115922	Gardetto's
4377982	070489301219	Gardetto's 10.5oz gardetto's snack Mix Original reduced fat	1	Неклассифицированные/default	3115922	Gardetto's
4377983	070489401216	Gardetto's 10oz gardetto's snack Mix italian a29324	1	Неклассифицированные/default	3115922	Gardetto's
4377984	070489156703	Gardetto's 10oz gardetto's snack Mix italian Cheese Blend s1	1	Неклассифицированные/default	3115922	Gardetto's
4377985	070489212096	Gardetto's 10oz gardettos snackers	1	Неклассифицированные/default	3115922	Gardetto's
4377986	070489250746	Gardetto's 11.2oz gardetto's snack Mix lignt 'n crispy sour Cream&onion	1	Неклассифицированные/default	3115922	Gardetto's
4377987	070489071501	Gardetto's 11oz gardetto's pretzel Mix mustard a26701	1	Неклассифицированные/default	3115922	Gardetto's
4377988	070489021209	Gardetto's 11oz gardetto's snack Mix Original	1	Неклассифицированные/default	3115922	Gardetto's
4377989	070489400714	Gardetto's 12/5 gardetto's snack Mix italian	1	Неклассифицированные/default	3115922	Gardetto's
4377990	070489211235	Gardetto's 14oz gardetto bp chip&Twist	1	Неклассифицированные/default	3115922	Gardetto's
4377991	070489201236	Gardetto's 14oz gardetto bp snak-ems	1	Неклассифицированные/default	3115922	Gardetto's
4377992	070489221234	Gardetto's 18oz gardetto bp mstd pretzel	1	Неклассифицированные/default	3115922	Gardetto's
4377993	070489170662	Gardetto's 19.8oz gardetto's pretzel Mix mustard 12ct	1	Неклассифицированные/default	3115922	Gardetto's
4377994	070489171164	Gardetto's 19.8oz gardetto's snack Mix italian	1	Неклассифицированные/default	3115922	Gardetto's
4377995	070489156802	Gardetto's 20oz gardetto's snack Mix italian Cheese Blend s1	1	Неклассифицированные/default	3115922	Gardetto's
4377996	070489170372	Gardetto's 21oz gardetto's snack Mix Original	1	Неклассифицированные/default	3115922	Gardetto's
4377997	070489200741	Gardetto's 31.5oz gardetto's snack Mix Original	1	Неклассифицированные/default	3115922	Gardetto's
4377998	070489300748	Gardetto's 31.5oz gardetto's snack Mix Original reduced fat	1	Неклассифицированные/default	3115922	Gardetto's
4377999	070489220749	Gardetto's 39oz gardetto's pretzel Mix mustard 6ct	1	Неклассифицированные/default	3115922	Gardetto's
4378000	070489400745	Gardetto's 39oz gardetto's snack Mix italian	1	Неклассифицированные/default	3115922	Gardetto's
4378001	070489250715	Gardetto's 4.75oz gardetto's snack Mix Light 'n crispy sour Cream&onion	1	Неклассифицированные/default	3115922	Gardetto's
4378002	070489450719	Gardetto's 4.75oz gardetto's snack Mix Light 'n crispy sweet&savory barbecue s3	1	Неклассифицированные/default	3115922	Gardetto's
4378003	070489300717	Gardetto's 5.25oz gardetto's snack Mix Original reduced fat	1	Неклассифицированные/default	3115922	Gardetto's
4378004	070489156901	Gardetto's 5.5oz gardetto's snack Mix italian Cheese Blend s1	1	Неклассифицированные/default	3115922	Gardetto's
4378005	070489021001	Gardetto's 6oz gardetto's snack Mix Original s2	1	Неклассифицированные/default	3115922	Gardetto's
1475263	070489077503	Gardetto's 7.5oz gardettos mustard pretzel 6.5oz	1	Неклассифицированные/default	3115922	Gardetto's
4378006	070489200772	Gardetto's 8ct gardetto's snack Mix Original	1	Неклассифицированные/default	3115922	Gardetto's
4378007	070489251217	Gardetto's 9.5oz gardetto's snack Mix Light 'n crispy sour Cream&onion a26708	1	Неклассифицированные/default	3115922	Gardetto's
4378008	070489451211	Gardetto's 9.5oz gardetto's snack Mix Light 'n crispy sweet&savory barbecue a26694	1	Неклассифицированные/default	3115922	Gardetto's
1475256	016000508156	Gardetto's ched bacon cracker	1	Неклассифицированные/default	3115922	Gardetto's
2086741	016000430426	Gardetto's chipotle cheddar 7ct	1	Неклассифицированные/default	3115922	Gardetto's
1475257	016000505384	Gardetto's chipotle cheddar snack Mix 5oz	1	Неклассифицированные/default	3115922	Gardetto's
2086742	016000274815	Gardetto's deli style mstrd prtzl 7c	1	Неклассифицированные/default	3115922	Gardetto's
1475258	016000508163	Gardetto's gar crm chs cracker	1	Неклассифицированные/default	3115922	Gardetto's
4378009	070489900573	Gardetto's gard snack tray	1	Неклассифицированные/default	3115922	Gardetto's
4378010	070489450351	Gardetto's gardetto bbq	1	Неклассифицированные/default	3115922	Gardetto's
4378011	070489271505	Gardetto's gardetto mustard	1	Неклассифицированные/default	3115922	Gardetto's
4378021	070489200109	Gardetto's gardetto's	1	Неклассифицированные/default	3115922	Gardetto's
4378022	070489220107	Gardetto's gardetto's #2	1	Неклассифицированные/default	3115922	Gardetto's
4378023	070489250104	Gardetto's gardetto's #3	1	Неклассифицированные/default	3115922	Gardetto's
4378024	070489400103	Gardetto's gardetto's #4	1	Неклассифицированные/default	3115922	Gardetto's
4378012	070489071808	Gardetto's gardettos	1	Неклассифицированные/default	3115922	Gardetto's
4378013	070489121206	Gardetto's gardettos #2	1	Неклассифицированные/default	3115922	Gardetto's
4378014	070489127000	Gardetto's gardettos #3	1	Неклассифицированные/default	3115922	Gardetto's
4378015	070489200031	Gardetto's gardettos #4	1	Неклассифицированные/default	3115922	Gardetto's
4378016	070489200857	Gardetto's gardettos #5	1	Неклассифицированные/default	3115922	Gardetto's
4378017	070489210856	Gardetto's gardettos #6	1	Неклассифицированные/default	3115922	Gardetto's
4378018	070489220855	Gardetto's gardettos #7	1	Неклассифицированные/default	3115922	Gardetto's
4378019	070489300854	Gardetto's gardettos #8	1	Неклассифицированные/default	3115922	Gardetto's
4378020	070489310853	Gardetto's gardettos #9	1	Неклассифицированные/default	3115922	Gardetto's
4378025	070489310266	Gardetto's gardettos chips	1	Неклассифицированные/default	3115922	Gardetto's
4378026	070489620358	Gardetto's gardettos prtzl	1	Неклассифицированные/default	3115922	Gardetto's
1474925	016000167490	Gardetto's italian Cheese Blend snack Mix 5.5oz	1	Неклассифицированные/default	3115922	Gardetto's
1475261	016000166998	Gardetto's italian recipe snack Mix 5oz	1	Неклассифицированные/default	3115922	Gardetto's
597640	016000167292	Gardetto's mustard 6oz	1	Неклассифицированные/default	0	
1474928	016000166295	Gardetto's mustard pretzl	1	Неклассифицированные/default	0	
1475265	016000166097	Gardetto's orig rcp	1	Неклассифицированные/default	3115922	Gardetto's
1483149	016000166134	Gardetto's Original 5oz	1	Неклассифицированные/default	0	
2086743	016000430372	Gardetto's Original 7ct	1	Неклассифицированные/default	3115922	Gardetto's
3115923	016000114982	Gardetto's Original recipe snack Mix	330591	Продукты питания (folder)/Продукты питания	3115922	Gardetto's
3115924	016000476363	Gardetto's Original recipe snack Mix #2	330591	Продукты питания (folder)/Продукты питания	3115922	Gardetto's
190780	016000193604	Gardetto's Original recipe snack Mix 14.5oz	18673	Продукты питания (folder)/Чипсы и снэки	3115922	Gardetto's
1475266	016000166196	Gardetto's Original recipe snack Mix 5.5oz	1	Неклассифицированные/default	3115922	Gardetto's
1475264	016000507319	Gardetto's pretzel Mix deli-style mustard 5.5oz	260335	Продукты питания (folder)/Снэки	3115922	Gardetto's
1483150	016000166684	Gardetto's rdc fat 5oz	1	Неклассифицированные/default	0	
1475267	016000166691	Gardetto's Red fat orig 5oz	260335	Продукты питания (folder)/Снэки	3115922	Gardetto's
1480011	016000193802	Gardetto's reduced fat Original recipe snack Mix	330591	Продукты питания (folder)/Продукты питания	3115922	Gardetto's
1475268	016000193703	Gardetto's snack Mix - Original recipe enriched flour (Wheat flour, niacin, iron, thiamin mononitrate, riboflavin, folic acid)	330591	Продукты питания (folder)/Продукты питания	3115922	Gardetto's
4378027	070489027003	Gardetto's snak-ens	1	Неклассифицированные/default	3115922	Gardetto's
1474956	016000166592	Gardetto's Special italian	1	Неклассифицированные/default	0	
2086744	016000430396	Gardetto's Special italian 7ct	1	Неклассифицированные/default	3115922	Gardetto's
3115925	016000468139	Gardetto's Special request rye chips grlc	330591	Продукты питания (folder)/Продукты питания	3115922	Gardetto's
1475259	016000502789	Gardetto's Special request rye chips grlc 4.75oz	260335	Продукты питания (folder)/Снэки	3115922	Gardetto's
190335	016000193338	Gardetto's Special request rye chips grlc 8oz	18673	Продукты питания (folder)/Чипсы и снэки	3115922	Gardetto's
3115926	016000143098	Gardetto's spicy italian snack Mix	330591	Продукты питания (folder)/Продукты питания	3115922	Gardetto's
4378028	070489250357	Gardetto's sr. crm.gardetto	1	Неклассифицированные/default	3115922	Gardetto's
597643	4607131425380	Gardex Baby (2014) молочко детское от комаров с защитой от солнца 75ml /24 Россия	102	Борьба с насекомыми и грызунами/Средства против насекомых	2015	Gardex
370742	4607131422150	Gardex Baby Natural детский спрей от комаров на натуральной основе от 3 лет 75ml /24 Россия	331155	Борьба с насекомыми и грызунами/Репеллент	2015	Gardex
3663180	027540016384	Gardex Baby q b cg 0.04l tu	331155	Борьба с насекомыми и грызунами/Репеллент	2015	Gardex
3663182	32467789	Gardex Baby q b l 0.05l spm	331155	Борьба с насекомыми и грызунами/Репеллент	2015	Gardex
2588092	4640016741052	Gardex Baby детский бальзам после укусов 7ml (ООО галант косметик - м)	1	Неклассифицированные/default	2015	Gardex
597642	4607131422198	Gardex Baby детский бальзам-стик после укусов /24 Россия снято	1	Неклассифицированные/default	2015	Gardex
63493	4607131420026	Gardex Baby детский карандаш-репеллент от комаров 50ml 0110	102	Борьба с насекомыми и грызунами/Средства против насекомых	2015	Gardex
122024	4607131421276	Gardex Baby детский спрей от комаров с защитой от солнца от 1.5 лет 75ml /24 Россия	102	Борьба с насекомыми и грызунами/Средства против насекомых	2015	Gardex
3663181	4607131422303	Gardex Baby Крем-гель от комаров 40ml/промо/	331155	Борьба с насекомыми и грызунами/Репеллент	2015	Gardex
4816258	4607131421382	Gardex Baby Крем-гель от комаров 70ml	241824	Лекарственные средства (folder)/Аптека	2015	Gardex
597641	4607131425397	Gardex Baby пенка дет от комаров 75 ил ООО аэрозоль новомосковск	102	Борьба с насекомыми и грызунами/Средства против насекомых	2015	Gardex
2588093	4640016741069	Gardex Baby пластырь п/укусов насекомых №20 (еуросирел спа)	1	Неклассифицированные/default	2015	Gardex
3663184	4640016742356	Gardex Classic q b l 0.045l spm	331155	Борьба с насекомыми и грызунами/Репеллент	2015	Gardex
3663185	4640016742646	Gardex Classic q b l 0.045l spm #2	331155	Борьба с насекомыми и грызунами/Репеллент	2015	Gardex
3663187	4607131424406	Gardex Classic q l 0.1l spm	331155	Борьба с насекомыми и грызунами/Репеллент	2015	Gardex
1475269	4607131424413	Gardex Classic спрей вiд комарiв 100ml	102	Борьба с насекомыми и грызунами/Средства против насекомых	2015	Gardex
597645	4607131425410	Gardex Extreme (2014) мини спрей от комаров 14ml Россия снято	102	Борьба с насекомыми и грызунами/Средства против насекомых	2015	Gardex
3663188	4640016742417	Gardex Extreme kkm l 0.1l sp	331155	Борьба с насекомыми и грызунами/Репеллент	2015	Gardex
3663189	027500016386	Gardex Extreme q l 0.1l sp	331155	Борьба с насекомыми и грызунами/Репеллент	2015	Gardex
37608	4607131420842	Gardex Extreme Super аэрозоль-репеллент от комаров, мошек и др.насек. 50ml /24 Россия снято	102	Борьба с насекомыми и грызунами/Средства против насекомых	2015	Gardex
3663190	4640016742660	Gardex Extreme vlk l 0.15l sp +10%fr	331155	Борьба с насекомыми и грызунами/Репеллент	2015	Gardex
2018	8032487040035	Gardex Extreme аэрозоль от клещей 200ml 32451500	102	Борьба с насекомыми и грызунами/Средства против насекомых	2015	Gardex
370743	4607131422136	Gardex Extreme аэрозоль от комаров 100ml (ООО аэрозоль новомосковск)	331155	Борьба с насекомыми и грызунами/Репеллент	2015	Gardex
2017	8032487040165	Gardex Extreme аэрозоль от комаров 50ml	102	Борьба с насекомыми и грызунами/Средства против насекомых	2015	Gardex
2019	8032487040028	Gardex Extreme аэрозоль-репеллент от комаров 100ml + пластины raptor нф	102	Борьба с насекомыми и грызунами/Средства против насекомых	2015	Gardex
1903139	4607131428299	Gardex Extreme аэрозоль-репеллент от комаров и мошки (vanilla screen) 100ml /24 Россия	102	Борьба с насекомыми и грызунами/Средства против насекомых	2015	Gardex
37607	4607131420835	Gardex Extreme аэрозоль-репеллент от мошек 100ml /24 Россия	102	Борьба с насекомыми и грызунами/Средства против насекомых	2015	Gardex
4816263	8021032714910	Gardex Extreme спирали от комаров №10 в банке	241824	Лекарственные средства (folder)/Аптека	2015	Gardex
2033	4606517000746	Gardex Extreme спирали-стик от комаров №3	102	Борьба с насекомыми и грызунами/Средства против насекомых	2015	Gardex
370744	4607131424116	Gardex Extreme спрей от клещей 250ml /24 Россия	331155	Борьба с насекомыми и грызунами/Репеллент	2015	Gardex
1475270	4607131425366	Gardex Extreme стержень от комаров малодымный 5шт (защита до 6 часов) /24 Китай	102	Борьба с насекомыми и грызунами/Средства против насекомых	2015	Gardex
370745	4607131422143	Gardex Family (2014) Natural спрей от комаров на натуральной основе 100ml /24 Россия	331155	Борьба с насекомыми и грызунами/Репеллент	2015	Gardex
597647	4607131425427	Gardex Family (2014) мини спрей от комаров 14ml росия	102	Борьба с насекомыми и грызунами/Средства против насекомых	2015	Gardex
2021	8032487040172	Gardex Family 2в1 от комаров + после укусов туба Крем-гель+ бальзам 25ml	102	Борьба с насекомыми и грызунами/Средства против насекомых	2015	Gardex
3663191	4607131422297	Gardex Family q fam cg 0.05l tu 30%of.pr.	331155	Борьба с насекомыми и грызунами/Репеллент	2015	Gardex
3663192	027510016383	Gardex Family q fam l 0.15l sp	331155	Борьба с насекомыми и грызунами/Репеллент	2015	Gardex
3663193	070060800025	Gardex Family q fam l 0.15l sp #2	331155	Борьба с насекомыми и грызунами/Репеллент	2015	Gardex
3663194	194520016389	Gardex Family q fam l 0.15l sp #3	331155	Борьба с насекомыми и грызунами/Репеллент	2015	Gardex
3663195	4607131422167	Gardex Family q fam l 0.1l spm	331155	Борьба с насекомыми и грызунами/Репеллент	2015	Gardex
3663197	8411799030413	Gardex Family аэрозоль репеллент мет/аэр с ал-вера 150ml	102	Борьба с насекомыми и грызунами/Средства против насекомых	2015	Gardex
4816260	4607131422174	Gardex Family аэрозоль-репел от комаров 125ml/промо	241824	Лекарственные средства (folder)/Аптека	2015	Gardex
2016	8032487040011	Gardex Family аэрозоль-репеллент 150ml + пластины raptor новая формула	102	Борьба с насекомыми и грызунами/Средства против насекомых	2015	Gardex
453414	4607131424444	Gardex Family аэрозоль-репеллент от комаров экономия 30% 125ml	331155	Борьба с насекомыми и грызунами/Репеллент	2015	Gardex
2020	4606517000807	Gardex Family бальзам после укусов 8ml спрей 0104	102	Борьба с насекомыми и грызунами/Средства против насекомых	2015	Gardex
597646	4607131425434	Gardex Family бальзам после укусов насекомых ролик 7ml мята, лаванда	1	Неклассифицированные/default	2015	Gardex
370747	4607131422181	Gardex Family бальзам-стик после укусов /24 Россия	348632	Борьба с насекомыми и грызунами/Средство от укусов насекомых	2015	Gardex
3663198	5410673052018	Gardex Family Крем от ком.туб.75ml	102	Борьба с насекомыми и грызунами/Средства против насекомых	2015	Gardex
2024	8032487040196	Gardex Family Крем от комаров защ.от солнца 100ml	102	Борьба с насекомыми и грызунами/Средства против насекомых	2015	Gardex
4816261	4640016743414	Gardex Family натурал спрей от комаров на натуральной основе 110ml	241824	Лекарственные средства (folder)/Аптека	2015	Gardex
2025	8032487040080	Gardex Family от комаров 60ml рол.репеллент	102	Борьба с насекомыми и грызунами/Средства против насекомых	2015	Gardex
63494	4607131420019	Gardex Family от комаров карандаш-репеллент 50ml	102	Борьба с насекомыми и грызунами/Средства против насекомых	2015	Gardex
2030	8032487040134	Gardex Family сетка от ком 130cm/150cm	102	Борьба с насекомыми и грызунами/Средства против насекомых	2015	Gardex
2032	8025051349061	Gardex Family спирали от комаров 10шт	102	Борьба с насекомыми и грызунами/Средства против насекомых	2015	Gardex
597649	4607131425373	Gardex Natural (2014) молочко от комаров на натуральной основе 75ml /24 Россия	102	Борьба с насекомыми и грызунами/Средства против насекомых	2015	Gardex
3432118	4640016742332	Gardex naturin q citrnll-extrct b patch 8pcs k	1	Неклассифицированные/default	2015	Gardex
1903141	4607131428305	Gardex naturin аэрозоль от комаров 100ml (эвкалипт+лимонник) (ООО аэрозоль новомосковск)	102	Борьба с насекомыми и грызунами/Средства против насекомых	2015	Gardex
1903140	4607131428312	Gardex naturin аэрозоль  от комаров и клещей на одежду (герань+можжевельник) 100ml /24 Россия	102	Борьба с насекомыми и грызунами/Средства против насекомых	2015	Gardex
