ID	UPCEAN	Name	CategoryID	CategoryName	BrandID	BrandName
3914506	4607130066478	Спз булочка кукурузная 60g	3780861	Продукты питания (folder)/Хлеб пшеничный	3734066	СОБСТВЕННОЕ ПРОИЗВОДСТВО
3914507	4620765040569	Спз булочка многозерновая 55g	3914477	Продукты питания (folder)/Хлеб зерновой	0	
3914508	4620765040255	Спз булочка немец.клас.пш.50g	3780861	Продукты питания (folder)/Хлеб пшеничный	3914503	БЕЙКЕРИ
3914509	4620765040286	Спз булочка немецкая класич.пшен.30g	3780861	Продукты питания (folder)/Хлеб пшеничный	3914503	БЕЙКЕРИ
3914510	4771033002823	Спз булочка плетенка с ванильной нач.70g	3620567	Продукты питания (folder)/Выпечка (мелкоштучные изделия)	3734066	СОБСТВЕННОЕ ПРОИЗВОДСТВО
3914511	4607169475401	Спз булочка пшеничная 100g	3780861	Продукты питания (folder)/Хлеб пшеничный	0	
3914512	4607169476149	Спз булочка студенческая с кунжутом 100g	3780861	Продукты питания (folder)/Хлеб пшеничный	0	
3914513	4607169476125	Спз булочка студенческая с маком 100g	3780861	Продукты питания (folder)/Хлеб пшеничный	0	
3914514	4607169473827	Спз булочка французская 50g	3780861	Продукты питания (folder)/Хлеб пшеничный	0	
3914515	4607169474244	Спз булочка французская с кунжутом 50g	3780861	Продукты питания (folder)/Хлеб пшеничный	0	
3914516	4607169472271	Спз булочка французская с луком 50g	3780861	Продукты питания (folder)/Хлеб пшеничный	0	
3914517	4607169474053	Спз булочка французская с луком 50g #2	3780861	Продукты питания (folder)/Хлеб пшеничный	0	
3914518	4620765040552	Спз булочка эльзаская ржаная 58g	3914486	Продукты питания (folder)/Хлеб ржано-пшеничный	0	
3914519	4620765040378	Спз витушка с шоколадом 85g	3620567	Продукты питания (folder)/Выпечка (мелкоштучные изделия)	3914503	БЕЙКЕРИ
3914520	4620765040064	Спз дк бейкери багет ржаной 220g	3914486	Продукты питания (folder)/Хлеб ржано-пшеничный	3914503	БЕЙКЕРИ
3914522	4620765040149	Спз дк бейкери хлеб новодвор 500g	3780861	Продукты питания (folder)/Хлеб пшеничный	3914503	БЕЙКЕРИ
3914524	4620765040217	Спз дк бейкери чиабатта с томатами 100g	3914523	Продукты питания (folder)/Хлеб этнический	3914503	БЕЙКЕРИ
3914529	4620765040415	Спз дкбейкери багет 5 злак.на камн.225g	3914477	Продукты питания (folder)/Хлеб зерновой	3914503	БЕЙКЕРИ
3914530	4620765040491	Спз дкбейкери булка семейная 220g	3780861	Продукты питания (folder)/Хлеб пшеничный	3914503	БЕЙКЕРИ
3914525	4620765040613	Спз дкбейкери косичка с маскарп/малин.90g	3620567	Продукты питания (folder)/Выпечка (мелкоштучные изделия)	3914503	БЕЙКЕРИ
3914528	4620765040347	Спз дкбейкери круассан с абрик.нач.110g	3620567	Продукты питания (folder)/Выпечка (мелкоштучные изделия)	3914503	БЕЙКЕРИ
3914531	4620765040811	Спз дкбейкери мини-кекс шоколадный 75g	264799	Продукты питания (folder)/Кондитерские изделия (folder)/Кекс	3914503	БЕЙКЕРИ
3914527	4620765040859	Спз дкбейкери слойка с франц.ветч/сыр.125g	3620567	Продукты питания (folder)/Выпечка (мелкоштучные изделия)	3914503	БЕЙКЕРИ
3914533	4620765040842	Спз дкбейкери сэндвич барбекю 140g	3620567	Продукты питания (folder)/Выпечка (мелкоштучные изделия)	3914503	БЕЙКЕРИ
3914534	4620765040835	Спз дкбейкери сэндвич гавайский 140g	3620567	Продукты питания (folder)/Выпечка (мелкоштучные изделия)	3914503	БЕЙКЕРИ
3914535	4620765040606	Спз дкбейкери твистер карибский 90g	3620567	Продукты питания (folder)/Выпечка (мелкоштучные изделия)	3914503	БЕЙКЕРИ
3914536	4620765040651	Спз дкбейкери трубочка с бананом 95g	3620567	Продукты питания (folder)/Выпечка (мелкоштучные изделия)	3914503	БЕЙКЕРИ
3914537	4620765040668	Спз дкбейкери трубочка с помадкой 90g	3620567	Продукты питания (folder)/Выпечка (мелкоштучные изделия)	3914503	БЕЙКЕРИ
3914538	4013552002732	Спз круассан бамбергский 75g	3620567	Продукты питания (folder)/Выпечка (мелкоштучные изделия)	0	
3914539	4620765040576	Спз круассан с миндалем 75g	3620567	Продукты питания (folder)/Выпечка (мелкоштучные изделия)	3914503	БЕЙКЕРИ
3914540	4013552003944	Спз круассан Французский на масле 55g	3620567	Продукты питания (folder)/Выпечка (мелкоштучные изделия)	0	
3914541	4771033001574	Спз круассан Французский на масле 55g #2	3620567	Продукты питания (folder)/Выпечка (мелкоштучные изделия)	3734066	СОБСТВЕННОЕ ПРОИЗВОДСТВО
3914542	4771033001727	Спз пирожок мини с яблочной начин.50g	3620567	Продукты питания (folder)/Выпечка (мелкоштучные изделия)	3734066	СОБСТВЕННОЕ ПРОИЗВОДСТВО
3914543	4771033226946	Спз пирожок с вишнями 85g	3620567	Продукты питания (folder)/Выпечка (мелкоштучные изделия)	3734066	СОБСТВЕННОЕ ПРОИЗВОДСТВО
3914544	4771033003653	Спз пирожок слоеный с нач.из слив 70g	3620567	Продукты питания (folder)/Выпечка (мелкоштучные изделия)	3734066	СОБСТВЕННОЕ ПРОИЗВОДСТВО
3914545	4771033003363	Спз пирожок слоеный с яблочной нач.70g	3620567	Продукты питания (folder)/Выпечка (мелкоштучные изделия)	3734066	СОБСТВЕННОЕ ПРОИЗВОДСТВО
3914546	4607130065471	Спз пирожок столичный с картошк/гриб.65g	3620567	Продукты питания (folder)/Выпечка (мелкоштучные изделия)	0	
3914547	4607130063446	Спз пирожок столичный с мясом 65g	3620567	Продукты питания (folder)/Выпечка (мелкоштучные изделия)	0	
3914548	4607130063620	Спз пирожок столичный с мясом 65g #2	3620567	Продукты питания (folder)/Выпечка (мелкоштучные изделия)	0	
3914549	4607130065372	Спз пирожок столичный с мясом 65g #3	3620567	Продукты питания (folder)/Выпечка (мелкоштучные изделия)	0	
3914550	4607130065815	Спз полубагет злаковый 140g	3780861	Продукты питания (folder)/Хлеб пшеничный	3734066	СОБСТВЕННОЕ ПРОИЗВОДСТВО
3914552	4771033002373	Спз пончик с банан.начинкой 50g	271140	Продукты питания (folder)/Пирожки, пончики, чебуреки	3701871	MANTINGA
3914553	4607169475845	Спз слойка дрож.с шоколадным кремом 70g	3620567	Продукты питания (folder)/Выпечка (мелкоштучные изделия)	0	
3914554	4607169476705	Спз слойка дрож.с шоколадным кремом 70g #2	3620567	Продукты питания (folder)/Выпечка (мелкоштучные изделия)	0	
3914555	4607007726245	Спз слойка с вишней 105g	3620567	Продукты питания (folder)/Выпечка (мелкоштучные изделия)	3734066	СОБСТВЕННОЕ ПРОИЗВОДСТВО
3914556	4607007726252	Спз слойка с картофелем и грибами 105g	3620567	Продукты питания (folder)/Выпечка (мелкоштучные изделия)	3734066	СОБСТВЕННОЕ ПРОИЗВОДСТВО
3914557	4607007726269	Спз слойка с клубникой 105g	3620567	Продукты питания (folder)/Выпечка (мелкоштучные изделия)	3734066	СОБСТВЕННОЕ ПРОИЗВОДСТВО
3914558	4607007726276	Спз слойка с малиной 105g	3620567	Продукты питания (folder)/Выпечка (мелкоштучные изделия)	3734066	СОБСТВЕННОЕ ПРОИЗВОДСТВО
3914559	4607007726283	Спз слойка с мясом 105g	3620567	Продукты питания (folder)/Выпечка (мелкоштучные изделия)	3734066	СОБСТВЕННОЕ ПРОИЗВОДСТВО
3914560	4607007726290	Спз слойка с сыром 105g	3620567	Продукты питания (folder)/Выпечка (мелкоштучные изделия)	3734066	СОБСТВЕННОЕ ПРОИЗВОДСТВО
3914561	4607007726429	Спз сосиска в тесте 105g	3620567	Продукты питания (folder)/Выпечка (мелкоштучные изделия)	3734066	СОБСТВЕННОЕ ПРОИЗВОДСТВО
3914562	4607130060735	Спз струдель-стийк с клубникой 65g	3620567	Продукты питания (folder)/Выпечка (мелкоштучные изделия)	3734066	СОБСТВЕННОЕ ПРОИЗВОДСТВО
1816016	4607130060704	Спз струдель-стийк с яблоком 65g	38561	Продукты питания (folder)/Кондитерские изделия (folder)/Кондитерские изделия мучные	3734066	СОБСТВЕННОЕ ПРОИЗВОДСТВО
3914563	4620765040828	Спз сэндвич пепперони 140g	3620567	Продукты питания (folder)/Выпечка (мелкоштучные изделия)	3914503	БЕЙКЕРИ
3914564	4620765040538	Спз фокаччо 385g	3914523	Продукты питания (folder)/Хлеб этнический	0	
3914565	4620765040484	Спз хлеб 5 злаков на камнях 575g	3914477	Продукты питания (folder)/Хлеб зерновой	0	
3914595	4771033138492	Спз хлеб ciabatta темн.итальянс.с олив.410	3914523	Продукты питания (folder)/Хлеб этнический	3734066	СОБСТВЕННОЕ ПРОИЗВОДСТВО
3914566	4771033138478	Спз хлеб ciabatta темный итал.с папр.410	3914523	Продукты питания (folder)/Хлеб этнический	3734066	СОБСТВЕННОЕ ПРОИЗВОДСТВО
3914567	4028584156216	Спз хлеб андреевский 60g	3914486	Продукты питания (folder)/Хлеб ржано-пшеничный	0	
3914568	4771033001222	Спз хлеб аппетитный 395g	3780861	Продукты питания (folder)/Хлеб пшеничный	0	
3914569	4607169475524	Спз хлеб байкальский 290g	3914486	Продукты питания (folder)/Хлеб ржано-пшеничный	0	
3914570	4607169472479	Спз хлеб венгерский домашн.с луком 400g	3914486	Продукты питания (folder)/Хлеб ржано-пшеничный	0	
3914571	4607169475111	Спз хлеб венский 250g	3780861	Продукты питания (folder)/Хлеб пшеничный	0	
3914572	4607169474978	Спз хлеб гречневый 300g	3780861	Продукты питания (folder)/Хлеб пшеничный	0	
3914573	4607169471939	Спз хлеб деревенский 450g	3914486	Продукты питания (folder)/Хлеб ржано-пшеничный	0	
3914574	4620765040453	Спз хлеб деревенский на камнях 575g	3780861	Продукты питания (folder)/Хлеб пшеничный	0	
3914575	4607169475159	Спз хлеб домашний 250g	3780861	Продукты питания (folder)/Хлеб пшеничный	0	
3914576	4620765040132	Спз хлеб зерн.с овс.хлоп.500g	3914477	Продукты питания (folder)/Хлеб зерновой	3914503	БЕЙКЕРИ
3914577	4607169476965	Спз хлеб карловацкий с отрубями 300g	3780861	Продукты питания (folder)/Хлеб пшеничный	0	
3914578	4607169472677	Спз хлеб кукурузный 300g	3780861	Продукты питания (folder)/Хлеб пшеничный	0	
3914579	4607169475029	Спз хлеб луковый 200g	3780861	Продукты питания (folder)/Хлеб пшеничный	0	
3914580	4607130066393	Спз хлеб льняной 300g	3914477	Продукты питания (folder)/Хлеб зерновой	3734066	СОБСТВЕННОЕ ПРОИЗВОДСТВО
3914581	4607130066447	Спз хлеб маратон 300g	3914486	Продукты питания (folder)/Хлеб ржано-пшеничный	3734066	СОБСТВЕННОЕ ПРОИЗВОДСТВО
3914582	4607169475586	Спз хлеб полезный 300g	3914486	Продукты питания (folder)/Хлеб ржано-пшеничный	0	
3914583	4771033001239	Спз хлеб Премиум 395g	3780861	Продукты питания (folder)/Хлеб пшеничный	0	
3914584	4620765040446	Спз хлеб пшен.с медом/орех.на камн.370g	3780861	Продукты питания (folder)/Хлеб пшеничный	0	
3914585	4620765040156	Спз хлеб с амарантусом 400g	3780861	Продукты питания (folder)/Хлеб пшеничный	3914503	БЕЙКЕРИ
3914586	4607169475043	Спз хлеб трапезный 400g	3780861	Продукты питания (folder)/Хлеб пшеничный	0	
1816037	4607130060445	Спз хлеб финский ржаной 500g	40119	Продукты питания (folder)/Хлебо-булочные изделия	0	
3914587	4607169475494	Спз хлеб фокаччо с базиликом 210g	3914523	Продукты питания (folder)/Хлеб этнический	0	
3914588	4607169475470	Спз хлеб фокаччо с оливками 250g	3914523	Продукты питания (folder)/Хлеб этнический	0	
3914589	4607169475456	Спз хлеб фокаччо с томатом/сыром 250g	3914523	Продукты питания (folder)/Хлеб этнический	0	
3914590	4620765040460	Спз хлеб хуторской на камнях 575g	3780861	Продукты питания (folder)/Хлеб пшеничный	0	
3914591	4607169475067	Спз хлеб чайный с изюмом 400g	3914486	Продукты питания (folder)/Хлеб ржано-пшеничный	0	
3914592	4607169473469	Спз хлеб чиабатта с оливками 220g	3914523	Продукты питания (folder)/Хлеб этнический	0	
3914593	4607169474756	Спз хлеб чиабатта с паприкой 220g	3914523	Продукты питания (folder)/Хлеб этнический	0	
3914594	4607130065068	Спз хлеб эльзаский 400g	3914486	Продукты питания (folder)/Хлеб ржано-пшеничный	3734066	СОБСТВЕННОЕ ПРОИЗВОДСТВО
5739599	9785353088318	Спи, моя радость, усни (колыбельные) (поющиекн) 40241613	5117045	Полиграфия (folder)/Книги-игры	0	
13806	5010182988428	Спиpаль raid от комаpов 2шт	102	Борьба с насекомыми и грызунами/Средства против насекомых	13792	Raid
5081257	9785090727938	Спивак тысяча и одна задача по математике книга для учащихся 5-7класс (переработка)	4884492	Полиграфия (folder)/Учебное пособие (folder)/Учебник Математика	4969304	Просвещение
525169	4607112090408	Спидометр велосипедный хн-0108-2 14-функций	334627	Спорт и отдых (folder)/Велосипед (folder)/Велосипедные аксессуары	0	
525171	8901664000844	Спизеф пор. для п ин. 1500mg фл №1	1	Неклассифицированные/default	0	
525172	8901664000837	Спизеф пор. для п ин. 750mg фл №1	1	Неклассифицированные/default	0	
525173	8901664000783	Спизеф табл покр обол 0.25g №10	210391	Лекарственные средства (folder)/Лекарственные средства	0	
525174	8901664000806	Спизеф табл покр обол 0.5g №10	210391	Лекарственные средства (folder)/Лекарственные средства	0	
5739600	4250046815151	Спикерный klotz sc3-02sw	1	Неклассифицированные/default	0	
5739601	194644018986	Спикерфон anker powerconf a 3301g 11	5290754	камеры и системы вкс	5121428	anker
5739603	6971337720159	Спикерфон emeet officecore m2 emeet m2	5244281	аудио для конференц связи	5739602	emeet
5739604	194850497100	Спикерфон hp 2d799AA (2d799AA)	5117182	компьютерная периферия	0	
5739605	194850497193	Спикерфон hp simba blk bt speaker (2d802AA)	5117182	компьютерная периферия	0	
5739606	194850497223	Спикерфон hp simba Blue bt speaker (2d803AA)	5117182	компьютерная периферия	0	
5739607	5706991013153	Спикерфон jabra speak 410 uc 7410-209	5244281	аудио для конференц связи	1661324	JABRA
5172790	5706991014839	Спикерфон jabra speak 510 ms (7510-109)	5118681	Акустика портативная	1661324	JABRA
5172793	5706991014846	Спикерфон jabra speak 510 uc 7510-209	5118681	Акустика портативная	1661324	JABRA
5172792	5706991016291	Спикерфон jabra speak 510+ ms 7510-309	5172791	комплектующие для систем конференций	1661324	JABRA
5739608	5706991016307	Спикерфон jabra speak 510+ uc 7510-409	5244281	аудио для конференц связи	1661324	JABRA
5172794	5706991020359	Спикерфон jabra speak 710 ms 7710-309	5117028	Акустика - умные колонки	1661324	JABRA
5739609	5706991020366	Спикерфон jabra speak 710 uc 7710-409	5244281	аудио для конференц связи	1661324	JABRA
5739610	5706991023404	Спикерфон jabra speak 750 ms 7700-309	5244281	аудио для конференц связи	1661324	JABRA
5172795	5706991023428	Спикерфон jabra speak 750 uc 7700-409	5118681	Акустика портативная	1661324	JABRA
5739611	5706991018448	Спикерфон jabra speak 810 ms 7810-109	5244281	аудио для конференц связи	1661324	JABRA
5739612	017229162945	Спикерфон plantronics calisto 3200 (210900-01)	5244281	аудио для конференц связи	1661337	PLANTRONICS
5739614	017229172432	Спикерфон plantronics sync 20+, sy20 216865-01	5244281	аудио для конференц связи	1661337	PLANTRONICS
5739613	017229172449	Спикерфон plantronics sync 20, sy20-m (216866-01)	5244281	аудио для конференц связи	1661337	PLANTRONICS
5739615	6938818305489	Спикерфон uc yealink cp700 uc	5118576	сетевое оборудование	0	
5739617	6938818305533	Спикерфон uc yealink cp900 with dongle uc	5118576	сетевое оборудование	0	
5234503	6938818304376	Спикерфон yealink cp700	5144830	ip-телефония	2759364	Yealink
5739616	6938818305540	Спикерфон yealink cp700 with dongle uc Silver	5118576	сетевое оборудование	2759364	Yealink
5739618	5706991018455	Спикерфон беспроводной jabra speak 810 uc черный 7810-209	5244281	аудио для конференц связи	1661324	JABRA
5739619	017229171572	Спикерфон беспроводной plantronics calisto 5300 (215496-01)	5244281	аудио для конференц связи	1661337	PLANTRONICS
5739620	6938818305519	Спикерфон для microsoft teams yealink cp700 teams	5118576	сетевое оборудование	0	
5739621	6938818305526	Спикерфон для microsoft teams yealink cp700 with dongle teams	5118576	сетевое оборудование	0	
5739622	6938818305496	Спикерфон для microsoft teams yealink cp900 teams	5118576	сетевое оборудование	0	
5739623	6938818305502	Спикерфон для microsoft teams yealink cp900 with dongle teams	5118576	сетевое оборудование	0	
4856125	8998898153248	Спилантра №45 капс	241824	Лекарственные средства (folder)/Аптека	0	
5081258	9785346009214	Спилсбери р. и л жизненный цикл земноводных (мнемозина)	1	Неклассифицированные/default	0	
5081259	9785346009245	Спилсбери р. и л жизненный цикл насекомых (мнемозина)	1	Неклассифицированные/default	0	
5081260	9785346009238	Спилсбери р. и л жизненный цикл рыб (мнемозина)	1	Неклассифицированные/default	0	
5739624	4630088335938	Спимвсе получехол непромокаемый аква-стоп 90x200	5121398	Наматрасник	0	
5740146	9785001460695	Спин-продажи 40246818	4892713	Полиграфия (folder)/Книги по теме Экономика и бизнес	0	
3537723	4680259061821	Спининг azor файберглас/неопрен телескоп 2.1m	1	Неклассифицированные/default	0	
525176	4603299031890	Спининг King fisher телескоп 1.8m 20-40g файберглас/неопрен /Китай	241624	Спорт и отдых (folder)/Рыбалка (folder)/Удилище	0	
5739625	5905197190938	Спинка для санок prosperplast seat 1 Blue (синий) (iseat1-3005u)	1	Неклассифицированные/default	5203503	prosperplast
5739627	5905197094182	Спинка для санок prosperplast seat 1 Green (зеленый) iseat1-361c	5331422	санки и аксессуары	5203503	prosperplast
5203558	5905197094199	Спинка для санок prosperplast seat 1 Red (красный) iseat1-1788c	2506071	Спорт и отдых (folder)/Санки	5203503	prosperplast
1975845	4811163005001	Спинка дружба цыпл. бройл. зам лоток вес	1	Неклассифицированные/default	0	
3537725	4607022886900	Спинка Золотая тетра минтая вяленая 100g	1	Неклассифицированные/default	0	
1313265	4812095002298	Спинка индейки замороженная Беларусь фермерское хозяйство островецкое	1	Неклассифицированные/default	0	
2930616	4607155337171	Спинка индейки копчено-вареная, вакуумный пакет, охлажденная	1	Неклассифицированные/default	0	
2930617	4607155337164	Спинка индейки копчено-вареная, монолит охлажденная	1	Неклассифицированные/default	0	
2930618	4650100430946	Спинка индейки охлажденная	1	Неклассифицированные/default	0	
2930620	468000326306	Спинка минтая сушеная 70g сухогруз	1	Неклассифицированные/default	0	
2930619	4680003262306	Спинка минтая сушено-вяленая (70g) 40шт перекресток	1	Неклассифицированные/default	550205	Сухогруз
2260008	6407970003507	Спинка свиная в/к нар.120g корпела	1183382	Продукты питания (folder)/Мясные продукты	37435	Корпела
121641	6379745001301	Спинка свиная к/в нар.130g корпела	1183382	Продукты питания (folder)/Мясные продукты	37435	Корпела
3537727	4607158210617	Спинка трески 20g арт. 40 042	1	Неклассифицированные/default	0	
1299784	4820111211081	Спинка трески морские, сушеные, 36g, м/у	1	Неклассифицированные/default	0	
