ID	UPCEAN	Name	CategoryID	CategoryName	BrandID	BrandName
4205850	715187766020	Cd ketchum, hal every Little word	4093300	Медиа (folder)/Media	0	
4205851	715187779723	Cd ketchum, hal greatest hits	4093300	Медиа (folder)/Media	0	
4205852	715187870727	Cd ketchum, hal Lucky man	4093300	Медиа (folder)/Media	0	
4205853	715187745025	Cd ketchum, hal past the point of rescue	4093300	Медиа (folder)/Media	0	
4205854	715187758124	Cd ketchum, hal sure Love	4093300	Медиа (folder)/Media	0	
1862018	8717185380378	Cd keune balm 200ml	1	Неклассифицированные/default	0	
4205855	634479428128	Cd kevin allred gasping for breath	4093300	Медиа (folder)/Media	0	
4205856	634479280023	Cd kevin atwood blessed be	4093300	Медиа (folder)/Media	0	
4205857	634479024047	Cd kevin ayers alive in California	4093300	Медиа (folder)/Media	0	
4205858	634479451928	Cd kevin beadles band modoc street sessions	4093300	Медиа (folder)/Media	0	
4205859	025041100427	Cd kevin braheny galaxies	4093300	Медиа (folder)/Media	0	
4205860	634479804625	Cd kevin brown mojave dust	4093300	Медиа (folder)/Media	0	
4205861	669910736722	Cd kevin caffrey packaged to Play	4093300	Медиа (folder)/Media	0	
4205862	634479233425	Cd kevin douglas wright what the hail you talkin bout	4093300	Медиа (folder)/Media	0	
4205863	781484900825	Cd kevin drumm comedy	4093300	Медиа (folder)/Media	0	
4205864	620953024429	Cd kevin Fox band miles above the mainland	4093300	Медиа (folder)/Media	0	
4205865	634479886423	Cd kevin gaffney trumpet patriotic songs volume 1	4093300	Медиа (folder)/Media	0	
4205866	634479886324	Cd kevin gaffney trumpet traditional Christian hymns volume 1	4093300	Медиа (folder)/Media	0	
4205867	782356040120	Cd kevin gilbert thud	4093300	Медиа (folder)/Media	0	
4205868	783707801926	Cd kevin griffin Red skies	4093300	Медиа (folder)/Media	0	
4205869	687474026325	Cd kevin hannan bridge to atlantis	4093300	Медиа (folder)/Media	0	
4205870	751937186120	Cd kevin hendrickson ship to shore	4093300	Медиа (folder)/Media	0	
4205871	665294200125	Cd kevin henry one's own place, a Family tradition	1	Неклассифицированные/default	0	
4205872	783707441528	Cd kevin hiatt another look at the sunrise	4093300	Медиа (folder)/Media	0	
4205873	634479353628	Cd kevin hicks Life and the drum ... the road back Home	4093300	Медиа (folder)/Media	0	
4205874	829757464527	Cd kevin huffman i was there	4093300	Медиа (folder)/Media	0	
4205875	683884033823	Cd kevin jacks band kevin jacks band	4093300	Медиа (folder)/Media	0	
4205876	783707602424	Cd kevin jacobson beyond the veil	4093300	Медиа (folder)/Media	0	
4205877	625989151927	Cd kevin kammeraad and friends the tomato collection	4093300	Медиа (folder)/Media	0	
4205878	634479843228	Cd kevin kelly aquannette	4093300	Медиа (folder)/Media	0	
4205879	046286263722	Cd kevin kern endless Blue sky	4093300	Медиа (folder)/Media	0	
4205880	046286263326	Cd kevin kern imagination???s Light	4093300	Медиа (folder)/Media	0	
4205881	750458316429	Cd kevin kirk symbols of harmony	4093300	Медиа (folder)/Media	0	
4205882	634479046124	Cd kevin kull years in the making	4093300	Медиа (folder)/Media	0	
4205883	775020150720	Cd kevin laliberte elation	4093300	Медиа (folder)/Media	0	
4205884	826572000121	Cd kevin lockhart get a grip	4093300	Медиа (folder)/Media	0	
4205885	634479823824	Cd kevin lux kevin lux	4093300	Медиа (folder)/Media	0	
4205886	634479507328	Cd kevin lux would you stand in Line for this?	4093300	Медиа (folder)/Media	0	
4205887	075678373022	Cd kevin lyttle kevin lyttle	4093300	Медиа (folder)/Media	0	
4205888	829757313528	Cd kevin m. buck initiation	4093300	Медиа (folder)/Media	0	
4205889	634479114526	Cd kevin m. Thomas chamber music collections	4093300	Медиа (folder)/Media	0	
4205890	634479594922	Cd kevin m. Thomas piano collections	4093300	Медиа (folder)/Media	0	
4205891	625989313622	Cd kevin macklin holy Spirit	4093300	Медиа (folder)/Media	0	
4205892	747313111565	Cd kevin mallon handel Water music	4093300	Медиа (folder)/Media	0	
4205893	724382529026	Cd kevin Max stereotype be	4093300	Медиа (folder)/Media	0	
4205894	786851002829	Cd kevin mccluskey trust	4093300	Медиа (folder)/Media	0	
4205895	733792449824	Cd kevin mckinney talking to plants	4093300	Медиа (folder)/Media	0	
4205896	783707763224	Cd kevin mcleod the road Home	4093300	Медиа (folder)/Media	0	
4205897	634479743528	Cd kevin Michael coming Home	4093300	Медиа (folder)/Media	0	
4205898	634479431128	Cd kevin midgley closed for the season	4093300	Медиа (folder)/Media	0	
4205899	783707823829	Cd kevin mileski which way did he turn?	4093300	Медиа (folder)/Media	0	
4205900	634479565328	Cd kevin moynahan reflections	4093300	Медиа (folder)/Media	0	
4205901	634479273421	Cd kevin o'brien flickering moment	4093300	Медиа (folder)/Media	0	
4205902	634479199929	Cd kevin parlor bassically speaking	4093300	Медиа (folder)/Media	0	
4205903	648035001021	Cd kevin pike and John kotchian fractured intuition	4093300	Медиа (folder)/Media	0	
4205904	648035000925	Cd kevin pike big ol chunka funk	4093300	Медиа (folder)/Media	0	
4205905	648035000123	Cd kevin pike i	4093300	Медиа (folder)/Media	0	
4205906	648035000529	Cd kevin pike microjazz	4093300	Медиа (folder)/Media	0	
4205907	648035005296	Cd kevin pike microjazz #2	4093300	Медиа (folder)/Media	0	
4205908	648035001229	Cd kevin pike podcast music	4093300	Медиа (folder)/Media	0	
4205909	648035000826	Cd kevin pike wachet auf und spielt das saxophon	4093300	Медиа (folder)/Media	0	
4205910	812517012595	Cd kevin rogers breaking idols	4093300	Медиа (folder)/Media	0	
4205911	602517901452	Cd kevin rudolf in the city	4093300	Медиа (folder)/Media	0	
4205912	802560100820	Cd kevin saunderson history elevate	4093300	Медиа (folder)/Media	0	
4205913	634479054921	Cd kevin scott the western sky	4093300	Медиа (folder)/Media	0	
4205914	821987778726	Cd kevin sharp make a wish	4093300	Медиа (folder)/Media	0	
4205915	620953028823	Cd kevin sharpe introducing kevin sharpe, pianist, opus 1 no. 1	4093300	Медиа (folder)/Media	0	
4205916	786851697728	Cd kevin so individual (1997)	4093300	Медиа (folder)/Media	0	
4205917	786851698527	Cd kevin so leaving the lights on (2003)	4093300	Медиа (folder)/Media	0	
4205918	081227844424	Cd kevin spacey beyond the sea	4093300	Медиа (folder)/Media	0	
4205919	659696017221	Cd kevin stonerock stranger in this town	4093300	Медиа (folder)/Media	0	
4205920	825165555550	Cd kevin stout&brian booth 5 Good pals	4093300	Медиа (folder)/Media	0	
4205921	075678345623	Cd kevin tihista's Red terror don't breathe a word	4093300	Медиа (folder)/Media	0	
4205922	634479633027	Cd kevin tyler look who has the last laugh now	4093300	Медиа (folder)/Media	0	
4205923	783707510224	Cd kevin winkel coming of the dawn	4093300	Медиа (folder)/Media	0	
4205924	783707645728	Cd kevin winkel walking on Water	4093300	Медиа (folder)/Media	0	
4205925	711517650922	Cd kevin Wood haven't had enough	4093300	Медиа (folder)/Media	0	
4205926	783707843629	Cd kevin Wood stray Dog	4093300	Медиа (folder)/Media	0	
4205927	649544058223	Cd kevin wyglad high road	4093300	Медиа (folder)/Media	0	
4205928	783707496122	Cd kevinmcgowan when i was a young man	4093300	Медиа (folder)/Media	0	
4205929	634479308925	Cd kevo the Life i live	4093300	Медиа (folder)/Media	0	
4205930	634479797422	Cd kevoz canvas	4093300	Медиа (folder)/Media	0	
4205931	634479796029	Cd kevoz lakefront	4093300	Медиа (folder)/Media	0	
4205932	634479192920	Cd kevyn lettau the Color of Love	4093300	Медиа (folder)/Media	0	
4205933	634479192821	Cd kevyn lettau walking in your footsteps	4093300	Медиа (folder)/Media	0	
4205934	3259119057123	Cd key motion automatic Love	4093300	Медиа (folder)/Media	0	
4205935	354621071469	Cd key to the highway by big bill broonzy	4093300	Медиа (folder)/Media	0	
4205936	634479151125	Cd keydragon awaken the lair	4093300	Медиа (folder)/Media	0	
4205937	634479190322	Cd keydragon drink from the waters of war	4093300	Медиа (folder)/Media	0	
4205938	634479190223	Cd keydragon solo piano pieces	4093300	Медиа (folder)/Media	0	
4205939	875365559148	Cd keylow celestial experience	4093300	Медиа (folder)/Media	0	
4205940	804663409527	Cd keys of knowledge flowetry	4093300	Медиа (folder)/Media	0	
4205941	743219135926	Cd keys, alicia a woman's worth	4093300	Медиа (folder)/Media	0	
4205942	743219620323	Cd keys, alicia girlfriend	4093300	Медиа (folder)/Media	0	
4205943	743219428929	Cd keys, alicia how come you don't call me?	4093300	Медиа (folder)/Media	0	
4205944	743219696229	Cd keys, alicia songs in a minor (Special edition)	4093300	Медиа (folder)/Media	0	
4205945	743219288929	Cd keys, alicia songs in a minor (uk version)	4093300	Медиа (folder)/Media	0	
4205946	602498641194	Cd keyshia cole way it is	4093300	Медиа (folder)/Media	0	
4205947	025218770323	Cd keystone encores	4093300	Медиа (folder)/Media	0	
4205948	724384720926	Cd keziah jones Liquid Sunshine	4093300	Медиа (folder)/Media	0	
4205949	634479483622	Cd kgink cosmickallage	4093300	Медиа (folder)/Media	0	
4205950	712136000525	Cd khac chi ensemble moonlight in vietnam	4093300	Медиа (folder)/Media	0	
4205951	685738923724	Cd khachaturian spartacus/gayaneh	4093300	Медиа (folder)/Media	0	
4205952	745099467722	Cd khachaturian, aram il'yich symphonic suites	4093300	Медиа (folder)/Media	0	
4205953	634479820427	Cd khaled the Bright blues	4093300	Медиа (folder)/Media	0	
4205954	720616211026	Cd khaleel people watching	4093300	Медиа (folder)/Media	0	
4205955	634479126826	Cd khamil'yon feat. sheemz&poem adaptations	4093300	Медиа (folder)/Media	0	
4205956	793018521826	Cd khan, ali Akbar Garden of dreams	4093300	Медиа (folder)/Media	0	
4205957	793018521727	Cd khan, ali Akbar journey	4093300	Медиа (folder)/Media	0	
4205958	093624586524	Cd khan, chaka best of	4093300	Медиа (folder)/Media	0	
4205959	075992570725	Cd khan, chaka c.k.	4093300	Медиа (folder)/Media	0	
4205960	075992586627	Cd khan, chaka chaka	4093300	Медиа (folder)/Media	0	
4205961	075992542524	Cd khan, chaka destiny	4093300	Медиа (folder)/Media	0	
4205962	075992516228	Cd khan, chaka i feel for you	4093300	Медиа (folder)/Media	0	
4205963	075992594622	Cd khan, chaka Life is a dance/remix project	4093300	Медиа (folder)/Media	0	
4205964	075992674720	Cd khan, chaka naughty	4093300	Медиа (folder)/Media	0	
4205965	093624378723	Cd khan, chaka never Miss the Water	4093300	Медиа (folder)/Media	0	
4205966	075992586726	Cd khan, chaka whatcha gonna do	4093300	Медиа (folder)/Media	0	
4205967	075992629621	Cd khan, chaka woman i am	4093300	Медиа (folder)/Media	0	
4205968	724381099629	Cd khan, nusrat fateh ali Body&soul	4093300	Медиа (folder)/Media	0	
4205969	077778772927	Cd khan, nusrat fateh ali devotional&Love songs	4093300	Медиа (folder)/Media	0	
4205970	724384917821	Cd khan, nusrat fateh ali dust to Gold	4093300	Медиа (folder)/Media	0	
4205971	077778622123	Cd khan, nusrat fateh ali mustt mustt	4093300	Медиа (folder)/Media	0	
4205972	724384068325	Cd khan, nusrat fateh ali Night song (with Michael brook)	4093300	Медиа (folder)/Media	0	
4205973	077778623922	Cd khan, nusrat fateh ali shahbaaz	4093300	Медиа (folder)/Media	0	
4205974	077778613626	Cd khan, nusrat fateh ali shahen shah	4093300	Медиа (folder)/Media	0	
4205975	724384491529	Cd khan, nusrat fateh ali Star rise nusrat fateh ali khan remixed	4093300	Медиа (folder)/Media	0	
4205976	724349775022	Cd khan, nusrat fateh ali swan song his final Performance	4093300	Медиа (folder)/Media	0	
4205977	724383946822	Cd khan, nusrat fateh ali the last prophet	4093300	Медиа (folder)/Media	0	
4205978	765481856422	Cd khana attitude	4093300	Медиа (folder)/Media	0	
4205979	634479207822	Cd khantoke khantoke	4093300	Медиа (folder)/Media	0	
4205980	639492000177	Cd khari lemuel morning music	4093300	Медиа (folder)/Media	0	
4205981	731452903525	Cd khun steve remembering tomorrow	4093300	Медиа (folder)/Media	0	
4205982	783707269320	Cd ki theory ki theory	4093300	Медиа (folder)/Media	0	
4205983	634479619328	Cd kia colton daydreaming	4093300	Медиа (folder)/Media	0	
4205984	634479052323	Cd kiara Hunter we can Play	4093300	Медиа (folder)/Media	0	
4205985	196658487338	Cd kiaules sakme the pig's saga	4093300	Медиа (folder)/Media	0	
4205986	634479829727	Cd kick me kate kick me kate	4093300	Медиа (folder)/Media	0	
4205987	724101904424	Cd kicked by the Dog another great Day	4093300	Медиа (folder)/Media	0	
4205988	634479292323	Cd kickin granny it's all about Life	4093300	Медиа (folder)/Media	0	
4205989	824767136525	Cd kicking a dead horse where to now	4093300	Медиа (folder)/Media	0	
4206007	109321635233	Cd kid 'n play's funhouse Original recording	4093300	Медиа (folder)/Media	0	
4205990	075992673822	Cd kid creole and the coconuts kid creole redux	4093300	Медиа (folder)/Media	0	
4205991	731458665328	Cd kid creole doppleganger (remastered)	4093300	Медиа (folder)/Media	0	
4205992	731458646020	Cd kid creole Fresh Fruit in foreign (rem	4093300	Медиа (folder)/Media	0	
4205993	731458665427	Cd kid creole off the Coast of me (remas	4093300	Медиа (folder)/Media	0	
4205994	731458646129	Cd kid creole Tropical gangsters (remast	4093300	Медиа (folder)/Media	0	
4205995	602527127521	Cd kid cudi man on the moon the end of Day	4093300	Медиа (folder)/Media	0	
4205996	602527127538	Cd kid cudi man on the moon the end of Day [clean]	4093300	Медиа (folder)/Media	0	
4205997	792258108521	Cd kid dynamite cheap shots, youth anthems	4093300	Медиа (folder)/Media	0	
4205998	706567907324	Cd kid dynamite explosion	4093300	Медиа (folder)/Media	0	
4205999	792258103922	Cd kid dynamite kid dynamite	4093300	Медиа (folder)/Media	0	
4206000	792258104523	Cd kid dynamite shorter, faster, louder	4093300	Медиа (folder)/Media	0	
4206001	625978103425	Cd kid koala carpal tunnel syndrome	4093300	Медиа (folder)/Media	0	
4206002	625978108222	Cd kid koala some of my best friends are djs	4093300	Медиа (folder)/Media	0	
4206003	4523132614823	Cd kid koala some of my best friends are djs #2	4093300	Медиа (folder)/Media	0	
4206004	3596972088728	Cd kid loco Grand Love story	4093300	Медиа (folder)/Media	0	
4206005	685738941025	Cd kid loco kill your darlings	4093300	Медиа (folder)/Media	0	
4206006	3596972088629	Cd kid loco kill your darlings #2	4093300	Медиа (folder)/Media	0	
4206008	075678989995	Cd kid Rock all summer Long	4093300	Медиа (folder)/Media	0	
4206009	075678990014	Cd kid Rock all summer Long #2	4093300	Медиа (folder)/Media	0	
4206010	075678368523	Cd kid Rock kid Rock	4093300	Медиа (folder)/Media	0	
4206011	075678391422	Cd kid Rock live trucker	4093300	Медиа (folder)/Media	0	
4206012	075678997174	Cd kid Rock rock'n'roll Jesus	4093300	Медиа (folder)/Media	0	
4206013	602527207100	Cd kid sister ultraviolet	4093300	Медиа (folder)/Media	0	
4206023	755174457029	Cd kid's dance party	4093300	Медиа (folder)/Media	0	
4206014	094922376473	Cd kiddus i rocking rebel	4093300	Медиа (folder)/Media	0	
4206015	731452452122	Cd kidjo angelique oremi	4093300	Медиа (folder)/Media	0	
4206016	731452462527	Cd kidjo angelique oremi (New version include	4093300	Медиа (folder)/Media	0	
4206017	696998579927	Cd kidjo, angelique Black ivory soul	4093300	Медиа (folder)/Media	0	
4206018	696998575820	Cd kidjo, angelique keep on moving the best of angelique kidjo	4093300	Медиа (folder)/Media	0	
4206019	606949768423	Cd kidman nicole One Day i'll fly away cdm	4093300	Медиа (folder)/Media	0	
4206020	093624810520	Cd kidneythieves zerospace	4093300	Медиа (folder)/Media	0	
4206021	671196034133	Cd kids christmas sing-along choir	4093300	Медиа (folder)/Media	0	
4206022	724356622920	Cd kids classics lullabies	4093300	Медиа (folder)/Media	0	
4206024	798936900029	Cd kids Farm educational computer Game mfg. by padmini multimedia LTD under lic. from rainbow tech us	4093300	Медиа (folder)/Media	0	
4206025	634479611926	Cd kids like us vol. 1 kids like us vol. 1	4093300	Медиа (folder)/Media	0	
4206027	738018643420	Cd kids toons Play time	4093300	Медиа (folder)/Media	0	
4206028	738018643321	Cd kids toons quiet time	4093300	Медиа (folder)/Media	0	
4206026	723721099558	Cd kids' party time includes 15 printable word search puzzles	4093300	Медиа (folder)/Media	0	
4206029	634479078224	Cd kidsplay ...and straight on till morning	4093300	Медиа (folder)/Media	0	
4206030	793018915526	Cd kidz bop kids coolest kidz bop christmas ever	4093300	Медиа (folder)/Media	0	
4206031	793018905527	Cd kidz bop kids kidz bop 2	4093300	Медиа (folder)/Media	0	
4206032	793018908320	Cd kidz bop kids kidz bop 6	4093300	Медиа (folder)/Media	0	
4206033	793018918022	Cd kidz bop kids kidz bop 80???s Gold	4093300	Медиа (folder)/Media	0	
4206034	793018905626	Cd kidz bop kids kidz bop christmas	4093300	Медиа (folder)/Media	0	
4206035	793018920629	Cd kidz bop kids kidz bop christmas [2009]	4093300	Медиа (folder)/Media	0	
4206036	793018914628	Cd kidz bop kids kidz bop country	4093300	Медиа (folder)/Media	0	
4206037	793018908221	Cd kidz bop kids kidz bop Gold	4093300	Медиа (folder)/Media	0	
4206038	793018920124	Cd kidz bop kids kidz bop greatest hits	4093300	Медиа (folder)/Media	0	
4206039	793018919029	Cd kidz bop kids kidz bop Halloween	4093300	Медиа (folder)/Media	0	
4206040	793018921527	Cd kidz bop kids kidz bop sings the beatles	4093300	Медиа (folder)/Media	0	
4206041	829757212722	Cd kierstin gray anything&everything the second edition	4093300	Медиа (folder)/Media	0	
4206042	081227090029	Cd kihn, greg band kihnsolidation	4093300	Медиа (folder)/Media	0	
4206043	623235214327	Cd kihn, greg true kihnfessions	4093300	Медиа (folder)/Media	0	
4206044	4988002509867	Cd kiko loureiro universo inverso	4093300	Медиа (folder)/Media	0	
4206045	075992469722	Cd kilgore a search for reason	4093300	Медиа (folder)/Media	0	
4206046	802867741122	Cd kilgore trout 340lb of balls	1	Неклассифицированные/default	0	
4206047	802867741429	Cd kilgore trout three	1	Неклассифицированные/default	0	
4206048	783707652023	Cd kilkenny road kilkenny road	4093300	Медиа (folder)/Media	0	
4206049	727361683429	Cd kill ii this another cross ii bare	4093300	Медиа (folder)/Media	0	
4206050	800314000921	Cd kill patrick defeat reality	4093300	Медиа (folder)/Media	0	
4206051	099923836223	Cd killa beez the sting	4093300	Медиа (folder)/Media	0	
4206052	634479356827	Cd killa meteorz ghetto Platinum	4093300	Медиа (folder)/Media	0	
4206053	823411003626	Cd killa will a.k.a. wheatie mississippi po-boy	4093300	Медиа (folder)/Media	0	
4206054	720642497128	Cd killah priest heavy mental	4093300	Медиа (folder)/Media	0	
4206055	823979901525	Cd killah priest priesthood	4093300	Медиа (folder)/Media	0	
4206056	088561192723	Cd killarmy fear Love&war	4093300	Медиа (folder)/Media	0	
4206057	859700153833	Cd killchain One more victim	4093300	Медиа (folder)/Media	0	
4206058	664980005426	Cd killer beaz killer beaz live:shaken not stirred	4093300	Медиа (folder)/Media	0	
4206059	664980016323	Cd killer beaz save up!	4093300	Медиа (folder)/Media	0	
4206060	602517067226	Cd killers sams town	4093300	Медиа (folder)/Media	0	
4206061	634479425424	Cd killing faith $Dog	4093300	Медиа (folder)/Media	0	
4206062	017046159821	Cd killing joke brighter than a thousand suns	4093300	Медиа (folder)/Media	0	
4206063	084317576021	Cd killing joke fire dances	4093300	Медиа (folder)/Media	0	
4206064	094631221620	Cd killing joke killing joke [1980/ uk bonus tracks]	4093300	Медиа (folder)/Media	0	
4206065	077778677123	Cd killing joke laugh? i nearly bought One!	4093300	Медиа (folder)/Media	0	
4206066	5099951089221	Cd killing joke Night time [bonus tracks]	4093300	Медиа (folder)/Media	0	
4206067	017046154024	Cd killing joke revelations	4093300	Медиа (folder)/Media	0	
4206068	084317575826	Cd killing joke what's this for...!	4093300	Медиа (folder)/Media	0	
4206069	724383917228	Cd killing joke wilful days	4093300	Медиа (folder)/Media	0	
4206070	731383569623	Cd killing zoe soundtrack	4093300	Медиа (folder)/Media	0	
4206071	016861805821	Cd killswitch engage as daylight dies	4093300	Медиа (folder)/Media	0	
4206072	016861788926	Cd killswitch engage killswitch engage [2009]	4093300	Медиа (folder)/Media	0	
4206073	884501100250	Cd kilted warriors	4093300	Медиа (folder)/Media	0	
4206074	077779546725	Cd Kim appleby Kim appleby (cdpcs7348)	4093300	Медиа (folder)/Media	0	
4206075	634479472022	Cd Kim archer they say i'm crazy	4093300	Медиа (folder)/Media	0	
4206076	829757254425	Cd Kim bankston my Love is here for you	4093300	Медиа (folder)/Media	0	
4206077	092193100926	Cd Kim boyce as i am CD	4093300	Медиа (folder)/Media	0	
4206078	783707514925	Cd Kim buchanan illusions	4093300	Медиа (folder)/Media	0	
4206079	625989166020	Cd Kim carson calle de orleans	4093300	Медиа (folder)/Media	0	
4206080	718751486928	Cd Kim cascone residualism	4093300	Медиа (folder)/Media	0	
4206081	634479815126	Cd Kim chambers the place i want to be	4093300	Медиа (folder)/Media	0	
4206082	9399032125623	Cd Kim cunio under eastern skies	4093300	Медиа (folder)/Media	0	
4206083	634479429422	Cd Kim dean when the Love starts growin' Old	4093300	Медиа (folder)/Media	0	
4206084	8809046083419	Cd Kim doo soo free Spirit	4093300	Медиа (folder)/Media	0	
4206085	731253035623	Cd Kim fowley another man???s Gold	4093300	Медиа (folder)/Media	0	
4206086	731253035524	Cd Kim fowley One man???s garbage	4093300	Медиа (folder)/Media	0	
4206087	783707566627	Cd Kim jones road dreams	4093300	Медиа (folder)/Media	0	
4206088	028947661498	Cd Kim kashkashian asturiana songs from spain and argentina	4093300	Медиа (folder)/Media	0	
4206089	094637723524	Cd Kim larsen&kjukken gammel hankat	4093300	Медиа (folder)/Media	0	
4206090	829757366326	Cd Kim monroe Kim monroe	4093300	Медиа (folder)/Media	0	
4206091	628740642924	Cd Kim reith trio bail!	4093300	Медиа (folder)/Media	0	
4206092	9399051797023	Cd Kim Salmon&the surrealists sin factory	4093300	Медиа (folder)/Media	0	
4206093	783707572529	Cd Kim taylor so Black, so Bright	4093300	Медиа (folder)/Media	0	
4206094	783707750828	Cd Kim townsend wayworn traveler	4093300	Медиа (folder)/Media	0	
4206095	016351516626	Cd Kim waters i want you Love in the Spirit of marvin	4093300	Медиа (folder)/Media	0	
4206096	088110625214	Cd Kim wilde Love is	4093300	Медиа (folder)/Media	0	
4206097	088110921224	Cd Kim wilde the singles collection 1981-1993	4093300	Медиа (folder)/Media	0	
4206098	724353595722	Cd Kim wilde very best of Kim wilde [emi]	4093300	Медиа (folder)/Media	0	
4206099	607735004923	Cd Kim wilson lookin??? for trouble	4093300	Медиа (folder)/Media	0	
4206100	634479114021	Cd Kim young every last drop	4093300	Медиа (folder)/Media	0	
4206101	611587102928	Cd Kim&reggie harris and magpie guide my feet	4093300	Медиа (folder)/Media	0	
4206102	611587103420	Cd Kim&reggie harris Rock of ages	4093300	Медиа (folder)/Media	0	
4206103	611587106124	Cd Kim&reggie harris simplicity	4093300	Медиа (folder)/Media	0	
4206104	611587102225	Cd Kim&reggie harris steal away songs from the underground railroad	4093300	Медиа (folder)/Media	0	
4206130	634479253027	Cd kim's fable breathless	4093300	Медиа (folder)/Media	0	
4206105	821681021227	Cd kimba arem peace journey	4093300	Медиа (folder)/Media	0	
4206106	709363675725	Cd kimberlee learning how to Love	4093300	Медиа (folder)/Media	0	
4206107	715187710320	Cd kimberley locke 8th world wonder (the remixes)	4093300	Медиа (folder)/Media	0	
4206108	715187884526	Cd kimberley locke One Love	4093300	Медиа (folder)/Media	0	
4206109	634479882029	Cd kimberly brown because i couldn't sleep...	4093300	Медиа (folder)/Media	0	
4206110	634479762727	Cd kimberly hassell kimberly hassell	4093300	Медиа (folder)/Media	0	
4206111	828631000127	Cd kimberly lord Happy	4093300	Медиа (folder)/Media	0	
4206112	687474043827	Cd kimberly lord welcome child	4093300	Медиа (folder)/Media	0	
4206113	634479748929	Cd kimberly raadt dreams&memories	4093300	Медиа (folder)/Media	0	
4206114	634479186325	Cd kimberly summer dreamer's heart	4093300	Медиа (folder)/Media	0	
4206115	783707644721	Cd kimberly wilson intermediate vinyasa yoga	4093300	Медиа (folder)/Media	0	
4206116	890846001121	Cd kimi djabate karam	4093300	Медиа (folder)/Media	0	
4206117	634479854323	Cd kimi hayes being	4093300	Медиа (folder)/Media	0	
4206118	634479848728	Cd kimi hayes porcupine girl	4093300	Медиа (folder)/Media	0	
4206119	634479848827	Cd kimi hayes shores of liberty / CD single	4093300	Медиа (folder)/Media	0	
4206120	634479849022	Cd kimi hayes simply live	4093300	Медиа (folder)/Media	0	
4206121	651027000728	Cd kimmie rhodes and willie Nelson picture in a frame	4093300	Медиа (folder)/Media	0	
4206122	651027000827	Cd kimmie rhodes lost and found	4093300	Медиа (folder)/Media	0	
4206123	651027000322	Cd kimmie rhodes Love me like a song	4093300	Медиа (folder)/Media	0	
4206124	651027000124	Cd kimmie rhodes Rich from the journey	4093300	Медиа (folder)/Media	0	
