ID	UPCEAN	Name	CategoryID	CategoryName	BrandID	BrandName
3546999	4607028400216	Сырок творожный глазированный далматин ассорти 45g #6	1318164	Продукты питания (folder)/Молочные продукты (folder)/Сырок	1678659	DALMATIN
3547000	4607028400223	Сырок творожный глазированный далматин ассорти 45g #7	1318164	Продукты питания (folder)/Молочные продукты (folder)/Сырок	1678659	DALMATIN
3547001	4607028400407	Сырок творожный глазированный далматин ассорти 45g #8	1318164	Продукты питания (folder)/Молочные продукты (folder)/Сырок	0	
3547002	4607028400414	Сырок творожный глазированный далматин ассорти 45g #9	1318164	Продукты питания (folder)/Молочные продукты (folder)/Сырок	0	
3547006	4607028400100	Сырок творожный глазированный далматин какао 45g	1318164	Продукты питания (folder)/Молочные продукты (folder)/Сырок	1678659	DALMATIN
3547007	4607028400209	Сырок творожный глазированный далматин какос 45g	1318164	Продукты питания (folder)/Молочные продукты (folder)/Сырок	1678659	DALMATIN
3547008	4607028400698	Сырок творожный глазированный далматин с джемом черная смородина 45g	1318164	Продукты питания (folder)/Молочные продукты (folder)/Сырок	1678659	DALMATIN
2936402	4607003720933	Сырок творожный глазированный картошка балтком (0406 10 500 9)	1318164	Продукты питания (folder)/Молочные продукты (folder)/Сырок	3704445	MELIKE (BALTKOM YUNI)
3919750	4606540000829	Сырок творожный глазированный китенок 23% черни 50g	1318164	Продукты питания (folder)/Молочные продукты (folder)/Сырок	0	
3919751	4606540001598	Сырок творожный глазированный китенок 23% черни 50g #2	1318164	Продукты питания (folder)/Молочные продукты (folder)/Сырок	0	
2936134	4602358001799	Сырок творожный глазированный коровка из кореновки 18%	1318164	Продукты питания (folder)/Молочные продукты (folder)/Сырок	3260274	коровка из кореновки
3546978	4602358001836	Сырок творожный глазированный коровка из кореновки 18% #2	1318164	Продукты питания (folder)/Молочные продукты (folder)/Сырок	3260274	коровка из кореновки
3546979	4602358001843	Сырок творожный глазированный коровка из кореновки 18% #3	1318164	Продукты питания (folder)/Молочные продукты (folder)/Сырок	3260274	коровка из кореновки
2936131	4602358001782	Сырок творожный глазированный коровка из кореновки с ванилином в карамельной глазури 18% 40g	1318164	Продукты питания (folder)/Молочные продукты (folder)/Сырок	3260274	коровка из кореновки
3547009	4602358003274	Сырок творожный глазированный коровка из кореновки с ванилином в карамельной глазури 18% 40g #2	1318164	Продукты питания (folder)/Молочные продукты (folder)/Сырок	3260274	коровка из кореновки
3546991	4660007980345	Сырок творожный глазированный Крем-брюле 32%	1318164	Продукты питания (folder)/Молочные продукты (folder)/Сырок	0	
2770600	4606540003219	Сырок творожный глазированный мдж 16.5% картошка три коровы два кота 0.04kg*10, гофра	1318164	Продукты питания (folder)/Молочные продукты (folder)/Сырок	0	
2770806	4606540003202	Сырок творожный глазированный мдж 16.5% с кокосом три коровы два кота 0.04kg*10, гофра	1318164	Продукты питания (folder)/Молочные продукты (folder)/Сырок	3923887	Три коровы два кота (MOLOCHNIY KIT/EKATERINBURG)
2770522	4606540003196	Сырок творожный глазированный мдж 16.5% со вкусом ванили три коровы два кота 0.04kg*10, гофра	1318164	Продукты питания (folder)/Молочные продукты (folder)/Сырок	3923887	Три коровы два кота (MOLOCHNIY KIT/EKATERINBURG)
3546992	4810397004347	Сырок творожный глазированный мягуп 50g	1318164	Продукты питания (folder)/Молочные продукты (folder)/Сырок	3707073	MOLOCHNOE RAZDOL'E (POLOTSKIY молочный KOMBINAT/BELARUS)
126073	4607016359045	Сырок творожный глазированный ростагроэкспорт картошка с орехами 20% мягуп 45g ту	1318164	Продукты питания (folder)/Молочные продукты (folder)/Сырок	99619	Ростагро
2936403	4600653110192	Сырок творожный глазированный с ароматом ванили мдж 12% молочная речка пленка, 0.035kg	1318164	Продукты питания (folder)/Молочные продукты (folder)/Сырок	0	
1318263	4602014007189	Сырок творожный глазированный с ванилином 0% 40g дмз	1318164	Продукты питания (folder)/Молочные продукты (folder)/Сырок	0	
2936233	4606450033801	Сырок творожный глазированный с ванилином в кондитерской глазури мдж 20% 38g 32шт, тз а.в.кривощеков	1318164	Продукты питания (folder)/Молочные продукты (folder)/Сырок	3607210	A.V.KRIVOTSHYOKOV (SIBIRSKIY ZD MOL.PROD./BERDSK NOVOS.OB.
2936404	4606450034396	Сырок творожный глазированный с ванилином в кондитерской глазури мдж 20% 50g 24шт, снеговичок	1318164	Продукты питания (folder)/Молочные продукты (folder)/Сырок	3624975	снеговичок (SIBIRSKIY ZD MOL.PROD./BERDSK NOVOS.OB.)
2936405	4607003720919	Сырок творожный глазированный с ванилью балтком (0406 10 500 9)	1318164	Продукты питания (folder)/Молочные продукты (folder)/Сырок	3704445	MELIKE (BALTKOM YUNI)
2936406	4606450034273	Сырок творожный глазированный с ванилью в кондитерской глазури мдж 20% 180g 6шт, снеговичок	1318164	Продукты питания (folder)/Молочные продукты (folder)/Сырок	3624975	снеговичок (SIBIRSKIY ZD MOL.PROD./BERDSK NOVOS.OB.)
2936407	4607003721367	Сырок творожный глазированный с ванилью мдж 23 % балтком (0406 10 500 9)	1318164	Продукты питания (folder)/Молочные продукты (folder)/Сырок	3619484	BALTKOM (BALTKOM YUNI)
3546982	4602117002036	Сырок творожный глазированный с вар.сгущенкой 40g рамоз	1318164	Продукты питания (folder)/Молочные продукты (folder)/Сырок	0	
2936408	4607003720926	Сырок творожный глазированный с вареной сгущенкой балтком (0406 10 500 9)	1318164	Продукты питания (folder)/Молочные продукты (folder)/Сырок	3704445	MELIKE (BALTKOM YUNI)
3546989	4607028400124	Сырок творожный глазированный с изюмом далматин 45g	1318164	Продукты питания (folder)/Молочные продукты (folder)/Сырок	1678659	DALMATIN
2936244	4602014010561	Сырок творожный глазированный с какао 26% свитлогорье 50g	1318164	Продукты питания (folder)/Молочные продукты (folder)/Сырок	3900986	Свитлогорье
2936234	4606450033795	Сырок творожный глазированный с какао в кондитерской глазури мдж 20% 38g 32шт, тз а.в.кривощеков	1318164	Продукты питания (folder)/Молочные продукты (folder)/Сырок	3607210	A.V.KRIVOTSHYOKOV (SIBIRSKIY ZD MOL.PROD./BERDSK NOVOS.OB.
2936409	4606450034372	Сырок творожный глазированный с какао и шоколадной крошкой в кондитерской глазури мдж 20% 50g 24шт, снеговичок	1318164	Продукты питания (folder)/Молочные продукты (folder)/Сырок	3624975	снеговичок (SIBIRSKIY ZD MOL.PROD./BERDSK NOVOS.OB.)
2936410	4600653110215	Сырок творожный глазированный с какао мдж 12% молочная речка пленка, 0.035kg	1318164	Продукты питания (folder)/Молочные продукты (folder)/Сырок	0	
2936411	4607003722470	Сырок творожный глазированный с какао мдж 23 % балтком (0406 10 500 9)	1318164	Продукты питания (folder)/Молочные продукты (folder)/Сырок	3619484	BALTKOM (BALTKOM YUNI)
2936238	4606450033849	Сырок творожный глазированный с какао, печеньем и вафлями трюфель шоколадный в кондитерской глазури мдж 20% 38g 32шт, тз а.в.кр	1318164	Продукты питания (folder)/Молочные продукты (folder)/Сырок	3607210	A.V.KRIVOTSHYOKOV (SIBIRSKIY ZD MOL.PROD./BERDSK NOVOS.OB.
2936412	4607003722128	Сырок творожный глазированный с карамелью (0406 10 500 9)	1318164	Продукты питания (folder)/Молочные продукты (folder)/Сырок	3619484	BALTKOM (BALTKOM YUNI)
1845120	4602014007196	Сырок творожный глазированный с клубник.40g дмз	1318164	Продукты питания (folder)/Молочные продукты (folder)/Сырок	0	
2936413	4607003721350	Сырок творожный глазированный с кокосом мдж 23 % балтком (0406 10 500 9)	1318164	Продукты питания (folder)/Молочные продукты (folder)/Сырок	3619484	BALTKOM (BALTKOM YUNI)
836852	4601751002150	Сырок творожный глазированный с кокосом мдж23% 45g /малыш/	1318164	Продукты питания (folder)/Молочные продукты (folder)/Сырок	0	
2936414	4600653110208	Сырок творожный глазированный с наполнителем со вкусом кокоса мдж 12% молочная речка пленка, 0.035kg	1318164	Продукты питания (folder)/Молочные продукты (folder)/Сырок	0	
3546990	4607028400193	Сырок творожный глазированный с печеньем далматин ассорти 45g	1318164	Продукты питания (folder)/Молочные продукты (folder)/Сырок	1678659	DALMATIN
3546976	4607028400148	Сырок творожный глазированный с черн смородиной далматин 45g	1318164	Продукты питания (folder)/Молочные продукты (folder)/Сырок	1678659	DALMATIN
2936366	4607075150393	Сырок творожный глазированный с шоколадом 45g 460707515039	1318164	Продукты питания (folder)/Молочные продукты (folder)/Сырок	0	
2936391	4607012700940	Сырок творожный глазированный снеда вареная сгущенка 23% 50g	1318164	Продукты питания (folder)/Молочные продукты (folder)/Сырок	3752330	SNEDA (MOLOCHNOE DELO KOMPANIYA)
2936415	4606450034389	Сырок творожный глазированный со сгущен молоком вареным в кондитерской глазури мдж 20% 50g 24шт, снеговичок	1318164	Продукты питания (folder)/Молочные продукты (folder)/Сырок	3624975	снеговичок (SIBIRSKIY ZD MOL.PROD./BERDSK NOVOS.OB.)
2936416	4600653110222	Сырок творожный глазированный со сгущенкой вареной мдж 12% молочная речка пленка, 0.035kg	1318164	Продукты питания (folder)/Молочные продукты (folder)/Сырок	0	
2935902	4607012705426	Сырок творожный глазированный творобушки с молочной глазурью ваниль 21% 6x 30g	1318164	Продукты питания (folder)/Молочные продукты (folder)/Сырок	3764404	TVOROBUSHKI (MOLOCHNOE DELO KOMPANIYA)
2936417	4607003722111	Сырок творожный глазированный тирамису (0406 10 500 9)	1318164	Продукты питания (folder)/Молочные продукты (folder)/Сырок	3619484	BALTKOM (BALTKOM YUNI)
2938456	4607011120169	Сырок творожный гришенька	1318164	Продукты питания (folder)/Молочные продукты (folder)/Сырок	0	
3547010	4630005090599	Сырок творожный дар продукт глазированный с персиком 40g	1318164	Продукты питания (folder)/Молочные продукты (folder)/Сырок	3801141	дарпродукт
3546777	4630005090773	Сырок творожный дарпродукт тропик глазированный 23% мягуп 40g	1318164	Продукты питания (folder)/Молочные продукты (folder)/Сырок	3801141	дарпродукт
3546781	4602014010523	Сырок творожный демик глазированный с ванилином мягуп 50g	1318164	Продукты питания (folder)/Молочные продукты (folder)/Сырок	3643224	DEMIK (DMITROVSKIY MOL.Z-D/MOSKOV.OBL.)
1827622	4602014002610	Сырок творожный демик с ванилином 12% 100g	1318164	Продукты питания (folder)/Молочные продукты (folder)/Сырок	0	
2936418	4607154940235	Сырок творожный детский с сахаром мдж 23%	1318164	Продукты питания (folder)/Молочные продукты (folder)/Сырок	0	
1318499	4602014009244	Сырок творожный дмз апельсин шоколад 100g	1318164	Продукты питания (folder)/Молочные продукты (folder)/Сырок	0	
3547011	4602014002306	Сырок творожный дмз ваниль 100g	1318164	Продукты питания (folder)/Молочные продукты (folder)/Сырок	0	
1318509	4602014009237	Сырок творожный дмз киви 100g	1318164	Продукты питания (folder)/Молочные продукты (folder)/Сырок	0	
1318511	4602014006878	Сырок творожный дмз клюква 100g	1318164	Продукты питания (folder)/Молочные продукты (folder)/Сырок	0	
3547012	4602014009473	Сырок творожный дмз с вар сгущенкой 40g	1318164	Продукты питания (folder)/Молочные продукты (folder)/Сырок	0	
3547013	4602014002313	Сырок творожный дмз с изюмом 100g	1318164	Продукты питания (folder)/Молочные продукты (folder)/Сырок	0	
1318510	4602014006885	Сырок творожный дмз с клубникой 100g	1318164	Продукты питания (folder)/Молочные продукты (folder)/Сырок	0	
1318512	4602014006595	Сырок творожный дмз с кокосом 100g	1318164	Продукты питания (folder)/Молочные продукты (folder)/Сырок	0	
1318505	4602014006274	Сырок творожный дмз с курагой 100g	1318164	Продукты питания (folder)/Молочные продукты (folder)/Сырок	0	
3546783	4607014190145	Сырок творожный добрая кормилица абрикос 100g флоупак	1318164	Продукты питания (folder)/Молочные продукты (folder)/Сырок	0	
2938457	4607041480875	Сырок творожный добрый фермер	1318164	Продукты питания (folder)/Молочные продукты (folder)/Сырок	0	
3546793	4620006001328	Сырок творожный залесский фермер	1318164	Продукты питания (folder)/Молочные продукты (folder)/Сырок	3604532	Залесский Фермер
3546794	4620006001335	Сырок творожный залесский фермер #2	1318164	Продукты питания (folder)/Молочные продукты (folder)/Сырок	3604532	Залесский Фермер
3546795	4620006001342	Сырок творожный залесский фермер #3	1318164	Продукты питания (folder)/Молочные продукты (folder)/Сырок	3604532	Залесский Фермер
3546792	4620006002967	Сырок творожный залесский фермер со сгущенным вареным молоком в молочном шоколаде 26 % 50ml	1318164	Продукты питания (folder)/Молочные продукты (folder)/Сырок	3604532	Залесский Фермер
3546796	4607043092618	Сырок творожный здоровая ферма с изюмом 4.5% мягуп 100g	1318164	Продукты питания (folder)/Молочные продукты (folder)/Сырок	0	
2938458	4606160001008	Сырок творожный зебра Колобок 15g	1318164	Продукты питания (folder)/Молочные продукты (folder)/Сырок	0	
2758961	4607041494520	Сырок творожный иваново молоко с ароматом ванили 100g	1318164	Продукты питания (folder)/Молочные продукты (folder)/Сырок	0	
3546799	4607041494759	Сырок творожный ивмолокопродукт с клубникой мягуп 100g	1318164	Продукты питания (folder)/Молочные продукты (folder)/Сырок	0	
2936367	4607036341327	Сырок творожный из чебаркуля с ванилином 15% мягуп 100g	1318164	Продукты питания (folder)/Молочные продукты (folder)/Сырок	0	
2936368	4607036341358	Сырок творожный из чебаркуля с изюмом 15% мягуп 100g	1318164	Продукты питания (folder)/Молочные продукты (folder)/Сырок	0	
3547014	4602433000228	Сырок творожный ирбитский молочный завод с сахаром и ванилином 8% мягуп 100g	1318164	Продукты питания (folder)/Молочные продукты (folder)/Сырок	0	
3546802	4602358001867	Сырок творожный каровка из кореновки глазированный с клубникой	1318164	Продукты питания (folder)/Молочные продукты (folder)/Сырок	3260274	коровка из кореновки
1318375	4750050340088	Сырок творожный карумс карамельный 14% 25g	1318164	Продукты питания (folder)/Молочные продукты (folder)/Сырок	678005	Карумс
1318376	4750050340071	Сырок творожный карумс клубничный 14% 25g	1318164	Продукты питания (folder)/Молочные продукты (folder)/Сырок	678005	Карумс
1318378	4750050341498	Сырок творожный карумс с орехами 13% 45g	1318164	Продукты питания (folder)/Молочные продукты (folder)/Сырок	678005	Карумс
1703907	4750050341078	Сырок творожный карумс с печеньем и тирамису 14% 45g	1318164	Продукты питания (folder)/Молочные продукты (folder)/Сырок	678005	Карумс
836872	4750050341016	Сырок творожный карумс с печеньем и тирамису 14%50g	1318164	Продукты питания (folder)/Молочные продукты (folder)/Сырок	678005	Карумс
1703908	4750050341061	Сырок творожный карумс сырный пирог с черник.13% 45g	1318164	Продукты питания (folder)/Молочные продукты (folder)/Сырок	678005	Карумс
836874	4750050341047	Сырок творожный карумс сырный пирог с черник.13%50g	1318164	Продукты питания (folder)/Молочные продукты (folder)/Сырок	678005	Карумс
3546804	4600712004486	Сырок творожный клубника 100g	1318164	Продукты питания (folder)/Молочные продукты (folder)/Сырок	0	
3546805	4607014190152	Сырок творожный клубника 100g #2	1318164	Продукты питания (folder)/Молочные продукты (folder)/Сырок	0	
3546833	4650068534519	Сырок творожный клубника 16.5% 100g лукоморье	1318164	Продукты питания (folder)/Молочные продукты (folder)/Сырок	0	
3546806	4607023400112	Сырок творожный клубника глазированный 40g	1318164	Продукты питания (folder)/Молочные продукты (folder)/Сырок	0	
2936419	4605119013499	Сырок творожный клубника термизир взбитый во взбитой шоколадной глазури глазиров в молочн шоколаде заморож лакомка двойной шоко	1318164	Продукты питания (folder)/Молочные продукты (folder)/Сырок	0	
3546808	4602358001874	Сырок творожный коровка из кореновки глазированныйс брусникой	1318164	Продукты питания (folder)/Молочные продукты (folder)/Сырок	3260274	коровка из кореновки
2936448	4602358004585	Сырок творожный коровка из кореновки с ванилином 100g 15%	1318164	Продукты питания (folder)/Молочные продукты (folder)/Сырок	0	
3546809	4602358001850	Сырок творожный коровка из кореновкм глазированный с черникой	1318164	Продукты питания (folder)/Молочные продукты (folder)/Сырок	3260274	коровка из кореновки
3546810	4699301488134	Сырок творожный краснодарский завод №1 с ванилью 15% 200m/у	1318164	Продукты питания (folder)/Молочные продукты (folder)/Сырок	0	
3546811	4699301488110	Сырок творожный краснодарский завод №1 с курагой 100g	1318164	Продукты питания (folder)/Молочные продукты (folder)/Сырок	0	
3546812	4699301488097	Сырок творожный краснодарский завод №1 с шоколадной крошкой 23% 50g к/к	1318164	Продукты питания (folder)/Молочные продукты (folder)/Сырок	0	
3546813	4699301487267	Сырок творожный краснодарский завод№1 в темном шоколаде 50g	1318164	Продукты питания (folder)/Молочные продукты (folder)/Сырок	3821340	КЗДЛПП №1
166915	4600765011066	Сырок творожный курага 100g флоупак снежок	1318164	Продукты питания (folder)/Молочные продукты (folder)/Сырок	0	
3547015	4750050342075	Сырок творожный лабрит ваниль 35g	1318164	Продукты питания (folder)/Молочные продукты (folder)/Сырок	0	
3547016	4750050342082	Сырок творожный лабрит клубника 35g	1318164	Продукты питания (folder)/Молочные продукты (folder)/Сырок	0	
3546830	4650067110417	Сырок творожный летний луг клубничный 12% 40g	1318164	Продукты питания (folder)/Молочные продукты (folder)/Сырок	0	
3546831	4650067110370	Сырок творожный летний луг с апельсином 12% 40g	1318164	Продукты питания (folder)/Молочные продукты (folder)/Сырок	0	
