ID	UPCEAN	Name	CategoryID	CategoryName	BrandID	BrandName
3345949	4611346008504	Клетчатка овсяная иммунутоник 150г	1	Неклассифицированные/default	0	
3345950	4610006770140	Клетчатка овсяная с йодом 150г	1	Неклассифицированные/default	0	
3345951	4611346008528	Клетчатка овсяная с кальцием и хотозаном 150г м/уп	1	Неклассифицированные/default	0	
3345952	4610006770157	Клетчатка овсяная с коэнзимом 150г	1	Неклассифицированные/default	0	
3345953	4610006770942	Клетчатка очищающая 150г	1	Неклассифицированные/default	0	
3345954	4607077790306	Клетчатка пшен 270г облепиха	1	Неклассифицированные/default	0	
3345955	4641364012214	Клетчатка пшеничная 100г мяг/уп	1	Неклассифицированные/default	0	
2442778	4607160650371	Клетчатка пшеничная без наполнителя в банке 300г 1/12 12мес	2442777	Продукты питания (folder)/Клетчатка	0	
23568	4603907002458	Клетчатка пшеничная живая клетчатка 200г 1/12 12 мес.	2442777	Продукты питания (folder)/Клетчатка	0	
1224504	4607077790368	Клетчатка пшеничная клеопатра пл/б 0.270	2442777	Продукты питания (folder)/Клетчатка	0	
23569	4607077790863	Клетчатка пшеничная крепкие сосуды 180г 1/20 12 мес.	2442777	Продукты питания (folder)/Клетчатка	0	
23570	4607077790986	Клетчатка пшеничная кукурузные рыльца 180г 1/20 12 мес.	2442777	Продукты питания (folder)/Клетчатка	0	
23571	4607077790955	Клетчатка пшеничная противодиабетический комплекс 180г 1/20 12 мес.	2442777	Продукты питания (folder)/Клетчатка	65623	Сокровища тайги
23572	4607077790887	Клетчатка пшеничная расторопша 180г 1/20 12 мес.	2442777	Продукты питания (folder)/Клетчатка	0	
23573	4607077790276	Клетчатка пшеничная с абрикосом 270г 1/20 12 мес.	2442777	Продукты питания (folder)/Клетчатка	0	
2442779	4607160650739	Клетчатка пшеничная с ламинарией в банке 300г 1/12 12мес	2442777	Продукты питания (folder)/Клетчатка	0	
2442773	4607160650586	Клетчатка пшеничная с ламинарией в пакете 300г 1/12 12мес	2442777	Продукты питания (folder)/Клетчатка	0	
2442780	4607160650760	Клетчатка пшеничная с пантогематогеном в банке 300г 1/12 12мес	2442777	Продукты питания (folder)/Клетчатка	0	
2442781	4607160650593	Клетчатка пшеничная с пантогематогеном в пакете 300г 1/12 12мес	2442777	Продукты питания (folder)/Клетчатка	0	
2442782	4607160650715	Клетчатка пшеничная с топинамбуром в банке 300г 1/12 12мес	2442777	Продукты питания (folder)/Клетчатка	0	
2442775	4607160650562	Клетчатка пшеничная с топинамбуром в пакете 300г 1/12 12мес	2442777	Продукты питания (folder)/Клетчатка	0	
2442783	4607160650746	Клетчатка пшеничная с тыквой в банке 300г 1/12 12мес	2442777	Продукты питания (folder)/Клетчатка	0	
2442784	4607160650609	Клетчатка пшеничная с тыквой в пакете 300г 1/12 12мес	2442777	Продукты питания (folder)/Клетчатка	0	
2442785	4607160650722	Клетчатка пшеничная с черникой в банке 300г 1/12 12мес	2442777	Продукты питания (folder)/Клетчатка	0	
2442786	4607160650579	Клетчатка пшеничная с черникой в пакете 300г 1/12 12мес	2442777	Продукты питания (folder)/Клетчатка	0	
23574	4607077790382	Клетчатка пшеничная с яблоком 270г 1/20 12 мес.	2442777	Продукты питания (folder)/Клетчатка	0	
2442787	4607160650616	Клетчатка пшеничная со свеклой в пакете 300г 1/12 12мес	2442777	Продукты питания (folder)/Клетчатка	0	
2442788	4607160650753	Клетчатка пшеничная со свелой в банке 300г 1/12 12мес	2442777	Продукты питания (folder)/Клетчатка	0	
23575	4607077790917	Клетчатка пшеничная успокаивающий комплекс 180г 1/20 12 мес.	2442777	Продукты питания (folder)/Клетчатка	65623	Сокровища тайги
28583	4820028130109	Клетчатка растительная наше наследие 0.150	2442777	Продукты питания (folder)/Клетчатка	28582	НАШЕ НАСЛЕДИЕ
265509	4820069930409	Клетчатка расторопши капс.№300	2442777	Продукты питания (folder)/Клетчатка	0	
23577	4607077791129	Клетчатка ржаная с брусникой 300г 1/20 12 мес.	2442777	Продукты питания (folder)/Клетчатка	0	
23578	4607077791136	Клетчатка ржаная с морской капустой 300г 1/20 12 мес.	2442777	Продукты питания (folder)/Клетчатка	28581	СИБИРСКАЯ
28584	4820028130031	Клетчатка с витам. и микроэлем. в п/э банке 300г	2442777	Продукты питания (folder)/Клетчатка	28582	НАШЕ НАСЛЕДИЕ
4842621	4610010013288	Клетчатка с семенами чиа 200г	241824	Лекарственные средства (folder)/Аптека	0	
2442789	4610010013202	Клетчатка с ягодами годжи эко-уп 200г bio national	2442777	Продукты питания (folder)/Клетчатка	2442770	BIO National
65610	4607077790047	Клетчатка сибири витам.коктейль 270г	2442777	Продукты питания (folder)/Клетчатка	0	
65611	4607077790115	Клетчатка сибири солянка холмовая 200г	2442777	Продукты питания (folder)/Клетчатка	0	
2870988	4607056264675	Клетчатка сибирская 0.300 суперчерника	1	Неклассифицированные/default	0	
23599	4607056261070	Клетчатка сибирская 170г сердечный друг, черникова чп	2442777	Продукты питания (folder)/Клетчатка	0	
3345956	4607056269588	Клетчатка сибирская stop аппетит питьевой коктейль 170г пл/бан	1	Неклассифицированные/default	0	
23579	4607056262817	Клетчатка сибирская анти диабет n34 200г 1/30 12 мес.	2442777	Продукты питания (folder)/Клетчатка	28581	СИБИРСКАЯ
3345957	4607056269571	Клетчатка сибирская анти-диабет питьевой коктейль 170г пл/бан	1	Неклассифицированные/default	0	
23580	4607056261094	Клетчатка сибирская витаминная n42 200г 1/30 12 мес.	2442777	Продукты питания (folder)/Клетчатка	28581	СИБИРСКАЯ
23581	4607056260080	Клетчатка сибирская витаминная поляна n1 300г 1/30 12 мес.	2442777	Продукты питания (folder)/Клетчатка	28581	СИБИРСКАЯ
1355095	4607056264668	Клетчатка сибирская витаминная поляна ягодно-злаковый Mix 300г пл/бан	2442777	Продукты питания (folder)/Клетчатка	0	
23582	4607056260486	Клетчатка сибирская голубика n20 1/30 12 мес.	2442777	Продукты питания (folder)/Клетчатка	0	
65612	4607077790139	Клетчатка сибирская диабетич.комплекс 200г	2442777	Продукты питания (folder)/Клетчатка	0	
2956212	4607077790559	Клетчатка сибирская диабетич.комплекс 200г #2	2442777	Продукты питания (folder)/Клетчатка	0	
23583	4607056228424	Клетчатка сибирская желчегонная n41 1/30 12 мес.	2442777	Продукты питания (folder)/Клетчатка	0	
23585	4607056260028	Клетчатка сибирская жимолость n38 1/30 12 мес.	2442777	Продукты питания (folder)/Клетчатка	0	
65613	4607077790351	Клетчатка сибирская здор.женщины 200г	2442777	Продукты питания (folder)/Клетчатка	0	
2956213	4607077790757	Клетчатка сибирская здор.женщины 200г #2	2442777	Продукты питания (folder)/Клетчатка	0	
23586	4607056261049	Клетчатка сибирская здоровая печень n17 170г 1/30 12 мес.	2442777	Продукты питания (folder)/Клетчатка	28581	СИБИРСКАЯ
23587	4607056261032	Клетчатка сибирская здоровые почки n16 250г 1/30 12 мес.	2442777	Продукты питания (folder)/Клетчатка	28581	СИБИРСКАЯ
23588	4607056261063	Клетчатка сибирская здоровые суставы n21 170г 1/30 12 мес.	2442777	Продукты питания (folder)/Клетчатка	28581	СИБИРСКАЯ
23589	4607056261056	Клетчатка сибирская здоровый желудок n22 250г 1/30 12 мес.	2442777	Продукты питания (folder)/Клетчатка	28581	СИБИРСКАЯ
23590	4607056261087	Клетчатка сибирская изящный силуэт n19 250г 1/30 12 мес.	2442777	Продукты питания (folder)/Клетчатка	28581	СИБИРСКАЯ
23591	4607056260011	Клетчатка сибирская кедровый орешек n9 300г 1/30 12 мес.	2442777	Продукты питания (folder)/Клетчатка	28581	СИБИРСКАЯ
3345958	4607056264743	Клетчатка сибирская клетчатка иммунитет + 170г пл/б	1	Неклассифицированные/default	0	
726519	4607056264682	Клетчатка сибирская клетчатка льняная с черникой 280г пл/б	2442777	Продукты питания (folder)/Клетчатка	0	
23592	4607056260103	Клетчатка сибирская корзинка здоровья n5 300г 1/30 12 мес.	2442777	Продукты питания (folder)/Клетчатка	28581	СИБИРСКАЯ
23593	4607056262855	Клетчатка сибирская крепкие сосуды n45 1/30 12 мес.	2442777	Продукты питания (folder)/Клетчатка	0	
23594	4607056260127	Клетчатка сибирская ласточка n24 1/30 12 мес.	2442777	Продукты питания (folder)/Клетчатка	0	
23595	4607056260110	Клетчатка сибирская лебедушка n27 1/30 12 мес.	2442777	Продукты питания (folder)/Клетчатка	0	
65615	4607056264385	Клетчатка сибирская леди стройность 200г	2442777	Продукты питания (folder)/Клетчатка	28581	СИБИРСКАЯ
3345959	4607056264699	Клетчатка сибирская льняная с травами 280г пл/бан	1	Неклассифицированные/default	0	
726518	4607056264712	Клетчатка сибирская льняная с фруктами 280г тв/уп	2442777	Продукты питания (folder)/Клетчатка	0	
2012885	4607056264705	Клетчатка сибирская льняная с ягодами 3в1 280г пл/бан	2442777	Продукты питания (folder)/Клетчатка	0	
65616	4607056260073	Клетчатка сибирская облепиха 300г	2442777	Продукты питания (folder)/Клетчатка	28581	СИБИРСКАЯ
3345960	4607056266297	Клетчатка сибирская овсяная анти-диабет 170г пл/бан	1	Неклассифицированные/default	0	
65617	4607077790771	Клетчатка сибирская осиная талия 200г	2442777	Продукты питания (folder)/Клетчатка	28581	СИБИРСКАЯ
2956214	4607077790337	Клетчатка сибирская осиная талия 200г #2	2442777	Продукты питания (folder)/Клетчатка	28581	СИБИРСКАЯ
3345961	4607056269564	Клетчатка сибирская очищающая питьевой коктейль 170г пл/бан	1	Неклассифицированные/default	0	
65618	4607077790221	Клетчатка сибирская противодиабет.150г	2442777	Продукты питания (folder)/Клетчатка	0	
726520	4607056264446	Клетчатка сибирская ржаная с травами (№103) 350г 1/20	2442777	Продукты питания (folder)/Клетчатка	0	
726521	4607056264439	Клетчатка сибирская ржаная с фруктами (№101) 350г 1/20	2442777	Продукты питания (folder)/Клетчатка	0	
726522	4607056264422	Клетчатка сибирская ржаная с ягодами (№102) 350г 1/20	2442777	Продукты питания (folder)/Клетчатка	0	
23597	4607056260332	Клетчатка сибирская с зеленым чаем n31 1/30 12 мес.	2442777	Продукты питания (folder)/Клетчатка	0	
28585	4607056260202	Клетчатка сибирская с расторопшей (№14) 170г 1/24	2442777	Продукты питания (folder)/Клетчатка	28581	СИБИРСКАЯ
23598	4607056260066	Клетчатка сибирская с солянкой холмовой n1/30 12 мес.	2442777	Продукты питания (folder)/Клетчатка	0	
23600	4607056263319	Клетчатка сибирская слабительная n47 1/30 12 мес.	2442777	Продукты питания (folder)/Клетчатка	0	
65619	4607056260868	Клетчатка сибирская со стевией (№25) 170г 1/24	2442777	Продукты питания (folder)/Клетчатка	28581	СИБИРСКАЯ
23601	4607056260134	Клетчатка сибирская соколиный глаз n3 300г 1/30 12 мес.	2442777	Продукты питания (folder)/Клетчатка	28581	СИБИРСКАЯ
23603	4607056260141	Клетчатка сибирская супербрусника n11 300г 1/30 12 мес.	2442777	Продукты питания (folder)/Клетчатка	28581	СИБИРСКАЯ
23604	4607056260158	Клетчатка сибирская суперклюква n10 300г 1/30 12 мес.	2442777	Продукты питания (folder)/Клетчатка	0	
23605	4607056260165	Клетчатка сибирская суперчерника n4 300г 1/30 12 мес.	2442777	Продукты питания (folder)/Клетчатка	28581	СИБИРСКАЯ
65620	4607077790214	Клетчатка сибирская успок.комплекс 150г	2442777	Продукты питания (folder)/Клетчатка	0	
65621	4607077790122	Клетчатка сибирская успок.комплекс 200г	2442777	Продукты питания (folder)/Клетчатка	0	
2956215	4607077790818	Клетчатка сибирская успок.комплекс 200г #2	2442777	Продукты питания (folder)/Клетчатка	0	
23607	4607056262275	Клетчатка сибирская хрустящая земляничная поляна n43 1/30 12 мес.	2442777	Продукты питания (folder)/Клетчатка	0	
23608	4607056262206	Клетчатка сибирская хрустящая Золотые фрукты n44 170г 1/30 12 мес.	2442777	Продукты питания (folder)/Клетчатка	0	
23609	4607056262213	Клетчатка сибирская хрустящая калинка-малинка n46 1/30 12 мес.	2442777	Продукты питания (folder)/Клетчатка	0	
65614	4607056264415	Клетчатка сибирская хрустящая легкий вес (№7) 170г 1/24	2442777	Продукты питания (folder)/Клетчатка	28581	СИБИРСКАЯ
23610	4607056262008	Клетчатка сибирская хрустящая легкий вес n7 200г 1/30 12 мес.	2442777	Продукты питания (folder)/Клетчатка	28581	СИБИРСКАЯ
23611	4607056264408	Клетчатка сибирская хрустящая леди босс n71 1/30 12 мес.	2442777	Продукты питания (folder)/Клетчатка	0	
23612	4607056261933	Клетчатка сибирская хрустящая леди совершенство n8 200г 1/30 12 мес.	2442777	Продукты питания (folder)/Клетчатка	28581	СИБИРСКАЯ
314992	4607056264378	Клетчатка сибирская хрустящая леди стройность (№6) 170г 1/24	2442777	Продукты питания (folder)/Клетчатка	0	
23613	4607056261995	Клетчатка сибирская хрустящая леди стройность n6 200г 1/30 12 мес.	2442777	Продукты питания (folder)/Клетчатка	28581	СИБИРСКАЯ
23614	4607056264392	Клетчатка сибирская хрустящая леди фитнес n72 200г 1/30 12 мес.	2442777	Продукты питания (folder)/Клетчатка	0	
23615	4607056262220	Клетчатка сибирская хрустящая молодильное яблоко n37 1/30 12 мес.	2442777	Продукты питания (folder)/Клетчатка	0	
23616	4607056260219	Клетчатка сибирская хрустящая сибирский Сад n1/30 12 мес.	2442777	Продукты питания (folder)/Клетчатка	0	
23617	4607056262268	Клетчатка сибирская хрустящая таежный дар n40 170г 1/30 12 мес.	2442777	Продукты питания (folder)/Клетчатка	0	
726523	4607077791679	Клетчатка сибтар пшеничная клеопатра короб 150г 1/27	2442777	Продукты питания (folder)/Клетчатка	0	
726525	4607077790252	Клетчатка сибтар пшеничная с клюквой банка 270г 1/20	2442777	Продукты питания (folder)/Клетчатка	0	
23576	4607077791143	Клетчатка сибтар ржаная с абрикосом банка 300г 1/20	2442777	Продукты питания (folder)/Клетчатка	28581	СИБИРСКАЯ
65624	4607077790856	Клетчатка сокровища тайги здоровье женщины 180г	2442777	Продукты питания (folder)/Клетчатка	65623	Сокровища тайги
65625	4607077790870	Клетчатка сокровища тайги осиная талия 180г	2442777	Продукты питания (folder)/Клетчатка	65623	Сокровища тайги
3345962	4647114860227	Клетчатка стройная талия пшеничная doypack 100г	1	Неклассифицированные/default	0	
2870986	4607077790405	Клетчатка таежный подарок, пшеничная, 27г, пл/б	1	Неклассифицированные/default	0	
726526	1977684601016	Клетчатка топинамбура (банка) 200г 1/24	2442777	Продукты питания (folder)/Клетчатка	0	
3345963	4611346008481	Клетчатка флорина, овсяные с инулином, 150г пл/б	1	Неклассифицированные/default	0	
472289	4820090052354	Клетчатка целебное питание банка 300г грецкий орех	2442777	Продукты питания (folder)/Клетчатка	0	
472290	4820090052323	Клетчатка целебное питание банка 300г тыква	2442777	Продукты питания (folder)/Клетчатка	0	
3345964	4641364013204	Клетчатка энергия природы пшеничная очищающая 100г пл/б	1	Неклассифицированные/default	0	
2870989	4607056268512	Клетчатка я диета 0.170 с семенами чиа	1	Неклассифицированные/default	0	
3345965	4610006770102	Клетчатка яблочная с ананасом doypack 150г	1	Неклассифицированные/default	0	
3345966	4610006770195	Клетчатка яблочная с имбирем doypack 150г	1	Неклассифицированные/default	0	
65626	8006165377713	Клецки casa rinaldi карт.с с/песто 500г	24086	Продукты питания (folder)/Макароны	37091	Casa Rinaldi
65627	8006165377737	Клецки casa rinaldi карт.с чернилами 500г	24086	Продукты питания (folder)/Макароны	37091	Casa Rinaldi
2442790	4810113011208	Клецки домашние 100г	1	Неклассифицированные/default	0	
65628	8007303004003	Клецки картофельные ньокки био 500г	144932	Продукты питания (folder)/Полуфабрикаты	0	
1224506	4814838000677	Клецки панские картофельные замороженные с мясом и грибами фирменные п/ф 0.45кг Беларусь	144932	Продукты питания (folder)/Полуфабрикаты	0	
1224507	4814838000660	Клецки панские картофельные замороженные с мясом фирменные п/ф 0.45кг Беларусь	144932	Продукты питания (folder)/Полуфабрикаты	0	
3345967	4814838001889	Клецки панские картофельные с луком 400г	1	Неклассифицированные/default	0	
3345968	4814838001926	Клецки панские картофельные с мясом 400г	1	Неклассифицированные/default	3728625	PANSKIE (PROVITBEL/NOVOGRUDOK BELORUSSIYA)
65630	80100737	Клецки паф картофельные ньокки 500г	144932	Продукты питания (folder)/Полуфабрикаты	65629	Паф
5011546	4870001222895	Клецки по-домашнему яичные миндаль 300г (1x16) (# 8) казахстан (шк - 2895)	1	Неклассифицированные/default	0	
5011547	4870001222925	Клецки по-домашнему яичные свистулька 300г (1x18) (# 8) казахстан (шк - 2925)	1	Неклассифицированные/default	0	
5011548	4870001222918	Клецки по-домашнему яичные спиралька 300г (1x18) (# 9) казахстан (шк - 2918)	1	Неклассифицированные/default	0	
3679659	4870001222932	Клецки по-домашнему яичные фисташка 300г (1x18) (# 9) казахстан (шк - 2932)	24086	Продукты питания (folder)/Макароны	3679655	KEMMI
3345969	4607078976747	Клечатка компас здоровья конопляная с базиликом 150г тв/уп	1	Неклассифицированные/default	0	
726517	4607078971018	Клечатка компас здоровья мелкая пшеничная с солодкой 200г тв/уп	2442777	Продукты питания (folder)/Клетчатка	758474	Компас Здоровья
3345970	4610006770164	Клечтчатка овсяная с омега 3 150г	1	Неклассифицированные/default	0	
2870990	4770190351164	Клешни краба (имитация) п/м 1/5000г vici	1	Неклассифицированные/default	37382	VICI
1224508	8410547048236	Клешни краба delfin в панировке 250г	1	Неклассифицированные/default	0	
155234	4770190375191	Клешни мал краба в пан карт кор 0.150	330591	Продукты питания (folder)/Продукты питания	0	
2870991	4770190111003	Клешни маленького краба (имитация из сурими) в чесночном масле марсель вак уп 1/200г vici	1	Неклассифицированные/default	37382	VICI
2442792	4770190100786	Клешни маленького краба (имитация из сурими) в чесночном масле п/у 1/360г vici	41409	Продукты питания (folder)/Рыба и морепродукты (folder)/Морепродукты	37382	VICI
2870992	4770190109093	Клешни маленького краба (имитация из сурими) замороженные п/у 1/300г vici любо есть	1	Неклассифицированные/default	37382	VICI
2442793	4770190106177	Клешни маленького краба (имитация) вак уп 1/200г vici	41409	Продукты питания (folder)/Рыба и морепродукты (folder)/Морепродукты	37382	VICI
