ID	UPCEAN	Name	CategoryID	CategoryName	BrandID	BrandName
688371	3429670547221	Вино chateau бартез крю буржуа о-медок красн сух 0.375л	688367	Продукты питания (folder)/Алкогольные напитки/Вино (folder)/Вина Франции Бордо	688370	Шато Бартез
175022	3429674489046	Вино chateau бартез о-медок крю буржуа 2004 красн сух 12.5% 0.375/12	22133	Продукты питания (folder)/Алкогольные напитки/Вино (folder)/Вино	175020	МВ-GVG/Вино (Франция)
47176	3249990214470	Вино chateau басак бордо белое сухое 12% 750мл стекло	41821	Продукты питания (folder)/Алкогольные напитки/Вино (folder)/Вина Франции	0	
47177	3249990214357	Вино chateau басак бордо красное сухое 13% 750мл с/б	41821	Продукты питания (folder)/Алкогольные напитки/Вино (folder)/Вина Франции	3794671	ШАТО БАССАК
47174	3249990214296	Вино chateau басак медок к.б красн сух 12% 750мл	22133	Продукты питания (folder)/Алкогольные напитки/Вино (folder)/Вино	0	
688373	3760053115393	Вино chateau бассак бордо aoc бел сух 750мл	688367	Продукты питания (folder)/Алкогольные напитки/Вино (folder)/Вина Франции Бордо	688372	Бассак
688375	3382360111143	Вино chateau бастор-лямонтань сотерн бел сл.750мл	688374	Продукты питания (folder)/Алкогольные напитки/Вино (folder)/Вина Франции Долина Луары	0	
688376	5949475001318	Вино chateau бахус роял мэйден 750мл 0% сухое выдержанное	22133	Продукты питания (folder)/Алкогольные напитки/Вино (folder)/Вино	0	
688377	5949475001325	Вино chateau бахус тэмыйос 750мл 0% полусладк выдержанное	22133	Продукты питания (folder)/Алкогольные напитки/Вино (folder)/Вино	0	
47178	3182520656268	Вино chateau бегадан медок красн сух 12.5% 750мл	41821	Продукты питания (folder)/Алкогольные напитки/Вино (folder)/Вина Франции	42615	Валомброз
47179	4607056601586	Вино chateau бейшвей 1995 с.ж.12.5% 750мл	41821	Продукты питания (folder)/Алкогольные напитки/Вино (folder)/Вина Франции	0	
4837145	3330251082270	Вино chateau бейшвель сен-жюльен аос 4 крю красн сух 750мл	688367	Продукты питания (folder)/Алкогольные напитки/Вино (folder)/Вина Франции Бордо	4837144	Yvon Mau
688378	3511060011044	Вино chateau бейшевель 750мл 12% сухое	22133	Продукты питания (folder)/Алкогольные напитки/Вино (folder)/Вино	0	
2976878	3511069511033	Вино chateau бейшевель 750мл 12% сухое #2	22133	Продукты питания (folder)/Алкогольные напитки/Вино (folder)/Вино	0	
688380	3511060717526	Вино chateau бейшевель красн сух 750мл	41821	Продукты питания (folder)/Алкогольные напитки/Вино (folder)/Вина Франции	688379	Шато Бейшевель
151879	3259354116401	Вино chateau белеэр-мустэ красн сух 12% 750мл	22133	Продукты питания (folder)/Алкогольные напитки/Вино (folder)/Вино	150311	ВИАЛКО 556
688381	3296512326753	Вино chateau белингар 750мл 13% сладкое	22133	Продукты питания (folder)/Алкогольные напитки/Вино (folder)/Вино	0	
283012	3423290096275	Вино chateau белфор медок красн сух 750мл 12.5% /св.винсент selection/Франция/	22133	Продукты питания (folder)/Алкогольные напитки/Вино (folder)/Вино	0	
688382	3760155272154	Вино chateau бель асиз куро 750мл 12% сухое	41821	Продукты питания (folder)/Алкогольные напитки/Вино (folder)/Вина Франции	0	
282429	3375080122513	Вино chateau бель эр bordeaux резерв перпонше красн сух 13% 750мл Франция	22133	Продукты питания (folder)/Алкогольные напитки/Вино (folder)/Вино	0	
688387	3375080320513	Вино chateau бель эр bordeaux резерв перпоншер бел сух 750мл Франция	22133	Продукты питания (folder)/Алкогольные напитки/Вино (folder)/Вино	0	
688388	3375080128515	Вино chateau бель эр bordeaux резерв перпоншер красн сух 750мл Франция	22133	Продукты питания (folder)/Алкогольные напитки/Вино (folder)/Вино	0	
47181	3249990214029	Вино chateau бельвю бордо красное сухое 11% 750мл ст/б	41821	Продукты питания (folder)/Алкогольные напитки/Вино (folder)/Вина Франции	0	
283574	3259354113202	Вино chateau бельвю бордо супериор красн сух 12.5% 750мл /Франция/	22133	Продукты питания (folder)/Алкогольные напитки/Вино (folder)/Вино	0	
283575	3423290113347	Вино chateau бельвю ружье bordeaux красн сух 750мл 13.5% /Франция/	22133	Продукты питания (folder)/Алкогольные напитки/Вино (folder)/Вино	0	
47182	3438910811862	Вино chateau бельвю шоле красн сух 12.5% 750мл	41821	Продукты питания (folder)/Алкогольные напитки/Вино (folder)/Вина Франции	0	
2855182	3258691420769	Вино chateau бельграв гран крю классе красн сух 750мл	22133	Продукты питания (folder)/Алкогольные напитки/Вино (folder)/Вино	0	
2855183	3258691441337	Вино chateau бельграв гран крю классе красн сух 750мл #2	22133	Продукты питания (folder)/Алкогольные напитки/Вино (folder)/Вино	0	
2227487	3295890180926	Вино chateau бельграв защ наим рег медок красн/сух 0.75 12.5% 1/6	22133	Продукты питания (folder)/Алкогольные напитки/Вино (folder)/Вино	0	
47183	3394150004504	Вино chateau бельграв красн сух 12.5% 750мл	41821	Продукты питания (folder)/Алкогольные напитки/Вино (folder)/Вина Франции	0	
3790666	3500610064760	Вино chateau бернадотт красн сух 15% 750мл	22133	Продукты питания (folder)/Алкогольные напитки/Вино (folder)/Вино	3790665	ШАТО БЕРНАДОТТ
4837147	3760137232169	Вино chateau бертино сэн вэнсан красн сух 750мл	688367	Продукты питания (folder)/Алкогольные напитки/Вино (folder)/Вина Франции Бордо	4837146	Роллан Коллекшн
47184	3303290076678	Вино chateau бессан медок крю Bourjois красн 12.5% 750мл	41821	Продукты питания (folder)/Алкогольные напитки/Вино (folder)/Вина Франции	1721254	Centrum
47185	3303290085540	Вино chateau бессан сегюр красн сух 12.5% 750мл	41821	Продукты питания (folder)/Алкогольные напитки/Вино (folder)/Вина Франции	1721254	Centrum
2954491	3303290150095	Вино chateau бессан сегюр красн сух 12.5% 750мл #2	41821	Продукты питания (folder)/Алкогольные напитки/Вино (folder)/Вина Франции	1721254	Centrum
2954492	3303290032919	Вино chateau бессан сегюр красн сух 12.5% 750мл #3	41821	Продукты питания (folder)/Алкогольные напитки/Вино (folder)/Вина Франции	1721254	Centrum
2954493	3760089810088	Вино chateau бессан сегюр красн сух 12.5% 750мл #4	41821	Продукты питания (folder)/Алкогольные напитки/Вино (folder)/Вина Франции	1721254	Centrum
688385	3303291603903	Вино chateau бессан сегюр медок красн сух 750мл	688367	Продукты питания (folder)/Алкогольные напитки/Вино (folder)/Вина Франции Бордо	688384	Шато Бессан Сегюр
1660232	3303291804355	Вино chateau бессан сегюр медок красн сух 750мл #2	688367	Продукты питания (folder)/Алкогольные напитки/Вино (folder)/Вина Франции Бордо	688384	Шато Бессан Сегюр
2227488	3303291905274	Вино chateau бессан сегюр медок красн сух 750мл #3	688367	Продукты питания (folder)/Алкогольные напитки/Вино (folder)/Вина Франции Бордо	688384	Шато Бессан Сегюр
2976880	3303291610055	Вино chateau бессан сегюр медок красн сух 750мл #4	688367	Продукты питания (folder)/Алкогольные напитки/Вино (folder)/Вина Франции Бордо	688384	Шато Бессан Сегюр
1760289	3432780011117	Вино chateau бире красн сух 13.5% 750мл	22133	Продукты питания (folder)/Алкогольные напитки/Вино (folder)/Вино	3790667	БИРЕ
3790668	3432780012251	Вино chateau бире красн сух 13.5% 750мл #2	22133	Продукты питания (folder)/Алкогольные напитки/Вино (folder)/Вино	3790667	БИРЕ
3790669	3432780012398	Вино chateau бире красн сух 13.5% 750мл #3	22133	Продукты питания (folder)/Алкогольные напитки/Вино (folder)/Вино	3790667	БИРЕ
3790670	3432780014040	Вино chateau бире красн сух 13.5% 750мл #4	22133	Продукты питания (folder)/Алкогольные напитки/Вино (folder)/Вино	3790667	БИРЕ
47186	3428980009740	Вино chateau блайак медок красн сух 12% 750мл	41821	Продукты питания (folder)/Алкогольные напитки/Вино (folder)/Вина Франции	0	
47188	3760107340214	Вино chateau бланкин 750мл 0% сухое	41821	Продукты питания (folder)/Алкогольные напитки/Вино (folder)/Вина Франции	0	
47187	3760107340146	Вино chateau бланкин aoc берж.руж красн сух 14% 750мл	41821	Продукты питания (folder)/Алкогольные напитки/Вино (folder)/Вина Франции	0	
1195980	3760107340047	Вино chateau бланкин aoc берж.сек бел сух 12% 750мл	41821	Продукты питания (folder)/Алкогольные напитки/Вино (folder)/Вина Франции	0	
1660254	3182524811083	Вино chateau бланш 2011 белое сухое 11.5 750мл стекло	688367	Продукты питания (folder)/Алкогольные напитки/Вино (folder)/Вина Франции Бордо	1660252	Шато Рош Бланш
688386	3495336110511	Вино chateau бо сит о-винебль крю буржуа 750мл 13% сухое	22133	Продукты питания (folder)/Алкогольные напитки/Вино (folder)/Вино	0	
3790671	3500610049354	Вино chateau боа пертуа красн сух 13.5% 750мл	22133	Продукты питания (folder)/Алкогольные напитки/Вино (folder)/Вино	3661667	ПЯТЕРОЧКА
3790673	3303292407647	Вино chateau боваллон красн сух 750мл	22133	Продукты питания (folder)/Алкогольные напитки/Вино (folder)/Вино	3790672	БОВАЛЛОН
3790674	3441501044235	Вино chateau боваллон красн сух 750мл #2	22133	Продукты питания (folder)/Алкогольные напитки/Вино (folder)/Вино	3790672	БОВАЛЛОН
3790675	3441501055231	Вино chateau боваллон красн сух 750мл #3	22133	Продукты питания (folder)/Алкогольные напитки/Вино (folder)/Вино	3790672	БОВАЛЛОН
3790676	3441599044230	Вино chateau боваллон красн сух 750мл #4	22133	Продукты питания (folder)/Алкогольные напитки/Вино (folder)/Вино	3790672	БОВАЛЛОН
4837149	3303292509969	Вино chateau боваллон красн сух 750мл #5	688367	Продукты питания (folder)/Алкогольные напитки/Вино (folder)/Вина Франции Бордо	4837148	S.A.S Совекс Волтер
47190	3593233100229	Вино chateau болье бел сух 12% 750мл	41821	Продукты питания (folder)/Алкогольные напитки/Вино (folder)/Вина Франции	47189	Шато Болье
47191	3593232100121	Вино chateau болье красн сух 14% 750мл	41821	Продукты питания (folder)/Алкогольные напитки/Вино (folder)/Вина Франции	47189	Шато Болье
47192	3593232100138	Вино chateau болье кюве Александр красн сух 13% 750мл	41821	Продукты питания (folder)/Алкогольные напитки/Вино (folder)/Вина Франции	47189	Шато Болье
47193	3593230100154	Вино chateau болье кюве беренджер красн сух 13% 750мл	41821	Продукты питания (folder)/Алкогольные напитки/Вино (folder)/Вина Франции	47189	Шато Болье
47194	3593233109215	Вино chateau болье ла провансаль бел сух 12% 750мл	41821	Продукты питания (folder)/Алкогольные напитки/Вино (folder)/Вина Франции	47189	Шато Болье
47195	3593233109017	Вино chateau болье ла провансаль розов сух 12% 750мл	41821	Продукты питания (folder)/Алкогольные напитки/Вино (folder)/Вина Франции	47189	Шато Болье
47196	3593230400209	Вино chateau болье соллианс бел сух 12% 750мл	41821	Продукты питания (folder)/Алкогольные напитки/Вино (folder)/Вина Франции	47189	Шато Болье
47197	3593230400100	Вино chateau болье соллианс красн сух 13% 750мл	41821	Продукты питания (folder)/Алкогольные напитки/Вино (folder)/Вина Франции	47189	Шато Болье
47198	3593230500220	Вино chateau болье солн.нектар бел сух 12% 750мл	41821	Продукты питания (folder)/Алкогольные напитки/Вино (folder)/Вина Франции	47189	Шато Болье
47199	3593230500138	Вино chateau болье солн.нектар красн полусладк 11.5% 750мл	41821	Продукты питания (folder)/Алкогольные напитки/Вино (folder)/Вина Франции	47189	Шато Болье
47200	3593230500121	Вино chateau болье солн.нектар красн сух 12% 750мл	41821	Продукты питания (folder)/Алкогольные напитки/Вино (folder)/Вина Франции	47189	Шато Болье
44960	3249990215163	Вино chateau бомон крю Bourjois медок красн сух 12% 750мл	22133	Продукты питания (folder)/Алкогольные напитки/Вино (folder)/Вино	0	
2954367	3249990214807	Вино chateau бомон крю Bourjois медок красн сух 12% 750мл #2	22133	Продукты питания (folder)/Алкогольные напитки/Вино (folder)/Вино	0	
1195982	3700438910717	Вино chateau бомон крю буржуа aoc бордо красн сух 750мл	22133	Продукты питания (folder)/Алкогольные напитки/Вино (folder)/Вино	1195981	Шато Бомон
1195983	3700438910816	Вино chateau бомон крю буржуа aoc бордо красн сух 750мл #2	22133	Продукты питания (folder)/Алкогольные напитки/Вино (folder)/Вино	1195981	Шато Бомон
2227489	3700438911011	Вино chateau бомон крю буржуа aoc бордо красн сух 750мл #3	688367	Продукты питания (folder)/Алкогольные напитки/Вино (folder)/Вина Франции Бордо	1195981	Шато Бомон
2855184	3700438911318	Вино chateau бомон крю буржуа о-медок красн сух 750мл бордо	22133	Продукты питания (folder)/Алкогольные напитки/Вино (folder)/Вино	3790677	БОМОН
2427418	3700438911110	Вино chateau бомон крю буржуа о-медок красн сух 750мл/бордо	22133	Продукты питания (folder)/Алкогольные напитки/Вино (folder)/Вино	1195981	Шато Бомон
2427419	3700438911219	Вино chateau бомон крю буржуа о-медок красн сух 750мл/бордо #2	22133	Продукты питания (folder)/Алкогольные напитки/Вино (folder)/Вино	1195981	Шато Бомон
47201	3192371041496	Вино chateau бордерон медок сух 12.5% 750мл	22133	Продукты питания (folder)/Алкогольные напитки/Вино (folder)/Вино	0	
688407	3192371064730	Вино chateau бордо гонтье красн сух 13% 750мл Франция	22133	Продукты питания (folder)/Алкогольные напитки/Вино (folder)/Вино	0	
688606	3542950000022	Вино chateau бордо от терр красн сух 750мл 12.5% (Франция)	22133	Продукты питания (folder)/Алкогольные напитки/Вино (folder)/Вино	0	
688389	3542950000039	Вино chateau бордо рок де казад бел сух 13% 750мл (Франция)	22133	Продукты питания (folder)/Алкогольные напитки/Вино (folder)/Вино	0	
688390	3542950000015	Вино chateau бордо рок де казад красн сух 13% 750мл (Франция)	22133	Продукты питания (folder)/Алкогольные напитки/Вино (folder)/Вино	0	
688394	3258691227993	Вино chateau бордо шато икем бел сл.750мл	688367	Продукты питания (folder)/Алкогольные напитки/Вино (folder)/Вина Франции Бордо	688393	Шато Бордо
688395	3258690074932	Вино chateau бордо шато лафит rothschild pauillac красн сух 750мл	688367	Продукты питания (folder)/Алкогольные напитки/Вино (folder)/Вина Франции Бордо	688393	Шато Бордо
688396	3258690053074	Вино chateau бордо шато мутон ротш.пр.крю красн сух 750мл	688367	Продукты питания (folder)/Алкогольные напитки/Вино (folder)/Вина Франции Бордо	688393	Шато Бордо
2427421	3475380037170	Вино chateau борегар лагюпо грав бел сух 750мл/бордо	22133	Продукты питания (folder)/Алкогольные напитки/Вино (folder)/Вино	2427420	Шато Боргар Лагюпо
2427422	3475380046042	Вино chateau борегар лагюпо грав бел сух 750мл/бордо #2	22133	Продукты питания (folder)/Алкогольные напитки/Вино (folder)/Вино	2427420	Шато Боргар Лагюпо
3284029	4607055342404	Вино chateau бортоли Cabernet Sauvignon кюве красное сухое 12.5% 0.75 ст/б	22133	Продукты питания (folder)/Алкогольные напитки/Вино (folder)/Вино	0	
3284030	4607055342398	Вино chateau бортоли шенен блан кюве белое сухое 12.5% 0.75 ст/б	22133	Продукты питания (folder)/Алкогольные напитки/Вино (folder)/Вино	0	
47202	4607056601838	Вино chateau босежур 97 12.5% 750мл	41821	Продукты питания (folder)/Алкогольные напитки/Вино (folder)/Вина Франции	0	
1195985	3258610000461	Вино chateau бран кантенак красн сух 750мл	22133	Продукты питания (folder)/Алкогольные напитки/Вино (folder)/Вино	1195984	Шато Бран Кантенак
1195987	3760023691247	Вино chateau бран-кантенак гран крю классе aoc бордо красн сух 750мл	41821	Продукты питания (folder)/Алкогольные напитки/Вино (folder)/Вина Франции	1195986	Шато Бран-Кантенак
688397	3429670295016	Вино chateau браун пессак-леоньян 750мл 0%	22133	Продукты питания (folder)/Алкогольные напитки/Вино (folder)/Вино	0	
2976881	3429670549249	Вино chateau браун пессак-леоньян 750мл 0% #2	22133	Продукты питания (folder)/Алкогольные напитки/Вино (folder)/Вино	0	
2976882	3429670450781	Вино chateau браун пессак-леоньян 750мл 0% #3	22133	Продукты питания (folder)/Алкогольные напитки/Вино (folder)/Вино	0	
2976883	3429670396003	Вино chateau браун пессак-леоньян 750мл 0% #4	22133	Продукты питания (folder)/Алкогольные напитки/Вино (folder)/Вино	0	
47203	3258690110654	Вино chateau бриллет aoc мулис красн сух 12.5% 750мл	41821	Продукты питания (folder)/Алкогольные напитки/Вино (folder)/Вина Франции	0	
1194481	3295890165190	Вино chateau брион ля ромэн медок aoc красн сух 750мл 13% /Франция/	22133	Продукты питания (folder)/Алкогольные напитки/Вино (folder)/Вино	0	
3284031	4840182005051	Вино chateau бронешт Cabernet крас. сх. 10% 750мл стекло	22133	Продукты питания (folder)/Алкогольные напитки/Вино (folder)/Вино	0	
688398	3495335019914	Вино chateau букейрайн aoc красн сух 750мл 12.5%1999 (Франция)	22133	Продукты питания (folder)/Алкогольные напитки/Вино (folder)/Вино	0	
1195988	3388111079991	Вино chateau бурбон ла шапель, 750мл 12.0% сухое	22133	Продукты питания (folder)/Алкогольные напитки/Вино (folder)/Вино	0	
2427423	3295890180087	Вино chateau бурдон ля тур бордо бел/сух 12% 750мл	22133	Продукты питания (folder)/Алкогольные напитки/Вино (folder)/Вино	0	
2427424	3305164501255	Вино chateau бурдье фонбий 2005 бел полусладк 12% 750мл	22133	Продукты питания (folder)/Алкогольные напитки/Вино (folder)/Вино	0	
283577	3380820031796	Вино chateau бюскейрон aoc бордо бел сух 750мл 12.5% /Франция/	22133	Продукты питания (folder)/Алкогольные напитки/Вино (folder)/Вино	3790678	ШАТО БЮСКЕЙРОН
3790679	3380820031543	Вино chateau бюскейрон бел сух 12.5-13% 750мл	22133	Продукты питания (folder)/Алкогольные напитки/Вино (folder)/Вино	3790678	ШАТО БЮСКЕЙРОН
3790680	3760034940082	Вино chateau бюскейрон бел сух 12.5-13% 750мл #2	22133	Продукты питания (folder)/Алкогольные напитки/Вино (folder)/Вино	3790678	ШАТО БЮСКЕЙРОН
283578	3380820031772	Вино chateau бюскейрон бордо красн сух 750мл 12.5% /Франция/	22133	Продукты питания (folder)/Алкогольные напитки/Вино (folder)/Вино	3790678	ШАТО БЮСКЕЙРОН
3790681	3380820031536	Вино chateau бюскейрон красн сух 13% 750мл	22133	Продукты питания (folder)/Алкогольные напитки/Вино (folder)/Вино	3790678	ШАТО БЮСКЕЙРОН
151880	3500610018954	Вино chateau валь де бруэр кот дю лангедок красн сух 075л 12% /Франция/	22133	Продукты питания (folder)/Алкогольные напитки/Вино (folder)/Вино	149689	Русьимпорт
