ID	UPCEAN	Name	CategoryID	CategoryName	BrandID	BrandName
4928593	8059599162073	Liu jo jeans jeans slim bottom up ideal regular waist decorato con perle blu denim women 28 (us) - 42 (it)	4884259	Одежда и обувь (folder)/APPAREL	4928537	LIU JO
4928594	8059599162080	Liu jo jeans jeans slim bottom up ideal regular waist decorato con perle blu denim women 29 (us) - 42-44 (it)	4884259	Одежда и обувь (folder)/APPAREL	4928537	LIU JO
4928595	8059599162097	Liu jo jeans jeans slim bottom up ideal regular waist decorato con perle blu denim women 30 (us) - 44 (it)	4884259	Одежда и обувь (folder)/APPAREL	4928537	LIU JO
4928596	8059599162103	Liu jo jeans jeans slim bottom up ideal regular waist decorato con perle blu denim women 31 (us) - 44-46 (it)	4884259	Одежда и обувь (folder)/APPAREL	4928537	LIU JO
4928597	8052047996190	Liu jo jeans jeans slim bottom up ideal regular waist ornato con strass blu denim women 31 (us) - 44-46 (it)	4884259	Одежда и обувь (folder)/APPAREL	4928537	LIU JO
4928598	8052047984920	Liu jo jeans jeans slim bottom up magnetic regular waist blu denim chiaro women 29 (us) - 42-44 (it)	4884259	Одежда и обувь (folder)/APPAREL	4928537	LIU JO
4928599	8052047950697	Liu jo jeans jeans slim bottom up magnetic regular waist decorato con perle blu denim women 32 (us) - 46 (it)	4884259	Одежда и обувь (folder)/APPAREL	4928537	LIU JO
4928600	8059599205541	Liu jo jeans jeans slim bottom up magnetic regular waist effetto slavato blu denim scuro women 26 (us) - 40 (it)	4884259	Одежда и обувь (folder)/APPAREL	4928537	LIU JO
4928601	8056156856833	Liu jo jeans jeans slim bottom up magnetic regular waist Grigio denim women 27 (us) - 40-42 (it)	4884259	Одежда и обувь (folder)/APPAREL	4928537	LIU JO
4928602	8052047998385	Liu jo jeans jeans slim bottom up magnetic regular waist stampato blu denim scuro women 30 (us) - 44 (it)	4884259	Одежда и обувь (folder)/APPAREL	4928537	LIU JO
4928603	8052047998392	Liu jo jeans jeans slim bottom up magnetic regular waist stampato blu denim scuro women 31 (us) - 44-46 (it)	4884259	Одежда и обувь (folder)/APPAREL	4928537	LIU JO
4928604	8052047939616	Liu jo jeans jeans slim bottom up magnetic regular waist strappato blu denim women 28 (us) - 42 (it)	4884259	Одежда и обувь (folder)/APPAREL	4928537	LIU JO
4928605	8052047993922	Liu jo jeans jeans slim bottom up precious regular waist effetto vintage blu denim women 28 (us) - 42 (it)	4884259	Одежда и обувь (folder)/APPAREL	4928537	LIU JO
4928606	8052047993939	Liu jo jeans jeans slim bottom up precious regular waist effetto vintage blu denim women 29 (us) - 42-44 (it)	4884259	Одежда и обувь (folder)/APPAREL	4928537	LIU JO
4928607	8052047993946	Liu jo jeans jeans slim bottom up precious regular waist effetto vintage blu denim women 30 (us) - 44 (it)	4884259	Одежда и обувь (folder)/APPAREL	4928537	LIU JO
4928608	8052047993977	Liu jo jeans jeans slim bottom up precious regular waist effetto vintage blu denim women 33 (us) - 46-48 (it)	4884259	Одежда и обувь (folder)/APPAREL	4928537	LIU JO
4928609	8059599208115	Liu jo jeans jeans slim bottom up precious regular waist ornato con strass blu denim women 32 (us) - 46 (it)	4884259	Одежда и обувь (folder)/APPAREL	4928537	LIU JO
4928610	8390478766945	Liu jo jeans jeans slim fit effetto vintage blu denim men 31 (us) - 44/46 (it)	4884259	Одежда и обувь (folder)/APPAREL	4928537	LIU JO
4928611	8002135143241	Liu jo jo Gold EDP spray 30ml	3068	Парфюмерия (folder)/Парфюмерия	4928537	LIU JO
4928612	8002135133419	Liu jo jo scent EDT spray 50ml	3068	Парфюмерия (folder)/Парфюмерия	4928537	LIU JO
4928613	8002135133433	Liu jo jo scent EDT spray 75ml	3068	Парфюмерия (folder)/Парфюмерия	4928537	LIU JO
4928614	8002135151932	Liu jo lovely me EDP spray 30ml	3068	Парфюмерия (folder)/Парфюмерия	4928537	LIU JO
4928615	8002135151956	Liu jo lovely me EDP spray 50ml	3068	Парфюмерия (folder)/Парфюмерия	4928537	LIU JO
4928616	8002135148086	Liu jo lovely u EDP spray 100ml	3068	Парфюмерия (folder)/Парфюмерия	4928537	LIU JO
4928617	8002135148062	Liu jo lovely u EDP spray 50ml	3068	Парфюмерия (folder)/Парфюмерия	4928537	LIU JO
4928618	8002135153707	Liu jo lovely u EDP spray 50ml + EDP spray 10ml	3068	Парфюмерия (folder)/Парфюмерия	4928537	LIU JO
4928619	8059599220810	Liu jo mesh maglia beige chiaro women m - 42 (it)	4884259	Одежда и обувь (folder)/APPAREL	4928537	LIU JO
4928621	8052047977991	Liu jo mesh maglia in pizzo beige chiaro women m - 42 (it)	4884259	Одежда и обувь (folder)/APPAREL	4928537	LIU JO
4928622	8052047956064	Liu jo mesh maglia righe bianco E multicolore women m - 42 (it)	4884259	Одежда и обувь (folder)/APPAREL	4928537	LIU JO
4928623	8059599155174	Liu jo mesh maglia righe rosa antico E multicolore women m - 42 (it)	4884259	Одежда и обувь (folder)/APPAREL	4928537	LIU JO
4928624	8052047956439	Liu jo mesh maglia rosso women m - 42 (it)	4884259	Одежда и обувь (folder)/APPAREL	4928537	LIU JO
4928625	8059599220872	Liu jo mesh maglia senape women l - 44 (it)	4884259	Одежда и обувь (folder)/APPAREL	4928537	LIU JO
4928626	8002135156159	Liu jo milano EDP spray 75ml	3068	Парфюмерия (folder)/Парфюмерия	4928537	LIU JO
4928627	8059599644470	Liu jo skirt gonna dritta righe blu E bianco women m - 42 (it)	4884259	Одежда и обувь (folder)/APPAREL	4928537	LIU JO
4928628	8059599170900	Liu jo sweater maglia beige scuro E Color oro women xs - 38 (it)	4884259	Одежда и обувь (folder)/APPAREL	4928537	LIU JO
4928629	8390478716285	Liu jo sweater maglia bordino contrastante beige scuro men 2xl	4884259	Одежда и обувь (folder)/APPAREL	4928537	LIU JO
4928630	8052047960818	Liu jo sweater maglia filo metallizzato Color oro women xs - 38 (it)	4884259	Одежда и обувь (folder)/APPAREL	4928537	LIU JO
4928620	8059599547573	Liu jo sweater maglia filo metallizzato marrone pallido women xs - 38 (it)	4884259	Одежда и обувь (folder)/APPAREL	4928537	LIU JO
4928631	8059599218831	Liu jo sweater maglia rosso women s - 40 (it)	4884259	Одежда и обувь (folder)/APPAREL	4928537	LIU JO
4928662	8059599095142	Liu jo t-shirt in pizzo fucsia women xs - 38 (it)	4884259	Одежда и обувь (folder)/APPAREL	4928537	LIU JO
4928632	8059599154917	Liu jo tank top canotta maglia a coste nero women s - 40 (it)	4884259	Одежда и обувь (folder)/APPAREL	4928537	LIU JO
4928633	8052047936158	Liu jo tops top con volant bianco women 40 (it)	4884259	Одежда и обувь (folder)/APPAREL	4928537	LIU JO
4928634	8059599092677	Liu jo tops top motivo ricamato rosso women 46 (it)	4884259	Одежда и обувь (folder)/APPAREL	4928537	LIU JO
4928635	8059599338522	Liu jo trousers jogging effetto traforato Grigio chiaro women m - 42 (it)	4884259	Одежда и обувь (folder)/APPAREL	4928537	LIU JO
4928636	8059599338508	Liu jo trousers jogging effetto traforato Grigio chiaro women xs - 38 (it)	4884259	Одежда и обувь (folder)/APPAREL	4928537	LIU JO
4928637	8390478782495	Liu jo trousers jogging taglio dritto blu ardesia men 50 (it)	4884259	Одежда и обувь (folder)/APPAREL	4928537	LIU JO
4928638	8052047970985	Liu jo trousers pantalone complex dritto merletto bianco women 42 (it)	4884259	Одежда и обувь (folder)/APPAREL	4928537	LIU JO
4928639	8059599187038	Liu jo trousers pantaloni cargo nice regular waist ornato con strass cammello women 27 (us) - 40-42 (it)	4884259	Одежда и обувь (folder)/APPAREL	4928537	LIU JO
4928640	8059599091656	Liu jo trousers pantaloni cargo regular waist kaki women 27 (us) - 40-42 (it)	4884259	Одежда и обувь (folder)/APPAREL	4928537	LIU JO
4928641	8390478747623	Liu jo trousers pantaloni cargo taglio slim carbone men 42 (it)	4884259	Одежда и обувь (folder)/APPAREL	4928537	LIU JO
4928642	8059599198805	Liu jo trousers pantaloni chino classy regular waist marrone women 25 (us) - 38-40 (it)	4884259	Одежда и обувь (folder)/APPAREL	4928537	LIU JO
4928643	8059599198850	Liu jo trousers pantaloni chino classy regular waist marrone women 30 (us) - 44 (it)	4884259	Одежда и обувь (folder)/APPAREL	4928537	LIU JO
4928644	8390478789562	Liu jo trousers pantaloni chino loose fit nero men 52 (it)	4884259	Одежда и обувь (folder)/APPAREL	4928537	LIU JO
4928645	8390478748750	Liu jo trousers pantaloni chino taglio slim 20% lino navy men 48 (it)	4884259	Одежда и обувь (folder)/APPAREL	4928537	LIU JO
4928646	8390478553118	Liu jo trousers pantaloni chino taglio slim 30% lino navy men 52 (it)	4884259	Одежда и обувь (folder)/APPAREL	4928537	LIU JO
4928647	8390478526846	Liu jo trousers pantaloni chino taglio slim beige men 42 (it)	4884259	Одежда и обувь (folder)/APPAREL	4928537	LIU JO
4928648	8390478518490	Liu jo trousers pantaloni chino taglio slim blu notte men 44 (it)	4884259	Одежда и обувь (folder)/APPAREL	4928537	LIU JO
4928649	8390478746725	Liu jo trousers pantaloni chino taglio slim blu notte men 44 (it) #2	4884259	Одежда и обувь (folder)/APPAREL	4928537	LIU JO
4928650	8390478771017	Liu jo trousers pantaloni chino taglio slim blu notte men 48 (it)	4884259	Одежда и обувь (folder)/APPAREL	4928537	LIU JO
4928651	8390478712508	Liu jo trousers pantaloni chino taglio slim cammello men 44 (it)	4884259	Одежда и обувь (folder)/APPAREL	4928537	LIU JO
4928652	8390478745476	Liu jo trousers pantaloni chino taglio slim kaki men 46 (it)	4884259	Одежда и обувь (folder)/APPAREL	4928537	LIU JO
4928653	8390478746718	Liu jo trousers pantaloni chino taglio slim marrone men 44 (it)	4884259	Одежда и обувь (folder)/APPAREL	4928537	LIU JO
4928654	8390478746558	Liu jo trousers pantaloni chino taglio slim marrone men 46 (it)	4884259	Одежда и обувь (folder)/APPAREL	4928537	LIU JO
4928655	8390478746633	Liu jo trousers pantaloni chino taglio slim marrone men 48 (it)	4884259	Одежда и обувь (folder)/APPAREL	4928537	LIU JO
4928656	8390478520158	Liu jo trousers pantaloni chino taglio slim navy men 44 (it)	4884259	Одежда и обувь (folder)/APPAREL	4928537	LIU JO
4928657	8390478520141	Liu jo trousers pantaloni chino taglio slim nero men 44 (it)	4884259	Одежда и обувь (folder)/APPAREL	4928537	LIU JO
4928658	8390478772793	Liu jo trousers pantaloni chino taglio slim righe 55% lino blu ardesia men 54 (it)	4884259	Одежда и обувь (folder)/APPAREL	4928537	LIU JO
4928659	8059599138498	Liu jo trousers pantaloni cropped motivo ricamato bianco women 42 (it)	4884259	Одежда и обувь (folder)/APPAREL	4928537	LIU JO
4928660	8059599177787	Liu jo trousers pantaloni slim bottom up monroe regular waist stampato nero E bianco women 26 (us) - 40 (it)	4884259	Одежда и обувь (folder)/APPAREL	4928537	LIU JO
4928661	8059599150094	Liu jo trousers pantaloni zampetta motivo vichy bianco E nero women 46 (it)	4884259	Одежда и обувь (folder)/APPAREL	4928537	LIU JO
4488438	686478001161	Liuzza produce Farm inc 8 / 1# strawberry	1	Неклассифицированные/default	0	
2353321	8901138502706	Liv 52 ds 60tb prisum himalaya	1	Неклассифицированные/default	0	
2353322	8901138110642	Liv 52 solutie 100ml prisum himalaya	1	Неклассифицированные/default	0	
1991465	7350022270480	Liv Blue (net)	363351	Adult/Sex-Shop	0	
2353323	5060095080009	Liv breast self exam kit #2	1	Неклассифицированные/default	0	
302498	893329000017	Liv breast self&#45,exam kit	297057	Лекарственные средства (folder)/Health & Personal Care	302497	Liv
1991464	7350022270497	Liv cerise (net) (d)	363351	Adult/Sex-Shop	0	
3692460	4811248000983	Liv delano Aqua spa inten-iy regen. hd&n c 0.15kg tu	5586	Косметика (folder)/Косметика	619616	Liv Delano
3692461	4811248001331	Liv delano Aqua spa inten-iy regen. hd&n c 0.15kg tu #2	5586	Косметика (folder)/Косметика	619616	Liv Delano
4820745	4811248000853	Liv delano Aqua spa бальзам пит+увл для тел 200.0	241824	Лекарственные средства (folder)/Аптека	619616	Liv Delano
4820746	4811248001768	Liv delano Aqua spa гель-интим делик уход для душ 225	241824	Лекарственные средства (folder)/Аптека	619616	Liv Delano
4820747	4811248001751	Liv delano Aqua spa гель-интим увлаж для душ 225.0	241824	Лекарственные средства (folder)/Аптека	619616	Liv Delano
4820748	4811248000976	Liv delano Aqua spa Крем для уставших ног 150mg	241824	Лекарственные средства (folder)/Аптека	619616	Liv Delano
4820749	4811248001317	Liv delano Aqua spa Крем смягчающий для ног 150mg	241824	Лекарственные средства (folder)/Аптека	619616	Liv Delano
4820750	4811248000914	Liv delano Aqua spa Крем-душ антистресс 250.0	241824	Лекарственные средства (folder)/Аптека	619616	Liv Delano
4820751	4811248000907	Liv delano Aqua spa Крем-душ тонизирующий 250.0	241824	Лекарственные средства (folder)/Аптека	619616	Liv Delano
4820752	4811248000891	Liv delano Aqua spa Крем-душ увлажняющий 250.0	241824	Лекарственные средства (folder)/Аптека	619616	Liv Delano
4820753	4811248000969	Liv delano Aqua spa Крем-мыло гидробаланс 490.0	241824	Лекарственные средства (folder)/Аптека	619616	Liv Delano
619617	4811248001003	Liv delano Aqua spa лосьон для рук и ногт.успокаив. 460g	5586	Косметика (folder)/Косметика	619616	Liv Delano
3421345	4811248006831	Liv delano Aroma fantasy подарочный набор свежий микс (спрей для тела /гель для душа) 500g/к8	5586	Косметика (folder)/Косметика	619616	Liv Delano
3421346	4811248006817	Liv delano Aroma fantasy подарочный набор сочный гранат (спрей для тела /гель для душа) 500g/к8	5586	Косметика (folder)/Косметика	619616	Liv Delano
4928663	4811248006190	Liv delano Aroma fantasy спрей для тела свежий микс, лайм и малина 200ml/к18	5586	Косметика (folder)/Косметика	619616	Liv Delano
4928664	4811248006169	Liv delano Aroma fantasy спрей для тела сочный гранат 200ml/к18	5586	Косметика (folder)/Косметика	619616	Liv Delano
4928665	4811248006183	Liv delano Aroma fantasy спрей для тела фруктовый салат 200ml/к18	5586	Косметика (folder)/Косметика	619616	Liv Delano
3263744	4811248005766	Liv delano Classic beauty бальзам-интенсив для придания блеска волосам 250g/к20	1	Неклассифицированные/default	619616	Liv Delano
3594079	4811248005742	Liv delano Classic beauty шампунь для блеска и сияния волос 500g/к12	1412	Уход за волосами (folder)/Шампунь	619616	Liv Delano
3594080	4811248005728	Liv delano Classic beauty шампунь для ежедневного ухода для всех типов 500g/к12	1412	Уход за волосами (folder)/Шампунь	619616	Liv Delano
3594081	4811248005759	Liv delano Classic beauty шампунь для придания объема волосам 500g/к12	1412	Уход за волосами (folder)/Шампунь	619616	Liv Delano
3594082	4811248005735	Liv delano Classic beauty шампунь для сохранения цвета окрашенных волос 500g/к12	1412	Уход за волосами (folder)/Шампунь	619616	Liv Delano
3692466	4811248001386	Liv delano cristel sovershen.tsv.dl.svetl.vol. w wot con 0.27kg bo	2187	Уход за волосами (folder)/Кондиционер для волос	619616	Liv Delano
4820754	4811248001454	Liv delano cristel Крем-конд инт восст для окр 270.0	241824	Лекарственные средства (folder)/Аптека	619616	Liv Delano
4820755	4811248001409	Liv delano cristel Крем-конд совер цвета для тем 270	241824	Лекарственные средства (folder)/Аптека	619616	Liv Delano
4820756	4811248001256	Liv delano cristel шампунь интен восст для окр 400.0	241824	Лекарственные средства (folder)/Аптека	619616	Liv Delano
4820757	4811248001355	Liv delano cristel шампунь совер цвета для свет 400.0	241824	Лекарственные средства (folder)/Аптека	619616	Liv Delano
4820758	4811248001379	Liv delano cristel шампунь совер цвета для тем 400.0	241824	Лекарственные средства (folder)/Аптека	619616	Liv Delano
4928666	4811248006527	Liv delano fito complex Крем актив для укрепления контура лица 45+ дневной 45g/к18	5586	Косметика (folder)/Косметика	619616	Liv Delano
4928667	4811248006480	Liv delano fito complex Крем для лица дневной глубокое увлажнения 45g/к18	5586	Косметика (folder)/Косметика	619616	Liv Delano
4928668	4811248006497	Liv delano fito complex Крем для лица ночной интенсивное питание 45g/к18	5586	Косметика (folder)/Косметика	619616	Liv Delano
4928669	4811248006503	Liv delano fito complex Крем лифт-актив для коррекции мимических морщин 35+ дневной 45g/к18	5586	Косметика (folder)/Косметика	619616	Liv Delano
4928670	4811248006510	Liv delano fito complex Крем-антистресс для сохранения тонуса цвета лица 35+ ночной 45g/к18	5586	Косметика (folder)/Косметика	619616	Liv Delano
4928671	4811248006534	Liv delano fito complex Крем-интенсив для борьбы с возрастными изменениями 45+ ночной 45g/к18	5586	Косметика (folder)/Косметика	619616	Liv Delano
4928672	4811248006558	Liv delano fito complex Крем-концентрат восстанавливающий 55+ ночной 45g/к18	5586	Косметика (folder)/Косметика	619616	Liv Delano
4928673	4811248006541	Liv delano fito complex Крем-корректор омолаживающий 55+ дневной 45g/к18	5586	Косметика (folder)/Косметика	619616	Liv Delano
4928674	4811248006459	Liv delano fito complex мицеллярная вода 200ml/к18	5586	Косметика (folder)/Косметика	619616	Liv Delano
3498720	4811248006572	Liv delano fito complex ролик-гель антивозрастной для кожи вокруг глаз 45+ 14g/к18	1	Неклассифицированные/default	619616	Liv Delano
3498721	4811248006565	Liv delano fito complex ролик-гель для коррекции мимических морщин вокруг глаз 35+ 14g/к18	1	Неклассифицированные/default	619616	Liv Delano
3498740	4811248006589	Liv delano fito complex ролик-корректор интенсивный лифтинг для кожи вокруг глаз 55+ 14g/к18	1	Неклассифицированные/default	619616	Liv Delano
4928676	4811248006435	Liv delano fito complex фито-тоник для сухой чувствит кожи лица 200ml/к18	5586	Косметика (folder)/Косметика	619616	Liv Delano
4928677	4811248006442	Liv delano fito complex фито-тоник жирной кожи лица 200ml/к18	5586	Косметика (folder)/Косметика	619616	Liv Delano
4928678	4811248007395	Liv delano fleurs de france гель для ног освежайщий нежность пиона 75g/к36	5586	Косметика (folder)/Косметика	619616	Liv Delano
3692470	4811248007302	Liv delano fleurs de france интим-гель нежность пиона 300/20	362160	Гигиена (folder)/Гигиена интимная	619616	Liv Delano
4928679	4811248007388	Liv delano fleurs de france Крем для ног увлажняющий бархат фиалки 75g/к36	5586	Косметика (folder)/Косметика	619616	Liv Delano
4928680	4811248007371	Liv delano fleurs de france питательное Крем-масло для ног роскошь гиацинта 75g/к36	5586	Косметика (folder)/Косметика	619616	Liv Delano
3421872	4811248007678	Liv delano fleurs de france подарочный набор бархат фиалки (Крем для рук Крем для ног,спрей для тела) к 8	10304	Косметика (folder)/Крем для ног	619616	Liv Delano
3421874	4811248007685	Liv delano fleurs de france подарочный набор роскошь гиацинта (Крем для рук+для ног,спрей для тела) к 8	1438	Косметика (folder)/Крем для рук	619616	Liv Delano
4928681	4811248007463	Liv delano fleurs de france спрей мист для тела бархат фиалки 200g/к18	5586	Косметика (folder)/Косметика	619616	Liv Delano
4928682	4811248007456	Liv delano fleurs de france спрей мист для тела нежность пиона 200g/к18	5586	Косметика (folder)/Косметика	619616	Liv Delano
4928683	4811248007470	Liv delano fleurs de france спрей мист для тела роскошь гиацинта 200g/к18	5586	Косметика (folder)/Косметика	619616	Liv Delano
619620	4811248002468	Liv delano Flower Code бальзам для рук питат 75g	5586	Косметика (folder)/Косметика	619616	Liv Delano
619621	4811248002475	Liv delano Flower Code Крем для ног питат 75g	10304	Косметика (folder)/Крем для ног	619616	Liv Delano
619622	4811248002451	Liv delano Flower Code Крем для рук смягч 75g	1438	Косметика (folder)/Крем для рук	619616	Liv Delano
619623	4811248001782	Liv delano Flower Code молочко для рук успокаив. 205g	5586	Косметика (folder)/Косметика	619616	Liv Delano
4928684	4811248006848	Liv delano Gentleman подарочный набор (гель для душа city/шампунь) 600g/к8	5586	Косметика (folder)/Косметика	619616	Liv Delano
4928685	4811248007647	Liv delano Gentleman спрей для тела city 200ml/к18	5586	Косметика (folder)/Косметика	619616	Liv Delano
4928686	4811248007654	Liv delano Gentleman спрей для тела Sport 200ml/к18	5586	Косметика (folder)/Косметика	619616	Liv Delano
619631	4811248002659	Liv delano Green style anti aging Крем-лифтинг для кожи вокруг глаз 25g	5586	Косметика (folder)/Косметика	619616	Liv Delano
619632	4811248002796	Liv delano Green style anti aging мусс для очищ.и демакияжа 195g	5586	Косметика (folder)/Косметика	619616	Liv Delano
619637	4811248002758	Liv delano Green style lifting Крем-лифтинг для кожи вокруг глаз и губ 25g	5586	Косметика (folder)/Косметика	619616	Liv Delano
619641	4811248002765	Liv delano Green style matt пенка для норм и комбиниров.кожи 195g	5586	Косметика (folder)/Косметика	619616	Liv Delano
619645	4811248002772	Liv delano Green style Sensitive пенка для сух и чувств.кожи (00255) 200g	5586	Косметика (folder)/Косметика	619616	Liv Delano
3692476	4811248006053	Liv delano Green style гель-пенка увлажняющая для глубокого очищения лица 190/18	5586	Косметика (folder)/Косметика	619616	Liv Delano
4928687	4811248006046	Liv delano Green style гель-пенка ультрамягкая для сух чуств кожи лица 190/18	5586	Косметика (folder)/Косметика	619616	Liv Delano
619636	4811248002710	Liv delano Green style Крем восстанав. пр/признаков старения (35+,ночной) 45g/12	5586	Косметика (folder)/Косметика	619616	Liv Delano
619629	4811248002727	Liv delano Green style Крем пр/морщин интенсивного действия (45+дневной) 45g/12	5586	Косметика (folder)/Косметика	619616	Liv Delano
619630	4811248002734	Liv delano Green style Крем регенерирующий для борьбы с морщинами (45+,ночной) 45g/12	5586	Косметика (folder)/Косметика	619616	Liv Delano
619643	4811248002666	Liv delano Green style Крем экстрапит. для сух чувствит кожи (ночной) 45g/12	5586	Косметика (folder)/Косметика	619616	Liv Delano
619639	4811248002697	Liv delano Green style Крем-баланс для жирн и комб кожи (ночной) 45g/12	5586	Косметика (folder)/Косметика	619616	Liv Delano
