ID	UPCEAN	Name	CategoryID	CategoryName	BrandID	BrandName
365098	708002300790	Faith hand wash-Aloe Vera&tea tree 6x 300ml	1	Неклассифицированные/default	365091	Essential Care
374141	708002101168	Faith hemp,lemongrass&Green tea soap 6x 100g	1	Неклассифицированные/default	374140	Green Baby
4351600	093624248422	Faith Hill - cry CD single - australia version	1	Неклассифицированные/default	0	
4351601	093624879428	Faith Hill /fireflies (CD)	1	Неклассифицированные/default	0	
1899161	746480017724	Faith Hill for women 0.50oz EDT spray by coty	3068	Парфюмерия (folder)/Парфюмерия	299230	Coty
4351602	075993999938	Faith Hill-hits (DVD)	1	Неклассифицированные/default	0	
366128	4021457330348	Faith in Nature 5 litre pump for refilling 1x1	1	Неклассифицированные/default	593182	Faith In Nature
366130	3571060000134	Faith in Nature Aloe Vera Conditioner 6x 400ml	2187	Уход за волосами (folder)/Кондиционер для волос	593182	Faith In Nature
987698	708002400513	Faith in Nature Aloe Vera Shampoo 6x 400ml	1412	Уход за волосами (folder)/Шампунь	593182	Faith In Nature
366131	055358350024	Faith in Nature Aloe Vera Shampoo 6x 400ml #2	1412	Уход за волосами (folder)/Шампунь	593182	Faith In Nature
987699	7080022052907	Faith in Nature Aloe Vera&Green tea roll on Deo 6x 50ml	407	Парфюмерия (folder)/Дезодорант	593182	Faith In Nature
593184	708002708183	Faith in Nature antibacterial cleaning wipes 12x40 p	1	Неклассифицированные/default	593182	Faith In Nature
366158	5034511005020	Faith in Nature antibacterial wash up Liquid 6x 500ml	1	Неклассифицированные/default	593182	Faith In Nature
2580288	708002908408	Faith in Nature antibacterial washing up Liquid 1x5 l	1	Неклассифицированные/default	593182	Faith In Nature
593183	708002108402	Faith in Nature antibacterial washing up Liquid 6x 500ml	1	Неклассифицированные/default	593182	Faith In Nature
593177	708002530517	Faith in Nature banded Aloe Vera Shampoo + Conditioner New! 3x2 x 250ml	1412	Уход за волосами (folder)/Шампунь	593182	Faith In Nature
593178	7080025305185	Faith in Nature banded Lavender&geranium Shampoo + Conditioner New! 3x2 x 250ml	1412	Уход за волосами (folder)/Шампунь	593182	Faith In Nature
593179	7080025305192	Faith in Nature banded rosemary Shampoo + Conditioner New! 3x2 x 250ml	1412	Уход за волосами (folder)/Шампунь	593182	Faith In Nature
1462576	708002360466	Faith in Nature bar soap gift bag - Orange/choc/Lavender 6x3 x 100g	146	Гигиена (folder)/Мыло	593182	Faith In Nature
2580289	708002908200	Faith in Nature bathroom antibacterial spray cleaner 1x5 l	1	Неклассифицированные/default	593182	Faith In Nature
363803	708002108273	Faith in Nature bathroom antibacterial spray cleaner 6x 500ml	274405	Хозяйственные товары (folder)/Бытовая химия (folder)/Средство для мытья посуды	363793	Ecover
366159	5034511005228	Faith in Nature bathroom antibacterial spray cleaner 6x 500ml #2	1	Неклассифицированные/default	593182	Faith In Nature
366134	5060164450061	Faith in Nature bulk Aloe Vera Shampoo 5l	1412	Уход за волосами (folder)/Шампунь	593182	Faith In Nature
366135	4021457330331	Faith in Nature bulk Aloe Vera Shower Gel&Foam Bath 5l #2	401	Гигиена (folder)/Гель для душа	593182	Faith In Nature
366136	5060164450047	Faith in Nature bulk hand wash Aloe Vera&tea tree 5l #2	366	Гигиена (folder)/Мыло жидкое	593182	Faith In Nature
366138	4021457379408	Faith in Nature bulk jojoba Conditioner 5l	2187	Уход за волосами (folder)/Кондиционер для волос	593182	Faith In Nature
366139	4021457379194	Faith in Nature bulk Lavender&geranium Conditioner 5l	2187	Уход за волосами (folder)/Кондиционер для волос	593182	Faith In Nature
366140	4021457330324	Faith in Nature bulk Lavender&geranium Shower Gel&Foam Bath 5l #2	401	Гигиена (folder)/Гель для душа	593182	Faith In Nature
366141	4021457379118	Faith in Nature bulk rosemary Conditioner 5l	2187	Уход за волосами (folder)/Кондиционер для волос	593182	Faith In Nature
366143	4021457330317	Faith in Nature bulk seaweed Conditioner 5l	2187	Уход за волосами (folder)/Кондиционер для волос	593182	Faith In Nature
366145	4021457330355	Faith in Nature chocolate Conditioner 6x 400ml	2187	Уход за волосами (folder)/Кондиционер для волос	593182	Faith In Nature
4910608	9024721546204	Faith in Nature Coconut Conditioner 400ml	5586	Косметика (folder)/Косметика	0	
987706	7080024005208	Faith in Nature Conditioner Aloe Vera 6x 400ml	336078	Гигиена (folder)/Personal Hygiene	593182	Faith In Nature
987707	7080024014286	Faith in Nature Conditioner ginkgo biloba 6x 400ml	336078	Гигиена (folder)/Personal Hygiene	593182	Faith In Nature
987708	7080024011216	Faith in Nature Conditioner hemp&meadowfoam 6x 400ml	336078	Гигиена (folder)/Personal Hygiene	593182	Faith In Nature
987709	7080024006298	Faith in Nature Conditioner jojoba 6x 400ml	336078	Гигиена (folder)/Personal Hygiene	593182	Faith In Nature
987710	7080024004218	Faith in Nature Conditioner Lavender&geranium 6x 400ml	336078	Гигиена (folder)/Personal Hygiene	593182	Faith In Nature
987711	7080024001248	Faith in Nature Conditioner rosemary 6x 400ml	336078	Гигиена (folder)/Personal Hygiene	593182	Faith In Nature
987712	7080024002238	Faith in Nature Conditioner seaweed 6x 400ml	336078	Гигиена (folder)/Personal Hygiene	593182	Faith In Nature
987713	7080024107278	Faith in Nature Conditioner tea tree 6x 400ml	336078	Гигиена (folder)/Personal Hygiene	593182	Faith In Nature
1462577	7080023051633	Faith in Nature Deo - refill Aloe Vera&Chamomile 6x 50ml	336078	Гигиена (folder)/Personal Hygiene	593182	Faith In Nature
1462578	7080023052623	Faith in Nature Deo - refill Aloe Vera&Green tea 6x 50ml	336078	Гигиена (folder)/Personal Hygiene	593182	Faith In Nature
1462579	7080023051947	Faith in Nature Deo - roll on Aloe Vera&Chamomile 6x 50ml	336078	Гигиена (folder)/Personal Hygiene	593182	Faith In Nature
1462580	7080023052937	Faith in Nature Deo - roll on Aloe Vera&Green tea 6x 50ml	336078	Гигиена (folder)/Personal Hygiene	593182	Faith In Nature
2580290	708002908507	Faith in Nature dishwasher Gel 1x5 l	1	Неклассифицированные/default	593182	Faith In Nature
593185	708002108501	Faith in Nature dishwasher Gel 6x 500ml	1	Неклассифицированные/default	593182	Faith In Nature
987714	708002616075	Faith in Nature feminine wash 6x 200ml	336078	Гигиена (folder)/Personal Hygiene	593182	Faith In Nature
987715	7080027080806	Faith in Nature feminine wipes 12x15 's	336078	Гигиена (folder)/Personal Hygiene	593182	Faith In Nature
987716	7080024005376	Faith in Nature Foam Bath Aloe Vera 6x 400ml	336078	Гигиена (folder)/Personal Hygiene	593182	Faith In Nature
987717	7080024004386	Faith in Nature Foam Bath Lavender&geranium 6x 400ml	336078	Гигиена (folder)/Personal Hygiene	593182	Faith In Nature
987718	7080024007356	Faith in Nature Foam Bath tea tree 6x 400ml	336078	Гигиена (folder)/Personal Hygiene	593182	Faith In Nature
987719	7080024013364	Faith in Nature Foam Bath with org.chocolate 6x 400ml	336078	Гигиена (folder)/Personal Hygiene	593182	Faith In Nature
4910609	190283211474	Faith in Nature geranium and Lavender Body wash	5586	Косметика (folder)/Косметика	0	
987701	708002301667	Faith in Nature Grapefruit soap New! 6x 100g	1	Неклассифицированные/default	593182	Faith In Nature
987702	708002401626	Faith in Nature Grapefruit&Orange Conditioner 6x 400ml	1	Неклассифицированные/default	593182	Faith In Nature
987703	708002401619	Faith in Nature Grapefruit&Orange Shampoo for Normal to oily Hair 400ml	1412	Уход за волосами (folder)/Шампунь	593182	Faith In Nature
987704	708002401671	Faith in Nature Grapefruit&Orange Shower Gel&Foam Bath 6x 400ml	401	Гигиена (folder)/Гель для душа	593182	Faith In Nature
987720	7080023007906	Faith in Nature hand wash Aloe Vera&tea tree 6x 300ml	336078	Гигиена (folder)/Personal Hygiene	593182	Faith In Nature
374147	708002900495	Faith in Nature hand wash bulk - Aloe Vera&tea tree 5l	1	Неклассифицированные/default	374146	Green Bay
374148	708002900792	Faith in Nature hand wash bulk - Lavender&geranium 5l	1	Неклассифицированные/default	374146	Green Bay
987705	708002301698	Faith in Nature hand wash Grapefruit&Orange 6x 300ml	1	Неклассифицированные/default	593182	Faith In Nature
987721	7080023004936	Faith in Nature hand wash Lavender&geranium 6x 300ml	336078	Гигиена (folder)/Personal Hygiene	593182	Faith In Nature
366152	8016744503068	Faith in Nature hand wash-Aloe Vera&tea tree 6x 300ml #2	366	Гигиена (folder)/Мыло жидкое	593182	Faith In Nature
366154	4021457310333	Faith in Nature hemp&meadowfoam Conditioner 6x 400ml	2187	Уход за волосами (folder)/Кондиционер для волос	593182	Faith In Nature
593181	708002401114	Faith in Nature hemp&meadowfoam Shampoo 6x 400ml	1412	Уход за волосами (folder)/Шампунь	593182	Faith In Nature
366156	8016744500098	Faith in Nature hemp,lemongrass&Green tea soap 6x 100g #2	146	Гигиена (folder)/Мыло	593182	Faith In Nature
2580291	708002908309	Faith in Nature laundry Liquid 1x5 l	1	Неклассифицированные/default	593182	Faith In Nature
593186	708002708305	Faith in Nature laundry Liquid 6x1 l	1	Неклассифицированные/default	593182	Faith In Nature
1462581	7080021083056	Faith in Nature laundry Liquid superconcentrated 6x1 l	900735	Хозяйственные товары (folder)/Бытовая химия (folder)/Cleaning Products	593182	Faith In Nature
366165	4021457310326	Faith in Nature Lavender&geranium Conditioner 6x 400ml	2187	Уход за волосами (folder)/Кондиционер для волос	593182	Faith In Nature
1462582	708002361678	Faith in Nature Mini Shower Gel gift bag (see above for items) 6x5 x 100ml	287296	Сувениры и подарки (folder)/Упаковка подарочная	593182	Faith In Nature
2580292	708002908101	Faith in Nature multi surface antibacterial spray cleaner 1x5 l	1	Неклассифицированные/default	593182	Faith In Nature
363802	708002108174	Faith in Nature multi surface antibacterial spray cleaner 6x 500ml	274405	Хозяйственные товары (folder)/Бытовая химия (folder)/Средство для мытья посуды	363793	Ecover
366160	5034511005006	Faith in Nature multi surface antibacterial spray cleaner 6x 500ml #2	1	Неклассифицированные/default	593182	Faith In Nature
1462583	7080021081830	Faith in Nature multi-surface antibacterial wipes 12x40 's	900735	Хозяйственные товары (folder)/Бытовая химия (folder)/Cleaning Products	593182	Faith In Nature
366168	4021457310364	Faith in Nature neem&propolis Conditioner 6x 400ml	2187	Уход за волосами (folder)/Кондиционер для волос	593182	Faith In Nature
593188	708002400926	Faith in Nature pomegranate&rooibos Conditioner 6x 400ml	1	Неклассифицированные/default	593182	Faith In Nature
593189	708002400919	Faith in Nature pomegranate&rooibos Shampoo 6x 400ml	1412	Уход за волосами (folder)/Шампунь	593182	Faith In Nature
987751	708002401725	Faith in Nature Raspberry&cranberry Conditioner 6x 400ml	1	Неклассифицированные/default	593182	Faith In Nature
987752	708002401718	Faith in Nature Raspberry&cranberry Shampoo 6x 400ml	1412	Уход за волосами (folder)/Шампунь	593182	Faith In Nature
987753	708002401770	Faith in Nature Raspberry&cranberry Shower Gel&Foam Bath 6x 400ml	401	Гигиена (folder)/Гель для душа	593182	Faith In Nature
366175	5060010680062	Faith in Nature refill Aloe Vera&Chamomile roll on Deo 6x 50ml	407	Парфюмерия (folder)/Дезодорант	593182	Faith In Nature
593190	708002205163	Faith in Nature refill Aloe Vera&Chamomile roll on Deo 6x 50ml #2	407	Парфюмерия (folder)/Дезодорант	593182	Faith In Nature
366176	7791940020113	Faith in Nature refill Aloe Vera&Green tea roll on Deo 6x 50ml	407	Парфюмерия (folder)/Дезодорант	593182	Faith In Nature
593191	708002205262	Faith in Nature refill Aloe Vera&Green tea roll on Deo 6x 50ml #2	407	Парфюмерия (folder)/Дезодорант	593182	Faith In Nature
366177	5060238480086	Faith in Nature rejuvenating facial wash 6x 150ml	1	Неклассифицированные/default	593182	Faith In Nature
366178	5060238480048	Faith in Nature replenishing moisturising Cream 6x 50ml	1	Неклассифицированные/default	593182	Faith In Nature
366180	708002600166	Faith in Nature rosemary soap 18x 100g	146	Гигиена (folder)/Мыло	593182	Faith In Nature
366181	4021457310340	Faith in Nature seaweed Conditioner 6x 400ml	2187	Уход за волосами (folder)/Кондиционер для волос	593182	Faith In Nature
987722	7080024005130	Faith in Nature Shampoo Aloe Vera 6x 400ml	336078	Гигиена (folder)/Personal Hygiene	593182	Faith In Nature
987723	7080024014118	Faith in Nature Shampoo ginkgo biloba 6x 400ml	336078	Гигиена (folder)/Personal Hygiene	593182	Faith In Nature
987724	7080024011148	Faith in Nature Shampoo hemp&meadowfoam 6x 400ml	336078	Гигиена (folder)/Personal Hygiene	593182	Faith In Nature
987725	7080024006120	Faith in Nature Shampoo jojoba 6x 400ml	336078	Гигиена (folder)/Personal Hygiene	593182	Faith In Nature
987726	7080024004140	Faith in Nature Shampoo Lavender&geranium 6x 400ml	336078	Гигиена (folder)/Personal Hygiene	593182	Faith In Nature
987727	7080024012138	Faith in Nature Shampoo neem&propolis 6x 400ml	336078	Гигиена (folder)/Personal Hygiene	593182	Faith In Nature
987728	7080024001170	Faith in Nature Shampoo rosemary 6x 400ml	336078	Гигиена (folder)/Personal Hygiene	593182	Faith In Nature
987729	7080024002160	Faith in Nature Shampoo seaweed 6x 400ml	336078	Гигиена (folder)/Personal Hygiene	593182	Faith In Nature
987730	7080024007110	Faith in Nature Shampoo tea tree 6x 400ml	336078	Гигиена (folder)/Personal Hygiene	593182	Faith In Nature
987731	7080024013128	Faith in Nature Shampoo with org.chocolate 6x 400ml	336078	Гигиена (folder)/Personal Hygiene	593182	Faith In Nature
1462584	7080021017440	Faith in Nature Skin Care - hand Cream 6x 50ml	336078	Гигиена (folder)/Personal Hygiene	593182	Faith In Nature
1462585	7080021017846	Faith in Nature Skin Care - intensive moisturising Cream 6x 50ml	336078	Гигиена (folder)/Personal Hygiene	593182	Faith In Nature
1462586	7080021017747	Faith in Nature Skin Care - replenishing moisturising Cream 6x 50ml	336078	Гигиена (folder)/Personal Hygiene	593182	Faith In Nature
987732	7080021017556	Faith in Nature Skin Care Aloe Vera Eye Gel 6x 50g	336078	Гигиена (folder)/Personal Hygiene	593182	Faith In Nature
987733	7080021020594	Faith in Nature Skin Care cleansing Lotion 6x 150ml	336078	Гигиена (folder)/Personal Hygiene	593182	Faith In Nature
987734	7080021021584	Faith in Nature Skin Care face&Body scrub 6x 150ml	336078	Гигиена (folder)/Personal Hygiene	593182	Faith In Nature
987735	7080021022574	Faith in Nature Skin Care facial wash 6x 150ml	336078	Гигиена (folder)/Personal Hygiene	593182	Faith In Nature
366127	708002704086	Faith in Nature Skin Care facial wipes 12x25 pk	499	Гигиена (folder)/Салфетки влажные	593182	Faith In Nature
987736	50079841	Faith in Nature Skin Care hand Cream 6x 50g	336078	Гигиена (folder)/Personal Hygiene	593182	Faith In Nature
218536	50079834	Faith in Nature Skin Care moisturising Cream 6x 50g	5586	Косметика (folder)/Косметика	593182	Faith In Nature
987737	50079865	Faith in Nature Skin Care moisturising Night Cream 6x 50g	336078	Гигиена (folder)/Personal Hygiene	593182	Faith In Nature
987738	7080021019536	Faith in Nature Skin Care toning Lotion 6x 150ml	336078	Гигиена (folder)/Personal Hygiene	593182	Faith In Nature
1462587	708002167157	Faith in Nature skincare Body gift bag - Body polish/Body Lotion 6x2 x 150ml	287296	Сувениры и подарки (folder)/Упаковка подарочная	593182	Faith In Nature
1462588	7080025674441	Faith in Nature skincare Mini gift bag (see above for items) 6x3 x 50ml	287296	Сувениры и подарки (folder)/Упаковка подарочная	593182	Faith In Nature
987739	7080026005626	Faith in Nature soap Aloe Vera&ylang ylang 18x 100g	336078	Гигиена (folder)/Personal Hygiene	593182	Faith In Nature
987740	7080021007410	Faith in Nature soap Aloe Vera&ylang ylang 6x 100g	336078	Гигиена (folder)/Personal Hygiene	593182	Faith In Nature
987741	7080026011634	Faith in Nature soap hemp lemongrass&Green tea (unwrapped) 18x 100g	336078	Гигиена (folder)/Personal Hygiene	593182	Faith In Nature
987742	7080021011684	Faith in Nature soap hemp lemongrass&Green tea 6x 100g	336078	Гигиена (folder)/Personal Hygiene	593182	Faith In Nature
987743	708002600463	Faith in Nature soap Lavender (unwrapped) 18x 100g	336078	Гигиена (folder)/Personal Hygiene	593182	Faith In Nature
987744	7080021012674	Faith in Nature soap neem&propolis 6x 100g	336078	Гигиена (folder)/Personal Hygiene	593182	Faith In Nature
987745	7080026016684	Faith in Nature soap Orange (unwrapped) 18x 100g	336078	Гигиена (folder)/Personal Hygiene	593182	Faith In Nature
987746	7080026001666	Faith in Nature soap rosemary (unwrapped) 18x 100g	336078	Гигиена (folder)/Personal Hygiene	593182	Faith In Nature
987747	5013575111182	Faith in Nature soap seaweed 6x 100g	336078	Гигиена (folder)/Personal Hygiene	593182	Faith In Nature
987748	7080021013664	Faith in Nature soap with org.chocolate 6x 100g	336078	Гигиена (folder)/Personal Hygiene	593182	Faith In Nature
987749	7080026007606	Faith in Nature soap with org.tea tree 18x 100g	336078	Гигиена (folder)/Personal Hygiene	593182	Faith In Nature
987750	7080021005430	Faith in Nature soap with org.tea tree 6x 100g	336078	Гигиена (folder)/Personal Hygiene	593182	Faith In Nature
1462589	708002470516	Faith in Nature Special value pack - Aloe Vera 12x2 x 400ml	336078	Гигиена (folder)/Personal Hygiene	593182	Faith In Nature
1462590	708002470417	Faith in Nature Special value pack - Lavender&geranium 12x2 x 400ml	336078	Гигиена (folder)/Personal Hygiene	593182	Faith In Nature
1462591	708002470219	Faith in Nature Special value pack - seaweed 12x2 x 400ml	336078	Гигиена (folder)/Personal Hygiene	593182	Faith In Nature
593192	708002410727	Faith in Nature tea tree Conditioner (2% Oil) 6x 400ml	1	Неклассифицированные/default	593182	Faith In Nature
366184	5060164450085	Faith in Nature tea tree Shampoo (2% Oil) 6x 400ml	1412	Уход за волосами (folder)/Шампунь	593182	Faith In Nature
1462592	708002560552	Faith in Nature twin pack Aloe Vera Shampoo/Conditioner 6x2 x 250ml	1	Неклассифицированные/default	593182	Faith In Nature
1462593	708002560255	Faith in Nature twin pack Aloe Vera/seaweed Foam baths 6x2 x 250ml	1	Неклассифицированные/default	593182	Faith In Nature
1462594	708002561610	Faith in Nature twin pack Grapefruit&Orange Shampoo&Conditioner 6x2 x 250ml	1	Неклассифицированные/default	593182	Faith In Nature
1462595	708002561672	Faith in Nature twin pack Grapefruit&Orange/rasp&cranberry Foam baths 6x2 x 250ml	1	Неклассифицированные/default	593182	Faith In Nature
1462596	708002560453	Faith in Nature twin pack Lavender&geranium Shampoo&Conditioner 6x2 x 250ml	1	Неклассифицированные/default	593182	Faith In Nature
1462597	708002561375	Faith in Nature twin pack Lavender&geranium/choc Foam baths 6x2 x 250ml	1	Неклассифицированные/default	593182	Faith In Nature
1462598	708002561719	Faith in Nature twin pack Raspberry&cranberry Shampoo&Conditioner 6x2 x 250ml	1	Неклассифицированные/default	593182	Faith In Nature
366161	8016744503037	Faith in Nature value pack Aloe Vera - Shampoo+Shower Gel 12x2 x 400ml	401	Гигиена (folder)/Гель для душа	593182	Faith In Nature
366162	8016744503051	Faith in Nature value pack Lavender&geranium - Shampoo+Shower Gel 12x2 x 400ml	401	Гигиена (folder)/Гель для душа	593182	Faith In Nature
366163	8016744503044	Faith in Nature value pack seaweed - Shampoo+Shower Gel 12x2 x 400ml	401	Гигиена (folder)/Гель для душа	593182	Faith In Nature
4910607	7425725949916	Faith in Nature | loose soap - Coconut | 18x 100g	5586	Косметика (folder)/Косметика	0	
593187	022735308336	Faith is knowing that he will	1	Неклассифицированные/default	0	
2972668	022735371378	Faith is knowing that he will #2	1	Неклассифицированные/default	0	
2580293	708002100451	Faith Lavender Body Lotion 6x 150ml	1	Неклассифицированные/default	1462574	Faith
2580294	708002200441	Faith Lavender hand Cream 6x 50ml	1	Неклассифицированные/default	1462574	Faith
365100	708002400414	Faith Lavender&geranium Shampoo 6x 400ml	1412	Уход за волосами (folder)/Шампунь	365091	Essential Care
374272	708002400438	Faith Lavender&geranium Shower Gel&Foam Bath 6x 400ml	401	Гигиена (folder)/Гель для душа	374244	Green People
79281	4021457260423	Faith Lavender&geranium Shower Gel&Foam Bath 6x 400ml #2	130	Гигиена (folder)/После бритья	37974	Lavera
2580295	708002405921	Faith Lemon&tea tree Conditioner 6x 400ml	1	Неклассифицированные/default	1462574	Faith
2580296	708002405914	Faith Lemon&tea tree Shampoo 6x 400ml	1	Неклассифицированные/default	1462574	Faith
2580297	708002405976	Faith Lemon&tea tree Shower Gel&Foam Bath 6x 400ml	1	Неклассифицированные/default	1462574	Faith
1462599	5011166050391	Faith Merlot	22133	Продукты питания (folder)/Алкогольные напитки/Вино (folder)/Вино	0	
2580298	708002401824	Faith mint Conditioner 6x 400ml	1	Неклассифицированные/default	1462574	Faith
2580299	708002401817	Faith mint Shampoo 6x 400ml	1	Неклассифицированные/default	1462574	Faith
2580300	708002401879	Faith mint Shower Gel&Foam Bath 6x 400ml	1	Неклассифицированные/default	1462574	Faith
75567	4021457260416	Faith Natural push up Stick Deo 6x 100g	130	Гигиена (folder)/После бритья	37974	Lavera
2580301	639842819923	Faith no more - album of the year CD 281992	4093300	Медиа (folder)/Media	0	
2580302	7981687711867	Faith no more - coachella festival DVD 654-877118	4093300	Медиа (folder)/Media	0	
2580303	639842820127	Faith no more - introduce yourself CD 282012	4093300	Медиа (folder)/Media	0	
2580304	639842820226	Faith no more - King for a Day, foolfor CD 282022	4093300	Медиа (folder)/Media	0	
2580305	5052498518029	Faith no more - Original album series-5 CD 8518022	4093300	Медиа (folder)/Media	0	
2580306	5051011173424	Faith no more - Platinum collection CD 117342	4093300	Медиа (folder)/Media	0	
2580307	825646568253	Faith no more - the triple album collect CD 6568252	4093300	Медиа (folder)/Media	0	
2580308	5051865440123	Faith no more - the very best definitive CD 544012	4093300	Медиа (folder)/Media	0	
2580309	639842820622	Faith no more - who cares a lot? CD 282062	4093300	Медиа (folder)/Media	0	
4351603	081227994020	Faith no more introduce yourself	1	Неклассифицированные/default	0	
4351604	603497162321	Faith no more-who cares a lot-greatest hits/live at brixton (DVD/2 disc)	1	Неклассифицированные/default	0	
4351605	043396115699	Faith of my fathers (DVD/ws 1.78 anamorphic/dd 5.1/eng-fr-sub)	1	Неклассифицированные/default	0	
4351606	618321521854	Faith of our fathers (DVD)	1	Неклассифицированные/default	0	
4351607	842977082241	Faith of our fathers (DVD/ff)	1	Неклассифицированные/default	0	
4351608	736899122324	Faith of the Century-history of communism (DVD) (2discs)	1	Неклассифицированные/default	0	
2580310	708002401022	Faith pineapple&Lime Conditioner 6x 400ml	1	Неклассифицированные/default	1462574	Faith
2580311	708002401015	Faith pineapple&Lime Shampoo 6x 400ml	1	Неклассифицированные/default	1462574	Faith
2580312	708002401077	Faith pineapple&Lime Shower Gel&Foam Bath 6x 400ml	1	Неклассифицированные/default	1462574	Faith
2580313	708002301063	Faith pineapple&Lime soap 6x 100g	1	Неклассифицированные/default	1462574	Faith
2580314	708002400971	Faith pomegranate&rooibos Shower Gel&Foam Bath 6x 400ml	1	Неклассифицированные/default	1462574	Faith
