ID	UPCEAN	Name	CategoryID	CategoryName	BrandID	BrandName
4038824	016000733466	Betty crocker Fruit snacks 1ct 54cs	1	Неклассифицированные/default	183807	Betty Crocker
1393008	016000346178	Betty crocker Fruit snacks animal Planet assorted	1	Неклассифицированные/default	183807	Betty Crocker
1393089	016000177314	Betty crocker Fruit snacks Care bears Fruit Juice from concentrates (Apple, pear), corn syrup, sugar, modified corn starch, c	1	Неклассифицированные/default	183807	Betty Crocker
1393230	016000168466	Betty crocker Fruit snacks Fruit by the foot crazy feet	1	Неклассифицированные/default	183807	Betty Crocker
1393232	016000542402	Betty crocker Fruit snacks looney tunes assorted flavors	1	Неклассифицированные/default	183807	Betty Crocker
1393233	016000140530	Betty crocker Fruit snacks polly pocket	1	Неклассифицированные/default	183807	Betty Crocker
1393235	016000237605	Betty crocker Fruit snacks scooby doo Fruit Juice from concentrates (Apple, pear), corn syrup, sugar, modified corn starch, c	1	Неклассифицированные/default	183807	Betty Crocker
1393236	016000151901	Betty crocker Fruit snacks shrek	1	Неклассифицированные/default	183807	Betty Crocker
1393237	016000431447	Betty crocker Fruit snacks teenage mutant ninja turtles	1	Неклассифицированные/default	183807	Betty Crocker
4131546	065633447929	Betty crocker Fruit-o-Long 128g	1	Неклассифицированные/default	183807	Betty Crocker
4131545	016000179325	Betty crocker Fruit/foot narnia vp 9oz	1	Неклассифицированные/default	183807	Betty Crocker
4131547	016000163805	Betty crocker fruity peel-outs cartoon network Fruit punch s1 5oz	1	Неклассифицированные/default	183807	Betty Crocker
1393240	016000493407	Betty crocker frut by ft	1	Неклассифицированные/default	183807	Betty Crocker
4131548	016000281394	Betty crocker ft create-a-bug 9oz	1	Неклассифицированные/default	183807	Betty Crocker
4131549	016000605589	Betty crocker ftr snack 147ct	1	Неклассифицированные/default	183807	Betty Crocker
1383012	5010084901266	Betty crocker fudge brownie Mix 2.19 415g	1	Неклассифицированные/default	183807	Betty Crocker
2534075	016000419513	Betty crocker fun Da-middles chocolate cupcake Mix with vanilla filling	1	Неклассифицированные/default	183807	Betty Crocker
2534076	016000419520	Betty crocker fun Da-middles Yellow cupcake Mix with creamy chocolate filling	1	Неклассифицированные/default	183807	Betty Crocker
2534077	016000419537	Betty crocker fun Da-middles Yellow cupcake Mix with vanilla filling	1	Неклассифицированные/default	183807	Betty Crocker
1393243	016000476004	Betty crocker fundamddles	1	Неклассифицированные/default	183807	Betty Crocker
4034767	016000281509	Betty crocker garlic alfredo rr 5.2oz	1	Неклассифицированные/default	183807	Betty Crocker
1393013	071169760005	Betty crocker Gel Food colors 4 Easy to use tubes 2.7oz (77g)	1	Неклассифицированные/default	183807	Betty Crocker
2534078	071169820938	Betty crocker Gel Food colors bold Black, Dark Blue, brown, White - 4ct	1	Неклассифицированные/default	183807	Betty Crocker
921864	065633109100	Betty crocker general mills nacho Cheese bugles corn snacks	1	Неклассифицированные/default	183807	Betty Crocker
921862	065633109117	Betty crocker general mills sour Cream&onion corn snacks bugles	1	Неклассифицированные/default	183807	Betty Crocker
3018064	016000169913	Betty crocker gingerbrd cokie Mix 17.5oz	330591	Продукты питания (folder)/Продукты питания	183807	Betty Crocker
4131550	016000118812	Betty crocker gingerbread 32oz	1	Неклассифицированные/default	183807	Betty Crocker
2534079	071169814548	Betty crocker glitter icing shimmering Blue	1	Неклассифицированные/default	183807	Betty Crocker
1393185	071169720054	Betty crocker glitter icing shimmering Green	1	Неклассифицированные/default	183807	Betty Crocker
1393182	071169720030	Betty crocker glitter icing shimmering Red	1	Неклассифицированные/default	183807	Betty Crocker
2534080	071169814555	Betty crocker glitter icing shimmering Red #2	1	Неклассифицированные/default	183807	Betty Crocker
2534081	016000277939	Betty crocker gluten free chocolate brownie Mix	1	Неклассифицированные/default	183807	Betty Crocker
2534082	016000277946	Betty crocker gluten free chocolate chip cookie Mix 19oz	1	Неклассифицированные/default	183807	Betty Crocker
2534083	016000277922	Betty crocker gluten free devil's Food cake Mix	1	Неклассифицированные/default	183807	Betty Crocker
3018098	016000486836	Betty crocker gluten free pizza crust Mix	330591	Продукты питания (folder)/Продукты питания	183807	Betty Crocker
2782129	016000458956	Betty crocker gluten free sugar cookie Mix	1	Неклассифицированные/default	183807	Betty Crocker
2534084	016000277915	Betty crocker gluten free Yellow cake Mix 15oz	1	Неклассифицированные/default	183807	Betty Crocker
4131551	071169813046	Betty crocker Green cherries candied frt* 4oz	1	Неклассифицированные/default	183807	Betty Crocker
4131552	071169814081	Betty crocker Green cherries halved 8oz	1	Неклассифицированные/default	183807	Betty Crocker
4131553	071169813084	Betty crocker Green cherries pp * 8oz	1	Неклассифицированные/default	183807	Betty Crocker
1393164	071169710253	Betty crocker Green sugar decorating decors	1	Неклассифицированные/default	183807	Betty Crocker
4131554	016000450813	Betty crocker grlc-chs mash pto 4.9oz	1	Неклассифицированные/default	183807	Betty Crocker
4123974	016000375505	Betty crocker gsbmps/gshers tray 5.4oz	1	Неклассифицированные/default	183807	Betty Crocker
4131555	016000179332	Betty crocker gusher narnia value 10.80oz 20ct	1	Неклассифицированные/default	183807	Betty Crocker
4057102	016000682054	Betty crocker gushers 1oz 7cs	1	Неклассифицированные/default	183807	Betty Crocker
4131556	016000530867	Betty crocker gushers 5.4oz	1	Неклассифицированные/default	183807	Betty Crocker
4131557	016000685598	Betty crocker gushers dt 5.4oz 28ct	1	Неклассифицированные/default	183807	Betty Crocker
4061909	016000688599	Betty crocker gushers Happy fee 28oz 1ct 8cs	1	Неклассифицированные/default	183807	Betty Crocker
4061908	016000123007	Betty crocker gushers Happy fee 28oz 8cs	1	Неклассифицированные/default	183807	Betty Crocker
4131558	016000240902	Betty crocker gushers sour Green Apple 5.4oz	1	Неклассифицированные/default	183807	Betty Crocker
1393248	016000328303	Betty crocker gushers watermelon blst5.4 	1	Неклассифицированные/default	183807	Betty Crocker
4131559	016000591301	Betty crocker gushers Wild cher 6ct	1	Неклассифицированные/default	183807	Betty Crocker
4131560	071169903013	Betty crocker hall candy making kit 6oz	1	Неклассифицированные/default	183807	Betty Crocker
4131561	071169903020	Betty crocker hall lolli making kit 6oz	1	Неклассифицированные/default	183807	Betty Crocker
2534085	071169812605	Betty crocker Halloween 10vrty dsp 98pcs	1	Неклассифицированные/default	183807	Betty Crocker
2534086	071169812629	Betty crocker Halloween 9vrty dsp 82pcs	1	Неклассифицированные/default	183807	Betty Crocker
1486780	071169733016	Betty crocker Halloween candy	1	Неклассифицированные/default	183807	Betty Crocker
1393003	071169791443	Betty crocker Halloween core dsp 180pc	1	Неклассифицированные/default	183807	Betty Crocker
4131562	071169402172	Betty crocker Halloween decor shpr 1ct	1	Неклассифицированные/default	183807	Betty Crocker
2534087	071169790446	Betty crocker Halloween dsp 144pc	1	Неклассифицированные/default	183807	Betty Crocker
4131563	071169738011	Betty crocker Halloween gummie cndy kit 4.2oz	1	Неклассифицированные/default	183807	Betty Crocker
4131564	071169738325	Betty crocker Halloween gummy 4.2oz	1	Неклассифицированные/default	183807	Betty Crocker
3969377	016000679313	Betty crocker Halloween gusher val 10.8oz 10cs	1	Неклассифицированные/default	183807	Betty Crocker
4131565	071169733023	Betty crocker Halloween lollipop kit	1	Неклассифицированные/default	183807	Betty Crocker
3018099	051576204934	Betty crocker halves&pieces pecans	330591	Продукты питания (folder)/Продукты питания	183807	Betty Crocker
3018100	051576202930	Betty crocker halves&pieces walnuts	330591	Продукты питания (folder)/Продукты питания	183807	Betty Crocker
4123975	016000328907	Betty crocker ham help/spec pot 1ct	1	Неклассифицированные/default	183807	Betty Crocker
1393263	016000405301	Betty crocker hamberger helper ~ beef taco 7.1oz	1	Неклассифицированные/default	183807	Betty Crocker
4123976	016000412941	Betty crocker hambger help cheesbur 8oz	1	Неклассифицированные/default	183807	Betty Crocker
4131566	016000411876	Betty crocker hamburger helper	1	Неклассифицированные/default	2597088	Betty Crocker Hamburger Helper
1393257	016000538702	Betty crocker hamburger helper 3-Cheese	1	Неклассифицированные/default	2597088	Betty Crocker Hamburger Helper
1393258	016000278806	Betty crocker hamburger helper 4 ch lasg	1	Неклассифицированные/default	2597088	Betty Crocker Hamburger Helper
4808346	016000431539	Betty crocker hamburger helper 40% chsbrgr mac 7.8oz	1	Неклассифицированные/default	2597088	Betty Crocker Hamburger Helper
4808347	016000431522	Betty crocker hamburger helper 40% more bf pasta 7.2oz	1	Неклассифицированные/default	2597088	Betty Crocker Hamburger Helper
1393260	016000414204	Betty crocker hamburger helper 5.6oz dinnr beef noodl	1	Неклассифицированные/default	2597088	Betty Crocker Hamburger Helper
183593	016000432413	Betty crocker hamburger helper asian helper mongolian style beef 6oz	1187071	Продукты питания (folder)/Обеды	2597088	Betty Crocker Hamburger Helper
1393262	016000414303	Betty crocker hamburger helper beef romanoff Mix	1	Неклассифицированные/default	2597088	Betty Crocker Hamburger Helper
1486996	016000491700	Betty crocker hamburger helper beef teriyaki Mix	1	Неклассифицированные/default	2597088	Betty Crocker Hamburger Helper
1393261	016000295209	Betty crocker hamburger helper bf garlic	1	Неклассифицированные/default	2597088	Betty Crocker Hamburger Helper
4131567	016000159747	Betty crocker hamburger helper bf/strog twin pk 11.2oz	1	Неклассифицированные/default	2597088	Betty Crocker Hamburger Helper
3125451	016000493247	Betty crocker hamburger helper cheddar Cheese melt twin pack	330591	Продукты питания (folder)/Продукты питания	2597088	Betty Crocker Hamburger Helper
4131568	016000199804	Betty crocker hamburger helper cheddar&broccoli s43 9oz	1	Неклассифицированные/default	2597088	Betty Crocker Hamburger Helper
1393266	016000470606	Betty crocker hamburger helper Cheese ench	1	Неклассифицированные/default	2597088	Betty Crocker Hamburger Helper
1393267	016000412903	Betty crocker hamburger helper cheeseburger macaroni Mix	1	Неклассифицированные/default	2597088	Betty Crocker Hamburger Helper
4131569	065633314245	Betty crocker hamburger helper cheesy enchilada 255g	1	Неклассифицированные/default	2597088	Betty Crocker Hamburger Helper
1486997	016000415300	Betty crocker hamburger helper cheesy italian Mix	1	Неклассифицированные/default	2597088	Betty Crocker Hamburger Helper
3125452	016000493254	Betty crocker hamburger helper cheesy taco twin pack	330591	Продукты питания (folder)/Продукты питания	2597088	Betty Crocker Hamburger Helper
2552464	016000437159	Betty crocker hamburger helper chicken creamy parmasean	1	Неклассифицированные/default	2597088	Betty Crocker Hamburger Helper
4131573	016000263673	Betty crocker hamburger helper chili Cheese 4.3oz	1	Неклассифицированные/default	2597088	Betty Crocker Hamburger Helper
3125453	016000496453	Betty crocker hamburger helper chili macaroni twin pack	330591	Продукты питания (folder)/Продукты питания	2597088	Betty Crocker Hamburger Helper
1487008	016000159730	Betty crocker hamburger helper chsy enchlda 7.5oz 7.5oz	1	Неклассифицированные/default	2597088	Betty Crocker Hamburger Helper
1393268	016000284210	Betty crocker hamburger helper chsy ital	1	Неклассифицированные/default	2597088	Betty Crocker Hamburger Helper
1393270	016000295902	Betty crocker hamburger helper chsy pota	1	Неклассифицированные/default	2597088	Betty Crocker Hamburger Helper
1393271	016000392908	Betty crocker hamburger helper chsy shel	1	Неклассифицированные/default	2597088	Betty Crocker Hamburger Helper
2534089	016000263697	Betty crocker hamburger helper Classic double cheeseburger macaroni	1	Неклассифицированные/default	2597088	Betty Crocker Hamburger Helper
4131570	016000428454	Betty crocker hamburger helper Classic patty melt 4.5oz	1	Неклассифицированные/default	2597088	Betty Crocker Hamburger Helper
1854264	016000263123	Betty crocker hamburger helper clsc tuna mlt 6oz	1	Неклассифицированные/default	2597088	Betty Crocker Hamburger Helper
1393272	016000436732	Betty crocker hamburger helper crnchy taco 7.5oz 7.1oz	1	Неклассифицированные/default	2597088	Betty Crocker Hamburger Helper
3125454	016000496446	Betty crocker hamburger helper de luxe beef stroganoff twin pack	330591	Продукты питания (folder)/Продукты питания	2597088	Betty Crocker Hamburger Helper
1393273	016000491304	Betty crocker hamburger helper fet alfrd	1	Неклассифицированные/default	2597088	Betty Crocker Hamburger Helper
4131571	016000336902	Betty crocker hamburger helper full plt * 1ct 592ct	1	Неклассифицированные/default	2597088	Betty Crocker Hamburger Helper
1486998	016000504806	Betty crocker hamburger helper homestyle italian rigatoni Mix	1	Неклассифицированные/default	2597088	Betty Crocker Hamburger Helper
1486999	016000504608	Betty crocker hamburger helper homestyle salisbury Mix	1	Неклассифицированные/default	2597088	Betty Crocker Hamburger Helper
1393274	016000284234	Betty crocker hamburger helper ital saus	1	Неклассифицированные/default	2597088	Betty Crocker Hamburger Helper
4131572	065633075412	Betty crocker hamburger helper italian herb 218g	1	Неклассифицированные/default	2597088	Betty Crocker Hamburger Helper
4131574	016000164932	Betty crocker hamburger helper mcrwv chs beef taco single 6.8oz	1	Неклассифицированные/default	2597088	Betty Crocker Hamburger Helper
1416579	016000164918	Betty crocker hamburger helper mcrwv stroganoff single 5.68oz	330591	Продукты питания (folder)/Продукты питания	2597088	Betty Crocker Hamburger Helper
1487000	016000193857	Betty crocker hamburger helper microwave singles - cheeseburger macaroni	1	Неклассифицированные/default	2597088	Betty Crocker Hamburger Helper
1487001	016000193864	Betty crocker hamburger helper microwave singles - cheesy beef taco	1	Неклассифицированные/default	2597088	Betty Crocker Hamburger Helper
4131575	016000194922	Betty crocker hamburger helper microwave singles cheeseburger mac 1.85oz	1	Неклассифицированные/default	2597088	Betty Crocker Hamburger Helper
1487002	016000193680	Betty crocker hamburger helper mircowave singles - cheesy lasagna with beef	1	Неклассифицированные/default	2597088	Betty Crocker Hamburger Helper
1487003	016000193840	Betty crocker hamburger helper mircrowave singles - stroganoff	1	Неклассифицированные/default	2597088	Betty Crocker Hamburger Helper
1487004	016000491601	Betty crocker hamburger helper mushroom&wildrice Mix	1	Неклассифицированные/default	2597088	Betty Crocker Hamburger Helper
2782133	016000165786	Betty crocker hamburger helper mw cheesy Twist 1.5oz	1	Неклассифицированные/default	2597088	Betty Crocker Hamburger Helper
4131576	016000627826	Betty crocker hamburger helper mw cup shipper 1ct	1	Неклассифицированные/default	2597088	Betty Crocker Hamburger Helper
1486982	016000165779	Betty crocker hamburger helper mw singles pasta chsy sauce beef chsbrgr mac	1	Неклассифицированные/default	2597088	Betty Crocker Hamburger Helper
4131577	016000405400	Betty crocker hamburger helper nacho Cheese s92 7.5oz	1	Неклассифицированные/default	2597088	Betty Crocker Hamburger Helper
2025305	016000402126	Betty crocker hamburger helper pasta chsy sauce Mix chsbrgr mac 5.8oz	1	Неклассифицированные/default	2597088	Betty Crocker Hamburger Helper
3029370	016000419780	Betty crocker hamburger helper pasta chsy sauce Mix chsbrgr mac twin pk	330591	Продукты питания (folder)/Продукты питания	2597088	Betty Crocker Hamburger Helper
2597089	016000260276	Betty crocker hamburger helper pasta chsy sauce Mix chsy bf pasta	1	Неклассифицированные/default	2597088	Betty Crocker Hamburger Helper
1854263	016000277182	Betty crocker hamburger helper pasta chsy sauce Mix chsy rnch burger 5.9oz	1	Неклассифицированные/default	2597088	Betty Crocker Hamburger Helper
2804274	016000416253	Betty crocker hamburger helper pasta chsy sauce Mix dbl chsbrgr mac 6oz	1	Неклассифицированные/default	2597088	Betty Crocker Hamburger Helper
3125455	016000477292	Betty crocker hamburger helper pasta chsy sauce Mix dbl chsbrgr mac twin pk	330591	Продукты питания (folder)/Продукты питания	2597088	Betty Crocker Hamburger Helper
2597091	016000260283	Betty crocker hamburger helper pasta chsy sauce Mix dlx chsbrgr mac	1	Неклассифицированные/default	2597088	Betty Crocker Hamburger Helper
3125456	016000139718	Betty crocker hamburger helper pasta chsy sauce Mix dlx chsbrgr mac twin pk	330591	Продукты питания (folder)/Продукты питания	2597088	Betty Crocker Hamburger Helper
1487022	016000159723	Betty crocker hamburger helper pasta chsy sauce Mix three chs	1	Неклассифицированные/default	2597088	Betty Crocker Hamburger Helper
3125457	016000487024	Betty crocker hamburger helper pasta chsy sauce Mix three chs twin pk	330591	Продукты питания (folder)/Продукты питания	2597088	Betty Crocker Hamburger Helper
2025308	016000416284	Betty crocker hamburger helper pasta creamy sauce Mix stroganoff 6.4oz	1	Неклассифицированные/default	2597088	Betty Crocker Hamburger Helper
3125458	016000420878	Betty crocker hamburger helper pasta creamy sauce Mix stroganoff twin pk	330591	Продукты питания (folder)/Продукты питания	2597088	Betty Crocker Hamburger Helper
1487009	016000283824	Betty crocker hamburger helper pasta italian sauce Mix chsy italian shells	1	Неклассифицированные/default	2597088	Betty Crocker Hamburger Helper
3125459	016000451339	Betty crocker hamburger helper pasta italian sauce Mix chsy italian shells twin pk	330591	Продукты питания (folder)/Продукты питания	2597088	Betty Crocker Hamburger Helper
1487014	016000283831	Betty crocker hamburger helper pasta italian sauce Mix four chs lasagna	1	Неклассифицированные/default	2597088	Betty Crocker Hamburger Helper
3125460	016000139695	Betty crocker hamburger helper pasta italian sauce Mix four chs lasagna twin pk	330591	Продукты питания (folder)/Продукты питания	2597088	Betty Crocker Hamburger Helper
2025307	016000417519	Betty crocker hamburger helper pasta italian sauce Mix lasagna 6.9oz	1	Неклассифицированные/default	2597088	Betty Crocker Hamburger Helper
3125461	016000420298	Betty crocker hamburger helper pasta italian sauce Mix lasagna twin pk	330591	Продукты питания (folder)/Продукты питания	2597088	Betty Crocker Hamburger Helper
2534088	016000283428	Betty crocker hamburger helper pasta sauce Mix bacon chsbrgr	1	Неклассифицированные/default	2597088	Betty Crocker Hamburger Helper
3125462	016000139688	Betty crocker hamburger helper pasta sauce Mix bacon chsbrgr twin pk	330591	Продукты питания (folder)/Продукты питания	2597088	Betty Crocker Hamburger Helper
2025304	016000417298	Betty crocker hamburger helper pasta sauce Mix beef pasta 5.9oz	1	Неклассифицированные/default	2597088	Betty Crocker Hamburger Helper
3125463	016000419773	Betty crocker hamburger helper pasta sauce Mix beef pasta twin pk	330591	Продукты питания (folder)/Продукты питания	2597088	Betty Crocker Hamburger Helper
2526958	016000283411	Betty crocker hamburger helper pasta sauce Mix chdr chs melt	1	Неклассифицированные/default	2597088	Betty Crocker Hamburger Helper
2526959	016000430662	Betty crocker hamburger helper pasta sauce Mix chs lvrs lasagna 5.4oz	1	Неклассифицированные/default	2597088	Betty Crocker Hamburger Helper
3125464	016000430655	Betty crocker hamburger helper pasta sauce Mix chsy itln beef	330591	Продукты питания (folder)/Продукты питания	2597088	Betty Crocker Hamburger Helper
2597090	016000430648	Betty crocker hamburger helper pasta sauce Mix dlx beef stroganoff	1	Неклассифицированные/default	2597088	Betty Crocker Hamburger Helper
3125465	016000424210	Betty crocker hamburger helper pasta sauce Mix supreme chs pizza	330591	Продукты питания (folder)/Продукты питания	2597088	Betty Crocker Hamburger Helper
1393280	016000284241	Betty crocker hamburger helper pasta sauce Mix tomato basil penne	1	Неклассифицированные/default	2597088	Betty Crocker Hamburger Helper
2534098	016000263680	Betty crocker hamburger helper pasta tomato sauce Mix chili mac	1	Неклассифицированные/default	2597088	Betty Crocker Hamburger Helper
4131578	016000124967	Betty crocker hamburger helper plt 1ct 704ct	1	Неклассифицированные/default	2597088	Betty Crocker Hamburger Helper
4131579	016000413900	Betty crocker hamburger helper potatoes au gratin s92 augratin	1	Неклассифицированные/default	2597088	Betty Crocker Hamburger Helper
3125466	016000413399	Betty crocker hamburger helper potatoes chsy topping Mix chsy hashbrowns	330591	Продукты питания (folder)/Продукты питания	2597088	Betty Crocker Hamburger Helper
3125467	016000138537	Betty crocker hamburger helper potatoes creamy sauce Mix potatoes stroganoff twin pk	330591	Продукты питания (folder)/Продукты питания	2597088	Betty Crocker Hamburger Helper
1393252	016000278905	Betty crocker hamburger helper ravioli 7.7oz	1	Неклассифицированные/default	2597088	Betty Crocker Hamburger Helper
1487005	016000413702	Betty crocker hamburger helper Rice oriental	1	Неклассифицированные/default	2597088	Betty Crocker Hamburger Helper
2025306	016000419759	Betty crocker hamburger helper Rice sauce Mix corn chips crnchy taco 7.6oz	1	Неклассифицированные/default	2597088	Betty Crocker Hamburger Helper
2597092	016000413382	Betty crocker hamburger helper Rice&seasoning Mix beef fried Rice	1	Неклассифицированные/default	2597088	Betty Crocker Hamburger Helper
1393259	016000472303	Betty crocker hamburger helper skillet meal bacon cheeseburger	1	Неклассифицированные/default	2597088	Betty Crocker Hamburger Helper
1487006	016000282018	Betty crocker hamburger helper skillet meal bacon cheeseburger mac	1	Неклассифицированные/default	2597088	Betty Crocker Hamburger Helper
1393264	016000408609	Betty crocker hamburger helper skillet meal cheddar Cheese melt	1	Неклассифицированные/default	2597088	Betty Crocker Hamburger Helper
1487007	016000411852	Betty crocker hamburger helper skillet meal cheeseburger macaroni	1	Неклассифицированные/default	2597088	Betty Crocker Hamburger Helper
1393255	016000249509	Betty crocker hamburger helper skillet meal cheesy hashbrowns	1	Неклассифицированные/default	2597088	Betty Crocker Hamburger Helper
