ID	UPCEAN	Name	CategoryID	CategoryName	BrandID	BrandName
1768180	4607077651225	Игра настольная домино для девоч 01119 гелий	56347	Игрушки (folder)/Игра настольная	0	
1768181	4607077651232	Игра настольная домино для мальч 01120 гелий	56347	Игрушки (folder)/Игра настольная	0	
1213086	4607077654288	Игра настольная домино дорожные знаки 01111 гелий	56347	Игрушки (folder)/Игра настольная	0	
5352824	4820198240400	Игра настольная домино животные r300137 dodo 28элем	5125859	Игрушка развивающая	4905604	Dodo
712748	4607170790838	Игра настольная домино зверята 9024	56347	Игрушки (folder)/Игра настольная	712502	Аспект
1213087	4690590023631	Игра настольная домино играем вместе-буратино Колобок s020-r симбат	56347	Игрушки (folder)/Игра настольная	1791899	Играем Вместе
705221	4607057560035	Игра настольная домино игрушки 5555-3 томик	56347	Игрушки (folder)/Игра настольная	60784	Томик
1213088	4607077651522	Игра настольная домино изучаем цвета 01103 гелий	56347	Игрушки (folder)/Игра настольная	0	
1213089	4607077654295	Игра настольная домино классическое 01112 гелий	56347	Игрушки (folder)/Игра настольная	0	
263760	073050023350	Игра настольная домино летим плывем едем (пластм) *для к* 00035	56347	Игрушки (folder)/Игра настольная	0	
1768182	9785378109722	Игра настольная домино любимые игрушки ин-0972	56347	Игрушки (folder)/Игра настольная	0	
1213090	4607147363270	Игра настольная домино малое барбоскины 2507 stellar	56347	Игрушки (folder)/Игра настольная	0	
263762	5250010010093	Игра настольная домино мини веселые кошки 01109 (гелий)	56347	Игрушки (folder)/Игра настольная	0	
263763	5250010010116	Игра настольная домино мини дорожные знаки 01111 (гелий)	56347	Игрушки (folder)/Игра настольная	0	
263764	5250010010123	Игра настольная домино мини классич 01112 (гелий)	56347	Игрушки (folder)/Игра настольная	0	
263765	5250010010062	Игра настольная домино мини морское 01106 (гелий)	56347	Игрушки (folder)/Игра настольная	0	
263766	5250010010079	Игра настольная домино мини на лугу 01107 (гелий)	56347	Игрушки (folder)/Игра настольная	0	
263767	5250010010055	Игра настольная домино мини пернатые 01105 (гелий)	56347	Игрушки (folder)/Игра настольная	0	
263768	5250010010086	Игра настольная домино мини пиратское 01108 (гелий)	56347	Игрушки (folder)/Игра настольная	0	
263769	5250010010031	Игра настольная домино мини познай цвета/изучаем цвета 01103 (гелий)	56347	Игрушки (folder)/Игра настольная	0	
263770	5250010010017	Игра настольная домино мини спортивное 01101 (гелий)	56347	Игрушки (folder)/Игра настольная	0	
263771	5250010010130	Игра настольная домино мини транспорт 01113 (гелий)	56347	Игрушки (folder)/Игра настольная	0	
263772	5250010010024	Игра настольная домино мини цветочное 01102 (гелий)	56347	Игрушки (folder)/Игра настольная	0	
1213091	4607077651553	Игра настольная домино морское 01106 гелий	56347	Игрушки (folder)/Игра настольная	0	
1213092	4607077651560	Игра настольная домино на лугу 01107 гелий	56347	Игрушки (folder)/Игра настольная	0	
2432466	4602933038271	Игра настольная домино ну, погоди 3-7 лет	56347	Игрушки (folder)/Игра настольная	0	
1213093	4607077651584	Игра настольная домино озорные кошки 01109 гелий	56347	Игрушки (folder)/Игра настольная	0	
1213094	4607077651546	Игра настольная домино пернатые 01105 гелий	56347	Игрушки (folder)/Игра настольная	0	
1213095	4607077651577	Игра настольная домино пиратское 01108 гелий	56347	Игрушки (folder)/Игра настольная	0	
3322568	6908801035556	Игра настольная домино с деревянными фишками	56347	Игрушки (folder)/Игра настольная	0	
3322569	7700118180016	Игра настольная домино сказочные персонажи	56347	Игрушки (folder)/Игра настольная	0	
1213096	4607077651508	Игра настольная домино спортивное 01101 гелий	56347	Игрушки (folder)/Игра настольная	0	
1213097	4607077654851	Игра настольная домино сувенирное №49 Маша и медведь 2538 гелий	56347	Игрушки (folder)/Игра настольная	0	
1213098	4607077654301	Игра настольная домино транспорт 01113 гелий	56347	Игрушки (folder)/Игра настольная	0	
705224	4607057560028	Игра настольная домино транспорт 5555-2 томик	56347	Игрушки (folder)/Игра настольная	60784	Томик
1768183	4607077653861	Игра настольная домино флаги 01115 гелий	56347	Игрушки (folder)/Игра настольная	0	
464051	4606086032940	Игра настольная домино фрукты и ягоды	56347	Игрушки (folder)/Игра настольная	407029	ЭКСМО
1768184	9785378109746	Игра настольная домино фрукты ин-0974	56347	Игрушки (folder)/Игра настольная	0	
1213099	4607077651515	Игра настольная домино цветочное 01102 гелий	56347	Игрушки (folder)/Игра настольная	0	
464052	4606088000114	Игра настольная домино цифры 011/00011/4715	56347	Игрушки (folder)/Игра настольная	439963	Тридевятое царство
464054	4606088000060	Игра настольная домино читаем по слогам 006/00006/4716	56347	Игрушки (folder)/Игра настольная	439963	Тридевятое царство
1213100	4607077651539	Игра настольная домино ягодка 01104 гелий	56347	Игрушки (folder)/Игра настольная	0	
1213082	4607038275613	Игра настольная домино №18 обитатели леса 00018 stellar	56347	Игрушки (folder)/Игра настольная	3476644	Stellar
1213101	4602010341201	Игра настольная домино, арт.01040/wg	56347	Игрушки (folder)/Игра настольная	1213042	GRANNA
1768185	4820074513833	Игра настольная домино-змейка едем, плывем, летим (обучающая) /забавка	56347	Игрушки (folder)/Игра настольная	0	
149471	9001890688492	Игра настольная дорожн кто быстрее	56347	Игрушки (folder)/Игра настольная	149470	Пятн_к
149472	9001890687891	Игра настольная дорожн нарды	56347	Игрушки (folder)/Игра настольная	149470	Пятн_к
149473	9001890688195	Игра настольная дорожн рулетка	56347	Игрушки (folder)/Игра настольная	149470	Пятн_к
149474	9001890688591	Игра настольная дорожн четыре в ряд	56347	Игрушки (folder)/Игра настольная	149470	Пятн_к
149475	9001890688294	Игра настольная дорожн шашки	56347	Игрушки (folder)/Игра настольная	149470	Пятн_к
5354986	5010993588541	Игра настольная дорожная hasbro клуэдо роудтрип e5341121	5140685	игры	306518	Hasbro
3670239	5010994889708	Игра настольная дорожная hasbro морской бой (b0995)	56347	Игрушки (folder)/Игра настольная	306518	Hasbro
3322570	7700045890019	Игра настольная доска с объемной геометриеей	56347	Игрушки (folder)/Игра настольная	0	
5354987	6921179202801	Игра настольная достань жирафа big tree Toys b1179202	56347	Игрушки (folder)/Игра настольная	5129854	big tree toys
2436026	6416739028347	Игра настольная дракон	56347	Игрушки (folder)/Игра настольная	0	
4998809	4607147377499	Игра настольная дрофа 3030 викторина почемучки 3030 дрофа	1	Неклассифицированные/default	871517	Дрофа
5354988	4607147390139	Игра настольная дрофа 3236 викторина о москве 3236 дрофа	56347	Игрушки (folder)/Игра настольная	871517	Дрофа
5336143	4607147394236	Игра настольная дрофа 3815 викторина о животных 3815 дрофа	5144641	развивающие игры	534912	Дрофа-Медиа
5354989	4607147395325	Игра настольная дрофа 3863 викторина кругосветное путешествие 3863 дрофа	56347	Игрушки (folder)/Игра настольная	871517	Дрофа
2233288	4607147365854	Игра настольная дрофа и логические квадраты /игротека	56347	Игрушки (folder)/Игра настольная	871517	Дрофа
2233289	4607147370544	Игра настольная дрофа игротека магия чисел	56347	Игрушки (folder)/Игра настольная	871517	Дрофа
2250010	4607147356340	Игра настольная дрофа мини ассоциации.	56347	Игрушки (folder)/Игра настольная	871517	Дрофа
2250011	4607147368589	Игра настольная дрофа мини внимание!	56347	Игрушки (folder)/Игра настольная	871517	Дрофа
2250012	4607147370827	Игра настольная дрофа мини головоломка	56347	Игрушки (folder)/Игра настольная	871517	Дрофа
2250013	4607147370520	Игра настольная дрофа мини спецтранспорт	56347	Игрушки (folder)/Игра настольная	871517	Дрофа
2250014	4607147353615	Игра настольная дрофа мини транспорт.	56347	Игрушки (folder)/Игра настольная	871517	Дрофа
2271179	4607147359808	Игра настольная дрофа ходилка в гости к белочке.	56347	Игрушки (folder)/Игра настольная	871517	Дрофа
2271180	4607147355114	Игра настольная дрофа ходилка в гостях у сказки.	56347	Игрушки (folder)/Игра настольная	871517	Дрофа
2271181	4607147352854	Игра настольная дрофа ходилка воздушные приключения	56347	Игрушки (folder)/Игра настольная	871517	Дрофа
2271182	4607147350874	Игра настольная дрофа ходилка заячья избушка.	56347	Игрушки (folder)/Игра настольная	871517	Дрофа
2271183	4607147350850	Игра настольная дрофа ходилка Колобок.	56347	Игрушки (folder)/Игра настольная	871517	Дрофа
2271184	4607147353691	Игра настольная дрофа ходилка кошки - мышки.	56347	Игрушки (folder)/Игра настольная	871517	Дрофа
2271185	4607147359839	Игра настольная дрофа ходилка лабиринт.	56347	Игрушки (folder)/Игра настольная	871517	Дрофа
2271186	4607147351444	Игра настольная дрофа ходилка лисичка - сестричка и серый волк.	56347	Игрушки (folder)/Игра настольная	871517	Дрофа
2271187	4607147351086	Игра настольная дрофа ходилка Маша и медведь.	56347	Игрушки (folder)/Игра настольная	871517	Дрофа
2271177	4607147357514	Игра настольная дрофа ходилка мини рыбалка	56347	Игрушки (folder)/Игра настольная	871517	Дрофа
2271178	4607147357507	Игра настольная дрофа ходилка мини сказки	56347	Игрушки (folder)/Игра настольная	871517	Дрофа
2271188	4607147355107	Игра настольная дрофа ходилка Остров сокровищ	56347	Игрушки (folder)/Игра настольная	871517	Дрофа
2271189	4607147350867	Игра настольная дрофа ходилка приключения колобка.	56347	Игрушки (folder)/Игра настольная	871517	Дрофа
2271190	4607147367797	Игра настольная дрофа ходилка сказка за сказкой	56347	Игрушки (folder)/Игра настольная	871517	Дрофа
1957920	4607147368800	Игра настольная дрофа-медиа викторина вундеркинда 2580 drofa	1	Неклассифицированные/default	871517	Дрофа
5354990	4607147395233	Игра настольная дрофа-медиа викторина. почемучка 3858 дрофа-медиа	56347	Игрушки (folder)/Игра настольная	871517	Дрофа
5354991	4607147395332	Игра настольная дрофа-медиа вокруг света. море открытий, 450 вопросов 3864 дрофа-медиа	56347	Игрушки (folder)/Игра настольная	871517	Дрофа
811424	4607147359792	Игра настольная дрофа-медиа Русское лото 1969 drofa	1	Неклассифицированные/default	871517	Дрофа
5354992	4602933024854	Игра настольная дублик-умник буквы и фигуры 60 карточек)	56347	Игрушки (folder)/Игра настольная	116734	Русский Стиль
56368	4606369021180	Игра настольная дюймовочка astrel 02016	56347	Игрушки (folder)/Игра настольная	0	
464056	4607032477716	Игра настольная дюймовочка гном арт. р5752	56347	Игрушки (folder)/Игра настольная	444389	ГНОМ
3322571	4606071190136	Игра настольная дюймовочка развлекательная	56347	Игрушки (folder)/Игра настольная	0	
712749	5900511006780	Игра настольная евро 2012	56347	Игрушки (folder)/Игра настольная	0	
4840710	4660006613961	Игра настольная ерш мини арт.mag114960	286761	Игрушки (folder)/Игра	4840708	Магеллан
661304	4812939000053	Игра настольная жажда скорости	56347	Игрушки (folder)/Игра настольная	661276	Top Game
56369	4600111002397	Игра настольная жажда скорости 239	56347	Игрушки (folder)/Игра настольная	0	
56348	7640114233630	Игра настольная животные 5063ou	56347	Игрушки (folder)/Игра настольная	0	
2726896	6934607737721	Игра настольная жизнь do2905r в русс. кор. 52x5 x 26cm в кор.24шт	56347	Игрушки (folder)/Игра настольная	0	
464058	6949999159969	Игра настольная жизнь экономическая 43297	56347	Игрушки (folder)/Игра настольная	0	
2726897	4001504408749	Игра настольная жучки в панике арт 40874	56347	Игрушки (folder)/Игра настольная	0	
2864103	6901795050024	Игра настольная за рулем Китай №7603	56347	Игрушки (folder)/Игра настольная	0	
3322572	4812939008806	Игра настольная забавные зверята 24элем	56347	Игрушки (folder)/Игра настольная	0	
1666562	4606089123133	Игра настольная забавные мартышки /00043/	56347	Игрушки (folder)/Игра настольная	0	
2864104	730002007911	Игра настольная забавный верблюд 0791	56347	Игрушки (folder)/Игра настольная	0	
3322573	4607155187714	Игра настольная задира-Плюс морской бой	56347	Игрушки (folder)/Игра настольная	0	
712750	4607037665248	Игра настольная зайкина избушка 3602/185	56347	Игрушки (folder)/Игра настольная	0	
3322574	4602827765351	Игра настольная закон джунглей тв/уп	56347	Игрушки (folder)/Игра настольная	0	
2436027	4680287005811	Игра настольная замки короля людвига	56347	Игрушки (folder)/Игра настольная	0	
3322575	4607114450156	Игра настольная замок дракона 0401	56347	Игрушки (folder)/Игра настольная	0	
3322576	4603725531468	Игра настольная занимательное путешествие развивающая	56347	Игрушки (folder)/Игра настольная	0	
2232924	4607020621558	Игра настольная занимательные квадраты - 3	56347	Игрушки (folder)/Игра настольная	0	
3322577	4067155182964	Игра настольная запоминайка парные картинки	56347	Игрушки (folder)/Игра настольная	0	
2233032	4607147357798	Игра настольная запоминайка. игрушки.	56347	Игрушки (folder)/Игра настольная	0	
2233033	4607147368497	Игра настольная запоминайка. лошадки	56347	Игрушки (folder)/Игра настольная	0	
2233035	4607147357804	Игра настольная запоминайка. пушистики.	56347	Игрушки (folder)/Игра настольная	0	
2726711	4683582530880	Игра настольная запретные слова	1	Неклассифицированные/default	0	
56370	4810898000039	Игра настольная затерянный мир 00003	56347	Игрушки (folder)/Игра настольная	0	
2726898	6934522203783	Игра настольная захватывающие стрельбы sr26788 в русс. кор. 57x10 x 35cm в кор.8шт	56347	Игрушки (folder)/Игра настольная	0	
1768186	4600327020215	Игра настольная Звезда 2021 тачки.улетные гонки (Disney)	56347	Игрушки (folder)/Игра настольная	48091	Zvezda
1768187	4600327020604	Игра настольная Звезда 2060 самолеты (planes) (Disney)	56347	Игрушки (folder)/Игра настольная	48091	Zvezda
1665955	4600327082367	Игра настольная Звезда 8236 полтава 1709g	56347	Игрушки (folder)/Игра настольная	48091	Zvezda
1211841	4600327082374	Игра настольная Звезда 8237 ледовое побоище 1242g /10	56347	Игрушки (folder)/Игра настольная	48091	Zvezda
1665956	4600327082398	Игра настольная Звезда 8239 куликовская битва /10	56347	Игрушки (folder)/Игра настольная	48091	Zvezda
1665957	4600327086037	Игра настольная Звезда 8603 топ гир	56347	Игрушки (folder)/Игра настольная	48091	Zvezda
710894	4600327086167	Игра настольная Звезда 8616 shrek-2	56347	Игрушки (folder)/Игра настольная	48091	Zvezda
710955	4600327086280	Игра настольная Звезда 8628 гномы	56347	Игрушки (folder)/Игра настольная	48091	Zvezda
2726899	4600327086327	Игра настольная Звезда 8632 маски монстров	56347	Игрушки (folder)/Игра настольная	2726152	Звезда
710895	4600327086358	Игра настольная Звезда 8635 хрюшина азбука	56347	Игрушки (folder)/Игра настольная	48091	Zvezda
710991	4600327086426	Игра настольная Звезда 8642 спокойной ночи малыши	56347	Игрушки (folder)/Игра настольная	48091	Zvezda
710965	4600327086433	Игра настольная Звезда 8643 каменный век	56347	Игрушки (folder)/Игра настольная	48091	Zvezda
710896	4600327086440	Игра настольная Звезда 8644 майя	56347	Игрушки (folder)/Игра настольная	48091	Zvezda
710897	4600327086488	Игра настольная Звезда 8648 ледниковый период.спасатели	56347	Игрушки (folder)/Игра настольная	48091	Zvezda
710950	4600327086518	Игра настольная Звезда 8651 битва за рим #2	56347	Игрушки (folder)/Игра настольная	48091	Zvezda
710956	4600327086532	Игра настольная Звезда 8653 гремучие джунгли	56347	Игрушки (folder)/Игра настольная	48091	Zvezda
710899	4600327086549	Игра настольная Звезда 8654 Pro-двинутые шашки	56347	Игрушки (folder)/Игра настольная	48091	Zvezda
710901	4600327086587	Игра настольная Звезда 8658 Star wars.война клонов /8	56347	Игрушки (folder)/Игра настольная	48091	Zvezda
2726901	4600327086648	Игра настольная Звезда 8664 грибной суп	56347	Игрушки (folder)/Игра настольная	2726152	Звезда
710902	4600327086594	Игра настольная Звезда 8665 хрюша.магазин игрушек	56347	Игрушки (folder)/Игра настольная	48091	Zvezda
710997	4600327086655	Игра настольная Звезда 8665 хрюша.магазин игрушек #2	56347	Игрушки (folder)/Игра настольная	48091	Zvezda
710904	4600327086716	Игра настольная Звезда 8671 морские сражения	56347	Игрушки (folder)/Игра настольная	48091	Zvezda
710906	4600327086754	Игра настольная Звезда 8675 робин гуд	56347	Игрушки (folder)/Игра настольная	48091	Zvezda
710907	4600327086761	Игра настольная Звезда 8676 экспедиция Винни	56347	Игрушки (folder)/Игра настольная	48091	Zvezda
710952	4600327086778	Игра настольная Звезда 8677 Винни-пух и слонотоп /8	56347	Игрушки (folder)/Игра настольная	48091	Zvezda
710908	4600327086785	Игра настольная Звезда 8678 shrek-3.школа волшебства	56347	Игрушки (folder)/Игра настольная	48091	Zvezda
710909	4600327086792	Игра настольная Звезда 8679 shrek-3.стань королем	56347	Игрушки (folder)/Игра настольная	48091	Zvezda
710910	4600327086815	Игра настольная Звезда 8681 дикий-дикий запад	56347	Игрушки (folder)/Игра настольная	48091	Zvezda
1665959	4600327086839	Игра настольная Звезда 8683 затерянные города 2 (расхитители гробниц)	56347	Игрушки (folder)/Игра настольная	48091	Zvezda
710911	4600327086853	Игра настольная Звезда 8685 принцессы	56347	Игрушки (folder)/Игра настольная	48091	Zvezda
710912	4600327086860	Игра настольная Звезда 8686 русалочка	56347	Игрушки (folder)/Игра настольная	48091	Zvezda
710913	4600327086914	Игра настольная Звезда 8691 немо.океан приключений	56347	Игрушки (folder)/Игра настольная	48091	Zvezda
710914	4600327086921	Игра настольная Звезда 8692 микки маус сокровища фараона	56347	Игрушки (folder)/Игра настольная	48091	Zvezda
710978	4600327086938	Игра настольная Звезда 8693 принцессы.королевский бал	56347	Игрушки (folder)/Игра настольная	48091	Zvezda
