ID	UPCEAN	Name	CategoryID	CategoryName	BrandID	BrandName
1655564	4047024344747	Аккумулятор автомобильный bosch t3047 143ah 12v cca950 514x218 x210 42.4kg /21	1387055	Эксплуатация и ремонт автомобилей/Аккумулятор автомобильный	39110	Bosch
1655566	4047024344914	Аккумулятор автомобильный bosch t3048 155ah 12v cca900 510x218 x230 43.15kg /21	1387055	Эксплуатация и ремонт автомобилей/Аккумулятор автомобильный	39110	Bosch
2714368	4047025290616	Аккумулятор автомобильный bosch t3050 105ah 12v cca800 330x172 x238 23.7kg /36	1387055	Эксплуатация и ремонт автомобилей/Аккумулятор автомобильный	39110	Bosch
2714369	4047025290593	Аккумулятор автомобильный bosch t3052 105ah 12v cca800 330x172 x238 23.7kg /36	1387055	Эксплуатация и ремонт автомобилей/Аккумулятор автомобильный	39110	Bosch
2714370	4047025290562	Аккумулятор автомобильный bosch t3054 145ah 12v cca1150 513x189 x223 40kg /24	1387055	Эксплуатация и ремонт автомобилей/Аккумулятор автомобильный	39110	Bosch
2714371	4047025290609	Аккумулятор автомобильный bosch t3055 180ah 12v cca1400 513x223 x223 46kg /21	1387055	Эксплуатация и ремонт автомобилей/Аккумулятор автомобильный	39110	Bosch
2714372	4047025290555	Аккумулятор автомобильный bosch t3056 190ah 12v cca1200 513x223 x223 45kg /21	1387055	Эксплуатация и ремонт автомобилей/Аккумулятор автомобильный	39110	Bosch
1655575	4047024345126	Аккумулятор автомобильный bosch t3060 70ah 6v cca300 175x167 x220 13.5kg /72	1387055	Эксплуатация и ремонт автомобилей/Аккумулятор автомобильный	39110	Bosch
1655553	4047024344716	Аккумулятор автомобильный bosch t3061 112ah 6v cca510 260x175 x236 16.5kg /57	1387055	Эксплуатация и ремонт автомобилей/Аккумулятор автомобильный	39110	Bosch
1655562	4047024345133	Аккумулятор автомобильный bosch t3062 140ah 6v cca720 260x175 x236 14kg /57	1387055	Эксплуатация и ремонт автомобилей/Аккумулятор автомобильный	39110	Bosch
1655565	4047024345140	Аккумулятор автомобильный bosch t3063 150ah 6v cca760 333x175 x236 15.1kg /36	1387055	Эксплуатация и ремонт автомобилей/Аккумулятор автомобильный	39110	Bosch
1655569	4047024345157	Аккумулятор автомобильный bosch t3064 200ah 6v cca950 403x175 x238 31kg /24	1387055	Эксплуатация и ремонт автомобилей/Аккумулятор автомобильный	39110	Bosch
1655543	4047024344921	Аккумулятор автомобильный bosch t3071 100ah 12v cca600 413x175 x220 26.76kg /36	1387055	Эксплуатация и ремонт автомобилей/Аккумулятор автомобильный	39110	Bosch
1655544	4047024344938	Аккумулятор автомобильный bosch t3072 100ah 12v cca600 413x175 x220 26.76kg /36	1387055	Эксплуатация и ремонт автомобилей/Аккумулятор автомобильный	39110	Bosch
1655552	4047024344945	Аккумулятор автомобильный bosch t3073 110ah 12v cca850 413x175 x220 30.4kg /24	1387055	Эксплуатация и ремонт автомобилей/Аккумулятор автомобильный	39110	Bosch
1655554	4047024344952	Аккумулятор автомобильный bosch t3075 120ah 12v cca680 513x189 x223 39.1kg /24	1387055	Эксплуатация и ремонт автомобилей/Аккумулятор автомобильный	39110	Bosch
1655567	4047024344969	Аккумулятор автомобильный bosch t3077 155ah 12v cca900 513x223 x223 41.26kg /21	1387055	Эксплуатация и ремонт автомобилей/Аккумулятор автомобильный	39110	Bosch
1655568	4047024344976	Аккумулятор автомобильный bosch t3079 180ah 12v cca1100 513x223 x223 44.24kg /21	1387055	Эксплуатация и ремонт автомобилей/Аккумулятор автомобильный	39110	Bosch
1655570	4047024344983	Аккумулятор автомобильный bosch t3080 200ah 12v cca1050 518x276 x242 39kg /12	1387055	Эксплуатация и ремонт автомобилей/Аккумулятор автомобильный	39110	Bosch
1655571	4047024344990	Аккумулятор автомобильный bosch t3081 220ah 12v cca1150 518x291 x242 57.18kg /12	1387055	Эксплуатация и ремонт автомобилей/Аккумулятор автомобильный	39110	Bosch
1655579	4047024345003	Аккумулятор автомобильный bosch t4075 140ah 12v cca800 513x189 x223 37.4kg /24	1387055	Эксплуатация и ремонт автомобилей/Аккумулятор автомобильный	39110	Bosch
1655580	4047024345010	Аккумулятор автомобильный bosch t4076 140ah 12v cca800 513x189 x223 37.4kg /24	1387055	Эксплуатация и ремонт автомобилей/Аккумулятор автомобильный	39110	Bosch
1655582	4047024345027	Аккумулятор автомобильный bosch t4077 170ah 12v cca1000 513x223 x223 45.1kg /21	1387055	Эксплуатация и ремонт автомобилей/Аккумулятор автомобильный	39110	Bosch
1655581	4047024344723	Аккумулятор автомобильный bosch t4078 170ah 12v cca1000 513x223 x223 5.1kg /21	1387055	Эксплуатация и ремонт автомобилей/Аккумулятор автомобильный	39110	Bosch
1655583	4047024345034	Аккумулятор автомобильный bosch t4080 215ah 12v cca1150 518x276 x242 62kg /12	1387055	Эксплуатация и ремонт автомобилей/Аккумулятор автомобильный	39110	Bosch
1655584	4047024344754	Аккумулятор автомобильный bosch t5075 145ah 12v cca800 513x189 x223 37.17kg /24	1387055	Эксплуатация и ремонт автомобилей/Аккумулятор автомобильный	39110	Bosch
1655585	4047024345041	Аккумулятор автомобильный bosch t5077 180ah 12v cca1000 513x223 x223 46.4kg /21	1387055	Эксплуатация и ремонт автомобилей/Аккумулятор автомобильный	39110	Bosch
1655586	4047024345058	Аккумулятор автомобильный bosch t5080 225ah 12v cca1150 518x276 x242 62kg /12	1387055	Эксплуатация и ремонт автомобилей/Аккумулятор автомобильный	39110	Bosch
2714373	4047025263467	Аккумулятор автомобильный bosch te077 180ah 12v cca1000 513x223 x223 45kg /21	1387055	Эксплуатация и ремонт автомобилей/Аккумулятор автомобильный	39110	Bosch
2714374	4047025263474	Аккумулятор автомобильный bosch te080 225ah 12v cca1150 518x276 x242 58kg /12	1387055	Эксплуатация и ремонт автомобилей/Аккумулятор автомобильный	39110	Bosch
672455	4820002502403	Аккумулятор автомобильный ista Black 6ct-50, 50 а/ч	1387055	Эксплуатация и ремонт автомобилей/Аккумулятор автомобильный	672454	Ista
2973470	5996093323162	Аккумулятор автомобильный ista Black 6ct-50, 50 а/ч #2	1387055	Эксплуатация и ремонт автомобилей/Аккумулятор автомобильный	672454	Ista
672456	4820002500348	Аккумулятор автомобильный ista Black 6ct-55, 55 а/ч	1387055	Эксплуатация и ремонт автомобилей/Аккумулятор автомобильный	672454	Ista
2973471	5996093323186	Аккумулятор автомобильный ista Black 6ct-55, 55 а/ч #2	1387055	Эксплуатация и ремонт автомобилей/Аккумулятор автомобильный	672454	Ista
672457	4820002500355	Аккумулятор автомобильный ista Black 6ct-60, 60 а/ч	1387055	Эксплуатация и ремонт автомобилей/Аккумулятор автомобильный	672454	Ista
2973472	5996093323209	Аккумулятор автомобильный ista Black 6ct-60, 60 а/ч #2	1387055	Эксплуатация и ремонт автомобилей/Аккумулятор автомобильный	672454	Ista
672458	4820002502786	Аккумулятор автомобильный ista Black 6ct-77, 77 а/ч	1387055	Эксплуатация и ремонт автомобилей/Аккумулятор автомобильный	672454	Ista
2973473	5996093323216	Аккумулятор автомобильный ista Black 6ct-77, 77 а/ч #2	1387055	Эксплуатация и ремонт автомобилей/Аккумулятор автомобильный	672454	Ista
672461	4820002502700	Аккумулятор автомобильный плазма 60агод +/-, 60 а/ч	1387055	Эксплуатация и ремонт автомобилей/Аккумулятор автомобильный	672459	Плазма
672460	5996093359697	Аккумулятор автомобильный плазма 60агод -/+, 60 а/ч	1387055	Эксплуатация и ремонт автомобилей/Аккумулятор автомобильный	672459	Плазма
4970343	4607034730024	Аккумулятор аком 6ст-60	4219	Техника (folder)/Электротехника/Батарейки и аккумуляторы	0	
4970344	4607034730543	Аккумулятор аком 6ст-60 евро	4219	Техника (folder)/Электротехника/Батарейки и аккумуляторы	0	
4970345	12346752	Аккумулятор аком 6ст-62	4219	Техника (folder)/Электротехника/Батарейки и аккумуляторы	0	
4970346	4607034730031	Аккумулятор аком 6ст-62 #2	4219	Техника (folder)/Электротехника/Батарейки и аккумуляторы	0	
4970347	6951758336368	Аккумулятор внешний (powerbank) 10000 mah romoss solo 5 Plus (гарантировано до 37wh, выход 2хusb 5v 2.1a/1a) со встроенным led-	4219	Техника (folder)/Электротехника/Батарейки и аккумуляторы	0	
4970348	6957531090939	Аккумулятор внешний (powerbank) 12000 mah hoco b35c, 2 USB 2.1a выхода, micro-USB 2a вход, дисплей, пластик белый	4219	Техника (folder)/Электротехника/Батарейки и аккумуляторы	0	
4970349	4607117453482	Аккумулятор внешний (powerbank) 13200 mah, acmepower, 2.5a выходн. напряж. 5v USB/16.5/19/22v, 7 переходников, для ноутбуков, ц	4219	Техника (folder)/Электротехника/Батарейки и аккумуляторы	0	
4970350	6931474714138	Аккумулятор внешний (powerbank) 20000 mah, borofone bt26a, Super Power, функцией qc3.0 (ускоренная зарядка) пластик 2 USB выход	4219	Техника (folder)/Электротехника/Батарейки и аккумуляторы	0	
4970351	7930046250264	Аккумулятор внешний (powerbank) 7500 mah hiper sp7500 li-ion (выход 2хusb 5v 2.1a/1a) для мобильных тел., смартфонов, черный	4219	Техника (folder)/Электротехника/Батарейки и аккумуляторы	0	
2721046	4627100961008	Аккумулятор внешний 3cott 3c-pb-104cr2l-b с картридером и двойным светодиодным фонариком, емкость 10400 мач, вх.: 5в1 а, вых1:	181341	Техника (folder)/Электротехника/Зарядное устройство	2714277	3Cott
2721047	4627100961015	Аккумулятор внешний 3cott 3c-pb-130cr2l-b с картридером и двойным светодиодным фонариком, емкость 13000 мач, вх.: 5в1 а, вых1:	181341	Техника (folder)/Электротехника/Зарядное устройство	2714277	3Cott
2721048	4627100961022	Аккумулятор внешний 3cott 3c-pb-156cr2l-b с картридером и двойным светодиодным фонариком, емкость 15600 мач, вх.: 5в1 а, вых1:	181341	Техника (folder)/Электротехника/Зарядное устройство	2714277	3Cott
2721049	4627100961039	Аккумулятор внешний 3cott 3c-pb-208cr2l-b с картридером и двойным светодиодным фонариком, емкость 20800 мач, вх.: 5в1 а, вых1:	181341	Техника (folder)/Электротехника/Зарядное устройство	2714277	3Cott
2721050	4627100960995	Аккумулятор внешний 3cott 3c-pb-78cr2l-b с картридером и двойным светодиодным фонариком, емкость 7800 мач, вх.: 5в1а, вых1: 5в1	181341	Техника (folder)/Электротехника/Зарядное устройство	2714277	3Cott
2427802	4627102590350	Аккумулятор внешний Black Fox bmp 052 5000мач, USB, серебр.	1	Неклассифицированные/default	0	
2427803	4627102590374	Аккумулятор внешний Black Fox bmp 052 5000мач, USB, синий	1	Неклассифицированные/default	0	
2427804	4627102590442	Аккумулятор внешний Black Fox bmp 055 5000мач, USB, серебр.	1	Неклассифицированные/default	0	
2427805	4627102590435	Аккумулятор внешний Black Fox bmp 055 5000мач, USB, синий	1	Неклассифицированные/default	0	
2427806	4627102590039	Аккумулятор внешний Black Fox bmp 104 10400мач, USB, золотистый	1	Неклассифицированные/default	0	
2427807	4627102590046	Аккумулятор внешний Black Fox bmp 104 10400мач, USB, серебр.	1	Неклассифицированные/default	0	
2427808	4627102590060	Аккумулятор внешний Black Fox bmp 110 11000мач, USB белый	1	Неклассифицированные/default	0	
2427809	4627102590251	Аккумулятор внешний Black Fox bmp 161 16000мач, USB черный	1	Неклассифицированные/default	0	
4970352	4680431028581	Аккумулятор внешний deppa (33540) nrg station 20100 mah, черный 45w, pd 2.0, 2xusb, USB-c	4219	Техника (folder)/Электротехника/Батарейки и аккумуляторы	0	
3260337	4606224094724	Аккумулятор внешний sonnen универсальный pb-10000, емк.10000мач, вых.ток 1а/2.1 a, led фонарик,серебр,261915	4219	Техника (folder)/Электротехника/Батарейки и аккумуляторы	1656924	SONNEN
3260340	4606224094625	Аккумулятор внешний sonnen универсальный pb-2200, емкость 2200мач, вых.ток. 1а, золотистый, 261905	4219	Техника (folder)/Электротехника/Батарейки и аккумуляторы	1656924	SONNEN
3260341	4606224094618	Аккумулятор внешний sonnen универсальный pb-2200, емкость 2200мач, вых.ток. 1а, розовый, 261904	4219	Техника (folder)/Электротехника/Батарейки и аккумуляторы	1656924	SONNEN
3260342	4606224094601	Аккумулятор внешний sonnen универсальный pb-2200, емкость 2200мач, вых.ток. 1а, синий, 261903	4219	Техника (folder)/Электротехника/Батарейки и аккумуляторы	1656924	SONNEN
3260343	4606224094687	Аккумулятор внешний sonnen универсальный pb-2600, емкость 2600мач, вых.ток 1a. серебристый, 261911	4219	Техника (folder)/Электротехника/Батарейки и аккумуляторы	1656924	SONNEN
3260344	4606224094694	Аккумулятор внешний sonnen универсальный pb-5001, емкость 5000мач, вых.ток 1a. серебристый, 261912	4219	Техника (folder)/Электротехника/Батарейки и аккумуляторы	1656924	SONNEN
3260338	4606224094717	Аккумулятор внешний sonnen универсальный pb-7500, емк.7500мач, вых.ток 1а/2.1 a, led фонарик, кофейн. 261914	4219	Техника (folder)/Электротехника/Батарейки и аккумуляторы	1656924	SONNEN
3260339	4606224094700	Аккумулятор внешний sonnen универсальный pb-7500, емк.7500мач, вых.ток 1а/2.1 a. led фонарик, серебр. 261913	4219	Техника (folder)/Электротехника/Батарейки и аккумуляторы	1656924	SONNEN
3260345	4606224094663	Аккумулятор внешний sonnen универсальный pb-9000, емк.9000мач, вых.ток. 1а/2.1 a, белый, 261909	4219	Техника (folder)/Электротехника/Батарейки и аккумуляторы	1656924	SONNEN
672943	4891199035425	Аккумулятор джи пи 200ааhс-u 2 (uc2) /2шт/ ассорт.	4219	Техника (folder)/Электротехника/Батарейки и аккумуляторы	148411	GP
673007	4260024756390	Аккумулятор для дрели CD-12 cdb-12-1 hander 12в, 1.2 ач	4219	Техника (folder)/Электротехника/Батарейки и аккумуляторы	0	
673008	4260024756482	Аккумулятор для дрели CD-14 cdb-14-1 14.4в, 1.2ач	4219	Техника (folder)/Электротехника/Батарейки и аккумуляторы	0	
673009	4260024756499	Аккумулятор для дрели CD-18 cdb-18-1 hander 18 в, 1.2ач	4219	Техника (folder)/Электротехника/Батарейки и аккумуляторы	0	
673010	4260071271662	Аккумулятор для дрели hcd ha-18-6 hander 18в, 1.2ач	4219	Техника (folder)/Электротехника/Батарейки и аккумуляторы	0	
441003	4606373091117	Аккумулятор для дрели закб-12 Зубр	4219	Техника (folder)/Электротехника/Батарейки и аккумуляторы	0	
441004	4606373091124	Аккумулятор для дрели закб-14.4 Зубр	4219	Техника (folder)/Электротехника/Батарейки и аккумуляторы	0	
441005	4606373091131	Аккумулятор для дрели закб-18 Зубр	4219	Техника (folder)/Электротехника/Батарейки и аккумуляторы	0	
4832650	4627100962791	Аккумулятор для ибп 3cott 12v12ah	176880	Техника (folder)/Электротехника/Цифровая техника (folder)/Источник бесперебойного питания (UPS)	2714277	3Cott
4832651	4627100962807	Аккумулятор для ибп 3cott 12v18ah	176880	Техника (folder)/Электротехника/Цифровая техника (folder)/Источник бесперебойного питания (UPS)	2714277	3Cott
4832652	4627100962746	Аккумулятор для ибп 3cott 12v4.5ah	176880	Техника (folder)/Электротехника/Цифровая техника (folder)/Источник бесперебойного питания (UPS)	2714277	3Cott
4832653	4627100962753	Аккумулятор для ибп 3cott 12v5.0ah	176880	Техника (folder)/Электротехника/Цифровая техника (folder)/Источник бесперебойного питания (UPS)	2714277	3Cott
4832654	4627100962777	Аккумулятор для ибп 3cott 12v7.2ah	176880	Техника (folder)/Электротехника/Цифровая техника (folder)/Источник бесперебойного питания (UPS)	2714277	3Cott
4832655	4627100962760	Аккумулятор для ибп 3cott 12v7ah	176880	Техника (folder)/Электротехника/Цифровая техника (folder)/Источник бесперебойного питания (UPS)	2714277	3Cott
4832656	4627100962784	Аккумулятор для ибп 3cott 12v9ah	176880	Техника (folder)/Электротехника/Цифровая техника (folder)/Источник бесперебойного питания (UPS)	2714277	3Cott
2714278	4627100961220	Аккумулятор для ибп 3cott 3c-12120, 12 в, 12 ач	4219	Техника (folder)/Электротехника/Батарейки и аккумуляторы	2714277	3Cott
1655588	4894128011583	Аккумулятор для ноутбука cs 335209-001 dd880a pp2171m (3600mah) для compaq business notebook nc4000	4219	Техника (folder)/Электротехника/Батарейки и аккумуляторы	0	
1655589	4894128022954	Аккумулятор для ноутбука cs 3ur18650f-2-qc-11 906c5040f (4400mah) для Asus a9t, f2, m50sa, z53	4219	Техника (folder)/Электротехника/Батарейки и аккумуляторы	0	
1655591	4894128023821	Аккумулятор для ноутбука cs 482262-001 hstnn-db63 (2600mah, 10.8v) для hp 2133 Mini-note	4219	Техника (folder)/Электротехника/Батарейки и аккумуляторы	0	
1655454	4894128032441	Аккумулятор для ноутбука cs as09d31 lc.btp00.052 (6600mah) для Acer Aspire 3810, Aspire 4810	4219	Техника (folder)/Электротехника/Батарейки и аккумуляторы	0	
1655594	4894128019145	Аккумулятор для ноутбука cs tol100hb (4400mah, 14.4v) для toshiba equium l100 equium l20 satellite l10	4219	Техника (folder)/Электротехника/Батарейки и аккумуляторы	0	
1955663	4894128011903	Аккумулятор для ноутбука cs-ac3200hb batefl50l, bt.00603.006, lc.bpt00.001 (4400mah, 11.1v) Acer travelmate 3000, Aspire 360	4219	Техника (folder)/Электротехника/Батарейки и аккумуляторы	0	
1655455	4894128011965	Аккумулятор для ноутбука cs-ac3620hb btp-amj1 btp-anj1 (4400mah) для Acer Aspire 2920, Aspire 3620	4219	Техника (folder)/Электротехника/Батарейки и аккумуляторы	0	
1955664	4894128018070	Аккумулятор для ноутбука cs-ac4200nb Acer Aspire 3100 series batbl50l8h (4400mah/49wh, 11.1v)	4219	Техника (folder)/Электротехника/Батарейки и аккумуляторы	0	
1180717	4894128020882	Аккумулятор для ноутбука cs-ap696xl sbp-09 (2600mah, 3.7v) для Asus mypal a686 mypal a696 mypal a626	4219	Техника (folder)/Электротехника/Батарейки и аккумуляторы	0	
1655593	4894128012016	Аккумулятор для ноутбука cs-aua3 a42-A3 a42-A6 70-na51b2100 (4400mah) для Asus A3, a3000, A6, a6000	4219	Техника (folder)/Электротехника/Батарейки и аккумуляторы	0	
1655592	4894128017554	Аккумулятор для ноутбука cs-aua8nb a32-a8 70-nf51b1000 90-nf51b1000 (4400mah) для Asus a8, a8000, z99	4219	Техника (folder)/Электротехника/Батарейки и аккумуляторы	0	
1655590	4894128011712	Аккумулятор для ноутбука cs-cv3000hl 436281-422 hstnn-ib31 (4400mah) для hp g 6000g 7000 pavilion dv2000 pavilion dv6900	4219	Техника (folder)/Электротехника/Батарейки и аккумуляторы	0	
1655595	4894128024583	Аккумулятор для ноутбука cs-dbe120 (2200mah 11.1v) для dell inspiron 1300, b120, b130	4219	Техника (folder)/Электротехника/Батарейки и аккумуляторы	0	
1180718	4894128027553	Аккумулятор для ноутбука cs-hdv4nb (4400mah) для compaq presario cq40, hp dv5-1017tx, dv5-1018tx	4219	Техника (folder)/Электротехника/Батарейки и аккумуляторы	0	
1655596	4894128028024	Аккумулятор для ноутбука cs-hpf510nb hp 510/530 (2200mah, 14.4v) hstnn-c20c	4219	Техника (folder)/Электротехника/Батарейки и аккумуляторы	0	
