ID	UPCEAN	Name	CategoryID	CategoryName	BrandID	BrandName
5355946	681920373865	Игровая поверхность 2E gaming mouse pad xl Black	5118569	Коврик для мыши	0	
2443265	4711421908238	Игровая поверхность A4tech bloody b-083 черный, 275x225 x 4mm (bloody b-083)	1	Неклассифицированные/default	2396349	A4tech
5355947	4713883908696	Игровая поверхность Acer fox's predator m size, retail pack (np.msp11.00f)	5118569	Коврик для мыши	205856	Acer
5355949	4713392276552	Игровая поверхность Acer predator gaming mousepad pmp510 (np.msp11.001)	5118569	Коврик для мыши	205856	Acer
5355950	4713883455671	Игровая поверхность Acer predator gaming mousepad pmp710 (np.msp11.004)	5118569	Коврик для мыши	205856	Acer
5355951	4713883455688	Игровая поверхность Acer predator gaming mousepad pmp711 (np.msp11.005)	5118569	Коврик для мыши	205856	Acer
5355952	4713883455695	Игровая поверхность Acer predator gaming mousepad pmp712 (np.msp11.006)	5118569	Коврик для мыши	205856	Acer
5355953	4713883455701	Игровая поверхность Acer predator gaming mousepad pmp720 (np.msp11.007)	5118569	Коврик для мыши	205856	Acer
5355954	4515777608015	Игровая поверхность Acer predator gaming mousepad xxl pmp020 (GP.msp11.005)	5118569	Коврик для мыши	205856	Acer
4818530	887758769140	Игровая поверхность Acer predator jersey fabric and Natural rubber (np.msp11.009)	4806477	Техника (folder)/Электротехника (folder)/Цифровая техника (folder)/Расходные материалы для цифровой техники (folder)/Toner - OEM	177134	Hewlett Packard
5355955	4515777593113	Игровая поверхность Acer predator mouse pad (np.msp11.00a)	5118569	Коврик для мыши	205856	Acer
5355956	4515777593120	Игровая поверхность Acer predator mouse pad (np.msp11.00b)	5118569	Коврик для мыши	205856	Acer
5355957	4515777593137	Игровая поверхность Acer predator mouse pad (np.msp11.00c)	5118569	Коврик для мыши	205856	Acer
5355958	4712900829747	Игровая поверхность Asus cerberus mat Mini Green (90yh01c4-bdua00)	5118569	Коврик для мыши	218565	Asus
5355959	4712900829730	Игровая поверхность Asus cerberus mat Mini Red (90yh01c3-bdua00)	5118569	Коврик для мыши	218565	Asus
5355960	4712900829723	Игровая поверхность Asus cerberus mat Plus Red (90yh01c2-bdua00)	5118569	Коврик для мыши	218565	Asus
5355961	4712900829716	Игровая поверхность Asus cerberus mat xxl Red (90yh01c1-bdua00)	5118569	Коврик для мыши	218565	Asus
5355962	4712900290615	Игровая поверхность Asus cerberus mouse pad (90yh00t1-bdua00)	5118569	Коврик для мыши	218565	Asus
5355963	4712900473223	Игровая поверхность Asus cerberus pad Speed ??(90yh0111-bdua00)	5118569	Коврик для мыши	218565	Asus
5355964	4716659576549	Игровая поверхность Asus echelon gaming mouse pad (90yh0031-bdua00)	5118569	Коврик для мыши	218565	Asus
5355966	4712900382488	Игровая поверхность Asus rog cerberus artic mouse pad (90yh00y1-baua00)	5118569	Коврик для мыши	218565	Asus
5355967	4712900759297	Игровая поверхность Asus rog scabbard gaming mouse pad (90mp00s0-b0ua00)	5118569	Коврик для мыши	218565	Asus
5355969	4712900845655	Игровая поверхность Asus rog sheath Black Box (90mp00k1-b0uc00)	5118569	Коврик для мыши	218565	Asus
5355972	4712900759310	Игровая поверхность Asus rog strix edge gaming mouse pad (90mp00t0-b0ua00)	5118569	Коврик для мыши	218565	Asus
5355973	4716659816294	Игровая поверхность Asus rog strix glide control gaming mouse pad (90yh00e1-bdua00)	5118569	Коврик для мыши	218565	Asus
5355974	4716659816249	Игровая поверхность Asus rog strix glide Speed gaming mouse pad (90yh00f1-bdua00)	5118569	Коврик для мыши	218565	Asus
5355975	886227957408	Игровая поверхность Asus rog whetstone (90mp00c1-b0ua00)	5118569	Коврик для мыши	218565	Asus
5355976	4712900236538	Игровая поверхность Asus strix glide control (90yh00e1-bdua01)	5118569	Коврик для мыши	218565	Asus
5355977	4712900236514	Игровая поверхность Asus strix glide Speed ??(90yh00f1-bdua01)	5118569	Коврик для мыши	218565	Asus
5355978	4718017225267	Игровая поверхность Asus tuf gaming p3 (90mp01c0-b0ua00)	5118569	Коврик для мыши	218565	Asus
5355979	4897025460317	Игровая поверхность cooler master choiix travelpad (c-mq01-kl)	5118569	Коврик для мыши	1692853	COOLER MASTER
5355980	4897025460409	Игровая поверхность cooler master choiix ультратонкий (c-mm02-kk)	5118569	Коврик для мыши	1692853	COOLER MASTER
5355981	4719512016718	Игровая поверхность cooler master cs-m tactics dc размер м, мягкий (sgs-4000-ksm-1-GP)	5118569	Коврик для мыши	1692853	COOLER MASTER
5355982	4719512016725	Игровая поверхность cooler master cs-m weapon of choice, размер м, мягкий (sgs-4000-wsm-1-GP)	5118569	Коврик для мыши	1692853	COOLER MASTER
5355983	4719512016732	Игровая поверхность cooler master cs-m weapon of choice, размер м, мягкий (sgs-4010-ksm-1-GP)	5118569	Коврик для мыши	1692853	COOLER MASTER
5355984	4719512016701	Игровая поверхность cooler master hs-m weapon of choice, размер м, жорсткий (sgs-6010-khm-1-GP)	5118569	Коврик для мыши	1692853	COOLER MASTER
5355985	4715302447809	Игровая поверхность cougar arena Orange (arena Orange)	5118569	Коврик для мыши	5140424	cougar
5355986	4715302447694	Игровая поверхность cougar control 2l (control 2l)	5118569	Коврик для мыши	5140424	cougar
5355987	4715302448981	Игровая поверхность cougar control 2m (control 2m)	5118569	Коврик для мыши	5140424	cougar
5140483	4715302448806	Игровая поверхность cougar Speed (arena Black)	5118569	Коврик для мыши	5140424	cougar
5355988	4715302449001	Игровая поверхность cougar Speed 2m (Speed 2m)	5118569	Коврик для мыши	5140424	cougar
5355989	4715302448998	Игровая поверхность cougar Speed 2s (Speed 2s)	5118569	Коврик для мыши	5140424	cougar
2443280	728658034931	Игровая поверхность cyborg mad catz g.l.i.d.e. 3 (mcb4381100a1/06/1)	1	Неклассифицированные/default	0	
2443281	728658285418	Игровая поверхность cyborg mad catz g.l.i.d.e. 5 (mcb4380900a1/06/1)	1	Неклассифицированные/default	0	
5355991	5902721300009	Игровая поверхность Dream machines dm pad l (dm_pad_l)	5118569	Коврик для мыши	5145389	dream machines
5355992	5902721300016	Игровая поверхность Dream machines dm pad xl (dm_pad_xl)	5118569	Коврик для мыши	5145389	dream machines
5355993	8716309086219	Игровая поверхность gembird mp-Game-s, тканину черный кол?р (8716309086219)	5118569	Коврик для мыши	0	
5355994	4710268250807	Игровая поверхность genius gx-control p100 (31250056100)	5118569	Коврик для мыши	228194	Genius
5355995	4710268250265	Игровая поверхность genius gx-Speed p100 (31250055100)	5118569	Коврик для мыши	228194	Genius
5355996	4719331550714	Игровая поверхность gigabyte aorus by gigabyte amp900 (amp_900)	5118569	Коврик для мыши	213738	GigaByte
5355997	4719331550684	Игровая поверхность gigabyte p7 aorus	5118569	Коврик для мыши	213738	GigaByte
5355998	190781648345	Игровая поверхность hp omen 100 (1my14AA)	5118569	Коврик для мыши	177633	HP
5356000	192545881968	Игровая поверхность hp pavilion gaming mouse pad 300 (4pz84AA)	5118569	Коврик для мыши	177633	HP
5356001	740617274233	Игровая поверхность hyperx fury s Pro gaming (large) New (hx-mpfs-l-1n)	5118569	Коврик для мыши	0	
5356002	740617274226	Игровая поверхность hyperx fury s Pro gaming mouse pad medium New (hx-mpfs-m-1n)	5118569	Коврик для мыши	0	
5356004	740617235180	Игровая поверхность hyperx skyn mouse pad (hx-mpsk-c)	5118569	Коврик для мыши	0	
5356005	740617239577	Игровая поверхность kingston hyperx fury Pro gaming mouse pad (hx-mpfp-xl)	5118569	Коврик для мыши	179969	Kingston
5175622	740617267075	Игровая поверхность kingston hyperx fury Pro gaming mouse pad (hx-mpfs-l)	5118569	Коврик для мыши	179969	Kingston
5356006	740617267068	Игровая поверхность kingston hyperx fury Pro gaming mouse pad (hx-mpfs-m)	5118569	Коврик для мыши	179969	Kingston
5356007	740617239560	Игровая поверхность kingston hyperx fury Pro gaming mouse pad large (hx-mpfp-l)	5118569	Коврик для мыши	179969	Kingston
5356008	740617267082	Игровая поверхность kingston hyperx fury Pro gaming mouse pad large (hx-mpfs-xl)	5118569	Коврик для мыши	179969	Kingston
5356009	740617239768	Игровая поверхность kingston hyperx fury Pro gaming mouse pad medium (hx-mpfp-m)	5118569	Коврик для мыши	179969	Kingston
5356010	740617267051	Игровая поверхность kingston hyperx fury s Pro gaming mouse pad small (hx-mpfs-sm)	5118569	Коврик для мыши	179969	Kingston
5175623	740617274455	Игровая поверхность kingston hyperx fury s Pro gaming mouse pad Speed edition large (hx-mpfs-s-l)	5118569	Коврик для мыши	179969	Kingston
5356011	740617274448	Игровая поверхность kingston hyperx fury s Pro gaming mouse pad Speed edition medium (hx-mpfs-s-m)	5118569	Коврик для мыши	179969	Kingston
5356012	740617274431	Игровая поверхность kingston hyperx fury s Pro gaming mouse pad Speed edition small (hx-mpfs-s-sm)	5118569	Коврик для мыши	179969	Kingston
5356013	740617274462	Игровая поверхность kingston hyperx fury s Pro gaming mouse pad Speed edition xl (hx-mpfs-s-xl)	5118569	Коврик для мыши	179969	Kingston
5356014	193638156321	Игровая поверхность legion cloth xl mouse pad (gxh0w29068)	5118569	Коврик для мыши	780890	LENOVO
5356015	889800506796	Игровая поверхность lenovo gaming mouse pad - ww (gxy0k07130)	5118569	Коврик для мыши	780890	LENOVO
5356017	7350041900344	Игровая поверхность mionix sargas m (mnx-04-25001-g)	5118569	Коврик для мыши	5422417	mionix
5356018	824142172698	Игровая поверхность msi agility gd70 (j02-vxxxxx1-eb9)	5118569	Коврик для мыши	2151139	MSI
5356019	4719072422332	Игровая поверхность msi gaming shield mousepad (gf9-v000002-eb9)	5118569	Коврик для мыши	2151139	MSI
5356020	8886419317814	Игровая поверхность razer goliathus control fissure extended (rz02-01070800-r3M20	5118569	Коврик для мыши	5144995	razer
2635798	8886419315261	Игровая поверхность razer goliathus standard control fragged (rz02-00211100-r3M1-r)	1	Неклассифицированные/default	5144995	razer
5356021	8886419317722	Игровая поверхность razer goliathus terra small Speed (rz02-01070100-r3M2)	5118569	Коврик для мыши	5144995	razer
5356022	8886419315346	Игровая поверхность razer kabuto mobile gaming (rz02-00340100-r3M1)	5118569	Коврик для мыши	5144995	razer
5356024	8886419315438	Игровая поверхность razer scarab	5118569	Коврик для мыши	5144995	razer
5356025	897126000447	Игровая поверхность razer vespula	5118569	Коврик для мыши	0	
5356026	813810011988	Игровая поверхность steelseries 4нd (63200)	5118569	Коврик для мыши	2730554	SteelSeries
5356027	813682023065	Игровая поверхность steelseries qck + limited edition (63700)	5118569	Коврик для мыши	2730554	SteelSeries
5356028	813810018710	Игровая поверхность steelseries qck dex (63500)	5118569	Коврик для мыши	2730554	SteelSeries
5356029	813810016983	Игровая поверхность steelseries qck Frost Blue (67273)	5118569	Коврик для мыши	2730554	SteelSeries
5356030	813810010448	Игровая поверхность steelseries qck heavy (63008)	5118569	Коврик для мыши	2730554	SteelSeries
5356031	5707119031196	Игровая поверхность steelseries qck limited edition (63400)	5118569	Коврик для мыши	2730554	SteelSeries
2663990	5707119001823	Игровая поверхность steelseries qck mass (63010)	1	Неклассифицированные/default	2730554	SteelSeries
5356032	813810018161	Игровая поверхность steelseries qck Mini cretins dans lemille (67286)	5118569	Коврик для мыши	2730554	SteelSeries
5356033	813810017423	Игровая поверхность steelseries qck Mini lapins cretins tmbwaaaah (67278)	5118569	Коврик для мыши	2730554	SteelSeries
5356034	813682023034	Игровая поверхность steelseries qck prism (63391gz)	5118569	Коврик для мыши	2730554	SteelSeries
5356035	813810016716	Игровая поверхность steelseries qck world of tanks (67269)	5118569	Коврик для мыши	2730554	SteelSeries
5356036	813682020118	Игровая поверхность steelseries qck xxl (67500)	5118569	Коврик для мыши	2730554	SteelSeries
5356037	813810010417	Игровая поверхность steelseries qck+ (63003)	5118569	Коврик для мыши	2730554	SteelSeries
5356038	5707119031561	Игровая поверхность steelseries qck+ cs go hyperbeast edition (63800)	5118569	Коврик для мыши	2730554	SteelSeries
5356040	813810017706	Игровая поверхность steelseries qck+ dota2 vengeful (67283)	5118569	Коврик для мыши	2730554	SteelSeries
5356041	813810014460	Игровая поверхность steelseries qck+ navi (63313)	5118569	Коврик для мыши	2730554	SteelSeries
5356042	813810017331	Игровая поверхность steelseries qck+ navi splash (63376)	5118569	Коврик для мыши	2730554	SteelSeries
5356039	5707119028431	Игровая поверхность steelseries qck+cs: go camo edition (63379gz)	5118569	Коврик для мыши	2730554	SteelSeries
5356043	813810014873	Игровая поверхность steelseries qck+dota2 (63319)	5118569	Коврик для мыши	2730554	SteelSeries
5356044	813810010455	Игровая поверхность steelseries qckmass gaming	5118569	Коврик для мыши	2730554	SteelSeries
5356045	609132867170	Игровая поверхность tesoro aegis x1 (ts-x1)	5118569	Коврик для мыши	3759990	TESORO
5356046	732330415598	Игровая поверхность tesoro aegis x2 (ts-x2)	5118569	Коврик для мыши	3759990	TESORO
5356047	732330415604	Игровая поверхность tesoro aegis x3 (ts-x3)	5118569	Коврик для мыши	3759990	TESORO
5356048	609132867194	Игровая поверхность tesoro aegis x3 virtus Pro (ts x3-vp)	5118569	Коврик для мыши	3759990	TESORO
5356049	8713439223828	Игровая поверхность trust gxt 752-sb spectra gaming mouse pad Blue (22382_trust)	5118569	Коврик для мыши	3763837	TRUST
5356050	8713439222296	Игровая поверхность trust gxt754-l mousepad (22229_trust)	5118569	Коврик для мыши	3763837	TRUST
5188981	4601250207186	Игровая приставка dendy Dream 300 игр + 2 джойстика	5143859	ретро консоли (8 и 16 бит)	5143860	new game
5188983	4601250207070	Игровая приставка dendy junior - 300 игр	5143859	ретро консоли (8 и 16 бит)	5143860	new game
5188980	4601250207100	Игровая приставка dendy junior 300 игр + световой пистолет	5143859	ретро консоли (8 и 16 бит)	5143860	new game
974974	4601250207216	Игровая приставка dendy smart 567 игр hdmi	4093300	Медиа (folder)/Media	5143846	dendy
974970	4601250207193	Игровая приставка dendy vakker 300 игр + световой пистолет + 2 джойстика	4093300	Медиа (folder)/Media	5143846	dendy
4269837	045496342067	Игровая приставка nintendo wii sports pack	1	Неклассифицированные/default	0	
4608460	711719856344	Игровая приставка sony playstation 4 (1tb) + assassins creed syndicate + watchdogs	1	Неклассифицированные/default	3089948	Sony Playstation
5221264	711719391401	Игровая приставка sony playstation 4 slim 1tb (gran turismo + horizon zero dawn + spider-man + psplus 3M) (9391401)	1	Неклассифицированные/default	144600	SONY
5188984	4601250207117	Игровая приставка магистр drive 2 lit 252 игры + 2 джойстика	5143859	ретро консоли (8 и 16 бит)	5143860	new game
4840718	6932391904107	Игровая проводная клавиатура marvo k201 - 104 кл	265432	Техника (folder)/Электротехника (folder)/Цифровая техника (folder)/Клавиатура	4834670	MARVO
4840719	6932391904183	Игровая проводная клавиатура с подсветкой marvo k636 (k936) - 114 кл, 10 кл мультимедиа, подсветка	265432	Техника (folder)/Электротехника (folder)/Цифровая техника (folder)/Клавиатура	4834670	MARVO
4840720	6932391904008	Игровая проводная клавиатура с подсветкой marvo kg749 (k949) - 118кл, 5 кл с макросами, 7цв подсветка	265432	Техника (folder)/Электротехника (folder)/Цифровая техника (folder)/Клавиатура	4834670	MARVO
4840721	6932391904534	Игровая проводная оптическая мышь marvo m205 bk - 6 кн, 1 подсветка, dpi 800/1200/1600	5323790	Техника (folder)/Электротехника (folder)/Цифровая техника (folder)/Мышь компьютерная	4834670	MARVO
4840722	6932391900154	Игровая проводная оптическая мышь marvo m306 - 6 кн, 7цв подсветки, dpi 800/1200/1600/2400	5323790	Техника (folder)/Электротехника (folder)/Цифровая техника (folder)/Мышь компьютерная	4834670	MARVO
4840723	6932391904541	Игровая проводная оптическая мышь marvo m310 - 6 кн, 7цв подсветки, dpi 800/1200/1600/2400	5323790	Техника (folder)/Электротехника (folder)/Цифровая техника (folder)/Мышь компьютерная	4834670	MARVO
4840724	6932391900178	Игровая проводная оптическая мышь marvo m316 - 6 кн, 7цв подсветки, dpi 800/1200/1600/2400	5323790	Техника (folder)/Электротехника (folder)/Цифровая техника (folder)/Мышь компьютерная	4834670	MARVO
5356226	4013594141475	Игровая тележка goki зеленая (14147g)	980	Игрушки (folder)/Игрушка	5163251	goki
713223	8411005050112	Игровая тележка с песочным наб	980	Игрушки (folder)/Игрушка	0	
5356234	062243263635	Игровая фигура our generation к?нь чемп?он с аксессуарами 50cm (bd38146z)	980	Игрушки (folder)/Игрушка	5356231	our generation
5356232	062243263642	Игровая фигура our generation лошадь Принцесса с аксессуарами 50cm (bd38003z)	980	Игрушки (folder)/Игрушка	5356231	our generation
5356233	062243281318	Игровая фигура our generation лошадь скарлет с аксессуарами 26cm (bd38012z)	980	Игрушки (folder)/Игрушка	5356231	our generation
5356239	681326115106	Игровая электронная мишень jazwares nerf elite hovering target (11510n)	1	Неклассифицированные/default	0	
5356240	4013594518062	Игровий набор goki ваги (51806g)	1	Неклассифицированные/default	5163251	goki
5356242	4601504032328	Игровое бескаркасное кресло paremo Фея, сиреневый, (pcr316-01)	148621	Игрушки (folder)/Игрушка мягкая	5326464	paremo
5356244	4601504032335	Игровое кресло paremo рыцарь голубой, (pcr316-02)	148621	Игрушки (folder)/Игрушка мягкая	5326464	paremo
5356245	4601504033240	Игровое кресло paremo серии мимими, крошка ви, (pcr317-04)	148621	Игрушки (folder)/Игрушка мягкая	5326464	paremo
5321864	6943478015258	Игровое Поле hape e3714_hp стол двусторонний с системой хранения	5321863	наборы мебели, столы и стулья	5316803	hape
2233176	6922191290425	Игровое Поле для - bblade-spintor	980	Игрушки (folder)/Игрушка	0	
1961225	6945642806150	Игровое Поле-2, для конструктора, арт.8802	1	Неклассифицированные/default	0	
5356251	4711421934626	Игровой A4tech x7 xp-50nh rgb	1	Неклассифицированные/default	2396349	A4tech
5356252	4715302442385	Игровой cougar control ex-m	1	Неклассифицированные/default	0	
5356253	4715302447656	Игровой cougar spd 2 l	1	Неклассифицированные/default	0	
5356254	4715302442347	Игровой cougar Speed ex-xl	1	Неклассифицированные/default	0	
5356259	5901299927984	Игровой esperanza Classic (egp102k)	1	Неклассифицированные/default	5149179	esperanza
5356260	5901299928028	Игровой esperanza Classic (egp103k)	1	Неклассифицированные/default	5149179	esperanza
5356266	4820210280193	Игровой podmыshku battlegrounds м	1	Неклассифицированные/default	5356265	pod mishkou
5356267	4820210280223	Игровой podmыshku counter Strike l	1	Неклассифицированные/default	5356265	pod mishkou
5356270	4820210280049	Игровой podmыshku gta 5m	1	Неклассифицированные/default	5356265	pod mishkou
5356273	4820210280087	Игровой podmыshku the witcher м	1	Неклассифицированные/default	5356265	pod mishkou
5356276	4820210280124	Игровой podmыshku танк ис-7m	1	Неклассифицированные/default	5356265	pod mishkou
5356277	5707119019132	Игровой steelseries qck world of tanks edition	1	Неклассифицированные/default	2730554	SteelSeries
1666766	4006592625665	Игровой автомат, 24x17 x 32cm, 6/6	980	Игрушки (folder)/Игрушка	651699	Simba
2436462	4607139715711	Игровой англ. музыкальные уроки - (russobit-m)	1	Неклассифицированные/default	2275054	Russobit-M
2436463	4607139716060	Игровой английский. спасение планеты- (russobit-m)	1	Неклассифицированные/default	2275054	Russobit-M
2436464	4607139715810	Игровой английский. твои первые урок- (russobit-m)	1	Неклассифицированные/default	2275054	Russobit-M
3811505	6438240024779	Игровой бассейнсерииснапсет океан,от 3 лет	1	Неклассифицированные/default	0	
5356281	4610074930040	Игровой беспроводной геймпад 20491 trust gxt 545 13 клавиш pc+ps3 68312	1	Неклассифицированные/default	3763837	TRUST
5356284	8716569028882	Игровой будиночок pop-it-up заколдованный лес (f2pg15809)	5145104	Домик игровой	5356283	pop-it-up
5356285	8716569031189	Игровой будиночок pop-it-up заколдованный лес 30x30x 40cm с игровым ковриком 60x 90cm (f2sb16809)	5145104	Домик игровой	5356283	pop-it-up
5356286	8716569027205	Игровой будиночок pop-it-up замок принцессы (f2pt12813)	5145104	Домик игровой	5356283	pop-it-up
5356287	8716569020749	Игровой будиночок pop-it-up питстоп (f2pg11807)	5145104	Домик игровой	5356283	pop-it-up
