ID	UPCEAN	Name	CategoryID	CategoryName	BrandID	BrandName
4184238	075596121521	Cd chapman, tracy matters of the heart	4093300	Медиа (folder)/Media	0	
4184239	634479144523	Cd chapter 23 flying in the face of conventional wisdom	4093300	Медиа (folder)/Media	0	
4184240	617024402125	Cd chapterhouse retranslated by global communication pentamerous metamorphosis	4093300	Медиа (folder)/Media	0	
4184241	5013929130425	Cd chapterhouse whirlpool	4093300	Медиа (folder)/Media	0	
4184242	078635300628	Cd chapterhouse whirlpool #2	4093300	Медиа (folder)/Media	0	
4184243	724384749828	Cd chaquico, craig four corners	4093300	Медиа (folder)/Media	0	
4184244	653738243326	Cd chardavoine fifth season	4093300	Медиа (folder)/Media	0	
4184245	601143003721	Cd chardiet simon bug bite daddy	4093300	Медиа (folder)/Media	0	
4184246	5013929219625	Cd charge perfection Plus anagram records cdm gram 196	4093300	Медиа (folder)/Media	0	
4184247	5014438200821	Cd charged gbh city baby's revenge	4093300	Медиа (folder)/Media	0	
4184248	783707409221	Cd charisse lowe places i've been..people i've known	4093300	Медиа (folder)/Media	0	
4184249	634479249624	Cd charity for sept. 11 victims the world will remember	4093300	Медиа (folder)/Media	0	
4184250	682161609126	Cd charivari i want to dance with you	4093300	Медиа (folder)/Media	0	
4184251	724353598525	Cd charlap, bill stardust the music of hoagy carmichael	4093300	Медиа (folder)/Media	0	
4184252	724352729128	Cd charlap, bill writen in the stars	4093300	Медиа (folder)/Media	0	
4184253	601215386622	Cd charlatans uk the us and us only	4093300	Медиа (folder)/Media	0	
4184254	638812708427	Cd charlelie soude soude	4093300	Медиа (folder)/Media	0	
4184255	634479781025	Cd charlene Helen berry dulcimer americana	4093300	Медиа (folder)/Media	0	
4184256	634479780721	Cd charlene Helen berry hymns of prayer and praise	4093300	Медиа (folder)/Media	0	
4184257	634479780929	Cd charlene Helen berry joy, peace, healing	4093300	Медиа (folder)/Media	0	
4184258	634479542626	Cd charlene jewel only trust your heart	4093300	Медиа (folder)/Media	0	
4184259	783707650821	Cd charlene lockwood flickering images	4093300	Медиа (folder)/Media	0	
4184260	634479839023	Cd charles allison braced in the beams	4093300	Медиа (folder)/Media	0	
4184261	094638881223	Cd charles aznavour colore ma vie	4093300	Медиа (folder)/Media	0	
4184262	724383370320	Cd charles aznavour greatest Golden hits	4093300	Медиа (folder)/Media	0	
4184263	724386028228	Cd charles aznavour mejor de charles aznavour [emi]	4093300	Медиа (folder)/Media	0	
4184264	724354043420	Cd charles aznavour ses Plus grands succes	4093300	Медиа (folder)/Media	0	
4184265	821960018023	Cd charles berry just for fun	4093300	Медиа (folder)/Media	0	
4184266	014551477129	Cd charles brown One more for the road	4093300	Медиа (folder)/Media	0	
4184267	881162801823	Cd charles brown very best of charles brown featuring shuggie otis [stardust]	4093300	Медиа (folder)/Media	0	
4184268	095115506622	Cd charles bruffy spotless Rose hymns to the virgin mary [hybrid sacd]	4093300	Медиа (folder)/Media	0	
4184269	660662038522	Cd charles compo seventh moon	4093300	Медиа (folder)/Media	0	
4184270	747313228676	Cd charles daniels edund rubbra string quartet no. 2	4093300	Медиа (folder)/Media	0	
4184271	804663601624	Cd charles davis&the cedar walton trio Blue gardenia	4093300	Медиа (folder)/Media	0	
4184272	067461629225	Cd charles denler purple piano	4093300	Медиа (folder)/Media	0	
4184273	634479204722	Cd charles dube Long walks off a short pier	4093300	Медиа (folder)/Media	0	
4184274	636943908723	Cd charles ives ives symphony no. 3	4093300	Медиа (folder)/Media	0	
4184275	096094112125	Cd charles jones tribute to the legends	4093300	Медиа (folder)/Media	0	
4184276	705092006625	Cd charles knox 2002 chamber music of charles knox	4093300	Медиа (folder)/Media	0	
4184277	634479199523	Cd charles l. matier god will provide	4093300	Медиа (folder)/Media	0	
4184278	602517799240	Cd charles lloyd call	4093300	Медиа (folder)/Media	0	
4184279	602517548114	Cd charles lloyd rabo de nube	4093300	Медиа (folder)/Media	0	
4184280	783707409825	Cd charles lyonhart down to the hard Line	4093300	Медиа (folder)/Media	0	
4184281	712657106027	Cd charles lyonhart exception to the rule	4093300	Медиа (folder)/Media	0	
4184282	712657075026	Cd charles lyonhart leap of faith	4093300	Медиа (folder)/Media	0	
4184283	828766637328	Cd charles m??nch berlioz requiem [hybrid sacd]	4093300	Медиа (folder)/Media	0	
4184284	828766138726	Cd charles m??nch Saint-sa??ns symphony no. 3	4093300	Медиа (folder)/Media	0	
4184285	089408027925	Cd charles mackerras handel Water music	4093300	Медиа (folder)/Media	0	
4184286	089408015625	Cd charles mackerras haydn symphonies nos. 31 ???hornsignal??? & 45 ???farewell???	4093300	Медиа (folder)/Media	0	
4184287	095115314326	Cd charles mackerras humperdinck hansel and gretel	4093300	Медиа (folder)/Media	0	
4184288	749677132521	Cd charles mackerras jan??cek sinfonietta four preludes	4093300	Медиа (folder)/Media	0	
4184289	095115313824	Cd charles mackerras jan??cek the makropoulos case	4093300	Медиа (folder)/Media	0	
4184290	634479742422	Cd charles mazarakes lost islands on an imagined sea	4093300	Медиа (folder)/Media	0	
4184291	820941000125	Cd charles miller petals of Love	4093300	Медиа (folder)/Media	0	
4184292	602498421796	Cd charles mingus 20th Century masters the millennium collection the best of charles mingus	4093300	Медиа (folder)/Media	0	
4184293	016728304122	Cd charles mingus at ucla 1965	4093300	Медиа (folder)/Media	0	
4184294	094639221028	Cd charles mingus cornell 1964	4093300	Медиа (folder)/Media	0	
4184295	886972412825	Cd charles mingus ken burns jazz	4093300	Медиа (folder)/Media	0	
4184296	886974801023	Cd charles mingus mingus ah um [50th anniversary legacy edition]	4093300	Медиа (folder)/Media	0	
2551511	074646551226	Cd charles mingus mingus ah um [bonus tracks]	4093300	Медиа (folder)/Media	0	
4184297	074646462423	Cd charles mingus this is jazz 6	4093300	Медиа (folder)/Media	0	
4184298	081227994457	Cd charles mingus very best of charles mingus [rhino]	4093300	Медиа (folder)/Media	0	
4184299	634479243820	Cd charles p. phillips a vision of ludovic lamothe	4093300	Медиа (folder)/Media	0	
4184300	791022083224	Cd charles parente clear across the Water	4093300	Медиа (folder)/Media	0	
4184301	634479427626	Cd charles rahmat woods Modern music therapy	4093300	Медиа (folder)/Media	0	
4184302	634479496424	Cd charles rahmat woods rahmat shabazz Original jazz	4093300	Медиа (folder)/Media	0	
4184303	651047121625	Cd charles sedlak La guitarra	4093300	Медиа (folder)/Media	0	
4184304	634479626524	Cd charles spencer roses	4093300	Медиа (folder)/Media	0	
4184305	829757260327	Cd charles w. Johnson, jr. the harvest	4093300	Медиа (folder)/Media	0	
4184306	765481538427	Cd charles williams&tom teasley poetry, prose, percussion and song	4093300	Медиа (folder)/Media	0	
4184307	081227575922	Cd charles, ray anthology	4093300	Медиа (folder)/Media	0	
4184308	075678136825	Cd charles, ray best of ...	4093300	Медиа (folder)/Media	0	
4184309	081227172220	Cd charles, ray best of the atlantic	4093300	Медиа (folder)/Media	0	
4184310	081227160722	Cd charles, ray blues and jazz	4093300	Медиа (folder)/Media	0	
4184311	741157121124	Cd charles, ray Essential collection	4093300	Медиа (folder)/Media	0	
4184312	075678133824	Cd charles, ray genius of ray charles	4093300	Медиа (folder)/Media	0	
4184313	075678173127	Cd charles, ray genius/the great	4093300	Медиа (folder)/Media	0	
4184314	075678173226	Cd charles, ray ray charles live	4093300	Медиа (folder)/Media	0	
4184315	081227609825	Cd charles, ray ray charles sings for America	4093300	Медиа (folder)/Media	0	
4184316	075678195129	Cd charles, ray soul brothers:soul meeting (db	4093300	Медиа (folder)/Media	0	
4184317	074646909928	Cd charles, ray Super hits	4093300	Медиа (folder)/Media	0	
4184318	075678231025	Cd charles, ray the birth of soul Box	4093300	Медиа (folder)/Media	0	
4184319	081227982225	Cd charles, ray the very best of	4093300	Медиа (folder)/Media	0	
4184320	075678028229	Cd charles, ray what i'd say	4093300	Медиа (folder)/Media	0	
4184321	625989151125	Cd charley beck life's pleasures?	4093300	Медиа (folder)/Media	0	
4184322	664241010220	Cd charley dush charley dush	4093300	Медиа (folder)/Media	0	
4184323	626776719122	Cd charley groth and Group grandpa flatpicked	4093300	Медиа (folder)/Media	0	
4184324	708535155423	Cd charley patton devil???s best friend	4093300	Медиа (folder)/Media	0	
4184325	792014070826	Cd charley pride 22 all time greatest hits	4093300	Медиа (folder)/Media	0	
4184326	012676146722	Cd charley pride best of charley pride	4093300	Медиа (folder)/Media	0	
4184327	625282791721	Cd charley pride country music superstars charley pride and conway twitty	4093300	Медиа (folder)/Media	0	
4184328	025218610728	Cd charlie byrd bossa Nova pelos passaros	4093300	Медиа (folder)/Media	0	
4184329	090431667729	Cd charlie byrd byrdland/ more brazilian byrd	4093300	Медиа (folder)/Media	0	
4184330	025218694520	Cd charlie byrd guitar artistry of charlie byrd	4093300	Медиа (folder)/Media	0	
4184331	634479677120	Cd charlie cardinal my money tree	4093300	Медиа (folder)/Media	0	
4184332	666449343025	Cd charlie channel charlie channel bedtime buddy	4093300	Медиа (folder)/Media	0	
4184333	076637037320	Cd charlie Christian immortal charlie Christian [columbia]	4093300	Медиа (folder)/Media	0	
4184334	634479587825	Cd charlie creasy Dream on	4093300	Медиа (folder)/Media	0	
4184335	684038423927	Cd charlie daniels deuces	4093300	Медиа (folder)/Media	0	
4184336	696998907423	Cd charlie daniels Essential charlie daniels band	4093300	Медиа (folder)/Media	0	
4184337	634479016721	Cd charlie dentel innocent things	4093300	Медиа (folder)/Media	0	
4184338	634479016325	Cd charlie dentel walls of Stone	4093300	Медиа (folder)/Media	0	
4184339	765481881226	Cd charlie faege imaginary themes volumes 1.2 and 3	4093300	Медиа (folder)/Media	0	
4184340	600753021071	Cd charlie haden best of quartet West	4093300	Медиа (folder)/Media	0	
4184341	4988005498304	Cd charlie haden liberation music orchestra	4093300	Медиа (folder)/Media	0	
4184342	797537102221	Cd charlie haden none but the lonely heart	4093300	Медиа (folder)/Media	0	
4184343	602517791657	Cd charlie haden rambling boy	4093300	Медиа (folder)/Media	0	
4184344	700435718128	Cd charlie Hunter altitude	4093300	Медиа (folder)/Media	0	
4184345	020286206026	Cd charlie Hunter copperopolis	4093300	Медиа (folder)/Media	0	
4184346	611587105028	Cd charlie King&karen brandow i struck Gold	4093300	Медиа (folder)/Media	0	
4184347	604388334629	Cd charlie kitchens of distinction	4093300	Медиа (folder)/Media	0	
4184348	856075001042	Cd charlie louvin charlie louvin [2007]	4093300	Медиа (folder)/Media	0	
4184349	894807002127	Cd charlie louvin sings murder ballads and disaster songs	4093300	Медиа (folder)/Media	0	
4184350	014551561224	Cd charlie musselwhite de luxe edition	4093300	Медиа (folder)/Media	0	
4184351	602498892985	Cd charlie Parker charlie Parker for lovers	4093300	Медиа (folder)/Media	0	
4184352	5014797296206	Cd charlie Parker in a soulful mood [double disc]	4093300	Медиа (folder)/Media	0	
4184353	795041758729	Cd charlie Parker now???s the time [savoy jazz]	4093300	Медиа (folder)/Media	0	
4184354	090096251721	Cd charlie Parker salt peanuts	4093300	Медиа (folder)/Media	0	
4184355	724385161827	Cd charlie peacock in the Light the very best of charlie peacock	4093300	Медиа (folder)/Media	0	
4184356	080688186524	Cd charlie peacock lie down in the grass	4093300	Медиа (folder)/Media	0	
4184357	635759167928	Cd charlie peacock Love press ex-curio	4093300	Медиа (folder)/Media	0	
4184358	634479284625	Cd charlie redd Code redd	4093300	Медиа (folder)/Media	0	
4184359	777215104204	Cd charlie redstar charlie redstar	4093300	Медиа (folder)/Media	0	
4184360	4000127165169	Cd charlie Rich ballads of charlie Rich	4093300	Медиа (folder)/Media	0	
4184361	801655013526	Cd charlie robinson, brad hammett, Mickey bennett Gentle rain	4093300	Медиа (folder)/Media	0	
4184362	803020144828	Cd charlie robison beautiful Day	4093300	Медиа (folder)/Media	0	
4184363	724359041629	Cd charlie rouse bossa Nova bacchanal	4093300	Медиа (folder)/Media	0	
4184364	650687053822	Cd charlie sneller sounds for the season	4093300	Медиа (folder)/Media	0	
4184365	650687098724	Cd charlie souza live your Dream	4093300	Медиа (folder)/Media	0	
4184366	634479003028	Cd charlie Spring a grateful man	4093300	Медиа (folder)/Media	0	
4184367	634479189821	Cd charlie verge all the Love that was	4093300	Медиа (folder)/Media	0	
4184368	634479351327	Cd charlie wayne watson kindred spirits	4093300	Медиа (folder)/Media	0	
4184369	634479351426	Cd charlie wayne watson sacred journey	4093300	Медиа (folder)/Media	0	
4184370	634479351624	Cd charlie wayne watson tribal echoes	4093300	Медиа (folder)/Media	0	
4184371	634479351525	Cd charlie wayne watson voices in the wind	4093300	Медиа (folder)/Media	0	
4184372	783707775920	Cd charlie wiener small truths for sale at tony's place	4093300	Медиа (folder)/Media	0	
4184373	791022106725	Cd charlie williams chateau debris-venus has seen us	4093300	Медиа (folder)/Media	0	
4184374	886972338927	Cd charlie wilson uncle charlie	4093300	Медиа (folder)/Media	0	
4184375	074646435625	Cd charlotte church	4093300	Медиа (folder)/Media	0	
4184376	696998946323	Cd charlotte church Dream a Dream. charlotte church	4093300	Медиа (folder)/Media	0	
4184377	696998971028	Cd charlotte church enchantment. charlotte church.	4093300	Медиа (folder)/Media	0	
4184378	696998699021	Cd charlotte church prelude the very best of charlotte church	4093300	Медиа (folder)/Media	0	
4184379	074646095720	Cd charlotte church voice of an Angel. charlotte church	4093300	Медиа (folder)/Media	0	
4184380	634479838729	Cd charlotte Martin test-drive songs-limited edition	4093300	Медиа (folder)/Media	0	
4184381	602517671515	Cd charlotte sometimes waves&the both of us	4093300	Медиа (folder)/Media	0	
4184382	634479180620	Cd charlotte words of Comfort and joy	4093300	Медиа (folder)/Media	0	
4184383	783707360225	Cd charlottesville the shark who pulled a mussel	4093300	Медиа (folder)/Media	0	
4184384	634479333828	Cd charlson ximenes collision course	4093300	Медиа (folder)/Media	0	
4184385	634479147722	Cd charlus all Bright kids are depraved	4093300	Медиа (folder)/Media	0	
4184386	783707573120	Cd charly heart's Desire	4093300	Медиа (folder)/Media	0	
4184387	074644018622	Cd charly mcclain biggest hits	4093300	Медиа (folder)/Media	0	
4184388	079893357423	Cd charly mcclain Pure country	4093300	Медиа (folder)/Media	0	
4184389	846070026027	Cd charm city devils let???s Rock-n-roll	4093300	Медиа (folder)/Media	0	
4184390	628740667224	Cd charm ray Invisible boy	4093300	Медиа (folder)/Media	0	
4184391	783707492025	Cd charmaine mazzone mind dances	4093300	Медиа (folder)/Media	0	
4184392	642412465734	Cd charmaine say you Love me	4093300	Медиа (folder)/Media	0	
4184393	634479370823	Cd charmparticles the scenic ep	4093300	Медиа (folder)/Media	0	
4184394	685738229826	Cd charpentier, gustave louise / lott, pruett	4093300	Медиа (folder)/Media	0	
4184395	706301191323	Cd charpentier, marc-antoine La descente d'orphee..	4093300	Медиа (folder)/Media	0	
4184396	639842548526	Cd charpentier, marc-antoine La dispute de..	4093300	Медиа (folder)/Media	0	
4184397	745099655822	Cd charpentier, marc-antoine medee, christie	4093300	Медиа (folder)/Media	0	
4184398	745099723828	Cd charpentier, marc-antoine messe pour les trepasses	4093300	Медиа (folder)/Media	0	
4184399	685738582020	Cd charpentier, marc-antoine noels pour instruments/..	4093300	Медиа (folder)/Media	0	
4184400	745099964122	Cd charpentier, marc-antoine te deum/oeuvres sacrees	4093300	Медиа (folder)/Media	0	
4184401	049925105421	Cd chart toppers chart toppers dance hits of the 60s	4093300	Медиа (folder)/Media	0	
4184402	731452780928	Cd charts les acte 1	4093300	Медиа (folder)/Media	0	
4184403	731452317520	Cd charts les hannibal	4093300	Медиа (folder)/Media	0	
4184404	731458661221	Cd charvet david leap of faith	4093300	Медиа (folder)/Media	0	
4184405	625989386824	Cd chas chas	4093300	Медиа (folder)/Media	0	
4184406	783707715421	Cd chas williams ring of fire	4093300	Медиа (folder)/Media	0	
4184407	5050749414939	Cd chas&j.i. before we grow too Old	4093300	Медиа (folder)/Media	0	
4184408	634479806827	Cd chase brady heartbeat of the words	4093300	Медиа (folder)/Media	0	
4184409	677516524223	Cd chase dead poets	4093300	Медиа (folder)/Media	0	
4184410	733792581920	Cd chase emery fuel	4093300	Медиа (folder)/Media	0	
4184411	634479467127	Cd chase pattison chicaghost	4093300	Медиа (folder)/Media	0	
4184412	783707480428	Cd chase the vine don't let go	4093300	Медиа (folder)/Media	0	
4184413	775020141728	Cd chase, diane in the middle of something	4093300	Медиа (folder)/Media	0	
4184414	724385169922	Cd chasing furies with abandon	4093300	Медиа (folder)/Media	0	
4184415	783707446820	Cd chasing hades spacehead	4093300	Медиа (folder)/Media	0	
4184416	634479570025	Cd chasing sunday realize	4093300	Медиа (folder)/Media	0	
4184417	634479006227	Cd chasing sunday shauldeseen's pocket	4093300	Медиа (folder)/Media	0	
4184418	783707617022	Cd chaskinakuy a flor de tierra	4093300	Медиа (folder)/Media	0	
4184419	634479651328	Cd chasm chasm	4093300	Медиа (folder)/Media	0	
4184420	634479651427	Cd chasm panorhythmica	4093300	Медиа (folder)/Media	0	
4184421	628740659922	Cd chasmatic kicker wisdom	4093300	Медиа (folder)/Media	0	
4184422	634479809729	Cd chasper wanner noretro	4093300	Медиа (folder)/Media	0	
4184423	016861974220	Cd chastain Mystery of illusion	4093300	Медиа (folder)/Media	0	
4184424	651047137121	Cd chaston&groditski 30-year reunion sessions	4093300	Медиа (folder)/Media	0	
4184425	651047154227	Cd chaston&groditski rugged hoarhadees	4093300	Медиа (folder)/Media	0	
4184426	634457219922	Cd chatham county Line chatham county Line	4093300	Медиа (folder)/Media	0	
4184427	651047126323	Cd chatterbox chatterbox	4093300	Медиа (folder)/Media	0	
4184428	731452309525	Cd chaussettes noires les chaussettes noires (prises	4093300	Медиа (folder)/Media	0	
4184429	075596114622	Cd chavis, boozoo boozoo chavis	4093300	Медиа (folder)/Media	0	
4184430	074649122126	Cd chayanne atado a tu amor	4093300	Медиа (folder)/Media	0	
4184431	696998466722	Cd chayanne greatest hits	4093300	Медиа (folder)/Media	0	
4184432	074649145620	Cd chayanne simplemente	4093300	Медиа (folder)/Media	0	
4184433	886974429524	Cd chayanne vivo [CD/ DVD]	4093300	Медиа (folder)/Media	0	
4184434	634479626029	Cd chazt3 no boundaries	4093300	Медиа (folder)/Media	0	
4184435	634479816628	Cd chazz not tonight	4093300	Медиа (folder)/Media	0	
4184436	829707197727	Cd che sounds of liberation	4093300	Медиа (folder)/Media	0	
4184437	634479188022	Cd che zuro 10.000 jalama road	4093300	Медиа (folder)/Media	0	
4184438	634479253225	Cd che zuro and tisa adamson soak	4093300	Медиа (folder)/Media	0	
4184439	791022143928	Cd che zuro welcome Home	4093300	Медиа (folder)/Media	0	
4184440	822371028724	Cd cheap thrills roll the dice	4093300	Медиа (folder)/Media	0	
4184441	074643649827	Cd cheap trick all shook up	4093300	Медиа (folder)/Media	0	
4184442	886973817124	Cd cheap trick at budokan 30th anniversary collectors edition	4093300	Медиа (folder)/Media	0	
4184443	074646552728	Cd cheap trick at budokan the complete concert (remastered)	4093300	Медиа (folder)/Media	0	
4184444	074643440028	Cd cheap trick cheap trick	4093300	Медиа (folder)/Media	0	
4184445	074646557228	Cd cheap trick cheap trick (remastered)	4093300	Медиа (folder)/Media	0	
4184446	074643577328	Cd cheap trick Dream police	4093300	Медиа (folder)/Media	0	
4184447	696998647329	Cd cheap trick greatest hits (remastered)	4093300	Медиа (folder)/Media	0	
4184448	074646564820	Cd cheap trick heaven tonight (remastered)	4093300	Медиа (folder)/Media	0	
4184449	074646557327	Cd cheap trick in Color (remastered)	4093300	Медиа (folder)/Media	0	
4184450	020286136422	Cd cheap trick latest	4093300	Медиа (folder)/Media	0	
4184451	696998644823	Cd cheap trick live at budokan	4093300	Медиа (folder)/Media	0	
4184452	074643879422	Cd cheap trick next position please	4093300	Медиа (folder)/Media	0	
4184453	074643802123	Cd cheap trick One on One	4093300	Медиа (folder)/Media	0	
4184454	696998566422	Cd cheap trick sex America cheap trick (reconfigured 4 CD cube)	4093300	Медиа (folder)/Media	0	
4184455	074646493823	Cd cheap trick sex, America, cheap trick	4093300	Медиа (folder)/Media	0	
4184456	804983700021	Cd cheap trick sgt. pepper live	4093300	Медиа (folder)/Media	0	
4184457	074646601525	Cd cheap trick the authorized greatest hits (remastered)	4093300	Медиа (folder)/Media	0	
4184458	074644868128	Cd cheap trick the greatest hits	4093300	Медиа (folder)/Media	0	
4184459	634479110825	Cd cheap Wine crime stories	4093300	Медиа (folder)/Media	0	
4184460	634479697326	Cd cheap Wine pictures	4093300	Медиа (folder)/Media	0	
4184461	634479697920	Cd cheap Wine ruby shade	4093300	Медиа (folder)/Media	0	
4184462	634479418525	Cd cheatin' soccer mom got milf?	4093300	Медиа (folder)/Media	0	
4184463	657036112629	Cd cheb i sabbah La ghriba La kahena remixed	4093300	Медиа (folder)/Media	0	
4184464	731458952824	Cd cheb kader mani	4093300	Медиа (folder)/Media	0	
4184465	875232008021	Cd cheb khaled libert??	4093300	Медиа (folder)/Media	0	
4184466	075992736923	Cd cheech&chong big bambu	4093300	Медиа (folder)/Media	0	
4184467	075992736824	Cd cheech&chong cheech&chong	4093300	Медиа (folder)/Media	0	
4184468	075992361422	Cd cheech&chong greatest hit	4093300	Медиа (folder)/Media	0	
4184469	075992737029	Cd cheech&chong los cochinos	4093300	Медиа (folder)/Media	0	
4184470	075992736725	Cd cheech&chong up in smoke	4093300	Медиа (folder)/Media	0	
4184471	075992737128	Cd cheech&chong wedding album	4093300	Медиа (folder)/Media	0	
4184472	081227426521	Cd cheech&chong where there's smoke	4093300	Медиа (folder)/Media	0	
4184473	824678005620	Cd cheeky girls cheeky song (Touch my bum)	4093300	Медиа (folder)/Media	0	
4184474	829757155128	Cd cheetah hotel White house	4093300	Медиа (folder)/Media	0	
4184475	687066501322	Cd cheetah sneaks sneak preview	4093300	Медиа (folder)/Media	0	
4184476	634479544927	Cd chef chris and his nairobi trio you're going to jail and your car is too	4093300	Медиа (folder)/Media	0	
4184477	620672139725	Cd cheley tackett when we knew it all	4093300	Медиа (folder)/Media	0	
4184478	625989386121	Cd chelle out of the wilderness	4093300	Медиа (folder)/Media	0	
4184479	634479757624	Cd chellezan chellezan jams	4093300	Медиа (folder)/Media	0	
4184480	609991422626	Cd chelo eternamente	4093300	Медиа (folder)/Media	0	
4184481	652718428623	Cd chelsea beauchamp Little Star	4093300	Медиа (folder)/Media	0	
4184482	777521106527	Cd chelsea bridge blues in a sharp sea	4093300	Медиа (folder)/Media	0	
4184483	777521120226	Cd chelsea bridge double feature	4093300	Медиа (folder)/Media	0	
4184484	777521106626	Cd chelsea bridge tatmagouchie	4093300	Медиа (folder)/Media	0	
4184485	634479341625	Cd chelsea in Orbit chelsea in Orbit	4093300	Медиа (folder)/Media	0	
4184486	765481143126	Cd chelsea in Orbit luminous	4093300	Медиа (folder)/Media	0	
4184487	829757585321	Cd chelsea logue incarnadine	4093300	Медиа (folder)/Media	0	
4184488	5099923481824	Cd chemical brothers brotherhood the definitive singles collection (xdustcd9)	4093300	Медиа (folder)/Media	0	
4184489	724381168226	Cd chemical brothers come with us	4093300	Медиа (folder)/Media	0	
4184490	724356330320	Cd chemical brothers push the button	4093300	Медиа (folder)/Media	0	
4184491	724359271422	Cd chemical brothers singles 93-03	4093300	Медиа (folder)/Media	0	
4184492	724359282923	Cd chemical brothers singles 93-03 #2	4093300	Медиа (folder)/Media	0	
4184493	724384761028	Cd chemical brothers surrender	4093300	Медиа (folder)/Media	0	
4184494	724354333804	Cd chemical brothers, the american e.p.	4093300	Медиа (folder)/Media	0	
4184495	724384659929	Cd chemical brothers, the brothers gonna work it out re-mixes	4093300	Медиа (folder)/Media	0	
4184496	724384295028	Cd chemical brothers, the dig your own hole	4093300	Медиа (folder)/Media	0	
4184497	724384054021	Cd chemical brothers, the exit Planet dust	4093300	Медиа (folder)/Media	0	
4184498	724383875108	Cd chemical brothers, the music response	4093300	Медиа (folder)/Media	0	
4184499	743037219327	Cd chen dacan chinese folk music	4093300	Медиа (folder)/Media	0	
4184500	712136000129	Cd chen sisi tides and sand the Art of	4093300	Медиа (folder)/Media	0	
4184501	059582510421	Cd cheng angela mozart piano concertos no	4093300	Медиа (folder)/Media	0	
4184502	059582519523	Cd cheng angela nights in the gardens of s	4093300	Медиа (folder)/Media	0	
4184503	059582108727	Cd cheng angela piano music of Robert and	4093300	Медиа (folder)/Media	0	
