ID	UPCEAN	Name	CategoryID	CategoryName	BrandID	BrandName
4677187	731451115622	Smash records CD allman brothers band - a decade of hits (remaster	1	Неклассифицированные/default	0	
4677188	731451729423	Smash records CD allman brothers band the - chronicles: the filmore co	1	Неклассифицированные/default	0	
4677189	731451471322	Smash records CD allwright graeme - le trimardeur	1	Неклассифицированные/default	0	
4677190	731451471421	Smash records CD allwright graeme - master serie (remasterise)	1	Неклассифицированные/default	0	
4677191	731451390227	Smash records CD andersen/ towner/ vasconce - if u look far enough	1	Неклассифицированные/default	0	
4677192	731451293429	Smash records CD ange - les larmes du dalai-lama	1	Неклассифицированные/default	0	
4677193	731451243127	Smash records CD Angel - an anthology	1	Неклассифицированные/default	0	
4677194	731451095528	Smash records CD Angel - Angel	1	Неклассифицированные/default	0	
4677195	731451095825	Smash records CD Angel - White Hot	1	Неклассифицированные/default	0	
4677196	731451892028	Smash records CD anthrax - live: the island years	1	Неклассифицированные/default	0	
4677197	731451771729	Smash records CD aparis - aparis	1	Неклассифицированные/default	0	
4677198	731451232022	Smash records CD apfelbaum peter - jodoji brightness	1	Неклассифицированные/default	0	
4677199	731451716928	Smash records CD armstrong louis - the Essential louis armstr	1	Неклассифицированные/default	0	
4677200	731451981821	Smash records CD armstrong louis - verve jazz masters #1	1	Неклассифицированные/default	0	
4677201	731451335525	Smash records CD Arthur h. - bachibouzouk	1	Неклассифицированные/default	0	
4677202	731451156328	Smash records CD Arthur h. - Cool jazz	1	Неклассифицированные/default	0	
4677203	731451925122	Smash records CD arvanitaki eleftheria - i nihta kateveni	1	Неклассифицированные/default	0	
4677204	731451807329	Smash records CD aswad - firesticks	1	Неклассифицированные/default	0	
4677205	731451930720	Smash records CD aufray hugues - a l'olympia 64-66	1	Неклассифицированные/default	0	
4677206	731451930928	Smash records CD aufray hugues - adieu monsieur le professe	1	Неклассифицированные/default	0	
4677207	731451934322	Smash records CD aufray hugues - celine	1	Неклассифицированные/default	0	
4677208	731451934421	Smash records CD aufray hugues - le rossignol anglais	1	Неклассифицированные/default	0	
4677209	731451930522	Smash records CD aufray hugues - les annees barclay	1	Неклассифицированные/default	0	
4677210	731451934520	Smash records CD aufray hugues - santiano	1	Неклассифицированные/default	0	
4677211	731451956720	Smash records CD ayers roy - mystic voyage	1	Неклассифицированные/default	0	
4677212	731451490224	Smash records CD bachman-turner overdrive - chronicles: the anthology	1	Неклассифицированные/default	0	
4677213	731451693922	Smash records CD baker chet - verve jazz masters #32	1	Неклассифицированные/default	0	
4677214	731451731723	Smash records CD balavoine daniel - master serie (remasterise)	1	Неклассифицированные/default	0	
4677215	731451325922	Smash records CD balavoine daniel - master serie, vol. 2 (rema	1	Неклассифицированные/default	0	
4677216	731451801327	Smash records CD banton buju - voice of jamaica	1	Неклассифицированные/default	0	
4677230	731451482328	Smash records CD bar-kays the - the best of bar-kays	1	Неклассифицированные/default	0	
4677217	731451089923	Smash records CD Barbara - chante brassens et brel, v	1	Неклассифицированные/default	0	
4677218	731451879524	Smash records CD Barbara - chatelet	1	Неклассифицированные/default	0	
4677219	731451094422	Smash records CD Barbara - ma Plus belle histoire	1	Неклассифицированные/default	0	
4677220	731451089824	Smash records CD Barbara - ma Plus belle histoire d'a	1	Неклассифицированные/default	0	
4677221	731451406324	Smash records CD Barbara - master serie (remasterise)	1	Неклассифицированные/default	0	
4677222	731451081125	Smash records CD Barbara - volume 11 - depardieu-lill	1	Неклассифицированные/default	0	
4677223	731451085123	Smash records CD Barbara - volume 3 - dis quand revie	1	Неклассифицированные/default	0	
4677224	731451075827	Smash records CD Barbara - volume 6.67.68 - La dame	1	Неклассифицированные/default	0	
4677225	731451077920	Smash records CD Barbara - volume 7 - madame	1	Неклассифицированные/default	0	
4677226	731451078125	Smash records CD Barbara - volume 8 - l'aigle Noir	1	Неклассифицированные/default	0	
4677227	731451223525	Smash records CD barber patricia - a distortion of Love	1	Неклассифицированные/default	0	
4677228	731451930324	Smash records CD barclay James harvest - caught in the Night	1	Неклассифицированные/default	0	
4677229	731451467325	Smash records CD bardot brigitte - initiale b.b	1	Неклассифицированные/default	0	
4677231	731451282126	Smash records CD barricada - balas blancas	1	Неклассифицированные/default	0	
4677232	731451898525	Smash records CD barricada - La arana	1	Неклассифицированные/default	0	
4677233	731451029929	Smash records CD barricada - por instinto	1	Неклассифицированные/default	0	
4677234	731451969928	Smash records CD barron kenny - other places	1	Неклассифицированные/default	0	
4677235	731451897023	Smash records CD barstool prophets - last of the big Game hunte	1	Неклассифицированные/default	0	
4677236	731451724527	Smash records CD bashung alain - figure impossee	1	Неклассифицированные/default	0	
4677237	731451724626	Smash records CD bashung alain - live tour 85	1	Неклассифицированные/default	0	
4677238	731451724824	Smash records CD bashung alain - novice	1	Неклассифицированные/default	0	
4677239	731451722127	Smash records CD bashung alain - osez bashung	1	Неклассифицированные/default	0	
4677240	731451724121	Smash records CD bashung alain - osez bashung #2	1	Неклассифицированные/default	0	
4677241	731451148521	Smash records CD bashung alain - osez josephine	1	Неклассифицированные/default	0	
4677242	731451724725	Smash records CD bashung alain - passe le rio grande	1	Неклассифицированные/default	0	
4677243	731451724329	Smash records CD bashung alain - pizza	1	Неклассифицированные/default	0	
4677244	731451724428	Smash records CD bashung alain - Play blessures (remasteri	1	Неклассифицированные/default	0	
4677245	731451981920	Smash records CD basie count - verve jazz masters v.2	1	Неклассифицированные/default	0	
4677246	731451985225	Smash records CD basie count&Joe William - count basie swings: Joe wi	1	Неклассифицированные/default	0	
4677247	731451226229	Smash records CD bauer axel - sentinelles	1	Неклассифицированные/default	0	
4677248	731451706028	Smash records CD bauer billy - plectrist	1	Неклассифицированные/default	0	
4677249	731451259227	Smash records CD beasley walter - intimacy	1	Неклассифицированные/default	0	
4677250	731451994524	Smash records CD bee gees the - size isn't everything	1	Неклассифицированные/default	0	
4677251	731451051821	Smash records CD belew adrian - Desire of the rhino King (	1	Неклассифицированные/default	0	
4677252	731451924927	Smash records CD berti orietta - le piu belle canzoni popol	1	Неклассифицированные/default	0	
4677253	731451878725	Smash records CD bethania Maria - las canciones que tu hicis	1	Неклассифицированные/default	0	
4677254	731451917523	Smash records CD big daddy kinsey - i am the blues	1	Неклассифицированные/default	0	
4677255	731451439520	Smash records CD birkin Jane - Jane birkin	1	Неклассифицированные/default	0	
4677256	731451899324	Smash records CD birkin Jane - master serie (remasterise)	1	Неклассифицированные/default	0	
4677257	731451895227	Smash records CD birkin Jane - master serie, vol. 2 (rema	1	Неклассифицированные/default	0	
4677258	731451907623	Smash records CD bjornstad ketil - Water stories	1	Неклассифицированные/default	0	
4677259	731451275029	Smash records CD Black uhuru - anthem	1	Неклассифицированные/default	0	
4677260	731451828225	Smash records CD Black uhuru - liberation: the island an	1	Неклассифицированные/default	0	
4677261	731451006623	Smash records CD Black uhuru - the dub Factor	1	Неклассифицированные/default	0	
2547899	731451767326	Smash records CD bley carla / steve swallow - go together	4093300	Медиа (folder)/Media	0	
4677262	731451996627	Smash records CD bley carla/hai - big band theory	1	Неклассифицированные/default	0	
4677263	731451746925	Smash records CD bley Paul - in the evenings out	1	Неклассифицированные/default	0	
4677264	731451468322	Smash records CD Blue cheer - outside inside	1	Неклассифицированные/default	0	
4677265	731451468520	Smash records CD Blue cheer - vincebus eruptum	1	Неклассифицированные/default	0	
4677266	731451231322	Smash records CD blues magoos the - kaleidoscope compendium (b	1	Неклассифицированные/default	0	
4677267	731451443220	Smash records CD bob marley - songs of freedom	1	Неклассифицированные/default	0	
4677268	731451989728	Smash records CD bobo willie - a New dimension	1	Неклассифицированные/default	0	
4677269	731451985720	Smash records CD bobo willie - juicy	1	Неклассифицированные/default	0	
4677270	731451404528	Smash records CD bon jovi keep the faith	1	Неклассифицированные/default	0	
4677271	731451405327	Smash records CD boomtown rats the - tonic for the troops	1	Неклассифицированные/default	0	
4677272	731451195921	Smash records CD brahem anouar - conte de l'incroyable amou	1	Неклассифицированные/default	0	
4677273	731451897825	Smash records CD brassens georges - coffret master serie	1	Неклассифицированные/default	0	
4677274	731451406423	Smash records CD brassens georges - master serie (remasterise)	1	Неклассифицированные/default	0	
4677275	731451575327	Smash records CD brel Jacques - master serie (remasterise)	1	Неклассифицированные/default	0	
4677276	731451960727	Smash records CD bridgewater dee dee - keeping tradition	1	Неклассифицированные/default	0	
4677277	731451435621	Smash records CD brown clifford - the Essential clifford bro	1	Неклассифицированные/default	0	
4677278	731451132629	Smash records CD brown James - 20 all time greatest hits!	1	Неклассифицированные/default	0	
4677279	731451713521	Smash records CD brown James - Black caesar	1	Неклассифицированные/default	0	
4677280	731451985423	Smash records CD brown James - funky President	1	Неклассифицированные/default	0	
4677281	731451798528	Smash records CD brown James - Hot pants	1	Неклассифицированные/default	0	
4677282	731451338922	Smash records CD brown James - Love Power	1	Неклассифицированные/default	0	
4677283	731451798320	Smash records CD brown James - revolution of the mind	1	Неклассифицированные/default	0	
4677284	731451798429	Smash records CD brown James - sex machine	1	Неклассифицированные/default	0	
4677285	731451713620	Smash records CD brown James - slaughter's big rip off	1	Неклассифицированные/default	0	
4677286	731451713729	Smash records CD brown James - the payback	1	Неклассифицированные/default	0	
4677287	731451708626	Smash records CD buchanan roy - chronicles: sweet dreams -	1	Неклассифицированные/default	0	
4677288	731451240829	Smash records CD camaron - potro de rabia y miel	1	Неклассифицированные/default	0	
4677289	731451282225	Smash records CD camaron - una leyenda flamenca	1	Неклассифицированные/default	0	
4677290	731451259524	Smash records CD cameo - knights of the sound table	1	Неклассифицированные/default	0	
4677291	731451482427	Smash records CD cameo - the best of cameo	1	Неклассифицированные/default	0	
4677292	731451492921	Smash records CD cameo - the funk essentials	1	Неклассифицированные/default	0	
4677293	731451800726	Smash records CD cameo - we all know who we are (re	1	Неклассифицированные/default	0	
4677294	731451918223	Smash records CD cantina La - La cantina	1	Неклассифицированные/default	0	
4677295	731451552229	Smash records CD caravan - canterbury tales	1	Неклассифицированные/default	0	
4677296	731451215629	Smash records CD carbonell Antonio - cartas de amor	1	Неклассифицированные/default	0	
4677297	731451239427	Smash records CD carbonell Antonio - de colores diferentes	1	Неклассифицированные/default	0	
4677298	731451251023	Smash records CD catherine wheel - ferment	1	Неклассифицированные/default	0	
4677299	731451803925	Smash records CD catherine wheel: chrome	1	Неклассифицированные/default	0	
4677300	731451884825	Smash records CD chaka demus&pliers - all she wrote	1	Неклассифицированные/default	0	
4677301	731451227424	Smash records CD chance, Jeff - walk softly on the bridges	1	Неклассифицированные/default	0	
4677302	731451439629	Smash records CD charts les - notre monde a nous	1	Неклассифицированные/default	0	
4677303	731451063626	Smash records CD chedid louis - entre nous	1	Неклассифицированные/default	0	
4677304	731451319822	Smash records CD chris Mars - horseshoes and hand grenades	1	Неклассифицированные/default	0	
4677305	731451864926	Smash records CD christians the - the collection	1	Неклассифицированные/default	0	
4677306	731451774027	Smash records CD cocciante Richard - exitos	1	Неклассифицированные/default	0	
4677307	731451825927	Smash records CD cocteau twins - four calendar Cafe	1	Неклассифицированные/default	0	
4677308	731451450129	Smash records CD cocteau twins - Milk&kisses	1	Неклассифицированные/default	0	
4677309	731451109324	Smash records CD cole lloyd - don't get weird on me	1	Неклассифицированные/default	0	
4677310	731451027529	Smash records CD con funk shun - best of	1	Неклассифицированные/default	0	
4677311	731451290121	Smash records CD concato fabio - in viaggio	1	Неклассифицированные/default	0	
4677312	731451278822	Smash records CD cope julian - floored genius (the best o	1	Неклассифицированные/default	0	
4677313	731451751226	Smash records CD copeland Johnny - flyin' high	1	Неклассифицированные/default	0	
4677314	731451979828	Smash records CD corea chick - the leprechaun	1	Неклассифицированные/default	0	
4677315	731451982026	Smash records CD corea chick - verve jazz masters #3	1	Неклассифицированные/default	0	
2587618	731451499425	Smash records CD costa gal - india	4093300	Медиа (folder)/Media	0	
4677316	731451413629	Smash records CD costa gal - personalidade	1	Неклассифицированные/default	0	
4677317	731451058424	Smash records CD couture charlelie - island colours	1	Неклассифицированные/default	0	
4677318	731451272127	Smash records CD cray Robert - i was warned	1	Неклассифицированные/default	0	
4677319	731451823725	Smash records CD cray Robert - shame and a sin	1	Неклассифицированные/default	0	
4677320	731451475825	Smash records CD cyrus billy ray - it won't be the last	1	Неклассифицированные/default	0	
4677321	731451063527	Smash records CD cyrus billy ray - some gave all	1	Неклассифицированные/default	0	
4677322	731451909429	Smash records CD dalma sergio - adivina	1	Неклассифицированные/default	0	
4677323	731451963520	Smash records CD dalma sergio - esa chica es mia	1	Неклассифицированные/default	0	
4677324	731451963629	Smash records CD dalma sergio - sintiendonos La piel	1	Неклассифицированные/default	0	
4677325	731451497926	Smash records CD dan reed network - mixin' it up	1	Неклассифицированные/default	0	
4677326	731451198229	Smash records CD darling david - cello	1	Неклассифицированные/default	0	
4677327	731451030123	Smash records CD de lucia Paco - concierto de aranjuez	1	Неклассифицированные/default	0	
4677328	731451880926	Smash records CD de lucia Paco - live in America	1	Неклассифицированные/default	0	
4677329	731451080524	Smash records CD de lucia Paco - zyryab	1	Неклассифицированные/default	0	
4677330	731451706721	Smash records CD dearie blossom - give him the ooh-La-La	1	Неклассифицированные/default	0	
4677331	731451722325	Smash records CD dearie blossom - once upon a summertime	1	Неклассифицированные/default	0	
4677332	731451143823	Smash records CD deep purple knocking at your back door	1	Неклассифицированные/default	0	
4677333	731451097829	Smash records CD def leppard adrenalize	1	Неклассифицированные/default	0	
4677334	731451218521	Smash records CD def leppard adrenalize #2	1	Неклассифицированные/default	0	
4677335	731451928420	Smash records CD dejohnette Jack - pictures	1	Неклассифицированные/default	0	
4677336	731451775420	Smash records CD dejohnette Jack/Special ed - tin can alley	1	Неклассифицированные/default	0	
4677337	731451960222	Smash records CD delano peter - peter delano	1	Неклассифицированные/default	0	
4677338	731451158728	Smash records CD deschamps yvon - 1969 a 1973	1	Неклассифицированные/default	0	
4677339	731451410321	Smash records CD devos raymond - a tort ou a raison	1	Неклассифицированные/default	0	
4677340	731451483929	Smash records CD dexy's midnight runners - too rye aye	1	Неклассифицированные/default	0	
4677341	731451393426	Smash records CD Diamond&the psychotic neurotics - stunts, blunts&hip-hop	1	Неклассифицированные/default	0	
4677342	731451006722	Smash records CD dillinger - cb 200	1	Неклассифицированные/default	0	
2566504	731451016028	Smash records CD dire straits - on every street	4093300	Медиа (folder)/Media	0	
2566506	731451476624	Smash records CD dire straits - on the Night	4093300	Медиа (folder)/Media	0	
4677343	731451843624	Smash records CD directions in groove - directions in groove	1	Неклассифицированные/default	0	
4677344	731451012426	Smash records CD dolphy Eric - last date	1	Неклассифицированные/default	0	
4677345	731451814426	Smash records CD donna summer - chronicles: the anthology	1	Неклассифицированные/default	0	
4677346	731451430923	Smash records CD doro - angels never die	1	Неклассифицированные/default	0	
4677347	731451868023	Smash records CD doro - live	1	Неклассифицированные/default	0	
4677348	731451010224	Smash records CD doro - true at heart	1	Неклассифицированные/default	0	
4677349	731451808623	Smash records CD downing will - love's the place to be	1	Неклассифицированные/default	0	
4677350	731451888021	Smash records CD downset - downset	1	Неклассифицированные/default	0	
4677351	731451410024	Smash records CD dutch swing college band - collectors items	1	Неклассифицированные/default	0	
4677352	731451157028	Smash records CD E - a man called e	1	Неклассифицированные/default	0	
4677353	731451669323	Smash records CD eckstine billy - verve jazz masters #22	1	Неклассифицированные/default	0	
4677354	731451484025	Smash records CD eddie&the Hot rods - the end of the beginning	1	Неклассифицированные/default	0	
4677355	731451739422	Smash records CD Element of crime - an einem sonntag in april	1	Неклассифицированные/default	0	
4677356	731451775628	Smash records CD Element of crime - weisses papier	1	Неклассифицированные/default	0	
4677357	731451980428	Smash records CD ella fitzgerald best of the songbooks	1	Неклассифицированные/default	0	
4677358	731451956423	Smash records CD ella fitzgerald complete 'ella in berlin'	1	Неклассифицированные/default	0	
4677359	731451934728	Smash records CD ella fitzgerald ella swings brightly with	1	Неклассифицированные/default	0	
4677360	731451934827	Smash records CD ella fitzgerald ella swings gently with ne	1	Неклассифицированные/default	0	
4677361	731451753527	Smash records CD ella fitzgerald ella swings lightly	1	Неклассифицированные/default	0	
4677362	731451789823	Smash records CD ella fitzgerald first Lady of song (3CD)	1	Неклассифицированные/default	0	
4677363	731451152429	Smash records CD ella fitzgerald like someone in Love	1	Неклассифицированные/default	0	
4677364	731451983221	Smash records CD ella fitzgerald the complete song books (1	1	Неклассифицированные/default	0	
4677365	731451717024	Smash records CD ella fitzgerald the Essential ella fitzger	1	Неклассифицированные/default	0	
4677366	731451982224	Smash records CD ella fitzgerald verve jazz masters #6	1	Неклассифицированные/default	0	
4677367	731451633829	Smash records CD ellington duke - verve jazz masters #4	1	Неклассифицированные/default	0	
4677368	731451413827	Smash records CD elton John chronicles: rare masters (	1	Неклассифицированные/default	0	
4677369	731451253225	Smash records CD elton John greatest hits, vol. 1	1	Неклассифицированные/default	0	
4677370	731451253324	Smash records CD elton john's greatest hits volume ii	1	Неклассифицированные/default	0	
4677371	731451735325	Smash records CD erskine peter - you never know	1	Неклассифицированные/default	0	
4677372	731451212024	Smash records CD etheridge melissa - never enough	1	Неклассифицированные/default	0	
4677373	731451897122	Smash records CD Eva - comme les bles	1	Неклассифицированные/default	0	
4677374	731451896927	Smash records CD Eva - toi et moi	1	Неклассифицированные/default	0	
4677375	731451777325	Smash records CD evans bill - the Essential bill evans	1	Неклассифицированные/default	0	
4677376	731451980824	Smash records CD evans bill - trio '65	1	Неклассифицированные/default	0	
4677377	731451982125	Smash records CD evans bill - verve jazz masters #5	1	Неклассифицированные/default	0	
4677378	731451463129	Smash records CD fairport convention - Angel delight	1	Неклассифицированные/default	0	
4677379	731451275524	Smash records CD fairport convention - John babbacombe lee	1	Неклассифицированные/default	0	
4677380	731451275623	Smash records CD fairport convention - nine	1	Неклассифицированные/default	0	
4677381	731451275722	Smash records CD fairport convention - rising for the moon	1	Неклассифицированные/default	0	
4677382	731451275425	Smash records CD fairport convention - rosie	1	Неклассифицированные/default	0	
4677383	731451755729	Smash records CD farmer mylene - dance remixes (2CD)	1	Неклассифицированные/default	0	
4677384	731451284328	Smash records CD feldman francois - feldman a bercy	1	Неклассифицированные/default	0	
4677385	731451895326	Smash records CD feldman francois - master serie (remasterise)	1	Неклассифицированные/default	0	
4677386	731451804922	Smash records CD fernandez pedro - lo mucho que te quiero	1	Неклассифицированные/default	0	
4677387	731451322020	Smash records CD ferrat Jean ferrat chante aragon (rema	1	Неклассифицированные/default	0	
